LADYS,milady-meme-coin,Milady Meme Coin,LADYS,28403141,28403141.0,6764699.0,"Meme, Arbitrum Ecosystem, Ethereum Ecosystem, DWF Labs Portfolio, 4chan-Themed"
PYR,vulcan-forged,Vulcan Forged,PYR,28321414,59255523.0,13141214.0,"Gaming (GameFi), NFT, Metaverse, Polygon Ecosystem, Ethereum Ecosystem, DWF Labs Portfolio, Gaming Blockchains, Gaming Platform, Action Games, MMO"
MIGGLES,mister-miggles,Mr. Miggles,MIGGLES,28258048,28258048.0,1630120.0,"Meme, Base Ecosystem, Cat-Themed, Base Meme, Made in USA"
GFAL,games-for-a-living,Games for a Living,GFAL,25598368,48727086.0,560200.0,"Gaming (GameFi), NFT, BNB Chain Ecosystem, Play To Earn"
BITBOARD,bitboard,BitBoard,BB,23311825,35237456.0,443833.0,"Smart Contract Platform, Polygon Ecosystem, Layer 2 (L2), Zero Knowledge (ZK)"
BXN,bxn,BXN,BXN,22917654,73589981.0,469067.0,"Smart Contract Platform, Layer 1 (L1)"
ARC,ai-rig-complex,AI Rig Complex,ARC,21804646,21804646.0,6378507.0,"Artificial Intelligence (AI), Infrastructure, Solana Ecosystem, AI Agents, Pump.fun Ecosystem, AI Agent Launchpad, Binance Alpha Spotlight, AI Framework"
STO,stakestone,StakeStone,STO,20949636,92971757.0,19451173.0,"Decentralized Finance (DeFi), BNB Chain Ecosystem, Ethereum Ecosystem, Binance Wallet IDO"
FARTCOIN,based-fartcoin,Based Fartcoin,FARTCOIN,20389359,20389359.0,130101.0,"Meme, Base Ecosystem, Base Meme"
POLS,polkastarter,Polkastarter,POLS,19996957,20156266.0,2597136.0,"Decentralized Finance (DeFi), BNB Chain Ecosystem, Launchpad, Ethereum Ecosystem"
RETARDIO,retardio,RETARDIO,RETARDIO,18867640,18867640.0,2009855.0,"NFT, Solana Ecosystem, Meme, Solana Meme, Murad Picks, 4chan-Themed, TikTok Meme"
BAR,fc-barcelona-fan-token,FC Barcelona Fan Token,BAR,16170148,45795155.0,5584797.0,"Sports, Fan Token, Binance Launchpad, Chiliz Ecosystem"
AMO,amo,AMO Coin,AMO,15735409,15735409.0,190815.0,"Big Data, Kaia Ecosystem"
SEAM,seamless-protocol,Seamless Protocol,SEAM,15638575,40132053.0,283339.0,"Decentralized Finance (DeFi), Lending/Borrowing Protocols, Ethereum Ecosystem, Base Ecosystem"
KIBSHI,kiboshib,KiboShib,KIBSHI,15179940,15179940.0,192420.0,"Solana Ecosystem, Meme, Arbitrum Ecosystem, Ethereum Ecosystem, Base Ecosystem, Dog-Themed, AI Meme"
REEF,reef,Reef,REEF,14689926,14689926.0,251361.0,"BNB Chain Ecosystem, Binance Launchpool, Layer 1 (L1), Harmony Ecosystem, Ethereum Ecosystem, Alameda Research Portfolio, Energi Ecosystem, Sora Ecosystem, YZi Labs (Prev. Binance Labs) Portfolio, GMCI Layer 1 Index, GMCI Index"
BKN,brickken,Brickken,BKN,13802374,27638302.0,1359621.0,"Tokenized Real Estate, BNB Chain Ecosystem, Impossible Finance Launchpad, Ethereum Ecosystem, Real World Assets (RWA), RWA Protocol"
KRL,kryll,KRYLL,KRL,13562077,16817115.0,248562.0,"Artificial Intelligence (AI), Decentralized Finance (DeFi), Analytics, Arbitrum Ecosystem, Ethereum Ecosystem, Optimism Ecosystem, Base Ecosystem, AI Applications"
ZCX,unizen,Unizen,ZCX,13104152,19066464.0,1502031.0,"Decentralized Exchange (DEX), Exchange-based Tokens, Decentralized Finance (DeFi), Polygon Ecosystem, Ethereum Ecosystem, DWF Labs Portfolio"
LAZIO,lazio-fan-token,Lazio Fan Token,LAZIO,11592540,38249994.0,1659639.0,"Sports, BNB Chain Ecosystem, Fan Token, Binance Launchpad"
BCUT,bitscrunch-token,bitsCrunch Token,BCUT,10312723,17920335.0,1245975.0,"Artificial Intelligence (AI), Infrastructure, Analytics, NFT, Polygon Ecosystem, Ethereum Ecosystem, Animoca Brands Portfolio, Coinbase Ventures Portfolio"
PAID,paid-network,PAID,PAID,10309576,11811599.0,79581.0,"Launchpad, Base Ecosystem"
MINIMA,minima,Minima,MINIMA,10162759,18800898.0,342710.0,"Smart Contract Platform, Layer 1 (L1), DePIN"
CLEAR,everclear,Everclear,CLEAR,9822127,18098547.0,98459.0,"Infrastructure, BNB Chain Ecosystem, Polygon Ecosystem, Gnosis Chain Ecosystem, Arbitrum Ecosystem, Ethereum Ecosystem, Optimism Ecosystem, Coinbase Ventures Portfolio, Cross-chain Communication, Chain Abstraction"
RWA,allo,Allo,RWA,9712885,53960473.0,1348767.0,"BNB Chain Ecosystem, Real World Assets (RWA), RWA Protocol"
TRUF,truflation,TRUF.Network,TRUF,9111059,23437922.0,423771.0,"Infrastructure, Oracle, Arbitrum Ecosystem, Ethereum Ecosystem, Real World Assets (RWA), Base Ecosystem, Coinbase Ventures Portfolio, Governance"
WUF,wuffi,WUFFI,WUF,8945074,8945074.0,25836.0,"Solana Ecosystem, Meme, Base Ecosystem"
READY,ready,READY!,READY,8255558,8255558.0,633349.0,"Gaming (GameFi), Solana Ecosystem, Gaming Platform"
RFC,retard-finder-coin,Retard Finder Coin,RFC,7205122,7493046.0,5798449.0,"Solana Ecosystem, Meme, Pump.fun Ecosystem, Wojak-Themed"
LNQ,linqai,LinqAI,LNQ,7100785,22397961.0,823951.0,"Artificial Intelligence (AI), Ethereum Ecosystem"
CREPE,crepe-2,CREPE,CREPE,6893357,6893357.0,370292.0,"BNB Chain Ecosystem, Meme"
BST,blocksquare,Blocksquare,BST,5742649,5742694.0,66109.0,"Tokenized Real Estate, Ethereum Ecosystem, Real World Assets (RWA)"
BAD,bad-idea-ai,Bad Idea AI,BAD,5522762,6689372.0,923711.0,"Artificial Intelligence (AI), Meme, Ethereum Ecosystem, Telegram Apps, Discord Bots, Shibarium Ecosystem"
INTER,inter-milan-fan-token,Inter Milan Fan Token,INTER,5327762,5327762.0,363973.0,"Sports, Fan Token, Chiliz Ecosystem"
BEAM,beam,BEAM,BEAM,5133046,7208401.0,98930.0,"Smart Contract Platform, Privacy, Ethereum Ecosystem, Proof of Work (PoW), BeamPrivacy Ecosystem, Privacy Blockchain"
SCF,smoking-chicken-fish,Smoking Chicken Fish,SCF,5110856,5110856.0,184540.0,"Solana Ecosystem, Meme, Solana Meme, Pump.fun Ecosystem"
AZIT,azit,azit,AZIT,4659686,6455042.0,569795.0,Kaia Ecosystem
DOP,data-ownership-protocol,Data Ownership Protocol,DOP,4383361,8260112.0,1493441.0,"Smart Contract Platform, Privacy, Ethereum Ecosystem, Zero Knowledge (ZK)"
TSUKA,dejitaru-tsuka,Dejitaru Tsuka,TSUKA,4021329,4021329.0,91207.0,"Meme, Ethereum Ecosystem"
NC,nodecoin,Nodecoin,NC,3541300,19020077.0,1622789.0,"Artificial Intelligence (AI), Solana Ecosystem, DePIN"
BILLY,billy,Billy,BILLY,3539875,3539875.0,2665323.0,"Solana Ecosystem, Meme, Dog-Themed, Solana Meme, Pump.fun Ecosystem"
GURU,guru,Guru,GURU,3484437,3484437.0,42684.0,"Decentralized Finance (DeFi), Ethereum Ecosystem"
NRG,energi,Energi,NRG,3471960,3472090.0,139556.0,"Smart Contract Platform, Masternodes, Layer 1 (L1), Ethereum Ecosystem, Proof of Stake (PoS), Energi Ecosystem"
KANGO,kango,KANGO,KANGO,3442203,3442203.0,120428.0,"Meme, Kaspa Ecosystem"
BGB,bitget-token,Bitget Token,BGB,4553870933,4553870933.0,179503400.0,"Exchange-based Tokens, Centralized Exchange (CEX) Token, Ethereum Ecosystem, DragonFly Capital Portfolio, Morph L2 Ecosystem"
QNT,quant-network,Quant,QNT,1493370327,1500384979.0,19807181.0,"Ethereum Ecosystem, Real World Assets (RWA), Energi Ecosystem, Coinbase 50 Index"
XAUT,tether-gold,Tether Gold,XAUT,1367240455,1367240455.0,111925506.0,"Stablecoins, Tokenized Assets, Tokenized Gold, Ethereum Ecosystem, Real World Assets (RWA), Tokenized Commodities"
DOGWIFHAT,dogwifcoin,dogwifhat,WIF,947195487,947195487.0,258423173.0,"Solana Ecosystem, Meme, Dog-Themed, Solana Meme, GMCI Meme Index, GMCI Index, Unichain Ecosystem"
PENDLE,pendle,Pendle,PENDLE,888904974,1482388205.0,75694910.0,"Decentralized Exchange (DEX), Decentralized Finance (DeFi), Yield Farming, Automated Market Maker (AMM), BNB Chain Ecosystem, Derivatives, Lending/Borrowing Protocols, Arbitrum Ecosystem, Ethereum Ecosystem, Optimism Ecosystem, Fixed Interest, LSDFi, Base Ecosystem, Restaking, LRTfi, Liquid Restaking Governance Tokens, Berachain Ecosystem, Yield Tokenization Protocol, YZi Labs (Prev. Binance Labs) Portfolio, GMCI DeFi Index, Sonic Ecosystem, Liquid Staking, GMCI Index, BTCfi Protocol, HyperEVM Ecosystem"
ATH,aethir,Aethir,ATH,673803674,2317721750.0,377103343.0,"Solana Ecosystem, Arbitrum Ecosystem, Impossible Finance Launchpad, Ethereum Ecosystem, DePIN, Animoca Brands Portfolio"
FLUID,instadapp,Fluid,FLUID,490986857,639694847.0,2597278.0,"Decentralized Finance (DeFi), Solana Ecosystem, Polygon Ecosystem, Arbitrum Ecosystem, Ethereum Ecosystem, Base Ecosystem, Coinbase Ventures Portfolio, Pantera Capital Portfolio"
PLUME,plume,Plume,PLUME,392147215,1336865505.0,114188962.0,"Smart Contract Platform, Layer 1 (L1), Ethereum Ecosystem, Real World Assets (RWA), RWA Protocol, Made in USA, Plume Network Ecosystem"
ZBCN,zebec-network,Zebec Network,ZBCN,380782296,441190397.0,19912306.0,"Decentralized Finance (DeFi), Solana Ecosystem, Real World Assets (RWA), Payment Solutions, DePIN, Coinbase Ventures Portfolio, Alameda Research Portfolio, Circle Ventures Portfolio, OKX Ventures Portfolio, RWA Protocol, Made in USA"
1INCH,1inch,1inch,1INCH,378946493,407124359.0,16075910.0,"Decentralized Exchange (DEX), Exchange-based Tokens, Decentralized Finance (DeFi), Automated Market Maker (AMM), BNB Chain Ecosystem, Avalanche Ecosystem, Polygon Ecosystem, Near Protocol Ecosystem, Harmony Ecosystem, Ethereum Ecosystem, FTX Holdings, Alameda Research Portfolio, DragonFly Capital Portfolio, Pantera Capital Portfolio, Energi Ecosystem, YZi Labs (Prev. Binance Labs) Portfolio, GMCI DeFi Index, Galaxy Digital Portfolio, Blockchain Capital Portfolio, Dex Aggregator, GMCI Index, Coinbase 50 Index, Governance"
QTUM,qtum,Qtum,QTUM,277237775,282519652.0,23332444.0,"Smart Contract Platform, Proof of Stake (PoS), Made in China"
SFP,safepal,SafePal,SFP,243394942,243394942.0,2845136.0,"BNB Chain Ecosystem, Wallets, Ethereum Ecosystem, Animoca Brands Portfolio, Binance Launchpad, Energi Ecosystem, YZi Labs (Prev. Binance Labs) Portfolio"
ROSE,oasis-network,Oasis,ROSE,224225627,302610250.0,23250667.0,"Smart Contract Platform, BNB Chain Ecosystem, Layer 1 (L1), Proof of Stake (PoS), Pantera Capital Portfolio, Andreessen Horowitz (a16z) Portfolio, YZi Labs (Prev. Binance Labs) Portfolio, Blockchain Capital Portfolio, Privacy Blockchain, Polychain Capital Portfolio, Coinbase 50 Index"
ZANO,zano,Zano,ZANO,222804403,222872655.0,1224385.0,"Smart Contract Platform, Privacy, Layer 1 (L1), Proof of Stake (PoS), Proof of Work (PoW), Zano Ecosystem, Privacy Blockchain"
ZORA,zora,Zora,ZORA,213386028,651037119.0,50588836.0,"Infrastructure, Media, Smart Contract Platform, NFT, Layer 2 (L2), Base Ecosystem, Coinbase Ventures Portfolio, Zora Ecosystem"
RED,redstone-oracles,RedStone,RED,173213422,618619364.0,22682230.0,"Infrastructure, Oracle, Ethereum Ecosystem"
PROM,prometeus,Prom,PROM,166581531,175709286.0,5631091.0,"Smart Contract Platform, BNB Chain Ecosystem, Ethereum Ecosystem, Layer 2 (L2)"
XCH,chia,Chia,XCH,152009654,343001633.0,7146520.0,"Smart Contract Platform, Layer 1 (L1), DePIN, Andreessen Horowitz (a16z) Portfolio, Made in USA"
OSAK,osaka-protocol,Osaka Protocol,OSAK,140082114,140082114.0,103555.0,"BNB Chain Ecosystem, Solana Ecosystem, Avalanche Ecosystem, Polygon Ecosystem, Meme, Arbitrum Ecosystem, Ethereum Ecosystem, Optimism Ecosystem, Base Ecosystem, Dog-Themed"
UMA,uma,UMA,UMA,126819508,177703627.0,36677561.0,"Business Services, Decentralized Finance (DeFi), Oracle, Derivatives, Synthetic Issuer, Avalanche Ecosystem, Ethereum Ecosystem, Blockchain Capital Portfolio, Synthetic, Made in USA, Governance"
SHX,stronghold-token,Stronghold,SHX,119982049,,2170251.0,"Ethereum Ecosystem, Stellar Ecosystem, Made in USA"
WAVES,waves,Waves,WAVES,114083375,114083375.0,12877757.0,"Smart Contract Platform, DWF Labs Portfolio, Proof of Stake (PoS)"
BIGTIME,big-time,Big Time,BIGTIME,106813568,279873823.0,17956679.0,"Gaming (GameFi), Play To Earn, Ethereum Ecosystem, RPG, Alameda Research Portfolio, Circle Ventures Portfolio, OKX Ventures Portfolio, MMO"
XVG,verge,Verge,XVG,100871549,101073322.0,4371363.0,"Smart Contract Platform, Privacy, Proof of Work (PoW), Made in USA"
MANTA,manta-network,Manta Network,MANTA,98946181,220862958.0,18271813.0,"Smart Contract Platform, Polkadot Ecosystem, Binance Launchpool, Layer 2 (L2), Manta Network Ecosystem, Multicoin Capital Portfolio, Alameda Research Portfolio, DeFiance Capital Portfolio, YZi Labs (Prev. Binance Labs) Portfolio"
FIDA,bonfida,Bonfida (aka SNS),FIDA,98457334,99360390.0,60268798.0,"Big Data, Business Services, Infrastructure, Decentralized Finance (DeFi), Solana Ecosystem, FTX Holdings, DWF Labs Portfolio, Name Service"
SOON,soon-2,SOON,SOON,86449793,329840262.0,13714303.0,"Infrastructure, Smart Contract Platform, BNB Chain Ecosystem, Layer 2 (L2), Base Ecosystem, Cross-chain Communication, Binance Alpha Spotlight"
DAG,constellation-labs,Constellation,DAG,85793859,106100514.0,2024566.0,"Smart Contract Platform, Layer 1 (L1), Layer 0 (L0), Made in USA, Directed Acyclic Graph (DAG)"
LQTY,liquity,Liquity,LQTY,84113276,86062546.0,15627733.0,"Decentralized Finance (DeFi), Lending/Borrowing Protocols, Arbitrum Ecosystem, Ethereum Ecosystem, Alameda Research Portfolio, Pantera Capital Portfolio"
DYM,dymension,Dymension,DYM,83860196,230358170.0,10617904.0,"Smart Contract Platform, Cosmos Ecosystem, Modular Blockchain, Osmosis Ecosystem, Rollups-as-a-Service (RaaS)"
TAIKO,taiko,Taiko,TAIKO,80405320,438096728.0,18376704.0,"Smart Contract Platform, BNB Chain Ecosystem, Ethereum Ecosystem, Layer 2 (L2), Zero Knowledge (ZK), Rollup, OKX Ventures Portfolio, Centralized Exchange (CEX) Product, Binance Alpha Spotlight"
SERAPH,seraph,Seraph,SERAPH,73597197,264332199.0,12166605.0,"Gaming (GameFi), BNB Chain Ecosystem, Play To Earn, Ethereum Ecosystem, RPG, Gaming Utility Token, Action Games"
STEEM,steem,Steem,STEEM,71683051,71717541.0,5665136.0,SocialFi
JOE,joe,JOE,JOE,68938778,85469189.0,5336664.0,"Decentralized Exchange (DEX), Decentralized Finance (DeFi), Yield Farming, Automated Market Maker (AMM), BNB Chain Ecosystem, Avalanche Ecosystem, Arbitrum Ecosystem, Mantle Ecosystem, DeFiance Capital Portfolio, Delphi Ventures Portfolio, Dex Aggregator"
XRD,radix,Radix,XRD,68807034,76943468.0,47422.0,"Smart Contract Platform, Layer 1 (L1), DWF Labs Portfolio, Radix Ecosystem"
SAI,sai,Sai,SAI,65824057,65824057.0,663.41,"Decentralized Finance (DeFi), Ethereum Ecosystem"
MFT,mainframe,Mainframe,MFT,59085022,62946456.0,8891.37,"Ethereum Ecosystem, Energi Ecosystem"
WCT,connect-token-wct,WalletConnect Token,WCT,58357058,313410355.0,28223871.0,"Solana Ecosystem, Wallets, Ethereum Ecosystem, Optimism Ecosystem"
AITECH,solidus-aitech,Solidus Ai Tech,AITECH,55318396,69024421.0,20328060.0,"Artificial Intelligence (AI), BNB Chain Ecosystem, Solana Ecosystem, Launchpad, Base Ecosystem, ChainGPT Launchpad, AI Agents, Binance Alpha Spotlight, DeFAI"
ANYONE,airtor-protocol,ANyONe Protocol,ANYONE,47683216,59650481.0,699773.0,"Smart Contract Platform, Ethereum Ecosystem, DePIN, Privacy Blockchain"
BOBA,boba-network,Boba Network,BOBA,47541900,48158394.0,9669442.0,"Smart Contract Platform, Ethereum Ecosystem, Layer 2 (L2), Rollup, Boba Network Ecosystem, GMCI Layer 2 Index, GMCI Index, Made in USA"
OGN,origin-protocol,Origin Token,OGN,44415214,94929470.0,7084621.0,"Decentralized Finance (DeFi), NFT, Ethereum Ecosystem, Base Ecosystem, Pantera Capital Portfolio, Sonic Ecosystem, Liquid Staking, Made in USA"
PARTI,particle-network,Particle Network,PARTI,42914388,184181925.0,27677268.0,"Decentralized Finance (DeFi), BNB Chain Ecosystem, Layer 1 (L1), Base Ecosystem, Account Abstraction, Cross-chain Communication, Binance HODLer Airdrops, Chain Abstraction, Binance Wallet IDO"
SD,stader,Stader,SD,42728883,79542325.0,4802528.0,"BNB Chain Ecosystem, Solana Ecosystem, Polygon Ecosystem, Fantom Ecosystem, Ethereum Ecosystem, Liquid Staking Governance Tokens, Animoca Brands Portfolio, Coinbase Ventures Portfolio, Pantera Capital Portfolio, Liquid Staking, Binance Alpha Spotlight"
MBL,moviebloc,MovieBloc,MBL,41768671,66695105.0,5656907.0,DWF Labs Portfolio
SUNDOG,sundog,Sundog,SUNDOG,38326849,38326849.0,17602607.0,"Meme, Tron Ecosystem, Sun Pump Ecosystem, TRON Meme"
RSS3,rss3,RSS3,RSS3,36274412,44825933.0,3381845.0,"Artificial Intelligence (AI), Infrastructure, Storage, Ethereum Ecosystem, Coinbase Ventures Portfolio, DragonFly Capital Portfolio, RSS3 VSL Ecosystem, AI Framework, DeFAI"
HASHAI,hashai,HashAI,HASHAI,34855204,37014702.0,407290.0,"Analytics, Ethereum Ecosystem, DePIN"
REZ,renzo,Renzo,REZ,32131172,122098598.0,10424254.0,"Decentralized Finance (DeFi), Binance Launchpool, Ethereum Ecosystem, Base Ecosystem, Restaking, YZi Labs (Prev. Binance Labs) Portfolio, OKX Ventures Portfolio"
BOOE,book-of-ethereum,Book of Ethereum,BOOE,31695564,31695564.0,313948.0,"Meme, Ethereum Ecosystem"
RIO,realio-network,Realio Network Token,RIO,31585463,31585463.0,2188047.0,"BNB Chain Ecosystem, Solana Ecosystem, Ethereum Ecosystem, Algorand Ecosystem, Real World Assets (RWA), Osmosis Ecosystem, Stellar Ecosystem, Made in USA"
DAO,dao-maker,DAO Maker,DAO,30828420,34096214.0,1997083.0,"BNB Chain Ecosystem, Solana Ecosystem, Launchpad, DaoMaker Launchpad, Arbitrum Ecosystem, Ethereum Ecosystem, Step Network Ecosystem, Governance"
MLC,my-lovely-coin,My Lovely Coin,MLC,30096392,91228945.0,404012.0,"Charity, Gaming (GameFi), Polygon Ecosystem, Gaming Utility Token"
VIC,tomochain,Viction,VIC,29892960,51251674.0,2770193.0,"Smart Contract Platform, Masternodes, Layer 1 (L1), DWF Labs Portfolio"
NMT,netmind-token,NetMind Token,NMT,22867495,62652254.0,2197285.0,"Artificial Intelligence (AI), BNB Chain Ecosystem, Ethereum Ecosystem, DePIN, AI Agents"
OGY,origyn-foundation,ORIGYN,OGY,18370319,23275854.0,243210.0,"Internet Computer Ecosystem, Real World Assets (RWA), RWA Protocol"
VOW,vow,Vow,VOW,18362111,60688767.0,184355.0,"Retail, Tourism, BNB Chain Ecosystem, Ethereum Ecosystem"
LOCK,houdini-swap,Houdini Swap,LOCK,18241122,18241122.0,47051.0,"Privacy, Solana Ecosystem, Ethereum Ecosystem"
VSC,vyvo-smart-chain,Vyvo Smart Chain,VSC,16847877,82306883.0,139794.0,"Smart Contract Platform, BNB Chain Ecosystem, Polygon Ecosystem, Layer 2 (L2)"
LIF3,lif3,LIF3 (OLD),LIF3,16253863,55231715.0,81.06,Fantom Ecosystem
NATIX,natix-network,NATIX Network,NATIX,15698579,73163750.0,167830.0,"Artificial Intelligence (AI), Internet of Things (IOT), Solana Ecosystem, DePIN"
PORT3,port3-network,Port3 Network,PORT3,15631063,31271680.0,7543142.0,"SocialFi, BNB Chain Ecosystem, Ethereum Ecosystem, Poolz Finance Launchpad"
MEMEFI,memefi-2,MemeFi,MEMEFI,14967320,14967320.0,8791376.0,"Gaming (GameFi), NFT, Meme, Play To Earn, Sui Ecosystem, Telegram Apps, Tap to Earn, Sui Meme, Action Games"
LOOKS,looksrare,LooksRare,LOOKS,14865468,14865468.0,1410503.0,"NFT, Ethereum Ecosystem, NFT Marketplace"
FHE,mind-network,Mind Network,FHE,14837329,59587665.0,7070716.0,"Artificial Intelligence (AI), Smart Contract Platform, BNB Chain Ecosystem, Layer 2 (L2), Binance Wallet IDO"
SUKU,suku,SUKU,SUKU,14794128,45498236.0,273426.0,"Solana Ecosystem, Polygon Ecosystem, Ethereum Ecosystem, Made in USA"
LINGO,lingo,Lingo,LINGO,14547817,14547817.0,207370.0,"Solana Ecosystem, Real World Assets (RWA), Base Ecosystem, RWA Protocol"
EPT,balance,Balance,EPT,14283017,61655530.0,22862055.0,"Gaming (GameFi), BNB Chain Ecosystem, Animoca Brands Portfolio, DWF Labs Portfolio, AI Agents, Andreessen Horowitz (a16z) Portfolio, AI Agent Launchpad"
VINU,vita-inu,Vita Inu,VINU,14009861,14009861.0,260403.0,"BNB Chain Ecosystem, Meme, Dog-Themed, DWF Labs Portfolio, Binance Alpha Spotlight"
CRTS,cratos,Cratos,CRTS,12681487,19965787.0,172751.0,"BNB Chain Ecosystem, Ethereum Ecosystem"
WEPE,wall-street-pepe,Wall Street Pepe,WEPE,11823105,11823105.0,149903.0,"Meme, Ethereum Ecosystem, Frog-Themed, The Boys Club"
NUM,numbers-protocol,Numbers Protocol,NUM,11285164,11422047.0,1992853.0,"Artificial Intelligence (AI), Smart Contract Platform, BNB Chain Ecosystem, DaoMaker Launchpad, Ethereum Ecosystem, Avalanche L1, YZi Labs (Prev. Binance Labs) Portfolio, Outlier Ventures Portfolio"
ZETA,zeta,Zeta,ZEX,11096632,59096897.0,893387.0,"Decentralized Finance (DeFi), Derivatives, Perpetuals, Solana Ecosystem"
PROPS,propbase,Propbase,PROPS,10839264,29331187.0,4102210.0,"Tokenized Real Estate, Aptos Ecosystem, Real World Assets (RWA), Base Ecosystem, RWA Protocol"
MCB,mcdex,MUX Protocol,MCB,9368689,11832098.0,587.32,"Decentralized Exchange (DEX), Exchange-based Tokens, Decentralized Finance (DeFi), BNB Chain Ecosystem, Derivatives, Perpetuals, Arbitrum Ecosystem, Ethereum Ecosystem, Multicoin Capital Portfolio, Alameda Research Portfolio, DeFiance Capital Portfolio, Delphi Ventures Portfolio, OKX Ventures Portfolio"
ATS,alltoscan,Alltoscan,ATS,9359187,13710967.0,117200.0,BNB Chain Ecosystem
DIONE,dione,Dione,DIONE,9188978,10645084.0,190250.0,"Energy, Smart Contract Platform, Layer 1 (L1), Made in USA"
AEROBUD,aerobud,AEROBUD,AEROBUD,8825084,8825084.0,235420.0,"Charity, Meme, Base Ecosystem, Dog-Themed, Base Meme, Made in USA"
PEAR,pear-protocol,Pear Protocol,PEAR,6977984,25695451.0,205048.0,"Decentralized Exchange (DEX), Decentralized Finance (DeFi), Perpetuals, Arbitrum Ecosystem"
SIDUS,sidus,Sidus,SIDUS,6721709,11471239.0,316840.0,"Gaming (GameFi), NFT, BNB Chain Ecosystem, Metaverse, Play To Earn, Ethereum Ecosystem, Linea Ecosystem, Animoca Brands Portfolio, Base Ecosystem, RPG, Gaming Governance Token, Alameda Research Portfolio, OKX Ventures Portfolio"
PMT,public-meme-token,Public Masterpiece Token,PMT,6461325,30167640.0,230180.0,BNB Chain Ecosystem
NLS,nolus,Nolus,NLS,6247326,8500153.0,138887.0,"Ethereum Ecosystem, Osmosis Ecosystem"
JUNO,juno-network,JUNO,JUNO,5369214,7133401.0,69410.0,"Smart Contract Platform, Cosmos Ecosystem, Osmosis Ecosystem, Juno Ecosystem, Evmos Ecosystem, Secret Ecosystem"
METAV,metaverse,METAVERSE,METAV,5254958,5254958.0,733726.0,"Artificial Intelligence (AI), Solana Ecosystem, AI Agents, Pump.fun Ecosystem, Binance Alpha Spotlight"
KILO,kiloex,KiloEx,KILO,5223786,24675419.0,2276952.0,"Decentralized Exchange (DEX), Decentralized Finance (DeFi), BNB Chain Ecosystem, Derivatives, Binance Wallet IDO"
LLD,liberland-lld,Liberland LLD,LLD,4655520,6122506.0,67866.0,"Smart Contract Platform, Solana Ecosystem, Layer 1 (L1), Ethereum Ecosystem, Tron Ecosystem"
RLY,rally-2,Rally,RLY,4611747,13802411.0,33621.0,"SocialFi, Yield Farming, Ethereum Ecosystem, Alleged SEC Securities, Coinbase Ventures Portfolio, Andreessen Horowitz (a16z) Portfolio"
OBT,oobit,Oobit,OBT,4334184,12312172.0,75791.0,"BNB Chain Ecosystem, Ethereum Ecosystem, Payment Solutions"
MAS,massa,Massa,MAS,3735197,13399635.0,152429.0,"Smart Contract Platform, Layer 1 (L1), Massa Ecosystem"
LL,lightlink,LightLink,LL,3567872,11773084.0,156206.0,"Infrastructure, Smart Contract Platform, Ethereum Ecosystem, Layer 2 (L2), Rollup, LightLink Ecosystem"
CREO,creo-engine,Creo Engine,CREO,3241229,4261603.0,1225539.0,"Gaming (GameFi), BNB Chain Ecosystem, Solana Ecosystem, Ethereum Ecosystem, Gaming Platform"
LEOX,leox,LEOX,LEOX,3146514,3146514.0,65011.0,"Tokenized Real Estate, Ethereum Ecosystem, Real World Assets (RWA), RWA Protocol"
HARAMBEAI,harambe-ai,Harambe AI,HARAMBEAI,2998078,4391424.0,62208.0,"Meme, Ethereum Ecosystem"
JUC,juice-2,Juice,JUC,2829648,4969351.0,113112.0,"Gaming (GameFi), Avalanche Ecosystem"
UNIT0,unit0,Unit0,UNIT0,2828348,31155361.0,965883.0,"Smart Contract Platform, Ethereum Ecosystem, Layer 2 (L2), Cross-chain Communication, Waves Ecosystem"
LIKE,likecoin,LikeCoin,LIKE,2779444,3787322.0,106.26,"SocialFi, Osmosis Ecosystem"
SDN,shiden,Shiden Network,SDN,2774923,3584595.0,66396.0,Smart Contract Platform
GAIA,gaia-2,Gaia,SN57,2762311,2776355.0,100482.0,"Artificial Intelligence (AI), Bittensor Ecosystem, Bittensor Subnets"
HMND,humanode,Humanode,HMND,2730986,7358285.0,200319.0,"Artificial Intelligence (AI), Smart Contract Platform, Layer 1 (L1), Decentralized Identifier (DID), Discord Bots, Humanode Ecosystem"
LEVER,lever,LeverFi,LEVER,2599444,2599500.0,376803.0,"Decentralized Finance (DeFi), Ethereum Ecosystem, DWF Labs Portfolio, Alameda Research Portfolio"
HBAR,hedera-hashgraph,Hedera,HBAR,10372560590,12233833834.0,293952762.0,"Smart Contract Platform, Layer 1 (L1), Hedera Ecosystem, GMCI Layer 1 Index, GMCI 30 Index, GMCI Index, Outlier Ventures Portfolio, Made in USA, Directed Acyclic Graph (DAG)"
IP,story-2,Story,IP,2998789112,9737829461.0,75341678.0,"Artificial Intelligence (AI), Smart Contract Platform, Layer 1 (L1), Made in USA, Story Ecosystem, IP"
RENDER,render-token,Render,RENDER,2085433404,2144789886.0,83738548.0,"Artificial Intelligence (AI), NFT, Metaverse, Solana Ecosystem, Ethereum Ecosystem, DePIN, Multicoin Capital Portfolio, Alameda Research Portfolio, GMCI DePIN Index, GMCI 30 Index, GMCI Index, Made in USA, Coinbase 50 Index"
LBTC,lombard-staked-btc,Lombard Staked BTC,LBTC,1534094960,1534094960.0,7911954.0,"BNB Chain Ecosystem, Solana Ecosystem, Ethereum Ecosystem, Sui Ecosystem, Base Ecosystem, Restaking, Berachain Ecosystem, Liquid Restaking Tokens, Sonic Ecosystem, Etherlink Ecosystem, Swellchain Ecosystem, Corn Ecosystem, Liquid Staked BTC, Katana Ecosystem, TAC Ecosystem"
TIA,celestia,Celestia,TIA,1436069814,2109328177.0,93459768.0,"Smart Contract Platform, Cosmos Ecosystem, Layer 1 (L1), Data Availability, Modular Blockchain, Osmosis Ecosystem, eGirl Capital Portfolio, Coinbase Ventures Portfolio, Proof of Stake (PoS), Secret Ecosystem, YZi Labs (Prev. Binance Labs) Portfolio, Delphi Ventures Portfolio, Galaxy Digital Portfolio, Blockchain Capital Portfolio, OKX Ventures Portfolio, Polychain Capital Portfolio"
XDC,xdce-crowd-sale,XDC Network,XDC,1358849960,2911609227.0,43947634.0,"Smart Contract Platform, Layer 1 (L1), Real World Assets (RWA)"
LDO,lido-dao,Lido DAO,LDO,1168302822,1304198261.0,90773976.0,"Infrastructure, Decentralized Finance (DeFi), Polygon Ecosystem, Arbitrum Ecosystem, Ethereum Ecosystem, Optimism Ecosystem, Liquid Staking Governance Tokens, eGirl Capital Portfolio, Paradigm Portfolio, Coinbase Ventures Portfolio, Multicoin Capital Portfolio, Index Coop Defi Index, Alameda Research Portfolio, DragonFly Capital Portfolio, Andreessen Horowitz (a16z) Portfolio, GMCI DeFi Index, Delphi Ventures Portfolio, Liquid Staking, GMCI Index, Coinbase 50 Index, Governance"
