RENDER,render-token,Render,RENDER,888456022,913743631.0,53994348.0,"Artificial Intelligence (AI), NFT, Metaverse, Solana Ecosystem, Ethereum Ecosystem, DePIN, Multicoin Capital Portfolio, Alameda Research Portfolio, GMCI DePIN Index, GMCI 30 Index, GMCI Index, Made in USA, Coinbase 50 Index"
IP,story-2,Story,IP,813382992,2502579977.0,61471272.0,"Artificial Intelligence (AI), Smart Contract Platform, Layer 1 (L1), Made in USA, Story Ecosystem, IP"
DASH,dash,Dash,DASH,701106949,701123498.0,179387208.0,"Smart Contract Platform, Privacy Coins, Masternodes, Alleged SEC Securities, Proof of Stake (PoS), Proof of Work (PoW), Made in USA"
AERO,aerodrome-finance,Aerodrome Finance,AERO,615596121,1215749486.0,39207395.0,"Decentralized Exchange (DEX), Exchange-based Tokens, Decentralized Finance (DeFi), Automated Market Maker (AMM), Base Ecosystem, Binance Alpha Spotlight, Made in USA"
STX,blockstack,Stacks,STX,557727002,557727002.0,13196337.0,"Infrastructure, Smart Contract Platform, Layer 2 (L2), Bitcoin Sidechains, Stacks Ecosystem, SideChain, GMCI Layer 2 Index, GMCI 30 Index, Blockchain Capital Portfolio, GMCI Index, Made in USA, Coinbase 50 Index"
LDO,lido-dao,Lido DAO,LDO,552053327,619870562.0,82479546.0,"Infrastructure, Decentralized Finance (DeFi), Polygon Ecosystem, Arbitrum Ecosystem, Ethereum Ecosystem, Optimism Ecosystem, Liquid Staking Governance Tokens, eGirl Capital Portfolio, Paradigm Portfolio, Coinbase Ventures Portfolio, Multicoin Capital Portfolio, Index Coop Defi Index, Alameda Research Portfolio, DragonFly Capital Portfolio, Andreessen Horowitz (a16z) Portfolio, GMCI DeFi Index, Delphi Ventures Portfolio, Liquid Staking, GMCI Index, Coinbase 50 Index, Governance"
TIA,celestia,Celestia,TIA,512592697,700593011.0,65613123.0,"Smart Contract Platform, Cosmos Ecosystem, Layer 1 (L1), Data Availability, Modular Blockchain, Osmosis Ecosystem, eGirl Capital Portfolio, Coinbase Ventures Portfolio, Proof of Stake (PoS), Secret Ecosystem, YZi Labs (Prev. Binance Labs) Portfolio, Delphi Ventures Portfolio, Galaxy Digital Portfolio, Blockchain Capital Portfolio, OKX Ventures Portfolio, Polychain Capital Portfolio"
FLOKI,floki,FLOKI,FLOKI,438463748,454008489.0,35458104.0,"Gaming (GameFi), NFT, BNB Chain Ecosystem, Metaverse, Meme, Play To Earn, Ethereum Ecosystem, Telegram Apps, Dog-Themed, DWF Labs Portfolio, RPG, On-chain Gaming, TokenFi Launchpad, GMCI Meme Index, GMCI Index"
PYTH,pyth-network,Pyth Network,PYTH,415764549,723070926.0,17292962.0,"Business Services, Infrastructure, Decentralized Finance (DeFi), Oracle, Solana Ecosystem, Neon Ecosystem, Manta Network Ecosystem, Multicoin Capital Portfolio, GMCI DeFi Index, Delphi Ventures Portfolio, GMCI Index"
CFX,conflux-token,Conflux,CFX,412644300,458489577.0,18160685.0,"Smart Contract Platform, DWF Labs Portfolio, Proof of Work (PoW), GMCI Layer 1 Index, Sequoia Capital Portfolio, GMCI Index, Made in China"
SUN,sun-token,Sun Token,SUN,409313589,424647328.0,19595179.0,"Decentralized Finance (DeFi), Tron Ecosystem, Made in China"
BTT,bittorrent,BitTorrent,BTT,398964500,400558178.0,9822044.0,"Storage, BNB Chain Ecosystem, Ethereum Ecosystem, DePIN, Alleged SEC Securities, Binance Launchpad, Tron Ecosystem, Energi Ecosystem, YZi Labs (Prev. Binance Labs) Portfolio, BitTorrent Ecosystem, GMCI DePIN Index, GMCI Index"
RAY,raydium,Raydium,RAY,281725942,582822011.0,52562768.0,"Decentralized Exchange (DEX), Exchange-based Tokens, Decentralized Finance (DeFi), Yield Farming, Automated Market Maker (AMM), Perpetuals, Solana Ecosystem, Launchpad, GMCI DeFi Index, GMCI Index"
ZK,zksync,ZKsync,ZK,273305232,793638366.0,47238985.0,"Smart Contract Platform, Ethereum Ecosystem, Layer 2 (L2), Zero Knowledge (ZK), ZkSync Ecosystem, Consensys Portfolio, Blockchain Capital Portfolio, OKX Ventures Portfolio, Privacy Blockchain"
EIGEN,eigenlayer,EigenCloud (prev. EigenLayer),EIGEN,240963901,965830812.0,44081422.0,"Infrastructure, Ethereum Ecosystem, Base Ecosystem, Data Availability, Restaking, Polychain Capital Portfolio, Made in USA, x402 Ecosystem"
LGCT,legacy-token,Legacy Token,LGCT,192538738,544514797.0,5800193.0,"Education, Gaming (GameFi), BNB Chain Ecosystem, Base Ecosystem"
TKX,tokenize-xchange,Tokenize Xchange,TKX,137181164,171485034.0,4308.24,"Exchange-based Tokens, Centralized Exchange (CEX) Token, Ethereum Ecosystem, Titanchain Ecosystem"
OZO,ozone-chain,Ozone Chain,OZO,119302829,130770298.0,226868.0,"Smart Contract Platform, Layer 1 (L1), Zero Knowledge (ZK)"
NPC,non-playable-coin,Non-Playable Coin,NPC,111376472,111376472.0,7733635.0,"NFT, BNB Chain Ecosystem, Solana Ecosystem, Meme, Ethereum Ecosystem, Base Ecosystem, Hybrid Token Standards, Wojak-Themed, 4chan-Themed"
CELO,celo,Celo,CELO,92924538,158360536.0,14354196.0,"Smart Contract Platform, Celo Ecosystem, Layer 2 (L2), DWF Labs Portfolio, Coinbase Ventures Portfolio, Proof of Stake (PoS), Andreessen Horowitz (a16z) Portfolio, Optimism Superchain Ecosystem, Outlier Ventures Portfolio, Made in USA"
DRIFT,drift-protocol,Drift Protocol,DRIFT,86806674,210559095.0,15724918.0,"Decentralized Finance (DeFi), Derivatives, Prediction Markets, Perpetuals, Solana Ecosystem, Binance Alpha Spotlight, Governance"
ELF,aelf,aelf,ELF,80908472,100414474.0,3200423.0,"Infrastructure, Smart Contract Platform, BNB Chain Ecosystem, Layer 1 (L1), Ethereum Ecosystem, GMCI Layer 1 Index, Aelf Ecosystem, GMCI Index"
EUL,euler,Euler,EUL,71644436,104224907.0,7333348.0,"BNB Chain Ecosystem, Lending/Borrowing Protocols, Avalanche Ecosystem, Arbitrum Ecosystem, Ethereum Ecosystem, Base Ecosystem, Berachain Ecosystem, Paradigm Portfolio, Coinbase Ventures Portfolio, Sonic Ecosystem, Swellchain Ecosystem, Unichain Ecosystem, TAC Ecosystem, Plasma Ecosystem"
BICO,biconomy,Biconomy,BICO,62315635,62412005.0,21353888.0,"Arbitrum Ecosystem, Ethereum Ecosystem, Account Abstraction, Coinbase Ventures Portfolio, YZi Labs (Prev. Binance Labs) Portfolio, Consensys Portfolio, Outlier Ventures Portfolio"
AP3X,apex-4,APEX,AP3X,60509925,150844811.0,100020.0,Layer 1 (L1)
IO,io,io.net,IO,53622586,181111128.0,12461904.0,"Artificial Intelligence (AI), Internet of Things (IOT), Binance Launchpool, Solana Ecosystem, DePIN, Animoca Brands Portfolio, Multicoin Capital Portfolio, Delphi Ventures Portfolio, OKX Ventures Portfolio, Made in USA"
RLC,iexec-rlc,iExec RLC,RLC,51631089,62057688.0,4005876.0,"Artificial Intelligence (AI), Oracle, Arbitrum Ecosystem, Ethereum Ecosystem, DePIN, AI Agents, Energi Ecosystem, Sora Ecosystem, GMCI DePIN Index, GMCI Index"
HIVE,hive,Hive,HIVE,51310592,,1364347.0,"Smart Contract Platform, SocialFi, Layer 1 (L1), Gaming Blockchains"
WOO,woo-network,WOO,WOO,50663819,58642066.0,3852939.0,"Decentralized Exchange (DEX), Exchange-based Tokens, Decentralized Finance (DeFi), Automated Market Maker (AMM), BNB Chain Ecosystem, Derivatives, Perpetuals, Centralized Exchange (CEX) Token, Solana Ecosystem, Avalanche Ecosystem, Polygon Ecosystem, Near Protocol Ecosystem, Fantom Ecosystem, Arbitrum Ecosystem, Ethereum Ecosystem, ZkSync Ecosystem, Mantle Ecosystem, Linea Ecosystem, Base Ecosystem, DragonFly Capital Portfolio, YZi Labs (Prev. Binance Labs) Portfolio"
ANVL,anvil,Anvil,ANVL,47225463,58841742.0,7890.89,"Decentralized Finance (DeFi), Ethereum Ecosystem"
SCRT,secret,Secret,SCRT,47134895,49299305.0,2980435.0,"Artificial Intelligence (AI), Infrastructure, Smart Contract Platform, Cosmos Ecosystem, Layer 1 (L1), Osmosis Ecosystem, Alameda Research Portfolio, DragonFly Capital Portfolio, DeFiance Capital Portfolio, Privacy Blockchain, Outlier Ventures Portfolio"
MVL,mass-vehicle-ledger,MVL,MVL,46041304,46543518.0,502332.0,"Internet of Things (IOT), BNB Chain Ecosystem, Ethereum Ecosystem, DePIN, DWF Labs Portfolio"
SIX,six,Six Sigma,SIX,43758042,43758042.0,368.15,"Gambling (GambleFi), Solana Ecosystem"
BAL,balancer,Balancer,BAL,43090773,47135678.0,1330540.0,"Decentralized Exchange (DEX), Exchange-based Tokens, Decentralized Finance (DeFi), Yield Farming, Automated Market Maker (AMM), Avalanche Ecosystem, Polygon Ecosystem, Near Protocol Ecosystem, Gnosis Chain Ecosystem, Harmony Ecosystem, Arbitrum Ecosystem, Ethereum Ecosystem, Optimism Ecosystem, Base Ecosystem, Index Coop Defi Index, Alameda Research Portfolio, DeFiance Capital Portfolio, Pantera Capital Portfolio, Energi Ecosystem, Polygon zkEVM Ecosystem, Huobi ECO Chain Ecosystem, Blockchain Capital Portfolio, Governance"
ACX,across-protocol,Across Protocol,ACX,38562540,60086544.0,1955851.0,"Polygon Ecosystem, Arbitrum Ecosystem, Ethereum Ecosystem, Optimism Ecosystem, Bridge Governance Tokens, Cross-chain Communication, Intent, Boba Network Ecosystem, Blockchain Capital Portfolio, Made in USA"
SEDA,seda-2,SEDA,SEDA,37478108,60917434.0,559156.0,"Smart Contract Platform, Oracle, Ethereum Ecosystem, Base Ecosystem, Modular Blockchain, Osmosis Ecosystem, HyperEVM Ecosystem"
AO,ao-computer,ao Computer,AO,37002017,37002017.0,160158.0,"Artificial Intelligence (AI), Smart Contract Platform, DePIN"
NYM,nym,Nym,NYM,35181621,42839347.0,1468965.0,"Smart Contract Platform, Privacy Coins, Ethereum Ecosystem, DePIN, Osmosis Ecosystem, VPN, Andreessen Horowitz (a16z) Portfolio, YZi Labs (Prev. Binance Labs) Portfolio, Governance"
VEE,blockv,BLOCKv,VEE,34919257,34919257.0,31705.0,"NFT, Polygon Ecosystem, Ethereum Ecosystem, Optimism Ecosystem, Base Ecosystem"
AINTI,aintivirus,AIntivirus,AINTI,33726458,33726458.0,0.0,"Solana Ecosystem, Meme, AI Meme, Pump.fun Ecosystem"
B3,b3,B3 (Base),B3,33314506,108041974.0,4989988.0,"Smart Contract Platform, Base Ecosystem, Gaming Blockchains"
FLOCK,flock-2,FLOCK,FLOCK,31510789,129851763.0,7794310.0,"Artificial Intelligence (AI), Base Ecosystem, AI Applications, Binance Alpha Spotlight, x402 Ecosystem"
QKC,quark-chain,QuarkChain,QKC,30778592,42847754.0,681072.0,"Infrastructure, Ethereum Ecosystem, Energi Ecosystem"
UQC,uquid-coin,Uquid Coin,UQC,29259231,117036925.0,13190.62,Ethereum Ecosystem
PIPPIN,pippin,pippin,PIPPIN,29090065,29090065.0,178148738.0,"Artificial Intelligence (AI), Infrastructure, Solana Ecosystem, Meme, Solana Meme, AI Meme, AI Agents, Pump.fun Ecosystem, Binance Alpha Spotlight, AI Framework"
QI,benqi,BENQI,QI,27139871,27139871.0,788268.0,"Decentralized Finance (DeFi), Yield Farming, Binance Launchpool, Lending/Borrowing Protocols, Avalanche Ecosystem, Liquid Staking Governance Tokens, DragonFly Capital Portfolio, Liquid Staking"
MBX,marblex,MARBLEX,MBX,22144515,27097058.0,726678.0,"Smart Contract Platform, Gaming (GameFi), NFT, BNB Chain Ecosystem, Kaia Ecosystem, Aptos Ecosystem, DWF Labs Portfolio, Gaming Blockchains"
MAPO,marcopolo,MAP Protocol,MAPO,21802979,34613892.0,581975.0,"BNB Chain Ecosystem, Ethereum Ecosystem, DWF Labs Portfolio"
GPS,goplus-security,GoPlus Security,GPS,20886888,62884954.0,22715061.0,"BNB Chain Ecosystem, Base Ecosystem, Cybersecurity, YZi Labs (Prev. Binance Labs) Portfolio, OKX Ventures Portfolio, Binance HODLer Airdrops, Binance Alpha Spotlight"
VANRY,vanar-chain,Vanar Chain,VANRY,20267441,21656762.0,7120758.0,"Artificial Intelligence (AI), Smart Contract Platform, Layer 1 (L1), Polygon Ecosystem, Ethereum Ecosystem, Vanar Chain Ecosystem"
NOS,nosana,Nosana,NOS,19776600,23712949.0,428365.0,"Artificial Intelligence (AI), Solana Ecosystem, DePIN"
LYX,lukso-token-2,LUKSO,LYX,19235441,26529558.0,1046904.0,"Smart Contract Platform, SocialFi, Layer 1 (L1), Ethereum Ecosystem, Decentralized Identifier (DID), Proof of Stake (PoS), Lukso Ecosystem"
ACS,access-protocol,Access Protocol,ACS,17895195,35885601.0,863938.0,"SocialFi, Solana Ecosystem"
PAAL,paal-ai,PAAL AI,PAAL,16746125,18658810.0,2368207.0,"Artificial Intelligence (AI), Virtual Reality, BNB Chain Ecosystem, Solana Ecosystem, Launchpad, Ethereum Ecosystem, Telegram Apps, Discord Bots, Base Ecosystem, PAAL AI Launchpad, AI Agents, AI Applications, AI Agent Launchpad, Binance Alpha Spotlight, AI Framework, DeFAI, Made in USA"
CHILLGUY,chill-guy,Just a chill guy,CHILLGUY,15704031,15704031.0,5382183.0,"Solana Ecosystem, Meme, Dog-Themed, Solana Meme, Pump.fun Ecosystem, TikTok Meme"
AI16Z,ai16z,ai16z,AI16Z,13434274,13434274.0,796681.0,"Artificial Intelligence (AI), Solana Ecosystem, Meme, Solana Token-2022, AI Agents, Binance Alpha Spotlight, AI Framework, Made in USA"
FORT,forta,Forta,FORT,13398004,21509018.0,517466.0,"Artificial Intelligence (AI), Polygon Ecosystem, Arbitrum Ecosystem, Ethereum Ecosystem, Base Ecosystem, Coinbase Ventures Portfolio, Cybersecurity, Andreessen Horowitz (a16z) Portfolio, Blockchain Capital Portfolio"
DEXTF,dextf,Memento,DEXTF,13181623,20030659.0,196343.0,"Decentralized Finance (DeFi), Asset Manager, Avalanche Ecosystem, Ethereum Ecosystem, ZkSync Ecosystem, Real World Assets (RWA), Base Ecosystem, Privacy Blockchain"
NAVX,navi,NAVI Protocol,NAVX,12834589,15725435.0,1398292.0,"Decentralized Finance (DeFi), Lending/Borrowing Protocols, Sui Ecosystem, OKX Ventures Portfolio, Binance Alpha Spotlight"
PIKA,pikaboss,Pikaboss,PIKA,11939918,11939918.0,3408.18,"Meme, Ethereum Ecosystem"
SWARMS,swarms,Swarms,SWARMS,11532772,11532772.0,3989614.0,"Artificial Intelligence (AI), Solana Ecosystem, AI Agents, Pump.fun Ecosystem, Binance Alpha Spotlight, AI Framework"
WALLET,ambire-wallet,Ambire Wallet,WALLET,11493072,11619738.0,175857.0,"Wallets, Polygon Ecosystem, Ethereum Ecosystem, Base Ecosystem, Account Abstraction, Governance"
TLOS,telos,Telos,TLOS,11344289,11344290.0,1702980.0,"Smart Contract Platform, BNB Chain Ecosystem, Layer 1 (L1), Avalanche Ecosystem, Polygon Ecosystem, Arbitrum Ecosystem, Ethereum Ecosystem, Zero Knowledge (ZK), Base Ecosystem, Telos Ecosystem, Consensys Portfolio, Privacy Blockchain"
FARTBOY,fartboy,Fartboy,$FARTBOY,11216971,11216971.0,1523900.0,"Solana Ecosystem, Meme, Solana Meme, Pump.fun Ecosystem"
L3,layer3,Layer3,L3,11080111,36485559.0,4690821.0,"Marketing, BNB Chain Ecosystem, Solana Ecosystem, Polygon Ecosystem, Arbitrum Ecosystem, Ethereum Ecosystem, Decentralized Identifier (DID), Optimism Ecosystem, Quest-to-Earn, Made in USA"
PPC,peercoin,Peercoin,PPC,10020897,10020915.0,53515.0,"Smart Contract Platform, Polygon Ecosystem, Ethereum Ecosystem, Proof of Stake (PoS), Proof of Work (PoW)"
LUMIA,lumia,Lumia,LUMIA,9853207,31256418.0,2343264.0,"Smart Contract Platform, Layer 2 (L2), Real World Assets (RWA), Governance"
NRN,neuron,Neuron,NRN,8018797,17842028.0,382892.0,"Artificial Intelligence (AI), Gaming (GameFi), NFT, Arbitrum Ecosystem, Paradigm Portfolio, AI Agents, AI Framework, Action Games, Robotics"
RARI,rarible,RARI,RARI,7434899,10266064.0,569506.0,"NFT, Ethereum Ecosystem, NFT Marketplace, Base Ecosystem, Coinbase Ventures Portfolio, Energi Ecosystem, Made in USA, Governance"
WEXO,wexo,Wexo,WEXO,7434455,19997741.0,202617.0,"Ethereum Ecosystem, Payment Solutions, Base Ecosystem, E-commerce"
TRIAS,trias-token,TriasLab,TRIAS,7264693,7264693.0,1066.61,"Artificial Intelligence (AI), Smart Contract Platform, BNB Chain Ecosystem, Layer 1 (L1), Ethereum Ecosystem, AI Agents"
SCA,scallop-2,Scallop,SCA,6857156,12512111.0,355535.0,"Decentralized Finance (DeFi), Lending/Borrowing Protocols, Sui Ecosystem"
XTER,xterio,Xterio,XTER,6788710,47544628.0,3175046.0,"Artificial Intelligence (AI), Gaming (GameFi), NFT, BNB Chain Ecosystem, Animoca Brands Portfolio, Gaming Blockchains, YZi Labs (Prev. Binance Labs) Portfolio, Binance Alpha Spotlight"
GRAM,gram-2,Gram,GRAM,6402111,6402111.0,23720.0,"TON Ecosystem, Proof of Work (PoW)"
VADER,vaderai-by-virtuals,Vader,VADER,6201080,6201080.0,288430.0,"Artificial Intelligence (AI), Meme, Base Ecosystem, AI Meme, AI Agents, Virtuals Protocol Ecosystem, Binance Alpha Spotlight, Robotics"
BELLS,bellscoin,Bellscoin,BELLS,5439065,5439065.0,269851.0,"Smart Contract Platform, Layer 1 (L1), Meme, Proof of Work (PoW), Inscriptions, Made in USA"
CEEK,ceek,CEEK Smart VR,CEEK,5238058,5259095.0,211988.0,"Entertainment, BNB Chain Ecosystem, Metaverse, Ethereum Ecosystem, DWF Labs Portfolio"
LCAT,lion-cat,Lion Cat,LCAT,5113641,5673943.0,21386.0,"BNB Chain Ecosystem, Meme, Cat-Themed"
TET,tectum,Tectum,TET,4795919,4827496.0,71558.0,"Smart Contract Platform, Layer 1 (L1), Ethereum Ecosystem, Bitcoin Sidechains, SideChain"
XX,xxcoin,XX Network,XX,4572880,12626974.0,99392.0,"Smart Contract Platform, Layer 1 (L1), Ethereum Ecosystem"
FNCT,financie-token,Financie Token,FNCT,4411841,23156439.0,84264.0,"SocialFi, Polygon Ecosystem, Ethereum Ecosystem, Governance"
SOVRN,sovrun,Sovrun,SOVRN,4287639,4618658.0,91033.0,"Gaming (GameFi), Metaverse, Ethereum Ecosystem, Animoca Brands Portfolio, Base Ecosystem, DWF Labs Portfolio, On-chain Gaming, Andreessen Horowitz (a16z) Portfolio, Hyperliquid Ecosystem, Delphi Ventures Portfolio, Circle Ventures Portfolio"
GRAIL,camelot-token,Camelot Token,GRAIL,4240028,16460130.0,76039.0,"Decentralized Exchange (DEX), Exchange-based Tokens, Arbitrum Ecosystem, Camelot Launchpad"
JOULE,joule-2,Joule,JOULE,4189348,4221081.0,32599.0,"Decentralized Finance (DeFi), Flare Network Ecosystem"
JETTON,jetton,JetTon Games,JETTON,3971092,6278395.0,91666.0,"Gambling (GambleFi), Telegram Apps, TON Ecosystem"
LVVA,levva-protocol,Levva Protocol,LVVA,3813836,3894430.0,399966.0,"Decentralized Finance (DeFi), Analytics, Yield Farming, Yield Aggregator, Ethereum Ecosystem, Yield Optimizer"
EOS,binance-peg-eos,Binance-Peg EOS,EOS,3764983,3764983.0,725.29,"Smart Contract Platform, BNB Chain Ecosystem, Binance-Peg Tokens"
PAIN,pain,Pain,PAIN,3743041,7486158.0,25096.0,"Solana Ecosystem, Meme, Solana Meme, 4chan-Themed"
QORPO,qopro,QORPO WORLD,QORPO,3723588,4517031.0,862446.0,"Gaming (GameFi), NFT, BNB Chain Ecosystem, Play To Earn, Ethereum Ecosystem, RPG, Gaming Utility Token, Adventure Games, Gaming Platform, Action Games"
VISTA,ethervista,Ethervista,VISTA,3441402,3441402.0,337410.0,"Decentralized Exchange (DEX), Exchange-based Tokens, Decentralized Finance (DeFi), Launchpad, Meme, Ethereum Ecosystem, Binance Alpha Spotlight"
OVR,ovr,Ovr,OVR,3122827,5347962.0,282592.0,"Artificial Intelligence (AI), Augmented Reality, BNB Chain Ecosystem, Polygon Ecosystem, Ethereum Ecosystem, DePIN, Base Ecosystem, Robotics"
ARCA,arca,Legend of Arcadia,ARCA,3023408,10051480.0,199171.0,"Gaming (GameFi), Ethereum Ecosystem, RPG"
RENTA,renta-network,Renta Network,RENTA,2983552,6328278.0,81467.0,"Retail, Smart Contract Platform, NFT, Ethereum Ecosystem, Layer 2 (L2), Real World Assets (RWA), NFTFi"
VRTX,vertex-protocol,Vertex,VRTX,2707502,5124334.0,217.29,"Decentralized Exchange (DEX), Exchange-based Tokens, Decentralized Finance (DeFi), Derivatives, Perpetuals, Avalanche Ecosystem, Arbitrum Ecosystem, Mantle Ecosystem, Base Ecosystem, Blast Ecosystem, Sonic Ecosystem, Sei Network Ecosystem"
KIMA,kima,Kima Network,KIMA,2700998,8644989.0,301858.0,"Infrastructure, Cosmos Ecosystem, Arbitrum Ecosystem, Outlier Ventures Portfolio"
HYDRA,hydra,Hydra,HYDRA,2667071,2911608.0,112195.0,"Smart Contract Platform, Layer 1 (L1)"
ICP,internet-computer,Internet Computer,ICP,2199955027,2199955027.0,143152081.0,"Artificial Intelligence (AI), Infrastructure, Smart Contract Platform, Layer 1 (L1), Ethereum Ecosystem, Internet Computer Ecosystem, Base Ecosystem, Alleged SEC Securities, Multicoin Capital Portfolio, Layer 0 (L0), Andreessen Horowitz (a16z) Portfolio, GMCI Layer 1 Index, GMCI 30 Index, Blockchain Capital Portfolio, GMCI Index, Polychain Capital Portfolio, Coinbase 50 Index, Governance"
JLP,jupiter-perpetuals-liquidity-provider-token,Jupiter Perpetuals Liquidity Provider Token,JLP,1812805770,1812797421.0,42623784.0,"Decentralized Finance (DeFi), LP Tokens, Solana Ecosystem"
APT,aptos,Aptos,APT,1708134178,2758794549.0,229796038.0,"Smart Contract Platform, Layer 1 (L1), Aptos Ecosystem, FTX Holdings, Coinbase Ventures Portfolio, Multicoin Capital Portfolio, Proof of Stake (PoS), DragonFly Capital Portfolio, Andreessen Horowitz (a16z) Portfolio, YZi Labs (Prev. Binance Labs) Portfolio, GMCI Layer 1 Index, GMCI 30 Index, Circle Ventures Portfolio, GMCI Index, Made in USA"
FTN,fasttoken,Fasttoken,FTN,781996718,1569742045.0,926200.0,"Smart Contract Platform, BNB Chain Ecosystem, Layer 1 (L1), Arbitrum Ecosystem, Ethereum Ecosystem, Base Ecosystem, Bahamut Ecosystem"
TEL,telcoin,Telcoin,TEL,512780955,539330942.0,3841640.0,"Decentralized Finance (DeFi), Wallets, Polygon Ecosystem, Arbitrum Ecosystem, Ethereum Ecosystem, Payment Solutions, Base Ecosystem, Made in USA"
DCR,decred,Decred,DCR,430446714,430479829.0,17659929.0,"Smart Contract Platform, Privacy Coins, Layer 1 (L1), Proof of Stake (PoS), Proof of Work (PoW), Blockchain Capital Portfolio, Made in USA"
SYRUP,syrup,Maple Finance,SYRUP,346850985,370439010.0,25705114.0,"Decentralized Finance (DeFi), Yield Farming, Lending/Borrowing Protocols, Ethereum Ecosystem, Real World Assets (RWA), Base Ecosystem, Binance Alpha Spotlight"
CCD,concordium,Concordium,CCD,212418055,256793434.0,1758321.0,"Smart Contract Platform, Layer 1 (L1), Decentralized Identifier (DID), Zero Knowledge (ZK), Privacy Blockchain"
DEXE,dexe,DeXe,DEXE,208954702,432035910.0,6977946.0,"Artificial Intelligence (AI), Decentralized Finance (DeFi), BNB Chain Ecosystem, Ethereum Ecosystem"
KMNO,kamino,Kamino,KMNO,172544036,521343808.0,14293298.0,"Decentralized Finance (DeFi), Lending/Borrowing Protocols, Solana Ecosystem, Binance Alpha Spotlight"
KSM,kusama,Kusama,KSM,147607537,147607537.0,5570135.0,"Smart Contract Platform, Polkadot Ecosystem, Proof of Stake (PoS), Pantera Capital Portfolio, Made in USA, Coinbase 50 Index, Hydration Ecosystem"
TFUEL,theta-fuel,Theta Fuel,TFUEL,145057046,145058094.0,1446070.0,"Artificial Intelligence (AI), Smart Contract Platform, DePIN, Proof of Stake (PoS), Made in USA"
YFI,yearn-finance,yearn.finance,YFI,136582390,147357283.0,9353322.0,"Decentralized Finance (DeFi), Yield Farming, Yield Aggregator, Yearn Ecosystem, Avalanche Ecosystem, Polygon Ecosystem, Near Protocol Ecosystem, Gnosis Chain Ecosystem, Fantom Ecosystem, Harmony Ecosystem, Arbitrum Ecosystem, Ethereum Ecosystem, Optimism Ecosystem, Base Ecosystem, Index Coop Defi Index, Alameda Research Portfolio, Energi Ecosystem, Sora Ecosystem, Huobi ECO Chain Ecosystem, Blockchain Capital Portfolio, Governance"
MINA,mina-protocol,Mina Protocol,MINA,136171059,136171059.0,23262593.0,"Smart Contract Platform, Layer 1 (L1), Zero Knowledge (ZK), FTX Holdings, Paradigm Portfolio, Coinbase Ventures Portfolio, Multicoin Capital Portfolio, Proof of Stake (PoS), Pantera Capital Portfolio, Circle Ventures Portfolio, Privacy Blockchain, Polychain Capital Portfolio, Made in USA, Coinbase 50 Index"
ZIL,zilliqa,Zilliqa,ZIL,115196679,119201561.0,8663616.0,"Smart Contract Platform, BNB Chain Ecosystem, GMCI Layer 1 Index, GMCI Index, Made in China"
QUBIC,qubic-network,Qubic,QUBIC,105228651,133535416.0,3284545.0,"Artificial Intelligence (AI), Smart Contract Platform, Layer 1 (L1), Proof of Work (PoW)"
MEW,cat-in-a-dogs-world,cat in a dogs world,MEW,100988482,100988482.0,17718522.0,"Solana Ecosystem, Meme, Dog-Themed, Solana Meme, Cat-Themed, Binance Alpha Spotlight, IP Meme"
NIZA,niza-global-2,Niza Global,NIZA,80217468,80217468.0,1254248.0,"Exchange-based Tokens, Centralized Exchange (CEX) Token, Ethereum Ecosystem"
AP3X,apex-4,APEX,AP3X,60509925,150844811.0,100020.0,Layer 1 (L1)
YGG,yield-guild-games,Yield Guild Games,YGG,59325041,87239715.0,17284282.0,"Gaming (GameFi), NFT, BNB Chain Ecosystem, Metaverse, Collectibles, Polygon Ecosystem, Play To Earn, Harmony Ecosystem, Guild and Scholarship, Ethereum Ecosystem, Animoca Brands Portfolio, Base Ecosystem, DWF Labs Portfolio, Ronin Ecosystem, Gaming Governance Token, Andreessen Horowitz (a16z) Portfolio, Delphi Ventures Portfolio, Abstract Ecosystem"
SWFTC,swftcoin,SWFTCOIN,SWFTC,53044007,53044007.0,13065552.0,"NFT, BNB Chain Ecosystem, Ethereum Ecosystem, Dex Aggregator"
PEOPLE,constitutiondao,ConstitutionDAO,PEOPLE,47722123,47722123.0,13321017.0,"Meme, Ethereum Ecosystem, PolitiFi"
ACH,alchemy-pay,Alchemy Pay,ACH,45597869,92234463.0,7131128.0,"BNB Chain Ecosystem, Ethereum Ecosystem, Payment Solutions, DWF Labs Portfolio, Made in China"
SGB,songbird,Songbird,SGB,43898635,51902791.0,156202.0,Smart Contract Platform
WHITE,whiteheart,Whiteheart,WHITE,43079983,43079983.0,11.97,"Decentralized Finance (DeFi), Derivatives, Ethereum Ecosystem"
NOW,changenow,ChangeNOW,NOW,42758066,49900580.0,14344.09,"Decentralized Exchange (DEX), Exchange-based Tokens, BNB Chain Ecosystem, Ethereum Ecosystem"
EWT,energy-web-token,Energy Web,EWT,42022085,47903159.0,292842.0,"Energy, Polkadot Ecosystem, Gnosis Chain Ecosystem, Regenerative Finance (ReFi), Real World Assets (RWA), Blockchain Capital Portfolio, Hydration Ecosystem"
CYBER,cyberconnect,CYBER,CYBER,41989598,76511912.0,9350926.0,"Artificial Intelligence (AI), Smart Contract Platform, SocialFi, NFT, BNB Chain Ecosystem, Binance Launchpool, Ethereum Ecosystem, Decentralized Identifier (DID), Optimism Ecosystem, Layer 2 (L2), Animoca Brands Portfolio, Multicoin Capital Portfolio, YZi Labs (Prev. Binance Labs) Portfolio, Delphi Ventures Portfolio, Cyber Ecosystem, Optimism Superchain Ecosystem, AI Applications, Governance"
CARV,carv,CARV,CARV,41244848,136153483.0,20106041.0,"Artificial Intelligence (AI), Infrastructure, Gaming (GameFi), NFT, BNB Chain Ecosystem, Solana Ecosystem, Arbitrum Ecosystem, Impossible Finance Launchpad, Ethereum Ecosystem, Animoca Brands Portfolio, Base Ecosystem, Binance Alpha Spotlight"
DORA,dora-2,DORA,DORA,40630990,40630990.0,394670.0,"BNB Chain Ecosystem, Meme, Binance Alpha Spotlight, Chinese Meme"
VVV,venice-token,Venice Token,VVV,40325407,76199314.0,1528866.0,"Artificial Intelligence (AI), Base Ecosystem, AI Agents, AI Applications, Binance Alpha Spotlight, Made in USA"
ISLM,islamic-coin,Islamic Coin,ISLM,34710952,311348758.0,158619.0,"Smart Contract Platform, Wallets, Layer 2 (L2), Osmosis Ecosystem"
HBD,hive_dollar,Hive Dollar,HBD,34157217,34155182.0,56.58,"Stablecoins, USD Stablecoin, Algorithmic Stablecoin"
