DNX,dynex,Dynex,DNX,2145427.0,2145486.0,45107.0,"Artificial Intelligence (AI), Smart Contract Platform, Layer 1 (L1), Ethereum Ecosystem, DePIN, Decentralized Science (DeSci), Proof of Work (PoW)"
LIKE,likecoin-2,LikeCoin,LIKE,2096730.0,2583988.0,3125.84,"Entertainment, Base Native"
APX,apextoken,ApexToken,APX,2077295.0,19035888.0,8.46,BNB Chain Ecosystem
BLEND,blend,Blend,BLND,2057281.0,3916753.0,1368.68,"Decentralized Finance (DeFi), Lending/Borrowing Protocols, Stellar Ecosystem"
METAV,metaverse,METAVERSE,METAV,1751999.0,1751999.0,174875.0,"Artificial Intelligence (AI), Solana Ecosystem, AI Agents, Pump.fun Ecosystem, Binance Alpha Spotlight"
EPT,balance,Balance,EPT,1682170.0,7261429.0,1549765.0,"Gaming (GameFi), BNB Chain Ecosystem, Animoca Brands Portfolio, DWF Labs Portfolio, AI Agents, Andreessen Horowitz (a16z) Portfolio, AI Agent Launchpad"
PAI,panther-ai,Panther AI,PAI,1473909.0,2510494.0,794103.0,"Artificial Intelligence (AI), BNB Chain Ecosystem, Trading Bots, Governance"
DIONE,dione,Dione,DIONE,1455732.0,1633907.0,13652.98,"Energy, Smart Contract Platform, Layer 1 (L1), Made in USA"
MLC,my-lovely-coin,My Lovely Coin,MLC,1386110.0,3370941.0,69788.0,"Charity, Gaming (GameFi), BNB Chain Ecosystem, Solana Ecosystem, Polygon Ecosystem, Gaming Utility Token"
KILO,kiloex,KiloEx,KILO,1330607.0,6285343.0,156223.0,"Decentralized Exchange (DEX), Exchange-based Tokens, Decentralized Finance (DeFi), BNB Chain Ecosystem, Derivatives, Perpetuals, Binance Wallet IDO"
AEROBUD,aerobud,AEROBUD,AEROBUD,1290649.0,1290649.0,200219.0,"Charity, Meme, Base Ecosystem, Dog-Themed, Base Meme, Made in USA, Base Native"
BNB,binancecoin,BNB,BNB,84261207647.0,84261207647.0,1114159286.0,"Smart Contract Platform, Exchange-based Tokens, BNB Chain Ecosystem, Centralized Exchange (CEX) Token, Layer 1 (L1), Ethereum Ecosystem, Alleged SEC Securities, FTX Holdings, Proof of Stake (PoS), GMCI Layer 1 Index, GMCI 30 Index, GMCI Index, Made in China"
HBAR,hedera-hashgraph,Hedera,HBAR,3845592534.0,4440284648.0,100114237.0,"Smart Contract Platform, Layer 1 (L1), Hedera Ecosystem, GMCI Layer 1 Index, GMCI 30 Index, GMCI Index, Outlier Ventures Portfolio, Made in USA, Directed Acyclic Graph (DAG)"
ICP,internet-computer,Internet Computer,ICP,1256722961.0,1256722961.0,41157862.0,"Artificial Intelligence (AI), Infrastructure, Smart Contract Platform, Layer 1 (L1), Ethereum Ecosystem, Internet Computer Ecosystem, Base Ecosystem, Alleged SEC Securities, Multicoin Capital Portfolio, Layer 0 (L0), Andreessen Horowitz (a16z) Portfolio, GMCI Layer 1 Index, GMCI 30 Index, Blockchain Capital Portfolio, GMCI Index, Polychain Capital Portfolio, Coinbase 50 Index, Governance, Base Native"
RENDER,render-token,Render,RENDER,924685064.0,950995790.0,61390275.0,"Artificial Intelligence (AI), NFT, Metaverse, Solana Ecosystem, Ethereum Ecosystem, DePIN, Multicoin Capital Portfolio, Alameda Research Portfolio, GMCI DePIN Index, GMCI 30 Index, GMCI Index, Made in USA, Coinbase 50 Index"
XDC,xdce-crowd-sale,XDC Network,XDC,607522331.0,1159525957.0,17647663.0,"Smart Contract Platform, Layer 1 (L1), Real World Assets (RWA)"
STX,blockstack,Stacks,STX,414558915.0,414558915.0,10059507.0,"Infrastructure, Smart Contract Platform, Layer 2 (L2), Bitcoin Sidechains, Stacks Ecosystem, SideChain, GMCI Layer 2 Index, GMCI 30 Index, Blockchain Capital Portfolio, GMCI Index, Made in USA, Coinbase 50 Index, CoinList Launchpad"
DASH,dash,Dash,DASH,414396297.0,414404551.0,79442562.0,"Masternodes, Payment Solutions, Alleged SEC Securities, Proof of Stake (PoS), Proof of Work (PoW), Made in USA, Privacy Infrastructure, Privacy"
DEXE,dexe,DeXe,DEXE,366907696.0,757373908.0,13540836.0,"Decentralized Finance (DeFi), BNB Chain Ecosystem, Ethereum Ecosystem"
SUN,sun-token,Sun Token,SUN,342340225.0,354348499.0,211199226.0,"Decentralized Finance (DeFi), Tron Ecosystem, Made in China"
BTT,bittorrent,BitTorrent,BTT,312441068.0,313378708.0,9224848.0,"Storage, BNB Chain Ecosystem, Ethereum Ecosystem, DePIN, Alleged SEC Securities, Binance Launchpad, Tron Ecosystem, Energi Ecosystem, YZi Labs (Prev. Binance Labs) Portfolio, BitTorrent Ecosystem, GMCI DePIN Index, GMCI Index"
AERO,aerodrome-finance,Aerodrome Finance,AERO,302362225.0,608770587.0,12484028.0,"Decentralized Exchange (DEX), Exchange-based Tokens, Decentralized Finance (DeFi), Automated Market Maker (AMM), Base Ecosystem, Binance Alpha Spotlight, Made in USA, Base Native"
TIA,celestia,Celestia,TIA,266078867.0,344800454.0,23380196.0,"Smart Contract Platform, Cosmos Ecosystem, Layer 1 (L1), Data Availability, Modular Blockchain, Osmosis Ecosystem, eGirl Capital Portfolio, Coinbase Ventures Portfolio, Proof of Stake (PoS), Secret Ecosystem, YZi Labs (Prev. Binance Labs) Portfolio, Delphi Ventures Portfolio, Galaxy Digital Portfolio, Blockchain Capital Portfolio, OKX Ventures Portfolio, Polychain Capital Portfolio"
PYTH,pyth-network,Pyth Network,PYTH,224611001.0,390629033.0,11394350.0,"Infrastructure, Decentralized Finance (DeFi), Oracle, Analytics, Solana Ecosystem, Neon Ecosystem, Manta Network Ecosystem, Multicoin Capital Portfolio, GMCI DeFi Index, Delphi Ventures Portfolio, GMCI Index"
IP,story-2,Story,IP,185419485.0,539863731.0,45814667.0,"Artificial Intelligence (AI), Smart Contract Platform, Layer 1 (L1), Binance Alpha Spotlight, Made in USA, Story Ecosystem, IP"
ZK,zksync,ZKsync,ZK,169040100.0,369585754.0,9648893.0,"Smart Contract Platform, Ethereum Ecosystem, Layer 2 (L2), Zero Knowledge (ZK), ZkSync Ecosystem, Consensys Portfolio, Blockchain Capital Portfolio, OKX Ventures Portfolio, Privacy Blockchain, Privacy Infrastructure, Privacy"
OZO,ozone-chain,Ozone Chain,OZO,125949647.0,131982342.0,207793.0,"Smart Contract Platform, Layer 1 (L1), Zero Knowledge (ZK)"
EIGEN,eigenlayer,EigenCloud (prev. EigenLayer),EIGEN,114666354.0,301118627.0,17651266.0,"Artificial Intelligence (AI), Infrastructure, Ethereum Ecosystem, Base Ecosystem, Data Availability, Restaking, Polychain Capital Portfolio, AI Framework, Made in USA, x402 Ecosystem"
GMRT,gamer-tag,The Game Company,GMRT,71474504.0,201081310.0,2660.59,"Infrastructure, Gaming (GameFi), Ethereum Ecosystem, Base Ecosystem"
NPC,non-playable-coin,Non-Playable Coin,NPC,61475468.0,61475468.0,3808889.0,"NFT, BNB Chain Ecosystem, Solana Ecosystem, Meme, Ethereum Ecosystem, Base Ecosystem, Hybrid Token Standards, Wojak-Themed, 4chan-Themed, Base Native"
SHIB,binance-peg-shib,Binance-Peg SHIB,SHIB,54919742.0,54919742.0,14985.7,"BNB Chain Ecosystem, Meme, Dog-Themed, Binance-Peg Tokens"
PIPPIN,pippin,pippin,PIPPIN,50524547.0,50524547.0,43016324.0,"Artificial Intelligence (AI), Infrastructure, Solana Ecosystem, Meme, Solana Meme, AI Meme, AI Agents, Pump.fun Ecosystem, Binance Alpha Spotlight, AI Framework"
MEW,cat-in-a-dogs-world,cat in a dogs world,MEW,50360891.0,50360891.0,6624696.0,"Solana Ecosystem, Meme, Dog-Themed, Solana Meme, Cat-Themed, Binance Alpha Spotlight, IP Meme"
CELO,celo,Celo,CELO,49609219.0,82805499.0,13659370.0,"Smart Contract Platform, Celo Ecosystem, Layer 2 (L2), DWF Labs Portfolio, Coinbase Ventures Portfolio, Proof of Stake (PoS), Andreessen Horowitz (a16z) Portfolio, Optimism Superchain Ecosystem, Outlier Ventures Portfolio, Made in USA, CoinList Launchpad"
VEE,blockv,BLOCKv,VEE,41273204.0,41273204.0,287799.0,"NFT, Polygon Ecosystem, Ethereum Ecosystem, Optimism Ecosystem, Base Ecosystem, Base Native"
DRIFT,drift-protocol,Drift Protocol,DRIFT,40016163.0,68855308.0,8143948.0,"Decentralized Finance (DeFi), Derivatives, Prediction Markets, Perpetuals, Solana Ecosystem, Binance Alpha Spotlight, Governance"
GPS,goplus-security,GoPlus Security,GPS,38170626.0,86572376.0,15824026.0,"BNB Chain Ecosystem, Base Ecosystem, Cybersecurity, YZi Labs (Prev. Binance Labs) Portfolio, OKX Ventures Portfolio, Binance HODLer Airdrops, Binance Alpha Spotlight, Base Native"
MVL,mass-vehicle-ledger,MVL,MVL,36428483.0,39307128.0,395831.0,"Internet of Things (IOT), BNB Chain Ecosystem, Ethereum Ecosystem, DePIN, DWF Labs Portfolio"
ISLM,islamic-coin,Islamic Coin,ISLM,34135193.0,271723265.0,461365.0,"Smart Contract Platform, Wallets, Layer 2 (L2), Osmosis Ecosystem"
IO,io,io.net,IO,33748955.0,85871708.0,6003270.0,"Artificial Intelligence (AI), Internet of Things (IOT), Binance Launchpool, Solana Ecosystem, DePIN, Animoca Brands Portfolio, Multicoin Capital Portfolio, Delphi Ventures Portfolio, OKX Ventures Portfolio, Made in USA"
AINTI,aintivirus,AIntivirus,AINTI,33725393.0,33725393.0,0.0,"Solana Ecosystem, Meme, AI Meme, Pump.fun Ecosystem"
HIVE,hive,Hive,HIVE,30603920.0,,1724846.0,"Smart Contract Platform, SocialFi, Layer 1 (L1), Gaming Blockchains"
ACX,across-protocol,Across Protocol,ACX,30312314.0,43087970.0,3875951.0,"Polygon Ecosystem, Arbitrum Ecosystem, Ethereum Ecosystem, Optimism Ecosystem, Bridge Governance Tokens, Cross-chain Communication, Intent, Boba Network Ecosystem, Blockchain Capital Portfolio, Made in USA"
RLC,iexec-rlc,iExec RLC,RLC,30051115.0,36119764.0,5381923.0,"Artificial Intelligence (AI), Oracle, Arbitrum Ecosystem, Ethereum Ecosystem, DePIN, AI Agents, Energi Ecosystem, Sora Ecosystem, GMCI DePIN Index, GMCI Index, Privacy Infrastructure, Privacy"
UQC,uquid-coin,Uquid Coin,UQC,28071460.0,112285842.0,26762.0,Ethereum Ecosystem
NYM,nym,Nym,NYM,27894887.0,33550697.0,1178933.0,"Smart Contract Platform, Ethereum Ecosystem, DePIN, Osmosis Ecosystem, VPN, Andreessen Horowitz (a16z) Portfolio, YZi Labs (Prev. Binance Labs) Portfolio, Privacy Blockchain, Governance, CoinList Launchpad, Privacy Infrastructure, Privacy"
SKR,saakuru-labs,Saakuru,SKR,26121178.0,37142322.0,1061.15,"Smart Contract Platform, BNB Chain Ecosystem, Ethereum Ecosystem, Optimism Ecosystem, Layer 2 (L2), Base Ecosystem, Saakuru Ecosystem"
AP3X,apex-4,APEX,AP3X,26022937.0,50059104.0,14.21,Layer 1 (L1)
SCRT,secret,Secret,SCRT,25591950.0,26736606.0,1193786.0,"Artificial Intelligence (AI), Infrastructure, Smart Contract Platform, Cosmos Ecosystem, Layer 1 (L1), Osmosis Ecosystem, Alameda Research Portfolio, DragonFly Capital Portfolio, DeFiance Capital Portfolio, Privacy Blockchain, Outlier Ventures Portfolio"
NOS,nosana,Nosana,NOS,24880889.0,24880889.0,717436.0,"Artificial Intelligence (AI), Solana Ecosystem, DePIN"
ADS,adshares,Adshares,ADS,21967647.0,21972789.0,856023.0,"Decentralized Finance (DeFi), Marketing, BNB Chain Ecosystem, Metaverse, Polygon Ecosystem, Ethereum Ecosystem, Base Ecosystem, Base Native"
EUL,euler,Euler,EUL,21282419.0,23940136.0,10080020.0,"BNB Chain Ecosystem, Lending/Borrowing Protocols, Avalanche Ecosystem, Arbitrum Ecosystem, Ethereum Ecosystem, Base Ecosystem, Berachain Ecosystem, Paradigm Portfolio, Coinbase Ventures Portfolio, Sonic Ecosystem, Swellchain Ecosystem, Unichain Ecosystem, TAC Ecosystem, Plasma Ecosystem, BOB Network Ecosystem"
MAPO,marcopolo,MAP Protocol,MAPO,19970242.0,31247907.0,191634.0,"BNB Chain Ecosystem, Ethereum Ecosystem, DWF Labs Portfolio"
AVAIL,avail,Avail,AVAIL,17483497.0,49502915.0,5600707.0,"Infrastructure, Smart Contract Platform, BNB Chain Ecosystem, Ethereum Ecosystem, Data Availability, Modular Blockchain, Binance Alpha Spotlight, Base Native"
FLOCK,flock-2,FLOCK,FLOCK,17422888.0,51517618.0,8405473.0,"Artificial Intelligence (AI), Base Ecosystem, AI Applications, Binance Alpha Spotlight, x402 Ecosystem, Base Native"
AO,ao-computer,ao Computer,AO,16502617.0,16502617.0,182491.0,"Artificial Intelligence (AI), Smart Contract Platform, DePIN"
BICO,biconomy,Biconomy,BICO,15230622.0,21379863.0,4784425.0,"Infrastructure, Arbitrum Ecosystem, Ethereum Ecosystem, Account Abstraction, Coinbase Ventures Portfolio, YZi Labs (Prev. Binance Labs) Portfolio, Consensys Portfolio, Outlier Ventures Portfolio, CoinList Launchpad"
B3,b3,B3 (Base),B3,13960512.0,31122925.0,2065860.0,"Smart Contract Platform, Base Ecosystem, Gaming Blockchains, Base Native"
ALI,alethea-artificial-liquid-intelligence-token,Artificial Liquid Intelligence,ALI,13232129.0,13923488.0,111255.0,"Artificial Intelligence (AI), NFT, Metaverse, Solana Ecosystem, Polygon Ecosystem, Ethereum Ecosystem, Cronos Ecosystem, Base Ecosystem, Multicoin Capital Portfolio, AI Agents, Alameda Research Portfolio, DeFiance Capital Portfolio, YZi Labs (Prev. Binance Labs) Portfolio, Airdropped Tokens by NFT Projects, Governance, Base Native"
SEDA,seda-2,SEDA,SEDA,13171722.0,20520530.0,391939.0,"Smart Contract Platform, Oracle, Ethereum Ecosystem, Base Ecosystem, Modular Blockchain, Osmosis Ecosystem, HyperEVM Ecosystem, Base Native"
PAAL,paal-ai,PAAL AI,PAAL,13033721.0,14522388.0,552050.0,"Artificial Intelligence (AI), Virtual Reality, BNB Chain Ecosystem, Solana Ecosystem, Launchpad, Ethereum Ecosystem, Telegram Apps, Discord Bots, Base Ecosystem, PAAL AI Launchpad, AI Agents, AI Applications, AI Agent Launchpad, Binance Alpha Spotlight, AI Framework, DeFAI, Made in USA, Base Native"
L3,layer3,Layer3,L3,12785290.0,30834833.0,4018881.0,"Marketing, BNB Chain Ecosystem, Solana Ecosystem, Polygon Ecosystem, Arbitrum Ecosystem, Ethereum Ecosystem, Decentralized Identifier (DID), Optimism Ecosystem, Quest-to-Earn, Made in USA, Base Native"
MBX,marblex,MARBLEX,MBX,10746439.0,12413808.0,1139510.0,"Smart Contract Platform, Gaming (GameFi), NFT, BNB Chain Ecosystem, Kaia Ecosystem, Aptos Ecosystem, DWF Labs Portfolio, Gaming Blockchains"
QI,benqi,BENQI,QI,9955283.0,9955283.0,376210.0,"Decentralized Finance (DeFi), Yield Farming, Binance Launchpool, Lending/Borrowing Protocols, Avalanche Ecosystem, Liquid Staking Governance Tokens, DragonFly Capital Portfolio, Liquid Staking"
HFT,hashflow,Hashflow,HFT,9825785.0,12745363.0,7357452.0,"Decentralized Exchange (DEX), Exchange-based Tokens, Decentralized Finance (DeFi), BNB Chain Ecosystem, Binance Launchpool, MEV Protection, Ethereum Ecosystem, Coinbase Ventures Portfolio, Alameda Research Portfolio, DragonFly Capital Portfolio, Galaxy Digital Portfolio"
SWARMS,swarms,Swarms,SWARMS,9637798.0,9637798.0,3495114.0,"Artificial Intelligence (AI), Solana Ecosystem, AI Agents, Pump.fun Ecosystem, Binance Alpha Spotlight, AI Framework"
BAL,balancer,Balancer,BAL,9199294.0,10272542.0,531839.0,"Automated Market Maker (AMM), Decentralized Finance (DeFi), Huobi ECO Chain Ecosystem, Avalanche Ecosystem, Exchange-based Tokens, Pantera Capital Portfolio, Alameda Research Portfolio, Base Native, DeFiance Capital Portfolio, Decentralized Exchange (DEX), Index Coop Defi Index, Polygon zkEVM Ecosystem, Yield Farming, Polygon Ecosystem, Optimism Ecosystem, Blockchain Capital Portfolio, Near Protocol Ecosystem, Base Ecosystem, Gnosis Chain Ecosystem, Arbitrum Ecosystem, Ethereum Ecosystem, Harmony Ecosystem, Energi Ecosystem, Governance"
FORT,forta,Forta,FORT,8675266.0,13729392.0,6677058.0,"Artificial Intelligence (AI), Polygon Ecosystem, Arbitrum Ecosystem, Ethereum Ecosystem, Base Ecosystem, Coinbase Ventures Portfolio, Cybersecurity, Andreessen Horowitz (a16z) Portfolio, Blockchain Capital Portfolio"
PPC,peercoin,Peercoin,PPC,8266715.0,8266728.0,40891.0,"Smart Contract Platform, Polygon Ecosystem, Ethereum Ecosystem, Proof of Stake (PoS), Proof of Work (PoW)"
ACS,access-protocol,Access Protocol,ACS,8150385.0,15456203.0,546137.0,"SocialFi, Solana Ecosystem"
PIKA,pikaboss,Pikaboss,PIKA,8006669.0,8006669.0,3765.88,"Meme, Ethereum Ecosystem"
WEXO,wexo,Wexo,WEXO,7500672.0,19486519.0,152851.0,"Ethereum Ecosystem, Payment Solutions, Base Ecosystem, E-commerce, Base Native"
NAVX,navi,NAVI Protocol,NAVX,7442657.0,9119032.0,407548.0,"Decentralized Finance (DeFi), Lending/Borrowing Protocols, Sui Ecosystem, OKX Ventures Portfolio, Binance Alpha Spotlight"
CHILLGUY,chill-guy,Just a chill guy,CHILLGUY,7289129.0,7289129.0,2574709.0,"Solana Ecosystem, Meme, Dog-Themed, Solana Meme, Pump.fun Ecosystem, TikTok Meme"
WALLET,ambire-wallet,Ambire Wallet,WALLET,7193260.0,7883485.0,166543.0,"Wallets, Polygon Ecosystem, Ethereum Ecosystem, Base Ecosystem, Account Abstraction, Governance, Base Native"
PAIN,pain,Pain,PAIN,6201316.0,12402786.0,191441.0,"Solana Ecosystem, Meme, Solana Meme, 4chan-Themed"
TLOS,telos,Telos,TLOS,4672473.0,4672474.0,1274934.0,"Smart Contract Platform, BNB Chain Ecosystem, Layer 1 (L1), Avalanche Ecosystem, Polygon Ecosystem, Arbitrum Ecosystem, Ethereum Ecosystem, Zero Knowledge (ZK), Base Ecosystem, Telos Ecosystem, Consensys Portfolio, Privacy Blockchain, Base Native"
TRIAS,trias-token,TriasLab,TRIAS,4497173.0,4497173.0,1593.59,"Artificial Intelligence (AI), Smart Contract Platform, BNB Chain Ecosystem, Layer 1 (L1), Ethereum Ecosystem, AI Agents"
ZRC,zircuit,Zircuit,ZRC,3482167.0,15320089.0,3577794.0,"Smart Contract Platform, BNB Chain Ecosystem, Ethereum Ecosystem, Layer 2 (L2), Zero Knowledge (ZK), Restaking, Zircuit Ecosystem"
DEOD,decentrawood,Decentrawood,DEOD,3463894.0,3463894.0,253353.0,"Gaming (GameFi), Metaverse"
BELLS,bellscoin,Bellscoin,BELLS,2993901.0,2993901.0,75120.0,"Smart Contract Platform, Layer 1 (L1), Meme, Proof of Work (PoW), Inscriptions, Made in USA"
SWEAT,sweatcoin,SWEAT,SWEAT,2965992.0,7326799.0,327456.0,"Sports, Gaming (GameFi), BNB Chain Ecosystem, Solana Ecosystem, Avalanche Ecosystem, Polygon Ecosystem, Near Protocol Ecosystem, Play To Earn, Arbitrum Ecosystem, Celo Ecosystem, Move To Earn, Ethereum Ecosystem, Optimism Ecosystem, Aptos Ecosystem, Sui Ecosystem, Base Ecosystem, Gaming Governance Token, Gaming Utility Token, OKX Ventures Portfolio"
SCA,scallop-2,Scallop,SCA,2918621.0,4783293.0,297874.0,"Decentralized Finance (DeFi), Lending/Borrowing Protocols, Sui Ecosystem"
CEEK,ceek,CEEK Smart VR,CEEK,2862039.0,2862039.0,149815.0,"Entertainment, Virtual Reality, BNB Chain Ecosystem, Metaverse, Ethereum Ecosystem, DWF Labs Portfolio"
TET,tectum,Tectum,TET,2610326.0,2627532.0,42567.0,"Smart Contract Platform, Layer 1 (L1), Ethereum Ecosystem, Bitcoin Sidechains, SideChain"
SOVRN,sovrun,Sovrun,SOVRN,2542167.0,2785480.0,12527.25,"Gaming (GameFi), Metaverse, Ethereum Ecosystem, Animoca Brands Portfolio, Base Ecosystem, DWF Labs Portfolio, On-chain Gaming, Andreessen Horowitz (a16z) Portfolio, Hyperliquid Ecosystem, Delphi Ventures Portfolio, Circle Ventures Portfolio, Base Native"
RVF,rocketx,RocketX Exchange,RVF,2517017.0,2517017.0,31192.0,"Decentralized Exchange (DEX), Exchange-based Tokens, Decentralized Finance (DeFi), Automated Market Maker (AMM), Ethereum Ecosystem, Poolz Finance Launchpad"
RARI,rarible,RARI,RARI,2476943.0,3417061.0,292911.0,"NFT, Ethereum Ecosystem, NFT Marketplace, Base Ecosystem, Coinbase Ventures Portfolio, Energi Ecosystem, Made in USA, Governance"
JOULE,joule-2,Joule,JOULE,2416022.0,2431402.0,5953.46,"Decentralized Finance (DeFi), Flare Network Ecosystem"
AXM,axiome,Axiome,AXM,2317497.0,2390292.0,165060.0,"Decentralized Finance (DeFi), Layer 1 (L1)"
DEXTF,dextf,Memento,DEXTF,2255838.0,3427948.0,1806.9,"Decentralized Finance (DeFi), Asset Manager, Avalanche Ecosystem, Ethereum Ecosystem, ZkSync Ecosystem, Real World Assets (RWA), Base Ecosystem, Privacy Blockchain"
NRN,neuron,Neuron,NRN,2111594.0,4698351.0,25962.0,"Artificial Intelligence (AI), Gaming (GameFi), NFT, Arbitrum Ecosystem, Paradigm Portfolio, AI Agents, AI Framework, Action Games, Robotics"
PEN,pendulum-chain,Pendulum,PEN,2089537.0,3697778.0,26099.0,Decentralized Exchange (DEX)
GRAIL,camelot-token,Camelot Token,GRAIL,1965581.0,7220022.0,4777.6,"Decentralized Exchange (DEX), Exchange-based Tokens, Arbitrum Ecosystem, Camelot Launchpad"
JETTON,jetton,JetTon Games,JETTON,1654235.0,2696155.0,71675.0,"Gambling (GambleFi), Telegram Apps, TON Ecosystem"
ARCA,arca,Legend of Arcadia,ARCA,1628477.0,4436998.0,146603.0,"Gaming (GameFi), Ethereum Ecosystem, RPG"
IOTX,binance-peg-iotex,Binance-Peg IoTeX,IOTX,1546397.0,1546397.0,7831.2,"Internet of Things (IOT), BNB Chain Ecosystem, Binance-Peg Tokens"
ALON,alon,Alon,ALON,1536359.0,1536359.0,154535.0,"Solana Ecosystem, Pump.fun Ecosystem, Binance Alpha Spotlight"
SIX,six,Six Sigma,SIX,1528465.0,1528465.0,90.34,"Gambling (GambleFi), Solana Ecosystem"
FNCT,financie-token,Financie Token,FNCT,1480720.0,7255072.0,30306.0,"SocialFi, Polygon Ecosystem, Ethereum Ecosystem, Governance"
VISTA,ethervista,Ethervista,VISTA,1478182.0,1478182.0,123898.0,"Decentralized Exchange (DEX), Exchange-based Tokens, Decentralized Finance (DeFi), Launchpad, Meme, Ethereum Ecosystem, Binance Alpha Spotlight"
MOEW,moew,MOEW,MOEW,1466475.0,1466475.0,252653.0,"Meme, Base Ecosystem, TON Ecosystem, Cat-Themed, Base Meme, TON Meme, Base Native"
SWAP,hyperswap,HyperSwap,SWAP,1366514.0,1898396.0,19842.9,"Decentralized Exchange (DEX), Decentralized Finance (DeFi), HyperEVM Ecosystem"
EOS,binance-peg-eos,Binance-Peg EOS,EOS,1330418.0,1330418.0,1043.01,"Smart Contract Platform, BNB Chain Ecosystem, Binance-Peg Tokens"
XX,xxcoin,XX Network,XX,1320923.0,3533994.0,31436.0,"Smart Contract Platform, Layer 1 (L1), Ethereum Ecosystem"
VADER,vaderai-by-virtuals,Vader,VADER,1266832.0,1266832.0,204940.0,"Artificial Intelligence (AI), Meme, Base Ecosystem, AI Meme, AI Agents, Virtuals Protocol Ecosystem, Binance Alpha Spotlight, Robotics, Base Native"
BAX,babb,BABB,BAX,1206864.0,1212929.0,8610.46,Ethereum Ecosystem
QORPO,qopro,QORPO WORLD,QORPO,1123166.0,1348086.0,167183.0,"Gaming (GameFi), NFT, BNB Chain Ecosystem, Play To Earn, Ethereum Ecosystem, RPG, Gaming Utility Token, Adventure Games, Gaming Platform, Action Games"
GMM,gamium,Gamium,GMM,1086011.0,1108969.0,12778.33,"SocialFi, Gaming (GameFi), BNB Chain Ecosystem, Metaverse, DaoMaker Launchpad, Ethereum Ecosystem, Gaming Governance Token, Gaming Utility Token, Governance"
KIMA,kima,Kima Network,KIMA,1040702.0,3214705.0,16788.08,"Infrastructure, Cosmos Ecosystem, Arbitrum Ecosystem, Outlier Ventures Portfolio"
TATSU,tatsu,Tatsu,TATSU,1018889.0,1018889.0,8477.15,"Artificial Intelligence (AI), Ethereum Ecosystem, Bittensor Ecosystem"
STETH,staked-ether,Lido Staked Ether,STETH,19404284817.0,19404284817.0,16306647.0,"Decentralized Finance (DeFi), Liquid Staking Tokens, Ethereum Ecosystem, Liquid Staked ETH, Liquid Staking"
JLP,jupiter-perpetuals-liquidity-provider-token,Jupiter Perpetuals Liquidity Provider Token,JLP,1092580688.0,1092580688.0,11179367.0,"Decentralized Finance (DeFi), LP Tokens, Solana Ecosystem"
APT,aptos,Aptos,APT,710924072.0,1074630685.0,65227028.0,"Smart Contract Platform, Layer 1 (L1), Aptos Ecosystem, FTX Holdings, Coinbase Ventures Portfolio, Multicoin Capital Portfolio, Proof of Stake (PoS), DragonFly Capital Portfolio, Andreessen Horowitz (a16z) Portfolio, YZi Labs (Prev. Binance Labs) Portfolio, GMCI Layer 1 Index, GMCI 30 Index, Circle Ventures Portfolio, GMCI Index, Made in USA"
FTN,fasttoken,Fasttoken,FTN,471714873.0,946704080.0,101804.0,"Smart Contract Platform, BNB Chain Ecosystem, Layer 1 (L1), Arbitrum Ecosystem, Ethereum Ecosystem, Base Ecosystem, Bahamut Ecosystem"
DCR,decred,Decred,DCR,353663793.0,353664589.0,1757630.0,"Smart Contract Platform, Privacy Coins, Layer 1 (L1), Proof of Stake (PoS), Proof of Work (PoW), Blockchain Capital Portfolio, Made in USA, Privacy"
VVV,venice-token,Venice Token,VVV,296512471.0,520352128.0,20161535.0,"Artificial Intelligence (AI), Base Ecosystem, AI Agents, AI Applications, Binance Alpha Spotlight, Made in USA, Base Native"
MON,monad,Monad,MON,269332045.0,2486773201.0,248987458.0,"Smart Contract Platform, Layer 1 (L1), Animoca Brands Portfolio, Parallelized EVM, eGirl Capital Portfolio, Paradigm Portfolio, Coinbase Ventures Portfolio, Galaxy Digital Portfolio, Monad Ecosystem"
SYRUP,syrup,Maple Finance,SYRUP,239634238.0,251346148.0,8514941.0,"Decentralized Finance (DeFi), Yield Farming, Lending/Borrowing Protocols, Ethereum Ecosystem, Real World Assets (RWA), Base Ecosystem, Binance Alpha Spotlight, Base Native"
TEL,telcoin,Telcoin,TEL,197551938.0,207780480.0,1680103.0,"Decentralized Finance (DeFi), Layer 1 (L1), Wallets, Polygon Ecosystem, Arbitrum Ecosystem, Ethereum Ecosystem, Payment Solutions, Base Ecosystem, Proof of Stake (PoS), Stablecoin Issuer, Made in USA, Neobank"
QUBIC,qubic-network,Qubic,QUBIC,149531393.0,183566751.0,2414569.0,"Artificial Intelligence (AI), Smart Contract Platform, Layer 1 (L1), Proof of Work (PoW), Quantum-Resistant"
KAITO,kaito,KAITO,KAITO,98663609.0,408733019.0,9393407.0,"Artificial Intelligence (AI), Analytics, Launchpad, Base Ecosystem, Binance HODLer Airdrops, InfoFi, Governance, Base Native"
YFI,yearn-finance,yearn.finance,YFI,88716136.0,91008235.0,5256080.0,"Decentralized Finance (DeFi), Yield Farming, Yield Aggregator, Yearn Ecosystem, Avalanche Ecosystem, Polygon Ecosystem, Near Protocol Ecosystem, Gnosis Chain Ecosystem, Fantom Ecosystem, Harmony Ecosystem, Arbitrum Ecosystem, Ethereum Ecosystem, Optimism Ecosystem, Base Ecosystem, Index Coop Defi Index, Alameda Research Portfolio, Energi Ecosystem, Sora Ecosystem, Huobi ECO Chain Ecosystem, Blockchain Capital Portfolio, Governance, Base Native"
TFUEL,theta-fuel,Theta Fuel,TFUEL,81864126.0,81864126.0,2267759.0,"Artificial Intelligence (AI), Smart Contract Platform, DePIN, Proof of Stake (PoS), Made in USA"
ZIL,zilliqa,Zilliqa,ZIL,76765073.0,78464551.0,6473585.0,"Smart Contract Platform, BNB Chain Ecosystem, GMCI Layer 1 Index, GMCI Index, Made in China"
KSM,kusama,Kusama,KSM,75263145.0,75263145.0,6324643.0,"Smart Contract Platform, Polkadot Ecosystem, Proof of Stake (PoS), Pantera Capital Portfolio, Made in USA, Coinbase 50 Index, Hydration Ecosystem"
MINA,mina-protocol,Mina Protocol,MINA,73529489.0,73529489.0,11132375.0,"Smart Contract Platform, Layer 1 (L1), Zero Knowledge (ZK), FTX Holdings, Paradigm Portfolio, Coinbase Ventures Portfolio, Multicoin Capital Portfolio, Proof of Stake (PoS), Pantera Capital Portfolio, Circle Ventures Portfolio, Privacy Blockchain, Polychain Capital Portfolio, Made in USA, Coinbase 50 Index, CoinList Launchpad"
KMNO,kamino,Kamino,KMNO,71960140.0,168367568.0,4104628.0,"Decentralized Finance (DeFi), Lending/Borrowing Protocols, Solana Ecosystem, Binance Alpha Spotlight"
