ISLM,islamic-coin,Islamic Coin,ISLM,43431042,419791180.0,181272.0,"Smart Contract Platform, Wallets, Layer 2 (L2), Osmosis Ecosystem"
NCT,polyswarm,PolySwarm,NCT,41197029,41206037.0,676077.0,"Business Services, Polygon Ecosystem, Ethereum Ecosystem, Cybersecurity, Made in USA"
INV,inverse-finance,Inverse Finance,INV,34521162,41503888.0,347901.0,"Decentralized Finance (DeFi), Yield Farming, Yield Aggregator, Lending/Borrowing Protocols, Olympus Pro Ecosystem, Ethereum Ecosystem, Fixed Interest"
PORTAL,portal-2,Portal,PORTAL,32406125,55106436.0,50704847.0,"Gaming (GameFi), Solana Ecosystem, Ethereum Ecosystem, Gaming Platform"
SYN,synapse-2,Synapse,SYN,30190466,34453536.0,5373876.0,"BNB Chain Ecosystem, Avalanche Ecosystem, Polygon Ecosystem, Fantom Ecosystem, Arbitrum Ecosystem, Olympus Pro Ecosystem, Ethereum Ecosystem, Optimism Ecosystem, Bridge Governance Tokens, Base Ecosystem, Alameda Research Portfolio, Intent"
ALU,altura,Altura,ALU,27452924,27452924.0,7922898.0,"Artificial Intelligence (AI), Infrastructure, Gaming (GameFi), NFT, BNB Chain Ecosystem, NFT Marketplace, Base Ecosystem, Gaming Platform, Made in USA, Gaming Marketplace"
SWARMS,swarms,Swarms,SWARMS,26069090,26069090.0,9551568.0,"Artificial Intelligence (AI), Solana Ecosystem, AI Agents, Pump.fun Ecosystem, Binance Alpha Spotlight, AI Framework"
D,dar-open-network,Dar Open Network,D,23364780,29064625.0,16441271.0,"Gaming (GameFi), BNB Chain Ecosystem, Binance Launchpool, Play To Earn, Ethereum Ecosystem, Animoca Brands Portfolio, AI Agents"
FLAY,flayer,Flayer,FLAY,21566327,35943878.0,836763.0,"Launchpad, Ethereum Ecosystem"
CHEQ,cheqd-network,CHEQD Network,CHEQ,21073570,27485307.0,368695.0,"Smart Contract Platform, Ethereum Ecosystem, Decentralized Identifier (DID), Zero Knowledge (ZK), Animoca Brands Portfolio, Osmosis Ecosystem, Outlier Ventures Portfolio"
ADS,adshares,Adshares,ADS,19937693,19946133.0,611805.0,"Business Services, Decentralized Finance (DeFi), BNB Chain Ecosystem, Metaverse, Polygon Ecosystem, Ethereum Ecosystem, Base Ecosystem"
OCTA,octaspace,OctaSpace,OCTA,18704605,18704757.0,655223.0,"Artificial Intelligence (AI), Internet of Things (IOT), Smart Contract Platform, BNB Chain Ecosystem, Layer 1 (L1), Ethereum Ecosystem, DePIN, AI Agents"
SWEAT,sweatcoin,SWEAT,SWEAT,17862302,48692643.0,6629724.0,"Sports, Gaming (GameFi), BNB Chain Ecosystem, Solana Ecosystem, Avalanche Ecosystem, Polygon Ecosystem, Near Protocol Ecosystem, Play To Earn, Arbitrum Ecosystem, Celo Ecosystem, Move To Earn, Ethereum Ecosystem, Optimism Ecosystem, Aptos Ecosystem, Sui Ecosystem, Base Ecosystem, Gaming Governance Token, Gaming Utility Token, OKX Ventures Portfolio"
J,jambo,Jambo,J,16600903,103106247.0,1622181.0,"Solana Ecosystem, Paradigm Portfolio, Coinbase Ventures Portfolio"
TKO,tokocrypto,Tokocrypto,TKO,14429268,96195123.0,1852397.0,"BNB Chain Ecosystem, Binance Launchpad, YZi Labs (Prev. Binance Labs) Portfolio"
PIVX,pivx,PIVX,PIVX,13899858,13899858.0,1595675.0,"Smart Contract Platform, Privacy, Masternodes, Zero Knowledge (ZK), Proof of Stake (PoS)"
KENDU,kendu-inu,Kendu,KENDU,13403197,13463839.0,77879.0,"Solana Ecosystem, Meme, Ethereum Ecosystem, Base Ecosystem, Dog-Themed"
WEXO,wexo,Wexo,WEXO,12421140,32977718.0,159272.0,"Ethereum Ecosystem, Base Ecosystem"
UPC,upcx,UPCX,UPC,12177698,2289530546.0,754437.0,Ethereum Ecosystem
ALVA,alvara-protocol,Alvara Protocol,ALVA,11076373,28658114.0,510037.0,"Decentralized Finance (DeFi), Avalanche Ecosystem, Ethereum Ecosystem"
MAVIA,heroes-of-mavia,Heroes of Mavia,MAVIA,9347618,45272007.0,17447387.0,"Gaming (GameFi), NFT, Ethereum Ecosystem, Animoca Brands Portfolio, Base Ecosystem, Gaming Governance Token, Strategy Games, Alameda Research Portfolio, YZi Labs (Prev. Binance Labs) Portfolio, Delphi Ventures Portfolio, Action Games"
BASEDAI,basedai,BasedAI,BASEDAI,8699195,8699195.0,185456.0,"Artificial Intelligence (AI), Ethereum Ecosystem, AI Agents"
MODE,mode,Mode,MODE,8541768,18206255.0,1625736.0,"Artificial Intelligence (AI), Infrastructure, Smart Contract Platform, Layer 2 (L2), Mode Ecosystem, Optimism Superchain Ecosystem, DeFAI"
MASK,catwifmask,catwifmask,MASK,8260194,8260194.0,754618.0,"Solana Ecosystem, Meme, Solana Meme, Cat-Themed, Pump.fun Ecosystem"
KASTA,kasta,Kasta,KASTA,8185882,16074669.0,193655.0,Polygon Ecosystem
GLQ,graphlinq-protocol,GraphLinq Chain,GLQ,6565262,9654797.0,154483.0,"Artificial Intelligence (AI), Business Services, Infrastructure, Smart Contract Platform, Analytics, Layer 1 (L1), Ethereum Ecosystem, DWF Labs Portfolio, AI Agents, DeFAI"
STAT,stat,STAT,STAT,6432676,8212037.0,914176.0,"Media, Ethereum Ecosystem"
QBX,qbx,QBX,QBX,6386631,6386631.0,74536.0,Ethereum Ecosystem
FNCT,financie-token,Financie Token,FNCT,6096181,32231434.0,88128.0,"Polygon Ecosystem, Ethereum Ecosystem"
CDX,cod3x,Cod3x,CDX,5999742,5999742.0,36726.0,"Artificial Intelligence (AI), Solana Ecosystem, Base Ecosystem, AI Agent Launchpad, AI Framework, DeFAI"
QORPO,qopro,QORPO WORLD,QORPO,5716031,9653966.0,565923.0,"Gaming (GameFi), NFT, BNB Chain Ecosystem, Play To Earn, Ethereum Ecosystem, RPG, Gaming Utility Token, Adventure Games, Gaming Platform, Action Games"
FLIX,omniflix-network,OmniFlix Network,FLIX,5616984,6196371.0,7184.33,"NFT, Osmosis Ecosystem, Archway Ecosystem"
TICO,tico,Funtico,TICO,5485925,25643851.0,74788.0,"Gaming (GameFi), Avalanche Ecosystem, RPG"
GTAI,gt-protocol,GT Protocol,GTAI,5185954,9585399.0,2312746.0,"Artificial Intelligence (AI), BNB Chain Ecosystem, DeFAI"
SHIDO,shido-2,Shido Network,SHIDO,5130937,5130945.0,188923.0,"Ethereum Ecosystem, Osmosis Ecosystem, Shido Network Ecosystem"
MLG,360noscope420blazeit,360noscope420blazeit,MLG,5010022,5010022.0,573496.0,"Solana Ecosystem, Meme, Solana Meme"
TRADE,polytrade,Polytrade,TRADE,4884805,11270445.0,159496.0,"BNB Chain Ecosystem, Polygon Ecosystem, Arbitrum Ecosystem, Ethereum Ecosystem, Real World Assets (RWA), Base Ecosystem, DWF Labs Portfolio"
IZI,izumi-finance,iZUMi Finance,IZI,4836100,12283718.0,1322611.0,"Decentralized Exchange (DEX), Decentralized Finance (DeFi), Automated Market Maker (AMM), BNB Chain Ecosystem, Polygon Ecosystem, Arbitrum Ecosystem, Ethereum Ecosystem, ZkSync Ecosystem, Mantle Ecosystem, Linea Ecosystem, Base Ecosystem, Manta Network Ecosystem, Scroll Ecosystem"
GENOME,genomesdao-genome,GenomesDAO GENOME,GENOME,4777511,4777511.0,72221.0,"Ethereum Ecosystem, Base Ecosystem, Decentralized Science (DeSci)"
ALON,alon,Alon,ALON,4771035,4771035.0,279039.0,"Solana Ecosystem, Pump.fun Ecosystem, Binance Alpha Spotlight"
ZYN,zyncoin-2,ZynCoin,ZYN,4749773,4749773.0,99476.0,"Solana Ecosystem, Meme, Ethereum Ecosystem, Parody Meme"
POR,portugal-national-team-fan-token,Portugal National Team Fan Token,POR,4733879,16908113.0,224059.0,"Sports, Fan Token, Chiliz Ecosystem"
DEOD,decentrawood,Decentrawood,DEOD,4395309,4395309.0,221867.0,"Gaming (GameFi), BNB Chain Ecosystem, Metaverse, Solana Ecosystem, Polygon Ecosystem"
ALEX,alexgo,ALEX Lab,ALEX,4262742,4917047.0,42225.0,"Decentralized Finance (DeFi), Lending/Borrowing Protocols, Ethereum Ecosystem, DWF Labs Portfolio, Mode Ecosystem, Stacks Ecosystem, BTCfi Protocol"
SRM,serum,Serum,SRM,4194442,12296385.0,110843.0,"Decentralized Exchange (DEX), Exchange-based Tokens, Decentralized Finance (DeFi), Solana Ecosystem, Ethereum Ecosystem, FTX Holdings, Multicoin Capital Portfolio, Energi Ecosystem, Viction Ecosystem"
4EVER,4everland,4EVERLAND,4EVER,4058835,22367864.0,320850.0,"Artificial Intelligence (AI), BNB Chain Ecosystem, Ethereum Ecosystem, DePIN, AI Framework"
WINR,winr-protocol,WINR Protocol,WINR,3937211,5855458.0,167658.0,"Gambling (GambleFi), Infrastructure, Smart Contract Platform, Solana Ecosystem, Arbitrum Ecosystem, Camelot Launchpad, Layer 3 (L3)"
POLYDOGE,polydoge,PolyDoge,POLYDOGE,3890823,3896314.0,249912.0,"NFT, Polygon Ecosystem, Meme, Dog-Themed"
SMURFCAT,real-smurf-cat,Real Smurf Cat,SMURFCAT,3550573,3550573.0,414517.0,"Solana Ecosystem, Meme, Arbitrum Ecosystem, Ethereum Ecosystem, Cat-Themed"
ARCA,arca,Legend of Arcadia,ARCA,3350836,12916804.0,199315.0,"Gaming (GameFi), Ethereum Ecosystem, RPG"
OFN,openfabric,Openfabric AI,OFN,3315253,3315253.0,49151.0,"Artificial Intelligence (AI), BNB Chain Ecosystem, ChainGPT Launchpad, Poolz Finance Launchpad, AI Agents, AI Applications, AI Framework, Governance"
TREAT,shiba-inu-treat,Shiba Inu Treat,TREAT,3091363,14367567.0,776468.0,"Meme, Ethereum Ecosystem, Dog-Themed"
SOLAMA,solama,Solama,SOLAMA,2673393,2673393.0,175727.0,"Gambling (GambleFi), Solana Ecosystem, Meme, Solana Meme"
SLN,smart-layer-network,Smart Layer Network,SLN,2399228,3109898.0,50622.0,"Infrastructure, BNB Chain Ecosystem, Polygon Ecosystem, Ethereum Ecosystem, Optimism Ecosystem, ZkSync Ecosystem, Linea Ecosystem, Base Ecosystem, Scroll Ecosystem, Polygon zkEVM Ecosystem, Mint Ecosystem"
HXD,honeyland-honey,Honeyland,HXD,2298389,5239076.0,64878.0,"Gaming (GameFi), NFT, Solana Ecosystem, Play To Earn, Breeding, Gaming Utility Token, Strategy Games"
RMV,reality-metaverse,Reality Metaverse,RMV,1908910,2557105.0,29532.0,"Gaming (GameFi), NFT, Metaverse, Polygon Ecosystem, Play To Earn, Ethereum Ecosystem, DWF Labs Portfolio, Gaming Utility Token"
MIN,metainside-by-virtuals,MetaInside by Virtuals,MIN,1904367,1904367.0,117561.0,"Base Ecosystem, AI Applications, Virtuals Protocol Ecosystem"
YULI,yuli,YULI,YULI,1828899,1828899.0,38145.0,"Gaming (GameFi), NFT, Meme, Kaia Ecosystem, Card Games, Gaming Utility Token, Anime-Themed"
MUMU,mumu,Mumu,MUMU,1609396,1609396.0,73085.0,"Meme, Ethereum Ecosystem, 4chan-Themed"
VGX,ethos,VGX Token,VGX,1579358,1583753.0,404631.0,"Gaming (GameFi), Ethereum Ecosystem, Galaxy Digital Portfolio"
BAX,babb,BABB,BAX,1560778,1568621.0,13208.63,Ethereum Ecosystem
STETH,staked-ether,Lido Staked Ether,STETH,40463328020,40463328020.0,46427037.0,"Decentralized Finance (DeFi), Liquid Staking Tokens, Ethereum Ecosystem, Liquid Staked ETH, Liquid Staking"
VET,vechain,VeChain,VET,2175015356,2175015356.0,42724253.0,"Internet of Things (IOT), Smart Contract Platform, Layer 1 (L1), VeChain Ecosystem, Made in China"
SAROS,saros-finance,Saros,SAROS,940907180,3584408544.0,6826380.0,"Decentralized Exchange (DEX), Decentralized Finance (DeFi), Solana Ecosystem, Viction Ecosystem, Binance Alpha Spotlight"
GALA,gala,GALA,GALA,827335260,827335260.0,109848324.0,"Smart Contract Platform, Gaming (GameFi), NFT, Layer 1 (L1), Play To Earn, Ethereum Ecosystem, DWF Labs Portfolio, Gaming Platform, YZi Labs (Prev. Binance Labs) Portfolio, GalaChain Ecosystem, Made in USA"
TWT,trust-wallet-token,Trust Wallet,TWT,338480867,812386772.0,14122371.0,"BNB Chain Ecosystem, Wallets, Account Abstraction, Energi Ecosystem"
KAITO,kaito,KAITO,KAITO,296496023,1228291924.0,62566704.0,"Artificial Intelligence (AI), Analytics, Base Ecosystem, Binance HODLer Airdrops, InfoFi, Governance"
QUBIC,qubic-network,Qubic,QUBIC,288919469,363391586.0,6527174.0,"Artificial Intelligence (AI), Smart Contract Platform, Layer 1 (L1), Proof of Work (PoW)"
TRIBE,tribe-2,Tribe,TRIBE,281118680,617822165.0,89211.0,"Decentralized Finance (DeFi), Ethereum Ecosystem, Stablecoin Issuer"
MOCA,mocaverse,Moca Network,MOCA,263148742,645956574.0,10592140.0,"Gaming (GameFi), Ethereum Ecosystem, Decentralized Identifier (DID), Animoca Brands Portfolio, Base Ecosystem, OKX Ventures Portfolio, Outlier Ventures Portfolio"
TFUEL,theta-fuel,Theta Fuel,TFUEL,250778188,250778188.0,1826197.0,"Artificial Intelligence (AI), Smart Contract Platform, DePIN, Proof of Stake (PoS), Made in USA"
MPLX,metaplex,Metaplex,MPLX,234063639,281064654.0,13219933.0,"Gaming (GameFi), NFT, BNB Chain Ecosystem, Solana Ecosystem, Launchpad, Animoca Brands Portfolio, FTX Holdings, Multicoin Capital Portfolio, Alameda Research Portfolio, Binance Alpha Spotlight"
ZRO,layerzero,LayerZero,ZRO,225427372,2028084418.0,30388997.0,"Smart Contract Platform, BNB Chain Ecosystem, Avalanche Ecosystem, Polygon Ecosystem, Arbitrum Ecosystem, Ethereum Ecosystem, Optimism Ecosystem, Base Ecosystem, Multicoin Capital Portfolio, Layer 0 (L0), Cross-chain Communication, Circle Ventures Portfolio, Sequoia Capital Portfolio, OKX Ventures Portfolio"
BLUR,blur,Blur,BLUR,215600337,257685094.0,15198483.0,"NFT, Ethereum Ecosystem, NFT Marketplace, FTX Holdings, NFTFi, eGirl Capital Portfolio, Paradigm Portfolio, GMCI DeFi Index, GMCI Index, Made in USA, Coinbase 50 Index"
HOT,holotoken,Holo,HOT,177351973,177351973.0,7480100.0,"Smart Contract Platform, Storage, Harmony Ecosystem, Arbitrum Ecosystem, Ethereum Ecosystem, DePIN, Base Ecosystem, Energi Ecosystem, Sora Ecosystem, GMCI DePIN Index, GMCI Index"
ANKR,ankr,Ankr Network,ANKR,157858707,157858707.0,11368320.0,"BNB Chain Ecosystem, Avalanche Ecosystem, Polygon Ecosystem, Fantom Ecosystem, Arbitrum Ecosystem, Ethereum Ecosystem, Optimism Ecosystem, Liquid Staking Governance Tokens, Linea Ecosystem, DePIN, Scroll Ecosystem, Rollups-as-a-Service (RaaS), Blast Ecosystem, Mode Ecosystem, Pantera Capital Portfolio, Polygon zkEVM Ecosystem, YZi Labs (Prev. Binance Labs) Portfolio, Liquid Staking, Made in USA, Governance"
CSPR,casper-network,Casper Network,CSPR,134134703,138873263.0,3439650.0,"Smart Contract Platform, Layer 1 (L1), Real World Assets (RWA), Proof of Stake (PoS), GMCI Layer 1 Index, GMCI Index, Made in USA"
HSK,hashkey-ecopoints,HashKey Platform Token,HSK,134086357,430854899.0,2406394.0,"Exchange-based Tokens, Centralized Exchange (CEX) Token, Ethereum Ecosystem, Governance"
WILD,wilder-world,Wilder World,WILD,121909752,154656478.0,13282259.0,"Gaming (GameFi), NFT, BNB Chain Ecosystem, Metaverse, Solana Ecosystem, Avalanche Ecosystem, Polygon Ecosystem, Play To Earn, Ethereum Ecosystem, Animoca Brands Portfolio, Base Ecosystem, Gaming Governance Token, Racing Games, Simulation Games, Action Games"
BLAST,blast,Blast,BLAST,121875083,266588289.0,11442146.0,"Smart Contract Platform, Layer 2 (L2), eGirl Capital Portfolio, Paradigm Portfolio, Blast Ecosystem"
GOHOME,gohome,GOHOME,GOHOME,112692699,2148002977.0,4426608.0,"Solana Ecosystem, Meme"
XVS,venus,Venus,XVS,110242967,195880040.0,7039637.0,"Decentralized Finance (DeFi), Yield Farming, BNB Chain Ecosystem, Binance Launchpool, Lending/Borrowing Protocols, Arbitrum Ecosystem, Ethereum Ecosystem, Optimism Ecosystem, ZkSync Ecosystem, opBNB Ecosystem, Unichain Ecosystem"
PHA,pha,PHALA,PHA,91278794,112649788.0,12097903.0,"Artificial Intelligence (AI), Infrastructure, Smart Contract Platform, Oracle, Polkadot Ecosystem, Ethereum Ecosystem, Interoperability, Layer 2 (L2), Zero Knowledge (ZK), DePIN, DWF Labs Portfolio, Rollup, AI Agents, Sora Ecosystem, AI Framework, Made in USA"
CETUS,cetus-protocol,Cetus Protocol,CETUS,82548810,97531984.0,15119798.0,"Decentralized Exchange (DEX), Decentralized Finance (DeFi), Sui Ecosystem, Animoca Brands Portfolio, OKX Ventures Portfolio, Dex Aggregator"
OMI,ecomi,ECOMI,OMI,81063424,93009954.0,842392.0,"Gaming (GameFi), NFT, Metaverse, Collectibles, Play To Earn, Ethereum Ecosystem, Base Ecosystem, Energi Ecosystem"
EDU,edu-coin,Open Campus,EDU,80672824,138447710.0,5895862.0,"Education, BNB Chain Ecosystem, Polygon Ecosystem, Ethereum Ecosystem, Binance Launchpad, YZi Labs (Prev. Binance Labs) Portfolio"
GLMR,moonbeam,Moonbeam,GLMR,71036172,83793363.0,4380190.0,"Smart Contract Platform, Polkadot Ecosystem, Layer 1 (L1), Coinbase Ventures Portfolio, Proof of Stake (PoS), YZi Labs (Prev. Binance Labs) Portfolio"
USDP,paxos-standard,Pax Dollar,USDP,67959025,67959025.0,3368340.0,"Stablecoins, USD Stablecoin, Solana Ecosystem, Ethereum Ecosystem, Multicoin Capital Portfolio, Fiat-backed Stablecoin"
RIF,rif-token,Rootstock Infrastructure Framework,RIF,60680425,60680425.0,1909697.0,"Solana Ecosystem, Arbitrum Ecosystem, Ethereum Ecosystem, Base Ecosystem, Rootstock Ecosystem, Outlier Ventures Portfolio"
JELLYJELLY,jelly-my-jelly,Jelly-My-Jelly,JELLYJELLY,59573184,59573184.0,26252343.0,"Solana Ecosystem, Pump.fun Ecosystem"
CTK,certik,Shentu,CTK,53061223,53356764.0,1963144.0,"Business Services, Binance Launchpool, Osmosis Ecosystem, Coinbase Ventures Portfolio, Cybersecurity, YZi Labs (Prev. Binance Labs) Portfolio, OKX Ventures Portfolio"
C98,coin98,Coin98,C98,51878510,51878525.0,13327680.0,"Decentralized Finance (DeFi), BNB Chain Ecosystem, Solana Ecosystem, Wallets, Polygon Ecosystem, Ethereum Ecosystem, Binance Launchpad, DWF Labs Portfolio, Multicoin Capital Portfolio, Alameda Research Portfolio, Viction Ecosystem, YZi Labs (Prev. Binance Labs) Portfolio"
DODO,dodo,DODO,DODO,50369069,50369069.0,5101203.0,"Decentralized Exchange (DEX), Exchange-based Tokens, Decentralized Finance (DeFi), BNB Chain Ecosystem, Binance Launchpool, Polygon Ecosystem, Near Protocol Ecosystem, Arbitrum Ecosystem, Ethereum Ecosystem, DWF Labs Portfolio, Coinbase Ventures Portfolio, Alameda Research Portfolio, DeFiance Capital Portfolio, Pantera Capital Portfolio, Aurora Ecosystem, Energi Ecosystem, YZi Labs (Prev. Binance Labs) Portfolio, Galaxy Digital Portfolio"
STORJ,storj,Storj,STORJ,38968909,115182426.0,11356488.0,"Storage, Harmony Ecosystem, Ethereum Ecosystem, DePIN, Energi Ecosystem"
M87,messier,MESSIER,M87,37565573,37565573.0,1121073.0,"Decentralized Finance (DeFi), Ethereum Ecosystem"
PHB,phoenix-global,Phoenix,PHB,35141253,35141253.0,5097351.0,"Artificial Intelligence (AI), Oracle, NFT, BNB Chain Ecosystem, DePIN, Made in China"
ELX,elixir-finance,Elixir,ELX,34830322,134339850.0,11936539.0,"Decentralized Finance (DeFi), Ethereum Ecosystem, Real World Assets (RWA), Stablecoin Issuer, RWA Protocol"
NEON,neon,Neon,NEON,34731691,145038398.0,1813681.0,"Smart Contract Platform, Solana Ecosystem, Neon Ecosystem, Parallelized EVM"
FORTH,ampleforth-governance-token,Ampleforth Governance,FORTH,32210364,42834689.0,3969219.0,"Ethereum Ecosystem, Stablecoin Issuer, Governance"
PNG,pangolin,Pangolin,PNG,31652232,75895170.0,539238.0,"Decentralized Exchange (DEX), Decentralized Finance (DeFi), Avalanche Ecosystem, Olympus Pro Ecosystem"
MNSRY,mansory-token,Mansory Token,MNSRY,31444203,31444203.0,1615140.0,"Retail, BNB Chain Ecosystem, Solana Ecosystem, Real World Assets (RWA), Pump.fun Ecosystem"
ACT,acet-token,Acet,ACT,30938026,40362982.0,165710.0,BNB Chain Ecosystem
KUJI,kujira,Kujira,KUJI,30629900,30637971.0,4694.75,"Smart Contract Platform, Decentralized Finance (DeFi), BNB Chain Ecosystem, Layer 1 (L1), Arbitrum Ecosystem, Ethereum Ecosystem, Optimism Ecosystem, Osmosis Ecosystem, Secret Ecosystem"
MMUI,metamui,MetaMUI,MMUI,29859116,50196645.0,367211.0,Avalanche Ecosystem
SFUND,seedify-fund,Seedify.fund,SFUND,28162406,44306400.0,5122194.0,"Gaming (GameFi), BNB Chain Ecosystem, Launchpad, Arbitrum Ecosystem, Ethereum Ecosystem, DWF Labs Portfolio"
DYDX,dydx,dYdX,ETHDYDX,27890248,580252901.0,19380038.0,"Decentralized Exchange (DEX), Exchange-based Tokens, Decentralized Finance (DeFi), Derivatives, Perpetuals, Ethereum Ecosystem, Paradigm Portfolio"
AVA,ava-ai,Ava AI,AVA,25671798,25671798.0,11267283.0,"Artificial Intelligence (AI), Solana Ecosystem, Meme, AI Meme, AI Agents, Pump.fun Ecosystem, Binance Alpha Spotlight, Made in USA"
UFD,unicorn-fart-dust,Unicorn Fart Dust,UFD,25528814,25528814.0,4648790.0,"Solana Ecosystem, Meme, Solana Meme, Pump.fun Ecosystem, Binance Alpha Spotlight, Made in USA"
GHST,aavegotchi,Aavegotchi,GHST,24518685,25281012.0,2580140.0,"Smart Contract Platform, Gaming (GameFi), NFT, Metaverse, Collectibles, Polygon Ecosystem, Meme, Play To Earn, Ethereum Ecosystem, Gotchiverse, Base Ecosystem, Layer 3 (L3), RPG, Gaming Governance Token, Gaming Utility Token, Energi Ecosystem, Governance"
RACA,radio-caca,Radio Caca,RACA,23060640,23284709.0,2119868.0,"Gaming (GameFi), NFT, BNB Chain Ecosystem, Metaverse, Play To Earn, Ethereum Ecosystem, DWF Labs Portfolio, OKT Chain Ecosystem"
ZEREBRO,zerebro,Zerebro,ZEREBRO,23024296,23024296.0,13256890.0,"Solana Ecosystem, Meme, Solana Meme, AI Meme, Pump.fun Ecosystem, Binance Alpha Spotlight"
PIKA,pikaboss,Pikaboss,PIKA,22814582,22814582.0,5372.72,"Meme, Ethereum Ecosystem"
LOFI,lofi-2,LOFI,LOFI,21740074,21740074.0,713158.0,"Meme, Sui Ecosystem, Sui Meme"
LAT,platon-network,PlatON Network,LAT,21457544,32867616.0,4100544.0,"Smart Contract Platform, Appchains"
BEL,bella-protocol,Bella Protocol,BEL,21038689,26298361.0,5174529.0,"Decentralized Finance (DeFi), Yield Farming, BNB Chain Ecosystem, Binance Launchpool, Yield Aggregator, Ethereum Ecosystem, Manta Network Ecosystem, YZi Labs (Prev. Binance Labs) Portfolio"
CWEB,coinweb,Coinweb,CWEB,20783294,25250805.0,149808.0,"Smart Contract Platform, Wallets, Ethereum Ecosystem, Interoperability, Layer 2 (L2), Cross-chain Communication, Bitcoin Sidechains, SideChain"
PERP,perpetual-protocol,Perpetual Protocol,PERP,20317016,41971604.0,7685497.0,"Decentralized Exchange (DEX), Exchange-based Tokens, Decentralized Finance (DeFi), Automated Market Maker (AMM), BNB Chain Ecosystem, Derivatives, Perpetuals, Gnosis Chain Ecosystem, Arbitrum Ecosystem, Ethereum Ecosystem, Optimism Ecosystem, Multicoin Capital Portfolio, Alameda Research Portfolio, YZi Labs (Prev. Binance Labs) Portfolio"
QUICK,quick,Quickswap [OLD],QUICK,19372530,26258894.0,26031.0,"Decentralized Exchange (DEX), Exchange-based Tokens, Decentralized Finance (DeFi), Yield Farming, Automated Market Maker (AMM), Polygon Ecosystem, Ethereum Ecosystem"
BR,bedrock-token,Bedrock,BR,17692810,80421866.0,9102165.0,"Decentralized Finance (DeFi), BNB Chain Ecosystem, Ethereum Ecosystem, Liquid Staking Governance Tokens, Base Ecosystem, Berachain Ecosystem, BTCfi Protocol, Binance Wallet IDO"
OPUL,opulous,Opulous,OPUL,17485439,17485439.0,544276.0,"Artificial Intelligence (AI), Music, NFT, BNB Chain Ecosystem, Arbitrum Ecosystem, Ethereum Ecosystem, Algorand Ecosystem, Real World Assets (RWA), Telegram Apps, AI Applications"
FIS,stafi,Stafi,FIS,17081136,17081136.0,8414390.0,"Decentralized Finance (DeFi), Ethereum Ecosystem, Liquid Staking Governance Tokens, Osmosis Ecosystem, Sora Ecosystem, Liquid Staking"
GHX,gamercoin,GamerCoin,GHX,16421683,18879244.0,492000.0,"Artificial Intelligence (AI), Infrastructure, BNB Chain Ecosystem, Solana Ecosystem, Ethereum Ecosystem, DePIN, AI Applications"
SLF,self-chain,Self Chain,SLF,15318301,30820054.0,297977461.0,"Infrastructure, Smart Contract Platform, Layer 1 (L1), Account Abstraction, Intent"
VARA,vara-network,Vara Network,VARA,15267439,35625324.0,293181.0,"Smart Contract Platform, Layer 1 (L1)"
KOMA,koma-inu,Koma Inu,KOMA,14882256,14882256.0,2167480.0,"BNB Chain Ecosystem, Meme, Dog-Themed, Binance Alpha Spotlight, Made in USA"
PSTAKE,pstake-finance,pSTAKE Finance,PSTAKE,14027215,14027215.0,2406563.0,"Smart Contract Platform, BNB Chain Ecosystem, Ethereum Ecosystem, Optimism Ecosystem, Liquid Staking Governance Tokens, Sui Ecosystem, Base Ecosystem, Coinbase Ventures Portfolio, Proof of Stake (PoS), Blast Ecosystem, Alameda Research Portfolio, DeFiance Capital Portfolio, YZi Labs (Prev. Binance Labs) Portfolio, Galaxy Digital Portfolio, Sequoia Capital Portfolio, Liquid Staking, BTCfi Protocol, Binance Alpha Spotlight"
BENJI,basenji,Basenji,BENJI,13738939,13738939.0,334441.0,"Meme, Base Ecosystem, Dog-Themed, Base Meme"
CATE,catecoin,CateCoin,CATE,11315909,11765241.0,2855445.0,"Entertainment, Gaming (GameFi), Yield Farming, NFT, BNB Chain Ecosystem, Yield Aggregator, Launchpad, Wallets, Meme, Play To Earn, Ethereum Ecosystem, Base Ecosystem, Cat-Themed"
STUFF,book-2,STUFF.io,STUFF,11268589,32391417.0,20556.0,Cardano Ecosystem
3ULL,playa3ull-games-2,PLAYA3ULL GAMES,3ULL,11177340,11194239.0,686158.0,"Smart Contract Platform, Gaming (GameFi), NFT, Avalanche Ecosystem, Play To Earn, Shooting Games, Avalanche L1, MMO"
U,u,U,U,11148259,11148259.0,673204.0,"BNB Chain Ecosystem, Meme"
ULTI,ultiverse,Ultiverse,ULTI,10826277,16616043.0,12572079.0,"Gaming (GameFi), BNB Chain Ecosystem, Ethereum Ecosystem, Animoca Brands Portfolio, Binance Alpha Spotlight"
CLY,colony,Colony,CLY,10730989,14281903.0,121474.0,Avalanche Ecosystem
CAM,camino-network,Camino Network,CAM,10070775,26742310.0,62408.0,"Smart Contract Platform, Layer 1 (L1), Outlier Ventures Portfolio"
T,talos-2,Talos,T,9651156,10105923.0,120533.0,"Artificial Intelligence (AI), Arbitrum Ecosystem, AI Agents, DeFAI"
EVR,evernode,Evernode,EVR,9629951,19236842.0,6662.93,"Smart Contract Platform, Layer 2 (L2), DePIN"
XSWAP,xswap-2,XSwap,XSWAP,9568681,12076391.0,100472.0,"Decentralized Finance (DeFi), Ethereum Ecosystem, Base Ecosystem, Cross-chain Communication"
REDO,resistance-dog,Resistance Dog,REDO,9120700,9120700.0,152099.0,"Meme, Dog-Themed, TON Ecosystem, TON Meme"
MSM,musmecoin,MusmeCoin,MSM,8967117,17244406.0,70.13,"Meme, Ethereum Ecosystem, Anime-Themed, Oasys Ecosystem"
CSWAP,chainswap-3,ChainSwap,CSWAP,8702957,9131489.0,120851.0,"Decentralized Exchange (DEX), Decentralized Finance (DeFi), Ethereum Ecosystem, Cross-chain Communication"
SNAI,swarmnode-ai,SwarmNode.ai,SNAI,8668726,8668726.0,1396190.0,"Artificial Intelligence (AI), Infrastructure, Solana Ecosystem, Pump.fun Ecosystem, AI Agent Launchpad, Binance Alpha Spotlight, AI Framework, DeFAI"
RNT,reental,Reental,RNT,8427695,36759291.0,5633.13,"Tokenized Real Estate, Tokenized Assets, Polygon Ecosystem, Real World Assets (RWA), RWA Protocol"
ROOT,the-root-network,The Root Network,ROOT,7907487,31165961.0,872433.0,"Smart Contract Platform, Gaming (GameFi), Layer 1 (L1), Ethereum Ecosystem, Gaming Blockchains, Outlier Ventures Portfolio"
NIBI,nibiru,Nibiru,NIBI,7823687,9764193.0,471467.0,"Infrastructure, Smart Contract Platform, Layer 1 (L1), Osmosis Ecosystem, Made in USA"
AZERO,aleph-zero,Aleph Zero,AZERO,7444578,12805165.0,205868.0,"Smart Contract Platform, Layer 1 (L1), Layer 2 (L2), Zero Knowledge (ZK), Rollup, Proof of Stake (PoS), Privacy Blockchain"
DINERO,dinero-2,Dinero,DINERO,7327109,11333175.0,37520.0,"Infrastructure, Decentralized Finance (DeFi), Lending/Borrowing Protocols, Ethereum Ecosystem, Metagovernance, Liquid Staking Governance Tokens, LSDFi, Curve Ecosystem, Liquid Staking"
