VTHO,vethor-token,VeThor,VTHO,176568973.0,176843825.0,3881319.0,"Layer 1 (L1), VeChain Ecosystem"
ELF,aelf,aelf,ELF,165652589.0,215720305.0,5504792.0,"Infrastructure, Smart Contract Platform, BNB Chain Ecosystem, Layer 1 (L1), Ethereum Ecosystem, GMCI Layer 1 Index, Aelf Ecosystem, GMCI Index"
CELO,celo,Celo,CELO,165539847.0,288729370.0,26312987.0,"Smart Contract Platform, Celo Ecosystem, Layer 2 (L2), DWF Labs Portfolio, Coinbase Ventures Portfolio, Proof of Stake (PoS), Andreessen Horowitz (a16z) Portfolio, Optimism Superchain Ecosystem, Outlier Ventures Portfolio, Made in USA"
ZIG,zignaly,ZIGChain,ZIG,143857484.0,199503775.0,6248197.0,"Artificial Intelligence (AI), Smart Contract Platform, BNB Chain Ecosystem, Solana Ecosystem, Layer 1 (L1), Polygon Ecosystem, Ethereum Ecosystem, DWF Labs Portfolio, Injective Ecosystem, OKX Ventures Portfolio"
DRIFT,drift-protocol,Drift Protocol,DRIFT,140168429.0,454838879.0,22776474.0,"Decentralized Finance (DeFi), Derivatives, Prediction Markets, Solana Ecosystem"
WOO,woo-network,WOO,WOO,138967554.0,160779797.0,12825305.0,"Decentralized Exchange (DEX), Exchange-based Tokens, Decentralized Finance (DeFi), Automated Market Maker (AMM), BNB Chain Ecosystem, Derivatives, Perpetuals, Centralized Exchange (CEX) Token, Solana Ecosystem, Avalanche Ecosystem, Polygon Ecosystem, Near Protocol Ecosystem, Fantom Ecosystem, Arbitrum Ecosystem, Ethereum Ecosystem, ZkSync Ecosystem, Mantle Ecosystem, Linea Ecosystem, Base Ecosystem, DragonFly Capital Portfolio, YZi Labs (Prev. Binance Labs) Portfolio"
OZO,ozone-chain,Ozone Chain,OZO,101653513.0,124480045.0,233691.0,"Smart Contract Platform, Layer 1 (L1), Zero Knowledge (ZK)"
NPC,non-playable-coin,Non-Playable Coin,NPC,101584900.0,101584900.0,3803535.0,"NFT, BNB Chain Ecosystem, Solana Ecosystem, Meme, Ethereum Ecosystem, Base Ecosystem, Hybrid Token Standards, Wojak-Themed, 4chan-Themed"
BICO,biconomy,Biconomy,BICO,88643197.0,92522946.0,10850254.0,"Arbitrum Ecosystem, Ethereum Ecosystem, Account Abstraction, Coinbase Ventures Portfolio, YZi Labs (Prev. Binance Labs) Portfolio, Consensys Portfolio, Outlier Ventures Portfolio"
MANTA,manta-network,Manta Network,MANTA,87459465.0,210065666.0,23108789.0,"Smart Contract Platform, Polkadot Ecosystem, Binance Launchpool, Layer 2 (L2), Manta Network Ecosystem, Multicoin Capital Portfolio, Alameda Research Portfolio, DeFiance Capital Portfolio, YZi Labs (Prev. Binance Labs) Portfolio"
AO,ao-computer,ao Computer,AO,76623154.0,76623154.0,22382583.0,"Artificial Intelligence (AI), Smart Contract Platform, DePIN"
RLC,iexec-rlc,iExec RLC,RLC,69267264.0,83255387.0,6799321.0,"Artificial Intelligence (AI), Oracle, Ethereum Ecosystem, DePIN, AI Agents, Energi Ecosystem, Sora Ecosystem, GMCI DePIN Index, GMCI Index"
TAIKO,taiko,Taiko,TAIKO,67565643.0,494530089.0,35484727.0,"Smart Contract Platform, Ethereum Ecosystem, Layer 2 (L2), Zero Knowledge (ZK), Rollup, OKX Ventures Portfolio"
BAL,balancer,Balancer,BAL,64739134.0,69761947.0,7128269.0,"Decentralized Exchange (DEX), Exchange-based Tokens, Decentralized Finance (DeFi), Yield Farming, Automated Market Maker (AMM), Avalanche Ecosystem, Polygon Ecosystem, Near Protocol Ecosystem, Gnosis Chain Ecosystem, Harmony Ecosystem, Arbitrum Ecosystem, Ethereum Ecosystem, Optimism Ecosystem, Base Ecosystem, Index Coop Defi Index, Alameda Research Portfolio, DeFiance Capital Portfolio, Pantera Capital Portfolio, Energi Ecosystem, Polygon zkEVM Ecosystem, Huobi ECO Chain Ecosystem, Blockchain Capital Portfolio"
OSAK,osaka-protocol,Osaka Protocol,OSAK,60504392.0,60504392.0,68320.0,"BNB Chain Ecosystem, Solana Ecosystem, Avalanche Ecosystem, Polygon Ecosystem, Meme, Arbitrum Ecosystem, Ethereum Ecosystem, Optimism Ecosystem, Base Ecosystem, Dog-Themed"
JOE,joe,JOE,JOE,59212261.0,74317786.0,6905319.0,"Decentralized Exchange (DEX), Decentralized Finance (DeFi), Yield Farming, Automated Market Maker (AMM), BNB Chain Ecosystem, Avalanche Ecosystem, Arbitrum Ecosystem, Mantle Ecosystem, DeFiance Capital Portfolio, Delphi Ventures Portfolio, Dex Aggregator"
VANRY,vanar-chain,Vanar Chain,VANRY,57717996.0,59362298.0,9673586.0,"Smart Contract Platform, Gaming (GameFi), NFT, Layer 1 (L1), Polygon Ecosystem, Ethereum Ecosystem, Vanar Chain Ecosystem"
ACS,access-protocol,Access Protocol,ACS,55597595.0,119582544.0,1669729.0,"SocialFi, Solana Ecosystem"
NOS,nosana,Nosana,NOS,53716355.0,64408100.0,868125.0,"Artificial Intelligence (AI), Solana Ecosystem, DePIN"
QI,benqi,BENQI,QI,50284617.0,52639734.0,2577642.0,"Decentralized Finance (DeFi), Yield Farming, Binance Launchpool, Lending/Borrowing Protocols, Avalanche Ecosystem, Liquid Staking Governance Tokens, DragonFly Capital Portfolio, Liquid Staking"
SUNDOG,sundog,Sundog,SUNDOG,50136980.0,50136980.0,13714849.0,"Meme, Tron Ecosystem, Sun Pump Ecosystem, TRON Meme"
CHILLGUY,chill-guy,Just a chill guy,CHILLGUY,49103299.0,49103299.0,20133347.0,"Solana Ecosystem, Meme, Dog-Themed, Solana Meme, Pump.fun Ecosystem, TikTok Meme"
ANVL,anvil,Anvil,ANVL,48477531.0,175672314.0,202579.0,"Decentralized Finance (DeFi), Ethereum Ecosystem"
QKC,quark-chain,QuarkChain,QKC,46875656.0,65740856.0,3491714.0,"Infrastructure, Ethereum Ecosystem, Energi Ecosystem"
GPS,goplus-security,GoPlus Security,GPS,43829721.0,241699132.0,13305166.0,"BNB Chain Ecosystem, Base Ecosystem, Cybersecurity, YZi Labs (Prev. Binance Labs) Portfolio, OKX Ventures Portfolio, Binance Alpha Spotlight"
MBX,marblex,MARBLEX,MBX,41995554.0,64208383.0,5843813.0,"Smart Contract Platform, Gaming (GameFi), NFT, BNB Chain Ecosystem, Kaia Ecosystem, Aptos Ecosystem, DWF Labs Portfolio, Gaming Blockchains"
SAI,sai,Sai,SAI,38562163.0,38562163.0,114.1,"Decentralized Finance (DeFi), Ethereum Ecosystem"
OGN,origin-protocol,Origin Token,OGN,36331404.0,72905356.0,6615167.0,"NFT, Ethereum Ecosystem, Base Ecosystem, Pantera Capital Portfolio, Sonic Ecosystem, Made in USA"
AINTI,aintivirus,AIntivirus,AINTI,33728682.0,33728682.0,0.0,"Solana Ecosystem, Meme, AI Meme, Pump.fun Ecosystem"
APX,apollox-2,APX,APX,32249010.0,298032178.0,1115136.0,"Decentralized Finance (DeFi), BNB Chain Ecosystem, Perpetuals, YZi Labs (Prev. Binance Labs) Portfolio, Binance Alpha Spotlight"
RSS3,rss3,RSS3,RSS3,31882546.0,44301824.0,5112756.0,"Artificial Intelligence (AI), Infrastructure, Storage, Ethereum Ecosystem, Coinbase Ventures Portfolio, DragonFly Capital Portfolio, RSS3 VSL Ecosystem, AI Framework, DeFAI"
L3,layer3,Layer3,L3,31823374.0,166128060.0,8743587.0,"Marketing, BNB Chain Ecosystem, Solana Ecosystem, Polygon Ecosystem, Arbitrum Ecosystem, Ethereum Ecosystem, Decentralized Identifier (DID), Optimism Ecosystem, Quest-to-Earn, Made in USA"
UQC,uquid-coin,Uquid Coin,UQC,29957666.0,119830662.0,325118.0,Ethereum Ecosystem
FARTBOY,fartboy,Fartboy,$FARTBOY,28116973.0,28116973.0,237424.0,"Solana Ecosystem, Meme, Solana Meme, Pump.fun Ecosystem"
MAPO,marcopolo,MAP Protocol,MAPO,27740767.0,45869675.0,7583683.0,"BNB Chain Ecosystem, Ethereum Ecosystem, DWF Labs Portfolio"
LYX,lukso-token-2,LUKSO,LYX,25615697.0,35329219.0,844659.0,"Smart Contract Platform, SocialFi, Layer 1 (L1), Decentralized Identifier (DID), Proof of Stake (PoS), Lukso Ecosystem"
NAVX,navi,NAVI Protocol,NAVX,24440905.0,42428631.0,3194860.0,"Decentralized Finance (DeFi), Lending/Borrowing Protocols, Sui Ecosystem, OKX Ventures Portfolio"
NAKA,nakamoto-games,Nakamoto Games,NAKA,24098635.0,66750827.0,9016930.0,"Gaming (GameFi), Polygon Ecosystem, Play To Earn, Gaming Platform"
XTER,xterio,Xterio,XTER,23786316.0,172402520.0,14350472.0,"Artificial Intelligence (AI), Gaming (GameFi), NFT, BNB Chain Ecosystem, Animoca Brands Portfolio, Gaming Blockchains, YZi Labs (Prev. Binance Labs) Portfolio, Binance Alpha Spotlight"
PIKA,pikaboss,Pikaboss,PIKA,22534964.0,22534964.0,12884.64,"Meme, Ethereum Ecosystem"
HMT,human-protocol,HUMAN Protocol,HMT,22138802.0,29212007.0,125452.0,"Artificial Intelligence (AI), Infrastructure, Software as a service, Polygon Ecosystem, Ethereum Ecosystem, Market-Making Solution, AI Framework"
NRN,neuron,Neuron,NRN,21252315.0,49894364.0,480054.0,"Artificial Intelligence (AI), Gaming (GameFi), NFT, Arbitrum Ecosystem, Paradigm Portfolio, AI Agents, AI Framework, Action Games"
VOW,vow,Vow,VOW,21027131.0,68902796.0,300041.0,"Retail, Tourism, BNB Chain Ecosystem, Ethereum Ecosystem"
LUMIA,lumia,Lumia,LUMIA,18676017.0,59244204.0,5756087.0,"Smart Contract Platform, Layer 2 (L2), Real World Assets (RWA)"
TLOS,telos,Telos,TLOS,17697436.0,17697438.0,2957291.0,"Smart Contract Platform, BNB Chain Ecosystem, Layer 1 (L1), Avalanche Ecosystem, Polygon Ecosystem, Arbitrum Ecosystem, Ethereum Ecosystem, Zero Knowledge (ZK), Telos Ecosystem, Consensys Portfolio"
RARI,rarible,RARI,RARI,17692514.0,24269718.0,2565458.0,"NFT, Ethereum Ecosystem, NFT Marketplace, Coinbase Ventures Portfolio, Energi Ecosystem, Made in USA"
PEPE,based-pepe,Based Pepe,PEPE,17379331.0,17379331.0,571975.0,"Meme, Base Ecosystem, Frog-Themed, Base Meme, The Boy’s Club"
VRTX,vertex-protocol,Vertex,VRTX,16838017.0,31395708.0,3353786.0,"Decentralized Exchange (DEX), Exchange-based Tokens, Decentralized Finance (DeFi), Derivatives, Perpetuals, Avalanche Ecosystem, Arbitrum Ecosystem, Mantle Ecosystem, Base Ecosystem, Blast Ecosystem, Sonic Ecosystem, Sei Network Ecosystem"
PIPPIN,pippin,pippin,PIPPIN,15692952.0,15692952.0,12923868.0,"Artificial Intelligence (AI), Infrastructure, Solana Ecosystem, Meme, Solana Meme, AI Meme, AI Agents, Pump.fun Ecosystem, Binance Alpha Spotlight, AI Framework"
BOOE,book-of-ethereum,Book of Ethereum,BOOE,13467300.0,13467300.0,224062.0,"Meme, Ethereum Ecosystem"
CRTS,cratos,Cratos,CRTS,13444810.0,21390153.0,1667738.0,"BNB Chain Ecosystem, Ethereum Ecosystem"
BELLS,bellscoin,Bellscoin,BELLS,11570754.0,11570777.0,961335.0,"Smart Contract Platform, Layer 1 (L1), Meme, Proof of Work (PoW), Inscriptions, Made in USA"
SOVRN,sovrun,Sovrun,SOVRN,10754441.0,11584717.0,679238.0,"Gaming (GameFi), Metaverse, Ethereum Ecosystem, Animoca Brands Portfolio, Base Ecosystem, DWF Labs Portfolio, On-chain Gaming, Andreessen Horowitz (a16z) Portfolio, Hyperliquid Ecosystem, Delphi Ventures Portfolio, Circle Ventures Portfolio"
WALLET,ambire-wallet,Ambire Wallet,WALLET,10447689.0,10508061.0,543501.0,"Wallets, Polygon Ecosystem, Ethereum Ecosystem, Base Ecosystem, Account Abstraction"
APP,moon-app,RWAX,APP,9751754.0,24180104.0,1693187.0,"Tokenized Real Estate, Tokenized Assets, BNB Chain Ecosystem, Solana Ecosystem, Ethereum Ecosystem, Real World Assets (RWA), Injective Ecosystem, RWA Protocol"
JETTON,jetton,JetTon Games,JETTON,9615196.0,14933878.0,19335.33,"Gambling (GambleFi), Telegram Apps, TON Ecosystem"
CA,ca-htb,Coupon Assets,CA,9359287.0,137395165.0,5072529.0,"Retail, Ethereum Ecosystem"
LCAT,lion-cat,Lion Cat,LCAT,9244522.0,13823585.0,152189.0,"BNB Chain Ecosystem, Meme, Cat-Themed"
SIDUS,sidus,Sidus,SIDUS,9057004.0,15467710.0,806717.0,"Gaming (GameFi), NFT, BNB Chain Ecosystem, Metaverse, Play To Earn, Ethereum Ecosystem, Linea Ecosystem, Animoca Brands Portfolio, Base Ecosystem, RPG, Gaming Governance Token, Alameda Research Portfolio, OKX Ventures Portfolio"
LMT,limitus,LIMITUS,LMT,8575191.0,8575191.0,533846.0,"Artificial Intelligence (AI), Solana Ecosystem, Pump.fun Ecosystem, Binance Alpha Spotlight"
PPC,peercoin,Peercoin,PPC,8070696.0,8070878.0,20389.0,"Smart Contract Platform, Polygon Ecosystem, Ethereum Ecosystem, Proof of Stake (PoS), Proof of Work (PoW)"
ZKL,zklink,zkLink,ZKL,7987534.0,28380899.0,6611191.0,"Smart Contract Platform, Ethereum Ecosystem, Zero Knowledge (ZK), Layer 3 (L3), zkLink Nova Ecosystem, OKX Ventures Portfolio"
GRAM,gram-2,Gram,GRAM,7592539.0,7592536.0,33165.0,"TON Ecosystem, Proof of Work (PoW)"
BUZZ,hive-ai,Hive AI,BUZZ,6677043.0,6677043.0,11736530.0,"Artificial Intelligence (AI), Decentralized Finance (DeFi), Solana Ecosystem, AI Agents, Pump.fun Ecosystem, Binance Alpha Spotlight, DeFAI"
HAPPY,happycat-2,Happy Cat,HAPPY,5995437.0,5995437.0,1539371.0,"BNB Chain Ecosystem, Solana Ecosystem, Meme, Cat-Themed, Binance Alpha Spotlight"
TET,tectum,Tectum,TET,5818400.0,7175435.0,282643.0,"Smart Contract Platform, Layer 1 (L1), Ethereum Ecosystem, Bitcoin Sidechains, SideChain"
AGC,argocoin-2,Argocoin,AGC,5792977.0,5792977.0,4785.62,"Artificial Intelligence (AI), Made in USA"
VISTA,ethervista,Ethervista,VISTA,5396940.0,5396920.0,1109310.0,"Decentralized Exchange (DEX), Launchpad, Ethereum Ecosystem, Binance Alpha Spotlight"
SIX,six-network,SIX Network,SIX,5118615.0,18696319.0,925228.0,"DWF Labs Portfolio, Stellar Ecosystem"
OVR,ovr,Ovr,OVR,5083306.0,8705356.0,371918.0,"Augmented Reality, NFT, BNB Chain Ecosystem, Metaverse, Polygon Ecosystem, Ethereum Ecosystem, DePIN, Base Ecosystem"
OBT,oobit,Oobit,OBT,5009312.0,14230018.0,113678.0,"BNB Chain Ecosystem, Ethereum Ecosystem, Payment Solutions"
RVF,rocketx,RocketX Exchange,RVF,4519837.0,4623924.0,61969.0,"Decentralized Exchange (DEX), Decentralized Finance (DeFi), Automated Market Maker (AMM), Ethereum Ecosystem, Poolz Finance Launchpad"
ELON4AFD,elon4afd,Elon4AfD,ELON4AFD,4427177.0,4427177.0,214928.0,"Solana Ecosystem, Meme, Elon Musk-Inspired, Pump.fun Ecosystem"
DNX,dynex,Dynex,DNX,4287769.0,4288877.0,419786.0,"Artificial Intelligence (AI), Smart Contract Platform, Layer 1 (L1), Ethereum Ecosystem, DePIN, Decentralized Science (DeSci), Proof of Work (PoW)"
MEMDEX,memdex100,MEMDEX100,MEMDEX,4166577.0,4166577.0,360599.0,"Solana Ecosystem, Meme, Solana Meme"
MUBI,multibit,Multibit,MUBI,4007124.0,4218025.0,2233578.0,"BNB Chain Ecosystem, Polygon Ecosystem, Ethereum Ecosystem, BRC-20, Inscriptions"
JOULE,joule-2,Joule,JOULE,3999262.0,4032487.0,2643.34,"Decentralized Finance (DeFi), Flare Network Ecosystem"
CHIRP,chirper-ai,Chirper AI,CHIRP,3945376.0,3945376.0,35253.0,"Artificial Intelligence (AI), Solana Ecosystem, AI Agents"
IMGN,imgn-labs,IMGN Labs,IMGN,3738859.0,3738859.0,83625.0,"Artificial Intelligence (AI), Base Ecosystem, AI Applications"
EGP,eigenpie,Eigenpie,EGP,3586041.0,9711082.0,3231846.0,"Decentralized Finance (DeFi), BNB Chain Ecosystem, Arbitrum Ecosystem, Restaking, Liquid Staking"
MOEW,moew,MOEW,MOEW,3540186.0,3540186.0,896184.0,"Meme, Base Ecosystem, TON Ecosystem, Cat-Themed, Base Meme, TON Meme"
ICP,internet-computer,Internet Computer,ICP,3012336724.0,3012336724.0,100296227.0,"Artificial Intelligence (AI), Infrastructure, Smart Contract Platform, Layer 1 (L1), Internet Computer Ecosystem, Alleged SEC Securities, Multicoin Capital Portfolio, Layer 0 (L0), Andreessen Horowitz (a16z) Portfolio, GMCI Layer 1 Index, GMCI 30 Index, Blockchain Capital Portfolio, GMCI Index, Polychain Capital Portfolio, Coinbase 50 Index"
FTN,fasttoken,Fasttoken,FTN,1914865037.0,3875951763.0,52076491.0,"Smart Contract Platform, BNB Chain Ecosystem, Layer 1 (L1), Arbitrum Ecosystem, Ethereum Ecosystem, Base Ecosystem, Bahamut Ecosystem"
POL,polygon-ecosystem-token,POL (ex-MATIC),POL,1805081143.0,2102552817.0,131302175.0,"Smart Contract Platform, Polygon Ecosystem, Ethereum Ecosystem, Layer 2 (L2)"
TIA,celestia,Celestia,TIA,1210089296.0,2033777653.0,144836765.0,"Smart Contract Platform, Cosmos Ecosystem, Layer 1 (L1), Data Availability, Modular Blockchain, Osmosis Ecosystem, eGirl Capital Portfolio, Coinbase Ventures Portfolio, Proof of Stake (PoS), Secret Ecosystem, YZi Labs (Prev. Binance Labs) Portfolio, Delphi Ventures Portfolio, Galaxy Digital Portfolio, Blockchain Capital Portfolio, OKX Ventures Portfolio, Polychain Capital Portfolio"
STX,blockstack,Stacks,STX,944352135.0,944352135.0,44376409.0,"Infrastructure, Smart Contract Platform, Layer 2 (L2), Bitcoin Sidechains, Stacks Ecosystem, SideChain, GMCI Layer 2 Index, GMCI 30 Index, Blockchain Capital Portfolio, GMCI Index, Made in USA, Coinbase 50 Index"
AERO,aerodrome-finance,Aerodrome Finance,AERO,517147295.0,1025834636.0,130730028.0,"Decentralized Exchange (DEX), Decentralized Finance (DeFi), Automated Market Maker (AMM), Base Ecosystem, Binance Alpha Spotlight, Made in USA"
DEXE,dexe,DeXe,DEXE,501591795.0,847683285.0,15750908.0,"Artificial Intelligence (AI), Decentralized Finance (DeFi), BNB Chain Ecosystem, Ethereum Ecosystem"
TEL,telcoin,Telcoin,TEL,380973191.0,414553398.0,2064927.0,"Decentralized Finance (DeFi), Wallets, Polygon Ecosystem, Arbitrum Ecosystem, Ethereum Ecosystem, Payment Solutions, Base Ecosystem, Made in USA"
MEW,cat-in-a-dogs-world,cat in a dogs world,MEW,249603326.0,249603326.0,33207910.0,"Solana Ecosystem, Meme, Dog-Themed, Solana Meme, Cat-Themed"
DCR,decred,Decred,DCR,240687992.0,240696479.0,4148031.0,"Smart Contract Platform, Privacy, Layer 1 (L1), Proof of Stake (PoS), Proof of Work (PoW), Blockchain Capital Portfolio, Made in USA"
MINA,mina-protocol,Mina Protocol,MINA,227137093.0,227137093.0,19592930.0,"Smart Contract Platform, Layer 1 (L1), Zero Knowledge (ZK), FTX Holdings, Paradigm Portfolio, Coinbase Ventures Portfolio, Multicoin Capital Portfolio, Proof of Stake (PoS), Pantera Capital Portfolio, Circle Ventures Portfolio, Privacy Blockchain, Polychain Capital Portfolio, Made in USA, Coinbase 50 Index"
ZIL,zilliqa,Zilliqa,ZIL,214832898.0,222311239.0,18683855.0,"Smart Contract Platform, BNB Chain Ecosystem, GMCI Layer 1 Index, GMCI Index, Made in China"
ZK,zksync,ZKsync,ZK,182309785.0,1041770197.0,28922248.0,"Smart Contract Platform, Layer 2 (L2), Zero Knowledge (ZK), ZkSync Ecosystem, Consensys Portfolio, Blockchain Capital Portfolio, OKX Ventures Portfolio"
EUL,euler,Euler,EUL,142642838.0,207509994.0,3007485.0,"Lending/Borrowing Protocols, Ethereum Ecosystem, Paradigm Portfolio, Coinbase Ventures Portfolio"
HIVE,hive,Hive,HIVE,104222562.0,,3463024.0,"Smart Contract Platform, SocialFi, Layer 1 (L1), Gaming Blockchains"
PAAL,paal-ai,PAAL AI,PAAL,99244906.0,110580320.0,12288354.0,"Artificial Intelligence (AI), Virtual Reality, BNB Chain Ecosystem, Launchpad, Ethereum Ecosystem, Telegram Apps, Discord Bots, Base Ecosystem, PAAL AI Launchpad, AI Agents, AI Applications, AI Agent Launchpad, Binance Alpha Spotlight, AI Framework, DeFAI, Made in USA"
EWT,energy-web-token,Energy Web,EWT,90870293.0,103595238.0,693056.0,"Energy, Polkadot Ecosystem, Gnosis Chain Ecosystem, Regenerative Finance (ReFi), Real World Assets (RWA), Blockchain Capital Portfolio, Hydration Ecosystem"
YGG,yield-guild-games,Yield Guild Games,YGG,86444252.0,164401872.0,18666253.0,"Gaming (GameFi), NFT, BNB Chain Ecosystem, Metaverse, Collectibles, Polygon Ecosystem, Play To Earn, Harmony Ecosystem, Guild and Scholarship, Ethereum Ecosystem, Animoca Brands Portfolio, Base Ecosystem, DWF Labs Portfolio, Ronin Ecosystem, Gaming Governance Token, Andreessen Horowitz (a16z) Portfolio, Delphi Ventures Portfolio, Abstract Ecosystem"
CARV,carv,CARV,CARV,84767895.0,288880258.0,14754565.0,"Artificial Intelligence (AI), Infrastructure, Gaming (GameFi), NFT, Solana Ecosystem, Arbitrum Ecosystem, Impossible Finance Launchpad, Ethereum Ecosystem, Animoca Brands Portfolio, Base Ecosystem"
MVL,mass-vehicle-ledger,MVL,MVL,83928903.0,87222945.0,1203199.0,"Internet of Things (IOT), BNB Chain Ecosystem, Ethereum Ecosystem, DePIN, DWF Labs Portfolio"
B3,b3,B3 (Base),B3,79949556.0,293209847.0,14057586.0,"Smart Contract Platform, Base Ecosystem, Gaming Blockchains"
ACX,across-protocol,Across Protocol,ACX,70504161.0,159981158.0,33732711.0,"Polygon Ecosystem, Arbitrum Ecosystem, Ethereum Ecosystem, Optimism Ecosystem, Bridge Governance Tokens, Cross-chain Communication, Intent, Boba Network Ecosystem, Blockchain Capital Portfolio, Made in USA"
AGLD,adventure-gold,Adventure Gold,AGLD,67165867.0,67165867.0,20306274.0,"Ethereum Ecosystem, DWF Labs Portfolio"
VEE,blockv,BLOCKv,VEE,64804198.0,64804198.0,73538.0,"NFT, Polygon Ecosystem, Ethereum Ecosystem, Optimism Ecosystem"
ZRC,zircuit,Zircuit,ZRC,64764156.0,295063391.0,97666125.0,"Smart Contract Platform, BNB Chain Ecosystem, Ethereum Ecosystem, Layer 2 (L2), Zero Knowledge (ZK), Restaking, Zircuit Ecosystem"
UNP,unipoly,Unipoly,UNP,63850778.0,228667329.0,1341259.0,"Gaming (GameFi), Ethereum Ecosystem, Skale Ecosystem"
AVAIL,avail,Avail,AVAIL,63812320.0,311006557.0,6509766.0,"Infrastructure, Smart Contract Platform, Ethereum Ecosystem, Data Availability, Modular Blockchain"
USTC,terrausd,TerraClassicUSD,USTC,62648572.0,68257699.0,5363388.0,"Stablecoins, USD Stablecoin, Seigniorage, Alleged SEC Securities, Osmosis Ecosystem, Stablecoin Protocol, DeFiance Capital Portfolio, Terra Classic Ecosystem, YZi Labs (Prev. Binance Labs) Portfolio, Delphi Ventures Portfolio, Galaxy Digital Portfolio, Fiat-backed Stablecoin"
ISLM,islamic-coin,Islamic Coin,ISLM,53512330.0,575836413.0,742049.0,"Smart Contract Platform, Wallets, Layer 2 (L2), Osmosis Ecosystem"
CYBER,cyberconnect,CYBER,CYBER,51642445.0,121937842.0,22576374.0,"Smart Contract Platform, SocialFi, NFT, BNB Chain Ecosystem, Binance Launchpool, Ethereum Ecosystem, Decentralized Identifier (DID), Optimism Ecosystem, Layer 2 (L2), Animoca Brands Portfolio, Multicoin Capital Portfolio, YZi Labs (Prev. Binance Labs) Portfolio, Delphi Ventures Portfolio, Cyber Ecosystem, Optimism Superchain Ecosystem"
ALI,alethea-artificial-liquid-intelligence-token,Artificial Liquid Intelligence,ALI,50789127.0,54982405.0,2340526.0,"Artificial Intelligence (AI), NFT, Metaverse, Solana Ecosystem, Polygon Ecosystem, Ethereum Ecosystem, Cronos Ecosystem, Base Ecosystem, Multicoin Capital Portfolio, AI Agents, Alameda Research Portfolio, DeFiance Capital Portfolio, YZi Labs (Prev. Binance Labs) Portfolio"
SCRT,secret,Secret,SCRT,50450542.0,53041871.0,1787148.0,"Artificial Intelligence (AI), Smart Contract Platform, Cosmos Ecosystem, Layer 1 (L1), Osmosis Ecosystem, Alameda Research Portfolio, DragonFly Capital Portfolio, DeFiance Capital Portfolio, Privacy Blockchain, Outlier Ventures Portfolio"
VADER,vaderai-by-virtuals,VaderAI by Virtuals,VADER,49796697.0,49796697.0,2085174.0,"Artificial Intelligence (AI), Meme, Base Ecosystem, AI Meme, AI Agents, Virtuals Protocol Ecosystem, Binance Alpha Spotlight"
WHITE,whiteheart,Whiteheart,WHITE,42220163.0,42220163.0,0.0,"Decentralized Finance (DeFi), Derivatives, Ethereum Ecosystem"
CONX,connex,Connex,CONX,41466501.0,3605782728.0,10929.81,BNB Chain Ecosystem
FORT,forta,Forta,FORT,38660451.0,66176223.0,1730329.0,"Artificial Intelligence (AI), Polygon Ecosystem, Ethereum Ecosystem, Coinbase Ventures Portfolio, Cybersecurity, Andreessen Horowitz (a16z) Portfolio, Blockchain Capital Portfolio"
STRIKE,strike,Strike,STRIKE,36060052.0,42206610.0,32557.0,"Decentralized Finance (DeFi), Lending/Borrowing Protocols, Ethereum Ecosystem"
NCT,polyswarm,PolySwarm,NCT,35171390.0,35179080.0,811280.0,"Business Services, Polygon Ecosystem, Ethereum Ecosystem, Cybersecurity, Made in USA"
NYM,nym,Nym,NYM,33129269.0,40760815.0,3547002.0,"Smart Contract Platform, Privacy, Ethereum Ecosystem, DePIN, Osmosis Ecosystem, VPN, Andreessen Horowitz (a16z) Portfolio, YZi Labs (Prev. Binance Labs) Portfolio"
SYN,synapse-2,Synapse,SYN,30707926.0,35044064.0,6126905.0,"BNB Chain Ecosystem, Avalanche Ecosystem, Polygon Ecosystem, Fantom Ecosystem, Arbitrum Ecosystem, Olympus Pro Ecosystem, Ethereum Ecosystem, Optimism Ecosystem, Bridge Governance Tokens, Base Ecosystem, Alameda Research Portfolio, Intent"
HFT,hashflow,Hashflow,HFT,30666438.0,52998839.0,18788555.0,"Decentralized Exchange (DEX), Exchange-based Tokens, Decentralized Finance (DeFi), BNB Chain Ecosystem, Binance Launchpool, MEV Protection, Ethereum Ecosystem, Coinbase Ventures Portfolio, Alameda Research Portfolio, DragonFly Capital Portfolio, Galaxy Digital Portfolio"
KENDU,kendu-inu,Kendu Inu,KENDU,25142013.0,25265098.0,116652.0,"Solana Ecosystem, Meme, Ethereum Ecosystem, Base Ecosystem, Dog-Themed"
J,jambo,Jambo,J,23557819.0,146314826.0,3933883.0,"Solana Ecosystem, Paradigm Portfolio, Coinbase Ventures Portfolio"
PEP,pepecoin-network,Pepecoin,PEP,20755735.0,20755735.0,240210.0,"Smart Contract Platform, Layer 1 (L1), Meme, Frog-Themed, Proof of Work (PoW), The Boy’s Club, 4chan-Themed"
SWEAT,sweatcoin,SWEAT,SWEAT,19393489.0,53646106.0,6208659.0,"Sports, Gaming (GameFi), BNB Chain Ecosystem, Solana Ecosystem, Avalanche Ecosystem, Polygon Ecosystem, Near Protocol Ecosystem, Play To Earn, Arbitrum Ecosystem, Celo Ecosystem, Move To Earn, Ethereum Ecosystem, Optimism Ecosystem, Aptos Ecosystem, Sui Ecosystem, Base Ecosystem, Gaming Governance Token, Gaming Utility Token, OKX Ventures Portfolio"
SWARMS,swarms,Swarms,SWARMS,19248577.0,19248577.0,7413055.0,"Artificial Intelligence (AI), Solana Ecosystem, Meme, AI Agents, Pump.fun Ecosystem, Binance Alpha Spotlight, AI Framework"
ADS,adshares,Adshares,ADS,18646467.0,18654383.0,15941.24,"Business Services, Decentralized Finance (DeFi), BNB Chain Ecosystem, Metaverse, Polygon Ecosystem, Ethereum Ecosystem, Base Ecosystem"
FLOCK,flock-2,FLOCK,FLOCK,17157833.0,155729868.0,13027267.0,"Artificial Intelligence (AI), Base Ecosystem, AI Applications, Binance Alpha Spotlight"
ALU,altura,Altura,ALU,16221275.0,16221275.0,9974522.0,"Artificial Intelligence (AI), Infrastructure, Gaming (GameFi), NFT, BNB Chain Ecosystem, NFT Marketplace, Base Ecosystem, Gaming Platform, Made in USA, Gaming Marketplace"
INV,inverse-finance,Inverse Finance,INV,16182475.0,16707136.0,251243.0,"Decentralized Finance (DeFi), Yield Farming, Yield Aggregator, Lending/Borrowing Protocols, Olympus Pro Ecosystem, Ethereum Ecosystem, Fixed Interest"
UPC,upcx,UPCX,UPC,16141593.0,3034782792.0,1063549.0,Ethereum Ecosystem
CHEQ,cheqd-network,CHEQD Network,CHEQ,15142860.0,20470156.0,174803.0,"Smart Contract Platform, Ethereum Ecosystem, Decentralized Identifier (DID), Zero Knowledge (ZK), Animoca Brands Portfolio, Osmosis Ecosystem, Outlier Ventures Portfolio"
OCTA,octaspace,OctaSpace,OCTA,14531056.0,14531925.0,847573.0,"Artificial Intelligence (AI), Internet of Things (IOT), Smart Contract Platform, BNB Chain Ecosystem, Layer 1 (L1), Ethereum Ecosystem, DePIN, AI Agents"
FLAY,flayer,Flayer,FLAY,14274306.0,23790509.0,218463.0,"Launchpad, Ethereum Ecosystem"
