PYTH,pyth-network,Pyth Network,PYTH,1017842883,1770166598.0,110548415.0,"Business Services, Infrastructure, Decentralized Finance (DeFi), Oracle, Solana Ecosystem, Neon Ecosystem, Manta Network Ecosystem, Multicoin Capital Portfolio, GMCI DeFi Index, Delphi Ventures Portfolio, GMCI Index"
FLOKI,floki,FLOKI,FLOKI,1009443262,1044944718.0,119190575.0,"Gaming (GameFi), NFT, BNB Chain Ecosystem, Metaverse, Meme, Play To Earn, Ethereum Ecosystem, Telegram Apps, Dog-Themed, DWF Labs Portfolio, RPG, On-chain Gaming, TokenFi Launchpad, GMCI Meme Index, GMCI Index"
RAY,raydium,Raydium,RAY,988357181,2045814302.0,121933701.0,"Decentralized Exchange (DEX), Decentralized Finance (DeFi), Yield Farming, Automated Market Maker (AMM), Solana Ecosystem, Launchpad, GMCI DeFi Index, GMCI Index"
CFX,conflux-token,Conflux,CFX,936053666,1040499735.0,78803776.0,"Smart Contract Platform, DWF Labs Portfolio, Proof of Work (PoW), GMCI Layer 1 Index, Sequoia Capital Portfolio, GMCI Index, Made in China"
BTT,bittorrent,BitTorrent,BTT,643202373,645771668.0,18332219.0,"Storage, BNB Chain Ecosystem, Ethereum Ecosystem, DePIN, Alleged SEC Securities, Binance Launchpad, Tron Ecosystem, Energi Ecosystem, YZi Labs (Prev. Binance Labs) Portfolio, BitTorrent Ecosystem, GMCI DePIN Index, GMCI Index"
EIGEN,eigenlayer,EigenCloud (prev. EigenLayer),EIGEN,508558821,2690179044.0,94655768.0,"Infrastructure, Ethereum Ecosystem, Base Ecosystem, Data Availability, Restaking, Polychain Capital Portfolio, Made in USA"
ZK,zksync,ZKsync,ZK,453825485,1317842741.0,17960604.0,"Smart Contract Platform, Ethereum Ecosystem, Layer 2 (L2), Zero Knowledge (ZK), ZkSync Ecosystem, Consensys Portfolio, Blockchain Capital Portfolio, OKX Ventures Portfolio"
SUN,sun-token,Sun Token,SUN,406692913,422337975.0,25777672.0,"Decentralized Finance (DeFi), Tron Ecosystem"
TKX,tokenize-xchange,Tokenize Xchange,TKX,393776989,492245863.0,455749.0,"Exchange-based Tokens, Centralized Exchange (CEX) Token, Ethereum Ecosystem, Titanchain Ecosystem"
JST,just,JUST,JST,338973470,338973470.0,12978369.0,"Decentralized Finance (DeFi), Tron Ecosystem"
DASH,dash,Dash,DASH,309216146,309243260.0,19972697.0,"Smart Contract Platform, Privacy, Masternodes, Alleged SEC Securities, Proof of Stake (PoS), Proof of Work (PoW), Made in USA"
DRIFT,drift-protocol,Drift Protocol,DRIFT,245057624,674118334.0,76318885.0,"Decentralized Finance (DeFi), Derivatives, Prediction Markets, Solana Ecosystem, Governance"
NPC,non-playable-coin,Non-Playable Coin,NPC,202384292,202384292.0,9851937.0,"NFT, BNB Chain Ecosystem, Solana Ecosystem, Meme, Ethereum Ecosystem, Base Ecosystem, Hybrid Token Standards, Wojak-Themed, 4chan-Themed"
LGCT,legacy-token,Legacy Token,LGCT,192538738,544514797.0,6385663.0,"Education, Gaming (GameFi), BNB Chain Ecosystem, Base Ecosystem"
CELO,celo,Celo,CELO,186733251,321172958.0,11186086.0,"Smart Contract Platform, Celo Ecosystem, Layer 2 (L2), DWF Labs Portfolio, Coinbase Ventures Portfolio, Proof of Stake (PoS), Andreessen Horowitz (a16z) Portfolio, Optimism Superchain Ecosystem, Outlier Ventures Portfolio, Made in USA"
VTHO,vethor-token,VeThor,VTHO,180045601,180045601.0,2220702.0,"Layer 1 (L1), VeChain Ecosystem"
ELF,aelf,aelf,ELF,155727598,195522316.0,5997556.0,"Infrastructure, Smart Contract Platform, BNB Chain Ecosystem, Layer 1 (L1), Ethereum Ecosystem, GMCI Layer 1 Index, Aelf Ecosystem, GMCI Index"
ZIG,zignaly,ZIGChain,ZIG,144990455,201074997.0,5152776.0,"Artificial Intelligence (AI), Smart Contract Platform, BNB Chain Ecosystem, Solana Ecosystem, Layer 1 (L1), Polygon Ecosystem, Ethereum Ecosystem, DWF Labs Portfolio, Injective Ecosystem, OKX Ventures Portfolio"
WOO,woo-network,WOO,WOO,138695780,160536791.0,7248977.0,"Decentralized Exchange (DEX), Exchange-based Tokens, Decentralized Finance (DeFi), Automated Market Maker (AMM), BNB Chain Ecosystem, Derivatives, Perpetuals, Centralized Exchange (CEX) Token, Solana Ecosystem, Avalanche Ecosystem, Polygon Ecosystem, Near Protocol Ecosystem, Fantom Ecosystem, Arbitrum Ecosystem, Ethereum Ecosystem, ZkSync Ecosystem, Mantle Ecosystem, Linea Ecosystem, Base Ecosystem, DragonFly Capital Portfolio, YZi Labs (Prev. Binance Labs) Portfolio"
IO,io,io.net,IO,133788794,523610187.0,48274038.0,"Artificial Intelligence (AI), Internet of Things (IOT), Binance Launchpool, Solana Ecosystem, DePIN, Animoca Brands Portfolio, Multicoin Capital Portfolio, Delphi Ventures Portfolio, OKX Ventures Portfolio, Made in USA"
AI16Z,ai16z,ai16z,AI16Z,133256822,133256822.0,185615761.0,"Artificial Intelligence (AI), Solana Ecosystem, Meme, Solana Token-2022, AI Agents, Binance Alpha Spotlight, AI Framework, Made in USA"
OZO,ozone-chain,Ozone Chain,OZO,116416444,134668523.0,232940.0,"Smart Contract Platform, Layer 1 (L1), Zero Knowledge (ZK)"
BICO,biconomy,Biconomy,BICO,102946755,104984670.0,7863801.0,"Arbitrum Ecosystem, Ethereum Ecosystem, Account Abstraction, Coinbase Ventures Portfolio, YZi Labs (Prev. Binance Labs) Portfolio, Consensys Portfolio, Outlier Ventures Portfolio"
ACX,across-protocol,Across Protocol,ACX,93834840,153790696.0,7052352.0,"Polygon Ecosystem, Arbitrum Ecosystem, Ethereum Ecosystem, Optimism Ecosystem, Bridge Governance Tokens, Cross-chain Communication, Intent, Boba Network Ecosystem, Blockchain Capital Portfolio, Made in USA"
RLC,iexec-rlc,iExec RLC,RLC,92425680,111090512.0,10389246.0,"Artificial Intelligence (AI), Oracle, Arbitrum Ecosystem, Ethereum Ecosystem, DePIN, AI Agents, Energi Ecosystem, Sora Ecosystem, GMCI DePIN Index, GMCI Index"
B3,b3,B3 (Base),B3,90084859,276645784.0,4084973.0,"Smart Contract Platform, Base Ecosystem, Gaming Blockchains"
FLOCK,flock-2,FLOCK,FLOCK,84876851,377705940.0,48483953.0,"Artificial Intelligence (AI), Base Ecosystem, AI Applications, Binance Alpha Spotlight"
BAL,balancer,Balancer,BAL,84783762,91638637.0,5202546.0,"Decentralized Exchange (DEX), Exchange-based Tokens, Decentralized Finance (DeFi), Yield Farming, Automated Market Maker (AMM), Avalanche Ecosystem, Polygon Ecosystem, Near Protocol Ecosystem, Gnosis Chain Ecosystem, Harmony Ecosystem, Arbitrum Ecosystem, Ethereum Ecosystem, Optimism Ecosystem, Base Ecosystem, Index Coop Defi Index, Alameda Research Portfolio, DeFiance Capital Portfolio, Pantera Capital Portfolio, Energi Ecosystem, Polygon zkEVM Ecosystem, Huobi ECO Chain Ecosystem, Blockchain Capital Portfolio, Governance"
SIX,six,Six Sigma,SIX,80706697,80706697.0,10832.95,"Gambling (GambleFi), Solana Ecosystem"
PAAL,paal-ai,PAAL AI,PAAL,73385954,81767847.0,11224401.0,"Artificial Intelligence (AI), Virtual Reality, BNB Chain Ecosystem, Launchpad, Ethereum Ecosystem, Telegram Apps, Discord Bots, Base Ecosystem, PAAL AI Launchpad, AI Agents, AI Applications, AI Agent Launchpad, Binance Alpha Spotlight, AI Framework, DeFAI, Made in USA"
VANRY,vanar-chain,Vanar Chain,VANRY,59423829,60460924.0,4910638.0,"Artificial Intelligence (AI), Smart Contract Platform, Layer 1 (L1), Polygon Ecosystem, Ethereum Ecosystem, Vanar Chain Ecosystem"
SCRT,secret,Secret,SCRT,58757340,61514805.0,2519003.0,"Artificial Intelligence (AI), Smart Contract Platform, Cosmos Ecosystem, Layer 1 (L1), Osmosis Ecosystem, Alameda Research Portfolio, DragonFly Capital Portfolio, DeFiance Capital Portfolio, Privacy Blockchain, Outlier Ventures Portfolio"
VEE,blockv,BLOCKv,VEE,55140793,55140793.0,42879.0,"NFT, Polygon Ecosystem, Ethereum Ecosystem, Optimism Ecosystem"
QI,benqi,BENQI,QI,54316143,54316143.0,2557411.0,"Decentralized Finance (DeFi), Yield Farming, Binance Launchpool, Lending/Borrowing Protocols, Avalanche Ecosystem, Liquid Staking Governance Tokens, DragonFly Capital Portfolio, Liquid Staking"
CHILLGUY,chill-guy,Just a chill guy,CHILLGUY,52023553,52023553.0,17562490.0,"Solana Ecosystem, Meme, Dog-Themed, Solana Meme, Pump.fun Ecosystem, TikTok Meme"
QKC,quark-chain,QuarkChain,QKC,50001945,69834596.0,863033.0,"Infrastructure, Ethereum Ecosystem, Energi Ecosystem"
AO,ao-computer,ao Computer,AO,44846920,44846920.0,519364.0,"Artificial Intelligence (AI), Smart Contract Platform, DePIN"
MBX,marblex,MARBLEX,MBX,43349972,54354317.0,2808508.0,"Smart Contract Platform, Gaming (GameFi), NFT, BNB Chain Ecosystem, Kaia Ecosystem, Aptos Ecosystem, DWF Labs Portfolio, Gaming Blockchains"
NOS,nosana,Nosana,NOS,43162783,51753937.0,1567575.0,"Artificial Intelligence (AI), Solana Ecosystem, DePIN"
NYM,nym,Nym,NYM,41899243,51276936.0,2508863.0,"Smart Contract Platform, Privacy, Ethereum Ecosystem, DePIN, Osmosis Ecosystem, VPN, Andreessen Horowitz (a16z) Portfolio, YZi Labs (Prev. Binance Labs) Portfolio, Governance"
ACS,access-protocol,Access Protocol,ACS,41801868,87834006.0,937084.0,"SocialFi, Solana Ecosystem"
FORT,forta,Forta,FORT,41043696,65619055.0,636136.0,"Artificial Intelligence (AI), Polygon Ecosystem, Arbitrum Ecosystem, Ethereum Ecosystem, Base Ecosystem, Coinbase Ventures Portfolio, Cybersecurity, Andreessen Horowitz (a16z) Portfolio, Blockchain Capital Portfolio"
APX,apollox-2,APX,APX,39885492,368605425.0,1594216.0,"Decentralized Finance (DeFi), BNB Chain Ecosystem, Perpetuals, YZi Labs (Prev. Binance Labs) Portfolio, Binance Alpha Spotlight"
UQC,uquid-coin,Uquid Coin,UQC,38944122,155776487.0,9687.17,Ethereum Ecosystem
FARTBOY,fartboy,Fartboy,$FARTBOY,38795926,38795926.0,852968.0,"Solana Ecosystem, Meme, Solana Meme, Pump.fun Ecosystem"
GPS,goplus-security,GoPlus Security,GPS,38420716,136141756.0,31749392.0,"BNB Chain Ecosystem, Base Ecosystem, Cybersecurity, YZi Labs (Prev. Binance Labs) Portfolio, OKX Ventures Portfolio, Binance Alpha Spotlight"
AINTI,aintivirus,AIntivirus,AINTI,33726760,33726760.0,0.0,"Solana Ecosystem, Meme, AI Meme, Pump.fun Ecosystem"
L3,layer3,Layer3,L3,30476555,126309309.0,7788370.0,"Marketing, BNB Chain Ecosystem, Solana Ecosystem, Polygon Ecosystem, Arbitrum Ecosystem, Ethereum Ecosystem, Decentralized Identifier (DID), Optimism Ecosystem, Quest-to-Earn, Made in USA"
LYX,lukso-token-2,LUKSO,LYX,29043331,40056618.0,466708.0,"Smart Contract Platform, SocialFi, Layer 1 (L1), Decentralized Identifier (DID), Proof of Stake (PoS), Lukso Ecosystem"
MAPO,marcopolo,MAP Protocol,MAPO,27730312,44596492.0,884520.0,"BNB Chain Ecosystem, Ethereum Ecosystem, DWF Labs Portfolio"
BUZZ,hive-ai,Hive AI,BUZZ,26276657,26276657.0,10007992.0,"Decentralized Finance (DeFi), Solana Ecosystem, AI Agents, Pump.fun Ecosystem, Binance Alpha Spotlight, DeFAI"
LUMIA,lumia,Lumia,LUMIA,25923919,82236056.0,3372955.0,"Smart Contract Platform, Layer 2 (L2), Real World Assets (RWA), Governance"
SEDA,seda-2,SEDA,SEDA,25617718,42324137.0,311290.0,"Smart Contract Platform, Oracle, Ethereum Ecosystem, Base Ecosystem, Modular Blockchain, Osmosis Ecosystem"
ANVL,anvil,Anvil,ANVL,25492881,91461801.0,204072.0,"Decentralized Finance (DeFi), Ethereum Ecosystem"
TLOS,telos,Telos,TLOS,25455910,25455913.0,1931409.0,"Smart Contract Platform, BNB Chain Ecosystem, Layer 1 (L1), Avalanche Ecosystem, Polygon Ecosystem, Arbitrum Ecosystem, Ethereum Ecosystem, Zero Knowledge (ZK), Base Ecosystem, Telos Ecosystem, Consensys Portfolio"
NAVX,navi,NAVI Protocol,NAVX,23764066,39314687.0,1168752.0,"Decentralized Finance (DeFi), Lending/Borrowing Protocols, Sui Ecosystem, OKX Ventures Portfolio, Binance Alpha Spotlight"
PIKA,pikaboss,Pikaboss,PIKA,22814582,22814582.0,5372.72,"Meme, Ethereum Ecosystem"
PIPPIN,pippin,pippin,PIPPIN,21471979,21471979.0,9987894.0,"Artificial Intelligence (AI), Infrastructure, Solana Ecosystem, Meme, Solana Meme, AI Meme, AI Agents, Pump.fun Ecosystem, Binance Alpha Spotlight, AI Framework"
NRN,neuron,Neuron,NRN,20809702,46302118.0,2605837.0,"Artificial Intelligence (AI), Gaming (GameFi), NFT, Arbitrum Ecosystem, Paradigm Portfolio, AI Agents, AI Framework, Action Games, Robotics"
WALLET,ambire-wallet,Ambire Wallet,WALLET,20086367,20330220.0,54700.0,"Wallets, Polygon Ecosystem, Ethereum Ecosystem, Base Ecosystem, Account Abstraction, Governance"
RARI,rarible,RARI,RARI,17554056,24216656.0,4275795.0,"NFT, Ethereum Ecosystem, NFT Marketplace, Coinbase Ventures Portfolio, Energi Ecosystem, Made in USA, Governance"
XTER,xterio,Xterio,XTER,15040444,106194790.0,18537103.0,"Artificial Intelligence (AI), Gaming (GameFi), NFT, BNB Chain Ecosystem, Animoca Brands Portfolio, Gaming Blockchains, YZi Labs (Prev. Binance Labs) Portfolio, Binance Alpha Spotlight"
SCA,scallop-2,Scallop,SCA,12673578,25528865.0,1332815.0,"Decentralized Finance (DeFi), Lending/Borrowing Protocols, Sui Ecosystem"
TRIAS,trias-token,TriasLab,TRIAS,12117872,12117872.0,94304.0,"Artificial Intelligence (AI), Smart Contract Platform, BNB Chain Ecosystem, Layer 1 (L1), Ethereum Ecosystem, AI Agents"
BELLS,bellscoin,Bellscoin,BELLS,11853345,11853345.0,378453.0,"Smart Contract Platform, Layer 1 (L1), Meme, Proof of Work (PoW), Inscriptions, Made in USA"
EOS,binance-peg-eos,Binance-Peg EOS,EOS,9690861,9690861.0,40569.0,"Smart Contract Platform, BNB Chain Ecosystem, Binance-Peg Tokens"
VISTA,ethervista,Ethervista,VISTA,9684517,9684517.0,618864.0,"Decentralized Exchange (DEX), Decentralized Finance (DeFi), Launchpad, Meme, Ethereum Ecosystem, Binance Alpha Spotlight"
CEEK,ceek,CEEK Smart VR,CEEK,9421832,9584765.0,220459.0,"Entertainment, BNB Chain Ecosystem, Metaverse, Ethereum Ecosystem, DWF Labs Portfolio"
JETTON,jetton,JetTon Games,JETTON,9361758,14681947.0,67852.0,"Gambling (GambleFi), Telegram Apps, TON Ecosystem"
PPC,peercoin,Peercoin,PPC,9173808,9173903.0,67198.0,"Smart Contract Platform, Polygon Ecosystem, Ethereum Ecosystem, Proof of Stake (PoS), Proof of Work (PoW)"
HMT,human-protocol,HUMAN Protocol,HMT,9164450,12092433.0,21211.0,"Artificial Intelligence (AI), Infrastructure, Software as a service, Polygon Ecosystem, Ethereum Ecosystem, Market-Making Solution, AI Framework"
VADER,vaderai-by-virtuals,Vader,VADER,8873308,8873308.0,868355.0,"Artificial Intelligence (AI), Meme, Base Ecosystem, AI Meme, AI Agents, Virtuals Protocol Ecosystem, Binance Alpha Spotlight"
GRAM,gram-2,Gram,GRAM,8659798,8659798.0,38833.0,"TON Ecosystem, Proof of Work (PoW)"
SOVRN,sovrun,Sovrun,SOVRN,8538129,9197299.0,98475.0,"Gaming (GameFi), Metaverse, Ethereum Ecosystem, Animoca Brands Portfolio, Base Ecosystem, DWF Labs Portfolio, On-chain Gaming, Andreessen Horowitz (a16z) Portfolio, Hyperliquid Ecosystem, Delphi Ventures Portfolio, Circle Ventures Portfolio"
SWAP,trustswap,TrustSwap,SWAP,8536547,8536547.0,184949.0,"Decentralized Finance (DeFi), BNB Chain Ecosystem, Avalanche Ecosystem, Launchpad, Polygon Ecosystem, Ethereum Ecosystem, Energi Ecosystem"
CA,ca-htb,Coupon Assets,CA,8288613,121677575.0,5709054.0,"Retail, Ethereum Ecosystem"
PAIN,pain,Pain,PAIN,7835953,15672015.0,126613.0,"Solana Ecosystem, Meme, Solana Meme, 4chan-Themed"
TET,tectum,Tectum,TET,7676883,7758618.0,189091.0,"Smart Contract Platform, Layer 1 (L1), Ethereum Ecosystem, Bitcoin Sidechains, SideChain"
OVR,ovr,Ovr,OVR,7118731,12191100.0,525702.0,"Augmented Reality, NFT, BNB Chain Ecosystem, Metaverse, Polygon Ecosystem, Ethereum Ecosystem, DePIN, Base Ecosystem"
RVF,rocketx,RocketX Exchange,RVF,7035241,7197256.0,7751.34,"Decentralized Exchange (DEX), Decentralized Finance (DeFi), Automated Market Maker (AMM), Ethereum Ecosystem, Poolz Finance Launchpad"
XX,xxcoin,XX Network,XX,6954376,19534997.0,188148.0,"Smart Contract Platform, Layer 1 (L1), Ethereum Ecosystem"
GRAIL,camelot-token,Camelot Token,GRAIL,6757792,25584800.0,46814.0,"Decentralized Exchange (DEX), Arbitrum Ecosystem, Camelot Launchpad"
DEXTF,dextf,Memento,DEXTF,6656194,10114684.0,122643.0,"Decentralized Finance (DeFi), Asset Manager, Avalanche Ecosystem, Ethereum Ecosystem, ZkSync Ecosystem, Real World Assets (RWA)"
LVVA,levva-protocol,Levva Protocol,LVVA,6629689,6791473.0,4080611.0,"Decentralized Finance (DeFi), Analytics, Yield Farming, Yield Aggregator, Ethereum Ecosystem, Yield Optimizer"
ZKL,zklink,zkLink,ZKL,5337129,15147782.0,3497541.0,"Smart Contract Platform, Ethereum Ecosystem, Zero Knowledge (ZK), Layer 3 (L3), zkLink Nova Ecosystem, OKX Ventures Portfolio"
DNX,dynex,Dynex,DNX,5128101,5129143.0,531590.0,"Artificial Intelligence (AI), Smart Contract Platform, Layer 1 (L1), Ethereum Ecosystem, DePIN, Decentralized Science (DeSci), Proof of Work (PoW)"
HAPPY,happycat-2,Happy Cat,HAPPY,5123118,5123118.0,494732.0,"BNB Chain Ecosystem, Solana Ecosystem, Meme, Cat-Themed, Binance Alpha Spotlight"
LCAT,lion-cat,Lion Cat,LCAT,5092064,6486706.0,18417.48,"BNB Chain Ecosystem, Meme, Cat-Themed"
APP,moon-app,RWAX,APP,4952169,7480825.0,148439.0,"Tokenized Real Estate, Tokenized Assets, BNB Chain Ecosystem, Solana Ecosystem, Ethereum Ecosystem, Real World Assets (RWA), Injective Ecosystem, RWA Protocol"
GMM,gamium,Gamium,GMM,4845558,4947995.0,56571.0,"SocialFi, Gaming (GameFi), BNB Chain Ecosystem, Metaverse, DaoMaker Launchpad, Ethereum Ecosystem, Gaming Governance Token, Gaming Utility Token, Governance"
MOEW,moew,MOEW,MOEW,4317300,4317300.0,1402692.0,"Meme, Base Ecosystem, TON Ecosystem, Cat-Themed, Base Meme, TON Meme"
HYDRA,hydra,Hydra,HYDRA,4185213,4639620.0,70886.0,"Smart Contract Platform, Layer 1 (L1)"
IMGN,imgn-labs,IMGN Labs,IMGN,4148490,4148490.0,65459.0,"Artificial Intelligence (AI), Base Ecosystem, AI Applications"
APT,aptos,Aptos,APT,3231234590,5418346337.0,498485713.0,"Smart Contract Platform, Layer 1 (L1), Aptos Ecosystem, FTX Holdings, Coinbase Ventures Portfolio, Multicoin Capital Portfolio, Proof of Stake (PoS), DragonFly Capital Portfolio, Andreessen Horowitz (a16z) Portfolio, YZi Labs (Prev. Binance Labs) Portfolio, GMCI Layer 1 Index, GMCI 30 Index, Circle Ventures Portfolio, GMCI Index, Made in USA"
ICP,internet-computer,Internet Computer,ICP,2676272396,2676272396.0,66798392.0,"Artificial Intelligence (AI), Infrastructure, Smart Contract Platform, Layer 1 (L1), Ethereum Ecosystem, Internet Computer Ecosystem, Base Ecosystem, Alleged SEC Securities, Multicoin Capital Portfolio, Layer 0 (L0), Andreessen Horowitz (a16z) Portfolio, GMCI Layer 1 Index, GMCI 30 Index, Blockchain Capital Portfolio, GMCI Index, Polychain Capital Portfolio, Coinbase 50 Index, Governance"
FTN,fasttoken,Fasttoken,FTN,1936410085,3904255105.0,58735297.0,"Smart Contract Platform, BNB Chain Ecosystem, Layer 1 (L1), Arbitrum Ecosystem, Ethereum Ecosystem, Base Ecosystem, Bahamut Ecosystem"
STX,blockstack,Stacks,STX,1239302685,1239307768.0,28686385.0,"Infrastructure, Smart Contract Platform, Layer 2 (L2), Bitcoin Sidechains, Stacks Ecosystem, SideChain, GMCI Layer 2 Index, GMCI 30 Index, Blockchain Capital Portfolio, GMCI Index, Made in USA, Coinbase 50 Index"
AERO,aerodrome-finance,Aerodrome Finance,AERO,1138838865,2209836694.0,72723032.0,"Decentralized Exchange (DEX), Decentralized Finance (DeFi), Automated Market Maker (AMM), Base Ecosystem, Binance Alpha Spotlight, Made in USA"
SYRUP,syrup,Maple Finance,SYRUP,531825687,571165845.0,28598655.0,"Decentralized Finance (DeFi), Yield Farming, Lending/Borrowing Protocols, Ethereum Ecosystem, Real World Assets (RWA), Base Ecosystem, Binance Alpha Spotlight"
TEL,telcoin,Telcoin,TEL,482203148,520865795.0,1850238.0,"Decentralized Finance (DeFi), Wallets, Polygon Ecosystem, Arbitrum Ecosystem, Ethereum Ecosystem, Payment Solutions, Base Ecosystem, Made in USA"
DEXE,dexe,DeXe,DEXE,399079644,674439150.0,4803402.0,"Artificial Intelligence (AI), Decentralized Finance (DeFi), BNB Chain Ecosystem, Ethereum Ecosystem"
DCR,decred,Decred,DCR,291630933,291668691.0,4484903.0,"Smart Contract Platform, Privacy, Layer 1 (L1), Proof of Stake (PoS), Proof of Work (PoW), Blockchain Capital Portfolio, Made in USA"
MEW,cat-in-a-dogs-world,cat in a dogs world,MEW,282091957,282091957.0,46292627.0,"Solana Ecosystem, Meme, Dog-Themed, Solana Meme, Cat-Themed"
DORA,dora-2,DORA,DORA,280906224,280906224.0,6633471.0,"BNB Chain Ecosystem, Meme, Binance Alpha Spotlight, Chinese Meme"
KSM,kusama,Kusama,KSM,271976095,271986204.0,9970055.0,"Smart Contract Platform, Polkadot Ecosystem, Proof of Stake (PoS), Pantera Capital Portfolio, Made in USA, Coinbase 50 Index, Hydration Ecosystem"
MINA,mina-protocol,Mina Protocol,MINA,245522361,245522361.0,11267869.0,"Smart Contract Platform, Layer 1 (L1), Zero Knowledge (ZK), FTX Holdings, Paradigm Portfolio, Coinbase Ventures Portfolio, Multicoin Capital Portfolio, Proof of Stake (PoS), Pantera Capital Portfolio, Circle Ventures Portfolio, Privacy Blockchain, Polychain Capital Portfolio, Made in USA, Coinbase 50 Index"
ZIL,zilliqa,Zilliqa,ZIL,227020686,254084674.0,15021153.0,"Smart Contract Platform, BNB Chain Ecosystem, GMCI Layer 1 Index, GMCI Index, Made in China"
YFI,yearn-finance,yearn.finance,YFI,190488204,206474537.0,16705103.0,"Decentralized Finance (DeFi), Yield Farming, Yield Aggregator, Yearn Ecosystem, Avalanche Ecosystem, Polygon Ecosystem, Near Protocol Ecosystem, Gnosis Chain Ecosystem, Fantom Ecosystem, Harmony Ecosystem, Arbitrum Ecosystem, Ethereum Ecosystem, Optimism Ecosystem, Base Ecosystem, Index Coop Defi Index, Alameda Research Portfolio, Energi Ecosystem, Sora Ecosystem, Huobi ECO Chain Ecosystem, Blockchain Capital Portfolio, Governance"
KMNO,kamino,Kamino,KMNO,180557146,652506080.0,52294009.0,"Decentralized Finance (DeFi), Lending/Borrowing Protocols, Solana Ecosystem, Binance Alpha Spotlight"
EUL,euler,Euler,EUL,178056235,259027713.0,5695582.0,"Lending/Borrowing Protocols, Avalanche Ecosystem, Arbitrum Ecosystem, Ethereum Ecosystem, Base Ecosystem, Paradigm Portfolio, Coinbase Ventures Portfolio, Unichain Ecosystem"
YGG,yield-guild-games,Yield Guild Games,YGG,128835123,216020930.0,440308272.0,"Gaming (GameFi), NFT, BNB Chain Ecosystem, Metaverse, Collectibles, Polygon Ecosystem, Play To Earn, Harmony Ecosystem, Guild and Scholarship, Ethereum Ecosystem, Animoca Brands Portfolio, Base Ecosystem, DWF Labs Portfolio, Ronin Ecosystem, Gaming Governance Token, Andreessen Horowitz (a16z) Portfolio, Delphi Ventures Portfolio, Abstract Ecosystem"
PEOPLE,constitutiondao,ConstitutionDAO,PEOPLE,110028722,110028722.0,38871530.0,"Meme, Ethereum Ecosystem, PolitiFi"
HIVE,hive,Hive,HIVE,102853789,,2149662.0,"Smart Contract Platform, SocialFi, Layer 1 (L1), Gaming Blockchains"
ACH,alchemy-pay,Alchemy Pay,ACH,101731480,205780415.0,26175690.0,"BNB Chain Ecosystem, Ethereum Ecosystem, Payment Solutions, DWF Labs Portfolio"
VVV,venice-token,Venice Token,VVV,100596422,208577260.0,2723382.0,"Artificial Intelligence (AI), Base Ecosystem, AI Agents, AI Applications, Made in USA"
SWFTC,swftcoin,SWFTCOIN,SWFTC,95841846,95841846.0,1434052.0,"Exchange-based Tokens, NFT, BNB Chain Ecosystem, Ethereum Ecosystem"
CARV,carv,CARV,CARV,95247546,322643958.0,23948707.0,"Artificial Intelligence (AI), Infrastructure, Gaming (GameFi), NFT, BNB Chain Ecosystem, Solana Ecosystem, Arbitrum Ecosystem, Impossible Finance Launchpad, Ethereum Ecosystem, Animoca Brands Portfolio, Base Ecosystem"
CYBER,cyberconnect,CYBER,CYBER,91001904,186181216.0,19637697.0,"Artificial Intelligence (AI), Smart Contract Platform, SocialFi, NFT, BNB Chain Ecosystem, Binance Launchpool, Ethereum Ecosystem, Decentralized Identifier (DID), Optimism Ecosystem, Layer 2 (L2), Animoca Brands Portfolio, Multicoin Capital Portfolio, YZi Labs (Prev. Binance Labs) Portfolio, Delphi Ventures Portfolio, Cyber Ecosystem, Optimism Superchain Ecosystem, AI Applications, Governance"
SGB,songbird,Songbird,SGB,87666352,103754635.0,242587.0,Smart Contract Platform
MVL,mass-vehicle-ledger,MVL,MVL,80679259,82458755.0,559098.0,"Internet of Things (IOT), BNB Chain Ecosystem, Ethereum Ecosystem, DePIN, DWF Labs Portfolio"
USTC,terrausd,TerraClassicUSD,USTC,76463878,83317673.0,6050394.0,"Stablecoins, USD Stablecoin, Seigniorage, Alleged SEC Securities, Osmosis Ecosystem, DeFiance Capital Portfolio, Terra Classic Ecosystem, YZi Labs (Prev. Binance Labs) Portfolio, Delphi Ventures Portfolio, Galaxy Digital Portfolio, Fiat-backed Stablecoin"
EWT,energy-web-token,Energy Web,EWT,72014316,82092862.0,437877.0,"Energy, Polkadot Ecosystem, Gnosis Chain Ecosystem, Regenerative Finance (ReFi), Real World Assets (RWA), Blockchain Capital Portfolio, Hydration Ecosystem"
WHITE,whiteheart,Whiteheart,WHITE,71450397,71450397.0,2388.94,"Decentralized Finance (DeFi), Derivatives, Ethereum Ecosystem"
SCR,scroll,Scroll,SCR,66491384,349954653.0,11346364.0,"Smart Contract Platform, Binance Launchpool, Layer 2 (L2), Scroll Ecosystem"
ALI,alethea-artificial-liquid-intelligence-token,Artificial Liquid Intelligence,ALI,62363928,67512850.0,2551982.0,"Artificial Intelligence (AI), NFT, Metaverse, Solana Ecosystem, Polygon Ecosystem, Ethereum Ecosystem, Cronos Ecosystem, Base Ecosystem, Multicoin Capital Portfolio, AI Agents, Alameda Research Portfolio, DeFiance Capital Portfolio, YZi Labs (Prev. Binance Labs) Portfolio, Governance"
AGLD,adventure-gold,Adventure Gold,AGLD,60832910,65187650.0,15359120.0,"Ethereum Ecosystem, DWF Labs Portfolio"
ZRC,zircuit,Zircuit,ZRC,60481225,275550499.0,13089577.0,"Smart Contract Platform, BNB Chain Ecosystem, Ethereum Ecosystem, Layer 2 (L2), Zero Knowledge (ZK), Restaking, Zircuit Ecosystem"
WNXM,wrapped-nxm,Wrapped NXM,WNXM,60199532,60199532.0,873798.0,"Crypto-Backed Tokens, Decentralized Finance (DeFi), Insurance, Wrapped-Tokens, Ethereum Ecosystem, Blockchain Capital Portfolio"
CCD,concordium,Concordium,CCD,58988926,71323836.0,406921.0,"Smart Contract Platform, Layer 1 (L1), Decentralized Identifier (DID), Zero Knowledge (ZK)"
HFT,hashflow,Hashflow,HFT,55862091,92648268.0,12791374.0,"Decentralized Exchange (DEX), Exchange-based Tokens, Decentralized Finance (DeFi), BNB Chain Ecosystem, Binance Launchpool, MEV Protection, Ethereum Ecosystem, Coinbase Ventures Portfolio, Alameda Research Portfolio, DragonFly Capital Portfolio, Galaxy Digital Portfolio"
AVAIL,avail,Avail,AVAIL,47174921,143827452.0,9326598.0,"Infrastructure, Smart Contract Platform, BNB Chain Ecosystem, Ethereum Ecosystem, Data Availability, Modular Blockchain, Binance Alpha Spotlight"
UNP,unipoly,Unipoly,UNP,47046901,168487987.0,519429.0,"Gaming (GameFi), Ethereum Ecosystem, Skale Ecosystem"
