Input Token,CoinGecko ID,Name,Symbol,Market Cap,FDV,24H Volume,Categories
SUI,sui,Sui,SUI,9334910756,25746201338.0,858163869.0,"Smart Contract Platform, Binance Launchpool, Layer 1 (L1), Sui Ecosystem, Coinbase Ventures Portfolio, Proof of Stake (PoS), Andreessen Horowitz (a16z) Portfolio, YZi Labs (Prev. Binance Labs) Portfolio, GMCI Layer 1 Index, Circle Ventures Portfolio, GMCI Index, Made in USA"
AVAX,avalanche-2,Avalanche,AVAX,8684554460,9363365572.0,561459441.0,"Smart Contract Platform, Layer 1 (L1), Avalanche Ecosystem, Proof of Stake (PoS), DragonFly Capital Portfolio, DeFiance Capital Portfolio, Andreessen Horowitz (a16z) Portfolio, GMCI Layer 1 Index, GMCI 30 Index, Galaxy Digital Portfolio, GMCI Index, Polychain Capital Portfolio, World Liberty Financial Portfolio, Made in USA, Coinbase 50 Index"
TAO,bittensor,Bittensor,TAO,4097814465,8966312526.0,332458371.0,"Artificial Intelligence (AI), Smart Contract Platform, Layer 1 (L1), DePIN, Bittensor Ecosystem, Polychain Capital Portfolio"
ENA,ethena,Ethena,ENA,3243847460,6799330921.0,431948588.0,"Decentralized Finance (DeFi), Binance Launchpool, Avalanche Ecosystem, Arbitrum Ecosystem, Ethereum Ecosystem, Metis Ecosystem, Optimism Ecosystem, ZkSync Ecosystem, Mantle Ecosystem, Base Ecosystem, TON Ecosystem, Manta Network Ecosystem, Scroll Ecosystem, Kava Ecosystem, Blast Ecosystem, Stablecoin Issuer, Mode Ecosystem, DragonFly Capital Portfolio, YZi Labs (Prev. Binance Labs) Portfolio, Fraxtal Ecosystem, Delphi Ventures Portfolio, OKX Ventures Portfolio, Zircuit Ecosystem, Morph L2 Ecosystem, World Liberty Financial Portfolio, Swellchain Ecosystem, Governance"
ONDO,ondo-finance,Ondo,ONDO,2378407946,7528733747.0,116913817.0,"Decentralized Finance (DeFi), Ethereum Ecosystem, Real World Assets (RWA), Coinbase Ventures Portfolio, Pantera Capital Portfolio, GMCI DeFi Index, RWA Protocol, GMCI Index, World Liberty Financial Portfolio, Binance Alpha Spotlight, Made in USA"
ALGO,algorand,Algorand,ALGO,1636420501,1636428548.0,71313631.0,"Smart Contract Platform, Layer 1 (L1), Algorand Ecosystem, Real World Assets (RWA), Alleged SEC Securities, DWF Labs Portfolio, Multicoin Capital Portfolio, Proof of Stake (PoS), GMCI Layer 1 Index, GMCI Index, Made in USA, Coinbase 50 Index"
ATOM,cosmos,Cosmos Hub,ATOM,1553737205,1553760226.0,80075782.0,"Smart Contract Platform, BNB Chain Ecosystem, Cosmos Ecosystem, Terra Ecosystem, Canto Ecosystem, Alleged SEC Securities, Osmosis Ecosystem, Paradigm Portfolio, Proof of Stake (PoS), Kava Ecosystem, Layer 0 (L0), DragonFly Capital Portfolio, Pantera Capital Portfolio, Archway Ecosystem, Evmos Ecosystem, GMCI 30 Index, GMCI Index, Outlier Ventures Portfolio, Polychain Capital Portfolio, Mantra Ecosystem, Coinbase 50 Index, Governance"
NEXO,nexo,NEXO,NEXO,1172495032,1172495032.0,6142614.0,"Exchange-based Tokens, Centralized Exchange (CEX) Token, Polygon Ecosystem, Fantom Ecosystem, Ethereum Ecosystem, Alleged SEC Securities, Energi Ecosystem, Sora Ecosystem"
FDUSD,first-digital-usd,First Digital USD,FDUSD,1011028791,1011028791.0,5810311351.0,"Stablecoins, USD Stablecoin, BNB Chain Ecosystem, Arbitrum Ecosystem, Ethereum Ecosystem, Sui Ecosystem, TON Ecosystem, Fiat-backed Stablecoin"
WBTC,arbitrum-bridged-wbtc-arbitrum-one,Arbitrum Bridged WBTC (Arbitrum One),WBTC,894275750,894275750.0,163576577.0,"Arbitrum Ecosystem, Bridged WBTC, Bridged-Tokens"
INJ,injective-protocol,Injective,INJ,853948420,873808154.0,73119011.0,"Smart Contract Platform, Decentralized Finance (DeFi), BNB Chain Ecosystem, Cosmos Ecosystem, Layer 1 (L1), Terra Ecosystem, Ethereum Ecosystem, Real World Assets (RWA), Binance Launchpad, Osmosis Ecosystem, Proof of Stake (PoS), Pantera Capital Portfolio, Secret Ecosystem, YZi Labs (Prev. Binance Labs) Portfolio, GMCI Layer 1 Index, GMCI Index, Made in USA, Coinbase 50 Index"
DOGWIFHAT,dogwifcoin,dogwifhat,WIF,542227746,542227746.0,176038643.0,"Solana Ecosystem, Meme, Dog-Themed, Solana Meme, GMCI Meme Index, GMCI Index, Unichain Ecosystem"
MANA,decentraland,Decentraland,MANA,461383146,527260410.0,26642075.0,"Entertainment, Gaming (GameFi), NFT, Metaverse, Polygon Ecosystem, Play To Earn, Ethereum Ecosystem, Animoca Brands Portfolio, Alleged SEC Securities, Simulation Games, Coinbase 50 Index"
NFT,apenft,APENFT,NFT,405800004,409851143.0,4930666.0,"NFT, BNB Chain Ecosystem, Ethereum Ecosystem, Tron Ecosystem"
RSR,reserve-rights-token,Reserve Rights,RSR,359468926,593109422.0,24269459.0,"Decentralized Finance (DeFi), Arbitrum Ecosystem, Ethereum Ecosystem, Real World Assets (RWA), Base Ecosystem, Coinbase Ventures Portfolio, Energi Ecosystem, Made in USA"
CHZ,chiliz,Chiliz,CHZ,333994236,333994236.0,23290319.0,"Smart Contract Platform, Sports, NFT, Layer 1 (L1), Ethereum Ecosystem, Alleged SEC Securities, Chiliz Ecosystem, YZi Labs (Prev. Binance Labs) Portfolio, Coinbase 50 Index"
MERL,merlin-chain,Merlin Chain,MERL,331115507,710287905.0,48744807.0,"Smart Contract Platform, BNB Chain Ecosystem, Ethereum Ecosystem, Layer 2 (L2), Merlin Chain Ecosystem, Bitcoin Sidechains, SideChain, OKX Ventures Portfolio, Made in China"
AR,arweave,Arweave,AR,264366651,264366651.0,29940435.0,"Artificial Intelligence (AI), Smart Contract Platform, Storage, Layer 1 (L1), DePIN, Coinbase Ventures Portfolio, Multicoin Capital Portfolio, Andreessen Horowitz (a16z) Portfolio, Blockchain Capital Portfolio"
BERA,berachain-bera,Berachain,BERA,255117489,1010718088.0,90588428.0,"Smart Contract Platform, Decentralized Finance (DeFi), Layer 1 (L1), Berachain Ecosystem, Binance HODLer Airdrops, Outlier Ventures Portfolio, Polychain Capital Portfolio"
LPT,livepeer,Livepeer,LPT,235840597,235840597.0,11801621.0,"Artificial Intelligence (AI), Harmony Ecosystem, Arbitrum Ecosystem, Ethereum Ecosystem, DePIN, Coinbase Ventures Portfolio, Multicoin Capital Portfolio, Pantera Capital Portfolio, GMCI DePIN Index, GMCI Index, Coinbase 50 Index"
VELO,velo,Velo,VELO,162215308,221655835.0,19376330.0,"Decentralized Finance (DeFi), BNB Chain Ecosystem, Real World Assets (RWA), DWF Labs Portfolio, Stellar Ecosystem, Binance Alpha Spotlight"
ALEO,aleo,ALEO,ALEO,159435789,500044363.0,6590503.0,"Smart Contract Platform, BNB Chain Ecosystem, Layer 1 (L1), Zero Knowledge (ZK), Andreessen Horowitz (a16z) Portfolio, Privacy Blockchain, Made in USA"
RVN,ravencoin,Ravencoin,RVN,156239203,156246406.0,5546039.0,"Smart Contract Platform, Real World Assets (RWA), Proof of Work (PoW), Made in USA"
POPCAT,popcat,Popcat,POPCAT,153757951,153757951.0,24023990.0,"Solana Ecosystem, Meme, Solana Meme, Cat-Themed, Murad Picks"
DBR,debridge,deBridge,DBR,103992042,295905752.0,9489389.0,"Solana Ecosystem, Bridge Governance Tokens, Cross-chain Communication, Intent, Governance"
WELL,moonwell-artemis,Moonwell,WELL,84691842,94733954.0,3598952.0,"Decentralized Finance (DeFi), Lending/Borrowing Protocols, Moonbeam Ecosystem, Base Ecosystem, Coinbase Ventures Portfolio, Made in USA"
MELANIA,melania-meme,Melania Meme,MELANIA,79861244,101411182.0,5951372.0,"Solana Ecosystem, Meme, Solana Meme, PolitiFi, Made in USA, Trump-Affiliated"
KDA,kadena,Kadena,KDA,74390897,74416017.0,6223255.0,"Smart Contract Platform, Layer 1 (L1), Kadena Ecosystem, Multicoin Capital Portfolio, Proof of Work (PoW), Made in USA"
SNT,status,Status,SNT,73411734,126135429.0,6146747.0,"Software as a service, Ethereum Ecosystem, Energi Ecosystem"
BNT,bancor,Bancor Network,BNT,67557229,67556929.0,430411.0,"Decentralized Exchange (DEX), Exchange-based Tokens, Decentralized Finance (DeFi), Automated Market Maker (AMM), Ethereum Ecosystem, DeFiance Capital Portfolio, Energi Ecosystem, Governance"
VRA,verasity,Verasity,VRA,64280574,70559778.0,17982369.0,"Entertainment, BNB Chain Ecosystem, Wallets, Ethereum Ecosystem, Binance Alpha Spotlight"
CHR,chromaway,Chromia,CHR,64043518,64043518.0,28435047.0,"Artificial Intelligence (AI), Smart Contract Platform, Gaming (GameFi), NFT, BNB Chain Ecosystem, Layer 1 (L1), Ethereum Ecosystem, Real World Assets (RWA), Modular Blockchain, Chromia Ecosystem, RWA Protocol"
LAYER,solayer,Solayer,LAYER,62110115,295762455.0,15827069.0,"Decentralized Finance (DeFi), Solana Ecosystem, LSDFi, Restaking, Stablecoin Issuer, YZi Labs (Prev. Binance Labs) Portfolio, Binance HODLer Airdrops, Polychain Capital Portfolio"
AIXBT,aixbt,aixbt,AIXBT,59710696,60031358.0,16881617.0,"Artificial Intelligence (AI), Solana Ecosystem, Meme, Ethereum Ecosystem, Base Ecosystem, AI Meme, AI Agents, Virtuals Protocol Ecosystem, Binance Alpha Spotlight, DeFAI"
MYTH,mythos,Mythos,MYTH,59286501,74441575.0,1533382.0,"Gaming (GameFi), Polkadot Ecosystem, NFT, Avalanche Ecosystem, Ethereum Ecosystem, Base Ecosystem, Gaming Blockchains, Andreessen Horowitz (a16z) Portfolio, YZi Labs (Prev. Binance Labs) Portfolio, Galaxy Digital Portfolio, Made in USA"
COREUM,coreum,Coreum,COREUM,58511493,58511493.0,307616.0,"Smart Contract Platform, Layer 1 (L1), Osmosis Ecosystem, XRP Ledger Ecosystem"
IQ,everipedia,IQ,IQ,56599224,56599224.0,888247.0,"Artificial Intelligence (AI), Big Data, Media, BNB Chain Ecosystem, Polygon Ecosystem, Ethereum Ecosystem, AI Agents, GMCI DePIN Index, Galaxy Digital Portfolio, GMCI Index, AI Agent Launchpad, AI Framework, DeFAI"
DOVU,dovu-2,DOVU,DOVU,55999355,56053914.0,107855.0,"Infrastructure, Ethereum Ecosystem, Regenerative Finance (ReFi), Real World Assets (RWA), Hedera Ecosystem"
ERG,ergo,Ergo,ERG,54921265,65305290.0,255112.0,"Smart Contract Platform, Layer 1 (L1), Proof of Work (PoW), Privacy Blockchain"
PYTHIA,pythia,PYTHIA,PYTHIA,54237724,54237724.0,1247496.0,"Solana Ecosystem, Meme, AI Meme, Pump.fun Ecosystem, Desci Meme, Binance Alpha Spotlight"
ELG,escoin-token,Escoin,ELG,53486147,72588869.0,478565.0,"BNB Chain Ecosystem, Polygon Ecosystem, Ethereum Ecosystem"
DKA,dkargo,dKargo,DKA,51976141,51976141.0,1681925.0,Ethereum Ecosystem
MAGIC,magic,Treasure,MAGIC,47073843,51714703.0,16221634.0,"Artificial Intelligence (AI), Gaming (GameFi), NFT, Metaverse, Arbitrum Ecosystem, Ethereum Ecosystem, Layer 2 (L2), Zero Knowledge (ZK), Gaming Blockchains, Gaming Governance Token, Gaming Utility Token, AI Agents, AI Agent Launchpad"
CAW,a-hunters-dream,A Hunters Dream,CAW,42899430,44920869.0,435404.0,"SocialFi, Ethereum Ecosystem"
KERNEL,kernel-2,KernelDAO,KERNEL,42520235,179592692.0,16949818.0,"Decentralized Finance (DeFi), BNB Chain Ecosystem, Arbitrum Ecosystem, Ethereum Ecosystem, Restaking, Liquid Restaking Governance Tokens"
DEVVE,devve,DevvE,DEVVE,36760794,50478291.0,322995.0,"Layer 1 (L1), Ethereum Ecosystem"
CELR,celer-network,Celer Network,CELR,32740364,57994200.0,2282977.0,"Arbitrum Ecosystem, Ethereum Ecosystem, Bridge Governance Tokens, Binance Launchpad, Cross-chain Communication, Pantera Capital Portfolio, Energi Ecosystem, YZi Labs (Prev. Binance Labs) Portfolio"
EVER,everscale,Everscale,EVER,32498049,34658317.0,195106.0,"Infrastructure, Layer 1 (L1), Ethereum Ecosystem"
NTRN,neutron-3,Neutron,NTRN,32225446,52736339.0,1836458.0,"Binance Launchpool, Osmosis Ecosystem, Delphi Ventures Portfolio"
MLN,melon,Enzyme,MLN,31862480,31862480.0,205389328.0,"Decentralized Finance (DeFi), Asset Manager, Polygon Ecosystem, Arbitrum Ecosystem, Ethereum Ecosystem, Real World Assets (RWA), DeFiance Capital Portfolio"
MAV,maverick-protocol,Maverick Protocol,MAV,30547657,81028793.0,2690914.0,"BNB Chain Ecosystem, Binance Launchpool, Ethereum Ecosystem, ZkSync Ecosystem, Base Ecosystem, Coinbase Ventures Portfolio, Pantera Capital Portfolio, YZi Labs (Prev. Binance Labs) Portfolio, Circle Ventures Portfolio"
ORAI,oraichain-token,Oraichain,ORAI,30476966,30830397.0,1360593.0,"Artificial Intelligence (AI), Big Data, Business Services, Smart Contract Platform, Decentralized Finance (DeFi), Oracle, BNB Chain Ecosystem, Solana Ecosystem, Layer 1 (L1), Ethereum Ecosystem, DWF Labs Portfolio, Osmosis Ecosystem, AI Agents"
IXS,ix-swap,IXS,IXS,30417991,30417991.0,211286.0,"Polygon Ecosystem, Ethereum Ecosystem, Real World Assets (RWA), Base Ecosystem, DWF Labs Portfolio, Poolz Finance Launchpad, Coinbase Ventures Portfolio"
ZKJ,polyhedra-network,Polyhedra Network,ZKJ,28224347,73114808.0,4040952.0,"Smart Contract Platform, BNB Chain Ecosystem, Ethereum Ecosystem, Zero Knowledge (ZK), Animoca Brands Portfolio, YZi Labs (Prev. Binance Labs) Portfolio, OKX Ventures Portfolio, Binance Alpha Spotlight"
SYS,syscoin,Syscoin,SYS,25228356,25228356.0,1648063.0,"Smart Contract Platform, Masternodes, Layer 1 (L1), Decentralized Identifier (DID), Layer 2 (L2), Zero Knowledge (ZK), Rollux Ecosystem, DWF Labs Portfolio, Data Availability, Modular Blockchain, Rollup, Proof of Work (PoW)"
ROAM,roam-token,ROAM Token,ROAM,24685211,79856819.0,26094825.0,"Retail, BNB Chain Ecosystem, Solana Ecosystem, DePIN"
XPLA,xpla,XPLA,XPLA,21728837,52206104.0,20480.0,"Smart Contract Platform, Gaming (GameFi), NFT, Wallets, Osmosis Ecosystem, Gaming Blockchains, Gaming Platform, Appchains"
GRIFFAIN,griffain,GRIFFAIN,GRIFFAIN,20833140,20833140.0,3409247.0,"Artificial Intelligence (AI), Solana Ecosystem, Meme, AI Meme, Pump.fun Ecosystem, AI Agent Launchpad, Binance Alpha Spotlight, DeFAI"
DF,dforce-token,dForce,DF,20090184,20090184.0,2365313.0,"Decentralized Finance (DeFi), BNB Chain Ecosystem, Lending/Borrowing Protocols, Arbitrum Ecosystem, Ethereum Ecosystem, Multicoin Capital Portfolio, Stablecoin Issuer, Energi Ecosystem, Made in China"
HEI,heima,Heima,HEI,18744566,23487167.0,3319369.0,"BNB Chain Ecosystem, Binance Launchpool, Ethereum Ecosystem, YZi Labs (Prev. Binance Labs) Portfolio"
OL,open-loot,OPENLOOT,OL,18108006,116034833.0,809912.0,"Gaming (GameFi), NFT, BNB Chain Ecosystem, Ethereum Ecosystem, Gaming Marketplace"
OMG,omisego,OMG Network,OMG,17415199,17415199.0,1183190.0,"Smart Contract Platform, Ethereum Ecosystem, Alleged SEC Securities, Pantera Capital Portfolio, Boba Network Ecosystem"
AA,arai,Arai,AA,17403284,120437952.0,19761256.0,"Artificial Intelligence (AI), Gaming (GameFi), BNB Chain Ecosystem, Animoca Brands Portfolio, Sequoia Capital Portfolio, Binance Alpha Spotlight"
HTR,hathor,Hathor,HTR,15033308,26169438.0,578357.0,"Infrastructure, Smart Contract Platform, Layer 1 (L1), Real World Assets (RWA), Proof of Work (PoW), Directed Acyclic Graph (DAG)"
CATI,catizen,Catizen,CATI,14141808,68649554.0,9774016.0,"Gaming (GameFi), Play To Earn, Telegram Apps, TON Ecosystem, Tap to Earn"
VICE,vice-2,VICE,VICE,13945845,17759007.0,120661.0,"Gaming (GameFi), Ethereum Ecosystem"
SYNTH,synth-2,Synth,SN50,13504046,13504046.0,3883282.0,"Artificial Intelligence (AI), Bittensor Ecosystem, Bittensor Subnets"
PSP,paraswap,ParaSwap,PSP,12143540,14832021.0,4542.0,"Decentralized Exchange (DEX), Exchange-based Tokens, Decentralized Finance (DeFi), BNB Chain Ecosystem, Polygon Ecosystem, Ethereum Ecosystem, Optimism Ecosystem, Alameda Research Portfolio, Intent, Blockchain Capital Portfolio, Dex Aggregator"
BLZ,bluzelle,Bluzelle,BLZ,11724963,12450462.0,363204.0,"Smart Contract Platform, BNB Chain Ecosystem, Ethereum Ecosystem, DePIN, Decentralized Science (DeSci), Osmosis Ecosystem, Energi Ecosystem, GMCI DePIN Index, GMCI Index"
GEL,gelato,Gelato,GEL,11075104,17939130.0,171685.0,"Smart Contract Platform, Polygon Ecosystem, Fantom Ecosystem, Ethereum Ecosystem, Layer 2 (L2), Modular Blockchain, Rollups-as-a-Service (RaaS), DragonFly Capital Portfolio, Galaxy Digital Portfolio, Binance Alpha Spotlight"
FIO,fio-protocol,FIO Protocol,FIO,10508341,12765524.0,4043675.0,"Smart Contract Platform, Layer 1 (L1), YZi Labs (Prev. Binance Labs) Portfolio"
ATR,artrade,Artrade,ATR,10006352,10037251.0,790486.0,"NFT, Solana Ecosystem, NFT Marketplace, Real World Assets (RWA), Art"
PHNIX,phnix,PHNIX,PHNIX,9797911,10877334.0,329813.0,"Meme, XRP Ledger Ecosystem"
VOXEL,voxies,Voxies,VOXEL,9639805,11888152.0,4503399.0,"Gaming (GameFi), NFT, Polygon Ecosystem, Binance Launchpad, RPG, Gaming Utility Token, Strategy Games, YZi Labs (Prev. Binance Labs) Portfolio"
REX,etherex,Etherex,REX,8953848,84798568.0,304239.0,"Decentralized Exchange (DEX), Exchange-based Tokens, Decentralized Finance (DeFi), Linea Ecosystem"
BOSON,boson-protocol,Boson,BOSON,8881260,12275427.0,1886792.0,"NFT, Metaverse, Polygon Ecosystem, Ethereum Ecosystem, Real World Assets (RWA), Animoca Brands Portfolio, Base Ecosystem, RWA Protocol, E-commerce, Outlier Ventures Portfolio"
EAI,eagle-ai,Eagle AI,EAI,8815495,9841504.0,331838.0,"Analytics, Base Ecosystem"
HANDY,handy,Handy,HANDY,8747873,16771319.0,332.95,Ethereum Ecosystem
MANEKI,maneki,MANEKI,MANEKI,8664644,8694217.0,1797567.0,"Solana Ecosystem, Meme, Solana Meme, Cat-Themed"
BXX,baanx,Baanx,BXX,8466141,8466141.0,6914.47,Ethereum Ecosystem
HIFI,hifi-finance,Hifi Finance,HIFI,8296669,9050283.0,623478.0,"Tokenized Real Estate, Decentralized Finance (DeFi), Ethereum Ecosystem, Real World Assets (RWA), Made in USA, Governance"
RX,reachx-mainnet,ReachX Mainnet,RX,7735479,15470958.0,26.71,"SocialFi, Meme, Base Ecosystem"
SNSY,sensay,Sensay,SNSY,7634364,12600343.0,446195.0,"Artificial Intelligence (AI), Arbitrum Ecosystem, Ethereum Ecosystem, Base Ecosystem, AI Agents"
HAI,hackenai,Hacken,HAI,6640423,7968509.0,272832.0,"Business Services, BNB Chain Ecosystem, Ethereum Ecosystem, Base Ecosystem, Cybersecurity, VeChain Ecosystem"
BCB,bitcoin-bit,Bitcoin Bit,BCB,6437961,31500761.0,4.5,"Ethereum Ecosystem, Proof of Stake (PoS)"
NTX,nunet,NuNet,NTX,6033035,8039972.0,53907.0,"BNB Chain Ecosystem, Cardano Ecosystem, Ethereum Ecosystem, DePIN"
PUSS,puss,Puss,PUSS,5673244,5673244.0,745522.0,"Meme, Tron Ecosystem, TRON Meme"
LOKA,league-of-kingdoms,League of Kingdoms,LOKA,5355953,58754104.0,106064.0,"Gaming (GameFi), NFT, Metaverse, Ethereum Ecosystem, Binance Launchpad, Gaming Governance Token, Gaming Utility Token, Strategy Games, Andreessen Horowitz (a16z) Portfolio, YZi Labs (Prev. Binance Labs) Portfolio, Sequoia Capital Portfolio"
SWELL,layerzero-bridged-swell,Layerzero Bridged Swell,SWELL,5230361,5229271.0,6559.22,"Liquid Staking Governance Tokens, Restaking, Liquid Restaking Governance Tokens, Bridged-Tokens, Swellchain Ecosystem"
NRS,nereus-token,Nereus,NRS,5203450,133397313.0,160175.0,"Decentralized Finance (DeFi), Derivatives, Polygon Ecosystem"
NYA,nya,Nya,NYA,4543085,4550897.0,8247.88,"BNB Chain Ecosystem, Avalanche Ecosystem, Polygon Ecosystem, Meme, Arbitrum Ecosystem, Ethereum Ecosystem, Optimism Ecosystem, Base Ecosystem, Cat-Themed"
PROS,prospective,Prospective,PROS,4374986,39062372.0,39976.0,"NFT, BNB Chain Ecosystem, Polygon Ecosystem, Ethereum Ecosystem, Tron Ecosystem, BitTorrent Ecosystem"
DOBO,dogebonk,DogeBonk,DOBO,4230294,7780099.0,418.35,"Analytics, BNB Chain Ecosystem, Meme, Dog-Themed"
REF,ref-finance,Ref Finance,REF,4175865,10699945.0,1421.03,"Near Protocol Ecosystem, Alameda Research Portfolio, DragonFly Capital Portfolio, OKX Ventures Portfolio"
BDC,billion-dollar-cat-runes,Billy (Bitcoin),BDC,4003171,4003171.0,21766.0,"Solana Ecosystem, Meme, Cat-Themed, Bitcoin Ecosystem, Runes, Bitcoin Meme"
HTM,hatom,Hatom,HTM,3921759,5776182.0,21760.0,"Decentralized Finance (DeFi), Lending/Borrowing Protocols, Meme, MultiversX Ecosystem, Liquid Staking"
DOLZ,dolz-io,DOLZ.io,DOLZ,3904897,3904897.0,2411.26,"Artificial Intelligence (AI), Gaming (GameFi), NFT, Polygon Ecosystem, Ethereum Ecosystem, Base Ecosystem, Card Games, AI Agents"
BAKE,bakerytoken,BakerySwap,BAKE,3786976,3800950.0,385037.0,"NFT, BNB Chain Ecosystem, Harmony Ecosystem"
ZYPTO,french-connection-finance,Zypto Token,ZYPTO,3607109,3607109.0,41144.0,"Decentralized Finance (DeFi), Wallets, Ethereum Ecosystem, Payment Solutions"
DEFX,definity,DeFinity,DEFX,3518161,3941896.0,1495.3,"BNB Chain Ecosystem, Ethereum Ecosystem"
MNT,mantle,Mantle,MNT,5883629140,11248934165.0,263596586.0,"Smart Contract Platform, Ethereum Ecosystem, Layer 2 (L2), Mantle Ecosystem, DWF Labs Portfolio, DragonFly Capital Portfolio, GMCI Layer 2 Index, GMCI 30 Index, GMCI Index, World Liberty Financial Portfolio, Made in China, Neobank"
XMR,monero,Monero,XMR,5682165512,5682165512.0,164097942.0,"Smart Contract Platform, Privacy, Layer 1 (L1), Proof of Work (PoW), Galaxy Digital Portfolio"
MORPHO,morpho,Morpho,MORPHO,999878949,1912312519.0,1378837341.0,"Decentralized Finance (DeFi), Lending/Borrowing Protocols, Arbitrum Ecosystem, Ethereum Ecosystem, Base Ecosystem, Coinbase Ventures Portfolio, Pantera Capital Portfolio, Morpho Ecosystem, Binance Alpha Spotlight, Katana Ecosystem"
SPX,spx6900,SPX6900,SPX,961860009,961860009.0,38612334.0,"Solana Ecosystem, Avalanche Ecosystem, Meme, Ethereum Ecosystem, Base Ecosystem, Bridged-Tokens, Murad Picks, Stock market-themed, 4chan-Themed"
STRK,starknet,Starknet,STRK,558678647,1293664233.0,121955984.0,"Infrastructure, Smart Contract Platform, Ethereum Ecosystem, Layer 2 (L2), Zero Knowledge (ZK), Starknet Ecosystem, Paradigm Portfolio, Coinbase Ventures Portfolio, Rollup, Multicoin Capital Portfolio, Alameda Research Portfolio, Pantera Capital Portfolio, GMCI Layer 2 Index, Consensys Portfolio, Sequoia Capital Portfolio, GMCI Index, Polychain Capital Portfolio"
VIRTUAL,virtual-protocol,Virtuals Protocol,VIRTUAL,528444368,805831077.0,86638625.0,"Artificial Intelligence (AI), Solana Ecosystem, Launchpad, Ethereum Ecosystem, Base Ecosystem, AI Agents, Virtuals Protocol Ecosystem, AI Agent Launchpad, Binance Alpha Spotlight"
SAND,the-sandbox,The Sandbox,SAND,522807274,641256517.0,29004950.0,"Gaming (GameFi), NFT, Metaverse, Polygon Ecosystem, Play To Earn, Harmony Ecosystem, Ethereum Ecosystem, Animoca Brands Portfolio, Alleged SEC Securities, Binance Launchpad, Gaming Utility Token, Simulation Games, Energi Ecosystem, YZi Labs (Prev. Binance Labs) Portfolio, Coinbase 50 Index"
DOGE,binance-peg-dogecoin,Binance-Peg Dogecoin,DOGE,513889977,513889977.0,4022987.0,"BNB Chain Ecosystem, Avalanche Ecosystem, Meme, Binance-Peg Tokens"
JASMY,jasmycoin,JasmyCoin,JASMY,507425692,523983573.0,32237885.0,"Internet of Things (IOT), Ethereum Ecosystem, DePIN, DWF Labs Portfolio, Coinbase 50 Index"
JTO,jito-governance-token,Jito,JTO,443564151,1133553435.0,35111293.0,"Decentralized Finance (DeFi), Solana Ecosystem, Liquid Staking Governance Tokens, Multicoin Capital Portfolio, Alameda Research Portfolio, Delphi Ventures Portfolio, Liquid Staking, Made in USA"
XCN,chain-2,Onyxcoin,XCN,324713143,439634985.0,14093789.0,"Smart Contract Platform, BNB Chain Ecosystem, Layer 1 (L1), Ethereum Ecosystem, Base Ecosystem, Proof of Stake (PoS), Pantera Capital Portfolio, Made in USA"
FORM,four,Four,FORM,316912589,474954794.0,58433722.0,"Gaming (GameFi), BNB Chain Ecosystem, Launchpad"
RUNE,thorchain,THORChain,RUNE,304680840,368914183.0,65938850.0,"Decentralized Exchange (DEX), Infrastructure, Smart Contract Platform, Exchange-based Tokens, Decentralized Finance (DeFi), Bridge Governance Tokens, Multicoin Capital Portfolio, Proof of Stake (PoS), Delphi Ventures Portfolio"
XEC,ecash,eCash,XEC,293538895,293539125.0,6984145.0,"Smart Contract Platform, Layer 1 (L1), Bitcoin Fork, Proof of Work (PoW)"
SVL,slash-vision-labs,Slash Vision Labs,SVL,226141735,457810134.0,1389712.0,"Mantle Ecosystem, Payment Solutions"
AMP,amp-token,Amp,AMP,209974847,248458881.0,10530795.0,"Decentralized Finance (DeFi), Near Protocol Ecosystem, Ethereum Ecosystem, Payment Solutions, Alleged SEC Securities, Pantera Capital Portfolio, Energi Ecosystem, Made in USA"
SOSO,sosovalue,SoSoValue,SOSO,208732822,759673265.0,10981533.0,"Index, Decentralized Finance (DeFi), Analytics, Ethereum Ecosystem, Base Ecosystem"
ZRX,0x,0x Protocol,ZRX,172901922,203798471.0,15372026.0,"Decentralized Exchange (DEX), Exchange-based Tokens, Decentralized Finance (DeFi), Avalanche Ecosystem, Harmony Ecosystem, Ethereum Ecosystem, Coinbase Ventures Portfolio, Pantera Capital Portfolio, Energi Ecosystem, GMCI DeFi Index, Blockchain Capital Portfolio, GMCI Index, Made in USA, Governance"
GOMINING,gmt-token,GoMining Token,GOMINING,158530916,158530916.0,8985425.0,"Gaming (GameFi), BNB Chain Ecosystem, Ethereum Ecosystem, TON Ecosystem"
ASTR,astar,Astar,ASTR,148783552,154959879.0,7262742.0,"Smart Contract Platform, Polkadot Ecosystem, Layer 1 (L1), Ethereum Ecosystem, Layer 2 (L2), Alameda Research Portfolio, YZi Labs (Prev. Binance Labs) Portfolio, OKX Ventures Portfolio"
GRASS,grass,Grass,GRASS,142917545,456080780.0,27279314.0,"Artificial Intelligence (AI), Solana Ecosystem, DePIN, Polychain Capital Portfolio, Binance Alpha Spotlight"
XPR,proton,XPR Network,XPR,141186600,155886608.0,2902714.0,"Smart Contract Platform, BNB Chain Ecosystem, Ethereum Ecosystem, DWF Labs Portfolio, Made in USA, Governance"
OM,mantra-dao,MANTRA,OM,133847653,209442034.0,39971952.0,"Infrastructure, Smart Contract Platform, BNB Chain Ecosystem, Cosmos Ecosystem, Layer 1 (L1), Polygon Ecosystem, Ethereum Ecosystem, Real World Assets (RWA), Base Ecosystem, Osmosis Ecosystem, Mantra Ecosystem"
AIA,aia,DeAgentAI,AIA,121513104,1221237229.0,26405388.0,"Artificial Intelligence (AI), BNB Chain Ecosystem, Sui Ecosystem, Binance Alpha Spotlight, AI Framework"
SKL,skale,SKALE,SKL,116350144,117240588.0,7930322.0,"Smart Contract Platform, Gaming (GameFi), Layer 1 (L1), Ethereum Ecosystem, Modular Blockchain, Account Abstraction, Multicoin Capital Portfolio, Gaming Blockchains, Gaming Utility Token, Skale Ecosystem, Consensys Portfolio, Galaxy Digital Portfolio, Made in USA"
PEAQ,peaq-2,peaq,PEAQ,116342874,363499477.0,5110314.0,"Smart Contract Platform, Polkadot Ecosystem, Layer 1 (L1), DePIN, Outlier Ventures Portfolio, Binance Alpha Spotlight, Robotics"
ORDI,ordinals,ORDI,ORDI,111295854,111295854.0,22044229.0,"Solana Ecosystem, Meme, BRC-20, Bitcoin Ecosystem, Inscriptions"
ETHW,ethereum-pow-iou,EthereumPoW,ETHW,107909405,107909405.0,7584810.0,"Smart Contract Platform, EthereumPoW Ecosystem, Proof of Work (PoW)"
