PAI,panther-ai,Panther AI,PAI,1617613.0,2755263,953101.0,"Artificial Intelligence (AI), BNB Chain Ecosystem, Trading Bots, Governance"
LLD,liberland-lld,Liberland LLD,LLD,1544791.0,582190138896846231175168,50709.0,"Smart Contract Platform, Solana Ecosystem, Layer 1 (L1), Ethereum Ecosystem, Tron Ecosystem"
KILO,kiloex,KiloEx,KILO,1440056.0,6802342,153797.0,"Decentralized Exchange (DEX), Exchange-based Tokens, Decentralized Finance (DeFi), BNB Chain Ecosystem, Derivatives, Perpetuals, Binance Wallet IDO"
HYDRA,hydra,Hydra,HYDRA,1390332.0,1475680,88542.0,"Smart Contract Platform, Layer 1 (L1)"
WEPE,wall-street-pepe,Wall Street Pepe,WEPE,1351681.0,1351681,195265.0,"Meme, Ethereum Ecosystem, Frog-Themed, The Boy’s Club"
AEROBUD,aerobud,AEROBUD,AEROBUD,1148856.0,1148856,127667.0,"Charity, Meme, Base Ecosystem, Dog-Themed, Base Meme, Made in USA, Base Native"
BNB,binancecoin,BNB,BNB,91595112136.0,91595112136,896319773.0,"Smart Contract Platform, Exchange-based Tokens, BNB Chain Ecosystem, Centralized Exchange (CEX) Token, Layer 1 (L1), Ethereum Ecosystem, Alleged SEC Securities, FTX Holdings, Proof of Stake (PoS), GMCI Layer 1 Index, GMCI 30 Index, GMCI Index, Made in China"
HBAR,hedera-hashgraph,Hedera,HBAR,4160058774.0,4803383455,98021364.0,"Smart Contract Platform, Layer 1 (L1), Hedera Ecosystem, GMCI Layer 1 Index, GMCI 30 Index, GMCI Index, Outlier Ventures Portfolio, Made in USA, Directed Acyclic Graph (DAG)"
ICP,internet-computer,Internet Computer,ICP,1463028466.0,1463028466,54820022.0,"Artificial Intelligence (AI), Infrastructure, Smart Contract Platform, Layer 1 (L1), Ethereum Ecosystem, Internet Computer Ecosystem, Base Ecosystem, Alleged SEC Securities, Multicoin Capital Portfolio, Layer 0 (L0), Andreessen Horowitz (a16z) Portfolio, GMCI Layer 1 Index, GMCI 30 Index, Blockchain Capital Portfolio, GMCI Index, Polychain Capital Portfolio, Coinbase 50 Index, Governance, Base Native"
RENDER,render-token,Render,RENDER,975046086.0,1002789770,119650365.0,"Artificial Intelligence (AI), NFT, Metaverse, Solana Ecosystem, Ethereum Ecosystem, DePIN, Multicoin Capital Portfolio, Alameda Research Portfolio, GMCI DePIN Index, GMCI 30 Index, GMCI Index, Made in USA, Coinbase 50 Index"
XDC,xdce-crowd-sale,XDC Network,XDC,634940640.0,1211957215,8068831.0,"Smart Contract Platform, Layer 1 (L1), Real World Assets (RWA)"
STX,blockstack,Stacks,STX,470868700.0,470868700,9589669.0,"Infrastructure, Smart Contract Platform, Layer 2 (L2), Bitcoin Sidechains, Stacks Ecosystem, SideChain, GMCI Layer 2 Index, GMCI 30 Index, Blockchain Capital Portfolio, GMCI Index, Made in USA, Coinbase 50 Index, CoinList Launchpad"
DASH,dash,Dash,DASH,426998731.0,427007406,66876864.0,"Masternodes, Payment Solutions, Alleged SEC Securities, Proof of Stake (PoS), Proof of Work (PoW), Made in USA, Privacy Infrastructure, Privacy"
PIPPIN,pippin,pippin,PIPPIN,371307464.0,371307464,16075044.0,"Artificial Intelligence (AI), Infrastructure, Solana Ecosystem, Meme, Solana Meme, AI Meme, AI Agents, Pump.fun Ecosystem, Binance Alpha Spotlight, AI Framework"
BTT,bittorrent,BitTorrent,BTT,348186842.0,349231756,41581244.0,"Storage, BNB Chain Ecosystem, Ethereum Ecosystem, DePIN, Alleged SEC Securities, Binance Launchpad, Tron Ecosystem, Energi Ecosystem, YZi Labs (Prev. Binance Labs) Portfolio, BitTorrent Ecosystem, GMCI DePIN Index, GMCI Index"
TIA,celestia,Celestia,TIA,315909210.0,412026457,32251908.0,"Smart Contract Platform, Cosmos Ecosystem, Layer 1 (L1), Data Availability, Modular Blockchain, Osmosis Ecosystem, eGirl Capital Portfolio, Coinbase Ventures Portfolio, Proof of Stake (PoS), Secret Ecosystem, YZi Labs (Prev. Binance Labs) Portfolio, Delphi Ventures Portfolio, Galaxy Digital Portfolio, Blockchain Capital Portfolio, OKX Ventures Portfolio, Polychain Capital Portfolio"
SUN,sun-token,Sun Token,SUN,314969969.0,326115691,20785874.0,"Decentralized Finance (DeFi), Tron Ecosystem, Made in China"
AERO,aerodrome-finance,Aerodrome Finance,AERO,310739236.0,626029642,11746515.0,"Decentralized Exchange (DEX), Exchange-based Tokens, Decentralized Finance (DeFi), Automated Market Maker (AMM), Base Ecosystem, Binance Alpha Spotlight, Made in USA, Base Native"
PYTH,pyth-network,Pyth Network,PYTH,278642428.0,484597017,11714278.0,"Infrastructure, Decentralized Finance (DeFi), Oracle, Analytics, Solana Ecosystem, Neon Ecosystem, Manta Network Ecosystem, Multicoin Capital Portfolio, GMCI DeFi Index, Delphi Ventures Portfolio, GMCI Index"
IP,story-2,Story,IP,276202686.0,805217854,24476418.0,"Artificial Intelligence (AI), Smart Contract Platform, Layer 1 (L1), Binance Alpha Spotlight, Made in USA, Story Ecosystem, IP"
DEXE,dexe,DeXe,DEXE,247181024.0,510219474,11731539.0,"Decentralized Finance (DeFi), BNB Chain Ecosystem, Ethereum Ecosystem"
ZK,zksync,ZKsync,ZK,180061298.0,410178364,9758855.0,"Smart Contract Platform, Ethereum Ecosystem, Layer 2 (L2), Zero Knowledge (ZK), ZkSync Ecosystem, Consensys Portfolio, Blockchain Capital Portfolio, OKX Ventures Portfolio, Privacy Blockchain, Privacy Infrastructure, Privacy"
MX,mx-token,MX,MX,164468396.0,732508835,5771946.0,"Exchange-based Tokens, Centralized Exchange (CEX) Token, Ethereum Ecosystem, Morph L2 Ecosystem, Made in China"
EIGEN,eigenlayer,EigenCloud (prev. EigenLayer),EIGEN,136868319.0,383246373,103660854.0,"Artificial Intelligence (AI), Infrastructure, Ethereum Ecosystem, Base Ecosystem, Data Availability, Restaking, Polychain Capital Portfolio, AI Framework, Made in USA, x402 Ecosystem"
OZO,ozone-chain,Ozone Chain,OZO,124033899.0,130885771,209750.0,"Smart Contract Platform, Layer 1 (L1), Zero Knowledge (ZK)"
NPC,non-playable-coin,Non-Playable Coin,NPC,66480421.0,66480421,2952086.0,"NFT, BNB Chain Ecosystem, Solana Ecosystem, Meme, Ethereum Ecosystem, Base Ecosystem, Hybrid Token Standards, Wojak-Themed, 4chan-Themed, Base Native"
GMRT,gamer-tag,The Game Company,GMRT,66184542.0,186918578,410.15,"Infrastructure, Gaming (GameFi), Ethereum Ecosystem, Base Ecosystem"
MEW,cat-in-a-dogs-world,cat in a dogs world,MEW,57924569.0,57924569,7324252.0,"Solana Ecosystem, Meme, Dog-Themed, Solana Meme, Cat-Themed, Binance Alpha Spotlight, IP Meme"
SHIB,binance-peg-shib,Binance-Peg SHIB,SHIB,55290106.0,55290106,11264.79,"BNB Chain Ecosystem, Meme, Dog-Themed, Binance-Peg Tokens"
ANVL,anvil,Anvil,ANVL,53600508.0,66784888,95478.0,"Decentralized Finance (DeFi), Ethereum Ecosystem"
ISLM,islamic-coin,Islamic Coin,ISLM,52872958.0,426845564,118580.0,"Smart Contract Platform, Wallets, Layer 2 (L2), Osmosis Ecosystem"
DRIFT,drift-protocol,Drift Protocol,DRIFT,48119843.0,82660175,4742413.0,"Decentralized Finance (DeFi), Derivatives, Prediction Markets, Perpetuals, Solana Ecosystem, Binance Alpha Spotlight, Governance"
CELO,celo,Celo,CELO,47306710.0,79167452,6260877.0,"Smart Contract Platform, Celo Ecosystem, Layer 2 (L2), DWF Labs Portfolio, Coinbase Ventures Portfolio, Proof of Stake (PoS), Andreessen Horowitz (a16z) Portfolio, Optimism Superchain Ecosystem, Outlier Ventures Portfolio, Made in USA, CoinList Launchpad"
MVL,mass-vehicle-ledger,MVL,MVL,37749378.0,40732404,77485.0,"Internet of Things (IOT), BNB Chain Ecosystem, Ethereum Ecosystem, DePIN, DWF Labs Portfolio"
GPS,goplus-security,GoPlus Security,GPS,37402442.0,84830105,4423982.0,"BNB Chain Ecosystem, Base Ecosystem, Cybersecurity, YZi Labs (Prev. Binance Labs) Portfolio, OKX Ventures Portfolio, Binance HODLer Airdrops, Binance Alpha Spotlight, Base Native"
IO,io,io.net,IO,35877610.0,95224208,16468676.0,"Artificial Intelligence (AI), Internet of Things (IOT), Binance Launchpool, Solana Ecosystem, DePIN, Animoca Brands Portfolio, Multicoin Capital Portfolio, Delphi Ventures Portfolio, OKX Ventures Portfolio, Made in USA"
HIVE,hive,Hive,HIVE,33883436.0,,1714100.0,"Smart Contract Platform, SocialFi, Layer 1 (L1), Gaming Blockchains"
AINTI,aintivirus,AIntivirus,AINTI,33725684.0,33725684,0.0,"Solana Ecosystem, Meme, AI Meme, Pump.fun Ecosystem"
AP3X,apex-4,APEX,AP3X,30718674.0,60905970,101231.0,Layer 1 (L1)
RLC,iexec-rlc,iExec RLC,RLC,29265709.0,35175750,2315182.0,"Artificial Intelligence (AI), Oracle, Arbitrum Ecosystem, Ethereum Ecosystem, DePIN, AI Agents, Energi Ecosystem, Sora Ecosystem, GMCI DePIN Index, GMCI Index, Privacy Infrastructure, Privacy"
ACX,across-protocol,Across Protocol,ACX,28759709.0,40976716,7577388.0,"Polygon Ecosystem, Arbitrum Ecosystem, Ethereum Ecosystem, Optimism Ecosystem, Bridge Governance Tokens, Cross-chain Communication, Intent, Boba Network Ecosystem, Blockchain Capital Portfolio, Made in USA"
UQC,uquid-coin,Uquid Coin,UQC,28473287.0,113893150,34522.0,Ethereum Ecosystem
SCRT,secret,Secret,SCRT,27783666.0,29030334,2897252.0,"Artificial Intelligence (AI), Infrastructure, Smart Contract Platform, Cosmos Ecosystem, Layer 1 (L1), Osmosis Ecosystem, Alameda Research Portfolio, DragonFly Capital Portfolio, DeFiance Capital Portfolio, Privacy Blockchain, Outlier Ventures Portfolio"
VEE,blockv,BLOCKv,VEE,26517581.0,26517581,700701.0,"NFT, Polygon Ecosystem, Ethereum Ecosystem, Optimism Ecosystem, Base Ecosystem, Base Native"
SKR,saakuru-labs,Saakuru,SKR,26121178.0,37142322,155.07,"Smart Contract Platform, BNB Chain Ecosystem, Ethereum Ecosystem, Optimism Ecosystem, Layer 2 (L2), Base Ecosystem, Saakuru Ecosystem"
NYM,nym,Nym,NYM,25029161.0,30175633,725343.0,"Smart Contract Platform, Ethereum Ecosystem, DePIN, Osmosis Ecosystem, VPN, Andreessen Horowitz (a16z) Portfolio, YZi Labs (Prev. Binance Labs) Portfolio, Privacy Blockchain, Governance, CoinList Launchpad, Privacy Infrastructure, Privacy"
EUL,euler,Euler,EUL,23310394.0,26186861,4589465.0,"BNB Chain Ecosystem, Lending/Borrowing Protocols, Avalanche Ecosystem, Arbitrum Ecosystem, Ethereum Ecosystem, Base Ecosystem, Berachain Ecosystem, Paradigm Portfolio, Coinbase Ventures Portfolio, Sonic Ecosystem, Swellchain Ecosystem, Unichain Ecosystem, TAC Ecosystem, Plasma Ecosystem, BOB Network Ecosystem"
AO,ao-computer,ao Computer,AO,23059686.0,23059686,383250.0,"Artificial Intelligence (AI), Smart Contract Platform, DePIN"
ADS,adshares,Adshares,ADS,22961527.0,22972452,542703.0,"Decentralized Finance (DeFi), Marketing, BNB Chain Ecosystem, Metaverse, Polygon Ecosystem, Ethereum Ecosystem, Base Ecosystem, Base Native"
MAPO,marcopolo,MAP Protocol,MAPO,21862749.0,34231756,491038.0,"BNB Chain Ecosystem, Ethereum Ecosystem, DWF Labs Portfolio"
NOS,nosana,Nosana,NOS,20551460.0,24642039,1279416.0,"Artificial Intelligence (AI), Solana Ecosystem, DePIN"
FLOCK,flock-2,FLOCK,FLOCK,17863037.0,56198058,1819647.0,"Artificial Intelligence (AI), Base Ecosystem, AI Applications, Binance Alpha Spotlight, x402 Ecosystem, Base Native"
B3,b3,B3 (Base),B3,17457322.0,38918551,1012170.0,"Smart Contract Platform, Base Ecosystem, Gaming Blockchains, Base Native"
BICO,biconomy,Biconomy,BICO,17083999.0,23981526,3203513.0,"Infrastructure, Arbitrum Ecosystem, Ethereum Ecosystem, Account Abstraction, Coinbase Ventures Portfolio, YZi Labs (Prev. Binance Labs) Portfolio, Consensys Portfolio, Outlier Ventures Portfolio, CoinList Launchpad"
AVAIL,avail,Avail,AVAIL,15321932.0,43661191,1578369.0,"Infrastructure, Smart Contract Platform, BNB Chain Ecosystem, Ethereum Ecosystem, Data Availability, Modular Blockchain, Binance Alpha Spotlight, Base Native"
PAAL,paal-ai,PAAL AI,PAAL,15061307.0,16781558,1062965.0,"Artificial Intelligence (AI), Virtual Reality, BNB Chain Ecosystem, Solana Ecosystem, Launchpad, Ethereum Ecosystem, Telegram Apps, Discord Bots, Base Ecosystem, PAAL AI Launchpad, AI Agents, AI Applications, AI Agent Launchpad, Binance Alpha Spotlight, AI Framework, DeFAI, Made in USA, Base Native"
SEDA,seda-2,SEDA,SEDA,14675363.0,22811139,390194.0,"Smart Contract Platform, Oracle, Ethereum Ecosystem, Base Ecosystem, Modular Blockchain, Osmosis Ecosystem, HyperEVM Ecosystem, Base Native"
QI,benqi,BENQI,QI,12783606.0,12783606,592152.0,"Decentralized Finance (DeFi), Yield Farming, Binance Launchpool, Lending/Borrowing Protocols, Avalanche Ecosystem, Liquid Staking Governance Tokens, DragonFly Capital Portfolio, Liquid Staking"
MBX,marblex,MARBLEX,MBX,11575596.0,13371587,116673.0,"Smart Contract Platform, Gaming (GameFi), NFT, BNB Chain Ecosystem, Kaia Ecosystem, Aptos Ecosystem, DWF Labs Portfolio, Gaming Blockchains"
BAL,balancer,Balancer,BAL,10137141.0,11288820,1459237.0,"Decentralized Exchange (DEX), Exchange-based Tokens, Decentralized Finance (DeFi), Yield Farming, Automated Market Maker (AMM), Avalanche Ecosystem, Polygon Ecosystem, Near Protocol Ecosystem, Gnosis Chain Ecosystem, Harmony Ecosystem, Arbitrum Ecosystem, Ethereum Ecosystem, Optimism Ecosystem, Base Ecosystem, Index Coop Defi Index, Alameda Research Portfolio, DeFiance Capital Portfolio, Pantera Capital Portfolio, Energi Ecosystem, Polygon zkEVM Ecosystem, Huobi ECO Chain Ecosystem, Blockchain Capital Portfolio, Governance, Base Native"
CHILLGUY,chill-guy,Just a chill guy,CHILLGUY,9513141.0,9513141,2026013.0,"Solana Ecosystem, Meme, Dog-Themed, Solana Meme, Pump.fun Ecosystem, TikTok Meme"
L3,layer3,Layer3,L3,9495271.0,23692545,3247915.0,"Marketing, BNB Chain Ecosystem, Solana Ecosystem, Polygon Ecosystem, Arbitrum Ecosystem, Ethereum Ecosystem, Decentralized Identifier (DID), Optimism Ecosystem, Quest-to-Earn, Made in USA, Base Native"
PPC,peercoin,Peercoin,PPC,9432251.0,9432290,25940.0,"Smart Contract Platform, Polygon Ecosystem, Ethereum Ecosystem, Proof of Stake (PoS), Proof of Work (PoW)"
FORT,forta,Forta,FORT,9246054.0,14632715,352959.0,"Artificial Intelligence (AI), Polygon Ecosystem, Arbitrum Ecosystem, Ethereum Ecosystem, Base Ecosystem, Coinbase Ventures Portfolio, Cybersecurity, Andreessen Horowitz (a16z) Portfolio, Blockchain Capital Portfolio"
ACS,access-protocol,Access Protocol,ACS,9108135.0,17307455,886230.0,"SocialFi, Solana Ecosystem"
WEXO,wexo,Wexo,WEXO,8895107.0,22963063,152117.0,"Ethereum Ecosystem, Payment Solutions, Base Ecosystem, E-commerce, Base Native"
FARTBOY,fartboy,Fartboy,$FARTBOY,8308798.0,8308798,216000.0,"Solana Ecosystem, Meme, Solana Meme, Pump.fun Ecosystem"
PIKA,pikaboss,Pikaboss,PIKA,8278910.0,8278910,2794.22,"Meme, Ethereum Ecosystem"
NAVX,navi,NAVI Protocol,NAVX,7664723.0,9391115,287698.0,"Decentralized Finance (DeFi), Lending/Borrowing Protocols, Sui Ecosystem, OKX Ventures Portfolio, Binance Alpha Spotlight"
SWARMS,swarms,Swarms,SWARMS,6908934.0,6908934,1131250.0,"Artificial Intelligence (AI), Solana Ecosystem, AI Agents, Pump.fun Ecosystem, Binance Alpha Spotlight, AI Framework"
WALLET,ambire-wallet,Ambire Wallet,WALLET,6816567.0,7443169,320130.0,"Wallets, Polygon Ecosystem, Ethereum Ecosystem, Base Ecosystem, Account Abstraction, Governance, Base Native"
TRIAS,trias-token,TriasLab,TRIAS,5205091.0,5205091,1964.23,"Artificial Intelligence (AI), Smart Contract Platform, BNB Chain Ecosystem, Layer 1 (L1), Ethereum Ecosystem, AI Agents"
TLOS,telos,Telos,TLOS,4712578.0,4712578,1403296.0,"Smart Contract Platform, BNB Chain Ecosystem, Layer 1 (L1), Avalanche Ecosystem, Polygon Ecosystem, Arbitrum Ecosystem, Ethereum Ecosystem, Zero Knowledge (ZK), Base Ecosystem, Telos Ecosystem, Consensys Portfolio, Privacy Blockchain, Base Native"
DEOD,decentrawood,Decentrawood,DEOD,4177727.0,4177727,203042.0,"Gaming (GameFi), Metaverse"
SCA,scallop-2,Scallop,SCA,4031261.0,6755234,993361.0,"Decentralized Finance (DeFi), Lending/Borrowing Protocols, Sui Ecosystem"
ZRC,zircuit,Zircuit,ZRC,3915870.0,17228205,684078.0,"Smart Contract Platform, BNB Chain Ecosystem, Ethereum Ecosystem, Layer 2 (L2), Zero Knowledge (ZK), Restaking, Zircuit Ecosystem"
SWEAT,sweatcoin,SWEAT,SWEAT,3811087.0,9462641,352966.0,"Sports, Gaming (GameFi), BNB Chain Ecosystem, Solana Ecosystem, Avalanche Ecosystem, Polygon Ecosystem, Near Protocol Ecosystem, Play To Earn, Arbitrum Ecosystem, Celo Ecosystem, Move To Earn, Ethereum Ecosystem, Optimism Ecosystem, Aptos Ecosystem, Sui Ecosystem, Base Ecosystem, Gaming Governance Token, Gaming Utility Token, OKX Ventures Portfolio"
BELLS,bellscoin,Bellscoin,BELLS,3470895.0,3470895,84509.0,"Smart Contract Platform, Layer 1 (L1), Meme, Proof of Work (PoW), Inscriptions, Made in USA"
TET,tectum,Tectum,TET,3180232.0,3201194,51815.0,"Smart Contract Platform, Layer 1 (L1), Ethereum Ecosystem, Bitcoin Sidechains, SideChain"
AXM,axiome,Axiome,AXM,3177918.0,3283500,120375.0,"Decentralized Finance (DeFi), Layer 1 (L1)"
CEEK,ceek,CEEK Smart VR,CEEK,3159233.0,3159233,102504.0,"Entertainment, Virtual Reality, BNB Chain Ecosystem, Metaverse, Ethereum Ecosystem, DWF Labs Portfolio"
RARI,rarible,RARI,RARI,2773020.0,3825513,136887.0,"NFT, Ethereum Ecosystem, NFT Marketplace, Base Ecosystem, Coinbase Ventures Portfolio, Energi Ecosystem, Made in USA, Governance"
JOULE,joule-2,Joule,JOULE,2718167.0,2735813,1398.77,"Decentralized Finance (DeFi), Flare Network Ecosystem"
PAIN,pain,Pain,PAIN,2607379.0,5214822,29931.0,"Solana Ecosystem, Meme, Solana Meme, 4chan-Themed"
SOVRN,sovrun,Sovrun,SOVRN,2523033.0,2717819,12072.52,"Gaming (GameFi), Metaverse, Ethereum Ecosystem, Animoca Brands Portfolio, Base Ecosystem, DWF Labs Portfolio, On-chain Gaming, Andreessen Horowitz (a16z) Portfolio, Hyperliquid Ecosystem, Delphi Ventures Portfolio, Circle Ventures Portfolio, Base Native"
DEXTF,dextf,Memento,DEXTF,2487669.0,3780236,18885.93,"Decentralized Finance (DeFi), Asset Manager, Avalanche Ecosystem, Ethereum Ecosystem, ZkSync Ecosystem, Real World Assets (RWA), Base Ecosystem, Privacy Blockchain"
XX,xxcoin,XX Network,XX,2287858.0,6145496,7254.31,"Smart Contract Platform, Layer 1 (L1), Ethereum Ecosystem"
PEN,pendulum-chain,Pendulum,PEN,2166428.0,3833848,7775.29,Decentralized Exchange (DEX)
GRAIL,camelot-token,Camelot Token,GRAIL,2126200.0,7820704,7021.17,"Decentralized Exchange (DEX), Exchange-based Tokens, Arbitrum Ecosystem, Camelot Launchpad"
JETTON,jetton,JetTon Games,JETTON,1934410.0,3126960,70066.0,"Gambling (GambleFi), Telegram Apps, TON Ecosystem"
RVF,rocketx,RocketX Exchange,RVF,1836699.0,1836699,174033.0,"Decentralized Exchange (DEX), Exchange-based Tokens, Decentralized Finance (DeFi), Automated Market Maker (AMM), Ethereum Ecosystem, Poolz Finance Launchpad"
NRN,neuron,Neuron,NRN,1809794.0,4026837,26348.0,"Artificial Intelligence (AI), Gaming (GameFi), NFT, Arbitrum Ecosystem, Paradigm Portfolio, AI Agents, AI Framework, Action Games, Robotics"
SIX,six,Six Sigma,SIX,1759240.0,1759240,56.43,"Gambling (GambleFi), Solana Ecosystem"
FNCT,financie-token,Financie Token,FNCT,1743101.0,8578682,69551.0,"SocialFi, Polygon Ecosystem, Ethereum Ecosystem, Governance"
ARCA,arca,Legend of Arcadia,ARCA,1719465.0,4684906,111990.0,"Gaming (GameFi), Ethereum Ecosystem, RPG"
IOTX,binance-peg-iotex,Binance-Peg IoTeX,IOTX,1708078.0,1708078,5744.08,"Internet of Things (IOT), BNB Chain Ecosystem, Binance-Peg Tokens"
QORPO,qopro,QORPO WORLD,QORPO,1693587.0,2032738,174604.0,"Gaming (GameFi), NFT, BNB Chain Ecosystem, Play To Earn, Ethereum Ecosystem, RPG, Gaming Utility Token, Adventure Games, Gaming Platform, Action Games"
VISTA,ethervista,Ethervista,VISTA,1688643.0,1688643,109264.0,"Decentralized Exchange (DEX), Exchange-based Tokens, Decentralized Finance (DeFi), Launchpad, Meme, Ethereum Ecosystem, Binance Alpha Spotlight"
MOEW,moew,MOEW,MOEW,1665316.0,1665316,252164.0,"Meme, Base Ecosystem, TON Ecosystem, Cat-Themed, Base Meme, TON Meme, Base Native"
VADER,vaderai-by-virtuals,Vader,VADER,1517174.0,1517174,211032.0,"Artificial Intelligence (AI), Meme, Base Ecosystem, AI Meme, AI Agents, Virtuals Protocol Ecosystem, Binance Alpha Spotlight, Robotics, Base Native"
EOS,binance-peg-eos,Binance-Peg EOS,EOS,1512608.0,1512608,656.21,"Smart Contract Platform, BNB Chain Ecosystem, Binance-Peg Tokens"
BAX,babb,BABB,BAX,1494459.0,1501969,21393.0,Ethereum Ecosystem
SWAP,hyperswap,HyperSwap,SWAP,1462844.0,2039444,2693.8,"Decentralized Exchange (DEX), Decentralized Finance (DeFi), HyperEVM Ecosystem"
GMM,gamium,Gamium,GMM,1403366.0,1433033,9286.6,"SocialFi, Gaming (GameFi), BNB Chain Ecosystem, Metaverse, DaoMaker Launchpad, Ethereum Ecosystem, Gaming Governance Token, Gaming Utility Token, Governance"
ARCH,archway,Archway,ARCH,1218095.0,2189044,9300.97,"Smart Contract Platform, Layer 1 (L1), Osmosis Ecosystem, Blockchain Capital Portfolio, CoinList Launchpad"
KIMA,kima,Kima Network,KIMA,1148622.0,3548067,121866.0,"Infrastructure, Cosmos Ecosystem, Arbitrum Ecosystem, Outlier Ventures Portfolio"
JLP,jupiter-perpetuals-liquidity-provider-token,Jupiter Perpetuals Liquidity Provider Token,JLP,1178565966.0,1178565966,9641088.0,"Decentralized Finance (DeFi), LP Tokens, Solana Ecosystem"
APT,aptos,Aptos,APT,739698388.0,1118551379,54501739.0,"Smart Contract Platform, Layer 1 (L1), Aptos Ecosystem, FTX Holdings, Coinbase Ventures Portfolio, Multicoin Capital Portfolio, Proof of Stake (PoS), DragonFly Capital Portfolio, Andreessen Horowitz (a16z) Portfolio, YZi Labs (Prev. Binance Labs) Portfolio, GMCI Layer 1 Index, GMCI 30 Index, Circle Ventures Portfolio, GMCI Index, Made in USA"
FTN,fasttoken,Fasttoken,FTN,472463098.0,948214466,40485.0,"Smart Contract Platform, BNB Chain Ecosystem, Layer 1 (L1), Arbitrum Ecosystem, Ethereum Ecosystem, Base Ecosystem, Bahamut Ecosystem"
DCR,decred,Decred,DCR,467999310.0,468003724,2855286.0,"Smart Contract Platform, Privacy Coins, Layer 1 (L1), Proof of Stake (PoS), Proof of Work (PoW), Blockchain Capital Portfolio, Made in USA, Privacy"
SYRUP,syrup,Maple Finance,SYRUP,303230292.0,318674000,14158743.0,"Decentralized Finance (DeFi), Yield Farming, Lending/Borrowing Protocols, Ethereum Ecosystem, Real World Assets (RWA), Base Ecosystem, Binance Alpha Spotlight, Base Native"
VVV,venice-token,Venice Token,VVV,276366220.0,488420831,12714867.0,"Artificial Intelligence (AI), Base Ecosystem, AI Agents, AI Applications, Binance Alpha Spotlight, Made in USA, Base Native"
MON,monad,Monad,MON,253657467.0,2342048043,35374383.0,"Smart Contract Platform, Layer 1 (L1), Animoca Brands Portfolio, Parallelized EVM, eGirl Capital Portfolio, Paradigm Portfolio, Coinbase Ventures Portfolio, Galaxy Digital Portfolio, Monad Ecosystem"
TEL,telcoin,Telcoin,TEL,246117270.0,258860353,1119269.0,"Decentralized Finance (DeFi), Layer 1 (L1), Wallets, Polygon Ecosystem, Arbitrum Ecosystem, Ethereum Ecosystem, Payment Solutions, Base Ecosystem, Proof of Stake (PoS), Stablecoin Issuer, Made in USA, Neobank"
QUBIC,qubic-network,Qubic,QUBIC,128945434.0,159121509,3498562.0,"Artificial Intelligence (AI), Smart Contract Platform, Layer 1 (L1), Proof of Work (PoW), Quantum-Resistant"
TFUEL,theta-fuel,Theta Fuel,TFUEL,94991121.0,94993032,1707094.0,"Artificial Intelligence (AI), Smart Contract Platform, DePIN, Proof of Stake (PoS), Made in USA"
YFI,yearn-finance,yearn.finance,YFI,93968084.0,96395874,6522940.0,"Decentralized Finance (DeFi), Yield Farming, Yield Aggregator, Yearn Ecosystem, Avalanche Ecosystem, Polygon Ecosystem, Near Protocol Ecosystem, Gnosis Chain Ecosystem, Fantom Ecosystem, Harmony Ecosystem, Arbitrum Ecosystem, Ethereum Ecosystem, Optimism Ecosystem, Base Ecosystem, Index Coop Defi Index, Alameda Research Portfolio, Energi Ecosystem, Sora Ecosystem, Huobi ECO Chain Ecosystem, Blockchain Capital Portfolio, Governance, Base Native"
KMNO,kamino,Kamino,KMNO,89354650.0,215133977,3896322.0,"Decentralized Finance (DeFi), Lending/Borrowing Protocols, Solana Ecosystem, Binance Alpha Spotlight"
KAITO,kaito,KAITO,KAITO,88210343.0,365428350,7341752.0,"Artificial Intelligence (AI), Analytics, Launchpad, Base Ecosystem, Binance HODLer Airdrops, InfoFi, Governance, Base Native"
ZIL,zilliqa,Zilliqa,ZIL,84558679.0,86431970,10445611.0,"Smart Contract Platform, BNB Chain Ecosystem, GMCI Layer 1 Index, GMCI Index, Made in China"
KSM,kusama,Kusama,KSM,80943440.0,80943440,4229836.0,"Smart Contract Platform, Polkadot Ecosystem, Proof of Stake (PoS), Pantera Capital Portfolio, Made in USA, Coinbase 50 Index, Hydration Ecosystem"
HOT,holotoken,Holo,HOT,75137425.0,75137425,4472277.0,"Smart Contract Platform, Storage, Harmony Ecosystem, Arbitrum Ecosystem, Ethereum Ecosystem, DePIN, Base Ecosystem, Energi Ecosystem, Sora Ecosystem, GMCI DePIN Index, GMCI Index"
MINA,mina-protocol,Mina Protocol,MINA,74967332.0,74967332,3524860.0,"Smart Contract Platform, Layer 1 (L1), Zero Knowledge (ZK), FTX Holdings, Paradigm Portfolio, Coinbase Ventures Portfolio, Multicoin Capital Portfolio, Proof of Stake (PoS), Pantera Capital Portfolio, Circle Ventures Portfolio, Privacy Blockchain, Polychain Capital Portfolio, Made in USA, Coinbase 50 Index, CoinList Launchpad"
EDU,edu-coin,Open Campus,EDU,72944094.0,87214569,4421079.0,"Education, BNB Chain Ecosystem, Polygon Ecosystem, Ethereum Ecosystem, Binance Launchpad, YZi Labs (Prev. Binance Labs) Portfolio"
CCD,concordium,Concordium,CCD,68691393.0,82318891,629306.0,"Smart Contract Platform, Layer 1 (L1), Decentralized Identifier (DID), Zero Knowledge (ZK), Payment Solutions, Privacy Blockchain, x402 Ecosystem, Privacy Infrastructure, Privacy"
FAI,freysa-ai,Freysa AI,FAI,58747073.0,58747073,3669749.0,"Artificial Intelligence (AI), Base Ecosystem, AI Agents, Binance Alpha Spotlight, AI Framework, Base Native"
BLUR,blur,Blur,BLUR,53908704.0,58701380,4345919.0,"NFT, Ethereum Ecosystem, NFT Marketplace, FTX Holdings, NFTFi, eGirl Capital Portfolio, Paradigm Portfolio, GMCI DeFi Index, GMCI Index, Made in USA, Coinbase 50 Index"
NIZA,niza-global-2,Niza Global,NIZA,50134031.0,50134031,1602545.0,"Exchange-based Tokens, Centralized Exchange (CEX) Token, Ethereum Ecosystem"
NOW,changenow,ChangeNOW,NOW,49157952.0,57390162,3644.53,"Decentralized Exchange (DEX), Exchange-based Tokens, BNB Chain Ecosystem, Ethereum Ecosystem"
UNP,unipoly,Unipoly,UNP,45856251.0,164223941,315418.0,"Gaming (GameFi), BNB Chain Ecosystem, Layer 1 (L1), Ethereum Ecosystem, Gaming Blockchains, Gaming Platform, Skale Ecosystem"
BCH,binance-peg-bitcoin-cash,Binance-Peg Bitcoin Cash,BCH,45374861.0,45374861,64488.0,"BNB Chain Ecosystem, Binance-Peg Tokens"
