DASH,dash,Dash,DASH,301533243,301589540.0,22811561.0,"Smart Contract Platform, Privacy, Masternodes, Alleged SEC Securities, Proof of Stake (PoS), Proof of Work (PoW), Made in USA"
CELO,celo,Celo,CELO,207243939,359780074.0,15808321.0,"Smart Contract Platform, Celo Ecosystem, Layer 2 (L2), DWF Labs Portfolio, Coinbase Ventures Portfolio, Proof of Stake (PoS), Andreessen Horowitz (a16z) Portfolio, Optimism Superchain Ecosystem, Outlier Ventures Portfolio, Made in USA"
NPC,non-playable-coin,Non-Playable Coin,NPC,202023874,202023874.0,6760195.0,"NFT, BNB Chain Ecosystem, Solana Ecosystem, Meme, Ethereum Ecosystem, Base Ecosystem, Hybrid Token Standards, Wojak-Themed, 4chan-Themed"
VTHO,vethor-token,VeThor,VTHO,197163129,197198116.0,4052333.0,"Layer 1 (L1), VeChain Ecosystem"
LGCT,legacy-token,Legacy Token,LGCT,192538738,544514797.0,7092049.0,"Education, Gaming (GameFi), BNB Chain Ecosystem, Base Ecosystem"
AI16Z,ai16z,ai16z,AI16Z,189007303,189007303.0,52014100.0,"Artificial Intelligence (AI), Solana Ecosystem, Meme, Solana Token-2022, AI Agents, Binance Alpha Spotlight, AI Framework, Made in USA"
ELF,aelf,aelf,ELF,168905027,219849550.0,2837821.0,"Infrastructure, Smart Contract Platform, BNB Chain Ecosystem, Layer 1 (L1), Ethereum Ecosystem, GMCI Layer 1 Index, Aelf Ecosystem, GMCI Index"
DRIFT,drift-protocol,Drift Protocol,DRIFT,168738499,489443105.0,9319390.0,"Decentralized Finance (DeFi), Derivatives, Prediction Markets, Solana Ecosystem"
WOO,woo-network,WOO,WOO,168319647,194767763.0,11977458.0,"Decentralized Exchange (DEX), Exchange-based Tokens, Decentralized Finance (DeFi), Automated Market Maker (AMM), BNB Chain Ecosystem, Derivatives, Perpetuals, Centralized Exchange (CEX) Token, Solana Ecosystem, Avalanche Ecosystem, Polygon Ecosystem, Near Protocol Ecosystem, Fantom Ecosystem, Arbitrum Ecosystem, Ethereum Ecosystem, ZkSync Ecosystem, Mantle Ecosystem, Linea Ecosystem, Base Ecosystem, DragonFly Capital Portfolio, YZi Labs (Prev. Binance Labs) Portfolio"
ZIG,zignaly,ZIGChain,ZIG,143144049,198514371.0,2650847.0,"Artificial Intelligence (AI), Smart Contract Platform, BNB Chain Ecosystem, Solana Ecosystem, Layer 1 (L1), Polygon Ecosystem, Ethereum Ecosystem, DWF Labs Portfolio, Injective Ecosystem, OKX Ventures Portfolio"
IO,io,io.net,IO,139194543,648016905.0,25820809.0,"Artificial Intelligence (AI), Internet of Things (IOT), Binance Launchpool, Solana Ecosystem, DePIN, Animoca Brands Portfolio, Multicoin Capital Portfolio, Delphi Ventures Portfolio, OKX Ventures Portfolio, Made in USA"
OZO,ozone-chain,Ozone Chain,OZO,131494170,154968960.0,218429.0,"Smart Contract Platform, Layer 1 (L1), Zero Knowledge (ZK)"
OSAK,osaka-protocol,Osaka Protocol,OSAK,130447954,130447954.0,175272.0,"BNB Chain Ecosystem, Solana Ecosystem, Avalanche Ecosystem, Polygon Ecosystem, Meme, Arbitrum Ecosystem, Ethereum Ecosystem, Optimism Ecosystem, Base Ecosystem, Dog-Themed"
BICO,biconomy,Biconomy,BICO,108215813,111882699.0,7050466.0,"Arbitrum Ecosystem, Ethereum Ecosystem, Account Abstraction, Coinbase Ventures Portfolio, YZi Labs (Prev. Binance Labs) Portfolio, Consensys Portfolio, Outlier Ventures Portfolio"
SIX,six,Six Sigma,SIX,106671577,106671577.0,69098.0,"Gambling (GambleFi), Solana Ecosystem"
PAAL,paal-ai,PAAL AI,PAAL,87628475,97637100.0,4248147.0,"Artificial Intelligence (AI), Virtual Reality, BNB Chain Ecosystem, Launchpad, Ethereum Ecosystem, Telegram Apps, Discord Bots, Base Ecosystem, PAAL AI Launchpad, AI Agents, AI Applications, AI Agent Launchpad, Binance Alpha Spotlight, AI Framework, DeFAI, Made in USA"
RLC,iexec-rlc,iExec RLC,RLC,83422292,100268941.0,5433621.0,"Artificial Intelligence (AI), Oracle, Ethereum Ecosystem, DePIN, AI Agents, Energi Ecosystem, Sora Ecosystem, GMCI DePIN Index, GMCI Index"
BAL,balancer,Balancer,BAL,82009204,87882105.0,6409444.0,"Decentralized Exchange (DEX), Exchange-based Tokens, Decentralized Finance (DeFi), Yield Farming, Automated Market Maker (AMM), Avalanche Ecosystem, Polygon Ecosystem, Near Protocol Ecosystem, Gnosis Chain Ecosystem, Harmony Ecosystem, Arbitrum Ecosystem, Ethereum Ecosystem, Optimism Ecosystem, Base Ecosystem, Index Coop Defi Index, Alameda Research Portfolio, DeFiance Capital Portfolio, Pantera Capital Portfolio, Energi Ecosystem, Polygon zkEVM Ecosystem, Huobi ECO Chain Ecosystem, Blockchain Capital Portfolio"
AO,ao-computer,ao Computer,AO,77934690,77934690.0,2134553.0,"Artificial Intelligence (AI), Smart Contract Platform, DePIN"
VANRY,vanar-chain,Vanar Chain,VANRY,71600024,73639804.0,11480719.0,"Smart Contract Platform, Gaming (GameFi), NFT, Layer 1 (L1), Polygon Ecosystem, Ethereum Ecosystem, Vanar Chain Ecosystem"
CHILLGUY,chill-guy,Just a chill guy,CHILLGUY,68422714,68422714.0,12850813.0,"Solana Ecosystem, Meme, Dog-Themed, Solana Meme, Pump.fun Ecosystem, TikTok Meme"
VEE,blockv,BLOCKv,VEE,65527845,65527845.0,48391.0,"NFT, Polygon Ecosystem, Ethereum Ecosystem, Optimism Ecosystem"
GPS,goplus-security,GoPlus Security,GPS,62815735,236534711.0,4262087.0,"BNB Chain Ecosystem, Base Ecosystem, Cybersecurity, YZi Labs (Prev. Binance Labs) Portfolio, OKX Ventures Portfolio, Binance Alpha Spotlight"
SCRT,secret,Secret,SCRT,59628629,62762583.0,2398185.0,"Artificial Intelligence (AI), Smart Contract Platform, Cosmos Ecosystem, Layer 1 (L1), Osmosis Ecosystem, Alameda Research Portfolio, DragonFly Capital Portfolio, DeFiance Capital Portfolio, Privacy Blockchain, Outlier Ventures Portfolio"
QI,benqi,BENQI,QI,55845525,56996801.0,7976772.0,"Decentralized Finance (DeFi), Yield Farming, Binance Launchpool, Lending/Borrowing Protocols, Avalanche Ecosystem, Liquid Staking Governance Tokens, DragonFly Capital Portfolio, Liquid Staking"
QKC,quark-chain,QuarkChain,QKC,54549743,76375537.0,1443521.0,"Infrastructure, Ethereum Ecosystem, Energi Ecosystem"
ANVL,anvil,Anvil,ANVL,54539678,197075306.0,149492.0,"Decentralized Finance (DeFi), Ethereum Ecosystem"
ACS,access-protocol,Access Protocol,ACS,53986369,114524145.0,6427746.0,"SocialFi, Solana Ecosystem"
NOS,nosana,Nosana,NOS,51683511,61970637.0,491456.0,"Artificial Intelligence (AI), Solana Ecosystem, DePIN"
OGN,origin-protocol,Origin Token,OGN,43725828,88616887.0,7478334.0,"NFT, Ethereum Ecosystem, Base Ecosystem, Pantera Capital Portfolio, Sonic Ecosystem, Made in USA"
FORT,forta,Forta,FORT,43299968,72044929.0,1353575.0,"Artificial Intelligence (AI), Polygon Ecosystem, Ethereum Ecosystem, Coinbase Ventures Portfolio, Cybersecurity, Andreessen Horowitz (a16z) Portfolio, Blockchain Capital Portfolio"
UQC,uquid-coin,Uquid Coin,UQC,42864352,171457406.0,190.04,Ethereum Ecosystem
MBX,marblex,MARBLEX,MBX,41511580,62129851.0,1248222.0,"Smart Contract Platform, Gaming (GameFi), NFT, BNB Chain Ecosystem, Kaia Ecosystem, Aptos Ecosystem, DWF Labs Portfolio, Gaming Blockchains"
APX,apollox-2,APX,APX,38212342,353142856.0,1226506.0,"Decentralized Finance (DeFi), BNB Chain Ecosystem, Perpetuals, YZi Labs (Prev. Binance Labs) Portfolio, Binance Alpha Spotlight"
SEDA,seda-2,SEDA,SEDA,35943568,63318692.0,674172.0,"Smart Contract Platform, Oracle, Ethereum Ecosystem, Base Ecosystem, Modular Blockchain, Osmosis Ecosystem"
RSS3,rss3,RSS3,RSS3,33989435,42822715.0,2360363.0,"Artificial Intelligence (AI), Infrastructure, Storage, Ethereum Ecosystem, Coinbase Ventures Portfolio, DragonFly Capital Portfolio, RSS3 VSL Ecosystem, AI Framework, DeFAI"
L3,layer3,Layer3,L3,33753338,167958923.0,9103665.0,"Marketing, BNB Chain Ecosystem, Solana Ecosystem, Polygon Ecosystem, Arbitrum Ecosystem, Ethereum Ecosystem, Decentralized Identifier (DID), Optimism Ecosystem, Quest-to-Earn, Made in USA"
AINTI,aintivirus,AIntivirus,AINTI,33728676,33728676.0,0.0,"Solana Ecosystem, Meme, AI Meme, Pump.fun Ecosystem"
NAVX,navi,NAVI Protocol,NAVX,28994716,49188797.0,1929580.0,"Decentralized Finance (DeFi), Lending/Borrowing Protocols, Sui Ecosystem, OKX Ventures Portfolio, Binance Alpha Spotlight"
MAPO,marcopolo,MAP Protocol,MAPO,28962221,47567928.0,387632.0,"BNB Chain Ecosystem, Ethereum Ecosystem, DWF Labs Portfolio"
PIKA,pikaboss,Pikaboss,PIKA,28307969,28307969.0,5730.44,"Meme, Ethereum Ecosystem"
FARTBOY,fartboy,Fartboy,$FARTBOY,28270785,28270785.0,540978.0,"Solana Ecosystem, Meme, Solana Meme, Pump.fun Ecosystem"
LUMIA,lumia,Lumia,LUMIA,24218131,76824940.0,4428150.0,"Smart Contract Platform, Layer 2 (L2), Real World Assets (RWA)"
VADER,vaderai-by-virtuals,VaderAI by Virtuals,VADER,22801547,22801547.0,943127.0,"Artificial Intelligence (AI), Meme, Base Ecosystem, AI Meme, AI Agents, Virtuals Protocol Ecosystem, Binance Alpha Spotlight"
LYX,lukso-token-2,LUKSO,LYX,22597286,31166221.0,364217.0,"Smart Contract Platform, SocialFi, Layer 1 (L1), Decentralized Identifier (DID), Proof of Stake (PoS), Lukso Ecosystem"
RARI,rarible,RARI,RARI,21149279,29176438.0,5016673.0,"NFT, Ethereum Ecosystem, NFT Marketplace, Coinbase Ventures Portfolio, Energi Ecosystem, Made in USA"
FLOCK,flock-2,FLOCK,FLOCK,19861415,180268418.0,7670766.0,"Artificial Intelligence (AI), Base Ecosystem, AI Applications, Binance Alpha Spotlight"
PIPPIN,pippin,pippin,PIPPIN,19733928,19733928.0,5608073.0,"Artificial Intelligence (AI), Infrastructure, Solana Ecosystem, Meme, Solana Meme, AI Meme, AI Agents, Pump.fun Ecosystem, Binance Alpha Spotlight, AI Framework"
NRN,neuron,Neuron,NRN,17727421,39443965.0,359298.0,"Artificial Intelligence (AI), Gaming (GameFi), NFT, Arbitrum Ecosystem, Paradigm Portfolio, AI Agents, AI Framework, Action Games"
XTER,xterio,Xterio,XTER,15709063,112231916.0,5271303.0,"Artificial Intelligence (AI), Gaming (GameFi), NFT, BNB Chain Ecosystem, Animoca Brands Portfolio, Gaming Blockchains, YZi Labs (Prev. Binance Labs) Portfolio, Binance Alpha Spotlight"
CRTS,cratos,Cratos,CRTS,14637461,23057866.0,653772.0,"BNB Chain Ecosystem, Ethereum Ecosystem"
BELLS,bellscoin,Bellscoin,BELLS,14519516,14519516.0,608979.0,"Smart Contract Platform, Layer 1 (L1), Meme, Proof of Work (PoW), Inscriptions, Made in USA"
WALLET,ambire-wallet,Ambire Wallet,WALLET,13783671,13861262.0,1036991.0,"Wallets, Polygon Ecosystem, Ethereum Ecosystem, Base Ecosystem, Account Abstraction"
TLOS,telos,Telos,TLOS,13775981,13775983.0,1927009.0,"Smart Contract Platform, BNB Chain Ecosystem, Layer 1 (L1), Avalanche Ecosystem, Polygon Ecosystem, Arbitrum Ecosystem, Ethereum Ecosystem, Zero Knowledge (ZK), Telos Ecosystem, Consensys Portfolio"
EOS,binance-peg-eos,Binance-Peg EOS,EOS,11893767,11893767.0,17040.35,"Smart Contract Platform, BNB Chain Ecosystem, Binance-Peg Tokens"
HMT,human-protocol,HUMAN Protocol,HMT,11667515,15395211.0,61988.0,"Artificial Intelligence (AI), Infrastructure, Software as a service, Polygon Ecosystem, Ethereum Ecosystem, Market-Making Solution, AI Framework"
JETTON,jetton,JetTon Games,JETTON,10313637,16066372.0,88002.0,"Gambling (GambleFi), Telegram Apps, TON Ecosystem"
PPC,peercoin,Peercoin,PPC,9575700,9575812.0,739.8,"Smart Contract Platform, Polygon Ecosystem, Ethereum Ecosystem, Proof of Stake (PoS), Proof of Work (PoW)"
GRAM,gram-2,Gram,GRAM,9260588,9260588.0,97941.0,"TON Ecosystem, Proof of Work (PoW)"
SOVRN,sovrun,Sovrun,SOVRN,8964257,9656325.0,209547.0,"Gaming (GameFi), Metaverse, Ethereum Ecosystem, Animoca Brands Portfolio, Base Ecosystem, DWF Labs Portfolio, On-chain Gaming, Andreessen Horowitz (a16z) Portfolio, Hyperliquid Ecosystem, Delphi Ventures Portfolio, Circle Ventures Portfolio"
LMT,limitus,LIMITUS,LMT,8919063,8919063.0,512172.0,"Artificial Intelligence (AI), Solana Ecosystem, Pump.fun Ecosystem, Binance Alpha Spotlight"
CA,ca-htb,Coupon Assets,CA,8461390,124213962.0,1289840.0,"Retail, Ethereum Ecosystem"
TRIAS,trias-token,TriasLab,TRIAS,8169763,8169763.0,213965.0,"Artificial Intelligence (AI), Smart Contract Platform, BNB Chain Ecosystem, Layer 1 (L1), Ethereum Ecosystem, AI Agents"
LCAT,lion-cat,Lion Cat,LCAT,7737021,10367867.0,148081.0,"BNB Chain Ecosystem, Meme, Cat-Themed"
DEXTF,dextf,Memento,DEXTF,7655953,11633907.0,231608.0,"Decentralized Finance (DeFi), Asset Manager, Avalanche Ecosystem, Ethereum Ecosystem, ZkSync Ecosystem, Real World Assets (RWA)"
OVR,ovr,Ovr,OVR,7386561,12649769.0,428367.0,"Augmented Reality, NFT, BNB Chain Ecosystem, Metaverse, Polygon Ecosystem, Ethereum Ecosystem, DePIN, Base Ecosystem"
VISTA,ethervista,Ethervista,VISTA,7273605,7273605.0,808358.0,"Decentralized Exchange (DEX), Launchpad, Ethereum Ecosystem, Binance Alpha Spotlight"
BUZZ,hive-ai,Hive AI,BUZZ,7151652,7151652.0,3760062.0,"Decentralized Finance (DeFi), Solana Ecosystem, AI Agents, Pump.fun Ecosystem, Binance Alpha Spotlight, DeFAI"
XX,xxcoin,XX Network,XX,6638542,18919593.0,127852.0,"Smart Contract Platform, Layer 1 (L1), Ethereum Ecosystem"
PAIN,pain,Pain,PAIN,6251732,12503539.0,822388.0,"Solana Ecosystem, Meme, Solana Meme, 4chan-Themed"
APP,moon-app,RWAX,APP,5647963,14004488.0,348284.0,"Tokenized Real Estate, Tokenized Assets, BNB Chain Ecosystem, Solana Ecosystem, Ethereum Ecosystem, Real World Assets (RWA), Injective Ecosystem, RWA Protocol"
ZKL,zklink,zkLink,ZKL,5564948,18384222.0,2718840.0,"Smart Contract Platform, Ethereum Ecosystem, Zero Knowledge (ZK), Layer 3 (L3), zkLink Nova Ecosystem, OKX Ventures Portfolio"
TET,tectum,Tectum,TET,5541914,6093575.0,227312.0,"Smart Contract Platform, Layer 1 (L1), Ethereum Ecosystem, Bitcoin Sidechains, SideChain"
HAPPY,happycat-2,Happy Cat,HAPPY,5229582,5229582.0,1451513.0,"BNB Chain Ecosystem, Solana Ecosystem, Meme, Cat-Themed, Binance Alpha Spotlight"
HYDRA,hydra,Hydra,HYDRA,5158936,5775304.0,139920.0,"Smart Contract Platform, Layer 1 (L1)"
RVF,rocketx,RocketX Exchange,RVF,5048220,5164476.0,37832.0,"Decentralized Exchange (DEX), Decentralized Finance (DeFi), Automated Market Maker (AMM), Ethereum Ecosystem, Poolz Finance Launchpad"
OBT,oobit,Oobit,OBT,4809567,13662599.0,86601.0,"BNB Chain Ecosystem, Ethereum Ecosystem, Payment Solutions"
KIMA,kima,Kima Network,KIMA,4507482,18058612.0,271858.0,"Infrastructure, Cosmos Ecosystem, Arbitrum Ecosystem, Outlier Ventures Portfolio"
ELON4AFD,elon4afd,Elon4AfD,ELON4AFD,4505065,4505065.0,61610.0,"Solana Ecosystem, Meme, Elon Musk-Inspired, Pump.fun Ecosystem"
RENTA,renta-network,Renta Network,RENTA,4364571,12175496.0,102767.0,"Retail, Smart Contract Platform, NFT, Ethereum Ecosystem, Layer 2 (L2), Real World Assets (RWA), NFTFi"
MOEW,moew,MOEW,MOEW,4059001,4059001.0,1963180.0,"Meme, Base Ecosystem, TON Ecosystem, Cat-Themed, Base Meme, TON Meme"
MUBI,multibit,Multibit,MUBI,3938912,4146223.0,1411072.0,"BNB Chain Ecosystem, Polygon Ecosystem, Ethereum Ecosystem, BRC-20, Inscriptions"
IMGN,imgn-labs,IMGN Labs,IMGN,3938251,3938251.0,84859.0,"Artificial Intelligence (AI), Base Ecosystem, AI Applications"
ICP,internet-computer,Internet Computer,ICP,3097914865,3097914865.0,71299104.0,"Artificial Intelligence (AI), Infrastructure, Smart Contract Platform, Layer 1 (L1), Internet Computer Ecosystem, Alleged SEC Securities, Multicoin Capital Portfolio, Layer 0 (L0), Andreessen Horowitz (a16z) Portfolio, GMCI Layer 1 Index, GMCI 30 Index, Blockchain Capital Portfolio, GMCI Index, Polychain Capital Portfolio, Coinbase 50 Index"
FTN,fasttoken,Fasttoken,FTN,1946556265,3931032118.0,61888999.0,"Smart Contract Platform, BNB Chain Ecosystem, Layer 1 (L1), Arbitrum Ecosystem, Ethereum Ecosystem, Base Ecosystem, Bahamut Ecosystem"
STX,blockstack,Stacks,STX,1336875438,1336875438.0,33575366.0,"Infrastructure, Smart Contract Platform, Layer 2 (L2), Bitcoin Sidechains, Stacks Ecosystem, SideChain, GMCI Layer 2 Index, GMCI 30 Index, Blockchain Capital Portfolio, GMCI Index, Made in USA, Coinbase 50 Index"
AERO,aerodrome-finance,Aerodrome Finance,AERO,755075835,1489055704.0,35590572.0,"Decentralized Exchange (DEX), Decentralized Finance (DeFi), Automated Market Maker (AMM), Base Ecosystem, Binance Alpha Spotlight, Made in USA"
TEL,telcoin,Telcoin,TEL,635619315,691644854.0,2761516.0,"Decentralized Finance (DeFi), Wallets, Polygon Ecosystem, Arbitrum Ecosystem, Ethereum Ecosystem, Payment Solutions, Base Ecosystem, Made in USA"
SYRUP,syrup,Maple Finance,SYRUP,459662494,515835978.0,34912100.0,"Decentralized Finance (DeFi), Yield Farming, Lending/Borrowing Protocols, Ethereum Ecosystem, Real World Assets (RWA), Base Ecosystem, Binance Alpha Spotlight"
ZK,zksync,ZKsync,ZK,434097518,1260555613.0,21397814.0,"Smart Contract Platform, Layer 2 (L2), Zero Knowledge (ZK), ZkSync Ecosystem, Consensys Portfolio, Blockchain Capital Portfolio, OKX Ventures Portfolio"
DEXE,dexe,DeXe,DEXE,420559259,710739405.0,13726636.0,"Artificial Intelligence (AI), Decentralized Finance (DeFi), BNB Chain Ecosystem, Ethereum Ecosystem"
MEW,cat-in-a-dogs-world,cat in a dogs world,MEW,367927233,367927233.0,244408679.0,"Solana Ecosystem, Meme, Dog-Themed, Solana Meme, Cat-Themed"
DCR,decred,Decred,DCR,289158314,289171082.0,2849940.0,"Smart Contract Platform, Privacy, Layer 1 (L1), Proof of Stake (PoS), Proof of Work (PoW), Blockchain Capital Portfolio, Made in USA"
MINA,mina-protocol,Mina Protocol,MINA,269002847,269002847.0,12355933.0,"Smart Contract Platform, Layer 1 (L1), Zero Knowledge (ZK), FTX Holdings, Paradigm Portfolio, Coinbase Ventures Portfolio, Multicoin Capital Portfolio, Proof of Stake (PoS), Pantera Capital Portfolio, Circle Ventures Portfolio, Privacy Blockchain, Polychain Capital Portfolio, Made in USA, Coinbase 50 Index"
ZIL,zilliqa,Zilliqa,ZIL,256501714,276094611.0,15762724.0,"Smart Contract Platform, BNB Chain Ecosystem, GMCI Layer 1 Index, GMCI Index, Made in China"
EUL,euler,Euler,EUL,239358000,348206596.0,1252843.0,"Lending/Borrowing Protocols, Ethereum Ecosystem, Paradigm Portfolio, Coinbase Ventures Portfolio"
YFI,yearn-finance,yearn.finance,YFI,205628224,223037111.0,20581007.0,"Decentralized Finance (DeFi), Yield Farming, Yield Aggregator, Yearn Ecosystem, Avalanche Ecosystem, Polygon Ecosystem, Near Protocol Ecosystem, Gnosis Chain Ecosystem, Fantom Ecosystem, Harmony Ecosystem, Arbitrum Ecosystem, Ethereum Ecosystem, Optimism Ecosystem, Base Ecosystem, Index Coop Defi Index, Alameda Research Portfolio, Energi Ecosystem, Sora Ecosystem, Huobi ECO Chain Ecosystem, Blockchain Capital Portfolio"
KMNO,kamino,Kamino,KMNO,149905594,637151031.0,12689817.0,"Decentralized Finance (DeFi), Lending/Borrowing Protocols, Solana Ecosystem, Binance Alpha Spotlight"
HIVE,hive,Hive,HIVE,119028546,,3725616.0,"Smart Contract Platform, SocialFi, Layer 1 (L1), Gaming Blockchains"
PEOPLE,constitutiondao,ConstitutionDAO,PEOPLE,117579898,117579898.0,44121164.0,"Meme, Ethereum Ecosystem, PolitiFi"
EWT,energy-web-token,Energy Web,EWT,106551844,121074633.0,555547.0,"Energy, Polkadot Ecosystem, Gnosis Chain Ecosystem, Regenerative Finance (ReFi), Real World Assets (RWA), Blockchain Capital Portfolio, Hydration Ecosystem"
VVV,venice-token,Venice Token,VVV,103345602,234682804.0,3410428.0,"Artificial Intelligence (AI), Base Ecosystem, AI Agents, AI Applications, Made in USA"
YGG,yield-guild-games,Yield Guild Games,YGG,98986156,186865271.0,14575414.0,"Gaming (GameFi), NFT, BNB Chain Ecosystem, Metaverse, Collectibles, Polygon Ecosystem, Play To Earn, Harmony Ecosystem, Guild and Scholarship, Ethereum Ecosystem, Animoca Brands Portfolio, Base Ecosystem, DWF Labs Portfolio, Ronin Ecosystem, Gaming Governance Token, Andreessen Horowitz (a16z) Portfolio, Delphi Ventures Portfolio, Abstract Ecosystem"
SGB,songbird,Songbird,SGB,98424225,116661645.0,620414.0,Smart Contract Platform
NMD,nexusmind,NexusMind,NMD,96707253,943715384.0,105666.0,"SocialFi, BNB Chain Ecosystem"
ACX,across-protocol,Across Protocol,ACX,95168718,192453901.0,91177050.0,"Polygon Ecosystem, Arbitrum Ecosystem, Ethereum Ecosystem, Optimism Ecosystem, Bridge Governance Tokens, Cross-chain Communication, Intent, Boba Network Ecosystem, Blockchain Capital Portfolio, Made in USA"
MVL,mass-vehicle-ledger,MVL,MVL,90064585,93077567.0,360844.0,"Internet of Things (IOT), BNB Chain Ecosystem, Ethereum Ecosystem, DePIN, DWF Labs Portfolio"
USTC,terrausd,TerraClassicUSD,USTC,85731510,93410664.0,19049694.0,"Stablecoins, USD Stablecoin, Seigniorage, Alleged SEC Securities, Osmosis Ecosystem, Stablecoin Protocol, DeFiance Capital Portfolio, Terra Classic Ecosystem, YZi Labs (Prev. Binance Labs) Portfolio, Delphi Ventures Portfolio, Galaxy Digital Portfolio, Fiat-backed Stablecoin"
CONX,connex,Connex,CONX,78145426,6795254433.0,10721.05,BNB Chain Ecosystem
CYBER,cyberconnect,CYBER,CYBER,77111690,172707645.0,13288350.0,"Smart Contract Platform, SocialFi, NFT, BNB Chain Ecosystem, Binance Launchpool, Ethereum Ecosystem, Decentralized Identifier (DID), Optimism Ecosystem, Layer 2 (L2), Animoca Brands Portfolio, Multicoin Capital Portfolio, YZi Labs (Prev. Binance Labs) Portfolio, Delphi Ventures Portfolio, Cyber Ecosystem, Optimism Superchain Ecosystem"
B3,b3,B3 (Base),B3,76595844,280910322.0,5791774.0,"Smart Contract Platform, Base Ecosystem, Gaming Blockchains"
ALI,alethea-artificial-liquid-intelligence-token,Artificial Liquid Intelligence,ALI,70885465,76737948.0,3977105.0,"Artificial Intelligence (AI), NFT, Metaverse, Solana Ecosystem, Polygon Ecosystem, Ethereum Ecosystem, Cronos Ecosystem, Base Ecosystem, Multicoin Capital Portfolio, AI Agents, Alameda Research Portfolio, DeFiance Capital Portfolio, YZi Labs (Prev. Binance Labs) Portfolio"
CARV,carv,CARV,CARV,68335923,232881788.0,4952608.0,"Artificial Intelligence (AI), Infrastructure, Gaming (GameFi), NFT, Solana Ecosystem, Arbitrum Ecosystem, Impossible Finance Launchpad, Ethereum Ecosystem, Animoca Brands Portfolio, Base Ecosystem"
AGLD,adventure-gold,Adventure Gold,AGLD,68243058,75842872.0,12684347.0,"Ethereum Ecosystem, DWF Labs Portfolio"
SCR,scroll,Scroll,SCR,63747495,335513133.0,10531791.0,"Smart Contract Platform, Binance Launchpool, Layer 2 (L2), Scroll Ecosystem"
ZRC,zircuit,Zircuit,ZRC,59034107,268957475.0,21678291.0,"Smart Contract Platform, BNB Chain Ecosystem, Ethereum Ecosystem, Layer 2 (L2), Zero Knowledge (ZK), Restaking, Zircuit Ecosystem"
ISLM,islamic-coin,Islamic Coin,ISLM,57489063,591233298.0,385347.0,"Smart Contract Platform, Wallets, Layer 2 (L2), Osmosis Ecosystem"
UNP,unipoly,Unipoly,UNP,54500241,195180464.0,809303.0,"Gaming (GameFi), Ethereum Ecosystem, Skale Ecosystem"
WHITE,whiteheart,Whiteheart,WHITE,53925642,53925642.0,1.99,"Decentralized Finance (DeFi), Derivatives, Ethereum Ecosystem"
WNXM,wrapped-nxm,Wrapped NXM,WNXM,51338216,51338216.0,1597781.0,"Crypto-Backed Tokens, Decentralized Finance (DeFi), Insurance, Wrapped-Tokens, Ethereum Ecosystem, Blockchain Capital Portfolio"
AVAIL,avail,Avail,AVAIL,48953553,202362193.0,3250437.0,"Infrastructure, Smart Contract Platform, BNB Chain Ecosystem, Ethereum Ecosystem, Data Availability, Modular Blockchain, Binance Alpha Spotlight"
HFT,hashflow,Hashflow,HFT,46416092,78499732.0,12353586.0,"Decentralized Exchange (DEX), Exchange-based Tokens, Decentralized Finance (DeFi), BNB Chain Ecosystem, Binance Launchpool, MEV Protection, Ethereum Ecosystem, Coinbase Ventures Portfolio, Alameda Research Portfolio, DragonFly Capital Portfolio, Galaxy Digital Portfolio"
STRIKE,strike,Strike,STRIKE,40470307,47040092.0,22720120.0,"Decentralized Finance (DeFi), Lending/Borrowing Protocols, Ethereum Ecosystem"
NCT,polyswarm,PolySwarm,NCT,40053629,40062388.0,916812.0,"Business Services, Polygon Ecosystem, Ethereum Ecosystem, Cybersecurity, Made in USA"
NYM,nym,Nym,NYM,34224170,42033218.0,1389714.0,"Smart Contract Platform, Privacy, Ethereum Ecosystem, DePIN, Osmosis Ecosystem, VPN, Andreessen Horowitz (a16z) Portfolio, YZi Labs (Prev. Binance Labs) Portfolio"
SYN,synapse-2,Synapse,SYN,29891071,34111864.0,12750807.0,"BNB Chain Ecosystem, Avalanche Ecosystem, Polygon Ecosystem, Fantom Ecosystem, Arbitrum Ecosystem, Olympus Pro Ecosystem, Ethereum Ecosystem, Optimism Ecosystem, Bridge Governance Tokens, Base Ecosystem, Alameda Research Portfolio, Intent"
PEP,pepecoin-network,Pepecoin,PEP,26018612,26018612.0,207799.0,"Smart Contract Platform, Layer 1 (L1), Meme, Frog-Themed, Proof of Work (PoW), The Boys Club, 4chan-Themed"
D,dar-open-network,Dar Open Network,D,24699436,30724871.0,9917445.0,"Gaming (GameFi), BNB Chain Ecosystem, Binance Launchpool, Play To Earn, Ethereum Ecosystem, Animoca Brands Portfolio, AI Agents"
INV,inverse-finance,Inverse Finance,INV,23596709,24318802.0,375217.0,"Decentralized Finance (DeFi), Yield Farming, Yield Aggregator, Lending/Borrowing Protocols, Olympus Pro Ecosystem, Ethereum Ecosystem, Fixed Interest"
KENDU,kendu-inu,Kendu Inu,KENDU,22383259,22492595.0,174153.0,"Solana Ecosystem, Meme, Ethereum Ecosystem, Base Ecosystem, Dog-Themed"
SWARMS,swarms,Swarms,SWARMS,22210271,22210271.0,5029126.0,"Artificial Intelligence (AI), Solana Ecosystem, AI Agents, Pump.fun Ecosystem, Binance Alpha Spotlight, AI Framework"
OCTA,octaspace,OctaSpace,OCTA,21688839,21688839.0,796501.0,"Artificial Intelligence (AI), Internet of Things (IOT), Smart Contract Platform, BNB Chain Ecosystem, Layer 1 (L1), Ethereum Ecosystem, DePIN, AI Agents"
SWEAT,sweatcoin,SWEAT,SWEAT,18596367,50964782.0,2902533.0,"Sports, Gaming (GameFi), BNB Chain Ecosystem, Solana Ecosystem, Avalanche Ecosystem, Polygon Ecosystem, Near Protocol Ecosystem, Play To Earn, Arbitrum Ecosystem, Celo Ecosystem, Move To Earn, Ethereum Ecosystem, Optimism Ecosystem, Aptos Ecosystem, Sui Ecosystem, Base Ecosystem, Gaming Governance Token, Gaming Utility Token, OKX Ventures Portfolio"
CHEQ,cheqd-network,CHEQD Network,CHEQ,16535319,21944770.0,303064.0,"Smart Contract Platform, Ethereum Ecosystem, Decentralized Identifier (DID), Zero Knowledge (ZK), Animoca Brands Portfolio, Osmosis Ecosystem, Outlier Ventures Portfolio"
ADS,adshares,Adshares,ADS,16383812,16390764.0,202124.0,"Business Services, Decentralized Finance (DeFi), BNB Chain Ecosystem, Metaverse, Polygon Ecosystem, Ethereum Ecosystem, Base Ecosystem"
BASEDAI,basedai,BasedAI,BASEDAI,15611248,15611248.0,68299.0,"Artificial Intelligence (AI), Ethereum Ecosystem, AI Agents"
J,jambo,Jambo,J,14668370,91103512.0,3193817.0,"Solana Ecosystem, Paradigm Portfolio, Coinbase Ventures Portfolio"
KASTA,kasta,Kasta,KASTA,14665289,28811966.0,3922032.0,Polygon Ecosystem
