UNP,unipoly,Unipoly,UNP,34130402,122230426.0,301744.0,"Gaming (GameFi), BNB Chain Ecosystem, Ethereum Ecosystem, Skale Ecosystem"
WNXM,wrapped-nxm,Wrapped NXM,WNXM,32851637,32851637.0,72128.0,"Crypto-Backed Tokens, Decentralized Finance (DeFi), Insurance, Wrapped-Tokens, Ethereum Ecosystem, Blockchain Capital Portfolio"
USTC,terrausd,TerraClassicUSD,USTC,32191513,35084471.0,3438528.0,"Stablecoins, USD Stablecoin, Seigniorage, Alleged SEC Securities, Osmosis Ecosystem, DeFiance Capital Portfolio, Terra Classic Ecosystem, YZi Labs (Prev. Binance Labs) Portfolio, Delphi Ventures Portfolio, Galaxy Digital Portfolio, Fiat-backed Stablecoin"
AVAIL,avail,Avail,AVAIL,30803626,91709105.0,6063089.0,"Infrastructure, Smart Contract Platform, BNB Chain Ecosystem, Ethereum Ecosystem, Data Availability, Modular Blockchain, Binance Alpha Spotlight"
ALI,alethea-artificial-liquid-intelligence-token,Artificial Liquid Intelligence,ALI,30022454,32501184.0,580693.0,"Artificial Intelligence (AI), NFT, Metaverse, Solana Ecosystem, Polygon Ecosystem, Ethereum Ecosystem, Cronos Ecosystem, Base Ecosystem, Multicoin Capital Portfolio, AI Agents, Alameda Research Portfolio, DeFiance Capital Portfolio, YZi Labs (Prev. Binance Labs) Portfolio, Airdropped Tokens by NFT Projects, Governance"
ADS,adshares,Adshares,ADS,28914353,28926504.0,831614.0,"Business Services, Decentralized Finance (DeFi), BNB Chain Ecosystem, Metaverse, Polygon Ecosystem, Ethereum Ecosystem, Base Ecosystem"
CETUS,cetus-protocol,Cetus Protocol,CETUS,26161219,30010376.0,6295775.0,"Decentralized Exchange (DEX), Exchange-based Tokens, Decentralized Finance (DeFi), Sui Ecosystem, Animoca Brands Portfolio, OKX Ventures Portfolio, Dex Aggregator"
AGLD,adventure-gold,Adventure Gold,AGLD,25129754,26682216.0,5529710.0,"Ethereum Ecosystem, DWF Labs Portfolio"
HFT,hashflow,Hashflow,HFT,23972829,37011265.0,18637550.0,"Decentralized Exchange (DEX), Exchange-based Tokens, Decentralized Finance (DeFi), BNB Chain Ecosystem, Binance Launchpool, MEV Protection, Ethereum Ecosystem, Coinbase Ventures Portfolio, Alameda Research Portfolio, DragonFly Capital Portfolio, Galaxy Digital Portfolio"
DODO,dodo,DODO,DODO,23400066,23400066.0,2548504.0,"Decentralized Exchange (DEX), Exchange-based Tokens, Decentralized Finance (DeFi), BNB Chain Ecosystem, Binance Launchpool, Polygon Ecosystem, Near Protocol Ecosystem, Arbitrum Ecosystem, Ethereum Ecosystem, DWF Labs Portfolio, Coinbase Ventures Portfolio, Alameda Research Portfolio, DeFiance Capital Portfolio, Pantera Capital Portfolio, Aurora Ecosystem, Energi Ecosystem, YZi Labs (Prev. Binance Labs) Portfolio, Galaxy Digital Portfolio, Made in China"
PIVX,pivx,PIVX,PIVX,20958079,20958201.0,4231922.0,"Smart Contract Platform, Privacy Coins, Masternodes, Zero Knowledge (ZK), Proof of Stake (PoS)"
FORTH,ampleforth-governance-token,Ampleforth Governance,FORTH,20404076,27134194.0,1726650.0,"Ethereum Ecosystem, Stablecoin Issuer, Governance"
INV,inverse-finance,Inverse Finance,INV,20279517,24410374.0,97917.0,"Decentralized Finance (DeFi), Yield Farming, Yield Aggregator, Olympus Pro Ecosystem, Ethereum Ecosystem, Fixed Interest"
ZRC,zircuit,Zircuit,ZRC,20228829,92161886.0,6632985.0,"Smart Contract Platform, BNB Chain Ecosystem, Ethereum Ecosystem, Layer 2 (L2), Zero Knowledge (ZK), Restaking, Zircuit Ecosystem"
NCT,polyswarm,PolySwarm,NCT,19976404,19980773.0,206092.0,"Business Services, Polygon Ecosystem, Ethereum Ecosystem, Cybersecurity, Made in USA"
ELX,elixir-finance,Elixir,ELX,19697751,75973831.0,5217579.0,"Decentralized Finance (DeFi), Ethereum Ecosystem, Real World Assets (RWA), Stablecoin Issuer, RWA Protocol"
SCR,scroll,Scroll,SCR,18141209,95480047.0,4682345.0,"Smart Contract Platform, Binance Launchpool, Layer 2 (L2), Scroll Ecosystem"
CWEB,coinweb,Coinweb,CWEB,15984863,18998459.0,128064.0,"Smart Contract Platform, Wallets, Ethereum Ecosystem, Interoperability, Layer 2 (L2), Cross-chain Communication, Bitcoin Sidechains, SideChain"
SYN,synapse-2,Synapse,SYN,13004985,14841365.0,2933362.0,"BNB Chain Ecosystem, Avalanche Ecosystem, Polygon Ecosystem, Fantom Ecosystem, Arbitrum Ecosystem, Olympus Pro Ecosystem, Ethereum Ecosystem, Optimism Ecosystem, Bridge Governance Tokens, Base Ecosystem, Alameda Research Portfolio, Intent"
SWEAT,sweatcoin,SWEAT,SWEAT,12000434,30600871.0,4251989.0,"Sports, Gaming (GameFi), BNB Chain Ecosystem, Solana Ecosystem, Avalanche Ecosystem, Polygon Ecosystem, Near Protocol Ecosystem, Play To Earn, Arbitrum Ecosystem, Celo Ecosystem, Move To Earn, Ethereum Ecosystem, Optimism Ecosystem, Aptos Ecosystem, Sui Ecosystem, Base Ecosystem, Gaming Governance Token, Gaming Utility Token, OKX Ventures Portfolio"
CHEQ,cheqd-network,CHEQD Network,CHEQ,11607741,15110775.0,464290.0,"Smart Contract Platform, Ethereum Ecosystem, Decentralized Identifier (DID), Zero Knowledge (ZK), Animoca Brands Portfolio, Osmosis Ecosystem, Outlier Ventures Portfolio"
PORTAL,portal-2,Portal,PORTAL,11011839,18449282.0,5038704.0,"Gaming (GameFi), Solana Ecosystem, Ethereum Ecosystem, Gaming Platform"
D,dar-open-network,Dar Open Network,D,10386432,12920205.0,8013272.0,"Gaming (GameFi), BNB Chain Ecosystem, Binance Launchpool, Play To Earn, Ethereum Ecosystem, Animoca Brands Portfolio, AI Agents"
OCTA,octaspace,OctaSpace,OCTA,9473960,9474184.0,207778.0,"Artificial Intelligence (AI), Internet of Things (IOT), Smart Contract Platform, BNB Chain Ecosystem, Layer 1 (L1), Ethereum Ecosystem, DePIN, AI Agents"
PNG,pangolin,Pangolin,PNG,9185396,22024582.0,640566.0,"Decentralized Exchange (DEX), Exchange-based Tokens, Decentralized Finance (DeFi), Avalanche Ecosystem, Olympus Pro Ecosystem"
ALU,altura,Altura,ALU,8452522,8452522.0,2385033.0,"Artificial Intelligence (AI), Infrastructure, Gaming (GameFi), NFT, BNB Chain Ecosystem, NFT Marketplace, Base Ecosystem, Gaming Platform, Made in USA, Gaming Marketplace"
TKO,tokocrypto,Tokocrypto,TKO,7705500,51370000.0,894474.0,"BNB Chain Ecosystem, Binance Launchpad, YZi Labs (Prev. Binance Labs) Portfolio"
IZI,izumi-finance,iZUMi Finance,IZI,7516439,19091794.0,63271.0,"Decentralized Exchange (DEX), Exchange-based Tokens, Decentralized Finance (DeFi), Automated Market Maker (AMM), BNB Chain Ecosystem, Polygon Ecosystem, Arbitrum Ecosystem, Ethereum Ecosystem, ZkSync Ecosystem, Mantle Ecosystem, Linea Ecosystem, Base Ecosystem, Manta Network Ecosystem, Scroll Ecosystem"
KENDU,kendu-inu,Kendu,KENDU,6609476,6638102.0,11891.93,"Solana Ecosystem, Meme, Ethereum Ecosystem, Base Ecosystem, Dog-Themed"
EVR,evernode,Evernode,EVR,6593690,13171591.0,8776.91,"Smart Contract Platform, Layer 2 (L2), DePIN"
FLAY,flayer,Flayer,FLAY,6148191,10246984.0,148578.0,"Launchpad, Ethereum Ecosystem"
UPC,upcx,UPCX,UPC,5964251,1121339630.0,672828.0,Ethereum Ecosystem
J,jambo,Jambo,J,5699708,35400221.0,770316.0,"Solana Ecosystem, Paradigm Portfolio, Coinbase Ventures Portfolio"
SHIDO,shido-2,Shido Network,SHIDO,5485056,5485065.0,129475.0,"Decentralized Finance (DeFi), Ethereum Ecosystem, Osmosis Ecosystem, Shido Network Ecosystem, Yield-Bearing"
QBX,qbx,QBX,QBX,4863390,4863390.0,56737.0,"Yield Farming, Ethereum Ecosystem"
GHUB,gemhub,GemHUB,GHUB,4640400,21158072.0,176329.0,"Gaming (GameFi), Kaia Ecosystem"
KASTA,kasta,Kasta,KASTA,4599916,9033192.0,332499.0,"Centralized Exchange (CEX) Token, Polygon Ecosystem, Payment Solutions"
POR,portugal-national-team-fan-token,Portugal National Team Fan Token,POR,4305958,12207469.0,374456.0,"Sports, Fan Token, Chiliz Ecosystem"
BASEDAI,basedai,BasedAI,BASEDAI,4035911,4035911.0,22524.0,"Artificial Intelligence (AI), Ethereum Ecosystem, AI Agents"
MODE,mode,Mode,MODE,3920654,7600622.0,463725.0,"Artificial Intelligence (AI), Infrastructure, Smart Contract Platform, Ethereum Ecosystem, Optimism Ecosystem, Layer 2 (L2), Mode Ecosystem, Optimism Superchain Ecosystem, DeFAI"
BENJI,basenji,Basenji,BENJI,3895173,3895173.0,315631.0,"Meme, Base Ecosystem, Dog-Themed, Base Meme, IP Meme"
STAT,stat,STAT,STAT,3206385,4093313.0,664440.0,"Media, Ethereum Ecosystem"
DEOD,decentrawood,Decentrawood,DEOD,3184829,3184829.0,214338.0,"Gaming (GameFi), BNB Chain Ecosystem, Metaverse, Solana Ecosystem, Polygon Ecosystem"
TICO,tico,Funtico,TICO,3107119,14524171.0,156477.0,"Gaming (GameFi), Avalanche Ecosystem, RPG"
WINR,winr-protocol,WINR Protocol,WINR,3079783,3188722.0,24299.0,"Gambling (GambleFi), Infrastructure, Smart Contract Platform, Solana Ecosystem, Arbitrum Ecosystem, Camelot Launchpad, Layer 3 (L3)"
MAVIA,heroes-of-mavia,Heroes of Mavia,MAVIA,3079299,14913536.0,7189304.0,"Gaming (GameFi), NFT, BNB Chain Ecosystem, Ethereum Ecosystem, Animoca Brands Portfolio, Base Ecosystem, Gaming Governance Token, Strategy Games, Alameda Research Portfolio, YZi Labs (Prev. Binance Labs) Portfolio, Delphi Ventures Portfolio, Action Games"
4EVER,4everland,4EVERLAND,4EVER,2897685,10137672.0,49330.0,"Artificial Intelligence (AI), BNB Chain Ecosystem, Ethereum Ecosystem, DePIN, AI Framework"
SRM,serum,Serum,SRM,2690451,7887300.0,77984.0,"Decentralized Exchange (DEX), Exchange-based Tokens, Decentralized Finance (DeFi), Solana Ecosystem, Ethereum Ecosystem, FTX Holdings, Multicoin Capital Portfolio, Energi Ecosystem, Viction Ecosystem"
SNAI,swarmnode-ai,SwarmNode.ai,SNAI,2330451,2330451.0,467808.0,"Artificial Intelligence (AI), Infrastructure, Solana Ecosystem, Pump.fun Ecosystem, AI Agent Launchpad, Binance Alpha Spotlight, AI Framework, DeFAI"
RMV,reality-metaverse,Reality Metaverse,RMV,2283004,3065956.0,68619.0,"Gaming (GameFi), NFT, Metaverse, Polygon Ecosystem, Play To Earn, Ethereum Ecosystem, DWF Labs Portfolio, Gaming Utility Token"
CDX,cod3x,Cod3x,CDX,2217516,2217516.0,5889.67,"Artificial Intelligence (AI), Solana Ecosystem, Base Ecosystem, AI Agent Launchpad, AI Framework, DeFAI, x402 Ecosystem"
ALVA,alvara-protocol,Alvara Protocol,ALVA,2114793,5185769.0,154756.0,"Decentralized Finance (DeFi), Avalanche Ecosystem, Ethereum Ecosystem"
GTAI,gt-protocol,GT Protocol,GTAI,2105477,3891635.0,201466.0,"Artificial Intelligence (AI), BNB Chain Ecosystem, DeFAI"
GLQ,graphlinq-protocol,GraphLinq Chain,GLQ,2020229,2970925.0,110601.0,"Artificial Intelligence (AI), Business Services, Infrastructure, Smart Contract Platform, Analytics, Layer 1 (L1), Ethereum Ecosystem, DWF Labs Portfolio, AI Agents, DeFAI"
ALON,alon,Alon,ALON,1855484,1855484.0,215442.0,"Solana Ecosystem, Pump.fun Ecosystem, Binance Alpha Spotlight"
CORE,core-2,Core,CORE,1628552,1628552.0,10140.02,"Solana Ecosystem, Pump.fun Ecosystem"
HDRO,hydro-protocol-2,Hydro Protocol,HDRO,1542863,3610804.0,13323.13,"Injective Ecosystem, Liquid Staking"
MASK,catwifmask,catwifmask,MASK,1540993,1540993.0,384646.0,"Solana Ecosystem, Meme, Solana Meme, Cat-Themed, Pump.fun Ecosystem"
ZYN,zyncoin-2,ZynCoin,ZYN,1427682,1427682.0,50342.0,"Solana Ecosystem, Meme, Ethereum Ecosystem, Parody Meme"
MLG,360noscope420blazeit,360noscope420blazeit,MLG,1402245,1402245.0,222824.0,"Solana Ecosystem, Meme, Solana Meme"
SMURFCAT,real-smurf-cat,Real Smurf Cat,SMURFCAT,1369466,1369466.0,182129.0,"Solana Ecosystem, Meme, Arbitrum Ecosystem, Ethereum Ecosystem, Cat-Themed"
TREAT,shiba-inu-treat,Shiba Inu Treat,TREAT,1337569,6216549.0,398981.0,"Meme, Ethereum Ecosystem, Dog-Themed"
FLIX,omniflix-network,OmniFlix Network,FLIX,1323710,1454938.0,601.05,"NFT, Osmosis Ecosystem, Archway Ecosystem"
BAX,babb,BABB,BAX,1295209,1301718.0,249149.0,Ethereum Ecosystem
OFN,openfabric,Openfabric AI,OFN,1293122,1293122.0,81507.0,"Artificial Intelligence (AI), BNB Chain Ecosystem, ChainGPT Launchpad, Poolz Finance Launchpad, AI Agents, AI Applications, AI Framework, Governance"
GENOME,genomesdao-genome,GenomesDAO GENOME,GENOME,1260471,1260471.0,59359.0,"Ethereum Ecosystem, Base Ecosystem, Decentralized Science (DeSci)"
PI,pchain,Plian,PI,964657,1478512.0,10337.95,"Smart Contract Platform, Proof of Stake (PoS)"
STETH,staked-ether,Lido Staked Ether,STETH,24120001763,24121652659.0,33660223.0,"Decentralized Finance (DeFi), Liquid Staking Tokens, Ethereum Ecosystem, Liquid Staked ETH, Liquid Staking"
HTX,htx-dao,HTX DAO,HTX,1594924655,1594924655.0,11270303.0,"Exchange-based Tokens, BNB Chain Ecosystem, Centralized Exchange (CEX) Token, Ethereum Ecosystem, Tron Ecosystem"
VET,vechain,VeChain,VET,1114183076,1114183076.0,21695680.0,"Internet of Things (IOT), Smart Contract Platform, Layer 1 (L1), VeChain Ecosystem, Made in China"
TWT,trust-wallet-token,Trust Wallet,TWT,441356508,1059298246.0,17189851.0,"BNB Chain Ecosystem, Wallets, Account Abstraction, Energi Ecosystem"
GALA,gala,GALA,GALA,346689934,346689934.0,37887272.0,"Smart Contract Platform, Gaming (GameFi), NFT, Layer 1 (L1), Play To Earn, Ethereum Ecosystem, DWF Labs Portfolio, Gaming Platform, YZi Labs (Prev. Binance Labs) Portfolio, GalaChain Ecosystem, Made in USA"
ZRO,layerzero,LayerZero,ZRO,251295776,1253002429.0,22039940.0,"Smart Contract Platform, BNB Chain Ecosystem, Avalanche Ecosystem, Polygon Ecosystem, Arbitrum Ecosystem, Ethereum Ecosystem, Optimism Ecosystem, Base Ecosystem, Multicoin Capital Portfolio, Layer 0 (L0), Cross-chain Communication, Circle Ventures Portfolio, Sequoia Capital Portfolio, OKX Ventures Portfolio"
KAITO,kaito,KAITO,KAITO,157866464,653992255.0,19095236.0,"Artificial Intelligence (AI), Analytics, Launchpad, Base Ecosystem, Binance HODLer Airdrops, InfoFi, Governance"
BLUR,blur,Blur,BLUR,99312114,113954560.0,9329288.0,"NFT, Ethereum Ecosystem, NFT Marketplace, FTX Holdings, NFTFi, eGirl Capital Portfolio, Paradigm Portfolio, GMCI DeFi Index, GMCI Index, Made in USA, Coinbase 50 Index"
HOT,holotoken,Holo,HOT,98224079,98224079.0,5472615.0,"Smart Contract Platform, Storage, Harmony Ecosystem, Arbitrum Ecosystem, Ethereum Ecosystem, DePIN, Base Ecosystem, Energi Ecosystem, Sora Ecosystem, GMCI DePIN Index, GMCI Index"
MOCA,mocaverse,Moca Network,MOCA,97866070,220083056.0,7439164.0,"Gaming (GameFi), Ethereum Ecosystem, Decentralized Identifier (DID), Animoca Brands Portfolio, Base Ecosystem, OKX Ventures Portfolio, Outlier Ventures Portfolio"
EDU,edu-coin,Open Campus,EDU,95189818,153263587.0,11295248.0,"Education, BNB Chain Ecosystem, Polygon Ecosystem, Ethereum Ecosystem, Binance Launchpad, YZi Labs (Prev. Binance Labs) Portfolio"
CSPR,casper-network,Casper Network,CSPR,80752963,83605713.0,2195975.0,"Smart Contract Platform, Layer 1 (L1), Real World Assets (RWA), Proof of Stake (PoS), GMCI Layer 1 Index, GMCI Index, Made in USA"
HSK,hashkey-ecopoints,HashKey Platform Token,HSK,78870429,255475597.0,1301896.0,"Exchange-based Tokens, Centralized Exchange (CEX) Token, Ethereum Ecosystem, Governance"
ANKR,ankr,Ankr Network,ANKR,78417862,78417862.0,5043941.0,"BNB Chain Ecosystem, Avalanche Ecosystem, Polygon Ecosystem, Fantom Ecosystem, Arbitrum Ecosystem, Ethereum Ecosystem, Optimism Ecosystem, Liquid Staking Governance Tokens, Linea Ecosystem, DePIN, Scroll Ecosystem, Rollups-as-a-Service (RaaS), Blast Ecosystem, Mode Ecosystem, Pantera Capital Portfolio, Polygon zkEVM Ecosystem, YZi Labs (Prev. Binance Labs) Portfolio, Liquid Staking, Made in USA, Governance"
OMI,ecomi,ECOMI,OMI,68600270,78710072.0,5193019.0,"Gaming (GameFi), NFT, Metaverse, Collectibles, Play To Earn, Ethereum Ecosystem, Base Ecosystem, Energi Ecosystem"
XVS,venus,Venus,XVS,66171623,117504529.0,10153082.0,"Decentralized Finance (DeFi), Yield Farming, BNB Chain Ecosystem, Binance Launchpool, Lending/Borrowing Protocols, Arbitrum Ecosystem, Ethereum Ecosystem, Optimism Ecosystem, ZkSync Ecosystem, opBNB Ecosystem, Unichain Ecosystem"
GOHOME,gohome,GOHOME,GOHOME,64887936,1236810214.0,2704452.0,"Solana Ecosystem, Meme"
MPLX,metaplex,Metaplex,MPLX,51254025,91102884.0,4048710.0,"Gaming (GameFi), NFT, BNB Chain Ecosystem, Solana Ecosystem, Launchpad, Animoca Brands Portfolio, FTX Holdings, Multicoin Capital Portfolio, Alameda Research Portfolio, Binance Alpha Spotlight"
BLAST,blast,Blast,BLAST,50546839,100384308.0,9017697.0,"Smart Contract Platform, Layer 2 (L2), eGirl Capital Portfolio, Paradigm Portfolio, Blast Ecosystem"
ACT,acet-token,Acet,ACT,47744000,62288726.0,53083.0,BNB Chain Ecosystem
JELLYJELLY,jelly-my-jelly,Jelly-My-Jelly,JELLYJELLY,38344661,38344661.0,16086419.0,"Solana Ecosystem, Pump.fun Ecosystem, Binance Alpha Spotlight"
RIF,rif-token,Rootstock Infrastructure Framework,RIF,37164625,37164625.0,522443.0,"Solana Ecosystem, Arbitrum Ecosystem, Ethereum Ecosystem, Base Ecosystem, Rootstock Ecosystem, Outlier Ventures Portfolio"
PHA,pha,PHALA,PHA,36886980,45198891.0,9316754.0,"Artificial Intelligence (AI), Infrastructure, Smart Contract Platform, Oracle, Polkadot Ecosystem, Ethereum Ecosystem, Interoperability, Layer 2 (L2), Zero Knowledge (ZK), DePIN, DWF Labs Portfolio, Rollup, AI Agents, Sora Ecosystem, AI Framework, Made in USA"
CTK,certik,Shentu,CTK,36738420,37578101.0,2181432.0,"Business Services, Binance Launchpool, Osmosis Ecosystem, Coinbase Ventures Portfolio, Cybersecurity, YZi Labs (Prev. Binance Labs) Portfolio, OKX Ventures Portfolio"
SAROS,saros-finance,Saros,SAROS,32269262,122930530.0,2160955.0,"Decentralized Exchange (DEX), Exchange-based Tokens, Decentralized Finance (DeFi), Solana Ecosystem, Viction Ecosystem, Binance Alpha Spotlight"
KUJI,kujira,Kujira,KUJI,30629900,30637971.0,751.81,"Smart Contract Platform, Decentralized Finance (DeFi), BNB Chain Ecosystem, Layer 1 (L1), Arbitrum Ecosystem, Ethereum Ecosystem, Optimism Ecosystem, Osmosis Ecosystem, Secret Ecosystem"
GLMR,moonbeam,Moonbeam,GLMR,28310387,33166670.0,2348256.0,"Smart Contract Platform, Polkadot Ecosystem, Layer 1 (L1), Coinbase Ventures Portfolio, Proof of Stake (PoS), YZi Labs (Prev. Binance Labs) Portfolio"
QI,benqi,BENQI,QI,27139871,27139871.0,788268.0,"Decentralized Finance (DeFi), Yield Farming, Binance Launchpool, Lending/Borrowing Protocols, Avalanche Ecosystem, Liquid Staking Governance Tokens, DragonFly Capital Portfolio, Liquid Staking"
C98,coin98,Coin98,C98,27001470,27001499.0,5968430.0,"Decentralized Finance (DeFi), BNB Chain Ecosystem, Perpetuals, Solana Ecosystem, Wallets, Polygon Ecosystem, Ethereum Ecosystem, Binance Launchpad, DWF Labs Portfolio, Multicoin Capital Portfolio, Alameda Research Portfolio, Viction Ecosystem, YZi Labs (Prev. Binance Labs) Portfolio"
SSV,ssv-network,SSV Network,SSV,26587936,55156468.0,7693040.0,"Decentralized Finance (DeFi), Ethereum Ecosystem, Restaking, Coinbase Ventures Portfolio, OKX Ventures Portfolio, Liquid Staking"
WILD,wilder-world,Wilder World,WILD,24411285,30966629.0,758375.0,"Gaming (GameFi), NFT, BNB Chain Ecosystem, Metaverse, Solana Ecosystem, Avalanche Ecosystem, Polygon Ecosystem, Play To Earn, Ethereum Ecosystem, Animoca Brands Portfolio, Base Ecosystem, Gaming Governance Token, Racing Games, Simulation Games, Action Games"
ZEREBRO,zerebro,Zerebro,ZEREBRO,23150002,23150002.0,8978534.0,"Solana Ecosystem, Meme, Solana Meme, AI Meme, Pump.fun Ecosystem, Binance Alpha Spotlight"
STORJ,storj,Storj,STORJ,21388093,63217896.0,6919160.0,"Storage, Harmony Ecosystem, Ethereum Ecosystem, DePIN, Energi Ecosystem"
TRIBE,tribe-2,Tribe,TRIBE,20186558,492295859.0,66443.0,"Decentralized Finance (DeFi), Ethereum Ecosystem, Stablecoin Issuer"
MMUI,metamui,MetaMUI,MMUI,19479366,32747018.0,574253.0,"Avalanche Ecosystem, Decentralized Identifier (DID)"
PHB,phoenix-global,Phoenix,PHB,19408615,19408615.0,9543134.0,"Artificial Intelligence (AI), Oracle, NFT, BNB Chain Ecosystem, DePIN, Made in China"
OORT,oort,OORT,OORT,17119432,52782650.0,296781.0,"Artificial Intelligence (AI), Storage, BNB Chain Ecosystem, Ethereum Ecosystem, DePIN, AI Agents, Made in USA"
MNSRY,mansory-token,Mansory Token,MNSRY,15421857,15421857.0,1399362.0,"Retail, BNB Chain Ecosystem, Solana Ecosystem, Real World Assets (RWA), Pump.fun Ecosystem"
LAT,platon-network,PlatON Network,LAT,14859107,22549999.0,3613272.0,"Smart Contract Platform, Appchains"
RACA,radio-caca,Radio Caca,RACA,14027057,14163351.0,1665227.0,"Gaming (GameFi), NFT, BNB Chain Ecosystem, Metaverse, Play To Earn, Ethereum Ecosystem, DWF Labs Portfolio, OKT Chain Ecosystem"
NEON,neon,Neon,NEON,13564148,56643432.0,693623.0,"Smart Contract Platform, Solana Ecosystem, Neon Ecosystem, Parallelized EVM"
GHST,aavegotchi,Aavegotchi,GHST,13076541,13483112.0,2324124.0,"Smart Contract Platform, Gaming (GameFi), NFT, Metaverse, Collectibles, Polygon Ecosystem, Meme, Play To Earn, Ethereum Ecosystem, Gotchiverse, Base Ecosystem, Layer 3 (L3), RPG, Gaming Governance Token, Gaming Utility Token, Energi Ecosystem, Governance"
SFI,saffron-finance,saffron.finance,SFI,13025570,14990854.0,16835.57,"Decentralized Finance (DeFi), Yield Farming, Ethereum Ecosystem, Fixed Interest, Coinbase Ventures Portfolio, Multicoin Capital Portfolio, DragonFly Capital Portfolio, Energi Ecosystem"
BR,bedrock-token,Bedrock,BR,12865333,58478785.0,1546012.0,"Decentralized Finance (DeFi), BNB Chain Ecosystem, Ethereum Ecosystem, Liquid Staking Governance Tokens, Base Ecosystem, Berachain Ecosystem, BTCfi Protocol, Binance Wallet IDO"
BEL,bella-protocol,Bella Protocol,BEL,12382306,15477883.0,3292658.0,"Decentralized Finance (DeFi), Yield Farming, BNB Chain Ecosystem, Binance Launchpool, Yield Aggregator, Ethereum Ecosystem, Manta Network Ecosystem, YZi Labs (Prev. Binance Labs) Portfolio"
PIKA,pikaboss,Pikaboss,PIKA,11939918,11939918.0,3408.18,"Meme, Ethereum Ecosystem"
NIBI,nibiru,Nibiru,NIBI,11922985,14101922.0,1061253.0,"Infrastructure, Smart Contract Platform, Layer 1 (L1), Osmosis Ecosystem, Made in USA"
ZEPH,zephyr-protocol,Zephyr Protocol,ZEPH,10689495,10689495.0,446485.0,"Smart Contract Platform, Privacy Coins, Proof of Work (PoW), Stablecoin Issuer, Privacy Blockchain"
QUICK,quick,Quickswap [OLD],QUICK,10344921,14522196.0,5357.51,"Decentralized Exchange (DEX), Exchange-based Tokens, Decentralized Finance (DeFi), Yield Farming, Automated Market Maker (AMM), Polygon Ecosystem, Ethereum Ecosystem"
DREAMS,daydreams,Daydreams,DREAMS,10301981,12811806.0,1450133.0,"Artificial Intelligence (AI), Solana Ecosystem, Base Ecosystem, Starknet Ecosystem, AI Framework, x402 Ecosystem"
AVA,ava-ai,Ava AI,AVA,9914000,9914000.0,2823198.0,"Artificial Intelligence (AI), Solana Ecosystem, Meme, AI Meme, AI Agents, Pump.fun Ecosystem, Binance Alpha Spotlight, Made in USA"
STNK,stonks-4,Stonks,STNK,9867464,9867464.0,215494.0,"Solana Ecosystem, Meme, Solana Meme, Wall Street Bets Themed, Stock market-themed, IP Meme"
PROPC,propchain,Propchain,PROPC,9718585,14530097.0,419529.0,"Ethereum Ecosystem, Real World Assets (RWA)"
UFD,unicorn-fart-dust,Unicorn Fart Dust,UFD,9677570,9677570.0,4406218.0,"Solana Ecosystem, Meme, Solana Meme, Pump.fun Ecosystem, Binance Alpha Spotlight, Made in USA"
DYDX,dydx,dYdX,ETHDYDX,9655222,200875614.0,18512156.0,"Decentralized Exchange (DEX), Exchange-based Tokens, Decentralized Finance (DeFi), Derivatives, Perpetuals, Ethereum Ecosystem, Paradigm Portfolio"
RNT,reental,Reental,RNT,9501983,35832801.0,11483.72,"Tokenized Real Estate, Tokenized Assets, Polygon Ecosystem, Real World Assets (RWA), RWA Protocol"
CXT,covalent-x-token,Covalent X Token,CXT,8458207,8458221.0,821703.0,"Artificial Intelligence (AI), Infrastructure, Decentralized Finance (DeFi), Ethereum Ecosystem, Base Ecosystem, Data Availability, Coinbase Ventures Portfolio, YZi Labs (Prev. Binance Labs) Portfolio"
GHX,gamercoin,GamerCoin,GHX,8352612,9602609.0,191025.0,"Artificial Intelligence (AI), Infrastructure, BNB Chain Ecosystem, Solana Ecosystem, Ethereum Ecosystem, DePIN, AI Applications"
DINERO,dinero-2,Dinero,DINERO,8205122,12247360.0,10631.45,"Infrastructure, Decentralized Finance (DeFi), Ethereum Ecosystem, Metagovernance, Liquid Staking Governance Tokens, LSDFi, Curve Ecosystem, Liquid Staking"
M87,messier,MESSIER,M87,8059486,8059486.0,394293.0,"Artificial Intelligence (AI), Decentralized Exchange (DEX), Decentralized Finance (DeFi), Ethereum Ecosystem, Zero Knowledge (ZK)"
SFUND,seedify-fund,Seedify.fund,SFUND,7921132,9543533.0,952853.0,"Gaming (GameFi), BNB Chain Ecosystem, Launchpad, DWF Labs Portfolio"
KOMA,koma-inu,Koma Inu,KOMA,7902876,7902876.0,911714.0,"BNB Chain Ecosystem, Meme, Dog-Themed, Binance Alpha Spotlight, Made in USA"
FIS,stafi,Stafi,FIS,7117825,7117825.0,2980313.0,"Decentralized Finance (DeFi), Ethereum Ecosystem, Liquid Staking Governance Tokens, Osmosis Ecosystem, Sora Ecosystem, Liquid Staking"
LOFI,lofi-2,LOFI,LOFI,7106932,7106932.0,456062.0,"Meme, Sui Ecosystem, Sui Meme"
XSWAP,xswap-2,XSwap,XSWAP,6706440,7619290.0,281750.0,"Decentralized Finance (DeFi), Ethereum Ecosystem, Base Ecosystem, Cross-chain Communication"
CAM,camino-network,Camino Network,CAM,6681444,15811776.0,48059.0,"Smart Contract Platform, Layer 1 (L1), Outlier Ventures Portfolio"
CATE,catecoin,CateCoin,CATE,6563259,6823234.0,894807.0,"Entertainment, Gaming (GameFi), Yield Farming, NFT, BNB Chain Ecosystem, Yield Aggregator, Launchpad, Wallets, Meme, Play To Earn, Ethereum Ecosystem, Base Ecosystem, Cat-Themed"
REN,republic-protocol,Ren,REN,6434609,6434609.0,749940.0,"Decentralized Finance (DeFi), Near Protocol Ecosystem, Harmony Ecosystem, Ethereum Ecosystem, Multicoin Capital Portfolio, Alameda Research Portfolio, Energi Ecosystem, Sora Ecosystem"
SPARKLET,upland,Upland,SPARKLET,6251337,24886917.0,289754.0,"Gaming (GameFi), NFT, Metaverse, Play To Earn, Ethereum Ecosystem, Animoca Brands Portfolio, Made in USA"
STUFF,book-2,STUFF.io,STUFF,6031132,13898112.0,7758.21,"NFT, Cardano Ecosystem, NFT Marketplace, NFT Launchpad"
OPUL,opulous,Opulous,OPUL,5740071,5740071.0,1624178.0,"Artificial Intelligence (AI), Music, NFT, BNB Chain Ecosystem, Arbitrum Ecosystem, Ethereum Ecosystem, Algorand Ecosystem, Real World Assets (RWA), Telegram Apps, AI Applications"
XEL,xelis,Xelis,XEL,5592185,5592507.0,65083.0,"Smart Contract Platform, Privacy Coins, Layer 1 (L1), Directed Acyclic Graph (DAG)"
