UPC,upcx,UPCX,UPC,14308535,2690149469.0,1250818.0,Ethereum Ecosystem
PIVX,pivx,PIVX,PIVX,14102643,14102643.0,2313675.0,"Smart Contract Platform, Privacy, Masternodes, Zero Knowledge (ZK), Proof of Stake (PoS)"
QBX,qbx,QBX,QBX,12588819,12588819.0,450967.0,Ethereum Ecosystem
TKO,tokocrypto,Tokocrypto,TKO,12469940,83132937.0,1370532.0,"BNB Chain Ecosystem, Binance Launchpad, YZi Labs (Prev. Binance Labs) Portfolio"
FLAY,flayer,Flayer,FLAY,11452226,19087044.0,28089.0,"Launchpad, Ethereum Ecosystem"
CEEK,ceek,CEEK Smart VR,CEEK,11093570,11460301.0,1585332.0,"Entertainment, BNB Chain Ecosystem, Metaverse, Ethereum Ecosystem, DWF Labs Portfolio"
MLG,360noscope420blazeit,360noscope420blazeit,MLG,10748102,10748102.0,529739.0,"Solana Ecosystem, Meme, Solana Meme"
ALEX,alexgo,ALEX Lab,ALEX,10378089,12113907.0,293797.0,"Decentralized Finance (DeFi), Lending/Borrowing Protocols, Ethereum Ecosystem, DWF Labs Portfolio, Mode Ecosystem, Stacks Ecosystem, BTCfi Protocol"
ALU,altura,Altura,ALU,10346358,10346358.0,7438038.0,"Artificial Intelligence (AI), Infrastructure, Gaming (GameFi), NFT, BNB Chain Ecosystem, NFT Marketplace, Base Ecosystem, Gaming Platform, Made in USA, Gaming Marketplace"
MAVIA,heroes-of-mavia,Heroes of Mavia,MAVIA,9439562,45717303.0,3565950.0,"Gaming (GameFi), NFT, Ethereum Ecosystem, Animoca Brands Portfolio, Base Ecosystem, Gaming Governance Token, Strategy Games, Alameda Research Portfolio, YZi Labs (Prev. Binance Labs) Portfolio, Delphi Ventures Portfolio, Action Games"
PORTAL,portal-2,Portal,PORTAL,9327311,55807179.0,13447928.0,"Gaming (GameFi), Solana Ecosystem, Ethereum Ecosystem, Gaming Platform"
GRAIL,camelot-token,Camelot Token,GRAIL,8900472,34270186.0,169020.0,"Decentralized Exchange (DEX), Arbitrum Ecosystem, Camelot Launchpad"
MODE,mode,Mode,MODE,7570069,28047276.0,985700.0,"Artificial Intelligence (AI), Infrastructure, Smart Contract Platform, Layer 2 (L2), Mode Ecosystem, Optimism Superchain Ecosystem, DeFAI"
GLQ,graphlinq-protocol,GraphLinq Chain,GLQ,7560960,11119058.0,240634.0,"Artificial Intelligence (AI), Business Services, Infrastructure, Smart Contract Platform, Analytics, Layer 1 (L1), Ethereum Ecosystem, DWF Labs Portfolio, AI Agents, DeFAI"
FNCT,financie-token,Financie Token,FNCT,7537903,37040987.0,102105.0,Ethereum Ecosystem
TRADE,polytrade,Polytrade,TRADE,6918502,16104571.0,272120.0,"BNB Chain Ecosystem, Polygon Ecosystem, Arbitrum Ecosystem, Ethereum Ecosystem, Real World Assets (RWA), Base Ecosystem, DWF Labs Portfolio"
ZYN,zyncoin-2,ZynCoin,ZYN,6691420,6691420.0,118111.0,"Solana Ecosystem, Meme, Ethereum Ecosystem, Parody Meme"
GTAI,gt-protocol,GT Protocol,GTAI,6485967,11988264.0,881354.0,"Artificial Intelligence (AI), BNB Chain Ecosystem, DeFAI"
SMURFCAT,real-smurf-cat,Real Smurf Cat,SMURFCAT,6143304,6143304.0,176399.0,"Solana Ecosystem, Meme, Arbitrum Ecosystem, Ethereum Ecosystem, Cat-Themed"
FLIX,omniflix-network,OmniFlix Network,FLIX,6078552,6731665.0,113198.0,"NFT, Osmosis Ecosystem, Archway Ecosystem"
WEXO,wexo,Wexo,WEXO,6058949,15883377.0,154887.0,"Ethereum Ecosystem, Base Ecosystem"
QORPO,qopro,QORPO WORLD,QORPO,5430955,9607678.0,1207048.0,"Gaming (GameFi), NFT, BNB Chain Ecosystem, Play To Earn, Ethereum Ecosystem, RPG, Gaming Utility Token, Adventure Games, Gaming Platform, Action Games"
SRM,serum,Serum,SRM,5249265,15388694.0,151618.0,"Decentralized Exchange (DEX), Exchange-based Tokens, Decentralized Finance (DeFi), Solana Ecosystem, Ethereum Ecosystem, FTX Holdings, Multicoin Capital Portfolio, Energi Ecosystem, Viction Ecosystem"
TREAT,shiba-inu-treat,Shiba Inu Treat,TREAT,4930712,22916211.0,1081678.0,"Meme, Ethereum Ecosystem, Dog-Themed"
STAT,stat,STAT,STAT,4767725,6515664.0,167415.0,"Media, Ethereum Ecosystem"
GENOME,genomesdao-genome,GenomesDAO GENOME,GENOME,4754575,4754575.0,59636.0,"Ethereum Ecosystem, Base Ecosystem, Decentralized Science (DeSci)"
DEOD,decentrawood,Decentrawood,DEOD,4589244,4589244.0,186248.0,"Gaming (GameFi), BNB Chain Ecosystem, Metaverse, Solana Ecosystem, Polygon Ecosystem"
SOLAMA,solama,Solama,SOLAMA,4533487,4533487.0,198428.0,"Gambling (GambleFi), Solana Ecosystem, Meme, Solana Meme"
FUTURE,futurecoin,FutureCoin,FUTURE,4375189,13577987.0,59470.0,BNB Chain Ecosystem
POLYDOGE,polydoge,PolyDoge,POLYDOGE,4293154,4299212.0,398742.0,"NFT, Polygon Ecosystem, Meme, Dog-Themed"
CANTO,canto,CANTO,CANTO,4239234,6967088.0,251236.0,"Smart Contract Platform, Layer 1 (L1), Ethereum Ecosystem, Canto Ecosystem, Real World Assets (RWA), Osmosis Ecosystem, Parallelized EVM"
ARCA,arca,Legend of Arcadia,ARCA,3758502,16809284.0,392316.0,"Gaming (GameFi), Ethereum Ecosystem, RPG"
SHIDO,shido-2,Shido Network,SHIDO,3732743,3732749.0,144548.0,"Ethereum Ecosystem, Osmosis Ecosystem, Shido Network Ecosystem"
IZI,izumi-finance,iZUMi Finance,IZI,3493743,8874125.0,385366.0,"Decentralized Exchange (DEX), Decentralized Finance (DeFi), Automated Market Maker (AMM), BNB Chain Ecosystem, Polygon Ecosystem, Arbitrum Ecosystem, Ethereum Ecosystem, ZkSync Ecosystem, Mantle Ecosystem, Linea Ecosystem, Base Ecosystem, Manta Network Ecosystem, Scroll Ecosystem"
POR,portugal-national-team-fan-token,Portugal National Team Fan Token,POR,3351249,15872481.0,490617.0,"Sports, Fan Token, Chiliz Ecosystem"
VGX,ethos,VGX Token,VGX,3336426,3345710.0,923139.0,"Gaming (GameFi), Ethereum Ecosystem, Galaxy Digital Portfolio"
BAX,babb,BABB,BAX,2941036,2959534.0,161174.0,Ethereum Ecosystem
FORWARD,forward,Forward,FORWARD,2924859,2928170.0,545430.0,"BNB Chain Ecosystem, Ethereum Ecosystem"
HXD,honeyland-honey,Honeyland,HXD,2791003,6361967.0,174321.0,"Gaming (GameFi), NFT, Solana Ecosystem, Play To Earn, Breeding, Gaming Utility Token, Strategy Games"
4EVER,4everland,4EVERLAND,4EVER,2637739,14536332.0,275013.0,"Artificial Intelligence (AI), BNB Chain Ecosystem, Ethereum Ecosystem, DePIN, AI Framework"
WINR,winr-protocol,WINR Protocol,WINR,2625838,3602079.0,42888.0,"Gambling (GambleFi), Infrastructure, Smart Contract Platform, Solana Ecosystem, Arbitrum Ecosystem, Camelot Launchpad, Layer 3 (L3)"
MUMU,mumu,Mumu,MUMU,2623433,2623433.0,60582.0,"Meme, Ethereum Ecosystem, 4chan-Themed"
CDX,cod3x,Cod3x,CDX,2413148,2413148.0,10488.83,"Artificial Intelligence (AI), Solana Ecosystem, Base Ecosystem, AI Agent Launchpad, AI Framework, DeFAI"
YULI,yuli,YULI,YULI,2334939,2334939.0,86044.0,"Gaming (GameFi), NFT, Meme, Kaia Ecosystem, Card Games, Gaming Utility Token, Anime-Themed"
MOVE,bluemove,BlueMove,MOVE,2210368,3048783.0,57898.0,"NFT, Aptos Ecosystem, Sui Ecosystem"
STETH,staked-ether,Lido Staked Ether,STETH,32664656863,32664829149.0,52640406.0,"Decentralized Finance (DeFi), Liquid Staking Tokens, Ethereum Ecosystem, Liquid Staked ETH, Liquid Staking"
APT,aptos,Aptos,APT,3450913285,6070232487.0,216582040.0,"Smart Contract Platform, Layer 1 (L1), Aptos Ecosystem, FTX Holdings, Coinbase Ventures Portfolio, Multicoin Capital Portfolio, Proof of Stake (PoS), DragonFly Capital Portfolio, Andreessen Horowitz (a16z) Portfolio, YZi Labs (Prev. Binance Labs) Portfolio, GMCI Layer 1 Index, GMCI 30 Index, Circle Ventures Portfolio, GMCI Index, Made in USA"
VET,vechain,VeChain,VET,2389197336,2389197336.0,52082268.0,"Internet of Things (IOT), Smart Contract Platform, Layer 1 (L1), VeChain Ecosystem, Made in China"
SAROS,saros-finance,Saros,SAROS,709245355,2701887245.0,12009476.0,"Solana Ecosystem, Payment Solutions, Viction Ecosystem"
KAITO,kaito,KAITO,KAITO,396583657,1642924238.0,22398147.0,"Artificial Intelligence (AI), Analytics, Base Ecosystem, Binance HODLer Airdrops, InfoFi"
TWT,trust-wallet-token,Trust Wallet,TWT,346139592,830768452.0,8744086.0,"BNB Chain Ecosystem, Wallets, Account Abstraction, Energi Ecosystem"
MOCA,mocaverse,Moca Network,MOCA,281137452,736464160.0,10119112.0,"Gaming (GameFi), Ethereum Ecosystem, Decentralized Identifier (DID), Animoca Brands Portfolio, Base Ecosystem, OKX Ventures Portfolio, Outlier Ventures Portfolio"
KSM,kusama,Kusama,KSM,277913952,277924523.0,12186375.0,"Smart Contract Platform, Polkadot Ecosystem, Proof of Stake (PoS), Pantera Capital Portfolio, Made in USA, Coinbase 50 Index, Hydration Ecosystem"
TFUEL,theta-fuel,Theta Fuel,TFUEL,275187892,275187892.0,2417784.0,"Smart Contract Platform, DePIN, Proof of Stake (PoS), Made in USA"
ZRO,layerzero,LayerZero,ZRO,243581043,2191406104.0,40448154.0,"Smart Contract Platform, BNB Chain Ecosystem, Avalanche Ecosystem, Polygon Ecosystem, Arbitrum Ecosystem, Ethereum Ecosystem, Optimism Ecosystem, Base Ecosystem, Multicoin Capital Portfolio, Layer 0 (L0), Cross-chain Communication, Circle Ventures Portfolio, Sequoia Capital Portfolio, OKX Ventures Portfolio"
TRIBE,tribe-2,Tribe,TRIBE,225750195,496137340.0,143169.0,"Decentralized Finance (DeFi), Ethereum Ecosystem, Stablecoin Protocol"
BLUR,blur,Blur,BLUR,220623973,272343666.0,19604684.0,"NFT, Ethereum Ecosystem, NFT Marketplace, FTX Holdings, NFTFi, eGirl Capital Portfolio, Paradigm Portfolio, GMCI DeFi Index, GMCI Index, Made in USA, Coinbase 50 Index"
QUBIC,qubic-network,Qubic,QUBIC,211013093,262866139.0,3921883.0,"Artificial Intelligence (AI), Smart Contract Platform, Layer 1 (L1), Proof of Work (PoW)"
HOT,holotoken,Holo,HOT,190767466,190767466.0,8498056.0,"Smart Contract Platform, Storage, Harmony Ecosystem, Arbitrum Ecosystem, Ethereum Ecosystem, DePIN, Base Ecosystem, Energi Ecosystem, Sora Ecosystem, GMCI DePIN Index, GMCI Index"
T,threshold-network-token,Threshold Network,T,186809664,205706374.0,7378264.0,"Decentralized Finance (DeFi), Solana Ecosystem, Ethereum Ecosystem, Optimism Ecosystem, Base Ecosystem, Cross-chain Communication, BTCfi Protocol"
ANKR,ankr,Ankr Network,ANKR,179426586,179426586.0,11886979.0,"BNB Chain Ecosystem, Avalanche Ecosystem, Polygon Ecosystem, Fantom Ecosystem, Arbitrum Ecosystem, Ethereum Ecosystem, Optimism Ecosystem, Liquid Staking Governance Tokens, Linea Ecosystem, DePIN, Scroll Ecosystem, Rollups-as-a-Service (RaaS), Blast Ecosystem, Mode Ecosystem, Pantera Capital Portfolio, Polygon zkEVM Ecosystem, YZi Labs (Prev. Binance Labs) Portfolio, Liquid Staking, Made in USA"
CSPR,casper-network,Casper Network,CSPR,165451723,171296616.0,4775048.0,"Smart Contract Platform, Layer 1 (L1), Real World Assets (RWA), Proof of Stake (PoS), GMCI Layer 1 Index, GMCI Index, Made in USA"
MPLX,metaplex,Metaplex,MPLX,139100760,167621792.0,17102391.0,"Gaming (GameFi), NFT, BNB Chain Ecosystem, Solana Ecosystem, Launchpad, Animoca Brands Portfolio, FTX Holdings, Multicoin Capital Portfolio, Alameda Research Portfolio, Binance Alpha Spotlight"
GOHOME,gohome,GOHOME,GOHOME,130733827,2491879697.0,5919742.0,"Solana Ecosystem, Meme"
ACT,acet-token,Acet,ACT,126763858,165381181.0,593439.0,BNB Chain Ecosystem
HSK,hashkey-ecopoints,HashKey Platform Token,HSK,126689439,530680827.0,9758947.0,"Exchange-based Tokens, Centralized Exchange (CEX) Token, Ethereum Ecosystem"
SWFTC,swftcoin,SWFTCOIN,SWFTC,125134159,125134159.0,1418642.0,"Exchange-based Tokens, NFT, BNB Chain Ecosystem, Ethereum Ecosystem"
XVS,venus,Venus,XVS,114236919,203046487.0,12235296.0,"Decentralized Finance (DeFi), Yield Farming, BNB Chain Ecosystem, Binance Launchpool, Lending/Borrowing Protocols, Arbitrum Ecosystem, Ethereum Ecosystem, Optimism Ecosystem, ZkSync Ecosystem, opBNB Ecosystem, Unichain Ecosystem"
BLAST,blast,Blast,BLAST,112592317,266954319.0,3982793.0,"Smart Contract Platform, Layer 2 (L2), eGirl Capital Portfolio, Paradigm Portfolio, Blast Ecosystem"
ACH,alchemy-pay,Alchemy Pay,ACH,111399557,225336810.0,16720420.0,"BNB Chain Ecosystem, Ethereum Ecosystem, Payment Solutions, DWF Labs Portfolio"
CETUS,cetus-protocol,Cetus Protocol,CETUS,96383181,117395225.0,16940591.0,"Decentralized Exchange (DEX), Decentralized Finance (DeFi), Sui Ecosystem, Animoca Brands Portfolio, OKX Ventures Portfolio, Dex Aggregator"
PHA,pha,PHALA,PHA,94447237,117549422.0,14447858.0,"Artificial Intelligence (AI), Infrastructure, Smart Contract Platform, Oracle, Polkadot Ecosystem, Ethereum Ecosystem, Interoperability, Layer 2 (L2), Zero Knowledge (ZK), DePIN, DWF Labs Portfolio, Rollup, AI Agents, Sora Ecosystem, AI Framework, Made in USA"
WILD,wilder-world,Wilder World,WILD,92276798,142260405.0,1175526.0,"Gaming (GameFi), NFT, Metaverse, Solana Ecosystem, Play To Earn, Ethereum Ecosystem, Animoca Brands Portfolio, Gaming Governance Token, Racing Games, Simulation Games, Action Games"
GLMR,moonbeam,Moonbeam,GLMR,79513882,94644795.0,9132972.0,"Smart Contract Platform, Polkadot Ecosystem, Layer 1 (L1), Coinbase Ventures Portfolio, Proof of Stake (PoS), YZi Labs (Prev. Binance Labs) Portfolio"
ELX,elixir-finance,Elixir,ELX,63970063,246731248.0,241701466.0,"Decentralized Finance (DeFi), Ethereum Ecosystem, Real World Assets (RWA), Stablecoin Protocol, RWA Protocol"
RIF,rif-token,Rootstock Infrastructure Framework,RIF,62175394,62175394.0,2031909.0,"Solana Ecosystem, Arbitrum Ecosystem, Ethereum Ecosystem, Base Ecosystem, Rootstock Ecosystem, Outlier Ventures Portfolio"
M87,messier,MESSIER,M87,62133750,62133750.0,1949483.0,"Decentralized Finance (DeFi), Ethereum Ecosystem"
C98,coin98,Coin98,C98,56787954,58729300.0,12137641.0,"Decentralized Finance (DeFi), BNB Chain Ecosystem, Solana Ecosystem, Wallets, Polygon Ecosystem, Ethereum Ecosystem, Binance Launchpad, DWF Labs Portfolio, Multicoin Capital Portfolio, Alameda Research Portfolio, Viction Ecosystem, YZi Labs (Prev. Binance Labs) Portfolio"
OMI,ecomi,ECOMI,OMI,53647851,61554076.0,574195.0,"Gaming (GameFi), NFT, Metaverse, Collectibles, Play To Earn, Ethereum Ecosystem, Base Ecosystem, Energi Ecosystem"
CTK,certik,Shentu,CTK,50319867,50721978.0,5507783.0,"Business Services, Binance Launchpool, Osmosis Ecosystem, Coinbase Ventures Portfolio, Cybersecurity, YZi Labs (Prev. Binance Labs) Portfolio, OKX Ventures Portfolio"
DODO,dodo,DODO,DODO,48268556,48268556.0,6396899.0,"Decentralized Exchange (DEX), Exchange-based Tokens, Decentralized Finance (DeFi), BNB Chain Ecosystem, Binance Launchpool, Polygon Ecosystem, Near Protocol Ecosystem, Arbitrum Ecosystem, Ethereum Ecosystem, DWF Labs Portfolio, Coinbase Ventures Portfolio, Alameda Research Portfolio, DeFiance Capital Portfolio, Pantera Capital Portfolio, Aurora Ecosystem, Energi Ecosystem, YZi Labs (Prev. Binance Labs) Portfolio, Galaxy Digital Portfolio"
CCD,concordium,Concordium,CCD,47498252,57376045.0,528889.0,"Smart Contract Platform, Layer 1 (L1), Decentralized Identifier (DID), Zero Knowledge (ZK)"
STORJ,storj,Storj,STORJ,44794927,132402691.0,10728530.0,"Storage, Harmony Ecosystem, Ethereum Ecosystem, DePIN, Energi Ecosystem"
SFUND,seedify-fund,Seedify.fund,SFUND,44112672,69400096.0,2038199.0,"Gaming (GameFi), BNB Chain Ecosystem, Launchpad, Arbitrum Ecosystem, Ethereum Ecosystem, DWF Labs Portfolio"
AVA,ava-ai,Ava AI,AVA,44097033,44097033.0,11850052.0,"Artificial Intelligence (AI), Solana Ecosystem, Meme, AI Meme, AI Agents, Pump.fun Ecosystem, Binance Alpha Spotlight, Made in USA"
LOFI,lofi-2,LOFI,LOFI,43231338,43231338.0,4375580.0,"Meme, Sui Ecosystem, Sui Meme"
UFD,unicorn-fart-dust,Unicorn Fart Dust,UFD,41971989,41971989.0,3950426.0,"Solana Ecosystem, Meme, Solana Meme, Pump.fun Ecosystem, Binance Alpha Spotlight, Made in USA"
EDU,edu-coin,Open Campus,EDU,40445437,155497072.0,4720539.0,"Education, BNB Chain Ecosystem, Polygon Ecosystem, Ethereum Ecosystem, Binance Launchpad, YZi Labs (Prev. Binance Labs) Portfolio"
PNG,pangolin,Pangolin,PNG,37508215,91568979.0,2734483.0,"Decentralized Exchange (DEX), Decentralized Finance (DeFi), Avalanche Ecosystem, Olympus Pro Ecosystem"
MMUI,metamui,MetaMUI,MMUI,36274721,60932656.0,720651.0,Avalanche Ecosystem
FORTH,ampleforth-governance-token,Ampleforth Governance,FORTH,31153082,41428672.0,2284637.0,"Ethereum Ecosystem, Stablecoin Protocol"
PHB,phoenix-global,Phoenix,PHB,31074423,31074423.0,31401923.0,"Artificial Intelligence (AI), Oracle, NFT, BNB Chain Ecosystem, DePIN, Made in China"
ZEREBRO,zerebro,Zerebro,ZEREBRO,30991271,30991271.0,13349820.0,"Solana Ecosystem, Meme, Solana Meme, AI Meme, Pump.fun Ecosystem, Binance Alpha Spotlight"
MNSRY,mansory-token,Mansory Token,MNSRY,30482415,30482415.0,3663692.0,"Retail, BNB Chain Ecosystem, Solana Ecosystem, Real World Assets (RWA), Pump.fun Ecosystem"
PIKA,pikaboss,Pikaboss,PIKA,28307969,28307969.0,5730.44,"Meme, Ethereum Ecosystem"
DYDX,dydx,dYdX,ETHDYDX,27844717,580143392.0,24405913.0,"Decentralized Exchange (DEX), Exchange-based Tokens, Decentralized Finance (DeFi), Derivatives, Perpetuals, Ethereum Ecosystem, Paradigm Portfolio"
GHST,aavegotchi,Aavegotchi,GHST,25818855,26621606.0,2712312.0,"Smart Contract Platform, Gaming (GameFi), NFT, Metaverse, Collectibles, Polygon Ecosystem, Meme, Play To Earn, Ethereum Ecosystem, Gotchiverse, Base Ecosystem, Layer 3 (L3), RPG, Gaming Governance Token, Gaming Utility Token, Energi Ecosystem"
BEL,bella-protocol,Bella Protocol,BEL,23490695,29363368.0,3977790.0,"Decentralized Finance (DeFi), Yield Farming, BNB Chain Ecosystem, Binance Launchpool, Yield Aggregator, Ethereum Ecosystem, Manta Network Ecosystem, YZi Labs (Prev. Binance Labs) Portfolio"
LAT,platon-network,PlatON Network,LAT,23471362,36223971.0,3974310.0,"Smart Contract Platform, Appchains"
THE,thena,Thena,THE,23205747,109940463.0,77992493.0,"Decentralized Exchange (DEX), Decentralized Finance (DeFi), BNB Chain Ecosystem, opBNB Ecosystem, Binance HODLer Airdrops"
NEON,neon,Neon,NEON,22145838,92480298.0,1442543.0,"Smart Contract Platform, Solana Ecosystem, Neon Ecosystem, Parallelized EVM"
BENJI,basenji,Basenji,BENJI,22138742,22138742.0,15112739.0,"Meme, Base Ecosystem, Dog-Themed, Base Meme"
JELLYJELLY,jelly-my-jelly,Jelly-My-Jelly,JELLYJELLY,22106784,22106784.0,4164740.0,"Solana Ecosystem, Pump.fun Ecosystem"
CWEB,coinweb,Coinweb,CWEB,21664843,26783160.0,248015.0,"Smart Contract Platform, Wallets, Ethereum Ecosystem, Interoperability, Layer 2 (L2), Cross-chain Communication, Bitcoin Sidechains, SideChain"
PERP,perpetual-protocol,Perpetual Protocol,PERP,20149065,41624644.0,6864368.0,"Decentralized Exchange (DEX), Exchange-based Tokens, Decentralized Finance (DeFi), Automated Market Maker (AMM), BNB Chain Ecosystem, Derivatives, Perpetuals, Gnosis Chain Ecosystem, Arbitrum Ecosystem, Ethereum Ecosystem, Optimism Ecosystem, Multicoin Capital Portfolio, Alameda Research Portfolio, YZi Labs (Prev. Binance Labs) Portfolio"
QUICK,quick,Quickswap [OLD],QUICK,19954457,26512311.0,9443.93,"Decentralized Exchange (DEX), Exchange-based Tokens, Decentralized Finance (DeFi), Yield Farming, Automated Market Maker (AMM), Polygon Ecosystem, Ethereum Ecosystem"
SIGMA,sigma,Sigma,SIGMA,19928246,19928246.0,1652730.0,"Solana Ecosystem, Meme, Solana Meme, Pump.fun Ecosystem, 4chan-Themed"
VARA,vara-network,Vara Network,VARA,18410468,50542482.0,484455.0,"Smart Contract Platform, Layer 1 (L1)"
U,u,U,U,18003505,18003505.0,1578102.0,"BNB Chain Ecosystem, Meme"
FIS,stafi,Stafi,FIS,16227433,16227433.0,3649158.0,"Decentralized Finance (DeFi), Ethereum Ecosystem, Liquid Staking Governance Tokens, Osmosis Ecosystem, Sora Ecosystem, Liquid Staking"
OPUL,opulous,Opulous,OPUL,16208068,16208068.0,980989.0,"Artificial Intelligence (AI), Music, NFT, BNB Chain Ecosystem, Arbitrum Ecosystem, Ethereum Ecosystem, Algorand Ecosystem, Real World Assets (RWA), Telegram Apps, AI Applications"
BR,bedrock-token,Bedrock,BR,15043585,71636120.0,177550525.0,"Decentralized Finance (DeFi), BNB Chain Ecosystem, Liquid Staking Governance Tokens, Berachain Ecosystem, BTCfi Protocol, Binance Wallet IDO"
KOMA,koma-inu,Koma Inu,KOMA,14603557,14603557.0,3441514.0,"BNB Chain Ecosystem, Meme, Dog-Themed, Binance Alpha Spotlight, Made in USA"
ROOT,the-root-network,The Root Network,ROOT,11792883,46479562.0,1276334.0,"Smart Contract Platform, Gaming (GameFi), Layer 1 (L1), Ethereum Ecosystem, Gaming Blockchains, Outlier Ventures Portfolio"
CSWAP,chainswap-3,ChainSwap,CSWAP,11622423,12194709.0,16541.95,"Decentralized Exchange (DEX), Decentralized Finance (DeFi), Ethereum Ecosystem, Cross-chain Communication"
3ULL,playa3ull-games-2,PLAYA3ULL GAMES,3ULL,10505968,10517999.0,468347.0,"Smart Contract Platform, Gaming (GameFi), NFT, Avalanche Ecosystem, Play To Earn, Shooting Games, Avalanche L1, MMO"
STNK,stonks-4,Stonks,STNK,10319203,10319203.0,63469.0,"Solana Ecosystem, Meme, Solana Meme, Wall Street Bets Themed, Stock market-themed"
DINERO,dinero-2,Dinero,DINERO,10294360,16602655.0,51464.0,"Infrastructure, Decentralized Finance (DeFi), Lending/Borrowing Protocols, Ethereum Ecosystem, Metagovernance, Liquid Staking Governance Tokens, LSDFi, Curve Ecosystem, Liquid Staking"
OIK,space-nation-oikos,Space Nation Oikos,OIK,10112022,50224238.0,416690346.0,"Gaming (GameFi), NFT, BNB Chain Ecosystem, Immutable zkEVM Ecosystem, RPG, MMO"
XSWAP,xswap-2,XSwap,XSWAP,10020318,14071591.0,138375.0,"Decentralized Finance (DeFi), Ethereum Ecosystem, Base Ecosystem, Cross-chain Communication"
KISHU,kishu-inu,Kishu Inu,KISHU,9666317,9666317.0,229054.0,"Meme, Ethereum Ecosystem, Dog-Themed"
AGRI,agridex-governance-token,AgriDex,AGRI,9527874,28808836.0,571441.0,"Tokenized Assets, Solana Ecosystem, Real World Assets (RWA), Tokenized Commodities"
EVR,evernode,Evernode,EVR,9368774,18715113.0,29027.0,"Smart Contract Platform, Layer 2 (L2), DePIN"
NIBI,nibiru,Nibiru,NIBI,8783644,11476059.0,961051.0,"Infrastructure, Smart Contract Platform, Layer 1 (L1), Osmosis Ecosystem, Made in USA"
HDRO,hydro-protocol-2,Hydro Protocol,HDRO,8707884,25028642.0,147684.0,Injective Ecosystem
GHUB,gemhub,GemHUB,GHUB,8290027,45732874.0,101877.0,Kaia Ecosystem
RNT,reental,Reental,RNT,7911173,38575589.0,10660.28,"Tokenized Real Estate, Tokenized Assets, Polygon Ecosystem, Real World Assets (RWA), RWA Protocol"
DROP,drop-2,DROP,DROP,7806262,7806262.0,87116.0,"Meme, XRP Ledger Ecosystem"
CLY,colony,Colony,CLY,7318559,9741738.0,115168.0,Avalanche Ecosystem
BOTIFY,botify,BOTIFY,BOTIFY,6444279,6444279.0,1400452.0,"Artificial Intelligence (AI), Retail, Solana Ecosystem, E-commerce"
ULTI,ultiverse,Ultiverse,ULTI,6045270,15088025.0,5989313.0,"Gaming (GameFi), BNB Chain Ecosystem, Ethereum Ecosystem, Animoca Brands Portfolio, Binance Alpha Spotlight"
XEL,xelis,Xelis,XEL,5808593,5808593.0,87153.0,"Smart Contract Platform, Privacy, Layer 1 (L1), Directed Acyclic Graph (DAG)"
DOLAN,dolan-duck,Dolan Duck,DOLAN,5786290,5786290.0,110327.0,"Solana Ecosystem, Meme, Solana Meme, Parody Meme, 4chan-Themed"
REDO,resistance-dog,Resistance Dog,REDO,5697723,5697723.0,833932.0,"Meme, Dog-Themed, TON Ecosystem, TON Meme"
CATE,catecoin,CateCoin,CATE,5548835,5791483.0,234348.0,"Entertainment, Gaming (GameFi), Yield Farming, NFT, BNB Chain Ecosystem, Yield Aggregator, Launchpad, Wallets, Meme, Play To Earn, Ethereum Ecosystem, Base Ecosystem, Cat-Themed"
MSM,musmecoin,MusmeCoin,MSM,5146129,9896373.0,32425.0,"Meme, Ethereum Ecosystem, Anime-Themed, Oasys Ecosystem"
MASK,catwifmask,catwifmask,MASK,5135449,5135449.0,4659782.0,"Solana Ecosystem, Meme, Solana Meme, Cat-Themed, Pump.fun Ecosystem"
SNAI,swarmnode-ai,SwarmNode.ai,SNAI,5083375,5632553.0,1843561.0,"Artificial Intelligence (AI), Infrastructure, Solana Ecosystem, Pump.fun Ecosystem, AI Agent Launchpad, Binance Alpha Spotlight, AI Framework, DeFAI"
SUAI,suiai,SuiAI,SUAI,4297432,4297432.0,189751.0,"Artificial Intelligence (AI), Sui Ecosystem, AI Agents, AI Agent Launchpad"
DCK,dexcheck,DexCheck AI,DCK,4282846,5834848.0,294075.0,"Artificial Intelligence (AI), Analytics, BNB Chain Ecosystem, Launchpad, ChainGPT Launchpad, Poolz Finance Launchpad, AI Agents, DeFAI, InfoFi"
BRN,brn-metaverse,BRN Metaverse,BRN,4139661,4599698.0,612871.0,"Gaming (GameFi), BNB Chain Ecosystem, Metaverse"
GRPH,soul-graph,Soul Graph,GRPH,4007049,4007049.0,60009.0,"Artificial Intelligence (AI), Solana Ecosystem, Pump.fun Ecosystem, AI Applications"
LUCE,offcial-mascot-of-the-holy-year,Luce,LUCE,3820155,3820155.0,3245239.0,"Solana Ecosystem, Meme, Solana Meme, Pump.fun Ecosystem, Mascot-Themed, Binance Alpha Spotlight"
ORBT,orbitt-pro,Orbitt Token,ORBT,3542315,4742081.0,811719.0,"Solana Ecosystem, Telegram Apps"
BTC2,bitcoin-2,Bitcoin 2,BTC2,3473728,3473728.0,10658.57,"Smart Contract Platform, Proof of Stake (PoS)"
BONK,bonk,Bonk,BONK,2598664563,2980510959.0,860156039.0,"BNB Chain Ecosystem, Solana Ecosystem, Polygon Ecosystem, Meme, Arbitrum Ecosystem, Ethereum Ecosystem, Aptos Ecosystem, Dog-Themed, Solana Meme, Neon Ecosystem, GMCI Meme Index, GMCI Index, Made in USA, Coinbase 50 Index, 4chan-Themed"
KAS,kaspa,Kaspa,KAS,2503388341,2513364922.0,69198302.0,"Smart Contract Platform, Layer 1 (L1), Proof of Work (PoW), Kaspa Ecosystem, Made in USA, Directed Acyclic Graph (DAG)"
GALA,gala,GALA,GALA,871279876,871279876.0,173881952.0,"Smart Contract Platform, Gaming (GameFi), NFT, Layer 1 (L1), Play To Earn, Ethereum Ecosystem, DWF Labs Portfolio, Gaming Platform, YZi Labs (Prev. Binance Labs) Portfolio, GalaChain Ecosystem, Made in USA"
FLOW,flow,Flow,FLOW,691609048,691609048.0,29210156.0,"Smart Contract Platform, Sports, NFT, Layer 1 (L1), Animoca Brands Portfolio, Alleged SEC Securities, Multicoin Capital Portfolio, Proof of Stake (PoS), Flow Ecosystem, Andreessen Horowitz (a16z) Portfolio"
BSV,bitcoin-cash-sv,Bitcoin SV,BSV,606565869,606565869.0,20678866.0,"Smart Contract Platform, Bitcoin Fork, Proof of Work (PoW)"
ETHFI,ether-fi,Ether.fi,ETHFI,540005490,1286071825.0,112961832.0,"Decentralized Finance (DeFi), Binance Launchpool, Arbitrum Ecosystem, Ethereum Ecosystem, Restaking, Liquid Restaking Governance Tokens, Ether.fi Ecosystem, Consensys Portfolio, OKX Ventures Portfolio"
COMP,compound-governance-token,Compound,COMP,484415467,515771298.0,88350550.0,"Decentralized Finance (DeFi), Yield Farming, BNB Chain Ecosystem, Lending/Borrowing Protocols, Avalanche Ecosystem, Polygon Ecosystem, Near Protocol Ecosystem, Harmony Ecosystem, Arbitrum Ecosystem, Ethereum Ecosystem, Base Ecosystem, Paradigm Portfolio, Index Coop Defi Index, Energi Ecosystem, Sora Ecosystem, Polychain Capital Portfolio, Made in USA"
