CSPR,casper-network,Casper Network,CSPR,41708133.0,43181551,1381627.0,"Smart Contract Platform, Layer 1 (L1), Real World Assets (RWA), Proof of Stake (PoS), GMCI Layer 1 Index, GMCI Index, Made in USA, CoinList Launchpad"
SQD,subsquid,SQD,SQD,38353549.0,50138881,1938985.0,"Artificial Intelligence (AI), Big Data, Analytics, BNB Chain Ecosystem, Arbitrum Ecosystem, Base Ecosystem, CoinList Launchpad, Base Native"
PEOPLE,constitutiondao,ConstitutionDAO,PEOPLE,36915928.0,36915928,5499209.0,"Meme, Ethereum Ecosystem, PolitiFi"
SWFTC,swftcoin,SWFTCOIN,SWFTC,35330746.0,35330746,577129.0,"NFT, BNB Chain Ecosystem, Ethereum Ecosystem, Dex Aggregator"
ACH,alchemy-pay,Alchemy Pay,ACH,34281960.0,69344866,7204009.0,"BNB Chain Ecosystem, Ethereum Ecosystem, Payment Solutions, DWF Labs Portfolio, Made in China"
CYBER,cyberconnect,CYBER,CYBER,34207336.0,55855445,8870312.0,"Artificial Intelligence (AI), Smart Contract Platform, SocialFi, NFT, BNB Chain Ecosystem, Binance Launchpool, Ethereum Ecosystem, Decentralized Identifier (DID), Optimism Ecosystem, Layer 2 (L2), Animoca Brands Portfolio, Multicoin Capital Portfolio, YZi Labs (Prev. Binance Labs) Portfolio, Delphi Ventures Portfolio, Cyber Ecosystem, Optimism Superchain Ecosystem, AI Applications, Governance, CoinList Launchpad"
HBD,hive_dollar,Hive Dollar,HBD,31616859.0,31616859,89.4,"Stablecoins, USD Stablecoin, Algorithmic Stablecoin"
AP3X,apex-4,APEX,AP3X,30718674.0,60905970,101231.0,Layer 1 (L1)
CARV,carv,CARV,CARV,30547754.0,57477172,2774336.0,"Artificial Intelligence (AI), Infrastructure, Gaming (GameFi), NFT, BNB Chain Ecosystem, Solana Ecosystem, Arbitrum Ecosystem, Impossible Finance Launchpad, Ethereum Ecosystem, Animoca Brands Portfolio, Base Ecosystem, Binance Alpha Spotlight, Base Native"
BLAST,blast,Blast,BLAST,29570620.0,51369352,5096112.0,"Smart Contract Platform, Layer 2 (L2), eGirl Capital Portfolio, Paradigm Portfolio, Blast Ecosystem"
EWT,energy-web-token,Energy Web Token,EWT,29101377.0,37821748,299477.0,"Energy, Polkadot Ecosystem, Gnosis Chain Ecosystem, Ethereum Ecosystem, Regenerative Finance (ReFi), Real World Assets (RWA), Blockchain Capital Portfolio, Hydration Ecosystem"
YGG,yield-guild-games,Yield Guild Games,YGG,28838249.0,40260937,16752936.0,"Gaming (GameFi), NFT, BNB Chain Ecosystem, Metaverse, Collectibles, Polygon Ecosystem, Play To Earn, Harmony Ecosystem, Guild and Scholarship, Ethereum Ecosystem, Animoca Brands Portfolio, Base Ecosystem, DWF Labs Portfolio, Ronin Ecosystem, Gaming Governance Token, Andreessen Horowitz (a16z) Portfolio, Delphi Ventures Portfolio, Abstract Ecosystem"
USTC,terrausd,TerraClassicUSD,USTC,27740852.0,30240188,1097966.0,"Stablecoins, USD Stablecoin, Seigniorage, Alleged SEC Securities, Osmosis Ecosystem, DeFiance Capital Portfolio, Terra Classic Ecosystem, YZi Labs (Prev. Binance Labs) Portfolio, Delphi Ventures Portfolio, Galaxy Digital Portfolio, Fiat-backed Stablecoin"
WNXM,wrapped-nxm,Wrapped NXM,WNXM,25265151.0,25265151,413830.0,"Crypto-Backed Tokens, Insurance, Wrapped-Tokens, Ethereum Ecosystem, Blockchain Capital Portfolio"
SGB,songbird,Songbird,SGB,24987155.0,28816274,68880.0,Smart Contract Platform
DOT,binance-peg-polkadot,Binance-Peg Polkadot,DOT,23054173.0,23054173,85021.0,"Crypto-Backed Tokens, BNB Chain Ecosystem, Binance-Peg Tokens"
AGLD,adventure-gold,Adventure Gold,AGLD,21400388.0,22722155,4758951.0,"Ethereum Ecosystem, DWF Labs Portfolio"
DORA,dora-2,DORA,DORA,16332182.0,16332182,194106.0,"BNB Chain Ecosystem, Meme, Binance Alpha Spotlight, Chinese Meme"
CETUS,cetus-protocol,Cetus Protocol,CETUS,16179703.0,17539662,2058717.0,"Decentralized Exchange (DEX), Exchange-based Tokens, Decentralized Finance (DeFi), Sui Ecosystem, Animoca Brands Portfolio, OKX Ventures Portfolio, Dex Aggregator"
ALI,alethea-artificial-liquid-intelligence-token,Artificial Liquid Intelligence,ALI,15162229.0,15954432,125960.0,"Artificial Intelligence (AI), NFT, Metaverse, Solana Ecosystem, Polygon Ecosystem, Ethereum Ecosystem, Cronos Ecosystem, Base Ecosystem, Multicoin Capital Portfolio, AI Agents, Alameda Research Portfolio, DeFiance Capital Portfolio, YZi Labs (Prev. Binance Labs) Portfolio, Airdropped Tokens by NFT Projects, Governance, Base Native"
DODO,dodo,DODO,DODO,15097658.0,15097658,12855433.0,"Decentralized Exchange (DEX), Exchange-based Tokens, Decentralized Finance (DeFi), BNB Chain Ecosystem, Binance Launchpool, Polygon Ecosystem, Near Protocol Ecosystem, Arbitrum Ecosystem, Ethereum Ecosystem, DWF Labs Portfolio, Coinbase Ventures Portfolio, Alameda Research Portfolio, DeFiance Capital Portfolio, Pantera Capital Portfolio, Aurora Ecosystem, Energi Ecosystem, YZi Labs (Prev. Binance Labs) Portfolio, Galaxy Digital Portfolio, Made in China"
NCT,polyswarm,PolySwarm,NCT,12781965.0,12784760,136852.0,"Polygon Ecosystem, Ethereum Ecosystem, Cybersecurity, Made in USA"
INV,inverse-finance,Inverse Finance,INV,12175347.0,12486920,125194.0,"Decentralized Finance (DeFi), Yield Farming, Yield Aggregator, Olympus Pro Ecosystem, Ethereum Ecosystem, Fixed Interest"
HFT,hashflow,Hashflow,HFT,10939559.0,14613661,7005423.0,"Decentralized Exchange (DEX), Exchange-based Tokens, Decentralized Finance (DeFi), BNB Chain Ecosystem, Binance Launchpool, MEV Protection, Ethereum Ecosystem, Coinbase Ventures Portfolio, Alameda Research Portfolio, DragonFly Capital Portfolio, Galaxy Digital Portfolio"
ABEY,abey,Abey,ABEY,10534262.0,13559824,14357.52,"Smart Contract Platform, Layer 1 (L1), Proof of Work (PoW)"
FORTH,ampleforth-governance-token,Ampleforth Governance,FORTH,10510443.0,13977226,1127683.0,"Ethereum Ecosystem, Stablecoin Issuer, Governance"
SYN,synapse-2,Synapse,SYN,10427231.0,11899617,1647631.0,"BNB Chain Ecosystem, Avalanche Ecosystem, Polygon Ecosystem, Fantom Ecosystem, Arbitrum Ecosystem, Olympus Pro Ecosystem, Ethereum Ecosystem, Optimism Ecosystem, Bridge Governance Tokens, Base Ecosystem, Alameda Research Portfolio, Intent"
TCAPY,toncapy,TonCapy,TCAPY,9676944.0,9676944,63889.0,"BNB Chain Ecosystem, Meme"
PORTAL,portal-2,Portal,PORTAL,9346318.0,12231847,2577167.0,"Gaming (GameFi), Solana Ecosystem, Ethereum Ecosystem, Base Ecosystem, Gaming Platform"
PIVX,pivx,PIVX,PIVX,9184825.0,9184825,1363025.0,"Smart Contract Platform, Privacy Coins, Masternodes, Zero Knowledge (ZK), Proof of Stake (PoS), Privacy"
PHB,phoenix-global,Phoenix,PHB,8945879.0,8945879,10317485.0,"Artificial Intelligence (AI), Oracle, NFT, BNB Chain Ecosystem, DePIN, Made in China"
TUT,tutorial,Tutorial,TUT,8880443.0,8880443,2327908.0,"BNB Chain Ecosystem, Meme, AI Meme, AI Agents, Four.meme Ecosystem (BNB Memes)"
MAVIA,heroes-of-mavia,Heroes of Mavia,MAVIA,8445761.0,8631011,1179962.0,"Gaming (GameFi), NFT, BNB Chain Ecosystem, Ethereum Ecosystem, Animoca Brands Portfolio, Base Ecosystem, Gaming Governance Token, Strategy Games, Alameda Research Portfolio, YZi Labs (Prev. Binance Labs) Portfolio, Delphi Ventures Portfolio, Action Games, Base Native"
SMOLE,smolecoin,smolecoin,SMOLE,8152742.0,8152742,10886.22,"Solana Ecosystem, Meme"
BEL,bella-protocol,Bella Protocol,BEL,8079449.0,10099311,1860288.0,"Decentralized Finance (DeFi), Yield Farming, BNB Chain Ecosystem, Binance Launchpool, Yield Aggregator, Ethereum Ecosystem, Manta Network Ecosystem, YZi Labs (Prev. Binance Labs) Portfolio"
NEON,neon,Neon,NEON,7661990.0,31996214,510621.0,"Smart Contract Platform, Solana Ecosystem, Neon Ecosystem, Parallelized EVM, CoinList Launchpad"
POR,portugal-national-team-fan-token,Portugal National Team Fan Token,POR,7592272.0,13488183,385839.0,"Sports, Fan Token, Chiliz Ecosystem"
CWEB,coinweb,Coinweb,CWEB,7491599.0,8692794,113339.0,"Smart Contract Platform, Wallets, Ethereum Ecosystem, Interoperability, Layer 2 (L2), Cross-chain Communication, Bitcoin Sidechains, SideChain"
PNG,pangolin,Pangolin,PNG,6740997.0,15749311,851720.0,"Decentralized Exchange (DEX), Exchange-based Tokens, Decentralized Finance (DeFi), Avalanche Ecosystem, Olympus Pro Ecosystem"
M87,messier,MESSIER,M87,6335459.0,6335459,281767.0,"Artificial Intelligence (AI), Decentralized Exchange (DEX), Decentralized Finance (DeFi), Ethereum Ecosystem, Zero Knowledge (ZK)"
SPARKLET,upland,Upland,SPARKLET,5783849.0,21327688,253977.0,"Gaming (GameFi), NFT, Metaverse, Play To Earn, Ethereum Ecosystem, Animoca Brands Portfolio, Made in USA"
CROWN,crown-by-third-time-games,Crown by Third Time Games,CROWN,5630650.0,5630650,15833.25,"Gaming (GameFi), Solana Ecosystem, Animal Racing, Gaming Utility Token, Sports Games, Made in USA"
FLAY,flayer,Flayer,FLAY,4753830.0,7923050,5528.68,"Launchpad, Ethereum Ecosystem, Base Native"
ALU,altura,Altura,ALU,4691772.0,4691772,1045135.0,"Artificial Intelligence (AI), Infrastructure, NFT, BNB Chain Ecosystem, NFT Marketplace, Base Ecosystem, Gaming Platform, Made in USA, Gaming Marketplace, Base Native"
OCTA,octaspace,OctaSpace,OCTA,4545095.0,4545095,171866.0,"Artificial Intelligence (AI), Internet of Things (IOT), Smart Contract Platform, BNB Chain Ecosystem, Layer 1 (L1), Ethereum Ecosystem, DePIN, AI Agents"
D,dar-open-network,Dar Open Network,D,4489616.0,5584860,2677714.0,"Gaming (GameFi), BNB Chain Ecosystem, Binance Launchpool, Play To Earn, Ethereum Ecosystem, Animoca Brands Portfolio, AI Agents"
TKO,tokocrypto,Tokocrypto,TKO,4261910.0,28412733,658835.0,"BNB Chain Ecosystem, Binance Launchpad, YZi Labs (Prev. Binance Labs) Portfolio"
EVR,evernode,Evernode,EVR,4143360.0,8276798,3427.6,"Smart Contract Platform, Layer 2 (L2), DePIN"
GHST,aavegotchi,Aavegotchi,GHST,3975348.0,4098948,324719.0,"Smart Contract Platform, Gaming (GameFi), NFT, Metaverse, Collectibles, Polygon Ecosystem, Meme, Play To Earn, Ethereum Ecosystem, Gotchiverse, Base Ecosystem, Layer 3 (L3), RPG, Gaming Governance Token, Gaming Utility Token, Energi Ecosystem, Governance, Base Native"
FEG,feg-token-2,FEED EVERY GORILLA,FEG,3758772.0,3758772,280373.0,"Decentralized Finance (DeFi), BNB Chain Ecosystem, Launchpad, Meme, Liquid Staking"
LOFI,lofi-2,LOFI,LOFI,3738989.0,3738989,193501.0,"Meme, Sui Ecosystem, Sui Meme"
SHIDO,shido-2,Shido Network,SHIDO,3701153.0,3701153,97171.0,"Decentralized Finance (DeFi), Ethereum Ecosystem, Osmosis Ecosystem, Shido Network Ecosystem"
CHEQ,cheqd-network,CHEQD Network,CHEQ,3414565.0,4333691,119115.0,"Smart Contract Platform, Ethereum Ecosystem, Decentralized Identifier (DID), Zero Knowledge (ZK), Animoca Brands Portfolio, Osmosis Ecosystem, Outlier Ventures Portfolio"
SAROS,saros-finance,Saros,SAROS,3401910.0,12959659,417884.0,"Decentralized Exchange (DEX), Exchange-based Tokens, Decentralized Finance (DeFi), Solana Ecosystem, Viction Ecosystem, Binance Alpha Spotlight"
NIBI,nibiru,Nibiru,NIBI,3309157.0,3656874,283524.0,"Infrastructure, Smart Contract Platform, Layer 1 (L1), Osmosis Ecosystem, Made in USA, CoinList Launchpad"
CDX,cod3x,Cod3x,CDX,3235472.0,3235472,2917.88,"Artificial Intelligence (AI), Solana Ecosystem, Base Ecosystem, AI Agent Launchpad, AI Framework, DeFAI, x402 Ecosystem, Base Native"
IZI,izumi-finance,iZUMi Finance,IZI,3235150.0,8217297,116635.0,"Decentralized Exchange (DEX), Exchange-based Tokens, Decentralized Finance (DeFi), Automated Market Maker (AMM), BNB Chain Ecosystem, Polygon Ecosystem, Arbitrum Ecosystem, Ethereum Ecosystem, ZkSync Ecosystem, Mantle Ecosystem, Linea Ecosystem, Base Ecosystem, Manta Network Ecosystem, Scroll Ecosystem"
KENDU,kendu-inu,Kendu,KENDU,3091739.0,3102220,10658.23,"Solana Ecosystem, Meme, Ethereum Ecosystem, Base Ecosystem, Dog-Themed, Base Native"
BRN,brn-metaverse,BRN Metaverse,BRN,3065417.0,3406032,185346.0,"Gaming (GameFi), BNB Chain Ecosystem, Metaverse"
DROP,drop-2,DROP,DROP,3061244.0,3061244,53167.0,"Meme, XRP Ledger Ecosystem"
REDO,resistance-dog,Resistance Dog,REDO,2726026.0,2726026,90727.0,"Meme, Dog-Themed, TON Ecosystem, TON Meme"
FIS,stafi,Stafi,FIS,2701544.0,2701544,153627.0,"Decentralized Finance (DeFi), Ethereum Ecosystem, Liquid Staking Governance Tokens, Osmosis Ecosystem, Sora Ecosystem, Liquid Staking"
DYDX,dydx,dYdX,ETHDYDX,2697743.0,75035917,5770261.0,"Decentralized Exchange (DEX), Exchange-based Tokens, Decentralized Finance (DeFi), Derivatives, Perpetuals, Ethereum Ecosystem, Paradigm Portfolio"
CSWAP,chainswap-3,ChainSwap,CSWAP,2485917.0,2485917,587.57,"Decentralized Exchange (DEX), Exchange-based Tokens, Decentralized Finance (DeFi), Ethereum Ecosystem, Cross-chain Communication"
CPH,cypherium,Cypherium,CPH,2454373.0,30995260,53862.0,"Smart Contract Platform, Layer 1 (L1), Proof of Work (PoW), Pantera Capital Portfolio"
XSWAP,xswap-2,XSwap,XSWAP,2305891.0,2396361,12192.39,"Decentralized Finance (DeFi), Ethereum Ecosystem, Base Ecosystem, Cross-chain Communication, Base Native"
PEIPEI,chinese-pepe,Chinese PEPE,PEIPEI,2229650.0,2229650,12.07,"BNB Chain Ecosystem, Meme, Frog-Themed, The Boy’s Club"
STAT,stat,STAT,STAT,2115172.0,2700256,198969.0,"Media, Ethereum Ecosystem"
GHUB,gemhub,GemHUB,GHUB,2086563.0,8596570,264968.0,"Gaming (GameFi), Kaia Ecosystem"
SOV,sovryn,Sovryn,SOV,2077741.0,3795242,52188.0,"Smart Contract Platform, Ethereum Ecosystem, Bitcoin Sidechains, SideChain, Rootstock Ecosystem"
BENJI,basenji,Basenji,BENJI,1995273.0,1995273,212421.0,"Meme, Base Ecosystem, Dog-Themed, Base Meme, IP Meme, Base Native"
XEL,xelis,Xelis,XEL,1974547.0,1974547,16054.72,"Smart Contract Platform, Layer 1 (L1), Directed Acyclic Graph (DAG)"
XTZ,binance-peg-tezos-token,Binance-Peg Tezos Token,XTZ,1969603.0,1969603,2344.67,"BNB Chain Ecosystem, Binance-Peg Tokens"
GRPH,soul-graph,Soul Graph,GRPH,1955954.0,1955954,213452.0,"Artificial Intelligence (AI), Solana Ecosystem, Pump.fun Ecosystem, AI Applications"
J,jambo,Jambo,J,1752854.0,10886774,747896.0,"Solana Ecosystem, Paradigm Portfolio, Coinbase Ventures Portfolio"
STETH,staked-ether,Lido Staked Ether,STETH,19902594010.0,19902594010,12368884.0,"Decentralized Finance (DeFi), Liquid Staking Tokens, Ethereum Ecosystem, Liquid Staked ETH, Liquid Staking"
HTX,htx-dao,HTX DAO,HTX,1503262127.0,1503262127,34531178.0,"Exchange-based Tokens, BNB Chain Ecosystem, Centralized Exchange (CEX) Token, Ethereum Ecosystem, Tron Ecosystem"
KAS,kaspa,Kaspa,KAS,830981551.0,846718613,10501924.0,"Smart Contract Platform, Layer 1 (L1), Wallets, Proof of Work (PoW), Kaspa Ecosystem, Made in USA, Directed Acyclic Graph (DAG)"
VET,vechain,VeChain,VET,636050007.0,636050007,16197642.0,"Internet of Things (IOT), Smart Contract Platform, Layer 1 (L1), VeChain Ecosystem, Made in China"
ZRO,layerzero,LayerZero,ZRO,437420614.0,2158726308,80167062.0,"Smart Contract Platform, BNB Chain Ecosystem, Avalanche Ecosystem, Polygon Ecosystem, Arbitrum Ecosystem, Ethereum Ecosystem, Optimism Ecosystem, Base Ecosystem, Multicoin Capital Portfolio, Layer 0 (L0), Cross-chain Communication, Circle Ventures Portfolio, Sequoia Capital Portfolio, OKX Ventures Portfolio, Base Native"
ETHFI,ether-fi,Ether.fi,ETHFI,413303688.0,554654672,24485060.0,"Decentralized Finance (DeFi), Binance Launchpool, Arbitrum Ecosystem, Ethereum Ecosystem, Base Ecosystem, Scroll Ecosystem, Restaking, Liquid Restaking Governance Tokens, Ether.fi Ecosystem, Consensys Portfolio, OKX Ventures Portfolio, Neobank"
BSV,bitcoin-cash-sv,Bitcoin SV,BSV,301320490.0,301321196,5727578.0,"Smart Contract Platform, Bitcoin Fork, Proof of Work (PoW)"
TWT,trust-wallet-token,Trust Wallet,TWT,217880455.0,522934134,12511419.0,"BNB Chain Ecosystem, Wallets, Account Abstraction, Energi Ecosystem"
GALA,gala,GALA,GALA,166629423.0,166629423,24391198.0,"Smart Contract Platform, Gaming (GameFi), NFT, Solana Ecosystem, Layer 1 (L1), Play To Earn, Ethereum Ecosystem, DWF Labs Portfolio, Gaming Platform, YZi Labs (Prev. Binance Labs) Portfolio, GalaChain Ecosystem, Made in USA"
FLOW,flow,Flow,FLOW,65110159.0,65110159,35063016.0,"Smart Contract Platform, Sports, NFT, Layer 1 (L1), Animoca Brands Portfolio, Alleged SEC Securities, Multicoin Capital Portfolio, Proof of Stake (PoS), Flow Ecosystem, Andreessen Horowitz (a16z) Portfolio, CoinList Launchpad"
MOCA,mocaverse,Moca Network,MOCA,60483708.0,131356201,2946962.0,"Gaming (GameFi), Ethereum Ecosystem, Decentralized Identifier (DID), Animoca Brands Portfolio, Base Ecosystem, OKX Ventures Portfolio, Outlier Ventures Portfolio, CoinList Launchpad, Base Native"
HSK,hashkey-ecopoints,HashKey Platform Token,HSK,58583418.0,169826695,639951.0,"Exchange-based Tokens, Centralized Exchange (CEX) Token, Ethereum Ecosystem, Governance"
JELLYJELLY,jelly-my-jelly,Jelly-My-Jelly,JELLYJELLY,57854383.0,57854383,3929778.0,"Solana Ecosystem, Pump.fun Ecosystem, Binance Alpha Spotlight"
XVS,venus,Venus,XVS,52095004.0,92447344,11949150.0,"Decentralized Finance (DeFi), Yield Farming, BNB Chain Ecosystem, Binance Launchpool, Lending/Borrowing Protocols, Arbitrum Ecosystem, Ethereum Ecosystem, Optimism Ecosystem, ZkSync Ecosystem, opBNB Ecosystem, Unichain Ecosystem"
GOHOME,gohome,GOHOME,GOHOME,48542365.0,925252000,1060555.0,"Solana Ecosystem, Meme"
DUSK,dusk-network,DUSK,DUSK,47310276.0,47310276,8086988.0,"Smart Contract Platform, BNB Chain Ecosystem, Layer 1 (L1), Ethereum Ecosystem, Zero Knowledge (ZK), Real World Assets (RWA), YZi Labs (Prev. Binance Labs) Portfolio, Privacy Blockchain"
ALTLAYER,altlayer,AltLayer,ALT,44446611.0,78229077,12560618.0,"Smart Contract Platform, BNB Chain Ecosystem, Binance Launchpool, Ethereum Ecosystem, Layer 2 (L2), Restaking, Rollups-as-a-Service (RaaS), Rollup, YZi Labs (Prev. Binance Labs) Portfolio, Governance"
ANKR,ankr,Ankr Network,ANKR,43943341.0,43943341,3535685.0,"BNB Chain Ecosystem, Avalanche Ecosystem, Polygon Ecosystem, Fantom Ecosystem, Arbitrum Ecosystem, Ethereum Ecosystem, Optimism Ecosystem, Liquid Staking Governance Tokens, Linea Ecosystem, DePIN, Scroll Ecosystem, Rollups-as-a-Service (RaaS), Blast Ecosystem, Mode Ecosystem, Pantera Capital Portfolio, Polygon zkEVM Ecosystem, YZi Labs (Prev. Binance Labs) Portfolio, Liquid Staking, Made in USA, Governance"
QUAI,quai-network,Quai Network,QUAI,42377481.0,126153755,297350.0,"Smart Contract Platform, Layer 1 (L1), Proof of Work (PoW), Privacy Blockchain, Made in USA, Quai Network Ecosystem"
SSV,ssv-network,SSV Network,SSV,41320596.0,41320596,9227981.0,"Decentralized Finance (DeFi), Ethereum Ecosystem, Restaking, Coinbase Ventures Portfolio, OKX Ventures Portfolio, Liquid Staking"
RIF,rif-token,Rootstock Infrastructure Framework,RIF,36447126.0,36447126,1049649.0,"Solana Ecosystem, Arbitrum Ecosystem, Ethereum Ecosystem, Base Ecosystem, Rootstock Ecosystem, Outlier Ventures Portfolio"
OMI,ecomi,ECOMI,OMI,31106619.0,35690883,783075.0,"Gaming (GameFi), NFT, Metaverse, Collectibles, Play To Earn, Ethereum Ecosystem, Base Ecosystem, Energi Ecosystem, Base Native"
C98,coin98,Coin98,C98,28916648.0,28916680,3957579.0,"Decentralized Finance (DeFi), BNB Chain Ecosystem, Perpetuals, Solana Ecosystem, Wallets, Polygon Ecosystem, Ethereum Ecosystem, Binance Launchpad, DWF Labs Portfolio, Multicoin Capital Portfolio, Alameda Research Portfolio, Viction Ecosystem, YZi Labs (Prev. Binance Labs) Portfolio"
CTK,certik,Shentu,CTK,26503254.0,26898021,1063590.0,"Binance Launchpool, Osmosis Ecosystem, Coinbase Ventures Portfolio, Cybersecurity, YZi Labs (Prev. Binance Labs) Portfolio, OKX Ventures Portfolio"
PHA,pha,PHALA,PHA,26251373.0,31552321,8857285.0,"Artificial Intelligence (AI), Infrastructure, Smart Contract Platform, Oracle, Polkadot Ecosystem, Ethereum Ecosystem, Interoperability, Layer 2 (L2), Zero Knowledge (ZK), DePIN, DWF Labs Portfolio, Rollup, AI Agents, Sora Ecosystem, AI Framework, Made in USA"
MPC,my-paqman-coin,My Paqman Coin,MPC,21262032.0,21262032,72089.0,Meme
POND,marlin,Marlin,POND,19635718.0,23939008,724760.0,"Artificial Intelligence (AI), Infrastructure, Smart Contract Platform, Decentralized Finance (DeFi), Arbitrum Ecosystem, Ethereum Ecosystem, Zero Knowledge (ZK), DWF Labs Portfolio, Coinbase Ventures Portfolio, Pantera Capital Portfolio, YZi Labs (Prev. Binance Labs) Portfolio"
MMUI,metamui,MetaMUI,MMUI,19347690.0,32524641,553628.0,"Avalanche Ecosystem, Decentralized Identifier (DID)"
DEGO,dego-finance,Dego Finance,DEGO,17979150.0,17979150,20368879.0,"Decentralized Finance (DeFi), NFT, BNB Chain Ecosystem, Solana Ecosystem, Ethereum Ecosystem, Binance Launchpad, Governance"
MPLX,metaplex,Metaplex,MPLX,17962873.0,34297695,1172062.0,"Gaming (GameFi), NFT, BNB Chain Ecosystem, Solana Ecosystem, Launchpad, Animoca Brands Portfolio, FTX Holdings, Multicoin Capital Portfolio, Alameda Research Portfolio, Binance Alpha Spotlight"
WUSD,worldwide-usd,Worldwide USD,WUSD,16958971.0,16958971,116535.0,"Stablecoins, USD Stablecoin, Polygon Ecosystem, Ethereum Ecosystem, Viction Ecosystem, Fiat-backed Stablecoin"
TRIBE,tribe-2,Tribe,TRIBE,14733705.0,387563433,57553.0,"Decentralized Finance (DeFi), Ethereum Ecosystem, Stablecoin Issuer"
STORJ,storj,Storj,STORJ,13985065.0,41336383,3094319.0,"Storage, Harmony Ecosystem, Ethereum Ecosystem, DePIN, Energi Ecosystem"
PUFFER,puffer-finance,Puffer,PUFFER,13678572.0,32920619,3818032.0,"Smart Contract Platform, BNB Chain Ecosystem, Ethereum Ecosystem, Layer 2 (L2), Restaking, Liquid Restaking Governance Tokens, Rollup, Liquid Staking, Binance Alpha Spotlight, Made in USA"
GLMR,moonbeam,Moonbeam,GLMR,13341513.0,14969676,1408246.0,"Smart Contract Platform, Polkadot Ecosystem, Layer 1 (L1), Coinbase Ventures Portfolio, Proof of Stake (PoS), YZi Labs (Prev. Binance Labs) Portfolio"
PORTO,fc-porto,FC Porto,PORTO,13153293.0,46444398,1283169.0,"Sports, BNB Chain Ecosystem, Fan Token, Binance Launchpad"
QI,benqi,BENQI,QI,12783606.0,12783606,592152.0,"Decentralized Finance (DeFi), Yield Farming, Binance Launchpool, Lending/Borrowing Protocols, Avalanche Ecosystem, Liquid Staking Governance Tokens, DragonFly Capital Portfolio, Liquid Staking"
BR,bedrock-token,Bedrock,BR,12603028.0,57286489,308267.0,"Decentralized Finance (DeFi), BNB Chain Ecosystem, Ethereum Ecosystem, Liquid Staking Governance Tokens, Base Ecosystem, Berachain Ecosystem, BTCfi Protocol, Binance Wallet IDO"
GFI,goldfinch,Goldfinch,GFI,12138758.0,14847504,143472.0,"Decentralized Finance (DeFi), Lending/Borrowing Protocols, Ethereum Ecosystem, Real World Assets (RWA), Coinbase Ventures Portfolio, Andreessen Horowitz (a16z) Portfolio, RWA Protocol, Made in USA"
PEPECOIN,pepecoin-2,PepeCoin,PEPECOIN,11776419.0,13067190,154923.0,"Gaming (GameFi), NFT, Solana Ecosystem, Meme, Ethereum Ecosystem, Frog-Themed, Solana Meme, RPG, Adventure Games, The Boy’s Club, Arcade Games, 4chan-Themed"
WILD,wilder-world,Wilder World,WILD,11298716.0,11787729,426718.0,"Gaming (GameFi), NFT, BNB Chain Ecosystem, Metaverse, Solana Ecosystem, Avalanche Ecosystem, Polygon Ecosystem, Play To Earn, Ethereum Ecosystem, Animoca Brands Portfolio, Base Ecosystem, Gaming Governance Token, Racing Games, Simulation Games, Action Games, Base Native"
UFD,unicorn-fart-dust,Unicorn Fart Dust,UFD,10344164.0,10344164,452154.0,"Solana Ecosystem, Meme, Solana Meme, Pump.fun Ecosystem, Binance Alpha Spotlight, Made in USA, IP Meme"
LAT,platon-network,PlatON Network,LAT,9083234.0,13597127,2974640.0,"Smart Contract Platform, Appchains"
MNSRY,mansory-token,Mansory Token,MNSRY,8489646.0,8489646,236353.0,"Retail, BNB Chain Ecosystem, Solana Ecosystem, Real World Assets (RWA), Pump.fun Ecosystem"
CTA,cross-the-ages,Cross The Ages,CTA,8440346.0,8456543,644081.0,"Gaming (GameFi), NFT, Solana Ecosystem, Play To Earn, Ethereum Ecosystem, Animoca Brands Portfolio, Card Games, Gaming Utility Token"
RNT,reental,Reental,RNT,8382765.0,31608898,188.88,"Tokenized Real Estate, Tokenized Assets, Polygon Ecosystem, Real World Assets (RWA), RWA Protocol"
PIKA,pikaboss,Pikaboss,PIKA,8278910.0,8278910,2794.22,"Meme, Ethereum Ecosystem"
ZEREBRO,zerebro,Zerebro,ZEREBRO,8055059.0,8055059,3337298.0,"Solana Ecosystem, Meme, Solana Meme, AI Meme, Pump.fun Ecosystem, Binance Alpha Spotlight"
RACA,radio-caca,Radio Caca,RACA,7724968.0,7800027,572295.0,"Gaming (GameFi), NFT, BNB Chain Ecosystem, Metaverse, Play To Earn, Ethereum Ecosystem, DWF Labs Portfolio, OKT Chain Ecosystem"
AVA,ava-ai,Ava AI,AVA,7505962.0,7505962,799288.0,"Artificial Intelligence (AI), Solana Ecosystem, Meme, AI Meme, AI Agents, Pump.fun Ecosystem, Binance Alpha Spotlight, Made in USA"
DINERO,dinero-2,Dinero,DINERO,7334461.0,10953772,1149.86,"Infrastructure, Decentralized Finance (DeFi), Ethereum Ecosystem, Metagovernance, Liquid Staking Governance Tokens, LSDFi, Curve Ecosystem, Liquid Staking"
SFI,saffron-finance,saffron.finance,SFI,7038612.0,8100591,26432.0,"Decentralized Finance (DeFi), Yield Farming, Ethereum Ecosystem, Fixed Interest, Coinbase Ventures Portfolio, Multicoin Capital Portfolio, DragonFly Capital Portfolio, Energi Ecosystem"
SOLX,solaxy,Solaxy,SOLX,6724965.0,6724965,576911.0,Ethereum Ecosystem
STNK,stonks-4,Stonks,STNK,6581692.0,6581692,2752.85,"Solana Ecosystem, Meme, Solana Meme, Wall Street Bets Themed, Stock market-themed, IP Meme"
SOIL,soil,Soil,SOIL,6446268.0,9731179,19760.3,"Decentralized Finance (DeFi), Polygon Ecosystem, Ethereum Ecosystem, Real World Assets (RWA), Poolz Finance Launchpad, RWA Protocol"
DREAMS,daydreams,Daydreams,DREAMS,6137455.0,7223198,899123.0,"Artificial Intelligence (AI), Solana Ecosystem, Base Ecosystem, Starknet Ecosystem, AI Agents, AI Applications, AI Framework, x402 Ecosystem, Base Native"
GHX,gamercoin,GamerCoin,GHX,5750118.0,6610643,238052.0,"Artificial Intelligence (AI), Infrastructure, BNB Chain Ecosystem, Solana Ecosystem, Ethereum Ecosystem, DePIN, AI Applications"
CXT,covalent-x-token,Covalent X Token,CXT,5403998.0,5404007,398264.0,"Artificial Intelligence (AI), Infrastructure, Decentralized Finance (DeFi), Ethereum Ecosystem, Base Ecosystem, Data Availability, Coinbase Ventures Portfolio, YZi Labs (Prev. Binance Labs) Portfolio"
OORT,oort,OORT,OORT,5379906.0,14865346,210973.0,"Artificial Intelligence (AI), Storage, BNB Chain Ecosystem, Ethereum Ecosystem, DePIN, AI Agents, Made in USA"
ZEPH,zephyr-protocol,Zephyr Protocol,ZEPH,5026758.0,5026758,466226.0,"Smart Contract Platform, Proof of Work (PoW), Stablecoin Issuer, Privacy Blockchain"
