NIL,nillion,Nillion,NIL,16646900.0,52937281,4102316.0,"Artificial Intelligence (AI), Infrastructure, Binance Launchpool, Ethereum Ecosystem, CoinList Launchpad, Privacy Infrastructure, Privacy"
STO,stakestone,StakeStone,STO,15659266.0,69493785,2255337.0,"Decentralized Finance (DeFi), BNB Chain Ecosystem, Ethereum Ecosystem, Binance HODLer Airdrops, Binance Wallet IDO"
PYR,vulcan-forged,Vulcan Forged,PYR,15042408.0,15781354,2758234.0,"Gaming (GameFi), NFT, Metaverse, Polygon Ecosystem, Ethereum Ecosystem, DWF Labs Portfolio, Gaming Blockchains, Gaming Platform, Action Games, MMO"
USDM,celo-dollar,Mento Dollar,USDM,14245566.0,14245566,273835.0,"Stablecoins, USD Stablecoin, Near Protocol Ecosystem, Celo Ecosystem, Algorithmic Stablecoin, Fiat-backed Stablecoin"
SOLO,solo-coin,Sologenic,SOLO,13764748.0,13764748,26863.0,"Decentralized Exchange (DEX), Exchange-based Tokens, Decentralized Finance (DeFi), BNB Chain Ecosystem, Wallets, XRP Ledger Ecosystem"
RARE,superrare,SuperRare,RARE,13326004.0,16254623,2587243.0,"NFT, Ethereum Ecosystem"
CREPE,crepe-2,CREPE,CREPE,12360876.0,12360876,376310.0,"BNB Chain Ecosystem, Meme"
SAGA,saga-2,Saga,SAGA,12298216.0,36564612,4323289.0,"Artificial Intelligence (AI), Infrastructure, Smart Contract Platform, Binance Launchpool, Layer 1 (L1), Modular Blockchain, Gaming Blockchains, Appchains, Saga Ecosystem"
HOPR,hopr,HOPR,HOPR,12037365.0,12539612,97444.0,"Gnosis Chain Ecosystem, Ethereum Ecosystem, DePIN, YZi Labs (Prev. Binance Labs) Portfolio, Governance, Privacy Infrastructure, Privacy"
SDL,stake-link,stake.link,SDL,11682794.0,19193447,3109.23,"Ethereum Ecosystem, Liquid Staking"
SUPRA,supra,Supra,SUPRA,11608184.0,36751905,920497.0,"Infrastructure, Smart Contract Platform, Oracle, Layer 1 (L1), Animoca Brands Portfolio, Coinbase Ventures Portfolio, Cross-chain Communication, DeFAI, Made in USA, Supra Ecosystem"
AITECH,solidus-aitech,Solidus Ai Tech,AITECH,10603665.0,11803595,2160480.0,"Artificial Intelligence (AI), BNB Chain Ecosystem, Solana Ecosystem, Launchpad, Base Ecosystem, ChainGPT Launchpad, AI Agents, Binance Alpha Spotlight, DeFAI"
RBNT,redbelly-network-token,Redbelly Network,RBNT,10391040.0,41291872,165830.0,"Smart Contract Platform, Layer 1 (L1), Zero Knowledge (ZK), Real World Assets (RWA), Redbelly Network Ecosystem"
OLAS,autonolas,Autonolas,OLAS,10215749.0,20447698,308237.0,"Artificial Intelligence (AI), Solana Ecosystem, Polygon Ecosystem, Gnosis Chain Ecosystem, Arbitrum Ecosystem, Celo Ecosystem, Ethereum Ecosystem, Optimism Ecosystem, Base Ecosystem, AI Agents, Mode Ecosystem, AI Agent Launchpad, Binance Alpha Spotlight, AI Framework, DeFAI, x402 Ecosystem, Base Native"
BGSC,bugscoin,BugsCoin,BGSC,9875802.0,13139760,732086.0,"Retail, BNB Chain Ecosystem, Binance Alpha Spotlight"
LAZIO,lazio-fan-token,Lazio Fan Token,LAZIO,9781873.0,29689454,1286530.0,"Sports, BNB Chain Ecosystem, Fan Token, Binance Launchpad"
ANYONE,airtor-protocol,ANyONe Protocol,ANYONE,9649481.0,12071254,198387.0,"Smart Contract Platform, Ethereum Ecosystem, DePIN, Base Ecosystem, Peaq Ecosystem, Privacy Infrastructure, Privacy"
AMO,amo,AMO Coin,AMO,8794717.0,8794717,44998.0,"Big Data, Kaia Ecosystem"
NFP,nfprompt-token,NFPrompt,NFP,8668281.0,16204408,4822473.0,"BNB Chain Ecosystem, Binance Launchpool, YZi Labs (Prev. Binance Labs) Portfolio, Governance"
INTER,inter-milan-fan-token,Inter Milan Fan Token,INTER,6432492.0,10761844,4628248.0,"Sports, Fan Token, Chiliz Ecosystem"
SOLV,solv-protocol,Solv Protocol,SOLV,6252102.0,35422675,4890306.0,"BNB Chain Ecosystem, Binance Megadrop, BTCfi Protocol, Made in China"
POLS,polkastarter,Polkastarter,POLS,6176639.0,6225846,163468.0,"Decentralized Finance (DeFi), BNB Chain Ecosystem, Launchpad, Ethereum Ecosystem"
KRL,kryll,KRYLL,KRL,6090279.0,7478243,79194.0,"Artificial Intelligence (AI), Decentralized Finance (DeFi), Analytics, Arbitrum Ecosystem, Ethereum Ecosystem, Optimism Ecosystem, Base Ecosystem"
TOMI,tominet,TOMI,TOMI,5563119.0,5563119,3080.93,"Smart Contract Platform, Ethereum Ecosystem, DWF Labs Portfolio, Proof of Stake (PoS)"
HEART,humans-ai,Humans.ai,HEART,5338318.0,5338318,162412.0,"Artificial Intelligence (AI), Smart Contract Platform, Layer 1 (L1), Ethereum Ecosystem, Osmosis Ecosystem, AI Agents, AI Agent Launchpad"
SEAM,seamless-protocol,Seamless Protocol,SEAM,5220126.0,11205851,239104.0,"Decentralized Finance (DeFi), Lending/Borrowing Protocols, Ethereum Ecosystem, Base Ecosystem, Base Native"
TUNA,defituna,DefiTuna,TUNA,5047420.0,17930445,20858.0,"Decentralized Exchange (DEX), Exchange-based Tokens, Decentralized Finance (DeFi), Automated Market Maker (AMM), Lending/Borrowing Protocols, Solana Ecosystem"
DYNA,dynachain,Dynachain,DYNA,4777036.0,4974371,39.05,"Healthcare, BNB Chain Ecosystem"
BKN,brickken,Brickken,BKN,4775206.0,9562021,194023.0,"Tokenized Real Estate, BNB Chain Ecosystem, Impossible Finance Launchpad, Ethereum Ecosystem, Real World Assets (RWA), RWA Protocol"
KIBSHI,kiboshib,KiboShib,KIBSHI,4758291.0,4758291,41508.0,"Solana Ecosystem, Meme, Arbitrum Ecosystem, Ethereum Ecosystem, Base Ecosystem, Dog-Themed, Solana Meme, AI Meme, Base Meme, Base Native"
WOD,world-of-dypians,World of Dypians,WOD,4571015.0,10310931,1839104.0,"Gaming (GameFi), NFT, BNB Chain Ecosystem, Metaverse, RPG, MMO"
BEAM,beam,BEAM,BEAM,4464209.0,5975993,71111.0,"Smart Contract Platform, Ethereum Ecosystem, Proof of Work (PoW), BeamPrivacy Ecosystem, Privacy Blockchain, Privacy Infrastructure, Privacy"
RWA,allo,Allo,RWA,3743697.0,20798318,516322.0,"BNB Chain Ecosystem, Real World Assets (RWA), RWA Protocol, Binance Wallet IDO"
UXLINK,uxlink,UXLINK,UXLINK,3715089.0,4725212,419954.0,"SocialFi, Ethereum Ecosystem"
ZKP,panther,Panther Protocol,ZKP,3118421.0,3118421,1418720.0,"Smart Contract Platform, Polygon Ecosystem, Ethereum Ecosystem, Zero Knowledge (ZK), Base Ecosystem"
MLT,media-licensing-token,Media Licensing Token,MLT,3101107.0,4236442,28098.0,"BNB Chain Ecosystem, Metaverse, Ethereum Ecosystem"
REEF,reef,Reef,REEF,2647113.0,2647113,378850.0,"Binance Launchpool, Layer 1 (L1), Harmony Ecosystem, Alameda Research Portfolio, YZi Labs (Prev. Binance Labs) Portfolio, GMCI Layer 1 Index, GMCI Index"
WITCH,witch-token,Witch Token,WITCH,2643859.0,3837242,25259.0,Ethereum Ecosystem
TRC,terrace,Terrace,TRC,2446614.0,10689727,53396.0,"Base Ecosystem, CeFi"
MEMEFI,memefi-2,MemeFi,MEMEFI,2122449.0,2122449,2342370.0,"Gaming (GameFi), NFT, Meme, Play To Earn, Sui Ecosystem, Telegram Apps, Tap to Earn, Sui Meme, Action Games"
ZCX,unizen,Unizen,ZCX,1995895.0,2653338,72480.0,"Decentralized Exchange (DEX), Exchange-based Tokens, Decentralized Finance (DeFi), Polygon Ecosystem, Ethereum Ecosystem, DWF Labs Portfolio"
TRUF,truflation,TRUF.Network,TRUF,1991013.0,3983223,246986.0,"Infrastructure, Oracle, Solana Ecosystem, Arbitrum Ecosystem, Ethereum Ecosystem, Real World Assets (RWA), Base Ecosystem, Coinbase Ventures Portfolio, Governance, Base Native"
SLERF,slerf,Slerf [OLD],SLERF,1984546.0,1984546,36551.0,"Solana Ecosystem, Meme, Solana Meme"
PORT3,port3-network,Port3 Network,PORT3,1820900.0,4410128,4126829.0,"SocialFi, BNB Chain Ecosystem, Poolz Finance Launchpad"
MAS,massa,Massa,MAS,1796972.0,4897209,145767.0,"Smart Contract Platform, Layer 1 (L1), Massa Ecosystem"
RETARDIO,retardio,RETARDIO,RETARDIO,1740792.0,1740792,809485.0,"NFT, Solana Ecosystem, Meme, Solana Meme, Murad Picks, 4chan-Themed, TikTok Meme"
BCUT,bitscrunch-token,bitsCrunch Token,BCUT,1577773.0,2386019,149381.0,"Artificial Intelligence (AI), Infrastructure, Analytics, NFT, Polygon Ecosystem, Ethereum Ecosystem, Animoca Brands Portfolio, Coinbase Ventures Portfolio, CoinList Launchpad"
AZIT,azit,azit,AZIT,1544995.0,1860618,299231.0,"Kaia Ecosystem, Payment Solutions"
LL,lightlink,LightLink,LL,1417094.0,3388544,111158.0,"Infrastructure, Smart Contract Platform, Ethereum Ecosystem, Layer 2 (L2), Base Ecosystem, Rollup, LightLink Ecosystem"
SERAPH,seraph,Seraph,SERAPH,1397874.0,4388366,757291.0,"Gaming (GameFi), BNB Chain Ecosystem, Play To Earn, Ethereum Ecosystem, RPG, Gaming Utility Token, Action Games"
UPT,uprock,UpRock,UPT,1346700.0,5886420,170857.0,"Solana Ecosystem, DePIN"
DBC,deepbrain-chain,DeepBrain Chain,DBC,1329407.0,4154397,32500.0,"Artificial Intelligence (AI), DeepBrain Chain Ecosystem"
XAUT,tether-gold,Tether Gold,XAUT,2817321833.0,3556575924,269218422.0,"Tokenized Assets, Tokenized Gold, Ethereum Ecosystem, Real World Assets (RWA), Tokenized Commodities"
BGB,bitget-token,Bitget Token,BGB,1520026937.0,1991109436,13941056.0,"Exchange-based Tokens, Centralized Exchange (CEX) Token, Ethereum Ecosystem, DragonFly Capital Portfolio, Morph L2 Ecosystem, Made in China"
QNT,quant-network,Quant,QNT,997665537.0,1002351767,13203855.0,"Infrastructure, Ethereum Ecosystem, Real World Assets (RWA), Energi Ecosystem, Coinbase 50 Index"
LBTC,lombard-staked-btc,Lombard Staked BTC,LBTC,763028694.0,763028694,3936113.0,"BNB Chain Ecosystem, Solana Ecosystem, Liquid Staking Tokens, Ethereum Ecosystem, Sui Ecosystem, Base Ecosystem, Starknet Ecosystem, Restaking, Berachain Ecosystem, Liquid Restaking Tokens, Sonic Ecosystem, Etherlink Ecosystem, Swellchain Ecosystem, Corn Ecosystem, Liquid Staked BTC, Movement Ecosystem, Katana Ecosystem, TAC Ecosystem, Base Native"
JST,just,JUST,JST,479226928.0,479226928,21674928.0,"Decentralized Finance (DeFi), Tron Ecosystem"
FLOKI,floki,FLOKI,FLOKI,292613683.0,303082778,18917315.0,"Gaming (GameFi), NFT, BNB Chain Ecosystem, Metaverse, Meme, Play To Earn, Ethereum Ecosystem, Telegram Apps, Dog-Themed, DWF Labs Portfolio, RPG, On-chain Gaming, TokenFi Launchpad, GMCI Meme Index, GMCI Index"
LDO,lido-dao,Lido DAO,LDO,262702744.0,309329728,18121025.0,"Infrastructure, Decentralized Finance (DeFi), Polygon Ecosystem, Arbitrum Ecosystem, Ethereum Ecosystem, Optimism Ecosystem, Liquid Staking Governance Tokens, eGirl Capital Portfolio, Paradigm Portfolio, Coinbase Ventures Portfolio, Multicoin Capital Portfolio, Index Coop Defi Index, Alameda Research Portfolio, DragonFly Capital Portfolio, Andreessen Horowitz (a16z) Portfolio, GMCI DeFi Index, Delphi Ventures Portfolio, Liquid Staking, GMCI Index, Coinbase 50 Index, Governance"
APEPE,ape-and-pepe,Ape and Pepe,APEPE,254619053.0,254619053,22099941.0,"Polygon Ecosystem, Meme, Frog-Themed, The Boy’s Club"
PENDLE,pendle,Pendle,PENDLE,213398644.0,362803578,17957828.0,"Decentralized Exchange (DEX), Exchange-based Tokens, Decentralized Finance (DeFi), Yield Farming, Automated Market Maker (AMM), BNB Chain Ecosystem, Derivatives, Arbitrum Ecosystem, Ethereum Ecosystem, Optimism Ecosystem, Fixed Interest, LSDFi, Base Ecosystem, Restaking, LRTfi, Liquid Restaking Governance Tokens, Berachain Ecosystem, Yield Tokenization Protocol, YZi Labs (Prev. Binance Labs) Portfolio, GMCI DeFi Index, Sonic Ecosystem, Liquid Staking, GMCI Index, BTCfi Protocol, HyperEVM Ecosystem, Base Native"
ZBCN,zebec-network,Zebec Network,ZBCN,200249861.0,204432442,4891860.0,"Decentralized Finance (DeFi), Solana Ecosystem, Real World Assets (RWA), Payment Solutions, DePIN, Coinbase Ventures Portfolio, Alameda Research Portfolio, Circle Ventures Portfolio, OKX Ventures Portfolio, RWA Protocol, Made in USA"
FLUID,instadapp,Fluid,FLUID,187061925.0,238196696,4163755.0,"Decentralized Finance (DeFi), Solana Ecosystem, Polygon Ecosystem, Arbitrum Ecosystem, Ethereum Ecosystem, Base Ecosystem, Coinbase Ventures Portfolio, Pantera Capital Portfolio, Binance Alpha Spotlight, Plasma Ecosystem, Base Native"
SONIC,sonic-3,Sonic,S,175715664.0,180391872,81276736.0,"Smart Contract Platform, Layer 1 (L1), Galaxy Digital Portfolio, Sonic Ecosystem"
DOGWIFHAT,dogwifcoin,dogwifhat,WIF,170336092.0,170336092,59855588.0,"Solana Ecosystem, Meme, Dog-Themed, Solana Meme, GMCI Meme Index, GMCI Index, Unichain Ecosystem"
RAY,raydium,Raydium,RAY,167924791.0,346848727,15443205.0,"Decentralized Exchange (DEX), Exchange-based Tokens, Decentralized Finance (DeFi), Yield Farming, Automated Market Maker (AMM), Perpetuals, Solana Ecosystem, Launchpad, GMCI DeFi Index, GMCI Index"
SFP,safepal,SafePal,SFP,144942879.0,144942879,2608536.0,"BNB Chain Ecosystem, Wallets, Ethereum Ecosystem, Animoca Brands Portfolio, Binance Launchpad, Energi Ecosystem, YZi Labs (Prev. Binance Labs) Portfolio"
ATH,aethir,Aethir,ATH,122700463.0,280569840,69449863.0,"Artificial Intelligence (AI), Infrastructure, Solana Ecosystem, Arbitrum Ecosystem, Impossible Finance Launchpad, Ethereum Ecosystem, DePIN, Animoca Brands Portfolio, Binance Alpha Spotlight"
TKX,tokenize-xchange,Tokenize Xchange,TKX,112549243.0,140693593,2854.34,"Exchange-based Tokens, Centralized Exchange (CEX) Token, Ethereum Ecosystem, Titanchain Ecosystem"
ROSE,oasis-network,Oasis,ROSE,95966448.0,127108449,5815259.0,"Smart Contract Platform, BNB Chain Ecosystem, Layer 1 (L1), Proof of Stake (PoS), Pantera Capital Portfolio, Andreessen Horowitz (a16z) Portfolio, YZi Labs (Prev. Binance Labs) Portfolio, Blockchain Capital Portfolio, Privacy Blockchain, Polychain Capital Portfolio, Coinbase 50 Index, Privacy Infrastructure, Privacy"
ZANO,zano,Zano,ZANO,91100862.0,91100862,1492058.0,"Smart Contract Platform, Layer 1 (L1), Proof of Stake (PoS), Proof of Work (PoW), Zano Ecosystem, Privacy Blockchain, Privacy Infrastructure, Privacy"
XVG,verge,Verge,XVG,88394387.0,88571202,4688154.0,"Smart Contract Platform, Proof of Work (PoW), Made in USA"
ZORA,zora,Zora,ZORA,76085958.0,170214672,5946391.0,"Infrastructure, Media, Smart Contract Platform, SocialFi, NFT, Launchpad, Layer 2 (L2), Base Ecosystem, Coinbase Ventures Portfolio, Zora Ecosystem, Binance Alpha Spotlight, Base Native"
ELF,aelf,aelf,ELF,66367223.0,80739533,1083525.0,"Infrastructure, Smart Contract Platform, BNB Chain Ecosystem, Layer 1 (L1), Ethereum Ecosystem, GMCI Layer 1 Index, Aelf Ecosystem, GMCI Index"
VTHO,vethor-token,VeThor,VTHO,58698376.0,58700364,996829.0,"Layer 1 (L1), VeChain Ecosystem"
ZIG,zignaly,ZIGChain,ZIG,53408503.0,74067735,765956.0,"Artificial Intelligence (AI), Smart Contract Platform, BNB Chain Ecosystem, Solana Ecosystem, Layer 1 (L1), Polygon Ecosystem, Ethereum Ecosystem, DWF Labs Portfolio, Injective Ecosystem, OKX Ventures Portfolio"
XCH,chia,Chia,XCH,50970696.0,97027439,1772094.0,"Smart Contract Platform, Layer 1 (L1), DePIN, Andreessen Horowitz (a16z) Portfolio, Made in USA"
DAG,constellation-labs,Constellation,DAG,39108825.0,39108825,771136.0,"Smart Contract Platform, Layer 1 (L1), Layer 0 (L0), Made in USA, Directed Acyclic Graph (DAG)"
STEEM,steem,Steem,STEEM,34121316.0,34122975,6915907.0,SocialFi
MANTA,manta-network,Manta Network,MANTA,33920919.0,72941938,9721685.0,"Smart Contract Platform, Polkadot Ecosystem, Binance Launchpool, Layer 2 (L2), Manta Network Ecosystem, Multicoin Capital Portfolio, Alameda Research Portfolio, DeFiance Capital Portfolio, YZi Labs (Prev. Binance Labs) Portfolio"
LQTY,liquity,Liquity,LQTY,31025734.0,31611219,3929828.0,"Decentralized Finance (DeFi), Arbitrum Ecosystem, Ethereum Ecosystem, Alameda Research Portfolio, Pantera Capital Portfolio"
SAI,sai,Sai,SAI,30974893.0,30974893,461.96,"Decentralized Finance (DeFi), Ethereum Ecosystem"
REZ,renzo,Renzo,REZ,28888653.0,39973269,84476292.0,"Decentralized Finance (DeFi), Binance Launchpool, Ethereum Ecosystem, Base Ecosystem, Restaking, YZi Labs (Prev. Binance Labs) Portfolio, OKX Ventures Portfolio"
TAIKO,taiko,Taiko,TAIKO,24913967.0,127993290,2582357.0,"Smart Contract Platform, BNB Chain Ecosystem, Ethereum Ecosystem, Layer 2 (L2), Zero Knowledge (ZK), Rollup, OKX Ventures Portfolio, Binance Alpha Spotlight"
XRD,radix,Radix,XRD,24913203.0,24913715,56734.0,"Smart Contract Platform, Layer 1 (L1), DWF Labs Portfolio, Radix Ecosystem"
QKC,quark-chain,QuarkChain,QKC,23296511.0,32273884,1056311.0,"Infrastructure, Ethereum Ecosystem, Energi Ecosystem"
PROM,prometeus,Prom,PROM,19532902.0,20603198,1835654.0,"Smart Contract Platform, BNB Chain Ecosystem, Ethereum Ecosystem, Layer 2 (L2)"
OSAK,osaka-protocol,Osaka Protocol,OSAK,19310102.0,19310102,19594.98,"BNB Chain Ecosystem, Solana Ecosystem, Avalanche Ecosystem, Polygon Ecosystem, Meme, Arbitrum Ecosystem, Ethereum Ecosystem, Optimism Ecosystem, Base Ecosystem, Dog-Themed, Base Native"
PARTI,particle-network,Particle Network,PARTI,18991714.0,81509500,7457373.0,"Decentralized Finance (DeFi), BNB Chain Ecosystem, Layer 1 (L1), Base Ecosystem, Account Abstraction, Cross-chain Communication, Binance HODLer Airdrops, Chain Abstraction, Binance Wallet IDO, Base Native"
MBL,moviebloc,MovieBloc,MBL,18083762.0,28209029,3393038.0,DWF Labs Portfolio
JOE,joe,JOE,JOE,16542057.0,20482469,1731139.0,"Decentralized Exchange (DEX), Exchange-based Tokens, Decentralized Finance (DeFi), Yield Farming, Automated Market Maker (AMM), BNB Chain Ecosystem, Avalanche Ecosystem, Launchpad, Arbitrum Ecosystem, Mantle Ecosystem, DeFiance Capital Portfolio, Delphi Ventures Portfolio, Dex Aggregator"
OGN,origin-protocol,Origin Token,OGN,16231618.0,34338365,4937889.0,"Decentralized Finance (DeFi), NFT, Ethereum Ecosystem, Base Ecosystem, Pantera Capital Portfolio, Sonic Ecosystem, Liquid Staking, Made in USA, CoinList Launchpad, Base Native"
FIDA,bonfida,Bonfida,FIDA,15949572.0,16095869,5103006.0,"Big Data, Infrastructure, Decentralized Finance (DeFi), Solana Ecosystem, FTX Holdings, DWF Labs Portfolio, Name Service"
DIAM,diam,DIAM,DIAM,15407573.0,44437878,208637.0,"Smart Contract Platform, Layer 1 (L1)"
VANRY,vanar-chain,Vanar Chain,VANRY,11012437.0,11069775,1575397.0,"Artificial Intelligence (AI), Smart Contract Platform, Layer 1 (L1), Polygon Ecosystem, Ethereum Ecosystem, Vanar Chain Ecosystem"
WCT,connect-token-wct,WalletConnect Token,WCT,10887292.0,58470900,5979652.0,"Binance Launchpool, Solana Ecosystem, Wallets, Ethereum Ecosystem, Optimism Ecosystem, Base Ecosystem, CoinList Launchpad, Base Native"
SD,stader,Stader,SD,9788331.0,16865659,594213.0,"BNB Chain Ecosystem, Solana Ecosystem, Polygon Ecosystem, Fantom Ecosystem, Ethereum Ecosystem, Liquid Staking Governance Tokens, Animoca Brands Portfolio, Coinbase Ventures Portfolio, Pantera Capital Portfolio, Liquid Staking, Binance Alpha Spotlight, CoinList Launchpad"
LUMIA,lumia,Lumia,LUMIA,9306605.0,16052768,1552917.0,"Smart Contract Platform, BNB Chain Ecosystem, Ethereum Ecosystem, Layer 2 (L2), Real World Assets (RWA), Governance"
VOW,vow,Vow,VOW,8962293.0,32070304,51945.0,"Retail, Tourism, BNB Chain Ecosystem, Ethereum Ecosystem"
DAO,dao-maker,DAO Maker,DAO,8323036.0,9208702,457145.0,"BNB Chain Ecosystem, Solana Ecosystem, Launchpad, DaoMaker Launchpad, Arbitrum Ecosystem, Ethereum Ecosystem, Step Network Ecosystem, Governance"
GTC,gitcoin,Gitcoin,GTC,8276250.0,9459490,1062618.0,"Near Protocol Ecosystem, Ethereum Ecosystem, Paradigm Portfolio, Governance"
LOCK,houdini-swap,Houdini Swap,LOCK,8007416.0,8007416,13359.45,"Decentralized Finance (DeFi), Solana Ecosystem, Ethereum Ecosystem, Privacy Infrastructure, Privacy"
LYX,lukso-token-2,LUKSO,LYX,7297522.0,10064756,207802.0,"Smart Contract Platform, SocialFi, Layer 1 (L1), Ethereum Ecosystem, Decentralized Identifier (DID), Proof of Stake (PoS), Lukso Ecosystem"
PMT,public-meme-token,Public Masterpiece Token,PMT,6937726.0,40181897,265014.0,"NFT, BNB Chain Ecosystem, Real World Assets (RWA), NFTFi"
MCB,mcdex,MUX Protocol,MCB,6875339.0,8683144,1069.76,"Decentralized Exchange (DEX), Exchange-based Tokens, Decentralized Finance (DeFi), BNB Chain Ecosystem, Derivatives, Perpetuals, Arbitrum Ecosystem, Ethereum Ecosystem, Multicoin Capital Portfolio, Alameda Research Portfolio, DeFiance Capital Portfolio, Delphi Ventures Portfolio, OKX Ventures Portfolio"
ZETA,zeta,Zeta,ZEX,6855363.0,36509418,377259.0,"Decentralized Finance (DeFi), Derivatives, Perpetuals, Solana Ecosystem"
OBT,orbiter-finance,Orbiter Finance,OBT,6634770.0,12518433,1468245.0,"Decentralized Finance (DeFi), BNB Chain Ecosystem, Arbitrum Ecosystem, Ethereum Ecosystem, Bridge Governance Tokens, Base Ecosystem, Cross-chain Communication, OKX Ventures Portfolio, Base Native"
SUNDOG,sundog,Sundog,SUNDOG,6628036.0,6628036,2772233.0,"Meme, Tron Ecosystem, Sun Pump Ecosystem, TRON Meme, Binance Alpha Spotlight"
OGY,origyn-foundation,ORIGYN,OGY,6589873.0,8410493,266008.0,"Internet Computer Ecosystem, Real World Assets (RWA), RWA Protocol"
RSS3,rss3,RSS3,RSS3,6490378.0,7433454,1247664.0,"Artificial Intelligence (AI), Infrastructure, Storage, Ethereum Ecosystem, Coinbase Ventures Portfolio, DragonFly Capital Portfolio, RSS3 VSL Ecosystem, AI Framework, DeFAI"
VIC,tomochain,Viction,VIC,6165548.0,10301429,1424453.0,"Smart Contract Platform, Masternodes, Layer 1 (L1), DWF Labs Portfolio"
FHE,mind-network,Mind Network,FHE,5602991.0,22501970,3501271.0,"Artificial Intelligence (AI), Smart Contract Platform, BNB Chain Ecosystem, Layer 2 (L2), Binance Wallet IDO"
RIO,realio-network,Realio Network Token,RIO,5426660.0,5426660,2203879.0,"BNB Chain Ecosystem, Solana Ecosystem, Layer 1 (L1), Ethereum Ecosystem, Algorand Ecosystem, Real World Assets (RWA), Base Ecosystem, Osmosis Ecosystem, Stellar Ecosystem, RWA Protocol, Made in USA, Base Native"
PEAR,pear-protocol,Pear Protocol,PEAR,5269734.0,17461362,7417.96,"Decentralized Exchange (DEX), Exchange-based Tokens, Decentralized Finance (DeFi), Perpetuals, Arbitrum Ecosystem"
IXT,ix-token,Planet IX (OLD),IXT,5207356.0,10038138,1720.67,"Gaming (GameFi), NFT, Metaverse, Polygon Ecosystem, Play To Earn, Gaming Governance Token, Gaming Utility Token, Strategy Games"
LINGO,lingo,Lingo,LINGO,5077274.0,5077274,183486.0,"Solana Ecosystem, Real World Assets (RWA), Base Ecosystem, RWA Protocol, Base Native"
GRAM,gram-2,Gram,GRAM,5056781.0,5056781,8766.01,"TON Ecosystem, Proof of Work (PoW)"
NUM,numbers-protocol,Numbers Protocol,NUM,4973525.0,5030567,136093.0,"Artificial Intelligence (AI), Smart Contract Platform, BNB Chain Ecosystem, DaoMaker Launchpad, Ethereum Ecosystem, Avalanche L1, YZi Labs (Prev. Binance Labs) Portfolio, Outlier Ventures Portfolio"
CA,ca-htb,Coupon Assets,CA,4939812.0,72516884,934940.0,"Retail, Ethereum Ecosystem"
NMT,netmind-token,NetMind Token,NMT,4909470.0,12128886,263004.0,"Artificial Intelligence (AI), BNB Chain Ecosystem, Ethereum Ecosystem, DePIN, AI Agents"
SUKU,suku,SUKU,SUKU,4577665.0,11745888,115785.0,"Solana Ecosystem, Polygon Ecosystem, Ethereum Ecosystem, Made in USA"
ATS,alltoscan,Alltoscan,ATS,4378482.0,6407859,75292.0,"BNB Chain Ecosystem, Layer 1 (L1)"
BOOE,book-of-ethereum,Book of Ethereum,BOOE,4142782.0,4142782,63206.0,"Meme, Ethereum Ecosystem"
GAIA,gaia-2,Gaia,SN57,4000948.0,4000948,458926.0,"Artificial Intelligence (AI), Bittensor Ecosystem, Bittensor Subnets"
VINU,vita-inu,Vita Inu,VINU,3804476.0,3804476,660064.0,"BNB Chain Ecosystem, Meme, Dog-Themed, DWF Labs Portfolio, Binance Alpha Spotlight"
NATIX,natix-network,NATIX Network,NATIX,3794731.0,9299139,792273.0,"Artificial Intelligence (AI), Internet of Things (IOT), Solana Ecosystem, DePIN, Robotics, CoinList Launchpad"
OOBIT,oobit-2,Oobit,OOB,3658491.0,10571001,31669.0,"Solana Ecosystem, Payment Solutions"
HASHAI,hashai,HashAI,HASHAI,3614764.0,4003048,109342.0,"Analytics, Ethereum Ecosystem, DePIN"
NLS,nolus,Nolus,NLS,3547012.0,3822821,130060.0,"Lending/Borrowing Protocols, Liquid Staking Tokens, Ethereum Ecosystem, Osmosis Ecosystem"
GEAR,gearbox,Gearbox,GEAR,3532630.0,3532630,59366.0,"Decentralized Finance (DeFi), Yield Farming, Lending/Borrowing Protocols, Ethereum Ecosystem, Curve Ecosystem, eGirl Capital Portfolio, Galaxy Digital Portfolio, Binance Alpha Spotlight"
CRTS,cratos,Cratos,CRTS,3518876.0,6903708,289644.0,"SocialFi, BNB Chain Ecosystem, Ethereum Ecosystem, Governance"
VSC,vyvo-smart-chain,Vyvo Smart Chain,VSC,3321627.0,14130605,14952.17,"Smart Contract Platform, BNB Chain Ecosystem, Polygon Ecosystem, Layer 2 (L2)"
MEMDEX,memdex100,MEMDEX100,MEMDEX,3188536.0,3188536,39351.0,"Solana Ecosystem, Meme, Solana Meme, Moonshot Ecosystem"
OVR,ovr,Ovr,OVR,3142533.0,3217711,192419.0,"Artificial Intelligence (AI), Augmented Reality, BNB Chain Ecosystem, Polygon Ecosystem, Ethereum Ecosystem, DePIN, Base Ecosystem, Robotics, Base Native"
HMT,human-protocol,HUMAN Protocol,HMT,2990749.0,3946274,172030.0,"Artificial Intelligence (AI), Infrastructure, Software as a service, BNB Chain Ecosystem, Polygon Ecosystem, Ethereum Ecosystem, Market-Making Solution, AI Framework, HyperEVM Ecosystem, CoinList Launchpad"
DNX,dynex,Dynex,DNX,2740006.0,2740008,146245.0,"Artificial Intelligence (AI), Smart Contract Platform, Layer 1 (L1), Ethereum Ecosystem, DePIN, Decentralized Science (DeSci), Proof of Work (PoW)"
MFT,mainframe,Mainframe,MFT,2731999.0,2910546,2.08,"Ethereum Ecosystem, Energi Ecosystem"
PROPS,propbase,Propbase,PROPS,2555158.0,6422607,1037900.0,"Tokenized Real Estate, Aptos Ecosystem, Real World Assets (RWA), Base Ecosystem, RWA Protocol, Base Native"
XTER,xterio,Xterio,XTER,2191618.0,15348962,1186186.0,"Artificial Intelligence (AI), Gaming (GameFi), NFT, BNB Chain Ecosystem, Animoca Brands Portfolio, Gaming Blockchains, YZi Labs (Prev. Binance Labs) Portfolio, Binance Alpha Spotlight"
BLEND,blend,Blend,BLND,2115124.0,4026877,1678.35,"Decentralized Finance (DeFi), Lending/Borrowing Protocols, Stellar Ecosystem"
EPT,balance,Balance,EPT,2001244.0,8638772,894506.0,"Gaming (GameFi), BNB Chain Ecosystem, Animoca Brands Portfolio, DWF Labs Portfolio, AI Agents, Andreessen Horowitz (a16z) Portfolio, AI Agent Launchpad"
METAV,metaverse,METAVERSE,METAV,1924399.0,1924399,412228.0,"Artificial Intelligence (AI), Solana Ecosystem, AI Agents, Pump.fun Ecosystem, Binance Alpha Spotlight"
LIKE,likecoin-2,LikeCoin,LIKE,1910761.0,2354801,12.26,"Entertainment, Base Native"
JUNO,juno-agent,Juno Agent,JUNO,1902053.0,1902053,373684.0,"Artificial Intelligence (AI), Base Ecosystem, AI Agents"
DIONE,dione,Dione,DIONE,1864010.0,2092156,18755.79,"Energy, Smart Contract Platform, Layer 1 (L1), Made in USA"
MLC,my-lovely-coin,My Lovely Coin,MLC,1745467.0,4242943,80583.0,"Charity, Gaming (GameFi), BNB Chain Ecosystem, Solana Ecosystem, Polygon Ecosystem, Gaming Utility Token"
