ROSE,oasis-network,Oasis,ROSE,269418511.0,400336824.0,21608050.0,"Smart Contract Platform, BNB Chain Ecosystem, Layer 1 (L1), Proof of Stake (PoS), Pantera Capital Portfolio, Andreessen Horowitz (a16z) Portfolio, YZi Labs (Prev. Binance Labs) Portfolio, Blockchain Capital Portfolio, Privacy Blockchain, Polychain Capital Portfolio, Coinbase 50 Index"
CELO,celo,Celo,CELO,246874450.0,432620668.0,24186318.0,"Smart Contract Platform, Celo Ecosystem, Layer 2 (L2), DWF Labs Portfolio, Coinbase Ventures Portfolio, Proof of Stake (PoS), Andreessen Horowitz (a16z) Portfolio, Optimism Superchain Ecosystem, Outlier Ventures Portfolio, Made in USA"
VTHO,vethor-token,VeThor,VTHO,246656485.0,246705711.0,8452771.0,"Layer 1 (L1), VeChain Ecosystem"
DRIFT,drift-protocol,Drift Protocol,DRIFT,199107412.0,660958125.0,28813671.0,"Decentralized Finance (DeFi), Derivatives, Prediction Markets, Solana Ecosystem"
ELF,aelf,aelf,ELF,188864089.0,254382380.0,4643045.0,"Infrastructure, Smart Contract Platform, BNB Chain Ecosystem, Layer 1 (L1), Ethereum Ecosystem, GMCI Layer 1 Index, Aelf Ecosystem, GMCI Index"
WOO,woo-network,WOO,WOO,177648550.0,205505233.0,11392955.0,"Decentralized Exchange (DEX), Exchange-based Tokens, Decentralized Finance (DeFi), Automated Market Maker (AMM), BNB Chain Ecosystem, Derivatives, Perpetuals, Centralized Exchange (CEX) Token, Solana Ecosystem, Avalanche Ecosystem, Polygon Ecosystem, Near Protocol Ecosystem, Fantom Ecosystem, Arbitrum Ecosystem, Ethereum Ecosystem, ZkSync Ecosystem, Mantle Ecosystem, Linea Ecosystem, Base Ecosystem, DragonFly Capital Portfolio, YZi Labs (Prev. Binance Labs) Portfolio"
ZIG,zignaly,ZIGChain,ZIG,146825288.0,203619571.0,3918285.0,"Artificial Intelligence (AI), Smart Contract Platform, BNB Chain Ecosystem, Solana Ecosystem, Layer 1 (L1), Polygon Ecosystem, Ethereum Ecosystem, DWF Labs Portfolio, Injective Ecosystem, OKX Ventures Portfolio"
NPC,non-playable-coin,Non-Playable Coin,NPC,137426529.0,137426529.0,2950626.0,"NFT, BNB Chain Ecosystem, Solana Ecosystem, Meme, Ethereum Ecosystem, Base Ecosystem, Hybrid Token Standards, Wojak-Themed, 4chan-Themed"
MANTA,manta-network,Manta Network,MANTA,130434440.0,315902084.0,17343216.0,"Smart Contract Platform, Polkadot Ecosystem, Binance Launchpool, Layer 2 (L2), Manta Network Ecosystem, Multicoin Capital Portfolio, Alameda Research Portfolio, DeFiance Capital Portfolio, YZi Labs (Prev. Binance Labs) Portfolio"
OSAK,osaka-protocol,Osaka Protocol,OSAK,117038528.0,117038528.0,148467.0,"BNB Chain Ecosystem, Avalanche Ecosystem, Polygon Ecosystem, Meme, Arbitrum Ecosystem, Ethereum Ecosystem, Optimism Ecosystem, Base Ecosystem, Dog-Themed"
OZO,ozone-chain,Ozone Chain,OZO,110163968.0,140116135.0,242251.0,"Smart Contract Platform, Layer 1 (L1), Zero Knowledge (ZK)"
CHILLGUY,chill-guy,Just a chill guy,CHILLGUY,109731145.0,109731145.0,62988095.0,"Solana Ecosystem, Meme, Dog-Themed, Solana Meme, Pump.fun Ecosystem"
RLC,iexec-rlc,iExec RLC,RLC,97020662.0,116613424.0,4567671.0,"Artificial Intelligence (AI), Oracle, Ethereum Ecosystem, DePIN, Energi Ecosystem, Sora Ecosystem, GMCI DePIN Index, GMCI Index"
JOE,joe,JOE,JOE,86699036.0,108816660.0,11029243.0,"Decentralized Exchange (DEX), Decentralized Finance (DeFi), Yield Farming, Automated Market Maker (AMM), BNB Chain Ecosystem, Avalanche Ecosystem, Arbitrum Ecosystem, Mantle Ecosystem, DeFiance Capital Portfolio, Delphi Ventures Portfolio, Dex Aggregator"
TAIKO,taiko,Taiko,TAIKO,80555088.0,780329106.0,14203777.0,"Smart Contract Platform, Ethereum Ecosystem, Layer 2 (L2), Zero Knowledge (ZK), Rollup, OKX Ventures Portfolio"
VANRY,vanar-chain,Vanar Chain,VANRY,80091590.0,82373283.0,12566558.0,"Smart Contract Platform, Gaming (GameFi), NFT, Layer 1 (L1), Polygon Ecosystem, Ethereum Ecosystem, Vanar Chain Ecosystem"
SUNDOG,sundog,Sundog,SUNDOG,78776876.0,78776876.0,35775138.0,"Meme, Tron Ecosystem, Sun Pump Ecosystem, TRON Meme"
NOS,nosana,Nosana,NOS,77377950.0,92779316.0,1606449.0,"Artificial Intelligence (AI), Solana Ecosystem, DePIN"
BAL,balancer,Balancer,BAL,76470203.0,82466734.0,9781245.0,"Decentralized Exchange (DEX), Exchange-based Tokens, Decentralized Finance (DeFi), Yield Farming, Automated Market Maker (AMM), Avalanche Ecosystem, Polygon Ecosystem, Near Protocol Ecosystem, Gnosis Chain Ecosystem, Harmony Ecosystem, Arbitrum Ecosystem, Ethereum Ecosystem, Optimism Ecosystem, Base Ecosystem, Index Coop Defi Index, Alameda Research Portfolio, DeFiance Capital Portfolio, Pantera Capital Portfolio, Energi Ecosystem, Polygon zkEVM Ecosystem, Huobi ECO Chain Ecosystem, Blockchain Capital Portfolio, Index Coop Index"
QI,benqi,BENQI,QI,62710879.0,66997609.0,2519867.0,"Decentralized Finance (DeFi), Yield Farming, Binance Launchpool, Lending/Borrowing Protocols, Avalanche Ecosystem, Liquid Staking Governance Tokens, DragonFly Capital Portfolio, Liquid Staking"
AO,ao-computer,ao Computer,AO,61590899.0,61590899.0,2901975.0,"Artificial Intelligence (AI), Smart Contract Platform, DePIN"
QKC,quark-chain,QuarkChain,QKC,57575238.0,80852593.0,2287855.0,"Infrastructure, Ethereum Ecosystem, Energi Ecosystem"
MBX,marblex,MARBLEX,MBX,55525001.0,85622300.0,6818920.0,"Smart Contract Platform, Gaming (GameFi), NFT, BNB Chain Ecosystem, Kaia Ecosystem, Aptos Ecosystem, DWF Labs Portfolio, Gaming Blockchains"
RSS3,rss3,RSS3,RSS3,51521415.0,71590664.0,5574193.0,"Artificial Intelligence (AI), Infrastructure, Storage, Ethereum Ecosystem, Coinbase Ventures Portfolio, DragonFly Capital Portfolio, RSS3 VSL Ecosystem, AI Framework, DeFAI"
OGN,origin-protocol,Origin Token,OGN,49213668.0,100171812.0,6338647.0,"NFT, Ethereum Ecosystem, Base Ecosystem, Pantera Capital Portfolio, Sonic Ecosystem, Made in USA"
ANVL,anvil,Anvil,ANVL,47699392.0,248448465.0,151158.0,"Decentralized Finance (DeFi), Ethereum Ecosystem"
GPS,goplus-security,GoPlus Security,GPS,46172856.0,254620361.0,6869577.0,"BNB Chain Ecosystem, Base Ecosystem, Cybersecurity, YZi Labs (Prev. Binance Labs) Portfolio, OKX Ventures Portfolio, Binance Alpha Spotlight"
XTER,xterio,Xterio,XTER,40541924.0,360372657.0,10931334.0,"Artificial Intelligence (AI), Gaming (GameFi), NFT, BNB Chain Ecosystem, Animoca Brands Portfolio, Gaming Blockchains, YZi Labs (Prev. Binance Labs) Portfolio"
L3,layer3,Layer3,L3,40519859.0,219985249.0,6516147.0,"Marketing, BNB Chain Ecosystem, Solana Ecosystem, Polygon Ecosystem, Arbitrum Ecosystem, Ethereum Ecosystem, Decentralized Identifier (DID), Optimism Ecosystem, Quest-to-Earn, Made in USA"
NAVX,navi,NAVI Protocol,NAVX,39706656.0,68929488.0,17000201.0,"Decentralized Finance (DeFi), Lending/Borrowing Protocols, Sui Ecosystem, OKX Ventures Portfolio"
TLOS,telos,Telos,TLOS,38421069.0,38421073.0,3597417.0,"Smart Contract Platform, BNB Chain Ecosystem, Layer 1 (L1), Avalanche Ecosystem, Polygon Ecosystem, Arbitrum Ecosystem, Ethereum Ecosystem, Zero Knowledge (ZK), Telos Ecosystem, Consensys Portfolio"
PIPPIN,pippin,pippin,PIPPIN,37196486.0,37196486.0,28982614.0,"Infrastructure, Solana Ecosystem, Meme, Solana Meme, AI Meme, AI Agents, Pump.fun Ecosystem, Binance Alpha Spotlight, AI Framework"
SAI,sai,Sai,SAI,37111786.0,37111786.0,11.64,"Decentralized Finance (DeFi), Ethereum Ecosystem"
FARTBOY,fartboy,Fartboy,$FARTBOY,36706526.0,36706526.0,631418.0,"Solana Ecosystem, Meme, Solana Meme, Pump.fun Ecosystem"
HMT,human-protocol,HUMAN Protocol,HMT,34135234.0,45041222.0,42452.0,"Artificial Intelligence (AI), Infrastructure, Software as a service, Polygon Ecosystem, Ethereum Ecosystem, Market-Making Solution, AI Framework"
AINTI,aintivirus,AIntivirus,AINTI,33729241.0,33729241.0,0.0,"Solana Ecosystem, Meme, AI Meme, Pump.fun Ecosystem"
PEPE,based-pepe,Based Pepe,PEPE,33521026.0,33521026.0,586790.0,"Meme, Base Ecosystem, Frog-Themed, Base Meme, The Boy’s Club"
UQC,uquid-coin,Uquid Coin,UQC,31685202.0,126740807.0,367996.0,Ethereum Ecosystem
LUMIA,lumia,Lumia,LUMIA,30768689.0,97604670.0,11767478.0,"Smart Contract Platform, Layer 2 (L2), Real World Assets (RWA)"
MAPO,marcopolo,MAP Protocol,MAPO,30657278.0,51040747.0,1970642.0,"BNB Chain Ecosystem, Ethereum Ecosystem, DWF Labs Portfolio"
LYX,lukso-token-2,LUKSO,LYX,30446647.0,41992075.0,178559.0,"Smart Contract Platform, SocialFi, Layer 1 (L1), Decentralized Identifier (DID), Proof of Stake (PoS), Lukso Ecosystem"
NRN,neuron,Neuron,NRN,26861475.0,61569933.0,632174.0,"Artificial Intelligence (AI), Gaming (GameFi), NFT, Arbitrum Ecosystem, Paradigm Portfolio, AI Agents, AI Framework, Action Games"
PIKA,pikaboss,Pikaboss,PIKA,25405772.0,25405772.0,12019.65,"Meme, Ethereum Ecosystem"
VOW,vow,Vow,VOW,24928722.0,80104169.0,289159.0,"Retail, Tourism, BNB Chain Ecosystem, Ethereum Ecosystem"
APX,apollox-2,APX,APX,24658058.0,227879695.0,1123304.0,"Decentralized Finance (DeFi), BNB Chain Ecosystem, Perpetuals, YZi Labs (Prev. Binance Labs) Portfolio, Binance Alpha Spotlight"
RARI,rarible,RARI,RARI,23671917.0,32912810.0,676537.0,"NFT, Ethereum Ecosystem, NFT Marketplace, Coinbase Ventures Portfolio, Energi Ecosystem, Made in USA"
BELLS,bellscoin,Bellscoin,BELLS,22064977.0,22064977.0,1481445.0,"Smart Contract Platform, Layer 1 (L1), Meme, Proof of Work (PoW), Inscriptions, Made in USA"
LMT,limitus,LIMITUS,LMT,21697156.0,21697156.0,1902656.0,"Artificial Intelligence (AI), Solana Ecosystem, Pump.fun Ecosystem, Binance Alpha Spotlight"
BOOE,book-of-ethereum,Book of Ethereum,BOOE,21304389.0,21304389.0,272791.0,"Meme, Ethereum Ecosystem"
VRTX,vertex-protocol,Vertex,VRTX,21243763.0,41330221.0,2299071.0,"Decentralized Exchange (DEX), Exchange-based Tokens, Decentralized Finance (DeFi), Derivatives, Perpetuals, Avalanche Ecosystem, Arbitrum Ecosystem, Mantle Ecosystem, Base Ecosystem, Blast Ecosystem, Sonic Ecosystem, Sei Network Ecosystem"
CRTS,cratos,Cratos,CRTS,20782992.0,33064906.0,1140808.0,"BNB Chain Ecosystem, Ethereum Ecosystem"
LCAT,lion-cat,Lion Cat,LCAT,17967798.0,26867735.0,174543.0,"BNB Chain Ecosystem, Meme, Cat-Themed"
ZKL,zklink,zkLink,ZKL,17885116.0,67749706.0,5872449.0,"Smart Contract Platform, Ethereum Ecosystem, Zero Knowledge (ZK), Layer 3 (L3), zkLink Nova Ecosystem, OKX Ventures Portfolio"
SUKU,suku,SUKU,SUKU,16215575.0,55187877.0,545004.0,"Polygon Ecosystem, Ethereum Ecosystem, Made in USA"
SOVRN,sovrun,Sovrun,SOVRN,13922953.0,14997848.0,141989.0,"Gaming (GameFi), Metaverse, Ethereum Ecosystem, Animoca Brands Portfolio, Base Ecosystem, DWF Labs Portfolio, On-chain Gaming, Andreessen Horowitz (a16z) Portfolio, Hyperliquid Ecosystem, Delphi Ventures Portfolio, Circle Ventures Portfolio"
VINU,vita-inu,Vita Inu,VINU,13455248.0,13455248.0,2308479.0,"BNB Chain Ecosystem, Meme, Dog-Themed, DWF Labs Portfolio, Binance Alpha Spotlight"
TET,tectum,Tectum,TET,11989888.0,15553555.0,250325.0,"Smart Contract Platform, Layer 1 (L1), Ethereum Ecosystem, Bitcoin Sidechains, SideChain"
SIDUS,sidus,Sidus,SIDUS,11701647.0,19987840.0,927877.0,"Gaming (GameFi), NFT, BNB Chain Ecosystem, Metaverse, Play To Earn, Ethereum Ecosystem, Linea Ecosystem, Animoca Brands Portfolio, Base Ecosystem, RPG, Gaming Governance Token, Alameda Research Portfolio, OKX Ventures Portfolio"
ELON4AFD,elon4afd,Elon4AfD,ELON4AFD,11523235.0,11523235.0,87445.0,"Solana Ecosystem, Meme, Elon Musk-Inspired, Pump.fun Ecosystem"
VISTA,ethervista,Ethervista,VISTA,10686168.0,10686168.0,2248863.0,"Decentralized Exchange (DEX), Launchpad, Ethereum Ecosystem, Binance Alpha Spotlight"
GRAM,gram-2,Gram,GRAM,10524988.0,10524988.0,37880.0,"TON Ecosystem, Proof of Work (PoW)"
JETTON,jetton,JetTon Games,JETTON,10463692.0,16208794.0,42874.0,"Gambling (GambleFi), Telegram Apps, TON Ecosystem"
CA,ca-htb,Coupon Assets,CA,10384574.0,152446462.0,3201298.0,"Retail, Ethereum Ecosystem"
WALLET,ambire-wallet,Ambire Wallet,WALLET,10274103.0,10335306.0,614625.0,"Wallets, Polygon Ecosystem, Ethereum Ecosystem, Base Ecosystem, Account Abstraction"
STC,saitachain-coin-2,SaitaChain Coin,STC,9198586.0,11971369.0,2.77,"Smart Contract Platform, Decentralized Finance (DeFi), BNB Chain Ecosystem"
PPC,peercoin,Peercoin,PPC,8168806.0,8168806.0,25446.0,"Smart Contract Platform, Polygon Ecosystem, Ethereum Ecosystem, Proof of Stake (PoS), Proof of Work (PoW)"
BUZZ,hive-ai,Hive AI,BUZZ,7688862.0,7688862.0,14724208.0,"Artificial Intelligence (AI), Decentralized Finance (DeFi), Solana Ecosystem, AI Agents, Pump.fun Ecosystem, Binance Alpha Spotlight, DeFAI"
HAPPY,happycat-2,Happy Cat,HAPPY,7184921.0,7184921.0,2953065.0,"BNB Chain Ecosystem, Solana Ecosystem, Meme, Cat-Themed, Binance Alpha Spotlight"
OVR,ovr,Ovr,OVR,6859914.0,11747866.0,310002.0,"Augmented Reality, NFT, BNB Chain Ecosystem, Metaverse, Polygon Ecosystem, Ethereum Ecosystem, DePIN, Base Ecosystem"
RVF,rocketx,RocketX Exchange,RVF,6271404.0,6415828.0,48617.0,"Decentralized Exchange (DEX), Decentralized Finance (DeFi), Automated Market Maker (AMM), Ethereum Ecosystem, Poolz Finance Launchpad"
IMGN,imgn-labs,IMGN Labs,IMGN,6229794.0,6229794.0,90567.0,"Artificial Intelligence (AI), Base Ecosystem, AI Applications"
OBT,oobit,Oobit,OBT,5657921.0,16072530.0,30839.0,"BNB Chain Ecosystem, Ethereum Ecosystem, Payment Solutions"
SIX,six-network,SIX Network,SIX,5588021.0,20410879.0,549790.0,"DWF Labs Portfolio, Stellar Ecosystem"
KIMA,kima,Kima Network,KIMA,5551209.0,35316108.0,1188085.0,"Infrastructure, Cosmos Ecosystem, Arbitrum Ecosystem, Outlier Ventures Portfolio"
APP,moon-app,RWAX,APP,5517435.0,13680837.0,224040.0,"Tokenized Real Estate, Tokenized Assets, BNB Chain Ecosystem, Solana Ecosystem, Ethereum Ecosystem, Real World Assets (RWA), Injective Ecosystem, RWA Protocol"
AGC,argocoin-2,Argocoin,AGC,5380853.0,5380853.0,13518.43,"Artificial Intelligence (AI), Made in USA"
MUBI,multibit,Multibit,MUBI,5013421.0,5277285.0,3030516.0,"BNB Chain Ecosystem, Polygon Ecosystem, Ethereum Ecosystem, BRC-20, Inscriptions"
MOEW,moew,MOEW,MOEW,4727329.0,4727329.0,1077519.0,"Meme, Base Ecosystem, TON Ecosystem, Cat-Themed, Base Meme, TON Meme"
JOULE,joule-2,Joule,JOULE,4496054.0,4534710.0,17067.43,"Decentralized Finance (DeFi), Flare Network Ecosystem"
CHIRP,chirper-ai,Chirper AI,CHIRP,4385882.0,4385882.0,44103.0,"Solana Ecosystem, AI Agents"
RJV,rejuve-ai,Rejuve.AI,RJV,4210203.0,7857414.0,561478.0,"BNB Chain Ecosystem, Cardano Ecosystem, Ethereum Ecosystem, Decentralized Science (DeSci)"
ORT,okratech-token,Okratech,ORT,3794562.0,4060692.0,287944.0,"BNB Chain Ecosystem, Kommunitas Launchpad, DWF Labs Portfolio"
EGP,eigenpie,Eigenpie,EGP,3716714.0,10099291.0,2329420.0,"Decentralized Finance (DeFi), BNB Chain Ecosystem, Arbitrum Ecosystem, Restaking, Liquid Staking"
ICP,internet-computer,Internet Computer,ICP,3030503437.0,3030509729.0,82810068.0,"Artificial Intelligence (AI), Infrastructure, Smart Contract Platform, Layer 1 (L1), Internet Computer Ecosystem, Alleged SEC Securities, Multicoin Capital Portfolio, Layer 0 (L0), Andreessen Horowitz (a16z) Portfolio, GMCI Layer 1 Index, GMCI 30 Index, Blockchain Capital Portfolio, GMCI Index, Polychain Capital Portfolio, Coinbase 50 Index"
POL,polygon-ecosystem-token,POL (ex-MATIC),POL,2209028274.0,2612580256.0,93169879.0,"Smart Contract Platform, Polygon Ecosystem, Ethereum Ecosystem, Layer 2 (L2)"
TIA,celestia,Celestia,TIA,1949796887.0,3444272327.0,131551188.0,"Smart Contract Platform, Cosmos Ecosystem, Layer 1 (L1), Data Availability, Modular Blockchain, Osmosis Ecosystem, eGirl Capital Portfolio, Coinbase Ventures Portfolio, Proof of Stake (PoS), Secret Ecosystem, YZi Labs (Prev. Binance Labs) Portfolio, Delphi Ventures Portfolio, Galaxy Digital Portfolio, Blockchain Capital Portfolio, OKX Ventures Portfolio, Polychain Capital Portfolio"
FTN,fasttoken,Fasttoken,FTN,1876967896.0,3801642367.0,55779527.0,"Smart Contract Platform, BNB Chain Ecosystem, Layer 1 (L1), Arbitrum Ecosystem, Ethereum Ecosystem, Base Ecosystem, Bahamut Ecosystem"
STX,blockstack,Stacks,STX,1448114213.0,1448114213.0,61971289.0,"Infrastructure, Smart Contract Platform, Layer 2 (L2), Bitcoin Sidechains, Stacks Ecosystem, SideChain, GMCI Layer 2 Index, GMCI 30 Index, Blockchain Capital Portfolio, GMCI Index, Made in USA, Coinbase 50 Index"
DEXE,dexe,DeXe,DEXE,720687209.0,1217951544.0,18681578.0,"Artificial Intelligence (AI), Decentralized Finance (DeFi), BNB Chain Ecosystem, Ethereum Ecosystem"
AERO,aerodrome-finance,Aerodrome Finance,AERO,592893657.0,1171425879.0,46766936.0,"Decentralized Exchange (DEX), Decentralized Finance (DeFi), Automated Market Maker (AMM), Base Ecosystem, Binance Alpha Spotlight, Made in USA"
TEL,telcoin,Telcoin,TEL,521223064.0,567165348.0,3193069.0,"Decentralized Finance (DeFi), Wallets, Polygon Ecosystem, Arbitrum Ecosystem, Ethereum Ecosystem, Payment Solutions, Base Ecosystem, Made in USA"
MINA,mina-protocol,Mina Protocol,MINA,347289806.0,347289806.0,23313340.0,"Smart Contract Platform, Zero Knowledge (ZK), FTX Holdings, Paradigm Portfolio, Coinbase Ventures Portfolio, Multicoin Capital Portfolio, Proof of Stake (PoS), Pantera Capital Portfolio, Circle Ventures Portfolio, Privacy Blockchain, Polychain Capital Portfolio, Made in USA, Coinbase 50 Index"
MEW,cat-in-a-dogs-world,cat in a dogs world,MEW,327804496.0,327804496.0,67960075.0,"Solana Ecosystem, Meme, Dog-Themed, Solana Meme, Cat-Themed"
ZIL,zilliqa,Zilliqa,ZIL,278947517.0,288713904.0,21112881.0,"Smart Contract Platform, BNB Chain Ecosystem, GMCI Layer 1 Index, GMCI Index, Made in China"
ZK,zksync,ZKsync,ZK,272655485.0,1558031344.0,32905152.0,"Smart Contract Platform, Layer 2 (L2), Zero Knowledge (ZK), ZkSync Ecosystem, Consensys Portfolio, Blockchain Capital Portfolio, OKX Ventures Portfolio"
DCR,decred,Decred,DCR,250931384.0,250934332.0,2724136.0,"Smart Contract Platform, Privacy, Layer 1 (L1), Proof of Stake (PoS), Proof of Work (PoW), Blockchain Capital Portfolio, Made in USA"
EUL,euler,Euler,EUL,174192526.0,253406974.0,3452891.0,"Lending/Borrowing Protocols, Ethereum Ecosystem, Paradigm Portfolio, Coinbase Ventures Portfolio"
STPT,stp-network,STP,STPT,147081077.0,147081077.0,42537497.0,"Decentralized Finance (DeFi), Derivatives, Synthetic Issuer, Ethereum Ecosystem, Base Ecosystem, Synthetic"
PAAL,paal-ai,PAAL AI,PAAL,146327579.0,163083609.0,12336311.0,"Artificial Intelligence (AI), Virtual Reality, BNB Chain Ecosystem, Launchpad, Ethereum Ecosystem, Telegram Apps, Discord Bots, Base Ecosystem, PAAL AI Launchpad, AI Agents, AI Applications, AI Agent Launchpad, Binance Alpha Spotlight, AI Framework, DeFAI, Made in USA"
BICO,biconomy,Biconomy,BICO,137517520.0,144609622.0,8068683.0,"Arbitrum Ecosystem, Ethereum Ecosystem, Account Abstraction, Coinbase Ventures Portfolio, YZi Labs (Prev. Binance Labs) Portfolio, Consensys Portfolio, Outlier Ventures Portfolio"
B3,b3,B3 (Base),B3,134659354.0,572649641.0,13767058.0,"Smart Contract Platform, Base Ecosystem, Gaming Blockchains"
HIVE,hive,Hive,HIVE,132122077.0,,7255427.0,"Smart Contract Platform, SocialFi, Layer 1 (L1), Gaming Blockchains"
CARV,carv,CARV,CARV,111729282.0,404568919.0,18010892.0,"Artificial Intelligence (AI), Infrastructure, Gaming (GameFi), NFT, Solana Ecosystem, Arbitrum Ecosystem, Impossible Finance Launchpad, Ethereum Ecosystem, Animoca Brands Portfolio, Base Ecosystem"
ACX,across-protocol,Across Protocol,ACX,110774052.0,252838755.0,10861858.0,"Polygon Ecosystem, Arbitrum Ecosystem, Ethereum Ecosystem, Optimism Ecosystem, Bridge Governance Tokens, Cross-chain Communication, Intent, Boba Network Ecosystem, Blockchain Capital Portfolio, Made in USA"
ZRC,zircuit,Zircuit,ZRC,110469245.0,503294292.0,17455071.0,"Smart Contract Platform, Ethereum Ecosystem, Layer 2 (L2), Zero Knowledge (ZK), Restaking, Zircuit Ecosystem"
YGG,yield-guild-games,Yield Guild Games,YGG,108142509.0,240246125.0,41490005.0,"Gaming (GameFi), NFT, BNB Chain Ecosystem, Metaverse, Collectibles, Polygon Ecosystem, Play To Earn, Harmony Ecosystem, Guild and Scholarship, Ethereum Ecosystem, Animoca Brands Portfolio, Base Ecosystem, DWF Labs Portfolio, Ronin Ecosystem, Gaming Governance Token, Andreessen Horowitz (a16z) Portfolio, Delphi Ventures Portfolio, Abstract Ecosystem"
AGLD,adventure-gold,Adventure Gold,AGLD,99254122.0,99254122.0,79387809.0,"Ethereum Ecosystem, DWF Labs Portfolio"
MVL,mass-vehicle-ledger,MVL,MVL,97020531.0,101396910.0,1797991.0,"Internet of Things (IOT), BNB Chain Ecosystem, Ethereum Ecosystem, DePIN, DWF Labs Portfolio"
VEE,blockv,BLOCKv,VEE,80350044.0,80350044.0,252468.0,"NFT, Polygon Ecosystem, Ethereum Ecosystem, Optimism Ecosystem"
USTC,terrausd,TerraClassicUSD,USTC,79453767.0,86565721.0,12978825.0,"Stablecoins, USD Stablecoin, Seigniorage, Alleged SEC Securities, Osmosis Ecosystem, Stablecoin Protocol, DeFiance Capital Portfolio, Terra Classic Ecosystem, YZi Labs (Prev. Binance Labs) Portfolio, Delphi Ventures Portfolio, Galaxy Digital Portfolio, Fiat-backed Stablecoin"
AVAIL,avail,Avail,AVAIL,78221255.0,394270259.0,9613022.0,"Infrastructure, Smart Contract Platform, Ethereum Ecosystem, Data Availability, Modular Blockchain"
EWT,energy-web-token,Energy Web,EWT,75460618.0,86103061.0,450203.0,"Energy, Polkadot Ecosystem, Gnosis Chain Ecosystem, Regenerative Finance (ReFi), Real World Assets (RWA), Blockchain Capital Portfolio"
SCRT,secret,Secret,SCRT,72605304.0,76338764.0,4821054.0,"Artificial Intelligence (AI), Smart Contract Platform, Cosmos Ecosystem, Layer 1 (L1), Osmosis Ecosystem, Alameda Research Portfolio, DragonFly Capital Portfolio, DeFiance Capital Portfolio, Privacy Blockchain, Outlier Ventures Portfolio"
ACS,access-protocol,Access Protocol,ACS,62814222.0,135326154.0,1070553.0,"SocialFi, Solana Ecosystem"
ISLM,islamic-coin,Islamic Coin,ISLM,61788162.0,689023576.0,982264.0,"Smart Contract Platform, Wallets, Layer 2 (L2), Osmosis Ecosystem"
SYN,synapse-2,Synapse,SYN,60253417.0,68761551.0,12996287.0,"BNB Chain Ecosystem, Avalanche Ecosystem, Polygon Ecosystem, Fantom Ecosystem, Arbitrum Ecosystem, Olympus Pro Ecosystem, Ethereum Ecosystem, Optimism Ecosystem, Bridge Governance Tokens, Base Ecosystem, Alameda Research Portfolio, Intent"
CYBER,cyberconnect,CYBER,CYBER,57868465.0,149735981.0,12259038.0,"Smart Contract Platform, SocialFi, NFT, BNB Chain Ecosystem, Binance Launchpool, Ethereum Ecosystem, Decentralized Identifier (DID), Optimism Ecosystem, Layer 2 (L2), Animoca Brands Portfolio, Multicoin Capital Portfolio, YZi Labs (Prev. Binance Labs) Portfolio, Delphi Ventures Portfolio, Cyber Ecosystem, Optimism Superchain Ecosystem"
ALI,alethea-artificial-liquid-intelligence-token,Artificial Liquid Intelligence,ALI,52944834.0,63812451.0,1605015.0,"Artificial Intelligence (AI), NFT, Metaverse, Solana Ecosystem, Polygon Ecosystem, Ethereum Ecosystem, Cronos Ecosystem, Base Ecosystem, Multicoin Capital Portfolio, AI Agents, Alameda Research Portfolio, DeFiance Capital Portfolio, YZi Labs (Prev. Binance Labs) Portfolio"
EOS,binance-peg-eos,Binance-Peg EOS,EOS,50708317.0,50708317.0,713274.0,"Smart Contract Platform, BNB Chain Ecosystem, Binance-Peg Tokens"
UNP,unipoly,Unipoly,UNP,50349396.0,180315138.0,634110.0,"Gaming (GameFi), Ethereum Ecosystem, Skale Ecosystem"
HFT,hashflow,Hashflow,HFT,49108966.0,85888382.0,20260058.0,"Decentralized Exchange (DEX), Exchange-based Tokens, Decentralized Finance (DeFi), BNB Chain Ecosystem, Binance Launchpool, MEV Protection, Ethereum Ecosystem, Coinbase Ventures Portfolio, Alameda Research Portfolio, DragonFly Capital Portfolio, Galaxy Digital Portfolio"
NCT,polyswarm,PolySwarm,NCT,44352232.0,44361930.0,3455478.0,"Business Services, Polygon Ecosystem, Ethereum Ecosystem, Cybersecurity, Made in USA"
STRIKE,strike,Strike,STRIKE,42283110.0,49764422.0,1147502.0,"Decentralized Finance (DeFi), Lending/Borrowing Protocols, Ethereum Ecosystem"
FORT,forta,Forta,FORT,41856508.0,73215632.0,918316.0,"Artificial Intelligence (AI), Polygon Ecosystem, Ethereum Ecosystem, Coinbase Ventures Portfolio, Cybersecurity, Andreessen Horowitz (a16z) Portfolio, Blockchain Capital Portfolio"
WHITE,whiteheart,Whiteheart,WHITE,39862521.0,39862521.0,5.23,"Decentralized Finance (DeFi), Derivatives, Ethereum Ecosystem"
ALEX,alexgo,ALEX Lab,ALEX,38860791.0,46618977.0,732852.0,"Decentralized Finance (DeFi), Lending/Borrowing Protocols, Ethereum Ecosystem, DWF Labs Portfolio, Mode Ecosystem, Stacks Ecosystem, BTCfi"
SWARMS,swarms,Swarms,SWARMS,38479715.0,38479715.0,21661632.0,"Artificial Intelligence (AI), Solana Ecosystem, Meme, AI Agents, Pump.fun Ecosystem, Binance Alpha Spotlight, AI Framework"
J,jambo,Jambo,J,37981463.0,235898369.0,4346923.0,"Solana Ecosystem, Paradigm Portfolio, Coinbase Ventures Portfolio"
VADER,vaderai-by-virtuals,VaderAI by Virtuals,VADER,37975912.0,37975912.0,2500812.0,"Artificial Intelligence (AI), Meme, Base Ecosystem, AI Meme, AI Agents, Virtuals Protocol Ecosystem, Binance Alpha Spotlight"
SWEAT,sweatcoin,Sweat Economy,SWEAT,37712938.0,104364747.0,4780406.0,"Sports, Gaming (GameFi), BNB Chain Ecosystem, Solana Ecosystem, Avalanche Ecosystem, Polygon Ecosystem, Near Protocol Ecosystem, Play To Earn, Arbitrum Ecosystem, Celo Ecosystem, Move To Earn, Ethereum Ecosystem, Optimism Ecosystem, Aptos Ecosystem, Sui Ecosystem, Base Ecosystem, Gaming Governance Token, Gaming Utility Token, OKX Ventures Portfolio"
NYM,nym,Nym,NYM,35876869.0,44220975.0,2571585.0,"Smart Contract Platform, Privacy, Ethereum Ecosystem, DePIN, Osmosis Ecosystem, VPN, Andreessen Horowitz (a16z) Portfolio, YZi Labs (Prev. Binance Labs) Portfolio"
ORDER,orderly-network,Orderly Network,ORDER,29687165.0,112775701.0,9398750.0,"Smart Contract Platform, Decentralized Finance (DeFi), BNB Chain Ecosystem, Solana Ecosystem, Polygon Ecosystem, Arbitrum Ecosystem, Ethereum Ecosystem, Optimism Ecosystem, Layer 2 (L2), Base Ecosystem, DragonFly Capital Portfolio, Pantera Capital Portfolio, Sequoia Capital Portfolio, OKX Ventures Portfolio, Optimism Superchain Ecosystem, Binance Alpha Spotlight"
CONX,connex,Connex,CONX,25092295.0,2181938691.0,65370.0,BNB Chain Ecosystem
KENDU,kendu-inu,Kendu Inu,KENDU,23641653.0,23744084.0,511481.0,"Solana Ecosystem, Meme, Ethereum Ecosystem, Base Ecosystem"
