TKX,tokenize-xchange,Tokenize Xchange,TKX,417412157,521791301.0,473156.0,"Exchange-based Tokens, Centralized Exchange (CEX) Token, Ethereum Ecosystem, Titanchain Ecosystem"
DRIFT,drift-protocol,Drift Protocol,DRIFT,336088071,538087570.0,31946864.0,"Decentralized Finance (DeFi), Derivatives, Prediction Markets, Solana Ecosystem"
JST,just,JUST,JST,330465557,330465557.0,26517280.0,"Decentralized Finance (DeFi), Tron Ecosystem"
DASH,dash,Dash,DASH,277816587,277819949.0,34392944.0,"Smart Contract Platform, Privacy, Masternodes, Alleged SEC Securities, Proof of Stake (PoS), Proof of Work (PoW), Made in USA"
NPC,non-playable-coin,Non-Playable Coin,NPC,216865009,216865009.0,8445926.0,"NFT, BNB Chain Ecosystem, Solana Ecosystem, Meme, Ethereum Ecosystem, Base Ecosystem, Hybrid Token Standards, Wojak-Themed, 4chan-Themed"
CELO,celo,Celo,CELO,196094737,338842234.0,40931631.0,"Smart Contract Platform, Celo Ecosystem, Layer 2 (L2), DWF Labs Portfolio, Coinbase Ventures Portfolio, Proof of Stake (PoS), Andreessen Horowitz (a16z) Portfolio, Optimism Superchain Ecosystem, Outlier Ventures Portfolio, Made in USA"
LGCT,legacy-token,Legacy Token,LGCT,192538738,544514797.0,4655976.0,"Education, Gaming (GameFi), BNB Chain Ecosystem, Base Ecosystem"
VTHO,vethor-token,VeThor,VTHO,175455150,175529145.0,2864998.0,"Layer 1 (L1), VeChain Ecosystem"
ELF,aelf,aelf,ELF,167793108,210749771.0,4082230.0,"Infrastructure, Smart Contract Platform, BNB Chain Ecosystem, Layer 1 (L1), Ethereum Ecosystem, GMCI Layer 1 Index, Aelf Ecosystem, GMCI Index"
ZIG,zignaly,ZIGChain,ZIG,157804540,218845766.0,3162006.0,"Artificial Intelligence (AI), Smart Contract Platform, BNB Chain Ecosystem, Solana Ecosystem, Layer 1 (L1), Polygon Ecosystem, Ethereum Ecosystem, DWF Labs Portfolio, Injective Ecosystem, OKX Ventures Portfolio"
WOO,woo-network,WOO,WOO,144555011,167292808.0,8588411.0,"Decentralized Exchange (DEX), Exchange-based Tokens, Decentralized Finance (DeFi), Automated Market Maker (AMM), BNB Chain Ecosystem, Derivatives, Perpetuals, Centralized Exchange (CEX) Token, Solana Ecosystem, Avalanche Ecosystem, Polygon Ecosystem, Near Protocol Ecosystem, Fantom Ecosystem, Arbitrum Ecosystem, Ethereum Ecosystem, ZkSync Ecosystem, Mantle Ecosystem, Linea Ecosystem, Base Ecosystem, DragonFly Capital Portfolio, YZi Labs (Prev. Binance Labs) Portfolio"
AI16Z,ai16z,ai16z,AI16Z,136271822,136271822.0,38887167.0,"Artificial Intelligence (AI), Solana Ecosystem, Meme, Solana Token-2022, AI Agents, Binance Alpha Spotlight, AI Framework, Made in USA"
IO,io,io.net,IO,116614122,495860593.0,31852669.0,"Artificial Intelligence (AI), Internet of Things (IOT), Binance Launchpool, Solana Ecosystem, DePIN, Animoca Brands Portfolio, Multicoin Capital Portfolio, Delphi Ventures Portfolio, OKX Ventures Portfolio, Made in USA"
OZO,ozone-chain,Ozone Chain,OZO,114460739,134894662.0,189551.0,"Smart Contract Platform, Layer 1 (L1), Zero Knowledge (ZK)"
SIX,six,Six Sigma,SIX,107378916,107378916.0,38363.0,"Gambling (GambleFi), Solana Ecosystem"
BICO,biconomy,Biconomy,BICO,104694082,107518350.0,8791657.0,"Arbitrum Ecosystem, Ethereum Ecosystem, Account Abstraction, Coinbase Ventures Portfolio, YZi Labs (Prev. Binance Labs) Portfolio, Consensys Portfolio, Outlier Ventures Portfolio"
PAAL,paal-ai,PAAL AI,PAAL,95460892,106364109.0,9056763.0,"Artificial Intelligence (AI), Virtual Reality, BNB Chain Ecosystem, Launchpad, Ethereum Ecosystem, Telegram Apps, Discord Bots, Base Ecosystem, PAAL AI Launchpad, AI Agents, AI Applications, AI Agent Launchpad, Binance Alpha Spotlight, AI Framework, DeFAI, Made in USA"
VEE,blockv,BLOCKv,VEE,87535773,87535773.0,75122.0,"NFT, Polygon Ecosystem, Ethereum Ecosystem, Optimism Ecosystem"
BAL,balancer,Balancer,BAL,87170821,93760529.0,7520917.0,"Decentralized Exchange (DEX), Exchange-based Tokens, Decentralized Finance (DeFi), Yield Farming, Automated Market Maker (AMM), Avalanche Ecosystem, Polygon Ecosystem, Near Protocol Ecosystem, Gnosis Chain Ecosystem, Harmony Ecosystem, Arbitrum Ecosystem, Ethereum Ecosystem, Optimism Ecosystem, Base Ecosystem, Index Coop Defi Index, Alameda Research Portfolio, DeFiance Capital Portfolio, Pantera Capital Portfolio, Energi Ecosystem, Polygon zkEVM Ecosystem, Huobi ECO Chain Ecosystem, Blockchain Capital Portfolio"
RLC,iexec-rlc,iExec RLC,RLC,69140210,83102676.0,5655154.0,"Artificial Intelligence (AI), Oracle, Arbitrum Ecosystem, Ethereum Ecosystem, DePIN, AI Agents, Energi Ecosystem, Sora Ecosystem, GMCI DePIN Index, GMCI Index"
VANRY,vanar-chain,Vanar Chain,VANRY,60791075,61852031.0,7246256.0,"Smart Contract Platform, Gaming (GameFi), NFT, Layer 1 (L1), Polygon Ecosystem, Ethereum Ecosystem, Vanar Chain Ecosystem"
AO,ao-computer,ao Computer,AO,59584926,59584926.0,1344992.0,"Artificial Intelligence (AI), Smart Contract Platform, DePIN"
SCRT,secret,Secret,SCRT,56677549,59547812.0,2294046.0,"Artificial Intelligence (AI), Smart Contract Platform, Cosmos Ecosystem, Layer 1 (L1), Osmosis Ecosystem, Alameda Research Portfolio, DragonFly Capital Portfolio, DeFiance Capital Portfolio, Privacy Blockchain, Outlier Ventures Portfolio"
STRIKE,strike,Strike,STRIKE,55865732,64674455.0,46022729.0,"Decentralized Finance (DeFi), Lending/Borrowing Protocols, Ethereum Ecosystem"
QKC,quark-chain,QuarkChain,QKC,52023488,72749774.0,2619020.0,"Infrastructure, Ethereum Ecosystem, Energi Ecosystem"
QI,benqi,BENQI,QI,50232964,50349199.0,3400535.0,"Decentralized Finance (DeFi), Yield Farming, Binance Launchpool, Lending/Borrowing Protocols, Avalanche Ecosystem, Liquid Staking Governance Tokens, DragonFly Capital Portfolio, Liquid Staking"
CHILLGUY,chill-guy,Just a chill guy,CHILLGUY,48628679,48628679.0,15422933.0,"Solana Ecosystem, Meme, Dog-Themed, Solana Meme, Pump.fun Ecosystem, TikTok Meme"
ACS,access-protocol,Access Protocol,ACS,47893987,100925573.0,734464.0,"SocialFi, Solana Ecosystem"
UQC,uquid-coin,Uquid Coin,UQC,45627999,182511996.0,113988.0,Ethereum Ecosystem
NOS,nosana,Nosana,NOS,43792267,52508714.0,496698.0,"Artificial Intelligence (AI), Solana Ecosystem, DePIN"
NYM,nym,Nym,NYM,42760834,52424768.0,2164522.0,"Smart Contract Platform, Privacy, Ethereum Ecosystem, DePIN, Osmosis Ecosystem, VPN, Andreessen Horowitz (a16z) Portfolio, YZi Labs (Prev. Binance Labs) Portfolio"
ANVL,anvil,Anvil,ANVL,41914740,151038605.0,183990.0,"Decentralized Finance (DeFi), Ethereum Ecosystem"
FORT,forta,Forta,FORT,41348377,67312801.0,595997.0,"Artificial Intelligence (AI), Polygon Ecosystem, Ethereum Ecosystem, Coinbase Ventures Portfolio, Cybersecurity, Andreessen Horowitz (a16z) Portfolio, Blockchain Capital Portfolio"
OGN,origin-protocol,Origin Token,OGN,40909356,85210322.0,5057288.0,"Decentralized Finance (DeFi), NFT, Ethereum Ecosystem, Base Ecosystem, Pantera Capital Portfolio, Sonic Ecosystem, Liquid Staking, Made in USA"
MBX,marblex,MARBLEX,MBX,38847781,57662307.0,2423529.0,"Smart Contract Platform, Gaming (GameFi), NFT, BNB Chain Ecosystem, Kaia Ecosystem, Aptos Ecosystem, DWF Labs Portfolio, Gaming Blockchains"
GPS,goplus-security,GoPlus Security,GPS,38329517,144331055.0,11658247.0,"BNB Chain Ecosystem, Base Ecosystem, Cybersecurity, YZi Labs (Prev. Binance Labs) Portfolio, OKX Ventures Portfolio, Binance Alpha Spotlight"
SEDA,seda-2,SEDA,SEDA,37411176,62428512.0,436227.0,"Smart Contract Platform, Oracle, Ethereum Ecosystem, Base Ecosystem, Modular Blockchain, Osmosis Ecosystem"
LYX,lukso-token-2,LUKSO,LYX,35024087,48305289.0,3406760.0,"Smart Contract Platform, SocialFi, Layer 1 (L1), Decentralized Identifier (DID), Proof of Stake (PoS), Lukso Ecosystem"
AINTI,aintivirus,AIntivirus,AINTI,33726860,33726860.0,0.0,"Solana Ecosystem, Meme, AI Meme, Pump.fun Ecosystem"
APX,apollox-2,APX,APX,33724158,311664893.0,6632457.0,"Decentralized Finance (DeFi), BNB Chain Ecosystem, Perpetuals, YZi Labs (Prev. Binance Labs) Portfolio, Binance Alpha Spotlight"
L3,layer3,Layer3,L3,29761133,137136318.0,9663406.0,"Marketing, BNB Chain Ecosystem, Solana Ecosystem, Polygon Ecosystem, Arbitrum Ecosystem, Ethereum Ecosystem, Decentralized Identifier (DID), Optimism Ecosystem, Quest-to-Earn, Made in USA"
MAPO,marcopolo,MAP Protocol,MAPO,28785115,46595708.0,1793567.0,"BNB Chain Ecosystem, Ethereum Ecosystem, DWF Labs Portfolio"
NAVX,navi,NAVI Protocol,NAVX,26006958,44120141.0,2748837.0,"Decentralized Finance (DeFi), Lending/Borrowing Protocols, Sui Ecosystem, OKX Ventures Portfolio, Binance Alpha Spotlight"
LUMIA,lumia,Lumia,LUMIA,23940097,75942958.0,3615845.0,"Smart Contract Platform, Layer 2 (L2), Real World Assets (RWA)"
PIKA,pikaboss,Pikaboss,PIKA,23280359,23280359.0,5607.52,"Meme, Ethereum Ecosystem"
FARTBOY,fartboy,Fartboy,$FARTBOY,20951849,20951849.0,441290.0,"Solana Ecosystem, Meme, Solana Meme, Pump.fun Ecosystem"
FLOCK,flock-2,FLOCK,FLOCK,20901313,189706859.0,3933427.0,"Artificial Intelligence (AI), Base Ecosystem, AI Applications, Binance Alpha Spotlight"
WALLET,ambire-wallet,Ambire Wallet,WALLET,20037648,20284537.0,462334.0,"Wallets, Polygon Ecosystem, Ethereum Ecosystem, Base Ecosystem, Account Abstraction"
TLOS,telos,Telos,TLOS,18813622,18813624.0,1933024.0,"Smart Contract Platform, BNB Chain Ecosystem, Layer 1 (L1), Avalanche Ecosystem, Polygon Ecosystem, Arbitrum Ecosystem, Ethereum Ecosystem, Zero Knowledge (ZK), Base Ecosystem, Telos Ecosystem, Consensys Portfolio"
NRN,neuron,Neuron,NRN,17960258,39962032.0,105074.0,"Artificial Intelligence (AI), Gaming (GameFi), NFT, Arbitrum Ecosystem, Paradigm Portfolio, AI Agents, AI Framework, Action Games"
RARI,rarible,RARI,RARI,17913348,24712317.0,1013987.0,"NFT, Ethereum Ecosystem, NFT Marketplace, Coinbase Ventures Portfolio, Energi Ecosystem, Made in USA"
PIPPIN,pippin,pippin,PIPPIN,16761108,16761108.0,8119974.0,"Artificial Intelligence (AI), Infrastructure, Solana Ecosystem, Meme, Solana Meme, AI Meme, AI Agents, Pump.fun Ecosystem, Binance Alpha Spotlight, AI Framework"
VADER,vaderai-by-virtuals,VaderAI by Virtuals,VADER,16507831,16507831.0,764444.0,"Artificial Intelligence (AI), Meme, Base Ecosystem, AI Meme, AI Agents, Virtuals Protocol Ecosystem, Binance Alpha Spotlight"
BUZZ,hive-ai,Hive AI,BUZZ,13471487,13471487.0,9807380.0,"Decentralized Finance (DeFi), Solana Ecosystem, AI Agents, Pump.fun Ecosystem, Binance Alpha Spotlight, DeFAI"
SCA,scallop-2,Scallop,SCA,12910004,26754761.0,4562846.0,"Decentralized Finance (DeFi), Lending/Borrowing Protocols, Sui Ecosystem"
XTER,xterio,Xterio,XTER,12695955,89812812.0,8339288.0,"Artificial Intelligence (AI), Gaming (GameFi), NFT, BNB Chain Ecosystem, Animoca Brands Portfolio, Gaming Blockchains, YZi Labs (Prev. Binance Labs) Portfolio, Binance Alpha Spotlight"
BELLS,bellscoin,Bellscoin,BELLS,10700816,10700816.0,354800.0,"Smart Contract Platform, Layer 1 (L1), Meme, Proof of Work (PoW), Inscriptions, Made in USA"
TET,tectum,Tectum,TET,10314270,10508795.0,306815.0,"Smart Contract Platform, Layer 1 (L1), Ethereum Ecosystem, Bitcoin Sidechains, SideChain"
EOS,binance-peg-eos,Binance-Peg EOS,EOS,10254834,10254834.0,12686.06,"Smart Contract Platform, BNB Chain Ecosystem, Binance-Peg Tokens"
JETTON,jetton,JetTon Games,JETTON,10161880,15880836.0,95121.0,"Gambling (GambleFi), Telegram Apps, TON Ecosystem"
VISTA,ethervista,Ethervista,VISTA,9858745,9858745.0,1508716.0,"Decentralized Exchange (DEX), Decentralized Finance (DeFi), Launchpad, Meme, Ethereum Ecosystem, Murad Picks, Binance Alpha Spotlight"
CEEK,ceek,CEEK Smart VR,CEEK,9818387,10090831.0,504503.0,"Entertainment, BNB Chain Ecosystem, Metaverse, Ethereum Ecosystem, DWF Labs Portfolio"
HMT,human-protocol,HUMAN Protocol,HMT,9792746,12921465.0,9119.07,"Artificial Intelligence (AI), Infrastructure, Software as a service, Polygon Ecosystem, Ethereum Ecosystem, Market-Making Solution, AI Framework"
PPC,peercoin,Peercoin,PPC,8919013,8919025.0,68128.0,"Smart Contract Platform, Polygon Ecosystem, Ethereum Ecosystem, Proof of Stake (PoS), Proof of Work (PoW)"
DEXTF,dextf,Memento,DEXTF,8917108,13550345.0,135584.0,"Decentralized Finance (DeFi), Asset Manager, Avalanche Ecosystem, Ethereum Ecosystem, ZkSync Ecosystem, Real World Assets (RWA)"
SOVRN,sovrun,Sovrun,SOVRN,8740570,9415369.0,57566.0,"Gaming (GameFi), Metaverse, Ethereum Ecosystem, Animoca Brands Portfolio, Base Ecosystem, DWF Labs Portfolio, On-chain Gaming, Andreessen Horowitz (a16z) Portfolio, Hyperliquid Ecosystem, Delphi Ventures Portfolio, Circle Ventures Portfolio"
XX,xxcoin,XX Network,XX,8473172,23957919.0,169589.0,"Smart Contract Platform, Layer 1 (L1), Ethereum Ecosystem"
GRAM,gram-2,Gram,GRAM,8436248,8436248.0,20610.0,"TON Ecosystem, Proof of Work (PoW)"
TRIAS,trias-token,TriasLab,TRIAS,8169730,8169730.0,175759.0,"Artificial Intelligence (AI), Smart Contract Platform, BNB Chain Ecosystem, Layer 1 (L1), Ethereum Ecosystem, AI Agents"
CA,ca-htb,Coupon Assets,CA,7646545,112251962.0,3868785.0,"Retail, Ethereum Ecosystem"
GRAIL,camelot-token,Camelot Token,GRAIL,7589367,28803283.0,137444.0,"Decentralized Exchange (DEX), Arbitrum Ecosystem, Camelot Launchpad"
OVR,ovr,Ovr,OVR,7520536,12879207.0,564128.0,"Augmented Reality, NFT, BNB Chain Ecosystem, Metaverse, Polygon Ecosystem, Ethereum Ecosystem, DePIN, Base Ecosystem"
DNX,dynex,Dynex,DNX,6564698,6571117.0,543267.0,"Artificial Intelligence (AI), Smart Contract Platform, Layer 1 (L1), Ethereum Ecosystem, DePIN, Decentralized Science (DeSci), Proof of Work (PoW)"
APP,moon-app,RWAX,APP,6356776,9602646.0,253630.0,"Tokenized Real Estate, Tokenized Assets, BNB Chain Ecosystem, Solana Ecosystem, Ethereum Ecosystem, Real World Assets (RWA), Injective Ecosystem, RWA Protocol"
RVF,rocketx,RocketX Exchange,RVF,6298946,6444005.0,28902.0,"Decentralized Exchange (DEX), Decentralized Finance (DeFi), Automated Market Maker (AMM), Ethereum Ecosystem, Poolz Finance Launchpad"
LCAT,lion-cat,Lion Cat,LCAT,6213428,7915195.0,36388.0,"BNB Chain Ecosystem, Meme, Cat-Themed"
PAIN,pain,Pain,PAIN,6213283,12426647.0,853274.0,"Solana Ecosystem, Meme, Solana Meme, 4chan-Themed"
IMGN,imgn-labs,IMGN Labs,IMGN,5922248,5922248.0,162461.0,"Artificial Intelligence (AI), Base Ecosystem, AI Applications"
HAPPY,happycat-2,Happy Cat,HAPPY,5600518,5600518.0,1245849.0,"BNB Chain Ecosystem, Solana Ecosystem, Meme, Cat-Themed, Binance Alpha Spotlight"
KIMA,kima,Kima Network,KIMA,5100808,18327462.0,183002.0,"Infrastructure, Cosmos Ecosystem, Arbitrum Ecosystem, Outlier Ventures Portfolio"
RENTA,renta-network,Renta Network,RENTA,4974561,12863433.0,132323.0,"Retail, Smart Contract Platform, NFT, Ethereum Ecosystem, Layer 2 (L2), Real World Assets (RWA), NFTFi"
ORT,okratech-token,Okratech,ORT,4955559,4974098.0,310314.0,"BNB Chain Ecosystem, Kommunitas Launchpad, DWF Labs Portfolio"
LMT,limitus,LIMITUS,LMT,4930741,4930741.0,471992.0,"Artificial Intelligence (AI), Solana Ecosystem, Pump.fun Ecosystem, Binance Alpha Spotlight"
VRTX,vertex-protocol,Vertex,VRTX,4737333,8966019.0,2201.78,"Decentralized Exchange (DEX), Exchange-based Tokens, Decentralized Finance (DeFi), Derivatives, Perpetuals, Avalanche Ecosystem, Arbitrum Ecosystem, Mantle Ecosystem, Base Ecosystem, Blast Ecosystem, Sonic Ecosystem, Sei Network Ecosystem"
APT,aptos,Aptos,APT,3219097172,5501278686.0,527176763.0,"Smart Contract Platform, Layer 1 (L1), Aptos Ecosystem, FTX Holdings, Coinbase Ventures Portfolio, Multicoin Capital Portfolio, Proof of Stake (PoS), DragonFly Capital Portfolio, Andreessen Horowitz (a16z) Portfolio, YZi Labs (Prev. Binance Labs) Portfolio, GMCI Layer 1 Index, GMCI 30 Index, Circle Ventures Portfolio, GMCI Index, Made in USA"
ICP,internet-computer,Internet Computer,ICP,2925746981,2925747624.0,72211749.0,"Artificial Intelligence (AI), Infrastructure, Smart Contract Platform, Layer 1 (L1), Internet Computer Ecosystem, Alleged SEC Securities, Multicoin Capital Portfolio, Layer 0 (L0), Andreessen Horowitz (a16z) Portfolio, GMCI Layer 1 Index, GMCI 30 Index, Blockchain Capital Portfolio, GMCI Index, Polychain Capital Portfolio, Coinbase 50 Index"
FTN,fasttoken,Fasttoken,FTN,1968868328,3972349416.0,62964065.0,"Smart Contract Platform, BNB Chain Ecosystem, Layer 1 (L1), Arbitrum Ecosystem, Ethereum Ecosystem, Base Ecosystem, Bahamut Ecosystem"
STX,blockstack,Stacks,STX,1279100346,1279100346.0,40719984.0,"Infrastructure, Smart Contract Platform, Layer 2 (L2), Bitcoin Sidechains, Stacks Ecosystem, SideChain, GMCI Layer 2 Index, GMCI 30 Index, Blockchain Capital Portfolio, GMCI Index, Made in USA, Coinbase 50 Index"
AERO,aerodrome-finance,Aerodrome Finance,AERO,1220793273,2382628418.0,192814539.0,"Decentralized Exchange (DEX), Decentralized Finance (DeFi), Automated Market Maker (AMM), Base Ecosystem, Binance Alpha Spotlight, Made in USA"
TEL,telcoin,Telcoin,TEL,527062960,569322430.0,2716360.0,"Decentralized Finance (DeFi), Wallets, Polygon Ecosystem, Arbitrum Ecosystem, Ethereum Ecosystem, Payment Solutions, Base Ecosystem, Made in USA"
SYRUP,syrup,Maple Finance,SYRUP,477389993,512703439.0,36994752.0,"Decentralized Finance (DeFi), Yield Farming, Lending/Borrowing Protocols, Ethereum Ecosystem, Real World Assets (RWA), Base Ecosystem, Binance Alpha Spotlight"
DEXE,dexe,DeXe,DEXE,417757154,706003886.0,8888532.0,"Artificial Intelligence (AI), Decentralized Finance (DeFi), BNB Chain Ecosystem, Ethereum Ecosystem"
DCR,decred,Decred,DCR,294571187,294578511.0,1929383.0,"Smart Contract Platform, Privacy, Layer 1 (L1), Proof of Stake (PoS), Proof of Work (PoW), Blockchain Capital Portfolio, Made in USA"
MEW,cat-in-a-dogs-world,cat in a dogs world,MEW,277986619,277986619.0,35378022.0,"Solana Ecosystem, Meme, Dog-Themed, Solana Meme, Cat-Themed"
KSM,kusama,Kusama,KSM,253424041,253434417.0,12909252.0,"Smart Contract Platform, Polkadot Ecosystem, Proof of Stake (PoS), Pantera Capital Portfolio, Made in USA, Coinbase 50 Index, Hydration Ecosystem"
MINA,mina-protocol,Mina Protocol,MINA,235981323,235982004.0,18795001.0,"Smart Contract Platform, Layer 1 (L1), Zero Knowledge (ZK), FTX Holdings, Paradigm Portfolio, Coinbase Ventures Portfolio, Multicoin Capital Portfolio, Proof of Stake (PoS), Pantera Capital Portfolio, Circle Ventures Portfolio, Privacy Blockchain, Polychain Capital Portfolio, Made in USA, Coinbase 50 Index"
ZIL,zilliqa,Zilliqa,ZIL,220530338,237375560.0,16336775.0,"Smart Contract Platform, BNB Chain Ecosystem, GMCI Layer 1 Index, GMCI Index, Made in China"
EUL,euler,Euler,EUL,206868677,300942678.0,3791898.0,"Lending/Borrowing Protocols, Avalanche Ecosystem, Arbitrum Ecosystem, Ethereum Ecosystem, Base Ecosystem, Paradigm Portfolio, Coinbase Ventures Portfolio, Unichain Ecosystem"
YFI,yearn-finance,yearn.finance,YFI,191009140,206958846.0,51406405.0,"Decentralized Finance (DeFi), Yield Farming, Yield Aggregator, Yearn Ecosystem, Avalanche Ecosystem, Polygon Ecosystem, Near Protocol Ecosystem, Gnosis Chain Ecosystem, Fantom Ecosystem, Harmony Ecosystem, Arbitrum Ecosystem, Ethereum Ecosystem, Optimism Ecosystem, Base Ecosystem, Index Coop Defi Index, Alameda Research Portfolio, Energi Ecosystem, Sora Ecosystem, Huobi ECO Chain Ecosystem, Blockchain Capital Portfolio"
KMNO,kamino,Kamino,KMNO,155148448,606955787.0,23076596.0,"Decentralized Finance (DeFi), Lending/Borrowing Protocols, Solana Ecosystem, Binance Alpha Spotlight"
CYBER,cyberconnect,CYBER,CYBER,113135020,242467861.0,47269765.0,"Smart Contract Platform, SocialFi, NFT, BNB Chain Ecosystem, Binance Launchpool, Ethereum Ecosystem, Decentralized Identifier (DID), Optimism Ecosystem, Layer 2 (L2), Animoca Brands Portfolio, Multicoin Capital Portfolio, YZi Labs (Prev. Binance Labs) Portfolio, Delphi Ventures Portfolio, Cyber Ecosystem, Optimism Superchain Ecosystem"
VVV,venice-token,Venice Token,VVV,108414606,243054785.0,15920983.0,"Artificial Intelligence (AI), Base Ecosystem, AI Agents, AI Applications, Made in USA"
ACX,across-protocol,Across Protocol,ACX,108101545,178011839.0,12914594.0,"Polygon Ecosystem, Arbitrum Ecosystem, Ethereum Ecosystem, Optimism Ecosystem, Bridge Governance Tokens, Cross-chain Communication, Intent, Boba Network Ecosystem, Blockchain Capital Portfolio, Made in USA"
HIVE,hive,Hive,HIVE,104924458,,3785293.0,"Smart Contract Platform, SocialFi, Layer 1 (L1), Gaming Blockchains"
PEOPLE,constitutiondao,ConstitutionDAO,PEOPLE,96072501,96072501.0,43977635.0,"Meme, Ethereum Ecosystem, PolitiFi"
YGG,yield-guild-games,Yield Guild Games,YGG,94455016,159296922.0,20905037.0,"Gaming (GameFi), NFT, BNB Chain Ecosystem, Metaverse, Collectibles, Polygon Ecosystem, Play To Earn, Harmony Ecosystem, Guild and Scholarship, Ethereum Ecosystem, Animoca Brands Portfolio, Base Ecosystem, DWF Labs Portfolio, Ronin Ecosystem, Gaming Governance Token, Andreessen Horowitz (a16z) Portfolio, Delphi Ventures Portfolio, Abstract Ecosystem"
SGB,songbird,Songbird,SGB,94245368,111598236.0,408029.0,Smart Contract Platform
EWT,energy-web-token,Energy Web,EWT,89831766,102028472.0,420833.0,"Energy, Polkadot Ecosystem, Gnosis Chain Ecosystem, Regenerative Finance (ReFi), Real World Assets (RWA), Blockchain Capital Portfolio, Hydration Ecosystem"
CARV,carv,CARV,CARV,88860467,301585347.0,24381828.0,"Artificial Intelligence (AI), Infrastructure, Gaming (GameFi), NFT, BNB Chain Ecosystem, Solana Ecosystem, Arbitrum Ecosystem, Impossible Finance Launchpad, Ethereum Ecosystem, Animoca Brands Portfolio, Base Ecosystem"
MVL,mass-vehicle-ledger,MVL,MVL,86069131,88455260.0,1580584.0,"Internet of Things (IOT), BNB Chain Ecosystem, Ethereum Ecosystem, DePIN, DWF Labs Portfolio"
B3,b3,B3 (Base),B3,80883021,296633269.0,5300702.0,"Smart Contract Platform, Base Ecosystem, Gaming Blockchains"
USTC,terrausd,TerraClassicUSD,USTC,74523771,81201354.0,8003006.0,"Stablecoins, USD Stablecoin, Seigniorage, Alleged SEC Securities, Osmosis Ecosystem, Stablecoin Protocol, DeFiance Capital Portfolio, Terra Classic Ecosystem, YZi Labs (Prev. Binance Labs) Portfolio, Delphi Ventures Portfolio, Galaxy Digital Portfolio, Fiat-backed Stablecoin"
SCR,scroll,Scroll,SCR,72199389,379996784.0,33847109.0,"Smart Contract Platform, Binance Launchpool, Layer 2 (L2), Scroll Ecosystem"
WHITE,whiteheart,Whiteheart,WHITE,70378487,70378487.0,1339.94,"Decentralized Finance (DeFi), Derivatives, Ethereum Ecosystem"
ZRC,zircuit,Zircuit,ZRC,66647108,303642058.0,16120145.0,"Smart Contract Platform, BNB Chain Ecosystem, Ethereum Ecosystem, Layer 2 (L2), Zero Knowledge (ZK), Restaking, Zircuit Ecosystem"
AVAIL,avail,Avail,AVAIL,62453597,192453130.0,4263253.0,"Infrastructure, Smart Contract Platform, BNB Chain Ecosystem, Ethereum Ecosystem, Data Availability, Modular Blockchain, Binance Alpha Spotlight"
ALI,alethea-artificial-liquid-intelligence-token,Artificial Liquid Intelligence,ALI,62340264,67487233.0,1897958.0,"Artificial Intelligence (AI), NFT, Metaverse, Solana Ecosystem, Polygon Ecosystem, Ethereum Ecosystem, Cronos Ecosystem, Base Ecosystem, Multicoin Capital Portfolio, AI Agents, Alameda Research Portfolio, DeFiance Capital Portfolio, YZi Labs (Prev. Binance Labs) Portfolio"
WNXM,wrapped-nxm,Wrapped NXM,WNXM,62233141,62233141.0,400998.0,"Crypto-Backed Tokens, Decentralized Finance (DeFi), Insurance, Wrapped-Tokens, Ethereum Ecosystem, Blockchain Capital Portfolio"
AGLD,adventure-gold,Adventure Gold,AGLD,59191366,65783148.0,10410844.0,"Ethereum Ecosystem, DWF Labs Portfolio"
PEP,pepecoin-network,Pepecoin,PEP,57397060,57397060.0,263188.0,"Smart Contract Platform, Layer 1 (L1), Meme, Frog-Themed, Proof of Work (PoW), The Boys Club, 4chan-Themed"
NMD,nexusmind,NexusMind,NMD,54160133,528005095.0,157.93,"SocialFi, BNB Chain Ecosystem"
HFT,hashflow,Hashflow,HFT,52287472,87355893.0,14195412.0,"Decentralized Exchange (DEX), Exchange-based Tokens, Decentralized Finance (DeFi), BNB Chain Ecosystem, Binance Launchpool, MEV Protection, Ethereum Ecosystem, Coinbase Ventures Portfolio, Alameda Research Portfolio, DragonFly Capital Portfolio, Galaxy Digital Portfolio"
UNP,unipoly,Unipoly,UNP,46145112,165258433.0,521021.0,"Gaming (GameFi), Ethereum Ecosystem, Skale Ecosystem"
ISLM,islamic-coin,Islamic Coin,ISLM,41115110,410056775.0,160469.0,"Smart Contract Platform, Wallets, Layer 2 (L2), Osmosis Ecosystem"
NCT,polyswarm,PolySwarm,NCT,39237344,39245924.0,349460.0,"Business Services, Polygon Ecosystem, Ethereum Ecosystem, Cybersecurity, Made in USA"
SYN,synapse-2,Synapse,SYN,29789000,33995380.0,8093318.0,"BNB Chain Ecosystem, Avalanche Ecosystem, Polygon Ecosystem, Fantom Ecosystem, Arbitrum Ecosystem, Olympus Pro Ecosystem, Ethereum Ecosystem, Optimism Ecosystem, Bridge Governance Tokens, Base Ecosystem, Alameda Research Portfolio, Intent"
CONX,connex,Connex,CONX,27322837,2375898912.0,1819.09,BNB Chain Ecosystem
PORTAL,portal-2,Portal,PORTAL,26270104,44859890.0,30201412.0,"Gaming (GameFi), Solana Ecosystem, Ethereum Ecosystem, Gaming Platform"
INV,inverse-finance,Inverse Finance,INV,25022140,30128442.0,183188.0,"Decentralized Finance (DeFi), Yield Farming, Yield Aggregator, Lending/Borrowing Protocols, Olympus Pro Ecosystem, Ethereum Ecosystem, Fixed Interest"
D,dar-open-network,Dar Open Network,D,22214247,27633420.0,2257120.0,"Gaming (GameFi), BNB Chain Ecosystem, Binance Launchpool, Play To Earn, Ethereum Ecosystem, Animoca Brands Portfolio, AI Agents"
SWARMS,swarms,Swarms,SWARMS,20113708,20113708.0,6509434.0,"Artificial Intelligence (AI), Solana Ecosystem, AI Agents, Pump.fun Ecosystem, Binance Alpha Spotlight, AI Framework"
FLAY,flayer,Flayer,FLAY,19764878,32941464.0,734721.0,"Launchpad, Ethereum Ecosystem"
OCTA,octaspace,OctaSpace,OCTA,19393388,19393557.0,451847.0,"Artificial Intelligence (AI), Internet of Things (IOT), Smart Contract Platform, BNB Chain Ecosystem, Layer 1 (L1), Ethereum Ecosystem, DePIN, AI Agents"
J,jambo,Jambo,J,19141539,118885839.0,23219043.0,"Solana Ecosystem, Paradigm Portfolio, Coinbase Ventures Portfolio"
