ANKR,ankr,Ankr Network,ANKR,145868617.0,145868617.0,16039746.0,"BNB Chain Ecosystem, Avalanche Ecosystem, Polygon Ecosystem, Fantom Ecosystem, Arbitrum Ecosystem, Ethereum Ecosystem, Optimism Ecosystem, Liquid Staking Governance Tokens, Linea Ecosystem, DePIN, Scroll Ecosystem, Rollups-as-a-Service (RaaS), Blast Ecosystem, Mode Ecosystem, Pantera Capital Portfolio, Polygon zkEVM Ecosystem, YZi Labs (Prev. Binance Labs) Portfolio, Liquid Staking, Made in USA"
GOHOME,gohome,GOHOME,GOHOME,128761418.0,2454284188.0,10357460.0,"Solana Ecosystem, Meme"
SWFTC,swftcoin,SWFTCOIN,SWFTC,105849061.0,105849061.0,1506302.0,"Exchange-based Tokens, NFT, BNB Chain Ecosystem, Ethereum Ecosystem"
ACT,acet-token,Acet,ACT,103444877.0,134958310.0,225209.0,BNB Chain Ecosystem
XVS,venus,Venus,XVS,99120217.0,176965220.0,7589163.0,"Decentralized Finance (DeFi), Yield Farming, BNB Chain Ecosystem, Binance Launchpool, Lending/Borrowing Protocols, Arbitrum Ecosystem, Ethereum Ecosystem, Optimism Ecosystem, ZkSync Ecosystem, opBNB Ecosystem, Unichain Ecosystem"
MPLX,metaplex,Metaplex,MPLX,96131970.0,116172642.0,7514095.0,"Gaming (GameFi), NFT, Solana Ecosystem, Animoca Brands Portfolio, FTX Holdings, Multicoin Capital Portfolio, Alameda Research Portfolio"
ACH,alchemy-pay,Alchemy Pay,ACH,92724023.0,187560309.0,27991477.0,"BNB Chain Ecosystem, Ethereum Ecosystem, Payment Solutions, DWF Labs Portfolio"
NMD,nexusmind,NexusMind,NMD,89664949.0,874993399.0,143993.0,"SocialFi, BNB Chain Ecosystem"
HSK,hashkey-ecopoints,HashKey Platform Token,HSK,86362605.0,651793248.0,5075685.0,"Exchange-based Tokens, Centralized Exchange (CEX) Token, Ethereum Ecosystem"
BLAST,blast,Blast,BLAST,84324058.0,205343453.0,10246811.0,"Smart Contract Platform, Layer 2 (L2), eGirl Capital Portfolio, Paradigm Portfolio, Blast Ecosystem"
PHA,pha,PHALA,PHA,80054744.0,99906009.0,10310391.0,"Artificial Intelligence (AI), Infrastructure, Smart Contract Platform, Oracle, Polkadot Ecosystem, Ethereum Ecosystem, Interoperability, Layer 2 (L2), Zero Knowledge (ZK), DePIN, DWF Labs Portfolio, Rollup, AI Agents, Sora Ecosystem, AI Framework, Made in USA"
SGB,songbird,Songbird,SGB,79591734.0,94385567.0,404977.0,Smart Contract Platform
CETUS,cetus-protocol,Cetus Protocol,CETUS,76786359.0,94993434.0,13691953.0,"Decentralized Exchange (DEX), Decentralized Finance (DeFi), Sui Ecosystem, Animoca Brands Portfolio, OKX Ventures Portfolio, Dex Aggregator"
GLMR,moonbeam,Moonbeam,GLMR,65056152.0,77620658.0,6303069.0,"Smart Contract Platform, Polkadot Ecosystem, Layer 1 (L1), Coinbase Ventures Portfolio, Proof of Stake (PoS), YZi Labs (Prev. Binance Labs) Portfolio"
RIF,rif-token,Rootstock Infrastructure Framework,RIF,54626753.0,54626753.0,2556445.0,"Solana Ecosystem, Arbitrum Ecosystem, Ethereum Ecosystem, Base Ecosystem, Rootstock Ecosystem, Outlier Ventures Portfolio"
OMI,ecomi,ECOMI,OMI,51884007.0,59530290.0,1559209.0,"Gaming (GameFi), NFT, Metaverse, Collectibles, Play To Earn, Ethereum Ecosystem, Base Ecosystem, Energi Ecosystem"
CTK,certik,Shentu,CTK,46764825.0,46946305.0,4972068.0,"Business Services, Binance Launchpool, Osmosis Ecosystem, Coinbase Ventures Portfolio, Cybersecurity, YZi Labs (Prev. Binance Labs) Portfolio, OKX Ventures Portfolio"
WILD,wilder-world,Wilder World,WILD,44769570.0,69019920.0,1125300.0,"Gaming (GameFi), NFT, Metaverse, Solana Ecosystem, Play To Earn, Ethereum Ecosystem, Animoca Brands Portfolio, Gaming Governance Token, Racing Games, Simulation Games, Action Games"
CCD,concordium,Concordium,CCD,44681341.0,53959190.0,615150.0,"Smart Contract Platform, Layer 1 (L1), Decentralized Identifier (DID), Zero Knowledge (ZK)"
MNSRY,mansory-token,Mansory Token,MNSRY,44084480.0,44084480.0,2099944.0,"Retail, BNB Chain Ecosystem, Solana Ecosystem, Real World Assets (RWA), Pump.fun Ecosystem"
SFUND,seedify-fund,Seedify.fund,SFUND,43603135.0,68598469.0,3637614.0,"Gaming (GameFi), BNB Chain Ecosystem, Launchpad, Arbitrum Ecosystem, Ethereum Ecosystem, DWF Labs Portfolio"
C98,coin98,Coin98,C98,42933898.0,44401631.0,7475888.0,"Decentralized Finance (DeFi), BNB Chain Ecosystem, Solana Ecosystem, Wallets, Polygon Ecosystem, Ethereum Ecosystem, Binance Launchpad, DWF Labs Portfolio, Multicoin Capital Portfolio, Alameda Research Portfolio, Viction Ecosystem, YZi Labs (Prev. Binance Labs) Portfolio"
DODO,dodo,DODO,DODO,39614868.0,39614868.0,5224500.0,"Decentralized Exchange (DEX), Exchange-based Tokens, Decentralized Finance (DeFi), BNB Chain Ecosystem, Binance Launchpool, Polygon Ecosystem, Near Protocol Ecosystem, Arbitrum Ecosystem, Ethereum Ecosystem, DWF Labs Portfolio, Coinbase Ventures Portfolio, Alameda Research Portfolio, DeFiance Capital Portfolio, Pantera Capital Portfolio, Aurora Ecosystem, Energi Ecosystem, YZi Labs (Prev. Binance Labs) Portfolio, Galaxy Digital Portfolio"
STORJ,storj,Storj,STORJ,36009221.0,106434325.0,10247899.0,"Storage, Harmony Ecosystem, Ethereum Ecosystem, DePIN, Energi Ecosystem"
EDU,edu-coin,Open Campus,EDU,34914922.0,134234382.0,5421981.0,"Education, BNB Chain Ecosystem, Polygon Ecosystem, Ethereum Ecosystem, Binance Launchpad, YZi Labs (Prev. Binance Labs) Portfolio"
AVA,ava-ai,Ava AI,AVA,31836068.0,31836068.0,9479962.0,"Artificial Intelligence (AI), Solana Ecosystem, Meme, AI Meme, AI Agents, Pump.fun Ecosystem, Binance Alpha Spotlight, Made in USA"
LOFI,lofi-2,LOFI,LOFI,30756043.0,30756043.0,1338692.0,"Meme, Sui Ecosystem, Sui Meme"
M87,messier,MESSIER,M87,30432754.0,30432754.0,721636.0,"Decentralized Finance (DeFi), Ethereum Ecosystem"
ZEREBRO,zerebro,Zerebro,ZEREBRO,29540187.0,29540187.0,11307656.0,"Solana Ecosystem, Meme, Solana Meme, AI Meme, Pump.fun Ecosystem, Binance Alpha Spotlight"
FORTH,ampleforth-governance-token,Ampleforth Governance,FORTH,27452067.0,36666276.0,1810703.0,"Ethereum Ecosystem, Stablecoin Protocol"
MMUI,metamui,MetaMUI,MMUI,26680705.0,44817100.0,257450.0,Avalanche Ecosystem
PNG,pangolin,Pangolin,PNG,26520895.0,64745583.0,891035.0,"Decentralized Exchange (DEX), Decentralized Finance (DeFi), Avalanche Ecosystem, Olympus Pro Ecosystem"
ELX,elixir-finance,Elixir,ELX,26124321.0,100760980.0,11920504.0,"Decentralized Finance (DeFi), Ethereum Ecosystem, Real World Assets (RWA), Stablecoin Protocol, RWA Protocol"
UFD,unicorn-fart-dust,Unicorn Fart Dust,UFD,23155030.0,23155030.0,5864424.0,"Solana Ecosystem, Meme, Solana Meme, Pump.fun Ecosystem, Binance Alpha Spotlight, Made in USA"
NEON,neon,Neon,NEON,23123267.0,96562010.0,1300218.0,"Smart Contract Platform, Solana Ecosystem, Neon Ecosystem, Parallelized EVM"
PHB,phoenix-global,Phoenix,PHB,22760774.0,22760774.0,6642518.0,"Artificial Intelligence (AI), Oracle, NFT, BNB Chain Ecosystem, DePIN, Made in China"
DYDX,dydx,dYdX,ETHDYDX,22626861.0,484499191.0,19422061.0,"Decentralized Exchange (DEX), Exchange-based Tokens, Decentralized Finance (DeFi), Derivatives, Perpetuals, Ethereum Ecosystem, Paradigm Portfolio"
LAT,platon-network,PlatON Network,LAT,22191141.0,34389192.0,2959821.0,"Smart Contract Platform, Appchains"
PIKA,pikaboss,Pikaboss,PIKA,22129303.0,22129303.0,4510.96,"Meme, Ethereum Ecosystem"
JELLYJELLY,jelly-my-jelly,Jelly-My-Jelly,JELLYJELLY,21114254.0,21114254.0,16350209.0,"Solana Ecosystem, Pump.fun Ecosystem"
GHST,aavegotchi,Aavegotchi,GHST,19362204.0,19964207.0,5432624.0,"Smart Contract Platform, Gaming (GameFi), NFT, Metaverse, Collectibles, Polygon Ecosystem, Meme, Play To Earn, Ethereum Ecosystem, Gotchiverse, Base Ecosystem, Layer 3 (L3), RPG, Gaming Governance Token, Gaming Utility Token, Energi Ecosystem"
BEL,bella-protocol,Bella Protocol,BEL,18911693.0,23639616.0,27980895.0,"Decentralized Finance (DeFi), Yield Farming, BNB Chain Ecosystem, Binance Launchpool, Yield Aggregator, Ethereum Ecosystem, Manta Network Ecosystem, YZi Labs (Prev. Binance Labs) Portfolio"
SIGMA,sigma,Sigma,SIGMA,18356796.0,18356796.0,1488848.0,"Solana Ecosystem, Meme, Solana Meme, Pump.fun Ecosystem, 4chan-Themed"
CWEB,coinweb,Coinweb,CWEB,16942913.0,21059104.0,226259.0,"Smart Contract Platform, Wallets, Ethereum Ecosystem, Interoperability, Layer 2 (L2), Cross-chain Communication, Bitcoin Sidechains, SideChain"
BR,bedrock-token,Bedrock,BR,16718385.0,79611359.0,438265729.0,"Decentralized Finance (DeFi), BNB Chain Ecosystem, Liquid Staking Governance Tokens, Berachain Ecosystem, BTCfi Protocol, Binance Wallet IDO"
BOTIFY,botify,BOTIFY,BOTIFY,15925058.0,15925058.0,1425078.0,"Artificial Intelligence (AI), Retail, Solana Ecosystem, E-commerce"
QUICK,quick,Quickswap [OLD],QUICK,15854130.0,21053874.0,9101.6,"Decentralized Exchange (DEX), Exchange-based Tokens, Decentralized Finance (DeFi), Yield Farming, Automated Market Maker (AMM), Polygon Ecosystem, Ethereum Ecosystem"
STNK,stonks-4,Stonks,STNK,15563040.0,15563040.0,545073.0,"Solana Ecosystem, Meme, Solana Meme, Wall Street Bets Themed, Stock market-themed"
BENJI,basenji,Basenji,BENJI,14682923.0,14682923.0,3315777.0,"Meme, Base Ecosystem, Dog-Themed, Base Meme"
THE,thena,Thena,THE,14656526.0,68875873.0,11469846.0,"Decentralized Exchange (DEX), Decentralized Finance (DeFi), BNB Chain Ecosystem, opBNB Ecosystem, Binance HODLer Airdrops"
VARA,vara-network,Vara Network,VARA,14444549.0,42026769.0,450971.0,"Smart Contract Platform, Layer 1 (L1)"
FIS,stafi,Stafi,FIS,13512235.0,13512235.0,16679334.0,"Decentralized Finance (DeFi), Ethereum Ecosystem, Liquid Staking Governance Tokens, Osmosis Ecosystem, Sora Ecosystem, Liquid Staking"
PIVX,pivx,PIVX,PIVX,12311879.0,12311948.0,4594591.0,"Smart Contract Platform, Privacy, Masternodes, Zero Knowledge (ZK), Proof of Stake (PoS)"
KOMA,koma-inu,Koma Inu,KOMA,11299494.0,11299494.0,2353784.0,"BNB Chain Ecosystem, Meme, Dog-Themed, Binance Alpha Spotlight, Made in USA"
NIBI,nibiru,Nibiru,NIBI,10137377.0,13458804.0,606758.0,"Infrastructure, Smart Contract Platform, Layer 1 (L1), Osmosis Ecosystem, Made in USA"
OIK,space-nation-oikos,Space Nation Oikos,OIK,9957580.0,60061405.0,476296.0,"Gaming (GameFi), NFT, BNB Chain Ecosystem, Immutable zkEVM Ecosystem, RPG, MMO"
XSWAP,xswap-2,XSwap,XSWAP,9798321.0,14266801.0,404925.0,"Decentralized Finance (DeFi), Ethereum Ecosystem, Base Ecosystem, Cross-chain Communication"
ROOT,the-root-network,The Root Network,ROOT,9200582.0,48485583.0,2079591.0,"Smart Contract Platform, Gaming (GameFi), Layer 1 (L1), Ethereum Ecosystem, Gaming Blockchains, Outlier Ventures Portfolio"
OPUL,opulous,Opulous,OPUL,9150964.0,9150964.0,607396.0,"Artificial Intelligence (AI), Music, NFT, BNB Chain Ecosystem, Arbitrum Ecosystem, Ethereum Ecosystem, Algorand Ecosystem, Real World Assets (RWA), Telegram Apps, AI Applications"
EVR,evernode,Evernode,EVR,8903535.0,17785750.0,12013.52,"Smart Contract Platform, Layer 2 (L2), DePIN"
MASK,catwifmask,catwifmask,MASK,8355810.0,8355810.0,3979452.0,"Solana Ecosystem, Meme, Solana Meme, Cat-Themed, Pump.fun Ecosystem"
RNT,reental,Reental,RNT,8044124.0,40579566.0,10320.78,"Tokenized Real Estate, Tokenized Assets, Polygon Ecosystem, Real World Assets (RWA), RWA Protocol"
HDRO,hydro-protocol-2,Hydro Protocol,HDRO,7535098.0,21948437.0,75441.0,Injective Ecosystem
AGRI,agridex-governance-token,AgriDex,AGRI,7274928.0,31694325.0,569751.0,"Tokenized Assets, Solana Ecosystem, Real World Assets (RWA), Tokenized Commodities"
MSM,musmecoin,MusmeCoin,MSM,7122033.0,13696178.0,30930.0,"Meme, Ethereum Ecosystem, Anime-Themed, Oasys Ecosystem"
GHUB,gemhub,GemHUB,GHUB,7033728.0,39344976.0,74205.0,Kaia Ecosystem
CSWAP,chainswap-3,ChainSwap,CSWAP,6901905.0,7241754.0,15341.57,"Decentralized Exchange (DEX), Decentralized Finance (DeFi), Ethereum Ecosystem, Cross-chain Communication"
ULTI,ultiverse,Ultiverse,ULTI,6784530.0,16933099.0,3060944.0,"Gaming (GameFi), BNB Chain Ecosystem, Ethereum Ecosystem, Animoca Brands Portfolio"
DINERO,dinero-2,Dinero,DINERO,6727177.0,10868086.0,27800.0,"Infrastructure, Decentralized Finance (DeFi), Lending/Borrowing Protocols, Ethereum Ecosystem, Metagovernance, Liquid Staking Governance Tokens, LSDFi, Curve Ecosystem, Liquid Staking"
CLY,colony,Colony,CLY,6340520.0,8440484.0,119286.0,Avalanche Ecosystem
GRPH,soul-graph,Soul Graph,GRPH,6268104.0,6268104.0,70517.0,"Artificial Intelligence (AI), Solana Ecosystem, Pump.fun Ecosystem, AI Applications"
U,u,U,U,6193266.0,6193266.0,310315.0,"BNB Chain Ecosystem, Meme"
3ULL,playa3ull-games-2,PLAYA3ULL GAMES,3ULL,5725896.0,5735024.0,689474.0,"Smart Contract Platform, Gaming (GameFi), NFT, Avalanche Ecosystem, Play To Earn, Shooting Games, Avalanche L1, MMO"
DOLAN,dolan-duck,Dolan Duck,DOLAN,5693624.0,5693624.0,247851.0,"Solana Ecosystem, Meme, Solana Meme, Parody Meme, 4chan-Themed"
DROP,drop-2,DROP,DROP,5585922.0,5585922.0,31950.0,"Meme, XRP Ledger Ecosystem"
LUCE,offcial-mascot-of-the-holy-year,Luce,LUCE,5266075.0,5266075.0,3728625.0,"Solana Ecosystem, Meme, Solana Meme, Pump.fun Ecosystem, Mascot-Themed, Binance Alpha Spotlight"
REDO,resistance-dog,Resistance Dog,REDO,5167520.0,5167520.0,808416.0,"Meme, Dog-Themed, TON Ecosystem, TON Meme"
CATE,catecoin,CateCoin,CATE,5104978.0,5322101.0,184260.0,"Entertainment, Gaming (GameFi), Yield Farming, NFT, BNB Chain Ecosystem, Yield Aggregator, Launchpad, Wallets, Meme, Play To Earn, Ethereum Ecosystem, Base Ecosystem, Cat-Themed"
STAT,stat,STAT,STAT,5038852.0,6886190.0,3462380.0,"Media, Ethereum Ecosystem"
DCK,dexcheck,DexCheck AI,DCK,4685876.0,6383926.0,214698.0,"Artificial Intelligence (AI), Analytics, BNB Chain Ecosystem, Launchpad, Ethereum Ecosystem, ChainGPT Launchpad, Poolz Finance Launchpad, AI Agents, DeFAI, InfoFi"
SNAI,swarmnode-ai,SwarmNode.ai,SNAI,4638413.0,5139522.0,3301428.0,"Artificial Intelligence (AI), Infrastructure, Solana Ecosystem, Pump.fun Ecosystem, AI Agent Launchpad, Binance Alpha Spotlight, AI Framework, DeFAI"
XAR,arcana-token,Arcana Network,XAR,4021015.0,7381584.0,1063601.0,"Infrastructure, Smart Contract Platform, Wallets, Ethereum Ecosystem, Modular Blockchain"
CPH,cypherium,Cypherium,CPH,3894093.0,49176882.0,2049.71,"Smart Contract Platform, Layer 1 (L1), Proof of Work (PoW), Pantera Capital Portfolio"
VGX,ethos,VGX Token,VGX,3689722.0,3699989.0,916751.0,"Gaming (GameFi), Ethereum Ecosystem, Galaxy Digital Portfolio"
XFI,crossfi-2,CrossFi,XFI,3612331.0,32352777.0,781563.0,"Smart Contract Platform, Layer 2 (L2)"
KAS,kaspa,Kaspa,KAS,2058539258.0,2060946830.0,83899665.0,"Smart Contract Platform, Layer 1 (L1), Proof of Work (PoW), Kaspa Ecosystem, Made in USA, Directed Acyclic Graph (DAG)"
VET,vechain,VeChain,VET,1888304934.0,1888304934.0,36527974.0,"Internet of Things (IOT), Smart Contract Platform, Layer 1 (L1), VeChain Ecosystem, Made in China"
BONK,bonk,Bonk,BONK,1156708253.0,1326680875.0,196497782.0,"BNB Chain Ecosystem, Solana Ecosystem, Polygon Ecosystem, Meme, Arbitrum Ecosystem, Ethereum Ecosystem, Aptos Ecosystem, Dog-Themed, Solana Meme, Neon Ecosystem, GMCI Meme Index, GMCI Index, Made in USA, Coinbase 50 Index, 4chan-Themed"
GALA,gala,GALA,GALA,670365367.0,670367274.0,82914013.0,"Smart Contract Platform, Gaming (GameFi), NFT, Layer 1 (L1), Play To Earn, Ethereum Ecosystem, DWF Labs Portfolio, Gaming Platform, YZi Labs (Prev. Binance Labs) Portfolio, GalaChain Ecosystem, Made in USA"
FLOW,flow,Flow,FLOW,542497215.0,542497215.0,16481326.0,"Smart Contract Platform, Sports, NFT, Layer 1 (L1), Animoca Brands Portfolio, Alleged SEC Securities, Multicoin Capital Portfolio, Proof of Stake (PoS), Flow Ecosystem, Andreessen Horowitz (a16z) Portfolio"
BSV,bitcoin-cash-sv,Bitcoin SV,BSV,502508587.0,502508823.0,71042772.0,"Smart Contract Platform, Bitcoin Fork, Proof of Work (PoW)"
ETHFI,ether-fi,Ether.fi,ETHFI,380332729.0,1015064747.0,111120063.0,"Decentralized Finance (DeFi), Binance Launchpool, Arbitrum Ecosystem, Ethereum Ecosystem, Restaking, Liquid Restaking Governance Tokens, Ether.fi Ecosystem, Consensys Portfolio, OKX Ventures Portfolio"
GNO,gnosis,Gnosis,GNO,296719276.0,337233496.0,6910643.0,"Decentralized Exchange (DEX), Smart Contract Platform, Decentralized Finance (DeFi), Prediction Markets, Layer 1 (L1), Gnosis Chain Ecosystem, MEV Protection, Arbitrum Ecosystem, Ethereum Ecosystem, SideChain, Energi Ecosystem"
MOCA,mocaverse,Moca Network,MOCA,241779582.0,636140148.0,21672853.0,"Gaming (GameFi), Ethereum Ecosystem, Decentralized Identifier (DID), Animoca Brands Portfolio, Base Ecosystem, OKX Ventures Portfolio, Outlier Ventures Portfolio"
SNX,havven,Synthetix Network,SNX,204463244.0,204715430.0,11733133.0,"Decentralized Exchange (DEX), Exchange-based Tokens, Decentralized Finance (DeFi), Yield Farming, Derivatives, Synthetic Issuer, Avalanche Ecosystem, Polygon Ecosystem, Near Protocol Ecosystem, Fantom Ecosystem, Harmony Ecosystem, Ethereum Ecosystem, Optimism Ecosystem, Base Ecosystem, DWF Labs Portfolio, Paradigm Portfolio, Coinbase Ventures Portfolio, Index Coop Defi Index, Energi Ecosystem, Huobi ECO Chain Ecosystem, GMCI DeFi Index, Synthetic, GMCI Index, Coinbase 50 Index"
COTI,coti,COTI,COTI,117047963.0,117048240.0,6734126.0,"Smart Contract Platform, Ethereum Ecosystem, Layer 2 (L2), Zero Knowledge (ZK), Alleged SEC Securities, Privacy Blockchain"
UDS,undeads-games,Undeads Games,UDS,113875079.0,281647899.0,702194.0,"Gaming (GameFi), NFT, Ethereum Ecosystem"
FUN,funfair,FUNToken,FUN,105938609.0,109946655.0,13967453.0,"Gambling (GambleFi), Ethereum Ecosystem, Pantera Capital Portfolio, Energi Ecosystem"
ALTLAYER,altlayer,AltLayer,ALT,102439884.0,272794144.0,17016973.0,"Smart Contract Platform, BNB Chain Ecosystem, Binance Launchpool, Ethereum Ecosystem, Layer 2 (L2), Restaking, Rollups-as-a-Service (RaaS), Rollup, YZi Labs (Prev. Binance Labs) Portfolio"
CPOOL,clearpool,Clearpool,CPOOL,91805775.0,117348241.0,2576164.0,"Decentralized Finance (DeFi), Solana Ecosystem, DaoMaker Launchpad, Ethereum Ecosystem, Real World Assets (RWA), Sequoia Capital Portfolio, Made in USA"
OKT,oec-token,OKT Chain,OKT,84638878.0,84638878.0,553322.0,Layer 1 (L1)
CGPT,chaingpt,ChainGPT,CGPT,81028599.0,96355584.0,12679343.0,"Artificial Intelligence (AI), Smart Contract Platform, Decentralized Finance (DeFi), Analytics, NFT, BNB Chain Ecosystem, Solana Ecosystem, Launchpad, Ethereum Ecosystem, Telegram Apps, Discord Bots, ChainGPT Launchpad, Poolz Finance Launchpad, AI Agents, AI Applications, Binance Alpha Spotlight, AI Framework, DeFAI"
IGT,infinitar-governance-token,Infinitar Governance Token,IGT,78705811.0,207702018.0,2995704.0,"Gaming (GameFi), NFT, BNB Chain Ecosystem"
BDCA,bitdca,BitDCA,BDCA,76512685.0,145689776.0,259096.0,BNB Chain Ecosystem
ARK,ark,ARK,ARK,72413248.0,72939961.0,23686535.0,
USDP,paxos-standard,Pax Dollar,USDP,69956956.0,69956956.0,7010314.0,"Stablecoins, USD Stablecoin, Solana Ecosystem, Ethereum Ecosystem, Multicoin Capital Portfolio, Fiat-backed Stablecoin"
GFI,goldfinch,Goldfinch,GFI,67213929.0,82676423.0,487103.0,"Decentralized Finance (DeFi), Lending/Borrowing Protocols, Ethereum Ecosystem, Real World Assets (RWA), Coinbase Ventures Portfolio, Andreessen Horowitz (a16z) Portfolio, RWA Protocol, Made in USA"
POND,marlin,Marlin,POND,65189857.0,79561450.0,5547877.0,"Artificial Intelligence (AI), Infrastructure, Smart Contract Platform, Decentralized Finance (DeFi), Arbitrum Ecosystem, Ethereum Ecosystem, Zero Knowledge (ZK), DWF Labs Portfolio, Coinbase Ventures Portfolio, Pantera Capital Portfolio, YZi Labs (Prev. Binance Labs) Portfolio"
NMR,numeraire,Numeraire,NMR,61762386.0,82296488.0,12588397.0,"Artificial Intelligence (AI), Business Services, Decentralized Finance (DeFi), Ethereum Ecosystem, Paradigm Portfolio, DragonFly Capital Portfolio, Energi Ecosystem"
SKYAI,skyai,SkyAI,SKYAI,57345268.0,57345268.0,41877686.0,"BNB Chain Ecosystem, Binance Alpha Spotlight"
SSV,ssv-network,SSV Network,SSV,55346074.0,101629211.0,16314180.0,"Decentralized Finance (DeFi), Ethereum Ecosystem, Restaking, Coinbase Ventures Portfolio, OKX Ventures Portfolio, Liquid Staking"
SKI,ski-mask-dog,Ski Mask Dog,SKI,46544715.0,46544715.0,889335.0,"Charity, Meme, Base Ecosystem, Dog-Themed, Base Meme, Binance Alpha Spotlight, Made in USA"
QI,benqi,BENQI,QI,44549804.0,46005788.0,2930421.0,"Decentralized Finance (DeFi), Yield Farming, Binance Launchpool, Lending/Borrowing Protocols, Avalanche Ecosystem, Liquid Staking Governance Tokens, DragonFly Capital Portfolio, Liquid Staking"
TNSR,tensor,Tensor,TNSR,40000356.0,119544204.0,9111043.0,"NFT, Solana Ecosystem, NFT Marketplace"
APFC,apf-coin,APF coin,APFC,35726057.0,52455413.0,18500.11,"Tokenized Real Estate, Tokenized Assets, Ethereum Ecosystem, Real World Assets (RWA), RWA Protocol"
OXT,orchid-protocol,Orchid Protocol,OXT,32031371.0,54148688.0,2978211.0,"Smart Contract Platform, Ethereum Ecosystem, DePIN, Proof of Stake (PoS), Andreessen Horowitz (a16z) Portfolio, Sequoia Capital Portfolio, Blockchain Capital Portfolio, Made in USA"
PEPECOIN,pepecoin-2,PepeCoin,PEPECOIN,31789860.0,36767297.0,509103.0,"Gaming (GameFi), NFT, Solana Ecosystem, Meme, Ethereum Ecosystem, Frog-Themed, Solana Meme, RPG, The Boys Club, Arcade Games, 4chan-Themed"
WOJAK,wojak,Wojak,WOJAK,30931229.0,30931229.0,1480299.0,"Meme, Ethereum Ecosystem, Wojak-Themed, 4chan-Themed"
HOLD,everybody,Everybody,HOLD,30821501.0,30821501.0,276600.0,"Meme, Ethereum Ecosystem"
QUAI,quai-network,Quai Network,QUAI,30375319.0,182319767.0,1331909.0,"Smart Contract Platform, Layer 1 (L1), Proof of Work (PoW), Made in USA"
KUJI,kujira,Kujira,KUJI,29673578.0,29681025.0,1928.79,"Smart Contract Platform, Decentralized Finance (DeFi), BNB Chain Ecosystem, Layer 1 (L1), Arbitrum Ecosystem, Ethereum Ecosystem, Optimism Ecosystem, Osmosis Ecosystem, Secret Ecosystem"
CTA,cross-the-ages,Cross The Ages,CTA,29419202.0,29475657.0,945131.0,"Gaming (GameFi), NFT, Play To Earn, Ethereum Ecosystem, Animoca Brands Portfolio, Card Games, Gaming Utility Token"
PUFFER,puffer-finance,Puffer,PUFFER,28903019.0,164269201.0,16806094.0,"Smart Contract Platform, BNB Chain Ecosystem, Ethereum Ecosystem, Layer 2 (L2), Restaking, Liquid Restaking Governance Tokens, Rollup, Liquid Staking, Made in USA"
PRCL,parcl,Parcl,PRCL,28719712.0,70307420.0,8403300.0,"Tokenized Real Estate, Decentralized Finance (DeFi), Tokenized Assets, Derivatives, Solana Ecosystem, Real World Assets (RWA), Coinbase Ventures Portfolio, DragonFly Capital Portfolio, RWA Protocol, Made in USA"
DUSK,dusk-network,DUSK,DUSK,27409197.0,27409197.0,3510576.0,"Smart Contract Platform, BNB Chain Ecosystem, Layer 1 (L1), Ethereum Ecosystem, Zero Knowledge (ZK), Real World Assets (RWA), Energi Ecosystem, YZi Labs (Prev. Binance Labs) Portfolio, Privacy Blockchain"
RDNT,radiant-capital,Radiant Capital,RDNT,26196511.0,30428439.0,7274267.0,"BNB Chain Ecosystem, Binance Launchpool, Lending/Borrowing Protocols, Arbitrum Ecosystem, Ethereum Ecosystem, Base Ecosystem, YZi Labs (Prev. Binance Labs) Portfolio"
VR,victoria-vr,Victoria VR,VR,24643145.0,50849951.0,4909955.0,"Artificial Intelligence (AI), Metaverse, DaoMaker Launchpad, Ethereum Ecosystem, AI Applications"
CXT,covalent-x-token,Covalent X Token,CXT,23242778.0,25000718.0,1929859.0,"Artificial Intelligence (AI), Infrastructure, Decentralized Finance (DeFi), Ethereum Ecosystem, Data Availability, Coinbase Ventures Portfolio, YZi Labs (Prev. Binance Labs) Portfolio"
RACA,radio-caca,Radio Caca,RACA,22540317.0,22814750.0,2413452.0,"Gaming (GameFi), NFT, BNB Chain Ecosystem, Metaverse, Play To Earn, Ethereum Ecosystem, DWF Labs Portfolio, OKT Chain Ecosystem"
DEGO,dego-finance,Dego Finance,DEGO,21368178.0,21368178.0,2492932.0,"NFT, BNB Chain Ecosystem, Solana Ecosystem, Ethereum Ecosystem, Binance Launchpad"
OORT,oort,OORT,OORT,21273870.0,79795242.0,1099587.0,"Artificial Intelligence (AI), Storage, BNB Chain Ecosystem, Ethereum Ecosystem, DePIN, AI Agents, Made in USA"
GHX,gamercoin,GamerCoin,GHX,19085779.0,21942031.0,339808.0,"Infrastructure, Gaming (GameFi), NFT, BNB Chain Ecosystem, Ethereum Ecosystem, DePIN"
CAM,camino-network,Camino Network,CAM,18292007.0,50212132.0,258179.0,"Smart Contract Platform, Layer 1 (L1), Outlier Ventures Portfolio"
PSTAKE,pstake-finance,pSTAKE Finance,PSTAKE,17211017.0,17211017.0,2400882.0,"Smart Contract Platform, BNB Chain Ecosystem, Ethereum Ecosystem, Optimism Ecosystem, Liquid Staking Governance Tokens, Sui Ecosystem, Base Ecosystem, Coinbase Ventures Portfolio, Proof of Stake (PoS), Blast Ecosystem, Alameda Research Portfolio, DeFiance Capital Portfolio, YZi Labs (Prev. Binance Labs) Portfolio, Galaxy Digital Portfolio, Sequoia Capital Portfolio, Liquid Staking, BTCfi Protocol, Binance Alpha Spotlight"
PERP,perpetual-protocol,Perpetual Protocol,PERP,17102264.0,35330456.0,5368234.0,"Decentralized Exchange (DEX), Exchange-based Tokens, Decentralized Finance (DeFi), Automated Market Maker (AMM), BNB Chain Ecosystem, Derivatives, Perpetuals, Gnosis Chain Ecosystem, Arbitrum Ecosystem, Ethereum Ecosystem, Optimism Ecosystem, Multicoin Capital Portfolio, Alameda Research Portfolio, YZi Labs (Prev. Binance Labs) Portfolio"
USA,american-coin,American Coin,USA,16416543.0,16416543.0,1061620.0,"Solana Ecosystem, Meme, Solana Meme, Parody Meme, Country-Themed Meme, Murad Picks"
MICHI,michicoin,michi,$MICHI,15070201.0,15070201.0,3495070.0,"Solana Ecosystem, Meme, Solana Meme, Cat-Themed, Pump.fun Ecosystem"
PROPC,propchain,Propchain,PROPC,14978089.0,25247938.0,714719.0,"Ethereum Ecosystem, Real World Assets (RWA)"
EDGE,definitive,Definitive,EDGE,14849608.0,73141884.0,1962791.0,"Decentralized Exchange (DEX), Decentralized Finance (DeFi), Base Ecosystem, Dex Aggregator"
SLF,self-chain,Self Chain,SLF,13844048.0,27853894.0,5473503.0,"Infrastructure, Smart Contract Platform, Layer 1 (L1), Account Abstraction, Intent"
U2U,unicorn-ultra,U2U Network,U2U,13138774.0,78780488.0,469617.0,"Smart Contract Platform, Layer 1 (L1), Ethereum Ecosystem, DePIN, Directed Acyclic Graph (DAG)"
SOIL,soil,Soil,SOIL,12946540.0,32703907.0,201317.0,"Decentralized Finance (DeFi), Tokenized Assets, Polygon Ecosystem, Ethereum Ecosystem, Real World Assets (RWA), Poolz Finance Launchpad, RWA Protocol"
SLT,salute,Salute,SLT,12389312.0,12389312.0,2385.88,"Meme, XRP Ledger Ecosystem"
