SWEAT,sweatcoin,SWEAT,SWEAT,18626399,50591007.0,5605896.0,"Sports, Gaming (GameFi), BNB Chain Ecosystem, Solana Ecosystem, Avalanche Ecosystem, Polygon Ecosystem, Near Protocol Ecosystem, Play To Earn, Arbitrum Ecosystem, Celo Ecosystem, Move To Earn, Ethereum Ecosystem, Optimism Ecosystem, Aptos Ecosystem, Sui Ecosystem, Base Ecosystem, Gaming Governance Token, Gaming Utility Token, OKX Ventures Portfolio"
ALVA,alvara-protocol,Alvara Protocol,ALVA,18530720,49622257.0,718934.0,"Decentralized Finance (DeFi), Avalanche Ecosystem, Ethereum Ecosystem"
KENDU,kendu-inu,Kendu Inu,KENDU,16450036,16528725.0,222900.0,"Solana Ecosystem, Meme, Ethereum Ecosystem, Base Ecosystem, Dog-Themed"
ADS,adshares,Adshares,ADS,16393166,16405799.0,78940.0,"Business Services, Decentralized Finance (DeFi), BNB Chain Ecosystem, Metaverse, Polygon Ecosystem, Ethereum Ecosystem, Base Ecosystem"
CHEQ,cheqd-network,CHEQD Network,CHEQ,14684968,19497337.0,202436.0,"Smart Contract Platform, Ethereum Ecosystem, Decentralized Identifier (DID), Zero Knowledge (ZK), Animoca Brands Portfolio, Osmosis Ecosystem, Outlier Ventures Portfolio"
ALU,altura,Altura,ALU,13999196,13999196.0,13166073.0,"Artificial Intelligence (AI), Infrastructure, Gaming (GameFi), NFT, BNB Chain Ecosystem, NFT Marketplace, Base Ecosystem, Gaming Platform, Made in USA, Gaming Marketplace"
UPC,upcx,UPCX,UPC,13712070,2578007902.0,958328.0,Ethereum Ecosystem
PIVX,pivx,PIVX,PIVX,13669309,13669382.0,2657195.0,"Smart Contract Platform, Privacy, Masternodes, Zero Knowledge (ZK), Proof of Stake (PoS)"
TKO,tokocrypto,Tokocrypto,TKO,13225829,88172192.0,4566127.0,"BNB Chain Ecosystem, Binance Launchpad, YZi Labs (Prev. Binance Labs) Portfolio"
BASEDAI,basedai,BasedAI,BASEDAI,11133767,11133767.0,98519.0,"Artificial Intelligence (AI), Ethereum Ecosystem, AI Agents"
TICO,tico,Funtico,TICO,10205625,47743198.0,66776.0,"Gaming (GameFi), Avalanche Ecosystem, RPG"
QBX,qbx,QBX,QBX,9678815,9678815.0,58427.0,Ethereum Ecosystem
KASTA,kasta,Kasta,KASTA,9523811,18704448.0,276397.0,Polygon Ecosystem
MODE,mode,Mode,MODE,9239034,20380221.0,1553404.0,"Artificial Intelligence (AI), Infrastructure, Smart Contract Platform, Layer 2 (L2), Mode Ecosystem, Optimism Superchain Ecosystem, DeFAI"
MASK,catwifmask,catwifmask,MASK,9097588,9097588.0,3025030.0,"Solana Ecosystem, Meme, Solana Meme, Cat-Themed, Pump.fun Ecosystem"
MAVIA,heroes-of-mavia,Heroes of Mavia,MAVIA,8919272,43197456.0,4292657.0,"Gaming (GameFi), NFT, Ethereum Ecosystem, Animoca Brands Portfolio, Base Ecosystem, Gaming Governance Token, Strategy Games, Alameda Research Portfolio, YZi Labs (Prev. Binance Labs) Portfolio, Delphi Ventures Portfolio, Action Games"
MLG,360noscope420blazeit,360noscope420blazeit,MLG,7776165,7776165.0,679573.0,"Solana Ecosystem, Meme, Solana Meme"
ZYN,zyncoin-2,ZynCoin,ZYN,7613510,7613510.0,29449.0,"Solana Ecosystem, Meme, Ethereum Ecosystem, Parody Meme"
FLIX,omniflix-network,OmniFlix Network,FLIX,7269019,8034528.0,1281.24,"NFT, Osmosis Ecosystem, Archway Ecosystem"
GLQ,graphlinq-protocol,GraphLinq Chain,GLQ,7005361,10302001.0,133595.0,"Artificial Intelligence (AI), Business Services, Infrastructure, Smart Contract Platform, Analytics, Layer 1 (L1), Ethereum Ecosystem, DWF Labs Portfolio, AI Agents, DeFAI"
CDX,cod3x,Cod3x,CDX,6988312,6988312.0,30695.0,"Artificial Intelligence (AI), Solana Ecosystem, Base Ecosystem, AI Agent Launchpad, AI Framework, DeFAI"
FNCT,financie-token,Financie Token,FNCT,6875580,33375442.0,94932.0,Ethereum Ecosystem
QORPO,qopro,QORPO WORLD,QORPO,6814522,11837383.0,565627.0,"Gaming (GameFi), NFT, BNB Chain Ecosystem, Play To Earn, Ethereum Ecosystem, RPG, Gaming Utility Token, Adventure Games, Gaming Platform, Action Games"
4EVER,4everland,4EVERLAND,4EVER,6809212,37524936.0,499949.0,"Artificial Intelligence (AI), BNB Chain Ecosystem, Ethereum Ecosystem, DePIN, AI Framework"
GTAI,gt-protocol,GT Protocol,GTAI,5916385,10935483.0,1293469.0,"Artificial Intelligence (AI), BNB Chain Ecosystem, DeFAI"
WEXO,wexo,Wexo,WEXO,5844664,15418512.0,142488.0,"Ethereum Ecosystem, Base Ecosystem"
TRADE,polytrade,Polytrade,TRADE,5546115,12829316.0,125549.0,"BNB Chain Ecosystem, Polygon Ecosystem, Arbitrum Ecosystem, Ethereum Ecosystem, Real World Assets (RWA), Base Ecosystem, DWF Labs Portfolio"
STAT,stat,STAT,STAT,5152679,6577977.0,100927.0,"Media, Ethereum Ecosystem"
GENOME,genomesdao-genome,GenomesDAO GENOME,GENOME,4818118,4818118.0,79682.0,"Ethereum Ecosystem, Base Ecosystem, Decentralized Science (DeSci)"
SRM,serum,Serum,SRM,4737119,13887291.0,143423.0,"Decentralized Exchange (DEX), Exchange-based Tokens, Decentralized Finance (DeFi), Solana Ecosystem, Ethereum Ecosystem, FTX Holdings, Multicoin Capital Portfolio, Energi Ecosystem, Viction Ecosystem"
ALEX,alexgo,ALEX Lab,ALEX,4652725,5405032.0,830481.0,"Decentralized Finance (DeFi), Lending/Borrowing Protocols, Ethereum Ecosystem, DWF Labs Portfolio, Mode Ecosystem, Stacks Ecosystem, BTCfi Protocol"
POR,portugal-national-team-fan-token,Portugal National Team Fan Token,POR,4625067,18697519.0,553676.0,"Sports, Fan Token, Chiliz Ecosystem"
SMURFCAT,real-smurf-cat,Real Smurf Cat,SMURFCAT,4503307,4503307.0,80688.0,"Solana Ecosystem, Meme, Arbitrum Ecosystem, Ethereum Ecosystem, Cat-Themed"
POLYDOGE,polydoge,PolyDoge,POLYDOGE,4096556,4102338.0,539688.0,"NFT, Polygon Ecosystem, Meme, Dog-Themed"
CANTO,canto,CANTO,CANTO,3917389,6438143.0,179324.0,"Smart Contract Platform, Layer 1 (L1), Ethereum Ecosystem, Canto Ecosystem, Real World Assets (RWA), Osmosis Ecosystem, Parallelized EVM"
IZI,izumi-finance,iZUMi Finance,IZI,3327456,8451755.0,70968.0,"Decentralized Exchange (DEX), Decentralized Finance (DeFi), Automated Market Maker (AMM), BNB Chain Ecosystem, Polygon Ecosystem, Arbitrum Ecosystem, Ethereum Ecosystem, ZkSync Ecosystem, Mantle Ecosystem, Linea Ecosystem, Base Ecosystem, Manta Network Ecosystem, Scroll Ecosystem"
ARCA,arca,Legend of Arcadia,ARCA,3241462,13421825.0,33350.0,"Gaming (GameFi), Ethereum Ecosystem, RPG"
DEOD,decentrawood,Decentrawood,DEOD,3213424,3213424.0,198784.0,"Gaming (GameFi), BNB Chain Ecosystem, Metaverse, Solana Ecosystem, Polygon Ecosystem"
SHIDO,shido-2,Shido Network,SHIDO,3173595,3173600.0,156202.0,"Ethereum Ecosystem, Osmosis Ecosystem, Shido Network Ecosystem"
SOLAMA,solama,Solama,SOLAMA,3012880,3012880.0,185511.0,"Gambling (GambleFi), Solana Ecosystem, Meme, Solana Meme"
WINR,winr-protocol,WINR Protocol,WINR,3000357,4282890.0,44616.0,"Gambling (GambleFi), Infrastructure, Smart Contract Platform, Solana Ecosystem, Arbitrum Ecosystem, Camelot Launchpad, Layer 3 (L3)"
TREAT,shiba-inu-treat,Shiba Inu Treat,TREAT,2931850,13626205.0,877349.0,"Meme, Ethereum Ecosystem, Dog-Themed"
VGX,ethos,VGX Token,VGX,2315956,2322400.0,510860.0,"Gaming (GameFi), Ethereum Ecosystem, Galaxy Digital Portfolio"
MUMU,mumu,Mumu,MUMU,2194971,2194971.0,60836.0,"Meme, Ethereum Ecosystem, 4chan-Themed"
YULI,yuli,YULI,YULI,2095793,2095793.0,44422.0,"Gaming (GameFi), NFT, Meme, Kaia Ecosystem, Card Games, Gaming Utility Token, Anime-Themed"
VMINT,volumint,VoluMint,VMINT,2054681,3371382.0,5429.97,"Artificial Intelligence (AI), Ethereum Ecosystem, Telegram Apps, Market-Making Solution"
SLN,smart-layer-network,Smart Layer Network,SLN,2049775,2661268.0,56671.0,"Infrastructure, BNB Chain Ecosystem, Polygon Ecosystem, Ethereum Ecosystem, Optimism Ecosystem, ZkSync Ecosystem, Linea Ecosystem, Base Ecosystem, Scroll Ecosystem, Polygon zkEVM Ecosystem, Mint Ecosystem"
MOVE,bluemove,BlueMove,MOVE,2041980,2816525.0,58551.0,"NFT, Aptos Ecosystem, Sui Ecosystem"
RMV,reality-metaverse,Reality Metaverse,RMV,1983235,2656669.0,58351.0,"Gaming (GameFi), NFT, Metaverse, Polygon Ecosystem, Play To Earn, Ethereum Ecosystem, DWF Labs Portfolio, Gaming Utility Token"
BAX,babb,BABB,BAX,1837497,1849053.0,6605.22,Ethereum Ecosystem
STETH,staked-ether,Lido Staked Ether,STETH,39512020482,39512020482.0,69230929.0,"Decentralized Finance (DeFi), Liquid Staking Tokens, Ethereum Ecosystem, Liquid Staked ETH, Liquid Staking"
VET,vechain,VeChain,VET,2117424571,2117424571.0,43981372.0,"Internet of Things (IOT), Smart Contract Platform, Layer 1 (L1), VeChain Ecosystem, Made in China"
SAROS,saros-finance,Saros,SAROS,1055822675,4022181886.0,11086763.0,"Decentralized Exchange (DEX), Decentralized Finance (DeFi), Solana Ecosystem, Viction Ecosystem"
QUBIC,qubic-network,Qubic,QUBIC,399418263,500872036.0,9124055.0,"Artificial Intelligence (AI), Smart Contract Platform, Layer 1 (L1), Proof of Work (PoW)"
TWT,trust-wallet-token,Trust Wallet,TWT,323586742,776639434.0,10127900.0,"BNB Chain Ecosystem, Wallets, Account Abstraction, Energi Ecosystem"
TRIBE,tribe-2,Tribe,TRIBE,277912063,610774895.0,74376.0,"Decentralized Finance (DeFi), Ethereum Ecosystem, Stablecoin Protocol"
MOCA,mocaverse,Moca Network,MOCA,265188174,650962812.0,25943752.0,"Gaming (GameFi), Ethereum Ecosystem, Decentralized Identifier (DID), Animoca Brands Portfolio, Base Ecosystem, OKX Ventures Portfolio, Outlier Ventures Portfolio"
TFUEL,theta-fuel,Theta Fuel,TFUEL,259455586,259455588.0,2117305.0,"Artificial Intelligence (AI), Smart Contract Platform, DePIN, Proof of Stake (PoS), Made in USA"
KAITO,kaito,KAITO,KAITO,255762015,1059543447.0,46435522.0,"Artificial Intelligence (AI), Analytics, Base Ecosystem, Binance HODLer Airdrops, InfoFi"
ZRO,layerzero,LayerZero,ZRO,236180703,2124828056.0,47012126.0,"Smart Contract Platform, BNB Chain Ecosystem, Avalanche Ecosystem, Polygon Ecosystem, Arbitrum Ecosystem, Ethereum Ecosystem, Optimism Ecosystem, Base Ecosystem, Multicoin Capital Portfolio, Layer 0 (L0), Cross-chain Communication, Circle Ventures Portfolio, Sequoia Capital Portfolio, OKX Ventures Portfolio"
BLUR,blur,Blur,BLUR,198716958,241412813.0,27035469.0,"NFT, Ethereum Ecosystem, NFT Marketplace, FTX Holdings, NFTFi, eGirl Capital Portfolio, Paradigm Portfolio, GMCI DeFi Index, GMCI Index, Made in USA, Coinbase 50 Index"
WILD,wilder-world,Wilder World,WILD,175311820,229409473.0,2475411.0,"Gaming (GameFi), NFT, Metaverse, Solana Ecosystem, Avalanche Ecosystem, Play To Earn, Ethereum Ecosystem, Animoca Brands Portfolio, Gaming Governance Token, Racing Games, Simulation Games, Action Games"
HOT,holotoken,Holo,HOT,168460374,168460374.0,14540848.0,"Smart Contract Platform, Storage, Harmony Ecosystem, Arbitrum Ecosystem, Ethereum Ecosystem, DePIN, Base Ecosystem, Energi Ecosystem, Sora Ecosystem, GMCI DePIN Index, GMCI Index"
ANKR,ankr,Ankr Network,ANKR,157740055,157740055.0,18796610.0,"BNB Chain Ecosystem, Avalanche Ecosystem, Polygon Ecosystem, Fantom Ecosystem, Arbitrum Ecosystem, Ethereum Ecosystem, Optimism Ecosystem, Liquid Staking Governance Tokens, Linea Ecosystem, DePIN, Scroll Ecosystem, Rollups-as-a-Service (RaaS), Blast Ecosystem, Mode Ecosystem, Pantera Capital Portfolio, Polygon zkEVM Ecosystem, YZi Labs (Prev. Binance Labs) Portfolio, Liquid Staking, Made in USA"
MPLX,metaplex,Metaplex,MPLX,142754333,171624051.0,6946373.0,"Gaming (GameFi), NFT, BNB Chain Ecosystem, Solana Ecosystem, Launchpad, Animoca Brands Portfolio, FTX Holdings, Multicoin Capital Portfolio, Alameda Research Portfolio, Binance Alpha Spotlight"
CSPR,casper-network,Casper Network,CSPR,141092551,146076910.0,3986919.0,"Smart Contract Platform, Layer 1 (L1), Real World Assets (RWA), Proof of Stake (PoS), GMCI Layer 1 Index, GMCI Index, Made in USA"
HSK,hashkey-ecopoints,HashKey Platform Token,HSK,132435502,529784372.0,5270354.0,"Exchange-based Tokens, Centralized Exchange (CEX) Token, Ethereum Ecosystem"
BLAST,blast,Blast,BLAST,126447954,287945483.0,11305329.0,"Smart Contract Platform, Layer 2 (L2), eGirl Capital Portfolio, Paradigm Portfolio, Blast Ecosystem"
SWFTC,swftcoin,SWFTCOIN,SWFTC,112446593,112446593.0,1570172.0,"Exchange-based Tokens, NFT, BNB Chain Ecosystem, Ethereum Ecosystem"
GOHOME,gohome,GOHOME,GOHOME,112101724,2136738581.0,5222493.0,"Solana Ecosystem, Meme"
ACH,alchemy-pay,Alchemy Pay,ACH,106381582,215186549.0,19624831.0,"BNB Chain Ecosystem, Ethereum Ecosystem, Payment Solutions, DWF Labs Portfolio"
ACT,acet-token,Acet,ACT,106236592,138600492.0,125124.0,BNB Chain Ecosystem
XVS,venus,Venus,XVS,103341747,183650597.0,8861053.0,"Decentralized Finance (DeFi), Yield Farming, BNB Chain Ecosystem, Binance Launchpool, Lending/Borrowing Protocols, Arbitrum Ecosystem, Ethereum Ecosystem, Optimism Ecosystem, ZkSync Ecosystem, opBNB Ecosystem, Unichain Ecosystem"
CETUS,cetus-protocol,Cetus Protocol,CETUS,87046648,104410581.0,14745159.0,"Decentralized Exchange (DEX), Decentralized Finance (DeFi), Sui Ecosystem, Animoca Brands Portfolio, OKX Ventures Portfolio, Dex Aggregator"
PHA,pha,PHALA,PHA,85937377,106514375.0,18555315.0,"Artificial Intelligence (AI), Infrastructure, Smart Contract Platform, Oracle, Polkadot Ecosystem, Ethereum Ecosystem, Interoperability, Layer 2 (L2), Zero Knowledge (ZK), DePIN, DWF Labs Portfolio, Rollup, AI Agents, Sora Ecosystem, AI Framework, Made in USA"
GLMR,moonbeam,Moonbeam,GLMR,74327424,88034430.0,6757873.0,"Smart Contract Platform, Polkadot Ecosystem, Layer 1 (L1), Coinbase Ventures Portfolio, Proof of Stake (PoS), YZi Labs (Prev. Binance Labs) Portfolio"
USDP,paxos-standard,Pax Dollar,USDP,66964439,66964439.0,14157751.0,"Stablecoins, USD Stablecoin, Solana Ecosystem, Ethereum Ecosystem, Multicoin Capital Portfolio, Fiat-backed Stablecoin"
CCD,concordium,Concordium,CCD,60208642,72764518.0,521334.0,"Smart Contract Platform, Layer 1 (L1), Decentralized Identifier (DID), Zero Knowledge (ZK)"
RIF,rif-token,Rootstock Infrastructure Framework,RIF,53927871,53927871.0,3926316.0,"Solana Ecosystem, Arbitrum Ecosystem, Ethereum Ecosystem, Base Ecosystem, Rootstock Ecosystem, Outlier Ventures Portfolio"
C98,coin98,Coin98,C98,52339891,52339906.0,14430157.0,"Decentralized Finance (DeFi), BNB Chain Ecosystem, Solana Ecosystem, Wallets, Polygon Ecosystem, Ethereum Ecosystem, Binance Launchpad, DWF Labs Portfolio, Multicoin Capital Portfolio, Alameda Research Portfolio, Viction Ecosystem, YZi Labs (Prev. Binance Labs) Portfolio"
CTK,certik,Shentu,CTK,50197103,51013164.0,3117297.0,"Business Services, Binance Launchpool, Osmosis Ecosystem, Coinbase Ventures Portfolio, Cybersecurity, YZi Labs (Prev. Binance Labs) Portfolio, OKX Ventures Portfolio"
THE,thena,Thena,THE,49794477,115043956.0,20631997.0,"Decentralized Exchange (DEX), Decentralized Finance (DeFi), BNB Chain Ecosystem, opBNB Ecosystem, Binance HODLer Airdrops"
OMI,ecomi,ECOMI,OMI,49688829,57011603.0,933071.0,"Gaming (GameFi), NFT, Metaverse, Collectibles, Play To Earn, Ethereum Ecosystem, Base Ecosystem, Energi Ecosystem"
M87,messier,MESSIER,M87,49128349,49128349.0,623525.0,"Decentralized Finance (DeFi), Ethereum Ecosystem"
DODO,dodo,DODO,DODO,44119410,44119410.0,6961223.0,"Decentralized Exchange (DEX), Exchange-based Tokens, Decentralized Finance (DeFi), BNB Chain Ecosystem, Binance Launchpool, Polygon Ecosystem, Near Protocol Ecosystem, Arbitrum Ecosystem, Ethereum Ecosystem, DWF Labs Portfolio, Coinbase Ventures Portfolio, Alameda Research Portfolio, DeFiance Capital Portfolio, Pantera Capital Portfolio, Aurora Ecosystem, Energi Ecosystem, YZi Labs (Prev. Binance Labs) Portfolio, Galaxy Digital Portfolio"
ELX,elixir-finance,Elixir,ELX,38723291,149354955.0,8343540.0,"Decentralized Finance (DeFi), Ethereum Ecosystem, Real World Assets (RWA), Stablecoin Protocol, RWA Protocol"
UFD,unicorn-fart-dust,Unicorn Fart Dust,UFD,38380196,38380196.0,4721509.0,"Solana Ecosystem, Meme, Solana Meme, Pump.fun Ecosystem, Binance Alpha Spotlight, Made in USA"
STORJ,storj,Storj,STORJ,37594225,111119203.0,12580988.0,"Storage, Harmony Ecosystem, Ethereum Ecosystem, DePIN, Energi Ecosystem"
SFUND,seedify-fund,Seedify.fund,SFUND,35565640,55953510.0,4153688.0,"Gaming (GameFi), BNB Chain Ecosystem, Launchpad, Arbitrum Ecosystem, Ethereum Ecosystem, DWF Labs Portfolio"
EDU,edu-coin,Open Campus,EDU,35061921,134799533.0,5590808.0,"Education, BNB Chain Ecosystem, Polygon Ecosystem, Ethereum Ecosystem, Binance Launchpad, YZi Labs (Prev. Binance Labs) Portfolio"
FORTH,ampleforth-governance-token,Ampleforth Governance,FORTH,32924932,43784951.0,5815370.0,"Ethereum Ecosystem, Stablecoin Protocol"
PHB,phoenix-global,Phoenix,PHB,32901006,32901006.0,6632113.0,"Artificial Intelligence (AI), Oracle, NFT, BNB Chain Ecosystem, DePIN, Made in China"
MMUI,metamui,MetaMUI,MMUI,31582619,53050939.0,851212.0,Avalanche Ecosystem
KUJI,kujira,Kujira,KUJI,30629900,30637971.0,14740.55,"Smart Contract Platform, Decentralized Finance (DeFi), BNB Chain Ecosystem, Layer 1 (L1), Arbitrum Ecosystem, Ethereum Ecosystem, Optimism Ecosystem, Osmosis Ecosystem, Secret Ecosystem"
AVA,ava-ai,Ava AI,AVA,30459612,30459612.0,11504599.0,"Artificial Intelligence (AI), Solana Ecosystem, Meme, AI Meme, AI Agents, Pump.fun Ecosystem, Binance Alpha Spotlight, Made in USA"
PNG,pangolin,Pangolin,PNG,30328257,74040514.0,772920.0,"Decentralized Exchange (DEX), Decentralized Finance (DeFi), Avalanche Ecosystem, Olympus Pro Ecosystem"
MNSRY,mansory-token,Mansory Token,MNSRY,28981651,28981651.0,2170831.0,"Retail, BNB Chain Ecosystem, Solana Ecosystem, Real World Assets (RWA), Pump.fun Ecosystem"
DYDX,dydx,dYdX,ETHDYDX,27508836,572317687.0,17993448.0,"Decentralized Exchange (DEX), Exchange-based Tokens, Decentralized Finance (DeFi), Derivatives, Perpetuals, Ethereum Ecosystem, Paradigm Portfolio"
ZEREBRO,zerebro,Zerebro,ZEREBRO,27309055,27309055.0,5119135.0,"Solana Ecosystem, Meme, Solana Meme, AI Meme, Pump.fun Ecosystem, Binance Alpha Spotlight"
LAT,platon-network,PlatON Network,LAT,27141880,41768531.0,9013589.0,"Smart Contract Platform, Appchains"
OPUL,opulous,Opulous,OPUL,26721781,26721781.0,890381.0,"Artificial Intelligence (AI), Music, NFT, BNB Chain Ecosystem, Arbitrum Ecosystem, Ethereum Ecosystem, Algorand Ecosystem, Real World Assets (RWA), Telegram Apps, AI Applications"
GHST,aavegotchi,Aavegotchi,GHST,24883125,25656783.0,3787435.0,"Smart Contract Platform, Gaming (GameFi), NFT, Metaverse, Collectibles, Polygon Ecosystem, Meme, Play To Earn, Ethereum Ecosystem, Gotchiverse, Base Ecosystem, Layer 3 (L3), RPG, Gaming Governance Token, Gaming Utility Token, Energi Ecosystem"
U,u,U,U,24719159,24719159.0,646584.0,"BNB Chain Ecosystem, Meme"
PIKA,pikaboss,Pikaboss,PIKA,23280359,23280359.0,5609.52,"Meme, Ethereum Ecosystem"
LOFI,lofi-2,LOFI,LOFI,22256427,22256427.0,1342814.0,"Meme, Sui Ecosystem, Sui Meme"
JELLYJELLY,jelly-my-jelly,Jelly-My-Jelly,JELLYJELLY,21125731,21125731.0,3312933.0,"Solana Ecosystem, Pump.fun Ecosystem"
NEON,neon,Neon,NEON,20851645,87075787.0,679822.0,"Smart Contract Platform, Solana Ecosystem, Neon Ecosystem, Parallelized EVM"
BEL,bella-protocol,Bella Protocol,BEL,20554157,25692696.0,3721600.0,"Decentralized Finance (DeFi), Yield Farming, BNB Chain Ecosystem, Binance Launchpool, Yield Aggregator, Ethereum Ecosystem, Manta Network Ecosystem, YZi Labs (Prev. Binance Labs) Portfolio"
FIS,stafi,Stafi,FIS,19928544,19928544.0,16856667.0,"Decentralized Finance (DeFi), Ethereum Ecosystem, Liquid Staking Governance Tokens, Osmosis Ecosystem, Sora Ecosystem, Liquid Staking"
CWEB,coinweb,Coinweb,CWEB,19927869,24422663.0,142199.0,"Smart Contract Platform, Wallets, Ethereum Ecosystem, Interoperability, Layer 2 (L2), Cross-chain Communication, Bitcoin Sidechains, SideChain"
PERP,perpetual-protocol,Perpetual Protocol,PERP,19779232,40860630.0,8008574.0,"Decentralized Exchange (DEX), Exchange-based Tokens, Decentralized Finance (DeFi), Automated Market Maker (AMM), BNB Chain Ecosystem, Derivatives, Perpetuals, Gnosis Chain Ecosystem, Arbitrum Ecosystem, Ethereum Ecosystem, Optimism Ecosystem, Multicoin Capital Portfolio, Alameda Research Portfolio, YZi Labs (Prev. Binance Labs) Portfolio"
T,talos-2,Talos,T,19489385,20515142.0,953632.0,"Artificial Intelligence (AI), Arbitrum Ecosystem, AI Agents, DeFAI"
QUICK,quick,Quickswap [OLD],QUICK,19389224,26081727.0,12384.03,"Decentralized Exchange (DEX), Exchange-based Tokens, Decentralized Finance (DeFi), Yield Farming, Automated Market Maker (AMM), Polygon Ecosystem, Ethereum Ecosystem"
CATE,catecoin,CateCoin,CATE,19319642,20093759.0,2226199.0,"Entertainment, Gaming (GameFi), Yield Farming, NFT, BNB Chain Ecosystem, Yield Aggregator, Launchpad, Wallets, Meme, Play To Earn, Ethereum Ecosystem, Base Ecosystem, Cat-Themed"
MSM,musmecoin,MusmeCoin,MSM,18252496,35100852.0,10980.1,"Meme, Ethereum Ecosystem, Anime-Themed, Oasys Ecosystem"
GHX,gamercoin,GamerCoin,GHX,17840020,20509840.0,194203.0,"Artificial Intelligence (AI), Infrastructure, BNB Chain Ecosystem, Solana Ecosystem, Ethereum Ecosystem, DePIN, AI Applications"
VARA,vara-network,Vara Network,VARA,17266459,43608578.0,193489.0,"Smart Contract Platform, Layer 1 (L1)"
BENJI,basenji,Basenji,BENJI,17262078,17262078.0,6692327.0,"Meme, Base Ecosystem, Dog-Themed, Base Meme"
PSTAKE,pstake-finance,pSTAKE Finance,PSTAKE,16084316,16084316.0,5055196.0,"Smart Contract Platform, BNB Chain Ecosystem, Ethereum Ecosystem, Optimism Ecosystem, Liquid Staking Governance Tokens, Sui Ecosystem, Base Ecosystem, Coinbase Ventures Portfolio, Proof of Stake (PoS), Blast Ecosystem, Alameda Research Portfolio, DeFiance Capital Portfolio, YZi Labs (Prev. Binance Labs) Portfolio, Galaxy Digital Portfolio, Sequoia Capital Portfolio, Liquid Staking, BTCfi Protocol, Binance Alpha Spotlight"
KOMA,koma-inu,Koma Inu,KOMA,14857546,14857546.0,8921868.0,"BNB Chain Ecosystem, Meme, Dog-Themed, Binance Alpha Spotlight, Made in USA"
REDO,resistance-dog,Resistance Dog,REDO,13440968,13440968.0,410964.0,"Meme, Dog-Themed, TON Ecosystem, TON Meme"
SIGMA,sigma,Sigma,SIGMA,13383008,13383008.0,1289476.0,"Solana Ecosystem, Meme, Solana Meme, Pump.fun Ecosystem, 4chan-Themed"
CAM,camino-network,Camino Network,CAM,12853534,34131751.0,40319.0,"Smart Contract Platform, Layer 1 (L1), Outlier Ventures Portfolio"
ULTI,ultiverse,Ultiverse,ULTI,12122063,20007069.0,7498794.0,"Gaming (GameFi), BNB Chain Ecosystem, Ethereum Ecosystem, Animoca Brands Portfolio, Binance Alpha Spotlight"
CSWAP,chainswap-3,ChainSwap,CSWAP,11122553,11670226.0,31171.0,"Decentralized Exchange (DEX), Decentralized Finance (DeFi), Ethereum Ecosystem, Cross-chain Communication"
OIK,space-nation-oikos,Space Nation Oikos,OIK,10894564,50231983.0,176080336.0,"Gaming (GameFi), NFT, BNB Chain Ecosystem, Immutable zkEVM Ecosystem, RPG, MMO"
XSWAP,xswap-2,XSwap,XSWAP,10771620,14327942.0,287857.0,"Decentralized Finance (DeFi), Ethereum Ecosystem, Base Ecosystem, Cross-chain Communication"
SLF,self-chain,Self Chain,SLF,10653965,21435523.0,37205295.0,"Infrastructure, Smart Contract Platform, Layer 1 (L1), Account Abstraction, Intent"
BR,bedrock-token,Bedrock,BR,10527461,50130767.0,38288675.0,"Decentralized Finance (DeFi), BNB Chain Ecosystem, Ethereum Ecosystem, Liquid Staking Governance Tokens, Base Ecosystem, Berachain Ecosystem, BTCfi Protocol, Binance Wallet IDO"
ROOT,the-root-network,The Root Network,ROOT,10019868,39491537.0,1541217.0,"Smart Contract Platform, Gaming (GameFi), Layer 1 (L1), Ethereum Ecosystem, Gaming Blockchains, Outlier Ventures Portfolio"
3ULL,playa3ull-games-2,PLAYA3ULL GAMES,3ULL,9146038,9159866.0,630892.0,"Smart Contract Platform, Gaming (GameFi), NFT, Avalanche Ecosystem, Play To Earn, Shooting Games, Avalanche L1, MMO"
SNAI,swarmnode-ai,SwarmNode.ai,SNAI,9024584,9999510.0,2219236.0,"Artificial Intelligence (AI), Infrastructure, Solana Ecosystem, Pump.fun Ecosystem, AI Agent Launchpad, Binance Alpha Spotlight, AI Framework, DeFAI"
AGRI,agridex-governance-token,AgriDex,AGRI,8526576,25540339.0,495949.0,"Tokenized Assets, Solana Ecosystem, Real World Assets (RWA), Tokenized Commodities"
RNT,reental,Reental,RNT,8100059,37966526.0,2130.81,"Tokenized Real Estate, Tokenized Assets, Polygon Ecosystem, Real World Assets (RWA), RWA Protocol"
DINERO,dinero-2,Dinero,DINERO,7553400,12079276.0,189834.0,"Infrastructure, Decentralized Finance (DeFi), Lending/Borrowing Protocols, Ethereum Ecosystem, Metagovernance, Liquid Staking Governance Tokens, LSDFi, Curve Ecosystem, Liquid Staking"
HDRO,hydro-protocol-2,Hydro Protocol,HDRO,7466719,21064521.0,30230.0,Injective Ecosystem
EVR,evernode,Evernode,EVR,7207180,14397101.0,4352.4,"Smart Contract Platform, Layer 2 (L2), DePIN"
NIBI,nibiru,Nibiru,NIBI,6679276,8527717.0,440999.0,"Infrastructure, Smart Contract Platform, Layer 1 (L1), Osmosis Ecosystem, Made in USA"
GHUB,gemhub,GemHUB,GHUB,6611009,33564845.0,330861.0,Kaia Ecosystem
CLY,colony,Colony,CLY,5986040,7967971.0,111966.0,Avalanche Ecosystem
DOLAN,dolan-duck,Dolan Duck,DOLAN,5943608,5943608.0,137473.0,"Solana Ecosystem, Meme, Solana Meme, Parody Meme, 4chan-Themed"
KISHU,kishu-inu,Kishu Inu,KISHU,5822753,5822751.0,107216.0,"Meme, Ethereum Ecosystem, Dog-Themed"
STNK,stonks-4,Stonks,STNK,5659197,5659197.0,106209.0,"Solana Ecosystem, Meme, Solana Meme, Wall Street Bets Themed, Stock market-themed"
XEL,xelis,Xelis,XEL,5634276,5634276.0,63139.0,"Smart Contract Platform, Privacy, Layer 1 (L1), Directed Acyclic Graph (DAG)"
SPARKLET,upland,Upland,SPARKLET,5273452,22463353.0,303663.0,"Gaming (GameFi), NFT, Metaverse, Play To Earn, Ethereum Ecosystem, Animoca Brands Portfolio, Venture Capital Portfolios, Made in USA"
BOTIFY,botify,BOTIFY,BOTIFY,5053524,5053524.0,477076.0,"Artificial Intelligence (AI), Retail, Solana Ecosystem, E-commerce"
DROP,drop-2,DROP,DROP,4603457,4603457.0,12762.14,"Meme, XRP Ledger Ecosystem"
BRN,brn-metaverse,BRN Metaverse,BRN,4363948,4848910.0,1036578.0,"Gaming (GameFi), BNB Chain Ecosystem, Metaverse"
DCK,dexcheck,DexCheck AI,DCK,4163152,5671779.0,388458.0,"Artificial Intelligence (AI), Analytics, BNB Chain Ecosystem, Launchpad, ChainGPT Launchpad, Poolz Finance Launchpad, AI Agents, DeFAI, InfoFi"
WUSD,worldwide-usd,Worldwide USD,WUSD,3777436,3777436.0,1417086.0,"Stablecoins, USD Stablecoin, Polygon Ecosystem, Ethereum Ecosystem, Viction Ecosystem, Fiat-backed Stablecoin"
KAS,kaspa,Kaspa,KAS,2383885449,2403520386.0,57133885.0,"Smart Contract Platform, Layer 1 (L1), Proof of Work (PoW), Kaspa Ecosystem, Made in USA, Directed Acyclic Graph (DAG)"
