SAUCE,saucerswap,SaucerSwap,SAUCE,17759652.0,19903007.0,97074.0,"Decentralized Exchange (DEX), Exchange-based Tokens, Decentralized Finance (DeFi), Base Ecosystem, Hedera Ecosystem, Made in USA, Base Native"
NEAR,binance-peg-near-protocol,Binance-Peg NEAR Protocol,NEAR,15395154.0,15395154.0,18915.03,"BNB Chain Ecosystem, Binance-Peg Tokens"
BXN,bxn,BXN,BXN,14898884.0,47107521.0,405334.0,"Smart Contract Platform, Layer 1 (L1)"
USDM,celo-dollar,Mento Dollar,USDM,14647592.0,14647592.0,528159.0,"Stablecoins, USD Stablecoin, Near Protocol Ecosystem, Celo Ecosystem, Algorithmic Stablecoin, Fiat-backed Stablecoin"
NIL,nillion,Nillion,NIL,14400163.0,33571390.0,4437563.0,"Artificial Intelligence (AI), Infrastructure, Binance Launchpool, Ethereum Ecosystem, CoinList Launchpad, Privacy Infrastructure, Privacy"
SDL,stake-link,stake.link,SDL,14232380.0,23447311.0,8632.63,"Ethereum Ecosystem, Liquid Staking"
HOPR,hopr,HOPR,HOPR,13849650.0,14363717.0,102947.0,"Gnosis Chain Ecosystem, Ethereum Ecosystem, DePIN, YZi Labs (Prev. Binance Labs) Portfolio, Governance, Privacy Infrastructure, Privacy"
PYR,vulcan-forged,Vulcan Forged,PYR,12310085.0,13084397.0,3121571.0,"Gaming (GameFi), NFT, Metaverse, Polygon Ecosystem, Ethereum Ecosystem, DWF Labs Portfolio, Gaming Blockchains, Gaming Platform, Action Games, MMO"
DYM,dymension,Dymension,DYM,12236825.0,26201163.0,3123349.0,"Smart Contract Platform, Cosmos Ecosystem, Modular Blockchain, Osmosis Ecosystem, Rollups-as-a-Service (RaaS)"
RARE,superrare,SuperRare,RARE,11643159.0,14190130.0,2376222.0,"NFT, Ethereum Ecosystem"
OLAS,autonolas,Autonolas,OLAS,10954314.0,21922775.0,191314.0,"Artificial Intelligence (AI), Solana Ecosystem, Polygon Ecosystem, Gnosis Chain Ecosystem, Arbitrum Ecosystem, Celo Ecosystem, Ethereum Ecosystem, Optimism Ecosystem, Base Ecosystem, AI Agents, Mode Ecosystem, AI Agent Launchpad, Binance Alpha Spotlight, AI Framework, DeFAI, x402 Ecosystem, Base Native"
CREPE,crepe-2,CREPE,CREPE,10905311.0,10905311.0,725650.0,"BNB Chain Ecosystem, Meme"
SOLO,solo-coin,Sologenic,SOLO,10758482.0,10758482.0,922.92,"Decentralized Exchange (DEX), Exchange-based Tokens, Decentralized Finance (DeFi), BNB Chain Ecosystem, Wallets, XRP Ledger Ecosystem"
SAGA,saga-2,Saga,SAGA,10362327.0,29898779.0,3831201.0,"Artificial Intelligence (AI), Infrastructure, Smart Contract Platform, Binance Launchpool, Layer 1 (L1), Modular Blockchain, Gaming Blockchains, Appchains, Saga Ecosystem"
AITECH,solidus-aitech,Solidus Ai Tech,AITECH,10332598.0,11501853.0,2370789.0,"Artificial Intelligence (AI), BNB Chain Ecosystem, Solana Ecosystem, Launchpad, Base Ecosystem, ChainGPT Launchpad, AI Agents, Binance Alpha Spotlight, DeFAI"
SUPRA,supra,Supra,SUPRA,9987060.0,31508725.0,293206.0,"Infrastructure, Smart Contract Platform, Oracle, Layer 1 (L1), Animoca Brands Portfolio, Coinbase Ventures Portfolio, Cross-chain Communication, DeFAI, Made in USA, Supra Ecosystem"
RBNT,redbelly-network-token,Redbelly Network,RBNT,9432061.0,37415355.0,141237.0,"Smart Contract Platform, Layer 1 (L1), Zero Knowledge (ZK), Real World Assets (RWA), Redbelly Network Ecosystem"
LAZIO,lazio-fan-token,Lazio Fan Token,LAZIO,8891957.0,26988427.0,1209086.0,"Sports, BNB Chain Ecosystem, Fan Token, Binance Launchpad"
AMO,amo,AMO Coin,AMO,8772171.0,8772171.0,615124.0,"Big Data, Kaia Ecosystem"
TOMI,tominet,TOMI,TOMI,8187012.0,8187012.0,1441.7,"Smart Contract Platform, Ethereum Ecosystem, DWF Labs Portfolio, Proof of Stake (PoS)"
BGSC,bugscoin,BugsCoin,BGSC,7824641.0,10410689.0,621531.0,"Retail, BNB Chain Ecosystem, Binance Alpha Spotlight"
ANYONE,airtor-protocol,ANyONe Protocol,ANYONE,7392181.0,9247429.0,162052.0,"Smart Contract Platform, Ethereum Ecosystem, DePIN, Base Ecosystem, Peaq Ecosystem, Privacy Infrastructure, Privacy"
NFP,nfprompt-token,NFPrompt,NFP,7142964.0,13352993.0,1336603.0,"BNB Chain Ecosystem, Binance Launchpool, YZi Labs (Prev. Binance Labs) Portfolio, Governance"
INTER,inter-milan-fan-token,Inter Milan Fan Token,INTER,6002264.0,10042054.0,329423.0,"Sports, Fan Token, Chiliz Ecosystem"
KRL,kryll,KRYLL,KRL,5788337.0,7107489.0,63278.0,"Artificial Intelligence (AI), Decentralized Finance (DeFi), Analytics, Arbitrum Ecosystem, Ethereum Ecosystem, Optimism Ecosystem, Base Ecosystem"
POLS,polkastarter,Polkastarter,POLS,5423431.0,5466637.0,128903.0,"Decentralized Finance (DeFi), BNB Chain Ecosystem, Launchpad, Ethereum Ecosystem"
SOLV,solv-protocol,Solv Protocol,SOLV,5156679.0,29216314.0,10969092.0,"BNB Chain Ecosystem, Binance Megadrop, BTCfi Protocol, Made in China"
WOD,world-of-dypians,World of Dypians,WOD,4968580.0,10769893.0,1376132.0,"Gaming (GameFi), NFT, BNB Chain Ecosystem, Metaverse, RPG, MMO"
HEART,humans-ai,Humans.ai,HEART,4919944.0,4919944.0,192451.0,"Artificial Intelligence (AI), Smart Contract Platform, Layer 1 (L1), Ethereum Ecosystem, Osmosis Ecosystem, AI Agents, AI Agent Launchpad"
DYNA,dynachain,Dynachain,DYNA,4545169.0,4729129.0,9.9,"Healthcare, BNB Chain Ecosystem"
SEAM,seamless-protocol,Seamless Protocol,SEAM,4349023.0,9892113.0,62522.0,"Decentralized Finance (DeFi), Lending/Borrowing Protocols, Ethereum Ecosystem, Base Ecosystem, Base Native"
BKN,brickken,Brickken,BKN,4069291.0,8148475.0,188500.0,"Tokenized Real Estate, BNB Chain Ecosystem, Impossible Finance Launchpad, Ethereum Ecosystem, Real World Assets (RWA), RWA Protocol"
BEAM,beam,BEAM,BEAM,3780595.0,5044557.0,71235.0,"Smart Contract Platform, Ethereum Ecosystem, Proof of Work (PoW), BeamPrivacy Ecosystem, Privacy Blockchain, Privacy Infrastructure, Privacy"
TUNA,defituna,DefiTuna,TUNA,3738053.0,13279052.0,28206.0,"Decentralized Exchange (DEX), Exchange-based Tokens, Decentralized Finance (DeFi), Automated Market Maker (AMM), Lending/Borrowing Protocols, Solana Ecosystem"
TRC,terrace,Terrace,TRC,3670225.0,15677632.0,53074.0,"Base Ecosystem, CeFi"
ZKP,panther,Panther Protocol,ZKP,3653113.0,3653113.0,3268799.0,"Smart Contract Platform, Polygon Ecosystem, Ethereum Ecosystem, Zero Knowledge (ZK), Base Ecosystem"
KIBSHI,kiboshib,KiboShib,KIBSHI,3572557.0,3572557.0,33951.0,"Solana Ecosystem, Meme, Arbitrum Ecosystem, Ethereum Ecosystem, Base Ecosystem, Dog-Themed, Solana Meme, AI Meme, Base Meme, Base Native"
RWA,allo,Allo,RWA,3323647.0,18464705.0,446786.0,"BNB Chain Ecosystem, Real World Assets (RWA), RWA Protocol, Binance Wallet IDO"
MLT,media-licensing-token,Media Licensing Token,MLT,2999841.0,4098102.0,6695.88,"BNB Chain Ecosystem, Metaverse, Ethereum Ecosystem"
REEF,reef,Reef,REEF,2571960.0,2571960.0,504445.0,"Binance Launchpool, Layer 1 (L1), Harmony Ecosystem, Alameda Research Portfolio, YZi Labs (Prev. Binance Labs) Portfolio, GMCI Layer 1 Index, GMCI Index"
WITCH,witch-token,Witch Token,WITCH,2343572.0,3401411.0,84524.0,Ethereum Ecosystem
GMEE,gamee,GAMEE,GMEE,2177268.0,5075571.0,279562.0,"Gaming (GameFi), NFT, BNB Chain Ecosystem, Play To Earn, Ethereum Ecosystem, Telegram Apps, Animoca Brands Portfolio, TON Ecosystem, Gaming Platform, YZi Labs (Prev. Binance Labs) Portfolio, Arcade Games"
TRUF,truflation,TRUF.Network,TRUF,2015945.0,3956621.0,235916.0,"Infrastructure, Oracle, Solana Ecosystem, Arbitrum Ecosystem, Ethereum Ecosystem, Real World Assets (RWA), Base Ecosystem, Coinbase Ventures Portfolio, Governance, Base Native"
AZIT,azit,azit,AZIT,1797470.0,2127191.0,8981858.0,"Kaia Ecosystem, Payment Solutions"
SLERF,slerf,Slerf [OLD],SLERF,1795741.0,1795741.0,38924.0,"Solana Ecosystem, Meme, Solana Meme"
ZCX,unizen,Unizen,ZCX,1782926.0,2370219.0,64977.0,"Decentralized Exchange (DEX), Exchange-based Tokens, Decentralized Finance (DeFi), Polygon Ecosystem, Ethereum Ecosystem, DWF Labs Portfolio"
MAS,massa,Massa,MAS,1631706.0,4293190.0,133971.0,"Smart Contract Platform, Layer 1 (L1), Massa Ecosystem"
RETARDIO,retardio,RETARDIO,RETARDIO,1599089.0,1599089.0,601367.0,"NFT, Solana Ecosystem, Meme, Solana Meme, Murad Picks, 4chan-Themed, TikTok Meme"
UXLINK,uxlink,UXLINK,UXLINK,1514840.0,1926722.0,1877366.0,"SocialFi, Ethereum Ecosystem"
UPT,uprock,UpRock,UPT,1384274.0,6070720.0,353554.0,"Solana Ecosystem, DePIN"
LL,lightlink,LightLink,LL,1371410.0,3279139.0,117474.0,"Infrastructure, Smart Contract Platform, Ethereum Ecosystem, Layer 2 (L2), Base Ecosystem, Rollup, LightLink Ecosystem"
SERAPH,seraph,Seraph,SERAPH,1322328.0,4151205.0,287970.0,"Gaming (GameFi), BNB Chain Ecosystem, Play To Earn, Ethereum Ecosystem, RPG, Gaming Utility Token, Action Games"
DBC,deepbrain-chain,DeepBrain Chain,DBC,1297072.0,4053350.0,10375.31,"Artificial Intelligence (AI), DeepBrain Chain Ecosystem"
MEMEFI,memefi-2,MemeFi,MEMEFI,1291753.0,1291753.0,723515.0,"Gaming (GameFi), NFT, Meme, Play To Earn, Sui Ecosystem, Telegram Apps, Tap to Earn, Sui Meme, Action Games"
PORT3,port3-network,Port3 Network,PORT3,1129575.0,2696446.0,82593.0,"SocialFi, BNB Chain Ecosystem, Poolz Finance Launchpad"
XAUT,tether-gold,Tether Gold,XAUT,2613711692.0,3305667141.0,559028388.0,"Tokenized Assets, Tokenized Gold, Ethereum Ecosystem, Real World Assets (RWA), Tokenized Commodities"
BGB,bitget-token,Bitget Token,BGB,1356866491.0,1777382760.0,22662284.0,"Exchange-based Tokens, Centralized Exchange (CEX) Token, Ethereum Ecosystem, DragonFly Capital Portfolio, Morph L2 Ecosystem, Made in China"
QNT,quant-network,Quant,QNT,1018877662.0,1023663529.0,11250642.0,"Infrastructure, Ethereum Ecosystem, Real World Assets (RWA), Energi Ecosystem, Coinbase 50 Index"
LBTC,lombard-staked-btc,Lombard Staked BTC,LBTC,709893935.0,709893935.0,1444423.0,"BNB Chain Ecosystem, Solana Ecosystem, Liquid Staking Tokens, Ethereum Ecosystem, Sui Ecosystem, Base Ecosystem, Starknet Ecosystem, Restaking, Berachain Ecosystem, Liquid Restaking Tokens, Sonic Ecosystem, Etherlink Ecosystem, Swellchain Ecosystem, Corn Ecosystem, Liquid Staked BTC, Movement Ecosystem, Katana Ecosystem, TAC Ecosystem, Base Native"
JST,just,JUST,JST,542009772.0,542009772.0,30602640.0,"Decentralized Finance (DeFi), Tron Ecosystem"
LDO,lido-dao,Lido DAO,LDO,280917627.0,330777562.0,37430286.0,"Infrastructure, Decentralized Finance (DeFi), Polygon Ecosystem, Arbitrum Ecosystem, Ethereum Ecosystem, Optimism Ecosystem, Liquid Staking Governance Tokens, eGirl Capital Portfolio, Paradigm Portfolio, Coinbase Ventures Portfolio, Multicoin Capital Portfolio, Index Coop Defi Index, Alameda Research Portfolio, DragonFly Capital Portfolio, Andreessen Horowitz (a16z) Portfolio, GMCI DeFi Index, Delphi Ventures Portfolio, Liquid Staking, GMCI Index, Coinbase 50 Index, Governance"
FLOKI,floki,FLOKI,FLOKI,269488622.0,279139242.0,21863374.0,"Gaming (GameFi), NFT, BNB Chain Ecosystem, Metaverse, Meme, Play To Earn, Ethereum Ecosystem, Telegram Apps, Dog-Themed, DWF Labs Portfolio, RPG, On-chain Gaming, TokenFi Launchpad, GMCI Meme Index, GMCI Index"
APEPE,ape-and-pepe,Ape and Pepe,APEPE,251033728.0,251033728.0,33006060.0,"Polygon Ecosystem, Meme, Frog-Themed, The Boy’s Club"
ZBCN,zebec-network,Zebec Network,ZBCN,227332223.0,232080466.0,6685620.0,"Decentralized Finance (DeFi), Solana Ecosystem, Real World Assets (RWA), Payment Solutions, DePIN, Coinbase Ventures Portfolio, Alameda Research Portfolio, Circle Ventures Portfolio, OKX Ventures Portfolio, RWA Protocol, Made in USA"
PENDLE,pendle,Pendle,PENDLE,185075377.0,313250970.0,25819522.0,"Decentralized Exchange (DEX), Exchange-based Tokens, Decentralized Finance (DeFi), Yield Farming, Automated Market Maker (AMM), BNB Chain Ecosystem, Derivatives, Arbitrum Ecosystem, Ethereum Ecosystem, Optimism Ecosystem, Fixed Interest, LSDFi, Base Ecosystem, Restaking, LRTfi, Liquid Restaking Governance Tokens, Berachain Ecosystem, Yield Tokenization Protocol, YZi Labs (Prev. Binance Labs) Portfolio, GMCI DeFi Index, Sonic Ecosystem, Liquid Staking, GMCI Index, BTCfi Protocol, HyperEVM Ecosystem, Base Native"
DOGWIFHAT,dogwifcoin,dogwifhat,WIF,179144401.0,179144401.0,49645650.0,"Solana Ecosystem, Meme, Dog-Themed, Solana Meme, GMCI Meme Index, GMCI Index, Unichain Ecosystem"
RAY,raydium,Raydium,RAY,170423233.0,352009258.0,80180390.0,"Decentralized Exchange (DEX), Exchange-based Tokens, Decentralized Finance (DeFi), Yield Farming, Automated Market Maker (AMM), Perpetuals, Solana Ecosystem, Launchpad, GMCI DeFi Index, GMCI Index"
MX,mx-token,MX,MX,164394857.0,732181307.0,9249879.0,"Exchange-based Tokens, Centralized Exchange (CEX) Token, Ethereum Ecosystem, Morph L2 Ecosystem, Made in China"
SONIC,sonic-3,Sonic,S,155480805.0,159618516.0,15814613.0,"Smart Contract Platform, Layer 1 (L1), Galaxy Digital Portfolio, Sonic Ecosystem"
ZANO,zano,Zano,ZANO,146833924.0,146838730.0,1465891.0,"Smart Contract Platform, Layer 1 (L1), Proof of Stake (PoS), Proof of Work (PoW), Zano Ecosystem, Privacy Blockchain, Privacy Infrastructure, Privacy"
SFP,safepal,SafePal,SFP,142097197.0,142097197.0,2865609.0,"BNB Chain Ecosystem, Wallets, Ethereum Ecosystem, Animoca Brands Portfolio, Binance Launchpad, Energi Ecosystem, YZi Labs (Prev. Binance Labs) Portfolio"
ATH,aethir,Aethir,ATH,130540285.0,298496567.0,17464976.0,"Artificial Intelligence (AI), Infrastructure, Solana Ecosystem, Arbitrum Ecosystem, Impossible Finance Launchpad, Ethereum Ecosystem, DePIN, Animoca Brands Portfolio, Binance Alpha Spotlight"
FLUID,instadapp,Fluid,FLUID,128435737.0,164773170.0,5093801.0,"Decentralized Finance (DeFi), Solana Ecosystem, Polygon Ecosystem, Arbitrum Ecosystem, Ethereum Ecosystem, Base Ecosystem, Coinbase Ventures Portfolio, Pantera Capital Portfolio, Binance Alpha Spotlight, Plasma Ecosystem, Base Native"
TKX,tokenize-xchange,Tokenize Xchange,TKX,109916461.0,137402450.0,4874.1,"Exchange-based Tokens, Centralized Exchange (CEX) Token, Ethereum Ecosystem, Titanchain Ecosystem"
ROSE,oasis-network,Oasis,ROSE,77750147.0,102961984.0,3795453.0,"Smart Contract Platform, BNB Chain Ecosystem, Layer 1 (L1), Proof of Stake (PoS), Pantera Capital Portfolio, Andreessen Horowitz (a16z) Portfolio, YZi Labs (Prev. Binance Labs) Portfolio, Blockchain Capital Portfolio, Privacy Blockchain, Polychain Capital Portfolio, Coinbase 50 Index, Privacy Infrastructure, Privacy"
XVG,verge,Verge,XVG,74628328.0,74777607.0,2781501.0,"Smart Contract Platform, Proof of Work (PoW), Made in USA"
ELF,aelf,aelf,ELF,64116955.0,77987854.0,597339.0,"Infrastructure, Smart Contract Platform, BNB Chain Ecosystem, Layer 1 (L1), Ethereum Ecosystem, GMCI Layer 1 Index, Aelf Ecosystem, GMCI Index"
ZORA,zora,Zora,ZORA,61753685.0,138151420.0,7981135.0,"Infrastructure, Media, Smart Contract Platform, SocialFi, NFT, Launchpad, Layer 2 (L2), Base Ecosystem, Coinbase Ventures Portfolio, Zora Ecosystem, Binance Alpha Spotlight, Base Native"
VTHO,vethor-token,VeThor,VTHO,53270849.0,53282503.0,1389378.0,"Layer 1 (L1), VeChain Ecosystem"
XCH,chia,Chia,XCH,46755375.0,88832147.0,3005519.0,"Smart Contract Platform, Layer 1 (L1), DePIN, Andreessen Horowitz (a16z) Portfolio, Made in USA"
ANVL,anvil,Anvil,ANVL,46714566.0,57488880.0,35475.0,"Decentralized Finance (DeFi), Ethereum Ecosystem"
ZIG,zignaly,ZIGChain,ZIG,42802639.0,59359359.0,1317380.0,"Artificial Intelligence (AI), Smart Contract Platform, BNB Chain Ecosystem, Solana Ecosystem, Layer 1 (L1), Polygon Ecosystem, Ethereum Ecosystem, DWF Labs Portfolio, Injective Ecosystem, OKX Ventures Portfolio"
DAG,constellation-labs,Constellation,DAG,34360965.0,34360965.0,994524.0,"Smart Contract Platform, Layer 1 (L1), Layer 0 (L0), Made in USA, Directed Acyclic Graph (DAG)"
OSAK,osaka-protocol,Osaka Protocol,OSAK,33059854.0,33059854.0,106710.0,"BNB Chain Ecosystem, Solana Ecosystem, Avalanche Ecosystem, Polygon Ecosystem, Meme, Arbitrum Ecosystem, Ethereum Ecosystem, Optimism Ecosystem, Base Ecosystem, Dog-Themed, Base Native"
STEEM,steem,Steem,STEEM,31419532.0,31421123.0,6214478.0,SocialFi
SAI,sai,Sai,SAI,28795801.0,28795801.0,2.91,"Decentralized Finance (DeFi), Ethereum Ecosystem"
MANTA,manta-network,Manta Network,MANTA,28745822.0,61384543.0,7483665.0,"Smart Contract Platform, Polkadot Ecosystem, Binance Launchpool, Layer 2 (L2), Manta Network Ecosystem, Multicoin Capital Portfolio, Alameda Research Portfolio, DeFiance Capital Portfolio, YZi Labs (Prev. Binance Labs) Portfolio"
LQTY,liquity,Liquity,LQTY,27251920.0,27745765.0,4012282.0,"Decentralized Finance (DeFi), Arbitrum Ecosystem, Ethereum Ecosystem, Alameda Research Portfolio, Pantera Capital Portfolio"
REZ,renzo,Renzo,REZ,26674026.0,32372306.0,5490765.0,"Decentralized Finance (DeFi), Binance Launchpool, Ethereum Ecosystem, Base Ecosystem, Restaking, YZi Labs (Prev. Binance Labs) Portfolio, OKX Ventures Portfolio"
TAIKO,taiko,Taiko,TAIKO,24849627.0,127131406.0,9270784.0,"Smart Contract Platform, BNB Chain Ecosystem, Ethereum Ecosystem, Layer 2 (L2), Zero Knowledge (ZK), Rollup, OKX Ventures Portfolio, Binance Alpha Spotlight"
QKC,quark-chain,QuarkChain,QKC,21476165.0,29733350.0,434881.0,"Infrastructure, Ethereum Ecosystem, Energi Ecosystem"
PARTI,particle-network,Particle Network,PARTI,19936352.0,85563744.0,9276293.0,"Decentralized Finance (DeFi), BNB Chain Ecosystem, Layer 1 (L1), Base Ecosystem, Account Abstraction, Cross-chain Communication, Binance HODLer Airdrops, Chain Abstraction, Binance Wallet IDO, Base Native"
MBL,moviebloc,MovieBloc,MBL,18310820.0,28563218.0,1604278.0,DWF Labs Portfolio
PROM,prometeus,Prom,PROM,17973458.0,18958305.0,840659.0,"Smart Contract Platform, BNB Chain Ecosystem, Ethereum Ecosystem, Layer 2 (L2)"
XRD,radix,Radix,XRD,16092224.0,16092352.0,200473.0,"Smart Contract Platform, Layer 1 (L1), DWF Labs Portfolio, Radix Ecosystem"
JOE,joe,JOE,JOE,15015402.0,18592155.0,2133367.0,"Decentralized Exchange (DEX), Exchange-based Tokens, Decentralized Finance (DeFi), Yield Farming, Automated Market Maker (AMM), BNB Chain Ecosystem, Avalanche Ecosystem, Launchpad, Arbitrum Ecosystem, Mantle Ecosystem, DeFiance Capital Portfolio, Delphi Ventures Portfolio, Dex Aggregator"
DIAM,diam,DIAM,DIAM,14807187.0,41887986.0,132060.0,"Smart Contract Platform, Layer 1 (L1)"
OGN,origin-protocol,Origin Token,OGN,14088114.0,29841300.0,3302171.0,"Decentralized Finance (DeFi), NFT, Ethereum Ecosystem, Base Ecosystem, Pantera Capital Portfolio, Sonic Ecosystem, Liquid Staking, Made in USA, CoinList Launchpad, Base Native"
DAO,dao-maker,DAO Maker,DAO,14003704.0,15493857.0,6411643.0,"BNB Chain Ecosystem, Solana Ecosystem, Launchpad, DaoMaker Launchpad, Arbitrum Ecosystem, Ethereum Ecosystem, Step Network Ecosystem, Governance"
FIDA,bonfida,Bonfida,FIDA,13336956.0,13459290.0,2449114.0,"Big Data, Infrastructure, Decentralized Finance (DeFi), Solana Ecosystem, FTX Holdings, DWF Labs Portfolio, Name Service"
VANRY,vanar-chain,Vanar Chain,VANRY,10979086.0,11036250.0,1190420.0,"Artificial Intelligence (AI), Smart Contract Platform, Layer 1 (L1), Polygon Ecosystem, Ethereum Ecosystem, Vanar Chain Ecosystem"
WCT,connect-token-wct,WalletConnect Token,WCT,10540699.0,56609503.0,25987886.0,"Binance Launchpool, Solana Ecosystem, Wallets, Ethereum Ecosystem, Optimism Ecosystem, Base Ecosystem, CoinList Launchpad, Base Native"
LUMIA,lumia,Lumia,LUMIA,9063821.0,15633995.0,2700595.0,"Smart Contract Platform, BNB Chain Ecosystem, Ethereum Ecosystem, Layer 2 (L2), Real World Assets (RWA), Governance"
SD,stader,Stader,SD,8975472.0,15465146.0,1286208.0,"BNB Chain Ecosystem, Solana Ecosystem, Polygon Ecosystem, Fantom Ecosystem, Ethereum Ecosystem, Liquid Staking Governance Tokens, Animoca Brands Portfolio, Coinbase Ventures Portfolio, Pantera Capital Portfolio, Liquid Staking, Binance Alpha Spotlight, CoinList Launchpad"
LYX,lukso-token-2,LUKSO,LYX,8541147.0,11779967.0,143792.0,"Smart Contract Platform, SocialFi, Layer 1 (L1), Ethereum Ecosystem, Decentralized Identifier (DID), Proof of Stake (PoS), Lukso Ecosystem"
FARTBOY,fartboy,Fartboy,$FARTBOY,8000492.0,8000492.0,283971.0,"Solana Ecosystem, Meme, Solana Meme, Pump.fun Ecosystem"
VOW,vow,Vow,VOW,7204192.0,25849629.0,39057.0,"Retail, Tourism, BNB Chain Ecosystem, Ethereum Ecosystem"
LOCK,houdini-swap,Houdini Swap,LOCK,7124868.0,7124868.0,41770.0,"Decentralized Finance (DeFi), Solana Ecosystem, Ethereum Ecosystem, Privacy Infrastructure, Privacy"
MCB,mcdex,MUX Protocol,MCB,6865524.0,8670749.0,76.34,"Decentralized Exchange (DEX), Exchange-based Tokens, Decentralized Finance (DeFi), BNB Chain Ecosystem, Derivatives, Perpetuals, Arbitrum Ecosystem, Ethereum Ecosystem, Multicoin Capital Portfolio, Alameda Research Portfolio, DeFiance Capital Portfolio, Delphi Ventures Portfolio, OKX Ventures Portfolio"
PMT,public-meme-token,Public Masterpiece Token,PMT,6791596.0,39335546.0,368211.0,"NFT, BNB Chain Ecosystem, Real World Assets (RWA), NFTFi"
GTC,gitcoin,Gitcoin,GTC,6744625.0,7708891.0,1440870.0,"Near Protocol Ecosystem, Ethereum Ecosystem, Paradigm Portfolio, Governance"
OGY,origyn-foundation,ORIGYN,OGY,6062831.0,7737584.0,308922.0,"Internet Computer Ecosystem, Real World Assets (RWA), RWA Protocol"
ZETA,zeta,Zeta,ZEX,5850484.0,31157759.0,108662.0,"Decentralized Finance (DeFi), Derivatives, Perpetuals, Solana Ecosystem"
OBT,orbiter-finance,Orbiter Finance,OBT,5394408.0,10178128.0,2645679.0,"Decentralized Finance (DeFi), BNB Chain Ecosystem, Arbitrum Ecosystem, Ethereum Ecosystem, Bridge Governance Tokens, Base Ecosystem, Cross-chain Communication, OKX Ventures Portfolio, Base Native"
VIC,tomochain,Viction,VIC,5369686.0,8956685.0,297141.0,"Smart Contract Platform, Masternodes, Layer 1 (L1), DWF Labs Portfolio"
SUNDOG,sundog,Sundog,SUNDOG,5150897.0,5150897.0,2089898.0,"Meme, Tron Ecosystem, Sun Pump Ecosystem, TRON Meme, Binance Alpha Spotlight"
RSS3,rss3,RSS3,RSS3,5081193.0,5788579.0,1709950.0,"Artificial Intelligence (AI), Infrastructure, Storage, Ethereum Ecosystem, Coinbase Ventures Portfolio, DragonFly Capital Portfolio, RSS3 VSL Ecosystem, AI Framework, DeFAI"
NMT,netmind-token,NetMind Token,NMT,4902311.0,12011789.0,32761.0,"Artificial Intelligence (AI), BNB Chain Ecosystem, Ethereum Ecosystem, DePIN, AI Agents"
LINGO,lingo,Lingo,LINGO,4831457.0,4831457.0,200346.0,"Solana Ecosystem, Real World Assets (RWA), Base Ecosystem, RWA Protocol, Base Native"
FHE,mind-network,Mind Network,FHE,4785591.0,19219240.0,5289678.0,"Artificial Intelligence (AI), Smart Contract Platform, BNB Chain Ecosystem, Layer 2 (L2), Binance Wallet IDO"
CA,ca-htb,Coupon Assets,CA,4408733.0,64720597.0,957130.0,"Retail, Ethereum Ecosystem"
GAIA,gaia-2,Gaia,SN57,4406281.0,4406281.0,72859.0,"Artificial Intelligence (AI), Bittensor Ecosystem, Bittensor Subnets"
OOBIT,oobit-2,Oobit,OOB,4358074.0,12654014.0,30049.0,"Solana Ecosystem, Payment Solutions"
PEAR,pear-protocol,Pear Protocol,PEAR,4223943.0,13996113.0,23584.0,"Decentralized Exchange (DEX), Exchange-based Tokens, Decentralized Finance (DeFi), Perpetuals, Arbitrum Ecosystem"
RIO,realio-network,Realio Network Token,RIO,4219254.0,4219254.0,286914.0,"BNB Chain Ecosystem, Solana Ecosystem, Layer 1 (L1), Ethereum Ecosystem, Algorand Ecosystem, Real World Assets (RWA), Base Ecosystem, Osmosis Ecosystem, Stellar Ecosystem, RWA Protocol, Made in USA, Base Native"
ATS,alltoscan,Alltoscan,ATS,4078721.0,5969163.0,70675.0,"BNB Chain Ecosystem, Layer 1 (L1)"
SUKU,suku,SUKU,SUKU,4012725.0,10296301.0,223012.0,"Solana Ecosystem, Polygon Ecosystem, Ethereum Ecosystem, Made in USA"
NUM,numbers-protocol,Numbers Protocol,NUM,3923851.0,3968349.0,135930.0,"Artificial Intelligence (AI), Smart Contract Platform, BNB Chain Ecosystem, DaoMaker Launchpad, Ethereum Ecosystem, Avalanche L1, YZi Labs (Prev. Binance Labs) Portfolio, Outlier Ventures Portfolio"
IXT,ix-token,Planet IX (OLD),IXT,3765563.0,7258816.0,1390.7,"Gaming (GameFi), NFT, Metaverse, Polygon Ecosystem, Play To Earn, Gaming Governance Token, Gaming Utility Token, Strategy Games"
GRAM,gram-2,Gram,GRAM,3724037.0,3724037.0,12465.16,"TON Ecosystem, Proof of Work (PoW)"
NLS,nolus,Nolus,NLS,3600226.0,3809287.0,117075.0,"Lending/Borrowing Protocols, Liquid Staking Tokens, Ethereum Ecosystem, Osmosis Ecosystem"
NATIX,natix-network,NATIX Network,NATIX,3597656.0,8816197.0,177910.0,"Artificial Intelligence (AI), Internet of Things (IOT), Solana Ecosystem, DePIN, Robotics, CoinList Launchpad"
OVR,ovr,Ovr,OVR,3507735.0,3591651.0,225837.0,"Artificial Intelligence (AI), Augmented Reality, BNB Chain Ecosystem, Polygon Ecosystem, Ethereum Ecosystem, DePIN, Base Ecosystem, Robotics, Base Native"
CRTS,cratos,Cratos,CRTS,3321324.0,6511330.0,428294.0,"SocialFi, BNB Chain Ecosystem, Ethereum Ecosystem, Governance"
VINU,vita-inu,Vita Inu,VINU,3306752.0,3306752.0,380815.0,"BNB Chain Ecosystem, Meme, Dog-Themed, DWF Labs Portfolio, Binance Alpha Spotlight"
MFT,mainframe,Mainframe,MFT,3111420.0,3314763.0,1.29,"Ethereum Ecosystem, Energi Ecosystem"
HASHAI,hashai,HashAI,HASHAI,3011842.0,3263466.0,86273.0,"Analytics, Ethereum Ecosystem, DePIN"
GEAR,gearbox,Gearbox,GEAR,2951950.0,2951950.0,20176.0,"Decentralized Finance (DeFi), Yield Farming, Lending/Borrowing Protocols, Ethereum Ecosystem, Curve Ecosystem, eGirl Capital Portfolio, Galaxy Digital Portfolio, Binance Alpha Spotlight"
MEMDEX,memdex100,MEMDEX100,MEMDEX,2726439.0,2726439.0,46367.0,"Solana Ecosystem, Meme, Solana Meme, Moonshot Ecosystem"
BOOE,book-of-ethereum,Book of Ethereum,BOOE,2722149.0,2722149.0,46247.0,"Meme, Ethereum Ecosystem"
XTER,xterio,Xterio,XTER,2588911.0,18131400.0,4020841.0,"Artificial Intelligence (AI), Gaming (GameFi), NFT, BNB Chain Ecosystem, Animoca Brands Portfolio, Gaming Blockchains, YZi Labs (Prev. Binance Labs) Portfolio, Binance Alpha Spotlight"
HMT,human-protocol,HUMAN Protocol,HMT,2543130.0,3355644.0,14317.0,"Artificial Intelligence (AI), Infrastructure, Software as a service, BNB Chain Ecosystem, Polygon Ecosystem, Ethereum Ecosystem, Market-Making Solution, AI Framework, HyperEVM Ecosystem, CoinList Launchpad"
PROPS,propbase,Propbase,PROPS,2520933.0,6336579.0,789116.0,"Tokenized Real Estate, Aptos Ecosystem, Real World Assets (RWA), Base Ecosystem, RWA Protocol, Base Native"
VSC,vyvo-smart-chain,Vyvo Smart Chain,VSC,2177215.0,9260938.0,11138.67,"Smart Contract Platform, BNB Chain Ecosystem, Polygon Ecosystem, Layer 2 (L2)"
