Input Token,CoinGecko ID,Name,Symbol,Market Cap,FDV,24H Volume,Categories
TRX,tron,TRON,TRX,33336551546,33336644000.0,739980257.0,"Smart Contract Platform, Layer 1 (L1), Alleged SEC Securities, FTX Holdings, DWF Labs Portfolio, Tron Ecosystem, Proof of Stake (PoS), GMCI Layer 1 Index, GMCI 30 Index, GMCI Index, World Liberty Financial Portfolio, Made in China"
SUI,sui,Sui,SUI,13286577164,37229465581.0,1150435640.0,"Smart Contract Platform, Binance Launchpool, Layer 1 (L1), Sui Ecosystem, Coinbase Ventures Portfolio, Proof of Stake (PoS), Andreessen Horowitz (a16z) Portfolio, YZi Labs (Prev. Binance Labs) Portfolio, GMCI Layer 1 Index, Circle Ventures Portfolio, GMCI Index, Made in USA"
AVAX,avalanche-2,Avalanche,AVAX,12257119975,13296330674.0,894439670.0,"Smart Contract Platform, Layer 1 (L1), Avalanche Ecosystem, Proof of Stake (PoS), DragonFly Capital Portfolio, DeFiance Capital Portfolio, Andreessen Horowitz (a16z) Portfolio, GMCI Layer 1 Index, GMCI 30 Index, Galaxy Digital Portfolio, GMCI Index, Polychain Capital Portfolio, World Liberty Financial Portfolio, Made in USA, Coinbase 50 Index"
ENA,ethena,Ethena,ENA,5350058382,11649027095.0,627782689.0,"Decentralized Finance (DeFi), Binance Launchpool, Avalanche Ecosystem, Arbitrum Ecosystem, Ethereum Ecosystem, Metis Ecosystem, Optimism Ecosystem, ZkSync Ecosystem, Mantle Ecosystem, Base Ecosystem, TON Ecosystem, Manta Network Ecosystem, Scroll Ecosystem, Kava Ecosystem, Blast Ecosystem, Stablecoin Issuer, Mode Ecosystem, DragonFly Capital Portfolio, YZi Labs (Prev. Binance Labs) Portfolio, Fraxtal Ecosystem, Delphi Ventures Portfolio, OKX Ventures Portfolio, Zircuit Ecosystem, Morph L2 Ecosystem, World Liberty Financial Portfolio, Swellchain Ecosystem, Governance"
ONDO,ondo-finance,Ondo,ONDO,3482677285,11024244198.0,379967027.0,"Decentralized Finance (DeFi), Ethereum Ecosystem, Real World Assets (RWA), Coinbase Ventures Portfolio, Pantera Capital Portfolio, GMCI DeFi Index, RWA Protocol, GMCI Index, World Liberty Financial Portfolio, Binance Alpha Spotlight, Made in USA"
TAO,bittensor,Bittensor,TAO,3463891651,7579243854.0,92148663.0,"Artificial Intelligence (AI), Smart Contract Platform, Layer 1 (L1), DePIN, Bittensor Ecosystem, Polychain Capital Portfolio"
ATOM,cosmos,Cosmos Hub,ATOM,2220703827,2220703827.0,91849933.0,"Smart Contract Platform, BNB Chain Ecosystem, Cosmos Ecosystem, Canto Ecosystem, Alleged SEC Securities, Osmosis Ecosystem, Paradigm Portfolio, Proof of Stake (PoS), Kava Ecosystem, Layer 0 (L0), DragonFly Capital Portfolio, Pantera Capital Portfolio, Archway Ecosystem, Evmos Ecosystem, GMCI 30 Index, GMCI Index, Outlier Ventures Portfolio, Polychain Capital Portfolio, Mantra Ecosystem, Coinbase 50 Index, Governance"
ALGO,algorand,Algorand,ALGO,2170751282,2170752762.0,92446758.0,"Smart Contract Platform, Layer 1 (L1), Algorand Ecosystem, Real World Assets (RWA), Alleged SEC Securities, DWF Labs Portfolio, Multicoin Capital Portfolio, Proof of Stake (PoS), GMCI Layer 1 Index, GMCI Index, Made in USA, Coinbase 50 Index"
INJ,injective-protocol,Injective,INJ,1414057336,1446943166.0,108713427.0,"Smart Contract Platform, Decentralized Finance (DeFi), BNB Chain Ecosystem, Cosmos Ecosystem, Layer 1 (L1), Ethereum Ecosystem, Real World Assets (RWA), Binance Launchpad, Osmosis Ecosystem, Proof of Stake (PoS), Pantera Capital Portfolio, Secret Ecosystem, YZi Labs (Prev. Binance Labs) Portfolio, GMCI Layer 1 Index, GMCI Index, Made in USA, Coinbase 50 Index"
NEXO,nexo,NEXO,NEXO,1293869976,1293869976.0,11364403.0,"Centralized Exchange (CEX) Token, Polygon Ecosystem, Fantom Ecosystem, Ethereum Ecosystem, Alleged SEC Securities, Energi Ecosystem, Sora Ecosystem"
FDUSD,first-digital-usd,First Digital USD,FDUSD,1127763685,1127763685.0,10911692.0,"Stablecoins, USD Stablecoin, BNB Chain Ecosystem, Arbitrum Ecosystem, Ethereum Ecosystem, Sui Ecosystem, TON Ecosystem, Fiat-backed Stablecoin"
WBTC,arbitrum-bridged-wbtc-arbitrum-one,Arbitrum Bridged WBTC (Arbitrum One),WBTC,972370870,972370870.0,139323979.0,"Arbitrum Ecosystem, Bridged WBTC, Bridged-Tokens"
DOGWIFHAT,dogwifcoin,dogwifhat,WIF,947195487,947195487.0,258423173.0,"Solana Ecosystem, Meme, Dog-Themed, Solana Meme, GMCI Meme Index, GMCI Index, Unichain Ecosystem"
MANA,decentraland,Decentraland,MANA,638634407,729811158.0,38655125.0,"Entertainment, Gaming (GameFi), NFT, Metaverse, Polygon Ecosystem, Play To Earn, Ethereum Ecosystem, Animoca Brands Portfolio, Alleged SEC Securities, Simulation Games, Coinbase 50 Index"
AR,arweave,Arweave,AR,495318601,495318601.0,29353894.0,"Artificial Intelligence (AI), Smart Contract Platform, Storage, Layer 1 (L1), DePIN, Coinbase Ventures Portfolio, Multicoin Capital Portfolio, Andreessen Horowitz (a16z) Portfolio, Blockchain Capital Portfolio"
RSR,reserve-rights-token,Reserve Rights,RSR,487867596,815383816.0,19399567.0,"Decentralized Finance (DeFi), Arbitrum Ecosystem, Ethereum Ecosystem, Real World Assets (RWA), Base Ecosystem, Coinbase Ventures Portfolio, Energi Ecosystem, Made in USA"
NFT,apenft,APENFT,NFT,437451604,441818724.0,7311700.0,"NFT, BNB Chain Ecosystem, Ethereum Ecosystem, Tron Ecosystem"
CHZ,chiliz,Chiliz,CHZ,433715240,433718696.0,76024925.0,"Smart Contract Platform, Sports, NFT, Layer 1 (L1), Ethereum Ecosystem, Alleged SEC Securities, Chiliz Ecosystem, YZi Labs (Prev. Binance Labs) Portfolio, Coinbase 50 Index"
LPT,livepeer,Livepeer,LPT,323650613,323650613.0,23408393.0,"Artificial Intelligence (AI), Harmony Ecosystem, Arbitrum Ecosystem, Ethereum Ecosystem, DePIN, Coinbase Ventures Portfolio, Multicoin Capital Portfolio, Pantera Capital Portfolio, GMCI DePIN Index, GMCI Index, Coinbase 50 Index"
BERA,berachain-bera,Berachain,BERA,306950660,1240920790.0,52027859.0,"Smart Contract Platform, Decentralized Finance (DeFi), Layer 1 (L1), Berachain Ecosystem, Binance HODLer Airdrops, Outlier Ventures Portfolio, Polychain Capital Portfolio"
VELO,velo,Velo,VELO,288604524,394357833.0,49404014.0,"Decentralized Finance (DeFi), BNB Chain Ecosystem, Real World Assets (RWA), DWF Labs Portfolio, Stellar Ecosystem, Binance Alpha Spotlight"
RVN,ravencoin,Ravencoin,RVN,215032938,215056060.0,8548151.0,"Smart Contract Platform, Real World Assets (RWA), Proof of Work (PoW), Made in USA"
MELANIA,melania-meme,Melania Meme,MELANIA,154602023,208921837.0,9014019.0,"Solana Ecosystem, Meme, Solana Meme, PolitiFi, Made in USA, Trump-Affiliated"
MERL,merlin-chain,Merlin Chain,MERL,152300040,326704350.0,17918343.0,"Smart Contract Platform, BNB Chain Ecosystem, Ethereum Ecosystem, Layer 2 (L2), Merlin Chain Ecosystem, Bitcoin Sidechains, SideChain, OKX Ventures Portfolio"
KDA,kadena,Kadena,KDA,132633673,132643618.0,5919104.0,"Smart Contract Platform, Layer 1 (L1), Kadena Ecosystem, Multicoin Capital Portfolio, Proof of Work (PoW), Made in USA"
PYTHIA,pythia,PYTHIA,PYTHIA,120481845,120481845.0,7109202.0,"Solana Ecosystem, Meme, AI Meme, Pump.fun Ecosystem, Desci Meme, Binance Alpha Spotlight"
AIXBT,aixbt,aixbt,AIXBT,119543188,122065263.0,32827311.0,"Artificial Intelligence (AI), Solana Ecosystem, Meme, Ethereum Ecosystem, Base Ecosystem, AI Meme, AI Agents, Virtuals Protocol Ecosystem, Binance Alpha Spotlight, DeFAI"
VRA,verasity,Verasity,VRA,118441235,128222678.0,18862088.0,"Entertainment, BNB Chain Ecosystem, Wallets, Ethereum Ecosystem, Binance Alpha Spotlight"
LAYER,solayer,Solayer,LAYER,117881581,561340860.0,17038575.0,"Decentralized Finance (DeFi), Solana Ecosystem, LSDFi, Restaking, Stablecoin Issuer, YZi Labs (Prev. Binance Labs) Portfolio, Binance HODLer Airdrops, Polychain Capital Portfolio"
ALEO,aleo,ALEO,ALEO,111633643,428892951.0,3536356.0,"Smart Contract Platform, Layer 1 (L1), Zero Knowledge (ZK), Andreessen Horowitz (a16z) Portfolio, Privacy Blockchain, Made in USA"
SNT,status,Status,SNT,104271930,179159159.0,9588673.0,"Software as a service, Ethereum Ecosystem, Energi Ecosystem"
WELL,moonwell-artemis,Moonwell,WELL,103088134,142447669.0,3026979.0,"Decentralized Finance (DeFi), Lending/Borrowing Protocols, Moonbeam Ecosystem, Base Ecosystem, Coinbase Ventures Portfolio, Made in USA"
COREUM,coreum,Coreum,COREUM,90782527,90782527.0,692937.0,"Smart Contract Platform, Layer 1 (L1), Osmosis Ecosystem, XRP Ledger Ecosystem"
BNT,bancor,Bancor Network,BNT,88243103,88243103.0,7687340.0,"Decentralized Exchange (DEX), Exchange-based Tokens, Decentralized Finance (DeFi), Automated Market Maker (AMM), Ethereum Ecosystem, DeFiance Capital Portfolio, Energi Ecosystem, Governance"
DBR,debridge,deBridge,DBR,83838434,238559360.0,11326020.0,"Solana Ecosystem, Bridge Governance Tokens, Cross-chain Communication, Intent, Governance"
IQ,everipedia,IQ,IQ,81068904,81068904.0,3284088.0,"Artificial Intelligence (AI), Big Data, Media, BNB Chain Ecosystem, Polygon Ecosystem, Ethereum Ecosystem, AI Agents, GMCI DePIN Index, Galaxy Digital Portfolio, GMCI Index, AI Agent Launchpad, AI Framework, DeFAI"
DKA,dkargo,dKargo,DKA,75254743,75254743.0,2477551.0,Ethereum Ecosystem
MYTH,mythos,Mythos,MYTH,74639453,93719116.0,3282098.0,"Gaming (GameFi), Polkadot Ecosystem, NFT, Avalanche Ecosystem, Ethereum Ecosystem, Base Ecosystem, Gaming Blockchains, Andreessen Horowitz (a16z) Portfolio, YZi Labs (Prev. Binance Labs) Portfolio, Galaxy Digital Portfolio, Made in USA"
ERG,ergo,Ergo,ERG,70756483,84433703.0,280597.0,"Smart Contract Platform, Layer 1 (L1), Proof of Work (PoW), Privacy Blockchain"
MAGIC,magic,Treasure,MAGIC,68620165,75708378.0,37786867.0,"Artificial Intelligence (AI), Gaming (GameFi), NFT, Metaverse, Arbitrum Ecosystem, Ethereum Ecosystem, Layer 2 (L2), Zero Knowledge (ZK), Gaming Blockchains, Gaming Governance Token, Gaming Utility Token, AI Agents, AI Agent Launchpad"
ZKJ,polyhedra-network,Polyhedra Network,ZKJ,63229472,178125125.0,3382213.0,"Smart Contract Platform, BNB Chain Ecosystem, Ethereum Ecosystem, Zero Knowledge (ZK), Animoca Brands Portfolio, YZi Labs (Prev. Binance Labs) Portfolio, OKX Ventures Portfolio, Binance Alpha Spotlight"
NTRN,neutron-3,Neutron,NTRN,61787771,101371056.0,4632917.0,"Binance Launchpool, Osmosis Ecosystem, Delphi Ventures Portfolio"
HIFI,hifi-finance,Hifi Finance,HIFI,59643704,65621631.0,654228341.0,"Tokenized Real Estate, Decentralized Finance (DeFi), Lending/Borrowing Protocols, Ethereum Ecosystem, Real World Assets (RWA), Made in USA, Governance"
DOVU,dovu-2,DOVU,DOVU,54821809,54941215.0,257941.0,"Infrastructure, Ethereum Ecosystem, Regenerative Finance (ReFi), Real World Assets (RWA), Hedera Ecosystem"
ELG,escoin-token,Escoin,ELG,53682696,72855615.0,396870.0,"BNB Chain Ecosystem, Polygon Ecosystem, Ethereum Ecosystem"
ORAI,oraichain-token,Oraichain,ORAI,50473583,51060762.0,961573.0,"Artificial Intelligence (AI), Big Data, Business Services, Smart Contract Platform, Decentralized Finance (DeFi), Oracle, BNB Chain Ecosystem, Solana Ecosystem, Layer 1 (L1), Ethereum Ecosystem, DWF Labs Portfolio, Osmosis Ecosystem, AI Agents"
MAV,maverick-protocol,Maverick Protocol,MAV,48980007,142062943.0,37213961.0,"BNB Chain Ecosystem, Binance Launchpool, Ethereum Ecosystem, ZkSync Ecosystem, Base Ecosystem, Coinbase Ventures Portfolio, Pantera Capital Portfolio, YZi Labs (Prev. Binance Labs) Portfolio, Circle Ventures Portfolio"
KERNEL,kernel-2,KernelDAO,KERNEL,47862453,214943128.0,17650493.0,"Decentralized Finance (DeFi), BNB Chain Ecosystem, Arbitrum Ecosystem, Ethereum Ecosystem, Restaking, Liquid Restaking Governance Tokens"
DEVVE,devve,DevvE,DEVVE,47423606,65119991.0,251909.0,"Exchange-based Tokens, Layer 1 (L1), Ethereum Ecosystem"
CELR,celer-network,Celer Network,CELR,47346935,83867350.0,5166293.0,"Arbitrum Ecosystem, Ethereum Ecosystem, Bridge Governance Tokens, Binance Launchpad, Cross-chain Communication, Pantera Capital Portfolio, Energi Ecosystem, YZi Labs (Prev. Binance Labs) Portfolio"
REX,etherex,Etherex,REX,44961987,152233729.0,1187845.0,"Decentralized Exchange (DEX), Decentralized Finance (DeFi), Linea Ecosystem"
GRIFFAIN,griffain,GRIFFAIN,GRIFFAIN,44010797,44010797.0,6932122.0,"Artificial Intelligence (AI), Solana Ecosystem, Meme, AI Meme, Pump.fun Ecosystem, AI Agent Launchpad, Binance Alpha Spotlight, DeFAI"
BAKE,bakerytoken,BakerySwap,BAKE,39671602,39817994.0,388799121.0,"NFT, BNB Chain Ecosystem, Harmony Ecosystem"
CAW,a-hunters-dream,A Hunters Dream,CAW,38560597,40377589.0,475740.0,"SocialFi, Ethereum Ecosystem"
ROAM,roam-token,ROAM Token,ROAM,36235238,121495687.0,56109545.0,"Retail, BNB Chain Ecosystem, Solana Ecosystem, DePIN"
SYS,syscoin,Syscoin,SYS,35468518,35469095.0,1871347.0,"Smart Contract Platform, Masternodes, Layer 1 (L1), Decentralized Identifier (DID), Layer 2 (L2), Zero Knowledge (ZK), Rollux Ecosystem, DWF Labs Portfolio, Data Availability, Modular Blockchain, Rollup, Proof of Work (PoW)"
HEI,heima,Heima,HEI,35290773,44219763.0,3788133.0,"BNB Chain Ecosystem, Binance Launchpool, Ethereum Ecosystem, YZi Labs (Prev. Binance Labs) Portfolio"
PSP,paraswap,ParaSwap,PSP,32911828,38164013.0,207179.0,"Decentralized Exchange (DEX), Exchange-based Tokens, Decentralized Finance (DeFi), BNB Chain Ecosystem, Polygon Ecosystem, Ethereum Ecosystem, Optimism Ecosystem, Alameda Research Portfolio, Intent, Blockchain Capital Portfolio, Dex Aggregator"
DF,dforce-token,dForce,DF,29421142,29421142.0,1050228.0,"Decentralized Finance (DeFi), BNB Chain Ecosystem, Lending/Borrowing Protocols, Arbitrum Ecosystem, Ethereum Ecosystem, Multicoin Capital Portfolio, Stablecoin Issuer, Energi Ecosystem"
XPLA,xpla,XPLA,XPLA,29173422,70746037.0,1074405.0,"Smart Contract Platform, Gaming (GameFi), NFT, Wallets, Osmosis Ecosystem, Gaming Blockchains, Gaming Platform, Appchains"
OL,open-loot,OPENLOOT,OL,28537749,225869448.0,5309397.0,"Gaming (GameFi), NFT, BNB Chain Ecosystem, Ethereum Ecosystem, Gaming Marketplace"
EVER,everscale,Everscale,EVER,25603000,27304928.0,187823.0,"Infrastructure, Layer 1 (L1), Ethereum Ecosystem"
MLN,melon,Enzyme,MLN,25212491,25212491.0,3999675.0,"Decentralized Finance (DeFi), Asset Manager, Polygon Ecosystem, Arbitrum Ecosystem, Ethereum Ecosystem, Real World Assets (RWA), DeFiance Capital Portfolio"
OMG,omisego,OMG Network,OMG,24233468,24233468.0,1269647.0,"Smart Contract Platform, Ethereum Ecosystem, Alleged SEC Securities, Pantera Capital Portfolio, Boba Network Ecosystem"
CATI,catizen,Catizen,CATI,19218925,93295751.0,12795912.0,"Gaming (GameFi), Play To Earn, Telegram Apps, TON Ecosystem, Tap to Earn"
GEL,gelato,Gelato,GEL,18474931,29947646.0,190399.0,"Smart Contract Platform, Polygon Ecosystem, Fantom Ecosystem, Ethereum Ecosystem, Layer 2 (L2), Modular Blockchain, Rollups-as-a-Service (RaaS), DragonFly Capital Portfolio, Galaxy Digital Portfolio, Binance Alpha Spotlight"
IXS,ix-swap,IXS,IXS,18223415,18223415.0,195815.0,"Polygon Ecosystem, Ethereum Ecosystem, Real World Assets (RWA), Base Ecosystem, DWF Labs Portfolio, Poolz Finance Launchpad, Coinbase Ventures Portfolio"
BLZ,bluzelle,Bluzelle,BLZ,16192331,17206774.0,551748.0,"Smart Contract Platform, BNB Chain Ecosystem, Ethereum Ecosystem, DePIN, Decentralized Science (DeSci), Osmosis Ecosystem, Energi Ecosystem, GMCI DePIN Index, GMCI Index"
VOXEL,voxies,Voxies,VOXEL,15974454,19700268.0,16684121.0,"Gaming (GameFi), NFT, Polygon Ecosystem, Binance Launchpad, RPG, Gaming Utility Token, Strategy Games, YZi Labs (Prev. Binance Labs) Portfolio"
FIO,fio-protocol,FIO Protocol,FIO,15968786,19502083.0,1252883.0,"Smart Contract Platform, Layer 1 (L1), YZi Labs (Prev. Binance Labs) Portfolio"
VICE,vice-2,VICE,VICE,15081492,19205170.0,126793.0,"Gaming (GameFi), Ethereum Ecosystem"
BOSON,boson-protocol,Boson,BOSON,14724343,20351571.0,2619450.0,"NFT, Metaverse, Polygon Ecosystem, Ethereum Ecosystem, Real World Assets (RWA), Animoca Brands Portfolio, Base Ecosystem, RWA Protocol, E-commerce, Outlier Ventures Portfolio"
ATR,artrade,Artrade,ATR,14336853,14381125.0,929044.0,"NFT, Solana Ecosystem, NFT Marketplace, Real World Assets (RWA), Art"
MANEKI,maneki,MANEKI,MANEKI,13542778,13588977.0,5914788.0,"Solana Ecosystem, Meme, Solana Meme, Cat-Themed"
PHNIX,phnix,PHNIX,PHNIX,12338711,13698051.0,346269.0,"Meme, XRP Ledger Ecosystem"
BVT,block-vault,Block Vault,BVT,10526036,31790101.0,236505.0,BNB Chain Ecosystem
BXX,baanx,Baanx,BXX,10139477,10139477.0,30219.0,Ethereum Ecosystem
AA,arai,Arai,AA,9961318,68936458.0,19194125.0,"Artificial Intelligence (AI), Gaming (GameFi), BNB Chain Ecosystem, Animoca Brands Portfolio, Sequoia Capital Portfolio, Binance Alpha Spotlight"
SWELL,layerzero-bridged-swell,Layerzero Bridged Swell,SWELL,8456402,8456402.0,2657.29,"Liquid Staking Governance Tokens, Restaking, Liquid Restaking Governance Tokens, Bridged-Tokens, Swellchain Ecosystem"
HANDY,handy,Handy,HANDY,8157587,15639628.0,54722.0,Ethereum Ecosystem
SNSY,sensay,Sensay,SNSY,7954235,13799467.0,481717.0,"Artificial Intelligence (AI), Arbitrum Ecosystem, Ethereum Ecosystem, Base Ecosystem, AI Agents"
RX,reachx-mainnet,ReachX Mainnet,RX,7735479,15470958.0,26.71,"SocialFi, Meme, Base Ecosystem"
LOKA,league-of-kingdoms,League of Kingdoms,LOKA,7304505,76934826.0,98752.0,"Gaming (GameFi), NFT, Metaverse, Ethereum Ecosystem, Binance Launchpad, Gaming Governance Token, Gaming Utility Token, Strategy Games, Andreessen Horowitz (a16z) Portfolio, YZi Labs (Prev. Binance Labs) Portfolio, Sequoia Capital Portfolio"
HAI,hackenai,Hacken,HAI,7029806,8435713.0,85836.0,"Business Services, BNB Chain Ecosystem, Ethereum Ecosystem, Base Ecosystem, Cybersecurity, VeChain Ecosystem"
BDC,billion-dollar-cat-runes,Billy (Bitcoin),BDC,6843305,6843305.0,17382.96,"Solana Ecosystem, Meme, Cat-Themed, Bitcoin Ecosystem, Runes"
HTR,hathor,Hathor,HTR,6721486,11721025.0,373522.0,"Infrastructure, Smart Contract Platform, Layer 1 (L1), Real World Assets (RWA), Proof of Work (PoW), Directed Acyclic Graph (DAG)"
REF,ref-finance,Ref Finance,REF,6492930,16637029.0,756.85,"Near Protocol Ecosystem, Alameda Research Portfolio, DragonFly Capital Portfolio, OKX Ventures Portfolio"
BCB,bitcoin-bit,Bitcoin Bit,BCB,6437961,31500761.0,4.5,"Ethereum Ecosystem, Proof of Stake (PoS)"
SYNTH,synth-2,Synth,SN50,6357962,6357962.0,7463012.0,"Artificial Intelligence (AI), Bittensor Ecosystem, Bittensor Subnets"
SEXY,settled-ethxy-token,Settled EthXY Token,SEXY,6116810,6116810.0,153619.0,"Gaming (GameFi), Ethereum Ecosystem, Base Ecosystem, Andreessen Horowitz (a16z) Portfolio"
PUSS,puss,Puss,PUSS,5978874,5978874.0,708625.0,"Meme, Tron Ecosystem, TRON Meme"
LVN,levana-protocol,Levana,LVN,5941434,7673640.0,1329.1,"Decentralized Finance (DeFi), Perpetuals, Terra Ecosystem, Injective Ecosystem, Osmosis Ecosystem, Archway Ecosystem"
EAI,eagle-ai,Eagle AI,EAI,5781601,14573209.0,472067.0,"Analytics, Base Ecosystem"
HTM,hatom,Hatom,HTM,5485879,8149121.0,33630.0,"Decentralized Finance (DeFi), Lending/Borrowing Protocols, Meme, MultiversX Ecosystem, Liquid Staking"
NYA,nya,Nya,NYA,5471298,5480707.0,52639.0,"BNB Chain Ecosystem, Avalanche Ecosystem, Polygon Ecosystem, Meme, Arbitrum Ecosystem, Ethereum Ecosystem, Optimism Ecosystem, Base Ecosystem, Cat-Themed"
NRS,nereus-token,Nereus,NRS,5461748,140019104.0,163038.0,"Decentralized Finance (DeFi), Derivatives, Polygon Ecosystem"
ZYPTO,french-connection-finance,Zypto Token,ZYPTO,5191233,5191233.0,48085.0,"Decentralized Finance (DeFi), Wallets, Ethereum Ecosystem, Payment Solutions"
RIZO,hahayes,HahaYes,RIZO,4958190,4958190.0,182026.0,"Solana Ecosystem, Meme, Elon Musk-Inspired, Solana Meme"
CHONKY,chonky,CHONKY,CHONKY,4274553,4274553.0,56596.0,"Solana Ecosystem, Meme, Cat-Themed"
SABAI,sabai-ecovers,Sabai Protocol,SABAI,4206488,20853355.0,125646.0,"Polygon Ecosystem, Ethereum Ecosystem"
MNT,mantle,Mantle,MNT,5685658300,10870432922.0,500595122.0,"Smart Contract Platform, Ethereum Ecosystem, Layer 2 (L2), Mantle Ecosystem, DWF Labs Portfolio, DragonFly Capital Portfolio, GMCI Layer 2 Index, GMCI 30 Index, GMCI Index, World Liberty Financial Portfolio"
XMR,monero,Monero,XMR,5256010253,5256010253.0,90676042.0,"Smart Contract Platform, Privacy, Layer 1 (L1), Proof of Work (PoW), Galaxy Digital Portfolio"
SPX,spx6900,SPX6900,SPX,1371083160,1371083160.0,39867422.0,"Solana Ecosystem, Avalanche Ecosystem, Meme, Ethereum Ecosystem, Base Ecosystem, Bridged-Tokens, Murad Picks, Stock market-themed, 4chan-Themed"
VIRTUAL,virtual-protocol,Virtuals Protocol,VIRTUAL,866323670,1321436272.0,118707898.0,"Artificial Intelligence (AI), Solana Ecosystem, Ethereum Ecosystem, Base Ecosystem, AI Agents, Virtuals Protocol Ecosystem, AI Agent Launchpad, Binance Alpha Spotlight"
SAND,the-sandbox,The Sandbox,SAND,769284468,943576540.0,74139311.0,"Gaming (GameFi), NFT, Metaverse, Polygon Ecosystem, Play To Earn, Harmony Ecosystem, Ethereum Ecosystem, Animoca Brands Portfolio, Alleged SEC Securities, Binance Launchpad, Gaming Utility Token, Simulation Games, Energi Ecosystem, YZi Labs (Prev. Binance Labs) Portfolio, Coinbase 50 Index"
JTO,jito-governance-token,Jito,JTO,747379191,1983358933.0,109698923.0,"Decentralized Finance (DeFi), Solana Ecosystem, Liquid Staking Governance Tokens, Multicoin Capital Portfolio, Alameda Research Portfolio, Delphi Ventures Portfolio, Liquid Staking, Made in USA"
MORPHO,morpho,Morpho,MORPHO,725123934,2187965598.0,30199256.0,"Decentralized Finance (DeFi), Lending/Borrowing Protocols, Arbitrum Ecosystem, Ethereum Ecosystem, Base Ecosystem, Coinbase Ventures Portfolio, Pantera Capital Portfolio, Morpho Ecosystem, Binance Alpha Spotlight, Katana Ecosystem"
JASMY,jasmycoin,JasmyCoin,JASMY,724925051,748580185.0,39653672.0,"Internet of Things (IOT), Ethereum Ecosystem, DePIN, DWF Labs Portfolio, Coinbase 50 Index"
DOGE,binance-peg-dogecoin,Binance-Peg Dogecoin,DOGE,702777001,702777001.0,6846161.0,"BNB Chain Ecosystem, Avalanche Ecosystem, Meme, Binance-Peg Tokens"
STRK,starknet,Starknet,STRK,553697617,1358057287.0,27037557.0,"Infrastructure, Smart Contract Platform, Ethereum Ecosystem, Layer 2 (L2), Zero Knowledge (ZK), Starknet Ecosystem, Paradigm Portfolio, Coinbase Ventures Portfolio, Rollup, Multicoin Capital Portfolio, Alameda Research Portfolio, Pantera Capital Portfolio, GMCI Layer 2 Index, Consensys Portfolio, Sequoia Capital Portfolio, GMCI Index, Polychain Capital Portfolio"
RUNE,thorchain,THORChain,RUNE,464671307,562641256.0,38269718.0,"Decentralized Exchange (DEX), Infrastructure, Smart Contract Platform, Exchange-based Tokens, Decentralized Finance (DeFi), Bridge Governance Tokens, Multicoin Capital Portfolio, Proof of Stake (PoS), Delphi Ventures Portfolio"
XCN,chain-2,Onyxcoin,XCN,439949728,607794311.0,59407921.0,"Smart Contract Platform, BNB Chain Ecosystem, Layer 1 (L1), Ethereum Ecosystem, Base Ecosystem, Proof of Stake (PoS), Pantera Capital Portfolio, Made in USA"
XEC,ecash,eCash,XEC,407969527,407972343.0,7732377.0,"Smart Contract Platform, Layer 1 (L1), Bitcoin Fork, Proof of Work (PoW)"
AMP,amp-token,Amp,AMP,296656734,351027759.0,14431665.0,"Decentralized Finance (DeFi), Near Protocol Ecosystem, Ethereum Ecosystem, Payment Solutions, Alleged SEC Securities, Pantera Capital Portfolio, Energi Ecosystem, Made in USA"
POPCAT,popcat,Popcat,POPCAT,283963574,283963574.0,31063613.0,"Solana Ecosystem, Meme, Solana Meme, Cat-Themed, Murad Picks"
GRASS,grass,Grass,GRASS,253964004,827120216.0,38352134.0,"Artificial Intelligence (AI), Solana Ecosystem, DePIN, Polychain Capital Portfolio, Binance Alpha Spotlight"
OM,mantra-dao,MANTRA,OM,235920100,375890757.0,37902708.0,"Infrastructure, Smart Contract Platform, BNB Chain Ecosystem, Cosmos Ecosystem, Layer 1 (L1), Polygon Ecosystem, Ethereum Ecosystem, Real World Assets (RWA), Base Ecosystem, Osmosis Ecosystem, Mantra Ecosystem"
ZRX,0x,0x Protocol,ZRX,234104918,275938079.0,20175415.0,"Decentralized Exchange (DEX), Decentralized Finance (DeFi), Avalanche Ecosystem, Harmony Ecosystem, Ethereum Ecosystem, Coinbase Ventures Portfolio, Pantera Capital Portfolio, Energi Ecosystem, GMCI DeFi Index, Blockchain Capital Portfolio, GMCI Index, Made in USA, Governance"
ORDI,ordinals,ORDI,ORDI,215154753,215154753.0,45294143.0,"Solana Ecosystem, BRC-20, Bitcoin Ecosystem, Inscriptions"
GOMINING,gmt-token,GoMining Token,GOMINING,206589410,206589410.0,15553099.0,"Gaming (GameFi), BNB Chain Ecosystem, Ethereum Ecosystem, TON Ecosystem"
ASTR,astar,Astar,ASTR,202527333,210956442.0,12731645.0,"Smart Contract Platform, Polkadot Ecosystem, Layer 1 (L1), Ethereum Ecosystem, Layer 2 (L2), Alameda Research Portfolio, YZi Labs (Prev. Binance Labs) Portfolio, OKX Ventures Portfolio"
NOT,notcoin,Notcoin,NOT,196121682,202084817.0,31624072.0,"Gaming (GameFi), Binance Launchpool, Meme, Play To Earn, TON Ecosystem, TON Meme, Tap to Earn"
SOSO,sosovalue,SoSoValue,SOSO,184735430,672335887.0,7012317.0,"Index, Decentralized Finance (DeFi), Analytics, Ethereum Ecosystem, Base Ecosystem"
XPR,proton,XPR Network,XPR,184692046,204011424.0,4159210.0,"Smart Contract Platform, BNB Chain Ecosystem, Ethereum Ecosystem, DWF Labs Portfolio, Made in USA, Governance"
ETHW,ethereum-pow-iou,EthereumPoW,ETHW,179964559,179964559.0,12030969.0,"Smart Contract Platform, EthereumPoW Ecosystem, Proof of Work (PoW)"
SVL,slash-vision-labs,Slash Vision Labs,SVL,177998649,360347397.0,761128.0,"Mantle Ecosystem, Payment Solutions"
SKL,skale,SKALE,SKL,172619113,175961021.0,23526623.0,"Smart Contract Platform, Gaming (GameFi), Layer 1 (L1), Ethereum Ecosystem, Modular Blockchain, Account Abstraction, Multicoin Capital Portfolio, Gaming Blockchains, Gaming Utility Token, Skale Ecosystem, Consensys Portfolio, Galaxy Digital Portfolio, Made in USA"
SUSHI,sushi,Sushi,SUSHI,162917834,241797149.0,28983805.0,"Decentralized Exchange (DEX), Exchange-based Tokens, Decentralized Finance (DeFi), Yield Farming, Automated Market Maker (AMM), BNB Chain Ecosystem, Yearn Ecosystem, Solana Ecosystem, Avalanche Ecosystem, Polygon Ecosystem, Near Protocol Ecosystem, Fantom Ecosystem, Harmony Ecosystem, Arbitrum Ecosystem, Celo Ecosystem, Ethereum Ecosystem, Base Ecosystem, Alameda Research Portfolio, Pantera Capital Portfolio, Energi Ecosystem, Sora Ecosystem, Blockchain Capital Portfolio, Governance"
