NFP,nfprompt-token,NFPrompt,NFP,16311628,30493669.0,3391907.0,"BNB Chain Ecosystem, Binance Launchpool, YZi Labs (Prev. Binance Labs) Portfolio, Governance"
HOPR,hopr,HOPR,HOPR,15966438,16726931.0,127294.0,"Privacy Coins, Gnosis Chain Ecosystem, Ethereum Ecosystem, DePIN, YZi Labs (Prev. Binance Labs) Portfolio, Governance"
GUN,gunz,Gunz,GUN,15891870,122994153.0,3053807.0,"Smart Contract Platform, Gaming (GameFi), Binance Launchpool, Solana Ecosystem, Layer 1 (L1), Avalanche Ecosystem, Play To Earn, Shooting Games, Coinbase Ventures Portfolio, Gaming Blockchains, Avalanche L1, YZi Labs (Prev. Binance Labs) Portfolio, Delphi Ventures Portfolio, Action Games, GUNZ Ecosystem"
BITBOARD,bitboard,BitBoard,BB,15438935,23337031.0,525675.0,"Smart Contract Platform, Polygon Ecosystem, Layer 2 (L2), Zero Knowledge (ZK)"
READY,ready,READY!,READY,15184663,15184663.0,135329.0,"Gaming (GameFi), Solana Ecosystem, Gaming Platform"
ZND,znd-token,ZND Token,ZND,14747927,56239072.0,2697261.0,"Exchange-based Tokens, Centralized Exchange (CEX) Token, Ethereum Ecosystem"
PYR,vulcan-forged,Vulcan Forged,PYR,14261152,29837917.0,16255184.0,"Gaming (GameFi), NFT, Metaverse, Polygon Ecosystem, Ethereum Ecosystem, DWF Labs Portfolio, Gaming Blockchains, Gaming Platform, Action Games, MMO"
TUNA,defituna,DefiTuna,TUNA,13048714,46354223.0,199073.0,"Decentralized Exchange (DEX), Exchange-based Tokens, Decentralized Finance (DeFi), Automated Market Maker (AMM), Lending/Borrowing Protocols, Solana Ecosystem"
UXLINK,uxlink,UXLINK,UXLINK,12879813,21202378.0,2468839.0,"SocialFi, Ethereum Ecosystem"
LAZIO,lazio-fan-token,Lazio Fan Token,LAZIO,12040284,39727344.0,1799376.0,"Sports, BNB Chain Ecosystem, Fan Token, Binance Launchpad"
POLS,polkastarter,Polkastarter,POLS,10623628,10708263.0,1395224.0,"Decentralized Finance (DeFi), BNB Chain Ecosystem, Launchpad, Ethereum Ecosystem"
LADYS,milady-meme-coin,Milady Meme Coin,LADYS,10443569,10443569.0,1334497.0,"Meme, Arbitrum Ecosystem, Ethereum Ecosystem, DWF Labs Portfolio, 4chan-Themed"
AMO,amo,AMO Coin,AMO,9768516,9768516.0,87241.0,"Big Data, Kaia Ecosystem"
GFAL,games-for-a-living,Games for a Living,GFAL,9677600,18421536.0,108527.0,"Gaming (GameFi), NFT, BNB Chain Ecosystem, Play To Earn"
KRL,kryll,KRYLL,KRL,8386972,10298349.0,137588.0,"Artificial Intelligence (AI), Decentralized Finance (DeFi), Analytics, Arbitrum Ecosystem, Ethereum Ecosystem, Optimism Ecosystem, Base Ecosystem, AI Applications"
MIGGLES,mister-miggles,Mr. Miggles,MIGGLES,8367390,8367390.0,1263623.0,"Meme, Base Ecosystem, Cat-Themed, Base Meme, Made in USA, IP Meme"
REEF,reef,Reef,REEF,8194409,8194409.0,1441997.0,"BNB Chain Ecosystem, Binance Launchpool, Layer 1 (L1), Harmony Ecosystem, Ethereum Ecosystem, Alameda Research Portfolio, Energi Ecosystem, Sora Ecosystem, YZi Labs (Prev. Binance Labs) Portfolio, GMCI Layer 1 Index, GMCI Index"
BKN,brickken,Brickken,BKN,7920151,15859556.0,508509.0,"Tokenized Real Estate, BNB Chain Ecosystem, Impossible Finance Launchpad, Ethereum Ecosystem, Real World Assets (RWA), RWA Protocol"
BEAM,beam,BEAM,BEAM,6427204,8861719.0,88196.0,"Smart Contract Platform, Privacy Coins, Ethereum Ecosystem, Proof of Work (PoW), BeamPrivacy Ecosystem, Privacy Blockchain"
RWA,allo,Allo,RWA,6261620,34786777.0,1072211.0,"BNB Chain Ecosystem, Real World Assets (RWA), RWA Protocol, Binance Wallet IDO"
SEAM,seamless-protocol,Seamless Protocol,SEAM,6184683,14707279.0,163808.0,"Decentralized Finance (DeFi), Lending/Borrowing Protocols, Ethereum Ecosystem, Base Ecosystem"
ZKP,panther,Panther Protocol,ZKP,4676252,4676252.0,412108.0,"Smart Contract Platform, Privacy Coins, Polygon Ecosystem, Ethereum Ecosystem, Zero Knowledge (ZK), Base Ecosystem"
PAID,paid-network,PAID,PAID,4470249,4856090.0,164863.0,"Launchpad, Base Ecosystem"
MLT,media-licensing-token,Media Licensing Token,MLT,4465260,6100021.0,30033.0,"BNB Chain Ecosystem, Metaverse, Ethereum Ecosystem"
KIBSHI,kiboshib,KiboShib,KIBSHI,4194614,4194614.0,96508.0,"Solana Ecosystem, Meme, Arbitrum Ecosystem, Ethereum Ecosystem, Base Ecosystem, Dog-Themed, AI Meme"
FARTCOIN,based-fartcoin,Based Fartcoin,FARTCOIN,4040797,4040797.0,56528.0,"Meme, Base Ecosystem, Base Meme, Clanker Ecosystem"
CLEAR,everclear,Everclear,CLEAR,4018163,7337082.0,23691.0,"Infrastructure, BNB Chain Ecosystem, Polygon Ecosystem, Gnosis Chain Ecosystem, Arbitrum Ecosystem, Ethereum Ecosystem, Optimism Ecosystem, Coinbase Ventures Portfolio, Cross-chain Communication, Chain Abstraction"
BCUT,bitscrunch-token,bitsCrunch Token,BCUT,3978320,6518417.0,480409.0,"Artificial Intelligence (AI), Infrastructure, Analytics, NFT, Polygon Ecosystem, Ethereum Ecosystem, Animoca Brands Portfolio, Coinbase Ventures Portfolio"
ZCX,unizen,Unizen,ZCX,3709958,5397967.0,86130.0,"Decentralized Exchange (DEX), Exchange-based Tokens, Decentralized Finance (DeFi), Polygon Ecosystem, Ethereum Ecosystem, DWF Labs Portfolio"
INTER,inter-milan-fan-token,Inter Milan Fan Token,INTER,3517987,3517987.0,518307.0,"Sports, Fan Token, Chiliz Ecosystem"
TRUF,truflation,TRUF.Network,TRUF,3441775,7963244.0,392520.0,"Infrastructure, Oracle, Solana Ecosystem, Arbitrum Ecosystem, Ethereum Ecosystem, Real World Assets (RWA), Base Ecosystem, Coinbase Ventures Portfolio, Governance"
STOS,stratos,Stratos,STOS,3428919,7028312.0,141871.0,"Entertainment, Infrastructure, Smart Contract Platform, Storage, Layer 1 (L1), Ethereum Ecosystem, DePIN, Osmosis Ecosystem"
WUF,wuffi,WUFFI,WUF,3095542,3095542.0,14113.42,"Solana Ecosystem, Meme, Base Ecosystem"
AZIT,azit,azit,AZIT,3017020,3948910.0,178259.0,"Kaia Ecosystem, Payment Solutions"
GMEE,gamee,GAMEE,GMEE,2692523,6276714.0,402022.0,"Gaming (GameFi), NFT, BNB Chain Ecosystem, Play To Earn, Ethereum Ecosystem, Telegram Apps, Animoca Brands Portfolio, TON Ecosystem, Gaming Platform, YZi Labs (Prev. Binance Labs) Portfolio, Arcade Games"
RETARDIO,retardio,RETARDIO,RETARDIO,2601224,2601224.0,624863.0,"NFT, Solana Ecosystem, Meme, Solana Meme, Murad Picks, 4chan-Themed, TikTok Meme"
NRG,energi,Energi,NRG,2441231,2469218.0,139267.0,"Smart Contract Platform, Masternodes, Layer 1 (L1), Ethereum Ecosystem, Proof of Stake (PoS), Energi Ecosystem"
SBR,saber,Saber,SBR,2213677,2998903.0,47139.0,"Decentralized Exchange (DEX), Exchange-based Tokens, Decentralized Finance (DeFi), Yield Farming, Automated Market Maker (AMM), Solana Ecosystem, Multicoin Capital Portfolio"
TSUKA,dejitaru-tsuka,Dejitaru Tsuka,TSUKA,2164019,2164019.0,206954.0,"Meme, Ethereum Ecosystem"
LNQ,linqai,LinqAI,LNQ,2063933,6008131.0,429209.0,"Artificial Intelligence (AI), Ethereum Ecosystem"
GURU,guru,Guru,GURU,1745217,1745217.0,9895.59,"Decentralized Finance (DeFi), Ethereum Ecosystem"
BST,blocksquare,Blocksquare,BST,1725733,1725733.0,102222.0,"Tokenized Real Estate, Ethereum Ecosystem, Real World Assets (RWA)"
MAS,massa,Massa,MAS,1711857,4866833.0,210449.0,"Smart Contract Platform, Layer 1 (L1), Massa Ecosystem"
EFFECT,effect-ai,Effect AI,EFFECT,1709891,2677975.0,8035.59,"Artificial Intelligence (AI), Business Services, Solana Ecosystem"
DYNA,dynachain,Dynachain,DYNA,1527757,4514748.0,23101.0,"Healthcare, BNB Chain Ecosystem"
BGB,bitget-token,Bitget Token,BGB,2484169867,3264917851.0,57668537.0,"Exchange-based Tokens, Centralized Exchange (CEX) Token, Ethereum Ecosystem, DragonFly Capital Portfolio, Morph L2 Ecosystem, Made in China"
XAUT,tether-gold,Tether Gold,XAUT,2109459312,2109459312.0,259593280.0,"Stablecoins, Tokenized Assets, Tokenized Gold, Ethereum Ecosystem, Real World Assets (RWA), Tokenized Commodities"
QNT,quant-network,Quant,QNT,1127042177,1132336114.0,23913245.0,"Ethereum Ecosystem, Real World Assets (RWA), Energi Ecosystem, Coinbase 50 Index"
JST,just,JUST,JST,371913472,371913472.0,13840990.0,"Decentralized Finance (DeFi), Tron Ecosystem"
PENDLE,pendle,Pendle,PENDLE,364459278,623027078.0,37003703.0,"Decentralized Exchange (DEX), Exchange-based Tokens, Decentralized Finance (DeFi), Yield Farming, Automated Market Maker (AMM), BNB Chain Ecosystem, Derivatives, Arbitrum Ecosystem, Ethereum Ecosystem, Optimism Ecosystem, Fixed Interest, LSDFi, Base Ecosystem, Restaking, LRTfi, Liquid Restaking Governance Tokens, Berachain Ecosystem, Yield Tokenization Protocol, YZi Labs (Prev. Binance Labs) Portfolio, GMCI DeFi Index, Sonic Ecosystem, Liquid Staking, GMCI Index, BTCfi Protocol, HyperEVM Ecosystem"
DOGWIFHAT,dogwifcoin,dogwifhat,WIF,337206975,337206975.0,150244890.0,"Solana Ecosystem, Meme, Dog-Themed, Solana Meme, GMCI Meme Index, GMCI Index, Unichain Ecosystem"
APEPE,ape-and-pepe,Ape and Pepe,APEPE,318387058,318387058.0,26257530.0,"Polygon Ecosystem, Meme, Frog-Themed, The Boys Club"
ZBCN,zebec-network,Zebec Network,ZBCN,301341153,314320536.0,16020037.0,"Decentralized Finance (DeFi), Solana Ecosystem, Real World Assets (RWA), Payment Solutions, DePIN, Coinbase Ventures Portfolio, Alameda Research Portfolio, Circle Ventures Portfolio, OKX Ventures Portfolio, RWA Protocol, Made in USA"
1INCH,1inch,1INCH,1INCH,261485746,280194038.0,57366856.0,"Decentralized Exchange (DEX), Exchange-based Tokens, Decentralized Finance (DeFi), Automated Market Maker (AMM), BNB Chain Ecosystem, Ethereum Ecosystem, Base Ecosystem, FTX Holdings, Alameda Research Portfolio, DragonFly Capital Portfolio, Pantera Capital Portfolio, YZi Labs (Prev. Binance Labs) Portfolio, GMCI DeFi Index, Galaxy Digital Portfolio, Blockchain Capital Portfolio, Dex Aggregator, GMCI Index, Coinbase 50 Index, Governance"
FLUID,instadapp,Fluid,FLUID,244982493,316154543.0,8937509.0,"Decentralized Finance (DeFi), Solana Ecosystem, Polygon Ecosystem, Arbitrum Ecosystem, Ethereum Ecosystem, Base Ecosystem, Coinbase Ventures Portfolio, Pantera Capital Portfolio, Binance Alpha Spotlight, Plasma Ecosystem"
ATH,aethir,Aethir,ATH,235389894,659122326.0,14876225.0,"Solana Ecosystem, Arbitrum Ecosystem, Impossible Finance Launchpad, Ethereum Ecosystem, DePIN, Animoca Brands Portfolio, Binance Alpha Spotlight"
ZORA,zora,Zora,ZORA,230876815,516502942.0,49909232.0,"Infrastructure, Media, Smart Contract Platform, SocialFi, NFT, Launchpad, Layer 2 (L2), Base Ecosystem, Coinbase Ventures Portfolio, Zora Ecosystem, Binance Alpha Spotlight"
SOON,soon-2,SOON,SOON,212460103,585915136.0,36772736.0,"Infrastructure, Smart Contract Platform, BNB Chain Ecosystem, Layer 2 (L2), Base Ecosystem, Cross-chain Communication, Binance Alpha Spotlight"
ZANO,zano,Zano,ZANO,200343536,200344921.0,1356696.0,"Smart Contract Platform, Privacy Coins, Layer 1 (L1), Proof of Stake (PoS), Proof of Work (PoW), Zano Ecosystem, Privacy Blockchain"
PROM,prometeus,Prom,PROM,166748568,175885475.0,4409593.0,"Smart Contract Platform, BNB Chain Ecosystem, Ethereum Ecosystem, Layer 2 (L2)"
SFP,safepal,SafePal,SFP,152746937,152746937.0,3063134.0,"BNB Chain Ecosystem, Wallets, Ethereum Ecosystem, Animoca Brands Portfolio, Binance Launchpad, Energi Ecosystem, YZi Labs (Prev. Binance Labs) Portfolio"
XVG,verge,Verge,XVG,120251139,120491676.0,37594931.0,"Smart Contract Platform, Privacy Coins, Proof of Work (PoW), Made in USA"
ROSE,oasis-network,Oasis,ROSE,115837019,154784385.0,6745370.0,"Smart Contract Platform, BNB Chain Ecosystem, Layer 1 (L1), Proof of Stake (PoS), Pantera Capital Portfolio, Andreessen Horowitz (a16z) Portfolio, YZi Labs (Prev. Binance Labs) Portfolio, Blockchain Capital Portfolio, Privacy Blockchain, Polychain Capital Portfolio, Coinbase 50 Index"
VTHO,vethor-token,VeThor,VTHO,92844534,92858040.0,1762418.0,"Layer 1 (L1), VeChain Ecosystem"
XCH,chia,Chia,XCH,92100477,207819788.0,5291721.0,"Smart Contract Platform, Layer 1 (L1), DePIN, Andreessen Horowitz (a16z) Portfolio, Made in USA"
ZIG,zignaly,ZIGChain,ZIG,77142027,106981751.0,3299392.0,"Artificial Intelligence (AI), Smart Contract Platform, BNB Chain Ecosystem, Solana Ecosystem, Layer 1 (L1), Polygon Ecosystem, Ethereum Ecosystem, DWF Labs Portfolio, Injective Ecosystem, OKX Ventures Portfolio"
RED,redstone-oracles,RedStone,RED,74992328,254965898.0,18734304.0,"Infrastructure, Oracle, Binance Launchpool, Ethereum Ecosystem, Real World Assets (RWA), Base Ecosystem"
WAVES,waves,Waves,WAVES,63477513,63477513.0,8775349.0,"Smart Contract Platform, DWF Labs Portfolio, Proof of Stake (PoS)"
DAG,constellation-labs,Constellation,DAG,53095273,53095273.0,1190217.0,"Smart Contract Platform, Layer 1 (L1), Layer 0 (L0), Made in USA, Directed Acyclic Graph (DAG)"
MANTA,manta-network,Manta Network,MANTA,51610168,114311335.0,23598788.0,"Smart Contract Platform, Polkadot Ecosystem, Binance Launchpool, Layer 2 (L2), Manta Network Ecosystem, Multicoin Capital Portfolio, Alameda Research Portfolio, DeFiance Capital Portfolio, YZi Labs (Prev. Binance Labs) Portfolio"
DYM,dymension,Dymension,DYM,48702743,118406782.0,130748203.0,"Smart Contract Platform, Cosmos Ecosystem, Modular Blockchain, Osmosis Ecosystem, Rollups-as-a-Service (RaaS)"
SHX,stronghold-token,Stronghold,SHX,45729613,,1057496.0,"Ethereum Ecosystem, Stellar Ecosystem, Made in USA"
FIDA,bonfida,Bonfida,FIDA,44305323,44711705.0,2931975.0,"Big Data, Business Services, Infrastructure, Decentralized Finance (DeFi), Solana Ecosystem, FTX Holdings, DWF Labs Portfolio, Name Service"
OSAK,osaka-protocol,Osaka Protocol,OSAK,43204749,43204749.0,41133.0,"BNB Chain Ecosystem, Solana Ecosystem, Avalanche Ecosystem, Polygon Ecosystem, Meme, Arbitrum Ecosystem, Ethereum Ecosystem, Optimism Ecosystem, Base Ecosystem, Dog-Themed"
BIGTIME,big-time,Big Time,BIGTIME,42954366,112549397.0,7268134.0,"Gaming (GameFi), Play To Earn, Ethereum Ecosystem, RPG, Alameda Research Portfolio, Circle Ventures Portfolio, OKX Ventures Portfolio, MMO"
LQTY,liquity,Liquity,LQTY,41636847,42510583.0,6187989.0,"Decentralized Finance (DeFi), Arbitrum Ecosystem, Ethereum Ecosystem, Alameda Research Portfolio, Pantera Capital Portfolio"
STEEM,steem,Steem,STEEM,38362516,38364232.0,11998596.0,SocialFi
SAI,sai,Sai,SAI,38356935,38356935.0,7259.02,"Decentralized Finance (DeFi), Ethereum Ecosystem"
TAIKO,taiko,Taiko,TAIKO,37052532,191635794.0,5388817.0,"Smart Contract Platform, BNB Chain Ecosystem, Ethereum Ecosystem, Layer 2 (L2), Zero Knowledge (ZK), Rollup, OKX Ventures Portfolio, Centralized Exchange (CEX) Product, Binance Alpha Spotlight"
OOBIT,oobit-2,Oobit,OOB,34534286,138137144.0,3313670.0,"Solana Ecosystem, Payment Solutions"
JOE,joe,JOE,JOE,29583266,37051880.0,2504608.0,"Decentralized Exchange (DEX), Exchange-based Tokens, Decentralized Finance (DeFi), Yield Farming, Automated Market Maker (AMM), BNB Chain Ecosystem, Avalanche Ecosystem, Launchpad, Arbitrum Ecosystem, Mantle Ecosystem, DeFiance Capital Portfolio, Delphi Ventures Portfolio, Dex Aggregator"
REZ,renzo,Renzo,REZ,29109419,63878996.0,8056416.0,"Decentralized Finance (DeFi), Binance Launchpool, Ethereum Ecosystem, Base Ecosystem, Restaking, YZi Labs (Prev. Binance Labs) Portfolio, OKX Ventures Portfolio"
XRD,radix,Radix,XRD,27423870,27423939.0,528.22,"Smart Contract Platform, Layer 1 (L1), DWF Labs Portfolio, Radix Ecosystem"
IXT,ix-token,Planet IX,IXT,23719383,23774714.0,68645.0,"Gaming (GameFi), NFT, Metaverse, Polygon Ecosystem, Play To Earn, Gaming Governance Token, Gaming Utility Token, Strategy Games"
AITECH,solidus-aitech,Solidus Ai Tech,AITECH,23034093,26623096.0,7425805.0,"Artificial Intelligence (AI), BNB Chain Ecosystem, Solana Ecosystem, Launchpad, Base Ecosystem, ChainGPT Launchpad, AI Agents, Binance Alpha Spotlight, DeFAI"
MBL,moviebloc,MovieBloc,MBL,22956297,36369509.0,3815483.0,DWF Labs Portfolio
OGN,origin-protocol,Origin Token,OGN,22857002,49645223.0,2837685.0,"Decentralized Finance (DeFi), NFT, Ethereum Ecosystem, Base Ecosystem, Pantera Capital Portfolio, Sonic Ecosystem, Liquid Staking, Made in USA"
ANYONE,airtor-protocol,ANyONe Protocol,ANYONE,22281857,27874032.0,674619.0,"Smart Contract Platform, Privacy Coins, Ethereum Ecosystem, DePIN, Base Ecosystem, Privacy Blockchain, Peaq Ecosystem"
WCT,connect-token-wct,WalletConnect Token,WCT,21462137,115263795.0,32585846.0,"Binance Launchpool, Solana Ecosystem, Wallets, Ethereum Ecosystem, Optimism Ecosystem, Base Ecosystem"
PARTI,particle-network,Particle Network,PARTI,21193410,90958840.0,148264567.0,"Decentralized Finance (DeFi), BNB Chain Ecosystem, Layer 1 (L1), Base Ecosystem, Account Abstraction, Cross-chain Communication, Binance HODLer Airdrops, Chain Abstraction, Binance Wallet IDO"
DIAM,diam,DIAM,DIAM,19422671,58927213.0,1936254.0,"Smart Contract Platform, Layer 1 (L1)"
ZETA,zeta,Zeta,ZEX,16123431,85868069.0,474462.0,"Decentralized Finance (DeFi), Derivatives, Perpetuals, Solana Ecosystem"
DAO,dao-maker,DAO Maker,DAO,16053041,17754654.0,615297.0,"BNB Chain Ecosystem, Solana Ecosystem, Launchpad, DaoMaker Launchpad, Arbitrum Ecosystem, Ethereum Ecosystem, Step Network Ecosystem, Governance"
SD,stader,Stader,SD,15470201,28140951.0,2900637.0,"BNB Chain Ecosystem, Solana Ecosystem, Polygon Ecosystem, Fantom Ecosystem, Ethereum Ecosystem, Liquid Staking Governance Tokens, Animoca Brands Portfolio, Coinbase Ventures Portfolio, Pantera Capital Portfolio, Liquid Staking, Binance Alpha Spotlight"
NATIX,natix-network,NATIX Network,NATIX,15017835,36831249.0,254563.0,"Artificial Intelligence (AI), Internet of Things (IOT), Solana Ecosystem, DePIN, Robotics"
RIO,realio-network,Realio Network Token,RIO,13826057,13826057.0,859352.0,"BNB Chain Ecosystem, Solana Ecosystem, Ethereum Ecosystem, Algorand Ecosystem, Real World Assets (RWA), Base Ecosystem, Osmosis Ecosystem, Stellar Ecosystem, Made in USA"
VIC,tomochain,Viction,VIC,13330823,22685389.0,1013096.0,"Smart Contract Platform, Masternodes, Layer 1 (L1), DWF Labs Portfolio"
OBT,orbiter-finance,Orbiter Finance,OBT,13127409,26254818.0,2405360.0,"BNB Chain Ecosystem, Arbitrum Ecosystem, Ethereum Ecosystem, Bridge Governance Tokens, Base Ecosystem, Cross-chain Communication, OKX Ventures Portfolio"
RSS3,rss3,RSS3,RSS3,12848930,15142552.0,1649435.0,"Artificial Intelligence (AI), Infrastructure, Storage, Ethereum Ecosystem, Coinbase Ventures Portfolio, DragonFly Capital Portfolio, RSS3 VSL Ecosystem, AI Framework, DeFAI"
SUNDOG,sundog,Sundog,SUNDOG,11864106,11864106.0,8444611.0,"Meme, Tron Ecosystem, Sun Pump Ecosystem, TRON Meme, Binance Alpha Spotlight"
VOW,vow,Vow,VOW,11762872,39484065.0,126307.0,"Retail, Tourism, BNB Chain Ecosystem, Ethereum Ecosystem"
LOCK,houdini-swap,Houdini Swap,LOCK,10807702,10807702.0,58623.0,"Privacy Coins, Solana Ecosystem, Ethereum Ecosystem"
MLC,my-lovely-coin,My Lovely Coin,MLC,10767968,27673709.0,111420.0,"Charity, Gaming (GameFi), BNB Chain Ecosystem, Solana Ecosystem, Polygon Ecosystem, Gaming Utility Token"
ATS,alltoscan,Alltoscan,ATS,10071007,14744123.0,142133.0,"BNB Chain Ecosystem, Layer 1 (L1)"
OGY,origyn-foundation,ORIGYN,OGY,10057003,12762045.0,261635.0,"Internet Computer Ecosystem, Real World Assets (RWA), RWA Protocol"
BOOE,book-of-ethereum,Book of Ethereum,BOOE,9856969,9856969.0,92551.0,"Meme, Ethereum Ecosystem"
MCB,mcdex,MUX Protocol,MCB,9488875,11983885.0,295.17,"Decentralized Exchange (DEX), Exchange-based Tokens, Decentralized Finance (DeFi), BNB Chain Ecosystem, Derivatives, Perpetuals, Arbitrum Ecosystem, Ethereum Ecosystem, Multicoin Capital Portfolio, Alameda Research Portfolio, DeFiance Capital Portfolio, Delphi Ventures Portfolio, OKX Ventures Portfolio"
VINU,vita-inu,Vita Inu,VINU,9435650,9435650.0,807671.0,"BNB Chain Ecosystem, Meme, Dog-Themed, DWF Labs Portfolio, Binance Alpha Spotlight"
HASHAI,hashai,HashAI,HASHAI,8856797,9405531.0,303761.0,"Analytics, Ethereum Ecosystem, DePIN"
VSC,vyvo-smart-chain,Vyvo Smart Chain,VSC,8538121,39182239.0,109819.0,"Smart Contract Platform, BNB Chain Ecosystem, Polygon Ecosystem, Layer 2 (L2)"
NMT,netmind-token,NetMind Token,NMT,8233027,21516454.0,1507738.0,"Artificial Intelligence (AI), BNB Chain Ecosystem, Ethereum Ecosystem, DePIN, AI Agents"
MEMEFI,memefi-2,MemeFi,MEMEFI,7962881,7962881.0,4435953.0,"Gaming (GameFi), NFT, Meme, Play To Earn, Sui Ecosystem, Telegram Apps, Tap to Earn, Sui Meme, Action Games"
SUKU,suku,SUKU,SUKU,7646456,21657774.0,240173.0,"Solana Ecosystem, Polygon Ecosystem, Ethereum Ecosystem, Made in USA"
NUM,numbers-protocol,Numbers Protocol,NUM,7076828,7161249.0,954305.0,"Artificial Intelligence (AI), Smart Contract Platform, BNB Chain Ecosystem, DaoMaker Launchpad, Ethereum Ecosystem, Avalanche L1, YZi Labs (Prev. Binance Labs) Portfolio, Outlier Ventures Portfolio"
PMT,public-meme-token,Public Masterpiece Token,PMT,6939096,35181013.0,305546.0,"NFT, BNB Chain Ecosystem, Real World Assets (RWA), NFTFi"
LINGO,lingo,Lingo,LINGO,5860212,5860478.0,256823.0,"Solana Ecosystem, Real World Assets (RWA), Base Ecosystem, RWA Protocol"
EPT,balance,Balance,EPT,5762413,24874619.0,6533241.0,"Gaming (GameFi), BNB Chain Ecosystem, Animoca Brands Portfolio, DWF Labs Portfolio, AI Agents, Andreessen Horowitz (a16z) Portfolio, AI Agent Launchpad"
CRTS,cratos,Cratos,CRTS,5751239,9048486.0,205360.0,"SocialFi, BNB Chain Ecosystem, Ethereum Ecosystem, Governance"
CA,ca-htb,Coupon Assets,CA,5511160,80904321.0,463714.0,"Retail, Ethereum Ecosystem"
HMT,human-protocol,HUMAN Protocol,HMT,5462727,7208033.0,135169.0,"Artificial Intelligence (AI), Infrastructure, Software as a service, Polygon Ecosystem, Ethereum Ecosystem, Market-Making Solution, AI Framework"
FHE,mind-network,Mind Network,FHE,5163963,20738806.0,3658074.0,"Artificial Intelligence (AI), Smart Contract Platform, BNB Chain Ecosystem, Layer 2 (L2), Binance Wallet IDO"
PEAR,pear-protocol,Pear Protocol,PEAR,5159241,17095242.0,14117.58,"Decentralized Exchange (DEX), Exchange-based Tokens, Decentralized Finance (DeFi), Perpetuals, Arbitrum Ecosystem"
MFT,mainframe,Mainframe,MFT,5008691,5336028.0,0.985518,"Ethereum Ecosystem, Energi Ecosystem"
NLS,nolus,Nolus,NLS,4012831,5052843.0,158696.0,"Lending/Borrowing Protocols, Liquid Staking Tokens, Ethereum Ecosystem, Osmosis Ecosystem"
JUNO,juno-network,JUNO,JUNO,4000095,5314425.0,13512.97,"Smart Contract Platform, Cosmos Ecosystem, Osmosis Ecosystem, Juno Ecosystem, Evmos Ecosystem, Secret Ecosystem"
SERAPH,seraph,Seraph,SERAPH,3892618,13340102.0,1503741.0,"Gaming (GameFi), BNB Chain Ecosystem, Play To Earn, Ethereum Ecosystem, RPG, Gaming Utility Token, Action Games"
PROPS,propbase,Propbase,PROPS,3775201,10043283.0,2079213.0,"Tokenized Real Estate, Aptos Ecosystem, Real World Assets (RWA), Base Ecosystem, RWA Protocol"
DNX,dynex,Dynex,DNX,3735454,3735568.0,92865.0,"Artificial Intelligence (AI), Smart Contract Platform, Layer 1 (L1), Ethereum Ecosystem, DePIN, Decentralized Science (DeSci), Proof of Work (PoW)"
DIONE,dione,Dione,DIONE,3540450,4052495.0,28450.0,"Energy, Smart Contract Platform, Layer 1 (L1), Made in USA"
LL,lightlink,LightLink,LL,3499700,8834094.0,331846.0,"Infrastructure, Smart Contract Platform, Ethereum Ecosystem, Layer 2 (L2), Base Ecosystem, Rollup, LightLink Ecosystem"
WEPE,wall-street-pepe,Wall Street Pepe,WEPE,3278711,3278711.0,374810.0,"Meme, Ethereum Ecosystem, Frog-Themed, The Boys Club"
METAV,metaverse,METAVERSE,METAV,2800023,2800023.0,358565.0,"Artificial Intelligence (AI), Solana Ecosystem, AI Agents, Pump.fun Ecosystem, Binance Alpha Spotlight"
LIKE,likecoin-2,LikeCoin,LIKE,2670310,3304436.0,583.3,
LLD,liberland-lld,Liberland LLD,LLD,2600473,3491152.0,70298.0,"Smart Contract Platform, Solana Ecosystem, Layer 1 (L1), Ethereum Ecosystem, Tron Ecosystem"
GAIA,gaia-2,Gaia,SN57,2580434,2580434.0,25838.0,"Artificial Intelligence (AI), Bittensor Ecosystem, Bittensor Subnets"
AEROBUD,aerobud,AEROBUD,AEROBUD,2435677,2435677.0,187587.0,"Charity, Meme, Base Ecosystem, Dog-Themed, Base Meme, Made in USA"
SIDUS,sidus,Sidus,SIDUS,2435019,4154745.0,196741.0,"Gaming (GameFi), NFT, BNB Chain Ecosystem, Metaverse, Play To Earn, Ethereum Ecosystem, Linea Ecosystem, Animoca Brands Portfolio, Base Ecosystem, RPG, Gaming Governance Token, Alameda Research Portfolio, OKX Ventures Portfolio"
GOATS,goats-2,GOATS,GOATS,2341341,2416956.0,165795.0,"Gaming (GameFi), Meme, Telegram Apps, TON Ecosystem"
KILO,kiloex,KiloEx,KILO,2328249,10997871.0,1804687.0,"Decentralized Exchange (DEX), Exchange-based Tokens, Decentralized Finance (DeFi), BNB Chain Ecosystem, Derivatives, Perpetuals, Binance Wallet IDO"
VC,vinuchain,VinuChain,VC,2004008,4207488.0,193665.0,"Smart Contract Platform, BNB Chain Ecosystem, Layer 1 (L1), Proof of Stake (PoS)"
BOBA,bobacat,Boba Cat,BOBA,1917826,1917826.0,2504.66,"Meme, Ethereum Ecosystem, Cat-Themed"
LOOKS,looksrare,LooksRare,LOOKS,1872213,1872213.0,1144574.0,"NFT, Ethereum Ecosystem, NFT Marketplace"
BLEND,blend,Blend,BLND,1755997,3343152.0,2291.92,"Decentralized Finance (DeFi), Lending/Borrowing Protocols, Stellar Ecosystem"
XNA,neurai,Neurai,XNA,1617598,1617616.0,34579.0,"Smart Contract Platform, Layer 1 (L1), Real World Assets (RWA), Proof of Work (PoW)"
CREO,creo-engine,Creo Engine,CREO,1489252,1958085.0,976025.0,"Gaming (GameFi), BNB Chain Ecosystem, Solana Ecosystem, Ethereum Ecosystem, Gaming Platform"
BNB,binancecoin,BNB,BNB,115800148926,115800148926.0,1330087150.0,"Smart Contract Platform, Exchange-based Tokens, BNB Chain Ecosystem, Centralized Exchange (CEX) Token, Layer 1 (L1), Ethereum Ecosystem, Alleged SEC Securities, FTX Holdings, Proof of Stake (PoS), GMCI Layer 1 Index, GMCI 30 Index, GMCI Index, Made in China"
HBAR,hedera-hashgraph,Hedera,HBAR,6344965840,7468969463.0,456414240.0,"Smart Contract Platform, Layer 1 (L1), Hedera Ecosystem, GMCI Layer 1 Index, GMCI 30 Index, GMCI Index, Outlier Ventures Portfolio, Made in USA, Directed Acyclic Graph (DAG)"
LBTC,lombard-staked-btc,Lombard Staked BTC,LBTC,999435327,999435327.0,3839403.0,"BNB Chain Ecosystem, Solana Ecosystem, Ethereum Ecosystem, Sui Ecosystem, Base Ecosystem, Starknet Ecosystem, Restaking, Berachain Ecosystem, Liquid Restaking Tokens, Sonic Ecosystem, Etherlink Ecosystem, Swellchain Ecosystem, Corn Ecosystem, Liquid Staked BTC, Katana Ecosystem, TAC Ecosystem"
XDC,xdce-crowd-sale,XDC Network,XDC,958353593,1968250497.0,21119354.0,"Smart Contract Platform, Layer 1 (L1), Real World Assets (RWA)"
