SWEAT,sweatcoin,SWEAT,SWEAT,17094178.0,47241778.0,4120913.0,"Sports, Gaming (GameFi), BNB Chain Ecosystem, Solana Ecosystem, Avalanche Ecosystem, Polygon Ecosystem, Near Protocol Ecosystem, Play To Earn, Arbitrum Ecosystem, Celo Ecosystem, Move To Earn, Ethereum Ecosystem, Optimism Ecosystem, Aptos Ecosystem, Sui Ecosystem, Base Ecosystem, Gaming Governance Token, Gaming Utility Token, OKX Ventures Portfolio"
ADS,adshares,Adshares,ADS,15674491.0,15681408.0,189055.0,"Business Services, Decentralized Finance (DeFi), BNB Chain Ecosystem, Metaverse, Polygon Ecosystem, Ethereum Ecosystem, Base Ecosystem"
CHEQ,cheqd-network,CHEQD Network,CHEQ,15115793.0,20060277.0,309840.0,"Smart Contract Platform, Ethereum Ecosystem, Decentralized Identifier (DID), Zero Knowledge (ZK), Animoca Brands Portfolio, Osmosis Ecosystem, Outlier Ventures Portfolio"
UPC,upcx,UPCX,UPC,14608146.0,2746479365.0,1002893.0,Ethereum Ecosystem
OCTA,octaspace,OctaSpace,OCTA,12899747.0,12899861.0,676569.0,"Artificial Intelligence (AI), Internet of Things (IOT), Smart Contract Platform, BNB Chain Ecosystem, Layer 1 (L1), Ethereum Ecosystem, DePIN, AI Agents"
ALEX,alexgo,ALEX Lab,ALEX,10627967.0,12411141.0,609716.0,"Decentralized Finance (DeFi), Lending/Borrowing Protocols, Ethereum Ecosystem, DWF Labs Portfolio, Mode Ecosystem, Stacks Ecosystem, BTCfi Protocol"
BASEDAI,basedai,BasedAI,BASEDAI,9971402.0,9971402.0,27853.0,"Artificial Intelligence (AI), Ethereum Ecosystem, AI Agents"
CEEK,ceek,CEEK Smart VR,CEEK,9874503.0,10200934.0,686165.0,"Entertainment, BNB Chain Ecosystem, Metaverse, Ethereum Ecosystem, DWF Labs Portfolio"
TKO,tokocrypto,Tokocrypto,TKO,9686433.0,64576219.0,1342992.0,"BNB Chain Ecosystem, Binance Launchpad, YZi Labs (Prev. Binance Labs) Portfolio"
FLAY,flayer,Flayer,FLAY,9549812.0,15916354.0,71767.0,"Launchpad, Ethereum Ecosystem"
DEXTF,dextf,Memento,DEXTF,8744888.0,13288641.0,72502.0,"Decentralized Finance (DeFi), Asset Manager, Avalanche Ecosystem, Ethereum Ecosystem, ZkSync Ecosystem, Real World Assets (RWA)"
MLG,360noscope420blazeit,360noscope420blazeit,MLG,8589723.0,8589723.0,528338.0,"Solana Ecosystem, Meme, Solana Meme"
ALU,altura,Altura,ALU,7491823.0,7491823.0,3214111.0,"Artificial Intelligence (AI), Infrastructure, Gaming (GameFi), NFT, BNB Chain Ecosystem, NFT Marketplace, Base Ecosystem, Gaming Platform, Made in USA, Gaming Marketplace"
GRAIL,camelot-token,Camelot Token,GRAIL,7325276.0,28547830.0,186677.0,"Decentralized Exchange (DEX), Arbitrum Ecosystem, Camelot Launchpad"
PORTAL,portal-2,Portal,PORTAL,6783532.0,40587235.0,55503183.0,"Gaming (GameFi), Solana Ecosystem, Ethereum Ecosystem, Gaming Platform"
MAVIA,heroes-of-mavia,Heroes of Mavia,MAVIA,6737694.0,32631727.0,2460078.0,"Gaming (GameFi), NFT, Ethereum Ecosystem, Animoca Brands Portfolio, Base Ecosystem, Gaming Governance Token, Strategy Games, Alameda Research Portfolio, YZi Labs (Prev. Binance Labs) Portfolio, Delphi Ventures Portfolio, Action Games"
KASTA,kasta,Kasta,KASTA,6545775.0,12862081.0,323000.0,Polygon Ecosystem
WEXO,wexo,Wexo,WEXO,6519518.0,17090744.0,126173.0,"Ethereum Ecosystem, Base Ecosystem"
FNCT,financie-token,Financie Token,FNCT,6473137.0,31795424.0,124734.0,Ethereum Ecosystem
GLQ,graphlinq-protocol,GraphLinq Chain,GLQ,6271152.0,9222281.0,215067.0,"Artificial Intelligence (AI), Business Services, Infrastructure, Smart Contract Platform, Analytics, Layer 1 (L1), Ethereum Ecosystem, DWF Labs Portfolio, AI Agents, DeFAI"
GTAI,gt-protocol,GT Protocol,GTAI,6242298.0,11537881.0,1049234.0,"Artificial Intelligence (AI), BNB Chain Ecosystem, DeFAI"
ZYN,zyncoin-2,ZynCoin,ZYN,5403690.0,5403690.0,57558.0,"Solana Ecosystem, Meme, Ethereum Ecosystem, Parody Meme"
MODE,mode,Mode,MODE,5381135.0,19937227.0,1459765.0,"Artificial Intelligence (AI), Infrastructure, Smart Contract Platform, Layer 2 (L2), Mode Ecosystem, Optimism Superchain Ecosystem, DeFAI"
PAIN,pain,Pain,PAIN,5335238.0,10670534.0,792005.0,"Solana Ecosystem, Meme, Solana Meme, 4chan-Themed"
TRADE,polytrade,Polytrade,TRADE,5300347.0,12378425.0,213099.0,"BNB Chain Ecosystem, Polygon Ecosystem, Arbitrum Ecosystem, Ethereum Ecosystem, Real World Assets (RWA), Base Ecosystem, DWF Labs Portfolio"
CANTO,canto,CANTO,CANTO,4848143.0,7967817.0,247849.0,"Smart Contract Platform, Layer 1 (L1), Ethereum Ecosystem, Canto Ecosystem, Real World Assets (RWA), Osmosis Ecosystem, Parallelized EVM"
FLIX,omniflix-network,OmniFlix Network,FLIX,4770075.0,5285225.0,3120.16,"NFT, Osmosis Ecosystem, Archway Ecosystem"
STAT,stat,STAT,STAT,4753927.0,6496807.0,214417.0,"Media, Ethereum Ecosystem"
OFN,openfabric,Openfabric AI,OFN,4706999.0,12159829.0,117249.0,"Artificial Intelligence (AI), BNB Chain Ecosystem, ChainGPT Launchpad, Poolz Finance Launchpad, AI Agents, AI Applications, AI Framework"
SRM,serum,Serum,SRM,4386417.0,12859178.0,174004.0,"Decentralized Exchange (DEX), Exchange-based Tokens, Decentralized Finance (DeFi), Solana Ecosystem, Ethereum Ecosystem, FTX Holdings, Multicoin Capital Portfolio, Energi Ecosystem, Viction Ecosystem"
FUTURE,futurecoin,FutureCoin,FUTURE,4375189.0,13577987.0,59470.0,BNB Chain Ecosystem
VGX,ethos,VGX Token,VGX,4336934.0,4349002.0,907623.0,"Gaming (GameFi), Ethereum Ecosystem, Galaxy Digital Portfolio"
QORPO,qopro,QORPO WORLD,QORPO,4141831.0,7324074.0,1078272.0,"Gaming (GameFi), NFT, BNB Chain Ecosystem, Play To Earn, Ethereum Ecosystem, RPG, Gaming Utility Token, Adventure Games, Gaming Platform, Action Games"
POLYDOGE,polydoge,PolyDoge,POLYDOGE,3978512.0,3984126.0,281661.0,"NFT, Polygon Ecosystem, Meme, Dog-Themed"
GENOME,genomesdao-genome,GenomesDAO GENOME,GENOME,3780009.0,3780009.0,26973.0,"Ethereum Ecosystem, Base Ecosystem, Decentralized Science (DeSci)"
IZI,izumi-finance,iZUMi Finance,IZI,3380115.0,8585508.0,279011.0,"Decentralized Exchange (DEX), Decentralized Finance (DeFi), Automated Market Maker (AMM), BNB Chain Ecosystem, Polygon Ecosystem, Arbitrum Ecosystem, Ethereum Ecosystem, ZkSync Ecosystem, Mantle Ecosystem, Linea Ecosystem, Base Ecosystem, Manta Network Ecosystem, Scroll Ecosystem"
ARCA,arca,Legend of Arcadia,ARCA,3333265.0,16205539.0,221649.0,"Gaming (GameFi), Ethereum Ecosystem, RPG"
YULI,yuli,YULI,YULI,3243332.0,3243332.0,106313.0,"Gaming (GameFi), NFT, Meme, Kaia Ecosystem, Card Games, Gaming Utility Token, Anime-Themed"
QBX,qbx,QBX,QBX,3220058.0,3220058.0,125687.0,Ethereum Ecosystem
POR,portugal-national-team-fan-token,Portugal National Team Fan Token,POR,3217216.0,16449500.0,621657.0,"Sports, Fan Token, Chiliz Ecosystem"
SAINT,carlo-acutis,Carlo Acutis,SAINT,3149915.0,3149915.0,252157.0,"Solana Ecosystem, Meme, Solana Meme, Pump.fun Ecosystem"
WINR,winr-protocol,WINR Protocol,WINR,3142415.0,4269464.0,20533.0,"Gambling (GambleFi), Infrastructure, Smart Contract Platform, Solana Ecosystem, Arbitrum Ecosystem, Camelot Launchpad, Layer 3 (L3)"
SOLAMA,solama,Solama,SOLAMA,3061275.0,3061275.0,171876.0,"Gambling (GambleFi), Solana Ecosystem, Meme, Solana Meme"
FORWARD,forward,Forward,FORWARD,2926972.0,2930285.0,142768.0,"BNB Chain Ecosystem, Ethereum Ecosystem"
SHIDO,shido-2,Shido Network,SHIDO,2880995.0,2880999.0,143376.0,"Ethereum Ecosystem, Osmosis Ecosystem, Shido Network Ecosystem"
TREAT,shiba-inu-treat,Shiba Inu Treat,TREAT,2878838.0,13379825.0,2933303.0,"Meme, Ethereum Ecosystem, Dog-Themed"
DEOD,decentrawood,Decentrawood,DEOD,2823097.0,2823097.0,178469.0,"Gaming (GameFi), BNB Chain Ecosystem, Metaverse, Solana Ecosystem, Polygon Ecosystem"
BAX,babb,BABB,BAX,2387781.0,2402798.0,8618.29,Ethereum Ecosystem
ETF500,elon-trump-fart,Elon Trump Fart,ETF500,2378191.0,2378191.0,200042.0,"Solana Ecosystem, Meme, Elon Musk-Inspired, Solana Meme, PolitiFi, Pump.fun Ecosystem, Stock market-themed"
GMM,gamium,Gamium,GMM,2267869.0,2315813.0,163389.0,"SocialFi, Gaming (GameFi), BNB Chain Ecosystem, Metaverse, DaoMaker Launchpad, Ethereum Ecosystem, Gaming Governance Token, Gaming Utility Token"
STETH,staked-ether,Lido Staked Ether,STETH,23184273549.0,23184944188.0,9854410.0,"Decentralized Finance (DeFi), Liquid Staking Tokens, Ethereum Ecosystem, Liquid Staked ETH, Liquid Staking"
APT,aptos,Aptos,APT,2867284780.0,5127397770.0,142282080.0,"Smart Contract Platform, Layer 1 (L1), Aptos Ecosystem, FTX Holdings, Coinbase Ventures Portfolio, Multicoin Capital Portfolio, Proof of Stake (PoS), DragonFly Capital Portfolio, Andreessen Horowitz (a16z) Portfolio, YZi Labs (Prev. Binance Labs) Portfolio, GMCI Layer 1 Index, GMCI 30 Index, Circle Ventures Portfolio, GMCI Index, Made in USA"
SAROS,saros-finance,Saros,SAROS,597858041.0,2277554592.0,9615224.0,"Solana Ecosystem, Payment Solutions, Viction Ecosystem"
KAITO,kaito,KAITO,KAITO,353583912.0,1464789507.0,31315002.0,"Artificial Intelligence (AI), Analytics, Base Ecosystem, Binance HODLer Airdrops, InfoFi"
TWT,trust-wallet-token,Trust Wallet,TWT,290381645.0,696943993.0,5882267.0,"BNB Chain Ecosystem, Wallets, Account Abstraction, Energi Ecosystem"
MOCA,mocaverse,Moca Network,MOCA,247413197.0,650962611.0,28335747.0,"Gaming (GameFi), Ethereum Ecosystem, Decentralized Identifier (DID), Animoca Brands Portfolio, Base Ecosystem, OKX Ventures Portfolio, Outlier Ventures Portfolio"
TFUEL,theta-fuel,Theta Fuel,TFUEL,236948035.0,236949489.0,4347897.0,"Smart Contract Platform, DePIN, Proof of Stake (PoS), Made in USA"
KSM,kusama,Kusama,KSM,209622752.0,209627885.0,10865789.0,"Smart Contract Platform, Polkadot Ecosystem, Proof of Stake (PoS), Pantera Capital Portfolio, Made in USA, Coinbase 50 Index, Hydration Ecosystem"
ZRO,layerzero,LayerZero,ZRO,197853940.0,1780016730.0,19182543.0,"Smart Contract Platform, BNB Chain Ecosystem, Avalanche Ecosystem, Polygon Ecosystem, Arbitrum Ecosystem, Ethereum Ecosystem, Optimism Ecosystem, Base Ecosystem, Multicoin Capital Portfolio, Layer 0 (L0), Cross-chain Communication, Circle Ventures Portfolio, Sequoia Capital Portfolio, OKX Ventures Portfolio"
TRIBE,tribe-2,Tribe,TRIBE,171874128.0,377732443.0,134227.0,"Decentralized Finance (DeFi), Ethereum Ecosystem, Stablecoin Protocol"
BLUR,blur,Blur,BLUR,167042694.0,207689302.0,11391538.0,"NFT, Ethereum Ecosystem, NFT Marketplace, FTX Holdings, NFTFi, eGirl Capital Portfolio, Paradigm Portfolio, GMCI DeFi Index, GMCI Index, Made in USA, Coinbase 50 Index"
T,threshold-network-token,Threshold Network,T,157369796.0,173288519.0,10803626.0,"Decentralized Finance (DeFi), Solana Ecosystem, Ethereum Ecosystem, Optimism Ecosystem, Base Ecosystem, Cross-chain Communication, BTCfi Protocol"
QUBIC,qubic-network,Qubic,QUBIC,157204233.0,196323850.0,1386022.0,"Artificial Intelligence (AI), Smart Contract Platform, Layer 1 (L1), Proof of Work (PoW)"
HOT,holotoken,Holo,HOT,147314905.0,147314905.0,6088503.0,"Smart Contract Platform, Storage, Harmony Ecosystem, Arbitrum Ecosystem, Ethereum Ecosystem, DePIN, Base Ecosystem, Energi Ecosystem, Sora Ecosystem, GMCI DePIN Index, GMCI Index"
ANKR,ankr,Ankr Network,ANKR,140884731.0,140884731.0,10262428.0,"BNB Chain Ecosystem, Avalanche Ecosystem, Polygon Ecosystem, Fantom Ecosystem, Arbitrum Ecosystem, Ethereum Ecosystem, Optimism Ecosystem, Liquid Staking Governance Tokens, Linea Ecosystem, DePIN, Scroll Ecosystem, Rollups-as-a-Service (RaaS), Blast Ecosystem, Mode Ecosystem, Pantera Capital Portfolio, Polygon zkEVM Ecosystem, YZi Labs (Prev. Binance Labs) Portfolio, Liquid Staking, Made in USA"
CSPR,casper-network,Casper Network,CSPR,138478727.0,143370748.0,2711099.0,"Smart Contract Platform, Layer 1 (L1), Real World Assets (RWA), Proof of Stake (PoS), GMCI Layer 1 Index, GMCI Index, Made in USA"
ONE,harmony,Harmony,ONE,135523756.0,135527447.0,5606903.0,"Smart Contract Platform, Layer 1 (L1), Harmony Ecosystem, Animoca Brands Portfolio, Binance Launchpad, YZi Labs (Prev. Binance Labs) Portfolio, Made in USA"
GOHOME,gohome,GOHOME,GOHOME,128181913.0,2443238399.0,6635696.0,"Solana Ecosystem, Meme"
ACT,acet-token,Acet,ACT,104291716.0,136063129.0,236842.0,BNB Chain Ecosystem
SWFTC,swftcoin,SWFTCOIN,SWFTC,101070043.0,101070043.0,738028.0,"Exchange-based Tokens, NFT, BNB Chain Ecosystem, Ethereum Ecosystem"
XVS,venus,Venus,XVS,97213287.0,173555497.0,6081557.0,"Decentralized Finance (DeFi), Yield Farming, BNB Chain Ecosystem, Binance Launchpool, Lending/Borrowing Protocols, Arbitrum Ecosystem, Ethereum Ecosystem, Optimism Ecosystem, ZkSync Ecosystem, opBNB Ecosystem, Unichain Ecosystem"
BLAST,blast,Blast,BLAST,95135244.0,229779181.0,32056542.0,"Smart Contract Platform, Layer 2 (L2), eGirl Capital Portfolio, Paradigm Portfolio, Blast Ecosystem"
ACH,alchemy-pay,Alchemy Pay,ACH,92489480.0,187085881.0,27673664.0,"BNB Chain Ecosystem, Ethereum Ecosystem, Payment Solutions, DWF Labs Portfolio"
NMD,nexusmind,NexusMind,NMD,88815418.0,866703270.0,144808.0,"SocialFi, BNB Chain Ecosystem"
MPLX,metaplex,Metaplex,MPLX,86536894.0,104326928.0,10547500.0,"Gaming (GameFi), NFT, BNB Chain Ecosystem, Solana Ecosystem, Launchpad, Animoca Brands Portfolio, FTX Holdings, Multicoin Capital Portfolio, Alameda Research Portfolio, Binance Alpha Spotlight"
PHA,pha,PHALA,PHA,77073481.0,96106403.0,7925048.0,"Artificial Intelligence (AI), Infrastructure, Smart Contract Platform, Oracle, Polkadot Ecosystem, Ethereum Ecosystem, Interoperability, Layer 2 (L2), Zero Knowledge (ZK), DePIN, DWF Labs Portfolio, Rollup, AI Agents, Sora Ecosystem, AI Framework, Made in USA"
HSK,hashkey-ecopoints,HashKey Platform Token,HSK,75220723.0,567703566.0,3866825.0,"Exchange-based Tokens, Centralized Exchange (CEX) Token, Ethereum Ecosystem"
CETUS,cetus-protocol,Cetus Protocol,CETUS,70574598.0,87308781.0,9835485.0,"Decentralized Exchange (DEX), Decentralized Finance (DeFi), Sui Ecosystem, Animoca Brands Portfolio, OKX Ventures Portfolio, Dex Aggregator"
GLMR,moonbeam,Moonbeam,GLMR,63581791.0,75873469.0,5523891.0,"Smart Contract Platform, Polkadot Ecosystem, Layer 1 (L1), Coinbase Ventures Portfolio, Proof of Stake (PoS), YZi Labs (Prev. Binance Labs) Portfolio"
CCD,concordium,Concordium,CCD,53781977.0,64953418.0,671329.0,"Smart Contract Platform, Layer 1 (L1), Decentralized Identifier (DID), Zero Knowledge (ZK)"
RIF,rif-token,Rootstock Infrastructure Framework,RIF,52372385.0,52372385.0,1714748.0,"Solana Ecosystem, Arbitrum Ecosystem, Ethereum Ecosystem, Base Ecosystem, Rootstock Ecosystem, Outlier Ventures Portfolio"
OMI,ecomi,ECOMI,OMI,49811474.0,57152322.0,1128994.0,"Gaming (GameFi), NFT, Metaverse, Collectibles, Play To Earn, Ethereum Ecosystem, Base Ecosystem, Energi Ecosystem"
WILD,wilder-world,Wilder World,WILD,41716276.0,64312747.0,744047.0,"Gaming (GameFi), NFT, Metaverse, Solana Ecosystem, Play To Earn, Ethereum Ecosystem, Animoca Brands Portfolio, Gaming Governance Token, Racing Games, Simulation Games, Action Games"
SFUND,seedify-fund,Seedify.fund,SFUND,41212865.0,64837986.0,2982483.0,"Gaming (GameFi), BNB Chain Ecosystem, Launchpad, Arbitrum Ecosystem, Ethereum Ecosystem, DWF Labs Portfolio"
CTK,certik,Shentu,CTK,41204629.0,41416057.0,3946000.0,"Business Services, Binance Launchpool, Osmosis Ecosystem, Coinbase Ventures Portfolio, Cybersecurity, YZi Labs (Prev. Binance Labs) Portfolio, OKX Ventures Portfolio"
C98,coin98,Coin98,C98,40733774.0,42126294.0,22217715.0,"Decentralized Finance (DeFi), BNB Chain Ecosystem, Solana Ecosystem, Wallets, Polygon Ecosystem, Ethereum Ecosystem, Binance Launchpad, DWF Labs Portfolio, Multicoin Capital Portfolio, Alameda Research Portfolio, Viction Ecosystem, YZi Labs (Prev. Binance Labs) Portfolio"
MNSRY,mansory-token,Mansory Token,MNSRY,39645527.0,39645527.0,1736658.0,"Retail, BNB Chain Ecosystem, Solana Ecosystem, Real World Assets (RWA), Pump.fun Ecosystem"
DODO,dodo,DODO,DODO,37464241.0,37464241.0,5515234.0,"Decentralized Exchange (DEX), Exchange-based Tokens, Decentralized Finance (DeFi), BNB Chain Ecosystem, Binance Launchpool, Polygon Ecosystem, Near Protocol Ecosystem, Arbitrum Ecosystem, Ethereum Ecosystem, DWF Labs Portfolio, Coinbase Ventures Portfolio, Alameda Research Portfolio, DeFiance Capital Portfolio, Pantera Capital Portfolio, Aurora Ecosystem, Energi Ecosystem, YZi Labs (Prev. Binance Labs) Portfolio, Galaxy Digital Portfolio"
STORJ,storj,Storj,STORJ,35393165.0,104613414.0,12171645.0,"Storage, Harmony Ecosystem, Ethereum Ecosystem, DePIN, Energi Ecosystem"
EDU,edu-coin,Open Campus,EDU,32809804.0,126141015.0,3562563.0,"Education, BNB Chain Ecosystem, Polygon Ecosystem, Ethereum Ecosystem, Binance Launchpad, YZi Labs (Prev. Binance Labs) Portfolio"
M87,messier,MESSIER,M87,31399582.0,31399582.0,787225.0,"Decentralized Finance (DeFi), Ethereum Ecosystem"
AVA,ava-ai,Ava AI,AVA,30578254.0,30578254.0,7470382.0,"Artificial Intelligence (AI), Solana Ecosystem, Meme, AI Meme, AI Agents, Pump.fun Ecosystem, Binance Alpha Spotlight, Made in USA"
LOFI,lofi-2,LOFI,LOFI,29840015.0,29840015.0,1383731.0,"Meme, Sui Ecosystem, Sui Meme"
MMUI,metamui,MetaMUI,MMUI,28456583.0,47800173.0,417153.0,Avalanche Ecosystem
BR,bedrock-token,Bedrock,BR,26851994.0,127866636.0,306578542.0,"Decentralized Finance (DeFi), BNB Chain Ecosystem, Liquid Staking Governance Tokens, Berachain Ecosystem, BTCfi Protocol, Binance Wallet IDO"
ZEREBRO,zerebro,Zerebro,ZEREBRO,26280464.0,26280464.0,6735664.0,"Solana Ecosystem, Meme, Solana Meme, AI Meme, Pump.fun Ecosystem, Binance Alpha Spotlight"
FORTH,ampleforth-governance-token,Ampleforth Governance,FORTH,26007711.0,34586142.0,2224773.0,"Ethereum Ecosystem, Stablecoin Protocol"
PNG,pangolin,Pangolin,PNG,25228090.0,61589455.0,734297.0,"Decentralized Exchange (DEX), Decentralized Finance (DeFi), Avalanche Ecosystem, Olympus Pro Ecosystem"
ELX,elixir-finance,Elixir,ELX,24424866.0,94206216.0,11815760.0,"Decentralized Finance (DeFi), Ethereum Ecosystem, Real World Assets (RWA), Stablecoin Protocol, RWA Protocol"
LAT,platon-network,PlatON Network,LAT,21980155.0,34043188.0,3866374.0,"Smart Contract Platform, Appchains"
NEON,neon,Neon,NEON,21889809.0,91411131.0,986605.0,"Smart Contract Platform, Solana Ecosystem, Neon Ecosystem, Parallelized EVM"
PIKA,pikaboss,Pikaboss,PIKA,21729751.0,21729751.0,1600.83,"Meme, Ethereum Ecosystem"
DYDX,dydx,dYdX,ETHDYDX,21556614.0,461584874.0,11970200.0,"Decentralized Exchange (DEX), Exchange-based Tokens, Decentralized Finance (DeFi), Derivatives, Perpetuals, Ethereum Ecosystem, Paradigm Portfolio"
PHB,phoenix-global,Phoenix,PHB,21298026.0,21298026.0,5514178.0,"Artificial Intelligence (AI), Oracle, NFT, BNB Chain Ecosystem, DePIN, Made in China"
BEL,bella-protocol,Bella Protocol,BEL,21109849.0,26387311.0,14930146.0,"Decentralized Finance (DeFi), Yield Farming, BNB Chain Ecosystem, Binance Launchpool, Yield Aggregator, Ethereum Ecosystem, Manta Network Ecosystem, YZi Labs (Prev. Binance Labs) Portfolio"
JELLYJELLY,jelly-my-jelly,Jelly-My-Jelly,JELLYJELLY,20073698.0,20073698.0,6516786.0,"Solana Ecosystem, Pump.fun Ecosystem"
UFD,unicorn-fart-dust,Unicorn Fart Dust,UFD,19752952.0,19752952.0,4233234.0,"Solana Ecosystem, Meme, Solana Meme, Pump.fun Ecosystem, Binance Alpha Spotlight, Made in USA"
GHST,aavegotchi,Aavegotchi,GHST,18839670.0,19425426.0,10769458.0,"Smart Contract Platform, Gaming (GameFi), NFT, Metaverse, Collectibles, Polygon Ecosystem, Meme, Play To Earn, Ethereum Ecosystem, Gotchiverse, Base Ecosystem, Layer 3 (L3), RPG, Gaming Governance Token, Gaming Utility Token, Energi Ecosystem"
FIS,stafi,Stafi,FIS,18653463.0,18653463.0,91222312.0,"Decentralized Finance (DeFi), Ethereum Ecosystem, Liquid Staking Governance Tokens, Osmosis Ecosystem, Sora Ecosystem, Liquid Staking"
SIGMA,sigma,Sigma,SIGMA,16044343.0,16044343.0,1611438.0,"Solana Ecosystem, Meme, Solana Meme, Pump.fun Ecosystem, 4chan-Themed"
CWEB,coinweb,Coinweb,CWEB,15959420.0,19804036.0,238978.0,"Smart Contract Platform, Wallets, Ethereum Ecosystem, Interoperability, Layer 2 (L2), Cross-chain Communication, Bitcoin Sidechains, SideChain"
QUICK,quick,Quickswap [OLD],QUICK,15714845.0,20879830.0,8166.23,"Decentralized Exchange (DEX), Exchange-based Tokens, Decentralized Finance (DeFi), Yield Farming, Automated Market Maker (AMM), Polygon Ecosystem, Ethereum Ecosystem"
VARA,vara-network,Vara Network,VARA,14887222.0,42787062.0,546753.0,"Smart Contract Platform, Layer 1 (L1)"
BENJI,basenji,Basenji,BENJI,14792720.0,14792720.0,2504153.0,"Meme, Base Ecosystem, Dog-Themed, Base Meme"
THE,thena,Thena,THE,12951825.0,61031973.0,6430195.0,"Decentralized Exchange (DEX), Decentralized Finance (DeFi), BNB Chain Ecosystem, opBNB Ecosystem, Binance HODLer Airdrops"
PIVX,pivx,PIVX,PIVX,12155114.0,12155114.0,3032776.0,"Smart Contract Platform, Privacy, Masternodes, Zero Knowledge (ZK), Proof of Stake (PoS)"
OIK,space-nation-oikos,Space Nation Oikos,OIK,11119981.0,59852421.0,367041.0,"Gaming (GameFi), NFT, BNB Chain Ecosystem, Immutable zkEVM Ecosystem, RPG, MMO"
KOMA,koma-inu,Koma Inu,KOMA,11017935.0,11017935.0,3782932.0,"BNB Chain Ecosystem, Meme, Dog-Themed, Binance Alpha Spotlight, Made in USA"
BOTIFY,botify,BOTIFY,BOTIFY,9568700.0,9568700.0,1120089.0,"Artificial Intelligence (AI), Retail, Solana Ecosystem, E-commerce"
STNK,stonks-4,Stonks,STNK,9396091.0,9396091.0,106274.0,"Solana Ecosystem, Meme, Solana Meme, Wall Street Bets Themed, Stock market-themed"
NIBI,nibiru,Nibiru,NIBI,9320917.0,12308092.0,1040553.0,"Infrastructure, Smart Contract Platform, Layer 1 (L1), Osmosis Ecosystem, Made in USA"
XSWAP,xswap-2,XSwap,XSWAP,9169594.0,13202992.0,414752.0,"Decentralized Finance (DeFi), Ethereum Ecosystem, Base Ecosystem, Cross-chain Communication"
OPUL,opulous,Opulous,OPUL,9071131.0,9071131.0,852735.0,"Artificial Intelligence (AI), Music, NFT, BNB Chain Ecosystem, Arbitrum Ecosystem, Ethereum Ecosystem, Algorand Ecosystem, Real World Assets (RWA), Telegram Apps, AI Applications"
EVR,evernode,Evernode,EVR,8378269.0,16736476.0,21563.0,"Smart Contract Platform, Layer 2 (L2), DePIN"
RNT,reental,Reental,RNT,8082313.0,39948370.0,5612.7,"Tokenized Real Estate, Tokenized Assets, Polygon Ecosystem, Real World Assets (RWA), RWA Protocol"
KISHU,kishu-inu,Kishu Inu,KISHU,7798920.0,7798919.0,169810.0,"Meme, Ethereum Ecosystem, Dog-Themed"
AGRI,agridex-governance-token,AgriDex,AGRI,7248154.0,31222961.0,593270.0,"Tokenized Assets, Solana Ecosystem, Real World Assets (RWA), Tokenized Commodities"
ROOT,the-root-network,The Root Network,ROOT,7222142.0,38059521.0,1715655.0,"Smart Contract Platform, Gaming (GameFi), Layer 1 (L1), Ethereum Ecosystem, Gaming Blockchains, Outlier Ventures Portfolio"
HDRO,hydro-protocol-2,Hydro Protocol,HDRO,7137488.0,20730272.0,132212.0,Injective Ecosystem
MSM,musmecoin,MusmeCoin,MSM,7108093.0,13669371.0,28605.0,"Meme, Ethereum Ecosystem, Anime-Themed, Oasys Ecosystem"
GHUB,gemhub,GemHUB,GHUB,7090634.0,39116288.0,56843.0,Kaia Ecosystem
CSWAP,chainswap-3,ChainSwap,CSWAP,6643355.0,6970473.0,31484.0,"Decentralized Exchange (DEX), Decentralized Finance (DeFi), Ethereum Ecosystem, Cross-chain Communication"
DINERO,dinero-2,Dinero,DINERO,6582264.0,10622811.0,17033.61,"Infrastructure, Decentralized Finance (DeFi), Lending/Borrowing Protocols, Ethereum Ecosystem, Metagovernance, Liquid Staking Governance Tokens, LSDFi, Curve Ecosystem, Liquid Staking"
CLY,colony,Colony,CLY,6202972.0,8257381.0,108537.0,Avalanche Ecosystem
MASK,catwifmask,catwifmask,MASK,6165272.0,6165272.0,2423856.0,"Solana Ecosystem, Meme, Solana Meme, Cat-Themed, Pump.fun Ecosystem"
U,u,U,U,5937116.0,5937116.0,362248.0,"BNB Chain Ecosystem, Meme"
SNAI,swarmnode-ai,SwarmNode.ai,SNAI,5906721.0,6544849.0,2810776.0,"Artificial Intelligence (AI), Infrastructure, Solana Ecosystem, Pump.fun Ecosystem, AI Agent Launchpad, Binance Alpha Spotlight, AI Framework, DeFAI"
ULTI,ultiverse,Ultiverse,ULTI,5906058.0,14740573.0,5261651.0,"Gaming (GameFi), BNB Chain Ecosystem, Ethereum Ecosystem, Animoca Brands Portfolio"
REDO,resistance-dog,Resistance Dog,REDO,5749779.0,5749779.0,850057.0,"Meme, Dog-Themed, TON Ecosystem, TON Meme"
3ULL,playa3ull-games-2,PLAYA3ULL GAMES,3ULL,5535299.0,5544244.0,800953.0,"Smart Contract Platform, Gaming (GameFi), NFT, Avalanche Ecosystem, Play To Earn, Shooting Games, Avalanche L1, MMO"
GRPH,soul-graph,Soul Graph,GRPH,5310162.0,5310162.0,58485.0,"Artificial Intelligence (AI), Solana Ecosystem, Pump.fun Ecosystem, AI Applications"
CATE,catecoin,CateCoin,CATE,5307686.0,5540301.0,240010.0,"Entertainment, Gaming (GameFi), Yield Farming, NFT, BNB Chain Ecosystem, Yield Aggregator, Launchpad, Wallets, Meme, Play To Earn, Ethereum Ecosystem, Base Ecosystem, Cat-Themed"
DOLAN,dolan-duck,Dolan Duck,DOLAN,4666219.0,4666219.0,117038.0,"Solana Ecosystem, Meme, Solana Meme, Parody Meme, 4chan-Themed"
LUCE,offcial-mascot-of-the-holy-year,Luce,LUCE,4665899.0,4665899.0,2148564.0,"Solana Ecosystem, Meme, Solana Meme, Pump.fun Ecosystem, Mascot-Themed, Binance Alpha Spotlight"
DCK,dexcheck,DexCheck AI,DCK,4283349.0,5835532.0,341421.0,"Artificial Intelligence (AI), Analytics, BNB Chain Ecosystem, Launchpad, Ethereum Ecosystem, ChainGPT Launchpad, Poolz Finance Launchpad, AI Agents, DeFAI, InfoFi"
DROP,drop-2,DROP,DROP,4171712.0,4171712.0,52056.0,"Meme, XRP Ledger Ecosystem"
CPH,cypherium,Cypherium,CPH,3948126.0,49859237.0,29029.0,"Smart Contract Platform, Layer 1 (L1), Proof of Work (PoW), Pantera Capital Portfolio"
XEL,xelis,Xelis,XEL,3720359.0,3720359.0,101783.0,"Smart Contract Platform, Privacy, Layer 1 (L1), Directed Acyclic Graph (DAG)"
SMURFCAT,real-smurf-cat,Real Smurf Cat,SMURFCAT,3686421.0,3686421.0,173954.0,"Solana Ecosystem, Meme, Arbitrum Ecosystem, Ethereum Ecosystem, Cat-Themed"
BTC2,bitcoin-2,Bitcoin 2,BTC2,3610579.0,3610579.0,10506.36,"Smart Contract Platform, Proof of Stake (PoS)"
KAS,kaspa,Kaspa,KAS,1991830016.0,1995901992.0,63165581.0,"Smart Contract Platform, Layer 1 (L1), Proof of Work (PoW), Kaspa Ecosystem, Made in USA, Directed Acyclic Graph (DAG)"
BONK,bonk,Bonk,BONK,1763945440.0,2023147166.0,1091375421.0,"BNB Chain Ecosystem, Solana Ecosystem, Polygon Ecosystem, Meme, Arbitrum Ecosystem, Ethereum Ecosystem, Aptos Ecosystem, Dog-Themed, Solana Meme, Neon Ecosystem, GMCI Meme Index, GMCI Index, Made in USA, Coinbase 50 Index, 4chan-Themed"
