Input Token,CoinGecko ID,Name,Symbol,Market Cap,FDV,24H Volume,Categories
TRX,tron,TRON,TRX,30168623554,30168677123.0,3291902237.0,"Smart Contract Platform, Layer 1 (L1), Alleged SEC Securities, FTX Holdings, DWF Labs Portfolio, Tron Ecosystem, Proof of Stake (PoS), GMCI Layer 1 Index, GMCI 30 Index, GMCI Index, World Liberty Financial Portfolio, Made in China"
SUI,sui,Sui,SUI,13314875774,38537820528.0,1032198853.0,"Smart Contract Platform, Binance Launchpool, Layer 1 (L1), Sui Ecosystem, Coinbase Ventures Portfolio, Proof of Stake (PoS), Andreessen Horowitz (a16z) Portfolio, YZi Labs (Prev. Binance Labs) Portfolio, GMCI Layer 1 Index, Circle Ventures Portfolio, GMCI Index, Made in USA"
AVAX,avalanche-2,Avalanche,AVAX,10313089842,11167946571.0,776989392.0,"Smart Contract Platform, Layer 1 (L1), Avalanche Ecosystem, Proof of Stake (PoS), DragonFly Capital Portfolio, DeFiance Capital Portfolio, Andreessen Horowitz (a16z) Portfolio, GMCI Layer 1 Index, GMCI 30 Index, Galaxy Digital Portfolio, GMCI Index, Polychain Capital Portfolio, World Liberty Financial Portfolio, Made in USA, Coinbase 50 Index"
TAO,bittensor,Bittensor,TAO,3927192792,8738371753.0,90675145.0,"Artificial Intelligence (AI), Smart Contract Platform, Layer 1 (L1), DePIN, Bittensor Ecosystem, Polychain Capital Portfolio"
ONDO,ondo-finance,Ondo,ONDO,3244554431,10270477978.0,199339250.0,"Decentralized Finance (DeFi), Ethereum Ecosystem, Real World Assets (RWA), Coinbase Ventures Portfolio, Pantera Capital Portfolio, GMCI DeFi Index, RWA Protocol, GMCI Index, World Liberty Financial Portfolio, Binance Alpha Spotlight, Made in USA"
ENA,ethena,Ethena,ENA,2746640347,6483340874.0,587914916.0,"Decentralized Finance (DeFi), Binance Launchpool, Ethereum Ecosystem, Stablecoin Protocol, DragonFly Capital Portfolio, YZi Labs (Prev. Binance Labs) Portfolio, Delphi Ventures Portfolio, OKX Ventures Portfolio, World Liberty Financial Portfolio"
ALGO,algorand,Algorand,ALGO,2519037414,2519059794.0,112261965.0,"Smart Contract Platform, Layer 1 (L1), Algorand Ecosystem, Real World Assets (RWA), Alleged SEC Securities, DWF Labs Portfolio, Multicoin Capital Portfolio, Proof of Stake (PoS), GMCI Layer 1 Index, GMCI Index, Made in USA, Coinbase 50 Index"
ATOM,cosmos,Cosmos Hub,ATOM,2301405583,2301405583.0,109893148.0,"Smart Contract Platform, BNB Chain Ecosystem, Cosmos Ecosystem, Canto Ecosystem, Alleged SEC Securities, Osmosis Ecosystem, Paradigm Portfolio, Proof of Stake (PoS), Kava Ecosystem, Layer 0 (L0), DragonFly Capital Portfolio, Pantera Capital Portfolio, Archway Ecosystem, Evmos Ecosystem, GMCI 30 Index, GMCI Index, Outlier Ventures Portfolio, Polychain Capital Portfolio, Mantra Ecosystem, Coinbase 50 Index"
FDUSD,first-digital-usd,First Digital USD,FDUSD,1481527766,1481527766.0,4557268658.0,"Stablecoins, USD Stablecoin, BNB Chain Ecosystem, Arbitrum Ecosystem, Ethereum Ecosystem, Sui Ecosystem, Fiat-backed Stablecoin"
INJ,injective-protocol,Injective,INJ,1376773008,1408791740.0,111659354.0,"Smart Contract Platform, Decentralized Finance (DeFi), BNB Chain Ecosystem, Cosmos Ecosystem, Layer 1 (L1), Ethereum Ecosystem, Real World Assets (RWA), Binance Launchpad, Osmosis Ecosystem, Proof of Stake (PoS), Pantera Capital Portfolio, Secret Ecosystem, GMCI Layer 1 Index, GMCI Index, Made in USA, Coinbase 50 Index"
NEXO,nexo,NEXO,NEXO,1332746417,1332746417.0,12183702.0,"Polygon Ecosystem, Fantom Ecosystem, Ethereum Ecosystem, Alleged SEC Securities, Energi Ecosystem, Sora Ecosystem"
DOGWIFHAT,dogwifcoin,dogwifhat,WIF,1081957243,1081957243.0,405931563.0,"Solana Ecosystem, Meme, Dog-Themed, Solana Meme, GMCI Meme Index, GMCI Index"
WBTC,arbitrum-bridged-wbtc-arbitrum-one,Arbitrum Bridged WBTC (Arbitrum One),WBTC,946573428,946573428.0,80909902.0,"Arbitrum Ecosystem, Bridged WBTC, Bridged-Tokens"
MANA,decentraland,Decentraland,MANA,647271170,739672635.0,43080404.0,"Entertainment, Gaming (GameFi), NFT, Metaverse, Polygon Ecosystem, Play To Earn, Ethereum Ecosystem, Animoca Brands Portfolio, Alleged SEC Securities, Simulation Games, Coinbase 50 Index"
RSR,reserve-rights-token,Reserve Rights,RSR,578363374,984900752.0,58233102.0,"Decentralized Finance (DeFi), Arbitrum Ecosystem, Ethereum Ecosystem, Real World Assets (RWA), Base Ecosystem, Coinbase Ventures Portfolio, Energi Ecosystem, Made in USA"
AR,arweave,Arweave,AR,487206841,487206841.0,34879418.0,"Artificial Intelligence (AI), Smart Contract Platform, Storage, Layer 1 (L1), DePIN, Coinbase Ventures Portfolio, Multicoin Capital Portfolio, Andreessen Horowitz (a16z) Portfolio, Blockchain Capital Portfolio"
NFT,apenft,APENFT,NFT,457517785,462085227.0,4644320.0,"NFT, BNB Chain Ecosystem, Ethereum Ecosystem, Tron Ecosystem"
CHZ,chiliz,Chiliz,CHZ,425063797,425063797.0,37050063.0,"Smart Contract Platform, Sports, NFT, Layer 1 (L1), Ethereum Ecosystem, Alleged SEC Securities, Chiliz Ecosystem, YZi Labs (Prev. Binance Labs) Portfolio, Coinbase 50 Index"
LPT,livepeer,Livepeer,LPT,307972699,307972699.0,18445440.0,"Artificial Intelligence (AI), Harmony Ecosystem, Arbitrum Ecosystem, Ethereum Ecosystem, DePIN, Coinbase Ventures Portfolio, Multicoin Capital Portfolio, Pantera Capital Portfolio, GMCI DePIN Index, GMCI Index, Coinbase 50 Index"
BERA,berachain-bera,Berachain,BERA,270526669,1128286260.0,37926365.0,"Smart Contract Platform, Decentralized Finance (DeFi), Layer 1 (L1), Berachain Ecosystem, Binance HODLer Airdrops, Outlier Ventures Portfolio, Polychain Capital Portfolio"
RVN,ravencoin,Ravencoin,RVN,231682664,231756634.0,14795586.0,"Smart Contract Platform, Real World Assets (RWA), Proof of Work (PoW), Made in USA"
KDA,kadena,Kadena,KDA,178652409,178663478.0,18008988.0,"Smart Contract Platform, Layer 1 (L1), Kadena Ecosystem, Multicoin Capital Portfolio, Proof of Work (PoW), Made in USA"
MELANIA,melania-meme,Melania Meme,MELANIA,161310779,250094522.0,8175234.0,"Solana Ecosystem, Meme, Solana Meme, PolitiFi, Made in USA"
AIXBT,aixbt,aixbt,AIXBT,160875810,167983984.0,43072306.0,"Artificial Intelligence (AI), Solana Ecosystem, Meme, Ethereum Ecosystem, Base Ecosystem, AI Meme, AI Agents, Virtuals Protocol Ecosystem, Binance Alpha Spotlight, DeFAI"
WELL,moonwell-artemis,Moonwell,WELL,145318553,207469210.0,1843920.0,"Decentralized Finance (DeFi), Lending/Borrowing Protocols, Moonbeam Ecosystem, Base Ecosystem, Coinbase Ventures Portfolio, Made in USA"
LAYER,solayer,Solayer,LAYER,145160425,691240119.0,14368443.0,"Decentralized Finance (DeFi), Solana Ecosystem, LSDFi, Restaking, Stablecoin Protocol, YZi Labs (Prev. Binance Labs) Portfolio, Binance HODLer Airdrops, Polychain Capital Portfolio"
VELO,velo,Velo,VELO,134258999,435992201.0,33750311.0,"Decentralized Finance (DeFi), BNB Chain Ecosystem, Real World Assets (RWA), DWF Labs Portfolio, Stellar Ecosystem, Binance Alpha Spotlight"
SNT,status,Status,SNT,127708939,219428433.0,10851539.0,"Software as a service, Ethereum Ecosystem, Energi Ecosystem"
MYTH,mythos,Mythos,MYTH,106658633,133923179.0,1234737.0,"Gaming (GameFi), Polkadot Ecosystem, NFT, Avalanche Ecosystem, Ethereum Ecosystem, Gaming Blockchains, Andreessen Horowitz (a16z) Portfolio, YZi Labs (Prev. Binance Labs) Portfolio, Galaxy Digital Portfolio, Made in USA"
ALEO,aleo,ALEO,ALEO,101676169,413242289.0,7835495.0,"Smart Contract Platform, Layer 1 (L1), Zero Knowledge (ZK), Andreessen Horowitz (a16z) Portfolio, Privacy Blockchain, Made in USA"
ERG,ergo,Ergo,ERG,96187683,115442580.0,265281.0,"Smart Contract Platform, Layer 1 (L1), Proof of Work (PoW), Privacy Blockchain"
COREUM,coreum,Coreum,COREUM,92511087,92511087.0,577228.0,"Smart Contract Platform, Layer 1 (L1), Osmosis Ecosystem, XRP Ledger Ecosystem"
IQ,everipedia,IQ,IQ,89843554,89843554.0,2594161.0,"Artificial Intelligence (AI), Big Data, Media, BNB Chain Ecosystem, Polygon Ecosystem, Ethereum Ecosystem, AI Agents, GMCI DePIN Index, Galaxy Digital Portfolio, GMCI Index, AI Agent Launchpad"
BNT,bancor,Bancor Network,BNT,88798699,88798699.0,6469860.0,"Decentralized Exchange (DEX), Exchange-based Tokens, Decentralized Finance (DeFi), Automated Market Maker (AMM), Ethereum Ecosystem, DeFiance Capital Portfolio, Energi Ecosystem"
DKA,dkargo,dKargo,DKA,85527099,85527099.0,1271461.0,Ethereum Ecosystem
MERL,merlin-chain,Merlin Chain,MERL,77433762,224290896.0,6764078.0,"Smart Contract Platform, BNB Chain Ecosystem, Ethereum Ecosystem, Layer 2 (L2), Merlin Chain Ecosystem, Bitcoin Sidechains, SideChain, OKX Ventures Portfolio"
PYTHIA,pythia,PYTHIA,PYTHIA,75707915,75707915.0,5991024.0,"Solana Ecosystem, Meme, AI Meme, Pump.fun Ecosystem, Desci Meme, Binance Alpha Spotlight"
NTRN,neutron-3,Neutron,NTRN,67339654,110895559.0,3289405.0,"Binance Launchpool, Osmosis Ecosystem, Delphi Ventures Portfolio"
ORAI,oraichain-token,Oraichain,ORAI,62693848,63282576.0,663656.0,"Artificial Intelligence (AI), Big Data, Business Services, Smart Contract Platform, Decentralized Finance (DeFi), Oracle, BNB Chain Ecosystem, Solana Ecosystem, Layer 1 (L1), Ethereum Ecosystem, DWF Labs Portfolio, Osmosis Ecosystem, AI Agents"
DBR,debridge,deBridge,DBR,60795825,208865150.0,3848329.0,"Solana Ecosystem, Bridge Governance Tokens, Cross-chain Communication, Intent"
ZKJ,polyhedra-network,Polyhedra Network,ZKJ,57344872,168937429.0,7688759.0,"Smart Contract Platform, BNB Chain Ecosystem, Ethereum Ecosystem, Zero Knowledge (ZK), Animoca Brands Portfolio, YZi Labs (Prev. Binance Labs) Portfolio, OKX Ventures Portfolio, Binance Alpha Spotlight"
MAGIC,magic,Treasure,MAGIC,54374323,61503452.0,34811364.0,"Artificial Intelligence (AI), Gaming (GameFi), NFT, Metaverse, Arbitrum Ecosystem, Ethereum Ecosystem, Layer 2 (L2), Zero Knowledge (ZK), Gaming Blockchains, Gaming Governance Token, Gaming Utility Token, AI Agents, AI Agent Launchpad"
ELG,escoin-token,Escoin,ELG,53682198,72854939.0,385523.0,"BNB Chain Ecosystem, Polygon Ecosystem, Ethereum Ecosystem"
CELR,celer-network,Celer Network,CELR,51495423,91215718.0,5579442.0,"Arbitrum Ecosystem, Ethereum Ecosystem, Bridge Governance Tokens, Binance Launchpad, Cross-chain Communication, Pantera Capital Portfolio, Energi Ecosystem, YZi Labs (Prev. Binance Labs) Portfolio"
GRIFFAIN,griffain,GRIFFAIN,GRIFFAIN,48658197,48658197.0,9014210.0,"Artificial Intelligence (AI), Solana Ecosystem, Pump.fun Ecosystem, AI Agent Launchpad, Binance Alpha Spotlight, DeFAI"
DEVVE,devve,DevvE,DEVVE,39049489,53621026.0,653636.0,"Exchange-based Tokens, Layer 1 (L1), Ethereum Ecosystem"
SYS,syscoin,Syscoin,SYS,38931715,39080409.0,4111610.0,"Smart Contract Platform, Masternodes, Layer 1 (L1), Decentralized Identifier (DID), Layer 2 (L2), Zero Knowledge (ZK), Rollux Ecosystem, DWF Labs Portfolio, Data Availability, Modular Blockchain, Rollup, Proof of Work (PoW)"
LOKA,league-of-kingdoms,League of Kingdoms,LOKA,38793280,51812705.0,47834578.0,"Gaming (GameFi), NFT, Metaverse, Ethereum Ecosystem, Binance Launchpad, Gaming Governance Token, Gaming Utility Token, Strategy Games, Andreessen Horowitz (a16z) Portfolio, YZi Labs (Prev. Binance Labs) Portfolio, Sequoia Capital Portfolio"
REX,revox,REVOX,REX,37310236,55365757.0,4503668.0,"Artificial Intelligence (AI), BNB Chain Ecosystem, AI Agents, AI Applications"
PSP,paraswap,ParaSwap,PSP,36833721,42711775.0,226590.0,"Decentralized Exchange (DEX), Exchange-based Tokens, Decentralized Finance (DeFi), BNB Chain Ecosystem, Polygon Ecosystem, Ethereum Ecosystem, Optimism Ecosystem, Alameda Research Portfolio, Intent, Blockchain Capital Portfolio, Dex Aggregator"
XPLA,xpla,XPLA,XPLA,36538097,88400860.0,784352.0,"Smart Contract Platform, Gaming (GameFi), NFT, Wallets, Osmosis Ecosystem, Gaming Blockchains, Gaming Platform, Appchains"
CAW,a-hunters-dream,A Hunters Dream,CAW,35274715,36936874.0,1259073.0,"SocialFi, Ethereum Ecosystem"
MAV,maverick-protocol,Maverick Protocol,MAV,33957030,100529770.0,8786165.0,"BNB Chain Ecosystem, Binance Launchpool, Ethereum Ecosystem, ZkSync Ecosystem, Base Ecosystem, Coinbase Ventures Portfolio, Pantera Capital Portfolio, YZi Labs (Prev. Binance Labs) Portfolio, Circle Ventures Portfolio"
ROAM,roam-token,ROAM Token,ROAM,29827578,102040756.0,7352817.0,"Retail, BNB Chain Ecosystem, Solana Ecosystem, DePIN"
DF,dforce-token,dForce,DF,29247662,29247662.0,3427451.0,"Decentralized Finance (DeFi), BNB Chain Ecosystem, Lending/Borrowing Protocols, Arbitrum Ecosystem, Ethereum Ecosystem, Multicoin Capital Portfolio, Stablecoin Protocol, Energi Ecosystem"
HEI,heima,Heima,HEI,27706456,35969641.0,78548600.0,"BNB Chain Ecosystem, Binance Launchpool, Ethereum Ecosystem, YZi Labs (Prev. Binance Labs) Portfolio"
BAKE,bakerytoken,BakerySwap,BAKE,26995654,27095271.0,7000400.0,"NFT, BNB Chain Ecosystem, Harmony Ecosystem"
KERNEL,kernel-2,KernelDAO,KERNEL,26603193,149107829.0,21154663.0,"BNB Chain Ecosystem, Arbitrum Ecosystem, Ethereum Ecosystem, Liquid Restaked ETH"
ATR,artrade,Artrade,ATR,25906848,25986849.0,1078158.0,"NFT, Solana Ecosystem, NFT Marketplace, Real World Assets (RWA), Art"
OMG,omisego,OMG Network,OMG,25824950,25824950.0,2697067.0,"Smart Contract Platform, Ethereum Ecosystem, Alleged SEC Securities, Pantera Capital Portfolio, Boba Network Ecosystem"
DOVU,dovu-2,DOVU,DOVU,25551806,25630578.0,72143.0,"Infrastructure, Ethereum Ecosystem, Regenerative Finance (ReFi), Real World Assets (RWA), Hedera Ecosystem"
IXS,ix-swap,IXS,IXS,23978117,23978117.0,169385.0,"Polygon Ecosystem, Ethereum Ecosystem, Real World Assets (RWA), Base Ecosystem, DWF Labs Portfolio, Poolz Finance Launchpad, Coinbase Ventures Portfolio"
OL,open-loot,OPENLOOT,OL,21578540,173214018.0,4948097.0,"Gaming (GameFi), NFT, BNB Chain Ecosystem, Ethereum Ecosystem, Gaming Marketplace"
CATI,catizen,Catizen,CATI,19861001,96412629.0,9222062.0,"Gaming (GameFi), Play To Earn, Telegram Apps, TON Ecosystem, Tap to Earn"
GEL,gelato,Gelato,GEL,18480732,29587457.0,669689.0,"Smart Contract Platform, Polygon Ecosystem, Fantom Ecosystem, Ethereum Ecosystem, Layer 2 (L2), Modular Blockchain, Rollups-as-a-Service (RaaS), DragonFly Capital Portfolio, Galaxy Digital Portfolio, Binance Alpha Spotlight"
BLZ,bluzelle,Bluzelle,BLZ,17432385,18525206.0,3892318.0,"Smart Contract Platform, BNB Chain Ecosystem, Ethereum Ecosystem, DePIN, Decentralized Science (DeSci), Osmosis Ecosystem, Energi Ecosystem, GMCI DePIN Index, GMCI Index"
PHNIX,phnix,PHNIX,PHNIX,16734409,18578017.0,591313.0,"Meme, XRP Ledger Ecosystem"
SNSY,sensay,Sensay,SNSY,15563878,27383710.0,610915.0,"Artificial Intelligence (AI), Arbitrum Ecosystem, Ethereum Ecosystem, Base Ecosystem, AI Agents"
BOSON,boson-protocol,Boson Protocol,BOSON,15465960,21317731.0,931181.0,"NFT, Metaverse, Polygon Ecosystem, Ethereum Ecosystem, Real World Assets (RWA), Animoca Brands Portfolio, Base Ecosystem, RWA Protocol, Outlier Ventures Portfolio"
RIZO,hahayes,HahaYes,RIZO,14995981,14995981.0,1240806.0,"Solana Ecosystem, Meme, Solana Meme"
FIO,fio-protocol,FIO Protocol,FIO,14481038,17778276.0,5438524.0,"Smart Contract Platform, Layer 1 (L1), YZi Labs (Prev. Binance Labs) Portfolio"
BDC,billion-dollar-cat-runes,Billy (Bitcoin),BDC,13926534,13926534.0,56212.0,"Solana Ecosystem, Meme, Cat-Themed, Bitcoin Ecosystem, Runes"
VICE,vice-2,VICE,VICE,13814505,17591755.0,363290.0,"Gaming (GameFi), Ethereum Ecosystem"
VOXEL,voxies,Voxies,VOXEL,13084828,16136679.0,7924829.0,"Gaming (GameFi), NFT, Polygon Ecosystem, Binance Launchpad, RPG, Gaming Utility Token, Strategy Games, YZi Labs (Prev. Binance Labs) Portfolio"
HIFI,hifi-finance,Hifi Finance,HIFI,12676437,14123086.0,7674937.0,"Tokenized Real Estate, Decentralized Finance (DeFi), Tokenized Assets, Lending/Borrowing Protocols, Ethereum Ecosystem, Real World Assets (RWA), Made in USA"
HANDY,handy,Handy,HANDY,11569025,22179999.0,63116.0,Ethereum Ecosystem
BXX,baanx,Baanx,BXX,10655656,10655656.0,95864.0,Ethereum Ecosystem
MANEKI,maneki,MANEKI,MANEKI,10511772,10547616.0,2856200.0,"Solana Ecosystem, Meme, Solana Meme, Cat-Themed"
PUSS,puss,Puss,PUSS,9774033,9774033.0,459164.0,"Meme, Tron Ecosystem, TRON Meme"
HTR,hathor,Hathor,HTR,9389361,16414922.0,476217.0,"Infrastructure, Smart Contract Platform, Layer 1 (L1), Real World Assets (RWA), Proof of Work (PoW), Directed Acyclic Graph (DAG)"
AURA,aura-2,Aura,AURA,8626703,24408138.0,1.99,"Artificial Intelligence (AI), Base Ecosystem, AI Framework"
PROS,prosper,Prosper [OLD],PROS,8485147,16509734.0,171.78,"Decentralized Finance (DeFi), BNB Chain Ecosystem, Polygon Ecosystem, Ethereum Ecosystem"
HTM,hatom,Hatom,HTM,8400000,15804581.0,202709.0,"Decentralized Finance (DeFi), Lending/Borrowing Protocols, Meme, MultiversX Ecosystem, Liquid Staking"
SWELL,layerzero-bridged-swell,Layerzero Bridged Swell,SWELL,8139317,8139317.0,10627.98,"Liquid Staking Governance Tokens, Liquid Restaking Governance Tokens, Bridged-Tokens, Swellchain Ecosystem"
EAI,eagle-ai,Eagle AI,EAI,8122061,20129114.0,3130122.0,"Analytics, Base Ecosystem"
RX,reachx-mainnet,ReachX Mainnet,RX,7742521,15485042.0,1010.57,"SocialFi, Meme, Base Ecosystem"
TJRM,tajir-tech-hub,Tajir Tech Hub,TJRM,7163640,7163640.0,393436.0,Solana Ecosystem
SYNTH,synth-2,Synth,SN50,6960843,7010381.0,77522.0,"Artificial Intelligence (AI), Bittensor Ecosystem, Bittensor Subnets"
ZYPTO,french-connection-finance,Zypto Token,ZYPTO,6650449,6650449.0,14151.73,Ethereum Ecosystem
BCB,bitcoin-bit,Bitcoin Bit,BCB,6437961,31500761.0,4.5,"Ethereum Ecosystem, Proof of Stake (PoS)"
SABAI,sabai-ecovers,Sabai Protocol,SABAI,6256271,31494407.0,4584070.0,"Polygon Ecosystem, Ethereum Ecosystem"
DEFI,de-fi,DeFi,DEFI,6164391,6164391.0,846099.0,"BNB Chain Ecosystem, Solana Ecosystem, Ethereum Ecosystem, DeFiance Capital Portfolio, Consensys Portfolio, OKX Ventures Portfolio"
DEFX,definity,DeFinity,DEFX,5869295,6576204.0,5943.57,"BNB Chain Ecosystem, Ethereum Ecosystem"
SEXY,settled-ethxy-token,Settled EthXY Token,SEXY,5677636,5677636.0,60805.0,"Gaming (GameFi), Ethereum Ecosystem, Base Ecosystem, Andreessen Horowitz (a16z) Portfolio"
GRIFT,orbit-3,ORBIT,GRIFT,5304001,6027282.0,1704836.0,"Artificial Intelligence (AI), Solana Ecosystem, AI Agents, Pump.fun Ecosystem, Binance Alpha Spotlight, DeFAI"
NRS,nereus-token,Nereus,NRS,4672433,119783993.0,186666.0,"Decentralized Finance (DeFi), Derivatives, Polygon Ecosystem"
NYA,nya,Nya,NYA,4566956,4574809.0,16280.77,"BNB Chain Ecosystem, Avalanche Ecosystem, Polygon Ecosystem, Meme, Arbitrum Ecosystem, Ethereum Ecosystem, Optimism Ecosystem, Base Ecosystem, Cat-Themed"
VAI,vai,Vai,VAI,4564579,4564579.0,2330.34,"Stablecoins, Decentralized Finance (DeFi), USD Stablecoin, BNB Chain Ecosystem, Crypto-backed Stablecoin, Fiat-backed Stablecoin"
IRIS,i-r-i-s,I.R.I.S,IRIS,4308954,8617909.0,2001243.0,"Artificial Intelligence (AI), Analytics, Ethereum Ecosystem, AI Agents, Virtuals Protocol Ecosystem"
DOLZ,dolz-io,DOLZ.io,DOLZ,4274188,4274188.0,10464.78,"Artificial Intelligence (AI), Gaming (GameFi), NFT, Polygon Ecosystem, Ethereum Ecosystem, Base Ecosystem, Card Games, AI Agents"
XMR,monero,Monero,XMR,6007270110,6007270110.0,69325411.0,"Smart Contract Platform, Privacy, Layer 1 (L1), Proof of Work (PoW), Galaxy Digital Portfolio"
MNT,mantle,Mantle,MNT,2695372656,4980511143.0,277646861.0,"Smart Contract Platform, Ethereum Ecosystem, Layer 2 (L2), Mantle Ecosystem, DWF Labs Portfolio, DragonFly Capital Portfolio, GMCI Layer 2 Index, GMCI 30 Index, GMCI Index, World Liberty Financial Portfolio"
SPX,spx6900,SPX6900,SPX,1679153946,1679153946.0,65150428.0,"Solana Ecosystem, Meme, Ethereum Ecosystem, Base Ecosystem, Bridged-Tokens, Murad Picks, Stock market-themed, 4chan-Themed"
VIRTUAL,virtual-protocol,Virtuals Protocol,VIRTUAL,1159422625,1769759930.0,131193149.0,"Artificial Intelligence (AI), Solana Ecosystem, Ethereum Ecosystem, Base Ecosystem, AI Agents, Virtuals Protocol Ecosystem, AI Agent Launchpad, Binance Alpha Spotlight"
JASMY,jasmycoin,JasmyCoin,JASMY,821957271,848778677.0,35337066.0,"Internet of Things (IOT), Ethereum Ecosystem, DePIN, DWF Labs Portfolio, Coinbase 50 Index"
SAND,the-sandbox,The Sandbox,SAND,802140504,983876567.0,63306404.0,"Gaming (GameFi), NFT, Metaverse, Polygon Ecosystem, Play To Earn, Harmony Ecosystem, Ethereum Ecosystem, Animoca Brands Portfolio, Alleged SEC Securities, Binance Launchpad, Gaming Utility Token, Simulation Games, Energi Ecosystem, YZi Labs (Prev. Binance Labs) Portfolio, Coinbase 50 Index"
JTO,jito-governance-token,Jito,JTO,694164242,1952461863.0,30063578.0,"Decentralized Finance (DeFi), Solana Ecosystem, Liquid Staking Governance Tokens, Multicoin Capital Portfolio, Alameda Research Portfolio, Delphi Ventures Portfolio, Liquid Staking, Made in USA"
MORPHO,morpho,Morpho,MORPHO,639453226,1996552238.0,22576512.0,"Decentralized Finance (DeFi), Lending/Borrowing Protocols, Ethereum Ecosystem, Base Ecosystem, Coinbase Ventures Portfolio, Pantera Capital Portfolio, Morpho Ecosystem, Binance Alpha Spotlight"
DOGE,binance-peg-dogecoin,Binance-Peg Dogecoin,DOGE,634039490,634039490.0,10387788.0,"BNB Chain Ecosystem, Meme, Binance-Peg Tokens"
XCN,chain-2,Onyxcoin,XCN,633616895,893940390.0,15942784.0,"Smart Contract Platform, BNB Chain Ecosystem, Layer 1 (L1), Ethereum Ecosystem, Base Ecosystem, Proof of Stake (PoS), Pantera Capital Portfolio, Made in USA"
RUNE,thorchain,THORChain,RUNE,585136591,708406934.0,97108235.0,"Decentralized Exchange (DEX), Infrastructure, Smart Contract Platform, Exchange-based Tokens, Decentralized Finance (DeFi), Bridge Governance Tokens, Multicoin Capital Portfolio, Proof of Stake (PoS), Delphi Ventures Portfolio"
STRK,starknet,Starknet,STRK,506118663,1408138425.0,48962921.0,"Infrastructure, Smart Contract Platform, Ethereum Ecosystem, Layer 2 (L2), Zero Knowledge (ZK), Starknet Ecosystem, Paradigm Portfolio, Coinbase Ventures Portfolio, Rollup, Multicoin Capital Portfolio, Alameda Research Portfolio, Pantera Capital Portfolio, GMCI Layer 2 Index, Consensys Portfolio, Sequoia Capital Portfolio, GMCI Index, Polychain Capital Portfolio"
XEC,ecash,eCash,XEC,464830902,464835940.0,51306843.0,"Smart Contract Platform, Layer 1 (L1), Bitcoin Fork, Proof of Work (PoW)"
POPCAT,popcat,Popcat,POPCAT,383101025,383101025.0,53731888.0,"Solana Ecosystem, Meme, Solana Meme, Cat-Themed, Murad Picks"
AMP,amp-token,Amp,AMP,344898807,408111603.0,9351269.0,"Decentralized Finance (DeFi), Near Protocol Ecosystem, Ethereum Ecosystem, Payment Solutions, Alleged SEC Securities, Pantera Capital Portfolio, Energi Ecosystem, Made in USA"
GRASS,grass,Grass,GRASS,314088565,1066812176.0,20997760.0,"Artificial Intelligence (AI), Solana Ecosystem, DePIN, Polychain Capital Portfolio, Binance Alpha Spotlight"
ZRX,0x,0x Protocol,ZRX,243184065,286639616.0,23736792.0,"Decentralized Exchange (DEX), Decentralized Finance (DeFi), Avalanche Ecosystem, Harmony Ecosystem, Ethereum Ecosystem, Coinbase Ventures Portfolio, Pantera Capital Portfolio, Energi Ecosystem, GMCI DeFi Index, Blockchain Capital Portfolio, GMCI Index, Made in USA"
OM,mantra-dao,MANTRA,OM,231528208,394314644.0,33879319.0,"Infrastructure, Smart Contract Platform, BNB Chain Ecosystem, Cosmos Ecosystem, Layer 1 (L1), Polygon Ecosystem, Ethereum Ecosystem, Real World Assets (RWA), Base Ecosystem, Osmosis Ecosystem, Mantra Ecosystem"
ORDI,ordinals,ORDI,ORDI,220792144,220792144.0,48913038.0,"Solana Ecosystem, BRC-20, Bitcoin Ecosystem, Inscriptions"
ASTR,astar,Astar,ASTR,212223238,221095080.0,10111660.0,"Smart Contract Platform, Polkadot Ecosystem, Layer 1 (L1), Ethereum Ecosystem, Layer 2 (L2), Alameda Research Portfolio, YZi Labs (Prev. Binance Labs) Portfolio, OKX Ventures Portfolio"
ETHW,ethereum-pow-iou,EthereumPoW,ETHW,201579803,201579803.0,11464052.0,"Smart Contract Platform, EthereumPoW Ecosystem, Proof of Work (PoW)"
SUSHI,sushi,Sushi,SUSHI,190181176,280467348.0,299277699.0,"Decentralized Exchange (DEX), Exchange-based Tokens, Decentralized Finance (DeFi), Yield Farming, Automated Market Maker (AMM), BNB Chain Ecosystem, Yearn Ecosystem, Solana Ecosystem, Avalanche Ecosystem, Polygon Ecosystem, Near Protocol Ecosystem, Fantom Ecosystem, Harmony Ecosystem, Arbitrum Ecosystem, Celo Ecosystem, Ethereum Ecosystem, Base Ecosystem, Alameda Research Portfolio, Pantera Capital Portfolio, Energi Ecosystem, Sora Ecosystem, Blockchain Capital Portfolio"
GOMINING,gmt-token,GoMining Token,GOMINING,189352035,189352035.0,12970238.0,"Gaming (GameFi), BNB Chain Ecosystem, Ethereum Ecosystem, TON Ecosystem"
RPL,rocket-pool,Rocket Pool,RPL,161709773,161709773.0,13394972.0,"Business Services, Infrastructure, Smart Contract Platform, Decentralized Finance (DeFi), Polygon Ecosystem, Arbitrum Ecosystem, Ethereum Ecosystem, Liquid Staking Governance Tokens, Coinbase Ventures Portfolio, Proof of Stake (PoS), Index Coop Defi Index, Consensys Portfolio, Liquid Staking"
ZEN,zencash,Horizen,ZEN,152418610,152423183.0,8841841.0,"Smart Contract Platform, Masternodes, Zero Knowledge (ZK), Proof of Work (PoW), Made in USA"
SXP,swipe,Solar,SXP,138425223,138679482.0,5793895.0,"BNB Chain Ecosystem, Harmony Ecosystem, Ethereum Ecosystem, Alameda Research Portfolio, YZi Labs (Prev. Binance Labs) Portfolio"
XPR,proton,XPR Network,XPR,138038684,152402225.0,17661436.0,"Smart Contract Platform, BNB Chain Ecosystem, Ethereum Ecosystem, DWF Labs Portfolio, Made in USA"
SKL,skale,SKALE,SKL,136603250,143701959.0,8061949.0,"Smart Contract Platform, Gaming (GameFi), Layer 1 (L1), Ethereum Ecosystem, Modular Blockchain, Account Abstraction, Multicoin Capital Portfolio, Gaming Blockchains, Gaming Utility Token, Skale Ecosystem, Consensys Portfolio, Galaxy Digital Portfolio, Made in USA"
COOKIE,cookie,Cookie DAO,COOKIE,115844301,195862017.0,13123125.0,"Artificial Intelligence (AI), Marketing, Analytics, BNB Chain Ecosystem, Ethereum Ecosystem, Animoca Brands Portfolio, Base Ecosystem, AI Agents, Binance Alpha Spotlight, InfoFi"
VRA,verasity,Verasity,VRA,112967343,130032368.0,5463576.0,"Entertainment, Wallets, Ethereum Ecosystem"
HONEY,hivemapper,Hivemapper,HONEY,105528028,151053695.0,868802.0,"Solana Ecosystem, DePIN, Multicoin Capital Portfolio, Made in USA"
