ALEX,alexgo,ALEX Lab,ALEX,13686463.0,15984939.0,518499.0,"Decentralized Finance (DeFi), Lending/Borrowing Protocols, Ethereum Ecosystem, DWF Labs Portfolio, Mode Ecosystem, Stacks Ecosystem, BTCfi Protocol"
OCTA,octaspace,OctaSpace,OCTA,13656675.0,13656791.0,725478.0,"Artificial Intelligence (AI), Internet of Things (IOT), Smart Contract Platform, BNB Chain Ecosystem, Layer 1 (L1), Ethereum Ecosystem, DePIN, AI Agents"
BASEDAI,basedai,BasedAI,BASEDAI,11386718.0,11386718.0,52904.0,"Artificial Intelligence (AI), Ethereum Ecosystem, AI Agents"
ALU,altura,Altura,ALU,10912820.0,10912820.0,6742704.0,"Artificial Intelligence (AI), Infrastructure, Gaming (GameFi), NFT, BNB Chain Ecosystem, NFT Marketplace, Base Ecosystem, Gaming Platform, Made in USA, Gaming Marketplace"
FLAY,flayer,Flayer,FLAY,10528376.0,17547293.0,105452.0,"Launchpad, Ethereum Ecosystem"
CEEK,ceek,CEEK Smart VR,CEEK,10136173.0,10471254.0,964757.0,"Entertainment, BNB Chain Ecosystem, Metaverse, Ethereum Ecosystem, DWF Labs Portfolio"
TKO,tokocrypto,Tokocrypto,TKO,9999118.0,66660790.0,1325887.0,"BNB Chain Ecosystem, Binance Launchpad, YZi Labs (Prev. Binance Labs) Portfolio"
DEXTF,dextf,Memento,DEXTF,9972411.0,15153974.0,156520.0,"Decentralized Finance (DeFi), Asset Manager, Avalanche Ecosystem, Ethereum Ecosystem, ZkSync Ecosystem, Real World Assets (RWA)"
EOS,binance-peg-eos,Binance-Peg EOS,EOS,9950463.0,9950463.0,26045.0,"Smart Contract Platform, BNB Chain Ecosystem, Binance-Peg Tokens"
GRAIL,camelot-token,Camelot Token,GRAIL,8846224.0,34479091.0,611657.0,"Decentralized Exchange (DEX), Arbitrum Ecosystem, Camelot Launchpad"
MLG,360noscope420blazeit,360noscope420blazeit,MLG,8714852.0,8714852.0,517255.0,"Solana Ecosystem, Meme, Solana Meme"
MAVIA,heroes-of-mavia,Heroes of Mavia,MAVIA,7450867.0,36085740.0,3739423.0,"Gaming (GameFi), NFT, Ethereum Ecosystem, Animoca Brands Portfolio, Base Ecosystem, Gaming Governance Token, Strategy Games, Alameda Research Portfolio, YZi Labs (Prev. Binance Labs) Portfolio, Delphi Ventures Portfolio, Action Games"
XX,xxcoin,XX Network,XX,7012976.0,20088649.0,183332.0,"Smart Contract Platform, Layer 1 (L1), Ethereum Ecosystem"
KASTA,kasta,Kasta,KASTA,6944601.0,13644864.0,282084.0,Polygon Ecosystem
FNCT,financie-token,Financie Token,FNCT,6571410.0,32220512.0,98498.0,Ethereum Ecosystem
WEXO,wexo,Wexo,WEXO,6498143.0,17034710.0,126713.0,"Ethereum Ecosystem, Base Ecosystem"
GTAI,gt-protocol,GT Protocol,GTAI,6354539.0,11745340.0,1543269.0,"Artificial Intelligence (AI), BNB Chain Ecosystem, DeFAI"
GLQ,graphlinq-protocol,GraphLinq Chain,GLQ,6192210.0,9106190.0,205522.0,"Artificial Intelligence (AI), Business Services, Infrastructure, Smart Contract Platform, Analytics, Layer 1 (L1), Ethereum Ecosystem, DWF Labs Portfolio, AI Agents, DeFAI"
PORTAL,portal-2,Portal,PORTAL,5715760.0,34198543.0,57216277.0,"Gaming (GameFi), Solana Ecosystem, Ethereum Ecosystem, Gaming Platform"
MODE,mode,Mode,MODE,5607698.0,20776649.0,2097014.0,"Artificial Intelligence (AI), Infrastructure, Smart Contract Platform, Layer 2 (L2), Mode Ecosystem, Optimism Superchain Ecosystem, DeFAI"
ZYN,zyncoin-2,ZynCoin,ZYN,5577546.0,5577546.0,73629.0,"Solana Ecosystem, Meme, Ethereum Ecosystem, Parody Meme"
PAIN,pain,Pain,PAIN,5484659.0,10969377.0,699653.0,"Solana Ecosystem, Meme, Solana Meme, 4chan-Themed"
TRADE,polytrade,Polytrade,TRADE,5320946.0,12453014.0,63752.0,"BNB Chain Ecosystem, Polygon Ecosystem, Arbitrum Ecosystem, Ethereum Ecosystem, Real World Assets (RWA), Base Ecosystem, DWF Labs Portfolio"
OFN,openfabric,Openfabric AI,OFN,5163215.0,13338485.0,148728.0,"Artificial Intelligence (AI), BNB Chain Ecosystem, ChainGPT Launchpad, Poolz Finance Launchpad, AI Agents, AI Applications, AI Framework"
FLIX,omniflix-network,OmniFlix Network,FLIX,5150229.0,5712484.0,4622.81,"NFT, Osmosis Ecosystem, Archway Ecosystem"
CANTO,canto,CANTO,CANTO,5098217.0,8378808.0,222436.0,"Smart Contract Platform, Layer 1 (L1), Ethereum Ecosystem, Canto Ecosystem, Real World Assets (RWA), Osmosis Ecosystem, Parallelized EVM"
YULI,yuli,YULI,YULI,5080210.0,5080210.0,252358.0,"Gaming (GameFi), NFT, Meme, Kaia Ecosystem, Card Games, Gaming Utility Token, Anime-Themed"
FUTURE,futurecoin,FutureCoin,FUTURE,4375189.0,13577987.0,59470.0,BNB Chain Ecosystem
QORPO,qopro,QORPO WORLD,QORPO,4339400.0,7673437.0,925316.0,"Gaming (GameFi), NFT, BNB Chain Ecosystem, Play To Earn, Ethereum Ecosystem, RPG, Gaming Utility Token, Adventure Games, Gaming Platform, Action Games"
SRM,serum,Serum,SRM,4336451.0,12712696.0,249421.0,"Decentralized Exchange (DEX), Exchange-based Tokens, Decentralized Finance (DeFi), Solana Ecosystem, Ethereum Ecosystem, FTX Holdings, Multicoin Capital Portfolio, Energi Ecosystem, Viction Ecosystem"
ARCA,arca,Legend of Arcadia,ARCA,4219727.0,20515305.0,174368.0,"Gaming (GameFi), Ethereum Ecosystem, RPG"
GENOME,genomesdao-genome,GenomesDAO GENOME,GENOME,4168389.0,4168389.0,7611.5,"Ethereum Ecosystem, Base Ecosystem, Decentralized Science (DeSci)"
POLYDOGE,polydoge,PolyDoge,POLYDOGE,4081594.0,4087355.0,305906.0,"NFT, Polygon Ecosystem, Meme, Dog-Themed"
TREAT,shiba-inu-treat,Shiba Inu Treat,TREAT,3707849.0,17232775.0,6756153.0,"Meme, Ethereum Ecosystem, Dog-Themed"
SAINT,carlo-acutis,Carlo Acutis,SAINT,3467299.0,3467299.0,567075.0,"Solana Ecosystem, Meme, Solana Meme, Pump.fun Ecosystem"
IZI,izumi-finance,iZUMi Finance,IZI,3411836.0,8666080.0,246429.0,"Decentralized Exchange (DEX), Decentralized Finance (DeFi), Automated Market Maker (AMM), BNB Chain Ecosystem, Polygon Ecosystem, Arbitrum Ecosystem, Ethereum Ecosystem, ZkSync Ecosystem, Mantle Ecosystem, Linea Ecosystem, Base Ecosystem, Manta Network Ecosystem, Scroll Ecosystem"
WINR,winr-protocol,WINR Protocol,WINR,3330213.0,4504883.0,26446.0,"Gambling (GambleFi), Infrastructure, Smart Contract Platform, Solana Ecosystem, Arbitrum Ecosystem, Camelot Launchpad, Layer 3 (L3)"
SOLAMA,solama,Solama,SOLAMA,3301957.0,3301957.0,175171.0,"Gambling (GambleFi), Solana Ecosystem, Meme, Solana Meme"
QBX,qbx,QBX,QBX,3137450.0,3137450.0,74731.0,Ethereum Ecosystem
SHIDO,shido-2,Shido Network,SHIDO,2943953.0,2943957.0,159281.0,"Ethereum Ecosystem, Osmosis Ecosystem, Shido Network Ecosystem"
FORWARD,forward,Forward,FORWARD,2707760.0,2710825.0,144463.0,"BNB Chain Ecosystem, Ethereum Ecosystem"
GMM,gamium,Gamium,GMM,2575539.0,2629987.0,174542.0,"SocialFi, Gaming (GameFi), BNB Chain Ecosystem, Metaverse, DaoMaker Launchpad, Ethereum Ecosystem, Gaming Governance Token, Gaming Utility Token"
BAX,babb,BABB,BAX,2440294.0,2455642.0,18856.1,Ethereum Ecosystem
DEOD,decentrawood,Decentrawood,DEOD,2282495.0,2282495.0,212158.0,"Gaming (GameFi), BNB Chain Ecosystem, Metaverse, Solana Ecosystem, Polygon Ecosystem"
MOVE,bluemove,BlueMove,MOVE,2215449.0,3055792.0,59480.0,"NFT, Aptos Ecosystem, Sui Ecosystem"
4EVER,4everland,4EVERLAND,4EVER,2084115.0,12662979.0,249348.0,"Artificial Intelligence (AI), BNB Chain Ecosystem, Ethereum Ecosystem, DePIN, AI Framework"
ETF500,elon-trump-fart,Elon Trump Fart,ETF500,1864132.0,1864132.0,197552.0,"Solana Ecosystem, Meme, Elon Musk-Inspired, Solana Meme, PolitiFi, Pump.fun Ecosystem, Stock market-themed"
STETH,staked-ether,Lido Staked Ether,STETH,23417256522.0,23417404090.0,68106103.0,"Decentralized Finance (DeFi), Liquid Staking Tokens, Ethereum Ecosystem, Liquid Staked ETH, Liquid Staking"
APT,aptos,Aptos,APT,3059389391.0,5471464617.0,232606991.0,"Smart Contract Platform, Layer 1 (L1), Aptos Ecosystem, FTX Holdings, Coinbase Ventures Portfolio, Multicoin Capital Portfolio, Proof of Stake (PoS), DragonFly Capital Portfolio, Andreessen Horowitz (a16z) Portfolio, YZi Labs (Prev. Binance Labs) Portfolio, GMCI Layer 1 Index, GMCI 30 Index, Circle Ventures Portfolio, GMCI Index, Made in USA"
SAROS,saros-finance,Saros,SAROS,588977234.0,2243722943.0,5430695.0,"Solana Ecosystem, Payment Solutions, Viction Ecosystem"
KAITO,kaito,KAITO,KAITO,389097232.0,1611910280.0,135868084.0,"Artificial Intelligence (AI), Analytics, Base Ecosystem, Binance HODLer Airdrops, InfoFi"
TWT,trust-wallet-token,Trust Wallet,TWT,296201064.0,710911161.0,8468912.0,"BNB Chain Ecosystem, Wallets, Account Abstraction, Energi Ecosystem"
TFUEL,theta-fuel,Theta Fuel,TFUEL,232795443.0,232800017.0,3749238.0,"Smart Contract Platform, DePIN, Proof of Stake (PoS), Made in USA"
KSM,kusama,Kusama,KSM,222864893.0,222871707.0,11899924.0,"Smart Contract Platform, Polkadot Ecosystem, Proof of Stake (PoS), Pantera Capital Portfolio, Made in USA, Coinbase 50 Index, Hydration Ecosystem"
ZRO,layerzero,LayerZero,ZRO,215572251.0,1939421638.0,39902451.0,"Smart Contract Platform, BNB Chain Ecosystem, Avalanche Ecosystem, Polygon Ecosystem, Arbitrum Ecosystem, Ethereum Ecosystem, Optimism Ecosystem, Base Ecosystem, Multicoin Capital Portfolio, Layer 0 (L0), Cross-chain Communication, Circle Ventures Portfolio, Sequoia Capital Portfolio, OKX Ventures Portfolio"
BLUR,blur,Blur,BLUR,178577454.0,222700290.0,15793367.0,"NFT, Ethereum Ecosystem, NFT Marketplace, FTX Holdings, NFTFi, eGirl Capital Portfolio, Paradigm Portfolio, GMCI DeFi Index, GMCI Index, Made in USA, Coinbase 50 Index"
TRIBE,tribe-2,Tribe,TRIBE,167330555.0,367746909.0,132504.0,"Decentralized Finance (DeFi), Ethereum Ecosystem, Stablecoin Protocol"
T,threshold-network-token,Threshold Network,T,164653628.0,181309146.0,14144908.0,"Decentralized Finance (DeFi), Solana Ecosystem, Ethereum Ecosystem, Optimism Ecosystem, Base Ecosystem, Cross-chain Communication, BTCfi Protocol"
QUBIC,qubic-network,Qubic,QUBIC,161048783.0,201125100.0,2850631.0,"Artificial Intelligence (AI), Smart Contract Platform, Layer 1 (L1), Proof of Work (PoW)"
HOT,holotoken,Holo,HOT,153873549.0,153873549.0,7613912.0,"Smart Contract Platform, Storage, Harmony Ecosystem, Arbitrum Ecosystem, Ethereum Ecosystem, DePIN, Base Ecosystem, Energi Ecosystem, Sora Ecosystem, GMCI DePIN Index, GMCI Index"
ONE,harmony,Harmony,ONE,152646814.0,152651590.0,8093675.0,"Smart Contract Platform, Layer 1 (L1), Harmony Ecosystem, Animoca Brands Portfolio, Binance Launchpad, YZi Labs (Prev. Binance Labs) Portfolio, Made in USA"
CSPR,casper-network,Casper Network,CSPR,149985972.0,155284508.0,4382566.0,"Smart Contract Platform, Layer 1 (L1), Real World Assets (RWA), Proof of Stake (PoS), GMCI Layer 1 Index, GMCI Index, Made in USA"
ANKR,ankr,Ankr Network,ANKR,145738463.0,145738463.0,16505061.0,"BNB Chain Ecosystem, Avalanche Ecosystem, Polygon Ecosystem, Fantom Ecosystem, Arbitrum Ecosystem, Ethereum Ecosystem, Optimism Ecosystem, Liquid Staking Governance Tokens, Linea Ecosystem, DePIN, Scroll Ecosystem, Rollups-as-a-Service (RaaS), Blast Ecosystem, Mode Ecosystem, Pantera Capital Portfolio, Polygon zkEVM Ecosystem, YZi Labs (Prev. Binance Labs) Portfolio, Liquid Staking, Made in USA"
GOHOME,gohome,GOHOME,GOHOME,129105746.0,2460847320.0,9258943.0,"Solana Ecosystem, Meme"
SWFTC,swftcoin,SWFTCOIN,SWFTC,105828941.0,105828941.0,1576845.0,"Exchange-based Tokens, NFT, BNB Chain Ecosystem, Ethereum Ecosystem"
ACT,acet-token,Acet,ACT,103254835.0,134710374.0,218562.0,BNB Chain Ecosystem
XVS,venus,Venus,XVS,99529379.0,177695522.0,7869085.0,"Decentralized Finance (DeFi), Yield Farming, BNB Chain Ecosystem, Binance Launchpool, Lending/Borrowing Protocols, Arbitrum Ecosystem, Ethereum Ecosystem, Optimism Ecosystem, ZkSync Ecosystem, opBNB Ecosystem, Unichain Ecosystem"
MPLX,metaplex,Metaplex,MPLX,96288769.0,116362128.0,8506917.0,"Gaming (GameFi), NFT, Solana Ecosystem, Animoca Brands Portfolio, FTX Holdings, Multicoin Capital Portfolio, Alameda Research Portfolio"
ACH,alchemy-pay,Alchemy Pay,ACH,92615070.0,187339923.0,30923253.0,"BNB Chain Ecosystem, Ethereum Ecosystem, Payment Solutions, DWF Labs Portfolio"
NMD,nexusmind,NexusMind,NMD,89452297.0,872918243.0,149388.0,"SocialFi, BNB Chain Ecosystem"
HSK,hashkey-ecopoints,HashKey Platform Token,HSK,86750997.0,654724507.0,5214308.0,"Exchange-based Tokens, Centralized Exchange (CEX) Token, Ethereum Ecosystem"
BLAST,blast,Blast,BLAST,82670406.0,201237644.0,11569102.0,"Smart Contract Platform, Layer 2 (L2), eGirl Capital Portfolio, Paradigm Portfolio, Blast Ecosystem"
PHA,pha,PHALA,PHA,80719859.0,100732106.0,11140564.0,"Artificial Intelligence (AI), Infrastructure, Smart Contract Platform, Oracle, Polkadot Ecosystem, Ethereum Ecosystem, Interoperability, Layer 2 (L2), Zero Knowledge (ZK), DePIN, DWF Labs Portfolio, Rollup, AI Agents, Sora Ecosystem, AI Framework, Made in USA"
SGB,songbird,Songbird,SGB,79781773.0,94615872.0,340061.0,Smart Contract Platform
CETUS,cetus-protocol,Cetus Protocol,CETUS,76577928.0,94735582.0,15240934.0,"Decentralized Exchange (DEX), Decentralized Finance (DeFi), Sui Ecosystem, Animoca Brands Portfolio, OKX Ventures Portfolio, Dex Aggregator"
GLMR,moonbeam,Moonbeam,GLMR,64714528.0,77213633.0,6644119.0,"Smart Contract Platform, Polkadot Ecosystem, Layer 1 (L1), Coinbase Ventures Portfolio, Proof of Stake (PoS), YZi Labs (Prev. Binance Labs) Portfolio"
RIF,rif-token,Rootstock Infrastructure Framework,RIF,54713958.0,54713958.0,2811779.0,"Solana Ecosystem, Arbitrum Ecosystem, Ethereum Ecosystem, Base Ecosystem, Rootstock Ecosystem, Outlier Ventures Portfolio"
OMI,ecomi,ECOMI,OMI,51375355.0,58946676.0,1645059.0,"Gaming (GameFi), NFT, Metaverse, Collectibles, Play To Earn, Ethereum Ecosystem, Base Ecosystem, Energi Ecosystem"
CCD,concordium,Concordium,CCD,45687994.0,55174870.0,697604.0,"Smart Contract Platform, Layer 1 (L1), Decentralized Identifier (DID), Zero Knowledge (ZK)"
CTK,certik,Shentu,CTK,45397706.0,45576641.0,4924047.0,"Business Services, Binance Launchpool, Osmosis Ecosystem, Coinbase Ventures Portfolio, Cybersecurity, YZi Labs (Prev. Binance Labs) Portfolio, OKX Ventures Portfolio"
MNSRY,mansory-token,Mansory Token,MNSRY,44562097.0,44562097.0,2160334.0,"Retail, BNB Chain Ecosystem, Solana Ecosystem, Real World Assets (RWA), Pump.fun Ecosystem"
WILD,wilder-world,Wilder World,WILD,44331152.0,68344024.0,962984.0,"Gaming (GameFi), NFT, Metaverse, Solana Ecosystem, Play To Earn, Ethereum Ecosystem, Animoca Brands Portfolio, Gaming Governance Token, Racing Games, Simulation Games, Action Games"
SFUND,seedify-fund,Seedify.fund,SFUND,43456877.0,68368368.0,4391705.0,"Gaming (GameFi), BNB Chain Ecosystem, Launchpad, Arbitrum Ecosystem, Ethereum Ecosystem, DWF Labs Portfolio"
C98,coin98,Coin98,C98,43418256.0,44902547.0,8474990.0,"Decentralized Finance (DeFi), BNB Chain Ecosystem, Solana Ecosystem, Wallets, Polygon Ecosystem, Ethereum Ecosystem, Binance Launchpad, DWF Labs Portfolio, Multicoin Capital Portfolio, Alameda Research Portfolio, Viction Ecosystem, YZi Labs (Prev. Binance Labs) Portfolio"
DODO,dodo,DODO,DODO,39371072.0,39371072.0,6067670.0,"Decentralized Exchange (DEX), Exchange-based Tokens, Decentralized Finance (DeFi), BNB Chain Ecosystem, Binance Launchpool, Polygon Ecosystem, Near Protocol Ecosystem, Arbitrum Ecosystem, Ethereum Ecosystem, DWF Labs Portfolio, Coinbase Ventures Portfolio, Alameda Research Portfolio, DeFiance Capital Portfolio, Pantera Capital Portfolio, Aurora Ecosystem, Energi Ecosystem, YZi Labs (Prev. Binance Labs) Portfolio, Galaxy Digital Portfolio"
STORJ,storj,Storj,STORJ,36147200.0,106842156.0,11381306.0,"Storage, Harmony Ecosystem, Ethereum Ecosystem, DePIN, Energi Ecosystem"
EDU,edu-coin,Open Campus,EDU,35205578.0,135351842.0,5157529.0,"Education, BNB Chain Ecosystem, Polygon Ecosystem, Ethereum Ecosystem, Binance Launchpad, YZi Labs (Prev. Binance Labs) Portfolio"
M87,messier,MESSIER,M87,31280067.0,31280067.0,751991.0,"Decentralized Finance (DeFi), Ethereum Ecosystem"
AVA,ava-ai,Ava AI,AVA,30548896.0,30548896.0,11206117.0,"Artificial Intelligence (AI), Solana Ecosystem, Meme, AI Meme, AI Agents, Pump.fun Ecosystem, Binance Alpha Spotlight, Made in USA"
ZEREBRO,zerebro,Zerebro,ZEREBRO,30090885.0,30090885.0,13279715.0,"Solana Ecosystem, Meme, Solana Meme, AI Meme, Pump.fun Ecosystem, Binance Alpha Spotlight"
LOFI,lofi-2,LOFI,LOFI,29937580.0,29937580.0,1494215.0,"Meme, Sui Ecosystem, Sui Meme"
FORTH,ampleforth-governance-token,Ampleforth Governance,FORTH,27593183.0,36854757.0,1951067.0,"Ethereum Ecosystem, Stablecoin Protocol"
PNG,pangolin,Pangolin,PNG,26526923.0,64760301.0,1004485.0,"Decentralized Exchange (DEX), Decentralized Finance (DeFi), Avalanche Ecosystem, Olympus Pro Ecosystem"
MMUI,metamui,MetaMUI,MMUI,26329817.0,44227693.0,265260.0,Avalanche Ecosystem
ELX,elixir-finance,Elixir,ELX,25567033.0,98611532.0,12920853.0,"Decentralized Finance (DeFi), Ethereum Ecosystem, Real World Assets (RWA), Stablecoin Protocol, RWA Protocol"
JELLYJELLY,jelly-my-jelly,Jelly-My-Jelly,JELLYJELLY,23161910.0,23161910.0,15802767.0,"Solana Ecosystem, Pump.fun Ecosystem"
UFD,unicorn-fart-dust,Unicorn Fart Dust,UFD,23101163.0,23101163.0,6234942.0,"Solana Ecosystem, Meme, Solana Meme, Pump.fun Ecosystem, Binance Alpha Spotlight, Made in USA"
PHB,phoenix-global,Phoenix,PHB,22979513.0,22979513.0,7146239.0,"Artificial Intelligence (AI), Oracle, NFT, BNB Chain Ecosystem, DePIN, Made in China"
DYDX,dydx,dYdX,ETHDYDX,22736506.0,486846982.0,20867466.0,"Decentralized Exchange (DEX), Exchange-based Tokens, Decentralized Finance (DeFi), Derivatives, Perpetuals, Ethereum Ecosystem, Paradigm Portfolio"
NEON,neon,Neon,NEON,22572809.0,94263315.0,1162032.0,"Smart Contract Platform, Solana Ecosystem, Neon Ecosystem, Parallelized EVM"
LAT,platon-network,PlatON Network,LAT,22110102.0,34262659.0,1643485.0,"Smart Contract Platform, Appchains"
PIKA,pikaboss,Pikaboss,PIKA,22046359.0,22046359.0,4613.99,"Meme, Ethereum Ecosystem"
BEL,bella-protocol,Bella Protocol,BEL,20492550.0,25615688.0,19762461.0,"Decentralized Finance (DeFi), Yield Farming, BNB Chain Ecosystem, Binance Launchpool, Yield Aggregator, Ethereum Ecosystem, Manta Network Ecosystem, YZi Labs (Prev. Binance Labs) Portfolio"
GHST,aavegotchi,Aavegotchi,GHST,19412926.0,20016507.0,5674213.0,"Smart Contract Platform, Gaming (GameFi), NFT, Metaverse, Collectibles, Polygon Ecosystem, Meme, Play To Earn, Ethereum Ecosystem, Gotchiverse, Base Ecosystem, Layer 3 (L3), RPG, Gaming Governance Token, Gaming Utility Token, Energi Ecosystem"
SIGMA,sigma,Sigma,SIGMA,18076605.0,18076605.0,1493255.0,"Solana Ecosystem, Meme, Solana Meme, Pump.fun Ecosystem, 4chan-Themed"
BR,bedrock-token,Bedrock,BR,16715506.0,79597649.0,444125926.0,"Decentralized Finance (DeFi), BNB Chain Ecosystem, Liquid Staking Governance Tokens, Berachain Ecosystem, BTCfi Protocol, Binance Wallet IDO"
CWEB,coinweb,Coinweb,CWEB,16656937.0,20701920.0,224983.0,"Smart Contract Platform, Wallets, Ethereum Ecosystem, Interoperability, Layer 2 (L2), Cross-chain Communication, Bitcoin Sidechains, SideChain"
QUICK,quick,Quickswap [OLD],QUICK,15757169.0,20925112.0,9894.55,"Decentralized Exchange (DEX), Exchange-based Tokens, Decentralized Finance (DeFi), Yield Farming, Automated Market Maker (AMM), Polygon Ecosystem, Ethereum Ecosystem"
BOTIFY,botify,BOTIFY,BOTIFY,15186939.0,15186939.0,1473921.0,"Artificial Intelligence (AI), Retail, Solana Ecosystem, E-commerce"
THE,thena,Thena,THE,14724288.0,69384221.0,13253235.0,"Decentralized Exchange (DEX), Decentralized Finance (DeFi), BNB Chain Ecosystem, opBNB Ecosystem, Binance HODLer Airdrops"
VARA,vara-network,Vara Network,VARA,14624932.0,42532956.0,475337.0,"Smart Contract Platform, Layer 1 (L1)"
BENJI,basenji,Basenji,BENJI,14553789.0,14553789.0,3221430.0,"Meme, Base Ecosystem, Dog-Themed, Base Meme"
STNK,stonks-4,Stonks,STNK,14071222.0,14071222.0,506447.0,"Solana Ecosystem, Meme, Solana Meme, Wall Street Bets Themed, Stock market-themed"
FIS,stafi,Stafi,FIS,12944988.0,12944988.0,16933806.0,"Decentralized Finance (DeFi), Ethereum Ecosystem, Liquid Staking Governance Tokens, Osmosis Ecosystem, Sora Ecosystem, Liquid Staking"
PIVX,pivx,PIVX,PIVX,12303311.0,12303391.0,4701461.0,"Smart Contract Platform, Privacy, Masternodes, Zero Knowledge (ZK), Proof of Stake (PoS)"
KOMA,koma-inu,Koma Inu,KOMA,11191038.0,11191038.0,2811730.0,"BNB Chain Ecosystem, Meme, Dog-Themed, Binance Alpha Spotlight, Made in USA"
NIBI,nibiru,Nibiru,NIBI,10064548.0,13350001.0,549047.0,"Infrastructure, Smart Contract Platform, Layer 1 (L1), Osmosis Ecosystem, Made in USA"
OIK,space-nation-oikos,Space Nation Oikos,OIK,10022685.0,60454097.0,470275.0,"Gaming (GameFi), NFT, BNB Chain Ecosystem, Immutable zkEVM Ecosystem, RPG, MMO"
OPUL,opulous,Opulous,OPUL,9714399.0,9714399.0,664637.0,"Artificial Intelligence (AI), Music, NFT, BNB Chain Ecosystem, Arbitrum Ecosystem, Ethereum Ecosystem, Algorand Ecosystem, Real World Assets (RWA), Telegram Apps, AI Applications"
XSWAP,xswap-2,XSwap,XSWAP,9632880.0,14018410.0,400853.0,"Decentralized Finance (DeFi), Ethereum Ecosystem, Base Ecosystem, Cross-chain Communication"
MASK,catwifmask,catwifmask,MASK,9374288.0,9374288.0,4744567.0,"Solana Ecosystem, Meme, Solana Meme, Cat-Themed, Pump.fun Ecosystem"
ROOT,the-root-network,The Root Network,ROOT,9072883.0,47812628.0,2433113.0,"Smart Contract Platform, Gaming (GameFi), Layer 1 (L1), Ethereum Ecosystem, Gaming Blockchains, Outlier Ventures Portfolio"
EVR,evernode,Evernode,EVR,8747612.0,17474278.0,10163.98,"Smart Contract Platform, Layer 2 (L2), DePIN"
RNT,reental,Reental,RNT,8037807.0,40547697.0,7595.7,"Tokenized Real Estate, Tokenized Assets, Polygon Ecosystem, Real World Assets (RWA), RWA Protocol"
HDRO,hydro-protocol-2,Hydro Protocol,HDRO,7763447.0,22612063.0,42889.0,Injective Ecosystem
AGRI,agridex-governance-token,AgriDex,AGRI,7214780.0,31432278.0,576995.0,"Tokenized Assets, Solana Ecosystem, Real World Assets (RWA), Tokenized Commodities"
MSM,musmecoin,MusmeCoin,MSM,7128789.0,13709170.0,30364.0,"Meme, Ethereum Ecosystem, Anime-Themed, Oasys Ecosystem"
GHUB,gemhub,GemHUB,GHUB,7069397.0,39544505.0,83573.0,Kaia Ecosystem
CSWAP,chainswap-3,ChainSwap,CSWAP,6895262.0,7234784.0,14711.11,"Decentralized Exchange (DEX), Decentralized Finance (DeFi), Ethereum Ecosystem, Cross-chain Communication"
ULTI,ultiverse,Ultiverse,ULTI,6815794.0,17011128.0,3062364.0,"Gaming (GameFi), BNB Chain Ecosystem, Ethereum Ecosystem, Animoca Brands Portfolio"
DINERO,dinero-2,Dinero,DINERO,6754032.0,10911471.0,28861.0,"Infrastructure, Decentralized Finance (DeFi), Lending/Borrowing Protocols, Ethereum Ecosystem, Metagovernance, Liquid Staking Governance Tokens, LSDFi, Curve Ecosystem, Liquid Staking"
CLY,colony,Colony,CLY,6335150.0,8433336.0,120907.0,Avalanche Ecosystem
GRPH,soul-graph,Soul Graph,GRPH,6315012.0,6315012.0,93929.0,"Artificial Intelligence (AI), Solana Ecosystem, Pump.fun Ecosystem, AI Applications"
U,u,U,U,6161662.0,6161662.0,276193.0,"BNB Chain Ecosystem, Meme"
DROP,drop-2,DROP,DROP,5596193.0,5596193.0,48779.0,"Meme, XRP Ledger Ecosystem"
DOLAN,dolan-duck,Dolan Duck,DOLAN,5530363.0,5530363.0,221079.0,"Solana Ecosystem, Meme, Solana Meme, Parody Meme, 4chan-Themed"
3ULL,playa3ull-games-2,PLAYA3ULL GAMES,3ULL,5523921.0,5532727.0,835905.0,"Smart Contract Platform, Gaming (GameFi), NFT, Avalanche Ecosystem, Play To Earn, Shooting Games, Avalanche L1, MMO"
LUCE,offcial-mascot-of-the-holy-year,Luce,LUCE,5165464.0,5165464.0,3942702.0,"Solana Ecosystem, Meme, Solana Meme, Pump.fun Ecosystem, Mascot-Themed, Binance Alpha Spotlight"
REDO,resistance-dog,Resistance Dog,REDO,5149631.0,5149631.0,806054.0,"Meme, Dog-Themed, TON Ecosystem, TON Meme"
STAT,stat,STAT,STAT,5073325.0,6933302.0,2982538.0,"Media, Ethereum Ecosystem"
CATE,catecoin,CateCoin,CATE,5033708.0,5247799.0,181446.0,"Entertainment, Gaming (GameFi), Yield Farming, NFT, BNB Chain Ecosystem, Yield Aggregator, Launchpad, Wallets, Meme, Play To Earn, Ethereum Ecosystem, Base Ecosystem, Cat-Themed"
SNAI,swarmnode-ai,SwarmNode.ai,SNAI,4786282.0,5303366.0,3214607.0,"Artificial Intelligence (AI), Infrastructure, Solana Ecosystem, Pump.fun Ecosystem, AI Agent Launchpad, Binance Alpha Spotlight, AI Framework, DeFAI"
DCK,dexcheck,DexCheck AI,DCK,4773423.0,6503198.0,268450.0,"Artificial Intelligence (AI), Analytics, BNB Chain Ecosystem, Launchpad, Ethereum Ecosystem, ChainGPT Launchpad, Poolz Finance Launchpad, AI Agents, DeFAI, InfoFi"
XAR,arcana-token,Arcana Network,XAR,3999492.0,7342073.0,813857.0,"Infrastructure, Smart Contract Platform, Wallets, Ethereum Ecosystem, Modular Blockchain"
CPH,cypherium,Cypherium,CPH,3939056.0,49744705.0,2487.16,"Smart Contract Platform, Layer 1 (L1), Proof of Work (PoW), Pantera Capital Portfolio"
XFI,crossfi-2,CrossFi,XFI,3620079.0,32422171.0,729657.0,"Smart Contract Platform, Layer 2 (L2)"
XEL,xelis,Xelis,XEL,3583249.0,3583249.0,108449.0,"Smart Contract Platform, Privacy, Layer 1 (L1), Directed Acyclic Graph (DAG)"
KAS,kaspa,Kaspa,KAS,2055362014.0,2057853446.0,92252387.0,"Smart Contract Platform, Layer 1 (L1), Proof of Work (PoW), Kaspa Ecosystem, Made in USA, Directed Acyclic Graph (DAG)"
VET,vechain,VeChain,VET,1888011647.0,1888011647.0,35745884.0,"Internet of Things (IOT), Smart Contract Platform, Layer 1 (L1), VeChain Ecosystem, Made in China"
BONK,bonk,Bonk,BONK,1270034382.0,1456659711.0,333547217.0,"BNB Chain Ecosystem, Solana Ecosystem, Polygon Ecosystem, Meme, Arbitrum Ecosystem, Ethereum Ecosystem, Aptos Ecosystem, Dog-Themed, Solana Meme, Neon Ecosystem, GMCI Meme Index, GMCI Index, Made in USA, Coinbase 50 Index, 4chan-Themed"
GALA,gala,GALA,GALA,668257716.0,668257725.0,102026954.0,"Smart Contract Platform, Gaming (GameFi), NFT, Layer 1 (L1), Play To Earn, Ethereum Ecosystem, DWF Labs Portfolio, Gaming Platform, YZi Labs (Prev. Binance Labs) Portfolio, GalaChain Ecosystem, Made in USA"
FLOW,flow,Flow,FLOW,543775584.0,543775584.0,18602303.0,"Smart Contract Platform, Sports, NFT, Layer 1 (L1), Animoca Brands Portfolio, Alleged SEC Securities, Multicoin Capital Portfolio, Proof of Stake (PoS), Flow Ecosystem, Andreessen Horowitz (a16z) Portfolio"
BSV,bitcoin-cash-sv,Bitcoin SV,BSV,492150955.0,492150955.0,59325756.0,"Smart Contract Platform, Bitcoin Fork, Proof of Work (PoW)"
ETHFI,ether-fi,Ether.fi,ETHFI,380256785.0,1014862060.0,133884246.0,"Decentralized Finance (DeFi), Binance Launchpool, Arbitrum Ecosystem, Ethereum Ecosystem, Restaking, Liquid Restaking Governance Tokens, Ether.fi Ecosystem, Consensys Portfolio, OKX Ventures Portfolio"
