CLEAR,everclear,Everclear,CLEAR,18227362,35802246.0,149626.0,"Infrastructure, BNB Chain Ecosystem, Polygon Ecosystem, Gnosis Chain Ecosystem, Arbitrum Ecosystem, Ethereum Ecosystem, Optimism Ecosystem, Coinbase Ventures Portfolio, Cross-chain Communication, Chain Abstraction"
ZCX,unizen,Unizen,ZCX,17309211,25184801.0,1892729.0,"Decentralized Exchange (DEX), Exchange-based Tokens, Decentralized Finance (DeFi), Polygon Ecosystem, Ethereum Ecosystem, DWF Labs Portfolio"
PAID,paid-network,PAID,PAID,16891561,19352529.0,123632.0,"Launchpad, Base Ecosystem"
SEAM,seamless-protocol,Seamless Protocol,SEAM,16428550,41627084.0,419869.0,"Decentralized Finance (DeFi), Lending/Borrowing Protocols, Ethereum Ecosystem, Base Ecosystem"
BKN,brickken,Brickken,BKN,15833116,31704723.0,715850.0,"Tokenized Real Estate, Tokenized Assets, BNB Chain Ecosystem, Impossible Finance Launchpad, Ethereum Ecosystem, Real World Assets (RWA), RWA Protocol"
KRL,kryll,KRYLL,KRL,14716157,18248186.0,341560.0,"Artificial Intelligence (AI), Decentralized Finance (DeFi), Analytics, Arbitrum Ecosystem, Ethereum Ecosystem, Optimism Ecosystem, Base Ecosystem, AI Applications"
TUNA,defituna,DeFituna,TUNA,12582370,44697583.0,50622791.0,"Decentralized Exchange (DEX), Decentralized Finance (DeFi), Automated Market Maker (AMM), Lending/Borrowing Protocols, Solana Ecosystem"
LNQ,linqai,LinqAI,LNQ,12269544,40458817.0,879253.0,"Artificial Intelligence (AI), Ethereum Ecosystem"
LAZIO,lazio-fan-token,Lazio Fan Token,LAZIO,12083261,39869148.0,6309149.0,"Sports, BNB Chain Ecosystem, Fan Token, Binance Launchpad"
WUF,wuffi,WUFFI,WUF,11892625,11892625.0,25883.0,"Solana Ecosystem, Meme, Base Ecosystem"
MINIMA,minima,Minima,MINIMA,10494152,20142092.0,333633.0,"Smart Contract Platform, Layer 1 (L1), DePIN"
RWA,allo,Allo,RWA,9778669,54325941.0,5931624.0,"BNB Chain Ecosystem, Real World Assets (RWA), RWA Protocol"
STOS,stratos,Stratos,STOS,9490258,13893138.0,229234.0,"Entertainment, Infrastructure, Smart Contract Platform, Storage, Layer 1 (L1), Ethereum Ecosystem, DePIN, Osmosis Ecosystem"
TRUF,truflation,TRUF.Network,TRUF,9457184,25559061.0,716456.0,"Infrastructure, Oracle, Arbitrum Ecosystem, Ethereum Ecosystem, Real World Assets (RWA), Base Ecosystem, Coinbase Ventures Portfolio"
RFC,retard-finder-coin,Retard Finder Coin,RFC,7996076,8315614.0,8626446.0,"Solana Ecosystem, Meme, Pump.fun Ecosystem, Wojak-Themed"
BCUT,bitscrunch-token,bitsCrunch Token,BCUT,7767262,14122112.0,171607.0,"Artificial Intelligence (AI), Infrastructure, Analytics, NFT, Polygon Ecosystem, Ethereum Ecosystem, Animoca Brands Portfolio, Coinbase Ventures Portfolio"
BAD,bad-idea-ai,Bad Idea AI,BAD,6955501,8424754.0,1314813.0,"Artificial Intelligence (AI), Meme, Ethereum Ecosystem, Telegram Apps, Discord Bots, Shibarium Ecosystem"
BST,blocksquare,Blocksquare,BST,6597321,6597321.0,176504.0,"Tokenized Real Estate, Tokenized Assets, Ethereum Ecosystem, Real World Assets (RWA)"
SCF,smoking-chicken-fish,Smoking Chicken Fish,SCF,6036942,6036942.0,251954.0,"Solana Ecosystem, Meme, Solana Meme, Pump.fun Ecosystem"
GURU,guru,Guru,GURU,5617863,5617863.0,64498.0,"Decentralized Finance (DeFi), Ethereum Ecosystem"
BEAM,beam,BEAM,BEAM,5576094,7896044.0,84232.0,"Smart Contract Platform, Privacy, Ethereum Ecosystem, Proof of Work (PoW), BeamPrivacy Ecosystem, Privacy Blockchain"
TSUKA,dejitaru-tsuka,Dejitaru Tsuka,TSUKA,5316055,5316055.0,166255.0,"Meme, Ethereum Ecosystem"
TRVL,dtravel,Dtravel,TRVL,5007660,11157551.0,526017.0,"Artificial Intelligence (AI), Tourism, BNB Chain Ecosystem, Ethereum Ecosystem, Real World Assets (RWA), DePIN, Base Ecosystem"
MCN,mcncoin,MCNCOIN,MCN,4802825,4802825.0,578448.0,BNB Chain Ecosystem
BITBOARD,bitboard,BitBoard,BB,4752069,7183085.0,16853.89,"Smart Contract Platform, Polygon Ecosystem, Layer 2 (L2), Zero Knowledge (ZK)"
AZIT,azit,azit,AZIT,4724039,6740971.0,592839.0,Kaia Ecosystem
BILLY,billy,Billy,BILLY,4704866,4704866.0,2473874.0,"Solana Ecosystem, Meme, Dog-Themed, Solana Meme, Pump.fun Ecosystem"
HUAHUA,chihuahua-token,Chihuahua Chain,HUAHUA,4335294,4617877.0,917283.0,"Smart Contract Platform, NFT, Layer 1 (L1), Meme, Dog-Themed, Osmosis Ecosystem"
DYNA,dynachain,Dynachain,DYNA,4217986,17425202.0,262417.0,"Healthcare, BNB Chain Ecosystem"
NC,nodecoin,Nodecoin,NC,3947190,21200126.0,2878861.0,"Artificial Intelligence (AI), Solana Ecosystem, DePIN"
GOGLZ,googles,GOGGLES,GOGLZ,3870160,3870160.0,275010.0,"Meme, Sonic Ecosystem"
KANGO,kango,KANGO,KANGO,3858586,3858586.0,155760.0,"Meme, Kaspa Ecosystem"
QNT,quant-network,Quant,QNT,1671363665,1679214387.0,20115013.0,"Ethereum Ecosystem, Real World Assets (RWA), Energi Ecosystem, Coinbase 50 Index"
XAUT,tether-gold,Tether Gold,XAUT,1256391369,1256391369.0,25063655.0,"Stablecoins, Tokenized Assets, Tokenized Gold, Ethereum Ecosystem, Real World Assets (RWA), Tokenized Commodities"
DOGWIFHAT,dogwifcoin,dogwifhat,WIF,996206573,996206573.0,329211389.0,"Solana Ecosystem, Meme, Dog-Themed, Solana Meme, GMCI Meme Index, GMCI Index"
PENDLE,pendle,Pendle,PENDLE,958629252,1611746806.0,178794996.0,"Decentralized Exchange (DEX), Decentralized Finance (DeFi), Yield Farming, Automated Market Maker (AMM), BNB Chain Ecosystem, Derivatives, Lending/Borrowing Protocols, Arbitrum Ecosystem, Ethereum Ecosystem, Optimism Ecosystem, Fixed Interest, LSDFi, Base Ecosystem, Restaking, LRTfi, Liquid Restaking Governance Tokens, Berachain Ecosystem, Yield Tokenization Protocol, YZi Labs (Prev. Binance Labs) Portfolio, GMCI DeFi Index, Sonic Ecosystem, Liquid Staking, GMCI Index, BTCfi Protocol, HyperEVM Ecosystem"
FLUID,instadapp,Fluid,FLUID,501974192,755123216.0,2913456.0,"Decentralized Finance (DeFi), Solana Ecosystem, Polygon Ecosystem, Arbitrum Ecosystem, Ethereum Ecosystem, Base Ecosystem, Coinbase Ventures Portfolio, Pantera Capital Portfolio"
ZBCN,zebec-network,Zebec Network,ZBCN,429042465,497106712.0,27944944.0,"Decentralized Finance (DeFi), Solana Ecosystem, Real World Assets (RWA), Payment Solutions, DePIN, Coinbase Ventures Portfolio, Alameda Research Portfolio, Circle Ventures Portfolio, OKX Ventures Portfolio, RWA Protocol, Made in USA"
KAVA,kava,Kava,KAVA,424514747,424514747.0,13045916.0,"Smart Contract Platform, Layer 1 (L1), Binance Launchpad, DWF Labs Portfolio, Osmosis Ecosystem, YZi Labs (Prev. Binance Labs) Portfolio, Made in USA"
ATH,aethir,Aethir,ATH,394652085,1452988615.0,32068115.0,"Solana Ecosystem, Arbitrum Ecosystem, Impossible Finance Launchpad, Ethereum Ecosystem, DePIN, Animoca Brands Portfolio"
ZORA,zora,Zora,ZORA,391107681,1210549278.0,302770631.0,"Infrastructure, Media, Smart Contract Platform, NFT, Layer 2 (L2), Base Ecosystem, Coinbase Ventures Portfolio, Zora Ecosystem"
1INCH,1inch,1inch,1INCH,382916559,411546810.0,27897160.0,"Decentralized Exchange (DEX), Exchange-based Tokens, Decentralized Finance (DeFi), Automated Market Maker (AMM), BNB Chain Ecosystem, Avalanche Ecosystem, Polygon Ecosystem, Near Protocol Ecosystem, Harmony Ecosystem, Ethereum Ecosystem, FTX Holdings, Alameda Research Portfolio, DragonFly Capital Portfolio, Pantera Capital Portfolio, Energi Ecosystem, YZi Labs (Prev. Binance Labs) Portfolio, GMCI DeFi Index, Galaxy Digital Portfolio, Blockchain Capital Portfolio, Dex Aggregator, GMCI Index, Coinbase 50 Index"
PLUME,plume,Plume,PLUME,267876681,1010855399.0,30021372.0,"Smart Contract Platform, Layer 1 (L1), Ethereum Ecosystem, Real World Assets (RWA), RWA Protocol, Made in USA, Plume Network Ecosystem"
SFP,safepal,SafePal,SFP,262207963,262207963.0,3308365.0,"BNB Chain Ecosystem, Wallets, Ethereum Ecosystem, Animoca Brands Portfolio, Binance Launchpad, Energi Ecosystem, YZi Labs (Prev. Binance Labs) Portfolio"
QTUM,qtum,Qtum,QTUM,236140869,240734991.0,22086083.0,"Smart Contract Platform, Proof of Stake (PoS), Made in China"
ROSE,oasis-network,Oasis,ROSE,215830407,291425164.0,9342094.0,"Smart Contract Platform, BNB Chain Ecosystem, Layer 1 (L1), Proof of Stake (PoS), Pantera Capital Portfolio, Andreessen Horowitz (a16z) Portfolio, YZi Labs (Prev. Binance Labs) Portfolio, Blockchain Capital Portfolio, Privacy Blockchain, Polychain Capital Portfolio, Coinbase 50 Index"
PROM,prometeus,Prom,PROM,177240580,186952393.0,26535397.0,"Smart Contract Platform, BNB Chain Ecosystem, Ethereum Ecosystem, Layer 2 (L2)"
ZANO,zano,Zano,ZANO,161532129,161554859.0,2360649.0,"Smart Contract Platform, Privacy, Layer 1 (L1), Proof of Stake (PoS), Proof of Work (PoW), Zano Ecosystem, Privacy Blockchain"
OSAK,osaka-protocol,Osaka Protocol,OSAK,157177691,157177691.0,502453.0,"BNB Chain Ecosystem, Solana Ecosystem, Avalanche Ecosystem, Polygon Ecosystem, Meme, Arbitrum Ecosystem, Ethereum Ecosystem, Optimism Ecosystem, Base Ecosystem, Dog-Themed"
XCH,chia,Chia,XCH,151127823,341011828.0,7641723.0,"Smart Contract Platform, Layer 1 (L1), DePIN, Andreessen Horowitz (a16z) Portfolio, Made in USA"
SHX,stronghold-token,Stronghold,SHX,147162367,,4686329.0,"Ethereum Ecosystem, Stellar Ecosystem, Made in USA"
XVG,verge,Verge,XVG,119531662,119770761.0,8648829.0,"Smart Contract Platform, Privacy, Proof of Work (PoW), Made in USA"
UMA,uma,UMA,UMA,118588186,167597758.0,93058852.0,"Business Services, Decentralized Finance (DeFi), Oracle, Derivatives, Synthetic Issuer, Avalanche Ecosystem, Ethereum Ecosystem, Blockchain Capital Portfolio, Synthetic, Made in USA"
RED,redstone-oracles,RedStone,RED,117118481,418280290.0,29150514.0,"Infrastructure, Oracle, Ethereum Ecosystem"
BIGTIME,big-time,Big Time,BIGTIME,116976818,306503658.0,18495994.0,"Gaming (GameFi), Play To Earn, Ethereum Ecosystem, RPG, Alameda Research Portfolio, Circle Ventures Portfolio, OKX Ventures Portfolio, MMO"
WAVES,waves,Waves,WAVES,114772102,114772102.0,14010690.0,"Smart Contract Platform, DWF Labs Portfolio, Proof of Stake (PoS)"
DAG,constellation-labs,Constellation,DAG,110056224,136224496.0,2117097.0,"Smart Contract Platform, Layer 1 (L1), Base Ecosystem, Layer 0 (L0), Made in USA, Directed Acyclic Graph (DAG)"
FIDA,bonfida,Solana Name Service (prev. Bonfida),FIDA,107969743,108960042.0,19958037.0,"Big Data, Business Services, Infrastructure, Decentralized Finance (DeFi), Solana Ecosystem, FTX Holdings, DWF Labs Portfolio, Name Service"
SOON,soon-2,SOON,SOON,102930290,425722683.0,218605055.0,"Infrastructure, Smart Contract Platform, BNB Chain Ecosystem, Layer 2 (L2), Cross-chain Communication, Binance Alpha Spotlight"
LQTY,liquity,Liquity,LQTY,102765381,105257828.0,27386092.0,"Decentralized Finance (DeFi), Lending/Borrowing Protocols, Arbitrum Ecosystem, Ethereum Ecosystem, Alameda Research Portfolio, Pantera Capital Portfolio"
MANTA,manta-network,Manta Network,MANTA,101992235,240627253.0,21707496.0,"Smart Contract Platform, Polkadot Ecosystem, Binance Launchpool, Layer 2 (L2), Manta Network Ecosystem, Multicoin Capital Portfolio, Alameda Research Portfolio, DeFiance Capital Portfolio, YZi Labs (Prev. Binance Labs) Portfolio"
DYM,dymension,Dymension,DYM,92671909,268598960.0,9834473.0,"Smart Contract Platform, Cosmos Ecosystem, Modular Blockchain, Osmosis Ecosystem, Rollups-as-a-Service (RaaS)"
TAIKO,taiko,Taiko,TAIKO,83006932,481718718.0,13008538.0,"Smart Contract Platform, BNB Chain Ecosystem, Ethereum Ecosystem, Layer 2 (L2), Zero Knowledge (ZK), Rollup, OKX Ventures Portfolio, Centralized Exchange (CEX) Product, Binance Alpha Spotlight"
XRD,radix,Radix,XRD,74356127,83167537.0,760721.0,"Smart Contract Platform, Layer 1 (L1), DWF Labs Portfolio, Radix Ecosystem"
STEEM,steem,Steem,STEEM,72381210,72398325.0,13839980.0,SocialFi
AITECH,solidus-aitech,Solidus Ai Tech,AITECH,66932248,85400490.0,20665029.0,"Artificial Intelligence (AI), BNB Chain Ecosystem, Solana Ecosystem, Launchpad, Base Ecosystem, ChainGPT Launchpad, AI Agents, Binance Alpha Spotlight, DeFAI"
JOE,joe,JOE,JOE,66512062,83479828.0,8933798.0,"Decentralized Exchange (DEX), Decentralized Finance (DeFi), Yield Farming, Automated Market Maker (AMM), BNB Chain Ecosystem, Avalanche Ecosystem, Arbitrum Ecosystem, Mantle Ecosystem, DeFiance Capital Portfolio, Delphi Ventures Portfolio, Dex Aggregator"
WCT,connect-token-wct,WalletConnect Token,WCT,66255351,355828655.0,164557493.0,"Solana Ecosystem, Wallets, Ethereum Ecosystem, Optimism Ecosystem"
SAI,sai,Sai,SAI,65078001,65078001.0,523.22,"Decentralized Finance (DeFi), Ethereum Ecosystem"
ANYONE,airtor-protocol,ANyONe Protocol,ANYONE,57210648,71569053.0,894496.0,"Smart Contract Platform, Ethereum Ecosystem, DePIN, Privacy Blockchain"
SUNDOG,sundog,Sundog,SUNDOG,48267075,48267075.0,11766700.0,"Meme, Tron Ecosystem, Sun Pump Ecosystem, TRON Meme"
SD,stader,Stader,SD,48134585,95194993.0,8401115.0,"BNB Chain Ecosystem, Solana Ecosystem, Polygon Ecosystem, Fantom Ecosystem, Ethereum Ecosystem, Liquid Staking Governance Tokens, Animoca Brands Portfolio, Coinbase Ventures Portfolio, Pantera Capital Portfolio, Liquid Staking, Binance Alpha Spotlight"
BOBA,boba-network,Boba Network,BOBA,48049557,48702235.0,6382536.0,"Smart Contract Platform, Ethereum Ecosystem, Layer 2 (L2), Rollup, Boba Network Ecosystem, GMCI Layer 2 Index, GMCI Index, Made in USA"
PARTI,particle-network,Particle Network,PARTI,45634258,195855185.0,27785885.0,"Decentralized Finance (DeFi), BNB Chain Ecosystem, Layer 1 (L1), Base Ecosystem, Account Abstraction, Cross-chain Communication, Binance HODLer Airdrops, Chain Abstraction, Binance Wallet IDO"
HASHAI,hashai,HashAI,HASHAI,44940723,47725081.0,773758.0,"Artificial Intelligence (AI), Ethereum Ecosystem, DePIN"
MBL,moviebloc,MovieBloc,MBL,43615029,69918712.0,7472452.0,DWF Labs Portfolio
REZ,renzo,Renzo,REZ,40173934,152661133.0,32471916.0,"Decentralized Finance (DeFi), Binance Launchpool, Ethereum Ecosystem, Base Ecosystem, Restaking, YZi Labs (Prev. Binance Labs) Portfolio, OKX Ventures Portfolio"
SERAPH,seraph,Seraph,SERAPH,38169988,151658227.0,17665561.0,"Gaming (GameFi), BNB Chain Ecosystem, Play To Earn, Ethereum Ecosystem, RPG, Gaming Utility Token, Action Games"
RSS3,rss3,RSS3,RSS3,37722836,47401469.0,2994136.0,"Artificial Intelligence (AI), Infrastructure, Storage, Ethereum Ecosystem, Coinbase Ventures Portfolio, DragonFly Capital Portfolio, RSS3 VSL Ecosystem, AI Framework, DeFAI"
NFP,nfprompt-token,NFPrompt,NFP,35373765,74794885.0,7459645.0,"BNB Chain Ecosystem, Binance Launchpool, YZi Labs (Prev. Binance Labs) Portfolio"
VIC,tomochain,Viction,VIC,32533562,55957978.0,3866269.0,"Smart Contract Platform, Masternodes, Layer 1 (L1), DWF Labs Portfolio"
DAO,dao-maker,DAO Maker,DAO,30892746,34167358.0,1568271.0,"BNB Chain Ecosystem, Solana Ecosystem, Launchpad, DaoMaker Launchpad, Arbitrum Ecosystem, Ethereum Ecosystem, Step Network Ecosystem"
VOW,vow,Vow,VOW,25021459,83083937.0,278392.0,"Retail, Tourism, BNB Chain Ecosystem, Ethereum Ecosystem"
RIO,realio-network,Realio Network Token,RIO,23523012,23523306.0,2183963.0,"BNB Chain Ecosystem, Solana Ecosystem, Ethereum Ecosystem, Algorand Ecosystem, Real World Assets (RWA), Osmosis Ecosystem, Stellar Ecosystem, Made in USA"
BOOE,book-of-ethereum,Book of Ethereum,BOOE,23341906,23341906.0,256871.0,"Meme, Ethereum Ecosystem"
MEMEFI,memefi-2,MemeFi,MEMEFI,22937667,22937667.0,48731618.0,"Gaming (GameFi), NFT, Meme, Play To Earn, Sui Ecosystem, Telegram Apps, Tap to Earn, Sui Meme, Action Games"
PORT3,port3-network,Port3 Network,PORT3,22519787,45053340.0,8519924.0,"SocialFi, BNB Chain Ecosystem, Ethereum Ecosystem, Poolz Finance Launchpad"
OGY,origyn-foundation,ORIGYN,OGY,21965004,26252546.0,197111.0,"Internet Computer Ecosystem, Real World Assets (RWA), RWA Protocol"
NMT,netmind-token,NetMind Token,NMT,21402109,59995027.0,1675568.0,"Artificial Intelligence (AI), BNB Chain Ecosystem, Ethereum Ecosystem, DePIN, AI Agents"
LOOKS,looksrare,LooksRare,LOOKS,20749977,20749977.0,7735409.0,"NFT, Ethereum Ecosystem, NFT Marketplace"
LIF3,lif3,LIF3 (OLD),LIF3,20111275,68339460.0,271.63,Fantom Ecosystem
MLC,my-lovely-coin,My Lovely Coin,MLC,19504475,62240424.0,174929.0,"Charity, Gaming (GameFi), Polygon Ecosystem, Gaming Utility Token"
LOCK,houdini-swap,Houdini Swap,LOCK,19160427,19160427.0,25133.0,"Privacy, Solana Ecosystem, Ethereum Ecosystem"
NATIX,natix-network,NATIX Network,NATIX,18047925,84148160.0,361659.0,"Artificial Intelligence (AI), Internet of Things (IOT), Solana Ecosystem, DePIN"
WEPE,wall-street-pepe,Wall Street Pepe,WEPE,17598778,17598778.0,854789.0,"Meme, Ethereum Ecosystem, Frog-Themed, The Boys Club"
VINU,vita-inu,Vita Inu,VINU,16811872,16811872.0,1356778.0,"BNB Chain Ecosystem, Meme, Dog-Themed, DWF Labs Portfolio, Binance Alpha Spotlight"
VSC,vyvo-smart-chain,Vyvo Smart Chain,VSC,16773382,84637498.0,151173.0,"Smart Contract Platform, BNB Chain Ecosystem, Polygon Ecosystem, Layer 2 (L2)"
ZETA,zeta,Zeta,ZEX,16703085,88954920.0,1322095.0,"Decentralized Finance (DeFi), Derivatives, Perpetuals, Solana Ecosystem"
LINGO,lingo,Lingo,LINGO,16185775,16187586.0,418684.0,"Solana Ecosystem, Real World Assets (RWA), Base Ecosystem, RWA Protocol"
FHE,mind-network,Mind Network,FHE,15861473,63700693.0,6476920.0,"Artificial Intelligence (AI), Smart Contract Platform, BNB Chain Ecosystem, Layer 2 (L2), Binance Wallet IDO"
SUKU,suku,SUKU,SUKU,15117394,47967626.0,210525.0,"Solana Ecosystem, Polygon Ecosystem, Ethereum Ecosystem, Made in USA"
NUM,numbers-protocol,Numbers Protocol,NUM,14347886,14524933.0,1475349.0,"Artificial Intelligence (AI), Smart Contract Platform, BNB Chain Ecosystem, DaoMaker Launchpad, Ethereum Ecosystem, Avalanche L1, YZi Labs (Prev. Binance Labs) Portfolio, Outlier Ventures Portfolio"
PROPS,propbase,Propbase,PROPS,14317972,39541219.0,3876956.0,"Tokenized Real Estate, Tokenized Assets, Aptos Ecosystem, Real World Assets (RWA), Base Ecosystem, RWA Protocol"
CRTS,cratos,Cratos,CRTS,13911583,21909180.0,304159.0,"BNB Chain Ecosystem, Ethereum Ecosystem"
K,kinto,Kinto,K,13320160,72595983.0,657088.0,"Decentralized Finance (DeFi), Wallets, Arbitrum Ecosystem"
MFT,mainframe,Mainframe,MFT,11219457,11952692.0,48.08,"Ethereum Ecosystem, Energi Ecosystem"
AEROBUD,aerobud,AEROBUD,AEROBUD,10914280,10914280.0,301691.0,"Charity, Meme, Base Ecosystem, Dog-Themed, Base Meme, Made in USA"
EPT,balance,Balance,EPT,10108165,43633936.0,3695276.0,"Gaming (GameFi), BNB Chain Ecosystem, Animoca Brands Portfolio, DWF Labs Portfolio, AI Agents, Andreessen Horowitz (a16z) Portfolio, AI Agent Launchpad"
DIONE,dione,Dione,DIONE,9742088,11354463.0,484237.0,"Energy, Smart Contract Platform, Layer 1 (L1), Made in USA"
MCB,mcdex,MUX Protocol,MCB,9041660,11419079.0,4373.52,"Decentralized Exchange (DEX), Exchange-based Tokens, Decentralized Finance (DeFi), BNB Chain Ecosystem, Derivatives, Perpetuals, Arbitrum Ecosystem, Ethereum Ecosystem, Multicoin Capital Portfolio, Alameda Research Portfolio, DeFiance Capital Portfolio, Delphi Ventures Portfolio, OKX Ventures Portfolio"
PEAR,pear-protocol,Pear Protocol,PEAR,8071411,29527136.0,26731.0,"Decentralized Exchange (DEX), Decentralized Finance (DeFi), Perpetuals, Arbitrum Ecosystem"
SIDUS,sidus,Sidus,SIDUS,7710392,13162338.0,453350.0,"Gaming (GameFi), NFT, BNB Chain Ecosystem, Metaverse, Play To Earn, Ethereum Ecosystem, Linea Ecosystem, Animoca Brands Portfolio, Base Ecosystem, RPG, Gaming Governance Token, Alameda Research Portfolio, OKX Ventures Portfolio"
JUNO,juno-network,JUNO,JUNO,7323778,9730186.0,88398.0,"Smart Contract Platform, Cosmos Ecosystem, Osmosis Ecosystem, Juno Ecosystem, Evmos Ecosystem, Secret Ecosystem"
RLY,rally-2,Rally,RLY,6674137,19974901.0,29968.0,"SocialFi, Yield Farming, Ethereum Ecosystem, Alleged SEC Securities, Coinbase Ventures Portfolio, Andreessen Horowitz (a16z) Portfolio"
LEVER,lever,LeverFi,LEVER,6466758,6466897.0,1655502.0,"Decentralized Finance (DeFi), Ethereum Ecosystem, DWF Labs Portfolio, Alameda Research Portfolio"
PMT,public-meme-token,Public Masterpiece Token,PMT,6001886,23208853.0,471178.0,BNB Chain Ecosystem
MAS,massa,Massa,MAS,4943889,18074274.0,128209.0,"Smart Contract Platform, Layer 1 (L1), Massa Ecosystem"
KILO,kiloex,KiloEx,KILO,4929518,23285393.0,2834027.0,"Decentralized Exchange (DEX), Decentralized Finance (DeFi), BNB Chain Ecosystem, Derivatives, Binance Wallet IDO"
OBT,oobit,Oobit,OBT,4891744,13896039.0,30274.0,"BNB Chain Ecosystem, Ethereum Ecosystem, Payment Solutions"
NLS,nolus,Nolus,NLS,4723976,6659578.0,113750.0,"Ethereum Ecosystem, Osmosis Ecosystem"
METAV,metaverse,METAVERSE,METAV,4315153,4315153.0,376177.0,"Artificial Intelligence (AI), Solana Ecosystem, AI Agents, Pump.fun Ecosystem, Binance Alpha Spotlight"
SHRUB,shrub,Shrub,SHRUB,4282357,4317931.0,572439.0,"Solana Ecosystem, Meme, Ethereum Ecosystem, Base Ecosystem, Elon Musk-Inspired"
LL,lightlink,LightLink,LL,4273382,14503925.0,134259.0,"Infrastructure, Smart Contract Platform, Ethereum Ecosystem, Layer 2 (L2), Rollup, LightLink Ecosystem"
LIKE,likecoin,LikeCoin,LIKE,4186278,5704300.0,2235.44,"SocialFi, Osmosis Ecosystem"
HMND,humanode,Humanode,HMND,4141997,11286488.0,227503.0,"Artificial Intelligence (AI), Smart Contract Platform, Layer 1 (L1), Decentralized Identifier (DID), Discord Bots, Humanode Ecosystem"
HARAMBEAI,harambe-ai,Harambe AI,HARAMBEAI,4029139,5906752.0,51011.0,"Meme, Ethereum Ecosystem"
LEOX,leox,LEOX,LEOX,3364784,3364784.0,70070.0,"Tokenized Real Estate, Tokenized Assets, Ethereum Ecosystem, Real World Assets (RWA), RWA Protocol"
ATS,alltoscan,Alltoscan,ATS,3071325,4500511.0,86420.0,BNB Chain Ecosystem
GAIA,gaia-2,Gaia,SN57,3063763,3063763.0,29744.0,"Artificial Intelligence (AI), Bittensor Ecosystem, Bittensor Subnets"
JUC,juice-2,Juice,JUC,2965363,5207690.0,40809.0,"Gaming (GameFi), Avalanche Ecosystem"
KLIMA,klima-dao,KlimaDAO,KLIMA,2901336,2901336.0,7789.96,"Rebase Tokens, Polygon Ecosystem, Ohm Fork, Regenerative Finance (ReFi), Real World Assets (RWA), Base Ecosystem"
GOATS,goats-2,GOATS,GOATS,2872128,2966101.0,13875.77,"Gaming (GameFi), Meme, Telegram Apps, TON Ecosystem"
HBAR,hedera-hashgraph,Hedera,HBAR,11014797903,12991392548.0,375674153.0,"Smart Contract Platform, Layer 1 (L1), Hedera Ecosystem, GMCI Layer 1 Index, GMCI 30 Index, GMCI Index, Outlier Ventures Portfolio, Made in USA, Directed Acyclic Graph (DAG)"
BGB,bitget-token,Bitget Token,BGB,5097010435,5097010435.0,85833684.0,"Exchange-based Tokens, Centralized Exchange (CEX) Token, Ethereum Ecosystem, DragonFly Capital Portfolio, Morph L2 Ecosystem"
RENDER,render-token,Render,RENDER,2117755752,2178085237.0,115137288.0,"Artificial Intelligence (AI), NFT, Metaverse, Solana Ecosystem, Polygon Ecosystem, Ethereum Ecosystem, DePIN, Multicoin Capital Portfolio, Alameda Research Portfolio, GMCI DePIN Index, GMCI 30 Index, GMCI Index, Made in USA, Coinbase 50 Index"
IP,story-2,Story,IP,1728940565,5771221646.0,81777631.0,"Artificial Intelligence (AI), Smart Contract Platform, Layer 1 (L1), Made in USA, Story Ecosystem"
LBTC,lombard-staked-btc,Lombard Staked BTC,LBTC,1639633106,1639633106.0,10650742.0,"BNB Chain Ecosystem, Ethereum Ecosystem, Sui Ecosystem, Base Ecosystem, Restaking, Berachain Ecosystem, Liquid Restaking Tokens, Sonic Ecosystem, Etherlink Ecosystem, Swellchain Ecosystem, Corn Ecosystem, Liquid Staked BTC, Katana Ecosystem, TAC Ecosystem"
XDC,xdce-crowd-sale,XDC Network,XDC,1466199567,3433555204.0,33756706.0,"Smart Contract Platform, Layer 1 (L1), Real World Assets (RWA)"
TIA,celestia,Celestia,TIA,1397093196,2141120562.0,129292120.0,"Smart Contract Platform, Cosmos Ecosystem, Layer 1 (L1), Data Availability, Modular Blockchain, Osmosis Ecosystem, eGirl Capital Portfolio, Coinbase Ventures Portfolio, Proof of Stake (PoS), Secret Ecosystem, YZi Labs (Prev. Binance Labs) Portfolio, Delphi Ventures Portfolio, Galaxy Digital Portfolio, Blockchain Capital Portfolio, OKX Ventures Portfolio, Polychain Capital Portfolio"
LDO,lido-dao,Lido DAO,LDO,1384313028,1545183879.0,549812793.0,"Infrastructure, Decentralized Finance (DeFi), Polygon Ecosystem, Arbitrum Ecosystem, Ethereum Ecosystem, Optimism Ecosystem, Liquid Staking Governance Tokens, eGirl Capital Portfolio, Paradigm Portfolio, Coinbase Ventures Portfolio, Multicoin Capital Portfolio, Index Coop Defi Index, Alameda Research Portfolio, DragonFly Capital Portfolio, Andreessen Horowitz (a16z) Portfolio, GMCI DeFi Index, Delphi Ventures Portfolio, Liquid Staking, GMCI Index, Coinbase 50 Index"
FLOKI,floki,FLOKI,FLOKI,1119882413,1159144565.0,219735108.0,"Gaming (GameFi), NFT, BNB Chain Ecosystem, Metaverse, Meme, Play To Earn, Ethereum Ecosystem, Telegram Apps, Dog-Themed, DWF Labs Portfolio, RPG, On-chain Gaming, TokenFi Launchpad, GMCI Meme Index, GMCI Index"
CFX,conflux-token,Conflux,CFX,1019792251,1133791705.0,104425063.0,"Smart Contract Platform, DWF Labs Portfolio, Proof of Work (PoW), GMCI Layer 1 Index, Sequoia Capital Portfolio, GMCI Index, Made in China"
RAY,raydium,Raydium,RAY,915285112,1894873399.0,122399377.0,"Decentralized Exchange (DEX), Decentralized Finance (DeFi), Yield Farming, Automated Market Maker (AMM), Solana Ecosystem, Launchpad, GMCI DeFi Index, GMCI Index"
PYTH,pyth-network,Pyth Network,PYTH,750715247,1305595130.0,34476218.0,"Business Services, Infrastructure, Decentralized Finance (DeFi), Oracle, Solana Ecosystem, Neon Ecosystem, Manta Network Ecosystem, Multicoin Capital Portfolio, GMCI DeFi Index, Delphi Ventures Portfolio, GMCI Index"
BTT,bittorrent,BitTorrent,BTT,681962292,684686415.0,32434876.0,"Storage, BNB Chain Ecosystem, Ethereum Ecosystem, DePIN, Alleged SEC Securities, Binance Launchpad, Tron Ecosystem, Energi Ecosystem, YZi Labs (Prev. Binance Labs) Portfolio, BitTorrent Ecosystem, GMCI DePIN Index, GMCI Index"
EIGEN,eigenlayer,EigenCloud (prev. EigenLayer),EIGEN,452354596,2464336927.0,105988655.0,"Infrastructure, Ethereum Ecosystem, Data Availability, Restaking, Polychain Capital Portfolio, Made in USA"
SUN,sun-token,Sun Token,SUN,439114740,456232829.0,26372971.0,"Decentralized Finance (DeFi), Tron Ecosystem"
ZK,zksync,ZKsync,ZK,438598557,1273625974.0,29822453.0,"Smart Contract Platform, Ethereum Ecosystem, Layer 2 (L2), Zero Knowledge (ZK), ZkSync Ecosystem, Consensys Portfolio, Blockchain Capital Portfolio, OKX Ventures Portfolio"
