Input Token,CoinGecko ID,Name,Symbol,Market Cap,FDV,24H Volume,Categories
AVAX,avalanche-2,Avalanche,AVAX,6541550112,7024615706.0,471861352.0,"Smart Contract Platform, Layer 1 (L1), Avalanche Ecosystem, Proof of Stake (PoS), DragonFly Capital Portfolio, DeFiance Capital Portfolio, Andreessen Horowitz (a16z) Portfolio, GMCI Layer 1 Index, GMCI 30 Index, Galaxy Digital Portfolio, GMCI Index, Polychain Capital Portfolio, World Liberty Financial Portfolio, Made in USA, Coinbase 50 Index"
SUI,sui,Sui,SUI,6211871590,16874008081.0,934886075.0,"Smart Contract Platform, Binance Launchpool, Layer 1 (L1), Sui Ecosystem, Coinbase Ventures Portfolio, Proof of Stake (PoS), Andreessen Horowitz (a16z) Portfolio, YZi Labs (Prev. Binance Labs) Portfolio, GMCI Layer 1 Index, Circle Ventures Portfolio, GMCI Index, Made in USA"
TAO,bittensor,Bittensor,TAO,3101944411,6787277283.0,169498909.0,"Artificial Intelligence (AI), Smart Contract Platform, Layer 1 (L1), DePIN, Bittensor Ecosystem, Polychain Capital Portfolio"
ENA,ethena,Ethena,ENA,2055334356,4153064580.0,315477989.0,"Decentralized Finance (DeFi), Binance Launchpool, Avalanche Ecosystem, Arbitrum Ecosystem, Ethereum Ecosystem, Metis Ecosystem, Optimism Ecosystem, ZkSync Ecosystem, Mantle Ecosystem, Base Ecosystem, TON Ecosystem, Manta Network Ecosystem, Scroll Ecosystem, Kava Ecosystem, Blast Ecosystem, Stablecoin Issuer, Mode Ecosystem, DragonFly Capital Portfolio, YZi Labs (Prev. Binance Labs) Portfolio, Fraxtal Ecosystem, Delphi Ventures Portfolio, OKX Ventures Portfolio, Zircuit Ecosystem, Morph L2 Ecosystem, World Liberty Financial Portfolio, Swellchain Ecosystem, Governance"
ONDO,ondo-finance,Ondo,ONDO,1771988937,5609144102.0,69841148.0,"Decentralized Finance (DeFi), Ethereum Ecosystem, Real World Assets (RWA), Coinbase Ventures Portfolio, Pantera Capital Portfolio, GMCI DeFi Index, RWA Protocol, GMCI Index, World Liberty Financial Portfolio, Binance Alpha Spotlight, Made in USA"
ALGO,algorand,Algorand,ALGO,1409978105,1409986997.0,73338478.0,"Smart Contract Platform, Layer 1 (L1), Algorand Ecosystem, Real World Assets (RWA), Alleged SEC Securities, DWF Labs Portfolio, Multicoin Capital Portfolio, Proof of Stake (PoS), GMCI Layer 1 Index, GMCI Index, Made in USA, Coinbase 50 Index"
ATOM,cosmos,Cosmos Hub,ATOM,1332274889,1332274889.0,61417591.0,"Smart Contract Platform, BNB Chain Ecosystem, Cosmos Ecosystem, Terra Ecosystem, Canto Ecosystem, Alleged SEC Securities, Osmosis Ecosystem, Paradigm Portfolio, Proof of Stake (PoS), Kava Ecosystem, Layer 0 (L0), DragonFly Capital Portfolio, Pantera Capital Portfolio, Archway Ecosystem, Evmos Ecosystem, GMCI 30 Index, GMCI Index, Outlier Ventures Portfolio, Polychain Capital Portfolio, Mantra Ecosystem, Coinbase 50 Index, Governance"
NEXO,nexo,NEXO,NEXO,990190761,990190761.0,24080207.0,"Exchange-based Tokens, Centralized Exchange (CEX) Token, Polygon Ecosystem, Fantom Ecosystem, Ethereum Ecosystem, Alleged SEC Securities, Energi Ecosystem, Sora Ecosystem"
FDUSD,first-digital-usd,First Digital USD,FDUSD,967217242,967217242.0,4124869840.0,"Stablecoins, USD Stablecoin, BNB Chain Ecosystem, Arbitrum Ecosystem, Ethereum Ecosystem, Sui Ecosystem, TON Ecosystem, Fiat-backed Stablecoin"
WBTC,arbitrum-bridged-wbtc-arbitrum-one,Arbitrum Bridged WBTC (Arbitrum One),WBTC,765789872,765789872.0,182916922.0,"Arbitrum Ecosystem, Bridged WBTC, Bridged-Tokens"
INJ,injective-protocol,Injective,INJ,656630086,656630086.0,63129783.0,"Smart Contract Platform, Decentralized Finance (DeFi), BNB Chain Ecosystem, Cosmos Ecosystem, Layer 1 (L1), Terra Ecosystem, Ethereum Ecosystem, Real World Assets (RWA), Binance Launchpad, Osmosis Ecosystem, Proof of Stake (PoS), Pantera Capital Portfolio, Secret Ecosystem, YZi Labs (Prev. Binance Labs) Portfolio, GMCI Layer 1 Index, GMCI Index, Made in USA, Coinbase 50 Index"
DOGWIFHAT,dogwifcoin,dogwifhat,WIF,416441629,416441629.0,149591314.0,"Solana Ecosystem, Meme, Dog-Themed, Solana Meme, GMCI Meme Index, GMCI Index, Unichain Ecosystem"
NFT,apenft,AINFT,NFT,388431140,388431140.0,31069699.0,"NFT, BNB Chain Ecosystem, Ethereum Ecosystem, Tron Ecosystem, Binance Alpha Spotlight"
MANA,decentraland,Decentraland,MANA,384724540,439659224.0,24355278.0,"Entertainment, Gaming (GameFi), NFT, Metaverse, Polygon Ecosystem, Play To Earn, Ethereum Ecosystem, Animoca Brands Portfolio, Alleged SEC Securities, Simulation Games, Coinbase 50 Index"
MERL,merlin-chain,Merlin Chain,MERL,381902972,762370142.0,26709884.0,"Smart Contract Platform, BNB Chain Ecosystem, Ethereum Ecosystem, Layer 2 (L2), Merlin Chain Ecosystem, Bitcoin Sidechains, SideChain, OKX Ventures Portfolio, Made in China"
CHZ,chiliz,Chiliz,CHZ,311746265,311746265.0,28932561.0,"Smart Contract Platform, Sports, NFT, Layer 1 (L1), Ethereum Ecosystem, Alleged SEC Securities, Chiliz Ecosystem, YZi Labs (Prev. Binance Labs) Portfolio, Coinbase 50 Index"
AR,arweave,Arweave,AR,286892858,286892858.0,44496132.0,"Artificial Intelligence (AI), Smart Contract Platform, Storage, Layer 1 (L1), DePIN, Coinbase Ventures Portfolio, Multicoin Capital Portfolio, Andreessen Horowitz (a16z) Portfolio, Blockchain Capital Portfolio"
RSR,reserve-rights-token,Reserve Rights,RSR,226767547,370434790.0,19707627.0,"Decentralized Finance (DeFi), Arbitrum Ecosystem, Ethereum Ecosystem, Real World Assets (RWA), Base Ecosystem, Coinbase Ventures Portfolio, Energi Ecosystem, Made in USA"
LPT,livepeer,Livepeer,LPT,211217546,211217546.0,15856903.0,"Artificial Intelligence (AI), Harmony Ecosystem, Arbitrum Ecosystem, Ethereum Ecosystem, DePIN, Coinbase Ventures Portfolio, Multicoin Capital Portfolio, Pantera Capital Portfolio, GMCI DePIN Index, GMCI Index, Coinbase 50 Index"
BERA,berachain-bera,Berachain,BERA,179837161,699444706.0,22391741.0,"Smart Contract Platform, Decentralized Finance (DeFi), Layer 1 (L1), Berachain Ecosystem, Binance HODLer Airdrops, Outlier Ventures Portfolio, Polychain Capital Portfolio"
RVN,ravencoin,Ravencoin,RVN,144354428,144395679.0,7555105.0,"Smart Contract Platform, Real World Assets (RWA), Proof of Work (PoW), Made in USA"
ALEO,aleo,ALEO,ALEO,124529833,353403783.0,5544313.0,"Infrastructure, Smart Contract Platform, Privacy, BNB Chain Ecosystem, Layer 1 (L1), Zero Knowledge (ZK), Andreessen Horowitz (a16z) Portfolio, Privacy Blockchain, Binance Alpha Spotlight, Made in USA"
MELANIA,melania-meme,Melania Meme,MELANIA,116925630,140030782.0,10584169.0,"Solana Ecosystem, Meme, Solana Meme, PolitiFi, Made in USA, Trump-Affiliated"
VELO,velo,Velo,VELO,111214586,151966927.0,16559254.0,"Decentralized Finance (DeFi), BNB Chain Ecosystem, Real World Assets (RWA), DWF Labs Portfolio, Stellar Ecosystem, Binance Alpha Spotlight"
POPCAT,popcat,Popcat,POPCAT,106424430,106424430.0,24567896.0,"Solana Ecosystem, Meme, Solana Meme, Cat-Themed, Murad Picks, Binance Alpha Spotlight"
DBR,debridge,deBridge,DBR,99180723,240849278.0,10025683.0,"Solana Ecosystem, Bridge Governance Tokens, Cross-chain Communication, Intent, Governance"
SNT,status,Status,SNT,64901505,111513224.0,3604635.0,"Infrastructure, Smart Contract Platform, Software as a service, Privacy, SocialFi, Ethereum Ecosystem, Layer 2 (L2), Energi Ecosystem"
COREUM,coreum,Coreum,COREUM,56594848,56594848.0,235933.0,"Smart Contract Platform, Layer 1 (L1), Osmosis Ecosystem, XRP Ledger Ecosystem"
CHR,chromaway,Chromia,CHR,54858821,54858821.0,5225659.0,"Artificial Intelligence (AI), Smart Contract Platform, Gaming (GameFi), NFT, BNB Chain Ecosystem, Layer 1 (L1), Ethereum Ecosystem, Real World Assets (RWA), Modular Blockchain, Chromia Ecosystem, RWA Protocol"
ELG,escoin-token,Escoin,ELG,53513336,72625768.0,519889.0,"Legal, BNB Chain Ecosystem, Polygon Ecosystem, Ethereum Ecosystem"
BNT,bancor,Bancor Network,BNT,53230296,53230296.0,490689.0,"Decentralized Exchange (DEX), Exchange-based Tokens, Decentralized Finance (DeFi), Automated Market Maker (AMM), Ethereum Ecosystem, DeFiance Capital Portfolio, Energi Ecosystem, Governance"
AIXBT,aixbt,aixbt,AIXBT,51842854,52121264.0,18616399.0,"Artificial Intelligence (AI), Solana Ecosystem, Meme, Ethereum Ecosystem, Base Ecosystem, AI Meme, AI Agents, Virtuals Protocol Ecosystem, Binance Alpha Spotlight, DeFAI"
PYTHIA,pythia,PYTHIA,PYTHIA,48111000,48111000.0,1108845.0,"Solana Ecosystem, Meme, AI Meme, Pump.fun Ecosystem, Desci Meme, Binance Alpha Spotlight"
IQ,everipedia,IQ,IQ,46799900,46799900.0,2505949.0,"Artificial Intelligence (AI), Big Data, Media, BNB Chain Ecosystem, Polygon Ecosystem, Ethereum Ecosystem, AI Agents, GMCI DePIN Index, Galaxy Digital Portfolio, GMCI Index, AI Agent Launchpad, AI Framework, DeFAI"
MYTH,mythos,Mythos,MYTH,45123794,56658536.0,1138603.0,"Gaming (GameFi), Polkadot Ecosystem, NFT, Avalanche Ecosystem, Ethereum Ecosystem, Base Ecosystem, Gaming Blockchains, Andreessen Horowitz (a16z) Portfolio, YZi Labs (Prev. Binance Labs) Portfolio, Galaxy Digital Portfolio, Made in USA"
LAYER,solayer,Solayer,LAYER,44881114,213719591.0,29932999.0,"Decentralized Finance (DeFi), Solana Ecosystem, LSDFi, Restaking, Stablecoin Issuer, YZi Labs (Prev. Binance Labs) Portfolio, Binance HODLer Airdrops, Polychain Capital Portfolio, Buidlpad Launchpad"
ERG,ergo,Ergo,ERG,42482165,50407564.0,206387.0,"Smart Contract Platform, Privacy, Layer 1 (L1), Zero Knowledge (ZK), Proof of Work (PoW), Privacy Blockchain"
WELL,moonwell-artemis,Moonwell,WELL,41701539,46609067.0,1184252.0,"Decentralized Finance (DeFi), Lending/Borrowing Protocols, Moonbeam Ecosystem, Base Ecosystem, Coinbase Ventures Portfolio, Made in USA"
MAGIC,magic,Treasure,MAGIC,37727427,41417624.0,15060820.0,"Artificial Intelligence (AI), NFT, Metaverse, Arbitrum Ecosystem, Ethereum Ecosystem, Layer 2 (L2), Zero Knowledge (ZK), Base Ecosystem, AI Agents, AI Agent Launchpad, x402 Ecosystem"
DKA,dkargo,dKargo,DKA,37122224,37122224.0,1538396.0,"Artificial Intelligence (AI), Infrastructure, Ethereum Ecosystem, Governance"
DEVVE,devve,DevvE,DEVVE,35405907,48617820.0,290709.0,"Layer 1 (L1), Ethereum Ecosystem"
DOVU,dovu-2,DOVU,DOVU,34944878,34950936.0,62477.0,"Infrastructure, Ethereum Ecosystem, Regenerative Finance (ReFi), Real World Assets (RWA), Hedera Ecosystem"
CAW,a-hunters-dream,A Hunters Dream,CAW,34530479,36157569.0,658926.0,"SocialFi, Ethereum Ecosystem"
CELR,celer-network,Celer Network,CELR,28498002,50479548.0,1755591.0,"Arbitrum Ecosystem, Ethereum Ecosystem, Bridge Governance Tokens, Binance Launchpad, Cross-chain Communication, Pantera Capital Portfolio, Energi Ecosystem, YZi Labs (Prev. Binance Labs) Portfolio"
VRA,verasity,Verasity,VRA,28412225,35566283.0,9434260.0,"Entertainment, BNB Chain Ecosystem, Wallets, Ethereum Ecosystem, Binance Alpha Spotlight"
ROAM,roam-token,ROAM Token,ROAM,23307518,71294424.0,15012832.0,"Retail, BNB Chain Ecosystem, Solana Ecosystem, DePIN"
CATI,catizen,Catizen,CATI,22967146,61741705.0,7721280.0,"Gaming (GameFi), Play To Earn, Telegram Apps, TON Ecosystem, Tap to Earn"
KERNEL,kernel-2,KernelDAO,KERNEL,22326816,94301762.0,19769729.0,"Decentralized Finance (DeFi), BNB Chain Ecosystem, Arbitrum Ecosystem, Ethereum Ecosystem, Restaking, Liquid Restaking Governance Tokens"
NTRN,neutron-3,Neutron,NTRN,22194351,35726183.0,1206255.0,"Binance Launchpool, Osmosis Ecosystem, Delphi Ventures Portfolio"
SYS,syscoin,Syscoin,SYS,21850237,21850947.0,1006483.0,"Smart Contract Platform, Masternodes, Layer 1 (L1), Decentralized Identifier (DID), Layer 2 (L2), Zero Knowledge (ZK), Rollux Ecosystem, DWF Labs Portfolio, Data Availability, Modular Blockchain, Rollup, Proof of Work (PoW)"
ZKJ,polyhedra-network,Polyhedra Network,ZKJ,21681584,56165865.0,3134783.0,"Smart Contract Platform, BNB Chain Ecosystem, Ethereum Ecosystem, Zero Knowledge (ZK), Animoca Brands Portfolio, YZi Labs (Prev. Binance Labs) Portfolio, OKX Ventures Portfolio, Binance Alpha Spotlight"
MAV,maverick-protocol,Maverick Protocol,MAV,21262129,56398587.0,3405530.0,"BNB Chain Ecosystem, Binance Launchpool, Ethereum Ecosystem, ZkSync Ecosystem, Base Ecosystem, Coinbase Ventures Portfolio, Pantera Capital Portfolio, YZi Labs (Prev. Binance Labs) Portfolio, Circle Ventures Portfolio"
ORAI,oraichain-token,Oraichain,ORAI,21163173,21407408.0,1086532.0,"Artificial Intelligence (AI), Big Data, Business Services, Smart Contract Platform, Decentralized Finance (DeFi), Oracle, BNB Chain Ecosystem, Solana Ecosystem, Layer 1 (L1), Ethereum Ecosystem, DWF Labs Portfolio, Osmosis Ecosystem, AI Agents"
EVER,everscale,Everscale,EVER,20690244,22065603.0,89385.0,"Infrastructure, Layer 1 (L1), Ethereum Ecosystem"
MLN,melon,Enzyme,MLN,17306380,17306380.0,3746046.0,"Decentralized Finance (DeFi), Asset Manager, Polygon Ecosystem, Arbitrum Ecosystem, Ethereum Ecosystem, Real World Assets (RWA), DeFiance Capital Portfolio"
HEI,heima,Heima,HEI,16765906,21007882.0,3638456.0,"BNB Chain Ecosystem, Binance Launchpool, Ethereum Ecosystem, YZi Labs (Prev. Binance Labs) Portfolio"
SYNTH,synth-2,Synth,SN50,16451306,16498971.0,644679.0,"Artificial Intelligence (AI), Bittensor Ecosystem, Bittensor Subnets"
OL,open-loot,OPENLOOT,OL,16178142,103668400.0,2229652.0,"Gaming (GameFi), NFT, BNB Chain Ecosystem, Ethereum Ecosystem, Gaming Marketplace"
DF,dforce-token,dForce,DF,16014578,16014578.0,1456203.0,"Decentralized Finance (DeFi), BNB Chain Ecosystem, Lending/Borrowing Protocols, Arbitrum Ecosystem, Ethereum Ecosystem, Multicoin Capital Portfolio, Stablecoin Issuer, Energi Ecosystem, Made in China"
GRIFFAIN,griffain,GRIFFAIN,GRIFFAIN,15502623,15502623.0,4090483.0,"Artificial Intelligence (AI), Solana Ecosystem, Meme, AI Meme, Pump.fun Ecosystem, AI Agent Launchpad, Binance Alpha Spotlight, DeFAI"
IXS,ix-swap,IXS,IXS,13725459,13725459.0,254240.0,"Polygon Ecosystem, Ethereum Ecosystem, Real World Assets (RWA), Base Ecosystem, DWF Labs Portfolio, Poolz Finance Launchpad, Coinbase Ventures Portfolio"
AA,arai,Arai,AA,13147897,90988903.0,1520808.0,"Artificial Intelligence (AI), Gaming (GameFi), BNB Chain Ecosystem, Animoca Brands Portfolio, Sequoia Capital Portfolio, Binance Alpha Spotlight"
HTR,hathor,Hathor,HTR,12944318,22505004.0,576610.0,"Infrastructure, Smart Contract Platform, Layer 1 (L1), Real World Assets (RWA), Proof of Work (PoW), Directed Acyclic Graph (DAG)"
KDA,kadena,Kadena,KDA,9318406,9318406.0,326958.0,"Smart Contract Platform, Layer 1 (L1), Kadena Ecosystem, Multicoin Capital Portfolio, Proof of Work (PoW), Made in USA"
REF,ref-finance,Ref Finance,REF,8736633,9103547.0,1089.79,"Near Protocol Ecosystem, Alameda Research Portfolio, DragonFly Capital Portfolio, OKX Ventures Portfolio"
BLZ,bluzelle,Bluzelle,BLZ,8669084,9360554.0,503176.0,"Smart Contract Platform, BNB Chain Ecosystem, Ethereum Ecosystem, DePIN, Decentralized Science (DeSci), Osmosis Ecosystem, Energi Ecosystem, GMCI DePIN Index, GMCI Index"
FIO,fio-protocol,FIO Protocol,FIO,8451169,10223922.0,3283715.0,"Smart Contract Platform, Layer 1 (L1), YZi Labs (Prev. Binance Labs) Portfolio"
VOXEL,voxies,Voxies,VOXEL,7903237,9746554.0,3196394.0,"Gaming (GameFi), NFT, Polygon Ecosystem, Binance Launchpad, RPG, Gaming Utility Token, Strategy Games, YZi Labs (Prev. Binance Labs) Portfolio"
PHNIX,phnix,PHNIX,PHNIX,7800057,8659379.0,188719.0,"Meme, XRP Ledger Ecosystem"
PSP,paraswap,ParaSwap,PSP,7790104,8049589.0,506.4,"Decentralized Exchange (DEX), Exchange-based Tokens, Decentralized Finance (DeFi), BNB Chain Ecosystem, Polygon Ecosystem, Ethereum Ecosystem, Optimism Ecosystem, Alameda Research Portfolio, Intent, Blockchain Capital Portfolio, Dex Aggregator"
RX,reachx-mainnet,ReachX Mainnet,RX,7735479,15470958.0,26.71,"SocialFi, Meme, Base Ecosystem"
EPIC,epic-cash,Epic Cash,EPIC,7538916,7545444.0,235089.0,"Smart Contract Platform, Privacy, Layer 1 (L1), Zero Knowledge (ZK), Proof of Work (PoW)"
HANDY,handy,Handy,HANDY,7446186,14275740.0,57691.0,Ethereum Ecosystem
GEL,gelato,Gelato,GEL,7146592,11316216.0,205375.0,"Smart Contract Platform, Polygon Ecosystem, Fantom Ecosystem, Ethereum Ecosystem, Layer 2 (L2), Modular Blockchain, Rollups-as-a-Service (RaaS), DragonFly Capital Portfolio, Galaxy Digital Portfolio, Binance Alpha Spotlight"
BOSON,boson-protocol,Boson,BOSON,6812754,9416396.0,263062.0,"NFT, Metaverse, Polygon Ecosystem, Ethereum Ecosystem, Real World Assets (RWA), Animoca Brands Portfolio, Base Ecosystem, RWA Protocol, E-commerce, Outlier Ventures Portfolio"
HAI,hackenai,Hacken,HAI,5568364,6682050.0,149857.0,"Business Services, BNB Chain Ecosystem, Ethereum Ecosystem, Base Ecosystem, Cybersecurity, VeChain Ecosystem"
HIFI,hifi-finance,Hifi Finance,HIFI,5449694,5909010.0,543061.0,"Tokenized Real Estate, Decentralized Finance (DeFi), Ethereum Ecosystem, Real World Assets (RWA), Made in USA, Governance"
VICE,vice-2,VICE,VICE,5305373,6756002.0,119920.0,"Gaming (GameFi), Ethereum Ecosystem"
NTX,nunet,NuNet,NTX,5265195,6878609.0,78159.0,"BNB Chain Ecosystem, Cardano Ecosystem, Ethereum Ecosystem, DePIN"
NRS,nereus-token,Nereus,NRS,5047020,129387005.0,164471.0,"Decentralized Finance (DeFi), Derivatives, Polygon Ecosystem"
PUSS,puss,Puss,PUSS,4933288,4933288.0,865700.0,"Meme, Tron Ecosystem, TRON Meme"
BXX,baanx,Baanx,BXX,4849859,4849859.0,60169.0,"Ethereum Ecosystem, Payment Solutions"
MANEKI,maneki,MANEKI,MANEKI,4649460,4665350.0,1298329.0,"Solana Ecosystem, Meme, Solana Meme, Cat-Themed"
SNSY,sensay,Sensay,SNSY,4626440,7640256.0,248610.0,"Artificial Intelligence (AI), Arbitrum Ecosystem, Ethereum Ecosystem, Base Ecosystem, AI Agents"
BDC,billion-dollar-cat-runes,Billy (Bitcoin),BDC,4549838,4549838.0,13670.56,"Solana Ecosystem, Meme, Cat-Themed, Bitcoin Ecosystem, Runes, Bitcoin Meme"
ATR,artrade,Artrade,ATR,4358132,4371590.0,473339.0,"NFT, Solana Ecosystem, NFT Marketplace, Real World Assets (RWA), Art"
EAI,eagle-ai,Eagle AI,EAI,3974082,4404620.0,193503.0,"Analytics, Base Ecosystem"
DOLZ,dolz-io,DOLZ.io,DOLZ,3802858,3802858.0,4766.61,"Artificial Intelligence (AI), Gaming (GameFi), NFT, Polygon Ecosystem, Ethereum Ecosystem, Base Ecosystem, Card Games, AI Agents"
PROS,prospective,Prospective,PROS,3752418,33503736.0,22144.0,"NFT, BNB Chain Ecosystem, Polygon Ecosystem, Ethereum Ecosystem, Tron Ecosystem, BitTorrent Ecosystem"
DOBO,dogebonk,DogeBonk,DOBO,3525039,6483038.0,3234.97,"Analytics, BNB Chain Ecosystem, Meme, Dog-Themed"
NYA,nya,Nya,NYA,3455018,3460959.0,8637.91,"BNB Chain Ecosystem, Avalanche Ecosystem, Polygon Ecosystem, Meme, Arbitrum Ecosystem, Ethereum Ecosystem, Optimism Ecosystem, Base Ecosystem, Cat-Themed"
REX,etherex,Etherex,REX,3239665,27239607.0,115975.0,"Decentralized Exchange (DEX), Exchange-based Tokens, Decentralized Finance (DeFi), Linea Ecosystem"
PNIC,phoenic-token,Phoenic Token,PNIC,3222884,36199368.0,152074.0,"Avalanche Ecosystem, Payment Solutions"
LOKA,league-of-kingdoms,League of Kingdoms,LOKA,3213532,37700417.0,196903.0,"Gaming (GameFi), NFT, Metaverse, Ethereum Ecosystem, Binance Launchpad, Gaming Governance Token, Gaming Utility Token, Strategy Games, Andreessen Horowitz (a16z) Portfolio, YZi Labs (Prev. Binance Labs) Portfolio, Sequoia Capital Portfolio"
ZYPTO,french-connection-finance,Zypto Token,ZYPTO,2987010,2987010.0,3897.36,"Decentralized Finance (DeFi), Wallets, Ethereum Ecosystem, Payment Solutions"
OMG,oh-my-god,OH MY GOD,OMG,2854650,2854650.0,73361.0,"Solana Ecosystem, Meme"
HTM,hatom,Hatom,HTM,2728202,3972632.0,117993.0,"Decentralized Finance (DeFi), Lending/Borrowing Protocols, Meme, MultiversX Ecosystem, Liquid Staking"
VALOR,valor-2,VALOR,VALOR,2549361,2549361.0,672017.0,"Solana Ecosystem, Meme, Solana Meme"
SABAI,sabai-ecovers,Sabai Protocol,SABAI,2486975,12301452.0,1246305.0,"Tokenized Real Estate, Tokenized Assets, Gaming (GameFi), Polygon Ecosystem, Ethereum Ecosystem, Real World Assets (RWA), Governance"
BAKE,bakerytoken,BakerySwap,BAKE,2486806,2495983.0,365761.0,"NFT, BNB Chain Ecosystem, Harmony Ecosystem"
XMR,monero,Monero,XMR,7495461001,7495461001.0,222853951.0,"Smart Contract Platform, Privacy, Layer 1 (L1), Proof of Work (PoW), Galaxy Digital Portfolio"
MNT,mantle,Mantle,MNT,3891245528,7439687941.0,92358726.0,"Smart Contract Platform, Ethereum Ecosystem, Layer 2 (L2), Mantle Ecosystem, DWF Labs Portfolio, DragonFly Capital Portfolio, GMCI Layer 2 Index, GMCI 30 Index, GMCI Index, World Liberty Financial Portfolio, Made in China, Neobank"
MORPHO,morpho,Morpho,MORPHO,1065184234,2019975324.0,21293123.0,"Decentralized Finance (DeFi), Lending/Borrowing Protocols, Arbitrum Ecosystem, Ethereum Ecosystem, Base Ecosystem, Coinbase Ventures Portfolio, Pantera Capital Portfolio, Morpho Ecosystem, Binance Alpha Spotlight, Katana Ecosystem"
STRK,starknet,Starknet,STRK,1025156197,2248139365.0,848782960.0,"Infrastructure, Smart Contract Platform, Ethereum Ecosystem, Layer 2 (L2), Zero Knowledge (ZK), Starknet Ecosystem, Paradigm Portfolio, Coinbase Ventures Portfolio, Rollup, Multicoin Capital Portfolio, Alameda Research Portfolio, Pantera Capital Portfolio, GMCI Layer 2 Index, Consensys Portfolio, Sequoia Capital Portfolio, GMCI Index, Privacy Blockchain, Polychain Capital Portfolio"
VIRTUAL,virtual-protocol,Virtuals Protocol,VIRTUAL,736211067,1122132666.0,190779068.0,"Artificial Intelligence (AI), Solana Ecosystem, Launchpad, Ethereum Ecosystem, Base Ecosystem, AI Agents, Virtuals Protocol Ecosystem, AI Agent Launchpad, Binance Alpha Spotlight, AI Framework, Robotics"
SAND,the-sandbox,The Sandbox,SAND,473313538,543353801.0,43674756.0,"Gaming (GameFi), NFT, Metaverse, Polygon Ecosystem, Play To Earn, Harmony Ecosystem, Ethereum Ecosystem, Animoca Brands Portfolio, Alleged SEC Securities, Binance Launchpad, Gaming Utility Token, Simulation Games, Energi Ecosystem, YZi Labs (Prev. Binance Labs) Portfolio, Coinbase 50 Index"
SPX,spx6900,SPX6900,SPX,463147251,463147251.0,27012635.0,"Solana Ecosystem, Avalanche Ecosystem, Meme, Ethereum Ecosystem, Base Ecosystem, Bridged-Tokens, Murad Picks, Stock market-themed, 4chan-Themed"
JASMY,jasmycoin,JasmyCoin,JASMY,416178422,420849859.0,30335020.0,"Internet of Things (IOT), Ethereum Ecosystem, DePIN, DWF Labs Portfolio, Coinbase 50 Index"
DOGE,binance-peg-dogecoin,Binance-Peg Dogecoin,DOGE,409876253,409876253.0,4747355.0,"BNB Chain Ecosystem, Avalanche Ecosystem, Meme, Binance-Peg Tokens"
XEC,ecash,eCash,XEC,256296382,256296744.0,7317110.0,"Smart Contract Platform, Layer 1 (L1), Bitcoin Fork, Proof of Work (PoW)"
RUNE,thorchain,THORChain,RUNE,254623560,308295478.0,41971964.0,"Decentralized Exchange (DEX), Infrastructure, Smart Contract Platform, Exchange-based Tokens, Decentralized Finance (DeFi), Bridge Governance Tokens, Multicoin Capital Portfolio, Proof of Stake (PoS), Delphi Ventures Portfolio"
JTO,jito-governance-token,Jito,JTO,231809344,577051736.0,26534298.0,"Decentralized Finance (DeFi), Solana Ecosystem, Liquid Staking Governance Tokens, Multicoin Capital Portfolio, Alameda Research Portfolio, Delphi Ventures Portfolio, Liquid Staking, Made in USA"
XCN,chain-2,Onyxcoin,XCN,207865113,278887572.0,11061228.0,"Smart Contract Platform, BNB Chain Ecosystem, Layer 1 (L1), Ethereum Ecosystem, Base Ecosystem, Proof of Stake (PoS), Pantera Capital Portfolio, Made in USA"
AMP,amp-token,Amp,AMP,202132435,239034978.0,5200241.0,"Decentralized Finance (DeFi), Near Protocol Ecosystem, Ethereum Ecosystem, Payment Solutions, Alleged SEC Securities, Pantera Capital Portfolio, Energi Ecosystem, Made in USA"
SOSO,sosovalue,SoSoValue,SOSO,172452102,627631294.0,9532060.0,"Index, Decentralized Finance (DeFi), Analytics, Ethereum Ecosystem, Base Ecosystem"
ZRX,0x,0x Protocol,ZRX,151814314,178942632.0,14242182.0,"Decentralized Exchange (DEX), Exchange-based Tokens, Decentralized Finance (DeFi), Ethereum Ecosystem, Coinbase Ventures Portfolio, Pantera Capital Portfolio, GMCI DeFi Index, Blockchain Capital Portfolio, GMCI Index, Made in USA, Governance"
FORM,four,Four,FORM,148580433,222676509.0,11388948.0,"Gaming (GameFi), BNB Chain Ecosystem, Launchpad"
WEFI,wefi,WeFi,WFI,141337822,1910765881.0,4073281.0,BNB Chain Ecosystem
GOMINING,gmt-token,GoMining Token,GOMINING,133351182,133351182.0,11353905.0,"Gaming (GameFi), BNB Chain Ecosystem, Ethereum Ecosystem, TON Ecosystem"
GRASS,grass,Grass,GRASS,126342434,283406851.0,21361436.0,"Artificial Intelligence (AI), Solana Ecosystem, DePIN, Polychain Capital Portfolio, Binance Alpha Spotlight"
ARRR,pirate-chain,Pirate Chain,ARRR,124509829,126912409.0,581736.0,"Smart Contract Platform, Privacy, Zero Knowledge (ZK), Proof of Work (PoW)"
SUSHI,sushi,Sushi,SUSHI,124463773,131149056.0,24060608.0,"Decentralized Exchange (DEX), Exchange-based Tokens, Decentralized Finance (DeFi), Yield Farming, Automated Market Maker (AMM), BNB Chain Ecosystem, Yearn Ecosystem, Solana Ecosystem, Avalanche Ecosystem, Polygon Ecosystem, Near Protocol Ecosystem, Fantom Ecosystem, Harmony Ecosystem, Arbitrum Ecosystem, Celo Ecosystem, Ethereum Ecosystem, Base Ecosystem, Alameda Research Portfolio, Pantera Capital Portfolio, Energi Ecosystem, Sora Ecosystem, Blockchain Capital Portfolio, Katana Ecosystem, Governance"
XPR,proton,XPR Network,XPR,113102060,124819791.0,2767722.0,"Smart Contract Platform, BNB Chain Ecosystem, Ethereum Ecosystem, DWF Labs Portfolio, Made in USA, Governance"
ASTR,astar,Astar,ASTR,110442231,115003837.0,4944464.0,"Smart Contract Platform, Polkadot Ecosystem, Layer 1 (L1), Ethereum Ecosystem, Layer 2 (L2), Alameda Research Portfolio, YZi Labs (Prev. Binance Labs) Portfolio, OKX Ventures Portfolio"
ORDI,ordinals,ORDI,ORDI,93200035,93200035.0,23456158.0,"Solana Ecosystem, Meme, BRC-20, Bitcoin Ecosystem, Inscriptions"
OM,mantra-dao,MANTRA,OM,92373709,142135237.0,25404287.0,"Infrastructure, Smart Contract Platform, BNB Chain Ecosystem, Cosmos Ecosystem, Layer 1 (L1), Polygon Ecosystem, Ethereum Ecosystem, Real World Assets (RWA), Base Ecosystem, Osmosis Ecosystem, Mantra Ecosystem"
SKL,skale,SKALE,SKL,92069865,92528329.0,7723944.0,"Smart Contract Platform, Gaming (GameFi), Layer 1 (L1), Ethereum Ecosystem, Modular Blockchain, Account Abstraction, Multicoin Capital Portfolio, Gaming Blockchains, Gaming Utility Token, Skale Ecosystem, Consensys Portfolio, Galaxy Digital Portfolio, Made in USA, x402 Ecosystem"
