KRL,kryll,KRYLL,KRL,15596153,19339391.0,353802.0,"Artificial Intelligence (AI), Decentralized Finance (DeFi), Analytics, Arbitrum Ecosystem, Ethereum Ecosystem, Optimism Ecosystem, Base Ecosystem, AI Applications"
BKN,brickken,Brickken,BKN,15585914,31209720.0,807537.0,"Tokenized Real Estate, Tokenized Assets, BNB Chain Ecosystem, Impossible Finance Launchpad, Ethereum Ecosystem, Real World Assets (RWA), RWA Protocol"
CLEAR,everclear,Everclear,CLEAR,15117291,36236082.0,102167.0,"Infrastructure, BNB Chain Ecosystem, Polygon Ecosystem, Gnosis Chain Ecosystem, Arbitrum Ecosystem, Ethereum Ecosystem, Optimism Ecosystem, Coinbase Ventures Portfolio, Cross-chain Communication, Chain Abstraction"
REEF,reef,Reef,REEF,14902290,14902290.0,1214658.0,"BNB Chain Ecosystem, Binance Launchpool, Harmony Ecosystem, Ethereum Ecosystem, Alameda Research Portfolio, Energi Ecosystem, Sora Ecosystem, YZi Labs (Prev. Binance Labs) Portfolio, GMCI Layer 1 Index, GMCI Index"
WUF,wuffi,WUFFI,WUF,14809025,14809025.0,101252.0,"Solana Ecosystem, Meme, Base Ecosystem"
BAR,fc-barcelona-fan-token,FC Barcelona Fan Token,BAR,13565099,44853289.0,2228665.0,"Sports, Fan Token, Binance Launchpad, Chiliz Ecosystem"
LAZIO,lazio-fan-token,Lazio Fan Token,LAZIO,10147236,33481165.0,2105528.0,"Sports, BNB Chain Ecosystem, Fan Token, Binance Launchpad"
PAID,paid-network,PAID,PAID,10051075,11901876.0,66876.0,"Launchpad, Base Ecosystem"
MINIMA,minima,Minima,MINIMA,9437202,18475711.0,242919.0,"Smart Contract Platform, Layer 1 (L1), DePIN"
BCUT,bitscrunch-token,bitsCrunch Token,BCUT,9343730,17868542.0,1510893.0,"Artificial Intelligence (AI), Infrastructure, Analytics, NFT, Polygon Ecosystem, Ethereum Ecosystem, Animoca Brands Portfolio, Coinbase Ventures Portfolio"
STOS,stratos,Stratos,STOS,9146385,13444066.0,302795.0,"Entertainment, Infrastructure, Smart Contract Platform, Storage, Layer 1 (L1), Ethereum Ecosystem, DePIN, Osmosis Ecosystem"
MCN,mcncoin,MCNCOIN,MCN,8745515,8745515.0,2423707.0,BNB Chain Ecosystem
LNQ,linqai,LinqAI,LNQ,8713155,29974096.0,1497880.0,"Artificial Intelligence (AI), Ethereum Ecosystem"
TRUF,truflation,TRUF.Network,TRUF,8204687,23077239.0,553033.0,"Infrastructure, Oracle, Arbitrum Ecosystem, Ethereum Ecosystem, Real World Assets (RWA), Base Ecosystem, Coinbase Ventures Portfolio"
BAD,bad-idea-ai,Bad Idea AI,BAD,7593974,9416487.0,1400408.0,"Artificial Intelligence (AI), Meme, Ethereum Ecosystem, Telegram Apps, Discord Bots, Shibarium Ecosystem"
RWA,allo,Allo,RWA,7263025,40350139.0,14746187.0,"BNB Chain Ecosystem, Real World Assets (RWA), RWA Protocol"
SCF,smoking-chicken-fish,Smoking Chicken Fish,SCF,7203563,7203563.0,961219.0,"Solana Ecosystem, Meme, Solana Meme, Pump.fun Ecosystem"
BST,blocksquare,Blocksquare,BST,6180461,6180461.0,416137.0,"Tokenized Real Estate, Tokenized Assets, Ethereum Ecosystem, Real World Assets (RWA)"
RFC,retard-finder-coin,Retard Finder Coin,RFC,5782823,6013943.0,4919053.0,"Solana Ecosystem, Meme, Pump.fun Ecosystem, Wojak-Themed"
GOGLZ,googles,GOGGLES,GOGLZ,5777741,5777741.0,242144.0,"Meme, Sonic Ecosystem"
BILLY,billy,Billy,BILLY,5326677,5326677.0,1337248.0,"Solana Ecosystem, Meme, Dog-Themed, Solana Meme, Pump.fun Ecosystem"
AZIT,azit,azit,AZIT,5013341,7375574.0,253187.0,Kaia Ecosystem
TSUKA,dejitaru-tsuka,Dejitaru Tsuka,TSUKA,4961534,4961534.0,68287.0,"Meme, Ethereum Ecosystem"
INTER,inter-milan-fan-token,Inter Milan Fan Token,INTER,4898758,4898758.0,644041.0,"Sports, Fan Token, Chiliz Ecosystem"
READY,ready,READY!,READY,4453717,4453717.0,199009.0,"Gaming (GameFi), Solana Ecosystem, Gaming Platform"
GURU,guru,Guru,GURU,4398565,4398565.0,26551.0,"Decentralized Finance (DeFi), Ethereum Ecosystem"
NWC,newscrypto-coin,Numerico,NWC,4106518,6994735.0,162589.0,"Education, Smart Contract Platform, BNB Chain Ecosystem, Ethereum Ecosystem, Layer 2 (L2), Stellar Ecosystem"
KANGO,kango,KANGO,KANGO,4056718,4056718.0,167206.0,"Meme, Kaspa Ecosystem"
HUAHUA,chihuahua-token,Chihuahua Chain,HUAHUA,3960332,4218576.0,742754.0,"Smart Contract Platform, NFT, Layer 1 (L1), Meme, Dog-Themed, Osmosis Ecosystem"
BITBOARD,bitboard,BitBoard,BB,3853547,5824906.0,93226.0,"Smart Contract Platform, Polygon Ecosystem, Layer 2 (L2), Zero Knowledge (ZK)"
TRVL,dtravel,Dtravel,TRVL,3726022,8432565.0,289060.0,"Artificial Intelligence (AI), Tourism, BNB Chain Ecosystem, Ethereum Ecosystem, Real World Assets (RWA), DePIN, Base Ecosystem"
FET,fetch-ai,Artificial Superintelligence Alliance,FET,2027620074,2112878570.0,123703760.0,"Artificial Intelligence (AI), NFT, BNB Chain Ecosystem, Cardano Ecosystem, Ethereum Ecosystem, Binance Launchpad, DWF Labs Portfolio, Osmosis Ecosystem, AI Agents, GMCI DePIN Index, GMCI Index, Outlier Ventures Portfolio, AI Agent Launchpad"
QNT,quant-network,Quant,QNT,1641942365,1649654889.0,31048923.0,"Ethereum Ecosystem, Real World Assets (RWA), Energi Ecosystem, Coinbase 50 Index"
DOGWIFHAT,dogwifcoin,dogwifhat,WIF,1081957243,1081957243.0,405931563.0,"Solana Ecosystem, Meme, Dog-Themed, Solana Meme, GMCI Meme Index, GMCI Index"
XAUT,tether-gold,Tether Gold,XAUT,826510262,826510262.0,12785326.0,"Stablecoins, Tokenized Assets, Tokenized Gold, Ethereum Ecosystem, Real World Assets (RWA), Tokenized Commodities"
PENDLE,pendle,Pendle,PENDLE,740232508,1263871602.0,55319735.0,"Decentralized Exchange (DEX), Decentralized Finance (DeFi), Yield Farming, Automated Market Maker (AMM), BNB Chain Ecosystem, Derivatives, Lending/Borrowing Protocols, Arbitrum Ecosystem, Ethereum Ecosystem, Optimism Ecosystem, Fixed Interest, LSDFi, Base Ecosystem, Restaking, LRTfi, Liquid Restaking Governance Tokens, Yield Tokenization Protocol, YZi Labs (Prev. Binance Labs) Portfolio, GMCI DeFi Index, Sonic Ecosystem, Liquid Staking, GMCI Index, BTCfi Protocol"
KAVA,kava,Kava,KAVA,460472883,460472883.0,7717242.0,"Smart Contract Platform, Layer 1 (L1), Binance Launchpad, DWF Labs Portfolio, Osmosis Ecosystem, YZi Labs (Prev. Binance Labs) Portfolio, Made in USA"
1INCH,1inch,1inch,1INCH,443025398,476359131.0,22671280.0,"Decentralized Exchange (DEX), Exchange-based Tokens, Decentralized Finance (DeFi), Automated Market Maker (AMM), BNB Chain Ecosystem, Avalanche Ecosystem, Polygon Ecosystem, Near Protocol Ecosystem, Harmony Ecosystem, Ethereum Ecosystem, FTX Holdings, Alameda Research Portfolio, DragonFly Capital Portfolio, Pantera Capital Portfolio, Energi Ecosystem, YZi Labs (Prev. Binance Labs) Portfolio, GMCI DeFi Index, Galaxy Digital Portfolio, Blockchain Capital Portfolio, Dex Aggregator, GMCI Index, Coinbase 50 Index"
RON,ronin,Ronin,RON,376696683,571410808.0,8710932.0,"Smart Contract Platform, Gaming (GameFi), NFT, Layer 1 (L1), Play To Earn, Zero Knowledge (ZK), FTX Holdings, Ronin Ecosystem, Gaming Blockchains, SideChain, Andreessen Horowitz (a16z) Portfolio, YZi Labs (Prev. Binance Labs) Portfolio"
ATH,aethir,Aethir,ATH,349861360,1381159199.0,21942201.0,"Solana Ecosystem, Arbitrum Ecosystem, Impossible Finance Launchpad, Ethereum Ecosystem, DePIN, Animoca Brands Portfolio"
ZBCN,zebec-network,Zebec Network,ZBCN,278038099,322146697.0,17207304.0,"Decentralized Finance (DeFi), Solana Ecosystem, Real World Assets (RWA), Payment Solutions, DePIN, Coinbase Ventures Portfolio, Alameda Research Portfolio, Circle Ventures Portfolio, OKX Ventures Portfolio, RWA Protocol, Made in USA"
PLUME,plume,Plume,PLUME,275352635,1083354631.0,21907361.0,"Smart Contract Platform, Layer 1 (L1), Ethereum Ecosystem, Real World Assets (RWA), RWA Protocol, Made in USA, Plume Network Ecosystem"
QTUM,qtum,Qtum,QTUM,263606890,268817656.0,30319021.0,"Smart Contract Platform, Proof of Stake (PoS), Made in China"
SFP,safepal,SafePal,SFP,261635200,261635200.0,4259507.0,"BNB Chain Ecosystem, Wallets, Ethereum Ecosystem, Animoca Brands Portfolio, Binance Launchpad, Energi Ecosystem, YZi Labs (Prev. Binance Labs) Portfolio"
ROSE,oasis-network,Oasis,ROSE,234864301,317254119.0,8676689.0,"Smart Contract Platform, BNB Chain Ecosystem, Layer 1 (L1), Proof of Stake (PoS), Pantera Capital Portfolio, Andreessen Horowitz (a16z) Portfolio, YZi Labs (Prev. Binance Labs) Portfolio, Blockchain Capital Portfolio, Privacy Blockchain, Polychain Capital Portfolio, Coinbase 50 Index"
FLUID,instadapp,Fluid,FLUID,230957826,585640333.0,2270754.0,"Decentralized Finance (DeFi), Polygon Ecosystem, Arbitrum Ecosystem, Ethereum Ecosystem, Base Ecosystem, Coinbase Ventures Portfolio, Pantera Capital Portfolio"
XCH,chia,Chia,XCH,168053715,379204197.0,3884780.0,"Smart Contract Platform, Layer 1 (L1), DePIN, Andreessen Horowitz (a16z) Portfolio, Made in USA"
PROM,prometeus,Prom,PROM,165118465,174166052.0,5075732.0,"Smart Contract Platform, BNB Chain Ecosystem, Ethereum Ecosystem, Layer 2 (L2)"
ZANO,zano,Zano,ZANO,133361535,133417170.0,1549619.0,"Smart Contract Platform, Privacy, Layer 1 (L1), Proof of Stake (PoS), Proof of Work (PoW), Zano Ecosystem, Privacy Blockchain"
LQTY,liquity,Liquity,LQTY,127930992,131084193.0,14141587.0,"Decentralized Finance (DeFi), Lending/Borrowing Protocols, Arbitrum Ecosystem, Ethereum Ecosystem, Alameda Research Portfolio, Pantera Capital Portfolio"
DAG,constellation-labs,Constellation,DAG,122596672,152679613.0,2961911.0,"Smart Contract Platform, Layer 1 (L1), Base Ecosystem, Layer 0 (L0), Made in USA, Directed Acyclic Graph (DAG)"
XVG,verge,Verge,XVG,122116754,122361024.0,10144555.0,"Smart Contract Platform, Privacy, Proof of Work (PoW), Made in USA"
BIGTIME,big-time,Big Time,BIGTIME,117911283,308952152.0,12699031.0,"Gaming (GameFi), Play To Earn, Ethereum Ecosystem, RPG, Alameda Research Portfolio, Circle Ventures Portfolio, OKX Ventures Portfolio, MMO"
WAVES,waves,Waves,WAVES,111485974,111485974.0,6773632.0,"Smart Contract Platform, DWF Labs Portfolio, Proof of Stake (PoS)"
UMA,uma,UMA,UMA,110394543,156825560.0,15834029.0,"Business Services, Decentralized Finance (DeFi), Oracle, Derivatives, Synthetic Issuer, Avalanche Ecosystem, Ethereum Ecosystem, Blockchain Capital Portfolio, Synthetic, Made in USA"
DYM,dymension,Dymension,DYM,103545755,313874519.0,22566506.0,"Smart Contract Platform, Cosmos Ecosystem, Modular Blockchain, Osmosis Ecosystem, Rollups-as-a-Service (RaaS)"
MANTA,manta-network,Manta Network,MANTA,103149484,244128195.0,13958138.0,"Smart Contract Platform, Polkadot Ecosystem, Binance Launchpool, Layer 2 (L2), Manta Network Ecosystem, Multicoin Capital Portfolio, Alameda Research Portfolio, DeFiance Capital Portfolio, YZi Labs (Prev. Binance Labs) Portfolio"
XRD,radix,Radix,XRD,99308218,111095861.0,1016702.0,"Smart Contract Platform, Layer 1 (L1), DWF Labs Portfolio, Radix Ecosystem"
RED,redstone-oracles,RedStone,RED,97090690,346752463.0,14745240.0,"Infrastructure, Oracle, Ethereum Ecosystem"
FIDA,bonfida,Solana Name Service (prev. Bonfida),FIDA,92703453,93553726.0,11101823.0,"Big Data, Business Services, Infrastructure, Decentralized Finance (DeFi), Solana Ecosystem, FTX Holdings, DWF Labs Portfolio, Name Service"
SHX,stronghold-token,Stronghold,SHX,82248089,,1045545.0,"Ethereum Ecosystem, Stellar Ecosystem, Made in USA"
STEEM,steem,Steem,STEEM,79913931,79929244.0,14219692.0,SocialFi
TAIKO,taiko,Taiko,TAIKO,78303502,493628337.0,12646684.0,"Smart Contract Platform, BNB Chain Ecosystem, Ethereum Ecosystem, Layer 2 (L2), Zero Knowledge (ZK), Rollup, OKX Ventures Portfolio, Centralized Exchange (CEX) Product, Binance Alpha Spotlight"
JOE,joe,JOE,JOE,71807345,90125980.0,5907634.0,"Decentralized Exchange (DEX), Decentralized Finance (DeFi), Yield Farming, Automated Market Maker (AMM), BNB Chain Ecosystem, Avalanche Ecosystem, Arbitrum Ecosystem, Mantle Ecosystem, DeFiance Capital Portfolio, Delphi Ventures Portfolio, Dex Aggregator"
AITECH,solidus-aitech,Solidus Ai Tech,AITECH,67251185,86433198.0,13147959.0,"Artificial Intelligence (AI), BNB Chain Ecosystem, Solana Ecosystem, Launchpad, Base Ecosystem, ChainGPT Launchpad, AI Agents, Binance Alpha Spotlight, DeFAI"
ANYONE,airtor-protocol,ANyONe Protocol,ANYONE,65999966,82564265.0,962812.0,"Smart Contract Platform, Ethereum Ecosystem, DePIN, Privacy Blockchain"
WCT,connect-token-wct,WalletConnect Token,WCT,64340216,345543312.0,48353050.0,"Solana Ecosystem, Wallets, Ethereum Ecosystem, Optimism Ecosystem"
SUNDOG,sundog,Sundog,SUNDOG,62986205,62986205.0,6616228.0,"Meme, Tron Ecosystem, Sun Pump Ecosystem, TRON Meme"
NIL,nillion,Nillion,NIL,62557764,320562462.0,10402907.0,"Infrastructure, Binance Launchpool"
HASHAI,hashai,HashAI,HASHAI,57510192,61073307.0,812728.0,"Artificial Intelligence (AI), Ethereum Ecosystem, DePIN"
SAI,sai,Sai,SAI,50471744,50462219.0,14822.84,"Decentralized Finance (DeFi), Ethereum Ecosystem"
BOBA,boba-network,Boba Network,BOBA,49094081,53733424.0,12623339.0,"Smart Contract Platform, Ethereum Ecosystem, Layer 2 (L2), Rollup, Boba Network Ecosystem, GMCI Layer 2 Index, GMCI Index, Made in USA"
MBL,moviebloc,MovieBloc,MBL,46493113,74828424.0,5754859.0,DWF Labs Portfolio
PARTI,particle-network,Particle Network,PARTI,42237017,181274750.0,16898081.0,"Decentralized Finance (DeFi), BNB Chain Ecosystem, Layer 1 (L1), Base Ecosystem, Account Abstraction, Cross-chain Communication, Binance HODLer Airdrops, Chain Abstraction, Binance Wallet IDO"
NFP,nfprompt-token,NFPrompt,NFP,38509694,81450902.0,7664912.0,"BNB Chain Ecosystem, Binance Launchpool, YZi Labs (Prev. Binance Labs) Portfolio"
ZORA,zora,Zora,ZORA,38483067,122110759.0,19550709.0,"Infrastructure, Media, Smart Contract Platform, NFT, Layer 2 (L2), Base Ecosystem, Coinbase Ventures Portfolio, Zora Ecosystem"
SERAPH,seraph,Seraph,SERAPH,37658126,149624482.0,25744432.0,"Gaming (GameFi), BNB Chain Ecosystem, Play To Earn, Ethereum Ecosystem, RPG, Gaming Utility Token, Action Games"
REZ,renzo,Renzo,REZ,35053740,133204372.0,16889281.0,"Decentralized Finance (DeFi), Binance Launchpool, Ethereum Ecosystem, Base Ecosystem, Restaking, YZi Labs (Prev. Binance Labs) Portfolio, OKX Ventures Portfolio"
DAO,dao-maker,DAO Maker,DAO,33130169,36641946.0,1202004.0,"BNB Chain Ecosystem, Solana Ecosystem, Launchpad, DaoMaker Launchpad, Arbitrum Ecosystem, Ethereum Ecosystem, Step Network Ecosystem"
SD,stader,Stader,SD,33061528,65385252.0,6640612.0,"BNB Chain Ecosystem, Polygon Ecosystem, Fantom Ecosystem, Ethereum Ecosystem, Liquid Staking Governance Tokens, Animoca Brands Portfolio, Coinbase Ventures Portfolio, Pantera Capital Portfolio, Liquid Staking, Binance Alpha Spotlight"
VIC,tomochain,Viction,VIC,31328262,54016639.0,5566927.0,"Smart Contract Platform, Masternodes, Layer 1 (L1), DWF Labs Portfolio"
BOOE,book-of-ethereum,Book of Ethereum,BOOE,27954968,27954968.0,217828.0,"Meme, Ethereum Ecosystem"
SOON,soon-2,SOON,SOON,27109135,145046203.0,4132619.0,"Infrastructure, Smart Contract Platform, BNB Chain Ecosystem, Layer 2 (L2), Cross-chain Communication, Binance Alpha Spotlight"
RIO,realio-network,Realio Network Token,RIO,26122549,26122863.0,3450229.0,"BNB Chain Ecosystem, Solana Ecosystem, Ethereum Ecosystem, Algorand Ecosystem, Real World Assets (RWA), Osmosis Ecosystem, Stellar Ecosystem, Made in USA"
OGY,origyn-foundation,ORIGYN,OGY,25992909,31066666.0,137500.0,"Internet Computer Ecosystem, Real World Assets (RWA), RWA Protocol"
WEPE,wall-street-pepe,Wall Street Pepe,WEPE,24690096,24690096.0,3208574.0,"Meme, Ethereum Ecosystem, Frog-Themed, The Boys Club"
NMT,netmind-token,NetMind Token,NMT,23733626,67708357.0,2681570.0,"Artificial Intelligence (AI), BNB Chain Ecosystem, Ethereum Ecosystem, DePIN, AI Agents"
MLC,my-lovely-coin,My Lovely Coin,MLC,19604846,88015430.0,931422.0,"Charity, Gaming (GameFi), Polygon Ecosystem, Gaming Utility Token"
NATIX,natix-network,NATIX Network,NATIX,19307506,90020943.0,336152.0,"Artificial Intelligence (AI), Internet of Things (IOT), Solana Ecosystem, DePIN"
SUKU,suku,SUKU,SUKU,19024273,61802248.0,4039725.0,"Polygon Ecosystem, Ethereum Ecosystem, Made in USA"
FHE,mind-network,Mind Network,FHE,17564101,70538560.0,5611837.0,"Artificial Intelligence (AI), Smart Contract Platform, BNB Chain Ecosystem, Layer 2 (L2), Binance Wallet IDO"
LOCK,houdini-swap,Houdini Swap,LOCK,16655212,16655212.0,17719.12,"Privacy, Solana Ecosystem, Ethereum Ecosystem"
ZETA,zeta,Zeta,ZEX,16038452,85415293.0,1706938.0,"Decentralized Finance (DeFi), Derivatives, Perpetuals, Solana Ecosystem"
NUM,numbers-protocol,Numbers Protocol,NUM,15934923,16135192.0,585662.0,"Artificial Intelligence (AI), Smart Contract Platform, BNB Chain Ecosystem, DaoMaker Launchpad, Ethereum Ecosystem, Avalanche L1, YZi Labs (Prev. Binance Labs) Portfolio, Outlier Ventures Portfolio"
VOW,vow,Vow,VOW,15427490,50578562.0,110620.0,"Retail, Tourism, BNB Chain Ecosystem, Ethereum Ecosystem"
VINU,vita-inu,Vita Inu,VINU,15400379,15400379.0,1495835.0,"BNB Chain Ecosystem, Meme, Dog-Themed, DWF Labs Portfolio, Binance Alpha Spotlight"
LINGO,lingo,Lingo,LINGO,14480538,14480538.0,659101.0,"Solana Ecosystem, Real World Assets (RWA), Base Ecosystem, RWA Protocol"
MEMEFI,memefi-2,MemeFi,MEMEFI,13758715,13758715.0,4477579.0,"Gaming (GameFi), NFT, Meme, Play To Earn, Sui Ecosystem, Telegram Apps, Tap to Earn, Sui Meme, Action Games"
MFT,mainframe,Mainframe,MFT,12789205,13625029.0,152.38,"Ethereum Ecosystem, Energi Ecosystem"
LOOKS,looksrare,LooksRare,LOOKS,12511752,12511752.0,2993505.0,"NFT, Ethereum Ecosystem, NFT Marketplace"
VSC,vyvo-smart-chain,Vyvo Smart Chain,VSC,12417679,52700146.0,160802.0,"Smart Contract Platform, BNB Chain Ecosystem, Polygon Ecosystem, Layer 2 (L2)"
DIONE,dione,Dione,DIONE,12121198,14213754.0,300154.0,"Energy, Smart Contract Platform, Layer 1 (L1), Made in USA"
PROPS,propbase,Propbase,PROPS,11828542,33852478.0,3361855.0,"Tokenized Real Estate, Tokenized Assets, Aptos Ecosystem, Real World Assets (RWA), Base Ecosystem, RWA Protocol"
PORT3,port3-network,Port3 Network,PORT3,11157163,22321147.0,2118991.0,"SocialFi, BNB Chain Ecosystem, Ethereum Ecosystem, Poolz Finance Launchpad"
AEROBUD,aerobud,AEROBUD,AEROBUD,11083944,11083944.0,126628.0,"Charity, Meme, Base Ecosystem, Dog-Themed, Base Meme, Made in USA"
EPT,balance,Balance,EPT,10541460,45504343.0,3286580.0,"Gaming (GameFi), BNB Chain Ecosystem, Animoca Brands Portfolio, DWF Labs Portfolio, AI Agents, Andreessen Horowitz (a16z) Portfolio, AI Agent Launchpad"
SIDUS,sidus,Sidus,SIDUS,9010635,15385854.0,716028.0,"Gaming (GameFi), NFT, BNB Chain Ecosystem, Metaverse, Play To Earn, Ethereum Ecosystem, Linea Ecosystem, Animoca Brands Portfolio, Base Ecosystem, RPG, Gaming Governance Token, Alameda Research Portfolio, OKX Ventures Portfolio"
MCB,mcdex,MUX Protocol,MCB,8945881,11298116.0,1840.56,"Decentralized Exchange (DEX), Exchange-based Tokens, Decentralized Finance (DeFi), BNB Chain Ecosystem, Derivatives, Perpetuals, Arbitrum Ecosystem, Ethereum Ecosystem, Multicoin Capital Portfolio, Alameda Research Portfolio, DeFiance Capital Portfolio, Delphi Ventures Portfolio, OKX Ventures Portfolio"
RLY,rally-2,Rally,RLY,7396925,22138119.0,120020.0,"SocialFi, Yield Farming, Ethereum Ecosystem, Alleged SEC Securities, Coinbase Ventures Portfolio, Andreessen Horowitz (a16z) Portfolio"
JUNO,juno-network,JUNO,JUNO,6898460,9165119.0,75691.0,"Smart Contract Platform, Cosmos Ecosystem, Osmosis Ecosystem, Juno Ecosystem, Evmos Ecosystem, Secret Ecosystem"
LEVER,lever,LeverFi,LEVER,6874690,6874838.0,1818213.0,"Decentralized Finance (DeFi), Ethereum Ecosystem, DWF Labs Portfolio, Alameda Research Portfolio"
PEAR,pear-protocol,Pear Protocol,PEAR,6285948,19794281.0,24762.0,"Decentralized Exchange (DEX), Decentralized Finance (DeFi), Perpetuals, Arbitrum Ecosystem"
BEAM,beam,BEAM,BEAM,6230469,8884874.0,349370.0,"Smart Contract Platform, Privacy, Ethereum Ecosystem, Proof of Work (PoW), BeamPrivacy Ecosystem, Privacy Blockchain"
LIF3,lif3,LIF3 (OLD),LIF3,6072875,20636036.0,11.79,Fantom Ecosystem
PMT,public-meme-token,Public Masterpiece Token,PMT,5898028,22807240.0,360715.0,BNB Chain Ecosystem
DYNA,dynachain,Dynachain,DYNA,5307469,22551365.0,356354.0,"Healthcare, BNB Chain Ecosystem"
HARAMBEAI,harambe-ai,Harambe AI,HARAMBEAI,5181895,7620667.0,1053.99,"Meme, Ethereum Ecosystem"
OBT,oobit,Oobit,OBT,4809567,13662599.0,86601.0,"BNB Chain Ecosystem, Ethereum Ecosystem, Payment Solutions"
KILO,kiloex,KiloEx,KILO,4578413,21626894.0,4839193.0,"Decentralized Exchange (DEX), Decentralized Finance (DeFi), BNB Chain Ecosystem, Derivatives, Binance Wallet IDO"
SHRUB,shrub,Shrub,SHRUB,4549664,4587458.0,504272.0,"Solana Ecosystem, Meme, Ethereum Ecosystem, Base Ecosystem, Elon Musk-Inspired"
GAIA,gaia-2,Gaia,SN57,4528652,4528652.0,16766.91,"Artificial Intelligence (AI), Bittensor Ecosystem, Bittensor Subnets"
LL,lightlink,LightLink,LL,4170068,14314488.0,197374.0,"Infrastructure, Smart Contract Platform, Ethereum Ecosystem, Layer 2 (L2), Rollup, LightLink Ecosystem"
METAV,metaverse,METAVERSE,METAV,4110938,4110938.0,465155.0,"Artificial Intelligence (AI), Solana Ecosystem, AI Agents, Pump.fun Ecosystem, Binance Alpha Spotlight"
MAS,massa,Massa,MAS,3778205,14053326.0,94144.0,"Smart Contract Platform, Layer 1 (L1), Massa Ecosystem"
SDN,shiden,Shiden Network,SDN,3700818,4769776.0,89683.0,Smart Contract Platform
BCT,toucan-protocol-base-carbon-tonne,Base Carbon Tonne,BCT,3470912,3470912.0,24.41,"Polygon Ecosystem, Regenerative Finance (ReFi), Base Ecosystem"
NLS,nolus,Nolus,NLS,3433902,4980266.0,225300.0,"Ethereum Ecosystem, Osmosis Ecosystem"
HMND,humanode,Humanode,HMND,3134524,9507199.0,502816.0,"Artificial Intelligence (AI), Smart Contract Platform, Layer 1 (L1), Decentralized Identifier (DID), Discord Bots, Humanode Ecosystem"
LEOX,leox,LEOX,LEOX,3082335,3082335.0,55837.0,"Tokenized Real Estate, Tokenized Assets, Ethereum Ecosystem, Real World Assets (RWA), RWA Protocol"
KLIMA,klima-dao,KlimaDAO,KLIMA,3075918,3075918.0,6022.53,"Rebase Tokens, Polygon Ecosystem, Ohm Fork, Regenerative Finance (ReFi), Real World Assets (RWA), Base Ecosystem"
XNA,neurai,Neurai,XNA,3050041,3050041.0,98123.0,"Smart Contract Platform, Layer 1 (L1), Real World Assets (RWA), Proof of Work (PoW)"
HBAR,hedera-hashgraph,Hedera,HBAR,11316042258,13346696791.0,538214608.0,"Smart Contract Platform, Layer 1 (L1), Hedera Ecosystem, GMCI Layer 1 Index, GMCI 30 Index, GMCI Index, Outlier Ventures Portfolio, Made in USA, Directed Acyclic Graph (DAG)"
BGB,bitget-token,Bitget Token,BGB,5628271213,5628271213.0,258924037.0,"Exchange-based Tokens, Centralized Exchange (CEX) Token, Ethereum Ecosystem, DragonFly Capital Portfolio, Morph L2 Ecosystem"
RENDER,render-token,Render,RENDER,2162144781,2223738797.0,86159629.0,"Artificial Intelligence (AI), NFT, Metaverse, Solana Ecosystem, Polygon Ecosystem, Ethereum Ecosystem, DePIN, Multicoin Capital Portfolio, Alameda Research Portfolio, GMCI DePIN Index, GMCI 30 Index, GMCI Index, Made in USA, Coinbase 50 Index"
LBTC,lombard-staked-btc,Lombard Staked BTC,LBTC,1683585594,1683585594.0,5254422.0,"BNB Chain Ecosystem, Ethereum Ecosystem, Sui Ecosystem, Base Ecosystem, Restaking, Berachain Ecosystem, Liquid Restaking Tokens, Sonic Ecosystem, Swellchain Ecosystem, Corn Ecosystem, Liquid Staked BTC"
XDC,xdce-crowd-sale,XDC Network,XDC,1560126601,3654717730.0,66645274.0,"Smart Contract Platform, Layer 1 (L1), Real World Assets (RWA)"
TIA,celestia,Celestia,TIA,1419725476,2252604059.0,148286694.0,"Smart Contract Platform, Cosmos Ecosystem, Layer 1 (L1), Data Availability, Modular Blockchain, Osmosis Ecosystem, eGirl Capital Portfolio, Coinbase Ventures Portfolio, Proof of Stake (PoS), Secret Ecosystem, YZi Labs (Prev. Binance Labs) Portfolio, Delphi Ventures Portfolio, Galaxy Digital Portfolio, Blockchain Capital Portfolio, OKX Ventures Portfolio, Polychain Capital Portfolio"
IP,story-2,Story,IP,1359909164,4665064297.0,23136198.0,"Artificial Intelligence (AI), Smart Contract Platform, Layer 1 (L1), Made in USA, Story Ecosystem"
FLOKI,floki,FLOKI,FLOKI,1350088747,1397368694.0,510614085.0,"Gaming (GameFi), NFT, BNB Chain Ecosystem, Metaverse, Meme, Play To Earn, Ethereum Ecosystem, Telegram Apps, Dog-Themed, DWF Labs Portfolio, RPG, On-chain Gaming, TokenFi Launchpad, GMCI Meme Index, GMCI Index"
LDO,lido-dao,Lido DAO,LDO,989864030,1103620845.0,163343327.0,"Infrastructure, Decentralized Finance (DeFi), Polygon Ecosystem, Arbitrum Ecosystem, Ethereum Ecosystem, Optimism Ecosystem, Liquid Staking Governance Tokens, eGirl Capital Portfolio, Paradigm Portfolio, Coinbase Ventures Portfolio, Multicoin Capital Portfolio, Index Coop Defi Index, Alameda Research Portfolio, DragonFly Capital Portfolio, Andreessen Horowitz (a16z) Portfolio, GMCI DeFi Index, Delphi Ventures Portfolio, Liquid Staking, GMCI Index, Coinbase 50 Index"
PYTH,pyth-network,Pyth Network,PYTH,757132649,1316755740.0,39249965.0,"Business Services, Infrastructure, Decentralized Finance (DeFi), Oracle, Solana Ecosystem, Neon Ecosystem, Manta Network Ecosystem, Multicoin Capital Portfolio, GMCI DeFi Index, Delphi Ventures Portfolio, GMCI Index"
RAY,raydium,Raydium,RAY,750342546,1556992316.0,45391559.0,"Decentralized Exchange (DEX), Decentralized Finance (DeFi), Yield Farming, Automated Market Maker (AMM), Solana Ecosystem, Launchpad, GMCI DeFi Index, GMCI Index"
BTT,bittorrent,BitTorrent,BTT,704683630,707498514.0,18124270.0,"Storage, BNB Chain Ecosystem, Ethereum Ecosystem, DePIN, Alleged SEC Securities, Binance Launchpad, Tron Ecosystem, Energi Ecosystem, YZi Labs (Prev. Binance Labs) Portfolio, BitTorrent Ecosystem, GMCI DePIN Index, GMCI Index"
TKX,tokenize-xchange,Tokenize Xchange,TKX,654237868,817838250.0,479833.0,"Exchange-based Tokens, Centralized Exchange (CEX) Token, Ethereum Ecosystem, Titanchain Ecosystem"
CFX,conflux-token,Conflux,CFX,539610786,600119656.0,30321621.0,"Smart Contract Platform, DWF Labs Portfolio, Proof of Work (PoW), GMCI Layer 1 Index, Sequoia Capital Portfolio, GMCI Index, Made in China"
EIGEN,eigenlayer,EigenCloud (prev. EigenLayer),EIGEN,484973842,2672668083.0,77017045.0,"Infrastructure, Ethereum Ecosystem, Data Availability, Restaking, Polychain Capital Portfolio, Made in USA"
JST,just,JUST,JST,371822357,371822357.0,28097703.0,"Decentralized Finance (DeFi), Tron Ecosystem"
SUN,sun-token,Sun Token,SUN,360163097,374296814.0,27443373.0,"Decentralized Finance (DeFi), Tron Ecosystem"
