Input Token,CoinGecko ID,Name,Symbol,Market Cap,FDV,24H Volume,Categories
AVAX,avalanche-2,Avalanche,AVAX,4286213918.0,4600594075,231416487.0,"Smart Contract Platform, Layer 1 (L1), Avalanche Ecosystem, Proof of Stake (PoS), DragonFly Capital Portfolio, DeFiance Capital Portfolio, Andreessen Horowitz (a16z) Portfolio, GMCI Layer 1 Index, GMCI 30 Index, Galaxy Digital Portfolio, GMCI Index, Polychain Capital Portfolio, World Liberty Financial Portfolio, Made in USA, Coinbase 50 Index"
SUI,sui,Sui,SUI,3975323074.0,10193176106,391852431.0,"Smart Contract Platform, Binance Launchpool, Layer 1 (L1), Sui Ecosystem, Coinbase Ventures Portfolio, Proof of Stake (PoS), Andreessen Horowitz (a16z) Portfolio, YZi Labs (Prev. Binance Labs) Portfolio, GMCI Layer 1 Index, Circle Ventures Portfolio, GMCI Index, Made in USA"
TAO,bittensor,Bittensor,TAO,2654949305.0,5809219868,538099327.0,"Artificial Intelligence (AI), Smart Contract Platform, Layer 1 (L1), DePIN, Bittensor Ecosystem, Polychain Capital Portfolio"
ONDO,ondo-finance,Ondo,ONDO,1314953936.0,2700481916,39812045.0,"Decentralized Finance (DeFi), Ethereum Ecosystem, Real World Assets (RWA), Coinbase Ventures Portfolio, Pantera Capital Portfolio, GMCI DeFi Index, RWA Protocol, GMCI Index, World Liberty Financial Portfolio, Binance Alpha Spotlight, Made in USA, CoinList Launchpad"
ENA,ethena,Ethena,ENA,938058719.0,1656920645,67106932.0,"Decentralized Finance (DeFi), Binance Launchpool, Avalanche Ecosystem, Arbitrum Ecosystem, Ethereum Ecosystem, Metis Ecosystem, Optimism Ecosystem, ZkSync Ecosystem, Mantle Ecosystem, Base Ecosystem, TON Ecosystem, Manta Network Ecosystem, Scroll Ecosystem, Kava Ecosystem, Blast Ecosystem, Stablecoin Issuer, Mode Ecosystem, DragonFly Capital Portfolio, YZi Labs (Prev. Binance Labs) Portfolio, Fraxtal Ecosystem, Delphi Ventures Portfolio, OKX Ventures Portfolio, Zircuit Ecosystem, Morph L2 Ecosystem, World Liberty Financial Portfolio, Swellchain Ecosystem, Governance"
ATOM,cosmos,Cosmos Hub,ATOM,928876022.0,928876022,23354466.0,"Smart Contract Platform, BNB Chain Ecosystem, Cosmos Ecosystem, Terra Ecosystem, Canto Ecosystem, Alleged SEC Securities, Osmosis Ecosystem, Paradigm Portfolio, Proof of Stake (PoS), Kava Ecosystem, Layer 0 (L0), DragonFly Capital Portfolio, Pantera Capital Portfolio, Archway Ecosystem, Evmos Ecosystem, GMCI 30 Index, GMCI Index, Outlier Ventures Portfolio, Polychain Capital Portfolio, Mantra Ecosystem, Coinbase 50 Index, Governance"
NEXO,nexo,NEXO,NEXO,915676180.0,915676180,5853142.0,"Exchange-based Tokens, Centralized Exchange (CEX) Token, Polygon Ecosystem, Fantom Ecosystem, Ethereum Ecosystem, Alleged SEC Securities, Energi Ecosystem, Sora Ecosystem, Crypto Card Issuer"
ALGO,algorand,Algorand,ALGO,819916984.0,819923746,30444914.0,"Smart Contract Platform, Layer 1 (L1), Algorand Ecosystem, Real World Assets (RWA), Alleged SEC Securities, DWF Labs Portfolio, Multicoin Capital Portfolio, Proof of Stake (PoS), GMCI Layer 1 Index, GMCI Index, Made in USA, Coinbase 50 Index, CoinList Launchpad"
WBTC,arbitrum-bridged-wbtc-arbitrum-one,Arbitrum Bridged WBTC (Arbitrum One),WBTC,568863083.0,568863083,93040066.0,"Arbitrum Ecosystem, Bridged WBTC, Bridged-Tokens"
CHZ,chiliz,Chiliz,CHZ,394494135.0,394494135,35109585.0,"Smart Contract Platform, Sports, NFT, Layer 1 (L1), Ethereum Ecosystem, Alleged SEC Securities, Chiliz Ecosystem, YZi Labs (Prev. Binance Labs) Portfolio, Coinbase 50 Index"
FDUSD,first-digital-usd,First Digital USD,FDUSD,374603405.0,374603405,65299732.0,"Stablecoins, USD Stablecoin, BNB Chain Ecosystem, Arbitrum Ecosystem, Ethereum Ecosystem, Sui Ecosystem, TON Ecosystem, Fiat-backed Stablecoin"
NFT,apenft,AINFT,NFT,328861534.0,328861534,8954821.0,"NFT, BNB Chain Ecosystem, Ethereum Ecosystem, Tron Ecosystem, Binance Alpha Spotlight"
INJ,injective-protocol,Injective,INJ,310257087.0,310257087,31361896.0,"Smart Contract Platform, Decentralized Finance (DeFi), BNB Chain Ecosystem, Cosmos Ecosystem, Layer 1 (L1), Terra Ecosystem, Ethereum Ecosystem, Real World Assets (RWA), Binance Launchpad, Osmosis Ecosystem, Proof of Stake (PoS), Pantera Capital Portfolio, Secret Ecosystem, YZi Labs (Prev. Binance Labs) Portfolio, GMCI Layer 1 Index, GMCI Index, Made in USA, Coinbase 50 Index"
MANA,decentraland,Decentraland,MANA,179344995.0,203250902,12929230.0,"Entertainment, Gaming (GameFi), NFT, Metaverse, Polygon Ecosystem, Play To Earn, Ethereum Ecosystem, Animoca Brands Portfolio, Alleged SEC Securities, Simulation Games, Coinbase 50 Index"
DOGWIFHAT,dogwifcoin,dogwifhat,WIF,170336092.0,170336092,59855353.0,"Solana Ecosystem, Meme, Dog-Themed, Solana Meme, GMCI Meme Index, GMCI Index, Unichain Ecosystem"
BERA,berachain-bera,Berachain,BERA,151564828.0,353563858,47243277.0,"Smart Contract Platform, Decentralized Finance (DeFi), Layer 1 (L1), Berachain Ecosystem, Binance HODLer Airdrops, Outlier Ventures Portfolio, Polychain Capital Portfolio"
AR,arweave,Arweave,AR,120549968.0,120549968,16694366.0,"Artificial Intelligence (AI), Smart Contract Platform, Storage, Layer 1 (L1), DePIN, Coinbase Ventures Portfolio, Multicoin Capital Portfolio, Andreessen Horowitz (a16z) Portfolio, Blockchain Capital Portfolio"
MELANIA,melania-meme,Melania Meme,MELANIA,115547443.0,121309663,10052800.0,"Solana Ecosystem, Meme, Solana Meme, PolitiFi, Made in USA, Trump-Affiliated"
LPT,livepeer,Livepeer,LPT,115307009.0,115307009,8201012.0,"Artificial Intelligence (AI), Harmony Ecosystem, Arbitrum Ecosystem, Ethereum Ecosystem, DePIN, Coinbase Ventures Portfolio, Multicoin Capital Portfolio, Pantera Capital Portfolio, GMCI DePIN Index, GMCI Index, Coinbase 50 Index"
RSR,reserve-rights-token,Reserve Rights,RSR,112288538.0,179508938,10681533.0,"Decentralized Finance (DeFi), Arbitrum Ecosystem, Ethereum Ecosystem, Real World Assets (RWA), Base Ecosystem, Coinbase Ventures Portfolio, Energi Ecosystem, Made in USA, Base Native"
LB,lovebit,LoveBit,LB,90393049.0,90393049,46234.0,"BNB Chain Ecosystem, Meme"
RVN,ravencoin,Ravencoin,RVN,89634497.0,89637858,5371854.0,"Smart Contract Platform, Real World Assets (RWA), Proof of Work (PoW), Made in USA"
DBR,debridge,deBridge,DBR,77543125.0,164232264,2795779.0,"Solana Ecosystem, Bridge Governance Tokens, Cross-chain Communication, Intent, Governance"
VELO,velo,Velo,VELO,64683134.0,88384794,2283266.0,"Decentralized Finance (DeFi), BNB Chain Ecosystem, Real World Assets (RWA), DWF Labs Portfolio, Stellar Ecosystem, Binance Alpha Spotlight"
PYTHIA,pythia,PYTHIA,PYTHIA,60728170.0,60728170,1098858.0,"Solana Ecosystem, Meme, AI Meme, Pump.fun Ecosystem, Desci Meme, Binance Alpha Spotlight"
ALEO,aleo,ALEO,ALEO,58717585.0,119298079,2764657.0,"Infrastructure, Smart Contract Platform, BNB Chain Ecosystem, Layer 1 (L1), Zero Knowledge (ZK), Andreessen Horowitz (a16z) Portfolio, Privacy Blockchain, Binance Alpha Spotlight, Made in USA"
POPCAT,popcat,Popcat,POPCAT,54559850.0,54559850,16670977.0,"Solana Ecosystem, Meme, Solana Meme, Cat-Themed, Murad Picks, Binance Alpha Spotlight"
ELG,escoin-token,Escoin,ELG,53989638.0,73272182,395692.0,"Legal, BNB Chain Ecosystem, Polygon Ecosystem, Ethereum Ecosystem"
MERL,merlin-chain,Merlin Chain,MERL,44320607.0,80131574,4580113.0,"Smart Contract Platform, BNB Chain Ecosystem, Ethereum Ecosystem, Layer 2 (L2), Merlin Chain Ecosystem, Bitcoin Sidechains, SideChain, OKX Ventures Portfolio, Made in China"
LTC,binance-peg-litecoin,Binance-Peg Litecoin,LTC,41790536.0,41790536,1591666.0,"Crypto-Backed Tokens, BNB Chain Ecosystem, Binance-Peg Tokens"
DOVU,dovu-2,DOVU,DOVU,39997764.0,39997764,153551.0,"Infrastructure, Ethereum Ecosystem, Regenerative Finance (ReFi), Real World Assets (RWA), Hedera Ecosystem, Base Native"
SNT,status,Status,SNT,38579558.0,66287074,799409.0,"Infrastructure, Smart Contract Platform, SocialFi, Ethereum Ecosystem, Layer 2 (L2)"
BIO,bio-protocol,Bio Protocol,BIO,37937436.0,71169700,13533880.0,"BNB Chain Ecosystem, Binance Launchpool, Solana Ecosystem, Ethereum Ecosystem, Base Ecosystem, Decentralized Science (DeSci), Base Native"
BNT,bancor,Bancor Network,BNT,33483977.0,33483977,270209.0,"Decentralized Exchange (DEX), Exchange-based Tokens, Decentralized Finance (DeFi), Automated Market Maker (AMM), Ethereum Ecosystem, DeFiance Capital Portfolio, Energi Ecosystem, Governance"
DKA,dkargo,dKargo,DKA,31994779.0,31994779,98460462.0,"Artificial Intelligence (AI), Infrastructure, Ethereum Ecosystem, Governance"
IQ,everipedia,IQ,IQ,29368882.0,29368882,1585849.0,"Artificial Intelligence (AI), Big Data, Media, BNB Chain Ecosystem, Polygon Ecosystem, Ethereum Ecosystem, AI Agents, GMCI DePIN Index, Galaxy Digital Portfolio, GMCI Index, AI Agent Launchpad, AI Framework, DeFAI"
SDEX,smardex,SMARDEX,SDEX,28555971.0,29240929,190298.0,"Decentralized Exchange (DEX), Exchange-based Tokens, Decentralized Finance (DeFi), BNB Chain Ecosystem, Solana Ecosystem, Polygon Ecosystem, Arbitrum Ecosystem, Ethereum Ecosystem, Base Ecosystem, Base Native"
KERNEL,kernel-2,KernelDAO,KERNEL,27357474.0,95552594,8671334.0,"Decentralized Finance (DeFi), BNB Chain Ecosystem, Arbitrum Ecosystem, Ethereum Ecosystem, Restaking, Liquid Restaking Governance Tokens"
ERG,ergo,Ergo,ERG,27034619.0,31841386,178831.0,"Smart Contract Platform, Layer 1 (L1), Zero Knowledge (ZK), Proof of Work (PoW), Privacy Blockchain"
AIXBT,aixbt,aixbt,AIXBT,26009054.0,26148729,13321775.0,"Artificial Intelligence (AI), Solana Ecosystem, Meme, Ethereum Ecosystem, Base Ecosystem, AI Meme, AI Agents, Virtuals Protocol Ecosystem, Binance Alpha Spotlight, DeFAI, Base Native"
PEAQ,peaq-2,peaq,PEAQ,23668007.0,53979643,1167649.0,"Smart Contract Platform, Polkadot Ecosystem, Layer 1 (L1), DePIN, Outlier Ventures Portfolio, Binance Alpha Spotlight, Robotics, x402 Ecosystem, CoinList Launchpad"
WELL,moonwell-artemis,Moonwell,WELL,22987783.0,25373513,757800.0,"Decentralized Finance (DeFi), Lending/Borrowing Protocols, Moonbeam Ecosystem, Base Ecosystem, Coinbase Ventures Portfolio, Made in USA, Base Native"
MAGIC,magic,Treasure,MAGIC,21086958.0,22380220,4366727.0,"Artificial Intelligence (AI), NFT, Metaverse, Arbitrum Ecosystem, Ethereum Ecosystem, Layer 2 (L2), Zero Knowledge (ZK), Base Ecosystem, AI Agents, AI Agent Launchpad, x402 Ecosystem"
CAW,a-hunters-dream,A Hunters Dream,CAW,19875789.0,20812344,328804.0,"SocialFi, Ethereum Ecosystem"
LAYER,solayer,Solayer,LAYER,17633399.0,83968568,5345689.0,"Decentralized Finance (DeFi), Solana Ecosystem, LSDFi, Restaking, Stablecoin Issuer, YZi Labs (Prev. Binance Labs) Portfolio, Binance HODLer Airdrops, Polychain Capital Portfolio, Buidlpad Launchpad"
CATI,catizen,Catizen,CATI,17564508.0,43388194,2630585.0,"Gaming (GameFi), Play To Earn, Telegram Apps, TON Ecosystem, Tap to Earn"
PONKE,ponke,PONKE,PONKE,16968924.0,16970799,1688759.0,"Solana Ecosystem, Meme, Base Ecosystem, Solana Meme, Base Meme, Made in USA, Base Native"
IXS,ix-swap,IXS,IXS,15606377.0,15606377,147856.0,"Polygon Ecosystem, Ethereum Ecosystem, Real World Assets (RWA), Base Ecosystem, DWF Labs Portfolio, Poolz Finance Launchpad, Coinbase Ventures Portfolio, Base Native"
CELR,celer-network,Celer Network,CELR,15366166.0,27218650,2064190.0,"Arbitrum Ecosystem, Ethereum Ecosystem, Bridge Governance Tokens, Binance Launchpad, Cross-chain Communication, Pantera Capital Portfolio, Energi Ecosystem, YZi Labs (Prev. Binance Labs) Portfolio"
CHR,chromaway,Chromia,CHR,14507892.0,14507892,2611485.0,"Artificial Intelligence (AI), Smart Contract Platform, NFT, BNB Chain Ecosystem, Layer 1 (L1), Ethereum Ecosystem, Real World Assets (RWA), Modular Blockchain, Chromia Ecosystem, RWA Protocol"
COOKIE,cookie,Cookie DAO,COOKIE,14213342.0,20157749,3150768.0,"Artificial Intelligence (AI), Marketing, Analytics, BNB Chain Ecosystem, Ethereum Ecosystem, Animoca Brands Portfolio, Base Ecosystem, AI Agents, Binance Alpha Spotlight, InfoFi, Governance, Base Native"
FIL,binance-peg-filecoin,Binance-Peg Filecoin,FIL,13423459.0,13423459,74818.0,"Infrastructure, Storage, BNB Chain Ecosystem, Binance-Peg Tokens"
MAV,maverick-protocol,Maverick Protocol,MAV,12907221.0,30623724,12163337.0,"BNB Chain Ecosystem, Binance Launchpool, Ethereum Ecosystem, ZkSync Ecosystem, Base Ecosystem, Coinbase Ventures Portfolio, Pantera Capital Portfolio, YZi Labs (Prev. Binance Labs) Portfolio, Circle Ventures Portfolio, Base Native"
ROAM,roam-token,ROAM Token,ROAM,12766563.0,37199650,1040542.0,"Retail, BNB Chain Ecosystem, Solana Ecosystem, DePIN"
MLN,melon,Enzyme,MLN,12290000.0,12290000,1444621.0,"Decentralized Finance (DeFi), Asset Manager, Polygon Ecosystem, Arbitrum Ecosystem, Ethereum Ecosystem, Real World Assets (RWA), DeFiance Capital Portfolio"
SYNTH,synth-2,Synth,SN50,11590952.0,11590952,326711.0,"Artificial Intelligence (AI), Bittensor Ecosystem, Bittensor Subnets"
ZKJ,polyhedra-network,Polyhedra Network,ZKJ,11065659.0,24692476,1837722.0,"Smart Contract Platform, BNB Chain Ecosystem, Ethereum Ecosystem, Zero Knowledge (ZK), Animoca Brands Portfolio, YZi Labs (Prev. Binance Labs) Portfolio, OKX Ventures Portfolio, Binance Alpha Spotlight"
SYS,syscoin,Syscoin,SYS,10439775.0,10439775,901880.0,"Smart Contract Platform, Masternodes, Layer 1 (L1), Decentralized Identifier (DID), Layer 2 (L2), Zero Knowledge (ZK), Rollux Ecosystem, DWF Labs Portfolio, Data Availability, Modular Blockchain, Rollup, Proof of Work (PoW)"
EPIC,epic-cash,Epic Private Internet Cash,EPIC,10315112.0,10315325,37489.0,"Privacy Coins, Layer 1 (L1), Zero Knowledge (ZK), Proof of Work (PoW), Privacy"
OL,open-loot,OPENLOOT,OL,10177790.0,65218569,890135.0,"Gaming (GameFi), NFT, BNB Chain Ecosystem, Ethereum Ecosystem, Gaming Marketplace"
HANDY,handy,Handy,HANDY,10092178.0,19348605,58114.0,Ethereum Ecosystem
GRIFFAIN,griffain,GRIFFAIN,GRIFFAIN,9685027.0,9685027,1088402.0,"Artificial Intelligence (AI), Solana Ecosystem, Meme, AI Meme, Pump.fun Ecosystem, AI Agent Launchpad, Binance Alpha Spotlight, DeFAI"
SHELL,myshell,MyShell,SHELL,9453574.0,35013239,24971220.0,"Artificial Intelligence (AI), BNB Chain Ecosystem, Ethereum Ecosystem, DragonFly Capital Portfolio, YZi Labs (Prev. Binance Labs) Portfolio, Delphi Ventures Portfolio, OKX Ventures Portfolio, Binance HODLer Airdrops, AI Agent Launchpad, Binance Alpha Spotlight, AI Framework, Binance Wallet IDO"
ORAI,oraichain-token,Oraichain,ORAI,8603532.0,8618307,525202.0,"Artificial Intelligence (AI), Big Data, Smart Contract Platform, Decentralized Finance (DeFi), Oracle, BNB Chain Ecosystem, Solana Ecosystem, Layer 1 (L1), Ethereum Ecosystem, DWF Labs Portfolio, Osmosis Ecosystem, AI Agents"
HEI,heima,Heima,HEI,7383753.0,8388565,7173955.0,"BNB Chain Ecosystem, Binance Launchpool, Ethereum Ecosystem, YZi Labs (Prev. Binance Labs) Portfolio"
DOLZ,dolz-io,DOLZ.io,DOLZ,7102180.0,7102180,5928.05,"Artificial Intelligence (AI), Gaming (GameFi), NFT, Polygon Ecosystem, Ethereum Ecosystem, Base Ecosystem, Card Games, Base Native"
NTRN,neutron-3,Neutron,NTRN,7042323.0,9081048,1821149.0,"Binance Launchpool, Osmosis Ecosystem, Delphi Ventures Portfolio"
BOSON,boson-protocol,Boson,BOSON,6560472.0,9067700,116215.0,"NFT, Metaverse, Polygon Ecosystem, Ethereum Ecosystem, Real World Assets (RWA), Animoca Brands Portfolio, Base Ecosystem, RWA Protocol, E-commerce, Outlier Ventures Portfolio"
FIO,fio-protocol,FIO Protocol,FIO,6420480.0,7634687,1547871.0,"Smart Contract Platform, Layer 1 (L1), YZi Labs (Prev. Binance Labs) Portfolio"
NS,suins-token,SuiNS Token,NS,6157701.0,11163495,563686.0,"Decentralized Identifier (DID), Sui Ecosystem, Name Service, Binance Alpha Spotlight"
EVER,everscale,Everscale,EVER,5602349.0,5974758,10347.39,"Infrastructure, Layer 1 (L1), Ethereum Ecosystem"
BLZ,bluzelle,Bluzelle,BLZ,5313543.0,5662926,176742.0,"Smart Contract Platform, BNB Chain Ecosystem, Ethereum Ecosystem, DePIN, Decentralized Science (DeSci), Osmosis Ecosystem, Energi Ecosystem, GMCI DePIN Index, GMCI Index"
NRS,nereus-token,Nereus,NRS,4617329.0,118371315,63095.0,"Decentralized Finance (DeFi), Derivatives, Polygon Ecosystem"
PUSS,puss,Puss,PUSS,4448298.0,4448298,429467.0,"Meme, Tron Ecosystem, TRON Meme"
NTX,nunet,NuNet,NTX,4260281.0,5129964,84055.0,"BNB Chain Ecosystem, Cardano Ecosystem, Ethereum Ecosystem, DePIN"
REF,ref-finance,Ref Finance,REF,4258512.0,4436310,2.37,"Decentralized Finance (DeFi), Near Protocol Ecosystem, Alameda Research Portfolio, DragonFly Capital Portfolio, OKX Ventures Portfolio"
PHNIX,phnix,PHNIX,PHNIX,3684071.0,4089940,104758.0,"Meme, XRP Ledger Ecosystem"
DEVVE,devve,DevvE,DEVVE,3542313.0,4864146,208434.0,"Layer 1 (L1), Ethereum Ecosystem"
ZYPTO,french-connection-finance,Zypto Token,ZYPTO,3436934.0,3436934,387.99,"Decentralized Finance (DeFi), Wallets, Ethereum Ecosystem, Payment Solutions"
HAI,hackenai,Hacken,HAI,3174205.0,3809574,136468.0,"BNB Chain Ecosystem, Ethereum Ecosystem, Base Ecosystem, Cybersecurity, VeChain Ecosystem, Base Native"
PROS,prospective,Prospective,PROS,2749249.0,24546869,24693.0,"NFT, BNB Chain Ecosystem, Polygon Ecosystem, Ethereum Ecosystem, Tron Ecosystem, BitTorrent Ecosystem"
MANEKI,maneki,MANEKI,MANEKI,2676078.0,2685252,122239.0,"Solana Ecosystem, Meme, Solana Meme, Cat-Themed"
SEED,garden-2,Garden,SEED,2639982.0,29791483,194.54,"Decentralized Exchange (DEX), Exchange-based Tokens, Decentralized Finance (DeFi), Arbitrum Ecosystem, Ethereum Ecosystem, BTCfi Protocol"
HTR,hathor,Hathor,HTR,2614432.0,4424753,73523.0,"Infrastructure, Smart Contract Platform, Layer 1 (L1), Real World Assets (RWA), Proof of Work (PoW), Directed Acyclic Graph (DAG)"
KDA,kadena,Kadena,KDA,2426508.0,2426508,45012.0,"Smart Contract Platform, Layer 1 (L1), Kadena Ecosystem, Multicoin Capital Portfolio, Proof of Work (PoW), Made in USA, CoinList Launchpad"
DOBO,dogebonk,DogeBonk,DOBO,2398002.0,4410260,10.04,"Analytics, BNB Chain Ecosystem, Meme, Dog-Themed"
PNIC,phoenic-token,Phoenic Token,PNIC,2397411.0,26927669,95386.0,"Avalanche Ecosystem, Payment Solutions"
NODL,nodle-network,Nodle Network,NODL,2351879.0,2721002,66655.0,"ZkSync Ecosystem, DePIN"
VAI,vai,Vai,VAI,2298038.0,2298038,4618.47,"Stablecoins, Decentralized Finance (DeFi), USD Stablecoin, BNB Chain Ecosystem, Crypto-backed Stablecoin, Fiat-backed Stablecoin"
BDC,billion-dollar-cat-runes,Billy (Bitcoin),BDC,2294616.0,2294616,44132.0,"Solana Ecosystem, Meme, Cat-Themed, Bitcoin Ecosystem, Runes, Bitcoin Meme"
HIFI,hifi-finance,Hifi Finance,HIFI,2170604.0,2315810,135400.0,"Tokenized Real Estate, Decentralized Finance (DeFi), Ethereum Ecosystem, Real World Assets (RWA), Made in USA, Governance"
DEFX,definity,DeFinity,DEFX,2020021.0,2263316,60288.0,"BNB Chain Ecosystem, Ethereum Ecosystem"
NYA,nya,Nya,NYA,2007768.0,2011220,2753.2,"BNB Chain Ecosystem, Avalanche Ecosystem, Polygon Ecosystem, Meme, Arbitrum Ecosystem, Ethereum Ecosystem, Optimism Ecosystem, Base Ecosystem, Cat-Themed, Base Native"
VOXEL,voxies,Voxies,VOXEL,2001660.0,2468519,881983.0,"Gaming (GameFi), NFT, Polygon Ecosystem, Binance Launchpad, RPG, Gaming Utility Token, Strategy Games, YZi Labs (Prev. Binance Labs) Portfolio"
XEN,xen-crypto,XEN Crypto,XEN,1970306.0,1970306,146643.0,"Smart Contract Platform, Decentralized Finance (DeFi), Layer 1 (L1), Avalanche Ecosystem, Ethereum Ecosystem, EthereumPoW Ecosystem"
BXX,baanx,Baanx,BXX,1939063.0,1939063,1442.95,"Ethereum Ecosystem, Payment Solutions, Crypto Card Issuer"
AA,arai,Arai,AA,1859445.0,12868130,1192450.0,"Artificial Intelligence (AI), Gaming (GameFi), BNB Chain Ecosystem, Animoca Brands Portfolio, Sequoia Capital Portfolio, Binance Alpha Spotlight"
NAP,napoli-fan-token,Napoli Fan Token,NAP,1828177.0,3305399,505570.0,"Sports, Fan Token, Chiliz Ecosystem"
SWASH,swash,Swash,SWASH,1782164.0,1791191,25564.0,"BNB Chain Ecosystem, Polygon Ecosystem, Gnosis Chain Ecosystem, Ethereum Ecosystem, Outlier Ventures Portfolio"
PSP,paraswap,ParaSwap,PSP,1752099.0,1775479,280.13,"Decentralized Exchange (DEX), Exchange-based Tokens, Decentralized Finance (DeFi), BNB Chain Ecosystem, Polygon Ecosystem, Ethereum Ecosystem, Optimism Ecosystem, Alameda Research Portfolio, Intent, Blockchain Capital Portfolio, Dex Aggregator"
XMR,monero,Monero,XMR,6636822589.0,6636822589,67480186.0,"Smart Contract Platform, Privacy Coins, Layer 1 (L1), Proof of Work (PoW), Galaxy Digital Portfolio, Privacy"
MNT,mantle,Mantle,MNT,2611873481.0,4955566151,46573831.0,"Smart Contract Platform, Ethereum Ecosystem, Layer 2 (L2), Mantle Ecosystem, DWF Labs Portfolio, DragonFly Capital Portfolio, GMCI Layer 2 Index, GMCI 30 Index, GMCI Index, World Liberty Financial Portfolio, Made in China, Neobank"
MORPHO,morpho,Morpho,MORPHO,1054011868.0,1917458638,15472703.0,"Decentralized Finance (DeFi), Lending/Borrowing Protocols, Arbitrum Ecosystem, Ethereum Ecosystem, Base Ecosystem, Coinbase Ventures Portfolio, Pantera Capital Portfolio, Morpho Ecosystem, Binance Alpha Spotlight, Katana Ecosystem, Base Native"
VIRTUAL,virtual-protocol,Virtuals Protocol,VIRTUAL,491951903.0,749581633,73452019.0,"Artificial Intelligence (AI), Solana Ecosystem, Launchpad, Ethereum Ecosystem, Base Ecosystem, AI Agents, Virtuals Protocol Ecosystem, AI Agent Launchpad, Binance Alpha Spotlight, AI Framework, Robotics, Base Native"
XRP,binance-peg-xrp,Binance-Peg XRP,XRP,471539013.0,471539013,2365315.0,"Crypto-Backed Tokens, BNB Chain Ecosystem, Binance-Peg Tokens"
SPX,spx6900,SPX6900,SPX,294566165.0,294566165,6014419.0,"Solana Ecosystem, Avalanche Ecosystem, Meme, Ethereum Ecosystem, Base Ecosystem, Bridged-Tokens, Murad Picks, Stock market-themed, 4chan-Themed, Base Native"
JASMY,jasmycoin,JasmyCoin,JASMY,289209779.0,292456043,10797050.0,"Internet of Things (IOT), Ethereum Ecosystem, DePIN, DWF Labs Portfolio, Coinbase 50 Index"
DOGE,binance-peg-dogecoin,Binance-Peg Dogecoin,DOGE,251402791.0,251402791,1405371.0,"BNB Chain Ecosystem, Avalanche Ecosystem, Meme, Binance-Peg Tokens"
XCN,chain-2,Onyxcoin,XCN,228358077.0,325501213,42387801.0,"Smart Contract Platform, BNB Chain Ecosystem, Layer 1 (L1), Ethereum Ecosystem, Base Ecosystem, Proof of Stake (PoS), Pantera Capital Portfolio, Made in USA, Base Native"
SAND,the-sandbox,The Sandbox,SAND,226980642.0,255293623,16804867.0,"Gaming (GameFi), NFT, Metaverse, Polygon Ecosystem, Play To Earn, Ethereum Ecosystem, Animoca Brands Portfolio, Base Ecosystem, Alleged SEC Securities, Binance Launchpad, Gaming Utility Token, Simulation Games, YZi Labs (Prev. Binance Labs) Portfolio, Coinbase 50 Index"
STRK,starknet,Starknet,STRK,222239797.0,393237921,17950704.0,"Infrastructure, Smart Contract Platform, Solana Ecosystem, Ethereum Ecosystem, Layer 2 (L2), Zero Knowledge (ZK), Starknet Ecosystem, Paradigm Portfolio, Coinbase Ventures Portfolio, Rollup, Multicoin Capital Portfolio, Bitcoin Sidechains, Alameda Research Portfolio, Pantera Capital Portfolio, GMCI Layer 2 Index, Consensys Portfolio, Sequoia Capital Portfolio, GMCI Index, Privacy Blockchain, Polychain Capital Portfolio, Quantum-Resistant"
GRASS,grass,Grass,GRASS,202731807.0,373903216,12393956.0,"Artificial Intelligence (AI), Solana Ecosystem, DePIN, Polychain Capital Portfolio, Binance Alpha Spotlight"
WEFI,wefi,WeFi,WFI,189395555.0,2328598554,2557833.0,"BNB Chain Ecosystem, Payment Solutions"
WAL,walrus-2,Walrus,WAL,179578583.0,400398179,4700777.0,"Infrastructure, Storage, Sui Ecosystem, Binance Alpha Spotlight"
XEC,ecash,eCash,XEC,144597165.0,144597662,3263981.0,"Smart Contract Platform, Layer 1 (L1), Bitcoin Fork, Proof of Work (PoW)"
JTO,jito-governance-token,Jito,JTO,128298398.0,286419445,6960708.0,"Decentralized Finance (DeFi), Solana Ecosystem, Liquid Staking Governance Tokens, Multicoin Capital Portfolio, Alameda Research Portfolio, Delphi Ventures Portfolio, Liquid Staking, Made in USA"
SOSO,sosovalue,SoSoValue,SOSO,121002160.0,387825512,4030168.0,"Index, Decentralized Finance (DeFi), Analytics, Ethereum Ecosystem, Base Ecosystem, Base Native"
GOMINING,gmt-token,GoMining Token,GOMINING,119771020.0,119771020,13052512.0,"Gaming (GameFi), BNB Chain Ecosystem, Ethereum Ecosystem, TON Ecosystem"
AMP,amp-token,Amp,AMP,116121623.0,137391464,4535649.0,"Decentralized Finance (DeFi), Near Protocol Ecosystem, Ethereum Ecosystem, Payment Solutions, Alleged SEC Securities, Pantera Capital Portfolio, Energi Ecosystem, Made in USA"
ZEN,zencash,Horizen,ZEN,108448119.0,127425468,31883211.0,"Zero Knowledge (ZK), Base Ecosystem, Made in USA, Privacy Infrastructure, Base Native, Horizen Ecosystem, Privacy"
FORM,four,Four,FORM,101626663.0,152307206,5317632.0,"Gaming (GameFi), BNB Chain Ecosystem, Launchpad"
ZRX,0x,0x Protocol,ZRX,91348335.0,107671741,7362105.0,"Decentralized Exchange (DEX), Exchange-based Tokens, Decentralized Finance (DeFi), Ethereum Ecosystem, Coinbase Ventures Portfolio, Pantera Capital Portfolio, GMCI DeFi Index, Blockchain Capital Portfolio, GMCI Index, Made in USA, Governance"
OM,mantra-dao,MANTRA [Old],OM,72542691.0,107294994,63049.0,"Infrastructure, Smart Contract Platform, BNB Chain Ecosystem, Cosmos Ecosystem, Layer 1 (L1), Real World Assets (RWA), Osmosis Ecosystem, Mantra Ecosystem, Mantra EVM Ecosystem"
BC,bc-token,BCGame Coin,BC,70765687.0,70765687,12181.38,"Gambling (GambleFi), Solana Ecosystem"
GMX,gmx,GMX,GMX,69093243.0,69093243,4584619.0,"Decentralized Finance (DeFi), Derivatives, Perpetuals, Avalanche Ecosystem, Arbitrum Ecosystem"
XPR,proton,XPR Network,XPR,68574914.0,75764386,1242015.0,"Smart Contract Platform, BNB Chain Ecosystem, Ethereum Ecosystem, DWF Labs Portfolio, Made in USA, Governance"
ASTR,astar,Astar,ASTR,64285744.0,64977579,2012820.0,"Smart Contract Platform, Polkadot Ecosystem, Layer 1 (L1), Ethereum Ecosystem, Layer 2 (L2), Alameda Research Portfolio, YZi Labs (Prev. Binance Labs) Portfolio, OKX Ventures Portfolio"
