Input Token,CoinGecko ID,Name,Symbol,Market Cap,FDV,24H Volume,Categories
TRX,tron,TRON,TRX,33408828150,33408870202.0,1223684868.0,"Smart Contract Platform, Layer 1 (L1), Alleged SEC Securities, FTX Holdings, DWF Labs Portfolio, Tron Ecosystem, Proof of Stake (PoS), GMCI Layer 1 Index, GMCI 30 Index, GMCI Index, World Liberty Financial Portfolio, Made in China"
SUI,sui,Sui,SUI,13704447006,39022613058.0,1506517569.0,"Smart Contract Platform, Binance Launchpool, Layer 1 (L1), Sui Ecosystem, Coinbase Ventures Portfolio, Proof of Stake (PoS), Andreessen Horowitz (a16z) Portfolio, YZi Labs (Prev. Binance Labs) Portfolio, GMCI Layer 1 Index, Circle Ventures Portfolio, GMCI Index, Made in USA"
AVAX,avalanche-2,Avalanche,AVAX,10491249549,11380742252.0,722840260.0,"Smart Contract Platform, Layer 1 (L1), Avalanche Ecosystem, Proof of Stake (PoS), DragonFly Capital Portfolio, DeFiance Capital Portfolio, Andreessen Horowitz (a16z) Portfolio, GMCI Layer 1 Index, GMCI 30 Index, Galaxy Digital Portfolio, GMCI Index, Polychain Capital Portfolio, World Liberty Financial Portfolio, Made in USA, Coinbase 50 Index"
ENA,ethena,Ethena,ENA,5425240788,12289360918.0,1586932152.0,"Decentralized Finance (DeFi), Binance Launchpool, Ethereum Ecosystem, Stablecoin Protocol, DragonFly Capital Portfolio, YZi Labs (Prev. Binance Labs) Portfolio, Delphi Ventures Portfolio, OKX Ventures Portfolio, World Liberty Financial Portfolio"
TAO,bittensor,Bittensor,TAO,3780489364,8271982401.0,138442619.0,"Artificial Intelligence (AI), Smart Contract Platform, Layer 1 (L1), DePIN, Bittensor Ecosystem, Polychain Capital Portfolio"
ONDO,ondo-finance,Ondo,ONDO,3375643418,10685433741.0,273980694.0,"Decentralized Finance (DeFi), Ethereum Ecosystem, Real World Assets (RWA), Coinbase Ventures Portfolio, Pantera Capital Portfolio, GMCI DeFi Index, RWA Protocol, GMCI Index, World Liberty Financial Portfolio, Binance Alpha Spotlight, Made in USA"
ALGO,algorand,Algorand,ALGO,2371387096,2371507969.0,236470078.0,"Smart Contract Platform, Layer 1 (L1), Algorand Ecosystem, Real World Assets (RWA), Alleged SEC Securities, DWF Labs Portfolio, Multicoin Capital Portfolio, Proof of Stake (PoS), GMCI Layer 1 Index, GMCI Index, Made in USA, Coinbase 50 Index"
ATOM,cosmos,Cosmos Hub,ATOM,2186314592,2186345481.0,126195927.0,"Smart Contract Platform, BNB Chain Ecosystem, Cosmos Ecosystem, Canto Ecosystem, Alleged SEC Securities, Osmosis Ecosystem, Paradigm Portfolio, Proof of Stake (PoS), Kava Ecosystem, Layer 0 (L0), DragonFly Capital Portfolio, Pantera Capital Portfolio, Archway Ecosystem, Evmos Ecosystem, GMCI 30 Index, GMCI Index, Outlier Ventures Portfolio, Polychain Capital Portfolio, Mantra Ecosystem, Coinbase 50 Index"
INJ,injective-protocol,Injective,INJ,1451056686,1484802987.0,140644078.0,"Smart Contract Platform, Decentralized Finance (DeFi), BNB Chain Ecosystem, Cosmos Ecosystem, Layer 1 (L1), Ethereum Ecosystem, Real World Assets (RWA), Binance Launchpad, Osmosis Ecosystem, Proof of Stake (PoS), Pantera Capital Portfolio, Secret Ecosystem, YZi Labs (Prev. Binance Labs) Portfolio, GMCI Layer 1 Index, GMCI Index, Made in USA, Coinbase 50 Index"
NEXO,nexo,NEXO,NEXO,1358222424,1358222424.0,15413315.0,"Polygon Ecosystem, Fantom Ecosystem, Ethereum Ecosystem, Alleged SEC Securities, Energi Ecosystem, Sora Ecosystem"
FDUSD,first-digital-usd,First Digital USD,FDUSD,1317277667,1317277667.0,9621506453.0,"Stablecoins, USD Stablecoin, BNB Chain Ecosystem, Arbitrum Ecosystem, Ethereum Ecosystem, Sui Ecosystem, TON Ecosystem, Fiat-backed Stablecoin"
DOGWIFHAT,dogwifcoin,dogwifhat,WIF,996206573,996206573.0,329211389.0,"Solana Ecosystem, Meme, Dog-Themed, Solana Meme, GMCI Meme Index, GMCI Index"
MANA,decentraland,Decentraland,MANA,599330859,684893505.0,41112803.0,"Entertainment, Gaming (GameFi), NFT, Metaverse, Polygon Ecosystem, Play To Earn, Ethereum Ecosystem, Animoca Brands Portfolio, Alleged SEC Securities, Simulation Games, Coinbase 50 Index"
RSR,reserve-rights-token,Reserve Rights,RSR,573800464,971832014.0,55057735.0,"Decentralized Finance (DeFi), Arbitrum Ecosystem, Ethereum Ecosystem, Real World Assets (RWA), Base Ecosystem, Coinbase Ventures Portfolio, Energi Ecosystem, Made in USA"
AR,arweave,Arweave,AR,516240949,516240949.0,49507647.0,"Artificial Intelligence (AI), Smart Contract Platform, Storage, Layer 1 (L1), DePIN, Coinbase Ventures Portfolio, Multicoin Capital Portfolio, Andreessen Horowitz (a16z) Portfolio, Blockchain Capital Portfolio"
NFT,apenft,APENFT,NFT,468392459,473068464.0,27928952.0,"NFT, BNB Chain Ecosystem, Ethereum Ecosystem, Tron Ecosystem"
CHZ,chiliz,Chiliz,CHZ,423985045,423985045.0,52592431.0,"Smart Contract Platform, Sports, NFT, Layer 1 (L1), Ethereum Ecosystem, Alleged SEC Securities, Chiliz Ecosystem, YZi Labs (Prev. Binance Labs) Portfolio, Coinbase 50 Index"
VELO,velo,Velo,VELO,308888544,422074522.0,33855025.0,"Decentralized Finance (DeFi), BNB Chain Ecosystem, Real World Assets (RWA), DWF Labs Portfolio, Stellar Ecosystem, Binance Alpha Spotlight"
LPT,livepeer,Livepeer,LPT,300101432,300101432.0,22896220.0,"Artificial Intelligence (AI), Harmony Ecosystem, Arbitrum Ecosystem, Ethereum Ecosystem, DePIN, Coinbase Ventures Portfolio, Multicoin Capital Portfolio, Pantera Capital Portfolio, GMCI DePIN Index, GMCI Index, Coinbase 50 Index"
BERA,berachain-bera,Berachain,BERA,253533700,1040439806.0,40260682.0,"Smart Contract Platform, Decentralized Finance (DeFi), Layer 1 (L1), Berachain Ecosystem, Binance HODLer Airdrops, Outlier Ventures Portfolio, Polychain Capital Portfolio"
RVN,ravencoin,Ravencoin,RVN,226443747,226443747.0,16993596.0,"Smart Contract Platform, Real World Assets (RWA), Proof of Work (PoW), Made in USA"
MELANIA,melania-meme,Melania Meme,MELANIA,159710988,230629822.0,7577156.0,"Solana Ecosystem, Meme, Solana Meme, PolitiFi, Made in USA"
KDA,kadena,Kadena,KDA,142918466,142940902.0,9040960.0,"Smart Contract Platform, Layer 1 (L1), Kadena Ecosystem, Multicoin Capital Portfolio, Proof of Work (PoW), Made in USA"
LAYER,solayer,Solayer,LAYER,134144404,638782877.0,18066462.0,"Decentralized Finance (DeFi), Solana Ecosystem, LSDFi, Restaking, Stablecoin Protocol, YZi Labs (Prev. Binance Labs) Portfolio, Binance HODLer Airdrops, Polychain Capital Portfolio"
VRA,verasity,Verasity,VRA,132092920,142947568.0,21793200.0,"Entertainment, BNB Chain Ecosystem, Wallets, Ethereum Ecosystem, Binance Alpha Spotlight"
AIXBT,aixbt,aixbt,AIXBT,130253695,134643356.0,49918642.0,"Artificial Intelligence (AI), Solana Ecosystem, Meme, Ethereum Ecosystem, Base Ecosystem, AI Meme, AI Agents, Virtuals Protocol Ecosystem, Binance Alpha Spotlight, DeFAI"
COREUM,coreum,Coreum,COREUM,123509553,123509553.0,716790.0,"Smart Contract Platform, Layer 1 (L1), Osmosis Ecosystem, XRP Ledger Ecosystem"
WELL,moonwell-artemis,Moonwell,WELL,121073501,168891780.0,5796910.0,"Decentralized Finance (DeFi), Lending/Borrowing Protocols, Moonbeam Ecosystem, Base Ecosystem, Coinbase Ventures Portfolio, Made in USA"
ALEO,aleo,ALEO,ALEO,113835123,449479887.0,7334964.0,"Smart Contract Platform, Layer 1 (L1), Zero Knowledge (ZK), Andreessen Horowitz (a16z) Portfolio, Privacy Blockchain, Made in USA"
SNT,status,Status,SNT,113289063,194652323.0,8907070.0,"Software as a service, Ethereum Ecosystem, Energi Ecosystem"
PYTHIA,pythia,PYTHIA,PYTHIA,112905666,112905666.0,6879788.0,"Solana Ecosystem, Meme, AI Meme, Pump.fun Ecosystem, Desci Meme, Binance Alpha Spotlight"
MERL,merlin-chain,Merlin Chain,MERL,110280600,245744122.0,15597295.0,"Smart Contract Platform, BNB Chain Ecosystem, Ethereum Ecosystem, Layer 2 (L2), Merlin Chain Ecosystem, Bitcoin Sidechains, SideChain, OKX Ventures Portfolio"
BNT,bancor,Bancor Network,BNT,94077353,94077353.0,184765.0,"Decentralized Exchange (DEX), Exchange-based Tokens, Decentralized Finance (DeFi), Automated Market Maker (AMM), Ethereum Ecosystem, DeFiance Capital Portfolio, Energi Ecosystem"
DBR,debridge,deBridge,DBR,87028603,247636874.0,10691346.0,"Solana Ecosystem, Bridge Governance Tokens, Cross-chain Communication, Intent"
MAGIC,magic,Treasure,MAGIC,85326649,94359026.0,130127043.0,"Artificial Intelligence (AI), Gaming (GameFi), NFT, Metaverse, Arbitrum Ecosystem, Ethereum Ecosystem, Layer 2 (L2), Zero Knowledge (ZK), Gaming Blockchains, Gaming Governance Token, Gaming Utility Token, AI Agents, AI Agent Launchpad"
ZKJ,polyhedra-network,Polyhedra Network,ZKJ,83785186,246830333.0,42776233.0,"Smart Contract Platform, BNB Chain Ecosystem, Ethereum Ecosystem, Zero Knowledge (ZK), Animoca Brands Portfolio, YZi Labs (Prev. Binance Labs) Portfolio, OKX Ventures Portfolio, Binance Alpha Spotlight"
IQ,everipedia,IQ,IQ,82387366,82387366.0,3790161.0,"Artificial Intelligence (AI), Big Data, Media, BNB Chain Ecosystem, Polygon Ecosystem, Ethereum Ecosystem, AI Agents, GMCI DePIN Index, Galaxy Digital Portfolio, GMCI Index, AI Agent Launchpad, AI Framework, DeFAI"
ERG,ergo,Ergo,ERG,79465164,95133796.0,217293.0,"Smart Contract Platform, Layer 1 (L1), Proof of Work (PoW), Privacy Blockchain"
DKA,dkargo,dKargo,DKA,78544854,78544854.0,2027329.0,Ethereum Ecosystem
MYTH,mythos,Mythos,MYTH,66893846,83993543.0,3783417.0,"Gaming (GameFi), Polkadot Ecosystem, NFT, Avalanche Ecosystem, Ethereum Ecosystem, Gaming Blockchains, Andreessen Horowitz (a16z) Portfolio, YZi Labs (Prev. Binance Labs) Portfolio, Galaxy Digital Portfolio, Made in USA"
ORAI,oraichain-token,Oraichain,ORAI,61259595,61833959.0,1016636.0,"Artificial Intelligence (AI), Big Data, Business Services, Smart Contract Platform, Decentralized Finance (DeFi), Oracle, BNB Chain Ecosystem, Solana Ecosystem, Layer 1 (L1), Ethereum Ecosystem, DWF Labs Portfolio, Osmosis Ecosystem, AI Agents"
NTRN,neutron-3,Neutron,NTRN,60179674,98679544.0,11603983.0,"Binance Launchpool, Osmosis Ecosystem, Delphi Ventures Portfolio"
ELG,escoin-token,Escoin,ELG,53940906,73206046.0,378893.0,"BNB Chain Ecosystem, Polygon Ecosystem, Ethereum Ecosystem"
CELR,celer-network,Celer Network,CELR,47691281,84477303.0,5406831.0,"Arbitrum Ecosystem, Ethereum Ecosystem, Bridge Governance Tokens, Binance Launchpad, Cross-chain Communication, Pantera Capital Portfolio, Energi Ecosystem, YZi Labs (Prev. Binance Labs) Portfolio"
DEVVE,devve,DevvE,DEVVE,46929118,64440983.0,323579.0,"Exchange-based Tokens, Layer 1 (L1), Ethereum Ecosystem"
KERNEL,kernel-2,KernelDAO,KERNEL,46126557,207147476.0,26804695.0,"Decentralized Finance (DeFi), BNB Chain Ecosystem, Arbitrum Ecosystem, Ethereum Ecosystem, Restaking, Liquid Restaking Governance Tokens"
CAW,a-hunters-dream,A Hunters Dream,CAW,45239143,47370830.0,1130693.0,"SocialFi, Ethereum Ecosystem"
GRIFFAIN,griffain,GRIFFAIN,GRIFFAIN,44281055,44281055.0,11358484.0,"Artificial Intelligence (AI), Solana Ecosystem, Pump.fun Ecosystem, AI Agent Launchpad, Binance Alpha Spotlight, DeFAI"
MAV,maverick-protocol,Maverick Protocol,MAV,42970989,124634225.0,75552836.0,"BNB Chain Ecosystem, Binance Launchpool, Ethereum Ecosystem, ZkSync Ecosystem, Base Ecosystem, Coinbase Ventures Portfolio, Pantera Capital Portfolio, YZi Labs (Prev. Binance Labs) Portfolio, Circle Ventures Portfolio"
PSP,paraswap,ParaSwap,PSP,42050729,48761331.0,515610.0,"Decentralized Exchange (DEX), Exchange-based Tokens, Decentralized Finance (DeFi), BNB Chain Ecosystem, Polygon Ecosystem, Ethereum Ecosystem, Optimism Ecosystem, Alameda Research Portfolio, Intent, Blockchain Capital Portfolio, Dex Aggregator"
HEI,heima,Heima,HEI,39747498,49804094.0,13595501.0,"BNB Chain Ecosystem, Binance Launchpool, Ethereum Ecosystem, YZi Labs (Prev. Binance Labs) Portfolio"
SYS,syscoin,Syscoin,SYS,38563083,38566966.0,4678657.0,"Smart Contract Platform, Masternodes, Layer 1 (L1), Decentralized Identifier (DID), Layer 2 (L2), Zero Knowledge (ZK), Rollux Ecosystem, DWF Labs Portfolio, Data Availability, Modular Blockchain, Rollup, Proof of Work (PoW)"
REX,etherex,Etherex,REX,37309480,180904156.0,940115.0,"Decentralized Exchange (DEX), Decentralized Finance (DeFi), Linea Ecosystem"
XPLA,xpla,XPLA,XPLA,31516462,74698766.0,216414.0,"Smart Contract Platform, Gaming (GameFi), NFT, Wallets, Osmosis Ecosystem, Gaming Blockchains, Gaming Platform, Appchains"
DF,dforce-token,dForce,DF,30839786,30839786.0,1561325.0,"Decentralized Finance (DeFi), BNB Chain Ecosystem, Lending/Borrowing Protocols, Arbitrum Ecosystem, Ethereum Ecosystem, Multicoin Capital Portfolio, Stablecoin Protocol, Energi Ecosystem"
MLN,melon,Enzyme,MLN,29019790,29019790.0,27439140.0,"Decentralized Finance (DeFi), Asset Manager, Polygon Ecosystem, Arbitrum Ecosystem, Ethereum Ecosystem, Real World Assets (RWA), DeFiance Capital Portfolio"
OL,open-loot,OPENLOOT,OL,26412311,211983259.0,8952748.0,"Gaming (GameFi), NFT, BNB Chain Ecosystem, Ethereum Ecosystem, Gaming Marketplace"
DOVU,dovu-2,DOVU,DOVU,26033933,26114191.0,55205.0,"Infrastructure, Ethereum Ecosystem, Regenerative Finance (ReFi), Real World Assets (RWA), Hedera Ecosystem"
OMG,omisego,OMG Network,OMG,26005226,26005226.0,3199445.0,"Smart Contract Platform, Ethereum Ecosystem, Alleged SEC Securities, Pantera Capital Portfolio, Boba Network Ecosystem"
BAKE,bakerytoken,BakerySwap,BAKE,25773719,25868827.0,8023448.0,"NFT, BNB Chain Ecosystem, Harmony Ecosystem"
ROAM,roam-token,ROAM Token,ROAM,24437874,83803730.0,19366301.0,"Retail, BNB Chain Ecosystem, Solana Ecosystem, DePIN"
IXS,ix-swap,IXS,IXS,23070981,23070981.0,199214.0,"Polygon Ecosystem, Ethereum Ecosystem, Real World Assets (RWA), Base Ecosystem, DWF Labs Portfolio, Poolz Finance Launchpad, Coinbase Ventures Portfolio"
CATI,catizen,Catizen,CATI,19842246,96321581.0,39893473.0,"Gaming (GameFi), Play To Earn, Telegram Apps, TON Ecosystem, Tap to Earn"
EVER,everscale,Everscale,EVER,19220325,20497973.0,147254.0,"Infrastructure, Layer 1 (L1), Ethereum Ecosystem"
GEL,gelato,Gelato,GEL,18805932,30075449.0,417906.0,"Smart Contract Platform, Polygon Ecosystem, Fantom Ecosystem, Ethereum Ecosystem, Layer 2 (L2), Modular Blockchain, Rollups-as-a-Service (RaaS), DragonFly Capital Portfolio, Galaxy Digital Portfolio, Binance Alpha Spotlight"
BLZ,bluzelle,Bluzelle,BLZ,17811424,18928007.0,788007.0,"Smart Contract Platform, BNB Chain Ecosystem, Ethereum Ecosystem, DePIN, Decentralized Science (DeSci), Osmosis Ecosystem, Energi Ecosystem, GMCI DePIN Index, GMCI Index"
HIFI,hifi-finance,Hifi Finance,HIFI,17765709,19685145.0,53416417.0,"Tokenized Real Estate, Decentralized Finance (DeFi), Tokenized Assets, Lending/Borrowing Protocols, Ethereum Ecosystem, Real World Assets (RWA), Made in USA"
ATR,artrade,Artrade,ATR,17484643,17538636.0,1142150.0,"NFT, Solana Ecosystem, NFT Marketplace, Real World Assets (RWA), Art"
FIO,fio-protocol,FIO Protocol,FIO,17087325,20941009.0,8082101.0,"Smart Contract Platform, Layer 1 (L1), YZi Labs (Prev. Binance Labs) Portfolio"
HANDY,handy,Handy,HANDY,16147863,30958492.0,54849.0,Ethereum Ecosystem
BXX,baanx,Baanx,BXX,15742867,15742867.0,207359.0,Ethereum Ecosystem
VOXEL,voxies,Voxies,VOXEL,14893376,18367044.0,6768953.0,"Gaming (GameFi), NFT, Polygon Ecosystem, Binance Launchpad, RPG, Gaming Utility Token, Strategy Games, YZi Labs (Prev. Binance Labs) Portfolio"
BOSON,boson-protocol,Boson,BOSON,13610910,18639651.0,2130154.0,"NFT, Metaverse, Polygon Ecosystem, Ethereum Ecosystem, Real World Assets (RWA), Animoca Brands Portfolio, Base Ecosystem, RWA Protocol, Outlier Ventures Portfolio"
BDC,billion-dollar-cat-runes,Billy (Bitcoin),BDC,13460127,13460127.0,81692.0,"Solana Ecosystem, Meme, Cat-Themed, Bitcoin Ecosystem, Runes"
LOKA,league-of-kingdoms,League of Kingdoms,LOKA,12894811,119462222.0,1195671.0,"Gaming (GameFi), NFT, Metaverse, Ethereum Ecosystem, Binance Launchpad, Gaming Governance Token, Gaming Utility Token, Strategy Games, Andreessen Horowitz (a16z) Portfolio, YZi Labs (Prev. Binance Labs) Portfolio, Sequoia Capital Portfolio"
PHNIX,phnix,PHNIX,PHNIX,12442988,13813815.0,975287.0,"Meme, XRP Ledger Ecosystem"
SNSY,sensay,Sensay,SNSY,11314107,19840907.0,588511.0,"Artificial Intelligence (AI), Arbitrum Ecosystem, Ethereum Ecosystem, Base Ecosystem, AI Agents"
MANEKI,maneki,MANEKI,MANEKI,10911317,10948529.0,5244759.0,"Solana Ecosystem, Meme, Solana Meme, Cat-Themed"
SWELL,layerzero-bridged-swell,Layerzero Bridged Swell,SWELL,9300008,9300008.0,14558.55,"Liquid Staking Governance Tokens, Liquid Restaking Governance Tokens, Bridged-Tokens, Swellchain Ecosystem"
REF,ref-finance,Ref Finance,REF,8885972,22768795.0,3526.5,"Near Protocol Ecosystem, Alameda Research Portfolio, DragonFly Capital Portfolio, OKX Ventures Portfolio"
VICE,vice-2,VICE,VICE,8717888,11101588.0,235076.0,"Gaming (GameFi), Ethereum Ecosystem"
HTR,hathor,Hathor,HTR,8391777,14654658.0,371639.0,"Infrastructure, Smart Contract Platform, Layer 1 (L1), Real World Assets (RWA), Proof of Work (PoW), Directed Acyclic Graph (DAG)"
HTM,hatom,Hatom,HTM,7873400,11764972.0,151850.0,"Decentralized Finance (DeFi), Lending/Borrowing Protocols, Meme, MultiversX Ecosystem, Liquid Staking"
RX,reachx-mainnet,ReachX Mainnet,RX,7735479,15470958.0,26.71,"SocialFi, Meme, Base Ecosystem"
PUSS,puss,Puss,PUSS,7695133,7695133.0,546727.0,"Meme, Tron Ecosystem, TRON Meme"
SEXY,settled-ethxy-token,Settled EthXY Token,SEXY,7503232,7503232.0,98816.0,"Gaming (GameFi), Ethereum Ecosystem, Base Ecosystem, Andreessen Horowitz (a16z) Portfolio"
RIZO,hahayes,HahaYes,RIZO,7286317,7286317.0,380664.0,"Solana Ecosystem, Meme, Elon Musk-Inspired, Solana Meme"
EAI,eagle-ai,Eagle AI,EAI,6873158,15284550.0,406834.0,"Analytics, Base Ecosystem"
GRIFT,orbit-3,ORBIT,GRIFT,6565029,7460579.0,3029355.0,"Artificial Intelligence (AI), Solana Ecosystem, AI Agents, Pump.fun Ecosystem, Binance Alpha Spotlight, DeFAI"
BCB,bitcoin-bit,Bitcoin Bit,BCB,6437961,31500761.0,4.5,"Ethereum Ecosystem, Proof of Stake (PoS)"
WBTC,aptos-bridged-wbtc-aptos,Aptos Bridged WBTC (Aptos),WBTC,6060557,6060557.0,2395560.0,"Aptos Ecosystem, Bridged WBTC, Bridged-Tokens"
SABAI,sabai-ecovers,Sabai Protocol,SABAI,5496468,27265865.0,3755510.0,"Polygon Ecosystem, Ethereum Ecosystem"
DEFX,definity,DeFinity,DEFX,5463128,6121118.0,11741.95,"BNB Chain Ecosystem, Ethereum Ecosystem"
NYA,nya,Nya,NYA,5330255,5339421.0,18128.27,"BNB Chain Ecosystem, Avalanche Ecosystem, Polygon Ecosystem, Meme, Arbitrum Ecosystem, Ethereum Ecosystem, Optimism Ecosystem, Base Ecosystem, Cat-Themed"
ZYPTO,french-connection-finance,Zypto Token,ZYPTO,5157336,5157336.0,45186.0,"Decentralized Finance (DeFi), Wallets, Ethereum Ecosystem, Payment Solutions"
NRS,nereus-token,Nereus,NRS,5138038,131720390.0,160821.0,"Decentralized Finance (DeFi), Derivatives, Polygon Ecosystem"
AURA,aura-2,Aura,AURA,4931883,13954124.0,185.47,"Artificial Intelligence (AI), Base Ecosystem, AI Framework"
TJRM,tajir-tech-hub,Tajir Tech Hub,TJRM,4876385,4876385.0,343438.0,Solana Ecosystem
LVN,levana-protocol,Levana,LVN,4646456,6103595.0,800.36,"Decentralized Finance (DeFi), Perpetuals, Terra Ecosystem, Injective Ecosystem, Osmosis Ecosystem, Archway Ecosystem"
SYNTH,synth-2,Synth,SN50,4562147,4562147.0,7392.85,"Artificial Intelligence (AI), Bittensor Ecosystem, Bittensor Subnets"
XMR,monero,Monero,XMR,4659744560,4659744560.0,107149805.0,"Smart Contract Platform, Privacy, Layer 1 (L1), Proof of Work (PoW), Galaxy Digital Portfolio"
MNT,mantle,Mantle,MNT,3446305844,6368085919.0,319272095.0,"Smart Contract Platform, Ethereum Ecosystem, Layer 2 (L2), Mantle Ecosystem, DWF Labs Portfolio, DragonFly Capital Portfolio, GMCI Layer 2 Index, GMCI 30 Index, GMCI Index, World Liberty Financial Portfolio"
SPX,spx6900,SPX6900,SPX,1703067440,1703067440.0,79983016.0,"Solana Ecosystem, Meme, Ethereum Ecosystem, Base Ecosystem, Bridged-Tokens, Murad Picks, Stock market-themed, 4chan-Themed"
JASMY,jasmycoin,JasmyCoin,JASMY,923242644,953369108.0,105916845.0,"Internet of Things (IOT), Ethereum Ecosystem, DePIN, DWF Labs Portfolio, Coinbase 50 Index"
VIRTUAL,virtual-protocol,Virtuals Protocol,VIRTUAL,885612127,1351205465.0,159567773.0,"Artificial Intelligence (AI), Solana Ecosystem, Ethereum Ecosystem, Base Ecosystem, AI Agents, Virtuals Protocol Ecosystem, AI Agent Launchpad, Binance Alpha Spotlight"
SAND,the-sandbox,The Sandbox,SAND,742832464,911131467.0,70656195.0,"Gaming (GameFi), NFT, Metaverse, Polygon Ecosystem, Play To Earn, Harmony Ecosystem, Ethereum Ecosystem, Animoca Brands Portfolio, Alleged SEC Securities, Binance Launchpad, Gaming Utility Token, Simulation Games, Energi Ecosystem, YZi Labs (Prev. Binance Labs) Portfolio, Coinbase 50 Index"
MORPHO,morpho,Morpho,MORPHO,732901903,2263698814.0,25416881.0,"Decentralized Finance (DeFi), Lending/Borrowing Protocols, Ethereum Ecosystem, Base Ecosystem, Coinbase Ventures Portfolio, Pantera Capital Portfolio, Morpho Ecosystem, Binance Alpha Spotlight"
JTO,jito-governance-token,Jito,JTO,713832070,1956387784.0,38688215.0,"Decentralized Finance (DeFi), Solana Ecosystem, Liquid Staking Governance Tokens, Multicoin Capital Portfolio, Alameda Research Portfolio, Delphi Ventures Portfolio, Liquid Staking, Made in USA"
DOGE,binance-peg-dogecoin,Binance-Peg Dogecoin,DOGE,606463102,606463102.0,5730758.0,"BNB Chain Ecosystem, Meme, Binance-Peg Tokens"
STRK,starknet,Starknet,STRK,538043897,1402732327.0,46549694.0,"Infrastructure, Smart Contract Platform, Ethereum Ecosystem, Layer 2 (L2), Zero Knowledge (ZK), Starknet Ecosystem, Paradigm Portfolio, Coinbase Ventures Portfolio, Rollup, Multicoin Capital Portfolio, Alameda Research Portfolio, Pantera Capital Portfolio, GMCI Layer 2 Index, Consensys Portfolio, Sequoia Capital Portfolio, GMCI Index, Polychain Capital Portfolio"
RUNE,thorchain,THORChain,RUNE,516842187,625784257.0,108530603.0,"Decentralized Exchange (DEX), Infrastructure, Smart Contract Platform, Exchange-based Tokens, Decentralized Finance (DeFi), Bridge Governance Tokens, Multicoin Capital Portfolio, Proof of Stake (PoS), Delphi Ventures Portfolio"
XCN,chain-2,Onyxcoin,XCN,484264913,678474825.0,23719105.0,"Smart Contract Platform, BNB Chain Ecosystem, Layer 1 (L1), Ethereum Ecosystem, Base Ecosystem, Proof of Stake (PoS), Pantera Capital Portfolio, Made in USA"
XEC,ecash,eCash,XEC,438766557,438766763.0,7920088.0,"Smart Contract Platform, Layer 1 (L1), Bitcoin Fork, Proof of Work (PoW)"
POPCAT,popcat,Popcat,POPCAT,329993461,329993461.0,46400831.0,"Solana Ecosystem, Meme, Solana Meme, Cat-Themed, Murad Picks"
AMP,amp-token,Amp,AMP,318091487,376391057.0,9660612.0,"Decentralized Finance (DeFi), Near Protocol Ecosystem, Ethereum Ecosystem, Payment Solutions, Alleged SEC Securities, Pantera Capital Portfolio, Energi Ecosystem, Made in USA"
OM,mantra-dao,MANTRA,OM,288724385,467933466.0,70922253.0,"Infrastructure, Smart Contract Platform, BNB Chain Ecosystem, Cosmos Ecosystem, Layer 1 (L1), Polygon Ecosystem, Ethereum Ecosystem, Real World Assets (RWA), Base Ecosystem, Osmosis Ecosystem, Mantra Ecosystem"
GRASS,grass,Grass,GRASS,241947726,804529464.0,40818150.0,"Artificial Intelligence (AI), Solana Ecosystem, DePIN, Polychain Capital Portfolio, Binance Alpha Spotlight"
ZRX,0x,0x Protocol,ZRX,225822396,266175520.0,17835565.0,"Decentralized Exchange (DEX), Decentralized Finance (DeFi), Avalanche Ecosystem, Harmony Ecosystem, Ethereum Ecosystem, Coinbase Ventures Portfolio, Pantera Capital Portfolio, Energi Ecosystem, GMCI DeFi Index, Blockchain Capital Portfolio, GMCI Index, Made in USA"
GOMINING,gmt-token,GoMining Token,GOMINING,216872967,216872967.0,17649229.0,"Gaming (GameFi), BNB Chain Ecosystem, Ethereum Ecosystem, TON Ecosystem"
NOT,notcoin,Notcoin,NOT,215733857,222293305.0,39113600.0,"Gaming (GameFi), Binance Launchpool, Meme, Play To Earn, TON Ecosystem, TON Meme, Tap to Earn"
ORDI,ordinals,ORDI,ORDI,215614951,215614951.0,80092402.0,"Solana Ecosystem, BRC-20, Bitcoin Ecosystem, Inscriptions"
ASTR,astar,Astar,ASTR,214067922,223002830.0,10010828.0,"Smart Contract Platform, Polkadot Ecosystem, Layer 1 (L1), Ethereum Ecosystem, Layer 2 (L2), Alameda Research Portfolio, YZi Labs (Prev. Binance Labs) Portfolio, OKX Ventures Portfolio"
XPR,proton,XPR Network,XPR,193496307,213623711.0,9350896.0,"Smart Contract Platform, BNB Chain Ecosystem, Ethereum Ecosystem, DWF Labs Portfolio, Made in USA"
RPL,rocket-pool,Rocket Pool,RPL,192534081,192534081.0,17765920.0,"Business Services, Infrastructure, Smart Contract Platform, Decentralized Finance (DeFi), Polygon Ecosystem, Arbitrum Ecosystem, Ethereum Ecosystem, Liquid Staking Governance Tokens, Coinbase Ventures Portfolio, Proof of Stake (PoS), Index Coop Defi Index, Consensys Portfolio, Liquid Staking"
ETHW,ethereum-pow-iou,EthereumPoW,ETHW,189888646,189888646.0,11445795.0,"Smart Contract Platform, EthereumPoW Ecosystem, Proof of Work (PoW)"
SUSHI,sushi,Sushi,SUSHI,170955074,252895610.0,45145065.0,"Decentralized Exchange (DEX), Exchange-based Tokens, Decentralized Finance (DeFi), Yield Farming, Automated Market Maker (AMM), BNB Chain Ecosystem, Yearn Ecosystem, Solana Ecosystem, Avalanche Ecosystem, Polygon Ecosystem, Near Protocol Ecosystem, Fantom Ecosystem, Harmony Ecosystem, Arbitrum Ecosystem, Celo Ecosystem, Ethereum Ecosystem, Base Ecosystem, Alameda Research Portfolio, Pantera Capital Portfolio, Energi Ecosystem, Sora Ecosystem, Blockchain Capital Portfolio"
ZEN,zencash,Horizen,ZEN,147433475,178567834.0,16007251.0,"Smart Contract Platform, Zero Knowledge (ZK), Base Ecosystem, Made in USA"
SKL,skale,SKALE,SKL,147107092,154751643.0,38763518.0,"Smart Contract Platform, Gaming (GameFi), Layer 1 (L1), Ethereum Ecosystem, Modular Blockchain, Account Abstraction, Multicoin Capital Portfolio, Gaming Blockchains, Gaming Utility Token, Skale Ecosystem, Consensys Portfolio, Galaxy Digital Portfolio, Made in USA"
CHEX,chex-token,Chintai,CHEX,137401204,137401204.0,4366109.0,"Decentralized Exchange (DEX), Decentralized Finance (DeFi), BNB Chain Ecosystem, Solana Ecosystem, Ethereum Ecosystem, Real World Assets (RWA), Base Ecosystem, RWA Protocol"
SXP,swipe,Solar,SXP,124726273,124835225.0,6748914.0,"BNB Chain Ecosystem, Harmony Ecosystem, Ethereum Ecosystem, Alameda Research Portfolio, YZi Labs (Prev. Binance Labs) Portfolio"
