Input Token,CoinGecko ID,Name,Symbol,Market Cap,FDV,24H Volume,Categories
AVAX,avalanche-2,Avalanche,AVAX,3861632648.0,4144871120.0,214860059.0,"Smart Contract Platform, Layer 1 (L1), Avalanche Ecosystem, Proof of Stake (PoS), DragonFly Capital Portfolio, DeFiance Capital Portfolio, Andreessen Horowitz (a16z) Portfolio, GMCI Layer 1 Index, GMCI 30 Index, Galaxy Digital Portfolio, GMCI Index, Polychain Capital Portfolio, World Liberty Financial Portfolio, Made in USA, Coinbase 50 Index"
SUI,sui,Sui,SUI,3435157318.0,8808130267.0,318340550.0,"Smart Contract Platform, Binance Launchpool, Layer 1 (L1), Sui Ecosystem, Coinbase Ventures Portfolio, Proof of Stake (PoS), Andreessen Horowitz (a16z) Portfolio, YZi Labs (Prev. Binance Labs) Portfolio, GMCI Layer 1 Index, Circle Ventures Portfolio, GMCI Index, Made in USA"
TAO,bittensor,Bittensor,TAO,2941364917.0,6435917811.0,301264887.0,"Artificial Intelligence (AI), Smart Contract Platform, Layer 1 (L1), DePIN, Bittensor Ecosystem, Polychain Capital Portfolio"
ONDO,ondo-finance,Ondo,ONDO,1331421767.0,2734301413.0,77709411.0,"Decentralized Finance (DeFi), Ethereum Ecosystem, Real World Assets (RWA), Coinbase Ventures Portfolio, Pantera Capital Portfolio, GMCI DeFi Index, RWA Protocol, GMCI Index, World Liberty Financial Portfolio, Binance Alpha Spotlight, Made in USA, CoinList Launchpad"
ALGO,algorand,Algorand,ALGO,874197805.0,874206745.0,90458298.0,"Smart Contract Platform, Layer 1 (L1), Algorand Ecosystem, Real World Assets (RWA), DWF Labs Portfolio, Multicoin Capital Portfolio, Proof of Stake (PoS), GMCI Layer 1 Index, GMCI Index, Made in USA, Coinbase 50 Index, CoinList Launchpad"
NEXO,nexo,NEXO,NEXO,867681357.0,867681357.0,9330838.0,"Exchange-based Tokens, Centralized Exchange (CEX) Token, Polygon Ecosystem, Fantom Ecosystem, Ethereum Ecosystem, Alleged SEC Securities, Energi Ecosystem, Sora Ecosystem, Crypto Card Issuer"
ATOM,cosmos,Cosmos Hub,ATOM,854150135.0,854150135.0,39535634.0,"Smart Contract Platform, BNB Chain Ecosystem, Cosmos Ecosystem, Terra Ecosystem, Canto Ecosystem, Alleged SEC Securities, Osmosis Ecosystem, Paradigm Portfolio, Proof of Stake (PoS), Kava Ecosystem, Layer 0 (L0), DragonFly Capital Portfolio, Pantera Capital Portfolio, Archway Ecosystem, Evmos Ecosystem, GMCI 30 Index, GMCI Index, Outlier Ventures Portfolio, Polychain Capital Portfolio, Mantra Ecosystem, Coinbase 50 Index, Governance"
ENA,ethena,Ethena,ENA,772626276.0,1364712465.0,83409417.0,"Decentralized Finance (DeFi), Binance Launchpool, Avalanche Ecosystem, Arbitrum Ecosystem, Ethereum Ecosystem, Metis Ecosystem, Optimism Ecosystem, ZkSync Ecosystem, Mantle Ecosystem, Base Ecosystem, TON Ecosystem, Manta Network Ecosystem, Scroll Ecosystem, Kava Ecosystem, Blast Ecosystem, Stablecoin Issuer, Mode Ecosystem, DragonFly Capital Portfolio, YZi Labs (Prev. Binance Labs) Portfolio, Fraxtal Ecosystem, Delphi Ventures Portfolio, OKX Ventures Portfolio, Zircuit Ecosystem, Morph L2 Ecosystem, World Liberty Financial Portfolio, Swellchain Ecosystem, Governance"
WBTC,arbitrum-bridged-wbtc-arbitrum-one,Arbitrum Bridged WBTC (Arbitrum One),WBTC,529441121.0,529441121.0,75665121.0,"Arbitrum Ecosystem, Bridged WBTC, Bridged-Tokens"
CHZ,chiliz,Chiliz,CHZ,432602255.0,432602255.0,72445391.0,"Smart Contract Platform, Sports, NFT, Layer 1 (L1), Ethereum Ecosystem, Alleged SEC Securities, Chiliz Ecosystem, YZi Labs (Prev. Binance Labs) Portfolio, Coinbase 50 Index"
FDUSD,first-digital-usd,First Digital USD,FDUSD,393959350.0,393959350.0,201063017.0,"Stablecoins, USD Stablecoin, BNB Chain Ecosystem, Arbitrum Ecosystem, Ethereum Ecosystem, Sui Ecosystem, TON Ecosystem, Fiat-backed Stablecoin"
NFT,apenft,AINFT,NFT,322015964.0,322015964.0,7728768.0,"NFT, BNB Chain Ecosystem, Ethereum Ecosystem, Tron Ecosystem, Binance Alpha Spotlight"
INJ,injective-protocol,Injective,INJ,287606791.0,287606791.0,41421246.0,"Smart Contract Platform, Decentralized Finance (DeFi), BNB Chain Ecosystem, Cosmos Ecosystem, Layer 1 (L1), Terra Ecosystem, Ethereum Ecosystem, Real World Assets (RWA), Binance Launchpad, Osmosis Ecosystem, Proof of Stake (PoS), Pantera Capital Portfolio, Secret Ecosystem, YZi Labs (Prev. Binance Labs) Portfolio, GMCI Layer 1 Index, GMCI Index, Made in USA, Coinbase 50 Index"
DOGWIFHAT,dogwifcoin,dogwifhat,WIF,179144401.0,179144401.0,49645650.0,"Solana Ecosystem, Meme, Dog-Themed, Solana Meme, GMCI Meme Index, GMCI Index, Unichain Ecosystem"
MANA,decentraland,Decentraland,MANA,166765222.0,188997819.0,12284840.0,"Entertainment, Gaming (GameFi), NFT, Metaverse, Polygon Ecosystem, Play To Earn, Ethereum Ecosystem, Animoca Brands Portfolio, Alleged SEC Securities, Simulation Games, Coinbase 50 Index"
AR,arweave,Arweave,AR,115157345.0,115157345.0,16443071.0,"Artificial Intelligence (AI), Smart Contract Platform, Storage, Layer 1 (L1), DePIN, Coinbase Ventures Portfolio, Multicoin Capital Portfolio, Andreessen Horowitz (a16z) Portfolio, Blockchain Capital Portfolio"
MELANIA,melania-meme,Melania Meme,MELANIA,108586288.0,114001358.0,15374737.0,"Solana Ecosystem, Meme, Solana Meme, PolitiFi, Made in USA, Trump-Affiliated"
LPT,livepeer,Livepeer,LPT,104928502.0,104928502.0,17689429.0,"Artificial Intelligence (AI), Harmony Ecosystem, Arbitrum Ecosystem, Ethereum Ecosystem, DePIN, Coinbase Ventures Portfolio, Multicoin Capital Portfolio, Pantera Capital Portfolio, GMCI DePIN Index, GMCI Index, Coinbase 50 Index"
BERA,berachain-bera,Berachain,BERA,101164282.0,235807506.0,16900712.0,"Smart Contract Platform, Decentralized Finance (DeFi), Layer 1 (L1), Berachain Ecosystem, Binance HODLer Airdrops, Outlier Ventures Portfolio, Polychain Capital Portfolio"
RVN,ravencoin,Ravencoin,RVN,96694512.0,96697907.0,6726859.0,"Smart Contract Platform, Real World Assets (RWA), Proof of Work (PoW), Made in USA"
RSR,reserve-rights-token,Reserve Rights,RSR,95417474.0,152538180.0,6883442.0,"Decentralized Finance (DeFi), Arbitrum Ecosystem, Ethereum Ecosystem, Real World Assets (RWA), Base Ecosystem, Coinbase Ventures Portfolio, Energi Ecosystem, Made in USA, Base Native"
LB,lovebit,LoveBit,LB,86776724.0,86776724.0,34214.0,"BNB Chain Ecosystem, Meme"
DBR,debridge,deBridge,DBR,68256575.0,144563838.0,8310819.0,"Solana Ecosystem, Bridge Governance Tokens, Cross-chain Communication, Intent, Governance"
VELO,velo,Velo,VELO,66263945.0,90544859.0,3011918.0,"Decentralized Finance (DeFi), BNB Chain Ecosystem, Real World Assets (RWA), DWF Labs Portfolio, Stellar Ecosystem, Binance Alpha Spotlight"
PYTHIA,pythia,PYTHIA,PYTHIA,61891765.0,61891765.0,849051.0,"Solana Ecosystem, Meme, AI Meme, Pump.fun Ecosystem, Desci Meme, Binance Alpha Spotlight"
ELG,escoin-token,Escoin,ELG,53349261.0,72403093.0,332201.0,"Legal, BNB Chain Ecosystem, Polygon Ecosystem, Ethereum Ecosystem"
POPCAT,popcat,Popcat,POPCAT,46968251.0,46968251.0,18737855.0,"Solana Ecosystem, Meme, Solana Meme, Cat-Themed, Murad Picks, Binance Alpha Spotlight"
ALEO,aleo,ALEO,ALEO,41025031.0,80408827.0,1888138.0,"Infrastructure, Smart Contract Platform, BNB Chain Ecosystem, Layer 1 (L1), Zero Knowledge (ZK), Andreessen Horowitz (a16z) Portfolio, Privacy Blockchain, Binance Alpha Spotlight, Made in USA"
LTC,binance-peg-litecoin,Binance-Peg Litecoin,LTC,40232241.0,40232241.0,1650444.0,"Crypto-Backed Tokens, BNB Chain Ecosystem, Binance-Peg Tokens"
SNT,status,Status,SNT,37856579.0,65044857.0,1676852.0,"Infrastructure, Smart Contract Platform, SocialFi, Ethereum Ecosystem, Layer 2 (L2)"
BNT,bancor,Bancor Network,BNT,31175028.0,31175028.0,1026100.0,"Decentralized Exchange (DEX), Exchange-based Tokens, Decentralized Finance (DeFi), Automated Market Maker (AMM), Ethereum Ecosystem, DeFiance Capital Portfolio, Energi Ecosystem, Governance"
DOVU,dovu-2,DOVU,DOVU,29816014.0,29816044.0,141974.0,"Infrastructure, Ethereum Ecosystem, Regenerative Finance (ReFi), Real World Assets (RWA), Hedera Ecosystem, Base Native"
BIO,bio-protocol,Bio Protocol,BIO,29776860.0,55860658.0,9769065.0,"BNB Chain Ecosystem, Binance Launchpool, Solana Ecosystem, Ethereum Ecosystem, Base Ecosystem, Decentralized Science (DeSci), Base Native"
MERL,merlin-chain,Merlin Chain,MERL,28716916.0,50337870.0,7210157.0,"Smart Contract Platform, BNB Chain Ecosystem, Ethereum Ecosystem, Layer 2 (L2), Merlin Chain Ecosystem, Bitcoin Sidechains, SideChain, OKX Ventures Portfolio, Made in China"
KERNEL,kernel-2,KernelDAO,KERNEL,28311659.0,98885317.0,167636365.0,"Decentralized Finance (DeFi), BNB Chain Ecosystem, Arbitrum Ecosystem, Ethereum Ecosystem, Real World Assets (RWA), Restaking, Liquid Restaking Governance Tokens"
IQ,everipedia,IQ,IQ,26152460.0,26152460.0,1340515.0,"Artificial Intelligence (AI), Big Data, Media, BNB Chain Ecosystem, Polygon Ecosystem, Ethereum Ecosystem, AI Agents, GMCI DePIN Index, Galaxy Digital Portfolio, GMCI Index, AI Agent Launchpad, AI Framework, DeFAI"
PEAQ,peaq-2,peaq,PEAQ,26102120.0,58806189.0,1268011.0,"Smart Contract Platform, Polkadot Ecosystem, Layer 1 (L1), DePIN, Outlier Ventures Portfolio, Binance Alpha Spotlight, Robotics, x402 Ecosystem, CoinList Launchpad"
DKA,dkargo,dKargo,DKA,26009655.0,26009655.0,2611869.0,"Artificial Intelligence (AI), Infrastructure, Ethereum Ecosystem, Governance"
ERG,ergo,Ergo,ERG,23238224.0,27347438.0,216210.0,"Smart Contract Platform, Layer 1 (L1), Zero Knowledge (ZK), Proof of Work (PoW), Privacy Blockchain"
AIXBT,aixbt,aixbt,AIXBT,23100129.0,23224183.0,7978190.0,"Artificial Intelligence (AI), Solana Ecosystem, Meme, Ethereum Ecosystem, Base Ecosystem, AI Meme, AI Agents, Virtuals Protocol Ecosystem, Binance Alpha Spotlight, DeFAI, Base Native"
CATI,catizen,Catizen,CATI,21306539.0,51739833.0,4185398.0,"Gaming (GameFi), Play To Earn, Telegram Apps, TON Ecosystem, Tap to Earn"
CAW,a-hunters-dream,A Hunters Dream,CAW,19914091.0,20852451.0,360278.0,"SocialFi, Ethereum Ecosystem"
SDEX,smardex,SMARDEX,SDEX,19790598.0,19959970.0,235882.0,"Decentralized Exchange (DEX), Exchange-based Tokens, Decentralized Finance (DeFi), BNB Chain Ecosystem, Solana Ecosystem, Polygon Ecosystem, Arbitrum Ecosystem, Ethereum Ecosystem, Base Ecosystem, Base Native"
MAGIC,magic,Treasure,MAGIC,18996596.0,20156065.0,11580025.0,"Artificial Intelligence (AI), NFT, Metaverse, Arbitrum Ecosystem, Ethereum Ecosystem, Layer 2 (L2), Zero Knowledge (ZK), Base Ecosystem, AI Agents, AI Agent Launchpad, x402 Ecosystem"
WELL,moonwell-artemis,Moonwell,WELL,18976042.0,20945424.0,1867365.0,"Decentralized Finance (DeFi), Lending/Borrowing Protocols, Moonbeam Ecosystem, Base Ecosystem, Coinbase Ventures Portfolio, Made in USA, Base Native"
LAYER,solayer,Solayer,LAYER,16730675.0,79669882.0,8310524.0,"Decentralized Finance (DeFi), Solana Ecosystem, LSDFi, Restaking, Stablecoin Issuer, YZi Labs (Prev. Binance Labs) Portfolio, Binance HODLer Airdrops, Polychain Capital Portfolio, Buidlpad Launchpad"
PONKE,ponke,PONKE,PONKE,15179853.0,15181529.0,2201055.0,"Solana Ecosystem, Meme, Base Ecosystem, Solana Meme, Base Meme, Made in USA, Base Native"
CHR,chromaway,Chromia,CHR,14420308.0,14420308.0,4667227.0,"Artificial Intelligence (AI), Smart Contract Platform, NFT, BNB Chain Ecosystem, Layer 1 (L1), Ethereum Ecosystem, Real World Assets (RWA), Modular Blockchain, Chromia Ecosystem, RWA Protocol"
CELR,celer-network,Celer Network,CELR,13734442.0,24328317.0,2492858.0,"Arbitrum Ecosystem, Ethereum Ecosystem, Bridge Governance Tokens, Binance Launchpad, Cross-chain Communication, Pantera Capital Portfolio, Energi Ecosystem, YZi Labs (Prev. Binance Labs) Portfolio"
ROAM,roam-token,ROAM Token,ROAM,13290703.0,38517970.0,843289.0,"Retail, BNB Chain Ecosystem, Solana Ecosystem, DePIN"
FIL,binance-peg-filecoin,Binance-Peg Filecoin,FIL,12483236.0,12483236.0,34377.0,"Infrastructure, Storage, BNB Chain Ecosystem, Binance-Peg Tokens"
IXS,ix-swap,IXS,IXS,12344017.0,12344017.0,125135.0,"Polygon Ecosystem, Ethereum Ecosystem, Real World Assets (RWA), Base Ecosystem, DWF Labs Portfolio, Poolz Finance Launchpad, Coinbase Ventures Portfolio, Base Native"
SYNTH,synth-2,Synth,SN50,11918306.0,11918306.0,72335.0,"Artificial Intelligence (AI), Bittensor Ecosystem, Bittensor Subnets"
COOKIE,cookie,Cookie DAO,COOKIE,11457465.0,16241556.0,3804523.0,"Artificial Intelligence (AI), Marketing, Analytics, BNB Chain Ecosystem, Ethereum Ecosystem, Animoca Brands Portfolio, Base Ecosystem, AI Agents, Binance Alpha Spotlight, InfoFi, Governance, Base Native"
GRIFFAIN,griffain,GRIFFAIN,GRIFFAIN,11045374.0,11045374.0,3008036.0,"Artificial Intelligence (AI), Solana Ecosystem, Meme, AI Meme, Pump.fun Ecosystem, AI Agent Launchpad, Binance Alpha Spotlight, DeFAI"
MAV,maverick-protocol,Maverick Protocol,MAV,10932190.0,25937758.0,1657924.0,"BNB Chain Ecosystem, Binance Launchpool, Ethereum Ecosystem, ZkSync Ecosystem, Base Ecosystem, Coinbase Ventures Portfolio, Pantera Capital Portfolio, YZi Labs (Prev. Binance Labs) Portfolio, Circle Ventures Portfolio, Base Native"
MLN,melon,Enzyme,MLN,10355107.0,10355107.0,1526383.0,"Decentralized Finance (DeFi), Asset Manager, Polygon Ecosystem, Arbitrum Ecosystem, Ethereum Ecosystem, Real World Assets (RWA), DeFiance Capital Portfolio"
ZKJ,polyhedra-network,Polyhedra Network,ZKJ,9273935.0,19459209.0,1658176.0,"Smart Contract Platform, BNB Chain Ecosystem, Ethereum Ecosystem, Zero Knowledge (ZK), Animoca Brands Portfolio, YZi Labs (Prev. Binance Labs) Portfolio, OKX Ventures Portfolio, Binance Alpha Spotlight"
ORAI,oraichain-token,Oraichain,ORAI,9127144.0,9139205.0,456206.0,"Artificial Intelligence (AI), Big Data, Smart Contract Platform, Decentralized Finance (DeFi), Oracle, BNB Chain Ecosystem, Solana Ecosystem, Layer 1 (L1), Ethereum Ecosystem, DWF Labs Portfolio, Osmosis Ecosystem, AI Agents"
SYS,syscoin,Syscoin,SYS,9028025.0,9028289.0,3142817.0,"Smart Contract Platform, Masternodes, Layer 1 (L1), Decentralized Identifier (DID), Layer 2 (L2), Zero Knowledge (ZK), Rollux Ecosystem, DWF Labs Portfolio, Data Availability, Modular Blockchain, Rollup, Proof of Work (PoW)"
EPIC,epic-cash,Epic Private Internet Cash,EPIC,8703530.0,8706423.0,69186.0,"Privacy Coins, Proof of Work (PoW), Privacy"
OL,open-loot,OPENLOOT,OL,8464679.0,54241068.0,1142480.0,"Gaming (GameFi), NFT, BNB Chain Ecosystem, Ethereum Ecosystem, Gaming Marketplace"
SHELL,myshell,MyShell,SHELL,7836825.0,29025277.0,4369110.0,"Artificial Intelligence (AI), BNB Chain Ecosystem, Ethereum Ecosystem, DragonFly Capital Portfolio, YZi Labs (Prev. Binance Labs) Portfolio, Delphi Ventures Portfolio, OKX Ventures Portfolio, Binance HODLer Airdrops, AI Agent Launchpad, Binance Alpha Spotlight, AI Framework, Binance Wallet IDO"
DOLZ,dolz-io,DOLZ.io,DOLZ,7209158.0,7209158.0,2559.58,"Artificial Intelligence (AI), Gaming (GameFi), NFT, Polygon Ecosystem, Ethereum Ecosystem, Base Ecosystem, Card Games, Base Native"
HEI,heima,Heima,HEI,6648801.0,7554186.0,1573335.0,"BNB Chain Ecosystem, Binance Launchpool, Ethereum Ecosystem, YZi Labs (Prev. Binance Labs) Portfolio"
PHNIX,phnix,PHNIX,PHNIX,6400893.0,7106071.0,63570.0,"Meme, XRP Ledger Ecosystem"
KDA,kadena,Kadena,KDA,5424479.0,5424479.0,100401.0,"Smart Contract Platform, Layer 1 (L1), Kadena Ecosystem, Multicoin Capital Portfolio, Proof of Work (PoW), Made in USA, CoinList Launchpad"
BOSON,boson-protocol,Boson,BOSON,5401730.0,7466119.0,84500.0,"NFT, Metaverse, Polygon Ecosystem, Ethereum Ecosystem, Real World Assets (RWA), Animoca Brands Portfolio, Base Ecosystem, RWA Protocol, E-commerce, Outlier Ventures Portfolio"
HANDY,handy,Handy,HANDY,5342052.0,10241720.0,55952.0,Ethereum Ecosystem
EVER,everscale,Everscale,EVER,5328992.0,5683230.0,22498.0,"Infrastructure, Layer 1 (L1), Ethereum Ecosystem"
FIO,fio-protocol,FIO Protocol,FIO,5196189.0,6157599.0,1224496.0,"Smart Contract Platform, Layer 1 (L1), YZi Labs (Prev. Binance Labs) Portfolio"
NS,suins-token,SuiNS Token,NS,5129403.0,9299261.0,421842.0,"Decentralized Identifier (DID), Sui Ecosystem, Name Service, Binance Alpha Spotlight"
BLZ,bluzelle,Bluzelle,BLZ,4723775.0,5034379.0,163424.0,"Smart Contract Platform, BNB Chain Ecosystem, Ethereum Ecosystem, DePIN, Decentralized Science (DeSci), Osmosis Ecosystem, Energi Ecosystem, GMCI DePIN Index, GMCI Index"
PUSS,puss,Puss,PUSS,4537578.0,4537578.0,444177.0,"Meme, Tron Ecosystem, TRON Meme"
NRS,nereus-token,Nereus,NRS,4224466.0,108299753.0,61863.0,"Decentralized Finance (DeFi), Derivatives, Polygon Ecosystem"
NTX,nunet,NuNet,NTX,3587868.0,4145032.0,82538.0,"BNB Chain Ecosystem, Cardano Ecosystem, Ethereum Ecosystem, DePIN"
REF,ref-finance,Ref Finance,REF,3554356.0,3702720.0,105.04,"Decentralized Finance (DeFi), Near Protocol Ecosystem, Alameda Research Portfolio, DragonFly Capital Portfolio, OKX Ventures Portfolio"
NODL,nodle-network,Nodle Network,NODL,3125062.0,3614175.0,64682.0,"ZkSync Ecosystem, DePIN"
XEN,xen-crypto,XEN Crypto,XEN,3079202.0,3079202.0,228771.0,"Smart Contract Platform, Decentralized Finance (DeFi), Layer 1 (L1), Avalanche Ecosystem, Ethereum Ecosystem, EthereumPoW Ecosystem"
HAI,hackenai,Hacken,HAI,3043953.0,3653449.0,95860.0,"BNB Chain Ecosystem, Ethereum Ecosystem, Base Ecosystem, Cybersecurity, VeChain Ecosystem, Base Native"
ZYPTO,french-connection-finance,Zypto Token,ZYPTO,2873942.0,2873942.0,1339.32,"Decentralized Finance (DeFi), BNB Chain Ecosystem, Wallets, Ethereum Ecosystem, Payment Solutions, Base Ecosystem"
PROS,prospective,Prospective,PROS,2708603.0,24183958.0,28762.0,"NFT, BNB Chain Ecosystem, Polygon Ecosystem, Ethereum Ecosystem, Tron Ecosystem, BitTorrent Ecosystem"
SEED,garden-2,Garden,SEED,2696412.0,30428282.0,2587.44,"Decentralized Exchange (DEX), Exchange-based Tokens, Decentralized Finance (DeFi), Arbitrum Ecosystem, Ethereum Ecosystem, BTCfi Protocol"
PNIC,phoenic-token,Phoenic Token,PNIC,2567934.0,28842985.0,92328.0,"Avalanche Ecosystem, Payment Solutions"
VAI,vai,Vai,VAI,2488304.0,2488304.0,1673.86,"Stablecoins, Decentralized Finance (DeFi), USD Stablecoin, BNB Chain Ecosystem, Crypto-backed Stablecoin, Fiat-backed Stablecoin"
HTR,hathor,Hathor,HTR,2462920.0,4165346.0,124363.0,"Infrastructure, Smart Contract Platform, Layer 1 (L1), Real World Assets (RWA), Proof of Work (PoW), Directed Acyclic Graph (DAG)"
MANEKI,maneki,MANEKI,MANEKI,2376126.0,2384276.0,180292.0,"Solana Ecosystem, Meme, Solana Meme, Cat-Themed"
DOBO,dogebonk,DogeBonk,DOBO,2197463.0,4041440.0,1.88,"Analytics, BNB Chain Ecosystem, Meme, Dog-Themed"
PSP,paraswap,ParaSwap,PSP,2101236.0,2128996.0,253.03,"Decentralized Exchange (DEX), Exchange-based Tokens, Decentralized Finance (DeFi), BNB Chain Ecosystem, Polygon Ecosystem, Ethereum Ecosystem, Optimism Ecosystem, Alameda Research Portfolio, Intent, Blockchain Capital Portfolio, Dex Aggregator"
VRA,verasity,Verasity,VRA,2093841.0,4832485.0,903239.0,"Entertainment, BNB Chain Ecosystem, Wallets, Ethereum Ecosystem, Binance Alpha Spotlight"
DEVVE,devve,DevvE,DEVVE,2056193.0,2823473.0,187233.0,"Layer 1 (L1), Ethereum Ecosystem"
NAP,napoli-fan-token,Napoli Fan Token,NAP,1942044.0,3511274.0,234463.0,"Sports, Fan Token, Chiliz Ecosystem"
BDC,billion-dollar-cat-runes,Billy (Bitcoin),BDC,1922406.0,1922406.0,8424.89,"Solana Ecosystem, Meme, Cat-Themed, Bitcoin Ecosystem, Runes, Bitcoin Meme"
NYA,nya,Nya,NYA,1876311.0,1879538.0,7293.79,"BNB Chain Ecosystem, Avalanche Ecosystem, Polygon Ecosystem, Meme, Arbitrum Ecosystem, Ethereum Ecosystem, Optimism Ecosystem, Base Ecosystem, Cat-Themed, Base Native"
SWASH,swash,Swash,SWASH,1829240.0,1838506.0,9116.32,"BNB Chain Ecosystem, Polygon Ecosystem, Gnosis Chain Ecosystem, Ethereum Ecosystem, Outlier Ventures Portfolio"
VOXEL,voxies,Voxies,VOXEL,1703602.0,2100943.0,717194.0,"Gaming (GameFi), NFT, Polygon Ecosystem, Binance Launchpad, RPG, Gaming Utility Token, Strategy Games, YZi Labs (Prev. Binance Labs) Portfolio"
BXX,baanx,Baanx,BXX,1624011.0,1624011.0,3823.21,"Ethereum Ecosystem, Payment Solutions, Crypto Card Issuer"
AA,arai,Arai,AA,1577567.0,10917421.0,1368221.0,"Artificial Intelligence (AI), Gaming (GameFi), BNB Chain Ecosystem, Animoca Brands Portfolio, Sequoia Capital Portfolio, Binance Alpha Spotlight"
DEFX,definity,DeFinity,DEFX,1496242.0,1676453.0,61201.0,"BNB Chain Ecosystem, Ethereum Ecosystem"
ONT,binance-peg-ontology,Binance-Peg Ontology,ONT,1431920.0,1431920.0,1876.23,"BNB Chain Ecosystem, Binance-Peg Tokens"
XMR,monero,Monero,XMR,6144656979.0,6144656979.0,106741351.0,"Smart Contract Platform, Privacy Coins, Layer 1 (L1), Proof of Work (PoW), Galaxy Digital Portfolio, Privacy"
MNT,mantle,Mantle,MNT,2287831231.0,4340753521.0,42063894.0,"Smart Contract Platform, Ethereum Ecosystem, Layer 2 (L2), Mantle Ecosystem, DWF Labs Portfolio, DragonFly Capital Portfolio, GMCI Layer 2 Index, GMCI 30 Index, GMCI Index, World Liberty Financial Portfolio, Made in China, Neobank"
MORPHO,morpho,Morpho,MORPHO,853951322.0,1547442664.0,7866706.0,"Decentralized Finance (DeFi), Lending/Borrowing Protocols, Arbitrum Ecosystem, Ethereum Ecosystem, Base Ecosystem, Coinbase Ventures Portfolio, Pantera Capital Portfolio, Morpho Ecosystem, Binance Alpha Spotlight, Katana Ecosystem, Base Native"
XRP,binance-peg-xrp,Binance-Peg XRP,XRP,436763043.0,436763043.0,1905434.0,"Crypto-Backed Tokens, BNB Chain Ecosystem, Binance-Peg Tokens"
VIRTUAL,virtual-protocol,Virtuals Protocol,VIRTUAL,434716528.0,662372731.0,56935415.0,"Artificial Intelligence (AI), Solana Ecosystem, Launchpad, Ethereum Ecosystem, Base Ecosystem, AI Agents, Virtuals Protocol Ecosystem, AI Agent Launchpad, Binance Alpha Spotlight, AI Framework, Robotics, Base Native"
JASMY,jasmycoin,JasmyCoin,JASMY,265944359.0,268929478.0,11285914.0,"Internet of Things (IOT), Ethereum Ecosystem, DePIN, DWF Labs Portfolio, Coinbase 50 Index"
SPX,spx6900,SPX6900,SPX,250921059.0,250921059.0,4088921.0,"Solana Ecosystem, Avalanche Ecosystem, Meme, Ethereum Ecosystem, Base Ecosystem, Bridged-Tokens, Murad Picks, Stock market-themed, 4chan-Themed, Base Native"
DOGE,binance-peg-dogecoin,Binance-Peg Dogecoin,DOGE,236909880.0,236909880.0,512346.0,"BNB Chain Ecosystem, Avalanche Ecosystem, Meme, Binance-Peg Tokens"
SAND,the-sandbox,The Sandbox,SAND,205233895.0,230834242.0,17196735.0,"Gaming (GameFi), NFT, Metaverse, Polygon Ecosystem, Play To Earn, Ethereum Ecosystem, Animoca Brands Portfolio, Base Ecosystem, Alleged SEC Securities, Binance Launchpad, Gaming Utility Token, Simulation Games, YZi Labs (Prev. Binance Labs) Portfolio, Coinbase 50 Index"
STRK,starknet,Starknet,STRK,197000748.0,346086070.0,14893070.0,"Infrastructure, Smart Contract Platform, Solana Ecosystem, Ethereum Ecosystem, Layer 2 (L2), Zero Knowledge (ZK), Starknet Ecosystem, Paradigm Portfolio, Coinbase Ventures Portfolio, Rollup, Multicoin Capital Portfolio, Bitcoin Sidechains, Alameda Research Portfolio, Pantera Capital Portfolio, GMCI Layer 2 Index, Consensys Portfolio, Sequoia Capital Portfolio, GMCI Index, Privacy Blockchain, Polychain Capital Portfolio, Quantum-Resistant"
WEFI,wefi,WeFi,WFI,182556407.0,2222755073.0,3304469.0,"BNB Chain Ecosystem, Payment Solutions"
XCN,chain-2,Onyxcoin,XCN,180389118.0,255336402.0,6401000.0,"Smart Contract Platform, BNB Chain Ecosystem, Layer 1 (L1), Ethereum Ecosystem, Base Ecosystem, Proof of Stake (PoS), Pantera Capital Portfolio, Made in USA, Base Native"
WAL,walrus-2,Walrus,WAL,160697038.0,358298859.0,7960707.0,"Infrastructure, Storage, Sui Ecosystem, Binance Alpha Spotlight"
GRASS,grass,Grass,GRASS,160619914.0,284447292.0,9380784.0,"Artificial Intelligence (AI), Solana Ecosystem, DePIN, Polychain Capital Portfolio, Binance Alpha Spotlight"
XEC,ecash,eCash,XEC,134451342.0,134452224.0,3417853.0,"Smart Contract Platform, Layer 1 (L1), Bitcoin Fork, Proof of Work (PoW)"
SOSO,sosovalue,SoSoValue,SOSO,127417259.0,408386624.0,3433783.0,"Index, Decentralized Finance (DeFi), Analytics, Ethereum Ecosystem, Base Ecosystem, Base Native"
JTO,jito-governance-token,Jito,JTO,125407492.0,276296134.0,10831260.0,"Decentralized Finance (DeFi), Solana Ecosystem, Liquid Staking Governance Tokens, Multicoin Capital Portfolio, Alameda Research Portfolio, Delphi Ventures Portfolio, Liquid Staking, Made in USA"
GOMINING,gmt-token,GoMining Token,GOMINING,117510333.0,117510333.0,13115014.0,"Gaming (GameFi), BNB Chain Ecosystem, Ethereum Ecosystem, TON Ecosystem"
ZEN,zencash,Horizen,ZEN,100128560.0,117150066.0,23668457.0,"Zero Knowledge (ZK), Base Ecosystem, Made in USA, Privacy Infrastructure, Base Native, Horizen Ecosystem, Privacy"
FORM,four,Four,FORM,90066403.0,134981921.0,3282163.0,"Gaming (GameFi), BNB Chain Ecosystem, Launchpad"
ZRX,0x,0x Protocol,ZRX,87443363.0,103068973.0,12249607.0,"Decentralized Exchange (DEX), Exchange-based Tokens, Decentralized Finance (DeFi), Ethereum Ecosystem, Coinbase Ventures Portfolio, Pantera Capital Portfolio, GMCI DeFi Index, Blockchain Capital Portfolio, GMCI Index, Made in USA, Governance"
AMP,amp-token,Amp,AMP,86609841.0,102474049.0,15953850.0,"Decentralized Finance (DeFi), Near Protocol Ecosystem, Ethereum Ecosystem, Payment Solutions, Alleged SEC Securities, Pantera Capital Portfolio, Energi Ecosystem, Made in USA"
OM,mantra-dao,MANTRA [Old],OM,74103385.0,107667241.0,92951.0,"Infrastructure, Smart Contract Platform, BNB Chain Ecosystem, Cosmos Ecosystem, Layer 1 (L1), Real World Assets (RWA), Osmosis Ecosystem, Mantra Ecosystem, Mantra EVM Ecosystem"
BC,bc-token,BCGame Coin,BC,67199338.0,67199338.0,9967.99,"Gambling (GambleFi), Solana Ecosystem"
GMX,gmx,GMX,GMX,66421040.0,66421040.0,8367956.0,"Decentralized Finance (DeFi), Derivatives, Perpetuals, Avalanche Ecosystem, Arbitrum Ecosystem"
BBT,babyboomtoken,BabyBoomToken,BBT,65797079.0,385046256.0,152395.0,"Healthcare, Marketing, BNB Chain Ecosystem"
XPR,proton,XPR Network,XPR,65146050.0,71990796.0,933611.0,"Smart Contract Platform, BNB Chain Ecosystem, Ethereum Ecosystem, DWF Labs Portfolio, Made in USA, Governance"
ASTR,astar,Astar,ASTR,64738533.0,65434325.0,2203471.0,"Smart Contract Platform, Polkadot Ecosystem, Layer 1 (L1), Ethereum Ecosystem, Layer 2 (L2), Alameda Research Portfolio, YZi Labs (Prev. Binance Labs) Portfolio, OKX Ventures Portfolio"
