ADS,adshares,Adshares,ADS,32829935,32843678.0,1295719.0,"Business Services, Decentralized Finance (DeFi), BNB Chain Ecosystem, Metaverse, Polygon Ecosystem, Ethereum Ecosystem, Base Ecosystem"
CETUS,cetus-protocol,Cetus Protocol,CETUS,32467213,37793972.0,11740527.0,"Decentralized Exchange (DEX), Exchange-based Tokens, Decentralized Finance (DeFi), Sui Ecosystem, Animoca Brands Portfolio, OKX Ventures Portfolio, Dex Aggregator"
ALI,alethea-artificial-liquid-intelligence-token,Artificial Liquid Intelligence,ALI,30338984,32843847.0,1501541.0,"Artificial Intelligence (AI), NFT, Metaverse, Solana Ecosystem, Polygon Ecosystem, Ethereum Ecosystem, Cronos Ecosystem, Base Ecosystem, Multicoin Capital Portfolio, AI Agents, Alameda Research Portfolio, DeFiance Capital Portfolio, YZi Labs (Prev. Binance Labs) Portfolio, Airdropped Tokens by NFT Projects, Governance"
SCR,scroll,Scroll,SCR,29834324,157022756.0,15815724.0,"Smart Contract Platform, Binance Launchpool, Layer 2 (L2), Scroll Ecosystem"
AVAIL,avail,Avail,AVAIL,28154353,84407213.0,4502768.0,"Infrastructure, Smart Contract Platform, BNB Chain Ecosystem, Ethereum Ecosystem, Data Availability, Modular Blockchain, Binance Alpha Spotlight"
AGLD,adventure-gold,Adventure Gold,AGLD,28101800,29837868.0,6874463.0,"Ethereum Ecosystem, DWF Labs Portfolio"
ZRC,zircuit,Zircuit,ZRC,27977983,127466783.0,10591648.0,"Smart Contract Platform, BNB Chain Ecosystem, Ethereum Ecosystem, Layer 2 (L2), Zero Knowledge (ZK), Restaking, Zircuit Ecosystem"
HFT,hashflow,Hashflow,HFT,26500173,42591152.0,14960104.0,"Decentralized Exchange (DEX), Exchange-based Tokens, Decentralized Finance (DeFi), BNB Chain Ecosystem, Binance Launchpool, MEV Protection, Ethereum Ecosystem, Coinbase Ventures Portfolio, Alameda Research Portfolio, DragonFly Capital Portfolio, Galaxy Digital Portfolio"
NCT,polyswarm,PolySwarm,NCT,26410292,26416067.0,515143.0,"Business Services, Polygon Ecosystem, Ethereum Ecosystem, Cybersecurity, Made in USA"
DODO,dodo,DODO,DODO,26356856,26356856.0,2991730.0,"Decentralized Exchange (DEX), Exchange-based Tokens, Decentralized Finance (DeFi), BNB Chain Ecosystem, Binance Launchpool, Polygon Ecosystem, Near Protocol Ecosystem, Arbitrum Ecosystem, Ethereum Ecosystem, DWF Labs Portfolio, Coinbase Ventures Portfolio, Alameda Research Portfolio, DeFiance Capital Portfolio, Pantera Capital Portfolio, Aurora Ecosystem, Energi Ecosystem, YZi Labs (Prev. Binance Labs) Portfolio, Galaxy Digital Portfolio, Made in China"
FORTH,ampleforth-governance-token,Ampleforth Governance,FORTH,23485268,31231691.0,2102295.0,"Ethereum Ecosystem, Stablecoin Issuer, Governance"
ELX,elixir-finance,Elixir,ELX,21454137,82748174.0,8462659.0,"Decentralized Finance (DeFi), Ethereum Ecosystem, Real World Assets (RWA), Stablecoin Issuer, RWA Protocol"
INV,inverse-finance,Inverse Finance,INV,19199749,23116946.0,281766.0,"Decentralized Finance (DeFi), Yield Farming, Yield Aggregator, Olympus Pro Ecosystem, Ethereum Ecosystem, Fixed Interest"
SYN,synapse-2,Synapse,SYN,16606924,18951919.0,10591202.0,"BNB Chain Ecosystem, Avalanche Ecosystem, Polygon Ecosystem, Fantom Ecosystem, Arbitrum Ecosystem, Olympus Pro Ecosystem, Ethereum Ecosystem, Optimism Ecosystem, Bridge Governance Tokens, Base Ecosystem, Alameda Research Portfolio, Intent"
CWEB,coinweb,Coinweb,CWEB,16211733,19373099.0,114276.0,"Smart Contract Platform, Wallets, Ethereum Ecosystem, Interoperability, Layer 2 (L2), Cross-chain Communication, Bitcoin Sidechains, SideChain"
CHEQ,cheqd-network,CHEQD Network,CHEQ,14146582,18403893.0,575668.0,"Smart Contract Platform, Ethereum Ecosystem, Decentralized Identifier (DID), Zero Knowledge (ZK), Animoca Brands Portfolio, Osmosis Ecosystem, Outlier Ventures Portfolio"
PORTAL,portal-2,Portal,PORTAL,13122718,22151286.0,10818432.0,"Gaming (GameFi), Solana Ecosystem, Ethereum Ecosystem, Gaming Platform"
ALU,altura,Altura,ALU,13005066,13005066.0,4130743.0,"Artificial Intelligence (AI), Infrastructure, Gaming (GameFi), NFT, BNB Chain Ecosystem, NFT Marketplace, Base Ecosystem, Gaming Platform, Made in USA, Gaming Marketplace"
OCTA,octaspace,OctaSpace,OCTA,12797816,12797908.0,260449.0,"Artificial Intelligence (AI), Internet of Things (IOT), Smart Contract Platform, BNB Chain Ecosystem, Layer 1 (L1), Ethereum Ecosystem, DePIN, AI Agents"
D,dar-open-network,Dar Open Network,D,11522620,14333567.0,1113937.0,"Gaming (GameFi), BNB Chain Ecosystem, Binance Launchpool, Play To Earn, Ethereum Ecosystem, Animoca Brands Portfolio, AI Agents"
FLAY,flayer,Flayer,FLAY,10879296,18132160.0,224136.0,"Launchpad, Ethereum Ecosystem"
KENDU,kendu-inu,Kendu,KENDU,8620191,8658518.0,118571.0,"Solana Ecosystem, Meme, Ethereum Ecosystem, Base Ecosystem, Dog-Themed"
UPC,upcx,UPCX,UPC,8313086,1562944301.0,517359.0,Ethereum Ecosystem
TKO,tokocrypto,Tokocrypto,TKO,8237906,54919375.0,1301862.0,"BNB Chain Ecosystem, Binance Launchpad, YZi Labs (Prev. Binance Labs) Portfolio"
EVR,evernode,Evernode,EVR,8146264,16273021.0,24203.0,"Smart Contract Platform, Layer 2 (L2), DePIN"
SWEAT,sweatcoin,SWEAT,SWEAT,8082980,21928884.0,2663612.0,"Sports, Gaming (GameFi), BNB Chain Ecosystem, Solana Ecosystem, Avalanche Ecosystem, Polygon Ecosystem, Near Protocol Ecosystem, Play To Earn, Arbitrum Ecosystem, Celo Ecosystem, Move To Earn, Ethereum Ecosystem, Optimism Ecosystem, Aptos Ecosystem, Sui Ecosystem, Base Ecosystem, Gaming Governance Token, Gaming Utility Token, OKX Ventures Portfolio"
IZI,izumi-finance,iZUMi Finance,IZI,8060764,20474381.0,299855.0,"Decentralized Exchange (DEX), Exchange-based Tokens, Decentralized Finance (DeFi), Automated Market Maker (AMM), BNB Chain Ecosystem, Polygon Ecosystem, Arbitrum Ecosystem, Ethereum Ecosystem, ZkSync Ecosystem, Mantle Ecosystem, Linea Ecosystem, Base Ecosystem, Manta Network Ecosystem, Scroll Ecosystem"
KASTA,kasta,Kasta,KASTA,6386391,12541318.0,355543.0,Polygon Ecosystem
SNAI,swarmnode-ai,SwarmNode.ai,SNAI,5973330,5973330.0,1408275.0,"Artificial Intelligence (AI), Infrastructure, Solana Ecosystem, Pump.fun Ecosystem, AI Agent Launchpad, Binance Alpha Spotlight, AI Framework, DeFAI"
J,jambo,Jambo,J,5761832,35786063.0,1791446.0,"Solana Ecosystem, Paradigm Portfolio, Coinbase Ventures Portfolio"
MAVIA,heroes-of-mavia,Heroes of Mavia,MAVIA,5595338,27099114.0,23779980.0,"Gaming (GameFi), NFT, BNB Chain Ecosystem, Ethereum Ecosystem, Animoca Brands Portfolio, Base Ecosystem, Gaming Governance Token, Strategy Games, Alameda Research Portfolio, YZi Labs (Prev. Binance Labs) Portfolio, Delphi Ventures Portfolio, Action Games"
QBX,qbx,QBX,QBX,4853878,4853878.0,62428.0,Ethereum Ecosystem
BASEDAI,basedai,BasedAI,BASEDAI,4841698,4841698.0,89254.0,"Artificial Intelligence (AI), Ethereum Ecosystem, AI Agents"
GHUB,gemhub,GemHUB,GHUB,4758787,23538471.0,171646.0,Kaia Ecosystem
STAT,stat,STAT,STAT,4194252,5354437.0,181619.0,"Media, Ethereum Ecosystem"
TICO,tico,Funtico,TICO,4161870,19454581.0,164504.0,"Gaming (GameFi), Avalanche Ecosystem, RPG"
POR,portugal-national-team-fan-token,Portugal National Team Fan Token,POR,3855059,11676606.0,145766.0,"Sports, Fan Token, Chiliz Ecosystem"
ALVA,alvara-protocol,Alvara Protocol,ALVA,3778016,9270233.0,245767.0,"Decentralized Finance (DeFi), Avalanche Ecosystem, Ethereum Ecosystem"
SHIDO,shido-2,Shido Network,SHIDO,3754105,3754111.0,149442.0,"Ethereum Ecosystem, Osmosis Ecosystem, Shido Network Ecosystem"
SRM,serum,Serum,SRM,3720484,10906934.0,11200.98,"Decentralized Exchange (DEX), Exchange-based Tokens, Decentralized Finance (DeFi), Solana Ecosystem, Ethereum Ecosystem, FTX Holdings, Multicoin Capital Portfolio, Energi Ecosystem, Viction Ecosystem"
MODE,mode,Mode,MODE,3690449,7154343.0,579042.0,"Artificial Intelligence (AI), Infrastructure, Smart Contract Platform, Ethereum Ecosystem, Optimism Ecosystem, Layer 2 (L2), Mode Ecosystem, Optimism Superchain Ecosystem, DeFAI"
DEOD,decentrawood,Decentrawood,DEOD,3620239,3620239.0,211710.0,"Gaming (GameFi), BNB Chain Ecosystem, Metaverse, Solana Ecosystem, Polygon Ecosystem"
4EVER,4everland,4EVERLAND,4EVER,3594607,12575885.0,51282.0,"Artificial Intelligence (AI), BNB Chain Ecosystem, Ethereum Ecosystem, DePIN, AI Framework"
GTAI,gt-protocol,GT Protocol,GTAI,3386930,6260194.0,870487.0,"Artificial Intelligence (AI), BNB Chain Ecosystem, DeFAI"
WINR,winr-protocol,WINR Protocol,WINR,3380880,3499266.0,21250.0,"Gambling (GambleFi), Infrastructure, Smart Contract Platform, Solana Ecosystem, Arbitrum Ecosystem, Camelot Launchpad, Layer 3 (L3)"
ALON,alon,Alon,ALON,3035749,3035749.0,636178.0,"Solana Ecosystem, Pump.fun Ecosystem, Binance Alpha Spotlight"
GLQ,graphlinq-protocol,GraphLinq Chain,GLQ,2972226,4370921.0,180345.0,"Artificial Intelligence (AI), Business Services, Infrastructure, Smart Contract Platform, Analytics, Layer 1 (L1), Ethereum Ecosystem, DWF Labs Portfolio, AI Agents, DeFAI"
RMV,reality-metaverse,Reality Metaverse,RMV,2957538,3961809.0,115333.0,"Gaming (GameFi), NFT, Metaverse, Polygon Ecosystem, Play To Earn, Ethereum Ecosystem, DWF Labs Portfolio, Gaming Utility Token"
CDX,cod3x,Cod3x,CDX,2733447,2733447.0,17431.11,"Artificial Intelligence (AI), Solana Ecosystem, Base Ecosystem, AI Agent Launchpad, AI Framework, DeFAI, x402 Ecosystem"
MASK,catwifmask,catwifmask,MASK,2720121,2720121.0,620841.0,"Solana Ecosystem, Meme, Solana Meme, Cat-Themed, Pump.fun Ecosystem"
FLIX,omniflix-network,OmniFlix Network,FLIX,2719190,2988761.0,2722.13,"NFT, Osmosis Ecosystem, Archway Ecosystem"
ZYN,zyncoin-2,ZynCoin,ZYN,2279758,2279758.0,74294.0,"Solana Ecosystem, Meme, Ethereum Ecosystem, Parody Meme"
ALEX,alexgo,ALEX Lab,ALEX,2162441,2468090.0,531548.0,"Decentralized Finance (DeFi), Ethereum Ecosystem, DWF Labs Portfolio, Mode Ecosystem, Stacks Ecosystem, BTCfi Protocol"
OFN,openfabric,Openfabric AI,OFN,1888109,1888109.0,85230.0,"Artificial Intelligence (AI), BNB Chain Ecosystem, ChainGPT Launchpad, Poolz Finance Launchpad, AI Agents, AI Applications, AI Framework, Governance"
CORE,core-2,Core,CORE,1806993,1806993.0,55815.0,"Solana Ecosystem, Pump.fun Ecosystem"
GENOME,genomesdao-genome,GenomesDAO GENOME,GENOME,1752719,1752719.0,66684.0,"Ethereum Ecosystem, Base Ecosystem, Decentralized Science (DeSci)"
SMURFCAT,real-smurf-cat,Real Smurf Cat,SMURFCAT,1718346,1718346.0,363460.0,"Solana Ecosystem, Meme, Arbitrum Ecosystem, Ethereum Ecosystem, Cat-Themed"
TREAT,shiba-inu-treat,Shiba Inu Treat,TREAT,1512039,7027424.0,347813.0,"Meme, Ethereum Ecosystem, Dog-Themed"
MLG,360noscope420blazeit,360noscope420blazeit,MLG,1433783,1433783.0,236862.0,"Solana Ecosystem, Meme, Solana Meme"
SLN,smart-layer-network,Smart Layer Network,SLN,1195865,1518451.0,47930.0,"Infrastructure, BNB Chain Ecosystem, Polygon Ecosystem, Ethereum Ecosystem, Optimism Ecosystem, ZkSync Ecosystem, Linea Ecosystem, Base Ecosystem, Scroll Ecosystem, Polygon zkEVM Ecosystem, Mint Ecosystem"
SOLAMA,solama,Solama,SOLAMA,1068293,1068293.0,161135.0,"Gambling (GambleFi), Solana Ecosystem, Meme, Solana Meme"
LUCE,offcial-mascot-of-the-holy-year,Luce,LUCE,1026482,1026482.0,655409.0,"Solana Ecosystem, Meme, Solana Meme, Pump.fun Ecosystem, Mascot-Themed, Binance Alpha Spotlight"
BAX,babb,BABB,BAX,1005636,1010690.0,10322.21,Ethereum Ecosystem
HXD,honeyland-honey,Honeyland,HXD,984725,2244637.0,19570.7,"Gaming (GameFi), NFT, Solana Ecosystem, Play To Earn, Breeding, Gaming Utility Token, Strategy Games"
STETH,staked-ether,Lido Staked Ether,STETH,29397483047,29397524898.0,127611447.0,"Decentralized Finance (DeFi), Liquid Staking Tokens, Ethereum Ecosystem, Liquid Staked ETH, Liquid Staking"
HTX,htx-dao,HTX DAO,HTX,1653649284,1653649284.0,13186706.0,"Exchange-based Tokens, BNB Chain Ecosystem, Centralized Exchange (CEX) Token, Ethereum Ecosystem, Tron Ecosystem"
VET,vechain,VeChain,VET,1299016153,1299016153.0,39274371.0,"Internet of Things (IOT), Smart Contract Platform, Layer 1 (L1), VeChain Ecosystem, Made in China"
TWT,trust-wallet-token,Trust Wallet,TWT,498701087,1196930773.0,28689111.0,"BNB Chain Ecosystem, Wallets, Account Abstraction, Energi Ecosystem"
GALA,gala,GALA,GALA,416763833,416763833.0,68611816.0,"Smart Contract Platform, Gaming (GameFi), NFT, Layer 1 (L1), Play To Earn, Ethereum Ecosystem, DWF Labs Portfolio, Gaming Platform, YZi Labs (Prev. Binance Labs) Portfolio, GalaChain Ecosystem, Made in USA"
KAITO,kaito,KAITO,KAITO,208114678,862155166.0,16636513.0,"Artificial Intelligence (AI), Analytics, Launchpad, Base Ecosystem, Binance HODLer Airdrops, InfoFi, Governance"
JELLYJELLY,jelly-my-jelly,Jelly-My-Jelly,JELLYJELLY,191996886,191996886.0,119194015.0,"Solana Ecosystem, Pump.fun Ecosystem"
MOCA,mocaverse,Moca Network,MOCA,168961430,379963635.0,17951466.0,"Gaming (GameFi), Ethereum Ecosystem, Decentralized Identifier (DID), Animoca Brands Portfolio, Base Ecosystem, OKX Ventures Portfolio, Outlier Ventures Portfolio"
ZRO,layerzero,LayerZero,ZRO,163076065,1467133397.0,44252682.0,"Smart Contract Platform, BNB Chain Ecosystem, Avalanche Ecosystem, Polygon Ecosystem, Arbitrum Ecosystem, Ethereum Ecosystem, Optimism Ecosystem, Base Ecosystem, Multicoin Capital Portfolio, Layer 0 (L0), Cross-chain Communication, Circle Ventures Portfolio, Sequoia Capital Portfolio, OKX Ventures Portfolio"
SAROS,saros-finance,Saros,SAROS,160112220,609951353.0,4265550.0,"Decentralized Exchange (DEX), Exchange-based Tokens, Decentralized Finance (DeFi), Solana Ecosystem, Viction Ecosystem, Binance Alpha Spotlight"
BLUR,blur,Blur,BLUR,109675059,127116192.0,13315695.0,"NFT, Ethereum Ecosystem, NFT Marketplace, FTX Holdings, NFTFi, eGirl Capital Portfolio, Paradigm Portfolio, GMCI DeFi Index, GMCI Index, Made in USA, Coinbase 50 Index"
HSK,hashkey-ecopoints,HashKey Platform Token,HSK,101223551,303327885.0,1755062.0,"Exchange-based Tokens, Centralized Exchange (CEX) Token, Ethereum Ecosystem, Governance"
HOT,holotoken,Holo,HOT,99646916,99646916.0,5006109.0,"Smart Contract Platform, Storage, Harmony Ecosystem, Arbitrum Ecosystem, Ethereum Ecosystem, DePIN, Base Ecosystem, Energi Ecosystem, Sora Ecosystem, GMCI DePIN Index, GMCI Index"
EDU,edu-coin,Open Campus,EDU,97379933,162480331.0,10109244.0,"Education, BNB Chain Ecosystem, Polygon Ecosystem, Ethereum Ecosystem, Binance Launchpad, YZi Labs (Prev. Binance Labs) Portfolio"
CSPR,casper-network,Casper Network,CSPR,97213844,100648106.0,5885826.0,"Smart Contract Platform, Layer 1 (L1), Real World Assets (RWA), Proof of Stake (PoS), GMCI Layer 1 Index, GMCI Index, Made in USA"
MPLX,metaplex,Metaplex,MPLX,92278316,162563445.0,7253709.0,"Gaming (GameFi), NFT, BNB Chain Ecosystem, Solana Ecosystem, Launchpad, Animoca Brands Portfolio, FTX Holdings, Multicoin Capital Portfolio, Alameda Research Portfolio, Binance Alpha Spotlight"
ANKR,ankr,Ankr Network,ANKR,88236641,88236641.0,6064681.0,"BNB Chain Ecosystem, Avalanche Ecosystem, Polygon Ecosystem, Fantom Ecosystem, Arbitrum Ecosystem, Ethereum Ecosystem, Optimism Ecosystem, Liquid Staking Governance Tokens, Linea Ecosystem, DePIN, Scroll Ecosystem, Rollups-as-a-Service (RaaS), Blast Ecosystem, Mode Ecosystem, Pantera Capital Portfolio, Polygon zkEVM Ecosystem, YZi Labs (Prev. Binance Labs) Portfolio, Liquid Staking, Made in USA, Governance"
GOHOME,gohome,GOHOME,GOHOME,79522846,1515762006.0,3389496.0,"Solana Ecosystem, Meme"
XVS,venus,Venus,XVS,70667949,125505162.0,5876034.0,"Decentralized Finance (DeFi), Yield Farming, BNB Chain Ecosystem, Binance Launchpool, Lending/Borrowing Protocols, Arbitrum Ecosystem, Ethereum Ecosystem, Optimism Ecosystem, ZkSync Ecosystem, opBNB Ecosystem, Unichain Ecosystem"
BLAST,blast,Blast,BLAST,56265322,114375974.0,4858323.0,"Smart Contract Platform, Layer 2 (L2), eGirl Capital Portfolio, Paradigm Portfolio, Blast Ecosystem"
ACT,acet-token,Acet,ACT,52120677,67998713.0,11209.22,BNB Chain Ecosystem
ZEREBRO,zerebro,Zerebro,ZEREBRO,45731585,45731585.0,16240344.0,"Solana Ecosystem, Meme, Solana Meme, AI Meme, Pump.fun Ecosystem, Binance Alpha Spotlight"
CTK,certik,Shentu,CTK,41547130,42315186.0,2633919.0,"Business Services, Binance Launchpool, Osmosis Ecosystem, Coinbase Ventures Portfolio, Cybersecurity, YZi Labs (Prev. Binance Labs) Portfolio, OKX Ventures Portfolio"
PHA,pha,PHALA,PHA,41398744,50674921.0,11844919.0,"Artificial Intelligence (AI), Infrastructure, Smart Contract Platform, Oracle, Polkadot Ecosystem, Ethereum Ecosystem, Interoperability, Layer 2 (L2), Zero Knowledge (ZK), DePIN, DWF Labs Portfolio, Rollup, AI Agents, Sora Ecosystem, AI Framework, Made in USA"
RIF,rif-token,Rootstock Infrastructure Framework,RIF,40938288,40938288.0,1894051.0,"Solana Ecosystem, Arbitrum Ecosystem, Ethereum Ecosystem, Base Ecosystem, Rootstock Ecosystem, Outlier Ventures Portfolio"
OMI,ecomi,ECOMI,OMI,33700434,38666955.0,3655197.0,"Gaming (GameFi), NFT, Metaverse, Collectibles, Play To Earn, Ethereum Ecosystem, Base Ecosystem, Energi Ecosystem"
GLMR,moonbeam,Moonbeam,GLMR,33023143,38776730.0,3941705.0,"Smart Contract Platform, Polkadot Ecosystem, Layer 1 (L1), Coinbase Ventures Portfolio, Proof of Stake (PoS), YZi Labs (Prev. Binance Labs) Portfolio"
C98,coin98,Coin98,C98,32341982,32342017.0,9947020.0,"Decentralized Finance (DeFi), BNB Chain Ecosystem, Perpetuals, Solana Ecosystem, Wallets, Polygon Ecosystem, Ethereum Ecosystem, Binance Launchpad, DWF Labs Portfolio, Multicoin Capital Portfolio, Alameda Research Portfolio, Viction Ecosystem, YZi Labs (Prev. Binance Labs) Portfolio"
QI,benqi,BENQI,QI,31019593,31019593.0,1234647.0,"Decentralized Finance (DeFi), Yield Farming, Binance Launchpool, Lending/Borrowing Protocols, Avalanche Ecosystem, Liquid Staking Governance Tokens, DragonFly Capital Portfolio, Liquid Staking"
KUJI,kujira,Kujira,KUJI,30629900,30637971.0,723.28,"Smart Contract Platform, Decentralized Finance (DeFi), BNB Chain Ecosystem, Layer 1 (L1), Arbitrum Ecosystem, Ethereum Ecosystem, Optimism Ecosystem, Osmosis Ecosystem, Secret Ecosystem"
SFI,saffron-finance,saffron.finance,SFI,29400350,33836244.0,648227.0,"Decentralized Finance (DeFi), Yield Farming, Ethereum Ecosystem, Fixed Interest, Coinbase Ventures Portfolio, Multicoin Capital Portfolio, DragonFly Capital Portfolio, Energi Ecosystem"
SSV,ssv-network,SSV Network,SSV,28367526,58025492.0,16875794.0,"Decentralized Finance (DeFi), Ethereum Ecosystem, Restaking, Coinbase Ventures Portfolio, OKX Ventures Portfolio, Liquid Staking"
WILD,wilder-world,Wilder World,WILD,23699448,30063637.0,3793035.0,"Gaming (GameFi), NFT, BNB Chain Ecosystem, Metaverse, Solana Ecosystem, Avalanche Ecosystem, Polygon Ecosystem, Play To Earn, Ethereum Ecosystem, Animoca Brands Portfolio, Base Ecosystem, Gaming Governance Token, Racing Games, Simulation Games, Action Games"
MMUI,metamui,MetaMUI,MMUI,22198762,37318629.0,994065.0,Avalanche Ecosystem
TRIBE,tribe-2,Tribe,TRIBE,22090349,538724220.0,75126.0,"Decentralized Finance (DeFi), Ethereum Ecosystem, Stablecoin Issuer"
STORJ,storj,Storj,STORJ,21350342,63106314.0,6331607.0,"Storage, Harmony Ecosystem, Ethereum Ecosystem, DePIN, Energi Ecosystem"
PHB,phoenix-global,Phoenix,PHB,20730985,20730985.0,6232082.0,"Artificial Intelligence (AI), Oracle, NFT, BNB Chain Ecosystem, DePIN, Made in China"
NEON,neon,Neon,NEON,18803647,78523408.0,597887.0,"Smart Contract Platform, Solana Ecosystem, Neon Ecosystem, Parallelized EVM"
BR,bedrock-token,Bedrock,BR,18763716,85289620.0,4174032.0,"Decentralized Finance (DeFi), BNB Chain Ecosystem, Ethereum Ecosystem, Liquid Staking Governance Tokens, Base Ecosystem, Berachain Ecosystem, BTCfi Protocol, Binance Wallet IDO"
OORT,oort,OORT,OORT,17855980,56607051.0,478904.0,"Artificial Intelligence (AI), Storage, BNB Chain Ecosystem, Ethereum Ecosystem, DePIN, AI Agents, Made in USA"
DREAMS,daydreams,Daydreams,DREAMS,17795249,21655317.0,24655439.0,"Artificial Intelligence (AI), Solana Ecosystem, Base Ecosystem, Starknet Ecosystem, AI Framework, x402 Ecosystem"
MNSRY,mansory-token,Mansory Token,MNSRY,17346823,17346823.0,1721768.0,"Retail, BNB Chain Ecosystem, Solana Ecosystem, Real World Assets (RWA), Pump.fun Ecosystem"
RACA,radio-caca,Radio Caca,RACA,15647585,15799625.0,2308498.0,"Gaming (GameFi), NFT, BNB Chain Ecosystem, Metaverse, Play To Earn, Ethereum Ecosystem, DWF Labs Portfolio, OKT Chain Ecosystem"
LAT,platon-network,PlatON Network,LAT,15147491,23030939.0,3301394.0,"Smart Contract Platform, Appchains"
PIKA,pikaboss,Pikaboss,PIKA,15028329,15028329.0,6590.76,"Meme, Ethereum Ecosystem"
BEL,bella-protocol,Bella Protocol,BEL,14943752,18679689.0,8626966.0,"Decentralized Finance (DeFi), Yield Farming, BNB Chain Ecosystem, Binance Launchpool, Yield Aggregator, Ethereum Ecosystem, Manta Network Ecosystem, YZi Labs (Prev. Binance Labs) Portfolio"
PNG,pangolin,Pangolin,PNG,14800049,35487300.0,622922.0,"Decentralized Exchange (DEX), Exchange-based Tokens, Decentralized Finance (DeFi), Avalanche Ecosystem, Olympus Pro Ecosystem"
AVA,ava-ai,Ava AI,AVA,14126051,14126051.0,1902343.0,"Artificial Intelligence (AI), Solana Ecosystem, Meme, AI Meme, AI Agents, Pump.fun Ecosystem, Binance Alpha Spotlight, Made in USA"
GHST,aavegotchi,Aavegotchi,GHST,13955770,14389678.0,2062238.0,"Smart Contract Platform, Gaming (GameFi), NFT, Metaverse, Collectibles, Polygon Ecosystem, Meme, Play To Earn, Ethereum Ecosystem, Gotchiverse, Base Ecosystem, Layer 3 (L3), RPG, Gaming Governance Token, Gaming Utility Token, Energi Ecosystem, Governance"
PROPC,propchain,Propchain,PROPC,13257701,19833629.0,231244.0,"Ethereum Ecosystem, Real World Assets (RWA)"
UFD,unicorn-fart-dust,Unicorn Fart Dust,UFD,13234928,13234928.0,4626005.0,"Solana Ecosystem, Meme, Solana Meme, Pump.fun Ecosystem, Binance Alpha Spotlight, Made in USA"
QUICK,quick,Quickswap [OLD],QUICK,12143648,16964532.0,15202.51,"Decentralized Exchange (DEX), Exchange-based Tokens, Decentralized Finance (DeFi), Yield Farming, Automated Market Maker (AMM), Polygon Ecosystem, Ethereum Ecosystem"
DYDX,dydx,dYdX,ETHDYDX,11870879,246972068.0,17709643.0,"Decentralized Exchange (DEX), Exchange-based Tokens, Decentralized Finance (DeFi), Derivatives, Perpetuals, Ethereum Ecosystem, Paradigm Portfolio"
M87,messier,MESSIER,M87,11066064,11066064.0,504083.0,"Artificial Intelligence (AI), Decentralized Exchange (DEX), Decentralized Finance (DeFi), Ethereum Ecosystem, Zero Knowledge (ZK)"
SFUND,seedify-fund,Seedify.fund,SFUND,10857123,13080871.0,1447760.0,"Gaming (GameFi), BNB Chain Ecosystem, Launchpad, DWF Labs Portfolio"
XSWAP,xswap-2,XSwap,XSWAP,10790318,12450614.0,169898.0,"Decentralized Finance (DeFi), Ethereum Ecosystem, Base Ecosystem, Cross-chain Communication"
NIBI,nibiru,Nibiru,NIBI,10678945,12788525.0,357631.0,"Infrastructure, Smart Contract Platform, Layer 1 (L1), Osmosis Ecosystem, Made in USA"
GHX,gamercoin,GamerCoin,GHX,10070641,11577747.0,188078.0,"Artificial Intelligence (AI), Infrastructure, BNB Chain Ecosystem, Solana Ecosystem, Ethereum Ecosystem, DePIN, AI Applications"
PERP,perpetual-protocol,Perpetual Protocol,PERP,9982983,20623196.0,8616467.0,"Decentralized Exchange (DEX), Exchange-based Tokens, Decentralized Finance (DeFi), Automated Market Maker (AMM), BNB Chain Ecosystem, Derivatives, Perpetuals, Gnosis Chain Ecosystem, Arbitrum Ecosystem, Ethereum Ecosystem, Optimism Ecosystem, Multicoin Capital Portfolio, Alameda Research Portfolio, YZi Labs (Prev. Binance Labs) Portfolio"
KOMA,koma-inu,Koma Inu,KOMA,9970913,9970913.0,606382.0,"BNB Chain Ecosystem, Meme, Dog-Themed, Binance Alpha Spotlight, Made in USA"
ZEPH,zephyr-protocol,Zephyr Protocol,ZEPH,9762660,9762660.0,520071.0,"Smart Contract Platform, Privacy, Proof of Work (PoW), Stablecoin Issuer, Privacy Blockchain"
RNT,reental,Reental,RNT,9733831,37196764.0,3903.74,"Tokenized Real Estate, Tokenized Assets, Polygon Ecosystem, Real World Assets (RWA), RWA Protocol"
CXT,covalent-x-token,Covalent X Token,CXT,9282467,9803940.0,1070228.0,"Artificial Intelligence (AI), Infrastructure, Decentralized Finance (DeFi), Ethereum Ecosystem, Base Ecosystem, Data Availability, Coinbase Ventures Portfolio, YZi Labs (Prev. Binance Labs) Portfolio"
FIS,stafi,Stafi,FIS,8861133,8861133.0,4230094.0,"Decentralized Finance (DeFi), Ethereum Ecosystem, Liquid Staking Governance Tokens, Osmosis Ecosystem, Sora Ecosystem, Liquid Staking"
DINERO,dinero-2,Dinero,DINERO,8714914,13000460.0,2837.24,"Infrastructure, Decentralized Finance (DeFi), Ethereum Ecosystem, Metagovernance, Liquid Staking Governance Tokens, LSDFi, Curve Ecosystem, Liquid Staking"
STUFF,book-2,STUFF.io,STUFF,8408841,19902157.0,25663.0,Cardano Ecosystem
LOFI,lofi-2,LOFI,LOFI,8253220,8253220.0,594223.0,"Meme, Sui Ecosystem, Sui Meme"
OPUL,opulous,Opulous,OPUL,7748454,7748454.0,1058767.0,"Artificial Intelligence (AI), Music, NFT, BNB Chain Ecosystem, Arbitrum Ecosystem, Ethereum Ecosystem, Algorand Ecosystem, Real World Assets (RWA), Telegram Apps, AI Applications"
STNK,stonks-4,Stonks,STNK,7725631,7725631.0,48813.0,"Solana Ecosystem, Meme, Solana Meme, Wall Street Bets Themed, Stock market-themed"
CATE,catecoin,CateCoin,CATE,7243399,7530451.0,966071.0,"Entertainment, Gaming (GameFi), Yield Farming, NFT, BNB Chain Ecosystem, Yield Aggregator, Launchpad, Wallets, Meme, Play To Earn, Ethereum Ecosystem, Base Ecosystem, Cat-Themed"
SPARKLET,upland,Upland,SPARKLET,6984577,28536662.0,303908.0,"Gaming (GameFi), NFT, Metaverse, Play To Earn, Ethereum Ecosystem, Animoca Brands Portfolio, Venture Capital Portfolios, Made in USA"
REN,republic-protocol,Ren,REN,6973823,6973823.0,1141631.0,"Decentralized Finance (DeFi), Near Protocol Ecosystem, Harmony Ecosystem, Ethereum Ecosystem, Multicoin Capital Portfolio, Alameda Research Portfolio, Energi Ecosystem, Sora Ecosystem"
VARA,vara-network,Vara Network,VARA,6599980,16315982.0,166990.0,"Smart Contract Platform, Layer 1 (L1)"
CAM,camino-network,Camino Network,CAM,6546688,17384319.0,59609.0,"Smart Contract Platform, Layer 1 (L1), Outlier Ventures Portfolio"
MOTHER,mother-iggy,Mother Iggy,MOTHER,6401738,6401738.0,506389.0,"Solana Ecosystem, Meme, Solana Meme, Celebrity-Themed, Pump.fun Ecosystem, Made in USA"
BENJI,basenji,Basenji,BENJI,6340754,6340754.0,383360.0,"Meme, Base Ecosystem, Dog-Themed, Base Meme"
