BITBOARD,bitboard,BitBoard,BB,17768273,26857988.0,413903.0,"Smart Contract Platform, Polygon Ecosystem, Layer 2 (L2), Zero Knowledge (ZK)"
PORT3,port3-network,Port3 Network,PORT3,17628143,35267062.0,1977082.0,"SocialFi, BNB Chain Ecosystem, Ethereum Ecosystem, Poolz Finance Launchpad"
TUNA,defituna,DefiTuna,TUNA,17150967,60927057.0,485282.0,"Decentralized Exchange (DEX), Exchange-based Tokens, Decentralized Finance (DeFi), Automated Market Maker (AMM), Lending/Borrowing Protocols, Solana Ecosystem"
GUN,gunz,Gunz,GUN,16624311,128662839.0,5344503.0,"Smart Contract Platform, Gaming (GameFi), Binance Launchpool, Solana Ecosystem, Layer 1 (L1), Avalanche Ecosystem, Play To Earn, Shooting Games, Coinbase Ventures Portfolio, Gaming Blockchains, Avalanche L1, YZi Labs (Prev. Binance Labs) Portfolio, Delphi Ventures Portfolio, Action Games, GUNZ Ecosystem"
RBNT,redbelly-network-token,Redbelly Network,RBNT,16017666,66369782.0,160396.0,"Smart Contract Platform, Layer 1 (L1), Zero Knowledge (ZK), Real World Assets (RWA), Redbelly Network Ecosystem"
ZND,znd-token,ZND Token,ZND,15959876,64158443.0,2846937.0,"Exchange-based Tokens, Centralized Exchange (CEX) Token, Ethereum Ecosystem"
PYR,vulcan-forged,Vulcan Forged,PYR,14523512,30386842.0,5769213.0,"Gaming (GameFi), NFT, Metaverse, Polygon Ecosystem, Ethereum Ecosystem, DWF Labs Portfolio, Gaming Blockchains, Gaming Platform, Action Games, MMO"
BXN,bxn,BXN,BXN,14448627,46183837.0,348585.0,"Smart Contract Platform, Layer 1 (L1)"
UXLINK,uxlink,UXLINK,UXLINK,14161725,23312626.0,1366561.0,"SocialFi, Ethereum Ecosystem"
POLS,polkastarter,Polkastarter,POLS,11490299,11581838.0,1615146.0,"Decentralized Finance (DeFi), BNB Chain Ecosystem, Launchpad, Ethereum Ecosystem"
LAZIO,lazio-fan-token,Lazio Fan Token,LAZIO,11321695,37356335.0,1329795.0,"Sports, BNB Chain Ecosystem, Fan Token, Binance Launchpad"
AMO,amo,AMO Coin,AMO,10912038,10912038.0,35558.0,"Big Data, Kaia Ecosystem"
LADYS,milady-meme-coin,Milady Meme Coin,LADYS,10772299,10772299.0,1531272.0,"Meme, Arbitrum Ecosystem, Ethereum Ecosystem, DWF Labs Portfolio, 4chan-Themed"
MIGGLES,mister-miggles,Mr. Miggles,MIGGLES,10239134,10239134.0,1196626.0,"Meme, Base Ecosystem, Cat-Themed, Base Meme, Made in USA, IP Meme"
GFAL,games-for-a-living,Games for a Living,GFAL,9930703,18903322.0,69616.0,"Gaming (GameFi), NFT, BNB Chain Ecosystem, Play To Earn"
READY,ready,READY!,READY,9865229,9865229.0,183086.0,"Gaming (GameFi), Solana Ecosystem, Gaming Platform"
REEF,reef,Reef,REEF,8708100,8708100.0,903138.0,"BNB Chain Ecosystem, Binance Launchpool, Layer 1 (L1), Harmony Ecosystem, Ethereum Ecosystem, Alameda Research Portfolio, Energi Ecosystem, Sora Ecosystem, YZi Labs (Prev. Binance Labs) Portfolio, GMCI Layer 1 Index, GMCI Index"
KRL,kryll,KRYLL,KRL,8694443,10675892.0,124232.0,"Artificial Intelligence (AI), Decentralized Finance (DeFi), Analytics, Arbitrum Ecosystem, Ethereum Ecosystem, Optimism Ecosystem, Base Ecosystem, AI Applications"
BEAM,beam,BEAM,BEAM,8488907,11719813.0,187297.0,"Smart Contract Platform, Privacy, Ethereum Ecosystem, Proof of Work (PoW), BeamPrivacy Ecosystem, Privacy Blockchain"
BKN,brickken,Brickken,BKN,8279834,16579796.0,366362.0,"Tokenized Real Estate, BNB Chain Ecosystem, Impossible Finance Launchpad, Ethereum Ecosystem, Real World Assets (RWA), RWA Protocol"
RWA,allo,Allo,RWA,7432150,41289723.0,1198235.0,"BNB Chain Ecosystem, Real World Assets (RWA), RWA Protocol, Binance Wallet IDO"
SEAM,seamless-protocol,Seamless Protocol,SEAM,6877406,16375357.0,211781.0,"Decentralized Finance (DeFi), Lending/Borrowing Protocols, Ethereum Ecosystem, Base Ecosystem"
ZKP,panther,Panther Protocol,ZKP,5170400,5170400.0,299637.0,"Smart Contract Platform, Privacy, Polygon Ecosystem, Ethereum Ecosystem, Zero Knowledge (ZK), Base Ecosystem"
PAID,paid-network,PAID,PAID,4937328,5363485.0,215787.0,"Launchpad, Base Ecosystem"
CLEAR,everclear,Everclear,CLEAR,4711561,8603212.0,55516.0,"Infrastructure, BNB Chain Ecosystem, Polygon Ecosystem, Gnosis Chain Ecosystem, Arbitrum Ecosystem, Ethereum Ecosystem, Optimism Ecosystem, Coinbase Ventures Portfolio, Cross-chain Communication, Chain Abstraction"
ZCX,unizen,Unizen,ZCX,4463496,6494360.0,140709.0,"Decentralized Exchange (DEX), Exchange-based Tokens, Decentralized Finance (DeFi), Polygon Ecosystem, Ethereum Ecosystem, DWF Labs Portfolio"
MLT,media-licensing-token,Media Licensing Token,MLT,4261921,5822239.0,21103.0,"BNB Chain Ecosystem, Metaverse, Ethereum Ecosystem"
TRUF,truflation,TRUF.Network,TRUF,4150765,9698483.0,387782.0,"Infrastructure, Oracle, Solana Ecosystem, Arbitrum Ecosystem, Ethereum Ecosystem, Real World Assets (RWA), Base Ecosystem, Coinbase Ventures Portfolio, Governance"
BCUT,bitscrunch-token,bitsCrunch Token,BCUT,4119066,6749028.0,366094.0,"Artificial Intelligence (AI), Infrastructure, Analytics, NFT, Polygon Ecosystem, Ethereum Ecosystem, Animoca Brands Portfolio, Coinbase Ventures Portfolio"
KIBSHI,kiboshib,KiboShib,KIBSHI,3918699,3918699.0,44252.0,"Solana Ecosystem, Meme, Arbitrum Ecosystem, Ethereum Ecosystem, Base Ecosystem, Dog-Themed, AI Meme"
FARTCOIN,based-fartcoin,Based Fartcoin,FARTCOIN,3826721,3826721.0,39638.0,"Meme, Base Ecosystem, Base Meme, Clanker Ecosystem"
INTER,inter-milan-fan-token,Inter Milan Fan Token,INTER,3751865,3751865.0,1023642.0,"Sports, Fan Token, Chiliz Ecosystem"
STOS,stratos,Stratos,STOS,3682946,7629248.0,89606.0,"Entertainment, Infrastructure, Smart Contract Platform, Storage, Layer 1 (L1), Ethereum Ecosystem, DePIN, Osmosis Ecosystem"
WUF,wuffi,WUFFI,WUF,3471379,3471379.0,9878.44,"Solana Ecosystem, Meme, Base Ecosystem"
AZIT,azit,azit,AZIT,3214182,4206972.0,69030.0,"Kaia Ecosystem, Payment Solutions"
RETARDIO,retardio,RETARDIO,RETARDIO,2880234,2880234.0,795177.0,"NFT, Solana Ecosystem, Meme, Solana Meme, Murad Picks, 4chan-Themed, TikTok Meme"
NRG,energi,Energi,NRG,2729510,2729516.0,131130.0,"Smart Contract Platform, Masternodes, Layer 1 (L1), Ethereum Ecosystem, Proof of Stake (PoS), Energi Ecosystem"
LNQ,linqai,LinqAI,LNQ,2722061,7923948.0,412248.0,"Artificial Intelligence (AI), Ethereum Ecosystem"
GMEE,gamee,GAMEE,GMEE,2619139,6105645.0,457603.0,"Gaming (GameFi), NFT, BNB Chain Ecosystem, Play To Earn, Ethereum Ecosystem, Telegram Apps, Animoca Brands Portfolio, TON Ecosystem, Gaming Platform, YZi Labs (Prev. Binance Labs) Portfolio, Arcade Games"
BST,blocksquare,Blocksquare,BST,2477658,2477658.0,117179.0,"Tokenized Real Estate, Ethereum Ecosystem, Real World Assets (RWA)"
TSUKA,dejitaru-tsuka,Dejitaru Tsuka,TSUKA,2135435,2135435.0,112577.0,"Meme, Ethereum Ecosystem"
SBR,saber,Saber,SBR,2063666,2795682.0,37485.0,"Decentralized Exchange (DEX), Exchange-based Tokens, Decentralized Finance (DeFi), Yield Farming, Automated Market Maker (AMM), Solana Ecosystem, Multicoin Capital Portfolio"
DYNA,dynachain,Dynachain,DYNA,2055702,6086820.0,64806.0,"Healthcare, BNB Chain Ecosystem"
ABX,aborean,Aborean,ABX,1996090,10981256.0,88781.0,"Decentralized Exchange (DEX), Exchange-based Tokens, Decentralized Finance (DeFi), Abstract Ecosystem"
EFFECT,effect-ai,Effect AI,EFFECT,1837159,2878165.0,8649.85,"Artificial Intelligence (AI), Business Services, Solana Ecosystem"
BGB,bitget-token,Bitget Token,BGB,2650421528,3483420628.0,72242536.0,"Exchange-based Tokens, Centralized Exchange (CEX) Token, Ethereum Ecosystem, DragonFly Capital Portfolio, Morph L2 Ecosystem, Made in China"
XAUT,tether-gold,Tether Gold,XAUT,2128473845,2128473845.0,252464950.0,"Stablecoins, Tokenized Assets, Tokenized Gold, Ethereum Ecosystem, Real World Assets (RWA), Tokenized Commodities"
QNT,quant-network,Quant,QNT,1189591353,1195179096.0,30252018.0,"Ethereum Ecosystem, Real World Assets (RWA), Energi Ecosystem, Coinbase 50 Index"
SOON,soon-2,SOON,SOON,564577575,1976344323.0,51717797.0,"Infrastructure, Smart Contract Platform, BNB Chain Ecosystem, Layer 2 (L2), Base Ecosystem, Cross-chain Communication, Binance Alpha Spotlight"
DOGWIFHAT,dogwifcoin,dogwifhat,WIF,416441629,416441629.0,149591314.0,"Solana Ecosystem, Meme, Dog-Themed, Solana Meme, GMCI Meme Index, GMCI Index, Unichain Ecosystem"
PENDLE,pendle,Pendle,PENDLE,399924829,679696154.0,91552054.0,"Decentralized Exchange (DEX), Exchange-based Tokens, Decentralized Finance (DeFi), Yield Farming, Automated Market Maker (AMM), BNB Chain Ecosystem, Derivatives, Arbitrum Ecosystem, Ethereum Ecosystem, Optimism Ecosystem, Fixed Interest, LSDFi, Base Ecosystem, Restaking, LRTfi, Liquid Restaking Governance Tokens, Berachain Ecosystem, Yield Tokenization Protocol, YZi Labs (Prev. Binance Labs) Portfolio, GMCI DeFi Index, Sonic Ecosystem, Liquid Staking, GMCI Index, BTCfi Protocol, HyperEVM Ecosystem"
JST,just,JUST,JST,359532376,359532376.0,24162311.0,"Decentralized Finance (DeFi), Tron Ecosystem"
APEPE,ape-and-pepe,Ape and Pepe,APEPE,345971706,345971706.0,31694139.0,"Polygon Ecosystem, Meme, Frog-Themed, The Boys Club"
ATH,aethir,Aethir,ATH,325407411,911183084.0,18182059.0,"Solana Ecosystem, Arbitrum Ecosystem, Impossible Finance Launchpad, Ethereum Ecosystem, DePIN, Animoca Brands Portfolio, Binance Alpha Spotlight"
FLUID,instadapp,Fluid,FLUID,280818873,362402070.0,8671613.0,"Decentralized Finance (DeFi), Solana Ecosystem, Polygon Ecosystem, Arbitrum Ecosystem, Ethereum Ecosystem, Base Ecosystem, Coinbase Ventures Portfolio, Pantera Capital Portfolio, Binance Alpha Spotlight, Plasma Ecosystem"
ZBCN,zebec-network,Zebec Network,ZBCN,277958502,293115619.0,14441626.0,"Decentralized Finance (DeFi), Solana Ecosystem, Real World Assets (RWA), Payment Solutions, DePIN, Coinbase Ventures Portfolio, Alameda Research Portfolio, Circle Ventures Portfolio, OKX Ventures Portfolio, RWA Protocol, Made in USA"
1INCH,1inch,1INCH,1INCH,263521495,282381921.0,22448538.0,"Decentralized Exchange (DEX), Exchange-based Tokens, Decentralized Finance (DeFi), Automated Market Maker (AMM), BNB Chain Ecosystem, Ethereum Ecosystem, Base Ecosystem, FTX Holdings, Alameda Research Portfolio, DragonFly Capital Portfolio, Pantera Capital Portfolio, YZi Labs (Prev. Binance Labs) Portfolio, GMCI DeFi Index, Galaxy Digital Portfolio, Blockchain Capital Portfolio, Dex Aggregator, GMCI Index, Coinbase 50 Index, Governance"
ZORA,zora,Zora,ZORA,228032808,510140511.0,64802005.0,"Infrastructure, Media, Smart Contract Platform, SocialFi, NFT, Launchpad, Layer 2 (L2), Base Ecosystem, Coinbase Ventures Portfolio, Zora Ecosystem, Binance Alpha Spotlight"
ZANO,zano,Zano,ZANO,226681221,226691721.0,2179160.0,"Smart Contract Platform, Privacy, Layer 1 (L1), Proof of Stake (PoS), Proof of Work (PoW), Zano Ecosystem, Privacy Blockchain"
SFP,safepal,SafePal,SFP,178735625,178735625.0,5710444.0,"BNB Chain Ecosystem, Wallets, Ethereum Ecosystem, Animoca Brands Portfolio, Binance Launchpad, Energi Ecosystem, YZi Labs (Prev. Binance Labs) Portfolio"
PROM,prometeus,Prom,PROM,168132738,177345491.0,5984508.0,"Smart Contract Platform, BNB Chain Ecosystem, Ethereum Ecosystem, Layer 2 (L2)"
ROSE,oasis-network,Oasis,ROSE,142349253,190229788.0,11380855.0,"Smart Contract Platform, Privacy, BNB Chain Ecosystem, Layer 1 (L1), Proof of Stake (PoS), Pantera Capital Portfolio, Andreessen Horowitz (a16z) Portfolio, YZi Labs (Prev. Binance Labs) Portfolio, Blockchain Capital Portfolio, Privacy Blockchain, Polychain Capital Portfolio, Coinbase 50 Index"
XVG,verge,Verge,XVG,127545388,127800516.0,42030549.0,"Smart Contract Platform, Privacy, Proof of Work (PoW), Made in USA"
XCH,chia,Chia,XCH,109983786,248172515.0,5483268.0,"Smart Contract Platform, Layer 1 (L1), DePIN, Andreessen Horowitz (a16z) Portfolio, Made in USA"
VTHO,vethor-token,VeThor,VTHO,102525274,102534956.0,1881068.0,"Layer 1 (L1), VeChain Ecosystem"
ZIG,zignaly,ZIGChain,ZIG,94587054,131174784.0,1905599.0,"Artificial Intelligence (AI), Smart Contract Platform, BNB Chain Ecosystem, Solana Ecosystem, Layer 1 (L1), Polygon Ecosystem, Ethereum Ecosystem, DWF Labs Portfolio, Injective Ecosystem, OKX Ventures Portfolio"
RED,redstone-oracles,RedStone,RED,83432431,284873717.0,8958821.0,"Infrastructure, Oracle, Binance Launchpool, Ethereum Ecosystem, Real World Assets (RWA), Base Ecosystem"
OOBIT,oobit-2,Oobit,OOB,77501450,310005794.0,6882027.0,"Solana Ecosystem, Payment Solutions"
WAVES,waves,Waves,WAVES,65670320,65670320.0,7757558.0,"Smart Contract Platform, DWF Labs Portfolio, Proof of Stake (PoS)"
DAG,constellation-labs,Constellation,DAG,63926862,63926862.0,1468894.0,"Smart Contract Platform, Layer 1 (L1), Layer 0 (L0), Made in USA, Directed Acyclic Graph (DAG)"
BIGTIME,big-time,Big Time,BIGTIME,51207278,134173748.0,9081112.0,"Gaming (GameFi), Play To Earn, Ethereum Ecosystem, RPG, Alameda Research Portfolio, Circle Ventures Portfolio, OKX Ventures Portfolio, MMO"
MANTA,manta-network,Manta Network,MANTA,51151335,113677763.0,16489762.0,"Smart Contract Platform, Polkadot Ecosystem, Binance Launchpool, Layer 2 (L2), Manta Network Ecosystem, Multicoin Capital Portfolio, Alameda Research Portfolio, DeFiance Capital Portfolio, YZi Labs (Prev. Binance Labs) Portfolio"
SHX,stronghold-token,Stronghold,SHX,50740405,,812824.0,"Ethereum Ecosystem, Stellar Ecosystem, Made in USA"
FIDA,bonfida,Bonfida,FIDA,49479063,49932896.0,4193290.0,"Big Data, Business Services, Infrastructure, Decentralized Finance (DeFi), Solana Ecosystem, FTX Holdings, DWF Labs Portfolio, Name Service"
LQTY,liquity,Liquity,LQTY,46759314,47743441.0,8946516.0,"Decentralized Finance (DeFi), Arbitrum Ecosystem, Ethereum Ecosystem, Alameda Research Portfolio, Pantera Capital Portfolio"
OSAK,osaka-protocol,Osaka Protocol,OSAK,44207291,44207291.0,22801.0,"BNB Chain Ecosystem, Solana Ecosystem, Avalanche Ecosystem, Polygon Ecosystem, Meme, Arbitrum Ecosystem, Ethereum Ecosystem, Optimism Ecosystem, Base Ecosystem, Dog-Themed"
SAI,sai,Sai,SAI,43692308,43692308.0,17.73,"Decentralized Finance (DeFi), Ethereum Ecosystem"
TAIKO,taiko,Taiko,TAIKO,42413816,217073918.0,8496579.0,"Smart Contract Platform, BNB Chain Ecosystem, Ethereum Ecosystem, Layer 2 (L2), Zero Knowledge (ZK), Rollup, OKX Ventures Portfolio, Centralized Exchange (CEX) Product, Binance Alpha Spotlight"
STEEM,steem,Steem,STEEM,41158221,41185511.0,8133199.0,SocialFi
XRD,radix,Radix,XRD,33480669,33481240.0,28342.0,"Smart Contract Platform, Layer 1 (L1), DWF Labs Portfolio, Radix Ecosystem"
JOE,joe,JOE,JOE,33183571,41561121.0,2878536.0,"Decentralized Exchange (DEX), Exchange-based Tokens, Decentralized Finance (DeFi), Yield Farming, Automated Market Maker (AMM), BNB Chain Ecosystem, Avalanche Ecosystem, Launchpad, Arbitrum Ecosystem, Mantle Ecosystem, DeFiance Capital Portfolio, Delphi Ventures Portfolio, Dex Aggregator"
DYM,dymension,Dymension,DYM,31965587,78729595.0,4236616.0,"Smart Contract Platform, Cosmos Ecosystem, Modular Blockchain, Osmosis Ecosystem, Rollups-as-a-Service (RaaS)"
REZ,renzo,Renzo,REZ,31062140,68155109.0,6682958.0,"Decentralized Finance (DeFi), Binance Launchpool, Ethereum Ecosystem, Base Ecosystem, Restaking, YZi Labs (Prev. Binance Labs) Portfolio, OKX Ventures Portfolio"
ANYONE,airtor-protocol,ANyONe Protocol,ANYONE,29443718,36833336.0,1207274.0,"Smart Contract Platform, Privacy, Ethereum Ecosystem, DePIN, Base Ecosystem, Privacy Blockchain, Peaq Ecosystem"
AITECH,solidus-aitech,Solidus Ai Tech,AITECH,29291850,33799935.0,10840076.0,"Artificial Intelligence (AI), BNB Chain Ecosystem, Solana Ecosystem, Launchpad, Base Ecosystem, ChainGPT Launchpad, AI Agents, Binance Alpha Spotlight, DeFAI"
IXT,ix-token,Planet IX,IXT,28926721,28994197.0,191781.0,"Gaming (GameFi), NFT, Metaverse, Polygon Ecosystem, Play To Earn, Gaming Governance Token, Gaming Utility Token, Strategy Games"
WCT,connect-token-wct,WalletConnect Token,WCT,26608426,142902274.0,222244570.0,"Binance Launchpool, Solana Ecosystem, Wallets, Ethereum Ecosystem, Optimism Ecosystem, Base Ecosystem"
OGN,origin-protocol,Origin Token,OGN,25825412,56570375.0,13441390.0,"Decentralized Finance (DeFi), NFT, Ethereum Ecosystem, Base Ecosystem, Pantera Capital Portfolio, Sonic Ecosystem, Liquid Staking, Made in USA"
MBL,moviebloc,MovieBloc,MBL,23835014,37761653.0,4900559.0,DWF Labs Portfolio
DIAM,diam,DIAM,DIAM,23554527,71689464.0,49941224.0,"Smart Contract Platform, Layer 1 (L1)"
SD,stader,Stader,SD,21832334,39713485.0,2728504.0,"BNB Chain Ecosystem, Solana Ecosystem, Polygon Ecosystem, Fantom Ecosystem, Ethereum Ecosystem, Liquid Staking Governance Tokens, Animoca Brands Portfolio, Coinbase Ventures Portfolio, Pantera Capital Portfolio, Liquid Staking, Binance Alpha Spotlight"
NATIX,natix-network,NATIX Network,NATIX,17960047,44047026.0,281461.0,"Artificial Intelligence (AI), Internet of Things (IOT), Solana Ecosystem, DePIN, Robotics"
DAO,dao-maker,DAO Maker,DAO,17429076,19276547.0,514970.0,"BNB Chain Ecosystem, Solana Ecosystem, Launchpad, DaoMaker Launchpad, Arbitrum Ecosystem, Ethereum Ecosystem, Step Network Ecosystem, Governance"
RSS3,rss3,RSS3,RSS3,15652232,18692927.0,1736935.0,"Artificial Intelligence (AI), Infrastructure, Storage, Ethereum Ecosystem, Coinbase Ventures Portfolio, DragonFly Capital Portfolio, RSS3 VSL Ecosystem, AI Framework, DeFAI"
OBT,orbiter-finance,Orbiter Finance,OBT,15614676,31229352.0,4063578.0,"BNB Chain Ecosystem, Arbitrum Ecosystem, Ethereum Ecosystem, Bridge Governance Tokens, Base Ecosystem, Cross-chain Communication, OKX Ventures Portfolio"
PARTI,particle-network,Particle Network,PARTI,15274342,65555118.0,13973574.0,"Decentralized Finance (DeFi), BNB Chain Ecosystem, Layer 1 (L1), Base Ecosystem, Account Abstraction, Cross-chain Communication, Binance HODLer Airdrops, Chain Abstraction, Binance Wallet IDO"
VIC,tomochain,Viction,VIC,14845694,25280342.0,1010727.0,"Smart Contract Platform, Masternodes, Layer 1 (L1), DWF Labs Portfolio"
RIO,realio-network,Realio Network Token,RIO,14005605,14005605.0,1701094.0,"BNB Chain Ecosystem, Solana Ecosystem, Ethereum Ecosystem, Algorand Ecosystem, Real World Assets (RWA), Base Ecosystem, Osmosis Ecosystem, Stellar Ecosystem, Made in USA"
MLC,my-lovely-coin,My Lovely Coin,MLC,13697890,35376384.0,493242.0,"Charity, Gaming (GameFi), BNB Chain Ecosystem, Solana Ecosystem, Polygon Ecosystem, Gaming Utility Token"
VOW,vow,Vow,VOW,12845667,43036005.0,152934.0,"Retail, Tourism, BNB Chain Ecosystem, Ethereum Ecosystem"
SUNDOG,sundog,Sundog,SUNDOG,12803122,12803122.0,7500089.0,"Meme, Tron Ecosystem, Sun Pump Ecosystem, TRON Meme, Binance Alpha Spotlight"
VINU,vita-inu,Vita Inu,VINU,11945923,11945923.0,991695.0,"BNB Chain Ecosystem, Meme, Dog-Themed, DWF Labs Portfolio, Binance Alpha Spotlight"
ZETA,zeta,Zeta,ZEX,11763962,68498563.0,261046.0,"Decentralized Finance (DeFi), Derivatives, Perpetuals, Solana Ecosystem"
OGY,origyn-foundation,ORIGYN,OGY,11466318,14550425.0,214337.0,"Internet Computer Ecosystem, Real World Assets (RWA), RWA Protocol"
HASHAI,hashai,HashAI,HASHAI,11005130,11686967.0,278540.0,"Analytics, Ethereum Ecosystem, DePIN"
LOCK,houdini-swap,Houdini Swap,LOCK,10901091,10901091.0,30860.0,"Privacy, Solana Ecosystem, Ethereum Ecosystem"
BOOE,book-of-ethereum,Book of Ethereum,BOOE,10022099,10022099.0,192683.0,"Meme, Ethereum Ecosystem"
ATS,alltoscan,Alltoscan,ATS,10016139,14663795.0,156065.0,"BNB Chain Ecosystem, Layer 1 (L1)"
MCB,mcdex,MUX Protocol,MCB,9788189,12361901.0,796.67,"Decentralized Exchange (DEX), Exchange-based Tokens, Decentralized Finance (DeFi), BNB Chain Ecosystem, Derivatives, Perpetuals, Arbitrum Ecosystem, Ethereum Ecosystem, Multicoin Capital Portfolio, Alameda Research Portfolio, DeFiance Capital Portfolio, Delphi Ventures Portfolio, OKX Ventures Portfolio"
NMT,netmind-token,NetMind Token,NMT,8860983,23243232.0,1446459.0,"Artificial Intelligence (AI), BNB Chain Ecosystem, Ethereum Ecosystem, DePIN, AI Agents"
SERAPH,seraph,Seraph,SERAPH,8498274,29123802.0,4168539.0,"Gaming (GameFi), BNB Chain Ecosystem, Play To Earn, Ethereum Ecosystem, RPG, Gaming Utility Token, Action Games"
MEMEFI,memefi-2,MemeFi,MEMEFI,8452166,8452166.0,4575319.0,"Gaming (GameFi), NFT, Meme, Play To Earn, Sui Ecosystem, Telegram Apps, Tap to Earn, Sui Meme, Action Games"
NUM,numbers-protocol,Numbers Protocol,NUM,8163548,8260933.0,1016634.0,"Artificial Intelligence (AI), Smart Contract Platform, BNB Chain Ecosystem, DaoMaker Launchpad, Ethereum Ecosystem, Avalanche L1, YZi Labs (Prev. Binance Labs) Portfolio, Outlier Ventures Portfolio"
SUKU,suku,SUKU,SUKU,8038549,22768335.0,234648.0,"Solana Ecosystem, Polygon Ecosystem, Ethereum Ecosystem, Made in USA"
EPT,balance,Balance,EPT,7183749,31010106.0,1981168.0,"Gaming (GameFi), BNB Chain Ecosystem, Animoca Brands Portfolio, DWF Labs Portfolio, AI Agents, Andreessen Horowitz (a16z) Portfolio, AI Agent Launchpad"
CRTS,cratos,Cratos,CRTS,7062169,11111768.0,961961.0,"SocialFi, BNB Chain Ecosystem, Ethereum Ecosystem, Governance"
HMT,human-protocol,HUMAN Protocol,HMT,7055922,9310244.0,146404.0,"Artificial Intelligence (AI), Infrastructure, Software as a service, Polygon Ecosystem, Ethereum Ecosystem, Market-Making Solution, AI Framework"
PMT,public-meme-token,Public Masterpiece Token,PMT,6904647,35006358.0,398686.0,"NFT, BNB Chain Ecosystem, Real World Assets (RWA), NFTFi"
VSC,vyvo-smart-chain,Vyvo Smart Chain,VSC,6891275,31799307.0,147267.0,"Smart Contract Platform, BNB Chain Ecosystem, Polygon Ecosystem, Layer 2 (L2)"
LINGO,lingo,Lingo,LINGO,6581491,6581543.0,274441.0,"Solana Ecosystem, Real World Assets (RWA), Base Ecosystem, RWA Protocol"
FHE,mind-network,Mind Network,FHE,6316982,25369404.0,3874601.0,"Artificial Intelligence (AI), Smart Contract Platform, BNB Chain Ecosystem, Layer 2 (L2), Binance Wallet IDO"
MFT,mainframe,Mainframe,MFT,6146283,6547967.0,4.66,"Ethereum Ecosystem, Energi Ecosystem"
CA,ca-htb,Coupon Assets,CA,6127001,89944918.0,521627.0,"Retail, Ethereum Ecosystem"
NLS,nolus,Nolus,NLS,5047964,6402577.0,157317.0,"Lending/Borrowing Protocols, Liquid Staking Tokens, Ethereum Ecosystem, Osmosis Ecosystem"
JUNO,juno-network,JUNO,JUNO,4552893,6048859.0,13383.59,"Smart Contract Platform, Cosmos Ecosystem, Osmosis Ecosystem, Juno Ecosystem, Evmos Ecosystem, Secret Ecosystem"
PROPS,propbase,Propbase,PROPS,4524059,12035494.0,3164183.0,"Tokenized Real Estate, Aptos Ecosystem, Real World Assets (RWA), Base Ecosystem, RWA Protocol"
PEAR,pear-protocol,Pear Protocol,PEAR,4399396,14577481.0,14232.15,"Decentralized Exchange (DEX), Exchange-based Tokens, Decentralized Finance (DeFi), Perpetuals, Arbitrum Ecosystem"
DIONE,dione,Dione,DIONE,4205566,4813805.0,128666.0,"Energy, Smart Contract Platform, Layer 1 (L1), Made in USA"
DNX,dynex,Dynex,DNX,3622010,3622583.0,99097.0,"Artificial Intelligence (AI), Smart Contract Platform, Layer 1 (L1), Ethereum Ecosystem, DePIN, Decentralized Science (DeSci), Proof of Work (PoW)"
LL,lightlink,LightLink,LL,3613861,9122746.0,275252.0,"Infrastructure, Smart Contract Platform, Ethereum Ecosystem, Layer 2 (L2), Base Ecosystem, Rollup, LightLink Ecosystem"
WEPE,wall-street-pepe,Wall Street Pepe,WEPE,3603543,3603543.0,381537.0,"Meme, Ethereum Ecosystem, Frog-Themed, The Boys Club"
METAV,metaverse,METAVERSE,METAV,2953171,2953171.0,368875.0,"Artificial Intelligence (AI), Solana Ecosystem, AI Agents, Pump.fun Ecosystem, Binance Alpha Spotlight"
AEROBUD,aerobud,AEROBUD,AEROBUD,2887398,2887398.0,204572.0,"Charity, Meme, Base Ecosystem, Dog-Themed, Base Meme, Made in USA"
SIDUS,sidus,Sidus,SIDUS,2882067,4917520.0,208940.0,"Gaming (GameFi), NFT, BNB Chain Ecosystem, Metaverse, Play To Earn, Ethereum Ecosystem, Linea Ecosystem, Animoca Brands Portfolio, Base Ecosystem, RPG, Gaming Governance Token, Alameda Research Portfolio, OKX Ventures Portfolio"
LLD,liberland-lld,Liberland LLD,LLD,2852863,3830829.0,69454.0,"Smart Contract Platform, Solana Ecosystem, Layer 1 (L1), Ethereum Ecosystem, Tron Ecosystem"
LOOKS,looksrare,LooksRare,LOOKS,2810648,2810648.0,1895611.0,"NFT, Ethereum Ecosystem, NFT Marketplace"
GAIA,gaia-2,Gaia,SN57,2765617,2776197.0,80876.0,"Artificial Intelligence (AI), Bittensor Ecosystem, Bittensor Subnets"
KILO,kiloex,KiloEx,KILO,2576965,12172720.0,558677.0,"Decentralized Exchange (DEX), Exchange-based Tokens, Decentralized Finance (DeFi), BNB Chain Ecosystem, Derivatives, Perpetuals, Binance Wallet IDO"
LIKE,likecoin-2,LikeCoin,LIKE,2475102,3062871.0,413.33,
BOBA,bobacat,Boba Cat,BOBA,2120455,2120455.0,1139.08,"Meme, Ethereum Ecosystem, Cat-Themed"
CREO,creo-engine,Creo Engine,CREO,1809712,2379430.0,1025019.0,"Gaming (GameFi), BNB Chain Ecosystem, Solana Ecosystem, Ethereum Ecosystem, Gaming Platform"
BLEND,blend,Blend,BLND,1771754,3373152.0,6239.35,"Decentralized Finance (DeFi), Lending/Borrowing Protocols, Stellar Ecosystem"
UNIT0,unit0,Unit0,UNIT0,1699494,16641338.0,69305.0,"Smart Contract Platform, Ethereum Ecosystem, Layer 2 (L2), Cross-chain Communication, Waves Ecosystem"
XNA,neurai,Neurai,XNA,1599659,1599677.0,20672.0,"Smart Contract Platform, Layer 1 (L1), Real World Assets (RWA), Proof of Work (PoW)"
VC,vinuchain,VinuChain,VC,1514219,3179729.0,308055.0,"Smart Contract Platform, BNB Chain Ecosystem, Layer 1 (L1), Proof of Stake (PoS)"
BNB,binancecoin,BNB,BNB,128646815422,128646815422.0,2053908645.0,"Smart Contract Platform, Exchange-based Tokens, BNB Chain Ecosystem, Centralized Exchange (CEX) Token, Layer 1 (L1), Ethereum Ecosystem, Alleged SEC Securities, FTX Holdings, Proof of Stake (PoS), GMCI Layer 1 Index, GMCI 30 Index, GMCI Index, Made in China"
HBAR,hedera-hashgraph,Hedera,HBAR,6309547702,7427277041.0,252240685.0,"Smart Contract Platform, Layer 1 (L1), Hedera Ecosystem, GMCI Layer 1 Index, GMCI 30 Index, GMCI Index, Outlier Ventures Portfolio, Made in USA, Directed Acyclic Graph (DAG)"
DASH,dash,Dash,DASH,1115754515,1115782440.0,873612595.0,"Smart Contract Platform, Privacy, Masternodes, Alleged SEC Securities, Proof of Stake (PoS), Proof of Work (PoW), Made in USA"
