AI16Z,ai16z,ai16z,AI16Z,179171150.0,179171150.0,82006207.0,"Artificial Intelligence (AI), Solana Ecosystem, Meme, Solana Meme, Solana Token-2022, AI Meme, AI Agents, Binance Alpha Spotlight, AI Framework, Made in USA"
CELO,celo,Celo,CELO,160492191.0,278618003.0,17022051.0,"Smart Contract Platform, Celo Ecosystem, Layer 2 (L2), DWF Labs Portfolio, Coinbase Ventures Portfolio, Proof of Stake (PoS), Andreessen Horowitz (a16z) Portfolio, Optimism Superchain Ecosystem, Outlier Ventures Portfolio, Made in USA"
ELF,aelf,aelf,ELF,146080507.0,190196225.0,4877243.0,"Infrastructure, Smart Contract Platform, BNB Chain Ecosystem, Layer 1 (L1), Ethereum Ecosystem, GMCI Layer 1 Index, Aelf Ecosystem, GMCI Index"
WOO,woo-network,WOO,WOO,135413843.0,156691460.0,22355366.0,"Decentralized Exchange (DEX), Exchange-based Tokens, Decentralized Finance (DeFi), Automated Market Maker (AMM), BNB Chain Ecosystem, Derivatives, Perpetuals, Centralized Exchange (CEX) Token, Solana Ecosystem, Avalanche Ecosystem, Polygon Ecosystem, Near Protocol Ecosystem, Fantom Ecosystem, Arbitrum Ecosystem, Ethereum Ecosystem, ZkSync Ecosystem, Mantle Ecosystem, Linea Ecosystem, Base Ecosystem, DragonFly Capital Portfolio, YZi Labs (Prev. Binance Labs) Portfolio"
DRIFT,drift-protocol,Drift Protocol,DRIFT,132089885.0,388498532.0,19699085.0,"Decentralized Finance (DeFi), Derivatives, Prediction Markets, Solana Ecosystem"
NPC,non-playable-coin,Non-Playable Coin,NPC,128171611.0,128171611.0,3458379.0,"NFT, BNB Chain Ecosystem, Solana Ecosystem, Meme, Ethereum Ecosystem, Base Ecosystem, Hybrid Token Standards, Wojak-Themed, 4chan-Themed"
IO,io,io.net,IO,125645792.0,595586393.0,26780906.0,"Artificial Intelligence (AI), Internet of Things (IOT), Binance Launchpool, Solana Ecosystem, DePIN, Animoca Brands Portfolio, Multicoin Capital Portfolio, Delphi Ventures Portfolio, OKX Ventures Portfolio, Made in USA"
ZIG,zignaly,ZIGChain,ZIG,121256006.0,168159696.0,3980741.0,"Artificial Intelligence (AI), Smart Contract Platform, BNB Chain Ecosystem, Solana Ecosystem, Layer 1 (L1), Polygon Ecosystem, Ethereum Ecosystem, DWF Labs Portfolio, Injective Ecosystem, OKX Ventures Portfolio"
SIX,six,Six Sigma,SIX,113046031.0,113046031.0,87517.0,"Gambling (GambleFi), Solana Ecosystem"
OZO,ozone-chain,Ozone Chain,OZO,108911333.0,130813080.0,248474.0,"Smart Contract Platform, Layer 1 (L1), Zero Knowledge (ZK)"
PAAL,paal-ai,PAAL AI,PAAL,93191005.0,103834963.0,9281497.0,"Artificial Intelligence (AI), Virtual Reality, BNB Chain Ecosystem, Launchpad, Ethereum Ecosystem, Telegram Apps, Discord Bots, Base Ecosystem, PAAL AI Launchpad, AI Agents, AI Applications, AI Agent Launchpad, Binance Alpha Spotlight, AI Framework, DeFAI, Made in USA"
BICO,biconomy,Biconomy,BICO,91228542.0,94736511.0,5925259.0,"Arbitrum Ecosystem, Ethereum Ecosystem, Account Abstraction, Coinbase Ventures Portfolio, YZi Labs (Prev. Binance Labs) Portfolio, Consensys Portfolio, Outlier Ventures Portfolio"
OSAK,osaka-protocol,Osaka Protocol,OSAK,72389934.0,72389934.0,117605.0,"BNB Chain Ecosystem, Solana Ecosystem, Avalanche Ecosystem, Polygon Ecosystem, Meme, Arbitrum Ecosystem, Ethereum Ecosystem, Optimism Ecosystem, Base Ecosystem, Dog-Themed"
RLC,iexec-rlc,iExec RLC,RLC,67985508.0,81714789.0,5324385.0,"Artificial Intelligence (AI), Oracle, Ethereum Ecosystem, DePIN, AI Agents, Energi Ecosystem, Sora Ecosystem, GMCI DePIN Index, GMCI Index"
VEE,blockv,BLOCKv,VEE,67092332.0,67092332.0,43909.0,"NFT, Polygon Ecosystem, Ethereum Ecosystem, Optimism Ecosystem"
ANVL,anvil,Anvil,ANVL,64785567.0,234400784.0,182716.0,"Decentralized Finance (DeFi), Ethereum Ecosystem"
BAL,balancer,Balancer,BAL,63991660.0,68723286.0,6459094.0,"Decentralized Exchange (DEX), Exchange-based Tokens, Decentralized Finance (DeFi), Yield Farming, Automated Market Maker (AMM), Avalanche Ecosystem, Polygon Ecosystem, Near Protocol Ecosystem, Gnosis Chain Ecosystem, Harmony Ecosystem, Arbitrum Ecosystem, Ethereum Ecosystem, Optimism Ecosystem, Base Ecosystem, Index Coop Defi Index, Alameda Research Portfolio, DeFiance Capital Portfolio, Pantera Capital Portfolio, Energi Ecosystem, Polygon zkEVM Ecosystem, Huobi ECO Chain Ecosystem, Blockchain Capital Portfolio"
JOE,joe,JOE,JOE,60227156.0,75591591.0,7669071.0,"Decentralized Exchange (DEX), Decentralized Finance (DeFi), Yield Farming, Automated Market Maker (AMM), BNB Chain Ecosystem, Avalanche Ecosystem, Arbitrum Ecosystem, Mantle Ecosystem, DeFiance Capital Portfolio, Delphi Ventures Portfolio, Dex Aggregator"
AO,ao-computer,ao Computer,AO,59666664.0,59666664.0,1664529.0,"Artificial Intelligence (AI), Smart Contract Platform, DePIN"
TAIKO,taiko,Taiko,TAIKO,58929113.0,379566775.0,11838122.0,"Smart Contract Platform, BNB Chain Ecosystem, Ethereum Ecosystem, Layer 2 (L2), Zero Knowledge (ZK), Rollup, OKX Ventures Portfolio, Centralized Exchange (CEX) Product, Binance Alpha Spotlight"
SUNDOG,sundog,Sundog,SUNDOG,56890864.0,56890864.0,12482712.0,"Meme, Tron Ecosystem, Sun Pump Ecosystem, TRON Meme"
CHILLGUY,chill-guy,Just a chill guy,CHILLGUY,56853638.0,56853638.0,31505689.0,"Solana Ecosystem, Meme, Dog-Themed, Solana Meme, Pump.fun Ecosystem, TikTok Meme"
VANRY,vanar-chain,Vanar Chain,VANRY,53421797.0,54943706.0,8752531.0,"Smart Contract Platform, Gaming (GameFi), NFT, Layer 1 (L1), Polygon Ecosystem, Ethereum Ecosystem, Vanar Chain Ecosystem"
SCRT,secret,Secret,SCRT,50548250.0,53133165.0,1771551.0,"Artificial Intelligence (AI), Smart Contract Platform, Cosmos Ecosystem, Layer 1 (L1), Osmosis Ecosystem, Alameda Research Portfolio, DragonFly Capital Portfolio, DeFiance Capital Portfolio, Privacy Blockchain, Outlier Ventures Portfolio"
QKC,quark-chain,QuarkChain,QKC,49569561.0,69456146.0,10906517.0,"Infrastructure, Ethereum Ecosystem, Energi Ecosystem"
GPS,goplus-security,GoPlus Security,GPS,48185908.0,265721339.0,5526339.0,"BNB Chain Ecosystem, Base Ecosystem, Cybersecurity, YZi Labs (Prev. Binance Labs) Portfolio, OKX Ventures Portfolio, Binance Alpha Spotlight"
ACS,access-protocol,Access Protocol,ACS,45628628.0,97468025.0,1806296.0,"SocialFi, Solana Ecosystem"
NOS,nosana,Nosana,NOS,45342773.0,54367833.0,552288.0,"Artificial Intelligence (AI), Solana Ecosystem, DePIN"
QI,benqi,BENQI,QI,43777188.0,45199646.0,2906948.0,"Decentralized Finance (DeFi), Yield Farming, Binance Launchpool, Lending/Borrowing Protocols, Avalanche Ecosystem, Liquid Staking Governance Tokens, DragonFly Capital Portfolio, Liquid Staking"
FORT,forta,Forta,FORT,42763443.0,71256277.0,1406561.0,"Artificial Intelligence (AI), Polygon Ecosystem, Ethereum Ecosystem, Coinbase Ventures Portfolio, Cybersecurity, Andreessen Horowitz (a16z) Portfolio, Blockchain Capital Portfolio"
MBX,marblex,MARBLEX,MBX,42273961.0,63670070.0,9884061.0,"Smart Contract Platform, Gaming (GameFi), NFT, BNB Chain Ecosystem, Kaia Ecosystem, Aptos Ecosystem, DWF Labs Portfolio, Gaming Blockchains"
OGN,origin-protocol,Origin Token,OGN,37618798.0,75356349.0,15323983.0,"NFT, Ethereum Ecosystem, Base Ecosystem, Pantera Capital Portfolio, Sonic Ecosystem, Made in USA"
APX,apollox-2,APX,APX,34153191.0,315629836.0,709753.0,"Decentralized Finance (DeFi), BNB Chain Ecosystem, Perpetuals, YZi Labs (Prev. Binance Labs) Portfolio, Binance Alpha Spotlight"
AINTI,aintivirus,AIntivirus,AINTI,33728677.0,33728677.0,0.0,"Solana Ecosystem, Meme, AI Meme, Pump.fun Ecosystem"
RSS3,rss3,RSS3,RSS3,33641111.0,42898681.0,3259403.0,"Artificial Intelligence (AI), Infrastructure, Storage, Ethereum Ecosystem, Coinbase Ventures Portfolio, DragonFly Capital Portfolio, RSS3 VSL Ecosystem, AI Framework, DeFAI"
UQC,uquid-coin,Uquid Coin,UQC,31381598.0,125526392.0,140944.0,Ethereum Ecosystem
L3,layer3,Layer3,L3,27702042.0,140877407.0,7777301.0,"Marketing, BNB Chain Ecosystem, Solana Ecosystem, Polygon Ecosystem, Arbitrum Ecosystem, Ethereum Ecosystem, Decentralized Identifier (DID), Optimism Ecosystem, Quest-to-Earn, Made in USA"
MAPO,marcopolo,MAP Protocol,MAPO,27065971.0,44490746.0,2180191.0,"BNB Chain Ecosystem, Ethereum Ecosystem, DWF Labs Portfolio"
PIKA,pikaboss,Pikaboss,PIKA,22046359.0,22046359.0,4613.99,"Meme, Ethereum Ecosystem"
NAVX,navi,NAVI Protocol,NAVX,21644299.0,37573813.0,2227374.0,"Decentralized Finance (DeFi), Lending/Borrowing Protocols, Sui Ecosystem, OKX Ventures Portfolio"
FARTBOY,fartboy,Fartboy,$FARTBOY,21061881.0,21061881.0,246305.0,"Solana Ecosystem, Meme, Solana Meme, Pump.fun Ecosystem"
LYX,lukso-token-2,LUKSO,LYX,19617801.0,27056909.0,801914.0,"Smart Contract Platform, SocialFi, Layer 1 (L1), Decentralized Identifier (DID), Proof of Stake (PoS), Lukso Ecosystem"
XTER,xterio,Xterio,XTER,18114370.0,131292421.0,9088837.0,"Artificial Intelligence (AI), Gaming (GameFi), NFT, BNB Chain Ecosystem, Animoca Brands Portfolio, Gaming Blockchains, YZi Labs (Prev. Binance Labs) Portfolio, Binance Alpha Spotlight"
LUMIA,lumia,Lumia,LUMIA,18095849.0,57403792.0,4762705.0,"Smart Contract Platform, Layer 2 (L2), Real World Assets (RWA)"
FLOCK,flock-2,FLOCK,FLOCK,17420435.0,158113326.0,8405895.0,"Artificial Intelligence (AI), Base Ecosystem, AI Applications, Binance Alpha Spotlight"
PIPPIN,pippin,pippin,PIPPIN,17111888.0,17111888.0,11632621.0,"Artificial Intelligence (AI), Infrastructure, Solana Ecosystem, Meme, Solana Meme, AI Meme, AI Agents, Pump.fun Ecosystem, Binance Alpha Spotlight, AI Framework"
RARI,rarible,RARI,RARI,16407099.0,22634375.0,472134.0,"NFT, Ethereum Ecosystem, NFT Marketplace, Coinbase Ventures Portfolio, Energi Ecosystem, Made in USA"
NRN,neuron,Neuron,NRN,15944357.0,37156557.0,320801.0,"Artificial Intelligence (AI), Gaming (GameFi), NFT, Arbitrum Ecosystem, Paradigm Portfolio, AI Agents, AI Framework, Action Games"
TLOS,telos,Telos,TLOS,15304794.0,15304795.0,2711434.0,"Smart Contract Platform, BNB Chain Ecosystem, Layer 1 (L1), Avalanche Ecosystem, Polygon Ecosystem, Arbitrum Ecosystem, Ethereum Ecosystem, Zero Knowledge (ZK), Telos Ecosystem, Consensys Portfolio"
HMT,human-protocol,HUMAN Protocol,HMT,15275876.0,20156420.0,17001.58,"Artificial Intelligence (AI), Infrastructure, Software as a service, Polygon Ecosystem, Ethereum Ecosystem, Market-Making Solution, AI Framework"
CRTS,cratos,Cratos,CRTS,13917261.0,21929293.0,1769930.0,"BNB Chain Ecosystem, Ethereum Ecosystem"
SEDA,seda-2,SEDA,SEDA,13806292.0,41118993.0,568685.0,"Smart Contract Platform, Oracle, Ethereum Ecosystem, Base Ecosystem, Modular Blockchain, Osmosis Ecosystem"
PEPE,based-pepe,Based Pepe,PEPE,12469580.0,12469580.0,427866.0,"Meme, Base Ecosystem, Frog-Themed, Base Meme, The Boys Club"
LCAT,lion-cat,Lion Cat,LCAT,10648036.0,15050227.0,67108.0,"BNB Chain Ecosystem, Meme, Cat-Themed"
WALLET,ambire-wallet,Ambire Wallet,WALLET,10324482.0,10384054.0,313129.0,"Wallets, Polygon Ecosystem, Ethereum Ecosystem, Base Ecosystem, Account Abstraction"
JETTON,jetton,JetTon Games,JETTON,10069214.0,15685615.0,90513.0,"Gambling (GambleFi), Telegram Apps, TON Ecosystem"
BELLS,bellscoin,Bellscoin,BELLS,9742992.0,9743010.0,804163.0,"Smart Contract Platform, Layer 1 (L1), Meme, Proof of Work (PoW), Inscriptions, Made in USA"
CA,ca-htb,Coupon Assets,CA,9431599.0,138456715.0,4081274.0,"Retail, Ethereum Ecosystem"
LMT,limitus,LIMITUS,LMT,8712905.0,8712905.0,611617.0,"Artificial Intelligence (AI), Solana Ecosystem, Pump.fun Ecosystem, Binance Alpha Spotlight"
TRIAS,trias-token,TriasLab,TRIAS,8296981.0,8296981.0,387439.0,"Artificial Intelligence (AI), Smart Contract Platform, BNB Chain Ecosystem, Layer 1 (L1), Ethereum Ecosystem, AI Agents"
PPC,peercoin,Peercoin,PPC,8118529.0,8118529.0,108.94,"Smart Contract Platform, Polygon Ecosystem, Ethereum Ecosystem, Proof of Stake (PoS), Proof of Work (PoW)"
VRTX,vertex-protocol,Vertex,VRTX,7218372.0,13467579.0,893512.0,"Decentralized Exchange (DEX), Exchange-based Tokens, Decentralized Finance (DeFi), Derivatives, Perpetuals, Avalanche Ecosystem, Arbitrum Ecosystem, Mantle Ecosystem, Base Ecosystem, Blast Ecosystem, Sonic Ecosystem, Sei Network Ecosystem"
BUZZ,hive-ai,Hive AI,BUZZ,7206481.0,7206481.0,9810857.0,"Decentralized Finance (DeFi), Solana Ecosystem, AI Agents, Pump.fun Ecosystem, Binance Alpha Spotlight, DeFAI"
GRAM,gram-2,Gram,GRAM,7101098.0,7101098.0,10658.17,"TON Ecosystem, Proof of Work (PoW)"
SOVRN,sovrun,Sovrun,SOVRN,7081225.0,7627917.0,130556.0,"Gaming (GameFi), Metaverse, Ethereum Ecosystem, Animoca Brands Portfolio, Base Ecosystem, DWF Labs Portfolio, On-chain Gaming, Andreessen Horowitz (a16z) Portfolio, Hyperliquid Ecosystem, Delphi Ventures Portfolio, Circle Ventures Portfolio"
VISTA,ethervista,Ethervista,VISTA,6051429.0,6051429.0,982289.0,"Decentralized Exchange (DEX), Launchpad, Ethereum Ecosystem, Binance Alpha Spotlight"
ZKL,zklink,zkLink,ZKL,5987730.0,19780913.0,5110193.0,"Smart Contract Platform, Ethereum Ecosystem, Zero Knowledge (ZK), Layer 3 (L3), zkLink Nova Ecosystem, OKX Ventures Portfolio"
APP,moon-app,RWAX,APP,5929706.0,14703090.0,543659.0,"Tokenized Real Estate, Tokenized Assets, BNB Chain Ecosystem, Solana Ecosystem, Ethereum Ecosystem, Real World Assets (RWA), Injective Ecosystem, RWA Protocol"
HAPPY,happycat-2,Happy Cat,HAPPY,5498016.0,5498016.0,1148264.0,"BNB Chain Ecosystem, Solana Ecosystem, Meme, Cat-Themed, Binance Alpha Spotlight"
ELON4AFD,elon4afd,Elon4AfD,ELON4AFD,4758394.0,4758394.0,240226.0,"Solana Ecosystem, Meme, Elon Musk-Inspired, Pump.fun Ecosystem"
OBT,oobit,Oobit,OBT,4706207.0,13368984.0,63098.0,"BNB Chain Ecosystem, Ethereum Ecosystem, Payment Solutions"
OVR,ovr,Ovr,OVR,4486041.0,7682517.0,393069.0,"Augmented Reality, NFT, BNB Chain Ecosystem, Metaverse, Polygon Ecosystem, Ethereum Ecosystem, DePIN, Base Ecosystem"
RVF,rocketx,RocketX Exchange,RVF,4042918.0,4136022.0,32958.0,"Decentralized Exchange (DEX), Decentralized Finance (DeFi), Automated Market Maker (AMM), Ethereum Ecosystem, Poolz Finance Launchpad"
TET,tectum,Tectum,TET,3641813.0,4245142.0,284422.0,"Smart Contract Platform, Layer 1 (L1), Ethereum Ecosystem, Bitcoin Sidechains, SideChain"
AGC,argocoin-2,Argocoin,AGC,3631160.0,3631160.0,6182.79,"Artificial Intelligence (AI), Made in USA"
KIMA,kima,Kima Network,KIMA,3411687.0,18981901.0,458411.0,"Infrastructure, Cosmos Ecosystem, Arbitrum Ecosystem, Outlier Ventures Portfolio"
MUBI,multibit,Multibit,MUBI,3396397.0,3575155.0,2143185.0,"BNB Chain Ecosystem, Polygon Ecosystem, Ethereum Ecosystem, BRC-20, Inscriptions"
EGP,eigenpie,Eigenpie,EGP,3315172.0,8977563.0,3161870.0,"Decentralized Finance (DeFi), BNB Chain Ecosystem, Arbitrum Ecosystem, Restaking, Liquid Staking"
MOEW,moew,MOEW,MOEW,3314517.0,3314517.0,1079331.0,"Meme, Base Ecosystem, TON Ecosystem, Cat-Themed, Base Meme, TON Meme"
ICP,internet-computer,Internet Computer,ICP,2698997415.0,2698997415.0,55720438.0,"Artificial Intelligence (AI), Infrastructure, Smart Contract Platform, Layer 1 (L1), Internet Computer Ecosystem, Alleged SEC Securities, Multicoin Capital Portfolio, Layer 0 (L0), Andreessen Horowitz (a16z) Portfolio, GMCI Layer 1 Index, GMCI 30 Index, Blockchain Capital Portfolio, GMCI Index, Polychain Capital Portfolio, Coinbase 50 Index"
FTN,fasttoken,Fasttoken,FTN,1906964492.0,3851923874.0,60357911.0,"Smart Contract Platform, BNB Chain Ecosystem, Layer 1 (L1), Arbitrum Ecosystem, Ethereum Ecosystem, Base Ecosystem, Bahamut Ecosystem"
POL,polygon-ecosystem-token,POL (ex-MATIC),POL,1702054971.0,1978080748.0,72409149.0,"Smart Contract Platform, Polygon Ecosystem, Ethereum Ecosystem, Layer 2 (L2)"
STX,blockstack,Stacks,STX,1059904327.0,1059904327.0,36861618.0,"Infrastructure, Smart Contract Platform, Layer 2 (L2), Bitcoin Sidechains, Stacks Ecosystem, SideChain, GMCI Layer 2 Index, GMCI 30 Index, Blockchain Capital Portfolio, GMCI Index, Made in USA, Coinbase 50 Index"
AERO,aerodrome-finance,Aerodrome Finance,AERO,662682921.0,1304532815.0,36940052.0,"Decentralized Exchange (DEX), Decentralized Finance (DeFi), Automated Market Maker (AMM), Base Ecosystem, Binance Alpha Spotlight, Made in USA"
SYRUP,syrup,Maple Finance,SYRUP,587577151.0,653233275.0,137126920.0,"Decentralized Finance (DeFi), Yield Farming, Lending/Borrowing Protocols, Ethereum Ecosystem, Real World Assets (RWA), Base Ecosystem, Binance Alpha Spotlight"
DEXE,dexe,DeXe,DEXE,423368819.0,715487523.0,6678319.0,"Artificial Intelligence (AI), Decentralized Finance (DeFi), BNB Chain Ecosystem, Ethereum Ecosystem"
TEL,telcoin,Telcoin,TEL,367395706.0,399779150.0,1110645.0,"Decentralized Finance (DeFi), Wallets, Polygon Ecosystem, Arbitrum Ecosystem, Ethereum Ecosystem, Payment Solutions, Base Ecosystem, Made in USA"
ZK,zksync,ZKsync,ZK,353287459.0,1036720514.0,26073178.0,"Smart Contract Platform, Layer 2 (L2), Zero Knowledge (ZK), ZkSync Ecosystem, Consensys Portfolio, Blockchain Capital Portfolio, OKX Ventures Portfolio"
DCR,decred,Decred,DCR,265067805.0,265071493.0,3984487.0,"Smart Contract Platform, Privacy, Layer 1 (L1), Proof of Stake (PoS), Proof of Work (PoW), Blockchain Capital Portfolio, Made in USA"
MEW,cat-in-a-dogs-world,cat in a dogs world,MEW,243917707.0,243917707.0,31599030.0,"Solana Ecosystem, Meme, Dog-Themed, Solana Meme, Cat-Themed"
MINA,mina-protocol,Mina Protocol,MINA,220659653.0,220667082.0,11886629.0,"Smart Contract Platform, Layer 1 (L1), Zero Knowledge (ZK), FTX Holdings, Paradigm Portfolio, Coinbase Ventures Portfolio, Multicoin Capital Portfolio, Proof of Stake (PoS), Pantera Capital Portfolio, Circle Ventures Portfolio, Privacy Blockchain, Polychain Capital Portfolio, Made in USA, Coinbase 50 Index"
EUL,euler,Euler,EUL,210989867.0,306937989.0,3240038.0,"Lending/Borrowing Protocols, Ethereum Ecosystem, Paradigm Portfolio, Coinbase Ventures Portfolio"
ZIL,zilliqa,Zilliqa,ZIL,205158145.0,2.208291607095357e+26,11603207.0,"Smart Contract Platform, BNB Chain Ecosystem, GMCI Layer 1 Index, GMCI Index, Made in China"
YFI,yearn-finance,yearn.finance,YFI,175065757.0,189857664.0,17604109.0,"Decentralized Finance (DeFi), Yield Farming, Yield Aggregator, Yearn Ecosystem, Avalanche Ecosystem, Polygon Ecosystem, Near Protocol Ecosystem, Gnosis Chain Ecosystem, Fantom Ecosystem, Harmony Ecosystem, Arbitrum Ecosystem, Ethereum Ecosystem, Optimism Ecosystem, Base Ecosystem, Index Coop Defi Index, Alameda Research Portfolio, Energi Ecosystem, Sora Ecosystem, Huobi ECO Chain Ecosystem, Blockchain Capital Portfolio"
KMNO,kamino,Kamino,KMNO,137423942.0,617728551.0,10894725.0,"Decentralized Finance (DeFi), Lending/Borrowing Protocols, Solana Ecosystem, Binance Alpha Spotlight"
HIVE,hive,Hive,HIVE,108907581.0,,25186886.0,"Smart Contract Platform, SocialFi, Layer 1 (L1), Gaming Blockchains"
PEOPLE,constitutiondao,ConstitutionDAO,PEOPLE,95925857.0,95925857.0,39578101.0,"Meme, Ethereum Ecosystem, PolitiFi"
VVV,venice-token,Venice Token,VVV,93200492.0,214081735.0,4774904.0,"Artificial Intelligence (AI), Base Ecosystem, AI Agents, AI Applications, Made in USA"
MVL,mass-vehicle-ledger,MVL,MVL,86960041.0,89869165.0,2784862.0,"Internet of Things (IOT), BNB Chain Ecosystem, Ethereum Ecosystem, DePIN, DWF Labs Portfolio"
YGG,yield-guild-games,Yield Guild Games,YGG,82126264.0,155680940.0,15826349.0,"Gaming (GameFi), NFT, BNB Chain Ecosystem, Metaverse, Collectibles, Polygon Ecosystem, Play To Earn, Harmony Ecosystem, Guild and Scholarship, Ethereum Ecosystem, Animoca Brands Portfolio, Base Ecosystem, DWF Labs Portfolio, Ronin Ecosystem, Gaming Governance Token, Andreessen Horowitz (a16z) Portfolio, Delphi Ventures Portfolio, Abstract Ecosystem"
HFT,hashflow,Hashflow,HFT,79005012.0,135123516.0,258138480.0,"Decentralized Exchange (DEX), Exchange-based Tokens, Decentralized Finance (DeFi), BNB Chain Ecosystem, Binance Launchpool, MEV Protection, Ethereum Ecosystem, Coinbase Ventures Portfolio, Alameda Research Portfolio, DragonFly Capital Portfolio, Galaxy Digital Portfolio"
B3,b3,B3 (Base),B3,74110122.0,271794098.0,5969522.0,"Smart Contract Platform, Base Ecosystem, Gaming Blockchains"
USTC,terrausd,TerraClassicUSD,USTC,72354867.0,78834368.0,7990241.0,"Stablecoins, USD Stablecoin, Seigniorage, Alleged SEC Securities, Osmosis Ecosystem, Stablecoin Protocol, DeFiance Capital Portfolio, Terra Classic Ecosystem, YZi Labs (Prev. Binance Labs) Portfolio, Delphi Ventures Portfolio, Galaxy Digital Portfolio, Fiat-backed Stablecoin"
ACX,across-protocol,Across Protocol,ACX,69464544.0,140971487.0,19948904.0,"Polygon Ecosystem, Arbitrum Ecosystem, Ethereum Ecosystem, Optimism Ecosystem, Bridge Governance Tokens, Cross-chain Communication, Intent, Boba Network Ecosystem, Blockchain Capital Portfolio, Made in USA"
EWT,energy-web-token,Energy Web,EWT,69320666.0,78983052.0,336013.0,"Energy, Polkadot Ecosystem, Gnosis Chain Ecosystem, Regenerative Finance (ReFi), Real World Assets (RWA), Blockchain Capital Portfolio, Hydration Ecosystem"
CARV,carv,CARV,CARV,68335923.0,232881788.0,13462480.0,"Artificial Intelligence (AI), Infrastructure, Gaming (GameFi), NFT, Solana Ecosystem, Arbitrum Ecosystem, Impossible Finance Launchpad, Ethereum Ecosystem, Animoca Brands Portfolio, Base Ecosystem"
AGLD,adventure-gold,Adventure Gold,AGLD,67068923.0,67068923.0,16221522.0,"Ethereum Ecosystem, DWF Labs Portfolio"
AVAIL,avail,Avail,AVAIL,58672035.0,243788106.0,27715086.0,"Infrastructure, Smart Contract Platform, BNB Chain Ecosystem, Ethereum Ecosystem, Data Availability, Modular Blockchain, Binance Alpha Spotlight"
CONX,connex,Connex,CONX,58295784.0,5069198646.0,7867.2,BNB Chain Ecosystem
ISLM,islamic-coin,Islamic Coin,ISLM,57788353.0,607165989.0,523129.0,"Smart Contract Platform, Wallets, Layer 2 (L2), Osmosis Ecosystem"
CYBER,cyberconnect,CYBER,CYBER,55873257.0,127673628.0,13158847.0,"Smart Contract Platform, SocialFi, NFT, BNB Chain Ecosystem, Binance Launchpool, Ethereum Ecosystem, Decentralized Identifier (DID), Optimism Ecosystem, Layer 2 (L2), Animoca Brands Portfolio, Multicoin Capital Portfolio, YZi Labs (Prev. Binance Labs) Portfolio, Delphi Ventures Portfolio, Cyber Ecosystem, Optimism Superchain Ecosystem"
UNP,unipoly,Unipoly,UNP,53006238.0,189830026.0,1019648.0,"Gaming (GameFi), Ethereum Ecosystem, Skale Ecosystem"
SCR,scroll,Scroll,SCR,50947008.0,268142150.0,9719543.0,"Smart Contract Platform, Binance Launchpool, Layer 2 (L2), Scroll Ecosystem"
ZRC,zircuit,Zircuit,ZRC,50643195.0,230728751.0,11778518.0,"Smart Contract Platform, BNB Chain Ecosystem, Ethereum Ecosystem, Layer 2 (L2), Zero Knowledge (ZK), Restaking, Zircuit Ecosystem"
ALI,alethea-artificial-liquid-intelligence-token,Artificial Liquid Intelligence,ALI,43543535.0,47138599.0,1923764.0,"Artificial Intelligence (AI), NFT, Metaverse, Solana Ecosystem, Polygon Ecosystem, Ethereum Ecosystem, Cronos Ecosystem, Base Ecosystem, Multicoin Capital Portfolio, AI Agents, Alameda Research Portfolio, DeFiance Capital Portfolio, YZi Labs (Prev. Binance Labs) Portfolio"
VADER,vaderai-by-virtuals,VaderAI by Virtuals,VADER,43158265.0,43158265.0,1221012.0,"Artificial Intelligence (AI), Meme, Base Ecosystem, AI Meme, AI Agents, Virtuals Protocol Ecosystem, Binance Alpha Spotlight"
WNXM,wrapped-nxm,Wrapped NXM,WNXM,38267771.0,38267771.0,140535.0,"Crypto-Backed Tokens, Decentralized Finance (DeFi), Insurance, Wrapped-Tokens, Ethereum Ecosystem, Blockchain Capital Portfolio"
WHITE,whiteheart,Whiteheart,WHITE,37092134.0,37092134.0,107.3,"Decentralized Finance (DeFi), Derivatives, Ethereum Ecosystem"
STRIKE,strike,Strike,STRIKE,34239294.0,39920565.0,38993906.0,"Decentralized Finance (DeFi), Lending/Borrowing Protocols, Ethereum Ecosystem"
NCT,polyswarm,PolySwarm,NCT,33417339.0,33424646.0,311317.0,"Business Services, Polygon Ecosystem, Ethereum Ecosystem, Cybersecurity, Made in USA"
NYM,nym,Nym,NYM,33079854.0,40627800.0,2044918.0,"Smart Contract Platform, Privacy, Ethereum Ecosystem, DePIN, Osmosis Ecosystem, VPN, Andreessen Horowitz (a16z) Portfolio, YZi Labs (Prev. Binance Labs) Portfolio"
SWARMS,swarms,Swarms,SWARMS,28719928.0,28719928.0,23986852.0,"Artificial Intelligence (AI), Solana Ecosystem, AI Agents, Pump.fun Ecosystem, Binance Alpha Spotlight, AI Framework"
SYN,synapse-2,Synapse,SYN,21102476.0,24082269.0,3872757.0,"BNB Chain Ecosystem, Avalanche Ecosystem, Polygon Ecosystem, Fantom Ecosystem, Arbitrum Ecosystem, Olympus Pro Ecosystem, Ethereum Ecosystem, Optimism Ecosystem, Bridge Governance Tokens, Base Ecosystem, Alameda Research Portfolio, Intent"
KENDU,kendu-inu,Kendu Inu,KENDU,20479828.0,20580090.0,45327.0,"Solana Ecosystem, Meme, Ethereum Ecosystem, Base Ecosystem, Dog-Themed"
D,dar-open-network,Dar Open Network,D,20398191.0,25374336.0,2936356.0,"Gaming (GameFi), BNB Chain Ecosystem, Binance Launchpool, Play To Earn, Ethereum Ecosystem, Animoca Brands Portfolio, AI Agents"
J,jambo,Jambo,J,19244534.0,119525528.0,2803758.0,"Solana Ecosystem, Paradigm Portfolio, Coinbase Ventures Portfolio"
ADS,adshares,Adshares,ADS,18672377.0,18684337.0,38365.0,"Business Services, Decentralized Finance (DeFi), BNB Chain Ecosystem, Metaverse, Polygon Ecosystem, Ethereum Ecosystem, Base Ecosystem"
PEP,pepecoin-network,Pepecoin,PEP,18302415.0,18302415.0,173513.0,"Smart Contract Platform, Layer 1 (L1), Meme, Frog-Themed, Proof of Work (PoW), The Boys Club, 4chan-Themed"
SWEAT,sweatcoin,SWEAT,SWEAT,17752742.0,49109373.0,6955746.0,"Sports, Gaming (GameFi), BNB Chain Ecosystem, Solana Ecosystem, Avalanche Ecosystem, Polygon Ecosystem, Near Protocol Ecosystem, Play To Earn, Arbitrum Ecosystem, Celo Ecosystem, Move To Earn, Ethereum Ecosystem, Optimism Ecosystem, Aptos Ecosystem, Sui Ecosystem, Base Ecosystem, Gaming Governance Token, Gaming Utility Token, OKX Ventures Portfolio"
INV,inverse-finance,Inverse Finance,INV,17311961.0,17873241.0,380860.0,"Decentralized Finance (DeFi), Yield Farming, Yield Aggregator, Lending/Borrowing Protocols, Olympus Pro Ecosystem, Ethereum Ecosystem, Fixed Interest"
UPC,upcx,UPCX,UPC,14711266.0,2765866878.0,1038323.0,Ethereum Ecosystem
CHEQ,cheqd-network,CHEQD Network,CHEQ,13794555.0,18307526.0,334346.0,"Smart Contract Platform, Ethereum Ecosystem, Decentralized Identifier (DID), Zero Knowledge (ZK), Animoca Brands Portfolio, Osmosis Ecosystem, Outlier Ventures Portfolio"
