HOT,holotoken,Holo,HOT,71852920.0,71852920.0,3699960.0,"Smart Contract Platform, Storage, Harmony Ecosystem, Arbitrum Ecosystem, Ethereum Ecosystem, DePIN, Base Ecosystem, Energi Ecosystem, Sora Ecosystem, GMCI DePIN Index, GMCI Index"
CCD,concordium,Concordium,CCD,57672225.0,69132823.0,3257161.0,"Smart Contract Platform, Layer 1 (L1), Decentralized Identifier (DID), Zero Knowledge (ZK), Payment Solutions, Privacy Blockchain, x402 Ecosystem, Privacy Infrastructure, Privacy"
BLUR,blur,Blur,BLUR,56242141.0,60984648.0,28831626.0,"NFT, Ethereum Ecosystem, NFT Marketplace, FTX Holdings, NFTFi, eGirl Capital Portfolio, Paradigm Portfolio, GMCI DeFi Index, GMCI Index, Made in USA, Coinbase 50 Index"
CSPR,casper-network,Casper Network,CSPR,49291682.0,60130410.0,1711290.0,"Smart Contract Platform, Layer 1 (L1), Real World Assets (RWA), Proof of Stake (PoS), GMCI Layer 1 Index, GMCI Index, Made in USA, CoinList Launchpad"
NOW,changenow,ChangeNOW,NOW,46156087.0,53886261.0,5596.14,"Decentralized Exchange (DEX), Exchange-based Tokens, BNB Chain Ecosystem, Ethereum Ecosystem"
BCH,binance-peg-bitcoin-cash,Binance-Peg Bitcoin Cash,BCH,44863326.0,44863326.0,44133.0,"BNB Chain Ecosystem, Binance-Peg Tokens"
UNP,unipoly,Unipoly,UNP,43928412.0,157319814.0,314025.0,"Gaming (GameFi), BNB Chain Ecosystem, Layer 1 (L1), Ethereum Ecosystem, Gaming Blockchains, Gaming Platform, Skale Ecosystem"
EDU,edu-coin,Open Campus,EDU,36271242.0,59158874.0,4587246.0,"Education, BNB Chain Ecosystem, Polygon Ecosystem, Ethereum Ecosystem, Binance Launchpad, YZi Labs (Prev. Binance Labs) Portfolio"
FAI,freysa-ai,Freysa AI,FAI,36198826.0,36198826.0,1399442.0,"Artificial Intelligence (AI), Base Ecosystem, AI Agents, Binance Alpha Spotlight, AI Framework, Base Native"
SWFTC,swftcoin,SWFTCOIN,SWFTC,34229520.0,34229520.0,519007.0,"NFT, BNB Chain Ecosystem, Ethereum Ecosystem, Dex Aggregator"
SQD,subsquid,SQD,SQD,33521442.0,43073817.0,1707311.0,"Artificial Intelligence (AI), Big Data, Analytics, BNB Chain Ecosystem, Arbitrum Ecosystem, Base Ecosystem, CoinList Launchpad, Base Native"
PEOPLE,constitutiondao,ConstitutionDAO,PEOPLE,33465245.0,33465245.0,8660686.0,"Meme, Ethereum Ecosystem, PolitiFi"
NIZA,niza-global-2,Niza Global,NIZA,33280999.0,33280999.0,848812.0,"Exchange-based Tokens, Centralized Exchange (CEX) Token, Ethereum Ecosystem"
ACH,alchemy-pay,Alchemy Pay,ACH,31645877.0,64012651.0,4506986.0,"BNB Chain Ecosystem, Ethereum Ecosystem, Payment Solutions, DWF Labs Portfolio, Made in China"
HBD,hive_dollar,Hive Dollar,HBD,30637786.0,30637786.0,127.39,"Stablecoins, USD Stablecoin, Algorithmic Stablecoin"
CYBER,cyberconnect,CYBER,CYBER,30138499.0,49211645.0,7232906.0,"Artificial Intelligence (AI), Smart Contract Platform, SocialFi, NFT, BNB Chain Ecosystem, Binance Launchpool, Ethereum Ecosystem, Decentralized Identifier (DID), Optimism Ecosystem, Layer 2 (L2), Animoca Brands Portfolio, Multicoin Capital Portfolio, YZi Labs (Prev. Binance Labs) Portfolio, Delphi Ventures Portfolio, Cyber Ecosystem, Optimism Superchain Ecosystem, AI Applications, Governance, CoinList Launchpad"
CARV,carv,CARV,CARV,29702137.0,55886100.0,3992592.0,"Artificial Intelligence (AI), Infrastructure, Gaming (GameFi), NFT, BNB Chain Ecosystem, Solana Ecosystem, Arbitrum Ecosystem, Impossible Finance Launchpad, Ethereum Ecosystem, Animoca Brands Portfolio, Base Ecosystem, Binance Alpha Spotlight, Base Native"
BLAST,blast,Blast,BLAST,27385329.0,46736753.0,7011941.0,"Smart Contract Platform, Layer 2 (L2), eGirl Capital Portfolio, Paradigm Portfolio, Blast Ecosystem"
EWT,energy-web-token,Energy Web Token,EWT,27076296.0,35692632.0,417392.0,"Energy, Polkadot Ecosystem, Gnosis Chain Ecosystem, Ethereum Ecosystem, Regenerative Finance (ReFi), Real World Assets (RWA), Blockchain Capital Portfolio, Hydration Ecosystem"
AP3X,apex-4,APEX,AP3X,26022937.0,50059104.0,14.21,Layer 1 (L1)
YGG,yield-guild-games,Yield Guild Games,YGG,24961618.0,34759206.0,14273448.0,"Gaming (GameFi), NFT, BNB Chain Ecosystem, Metaverse, Collectibles, Polygon Ecosystem, Play To Earn, Harmony Ecosystem, Guild and Scholarship, Ethereum Ecosystem, Animoca Brands Portfolio, Base Ecosystem, DWF Labs Portfolio, Ronin Ecosystem, Gaming Governance Token, Andreessen Horowitz (a16z) Portfolio, Delphi Ventures Portfolio, Abstract Ecosystem"
USTC,terrausd,TerraClassicUSD,USTC,24869992.0,27110929.0,886255.0,"Stablecoins, USD Stablecoin, Seigniorage, Alleged SEC Securities, Osmosis Ecosystem, DeFiance Capital Portfolio, Terra Classic Ecosystem, YZi Labs (Prev. Binance Labs) Portfolio, Delphi Ventures Portfolio, Galaxy Digital Portfolio, Fiat-backed Stablecoin"
WNXM,wrapped-nxm,Wrapped NXM,WNXM,23108036.0,23108036.0,70102.0,"Crypto-Backed Tokens, Insurance, Wrapped-Tokens, Ethereum Ecosystem, Blockchain Capital Portfolio"
AGLD,adventure-gold,Adventure Gold,AGLD,20249132.0,21499794.0,3750487.0,"Ethereum Ecosystem, DWF Labs Portfolio"
DOT,binance-peg-polkadot,Binance-Peg Polkadot,DOT,20088225.0,20088225.0,44501.0,"Crypto-Backed Tokens, BNB Chain Ecosystem, Binance-Peg Tokens"
CETUS,cetus-protocol,Cetus Protocol,CETUS,19411395.0,21042989.0,17004959.0,"Decentralized Exchange (DEX), Exchange-based Tokens, Decentralized Finance (DeFi), Sui Ecosystem, Animoca Brands Portfolio, OKX Ventures Portfolio, Dex Aggregator"
DORA,dora-2,DORA,DORA,16406801.0,16406801.0,23184.0,"BNB Chain Ecosystem, Meme, Binance Alpha Spotlight, Chinese Meme"
SGB,songbird,Songbird,SGB,16343885.0,18841789.0,73376.0,Smart Contract Platform
DODO,dodo,DODO,DODO,14071076.0,14071076.0,1092534.0,"Decentralized Exchange (DEX), Exchange-based Tokens, Decentralized Finance (DeFi), BNB Chain Ecosystem, Binance Launchpool, Polygon Ecosystem, Near Protocol Ecosystem, Arbitrum Ecosystem, Ethereum Ecosystem, DWF Labs Portfolio, Coinbase Ventures Portfolio, Alameda Research Portfolio, DeFiance Capital Portfolio, Pantera Capital Portfolio, Aurora Ecosystem, Energi Ecosystem, YZi Labs (Prev. Binance Labs) Portfolio, Galaxy Digital Portfolio, Made in China"
ABEY,abey,Abey,ABEY,13686502.0,17612606.0,20922.0,"Smart Contract Platform, Layer 1 (L1), Proof of Work (PoW)"
NCT,polyswarm,PolySwarm,NCT,11446224.0,11448727.0,111749.0,"Polygon Ecosystem, Ethereum Ecosystem, Cybersecurity, Made in USA"
INV,inverse-finance,Inverse Finance,INV,10495425.0,10779742.0,27693.0,"Decentralized Finance (DeFi), Yield Farming, Yield Aggregator, Olympus Pro Ecosystem, Ethereum Ecosystem, Fixed Interest"
SYN,synapse-2,Synapse,SYN,9898746.0,11296506.0,1465147.0,"BNB Chain Ecosystem, Avalanche Ecosystem, Polygon Ecosystem, Fantom Ecosystem, Arbitrum Ecosystem, Olympus Pro Ecosystem, Ethereum Ecosystem, Optimism Ecosystem, Bridge Governance Tokens, Base Ecosystem, Alameda Research Portfolio, Intent"
LAT,platon-network,PlatON Network,LAT,9094330.0,13588306.0,3142098.0,"Smart Contract Platform, Appchains"
CTF,crypto-trading-fund,Crypto Trading Fund,CTF,8903219.0,8903219.0,16.17,"Polygon Ecosystem, XRP Ledger Ecosystem"
RNT,reental,Reental,RNT,8104331.0,30543719.0,8520.41,"Tokenized Real Estate, Tokenized Assets, Polygon Ecosystem, Real World Assets (RWA), RWA Protocol"
PIVX,pivx,PIVX,PIVX,8067048.0,8067048.0,1178759.0,"Smart Contract Platform, Privacy Coins, Masternodes, Zero Knowledge (ZK), Proof of Stake (PoS), Privacy"
BEL,bella-protocol,Bella Protocol,BEL,7606386.0,9507982.0,1594227.0,"Decentralized Finance (DeFi), Yield Farming, BNB Chain Ecosystem, Binance Launchpool, Yield Aggregator, Ethereum Ecosystem, Manta Network Ecosystem, YZi Labs (Prev. Binance Labs) Portfolio"
TUT,tutorial,Tutorial,TUT,7331343.0,7331343.0,2478060.0,"BNB Chain Ecosystem, Meme, AI Meme, AI Agents, Four.meme Ecosystem (BNB Memes)"
SMOLE,smolecoin,smolecoin,SMOLE,7302304.0,7302304.0,541.78,"Solana Ecosystem, Meme"
POR,portugal-national-team-fan-token,Portugal National Team Fan Token,POR,6974509.0,12173652.0,389071.0,"Sports, Fan Token, Chiliz Ecosystem"
CWEB,coinweb,Coinweb,CWEB,6953133.0,8042810.0,97622.0,"Smart Contract Platform, Wallets, Ethereum Ecosystem, Interoperability, Layer 2 (L2), Cross-chain Communication, Bitcoin Sidechains, SideChain"
NEON,neon,Neon,NEON,6924811.0,28917779.0,718549.0,"Smart Contract Platform, Solana Ecosystem, Neon Ecosystem, Parallelized EVM, CoinList Launchpad"
PORTAL,portal-2,Portal,PORTAL,6891891.0,9016123.0,1708122.0,"Gaming (GameFi), Solana Ecosystem, Ethereum Ecosystem, Base Ecosystem, Gaming Platform"
MAVIA,heroes-of-mavia,Heroes of Mavia,MAVIA,6821205.0,6970822.0,1112387.0,"Gaming (GameFi), NFT, BNB Chain Ecosystem, Ethereum Ecosystem, Animoca Brands Portfolio, Base Ecosystem, Gaming Governance Token, Strategy Games, Alameda Research Portfolio, YZi Labs (Prev. Binance Labs) Portfolio, Delphi Ventures Portfolio, Action Games, Base Native"
PNG,pangolin,Pangolin,PNG,6544705.0,15290704.0,440708.0,"Decentralized Exchange (DEX), Exchange-based Tokens, Decentralized Finance (DeFi), Avalanche Ecosystem, Olympus Pro Ecosystem"
PHB,phoenix-global,Phoenix,PHB,6282101.0,6282101.0,1839981.0,"Artificial Intelligence (AI), Oracle, NFT, BNB Chain Ecosystem, DePIN, Made in China"
SPARKLET,upland,Upland,SPARKLET,6062909.0,22318855.0,176566.0,"Gaming (GameFi), NFT, Metaverse, Play To Earn, Ethereum Ecosystem, Animoca Brands Portfolio, Made in USA"
M87,messier,MESSIER,M87,5447202.0,5447202.0,250350.0,"Artificial Intelligence (AI), Decentralized Exchange (DEX), Decentralized Finance (DeFi), Ethereum Ecosystem, Zero Knowledge (ZK)"
OCTA,octaspace,OctaSpace,OCTA,4863059.0,4863059.0,170636.0,"Artificial Intelligence (AI), Internet of Things (IOT), Smart Contract Platform, BNB Chain Ecosystem, Layer 1 (L1), Ethereum Ecosystem, DePIN, AI Agents"
ALU,altura,Altura,ALU,4456573.0,6004758.0,1639158.0,"Artificial Intelligence (AI), Infrastructure, NFT, BNB Chain Ecosystem, NFT Marketplace, Base Ecosystem, Gaming Platform, Made in USA, Gaming Marketplace, Base Native"
GHST,aavegotchi,Aavegotchi,GHST,4129476.0,4257868.0,557612.0,"Smart Contract Platform, Gaming (GameFi), NFT, Metaverse, Collectibles, Polygon Ecosystem, Meme, Play To Earn, Ethereum Ecosystem, Gotchiverse, Base Ecosystem, Layer 3 (L3), RPG, Gaming Governance Token, Gaming Utility Token, Energi Ecosystem, Governance, Base Native"
D,dar-open-network,Dar Open Network,D,4069864.0,5062709.0,10842628.0,"Gaming (GameFi), BNB Chain Ecosystem, Binance Launchpool, Play To Earn, Ethereum Ecosystem, Animoca Brands Portfolio, AI Agents"
EVR,evernode,Evernode,EVR,3862929.0,7716607.0,2693.54,"Smart Contract Platform, Layer 2 (L2), DePIN"
FLAY,flayer,Flayer,FLAY,3856272.0,6427120.0,624.56,"Launchpad, Ethereum Ecosystem, Base Native"
TKO,tokocrypto,Tokocrypto,TKO,3848485.0,25656570.0,436424.0,"BNB Chain Ecosystem, Binance Launchpad, YZi Labs (Prev. Binance Labs) Portfolio"
CROWN,crown-by-third-time-games,Crown by Third Time Games,CROWN,3744869.0,3744869.0,10217.02,"Gaming (GameFi), Solana Ecosystem, Animal Racing, Gaming Utility Token, Sports Games, Made in USA"
SHIDO,shido-2,Shido Network,SHIDO,3285600.0,3285600.0,86394.0,"Decentralized Finance (DeFi), Ethereum Ecosystem, Osmosis Ecosystem, Shido Network Ecosystem"
FEG,feg-token-2,FEED EVERY GORILLA,FEG,3252503.0,3252503.0,321381.0,"Decentralized Finance (DeFi), BNB Chain Ecosystem, Launchpad, Meme, Liquid Staking"
FORTH,ampleforth-governance-token,Ampleforth Governance,FORTH,3232160.0,4619520.0,2001360.0,"Ethereum Ecosystem, Stablecoin Issuer, Governance"
KENDU,kendu-inu,Kendu,KENDU,3196545.0,3207381.0,45605.0,"Solana Ecosystem, Meme, Ethereum Ecosystem, Base Ecosystem, Dog-Themed, Base Native"
DYDX,dydx,dYdX,ETHDYDX,3024337.0,84119926.0,9403135.0,"Decentralized Exchange (DEX), Exchange-based Tokens, Decentralized Finance (DeFi), Derivatives, Perpetuals, Ethereum Ecosystem, Paradigm Portfolio"
DROP,drop-2,DROP,DROP,3020703.0,3020700.0,103.92,"Meme, XRP Ledger Ecosystem"
NIBI,nibiru,Nibiru,NIBI,3012950.0,3313931.0,305585.0,"Infrastructure, Smart Contract Platform, Layer 1 (L1), Osmosis Ecosystem, Made in USA, CoinList Launchpad"
IZI,izumi-finance,iZUMi Finance,IZI,2981743.0,7573641.0,37046.0,"Decentralized Exchange (DEX), Exchange-based Tokens, Decentralized Finance (DeFi), Automated Market Maker (AMM), BNB Chain Ecosystem, Polygon Ecosystem, Arbitrum Ecosystem, Ethereum Ecosystem, ZkSync Ecosystem, Mantle Ecosystem, Linea Ecosystem, Base Ecosystem, Manta Network Ecosystem, Scroll Ecosystem"
CHEQ,cheqd-network,CHEQD Network,CHEQ,2973397.0,3744621.0,144326.0,"Smart Contract Platform, Ethereum Ecosystem, Decentralized Identifier (DID), Zero Knowledge (ZK), Animoca Brands Portfolio, Osmosis Ecosystem, Outlier Ventures Portfolio"
RMV,reality-metaverse,Reality Metaverse,RMV,2891773.0,3883644.0,72764.0,"Gaming (GameFi), NFT, Metaverse, Polygon Ecosystem, Play To Earn, Ethereum Ecosystem, DWF Labs Portfolio, Gaming Utility Token"
CPH,cypherium,Cypherium,CPH,2833830.0,35787260.0,55750.0,"Smart Contract Platform, Layer 1 (L1), Proof of Work (PoW), Pantera Capital Portfolio"
GHUB,gemhub,GemHUB,GHUB,2728565.0,8359486.0,228435.0,"Gaming (GameFi), Kaia Ecosystem"
LOFI,lofi-2,LOFI,LOFI,2699443.0,2699443.0,48315.0,"Meme, Sui Ecosystem, Sui Meme"
BRN,brn-metaverse,BRN Metaverse,BRN,2672274.0,2969205.0,118416.0,"Gaming (GameFi), BNB Chain Ecosystem, Metaverse"
REDO,resistance-dog,Resistance Dog,REDO,2463416.0,2463416.0,68710.0,"Meme, Dog-Themed, TON Ecosystem, TON Meme"
XSWAP,xswap-2,XSwap,XSWAP,2263324.0,2323817.0,85144.0,"Decentralized Finance (DeFi), Ethereum Ecosystem, Base Ecosystem, Cross-chain Communication, Base Native"
CDX,cod3x,Cod3x,CDX,2241143.0,2241143.0,660.3,"Artificial Intelligence (AI), Solana Ecosystem, Base Ecosystem, AI Agent Launchpad, AI Framework, DeFAI, x402 Ecosystem, Base Native"
PEIPEI,chinese-pepe,Chinese PEPE,PEIPEI,2229650.0,2229650.0,12.07,"BNB Chain Ecosystem, Meme, Frog-Themed, The Boy’s Club"
FIS,stafi,Stafi,FIS,2211176.0,2211176.0,114929.0,"Decentralized Finance (DeFi), Ethereum Ecosystem, Liquid Staking Governance Tokens, Osmosis Ecosystem, Sora Ecosystem, Liquid Staking"
TCAPY,toncapy,TonCapy,TCAPY,2174474.0,2174474.0,56236.0,"BNB Chain Ecosystem, Meme"
CSWAP,chainswap-3,ChainSwap,CSWAP,2110759.0,2110759.0,1123.74,"Decentralized Exchange (DEX), Exchange-based Tokens, Decentralized Finance (DeFi), Ethereum Ecosystem, Cross-chain Communication"
STAT,stat,STAT,STAT,2015899.0,2573523.0,292938.0,"Media, Ethereum Ecosystem"
SOV,sovryn,Sovryn,SOV,1945310.0,3554483.0,32392.0,"Smart Contract Platform, Ethereum Ecosystem, Bitcoin Sidechains, SideChain, Rootstock Ecosystem"
XEL,xelis,Xelis,XEL,1813312.0,1813312.0,28375.0,"Smart Contract Platform, Layer 1 (L1), Privacy Blockchain, Directed Acyclic Graph (DAG)"
XTZ,binance-peg-tezos-token,Binance-Peg Tezos Token,XTZ,1808173.0,1808173.0,642.55,"BNB Chain Ecosystem, Binance-Peg Tokens"
BENJI,basenji,Basenji,BENJI,1775645.0,1775645.0,288514.0,"Meme, Base Ecosystem, Dog-Themed, Base Meme, IP Meme, Base Native"
HTX,htx-dao,HTX DAO,HTX,1555781207.0,1555781207.0,17697715.0,"Exchange-based Tokens, BNB Chain Ecosystem, Centralized Exchange (CEX) Token, Ethereum Ecosystem, Tron Ecosystem"
KAS,kaspa,Kaspa,KAS,892638488.0,893438233.0,19712792.0,"Smart Contract Platform, Layer 1 (L1), Wallets, Proof of Work (PoW), Kaspa Ecosystem, Made in USA, Directed Acyclic Graph (DAG)"
VET,vechain,VeChain,VET,583702044.0,583702044.0,14928492.0,"Internet of Things (IOT), Smart Contract Platform, Layer 1 (L1), VeChain Ecosystem, Made in China"
ZRO,layerzero,LayerZero,ZRO,479434653.0,1900017887.0,40510805.0,"Smart Contract Platform, BNB Chain Ecosystem, Avalanche Ecosystem, Polygon Ecosystem, Arbitrum Ecosystem, Ethereum Ecosystem, Optimism Ecosystem, Base Ecosystem, Multicoin Capital Portfolio, Layer 0 (L0), Cross-chain Communication, Circle Ventures Portfolio, Sequoia Capital Portfolio, OKX Ventures Portfolio, Base Native"
ETHFI,ether-fi,Ether.fi,ETHFI,377497730.0,478803520.0,31637740.0,"Decentralized Finance (DeFi), Binance Launchpool, Arbitrum Ecosystem, Ethereum Ecosystem, Base Ecosystem, Scroll Ecosystem, Restaking, Liquid Restaking Governance Tokens, Ether.fi Ecosystem, Consensys Portfolio, OKX Ventures Portfolio, Neobank"
BSV,bitcoin-cash-sv,Bitcoin SV,BSV,278631937.0,278633243.0,8267359.0,"Smart Contract Platform, Bitcoin Fork, Proof of Work (PoW)"
TWT,trust-wallet-token,Trust Wallet,TWT,149828552.0,359602995.0,57751621.0,"BNB Chain Ecosystem, Wallets, Account Abstraction, Energi Ecosystem"
GALA,gala,GALA,GALA,137787521.0,137787521.0,15946881.0,"Smart Contract Platform, Gaming (GameFi), NFT, Solana Ecosystem, Layer 1 (L1), Play To Earn, Ethereum Ecosystem, DWF Labs Portfolio, Gaming Platform, YZi Labs (Prev. Binance Labs) Portfolio, GalaChain Ecosystem, Made in USA"
HSK,hashkey-ecopoints,HashKey Platform Token,HSK,54493721.0,157971127.0,213135.0,"Exchange-based Tokens, Centralized Exchange (CEX) Token, Ethereum Ecosystem, Governance"
MOCA,mocaverse,Moca Network,MOCA,53310277.0,115777219.0,4406038.0,"Gaming (GameFi), Ethereum Ecosystem, Decentralized Identifier (DID), Animoca Brands Portfolio, Base Ecosystem, OKX Ventures Portfolio, Outlier Ventures Portfolio, CoinList Launchpad, Base Native"
JELLYJELLY,jelly-my-jelly,Jelly-My-Jelly,JELLYJELLY,52484146.0,52484146.0,3653959.0,"Solana Ecosystem, Pump.fun Ecosystem, Binance Alpha Spotlight"
DUSK,dusk-network,DUSK,DUSK,51564849.0,51564849.0,6438735.0,"Smart Contract Platform, BNB Chain Ecosystem, Layer 1 (L1), Ethereum Ecosystem, Zero Knowledge (ZK), Real World Assets (RWA), YZi Labs (Prev. Binance Labs) Portfolio, Privacy Blockchain"
FLOW,flow,Flow,FLOW,49155304.0,49155304.0,8211761.0,"Smart Contract Platform, Sports, NFT, Layer 1 (L1), Animoca Brands Portfolio, Alleged SEC Securities, Multicoin Capital Portfolio, Proof of Stake (PoS), Flow Ecosystem, Andreessen Horowitz (a16z) Portfolio, CoinList Launchpad"
ANKR,ankr,Ankr Network,ANKR,48964381.0,48964381.0,24243615.0,"BNB Chain Ecosystem, Avalanche Ecosystem, Polygon Ecosystem, Fantom Ecosystem, Arbitrum Ecosystem, Ethereum Ecosystem, Optimism Ecosystem, Liquid Staking Governance Tokens, Linea Ecosystem, DePIN, Scroll Ecosystem, Rollups-as-a-Service (RaaS), Blast Ecosystem, Mode Ecosystem, Pantera Capital Portfolio, Polygon zkEVM Ecosystem, YZi Labs (Prev. Binance Labs) Portfolio, Liquid Staking, Made in USA, Governance"
XVS,venus,Venus,XVS,45781910.0,81236326.0,2954568.0,"Decentralized Finance (DeFi), Yield Farming, BNB Chain Ecosystem, Binance Launchpool, Lending/Borrowing Protocols, Arbitrum Ecosystem, Ethereum Ecosystem, Optimism Ecosystem, ZkSync Ecosystem, opBNB Ecosystem, Unichain Ecosystem"
GOHOME,gohome,GOHOME,GOHOME,45702445.0,871121105.0,774654.0,"Solana Ecosystem, Meme"
ALTLAYER,altlayer,AltLayer,ALT,36910367.0,62323370.0,10986125.0,"Smart Contract Platform, BNB Chain Ecosystem, Binance Launchpool, Ethereum Ecosystem, Layer 2 (L2), Restaking, Rollups-as-a-Service (RaaS), Rollup, YZi Labs (Prev. Binance Labs) Portfolio, Governance"
RIF,rif-token,Rootstock Infrastructure Framework,RIF,34347145.0,34347145.0,880204.0,"Solana Ecosystem, Arbitrum Ecosystem, Ethereum Ecosystem, Base Ecosystem, Rootstock Ecosystem, Outlier Ventures Portfolio"
SSV,ssv-network,SSV Network,SSV,33075971.0,33075971.0,6284901.0,"Decentralized Finance (DeFi), Ethereum Ecosystem, Restaking, Coinbase Ventures Portfolio, OKX Ventures Portfolio, Liquid Staking"
OMI,ecomi,ECOMI,OMI,31442208.0,36075929.0,875740.0,"Gaming (GameFi), NFT, Metaverse, Collectibles, Play To Earn, Ethereum Ecosystem, Base Ecosystem, Energi Ecosystem, Base Native"
QUAI,quai-network,Quai Network,QUAI,30423583.0,30423583.0,298508.0,"Smart Contract Platform, Layer 1 (L1), Proof of Work (PoW), Privacy Blockchain, Made in USA, Quai Network Ecosystem"
PHA,pha,PHALA,PHA,28913432.0,34719770.0,13201418.0,"Artificial Intelligence (AI), Infrastructure, Smart Contract Platform, Oracle, Polkadot Ecosystem, Ethereum Ecosystem, Interoperability, Layer 2 (L2), Zero Knowledge (ZK), DePIN, DWF Labs Portfolio, Rollup, AI Agents, Sora Ecosystem, AI Framework, Made in USA"
CTK,certik,Shentu,CTK,25772351.0,26255921.0,4278707.0,"Binance Launchpool, Osmosis Ecosystem, Coinbase Ventures Portfolio, Cybersecurity, YZi Labs (Prev. Binance Labs) Portfolio, OKX Ventures Portfolio"
BR,bedrock-token,Bedrock,BR,25735120.0,102428338.0,8898570.0,"Decentralized Finance (DeFi), BNB Chain Ecosystem, Ethereum Ecosystem, Liquid Staking Governance Tokens, Base Ecosystem, Berachain Ecosystem, BTCfi Protocol, Binance Wallet IDO"
C98,coin98,Coin98,C98,25276024.0,25276053.0,2212485.0,"Decentralized Finance (DeFi), BNB Chain Ecosystem, Perpetuals, Solana Ecosystem, Wallets, Polygon Ecosystem, Ethereum Ecosystem, Binance Launchpad, DWF Labs Portfolio, Multicoin Capital Portfolio, Alameda Research Portfolio, Viction Ecosystem, YZi Labs (Prev. Binance Labs) Portfolio"
MPC,my-paqman-coin,My Paqman Coin,MPC,19932051.0,19932051.0,94077.0,Meme
MMUI,metamui,MetaMUI,MMUI,19341477.0,32514181.0,555674.0,"Avalanche Ecosystem, Decentralized Identifier (DID)"
POND,marlin,Marlin,POND,17734478.0,21621099.0,640321.0,"Artificial Intelligence (AI), Infrastructure, Smart Contract Platform, Decentralized Finance (DeFi), Arbitrum Ecosystem, Ethereum Ecosystem, Zero Knowledge (ZK), DWF Labs Portfolio, Coinbase Ventures Portfolio, Pantera Capital Portfolio, YZi Labs (Prev. Binance Labs) Portfolio"
MPLX,metaplex,Metaplex,MPLX,15877945.0,30316816.0,910029.0,"Gaming (GameFi), NFT, BNB Chain Ecosystem, Solana Ecosystem, Launchpad, Animoca Brands Portfolio, FTX Holdings, Multicoin Capital Portfolio, Alameda Research Portfolio, Binance Alpha Spotlight"
STORJ,storj,Storj,STORJ,13136519.0,38828291.0,3833103.0,"Storage, Harmony Ecosystem, Ethereum Ecosystem, DePIN, Energi Ecosystem"
XAI,sideshift-token,SideShift,XAI,13135962.0,17665156.0,3127.81,Ethereum Ecosystem
TRIBE,tribe-2,Tribe,TRIBE,12629776.0,332546510.0,7442.56,"Decentralized Finance (DeFi), Ethereum Ecosystem, Stablecoin Issuer"
GLMR,moonbeam,Moonbeam,GLMR,11535357.0,12942075.0,1942005.0,"Smart Contract Platform, Polkadot Ecosystem, Layer 1 (L1), Coinbase Ventures Portfolio, Proof of Stake (PoS), YZi Labs (Prev. Binance Labs) Portfolio"
WUSD,worldwide-usd,Worldwide USD,WUSD,11530066.0,11530066.0,116387.0,"Stablecoins, USD Stablecoin, Polygon Ecosystem, Ethereum Ecosystem, Viction Ecosystem, Fiat-backed Stablecoin"
PORTO,fc-porto,FC Porto,PORTO,11359758.0,40111407.0,959748.0,"Sports, BNB Chain Ecosystem, Fan Token, Binance Launchpad"
GFI,goldfinch,Goldfinch,GFI,10998959.0,13453279.0,77282.0,"Decentralized Finance (DeFi), Lending/Borrowing Protocols, Ethereum Ecosystem, Real World Assets (RWA), Coinbase Ventures Portfolio, Andreessen Horowitz (a16z) Portfolio, RWA Protocol, Made in USA"
SFI,saffron-finance,saffron.finance,SFI,10678431.0,12289582.0,160531.0,"Decentralized Finance (DeFi), Yield Farming, Ethereum Ecosystem, Fixed Interest, Coinbase Ventures Portfolio, Multicoin Capital Portfolio, DragonFly Capital Portfolio, Energi Ecosystem"
PUFFER,puffer-finance,Puffer,PUFFER,10612367.0,25541094.0,4341227.0,"Smart Contract Platform, BNB Chain Ecosystem, Ethereum Ecosystem, Layer 2 (L2), Restaking, Liquid Restaking Governance Tokens, Rollup, Liquid Staking, Binance Alpha Spotlight, Made in USA"
QI,benqi,BENQI,QI,9955283.0,9955283.0,376210.0,"Decentralized Finance (DeFi), Yield Farming, Binance Launchpool, Lending/Borrowing Protocols, Avalanche Ecosystem, Liquid Staking Governance Tokens, DragonFly Capital Portfolio, Liquid Staking"
WILD,wilder-world,Wilder World,WILD,9206335.0,9604788.0,353958.0,"Gaming (GameFi), NFT, BNB Chain Ecosystem, Metaverse, Solana Ecosystem, Avalanche Ecosystem, Polygon Ecosystem, Play To Earn, Ethereum Ecosystem, Animoca Brands Portfolio, Base Ecosystem, Gaming Governance Token, Racing Games, Simulation Games, Action Games, Base Native"
UFD,unicorn-fart-dust,Unicorn Fart Dust,UFD,8809203.0,8809203.0,340660.0,"Solana Ecosystem, Meme, Solana Meme, Pump.fun Ecosystem, Binance Alpha Spotlight, Made in USA, IP Meme"
PEPECOIN,pepecoin-2,PepeCoin,PEPECOIN,8107896.0,8996535.0,176412.0,"Gaming (GameFi), NFT, Solana Ecosystem, Meme, Ethereum Ecosystem, Frog-Themed, Solana Meme, RPG, Adventure Games, The Boy’s Club, Arcade Games, 4chan-Themed"
PIKA,pikaboss,Pikaboss,PIKA,8006669.0,8006669.0,3765.88,"Meme, Ethereum Ecosystem"
MNSRY,mansory-token,Mansory Token,MNSRY,8004642.0,8004642.0,279648.0,"Retail, BNB Chain Ecosystem, Solana Ecosystem, Real World Assets (RWA), Pump.fun Ecosystem"
CATE,catecoin,CateCoin,CATE,7760539.0,8103937.0,1744901.0,"Entertainment, Gaming (GameFi), Yield Farming, NFT, BNB Chain Ecosystem, Yield Aggregator, Launchpad, Wallets, Meme, Play To Earn, Ethereum Ecosystem, Base Ecosystem, Cat-Themed"
RACA,radio-caca,Radio Caca,RACA,7145697.0,7215129.0,629473.0,"Gaming (GameFi), NFT, BNB Chain Ecosystem, Metaverse, Play To Earn, Ethereum Ecosystem, DWF Labs Portfolio, OKT Chain Ecosystem"
CTA,cross-the-ages,Cross The Ages,CTA,6742691.0,6755630.0,609206.0,"Gaming (GameFi), NFT, Solana Ecosystem, Play To Earn, Ethereum Ecosystem, Animoca Brands Portfolio, Base Ecosystem, Card Games, Gaming Utility Token"
ZEREBRO,zerebro,Zerebro,ZEREBRO,6283696.0,6283696.0,2007876.0,"Solana Ecosystem, Meme, Solana Meme, AI Meme, Pump.fun Ecosystem, Binance Alpha Spotlight"
AVA,ava-ai,Ava AI,AVA,6208960.0,6208960.0,600762.0,"Artificial Intelligence (AI), Solana Ecosystem, Meme, AI Meme, AI Agents, Pump.fun Ecosystem, Binance Alpha Spotlight, Made in USA"
SOIL,soil,Soil,SOIL,6197011.0,9345447.0,10567.18,"Decentralized Finance (DeFi), Polygon Ecosystem, Ethereum Ecosystem, Real World Assets (RWA), Poolz Finance Launchpad, RWA Protocol"
DEGO,dego-finance,Dego Finance,DEGO,6148763.0,6148763.0,3862153.0,"Decentralized Finance (DeFi), NFT, BNB Chain Ecosystem, Solana Ecosystem, Ethereum Ecosystem, Binance Launchpad, Governance"
PIT,pitbull,Pitbull,PIT,5713415.0,5713415.0,123408.0,"BNB Chain Ecosystem, Meme"
GHX,gamercoin,GamerCoin,GHX,5462765.0,6280287.0,310163.0,"Artificial Intelligence (AI), Infrastructure, BNB Chain Ecosystem, Solana Ecosystem, Ethereum Ecosystem, DePIN, AI Applications"
