BASEDAI,basedai,BasedAI,BASEDAI,21561885.0,21561885.0,230197.0,"Artificial Intelligence (AI), Ethereum Ecosystem, AI Agents"
OCTA,octaspace,OctaSpace,OCTA,21401369.0,21401734.0,599122.0,"Artificial Intelligence (AI), Internet of Things (IOT), Smart Contract Platform, BNB Chain Ecosystem, Layer 1 (L1), Ethereum Ecosystem, DePIN, AI Agents"
ADS,adshares,Adshares,ADS,20060267.0,20072853.0,43506.0,"Business Services, Decentralized Finance (DeFi), BNB Chain Ecosystem, Metaverse, Polygon Ecosystem, Ethereum Ecosystem, Base Ecosystem"
TRIAS,trias-token,TriasLab,TRIAS,20010840.0,20010840.0,316220.0,"Artificial Intelligence (AI), Smart Contract Platform, BNB Chain Ecosystem, Layer 1 (L1), Ethereum Ecosystem, AI Agents"
PEP,pepecoin-network,Pepecoin,PEP,18162490.0,18162490.0,247050.0,"Smart Contract Platform, Layer 1 (L1), Meme, Frog-Themed, Proof of Work (PoW), The Boy’s Club, 4chan-Themed"
INV,inverse-finance,Inverse Finance,INV,16946232.0,17495779.0,284672.0,"Decentralized Finance (DeFi), Yield Farming, Yield Aggregator, Lending/Borrowing Protocols, Olympus Pro Ecosystem, Ethereum Ecosystem, Fixed Interest"
CHEQ,cheqd-network,CHEQD Network,CHEQ,16841230.0,22783907.0,835490.0,"Smart Contract Platform, Ethereum Ecosystem, Decentralized Identifier (DID), Zero Knowledge (ZK), Animoca Brands Portfolio, Osmosis Ecosystem, Outlier Ventures Portfolio"
CEEK,ceek,CEEK Smart VR,CEEK,15604219.0,16120063.0,776495.0,"Entertainment, BNB Chain Ecosystem, Metaverse, Ethereum Ecosystem, DWF Labs Portfolio"
UPC,upcx,UPCX,UPC,15408112.0,2896880956.0,977997.0,Ethereum Ecosystem
TKO,tokocrypto,Tokocrypto,TKO,14047740.0,93651601.0,1780776.0,"BNB Chain Ecosystem, Binance Launchpad, YZi Labs (Prev. Binance Labs) Portfolio"
DEXTF,dextf,Memento,DEXTF,13983886.0,21249770.0,39654.0,"Decentralized Finance (DeFi), Asset Manager, Avalanche Ecosystem, Ethereum Ecosystem, ZkSync Ecosystem, Real World Assets (RWA)"
MLG,360noscope420blazeit,360noscope420blazeit,MLG,13453629.0,13453629.0,3143240.0,"Solana Ecosystem, Meme, Solana Meme"
KASTA,kasta,Kasta,KASTA,13300073.0,26149463.0,193771.0,Polygon Ecosystem
MAVIA,heroes-of-mavia,Heroes of Mavia,MAVIA,12627726.0,61158090.0,13254047.0,"Gaming (GameFi), NFT, Ethereum Ecosystem, Animoca Brands Portfolio, Base Ecosystem, Gaming Governance Token, Strategy Games, Alameda Research Portfolio, YZi Labs (Prev. Binance Labs) Portfolio, Delphi Ventures Portfolio, Action Games"
ZYN,zyncoin-2,ZynCoin,ZYN,12266025.0,12266025.0,102784.0,"Solana Ecosystem, Meme, Ethereum Ecosystem, Parody Meme"
WEXO,wexo,Wexo,WEXO,11331004.0,29339458.0,91032.0,"Ethereum Ecosystem, Base Ecosystem"
FLIX,omniflix-network,OmniFlix Network,FLIX,11270270.0,12536105.0,40616.0,"NFT, Osmosis Ecosystem, Archway Ecosystem"
BONGO,bongo-cat,BONGO CAT,BONGO,10798504.0,10798504.0,801116.0,"Solana Ecosystem, Meme, Cat-Themed, AI Meme"
PORTAL,portal-2,Portal,PORTAL,10376574.0,62085129.0,12338954.0,"Gaming (GameFi), Solana Ecosystem, Ethereum Ecosystem, Gaming Platform"
GLQ,graphlinq-protocol,GraphLinq Chain,GLQ,10063941.0,14799913.0,220857.0,"Artificial Intelligence (AI), Business Services, Infrastructure, Smart Contract Platform, Analytics, Layer 1 (L1), Ethereum Ecosystem, DWF Labs Portfolio"
FLAY,flayer,Flayer,FLAY,9724071.0,16206784.0,957291.0,"Launchpad, Ethereum Ecosystem"
TRADE,polytrade,Polytrade,TRADE,9714337.0,22729635.0,260224.0,"BNB Chain Ecosystem, Polygon Ecosystem, Arbitrum Ecosystem, Ethereum Ecosystem, Real World Assets (RWA), Base Ecosystem, DWF Labs Portfolio"
HYPERSKIDS,hyperskids,$HYPERSKIDS,HYPERSKIDS,9709028.0,9709028.0,4308163.0,"Solana Ecosystem, Meme, Solana Meme"
FLOCK,flock-2,FLOCK,FLOCK,9421578.0,85513190.0,3597335.0,"Artificial Intelligence (AI), Base Ecosystem, AI Applications, Binance Alpha Spotlight"
OFN,openfabric,Openfabric AI,OFN,8560934.0,26084813.0,207738.0,"Artificial Intelligence (AI), BNB Chain Ecosystem, ChainGPT Launchpad, Poolz Finance Launchpad, AI Agents, AI Applications, AI Framework"
SEDA,seda-2,SEDA,SEDA,8463329.0,24645905.0,33160.0,"Smart Contract Platform, Oracle, Ethereum Ecosystem, Base Ecosystem, Modular Blockchain, Osmosis Ecosystem"
GTAI,gt-protocol,GT Protocol,GTAI,8293516.0,15329227.0,2374982.0,"Artificial Intelligence (AI), BNB Chain Ecosystem, DeFAI"
PAIN,pain,Pain,PAIN,8150572.0,16301209.0,3406638.0,"Solana Ecosystem, Meme, Solana Meme, 4chan-Themed"
XX,xxcoin,XX Network,XX,7873951.0,22909985.0,216978.0,"Smart Contract Platform, Layer 1 (L1), Ethereum Ecosystem"
GRAIL,camelot-token,Camelot Token,GRAIL,7298183.0,31528617.0,182889.0,"Decentralized Exchange (DEX), Arbitrum Ecosystem, Camelot Launchpad"
YULI,yuli,YULI,YULI,6783138.0,6783138.0,100828.0,"Gaming (GameFi), NFT, Meme, Kaia Ecosystem, Card Games, Gaming Utility Token, Anime-Themed"
FNCT,financie-token,Financie Token,FNCT,6486117.0,31802240.0,89438.0,Ethereum Ecosystem
POLYDOGE,polydoge,PolyDoge,POLYDOGE,6237251.0,6246053.0,2053324.0,"NFT, Polygon Ecosystem, Meme, Dog-Themed"
CANTO,canto,CANTO,CANTO,6045952.0,9936388.0,264666.0,"Smart Contract Platform, Layer 1 (L1), Ethereum Ecosystem, Canto Ecosystem, Real World Assets (RWA), Osmosis Ecosystem, Parallelized EVM"
ETF500,elon-trump-fart,Elon Trump Fart,ETF500,5291575.0,5291575.0,74623.0,"Solana Ecosystem, Meme, Elon Musk-Inspired, Solana Meme, PolitiFi, Pump.fun Ecosystem, Stock market-themed"
SRM,serum,Serum,SRM,5064616.0,14847380.0,348642.0,"Decentralized Exchange (DEX), Exchange-based Tokens, Decentralized Finance (DeFi), Solana Ecosystem, Ethereum Ecosystem, FTX Holdings, Multicoin Capital Portfolio, Energi Ecosystem, Viction Ecosystem"
WINR,winr-protocol,WINR Protocol,WINR,4537214.0,5814502.0,27378.0,"Gambling (GambleFi), Infrastructure, Smart Contract Platform, Solana Ecosystem, Arbitrum Ecosystem, Camelot Launchpad, Layer 3 (L3)"
FUTURE,futurecoin,FutureCoin,FUTURE,4450230.0,13810868.0,215.03,BNB Chain Ecosystem
L1,lamina1,Lamina1,L1,4225698.0,67174946.0,74869.0,"Smart Contract Platform, NFT, Metaverse, Layer 1 (L1), Avalanche Ecosystem, Made in USA"
PHIL,phil,Phil,PHIL,3992928.0,3992928.0,1878557.0,"Meme, Ethereum Ecosystem"
FORWARD,forward,Forward,FORWARD,3719091.0,3723300.0,170094.0,"BNB Chain Ecosystem, Ethereum Ecosystem"
MOVE,bluemove,BlueMove,MOVE,3718540.0,5129021.0,54137.0,"NFT, Aptos Ecosystem, Sui Ecosystem"
SOLAMA,solama,Solama,SOLAMA,3701321.0,3701321.0,33398.0,"Gambling (GambleFi), Solana Ecosystem, Meme, Solana Meme"
QORPO,qopro,QORPO WORLD,QORPO,3665557.0,16812696.0,142665.0,"Gaming (GameFi), NFT, BNB Chain Ecosystem, Play To Earn, Ethereum Ecosystem, RPG, Gaming Utility Token, Adventure Games, Gaming Platform, Action Games"
BAX,babb,BABB,BAX,3660476.0,3683497.0,8810.08,Ethereum Ecosystem
GMM,gamium,Gamium,GMM,3497288.0,3571253.0,100188.0,"SocialFi, Gaming (GameFi), BNB Chain Ecosystem, Metaverse, DaoMaker Launchpad, Ethereum Ecosystem, Gaming Governance Token, Gaming Utility Token"
ARCA,arca,Legend of Arcadia,ARCA,3203764.0,16656278.0,106244.0,"Gaming (GameFi), Ethereum Ecosystem, RPG"
PIGCOIN,pigcoin-2,Pigcoin,PIG,3073990.0,3073990.0,31920.0,Polygon Ecosystem
IZI,izumi-finance,iZUMi Finance,IZI,2993945.0,7604637.0,304766.0,"Decentralized Exchange (DEX), Decentralized Finance (DeFi), Automated Market Maker (AMM), BNB Chain Ecosystem, Polygon Ecosystem, Arbitrum Ecosystem, Ethereum Ecosystem, ZkSync Ecosystem, Mantle Ecosystem, Linea Ecosystem, Base Ecosystem, Manta Network Ecosystem, Scroll Ecosystem"
STETH,staked-ether,Lido Staked Ether,STETH,23974664920.0,23974664920.0,21960545.0,"Decentralized Finance (DeFi), Liquid Staking Tokens, Ethereum Ecosystem, Liquid Staked ETH, Liquid Staking"
APT,aptos,Aptos,APT,3663631931.0,6677355854.0,180525350.0,"Smart Contract Platform, Layer 1 (L1), Aptos Ecosystem, FTX Holdings, Coinbase Ventures Portfolio, Multicoin Capital Portfolio, Proof of Stake (PoS), DragonFly Capital Portfolio, Andreessen Horowitz (a16z) Portfolio, YZi Labs (Prev. Binance Labs) Portfolio, GMCI Layer 1 Index, GMCI 30 Index, Circle Ventures Portfolio, GMCI Index, Made in USA"
KAITO,kaito,KAITO,KAITO,465505545.0,1928446447.0,240889406.0,"Artificial Intelligence (AI), Analytics, Base Ecosystem, Binance HODLer Airdrops"
SAROS,saros-finance,Saros,SAROS,409640268.0,1560534457.0,19392909.0,"Solana Ecosystem, Payment Solutions, Viction Ecosystem"
TWT,trust-wallet-token,Trust Wallet,TWT,365382928.0,876954316.0,10212053.0,"BNB Chain Ecosystem, Wallets, Account Abstraction, Energi Ecosystem"
ZRO,layerzero,LayerZero,ZRO,361675768.0,3253859477.0,78634845.0,"Smart Contract Platform, BNB Chain Ecosystem, Avalanche Ecosystem, Polygon Ecosystem, Arbitrum Ecosystem, Ethereum Ecosystem, Optimism Ecosystem, Base Ecosystem, Multicoin Capital Portfolio, Layer 0 (L0), Cross-chain Communication, Circle Ventures Portfolio, Sequoia Capital Portfolio, OKX Ventures Portfolio"
KSM,kusama,Kusama,KSM,349169029.0,349189984.0,23153597.0,"Smart Contract Platform, Polkadot Ecosystem, Proof of Stake (PoS), Pantera Capital Portfolio, Made in USA, Coinbase 50 Index"
SYRUP,syrup,Maple Finance,SYRUP,329857794.0,366255891.0,140336389.0,"Decentralized Finance (DeFi), Yield Farming, Lending/Borrowing Protocols, Ethereum Ecosystem, Real World Assets (RWA), Base Ecosystem, Binance Alpha Spotlight"
BLUR,blur,Blur,BLUR,285011279.0,366257334.0,36986367.0,"NFT, Ethereum Ecosystem, NFT Marketplace, FTX Holdings, NFTFi, eGirl Capital Portfolio, Paradigm Portfolio, GMCI DeFi Index, GMCI Index, Made in USA, Coinbase 50 Index"
TFUEL,theta-fuel,Theta Fuel,TFUEL,283528678.0,283534643.0,4838908.0,"Smart Contract Platform, DePIN, Proof of Stake (PoS), Made in USA"
ONE,harmony,Harmony,ONE,230417784.0,230809606.0,13851425.0,"Smart Contract Platform, Layer 1 (L1), Harmony Ecosystem, Animoca Brands Portfolio, Binance Launchpad, YZi Labs (Prev. Binance Labs) Portfolio, Made in USA"
HOT,holotoken,Holo,HOT,226731391.0,226731391.0,9853738.0,"Smart Contract Platform, Storage, Harmony Ecosystem, Ethereum Ecosystem, DePIN, Energi Ecosystem, Sora Ecosystem, GMCI DePIN Index, GMCI Index"
CSPR,casper-network,Casper Network,CSPR,218599900.0,226322351.0,9311270.0,"Smart Contract Platform, Layer 1 (L1), Proof of Stake (PoS), GMCI Layer 1 Index, GMCI Index, Made in USA"
ANKR,ankr,Ankr Network,ANKR,206794639.0,206794639.0,21801308.0,"BNB Chain Ecosystem, Avalanche Ecosystem, Polygon Ecosystem, Fantom Ecosystem, Arbitrum Ecosystem, Ethereum Ecosystem, Optimism Ecosystem, Liquid Staking Governance Tokens, Linea Ecosystem, DePIN, Scroll Ecosystem, Rollups-as-a-Service (RaaS), Blast Ecosystem, Mode Ecosystem, Pantera Capital Portfolio, Polygon zkEVM Ecosystem, YZi Labs (Prev. Binance Labs) Portfolio, Liquid Staking, Made in USA"
YFI,yearn-finance,yearn.finance,YFI,204690693.0,221961989.0,26172837.0,"Decentralized Finance (DeFi), Yield Farming, Yield Aggregator, Yearn Ecosystem, Avalanche Ecosystem, Polygon Ecosystem, Near Protocol Ecosystem, Gnosis Chain Ecosystem, Fantom Ecosystem, Harmony Ecosystem, Arbitrum Ecosystem, Ethereum Ecosystem, Optimism Ecosystem, Base Ecosystem, Index Coop Defi Index, Alameda Research Portfolio, Energi Ecosystem, Sora Ecosystem, Huobi ECO Chain Ecosystem, Blockchain Capital Portfolio, Index Coop Index"
T,threshold-network-token,Threshold Network,T,187705702.0,206732632.0,8303050.0,"Decentralized Finance (DeFi), Solana Ecosystem, Ethereum Ecosystem, Optimism Ecosystem, Base Ecosystem, Cross-chain Communication, BTCfi"
PEOPLE,constitutiondao,ConstitutionDAO,PEOPLE,182491078.0,182491078.0,706871279.0,"Meme, Ethereum Ecosystem, PolitiFi"
TRIBE,tribe-2,Tribe,TRIBE,177729993.0,390602036.0,90953.0,"Decentralized Finance (DeFi), Ethereum Ecosystem, Stablecoin Protocol"
QUBIC,qubic-network,Qubic,QUBIC,176635284.0,214540692.0,5370982.0,"Artificial Intelligence (AI), Smart Contract Platform, Layer 1 (L1), Proof of Work (PoW)"
CETUS,cetus-protocol,Cetus Protocol,CETUS,155964930.0,215638776.0,27867124.0,"Decentralized Exchange (DEX), Decentralized Finance (DeFi), Sui Ecosystem, Animoca Brands Portfolio, OKX Ventures Portfolio, Dex Aggregator"
MPLX,metaplex,Metaplex,MPLX,154884721.0,195013344.0,4892343.0,"Gaming (GameFi), NFT, Solana Ecosystem, Animoca Brands Portfolio, FTX Holdings, Multicoin Capital Portfolio, Alameda Research Portfolio"
SWFTC,swftcoin,SWFTCOIN,SWFTC,146954120.0,146954120.0,2983318.0,"Exchange-based Tokens, NFT, BNB Chain Ecosystem, Ethereum Ecosystem"
MASK,mask-network,Mask Network,MASK,138727598.0,138727598.0,55936450.0,"BNB Chain Ecosystem, Polygon Ecosystem, Ethereum Ecosystem, Animoca Brands Portfolio, DWF Labs Portfolio, Alameda Research Portfolio, Energi Ecosystem, YZi Labs (Prev. Binance Labs) Portfolio"
ACH,alchemy-pay,Alchemy Pay,ACH,138666090.0,280491010.0,29511922.0,"BNB Chain Ecosystem, Ethereum Ecosystem, Payment Solutions, DWF Labs Portfolio"
SGB,songbird,Songbird,SGB,135573111.0,160998766.0,1617753.0,Smart Contract Platform
VVV,venice-token,Venice Token,VVV,121432339.0,286387622.0,12072878.0,"Artificial Intelligence (AI), Base Ecosystem, AI Agents, AI Applications, Made in USA"
XVS,venus,Venus,XVS,120635614.0,215481635.0,18388681.0,"Decentralized Finance (DeFi), Yield Farming, BNB Chain Ecosystem, Binance Launchpool, Lending/Borrowing Protocols, Arbitrum Ecosystem, Ethereum Ecosystem, Optimism Ecosystem, ZkSync Ecosystem, opBNB Ecosystem, Unichain Ecosystem"
PHA,pha,PHALA,PHA,117630973.0,148074010.0,42161601.0,"Artificial Intelligence (AI), Infrastructure, Smart Contract Platform, Oracle, Polkadot Ecosystem, Ethereum Ecosystem, Interoperability, Layer 2 (L2), Zero Knowledge (ZK), DePIN, DWF Labs Portfolio, Rollup, AI Agents, Sora Ecosystem, AI Framework, Made in USA"
BLAST,blast,Blast,BLAST,103280793.0,360480229.0,16451913.0,"Smart Contract Platform, Layer 2 (L2), eGirl Capital Portfolio, Paradigm Portfolio, Blast Ecosystem"
GLMR,moonbeam,Moonbeam,GLMR,98761399.0,118404363.0,7561732.0,"Smart Contract Platform, Polkadot Ecosystem, Layer 1 (L1), Coinbase Ventures Portfolio, Proof of Stake (PoS), YZi Labs (Prev. Binance Labs) Portfolio"
KMNO,kamino,Kamino,KMNO,96266827.0,661408604.0,33573670.0,"Decentralized Finance (DeFi), Lending/Borrowing Protocols, Solana Ecosystem, Binance Alpha Spotlight"
NMD,nexusmind,NexusMind,NMD,85157158.0,831004224.0,42657.0,"SocialFi, BNB Chain Ecosystem"
AVA,ava-ai,Ava AI,AVA,75014235.0,75014235.0,26308345.0,"Solana Ecosystem, Meme, Solana Meme, AI Meme, AI Agents, Pump.fun Ecosystem, Binance Alpha Spotlight, Made in USA"
WILD,wilder-world,Wilder World,WILD,70911251.0,109321775.0,845686.0,"Gaming (GameFi), NFT, Metaverse, Solana Ecosystem, Play To Earn, Ethereum Ecosystem, Animoca Brands Portfolio, Gaming Governance Token, Racing Games, Simulation Games, Action Games"
LOFI,lofi-2,LOFI,LOFI,70408652.0,70408652.0,10131989.0,"Meme, Sui Ecosystem, Sui Meme"
C98,coin98,Coin98,C98,69228700.0,72840389.0,15386946.0,"Decentralized Finance (DeFi), BNB Chain Ecosystem, Solana Ecosystem, Wallets, Polygon Ecosystem, Ethereum Ecosystem, Binance Launchpad, DWF Labs Portfolio, Multicoin Capital Portfolio, Alameda Research Portfolio, Viction Ecosystem, YZi Labs (Prev. Binance Labs) Portfolio"
RIF,rif-token,Rootstock Infrastructure Framework,RIF,63906323.0,63906323.0,9812041.0,"Rootstock Ecosystem, Outlier Ventures Portfolio"
DODO,dodo,DODO,DODO,59218086.0,59218086.0,6400516.0,"Decentralized Exchange (DEX), Exchange-based Tokens, Decentralized Finance (DeFi), BNB Chain Ecosystem, Binance Launchpool, Polygon Ecosystem, Near Protocol Ecosystem, Arbitrum Ecosystem, Ethereum Ecosystem, DWF Labs Portfolio, Coinbase Ventures Portfolio, Alameda Research Portfolio, DeFiance Capital Portfolio, Pantera Capital Portfolio, Aurora Ecosystem, Energi Ecosystem, YZi Labs (Prev. Binance Labs) Portfolio, Galaxy Digital Portfolio"
HSK,hashkey-ecopoints,HashKey Platform Token,HSK,52701132.0,397744394.0,1500835.0,"Exchange-based Tokens, Centralized Exchange (CEX) Token, Ethereum Ecosystem"
MNSRY,mansory-token,Mansory Token,MNSRY,46082847.0,46082847.0,985269.0,"BNB Chain Ecosystem, Solana Ecosystem, Pump.fun Ecosystem"
CCD,concordium,Concordium,CCD,45674662.0,55150425.0,432437.0,"Smart Contract Platform, Layer 1 (L1), Decentralized Identifier (DID), Zero Knowledge (ZK)"
NEON,neon,Neon,NEON,45580034.0,190340742.0,16982675.0,"Smart Contract Platform, Solana Ecosystem, Neon Ecosystem, Parallelized EVM"
M87,messier,MESSIER,M87,44891703.0,44891703.0,1344439.0,"Decentralized Finance (DeFi), Ethereum Ecosystem"
EDU,edu-coin,Open Campus,EDU,44475201.0,170989957.0,10236677.0,"Education, BNB Chain Ecosystem, Polygon Ecosystem, Ethereum Ecosystem, Binance Launchpad, YZi Labs (Prev. Binance Labs) Portfolio"
DYDX,dydx,dYdX,ETHDYDX,43516054.0,131299883.0,24609447.0,"Decentralized Exchange (DEX), Exchange-based Tokens, Decentralized Finance (DeFi), Derivatives, Perpetuals, Ethereum Ecosystem, Paradigm Portfolio"
PNG,pangolin,Pangolin,PNG,41034573.0,100177894.0,1012606.0,"Decentralized Exchange (DEX), Decentralized Finance (DeFi), Avalanche Ecosystem, Olympus Pro Ecosystem"
WNXM,wrapped-nxm,Wrapped NXM,WNXM,39113369.0,39113369.0,1408566.0,"Crypto-Backed Tokens, Decentralized Finance (DeFi), Insurance, Wrapped-Tokens, Ethereum Ecosystem, Blockchain Capital Portfolio"
PHB,phoenix-global,Phoenix,PHB,36092322.0,36092322.0,7851886.0,"Artificial Intelligence (AI), Oracle, NFT, BNB Chain Ecosystem, DePIN, Made in China"
ALU,altura,Altura,ALU,35376465.0,35376465.0,10194295.0,"Artificial Intelligence (AI), Infrastructure, Gaming (GameFi), NFT, BNB Chain Ecosystem, NFT Marketplace, Base Ecosystem, Gaming Platform, Made in USA, Gaming Marketplace"
FORTH,ampleforth-governance-token,Ampleforth Governance,FORTH,34152446.0,45612913.0,4539880.0,"Ethereum Ecosystem, Stablecoin Protocol"
D,dar-open-network,Dar Open Network,D,32615009.0,40571449.0,5117798.0,"Gaming (GameFi), BNB Chain Ecosystem, Binance Launchpool, Play To Earn, Ethereum Ecosystem, Animoca Brands Portfolio, AI Agents"
FIS,stafi,Stafi,FIS,32421848.0,32421848.0,5528253.0,"Decentralized Finance (DeFi), Ethereum Ecosystem, Liquid Staking Governance Tokens, Osmosis Ecosystem, Sora Ecosystem, Liquid Staking"
BEL,bella-protocol,Bella Protocol,BEL,30322184.0,37902730.0,5343248.0,"Decentralized Finance (DeFi), Yield Farming, BNB Chain Ecosystem, Binance Launchpool, Yield Aggregator, Ethereum Ecosystem, Manta Network Ecosystem, YZi Labs (Prev. Binance Labs) Portfolio"
GHST,aavegotchi,Aavegotchi,GHST,30001933.0,30934743.0,3649344.0,"Smart Contract Platform, Gaming (GameFi), NFT, Metaverse, Collectibles, Polygon Ecosystem, Meme, Play To Earn, Ethereum Ecosystem, Gotchiverse, Base Ecosystem, Layer 3 (L3), RPG, Gaming Governance Token, Gaming Utility Token, Energi Ecosystem"
LAT,platon-network,PlatON Network,LAT,28891881.0,45332973.0,6112641.0,"Smart Contract Platform, Appchains"
PIKA,pikaboss,Pikaboss,PIKA,25405772.0,25405772.0,12019.75,"Meme, Ethereum Ecosystem"
BENJI,basenji,Basenji,BENJI,24417771.0,24417771.0,2053904.0,"Meme, Base Ecosystem, Dog-Themed, Base Meme"
ELX,elixir-finance,Elixir,ELX,21369280.0,133843099.0,38531962.0,"Decentralized Finance (DeFi), Ethereum Ecosystem, Real World Assets (RWA), Stablecoin Protocol, RWA Protocol"
SIGMA,sigma,Sigma,SIGMA,20726836.0,20726836.0,1760578.0,"Solana Ecosystem, Meme, Solana Meme, Pump.fun Ecosystem, 4chan-Themed"
CWEB,coinweb,Coinweb,CWEB,20415429.0,25770539.0,147999.0,"Smart Contract Platform, Wallets, Ethereum Ecosystem, Interoperability, Layer 2 (L2), Cross-chain Communication, Bitcoin Sidechains, SideChain"
SNAI,swarmnode-ai,SwarmNode.ai,SNAI,20298469.0,22491722.0,4481902.0,"Artificial Intelligence (AI), Infrastructure, Solana Ecosystem, Pump.fun Ecosystem, AI Agent Launchpad, Binance Alpha Spotlight, AI Framework, DeFAI"
BOTIFY,botify,BOTIFY,BOTIFY,20104346.0,20104346.0,2926688.0,"Artificial Intelligence (AI), Retail, Solana Ecosystem, E-commerce"
QUICK,quick,Quickswap [OLD],QUICK,20069267.0,26706049.0,20135.0,"Decentralized Exchange (DEX), Exchange-based Tokens, Decentralized Finance (DeFi), Yield Farming, Automated Market Maker (AMM), Polygon Ecosystem, Ethereum Ecosystem"
THE,thena,Thena,THE,19981440.0,92021012.0,35516036.0,"Decentralized Exchange (DEX), Decentralized Finance (DeFi), BNB Chain Ecosystem, opBNB Ecosystem, Binance HODLer Airdrops"
DINERO,dinero-2,Dinero,DINERO,17890543.0,30926107.0,264447.0,"Infrastructure, Decentralized Finance (DeFi), Lending/Borrowing Protocols, Ethereum Ecosystem, Metagovernance, Liquid Staking Governance Tokens, LSDFi, Curve Ecosystem, Liquid Staking"
KOMA,koma-inu,Koma Inu,KOMA,17573900.0,17573900.0,11696190.0,"BNB Chain Ecosystem, Meme, Dog-Themed, Binance Alpha Spotlight, Made in USA"
PIVX,pivx,PIVX,PIVX,16229795.0,16229795.0,2195175.0,"Smart Contract Platform, Privacy, Masternodes, Zero Knowledge (ZK), Proof of Stake (PoS)"
CSWAP,chainswap-3,ChainSwap,CSWAP,16227591.0,17026635.0,71481.0,"Decentralized Exchange (DEX), Decentralized Finance (DeFi), Ethereum Ecosystem, Cross-chain Communication"
OIK,space-nation-oikos,Space Nation Oikos,OIK,16019722.0,29393985.0,19473651.0,"Gaming (GameFi), NFT, BNB Chain Ecosystem, Immutable zkEVM Ecosystem, RPG, MMO"
BR,bedrock-token,Bedrock,BR,13899710.0,66189093.0,17179671.0,"Decentralized Finance (DeFi), BNB Chain Ecosystem, Liquid Staking Governance Tokens, Berachain Ecosystem, BTCfi, Binance Wallet IDO"
MODE,mode,Mode,MODE,13628637.0,50494407.0,3095567.0,"Artificial Intelligence (AI), Infrastructure, Smart Contract Platform, Layer 2 (L2), Mode Ecosystem, Optimism Superchain Ecosystem, DeFAI"
STNK,stonks-4,Stonks,STNK,13613849.0,13613849.0,178880.0,"Solana Ecosystem, Meme, Solana Meme, Wall Street Bets Themed, Stock market-themed"
ROOT,the-root-network,The Root Network,ROOT,11624933.0,61261517.0,2025435.0,"Smart Contract Platform, Gaming (GameFi), Layer 1 (L1), Ethereum Ecosystem, Gaming Blockchains, Outlier Ventures Portfolio"
NIBI,nibiru,Nibiru,NIBI,11316681.0,15726851.0,734520.0,"Infrastructure, Smart Contract Platform, Layer 1 (L1), Osmosis Ecosystem, Made in USA"
ULTI,ultiverse,Ultiverse,ULTI,10563272.0,26364233.0,25208597.0,"Gaming (GameFi), BNB Chain Ecosystem, Ethereum Ecosystem, Animoca Brands Portfolio"
DOLAN,dolan-duck,Dolan Duck,DOLAN,10308278.0,10308278.0,232810.0,"Solana Ecosystem, Meme, Solana Meme, Parody Meme, 4chan-Themed"
LUCE,offcial-mascot-of-the-holy-year,Luce,LUCE,10128074.0,10128074.0,9579017.0,"Solana Ecosystem, Meme, Solana Meme, Pump.fun Ecosystem, Mascot-Themed, Binance Alpha Spotlight"
CLY,colony,Colony,CLY,9362438.0,12463286.0,18111.1,Avalanche Ecosystem
DCK,dexcheck,DexCheck AI,DCK,8990772.0,12248814.0,1044568.0,"Artificial Intelligence (AI), Decentralized Finance (DeFi), Analytics, BNB Chain Ecosystem, Launchpad, Ethereum Ecosystem, Telegram Apps, ChainGPT Launchpad, Poolz Finance Launchpad, AI Agents, Dex Aggregator, DeFAI"
HDRO,hydro-protocol-2,Hydro Protocol,HDRO,8826965.0,30665201.0,139564.0,Injective Ecosystem
XSWAP,xswap-2,XSwap,XSWAP,8551016.0,13900992.0,49129.0,"Decentralized Finance (DeFi), Ethereum Ecosystem, Base Ecosystem, Cross-chain Communication"
VIVI,vivi-coin,VIVI COIN,VIVI,8531547.0,15955252.0,90740.0,"NFT, Solana Ecosystem, Real World Assets (RWA), AI Agents"
YFII,yfii-finance,DFI.money,YFII,8389475.0,8446040.0,126242.0,"Decentralized Finance (DeFi), Yield Farming, Yield Aggregator, Ethereum Ecosystem, Energi Ecosystem"
GENOME,genomesdao-genome,GenomesDAO GENOME,GENOME,7793634.0,7793634.0,16034.58,"Ethereum Ecosystem, Base Ecosystem, Decentralized Science (DeSci)"
REDO,resistance-dog,Resistance Dog,REDO,7194177.0,7194177.0,849693.0,"Meme, Dog-Themed, TON Ecosystem, TON Meme"
TREAT,shiba-inu-treat,Shiba Inu Treat,TREAT,6825549.0,31722749.0,2178773.0,"Meme, Ethereum Ecosystem, Dog-Themed"
CATE,catecoin,CateCoin,CATE,6648678.0,6934948.0,98742.0,"Entertainment, Gaming (GameFi), Yield Farming, NFT, BNB Chain Ecosystem, Yield Aggregator, Launchpad, Wallets, Meme, Play To Earn, Ethereum Ecosystem, Base Ecosystem, Cat-Themed"
CPH,cypherium,Cypherium,CPH,6346965.0,80153182.0,6042.07,"Smart Contract Platform, Layer 1 (L1), Proof of Work (PoW), Pantera Capital Portfolio"
AGRI,agridex-governance-token,AgriDex,AGRI,6003762.0,36935810.0,719477.0,"Tokenized Assets, Solana Ecosystem, Real World Assets (RWA), Tokenized Commodities"
XEL,xelis,Xelis,XEL,5999893.0,5999893.0,242669.0,"Smart Contract Platform, Privacy, Layer 1 (L1), Directed Acyclic Graph (DAG)"
EVR,evernode,Evernode,EVR,5840236.0,11666487.0,3778.06,"Smart Contract Platform, Layer 2 (L2), DePIN"
SLN,smart-layer-network,Smart Layer Network,SLN,5762643.0,7530914.0,1196298.0,"Infrastructure, BNB Chain Ecosystem, Polygon Ecosystem, Ethereum Ecosystem, Optimism Ecosystem, ZkSync Ecosystem, Linea Ecosystem, Base Ecosystem, Scroll Ecosystem, Polygon zkEVM Ecosystem, Mint Ecosystem"
BEER,beercoin-2,Beercoin,BEER,5354208.0,5354208.0,3810864.0,"Solana Ecosystem, Meme, Solana Meme"
STAT,stat,STAT,STAT,4854297.0,7303362.0,806843.0,"Media, Ethereum Ecosystem"
LANDSHARE,landshare,Landshare,LAND,4828156.0,4843473.0,50309.0,"Tokenized Real Estate, Tokenized Assets, BNB Chain Ecosystem, Polygon Ecosystem, Arbitrum Ecosystem, Real World Assets (RWA)"
VGX,ethos,VGX Token,VGX,4727037.0,4740190.0,746079.0,"Gaming (GameFi), Ethereum Ecosystem, Galaxy Digital Portfolio"
GRPH,soul-graph,Soul Graph,GRPH,4565111.0,4565111.0,555159.0,"Artificial Intelligence (AI), Solana Ecosystem, Pump.fun Ecosystem, AI Applications"
HINT,hive-intelligence,Hive Intelligence,HINT,4538957.0,9846428.0,658166.0,"Artificial Intelligence (AI), Infrastructure, Base Ecosystem, AI Agents, AI Framework, DeFAI"
ORBT,orbitt-pro,Orbitt Token,ORBT,4475602.0,5991466.0,3333613.0,"Solana Ecosystem, Telegram Apps"
TAOCAT,taocat-by-virtuals,TAOCat by Virtuals,TAOCAT,4192469.0,4192469.0,248999.0,"Base Ecosystem, Virtuals Protocol Ecosystem, Binance Alpha Spotlight"
KAS,kaspa,Kaspa,KAS,3189186221.0,3189224365.0,110387470.0,"Smart Contract Platform, Layer 1 (L1), Proof of Work (PoW), Kaspa Ecosystem, Made in USA, Directed Acyclic Graph (DAG)"
