BXN,bxn,BXN,BXN,18055011,57813305.0,451554.0,"Smart Contract Platform, Layer 1 (L1)"
NFP,nfprompt-token,NFPrompt,NFP,17930223,33519645.0,4613064.0,"BNB Chain Ecosystem, Binance Launchpool, YZi Labs (Prev. Binance Labs) Portfolio, Governance"
TUNA,defituna,DefiTuna,TUNA,17214466,61152632.0,524478.0,"Decentralized Exchange (DEX), Exchange-based Tokens, Decentralized Finance (DeFi), Automated Market Maker (AMM), Lending/Borrowing Protocols, Solana Ecosystem"
GUN,gunz,Gunz,GUN,17212022,133211390.0,4429430.0,"Smart Contract Platform, Gaming (GameFi), Binance Launchpool, Solana Ecosystem, Layer 1 (L1), Avalanche Ecosystem, Play To Earn, Shooting Games, Coinbase Ventures Portfolio, Gaming Blockchains, Avalanche L1, YZi Labs (Prev. Binance Labs) Portfolio, Delphi Ventures Portfolio, Action Games"
READY,ready,READY!,READY,15246107,15246107.0,519485.0,"Gaming (GameFi), Solana Ecosystem, Gaming Platform"
RBNT,redbelly-network-token,Redbelly Network,RBNT,14772996,63401041.0,264528.0,"Smart Contract Platform, Layer 1 (L1), Real World Assets (RWA), Redbelly Network Ecosystem"
POLS,polkastarter,Polkastarter,POLS,13268152,13373854.0,2668049.0,"Decentralized Finance (DeFi), BNB Chain Ecosystem, Launchpad, Ethereum Ecosystem"
MIGGLES,mister-miggles,Mr. Miggles,MIGGLES,13166909,13166909.0,1753693.0,"Meme, Base Ecosystem, Cat-Themed, Base Meme, Made in USA"
LADYS,milady-meme-coin,Milady Meme Coin,LADYS,13144844,13144844.0,3998546.0,"Meme, Arbitrum Ecosystem, Ethereum Ecosystem, DWF Labs Portfolio, 4chan-Themed"
PYR,vulcan-forged,Vulcan Forged,PYR,12277897,25688448.0,4184617.0,"Gaming (GameFi), NFT, Metaverse, Polygon Ecosystem, Ethereum Ecosystem, DWF Labs Portfolio, Gaming Blockchains, Gaming Platform, Action Games, MMO"
GFAL,games-for-a-living,Games for a Living,GFAL,12081364,22997155.0,96934.0,"Gaming (GameFi), NFT, BNB Chain Ecosystem, Play To Earn"
AMO,amo,AMO Coin,AMO,11373973,11373973.0,112270.0,"Big Data, Kaia Ecosystem"
LAZIO,lazio-fan-token,Lazio Fan Token,LAZIO,10979656,36227765.0,3219381.0,"Sports, BNB Chain Ecosystem, Fan Token, Binance Launchpad"
KRL,kryll,KRYLL,KRL,9691312,11899945.0,144581.0,"Artificial Intelligence (AI), Decentralized Finance (DeFi), Analytics, Arbitrum Ecosystem, Ethereum Ecosystem, Optimism Ecosystem, Base Ecosystem, AI Applications"
REEF,reef,Reef,REEF,9438066,9438066.0,2067599.0,"BNB Chain Ecosystem, Binance Launchpool, Layer 1 (L1), Harmony Ecosystem, Ethereum Ecosystem, Alameda Research Portfolio, Energi Ecosystem, Sora Ecosystem, YZi Labs (Prev. Binance Labs) Portfolio, GMCI Layer 1 Index, GMCI Index"
BKN,brickken,Brickken,BKN,8999447,18020773.0,530130.0,"Tokenized Real Estate, BNB Chain Ecosystem, Impossible Finance Launchpad, Ethereum Ecosystem, Real World Assets (RWA), RWA Protocol"
FARTCOIN,based-fartcoin,Based Fartcoin,FARTCOIN,8075695,8075695.0,105516.0,"Meme, Base Ecosystem, Base Meme"
RWA,allo,Allo,RWA,7950068,44167045.0,1894627.0,"BNB Chain Ecosystem, Real World Assets (RWA), RWA Protocol"
BITBOARD,bitboard,BitBoard,BB,7920584,11972518.0,347966.0,"Smart Contract Platform, Polygon Ecosystem, Layer 2 (L2), Zero Knowledge (ZK)"
SEAM,seamless-protocol,Seamless Protocol,SEAM,7599136,18927660.0,194032.0,"Decentralized Finance (DeFi), Lending/Borrowing Protocols, Ethereum Ecosystem, Base Ecosystem"
ZCX,unizen,Unizen,ZCX,6935317,10090846.0,535386.0,"Decentralized Exchange (DEX), Exchange-based Tokens, Decentralized Finance (DeFi), Polygon Ecosystem, Ethereum Ecosystem, DWF Labs Portfolio"
BEAM,beam,BEAM,BEAM,6783391,9406417.0,99206.0,"Smart Contract Platform, Privacy, Ethereum Ecosystem, Proof of Work (PoW), BeamPrivacy Ecosystem, Privacy Blockchain"
CLEAR,everclear,Everclear,CLEAR,6555160,11969585.0,47313.0,"Infrastructure, BNB Chain Ecosystem, Polygon Ecosystem, Gnosis Chain Ecosystem, Arbitrum Ecosystem, Ethereum Ecosystem, Optimism Ecosystem, Coinbase Ventures Portfolio, Cross-chain Communication, Chain Abstraction"
MINIMA,minima,Minima,MINIMA,6394328,11532400.0,70723.0,"Smart Contract Platform, Layer 1 (L1), DePIN, Quantum-Resistant"
PAID,paid-network,PAID,PAID,5397974,5863890.0,145651.0,"Launchpad, Base Ecosystem"
TRUF,truflation,TRUF.Network,TRUF,5042787,11968492.0,503060.0,"Infrastructure, Oracle, Solana Ecosystem, Arbitrum Ecosystem, Ethereum Ecosystem, Real World Assets (RWA), Base Ecosystem, Coinbase Ventures Portfolio, Governance"
KIBSHI,kiboshib,KiboShib,KIBSHI,4619696,4619696.0,75660.0,"Solana Ecosystem, Meme, Arbitrum Ecosystem, Ethereum Ecosystem, Base Ecosystem, Dog-Themed, AI Meme"
BCUT,bitscrunch-token,bitsCrunch Token,BCUT,4525107,7414319.0,883667.0,"Artificial Intelligence (AI), Infrastructure, Analytics, NFT, Polygon Ecosystem, Ethereum Ecosystem, Animoca Brands Portfolio, Coinbase Ventures Portfolio"
WUF,wuffi,WUFFI,WUF,3961188,3961188.0,10408.61,"Solana Ecosystem, Meme, Base Ecosystem"
INTER,inter-milan-fan-token,Inter Milan Fan Token,INTER,3846826,3846826.0,784781.0,"Sports, Fan Token, Chiliz Ecosystem"
RETARDIO,retardio,RETARDIO,RETARDIO,3841090,3841090.0,918396.0,"NFT, Solana Ecosystem, Meme, Solana Meme, Murad Picks, 4chan-Themed, TikTok Meme"
MLT,media-licensing-token,Media Licensing Token,MLT,3552854,4853577.0,41283.0,"BNB Chain Ecosystem, Metaverse, Ethereum Ecosystem"
STOS,stratos,Stratos,STOS,3413483,7077627.0,90047.0,"Entertainment, Infrastructure, Smart Contract Platform, Storage, Layer 1 (L1), Ethereum Ecosystem, DePIN, Osmosis Ecosystem"
NRG,energi,Energi,NRG,3042383,3042883.0,136865.0,"Smart Contract Platform, Masternodes, Layer 1 (L1), Ethereum Ecosystem, Proof of Stake (PoS), Energi Ecosystem"
GMEE,gamee,GAMEE,GMEE,3036530,7078651.0,310450.0,"Gaming (GameFi), NFT, BNB Chain Ecosystem, Play To Earn, Ethereum Ecosystem, Telegram Apps, Animoca Brands Portfolio, TON Ecosystem, Gaming Platform, YZi Labs (Prev. Binance Labs) Portfolio, Arcade Games"
AZIT,azit,azit,AZIT,2932424,3838185.0,164851.0,Kaia Ecosystem
DYNA,dynachain,Dynachain,DYNA,2692633,8046987.0,147105.0,"Healthcare, BNB Chain Ecosystem"
BST,blocksquare,Blocksquare,BST,2683371,2683371.0,70915.0,"Tokenized Real Estate, Ethereum Ecosystem, Real World Assets (RWA)"
RFC,retard-finder-coin,Retard Finder Coin,RFC,2640218,2745719.0,38082824.0,"Solana Ecosystem, Meme, Pump.fun Ecosystem, Wojak-Themed"
LNQ,linqai,LinqAI,LNQ,2605573,7584849.0,512202.0,"Artificial Intelligence (AI), Ethereum Ecosystem"
TSUKA,dejitaru-tsuka,Dejitaru Tsuka,TSUKA,2566353,2566353.0,67752.0,"Meme, Ethereum Ecosystem"
ABX,aborean,Aborean,ABX,2526606,16583965.0,279687.0,"Decentralized Exchange (DEX), Exchange-based Tokens, Decentralized Finance (DeFi), Abstract Ecosystem"
TRVL,dtravel,Dtravel,TRVL,2220713,4910758.0,812367.0,"Artificial Intelligence (AI), Tourism, BNB Chain Ecosystem, Ethereum Ecosystem, Real World Assets (RWA), DePIN, Base Ecosystem"
EFFECT,effect-ai,Effect AI,EFFECT,1937775,3040373.0,10775.46,"Artificial Intelligence (AI), Business Services, Solana Ecosystem"
BGB,bitget-token,Bitget Token,BGB,2902411029,3814607730.0,56183637.0,"Exchange-based Tokens, Centralized Exchange (CEX) Token, Ethereum Ecosystem, DragonFly Capital Portfolio, Morph L2 Ecosystem, Made in China"
XAUT,tether-gold,Tether Gold,XAUT,2074529567,2074529567.0,274127246.0,"Stablecoins, Tokenized Assets, Tokenized Gold, Ethereum Ecosystem, Real World Assets (RWA), Tokenized Commodities"
QNT,quant-network,Quant,QNT,1242915229,1248753445.0,60285467.0,"Ethereum Ecosystem, Real World Assets (RWA), Energi Ecosystem, Coinbase 50 Index"
PENDLE,pendle,Pendle,PENDLE,455813994,762984218.0,61672049.0,"Decentralized Exchange (DEX), Exchange-based Tokens, Decentralized Finance (DeFi), Yield Farming, Automated Market Maker (AMM), BNB Chain Ecosystem, Derivatives, Arbitrum Ecosystem, Ethereum Ecosystem, Optimism Ecosystem, Fixed Interest, LSDFi, Base Ecosystem, Restaking, LRTfi, Liquid Restaking Governance Tokens, Berachain Ecosystem, Yield Tokenization Protocol, YZi Labs (Prev. Binance Labs) Portfolio, GMCI DeFi Index, Sonic Ecosystem, Liquid Staking, GMCI Index, BTCfi Protocol, HyperEVM Ecosystem"
SOON,soon-2,SOON,SOON,453039507,1590018059.0,275244682.0,"Infrastructure, Smart Contract Platform, BNB Chain Ecosystem, Layer 2 (L2), Base Ecosystem, Cross-chain Communication, Binance Alpha Spotlight"
DOGWIFHAT,dogwifcoin,dogwifhat,WIF,434642101,434642101.0,174718645.0,"Solana Ecosystem, Meme, Dog-Themed, Solana Meme, GMCI Meme Index, GMCI Index, Unichain Ecosystem"
ATH,aethir,Aethir,ATH,348019740,1026842608.0,27455612.0,"Solana Ecosystem, Arbitrum Ecosystem, Impossible Finance Launchpad, Ethereum Ecosystem, DePIN, Animoca Brands Portfolio"
ZBCN,zebec-network,Zebec Network,ZBCN,316937699,334220358.0,23320149.0,"Decentralized Finance (DeFi), Solana Ecosystem, Real World Assets (RWA), Payment Solutions, DePIN, Coinbase Ventures Portfolio, Alameda Research Portfolio, Circle Ventures Portfolio, OKX Ventures Portfolio, RWA Protocol, Made in USA"
APEPE,ape-and-pepe,Ape and Pepe,APEPE,293602012,293602012.0,13500259.0,"Polygon Ecosystem, Meme, Frog-Themed, The Boys Club"
ZORA,zora,Zora,ZORA,288419763,645234368.0,83188870.0,"Infrastructure, Media, Smart Contract Platform, SocialFi, NFT, Launchpad, Layer 2 (L2), Base Ecosystem, Coinbase Ventures Portfolio, Zora Ecosystem, Binance Alpha Spotlight"
FLUID,instadapp,Fluid,FLUID,283205091,365481529.0,7438983.0,"Decentralized Finance (DeFi), Solana Ecosystem, Polygon Ecosystem, Arbitrum Ecosystem, Ethereum Ecosystem, Base Ecosystem, Coinbase Ventures Portfolio, Pantera Capital Portfolio, Plasma Ecosystem"
1INCH,1inch,1INCH,1INCH,259107872,277722108.0,102487783.0,"Decentralized Exchange (DEX), Exchange-based Tokens, Decentralized Finance (DeFi), Automated Market Maker (AMM), BNB Chain Ecosystem, Ethereum Ecosystem, Base Ecosystem, FTX Holdings, Alameda Research Portfolio, DragonFly Capital Portfolio, Pantera Capital Portfolio, YZi Labs (Prev. Binance Labs) Portfolio, GMCI DeFi Index, Galaxy Digital Portfolio, Blockchain Capital Portfolio, Dex Aggregator, GMCI Index, Coinbase 50 Index, Governance"
ZANO,zano,Zano,ZANO,199825813,199854729.0,2457912.0,"Smart Contract Platform, Privacy, Layer 1 (L1), Proof of Stake (PoS), Proof of Work (PoW), Zano Ecosystem, Privacy Blockchain"
PROM,prometeus,Prom,PROM,189304057,199676882.0,2700577.0,"Smart Contract Platform, BNB Chain Ecosystem, Ethereum Ecosystem, Layer 2 (L2)"
QTUM,qtum,Qtum,QTUM,185641420,189047965.0,15118603.0,"Smart Contract Platform, Proof of Stake (PoS), Made in China"
SFP,safepal,SafePal,SFP,168336748,168336748.0,2909382.0,"BNB Chain Ecosystem, Wallets, Ethereum Ecosystem, Animoca Brands Portfolio, Binance Launchpad, Energi Ecosystem, YZi Labs (Prev. Binance Labs) Portfolio"
XVG,verge,Verge,XVG,133315691,133582362.0,45094016.0,"Smart Contract Platform, Privacy, Proof of Work (PoW), Made in USA"
ROSE,oasis-network,Oasis,ROSE,131819359,176185702.0,17978944.0,"Smart Contract Platform, BNB Chain Ecosystem, Layer 1 (L1), Proof of Stake (PoS), Pantera Capital Portfolio, Andreessen Horowitz (a16z) Portfolio, YZi Labs (Prev. Binance Labs) Portfolio, Blockchain Capital Portfolio, Privacy Blockchain, Polychain Capital Portfolio, Coinbase 50 Index"
ZIG,zignaly,ZIGChain,ZIG,108610301,150622438.0,3933264.0,"Artificial Intelligence (AI), Smart Contract Platform, BNB Chain Ecosystem, Solana Ecosystem, Layer 1 (L1), Polygon Ecosystem, Ethereum Ecosystem, DWF Labs Portfolio, Injective Ecosystem, OKX Ventures Portfolio"
VTHO,vethor-token,VeThor,VTHO,98359499,98359499.0,2602118.0,"Layer 1 (L1), VeChain Ecosystem"
XCH,chia,Chia,XCH,87088368,196510232.0,5997305.0,"Smart Contract Platform, Layer 1 (L1), DePIN, Andreessen Horowitz (a16z) Portfolio, Made in USA"
RED,redstone-oracles,RedStone,RED,82996194,296414977.0,13193687.0,"Infrastructure, Oracle, Ethereum Ecosystem, Real World Assets (RWA), Base Ecosystem"
WAVES,waves,Waves,WAVES,65896186,65896186.0,9280933.0,"Smart Contract Platform, DWF Labs Portfolio, Proof of Stake (PoS)"
DAG,constellation-labs,Constellation,DAG,60374099,60374099.0,1647251.0,"Smart Contract Platform, Layer 1 (L1), Layer 0 (L0), Made in USA, Directed Acyclic Graph (DAG)"
SHX,stronghold-token,Stronghold,SHX,57829196,,1315834.0,"Ethereum Ecosystem, Stellar Ecosystem, Made in USA"
BIGTIME,big-time,Big Time,BIGTIME,52873982,138540858.0,8573322.0,"Gaming (GameFi), Play To Earn, Ethereum Ecosystem, RPG, Alameda Research Portfolio, Circle Ventures Portfolio, OKX Ventures Portfolio, MMO"
FIDA,bonfida,Bonfida,FIDA,50946748,51414041.0,7641850.0,"Big Data, Business Services, Infrastructure, Decentralized Finance (DeFi), Solana Ecosystem, FTX Holdings, DWF Labs Portfolio, Name Service"
LQTY,liquity,Liquity,LQTY,49738492,50795762.0,17373933.0,"Decentralized Finance (DeFi), Arbitrum Ecosystem, Ethereum Ecosystem, Alameda Research Portfolio, Pantera Capital Portfolio"
SAI,sai,Sai,SAI,47483000,47483000.0,86.63,"Decentralized Finance (DeFi), Ethereum Ecosystem"
OSAK,osaka-protocol,Osaka Protocol,OSAK,46427245,46427245.0,30715.0,"BNB Chain Ecosystem, Solana Ecosystem, Avalanche Ecosystem, Polygon Ecosystem, Meme, Arbitrum Ecosystem, Ethereum Ecosystem, Optimism Ecosystem, Base Ecosystem, Dog-Themed"
MANTA,manta-network,Manta Network,MANTA,42978686,95668503.0,10564327.0,"Smart Contract Platform, Polkadot Ecosystem, Binance Launchpool, Layer 2 (L2), Manta Network Ecosystem, Multicoin Capital Portfolio, Alameda Research Portfolio, DeFiance Capital Portfolio, YZi Labs (Prev. Binance Labs) Portfolio"
ANYONE,airtor-protocol,ANyONe Protocol,ANYONE,42651189,53355544.0,1465179.0,"Smart Contract Platform, Privacy, Ethereum Ecosystem, DePIN, Base Ecosystem, Privacy Blockchain, Peaq Ecosystem"
TAIKO,taiko,Taiko,TAIKO,40934117,218598617.0,7931301.0,"Smart Contract Platform, BNB Chain Ecosystem, Ethereum Ecosystem, Layer 2 (L2), Zero Knowledge (ZK), Rollup, OKX Ventures Portfolio, Centralized Exchange (CEX) Product, Binance Alpha Spotlight"
STEEM,steem,Steem,STEEM,40760390,40763409.0,10900132.0,SocialFi
JOE,joe,JOE,JOE,38981844,48823229.0,3640290.0,"Decentralized Exchange (DEX), Exchange-based Tokens, Decentralized Finance (DeFi), Yield Farming, Automated Market Maker (AMM), BNB Chain Ecosystem, Avalanche Ecosystem, Launchpad, Arbitrum Ecosystem, Mantle Ecosystem, DeFiance Capital Portfolio, Delphi Ventures Portfolio, Dex Aggregator"
REZ,renzo,Renzo,REZ,33433397,74157211.0,8453087.0,"Decentralized Finance (DeFi), Binance Launchpool, Ethereum Ecosystem, Base Ecosystem, Restaking, YZi Labs (Prev. Binance Labs) Portfolio, OKX Ventures Portfolio"
DYM,dymension,Dymension,DYM,32206594,80964251.0,5956994.0,"Smart Contract Platform, Cosmos Ecosystem, Modular Blockchain, Osmosis Ecosystem, Rollups-as-a-Service (RaaS)"
XRD,radix,Radix,XRD,30979435,30979605.0,99786.0,"Smart Contract Platform, Layer 1 (L1), DWF Labs Portfolio, Radix Ecosystem"
AITECH,solidus-aitech,Solidus Ai Tech,AITECH,29032283,33500291.0,13118352.0,"Artificial Intelligence (AI), BNB Chain Ecosystem, Solana Ecosystem, Launchpad, Base Ecosystem, ChainGPT Launchpad, AI Agents, Binance Alpha Spotlight, DeFAI"
OGN,origin-protocol,Origin Token,OGN,26116967,55768567.0,5722547.0,"Decentralized Finance (DeFi), NFT, Ethereum Ecosystem, Base Ecosystem, Pantera Capital Portfolio, Sonic Ecosystem, Liquid Staking, Made in USA"
SD,stader,Stader,SD,25673457,46815346.0,5003958.0,"BNB Chain Ecosystem, Solana Ecosystem, Polygon Ecosystem, Fantom Ecosystem, Ethereum Ecosystem, Liquid Staking Governance Tokens, Animoca Brands Portfolio, Coinbase Ventures Portfolio, Pantera Capital Portfolio, Liquid Staking, Binance Alpha Spotlight"
DIAM,diam,DIAM,DIAM,25299680,78183272.0,5822778.0,"Smart Contract Platform, Layer 1 (L1)"
MBL,moviebloc,MovieBloc,MBL,22836975,36180467.0,7399915.0,DWF Labs Portfolio
WCT,connect-token-wct,WalletConnect Token,WCT,21303454,114411578.0,32897378.0,"Solana Ecosystem, Wallets, Ethereum Ecosystem, Optimism Ecosystem, Base Ecosystem"
NATIX,natix-network,NATIX Network,NATIX,21297366,52256419.0,294355.0,"Artificial Intelligence (AI), Internet of Things (IOT), Solana Ecosystem, DePIN, Robotics"
OGY,origyn-foundation,ORIGYN,OGY,20454747,25845567.0,242886.0,"Internet Computer Ecosystem, Real World Assets (RWA), RWA Protocol"
MLC,my-lovely-coin,My Lovely Coin,MLC,18949646,50406419.0,208928.0,"Charity, Gaming (GameFi), Solana Ecosystem, Polygon Ecosystem, Gaming Utility Token"
RSS3,rss3,RSS3,RSS3,18559827,22180744.0,3203561.0,"Artificial Intelligence (AI), Infrastructure, Storage, Ethereum Ecosystem, Coinbase Ventures Portfolio, DragonFly Capital Portfolio, RSS3 VSL Ecosystem, AI Framework, DeFAI"
DAO,dao-maker,DAO Maker,DAO,18179983,20107050.0,635459.0,"BNB Chain Ecosystem, Solana Ecosystem, Launchpad, DaoMaker Launchpad, Arbitrum Ecosystem, Ethereum Ecosystem, Step Network Ecosystem, Governance"
RIO,realio-network,Realio Network Token,RIO,15989022,15989022.0,1688014.0,"BNB Chain Ecosystem, Solana Ecosystem, Ethereum Ecosystem, Algorand Ecosystem, Real World Assets (RWA), Base Ecosystem, Osmosis Ecosystem, Stellar Ecosystem, Made in USA"
BOOE,book-of-ethereum,Book of Ethereum,BOOE,15387049,15387049.0,305915.0,"Meme, Ethereum Ecosystem"
VIC,tomochain,Viction,VIC,14835679,25292071.0,2453282.0,"Smart Contract Platform, Masternodes, Layer 1 (L1), DWF Labs Portfolio"
SUNDOG,sundog,Sundog,SUNDOG,14781918,14781918.0,12867943.0,"Meme, Tron Ecosystem, Sun Pump Ecosystem, TRON Meme"
HASHAI,hashai,HashAI,HASHAI,14142058,15018247.0,323795.0,"Analytics, Ethereum Ecosystem, DePIN"
PARTI,particle-network,Particle Network,PARTI,13027497,55912005.0,11465598.0,"Decentralized Finance (DeFi), BNB Chain Ecosystem, Layer 1 (L1), Base Ecosystem, Account Abstraction, Cross-chain Communication, Binance HODLer Airdrops, Chain Abstraction, Binance Wallet IDO"
ZETA,zeta,Zeta,ZEX,12810836,74594228.0,561897.0,"Decentralized Finance (DeFi), Derivatives, Perpetuals, Solana Ecosystem"
VOW,vow,Vow,VOW,12663161,42335250.0,93055.0,"Retail, Tourism, BNB Chain Ecosystem, Ethereum Ecosystem"
NMT,netmind-token,NetMind Token,NMT,10738717,28349889.0,1677710.0,"Artificial Intelligence (AI), BNB Chain Ecosystem, Ethereum Ecosystem, DePIN, AI Agents"
OBT,oobit,Oobit,OBT,10128260,28771475.0,100079.0,"BNB Chain Ecosystem, Ethereum Ecosystem, Payment Solutions"
ATS,alltoscan,Alltoscan,ATS,9947081,14564384.0,157535.0,BNB Chain Ecosystem
MCB,mcdex,MUX Protocol,MCB,9821976,12404572.0,1173.03,"Decentralized Exchange (DEX), Exchange-based Tokens, Decentralized Finance (DeFi), BNB Chain Ecosystem, Derivatives, Perpetuals, Arbitrum Ecosystem, Ethereum Ecosystem, Multicoin Capital Portfolio, Alameda Research Portfolio, DeFiance Capital Portfolio, Delphi Ventures Portfolio, OKX Ventures Portfolio"
LOCK,houdini-swap,Houdini Swap,LOCK,9658901,9658901.0,43490.0,"Privacy, Solana Ecosystem, Ethereum Ecosystem"
SUKU,suku,SUKU,SUKU,9097387,25767382.0,239715.0,"Solana Ecosystem, Polygon Ecosystem, Ethereum Ecosystem, Made in USA"
FHE,mind-network,Mind Network,FHE,8812874,35393067.0,7824894.0,"Artificial Intelligence (AI), Smart Contract Platform, BNB Chain Ecosystem, Layer 2 (L2), Binance Wallet IDO"
VINU,vita-inu,Vita Inu,VINU,8633119,8633119.0,1992975.0,"BNB Chain Ecosystem, Meme, Dog-Themed, DWF Labs Portfolio, Binance Alpha Spotlight"
LINGO,lingo,Lingo,LINGO,8556744,8556788.0,272937.0,"Solana Ecosystem, Real World Assets (RWA), Base Ecosystem, RWA Protocol"
MEMEFI,memefi-2,MemeFi,MEMEFI,8344689,8344689.0,5720920.0,"Gaming (GameFi), NFT, Meme, Play To Earn, Sui Ecosystem, Telegram Apps, Tap to Earn, Sui Meme, Action Games"
EPT,balance,Balance,EPT,8044291,34724806.0,3821554.0,"Gaming (GameFi), BNB Chain Ecosystem, Animoca Brands Portfolio, DWF Labs Portfolio, AI Agents, Andreessen Horowitz (a16z) Portfolio, AI Agent Launchpad"
NUM,numbers-protocol,Numbers Protocol,NUM,7944260,8039029.0,1507566.0,"Artificial Intelligence (AI), Smart Contract Platform, BNB Chain Ecosystem, DaoMaker Launchpad, Ethereum Ecosystem, Avalanche L1, YZi Labs (Prev. Binance Labs) Portfolio, Outlier Ventures Portfolio"
VSC,vyvo-smart-chain,Vyvo Smart Chain,VSC,7622484,35484431.0,55366.0,"Smart Contract Platform, BNB Chain Ecosystem, Polygon Ecosystem, Layer 2 (L2)"
SERAPH,seraph,Seraph,SERAPH,7474718,25616048.0,1968932.0,"Gaming (GameFi), BNB Chain Ecosystem, Play To Earn, Ethereum Ecosystem, RPG, Gaming Utility Token, Action Games"
CRTS,cratos,Cratos,CRTS,7337948,11547267.0,376991.0,"BNB Chain Ecosystem, Ethereum Ecosystem"
MFT,mainframe,Mainframe,MFT,6916961,7369011.0,528.99,"Ethereum Ecosystem, Energi Ecosystem"
PMT,public-meme-token,Public Masterpiece Token,PMT,6876409,34863191.0,293409.0,BNB Chain Ecosystem
LOOKS,looksrare,LooksRare,LOOKS,6237778,6237778.0,1585830.0,"NFT, Ethereum Ecosystem, NFT Marketplace"
CA,ca-htb,Coupon Assets,CA,6181687,90747709.0,520194.0,"Retail, Ethereum Ecosystem"
HMT,human-protocol,HUMAN Protocol,HMT,5894629,7777925.0,132482.0,"Artificial Intelligence (AI), Infrastructure, Software as a service, Polygon Ecosystem, Ethereum Ecosystem, Market-Making Solution, AI Framework"
JUNO,juno-network,JUNO,JUNO,5127034,6811647.0,31812.0,"Smart Contract Platform, Cosmos Ecosystem, Osmosis Ecosystem, Juno Ecosystem, Evmos Ecosystem, Secret Ecosystem"
DIONE,dione,Dione,DIONE,4938108,5686247.0,154448.0,"Energy, Smart Contract Platform, Layer 1 (L1), Made in USA"
NLS,nolus,Nolus,NLS,4552044,5840311.0,158979.0,"Ethereum Ecosystem, Osmosis Ecosystem"
PROPS,propbase,Propbase,PROPS,4427091,11777526.0,4376055.0,"Tokenized Real Estate, Aptos Ecosystem, Real World Assets (RWA), Base Ecosystem, RWA Protocol"
WEPE,wall-street-pepe,Wall Street Pepe,WEPE,4232864,4232864.0,385153.0,"Meme, Ethereum Ecosystem, Frog-Themed, The Boys Club"
DNX,dynex,Dynex,DNX,3890623,3890968.0,151283.0,"Artificial Intelligence (AI), Smart Contract Platform, Layer 1 (L1), Ethereum Ecosystem, DePIN, Decentralized Science (DeSci), Proof of Work (PoW)"
LL,lightlink,LightLink,LL,3888355,9743567.0,297825.0,"Infrastructure, Smart Contract Platform, Ethereum Ecosystem, Layer 2 (L2), Base Ecosystem, Rollup, LightLink Ecosystem"
PEAR,pear-protocol,Pear Protocol,PEAR,3853899,12769967.0,67989.0,"Decentralized Exchange (DEX), Exchange-based Tokens, Decentralized Finance (DeFi), Perpetuals, Arbitrum Ecosystem"
METAV,metaverse,METAVERSE,METAV,3510133,3510133.0,379077.0,"Artificial Intelligence (AI), Solana Ecosystem, AI Agents, Pump.fun Ecosystem, Binance Alpha Spotlight"
SIDUS,sidus,Sidus,SIDUS,3433244,5858670.0,539679.0,"Gaming (GameFi), NFT, BNB Chain Ecosystem, Metaverse, Play To Earn, Ethereum Ecosystem, Linea Ecosystem, Animoca Brands Portfolio, Base Ecosystem, RPG, Gaming Governance Token, Alameda Research Portfolio, OKX Ventures Portfolio"
LLD,liberland-lld,Liberland LLD,LLD,3162694,4240522.0,73594.0,"Smart Contract Platform, Solana Ecosystem, Layer 1 (L1), Ethereum Ecosystem, Tron Ecosystem"
GAIA,gaia-2,Gaia,SN57,3098089,3109200.0,17701.22,"Artificial Intelligence (AI), Bittensor Ecosystem, Bittensor Subnets"
AEROBUD,aerobud,AEROBUD,AEROBUD,3096995,3096995.0,211738.0,"Charity, Meme, Base Ecosystem, Dog-Themed, Base Meme, Made in USA"
KILO,kiloex,KiloEx,KILO,2961789,13990498.0,949303.0,"Decentralized Exchange (DEX), Exchange-based Tokens, Decentralized Finance (DeFi), BNB Chain Ecosystem, Derivatives, Perpetuals, Binance Wallet IDO"
BOBA,bobacat,Boba Cat,BOBA,2363685,2363685.0,13903.25,"Meme, Ethereum Ecosystem, Cat-Themed"
SDN,shiden,Shiden Network,SDN,2188458,2807321.0,124012.0,Smart Contract Platform
CREO,creo-engine,Creo Engine,CREO,1743510,2292387.0,1294589.0,"Gaming (GameFi), BNB Chain Ecosystem, Solana Ecosystem, Ethereum Ecosystem, Gaming Platform"
BLEND,blend,Blend,BLND,1694415,3225910.0,2265.82,"Decentralized Finance (DeFi), Lending/Borrowing Protocols, Stellar Ecosystem"
UNIT0,unit0,Unit0,UNIT0,1659407,17116521.0,97092.0,"Smart Contract Platform, Ethereum Ecosystem, Layer 2 (L2), Cross-chain Communication, Waves Ecosystem"
XNA,neurai,Neurai,XNA,1596737,1596737.0,46092.0,"Smart Contract Platform, Layer 1 (L1), Real World Assets (RWA), Proof of Work (PoW)"
LEOX,leox,LEOX,LEOX,1527226,1527226.0,63459.0,"Tokenized Real Estate, Ethereum Ecosystem, Real World Assets (RWA), RWA Protocol"
HMND,humanode,Humanode,HMND,1341833,3433159.0,208494.0,"Artificial Intelligence (AI), Smart Contract Platform, Layer 1 (L1), Decentralized Identifier (DID), Discord Bots, Humanode Ecosystem"
RLY,rally-2,Rally,RLY,1338635,4006377.0,54595.0,"SocialFi, Yield Farming, Ethereum Ecosystem, Alleged SEC Securities, Coinbase Ventures Portfolio, Andreessen Horowitz (a16z) Portfolio"
HBAR,hedera-hashgraph,Hedera,HBAR,7374561832,8681014612.0,300796887.0,"Smart Contract Platform, Layer 1 (L1), Hedera Ecosystem, GMCI Layer 1 Index, GMCI 30 Index, GMCI Index, Outlier Ventures Portfolio, Made in USA, Directed Acyclic Graph (DAG)"
DASH,dash,Dash,DASH,1323567434,1323589731.0,1038213091.0,"Smart Contract Platform, Privacy, Masternodes, Alleged SEC Securities, Proof of Stake (PoS), Proof of Work (PoW), Made in USA"
LBTC,lombard-staked-btc,Lombard Staked BTC,LBTC,1239893261,1239893261.0,28092503.0,"BNB Chain Ecosystem, Solana Ecosystem, Ethereum Ecosystem, Sui Ecosystem, Base Ecosystem, Starknet Ecosystem, Restaking, Berachain Ecosystem, Liquid Restaking Tokens, Sonic Ecosystem, Etherlink Ecosystem, Swellchain Ecosystem, Corn Ecosystem, Liquid Staked BTC, Katana Ecosystem, TAC Ecosystem"
IP,story-2,Story,IP,1106316547,3485979739.0,65090822.0,"Artificial Intelligence (AI), Smart Contract Platform, Layer 1 (L1), Made in USA, Story Ecosystem, IP"
RENDER,render-token,Render,RENDER,1034725904,1064176708.0,74911749.0,"Artificial Intelligence (AI), NFT, Metaverse, Solana Ecosystem, Ethereum Ecosystem, DePIN, Multicoin Capital Portfolio, Alameda Research Portfolio, GMCI DePIN Index, GMCI 30 Index, GMCI Index, Made in USA, Coinbase 50 Index"
XDC,xdce-crowd-sale,XDC Network,XDC,937729259,2008555113.0,41085630.0,"Smart Contract Platform, Layer 1 (L1), Real World Assets (RWA)"
