WNXM,wrapped-nxm,Wrapped NXM,WNXM,36168521,36168521.0,381937.0,"Crypto-Backed Tokens, Decentralized Finance (DeFi), Insurance, Wrapped-Tokens, Ethereum Ecosystem, Blockchain Capital Portfolio"
ISLM,islamic-coin,Islamic Coin,ISLM,35850528,323829843.0,121115.0,"Smart Contract Platform, Wallets, Layer 2 (L2), Osmosis Ecosystem"
HBD,hive_dollar,Hive Dollar,HBD,34375149,34375236.0,3553.21,"Stablecoins, USD Stablecoin, Algorithmic Stablecoin"
UNP,unipoly,Unipoly,UNP,33599803,120330204.0,220506.0,"Gaming (GameFi), Ethereum Ecosystem, Skale Ecosystem"
ADS,adshares,Adshares,ADS,30757056,30770307.0,1308553.0,"Business Services, Decentralized Finance (DeFi), BNB Chain Ecosystem, Metaverse, Polygon Ecosystem, Ethereum Ecosystem, Base Ecosystem"
CETUS,cetus-protocol,Cetus Protocol,CETUS,30157180,34594271.0,7530632.0,"Decentralized Exchange (DEX), Exchange-based Tokens, Decentralized Finance (DeFi), Sui Ecosystem, Animoca Brands Portfolio, OKX Ventures Portfolio, Dex Aggregator"
AVAIL,avail,Avail,AVAIL,28795969,85968149.0,3238711.0,"Infrastructure, Smart Contract Platform, BNB Chain Ecosystem, Ethereum Ecosystem, Data Availability, Modular Blockchain, Binance Alpha Spotlight"
PIVX,pivx,PIVX,PIVX,28628516,28628696.0,21676835.0,"Smart Contract Platform, Privacy, Masternodes, Zero Knowledge (ZK), Proof of Stake (PoS)"
AGLD,adventure-gold,Adventure Gold,AGLD,27912008,29636351.0,4894530.0,"Ethereum Ecosystem, DWF Labs Portfolio"
ZRC,zircuit,Zircuit,ZRC,26821178,122196416.0,8846853.0,"Smart Contract Platform, BNB Chain Ecosystem, Ethereum Ecosystem, Layer 2 (L2), Zero Knowledge (ZK), Restaking, Zircuit Ecosystem"
ALI,alethea-artificial-liquid-intelligence-token,Artificial Liquid Intelligence,ALI,25773449,27901370.0,1124101.0,"Artificial Intelligence (AI), NFT, Metaverse, Solana Ecosystem, Polygon Ecosystem, Ethereum Ecosystem, Cronos Ecosystem, Base Ecosystem, Multicoin Capital Portfolio, AI Agents, Alameda Research Portfolio, DeFiance Capital Portfolio, YZi Labs (Prev. Binance Labs) Portfolio, Airdropped Tokens by NFT Projects, Governance"
SCR,scroll,Scroll,SCR,25687971,135199847.0,8367133.0,"Smart Contract Platform, Binance Launchpool, Layer 2 (L2), Scroll Ecosystem"
DODO,dodo,DODO,DODO,25456776,25456776.0,3015214.0,"Decentralized Exchange (DEX), Exchange-based Tokens, Decentralized Finance (DeFi), BNB Chain Ecosystem, Binance Launchpool, Polygon Ecosystem, Near Protocol Ecosystem, Arbitrum Ecosystem, Ethereum Ecosystem, DWF Labs Portfolio, Coinbase Ventures Portfolio, Alameda Research Portfolio, DeFiance Capital Portfolio, Pantera Capital Portfolio, Aurora Ecosystem, Energi Ecosystem, YZi Labs (Prev. Binance Labs) Portfolio, Galaxy Digital Portfolio, Made in China"
HFT,hashflow,Hashflow,HFT,24379409,38252681.0,10676292.0,"Decentralized Exchange (DEX), Exchange-based Tokens, Decentralized Finance (DeFi), BNB Chain Ecosystem, Binance Launchpool, MEV Protection, Ethereum Ecosystem, Coinbase Ventures Portfolio, Alameda Research Portfolio, DragonFly Capital Portfolio, Galaxy Digital Portfolio"
FORTH,ampleforth-governance-token,Ampleforth Governance,FORTH,22736060,30235363.0,3071088.0,"Ethereum Ecosystem, Stablecoin Issuer, Governance"
NCT,polyswarm,PolySwarm,NCT,22196493,22201347.0,921373.0,"Business Services, Polygon Ecosystem, Ethereum Ecosystem, Cybersecurity, Made in USA"
ELX,elixir-finance,Elixir,ELX,21614629,83367190.0,6138847.0,"Decentralized Finance (DeFi), Ethereum Ecosystem, Real World Assets (RWA), Stablecoin Issuer, RWA Protocol"
INV,inverse-finance,Inverse Finance,INV,20973993,25246311.0,257068.0,"Decentralized Finance (DeFi), Yield Farming, Yield Aggregator, Olympus Pro Ecosystem, Ethereum Ecosystem, Fixed Interest"
CWEB,coinweb,Coinweb,CWEB,15159660,18055713.0,104655.0,"Smart Contract Platform, Wallets, Ethereum Ecosystem, Interoperability, Layer 2 (L2), Cross-chain Communication, Bitcoin Sidechains, SideChain"
SYN,synapse-2,Synapse,SYN,14543811,16597482.0,2763809.0,"BNB Chain Ecosystem, Avalanche Ecosystem, Polygon Ecosystem, Fantom Ecosystem, Arbitrum Ecosystem, Olympus Pro Ecosystem, Ethereum Ecosystem, Optimism Ecosystem, Bridge Governance Tokens, Base Ecosystem, Alameda Research Portfolio, Intent"
PNG,pangolin,Pangolin,PNG,12925526,30992602.0,751075.0,"Decentralized Exchange (DEX), Exchange-based Tokens, Decentralized Finance (DeFi), Avalanche Ecosystem, Olympus Pro Ecosystem"
CHEQ,cheqd-network,CHEQD Network,CHEQ,12727120,16556272.0,466737.0,"Smart Contract Platform, Ethereum Ecosystem, Decentralized Identifier (DID), Zero Knowledge (ZK), Animoca Brands Portfolio, Osmosis Ecosystem, Outlier Ventures Portfolio"
SWEAT,sweatcoin,SWEAT,SWEAT,12494707,33712472.0,2356566.0,"Sports, Gaming (GameFi), BNB Chain Ecosystem, Solana Ecosystem, Avalanche Ecosystem, Polygon Ecosystem, Near Protocol Ecosystem, Play To Earn, Arbitrum Ecosystem, Celo Ecosystem, Move To Earn, Ethereum Ecosystem, Optimism Ecosystem, Aptos Ecosystem, Sui Ecosystem, Base Ecosystem, Gaming Governance Token, Gaming Utility Token, OKX Ventures Portfolio"
PORTAL,portal-2,Portal,PORTAL,11587704,19557597.0,5264212.0,"Gaming (GameFi), Solana Ecosystem, Ethereum Ecosystem, Gaming Platform"
D,dar-open-network,Dar Open Network,D,11578962,14403654.0,1299447.0,"Gaming (GameFi), BNB Chain Ecosystem, Binance Launchpool, Play To Earn, Ethereum Ecosystem, Animoca Brands Portfolio, AI Agents"
ALU,altura,Altura,ALU,10532803,10532803.0,2736370.0,"Artificial Intelligence (AI), Infrastructure, Gaming (GameFi), NFT, BNB Chain Ecosystem, NFT Marketplace, Base Ecosystem, Gaming Platform, Made in USA, Gaming Marketplace"
OCTA,octaspace,OctaSpace,OCTA,9689684,9689684.0,333900.0,"Artificial Intelligence (AI), Internet of Things (IOT), Smart Contract Platform, BNB Chain Ecosystem, Layer 1 (L1), Ethereum Ecosystem, DePIN, AI Agents"
TKO,tokocrypto,Tokocrypto,TKO,8357568,55717118.0,1743939.0,"BNB Chain Ecosystem, Binance Launchpad, YZi Labs (Prev. Binance Labs) Portfolio"
UPC,upcx,UPCX,UPC,8290581,1558713140.0,625220.0,Ethereum Ecosystem
FLAY,flayer,Flayer,FLAY,7799135,12998558.0,177168.0,"Launchpad, Ethereum Ecosystem"
EVR,evernode,Evernode,EVR,7501601,14985238.0,4089.38,"Smart Contract Platform, Layer 2 (L2), DePIN"
IZI,izumi-finance,iZUMi Finance,IZI,6948699,17649730.0,169986.0,"Decentralized Exchange (DEX), Exchange-based Tokens, Decentralized Finance (DeFi), Automated Market Maker (AMM), BNB Chain Ecosystem, Polygon Ecosystem, Arbitrum Ecosystem, Ethereum Ecosystem, ZkSync Ecosystem, Mantle Ecosystem, Linea Ecosystem, Base Ecosystem, Manta Network Ecosystem, Scroll Ecosystem"
KENDU,kendu-inu,Kendu,KENDU,6559799,6588209.0,102706.0,"Solana Ecosystem, Meme, Ethereum Ecosystem, Base Ecosystem, Dog-Themed"
KASTA,kasta,Kasta,KASTA,6201343,12178678.0,332584.0,"Centralized Exchange (CEX) Token, Polygon Ecosystem, Payment Solutions"
J,jambo,Jambo,J,6116557,37989223.0,3003822.0,"Solana Ecosystem, Paradigm Portfolio, Coinbase Ventures Portfolio"
SHIDO,shido-2,Shido Network,SHIDO,5414392,5414400.0,141216.0,"Decentralized Finance (DeFi), Ethereum Ecosystem, Osmosis Ecosystem, Shido Network Ecosystem, Yield-Bearing"
QBX,qbx,QBX,QBX,5332766,5332766.0,48713.0,"Yield Farming, Ethereum Ecosystem"
MODE,mode,Mode,MODE,5154992,9993523.0,1424134.0,"Artificial Intelligence (AI), Infrastructure, Smart Contract Platform, Ethereum Ecosystem, Optimism Ecosystem, Layer 2 (L2), Mode Ecosystem, Optimism Superchain Ecosystem, DeFAI"
BENJI,basenji,Basenji,BENJI,4727989,4727989.0,353752.0,"Meme, Base Ecosystem, Dog-Themed, Base Meme, IP Meme"
GHUB,gemhub,GemHUB,GHUB,4647394,21189961.0,160658.0,"Gaming (GameFi), Kaia Ecosystem"
POR,portugal-national-team-fan-token,Portugal National Team Fan Token,POR,4303258,12465803.0,127499.0,"Sports, Fan Token, Chiliz Ecosystem"
SNAI,swarmnode-ai,SwarmNode.ai,SNAI,4291087,4291087.0,1110548.0,"Artificial Intelligence (AI), Infrastructure, Solana Ecosystem, Pump.fun Ecosystem, AI Agent Launchpad, Binance Alpha Spotlight, AI Framework, DeFAI"
BASEDAI,basedai,BasedAI,BASEDAI,4218811,4218811.0,21470.0,"Artificial Intelligence (AI), Ethereum Ecosystem, AI Agents"
STAT,stat,STAT,STAT,3932062,5019722.0,89424.0,"Media, Ethereum Ecosystem"
TICO,tico,Funtico,TICO,3918468,18316803.0,177423.0,"Gaming (GameFi), Avalanche Ecosystem, RPG"
DEOD,decentrawood,Decentrawood,DEOD,3828758,3828758.0,223285.0,"Gaming (GameFi), BNB Chain Ecosystem, Metaverse, Solana Ecosystem, Polygon Ecosystem"
MAVIA,heroes-of-mavia,Heroes of Mavia,MAVIA,3788626,18348922.0,3783313.0,"Gaming (GameFi), NFT, BNB Chain Ecosystem, Ethereum Ecosystem, Animoca Brands Portfolio, Base Ecosystem, Gaming Governance Token, Strategy Games, Alameda Research Portfolio, YZi Labs (Prev. Binance Labs) Portfolio, Delphi Ventures Portfolio, Action Games"
WINR,winr-protocol,WINR Protocol,WINR,3488106,3613603.0,26176.0,"Gambling (GambleFi), Infrastructure, Smart Contract Platform, Solana Ecosystem, Arbitrum Ecosystem, Camelot Launchpad, Layer 3 (L3)"
SRM,serum,Serum,SRM,3364752,9864073.0,144265.0,"Decentralized Exchange (DEX), Exchange-based Tokens, Decentralized Finance (DeFi), Solana Ecosystem, Ethereum Ecosystem, FTX Holdings, Multicoin Capital Portfolio, Energi Ecosystem, Viction Ecosystem"
4EVER,4everland,4EVERLAND,4EVER,3292822,11520079.0,49360.0,"Artificial Intelligence (AI), BNB Chain Ecosystem, Ethereum Ecosystem, DePIN, AI Framework"
GTAI,gt-protocol,GT Protocol,GTAI,3000093,5545189.0,494573.0,"Artificial Intelligence (AI), BNB Chain Ecosystem, DeFAI"
CDX,cod3x,Cod3x,CDX,2762174,2762174.0,9329.85,"Artificial Intelligence (AI), Solana Ecosystem, Base Ecosystem, AI Agent Launchpad, AI Framework, DeFAI, x402 Ecosystem"
GLQ,graphlinq-protocol,GraphLinq Chain,GLQ,2626671,3862752.0,182991.0,"Artificial Intelligence (AI), Business Services, Infrastructure, Smart Contract Platform, Analytics, Layer 1 (L1), Ethereum Ecosystem, DWF Labs Portfolio, AI Agents, DeFAI"
ALVA,alvara-protocol,Alvara Protocol,ALVA,2486025,6096657.0,166755.0,"Decentralized Finance (DeFi), Avalanche Ecosystem, Ethereum Ecosystem"
ALON,alon,Alon,ALON,2260622,2260622.0,673038.0,"Solana Ecosystem, Pump.fun Ecosystem, Binance Alpha Spotlight"
RMV,reality-metaverse,Reality Metaverse,RMV,1988825,2664157.0,73595.0,"Gaming (GameFi), NFT, Metaverse, Polygon Ecosystem, Play To Earn, Ethereum Ecosystem, DWF Labs Portfolio, Gaming Utility Token"
HDRO,hydro-protocol-2,Hydro Protocol,HDRO,1955730,4589805.0,17987.05,"Injective Ecosystem, Liquid Staking"
MASK,catwifmask,catwifmask,MASK,1928578,1928578.0,417114.0,"Solana Ecosystem, Meme, Solana Meme, Cat-Themed, Pump.fun Ecosystem"
CORE,core-2,Core,CORE,1824630,1824630.0,13877.7,"Solana Ecosystem, Pump.fun Ecosystem"
ZYN,zyncoin-2,ZynCoin,ZYN,1791120,1791120.0,56715.0,"Solana Ecosystem, Meme, Ethereum Ecosystem, Parody Meme"
GENOME,genomesdao-genome,GenomesDAO GENOME,GENOME,1653360,1653360.0,63493.0,"Ethereum Ecosystem, Base Ecosystem, Decentralized Science (DeSci)"
TREAT,shiba-inu-treat,Shiba Inu Treat,TREAT,1578450,7336082.0,476046.0,"Meme, Ethereum Ecosystem, Dog-Themed"
SMURFCAT,real-smurf-cat,Real Smurf Cat,SMURFCAT,1521082,1521082.0,68174.0,"Solana Ecosystem, Meme, Arbitrum Ecosystem, Ethereum Ecosystem, Cat-Themed"
FLIX,omniflix-network,OmniFlix Network,FLIX,1385315,1522650.0,1426.03,"NFT, Osmosis Ecosystem, Archway Ecosystem"
OFN,openfabric,Openfabric AI,OFN,1311744,1311744.0,82458.0,"Artificial Intelligence (AI), BNB Chain Ecosystem, ChainGPT Launchpad, Poolz Finance Launchpad, AI Agents, AI Applications, AI Framework, Governance"
MLG,360noscope420blazeit,360noscope420blazeit,MLG,1241173,1241173.0,247385.0,"Solana Ecosystem, Meme, Solana Meme"
ALEX,alexgo,ALEX Lab,ALEX,1024211,1168210.0,62022.0,"Decentralized Finance (DeFi), Ethereum Ecosystem, DWF Labs Portfolio, Mode Ecosystem, Stacks Ecosystem, BTCfi Protocol"
HXD,honeyland-honey,Honeyland,HXD,998439,2275898.0,22251.0,"Gaming (GameFi), NFT, Solana Ecosystem, Play To Earn, Breeding, Gaming Utility Token, Strategy Games"
PI,pchain,Plian,PI,987936,1514191.0,9412.48,"Smart Contract Platform, Proof of Stake (PoS)"
STETH,staked-ether,Lido Staked Ether,STETH,26936115674,26936497185.0,44596012.0,"Decentralized Finance (DeFi), Liquid Staking Tokens, Ethereum Ecosystem, Liquid Staked ETH, Liquid Staking"
HTX,htx-dao,HTX DAO,HTX,1670230155,1670230155.0,7668706.0,"Exchange-based Tokens, BNB Chain Ecosystem, Centralized Exchange (CEX) Token, Ethereum Ecosystem, Tron Ecosystem"
VET,vechain,VeChain,VET,1304160751,1304160751.0,29118625.0,"Internet of Things (IOT), Smart Contract Platform, Layer 1 (L1), VeChain Ecosystem, Made in China"
TWT,trust-wallet-token,Trust Wallet,TWT,472512634,1134075957.0,19844663.0,"BNB Chain Ecosystem, Wallets, Account Abstraction, Energi Ecosystem"
GALA,gala,GALA,GALA,404201655,404201655.0,111007811.0,"Smart Contract Platform, Gaming (GameFi), NFT, Layer 1 (L1), Play To Earn, Ethereum Ecosystem, DWF Labs Portfolio, Gaming Platform, YZi Labs (Prev. Binance Labs) Portfolio, GalaChain Ecosystem, Made in USA"
ZRO,layerzero,LayerZero,ZRO,285322697,1439168876.0,35843510.0,"Smart Contract Platform, BNB Chain Ecosystem, Avalanche Ecosystem, Polygon Ecosystem, Arbitrum Ecosystem, Ethereum Ecosystem, Optimism Ecosystem, Base Ecosystem, Multicoin Capital Portfolio, Layer 0 (L0), Cross-chain Communication, Circle Ventures Portfolio, Sequoia Capital Portfolio, OKX Ventures Portfolio"
MOCA,mocaverse,Moca Network,MOCA,240051500,300081002.0,7822071.0,"Gaming (GameFi), Ethereum Ecosystem, Decentralized Identifier (DID), Animoca Brands Portfolio, Base Ecosystem, OKX Ventures Portfolio, Outlier Ventures Portfolio"
KAITO,kaito,KAITO,KAITO,179289175,742739964.0,13342315.0,"Artificial Intelligence (AI), Analytics, Launchpad, Base Ecosystem, Binance HODLer Airdrops, InfoFi, Governance"
BLUR,blur,Blur,BLUR,107734092,124101463.0,8867396.0,"NFT, Ethereum Ecosystem, NFT Marketplace, FTX Holdings, NFTFi, eGirl Capital Portfolio, Paradigm Portfolio, GMCI DeFi Index, GMCI Index, Made in USA, Coinbase 50 Index"
HOT,holotoken,Holo,HOT,102991488,102991488.0,4718380.0,"Smart Contract Platform, Storage, Harmony Ecosystem, Arbitrum Ecosystem, Ethereum Ecosystem, DePIN, Base Ecosystem, Energi Ecosystem, Sora Ecosystem, GMCI DePIN Index, GMCI Index"
EDU,edu-coin,Open Campus,EDU,100651386,162057168.0,10119312.0,"Education, BNB Chain Ecosystem, Polygon Ecosystem, Ethereum Ecosystem, Binance Launchpad, YZi Labs (Prev. Binance Labs) Portfolio"
CSPR,casper-network,Casper Network,CSPR,89987346,93166317.0,3081912.0,"Smart Contract Platform, Layer 1 (L1), Real World Assets (RWA), Proof of Stake (PoS), GMCI Layer 1 Index, GMCI Index, Made in USA"
HSK,hashkey-ecopoints,HashKey Platform Token,HSK,88556047,286849069.0,584731.0,"Exchange-based Tokens, Centralized Exchange (CEX) Token, Ethereum Ecosystem, Governance"
ANKR,ankr,Ankr Network,ANKR,88032484,88032484.0,6210760.0,"BNB Chain Ecosystem, Avalanche Ecosystem, Polygon Ecosystem, Fantom Ecosystem, Arbitrum Ecosystem, Ethereum Ecosystem, Optimism Ecosystem, Liquid Staking Governance Tokens, Linea Ecosystem, DePIN, Scroll Ecosystem, Rollups-as-a-Service (RaaS), Blast Ecosystem, Mode Ecosystem, Pantera Capital Portfolio, Polygon zkEVM Ecosystem, YZi Labs (Prev. Binance Labs) Portfolio, Liquid Staking, Made in USA, Governance"
GOHOME,gohome,GOHOME,GOHOME,73373404,1398549260.0,3172595.0,"Solana Ecosystem, Meme"
XVS,venus,Venus,XVS,70105098,124493356.0,5459822.0,"Decentralized Finance (DeFi), Yield Farming, BNB Chain Ecosystem, Binance Launchpool, Lending/Borrowing Protocols, Arbitrum Ecosystem, Ethereum Ecosystem, Optimism Ecosystem, ZkSync Ecosystem, opBNB Ecosystem, Unichain Ecosystem"
SAROS,saros-finance,Saros,SAROS,59633928,227176883.0,2005236.0,"Decentralized Exchange (DEX), Exchange-based Tokens, Decentralized Finance (DeFi), Solana Ecosystem, Viction Ecosystem, Binance Alpha Spotlight"
JELLYJELLY,jelly-my-jelly,Jelly-My-Jelly,JELLYJELLY,55537052,55537052.0,9597645.0,"Solana Ecosystem, Pump.fun Ecosystem, Binance Alpha Spotlight"
MPLX,metaplex,Metaplex,MPLX,54616373,97083178.0,4810426.0,"Gaming (GameFi), NFT, BNB Chain Ecosystem, Solana Ecosystem, Launchpad, Animoca Brands Portfolio, FTX Holdings, Multicoin Capital Portfolio, Alameda Research Portfolio, Binance Alpha Spotlight"
BLAST,blast,Blast,BLAST,52871461,105951583.0,3955005.0,"Smart Contract Platform, Layer 2 (L2), eGirl Capital Portfolio, Paradigm Portfolio, Blast Ecosystem"
OMI,ecomi,ECOMI,OMI,51062001,58587143.0,4630155.0,"Gaming (GameFi), NFT, Metaverse, Collectibles, Play To Earn, Ethereum Ecosystem, Base Ecosystem, Energi Ecosystem"
PHA,pha,PHALA,PHA,42006106,51332521.0,17598598.0,"Artificial Intelligence (AI), Infrastructure, Smart Contract Platform, Oracle, Polkadot Ecosystem, Ethereum Ecosystem, Interoperability, Layer 2 (L2), Zero Knowledge (ZK), DePIN, DWF Labs Portfolio, Rollup, AI Agents, Sora Ecosystem, AI Framework, Made in USA"
CTK,certik,Shentu,CTK,40674904,41535528.0,3890812.0,"Business Services, Binance Launchpool, Osmosis Ecosystem, Coinbase Ventures Portfolio, Cybersecurity, YZi Labs (Prev. Binance Labs) Portfolio, OKX Ventures Portfolio"
RIF,rif-token,Rootstock Infrastructure Framework,RIF,39591626,39591626.0,1018451.0,"Solana Ecosystem, Arbitrum Ecosystem, Ethereum Ecosystem, Base Ecosystem, Rootstock Ecosystem, Outlier Ventures Portfolio"
ACT,acet-token,Acet,ACT,38951684,50817920.0,31668.0,BNB Chain Ecosystem
GLMR,moonbeam,Moonbeam,GLMR,32407590,37958209.0,9869085.0,"Smart Contract Platform, Polkadot Ecosystem, Layer 1 (L1), Coinbase Ventures Portfolio, Proof of Stake (PoS), YZi Labs (Prev. Binance Labs) Portfolio"
C98,coin98,Coin98,C98,30662575,30662608.0,5843514.0,"Decentralized Finance (DeFi), BNB Chain Ecosystem, Perpetuals, Solana Ecosystem, Wallets, Polygon Ecosystem, Ethereum Ecosystem, Binance Launchpad, DWF Labs Portfolio, Multicoin Capital Portfolio, Alameda Research Portfolio, Viction Ecosystem, YZi Labs (Prev. Binance Labs) Portfolio"
KUJI,kujira,Kujira,KUJI,30629900,30637971.0,905.66,"Smart Contract Platform, Decentralized Finance (DeFi), BNB Chain Ecosystem, Layer 1 (L1), Arbitrum Ecosystem, Ethereum Ecosystem, Optimism Ecosystem, Osmosis Ecosystem, Secret Ecosystem"
QI,benqi,BENQI,QI,29050718,29050718.0,1017578.0,"Decentralized Finance (DeFi), Yield Farming, Binance Launchpool, Lending/Borrowing Protocols, Avalanche Ecosystem, Liquid Staking Governance Tokens, DragonFly Capital Portfolio, Liquid Staking"
WILD,wilder-world,Wilder World,WILD,28987812,36772124.0,1107570.0,"Gaming (GameFi), NFT, BNB Chain Ecosystem, Metaverse, Solana Ecosystem, Avalanche Ecosystem, Polygon Ecosystem, Play To Earn, Ethereum Ecosystem, Animoca Brands Portfolio, Base Ecosystem, Gaming Governance Token, Racing Games, Simulation Games, Action Games"
ZEREBRO,zerebro,Zerebro,ZEREBRO,27917153,27917153.0,11633296.0,"Solana Ecosystem, Meme, Solana Meme, AI Meme, Pump.fun Ecosystem, Binance Alpha Spotlight"
SSV,ssv-network,SSV Network,SSV,27261153,56553051.0,9985894.0,"Decentralized Finance (DeFi), Ethereum Ecosystem, Restaking, Coinbase Ventures Portfolio, OKX Ventures Portfolio, Liquid Staking"
STORJ,storj,Storj,STORJ,23386682,69125232.0,6624219.0,"Storage, Harmony Ecosystem, Ethereum Ecosystem, DePIN, Energi Ecosystem"
TRIBE,tribe-2,Tribe,TRIBE,22488095,548424154.0,79628.0,"Decentralized Finance (DeFi), Ethereum Ecosystem, Stablecoin Issuer"
MMUI,metamui,MetaMUI,MMUI,20617731,34660738.0,586737.0,"Avalanche Ecosystem, Decentralized Identifier (DID)"
PHB,phoenix-global,Phoenix,PHB,19888527,19888527.0,3631488.0,"Artificial Intelligence (AI), Oracle, NFT, BNB Chain Ecosystem, DePIN, Made in China"
NEON,neon,Neon,NEON,17010941,71037124.0,652316.0,"Smart Contract Platform, Solana Ecosystem, Neon Ecosystem, Parallelized EVM"
MNSRY,mansory-token,Mansory Token,MNSRY,15901563,15901563.0,1446215.0,"Retail, BNB Chain Ecosystem, Solana Ecosystem, Real World Assets (RWA), Pump.fun Ecosystem"
LAT,platon-network,PlatON Network,LAT,15204669,23091312.0,3439883.0,"Smart Contract Platform, Appchains"
OORT,oort,OORT,OORT,14647843,45354045.0,368838.0,"Artificial Intelligence (AI), Storage, BNB Chain Ecosystem, Ethereum Ecosystem, DePIN, AI Agents, Made in USA"
BR,bedrock-token,Bedrock,BR,14597911,66354142.0,1163662.0,"Decentralized Finance (DeFi), BNB Chain Ecosystem, Ethereum Ecosystem, Liquid Staking Governance Tokens, Base Ecosystem, Berachain Ecosystem, BTCfi Protocol, Binance Wallet IDO"
RACA,radio-caca,Radio Caca,RACA,14597104,14738937.0,3774067.0,"Gaming (GameFi), NFT, BNB Chain Ecosystem, Metaverse, Play To Earn, Ethereum Ecosystem, DWF Labs Portfolio, OKT Chain Ecosystem"
BEL,bella-protocol,Bella Protocol,BEL,14030729,17538411.0,3201441.0,"Decentralized Finance (DeFi), Yield Farming, BNB Chain Ecosystem, Binance Launchpool, Yield Aggregator, Ethereum Ecosystem, Manta Network Ecosystem, YZi Labs (Prev. Binance Labs) Portfolio"
PIKA,pikaboss,Pikaboss,PIKA,13700689,13700689.0,9312.3,"Meme, Ethereum Ecosystem"
GHST,aavegotchi,Aavegotchi,GHST,13621781,14045305.0,2495897.0,"Smart Contract Platform, Gaming (GameFi), NFT, Metaverse, Collectibles, Polygon Ecosystem, Meme, Play To Earn, Ethereum Ecosystem, Gotchiverse, Base Ecosystem, Layer 3 (L3), RPG, Gaming Governance Token, Gaming Utility Token, Energi Ecosystem, Governance"
DREAMS,daydreams,Daydreams,DREAMS,13593026,16916668.0,2195906.0,"Artificial Intelligence (AI), Solana Ecosystem, Base Ecosystem, Starknet Ecosystem, AI Framework, x402 Ecosystem"
SFI,saffron-finance,saffron.finance,SFI,12875337,14817955.0,106558.0,"Decentralized Finance (DeFi), Yield Farming, Ethereum Ecosystem, Fixed Interest, Coinbase Ventures Portfolio, Multicoin Capital Portfolio, DragonFly Capital Portfolio, Energi Ecosystem"
DYDX,dydx,dYdX,ETHDYDX,12064595,251002288.0,20375027.0,"Decentralized Exchange (DEX), Exchange-based Tokens, Decentralized Finance (DeFi), Derivatives, Perpetuals, Ethereum Ecosystem, Paradigm Portfolio"
AVA,ava-ai,Ava AI,AVA,11791686,11791686.0,1752794.0,"Artificial Intelligence (AI), Solana Ecosystem, Meme, AI Meme, AI Agents, Pump.fun Ecosystem, Binance Alpha Spotlight, Made in USA"
QUICK,quick,Quickswap [OLD],QUICK,11679619,16355001.0,31094.0,"Decentralized Exchange (DEX), Exchange-based Tokens, Decentralized Finance (DeFi), Yield Farming, Automated Market Maker (AMM), Polygon Ecosystem, Ethereum Ecosystem"
NIBI,nibiru,Nibiru,NIBI,11457333,13618430.0,326615.0,"Infrastructure, Smart Contract Platform, Layer 1 (L1), Osmosis Ecosystem, Made in USA"
UFD,unicorn-fart-dust,Unicorn Fart Dust,UFD,10888104,10888104.0,3665318.0,"Solana Ecosystem, Meme, Solana Meme, Pump.fun Ecosystem, Binance Alpha Spotlight, Made in USA"
PROPC,propchain,Propchain,PROPC,10783390,16125372.0,364169.0,"Ethereum Ecosystem, Real World Assets (RWA)"
ZEPH,zephyr-protocol,Zephyr Protocol,ZEPH,10479381,10479860.0,510451.0,"Smart Contract Platform, Privacy, Proof of Work (PoW), Stablecoin Issuer, Privacy Blockchain"
CXT,covalent-x-token,Covalent X Token,CXT,9971309,9971325.0,1895571.0,"Artificial Intelligence (AI), Infrastructure, Decentralized Finance (DeFi), Ethereum Ecosystem, Base Ecosystem, Data Availability, Coinbase Ventures Portfolio, YZi Labs (Prev. Binance Labs) Portfolio"
M87,messier,MESSIER,M87,9873012,9873012.0,436267.0,"Artificial Intelligence (AI), Decentralized Exchange (DEX), Decentralized Finance (DeFi), Ethereum Ecosystem, Zero Knowledge (ZK)"
GHX,gamercoin,GamerCoin,GHX,9860098,11335695.0,205126.0,"Artificial Intelligence (AI), Infrastructure, BNB Chain Ecosystem, Solana Ecosystem, Ethereum Ecosystem, DePIN, AI Applications"
XSWAP,xswap-2,XSwap,XSWAP,9441465,10789445.0,115544.0,"Decentralized Finance (DeFi), Ethereum Ecosystem, Base Ecosystem, Cross-chain Communication"
RNT,reental,Reental,RNT,9275977,35038067.0,7684.69,"Tokenized Real Estate, Tokenized Assets, Polygon Ecosystem, Real World Assets (RWA), RWA Protocol"
KOMA,koma-inu,Koma Inu,KOMA,9228116,9228116.0,216644.0,"BNB Chain Ecosystem, Meme, Dog-Themed, Binance Alpha Spotlight, Made in USA"
SFUND,seedify-fund,Seedify.fund,SFUND,9022025,10869909.0,917255.0,"Gaming (GameFi), BNB Chain Ecosystem, Launchpad, DWF Labs Portfolio"
FIS,stafi,Stafi,FIS,8849815,8849815.0,9566129.0,"Decentralized Finance (DeFi), Ethereum Ecosystem, Liquid Staking Governance Tokens, Osmosis Ecosystem, Sora Ecosystem, Liquid Staking"
DINERO,dinero-2,Dinero,DINERO,8326833,12428261.0,731.4,"Infrastructure, Decentralized Finance (DeFi), Ethereum Ecosystem, Metagovernance, Liquid Staking Governance Tokens, LSDFi, Curve Ecosystem, Liquid Staking"
PERP,perpetual-protocol,Perpetual Protocol,PERP,8211838,16964303.0,23056821.0,"Decentralized Exchange (DEX), Exchange-based Tokens, Decentralized Finance (DeFi), Automated Market Maker (AMM), BNB Chain Ecosystem, Derivatives, Perpetuals, Gnosis Chain Ecosystem, Arbitrum Ecosystem, Ethereum Ecosystem, Optimism Ecosystem, Multicoin Capital Portfolio, Alameda Research Portfolio, YZi Labs (Prev. Binance Labs) Portfolio"
CATE,catecoin,CateCoin,CATE,7498379,7795472.0,951613.0,"Entertainment, Gaming (GameFi), Yield Farming, NFT, BNB Chain Ecosystem, Yield Aggregator, Launchpad, Wallets, Meme, Play To Earn, Ethereum Ecosystem, Base Ecosystem, Cat-Themed"
STUFF,book-2,STUFF.io,STUFF,7203259,16769607.0,13449.19,"NFT, Cardano Ecosystem, NFT Marketplace, NFT Launchpad"
ROOT,the-root-network,The Root Network,ROOT,6987668,27540660.0,3843348.0,"Smart Contract Platform, Gaming (GameFi), Layer 1 (L1), Ethereum Ecosystem, Gaming Blockchains, Outlier Ventures Portfolio"
SPARKLET,upland,Upland,SPARKLET,6965950,27731834.0,308786.0,"Gaming (GameFi), NFT, Metaverse, Play To Earn, Ethereum Ecosystem, Animoca Brands Portfolio, Made in USA"
OPUL,opulous,Opulous,OPUL,6960475,6960475.0,969559.0,"Artificial Intelligence (AI), Music, NFT, BNB Chain Ecosystem, Arbitrum Ecosystem, Ethereum Ecosystem, Algorand Ecosystem, Real World Assets (RWA), Telegram Apps, AI Applications"
LOFI,lofi-2,LOFI,LOFI,6800756,6800756.0,743385.0,"Meme, Sui Ecosystem, Sui Meme"
VARA,vara-network,Vara Network,VARA,6559354,15891380.0,141699.0,"Smart Contract Platform, Layer 1 (L1)"
