BKN,brickken,Brickken,BKN,16476881,32993819.0,1516367.0,"Tokenized Real Estate, Tokenized Assets, BNB Chain Ecosystem, Impossible Finance Launchpad, Ethereum Ecosystem, Real World Assets (RWA), RWA Protocol"
SEAM,seamless-protocol,Seamless Protocol,SEAM,16154003,40905560.0,451083.0,"Decentralized Finance (DeFi), Lending/Borrowing Protocols, Ethereum Ecosystem, Base Ecosystem"
TUNA,defituna,DeFituna,TUNA,14972431,53188033.0,5582895.0,"Decentralized Exchange (DEX), Decentralized Finance (DeFi), Automated Market Maker (AMM), Lending/Borrowing Protocols, Solana Ecosystem"
KRL,kryll,KRYLL,KRL,14341576,17783703.0,143244.0,"Artificial Intelligence (AI), Decentralized Finance (DeFi), Analytics, Arbitrum Ecosystem, Ethereum Ecosystem, Optimism Ecosystem, Base Ecosystem, AI Applications"
LAZIO,lazio-fan-token,Lazio Fan Token,LAZIO,13911454,45901335.0,32329957.0,"Sports, BNB Chain Ecosystem, Fan Token, Binance Launchpad"
PAID,paid-network,PAID,PAID,13839585,15855904.0,69531.0,"Launchpad, Base Ecosystem"
CLEAR,everclear,Everclear,CLEAR,13514055,26524379.0,159838.0,"Infrastructure, BNB Chain Ecosystem, Polygon Ecosystem, Gnosis Chain Ecosystem, Arbitrum Ecosystem, Ethereum Ecosystem, Optimism Ecosystem, Coinbase Ventures Portfolio, Cross-chain Communication, Chain Abstraction"
REEF,reef,Reef,REEF,13290043,13290043.0,379966.0,"BNB Chain Ecosystem, Binance Launchpool, Layer 1 (L1), Harmony Ecosystem, Ethereum Ecosystem, Alameda Research Portfolio, Energi Ecosystem, Sora Ecosystem, YZi Labs (Prev. Binance Labs) Portfolio, GMCI Layer 1 Index, GMCI Index"
WUF,wuffi,WUFFI,WUF,12140771,12140771.0,15032.71,"Solana Ecosystem, Meme, Base Ecosystem"
LNQ,linqai,LinqAI,LNQ,11012864,36314915.0,624283.0,"Artificial Intelligence (AI), Ethereum Ecosystem"
MINIMA,minima,Minima,MINIMA,10548076,20239286.0,627441.0,"Smart Contract Platform, Layer 1 (L1), DePIN"
TRUF,truflation,TRUF.Network,TRUF,9177160,24681441.0,474036.0,"Infrastructure, Oracle, Arbitrum Ecosystem, Ethereum Ecosystem, Real World Assets (RWA), Base Ecosystem, Coinbase Ventures Portfolio"
STOS,stratos,Stratos,STOS,8692945,12719472.0,71981.0,"Entertainment, Infrastructure, Smart Contract Platform, Storage, Layer 1 (L1), Ethereum Ecosystem, DePIN, Osmosis Ecosystem"
RWA,allo,Allo,RWA,8538921,47438452.0,3279999.0,"BNB Chain Ecosystem, Real World Assets (RWA), RWA Protocol"
RFC,retard-finder-coin,Retard Finder Coin,RFC,7854232,8168101.0,6454815.0,"Solana Ecosystem, Meme, Pump.fun Ecosystem, Wojak-Themed"
BCUT,bitscrunch-token,bitsCrunch Token,BCUT,7330754,13328471.0,7521226.0,"Artificial Intelligence (AI), Infrastructure, Analytics, NFT, Polygon Ecosystem, Ethereum Ecosystem, Animoca Brands Portfolio, Coinbase Ventures Portfolio"
BAD,bad-idea-ai,Bad Idea AI,BAD,6155377,7455615.0,1132178.0,"Artificial Intelligence (AI), Meme, Ethereum Ecosystem, Telegram Apps, Discord Bots, Shibarium Ecosystem"
BST,blocksquare,Blocksquare,BST,6098592,6098592.0,147668.0,"Tokenized Real Estate, Tokenized Assets, Ethereum Ecosystem, Real World Assets (RWA)"
INTER,inter-milan-fan-token,Inter Milan Fan Token,INTER,5995999,5995999.0,2700826.0,"Sports, Fan Token, Chiliz Ecosystem"
BEAM,beam,BEAM,BEAM,5469963,7741273.0,78039.0,"Smart Contract Platform, Privacy, Ethereum Ecosystem, Proof of Work (PoW), BeamPrivacy Ecosystem, Privacy Blockchain"
SCF,smoking-chicken-fish,Smoking Chicken Fish,SCF,5458294,5458294.0,158698.0,"Solana Ecosystem, Meme, Solana Meme, Pump.fun Ecosystem"
GURU,guru,Guru,GURU,5447365,5447365.0,33072.0,"Decentralized Finance (DeFi), Ethereum Ecosystem"
TSUKA,dejitaru-tsuka,Dejitaru Tsuka,TSUKA,5267501,5267501.0,87057.0,"Meme, Ethereum Ecosystem"
MCN,mcncoin,MCNCOIN,MCN,4789452,4789452.0,532667.0,BNB Chain Ecosystem
BITBOARD,bitboard,BitBoard,BB,4685564,7082559.0,25351.0,"Smart Contract Platform, Polygon Ecosystem, Layer 2 (L2), Zero Knowledge (ZK)"
AZIT,azit,azit,AZIT,4645498,6628898.0,3250375.0,Kaia Ecosystem
NRG,energi,Energi,NRG,4529000,4529541.0,735786.0,"Smart Contract Platform, Masternodes, Layer 1 (L1), Ethereum Ecosystem, Proof of Stake (PoS), Energi Ecosystem"
BILLY,billy,Billy,BILLY,4422814,4422814.0,2084732.0,"Solana Ecosystem, Meme, Dog-Themed, Solana Meme, Pump.fun Ecosystem"
HUAHUA,chihuahua-token,Chihuahua Chain,HUAHUA,4227804,4503367.0,814747.0,"Smart Contract Platform, NFT, Layer 1 (L1), Meme, Dog-Themed, Osmosis Ecosystem"
KANGO,kango,KANGO,KANGO,4010326,4010326.0,129928.0,"Meme, Kaspa Ecosystem"
DYNA,dynachain,Dynachain,DYNA,3993470,16476400.0,257632.0,"Healthcare, BNB Chain Ecosystem"
QNT,quant-network,Quant,QNT,1594720204,1602210916.0,24084040.0,"Ethereum Ecosystem, Real World Assets (RWA), Energi Ecosystem, Coinbase 50 Index"
XAUT,tether-gold,Tether Gold,XAUT,1257010278,1257010278.0,20699852.0,"Stablecoins, Tokenized Assets, Tokenized Gold, Ethereum Ecosystem, Real World Assets (RWA), Tokenized Commodities"
PENDLE,pendle,Pendle,PENDLE,904057451,1520572780.0,155334143.0,"Decentralized Exchange (DEX), Decentralized Finance (DeFi), Yield Farming, Automated Market Maker (AMM), BNB Chain Ecosystem, Derivatives, Lending/Borrowing Protocols, Arbitrum Ecosystem, Ethereum Ecosystem, Optimism Ecosystem, Fixed Interest, LSDFi, Base Ecosystem, Restaking, LRTfi, Liquid Restaking Governance Tokens, Berachain Ecosystem, Yield Tokenization Protocol, YZi Labs (Prev. Binance Labs) Portfolio, GMCI DeFi Index, Sonic Ecosystem, Liquid Staking, GMCI Index, BTCfi Protocol, HyperEVM Ecosystem"
DOGWIFHAT,dogwifcoin,dogwifhat,WIF,881800466,881800466.0,2005593459.0,"Solana Ecosystem, Meme, Dog-Themed, Solana Meme, GMCI Meme Index, GMCI Index"
FLUID,instadapp,Fluid,FLUID,468910057,703268747.0,3388473.0,"Decentralized Finance (DeFi), Solana Ecosystem, Polygon Ecosystem, Arbitrum Ecosystem, Ethereum Ecosystem, Base Ecosystem, Coinbase Ventures Portfolio, Pantera Capital Portfolio"
KAVA,kava,Kava,KAVA,409255441,409255441.0,35915691.0,"Smart Contract Platform, Layer 1 (L1), Binance Launchpad, DWF Labs Portfolio, Osmosis Ecosystem, YZi Labs (Prev. Binance Labs) Portfolio, Made in USA"
ZBCN,zebec-network,Zebec Network,ZBCN,401084496,464713428.0,22809957.0,"Decentralized Finance (DeFi), Solana Ecosystem, Real World Assets (RWA), Payment Solutions, DePIN, Coinbase Ventures Portfolio, Alameda Research Portfolio, Circle Ventures Portfolio, OKX Ventures Portfolio, RWA Protocol, Made in USA"
ATH,aethir,Aethir,ATH,385901688,1420772319.0,30840398.0,"Solana Ecosystem, Arbitrum Ecosystem, Impossible Finance Launchpad, Ethereum Ecosystem, DePIN, Animoca Brands Portfolio"
1INCH,1inch,1inch,1INCH,354839658,381351112.0,89894119.0,"Decentralized Exchange (DEX), Exchange-based Tokens, Decentralized Finance (DeFi), Automated Market Maker (AMM), BNB Chain Ecosystem, Avalanche Ecosystem, Polygon Ecosystem, Near Protocol Ecosystem, Harmony Ecosystem, Ethereum Ecosystem, FTX Holdings, Alameda Research Portfolio, DragonFly Capital Portfolio, Pantera Capital Portfolio, Energi Ecosystem, YZi Labs (Prev. Binance Labs) Portfolio, GMCI DeFi Index, Galaxy Digital Portfolio, Blockchain Capital Portfolio, Dex Aggregator, GMCI Index, Coinbase 50 Index"
ZORA,zora,Zora,ZORA,319059627,986891222.0,131628266.0,"Infrastructure, Media, Smart Contract Platform, NFT, Layer 2 (L2), Base Ecosystem, Coinbase Ventures Portfolio, Zora Ecosystem"
PLUME,plume,Plume,PLUME,254812326,961555947.0,27017348.0,"Smart Contract Platform, Layer 1 (L1), Ethereum Ecosystem, Real World Assets (RWA), RWA Protocol, Made in USA, Plume Network Ecosystem"
SFP,safepal,SafePal,SFP,237203331,237203331.0,6770264.0,"BNB Chain Ecosystem, Wallets, Ethereum Ecosystem, Animoca Brands Portfolio, Binance Launchpad, Energi Ecosystem, YZi Labs (Prev. Binance Labs) Portfolio"
QTUM,qtum,Qtum,QTUM,221345769,225643411.0,24894905.0,"Smart Contract Platform, Proof of Stake (PoS), Made in China"
ROSE,oasis-network,Oasis,ROSE,206694805,279076028.0,10256153.0,"Smart Contract Platform, BNB Chain Ecosystem, Layer 1 (L1), Proof of Stake (PoS), Pantera Capital Portfolio, Andreessen Horowitz (a16z) Portfolio, YZi Labs (Prev. Binance Labs) Portfolio, Blockchain Capital Portfolio, Privacy Blockchain, Polychain Capital Portfolio, Coinbase 50 Index"
ZANO,zano,Zano,ZANO,197887756,197907547.0,2355996.0,"Smart Contract Platform, Privacy, Layer 1 (L1), Proof of Stake (PoS), Proof of Work (PoW), Zano Ecosystem, Privacy Blockchain"
SHX,stronghold-token,Stronghold,SHX,165628931,,4320539.0,"Ethereum Ecosystem, Stellar Ecosystem, Made in USA"
PROM,prometeus,Prom,PROM,163906383,172887555.0,3275647.0,"Smart Contract Platform, BNB Chain Ecosystem, Ethereum Ecosystem, Layer 2 (L2)"
OSAK,osaka-protocol,Osaka Protocol,OSAK,158818831,158818831.0,304682.0,"BNB Chain Ecosystem, Solana Ecosystem, Avalanche Ecosystem, Polygon Ecosystem, Meme, Arbitrum Ecosystem, Ethereum Ecosystem, Optimism Ecosystem, Base Ecosystem, Dog-Themed"
XCH,chia,Chia,XCH,144140892,325246193.0,5945063.0,"Smart Contract Platform, Layer 1 (L1), DePIN, Andreessen Horowitz (a16z) Portfolio, Made in USA"
WAVES,waves,Waves,WAVES,122599899,122599899.0,138507001.0,"Smart Contract Platform, DWF Labs Portfolio, Proof of Stake (PoS)"
UMA,uma,UMA,UMA,113944148,160576453.0,16250864.0,"Business Services, Decentralized Finance (DeFi), Oracle, Derivatives, Synthetic Issuer, Avalanche Ecosystem, Ethereum Ecosystem, Blockchain Capital Portfolio, Synthetic, Made in USA"
XVG,verge,Verge,XVG,109112828,109331085.0,8969436.0,"Smart Contract Platform, Privacy, Proof of Work (PoW), Made in USA"
BIGTIME,big-time,Big Time,BIGTIME,108672219,284743877.0,15504386.0,"Gaming (GameFi), Play To Earn, Ethereum Ecosystem, RPG, Alameda Research Portfolio, Circle Ventures Portfolio, OKX Ventures Portfolio, MMO"
RED,redstone-oracles,RedStone,RED,105254948,375910529.0,27747098.0,"Infrastructure, Oracle, Ethereum Ecosystem"
DAG,constellation-labs,Constellation,DAG,101419285,125216133.0,1411958.0,"Smart Contract Platform, Layer 1 (L1), Base Ecosystem, Layer 0 (L0), Made in USA, Directed Acyclic Graph (DAG)"
MANTA,manta-network,Manta Network,MANTA,99694272,227362195.0,25461561.0,"Smart Contract Platform, Polkadot Ecosystem, Binance Launchpool, Layer 2 (L2), Manta Network Ecosystem, Multicoin Capital Portfolio, Alameda Research Portfolio, DeFiance Capital Portfolio, YZi Labs (Prev. Binance Labs) Portfolio"
FIDA,bonfida,Bonfida (aka SNS),FIDA,98003103,98901988.0,15156767.0,"Big Data, Business Services, Infrastructure, Decentralized Finance (DeFi), Solana Ecosystem, FTX Holdings, DWF Labs Portfolio, Name Service"
LQTY,liquity,Liquity,LQTY,90473421,92658227.0,13161689.0,"Decentralized Finance (DeFi), Lending/Borrowing Protocols, Arbitrum Ecosystem, Ethereum Ecosystem, Alameda Research Portfolio, Pantera Capital Portfolio"
DYM,dymension,Dymension,DYM,84712819,244143308.0,9481760.0,"Smart Contract Platform, Cosmos Ecosystem, Modular Blockchain, Osmosis Ecosystem, Rollups-as-a-Service (RaaS)"
TAIKO,taiko,Taiko,TAIKO,77155911,445671525.0,11095532.0,"Smart Contract Platform, BNB Chain Ecosystem, Ethereum Ecosystem, Layer 2 (L2), Zero Knowledge (ZK), Rollup, OKX Ventures Portfolio, Centralized Exchange (CEX) Product, Binance Alpha Spotlight"
SOON,soon-2,SOON,SOON,74921696,309163906.0,38758964.0,"Infrastructure, Smart Contract Platform, BNB Chain Ecosystem, Layer 2 (L2), Base Ecosystem, Cross-chain Communication, Binance Alpha Spotlight"
XRD,radix,Radix,XRD,70580657,78942966.0,26913.0,"Smart Contract Platform, Layer 1 (L1), DWF Labs Portfolio, Radix Ecosystem"
STEEM,steem,Steem,STEEM,70041118,70043850.0,14308709.0,SocialFi
AITECH,solidus-aitech,Solidus Ai Tech,AITECH,64394383,82102883.0,22054716.0,"Artificial Intelligence (AI), BNB Chain Ecosystem, Solana Ecosystem, Launchpad, Base Ecosystem, ChainGPT Launchpad, AI Agents, Binance Alpha Spotlight, DeFAI"
SAI,sai,Sai,SAI,62663539,62663539.0,636.03,"Decentralized Finance (DeFi), Ethereum Ecosystem"
JOE,joe,JOE,JOE,62406042,78326328.0,8725896.0,"Decentralized Exchange (DEX), Decentralized Finance (DeFi), Yield Farming, Automated Market Maker (AMM), BNB Chain Ecosystem, Avalanche Ecosystem, Arbitrum Ecosystem, Mantle Ecosystem, DeFiance Capital Portfolio, Delphi Ventures Portfolio, Dex Aggregator"
WCT,connect-token-wct,WalletConnect Token,WCT,60474308,324781184.0,35077018.0,"Solana Ecosystem, Wallets, Ethereum Ecosystem, Optimism Ecosystem"
ANYONE,airtor-protocol,ANyONe Protocol,ANYONE,59258780,74131215.0,560520.0,"Smart Contract Platform, Ethereum Ecosystem, DePIN, Privacy Blockchain"
HASHAI,hashai,HashAI,HASHAI,49974089,53070295.0,674470.0,"Artificial Intelligence (AI), Ethereum Ecosystem, DePIN"
BOBA,boba-network,Boba Network,BOBA,49426091,50097467.0,10035340.0,"Smart Contract Platform, Ethereum Ecosystem, Layer 2 (L2), Rollup, Boba Network Ecosystem, GMCI Layer 2 Index, GMCI Index, Made in USA"
SUNDOG,sundog,Sundog,SUNDOG,46708888,46708888.0,16042508.0,"Meme, Tron Ecosystem, Sun Pump Ecosystem, TRON Meme"
SD,stader,Stader,SD,46658701,92276162.0,12596808.0,"BNB Chain Ecosystem, Solana Ecosystem, Polygon Ecosystem, Fantom Ecosystem, Ethereum Ecosystem, Liquid Staking Governance Tokens, Animoca Brands Portfolio, Coinbase Ventures Portfolio, Pantera Capital Portfolio, Liquid Staking, Binance Alpha Spotlight"
PARTI,particle-network,Particle Network,PARTI,43148408,185186302.0,29365922.0,"Decentralized Finance (DeFi), BNB Chain Ecosystem, Layer 1 (L1), Base Ecosystem, Account Abstraction, Cross-chain Communication, Binance HODLer Airdrops, Chain Abstraction, Binance Wallet IDO"
MBL,moviebloc,MovieBloc,MBL,42160463,67586914.0,6205507.0,DWF Labs Portfolio
SERAPH,seraph,Seraph,SERAPH,38030175,143480002.0,15133249.0,"Gaming (GameFi), BNB Chain Ecosystem, Play To Earn, Ethereum Ecosystem, RPG, Gaming Utility Token, Action Games"
REZ,renzo,Renzo,REZ,36130753,137297025.0,14514544.0,"Decentralized Finance (DeFi), Binance Launchpool, Ethereum Ecosystem, Base Ecosystem, Restaking, YZi Labs (Prev. Binance Labs) Portfolio, OKX Ventures Portfolio"
RSS3,rss3,RSS3,RSS3,35974445,45203434.0,5350047.0,"Artificial Intelligence (AI), Infrastructure, Storage, Ethereum Ecosystem, Coinbase Ventures Portfolio, DragonFly Capital Portfolio, RSS3 VSL Ecosystem, AI Framework, DeFAI"
NFP,nfprompt-token,NFPrompt,NFP,32538563,68800087.0,3441262.0,"BNB Chain Ecosystem, Binance Launchpool, YZi Labs (Prev. Binance Labs) Portfolio"
DAO,dao-maker,DAO Maker,DAO,30999198,34285094.0,1635668.0,"BNB Chain Ecosystem, Solana Ecosystem, Launchpad, DaoMaker Launchpad, Arbitrum Ecosystem, Ethereum Ecosystem, Step Network Ecosystem"
VIC,tomochain,Viction,VIC,29790177,51225188.0,3310473.0,"Smart Contract Platform, Masternodes, Layer 1 (L1), DWF Labs Portfolio"
VOW,vow,Vow,VOW,24357447,80593200.0,318785.0,"Retail, Tourism, BNB Chain Ecosystem, Ethereum Ecosystem"
RIO,realio-network,Realio Network Token,RIO,22229567,22229803.0,2325839.0,"BNB Chain Ecosystem, Solana Ecosystem, Ethereum Ecosystem, Algorand Ecosystem, Real World Assets (RWA), Osmosis Ecosystem, Stellar Ecosystem, Made in USA"
NMT,netmind-token,NetMind Token,NMT,21301056,59582162.0,1685105.0,"Artificial Intelligence (AI), BNB Chain Ecosystem, Ethereum Ecosystem, DePIN, AI Agents"
PORT3,port3-network,Port3 Network,PORT3,20920323,41853435.0,4523822.0,"SocialFi, BNB Chain Ecosystem, Ethereum Ecosystem, Poolz Finance Launchpad"
OGY,origyn-foundation,ORIGYN,OGY,20658182,24690634.0,200556.0,"Internet Computer Ecosystem, Real World Assets (RWA), RWA Protocol"
LIF3,lif3,LIF3 (OLD),LIF3,20037671,68089348.0,59.54,Fantom Ecosystem
BOOE,book-of-ethereum,Book of Ethereum,BOOE,19943019,19943019.0,227687.0,"Meme, Ethereum Ecosystem"
LOOKS,looksrare,LooksRare,LOOKS,19343696,19343694.0,2298441.0,"NFT, Ethereum Ecosystem, NFT Marketplace"
LOCK,houdini-swap,Houdini Swap,LOCK,19171406,19171406.0,16837.91,"Privacy, Solana Ecosystem, Ethereum Ecosystem"
LINGO,lingo,Lingo,LINGO,17833220,17833909.0,332155.0,"Solana Ecosystem, Real World Assets (RWA), Base Ecosystem, RWA Protocol"
MLC,my-lovely-coin,My Lovely Coin,MLC,17707504,56250501.0,65027.0,"Charity, Gaming (GameFi), Polygon Ecosystem, Gaming Utility Token"
MEMEFI,memefi-2,MemeFi,MEMEFI,17436860,17436860.0,13427709.0,"Gaming (GameFi), NFT, Meme, Play To Earn, Sui Ecosystem, Telegram Apps, Tap to Earn, Sui Meme, Action Games"
VSC,vyvo-smart-chain,Vyvo Smart Chain,VSC,17347892,87305351.0,100006.0,"Smart Contract Platform, BNB Chain Ecosystem, Polygon Ecosystem, Layer 2 (L2)"
SUKU,suku,SUKU,SUKU,17268363,53107561.0,1651829.0,"Solana Ecosystem, Polygon Ecosystem, Ethereum Ecosystem, Made in USA"
NATIX,natix-network,NATIX Network,NATIX,16821582,78397542.0,464593.0,"Artificial Intelligence (AI), Internet of Things (IOT), Solana Ecosystem, DePIN"
VINU,vita-inu,Vita Inu,VINU,16311894,16311894.0,1323583.0,"BNB Chain Ecosystem, Meme, Dog-Themed, DWF Labs Portfolio, Binance Alpha Spotlight"
FHE,mind-network,Mind Network,FHE,16276429,65367183.0,8402628.0,"Artificial Intelligence (AI), Smart Contract Platform, BNB Chain Ecosystem, Layer 2 (L2), Binance Wallet IDO"
ZETA,zeta,Zeta,ZEX,15541522,82768834.0,1130535.0,"Decentralized Finance (DeFi), Derivatives, Perpetuals, Solana Ecosystem"
NUM,numbers-protocol,Numbers Protocol,NUM,15176064,15363330.0,199794.0,"Artificial Intelligence (AI), Smart Contract Platform, BNB Chain Ecosystem, DaoMaker Launchpad, Ethereum Ecosystem, Avalanche L1, YZi Labs (Prev. Binance Labs) Portfolio, Outlier Ventures Portfolio"
WEPE,wall-street-pepe,Wall Street Pepe,WEPE,14915856,14915856.0,889848.0,"Meme, Ethereum Ecosystem, Frog-Themed, The Boys Club"
CRTS,cratos,Cratos,CRTS,13712658,21595155.0,463814.0,"BNB Chain Ecosystem, Ethereum Ecosystem"
K,kinto,Kinto,K,13539328,73761448.0,253392.0,"Decentralized Finance (DeFi), Wallets, Arbitrum Ecosystem"
PROPS,propbase,Propbase,PROPS,13049492,36038121.0,9159197.0,"Tokenized Real Estate, Tokenized Assets, Aptos Ecosystem, Real World Assets (RWA), Base Ecosystem, RWA Protocol"
MFT,mainframe,Mainframe,MFT,11050077,11772242.0,28.19,"Ethereum Ecosystem, Energi Ecosystem"
AEROBUD,aerobud,AEROBUD,AEROBUD,9812877,9812877.0,338025.0,"Charity, Meme, Base Ecosystem, Dog-Themed, Base Meme, Made in USA"
EPT,balance,Balance,EPT,9611869,41491574.0,5928952.0,"Gaming (GameFi), BNB Chain Ecosystem, Animoca Brands Portfolio, DWF Labs Portfolio, AI Agents, Andreessen Horowitz (a16z) Portfolio, AI Agent Launchpad"
DIONE,dione,Dione,DIONE,9112785,10621006.0,229750.0,"Energy, Smart Contract Platform, Layer 1 (L1), Made in USA"
MCB,mcdex,MUX Protocol,MCB,8566561,10819057.0,4133.79,"Decentralized Exchange (DEX), Exchange-based Tokens, Decentralized Finance (DeFi), BNB Chain Ecosystem, Derivatives, Perpetuals, Arbitrum Ecosystem, Ethereum Ecosystem, Multicoin Capital Portfolio, Alameda Research Portfolio, DeFiance Capital Portfolio, Delphi Ventures Portfolio, OKX Ventures Portfolio"
SIDUS,sidus,Sidus,SIDUS,7511869,12823441.0,357650.0,"Gaming (GameFi), NFT, BNB Chain Ecosystem, Metaverse, Play To Earn, Ethereum Ecosystem, Linea Ecosystem, Animoca Brands Portfolio, Base Ecosystem, RPG, Gaming Governance Token, Alameda Research Portfolio, OKX Ventures Portfolio"
PEAR,pear-protocol,Pear Protocol,PEAR,6963476,25474047.0,21065.0,"Decentralized Exchange (DEX), Decentralized Finance (DeFi), Perpetuals, Arbitrum Ecosystem"
JUNO,juno-network,JUNO,JUNO,6308799,8381711.0,63391.0,"Smart Contract Platform, Cosmos Ecosystem, Osmosis Ecosystem, Juno Ecosystem, Evmos Ecosystem, Secret Ecosystem"
RLY,rally-2,Rally,RLY,6163181,18445668.0,24482.0,"SocialFi, Yield Farming, Ethereum Ecosystem, Alleged SEC Securities, Coinbase Ventures Portfolio, Andreessen Horowitz (a16z) Portfolio"
LEVER,lever,LeverFi,LEVER,5982806,5982935.0,1141840.0,"Decentralized Finance (DeFi), Ethereum Ecosystem, DWF Labs Portfolio, Alameda Research Portfolio"
PMT,public-meme-token,Public Masterpiece Token,PMT,5963842,26888280.0,448911.0,BNB Chain Ecosystem
KILO,kiloex,KiloEx,KILO,5489755,25931767.0,3100027.0,"Decentralized Exchange (DEX), Decentralized Finance (DeFi), BNB Chain Ecosystem, Derivatives, Binance Wallet IDO"
NLS,nolus,Nolus,NLS,5086168,7145205.0,114982.0,"Ethereum Ecosystem, Osmosis Ecosystem"
SHRUB,shrub,Shrub,SHRUB,4947554,4988653.0,391734.0,"Solana Ecosystem, Meme, Ethereum Ecosystem, Base Ecosystem, Elon Musk-Inspired"
MAS,massa,Massa,MAS,4762797,17363122.0,129460.0,"Smart Contract Platform, Layer 1 (L1), Massa Ecosystem"
LL,lightlink,LightLink,LL,4178485,14175997.0,122038.0,"Infrastructure, Smart Contract Platform, Ethereum Ecosystem, Layer 2 (L2), Rollup, LightLink Ecosystem"
OBT,oobit,Oobit,OBT,4134224,11744143.0,13564.62,"BNB Chain Ecosystem, Ethereum Ecosystem, Payment Solutions"
METAV,metaverse,METAVERSE,METAV,4107228,4107228.0,378865.0,"Artificial Intelligence (AI), Solana Ecosystem, AI Agents, Pump.fun Ecosystem, Binance Alpha Spotlight"
HARAMBEAI,harambe-ai,Harambe AI,HARAMBEAI,4035919,5916631.0,84057.0,"Meme, Ethereum Ecosystem"
ATS,alltoscan,Alltoscan,ATS,4001617,5862265.0,94075.0,BNB Chain Ecosystem
LIKE,likecoin,LikeCoin,LIKE,3809143,5190410.0,219.6,"SocialFi, Osmosis Ecosystem"
HMND,humanode,Humanode,HMND,3596742,9796599.0,191710.0,"Artificial Intelligence (AI), Smart Contract Platform, Layer 1 (L1), Decentralized Identifier (DID), Discord Bots, Humanode Ecosystem"
LEOX,leox,LEOX,LEOX,3260909,3260909.0,58673.0,"Tokenized Real Estate, Tokenized Assets, Ethereum Ecosystem, Real World Assets (RWA), RWA Protocol"
SDN,shiden,Shiden Network,SDN,3194138,4134091.0,11371.04,Smart Contract Platform
GAIA,gaia-2,Gaia,SN57,2899559,2918059.0,29569.0,"Artificial Intelligence (AI), Bittensor Ecosystem, Bittensor Subnets"
JUC,juice-2,Juice,JUC,2733778,4800986.0,21789.0,"Gaming (GameFi), Avalanche Ecosystem"
GOATS,goats-2,GOATS,GOATS,2732836,2821095.0,6058.39,"Gaming (GameFi), Meme, Telegram Apps, TON Ecosystem"
HBAR,hedera-hashgraph,Hedera,HBAR,10602472234,12505001288.0,404521423.0,"Smart Contract Platform, Layer 1 (L1), Hedera Ecosystem, GMCI Layer 1 Index, GMCI 30 Index, GMCI Index, Outlier Ventures Portfolio, Made in USA, Directed Acyclic Graph (DAG)"
BGB,bitget-token,Bitget Token,BGB,5268879580,5268879580.0,215477342.0,"Exchange-based Tokens, Centralized Exchange (CEX) Token, Ethereum Ecosystem, DragonFly Capital Portfolio, Morph L2 Ecosystem"
RENDER,render-token,Render,RENDER,2009256908,2066495536.0,102406936.0,"Artificial Intelligence (AI), NFT, Metaverse, Solana Ecosystem, Polygon Ecosystem, Ethereum Ecosystem, DePIN, Multicoin Capital Portfolio, Alameda Research Portfolio, GMCI DePIN Index, GMCI 30 Index, GMCI Index, Made in USA, Coinbase 50 Index"
IP,story-2,Story,IP,1702903623,5681525761.0,216165872.0,"Artificial Intelligence (AI), Smart Contract Platform, Layer 1 (L1), Made in USA, Story Ecosystem, IP"
LBTC,lombard-staked-btc,Lombard Staked BTC,LBTC,1586214022,1586214022.0,7488475.0,"BNB Chain Ecosystem, Ethereum Ecosystem, Sui Ecosystem, Base Ecosystem, Restaking, Berachain Ecosystem, Liquid Restaking Tokens, Sonic Ecosystem, Etherlink Ecosystem, Swellchain Ecosystem, Corn Ecosystem, Liquid Staked BTC, Katana Ecosystem, TAC Ecosystem"
XDC,xdce-crowd-sale,XDC Network,XDC,1410791863,3303723100.0,42442682.0,"Smart Contract Platform, Layer 1 (L1), Real World Assets (RWA)"
TIA,celestia,Celestia,TIA,1338767195,2043122304.0,170170959.0,"Smart Contract Platform, Cosmos Ecosystem, Layer 1 (L1), Data Availability, Modular Blockchain, Osmosis Ecosystem, eGirl Capital Portfolio, Coinbase Ventures Portfolio, Proof of Stake (PoS), Secret Ecosystem, YZi Labs (Prev. Binance Labs) Portfolio, Delphi Ventures Portfolio, Galaxy Digital Portfolio, Blockchain Capital Portfolio, OKX Ventures Portfolio, Polychain Capital Portfolio"
LDO,lido-dao,Lido DAO,LDO,1267497659,1415027924.0,250343035.0,"Infrastructure, Decentralized Finance (DeFi), Polygon Ecosystem, Arbitrum Ecosystem, Ethereum Ecosystem, Optimism Ecosystem, Liquid Staking Governance Tokens, eGirl Capital Portfolio, Paradigm Portfolio, Coinbase Ventures Portfolio, Multicoin Capital Portfolio, Index Coop Defi Index, Alameda Research Portfolio, DragonFly Capital Portfolio, Andreessen Horowitz (a16z) Portfolio, GMCI DeFi Index, Delphi Ventures Portfolio, Liquid Staking, GMCI Index, Coinbase 50 Index"
FLOKI,floki,FLOKI,FLOKI,1020358268,1056134594.0,232705501.0,"Gaming (GameFi), NFT, BNB Chain Ecosystem, Metaverse, Meme, Play To Earn, Ethereum Ecosystem, Telegram Apps, Dog-Themed, DWF Labs Portfolio, RPG, On-chain Gaming, TokenFi Launchpad, GMCI Meme Index, GMCI Index"
RAY,raydium,Raydium,RAY,983663527,2036434141.0,157811995.0,"Decentralized Exchange (DEX), Decentralized Finance (DeFi), Yield Farming, Automated Market Maker (AMM), Solana Ecosystem, Launchpad, GMCI DeFi Index, GMCI Index"
CFX,conflux-token,Conflux,CFX,920349605,1023214451.0,72767883.0,"Smart Contract Platform, DWF Labs Portfolio, Proof of Work (PoW), GMCI Layer 1 Index, Sequoia Capital Portfolio, GMCI Index, Made in China"
PYTH,pyth-network,Pyth Network,PYTH,703771141,1223953018.0,30443340.0,"Business Services, Infrastructure, Decentralized Finance (DeFi), Oracle, Solana Ecosystem, Neon Ecosystem, Manta Network Ecosystem, Multicoin Capital Portfolio, GMCI DeFi Index, Delphi Ventures Portfolio, GMCI Index"
BTT,bittorrent,BitTorrent,BTT,666745351,669408689.0,26842571.0,"Storage, BNB Chain Ecosystem, Ethereum Ecosystem, DePIN, Alleged SEC Securities, Binance Launchpad, Tron Ecosystem, Energi Ecosystem, YZi Labs (Prev. Binance Labs) Portfolio, BitTorrent Ecosystem, GMCI DePIN Index, GMCI Index"
SUN,sun-token,Sun Token,SUN,459336884,477216440.0,25934928.0,"Decentralized Finance (DeFi), Tron Ecosystem"
ZK,zksync,ZKsync,ZK,455788149,1323542031.0,35206009.0,"Smart Contract Platform, Ethereum Ecosystem, Layer 2 (L2), Zero Knowledge (ZK), ZkSync Ecosystem, Consensys Portfolio, Blockchain Capital Portfolio, OKX Ventures Portfolio"
EIGEN,eigenlayer,EigenCloud (prev. EigenLayer),EIGEN,440015236,2376107367.0,80886011.0,"Infrastructure, Ethereum Ecosystem, Base Ecosystem, Data Availability, Restaking, Polychain Capital Portfolio, Made in USA"
