BTY,bityuan,Bityuan,BTY,23491758,23491915.0,356704.0,
TUNA,defituna,DefiTuna,TUNA,22012797,78198212.0,471725.0,"Decentralized Exchange (DEX), Exchange-based Tokens, Decentralized Finance (DeFi), Automated Market Maker (AMM), Lending/Borrowing Protocols, Solana Ecosystem"
HOPR,hopr,HOPR,HOPR,21867182,22908808.0,112463.0,"Privacy, Gnosis Chain Ecosystem, Ethereum Ecosystem, DePIN, YZi Labs (Prev. Binance Labs) Portfolio, Governance"
NFP,nfprompt-token,NFPrompt,NFP,21713681,43086147.0,5043109.0,"BNB Chain Ecosystem, Binance Launchpool, YZi Labs (Prev. Binance Labs) Portfolio, Governance"
SLERF,slerf,Slerf,SLERF,20476720,20476720.0,10941534.0,"Solana Ecosystem, Meme, Solana Meme"
BXN,bxn,BXN,BXN,18163244,58221223.0,467791.0,"Smart Contract Platform, Layer 1 (L1)"
MIGGLES,mister-miggles,Mr. Miggles,MIGGLES,18078007,18078007.0,1386080.0,"Meme, Base Ecosystem, Cat-Themed, Base Meme, Made in USA"
LADYS,milady-meme-coin,Milady Meme Coin,LADYS,17594889,17594889.0,3837190.0,"Meme, Arbitrum Ecosystem, Ethereum Ecosystem, DWF Labs Portfolio, 4chan-Themed"
PYR,vulcan-forged,Vulcan Forged,PYR,16906900,35373487.0,5267791.0,"Gaming (GameFi), NFT, Metaverse, Polygon Ecosystem, Ethereum Ecosystem, DWF Labs Portfolio, Gaming Blockchains, Gaming Platform, Action Games, MMO"
GFAL,games-for-a-living,Games for a Living,GFAL,16733861,31853292.0,95863.0,"Gaming (GameFi), NFT, BNB Chain Ecosystem, Play To Earn"
RBNT,redbelly-network-token,Redbelly Network,RBNT,16582799,72342754.0,177410.0,"Smart Contract Platform, Layer 1 (L1), Real World Assets (RWA), Redbelly Network Ecosystem"
PORT3,port3-network,Port3 Network,PORT3,15554026,31117560.0,2645686.0,"SocialFi, BNB Chain Ecosystem, Ethereum Ecosystem, Poolz Finance Launchpad"
ARC,ai-rig-complex,AI Rig Complex,ARC,13370946,13370946.0,2730836.0,"Artificial Intelligence (AI), Infrastructure, Solana Ecosystem, AI Agents, Pump.fun Ecosystem, AI Agent Launchpad, Binance Alpha Spotlight, AI Framework"
POLS,polkastarter,Polkastarter,POLS,13316239,13422324.0,1931731.0,"Decentralized Finance (DeFi), BNB Chain Ecosystem, Launchpad, Ethereum Ecosystem"
BKN,brickken,Brickken,BKN,13019371,26070394.0,1032505.0,"Tokenized Real Estate, BNB Chain Ecosystem, Impossible Finance Launchpad, Ethereum Ecosystem, Real World Assets (RWA), RWA Protocol"
AMO,amo,AMO Coin,AMO,13015141,13015141.0,92795.0,"Big Data, Kaia Ecosystem"
LAZIO,lazio-fan-token,Lazio Fan Token,LAZIO,10844560,35782008.0,1695517.0,"Sports, BNB Chain Ecosystem, Fan Token, Binance Launchpad"
REEF,reef,Reef,REEF,10708706,10708706.0,1587756.0,"BNB Chain Ecosystem, Binance Launchpool, Layer 1 (L1), Harmony Ecosystem, Ethereum Ecosystem, Alameda Research Portfolio, Energi Ecosystem, Sora Ecosystem, YZi Labs (Prev. Binance Labs) Portfolio, GMCI Layer 1 Index, GMCI Index"
KRL,kryll,KRYLL,KRL,10133732,12443192.0,139328.0,"Artificial Intelligence (AI), Decentralized Finance (DeFi), Analytics, Arbitrum Ecosystem, Ethereum Ecosystem, Optimism Ecosystem, Base Ecosystem, AI Applications"
RWA,allo,Allo,RWA,10020845,55671363.0,1118355.0,"BNB Chain Ecosystem, Real World Assets (RWA), RWA Protocol"
BITBOARD,bitboard,BitBoard,BB,9892707,14953519.0,116734.0,"Smart Contract Platform, Polygon Ecosystem, Layer 2 (L2), Zero Knowledge (ZK)"
SEAM,seamless-protocol,Seamless Protocol,SEAM,9708798,24651788.0,255570.0,"Decentralized Finance (DeFi), Lending/Borrowing Protocols, Ethereum Ecosystem, Base Ecosystem"
ZCX,unizen,Unizen,ZCX,9413808,13697036.0,139837.0,"Decentralized Exchange (DEX), Exchange-based Tokens, Decentralized Finance (DeFi), Polygon Ecosystem, Ethereum Ecosystem, DWF Labs Portfolio"
CLEAR,everclear,Everclear,CLEAR,8857404,16173434.0,73823.0,"Infrastructure, BNB Chain Ecosystem, Polygon Ecosystem, Gnosis Chain Ecosystem, Arbitrum Ecosystem, Ethereum Ecosystem, Optimism Ecosystem, Coinbase Ventures Portfolio, Cross-chain Communication, Chain Abstraction"
FARTCOIN,based-fartcoin,Based Fartcoin,FARTCOIN,8467489,8467489.0,34984.0,"Meme, Base Ecosystem, Base Meme"
PAID,paid-network,PAID,PAID,7689330,8499865.0,97018.0,"Launchpad, Base Ecosystem"
BEAM,beam,BEAM,BEAM,6732027,9363621.0,23923.0,"Smart Contract Platform, Privacy, Ethereum Ecosystem, Proof of Work (PoW), BeamPrivacy Ecosystem, Privacy Blockchain"
RETARDIO,retardio,RETARDIO,RETARDIO,6512869,6512869.0,543611.0,"NFT, Solana Ecosystem, Meme, Solana Meme, Murad Picks, 4chan-Themed, TikTok Meme"
BCUT,bitscrunch-token,bitsCrunch Token,BCUT,6372740,10441639.0,573118.0,"Artificial Intelligence (AI), Infrastructure, Analytics, NFT, Polygon Ecosystem, Ethereum Ecosystem, Animoca Brands Portfolio, Coinbase Ventures Portfolio"
WUF,wuffi,WUFFI,WUF,5955795,5955795.0,35499.0,"Solana Ecosystem, Meme, Base Ecosystem"
TRUF,truflation,TRUF.Network,TRUF,5762269,13997053.0,503813.0,"Infrastructure, Oracle, Solana Ecosystem, Arbitrum Ecosystem, Ethereum Ecosystem, Real World Assets (RWA), Base Ecosystem, Coinbase Ventures Portfolio, Governance"
KIBSHI,kiboshib,KiboShib,KIBSHI,5211302,5211302.0,49468.0,"Solana Ecosystem, Meme, Arbitrum Ecosystem, Ethereum Ecosystem, Base Ecosystem, Dog-Themed, AI Meme"
MLT,media-licensing-token,Media Licensing Token,MLT,4148521,5667322.0,40671.0,"BNB Chain Ecosystem, Metaverse, Ethereum Ecosystem"
INTER,inter-milan-fan-token,Inter Milan Fan Token,INTER,3982205,3982205.0,645481.0,"Sports, Fan Token, Chiliz Ecosystem"
GMEE,gamee,GAMEE,GMEE,3952152,9213118.0,133825.0,"Gaming (GameFi), NFT, BNB Chain Ecosystem, Play To Earn, Ethereum Ecosystem, Telegram Apps, Animoca Brands Portfolio, TON Ecosystem, Gaming Platform, YZi Labs (Prev. Binance Labs) Portfolio, Arcade Games"
AZIT,azit,azit,AZIT,3906781,5258538.0,98332.0,Kaia Ecosystem
BST,blocksquare,Blocksquare,BST,3772175,3772175.0,107060.0,"Tokenized Real Estate, Ethereum Ecosystem, Real World Assets (RWA)"
TSUKA,dejitaru-tsuka,Dejitaru Tsuka,TSUKA,3473965,3473965.0,104452.0,"Meme, Ethereum Ecosystem"
DYNA,dynachain,Dynachain,DYNA,3376597,10166183.0,141452.0,"Healthcare, BNB Chain Ecosystem"
LNQ,linqai,LinqAI,LNQ,3358669,10258735.0,264571.0,"Artificial Intelligence (AI), Ethereum Ecosystem"
NRG,energi,Energi,NRG,3257251,3257279.0,132987.0,"Smart Contract Platform, Masternodes, Layer 1 (L1), Ethereum Ecosystem, Proof of Stake (PoS), Energi Ecosystem"
ABX,aborean,Aborean,ABX,3228755,23708174.0,263226.0,"Decentralized Exchange (DEX), Exchange-based Tokens, Decentralized Finance (DeFi), Abstract Ecosystem"
STOS,stratos,Stratos,STOS,3179241,6600523.0,185442.0,"Entertainment, Infrastructure, Smart Contract Platform, Storage, Layer 1 (L1), Ethereum Ecosystem, DePIN, Osmosis Ecosystem"
RFC,retard-finder-coin,Retard Finder Coin,RFC,2867937,2982540.0,10675651.0,"Solana Ecosystem, Meme, Pump.fun Ecosystem, Wojak-Themed"
TRVL,dtravel,Dtravel,TRVL,2810945,6248949.0,469719.0,"Artificial Intelligence (AI), Tourism, BNB Chain Ecosystem, Ethereum Ecosystem, Real World Assets (RWA), DePIN, Base Ecosystem"
ZKP,panther,Panther Protocol,ZKP,2188409,2188409.0,258321.0,"Smart Contract Platform, Privacy, Polygon Ecosystem, Ethereum Ecosystem, Zero Knowledge (ZK)"
NC,nodecoin,Nodepay,NC,2150877,11552187.0,1528785.0,"Artificial Intelligence (AI), Solana Ecosystem, DePIN"
BGB,bitget-token,Bitget Token,BGB,3266613522,4293275167.0,67649284.0,"Exchange-based Tokens, Centralized Exchange (CEX) Token, Ethereum Ecosystem, DragonFly Capital Portfolio, Morph L2 Ecosystem, Made in China"
XAUT,tether-gold,Tether Gold,XAUT,2284053305,2284053305.0,443603279.0,"Stablecoins, Tokenized Assets, Tokenized Gold, Ethereum Ecosystem, Real World Assets (RWA), Tokenized Commodities"
QNT,quant-network,Quant,QNT,1241988979,1247822843.0,18424549.0,"Ethereum Ecosystem, Real World Assets (RWA), Energi Ecosystem, Coinbase 50 Index"
DOGWIFHAT,dogwifcoin,dogwifhat,WIF,542227746,542227746.0,176038643.0,"Solana Ecosystem, Meme, Dog-Themed, Solana Meme, GMCI Meme Index, GMCI Index, Unichain Ecosystem"
PENDLE,pendle,Pendle,PENDLE,540340944,899550203.0,53634702.0,"Decentralized Exchange (DEX), Exchange-based Tokens, Decentralized Finance (DeFi), Yield Farming, Automated Market Maker (AMM), BNB Chain Ecosystem, Derivatives, Arbitrum Ecosystem, Ethereum Ecosystem, Optimism Ecosystem, Fixed Interest, LSDFi, Base Ecosystem, Restaking, LRTfi, Liquid Restaking Governance Tokens, Berachain Ecosystem, Yield Tokenization Protocol, YZi Labs (Prev. Binance Labs) Portfolio, GMCI DeFi Index, Sonic Ecosystem, Liquid Staking, GMCI Index, BTCfi Protocol, HyperEVM Ecosystem"
ZORA,zora,Zora,ZORA,455339803,1018657277.0,174248451.0,"Infrastructure, Media, Smart Contract Platform, SocialFi, NFT, Launchpad, Layer 2 (L2), Base Ecosystem, Coinbase Ventures Portfolio, Zora Ecosystem, Binance Alpha Spotlight"
ATH,aethir,Aethir,ATH,407434680,1202148159.0,28867618.0,"Solana Ecosystem, Arbitrum Ecosystem, Impossible Finance Launchpad, Ethereum Ecosystem, DePIN, Animoca Brands Portfolio"
FLUID,instadapp,Fluid,FLUID,361523348,471019987.0,5434948.0,"Decentralized Finance (DeFi), Solana Ecosystem, Polygon Ecosystem, Arbitrum Ecosystem, Ethereum Ecosystem, Base Ecosystem, Coinbase Ventures Portfolio, Pantera Capital Portfolio, Plasma Ecosystem"
ZBCN,zebec-network,Zebec Network,ZBCN,360516894,380175931.0,17563072.0,"Decentralized Finance (DeFi), Solana Ecosystem, Real World Assets (RWA), Payment Solutions, DePIN, Coinbase Ventures Portfolio, Alameda Research Portfolio, Circle Ventures Portfolio, OKX Ventures Portfolio, RWA Protocol, Made in USA"
APEPE,ape-and-pepe,Ape and Pepe,APEPE,283477440,283477440.0,6991155.0,"Polygon Ecosystem, Meme, Frog-Themed, The Boys Club"
SOON,soon-2,SOON,SOON,260289053,937819713.0,94231148.0,"Infrastructure, Smart Contract Platform, BNB Chain Ecosystem, Layer 2 (L2), Base Ecosystem, Cross-chain Communication, Binance Alpha Spotlight"
1INCH,1inch,1INCH,1INCH,249445392,267507766.0,13891221.0,"Decentralized Exchange (DEX), Exchange-based Tokens, Decentralized Finance (DeFi), Automated Market Maker (AMM), BNB Chain Ecosystem, Ethereum Ecosystem, Base Ecosystem, FTX Holdings, Alameda Research Portfolio, DragonFly Capital Portfolio, Pantera Capital Portfolio, YZi Labs (Prev. Binance Labs) Portfolio, GMCI DeFi Index, Galaxy Digital Portfolio, Blockchain Capital Portfolio, Dex Aggregator, GMCI Index, Coinbase 50 Index, Governance"
QTUM,qtum,Qtum,QTUM,212173578,216111085.0,15890168.0,"Smart Contract Platform, Proof of Stake (PoS), Made in China"
SFP,safepal,SafePal,SFP,194603540,194603540.0,4243467.0,"BNB Chain Ecosystem, Wallets, Ethereum Ecosystem, Animoca Brands Portfolio, Binance Launchpad, Energi Ecosystem, YZi Labs (Prev. Binance Labs) Portfolio"
ZANO,zano,Zano,ZANO,181485538,181486823.0,1449587.0,"Smart Contract Platform, Privacy, Layer 1 (L1), Proof of Stake (PoS), Proof of Work (PoW), Zano Ecosystem, Privacy Blockchain"
PROM,prometeus,Prom,PROM,178709992,188502321.0,4819328.0,"Smart Contract Platform, BNB Chain Ecosystem, Ethereum Ecosystem, Layer 2 (L2)"
ZIG,zignaly,ZIGChain,ZIG,142615524,197781405.0,1828256.0,"Artificial Intelligence (AI), Smart Contract Platform, BNB Chain Ecosystem, Solana Ecosystem, Layer 1 (L1), Polygon Ecosystem, Ethereum Ecosystem, DWF Labs Portfolio, Injective Ecosystem, OKX Ventures Portfolio"
ROSE,oasis-network,Oasis,ROSE,134703839,181685789.0,5033521.0,"Smart Contract Platform, BNB Chain Ecosystem, Layer 1 (L1), Proof of Stake (PoS), Pantera Capital Portfolio, Andreessen Horowitz (a16z) Portfolio, YZi Labs (Prev. Binance Labs) Portfolio, Blockchain Capital Portfolio, Privacy Blockchain, Polychain Capital Portfolio, Coinbase 50 Index"
VTHO,vethor-token,VeThor,VTHO,118998834,119152429.0,1312523.0,"Layer 1 (L1), VeChain Ecosystem"
XCH,chia,Chia,XCH,105358750,237736369.0,5497365.0,"Smart Contract Platform, Layer 1 (L1), DePIN, Andreessen Horowitz (a16z) Portfolio, Made in USA"
XVG,verge,Verge,XVG,101212906,101415362.0,11105227.0,"Smart Contract Platform, Privacy, Proof of Work (PoW), Made in USA"
RED,redstone-oracles,RedStone,RED,99277654,354563050.0,6590096.0,"Infrastructure, Oracle, Ethereum Ecosystem"
WAVES,waves,Waves,WAVES,84542801,84542801.0,9211628.0,"Smart Contract Platform, DWF Labs Portfolio, Proof of Stake (PoS)"
SHX,stronghold-token,Stronghold,SHX,70147173,,858106.0,"Ethereum Ecosystem, Stellar Ecosystem, Made in USA"
DAG,constellation-labs,Constellation,DAG,64460653,79717926.0,1498134.0,"Smart Contract Platform, Layer 1 (L1), Layer 0 (L0), Made in USA, Directed Acyclic Graph (DAG)"
BIGTIME,big-time,Big Time,BIGTIME,63695280,166894918.0,7175112.0,"Gaming (GameFi), Play To Earn, Ethereum Ecosystem, RPG, Alameda Research Portfolio, Circle Ventures Portfolio, OKX Ventures Portfolio, MMO"
OSAK,osaka-protocol,Osaka Protocol,OSAK,61841538,61841538.0,29138.0,"BNB Chain Ecosystem, Solana Ecosystem, Avalanche Ecosystem, Polygon Ecosystem, Meme, Arbitrum Ecosystem, Ethereum Ecosystem, Optimism Ecosystem, Base Ecosystem, Dog-Themed"
FIDA,bonfida,Bonfida,FIDA,59524256,60070221.0,4325283.0,"Big Data, Business Services, Infrastructure, Decentralized Finance (DeFi), Solana Ecosystem, FTX Holdings, DWF Labs Portfolio, Name Service"
SAI,sai,Sai,SAI,55965379,55965379.0,538.67,"Decentralized Finance (DeFi), Ethereum Ecosystem"
MANTA,manta-network,Manta Network,MANTA,54421226,120566472.0,8882294.0,"Smart Contract Platform, Polkadot Ecosystem, Binance Launchpool, Layer 2 (L2), Manta Network Ecosystem, Multicoin Capital Portfolio, Alameda Research Portfolio, DeFiance Capital Portfolio, YZi Labs (Prev. Binance Labs) Portfolio"
LQTY,liquity,Liquity,LQTY,53576633,54729278.0,8850747.0,"Decentralized Finance (DeFi), Arbitrum Ecosystem, Ethereum Ecosystem, Alameda Research Portfolio, Pantera Capital Portfolio"
TAIKO,taiko,Taiko,TAIKO,50629393,271717621.0,7747693.0,"Smart Contract Platform, BNB Chain Ecosystem, Ethereum Ecosystem, Layer 2 (L2), Zero Knowledge (ZK), Rollup, OKX Ventures Portfolio, Centralized Exchange (CEX) Product, Binance Alpha Spotlight"
AITECH,solidus-aitech,Solidus Ai Tech,AITECH,49503333,58058073.0,121880424.0,"Artificial Intelligence (AI), BNB Chain Ecosystem, Solana Ecosystem, Launchpad, Base Ecosystem, ChainGPT Launchpad, AI Agents, Binance Alpha Spotlight, DeFAI"
STEEM,steem,Steem,STEEM,49484088,49505048.0,10877621.0,SocialFi
JOE,joe,JOE,JOE,47664775,59105694.0,3513740.0,"Decentralized Exchange (DEX), Exchange-based Tokens, Decentralized Finance (DeFi), Yield Farming, Automated Market Maker (AMM), BNB Chain Ecosystem, Avalanche Ecosystem, Launchpad, Arbitrum Ecosystem, Mantle Ecosystem, DeFiance Capital Portfolio, Delphi Ventures Portfolio, Dex Aggregator"
DYM,dymension,Dymension,DYM,44797707,115573894.0,2932745.0,"Smart Contract Platform, Cosmos Ecosystem, Modular Blockchain, Osmosis Ecosystem, Rollups-as-a-Service (RaaS)"
ANYONE,airtor-protocol,ANyONe Protocol,ANYONE,36746705,45969186.0,903402.0,"Smart Contract Platform, Privacy, Ethereum Ecosystem, DePIN, Base Ecosystem, Privacy Blockchain, Peaq Ecosystem"
XRD,radix,Radix,XRD,33060424,36959825.0,86843.0,"Smart Contract Platform, Layer 1 (L1), DWF Labs Portfolio, Radix Ecosystem"
WCT,connect-token-wct,WalletConnect Token,WCT,32511689,174606136.0,32999905.0,"Solana Ecosystem, Wallets, Ethereum Ecosystem, Optimism Ecosystem, Base Ecosystem"
MLC,my-lovely-coin,My Lovely Coin,MLC,32250587,88745557.0,750266.0,"Charity, Gaming (GameFi), Polygon Ecosystem, Gaming Utility Token"
OGN,origin-protocol,Origin Token,OGN,32018970,69309083.0,2706143.0,"Decentralized Finance (DeFi), NFT, Ethereum Ecosystem, Base Ecosystem, Pantera Capital Portfolio, Sonic Ecosystem, Liquid Staking, Made in USA"
REZ,renzo,Renzo,REZ,30268285,115019622.0,15679235.0,"Decentralized Finance (DeFi), Binance Launchpool, Ethereum Ecosystem, Base Ecosystem, Restaking, YZi Labs (Prev. Binance Labs) Portfolio, OKX Ventures Portfolio"
MBL,moviebloc,MovieBloc,MBL,29021088,46158300.0,6055044.0,DWF Labs Portfolio
SD,stader,Stader,SD,25483285,46824238.0,2793386.0,"BNB Chain Ecosystem, Solana Ecosystem, Polygon Ecosystem, Fantom Ecosystem, Ethereum Ecosystem, Liquid Staking Governance Tokens, Animoca Brands Portfolio, Coinbase Ventures Portfolio, Pantera Capital Portfolio, Liquid Staking, Binance Alpha Spotlight"
RSS3,rss3,RSS3,RSS3,25411959,30349605.0,2916277.0,"Artificial Intelligence (AI), Infrastructure, Storage, Ethereum Ecosystem, Coinbase Ventures Portfolio, DragonFly Capital Portfolio, RSS3 VSL Ecosystem, AI Framework, DeFAI"
NATIX,natix-network,NATIX Network,NATIX,23673946,58087742.0,268489.0,"Artificial Intelligence (AI), Internet of Things (IOT), Solana Ecosystem, DePIN, Robotics"
DIAM,diam,DIAM,DIAM,22766794,70355925.0,123996.0,"Smart Contract Platform, Layer 1 (L1)"
DAO,dao-maker,DAO Maker,DAO,22394677,24768499.0,835383.0,"BNB Chain Ecosystem, Solana Ecosystem, Launchpad, DaoMaker Launchpad, Arbitrum Ecosystem, Ethereum Ecosystem, Step Network Ecosystem, Governance"
PARTI,particle-network,Particle Network,PARTI,21008014,90163152.0,13093923.0,"Decentralized Finance (DeFi), BNB Chain Ecosystem, Layer 1 (L1), Base Ecosystem, Account Abstraction, Cross-chain Communication, Binance HODLer Airdrops, Chain Abstraction, Binance Wallet IDO"
VIC,tomochain,Viction,VIC,20986324,35837582.0,14192265.0,"Smart Contract Platform, Masternodes, Layer 1 (L1), DWF Labs Portfolio"
RIO,realio-network,Realio Network Token,RIO,20937089,20937089.0,1202609.0,"BNB Chain Ecosystem, Solana Ecosystem, Ethereum Ecosystem, Algorand Ecosystem, Real World Assets (RWA), Osmosis Ecosystem, Stellar Ecosystem, Made in USA"
HASHAI,hashai,HashAI,HASHAI,20140673,21388513.0,141316.0,"Analytics, Ethereum Ecosystem, DePIN"
SUNDOG,sundog,Sundog,SUNDOG,20080900,20080900.0,8920908.0,"Meme, Tron Ecosystem, Sun Pump Ecosystem, TRON Meme"
VOW,vow,Vow,VOW,15601511,51564684.0,78519.0,"Retail, Tourism, BNB Chain Ecosystem, Ethereum Ecosystem"
BOOE,book-of-ethereum,Book of Ethereum,BOOE,14552263,14552263.0,155118.0,"Meme, Ethereum Ecosystem"
NMT,netmind-token,NetMind Token,NMT,14527473,38750852.0,1947568.0,"Artificial Intelligence (AI), BNB Chain Ecosystem, Ethereum Ecosystem, DePIN, AI Agents"
SERAPH,seraph,Seraph,SERAPH,14403910,49362568.0,3569011.0,"Gaming (GameFi), BNB Chain Ecosystem, Play To Earn, Ethereum Ecosystem, RPG, Gaming Utility Token, Action Games"
LOCK,houdini-swap,Houdini Swap,LOCK,14074601,14074601.0,75222.0,"Privacy, Solana Ecosystem, Ethereum Ecosystem"
OGY,origyn-foundation,ORIGYN,OGY,14041813,17741418.0,207445.0,"Internet Computer Ecosystem, Real World Assets (RWA), RWA Protocol"
ZETA,zeta,Zeta,ZEX,13349706,72276503.0,486937.0,"Decentralized Finance (DeFi), Derivatives, Perpetuals, Solana Ecosystem"
VINU,vita-inu,Vita Inu,VINU,11343602,11343602.0,183984.0,"BNB Chain Ecosystem, Meme, Dog-Themed, DWF Labs Portfolio, Binance Alpha Spotlight"
LINGO,lingo,Lingo,LINGO,10491072,10491103.0,169531.0,"Solana Ecosystem, Real World Assets (RWA), Base Ecosystem, RWA Protocol"
SUKU,suku,SUKU,SUKU,10480818,30477097.0,285440.0,"Solana Ecosystem, Polygon Ecosystem, Ethereum Ecosystem, Made in USA"
OBT,oobit,Oobit,OBT,10429962,29628526.0,107749.0,"BNB Chain Ecosystem, Ethereum Ecosystem, Payment Solutions"
MEMEFI,memefi-2,MemeFi,MEMEFI,10188744,10188744.0,5353220.0,"Gaming (GameFi), NFT, Meme, Play To Earn, Sui Ecosystem, Telegram Apps, Tap to Earn, Sui Meme, Action Games"
CRTS,cratos,Cratos,CRTS,9918062,15609648.0,578216.0,"BNB Chain Ecosystem, Ethereum Ecosystem"
MFT,mainframe,Mainframe,MFT,9482878,10102621.0,1.91,"Ethereum Ecosystem, Energi Ecosystem"
NUM,numbers-protocol,Numbers Protocol,NUM,9221669,9332991.0,815663.0,"Artificial Intelligence (AI), Smart Contract Platform, BNB Chain Ecosystem, DaoMaker Launchpad, Ethereum Ecosystem, Avalanche L1, YZi Labs (Prev. Binance Labs) Portfolio, Outlier Ventures Portfolio"
LOOKS,looksrare,LooksRare,LOOKS,9184457,9184442.0,1153743.0,"NFT, Ethereum Ecosystem, NFT Marketplace"
VSC,vyvo-smart-chain,Vyvo Smart Chain,VSC,9120456,43044842.0,124983.0,"Smart Contract Platform, BNB Chain Ecosystem, Polygon Ecosystem, Layer 2 (L2)"
MCB,mcdex,MUX Protocol,MCB,9011791,11381357.0,13987.98,"Decentralized Exchange (DEX), Exchange-based Tokens, Decentralized Finance (DeFi), BNB Chain Ecosystem, Derivatives, Perpetuals, Arbitrum Ecosystem, Ethereum Ecosystem, Multicoin Capital Portfolio, Alameda Research Portfolio, DeFiance Capital Portfolio, Delphi Ventures Portfolio, OKX Ventures Portfolio"
FHE,mind-network,Mind Network,FHE,8825079,35442083.0,8094401.0,"Artificial Intelligence (AI), Smart Contract Platform, BNB Chain Ecosystem, Layer 2 (L2), Binance Wallet IDO"
EPT,balance,Balance,EPT,8743532,37743221.0,3722648.0,"Gaming (GameFi), BNB Chain Ecosystem, Animoca Brands Portfolio, DWF Labs Portfolio, AI Agents, Andreessen Horowitz (a16z) Portfolio, AI Agent Launchpad"
ATS,alltoscan,Alltoscan,ATS,8383893,12275586.0,220978.0,BNB Chain Ecosystem
CA,ca-htb,Coupon Assets,CA,7549185,110822708.0,645585.0,"Retail, Ethereum Ecosystem"
DIONE,dione,Dione,DIONE,7427153,8552391.0,229385.0,"Energy, Smart Contract Platform, Layer 1 (L1), Made in USA"
PROPS,propbase,Propbase,PROPS,7173117,19082864.0,3191532.0,"Tokenized Real Estate, Aptos Ecosystem, Real World Assets (RWA), Base Ecosystem, RWA Protocol"
HMT,human-protocol,HUMAN Protocol,HMT,7154287,9440036.0,18900.48,"Artificial Intelligence (AI), Infrastructure, Software as a service, Polygon Ecosystem, Ethereum Ecosystem, Market-Making Solution, AI Framework"
PMT,public-meme-token,Public Masterpiece Token,PMT,6727993,34110726.0,338433.0,BNB Chain Ecosystem
WEPE,wall-street-pepe,Wall Street Pepe,WEPE,6193040,6193040.0,498643.0,"Meme, Ethereum Ecosystem, Frog-Themed, The Boys Club"
JUNO,juno-network,JUNO,JUNO,5741862,7628492.0,26108.0,"Smart Contract Platform, Cosmos Ecosystem, Osmosis Ecosystem, Juno Ecosystem, Evmos Ecosystem, Secret Ecosystem"
PEAR,pear-protocol,Pear Protocol,PEAR,5440168,18026099.0,30753.0,"Decentralized Exchange (DEX), Exchange-based Tokens, Decentralized Finance (DeFi), Perpetuals, Arbitrum Ecosystem"
KILO,kiloex,KiloEx,KILO,4872219,23014732.0,890884.0,"Decentralized Exchange (DEX), Exchange-based Tokens, Decentralized Finance (DeFi), BNB Chain Ecosystem, Derivatives, Perpetuals, Binance Wallet IDO"
SIDUS,sidus,Sidus,SIDUS,4340612,7407051.0,319735.0,"Gaming (GameFi), NFT, BNB Chain Ecosystem, Metaverse, Play To Earn, Ethereum Ecosystem, Linea Ecosystem, Animoca Brands Portfolio, Base Ecosystem, RPG, Gaming Governance Token, Alameda Research Portfolio, OKX Ventures Portfolio"
RLY,rally-2,Rally,RLY,4304782,12883702.0,25271.0,"SocialFi, Yield Farming, Ethereum Ecosystem, Alleged SEC Securities, Coinbase Ventures Portfolio, Andreessen Horowitz (a16z) Portfolio"
NLS,nolus,Nolus,NLS,4266179,5567505.0,152561.0,"Ethereum Ecosystem, Osmosis Ecosystem"
AEROBUD,aerobud,AEROBUD,AEROBUD,4256450,4256450.0,147753.0,"Charity, Meme, Base Ecosystem, Dog-Themed, Base Meme, Made in USA"
DNX,dynex,Dynex,DNX,4253982,4254724.0,139395.0,"Artificial Intelligence (AI), Smart Contract Platform, Layer 1 (L1), Ethereum Ecosystem, DePIN, Decentralized Science (DeSci), Proof of Work (PoW)"
METAV,metaverse,METAVERSE,METAV,4061750,4061750.0,269637.0,"Artificial Intelligence (AI), Solana Ecosystem, AI Agents, Pump.fun Ecosystem, Binance Alpha Spotlight"
GAIA,gaia-2,Gaia,SN57,3825639,3842232.0,18293.31,"Artificial Intelligence (AI), Bittensor Ecosystem, Bittensor Subnets"
LLD,liberland-lld,Liberland LLD,LLD,3682166,4931222.0,71481.0,"Smart Contract Platform, Solana Ecosystem, Layer 1 (L1), Ethereum Ecosystem, Tron Ecosystem"
LL,lightlink,LightLink,LL,3145053,8484072.0,71934.0,"Infrastructure, Smart Contract Platform, Ethereum Ecosystem, Layer 2 (L2), Base Ecosystem, Rollup, LightLink Ecosystem"
BOBA,bobacat,Boba Cat,BOBA,3102714,3102714.0,50842.0,"Meme, Ethereum Ecosystem, Cat-Themed"
UNIT0,unit0,Unit0,UNIT0,2567668,28019649.0,80327.0,"Smart Contract Platform, Ethereum Ecosystem, Layer 2 (L2), Cross-chain Communication, Waves Ecosystem"
HMND,humanode,Humanode,HMND,2250801,5790029.0,232202.0,"Artificial Intelligence (AI), Smart Contract Platform, Layer 1 (L1), Decentralized Identifier (DID), Discord Bots, Humanode Ecosystem"
SDN,shiden,Shiden Network,SDN,2123616,2713365.0,16561.51,Smart Contract Platform
LEOX,leox,LEOX,LEOX,2067996,2067996.0,54546.0,"Tokenized Real Estate, Ethereum Ecosystem, Real World Assets (RWA), RWA Protocol"
CREO,creo-engine,Creo Engine,CREO,2035347,2676097.0,1348682.0,"Gaming (GameFi), BNB Chain Ecosystem, Solana Ecosystem, Ethereum Ecosystem, Gaming Platform"
BLEND,blend,Blend,BLND,1732906,3299191.0,1712.0,"Decentralized Finance (DeFi), Lending/Borrowing Protocols, Stellar Ecosystem"
KLIMA,klima-dao,KlimaDAO,KLIMA,1705432,1705432.0,9749.82,"Rebase Tokens, Polygon Ecosystem, Ohm Fork, Regenerative Finance (ReFi), Real World Assets (RWA), Base Ecosystem"
HBAR,hedera-hashgraph,Hedera,HBAR,7447344612,8781162871.0,200225875.0,"Smart Contract Platform, Layer 1 (L1), Hedera Ecosystem, GMCI Layer 1 Index, GMCI 30 Index, GMCI Index, Outlier Ventures Portfolio, Made in USA, Directed Acyclic Graph (DAG)"
IP,story-2,Story,IP,1768395790,5585306193.0,51584815.0,"Artificial Intelligence (AI), Smart Contract Platform, Layer 1 (L1), Made in USA, Story Ecosystem, IP"
RENDER,render-token,Render,RENDER,1329618914,1367463087.0,51546545.0,"Artificial Intelligence (AI), NFT, Metaverse, Solana Ecosystem, Ethereum Ecosystem, DePIN, Multicoin Capital Portfolio, Alameda Research Portfolio, GMCI DePIN Index, GMCI 30 Index, GMCI Index, Made in USA, Coinbase 50 Index"
LBTC,lombard-staked-btc,Lombard Staked BTC,LBTC,1320726825,1320727017.0,8872786.0,"BNB Chain Ecosystem, Solana Ecosystem, Ethereum Ecosystem, Sui Ecosystem, Base Ecosystem, Starknet Ecosystem, Restaking, Berachain Ecosystem, Liquid Restaking Tokens, Sonic Ecosystem, Etherlink Ecosystem, Swellchain Ecosystem, Corn Ecosystem, Liquid Staked BTC, Katana Ecosystem, TAC Ecosystem"
XDC,xdce-crowd-sale,XDC Network,XDC,1117820922,2394555057.0,43204870.0,"Smart Contract Platform, Layer 1 (L1), Real World Assets (RWA)"
