KIBSHI,kiboshib,KiboShib,KIBSHI,12963206.0,12963206.0,768790.0,"Solana Ecosystem, Meme, Arbitrum Ecosystem, Ethereum Ecosystem, Base Ecosystem, Dog-Themed, AI Meme"
DOLO,dolomite,Dolomite,DOLO,12522302.0,34621261.0,3927996.0,"Decentralized Exchange (DEX), Decentralized Finance (DeFi), Automated Market Maker (AMM), Lending/Borrowing Protocols, Ethereum Ecosystem, Coinbase Ventures Portfolio, Venture Capital Portfolios, Dex Aggregator"
COCA,coca,COCA,COCA,11905684.0,104739018.0,350995.0,"Wallets, Polygon Ecosystem, Payment Solutions"
BCUT,bitscrunch-token,bitsCrunch Token,BCUT,11659465.0,23515376.0,3832889.0,"Artificial Intelligence (AI), Infrastructure, Analytics, NFT, Polygon Ecosystem, Ethereum Ecosystem, Animoca Brands Portfolio, Coinbase Ventures Portfolio"
LAZIO,lazio-fan-token,Lazio Fan Token,LAZIO,9691679.0,32514452.0,3434511.0,"Sports, BNB Chain Ecosystem, Fan Token, Binance Launchpad"
CLEAR,everclear,Everclear,CLEAR,9585423.0,24765607.0,355485.0,"Infrastructure, BNB Chain Ecosystem, Polygon Ecosystem, Gnosis Chain Ecosystem, Arbitrum Ecosystem, Ethereum Ecosystem, Optimism Ecosystem, Coinbase Ventures Portfolio, Cross-chain Communication, Chain Abstraction"
ZND,znd-token,ZND Token,ZND,9038443.0,51177224.0,4659363.0,"Centralized Exchange (CEX) Token, Ethereum Ecosystem"
LNQ,linqai,LinqAI,LNQ,8525949.0,31158562.0,852885.0,"Artificial Intelligence (AI), Ethereum Ecosystem"
STOS,stratos,Stratos,STOS,8475958.0,12537197.0,205125.0,"Entertainment, Infrastructure, Smart Contract Platform, Storage, Layer 1 (L1), Ethereum Ecosystem, DePIN, Osmosis Ecosystem"
TRUF,truflation,TRUF.Network,TRUF,8263457.0,24801307.0,332555.0,"Infrastructure, Oracle, Arbitrum Ecosystem, Ethereum Ecosystem, Real World Assets (RWA), Base Ecosystem, Coinbase Ventures Portfolio"
SCF,smoking-chicken-fish,Smoking Chicken Fish,SCF,7734362.0,7734362.0,1522045.0,"Solana Ecosystem, Meme, Solana Meme, Pump.fun Ecosystem"
RFC,retard-finder-coin,Retard Finder Coin,RFC,7730323.0,8039284.0,11897674.0,"Solana Ecosystem, Meme, Pump.fun Ecosystem, Wojak-Themed"
TMAI,token-metrics-ai,Token Metrics AI,TMAI,7391856.0,10436109.0,1513329.0,"Artificial Intelligence (AI), Analytics, Meme, Base Ecosystem, AI Agents, DeFAI, Made in USA"
BAD,bad-idea-ai,Bad Idea AI,BAD,6825394.0,8463318.0,1366840.0,"Artificial Intelligence (AI), Meme, Ethereum Ecosystem, Telegram Apps, Discord Bots, Shibarium Ecosystem"
FT,fracton-protocol,Fracton Protocol,FT,6502953.0,7434306.0,2322.48,"NFT, Ethereum Ecosystem, NFTFi"
INTER,inter-milan-fan-token,Inter Milan Fan Token,INTER,5680561.0,5680561.0,720529.0,"Sports, Fan Token, Chiliz Ecosystem"
NRG,energi,Energi,NRG,5564954.0,5564954.0,383314.0,"Smart Contract Platform, Masternodes, Layer 1 (L1), Ethereum Ecosystem, Proof of Stake (PoS), Energi Ecosystem"
BST,blocksquare,Blocksquare,BST,5464794.0,5464794.0,344805.0,"Tokenized Real Estate, Tokenized Assets, Ethereum Ecosystem, Real World Assets (RWA)"
READY,ready,READY!,READY,4805306.0,4805306.0,184168.0,"Gaming (GameFi), Solana Ecosystem, Gaming Platform"
BITBOARD,bitboard,BitBoard,BB,4750375.0,7180525.0,112102.0,"Smart Contract Platform, Polygon Ecosystem, Layer 2 (L2), Zero Knowledge (ZK)"
BILLY,billy,Billy,BILLY,4511838.0,4511838.0,4699559.0,"Solana Ecosystem, Meme, Dog-Themed, Solana Meme, Pump.fun Ecosystem"
KANGO,kango,KANGO,KANGO,4379539.0,4379539.0,235216.0,"Meme, Kaspa Ecosystem"
GOGLZ,googles,GOGGLES,GOGLZ,4078614.0,4078614.0,781303.0,"Meme, Sonic Ecosystem"
TRVL,dtravel,Dtravel,TRVL,3716851.0,8435854.0,124119.0,"Artificial Intelligence (AI), Tourism, BNB Chain Ecosystem, Ethereum Ecosystem, Real World Assets (RWA), DePIN, Base Ecosystem"
NETVR,netvrk,Netvrk,NETVR,3639751.0,3639751.0,269013.0,"Entertainment, Gaming (GameFi), NFT, Metaverse, Polygon Ecosystem, Ethereum Ecosystem, Shooting Games, Racing Games"
CATCH,spacecatch,SpaceCatch,CATCH,3545604.0,8561511.0,149676.0,"Gaming (GameFi), Metaverse, Arbitrum Ecosystem, Gaming Utility Token"
NWC,newscrypto-coin,Numerico,NWC,3479210.0,5926225.0,131630.0,"Education, Smart Contract Platform, BNB Chain Ecosystem, Ethereum Ecosystem, Layer 2 (L2), Stellar Ecosystem"
TOMI,tominet,TOMI,TOMI,3302640.0,3316855.0,7060095.0,"Smart Contract Platform, Ethereum Ecosystem, DWF Labs Portfolio, Proof of Stake (PoS)"
GURU,guru,Guru,GURU,3276990.0,3276990.0,55678.0,"Meme, Ethereum Ecosystem"
FUSE,fuse-network-token,Fuse,FUSE,3265472.0,4086989.0,1062760.0,"Smart Contract Platform, Decentralized Finance (DeFi), BNB Chain Ecosystem, Layer 1 (L1), Polygon Ecosystem, Gnosis Chain Ecosystem, Arbitrum Ecosystem, Ethereum Ecosystem, Optimism Ecosystem, Layer 2 (L2), Payment Solutions, Base Ecosystem, DWF Labs Portfolio, Account Abstraction, Fuse Ecosystem"
FET,fetch-ai,Artificial Superintelligence Alliance,FET,1749550983.0,1823117075.0,173259210.0,"Artificial Intelligence (AI), NFT, BNB Chain Ecosystem, Ethereum Ecosystem, Binance Launchpad, DWF Labs Portfolio, Osmosis Ecosystem, AI Agents, GMCI DePIN Index, GMCI Index, Outlier Ventures Portfolio, AI Agent Launchpad"
QNT,quant-network,Quant,QNT,1549684421.0,1556963591.0,33274935.0,"Ethereum Ecosystem, Real World Assets (RWA), Energi Ecosystem, Coinbase 50 Index"
XAUT,tether-gold,Tether Gold,XAUT,840453921.0,840453921.0,49276475.0,"Stablecoins, Tokenized Assets, Tokenized Gold, Ethereum Ecosystem, Real World Assets (RWA), Tokenized Commodities"
DOGWIFHAT,dogwifcoin,dogwifhat,WIF,823645221.0,823645221.0,460252052.0,"Solana Ecosystem, Meme, Dog-Themed, Solana Meme, GMCI Meme Index, GMCI Index"
PENDLE,pendle,Pendle,PENDLE,594473868.0,1030178374.0,135647865.0,"Decentralized Exchange (DEX), Decentralized Finance (DeFi), Yield Farming, Automated Market Maker (AMM), BNB Chain Ecosystem, Derivatives, Lending/Borrowing Protocols, Arbitrum Ecosystem, Ethereum Ecosystem, Optimism Ecosystem, Fixed Interest, LSDFi, Base Ecosystem, Restaking, LRTfi, Liquid Restaking Governance Tokens, Yield Tokenization Protocol, YZi Labs (Prev. Binance Labs) Portfolio, GMCI DeFi Index, Sonic Ecosystem, Liquid Staking, GMCI Index, BTCfi Protocol"
KAVA,kava,Kava,KAVA,455090852.0,455090852.0,15126117.0,"Smart Contract Platform, Layer 1 (L1), Binance Launchpad, DWF Labs Portfolio, Osmosis Ecosystem, YZi Labs (Prev. Binance Labs) Portfolio, Made in USA"
ATH,aethir,Aethir,ATH,418135294.0,1774723626.0,42080204.0,"Solana Ecosystem, Arbitrum Ecosystem, Impossible Finance Launchpad, Ethereum Ecosystem, DePIN, Animoca Brands Portfolio"
RON,ronin,Ronin,RON,334386814.0,511107504.0,9572769.0,"Smart Contract Platform, Gaming (GameFi), NFT, Layer 1 (L1), Play To Earn, Zero Knowledge (ZK), FTX Holdings, Ronin Ecosystem, Gaming Blockchains, SideChain, Andreessen Horowitz (a16z) Portfolio, YZi Labs (Prev. Binance Labs) Portfolio"
ZBCN,zebec-network,Zebec Network,ZBCN,310344159.0,383557933.0,41787116.0,"Decentralized Finance (DeFi), Solana Ecosystem, Real World Assets (RWA), Payment Solutions, DePIN, Coinbase Ventures Portfolio, Alameda Research Portfolio, Circle Ventures Portfolio, OKX Ventures Portfolio, RWA Protocol, Made in USA"
1INCH,1inch,1inch,1INCH,268621317.0,289989736.0,39856593.0,"Decentralized Exchange (DEX), Exchange-based Tokens, Decentralized Finance (DeFi), Automated Market Maker (AMM), BNB Chain Ecosystem, Avalanche Ecosystem, Polygon Ecosystem, Near Protocol Ecosystem, Harmony Ecosystem, Ethereum Ecosystem, FTX Holdings, Alameda Research Portfolio, DragonFly Capital Portfolio, Pantera Capital Portfolio, Energi Ecosystem, YZi Labs (Prev. Binance Labs) Portfolio, GMCI DeFi Index, Galaxy Digital Portfolio, Blockchain Capital Portfolio, Dex Aggregator, GMCI Index, Coinbase 50 Index"
PLUME,plume,Plume,PLUME,251191358.0,1032293251.0,35359125.0,"Smart Contract Platform, Layer 1 (L1), Ethereum Ecosystem, Real World Assets (RWA), RWA Protocol, Made in USA, Plume Network Ecosystem"
SFP,safepal,SafePal,SFP,228577354.0,228577354.0,3730785.0,"BNB Chain Ecosystem, Wallets, Ethereum Ecosystem, Animoca Brands Portfolio, Binance Launchpad, Energi Ecosystem, YZi Labs (Prev. Binance Labs) Portfolio"
QTUM,qtum,Qtum,QTUM,211171559.0,215449012.0,21570859.0,"Smart Contract Platform, Proof of Stake (PoS), Made in China"
XCH,chia,Chia,XCH,157702688.0,355847658.0,9573756.0,"Smart Contract Platform, Layer 1 (L1), DePIN, Andreessen Horowitz (a16z) Portfolio, Made in USA"
FLUID,instadapp,Fluid,FLUID,156522098.0,396893473.0,3986044.0,"Decentralized Finance (DeFi), Polygon Ecosystem, Ethereum Ecosystem, Base Ecosystem, Coinbase Ventures Portfolio, Pantera Capital Portfolio"
ZANO,zano,Zano,ZANO,149811228.0,149858672.0,1248376.0,"Smart Contract Platform, Privacy, Layer 1 (L1), Proof of Stake (PoS), Proof of Work (PoW), Zano Ecosystem, Privacy Blockchain"
OSMO,osmosis,Osmosis,OSMO,128368891.0,174796418.0,9989814.0,"Decentralized Exchange (DEX), Decentralized Finance (DeFi), Automated Market Maker (AMM), Cosmos Ecosystem, Osmosis Ecosystem, Paradigm Portfolio, Proof of Stake (PoS), Evmos Ecosystem, Secret Ecosystem, GMCI DeFi Index, GMCI Index, Made in USA"
UMA,uma,UMA,UMA,112279862.0,160036789.0,20480170.0,"Business Services, Decentralized Finance (DeFi), Oracle, Derivatives, Synthetic Issuer, Avalanche Ecosystem, Ethereum Ecosystem, Blockchain Capital Portfolio, Synthetic, Made in USA"
BIGTIME,big-time,Big Time,BIGTIME,104339910.0,273392323.0,30442340.0,"Gaming (GameFi), Play To Earn, Ethereum Ecosystem, RPG, Alameda Research Portfolio, Circle Ventures Portfolio, OKX Ventures Portfolio, MMO"
WAVES,waves,Waves,WAVES,100952352.0,100952352.0,12077000.0,"Smart Contract Platform, DWF Labs Portfolio, Proof of Stake (PoS)"
DAG,constellation-labs,Constellation,DAG,100290444.0,124705716.0,3457120.0,"Smart Contract Platform, Layer 1 (L1), Base Ecosystem, Layer 0 (L0), Made in USA, Directed Acyclic Graph (DAG)"
PROM,prometeus,Prom,PROM,94707418.0,99896866.0,4090828.0,"Smart Contract Platform, BNB Chain Ecosystem, Ethereum Ecosystem, Layer 2 (L2)"
LQTY,liquity,Liquity,LQTY,91480342.0,93793366.0,25224285.0,"Decentralized Finance (DeFi), Lending/Borrowing Protocols, Arbitrum Ecosystem, Ethereum Ecosystem, Alameda Research Portfolio, Pantera Capital Portfolio"
XVG,verge,Verge,XVG,85750936.0,85922463.0,6838124.0,"Smart Contract Platform, Privacy, Proof of Work (PoW), Made in USA"
AITECH,solidus-aitech,Solidus Ai Tech,AITECH,85450032.0,109571210.0,35068549.0,"Artificial Intelligence (AI), BNB Chain Ecosystem, Launchpad, Base Ecosystem, ChainGPT Launchpad, AI Agents, Binance Alpha Spotlight, DeFAI"
RED,redstone-oracles,RedStone,RED,83363091.0,297725325.0,23421927.0,"Infrastructure, Oracle, Ethereum Ecosystem"
DYM,dymension,Dymension,DYM,79527986.0,259379587.0,7982977.0,"Smart Contract Platform, Cosmos Ecosystem, Modular Blockchain, Osmosis Ecosystem, Rollups-as-a-Service (RaaS)"
SHX,stronghold-token,Stronghold,SHX,72802141.0,,3468874.0,"Ethereum Ecosystem, Stellar Ecosystem, Made in USA"
WCT,connect-token-wct,WalletConnect Token,WCT,69840794.0,375084556.0,62150969.0,"Solana Ecosystem, Wallets, Ethereum Ecosystem, Optimism Ecosystem"
XRD,radix,Radix,XRD,66380314.0,81180061.0,559518.0,"Smart Contract Platform, Layer 1 (L1), DWF Labs Portfolio, Radix Ecosystem"
STEEM,steem,Steem,STEEM,65391212.0,65448802.0,6258707.0,SocialFi
NIL,nillion,Nillion,NIL,64148787.0,328715280.0,23481601.0,"Infrastructure, Binance Launchpool"
FIDA,bonfida,Solana Name Service (prev. Bonfida),FIDA,62703282.0,63278384.0,14088926.0,"Big Data, Business Services, Infrastructure, Decentralized Finance (DeFi), Solana Ecosystem, FTX Holdings, DWF Labs Portfolio, Name Service"
PARTI,particle-network,Particle Network,PARTI,51308112.0,220206491.0,26554451.0,"Decentralized Finance (DeFi), BNB Chain Ecosystem, Layer 1 (L1), Base Ecosystem, Account Abstraction, Cross-chain Communication, Binance HODLer Airdrops, Chain Abstraction, Binance Wallet IDO"
MBL,moviebloc,MovieBloc,MBL,40611877.0,65623383.0,6094141.0,DWF Labs Portfolio
SOON,soon-2,SOON,SOON,40284502.0,215540409.0,89944940.0,"Infrastructure, Smart Contract Platform, BNB Chain Ecosystem, Layer 2 (L2), Cross-chain Communication, Binance Alpha Spotlight"
SERAPH,seraph,Seraph,SERAPH,39793400.0,166149623.0,137001214.0,"Gaming (GameFi), BNB Chain Ecosystem, Play To Earn, Ethereum Ecosystem, RPG, Gaming Utility Token, Action Games"
HASHAI,hashai,HashAI,HASHAI,36227903.0,38472448.0,601352.0,"Artificial Intelligence (AI), Ethereum Ecosystem, DePIN"
NMT,netmind-token,NetMind Token,NMT,32308384.0,94818799.0,1856404.0,"Artificial Intelligence (AI), BNB Chain Ecosystem, Ethereum Ecosystem, DePIN, AI Agents"
DAO,dao-maker,DAO Maker,DAO,30794348.0,34058529.0,1797945.0,"BNB Chain Ecosystem, Solana Ecosystem, Launchpad, DaoMaker Launchpad, Arbitrum Ecosystem, Ethereum Ecosystem, Step Network Ecosystem"
VINE,vine,Vine,VINE,30670154.0,30670154.0,33394125.0,"Solana Ecosystem, Meme, Solana Meme, Pump.fun Ecosystem, Binance Alpha Spotlight"
ANYONE,airtor-protocol,ANyONe Protocol,ANYONE,29262291.0,36606376.0,283681.0,"Smart Contract Platform, Ethereum Ecosystem, DePIN, Privacy Blockchain"
NFP,nfprompt-token,NFPrompt,NFP,28667662.0,62686518.0,5457398.0,"BNB Chain Ecosystem, Binance Launchpool, YZi Labs (Prev. Binance Labs) Portfolio"
SD,stader,Stader,SD,27800185.0,55204875.0,4652895.0,"BNB Chain Ecosystem, Polygon Ecosystem, Fantom Ecosystem, Ethereum Ecosystem, Liquid Staking Governance Tokens, Animoca Brands Portfolio, Coinbase Ventures Portfolio, Pantera Capital Portfolio, Liquid Staking, Binance Alpha Spotlight"
ZORA,zora,Zora,ZORA,27360173.0,86912144.0,20512147.0,"Infrastructure, Media, Smart Contract Platform, NFT, Layer 2 (L2), Base Ecosystem, Coinbase Ventures Portfolio, Zora Ecosystem"
NATIX,natix-network,NATIX Network,NATIX,25760118.0,120147684.0,618882.0,"Artificial Intelligence (AI), Internet of Things (IOT), Solana Ecosystem, DePIN"
OGY,origyn-foundation,ORIGYN,OGY,24810196.0,28890586.0,244454.0,"Internet Computer Ecosystem, Real World Assets (RWA), RWA Protocol"
REZ,renzo,Renzo,REZ,24277252.0,92253668.0,17296031.0,"Decentralized Finance (DeFi), Binance Launchpool, Ethereum Ecosystem, Base Ecosystem, Restaking, YZi Labs (Prev. Binance Labs) Portfolio, OKX Ventures Portfolio"
PORT3,port3-network,Port3 Network,PORT3,22985545.0,45985142.0,6901596.0,"SocialFi, BNB Chain Ecosystem, Ethereum Ecosystem, Poolz Finance Launchpad"
HOPR,hopr,HOPR,HOPR,21836365.0,22904592.0,556204.0,"Privacy, Gnosis Chain Ecosystem, Ethereum Ecosystem, DePIN, YZi Labs (Prev. Binance Labs) Portfolio"
RIO,realio-network,Realio Network Token,RIO,21213273.0,21213529.0,4750754.0,"BNB Chain Ecosystem, Solana Ecosystem, Ethereum Ecosystem, Algorand Ecosystem, Real World Assets (RWA), Osmosis Ecosystem, Stellar Ecosystem, Made in USA"
RETARDIO,retardio,RETARDIO,RETARDIO,20838061.0,20838061.0,2515817.0,"NFT, Solana Ecosystem, Meme, Solana Meme, Murad Picks, 4chan-Themed"
BRISE,bitrise-token,Bitgert,BRISE,20149165.0,21746854.0,3573378.0,"Smart Contract Platform, BNB Chain Ecosystem, Solana Ecosystem, Ethereum Ecosystem, Bitgert Ecosystem"
VIC,tomochain,Viction,VIC,19102106.0,33059954.0,1794052.0,"Smart Contract Platform, Masternodes, Layer 1 (L1), DWF Labs Portfolio"
FHE,mind-network,Mind Network,FHE,18038411.0,72443419.0,15439524.0,"Artificial Intelligence (AI), Smart Contract Platform, BNB Chain Ecosystem, Layer 2 (L2), Binance Wallet IDO"
ZETA,zeta,Zeta,ZEX,17351038.0,92405653.0,9369942.0,"Decentralized Finance (DeFi), Derivatives, Perpetuals, Solana Ecosystem"
NUM,numbers-protocol,Numbers Protocol,NUM,17130733.0,17348430.0,2071696.0,"Artificial Intelligence (AI), Smart Contract Platform, BNB Chain Ecosystem, DaoMaker Launchpad, Ethereum Ecosystem, Avalanche L1, YZi Labs (Prev. Binance Labs) Portfolio, Outlier Ventures Portfolio"
VINU,vita-inu,Vita Inu,VINU,16964421.0,16964421.0,1388502.0,"BNB Chain Ecosystem, Meme, Dog-Themed, DWF Labs Portfolio, Binance Alpha Spotlight"
REI,rei-network,REI Network,REI,16254683.0,16598993.0,1901025.0,"Smart Contract Platform, Layer 1 (L1)"
VSC,vyvo-smart-chain,Vyvo Smart Chain,VSC,16219319.0,70847848.0,222654.0,"Smart Contract Platform, BNB Chain Ecosystem, Polygon Ecosystem, Layer 2 (L2)"
MFT,mainframe,Mainframe,MFT,16003786.0,17049695.0,15.83,"Ethereum Ecosystem, Energi Ecosystem"
MLC,my-lovely-coin,My Lovely Coin,MLC,15199871.0,68239413.0,461513.0,"Charity, Gaming (GameFi), Polygon Ecosystem, Gaming Utility Token"
EPT,balance,Balance,EPT,14538495.0,62758353.0,21388534.0,"Artificial Intelligence (AI), Gaming (GameFi), BNB Chain Ecosystem, Animoca Brands Portfolio, DWF Labs Portfolio, AI Agents, Andreessen Horowitz (a16z) Portfolio, AI Agent Launchpad"
LEVER,lever,LeverFi,LEVER,14513769.0,14514082.0,3787254.0,"Decentralized Finance (DeFi), Ethereum Ecosystem, DWF Labs Portfolio, Alameda Research Portfolio"
LOCK,houdini-swap,Houdini Swap,LOCK,14088922.0,14088922.0,92117.0,"Privacy, Solana Ecosystem, Ethereum Ecosystem"
RWA,allo,Allo,RWA,14012535.0,77847416.0,13233024.0,"BNB Chain Ecosystem, Real World Assets (RWA), RWA Protocol"
SUKU,suku,SUKU,SUKU,12777476.0,43486697.0,310969.0,"Polygon Ecosystem, Ethereum Ecosystem, Made in USA"
LINGO,lingo,Lingo,LINGO,12409944.0,12409944.0,588685.0,"Solana Ecosystem, Real World Assets (RWA), Base Ecosystem, RWA Protocol"
AEROBUD,aerobud,AEROBUD,AEROBUD,11906095.0,11906095.0,233336.0,"Charity, Meme, Base Ecosystem, Dog-Themed, Base Meme, Made in USA"
LOOKS,looksrare,LooksRare,LOOKS,11672299.0,11672299.0,1630279.0,"NFT, Ethereum Ecosystem, NFT Marketplace"
MEMEFI,memefi-2,MemeFi,MEMEFI,11519670.0,11519670.0,7513926.0,"Gaming (GameFi), NFT, Meme, Play To Earn, Sui Ecosystem, Telegram Apps, Tap to Earn, Sui Meme, Action Games"
PAID,paid-network,PAID,PAID,10493548.0,12425825.0,202635.0,"Launchpad, Base Ecosystem"
PROPS,propbase,Propbase,PROPS,9838197.0,28156246.0,2777142.0,"Tokenized Real Estate, Tokenized Assets, Aptos Ecosystem, Real World Assets (RWA), Base Ecosystem, RWA Protocol"
OX,ox-fun,OX Coin,OX,9638705.0,9638705.0,148445.0,"BNB Chain Ecosystem, Derivatives, Perpetuals, Solana Ecosystem, Avalanche Ecosystem, Polygon Ecosystem, Arbitrum Ecosystem, Ethereum Ecosystem, Base Ecosystem, Blast Ecosystem"
DIONE,dione,Dione,DIONE,9535590.0,12626094.0,302348.0,"Energy, Smart Contract Platform, Layer 1 (L1), Made in USA"
WEPE,wall-street-pepe,Wall Street Pepe,WEPE,8258816.0,8258816.0,961744.0,"Meme, Ethereum Ecosystem, Frog-Themed, The Boy’s Club"
MCB,mcdex,MUX Protocol,MCB,8101558.0,10231787.0,49364.0,"Decentralized Exchange (DEX), Exchange-based Tokens, Decentralized Finance (DeFi), BNB Chain Ecosystem, Derivatives, Perpetuals, Arbitrum Ecosystem, Ethereum Ecosystem, Multicoin Capital Portfolio, Alameda Research Portfolio, DeFiance Capital Portfolio, Delphi Ventures Portfolio, OKX Ventures Portfolio"
K,kinto,Kinto,K,7554548.0,59455239.0,343115.0,"Decentralized Finance (DeFi), Wallets"
PEAR,pear-protocol,Pear Protocol,PEAR,6854298.0,23412135.0,157150.0,"Decentralized Exchange (DEX), Decentralized Finance (DeFi), Perpetuals, Arbitrum Ecosystem"
JUNO,juno-network,JUNO,JUNO,6199328.0,8236271.0,137906.0,"Smart Contract Platform, Cosmos Ecosystem, Osmosis Ecosystem, Juno Ecosystem, Evmos Ecosystem, Secret Ecosystem"
RLY,rally-2,Rally,RLY,5990161.0,17927841.0,336613.0,"SocialFi, Yield Farming, Ethereum Ecosystem, Alleged SEC Securities, Coinbase Ventures Portfolio, Andreessen Horowitz (a16z) Portfolio"
BEAM,beam,BEAM,BEAM,5928876.0,8536678.0,423019.0,"Smart Contract Platform, Privacy, Ethereum Ecosystem, Proof of Work (PoW), BeamPrivacy Ecosystem, Privacy Blockchain"
KILO,kiloex,KiloEx,KILO,5868012.0,27718526.0,5540261.0,"Decentralized Exchange (DEX), Decentralized Finance (DeFi), BNB Chain Ecosystem, Derivatives, Binance Wallet IDO"
PMT,public-meme-token,Public Masterpiece Token,PMT,5345213.0,22249240.0,254224.0,BNB Chain Ecosystem
NC,nodecoin,Nodecoin,NC,5322868.0,28588913.0,4839675.0,"Artificial Intelligence (AI), Solana Ecosystem, DePIN"
MOZ,lumoz,Lumoz,MOZ,5204137.0,40499821.0,3180914.0,"Smart Contract Platform, Arbitrum Ecosystem, Zero Knowledge (ZK)"
OBT,oobit,Oobit,OBT,5009312.0,14230018.0,113678.0,"BNB Chain Ecosystem, Ethereum Ecosystem, Payment Solutions"
GAIA,gaia-2,Gaia,SN57,4935567.0,4935567.0,1228886.0,"Artificial Intelligence (AI), Bittensor Ecosystem, Bittensor Subnets"
MAS,massa,Massa,MAS,4451793.0,17129166.0,112487.0,"Smart Contract Platform, Layer 1 (L1), Massa Ecosystem"
LL,lightlink,LightLink,LL,4354372.0,15032940.0,583453.0,"Infrastructure, Smart Contract Platform, Ethereum Ecosystem, Layer 2 (L2), Rollup, LightLink Ecosystem"
AZIT,azit,azit,AZIT,4250508.0,6453370.0,560087.0,Kaia Ecosystem
SDN,shiden,Shiden Network,SDN,3849073.0,5002288.0,19052.88,Smart Contract Platform
DYNA,dynachain,Dynachain,DYNA,3842436.0,16893082.0,150892.0,"Healthcare, BNB Chain Ecosystem"
LIF3,lif3,LIF3 (OLD),LIF3,3800689.0,12914997.0,129.12,Fantom Ecosystem
CREO,creo-engine,Creo Engine,CREO,3793667.0,7481430.0,1280422.0,"Gaming (GameFi), BNB Chain Ecosystem, Ethereum Ecosystem, Gaming Platform"
HMND,humanode,Humanode,HMND,3633199.0,11279476.0,531593.0,"Artificial Intelligence (AI), Smart Contract Platform, Layer 1 (L1), Decentralized Identifier (DID), Discord Bots"
HARAMBEAI,harambe-ai,Harambe AI,HARAMBEAI,3585587.0,5358325.0,17898.23,"Meme, Ethereum Ecosystem"
SHRUB,shrub,Shrub,SHRUB,3475606.0,3504478.0,1259100.0,"Solana Ecosystem, Meme, Ethereum Ecosystem, Base Ecosystem, Elon Musk-Inspired"
ATS,alltoscan,Alltoscan,ATS,3465079.0,5117803.0,125894.0,BNB Chain Ecosystem
METAV,metaverse,METAVERSE,METAV,3445496.0,3445496.0,546519.0,"Artificial Intelligence (AI), Solana Ecosystem, AI Agents, Pump.fun Ecosystem, Binance Alpha Spotlight"
HBAR,hedera-hashgraph,Hedera,HBAR,6529455717.0,7729039706.0,204634359.0,"Smart Contract Platform, Layer 1 (L1), Hedera Ecosystem, GMCI Layer 1 Index, GMCI 30 Index, GMCI Index, Outlier Ventures Portfolio, Made in USA, Directed Acyclic Graph (DAG)"
BGB,bitget-token,Bitget Token,BGB,5264419064.0,5264419064.0,56519543.0,"Exchange-based Tokens, Centralized Exchange (CEX) Token, Ethereum Ecosystem, DragonFly Capital Portfolio, Morph L2 Ecosystem"
TKX,tokenize-xchange,Tokenize Xchange,TKX,2410017703.0,3012672846.0,23531277.0,"Exchange-based Tokens, Centralized Exchange (CEX) Token, Ethereum Ecosystem, Titanchain Ecosystem"
RENDER,render-token,Render,RENDER,1758882634.0,1809011465.0,164791623.0,"Artificial Intelligence (AI), NFT, Metaverse, Solana Ecosystem, Polygon Ecosystem, Ethereum Ecosystem, DePIN, Multicoin Capital Portfolio, Alameda Research Portfolio, GMCI DePIN Index, GMCI 30 Index, GMCI Index, Made in USA, Coinbase 50 Index"
LBTC,lombard-staked-btc,Lombard Staked BTC,LBTC,1101325403.0,1101325403.0,7173678.0,"BNB Chain Ecosystem, Ethereum Ecosystem, Sui Ecosystem, Base Ecosystem, Restaking, Berachain Ecosystem, Liquid Restaking Tokens, Sonic Ecosystem, Swellchain Ecosystem, Corn Ecosystem, Liquid Staked BTC"
IP,story-2,Story,IP,1038617363.0,3609320796.0,22842882.0,"Artificial Intelligence (AI), Smart Contract Platform, Layer 1 (L1), Made in USA, Story Ecosystem"
XDC,xdce-crowd-sale,XDC Network,XDC,991373388.0,2322717480.0,36672550.0,"Smart Contract Platform, Layer 1 (L1), Real World Assets (RWA)"
FLOKI,floki,FLOKI,FLOKI,753249318.0,779504471.0,112312686.0,"Gaming (GameFi), NFT, BNB Chain Ecosystem, Metaverse, Meme, Play To Earn, Ethereum Ecosystem, Telegram Apps, Dog-Themed, DWF Labs Portfolio, RPG, On-chain Gaming, TokenFi Launchpad, GMCI Meme Index, GMCI Index"
LDO,lido-dao,Lido DAO,LDO,730750388.0,814528667.0,149911374.0,"Infrastructure, Decentralized Finance (DeFi), Polygon Ecosystem, Arbitrum Ecosystem, Ethereum Ecosystem, Optimism Ecosystem, Liquid Staking Governance Tokens, eGirl Capital Portfolio, Paradigm Portfolio, Coinbase Ventures Portfolio, Multicoin Capital Portfolio, Index Coop Defi Index, Alameda Research Portfolio, DragonFly Capital Portfolio, Andreessen Horowitz (a16z) Portfolio, GMCI DeFi Index, Delphi Ventures Portfolio, Liquid Staking, GMCI Index, Coinbase 50 Index"
BTT,bittorrent,BitTorrent,BTT,667035121.0,669699617.0,20531238.0,"Storage, BNB Chain Ecosystem, Ethereum Ecosystem, DePIN, Alleged SEC Securities, Binance Launchpad, Tron Ecosystem, Energi Ecosystem, YZi Labs (Prev. Binance Labs) Portfolio, BitTorrent Ecosystem, GMCI DePIN Index, GMCI Index"
PYTH,pyth-network,Pyth Network,PYTH,619458249.0,1077321222.0,35403563.0,"Business Services, Infrastructure, Decentralized Finance (DeFi), Oracle, Solana Ecosystem, Neon Ecosystem, Manta Network Ecosystem, Multicoin Capital Portfolio, GMCI DeFi Index, Delphi Ventures Portfolio, GMCI Index"
RAY,raydium,Raydium,RAY,602755303.0,1159235022.0,91429424.0,"Decentralized Exchange (DEX), Decentralized Finance (DeFi), Yield Farming, Automated Market Maker (AMM), Solana Ecosystem, Launchpad, GMCI DeFi Index, GMCI Index"
EIGEN,eigenlayer,Eigenlayer,EIGEN,392680422.0,2205714516.0,127622741.0,"Infrastructure, Ethereum Ecosystem, Data Availability, Restaking, Polychain Capital Portfolio, Made in USA"
CFX,conflux-token,Conflux,CFX,384380131.0,427705306.0,31923326.0,"Smart Contract Platform, DWF Labs Portfolio, Proof of Work (PoW), GMCI Layer 1 Index, Sequoia Capital Portfolio, GMCI Index, Made in China"
SUN,sun-token,Sun Token,SUN,351731289.0,363340972.0,22056587.0,"Decentralized Finance (DeFi), Tron Ecosystem"
JST,just,JUST,JST,319710091.0,319710091.0,48007715.0,"Decentralized Finance (DeFi), Tron Ecosystem"
DASH,dash,Dash,DASH,246997745.0,247069540.0,18673296.0,"Smart Contract Platform, Privacy, Masternodes, Alleged SEC Securities, Proof of Stake (PoS), Proof of Work (PoW), Made in USA"
ROSE,oasis-network,Oasis,ROSE,190718897.0,258183718.0,10457301.0,"Smart Contract Platform, BNB Chain Ecosystem, Layer 1 (L1), Proof of Stake (PoS), Pantera Capital Portfolio, Andreessen Horowitz (a16z) Portfolio, YZi Labs (Prev. Binance Labs) Portfolio, Blockchain Capital Portfolio, Privacy Blockchain, Polychain Capital Portfolio, Coinbase 50 Index"
AI16Z,ai16z,ai16z,AI16Z,178675018.0,178675018.0,99181125.0,"Artificial Intelligence (AI), Solana Ecosystem, Meme, Solana Meme, Solana Token-2022, AI Meme, AI Agents, Binance Alpha Spotlight, AI Framework, Made in USA"
