LDO,lido-dao,Lido DAO,LDO,684973059,764676171.0,64575272.0,"Infrastructure, Decentralized Finance (DeFi), Polygon Ecosystem, Arbitrum Ecosystem, Ethereum Ecosystem, Optimism Ecosystem, Liquid Staking Governance Tokens, eGirl Capital Portfolio, Paradigm Portfolio, Coinbase Ventures Portfolio, Multicoin Capital Portfolio, Index Coop Defi Index, Alameda Research Portfolio, DragonFly Capital Portfolio, Andreessen Horowitz (a16z) Portfolio, GMCI DeFi Index, Delphi Ventures Portfolio, Liquid Staking, GMCI Index, Coinbase 50 Index, Governance"
TIA,celestia,Celestia,TIA,677447546,934044803.0,73051787.0,"Smart Contract Platform, Cosmos Ecosystem, Layer 1 (L1), Data Availability, Modular Blockchain, Osmosis Ecosystem, eGirl Capital Portfolio, Coinbase Ventures Portfolio, Proof of Stake (PoS), Secret Ecosystem, YZi Labs (Prev. Binance Labs) Portfolio, Delphi Ventures Portfolio, Galaxy Digital Portfolio, Blockchain Capital Portfolio, OKX Ventures Portfolio, Polychain Capital Portfolio"
STX,blockstack,Stacks,STX,647965826,647965826.0,22322790.0,"Infrastructure, Smart Contract Platform, Layer 2 (L2), Bitcoin Sidechains, Stacks Ecosystem, SideChain, GMCI Layer 2 Index, GMCI 30 Index, Blockchain Capital Portfolio, GMCI Index, Made in USA, Coinbase 50 Index"
FLOKI,floki,FLOKI,FLOKI,577343981,597772923.0,65227006.0,"Gaming (GameFi), NFT, BNB Chain Ecosystem, Metaverse, Meme, Play To Earn, Ethereum Ecosystem, Telegram Apps, Dog-Themed, DWF Labs Portfolio, RPG, On-chain Gaming, TokenFi Launchpad, GMCI Meme Index, GMCI Index"
PYTH,pyth-network,Pyth Network,PYTH,537808344,935321627.0,29416984.0,"Business Services, Infrastructure, Decentralized Finance (DeFi), Oracle, Solana Ecosystem, Neon Ecosystem, Manta Network Ecosystem, Multicoin Capital Portfolio, GMCI DeFi Index, Delphi Ventures Portfolio, GMCI Index"
ZK,zksync,ZKsync,ZK,525404311,1525697169.0,692695736.0,"Smart Contract Platform, Ethereum Ecosystem, Layer 2 (L2), Zero Knowledge (ZK), ZkSync Ecosystem, Consensys Portfolio, Blockchain Capital Portfolio, OKX Ventures Portfolio, Privacy Blockchain"
CFX,conflux-token,Conflux,CFX,465983675,517810972.0,27680536.0,"Smart Contract Platform, DWF Labs Portfolio, Proof of Work (PoW), GMCI Layer 1 Index, Sequoia Capital Portfolio, GMCI Index, Made in China"
BTT,bittorrent,BitTorrent,BTT,425016521,426714265.0,14701317.0,"Storage, BNB Chain Ecosystem, Ethereum Ecosystem, DePIN, Alleged SEC Securities, Binance Launchpad, Tron Ecosystem, Energi Ecosystem, YZi Labs (Prev. Binance Labs) Portfolio, BitTorrent Ecosystem, GMCI DePIN Index, GMCI Index"
SUN,sun-token,Sun Token,SUN,415869649,431594515.0,26172360.0,"Decentralized Finance (DeFi), Tron Ecosystem, Made in China"
RAY,raydium,Raydium,RAY,366926612,759145411.0,41603409.0,"Decentralized Exchange (DEX), Exchange-based Tokens, Decentralized Finance (DeFi), Yield Farming, Automated Market Maker (AMM), Perpetuals, Solana Ecosystem, Launchpad, GMCI DeFi Index, GMCI Index"
JST,just,JUST,JST,345948600,345948600.0,27690854.0,"Decentralized Finance (DeFi), Tron Ecosystem"
EIGEN,eigenlayer,EigenCloud (prev. EigenLayer),EIGEN,330601224,1341304602.0,60969541.0,"Infrastructure, Ethereum Ecosystem, Base Ecosystem, Data Availability, Restaking, Polychain Capital Portfolio, Made in USA, x402 Ecosystem"
LGCT,legacy-token,Legacy Token,LGCT,192538738,544514797.0,3989325.0,"Education, Gaming (GameFi), BNB Chain Ecosystem, Base Ecosystem"
TKX,tokenize-xchange,Tokenize Xchange,TKX,154035171,192553597.0,7370.53,"Exchange-based Tokens, Centralized Exchange (CEX) Token, Ethereum Ecosystem, Titanchain Ecosystem"
DRIFT,drift-protocol,Drift Protocol,DRIFT,133755807,346957508.0,18187860.0,"Decentralized Finance (DeFi), Derivatives, Prediction Markets, Perpetuals, Solana Ecosystem, Governance"
CELO,celo,Celo,CELO,129971633,221495612.0,16547043.0,"Smart Contract Platform, Celo Ecosystem, Layer 2 (L2), DWF Labs Portfolio, Coinbase Ventures Portfolio, Proof of Stake (PoS), Andreessen Horowitz (a16z) Portfolio, Optimism Superchain Ecosystem, Outlier Ventures Portfolio, Made in USA"
SEDA,seda-2,SEDA,SEDA,125154151,205633993.0,3111888.0,"Smart Contract Platform, Oracle, Ethereum Ecosystem, Base Ecosystem, Modular Blockchain, Osmosis Ecosystem, HyperEVM Ecosystem"
OZO,ozone-chain,Ozone Chain,OZO,118636994,132354023.0,223343.0,"Smart Contract Platform, Layer 1 (L1), Zero Knowledge (ZK)"
EUL,euler,Euler,EUL,115216856,167611984.0,12152564.0,"BNB Chain Ecosystem, Lending/Borrowing Protocols, Avalanche Ecosystem, Arbitrum Ecosystem, Ethereum Ecosystem, Base Ecosystem, Berachain Ecosystem, Paradigm Portfolio, Coinbase Ventures Portfolio, Sonic Ecosystem, Swellchain Ecosystem, Unichain Ecosystem, TAC Ecosystem, Plasma Ecosystem"
NPC,non-playable-coin,Non-Playable Coin,NPC,110693165,110693165.0,7594849.0,"NFT, BNB Chain Ecosystem, Solana Ecosystem, Meme, Ethereum Ecosystem, Base Ecosystem, Hybrid Token Standards, Wojak-Themed, 4chan-Themed"
ELF,aelf,aelf,ELF,95412129,118447624.0,4409040.0,"Infrastructure, Smart Contract Platform, BNB Chain Ecosystem, Layer 1 (L1), Ethereum Ecosystem, GMCI Layer 1 Index, Aelf Ecosystem, GMCI Index"
AI16Z,ai16z,ai16z,AI16Z,72144864,72144863.0,105779571.0,"Artificial Intelligence (AI), Solana Ecosystem, Meme, Solana Token-2022, AI Agents, Binance Alpha Spotlight, AI Framework, Made in USA"
SCRT,secret,Secret,SCRT,71529924,74848133.0,23066437.0,"Artificial Intelligence (AI), Infrastructure, Smart Contract Platform, Privacy, Cosmos Ecosystem, Layer 1 (L1), Osmosis Ecosystem, Alameda Research Portfolio, DragonFly Capital Portfolio, DeFiance Capital Portfolio, Privacy Blockchain, Outlier Ventures Portfolio"
IO,io,io.net,IO,64386534,220323584.0,18597465.0,"Artificial Intelligence (AI), Internet of Things (IOT), Binance Launchpool, Solana Ecosystem, DePIN, Animoca Brands Portfolio, Multicoin Capital Portfolio, Delphi Ventures Portfolio, OKX Ventures Portfolio, Made in USA"
ANVL,anvil,Anvil,ANVL,61803640,77061361.0,50804.0,"Decentralized Finance (DeFi), Ethereum Ecosystem"
WOO,woo-network,WOO,WOO,61561951,71256372.0,5294229.0,"Decentralized Exchange (DEX), Exchange-based Tokens, Decentralized Finance (DeFi), Automated Market Maker (AMM), BNB Chain Ecosystem, Derivatives, Perpetuals, Centralized Exchange (CEX) Token, Solana Ecosystem, Avalanche Ecosystem, Polygon Ecosystem, Near Protocol Ecosystem, Fantom Ecosystem, Arbitrum Ecosystem, Ethereum Ecosystem, ZkSync Ecosystem, Mantle Ecosystem, Linea Ecosystem, Base Ecosystem, DragonFly Capital Portfolio, YZi Labs (Prev. Binance Labs) Portfolio"
BICO,biconomy,Biconomy,BICO,61146236,61528234.0,12309314.0,"Arbitrum Ecosystem, Ethereum Ecosystem, Account Abstraction, Coinbase Ventures Portfolio, YZi Labs (Prev. Binance Labs) Portfolio, Consensys Portfolio, Outlier Ventures Portfolio"
B3,b3,B3 (Base),B3,59846307,197528320.0,2651445.0,"Smart Contract Platform, Base Ecosystem, Gaming Blockchains"
RLC,iexec-rlc,iExec RLC,RLC,55241395,66397076.0,6989789.0,"Artificial Intelligence (AI), Oracle, Arbitrum Ecosystem, Ethereum Ecosystem, DePIN, AI Agents, Energi Ecosystem, Sora Ecosystem, GMCI DePIN Index, GMCI Index"
HIVE,hive,Hive,HIVE,55063343,,1215283.0,"Smart Contract Platform, SocialFi, Layer 1 (L1), Gaming Blockchains"
BAL,balancer,Balancer,BAL,54870693,59875341.0,6255786.0,"Decentralized Exchange (DEX), Exchange-based Tokens, Decentralized Finance (DeFi), Yield Farming, Automated Market Maker (AMM), Avalanche Ecosystem, Polygon Ecosystem, Near Protocol Ecosystem, Gnosis Chain Ecosystem, Harmony Ecosystem, Arbitrum Ecosystem, Ethereum Ecosystem, Optimism Ecosystem, Base Ecosystem, Index Coop Defi Index, Alameda Research Portfolio, DeFiance Capital Portfolio, Pantera Capital Portfolio, Energi Ecosystem, Polygon zkEVM Ecosystem, Huobi ECO Chain Ecosystem, Blockchain Capital Portfolio, Governance"
FLOCK,flock-2,FLOCK,FLOCK,49852039,205433606.0,7783079.0,"Artificial Intelligence (AI), Base Ecosystem, AI Applications, Binance Alpha Spotlight, x402 Ecosystem"
MVL,mass-vehicle-ledger,MVL,MVL,47099193,47612947.0,379119.0,"Internet of Things (IOT), BNB Chain Ecosystem, Ethereum Ecosystem, DePIN, DWF Labs Portfolio"
ACX,across-protocol,Across Protocol,ACX,41194578,64373220.0,6599651.0,"Polygon Ecosystem, Arbitrum Ecosystem, Ethereum Ecosystem, Optimism Ecosystem, Bridge Governance Tokens, Cross-chain Communication, Intent, Boba Network Ecosystem, Blockchain Capital Portfolio, Made in USA"
VEE,blockv,BLOCKv,VEE,35661563,35661563.0,51860.0,"NFT, Polygon Ecosystem, Ethereum Ecosystem, Optimism Ecosystem"
NYM,nym,Nym,NYM,34598119,42128839.0,2474868.0,"Smart Contract Platform, Privacy, Ethereum Ecosystem, DePIN, Osmosis Ecosystem, VPN, Andreessen Horowitz (a16z) Portfolio, YZi Labs (Prev. Binance Labs) Portfolio, Governance"
QKC,quark-chain,QuarkChain,QKC,33739304,47007363.0,836360.0,"Infrastructure, Ethereum Ecosystem, Energi Ecosystem"
AINTI,aintivirus,AIntivirus,AINTI,33726458,33726458.0,0.0,"Solana Ecosystem, Meme, AI Meme, Pump.fun Ecosystem"
UQC,uquid-coin,Uquid Coin,UQC,32128292,128513170.0,15495.14,Ethereum Ecosystem
PIPPIN,pippin,pippin,PIPPIN,31315450,31315450.0,11179856.0,"Artificial Intelligence (AI), Infrastructure, Solana Ecosystem, Meme, Solana Meme, AI Meme, AI Agents, Pump.fun Ecosystem, Binance Alpha Spotlight, AI Framework"
QI,benqi,BENQI,QI,31019593,31019593.0,1234647.0,"Decentralized Finance (DeFi), Yield Farming, Binance Launchpool, Lending/Borrowing Protocols, Avalanche Ecosystem, Liquid Staking Governance Tokens, DragonFly Capital Portfolio, Liquid Staking"
NOS,nosana,Nosana,NOS,30978302,37144247.0,658429.0,"Artificial Intelligence (AI), Solana Ecosystem, DePIN"
AO,ao-computer,ao Computer,AO,29668236,29668236.0,452766.0,"Artificial Intelligence (AI), Smart Contract Platform, DePIN"
PAAL,paal-ai,PAAL AI,PAAL,28736641,32018842.0,5693873.0,"Artificial Intelligence (AI), Virtual Reality, BNB Chain Ecosystem, Solana Ecosystem, Launchpad, Ethereum Ecosystem, Telegram Apps, Discord Bots, Base Ecosystem, PAAL AI Launchpad, AI Agents, AI Applications, AI Agent Launchpad, Binance Alpha Spotlight, AI Framework, DeFAI, Made in USA"
MBX,marblex,MARBLEX,MBX,24190153,29752720.0,1584944.0,"Smart Contract Platform, Gaming (GameFi), NFT, BNB Chain Ecosystem, Kaia Ecosystem, Aptos Ecosystem, DWF Labs Portfolio, Gaming Blockchains"
VANRY,vanar-chain,Vanar Chain,VANRY,23864423,25500315.0,3964135.0,"Artificial Intelligence (AI), Smart Contract Platform, Layer 1 (L1), Polygon Ecosystem, Ethereum Ecosystem, Vanar Chain Ecosystem"
MAPO,marcopolo,MAP Protocol,MAPO,23149026,36785430.0,570807.0,"BNB Chain Ecosystem, Ethereum Ecosystem, DWF Labs Portfolio"
ACS,access-protocol,Access Protocol,ACS,22934289,46655081.0,1266409.0,"SocialFi, Solana Ecosystem"
CHILLGUY,chill-guy,Just a chill guy,CHILLGUY,22541844,22541844.0,8296471.0,"Solana Ecosystem, Meme, Dog-Themed, Solana Meme, Pump.fun Ecosystem, TikTok Meme"
NAVX,navi,NAVI Protocol,NAVX,21714661,30170997.0,2915533.0,"Decentralized Finance (DeFi), Lending/Borrowing Protocols, Sui Ecosystem, OKX Ventures Portfolio, Binance Alpha Spotlight"
SIX,six,Six Sigma,SIX,20596384,20596384.0,86.31,"Gambling (GambleFi), Solana Ecosystem"
LYX,lukso-token-2,LUKSO,LYX,19243194,26540250.0,558474.0,"Smart Contract Platform, SocialFi, Layer 1 (L1), Decentralized Identifier (DID), Proof of Stake (PoS), Lukso Ecosystem"
GPS,goplus-security,GoPlus Security,GPS,18815331,59636549.0,6148938.0,"BNB Chain Ecosystem, Base Ecosystem, Cybersecurity, YZi Labs (Prev. Binance Labs) Portfolio, OKX Ventures Portfolio, Binance Alpha Spotlight"
SWARMS,swarms,Swarms,SWARMS,18779462,18779462.0,10019469.0,"Artificial Intelligence (AI), Solana Ecosystem, AI Agents, Pump.fun Ecosystem, Binance Alpha Spotlight, AI Framework"
FORT,forta,Forta,FORT,18052054,28799405.0,673699.0,"Artificial Intelligence (AI), Polygon Ecosystem, Arbitrum Ecosystem, Ethereum Ecosystem, Base Ecosystem, Coinbase Ventures Portfolio, Cybersecurity, Andreessen Horowitz (a16z) Portfolio, Blockchain Capital Portfolio"
FARTBOY,fartboy,Fartboy,$FARTBOY,17882337,17882337.0,1829226.0,"Solana Ecosystem, Meme, Solana Meme, Pump.fun Ecosystem"
L3,layer3,Layer3,L3,15210526,52798777.0,6351476.0,"Marketing, BNB Chain Ecosystem, Solana Ecosystem, Polygon Ecosystem, Arbitrum Ecosystem, Ethereum Ecosystem, Decentralized Identifier (DID), Optimism Ecosystem, Quest-to-Earn, Made in USA"
PIKA,pikaboss,Pikaboss,PIKA,15028329,15028329.0,6590.76,"Meme, Ethereum Ecosystem"
WALLET,ambire-wallet,Ambire Wallet,WALLET,13551575,13701228.0,390207.0,"Wallets, Polygon Ecosystem, Ethereum Ecosystem, Base Ecosystem, Account Abstraction, Governance"
DEXTF,dextf,Memento,DEXTF,13508209,20526936.0,490331.0,"Decentralized Finance (DeFi), Asset Manager, Avalanche Ecosystem, Ethereum Ecosystem, ZkSync Ecosystem, Real World Assets (RWA), Base Ecosystem, Privacy Blockchain"
TLOS,telos,Telos,TLOS,12380512,12380513.0,2093635.0,"Smart Contract Platform, BNB Chain Ecosystem, Layer 1 (L1), Avalanche Ecosystem, Polygon Ecosystem, Arbitrum Ecosystem, Ethereum Ecosystem, Zero Knowledge (ZK), Base Ecosystem, Telos Ecosystem, Consensys Portfolio"
VADER,vaderai-by-virtuals,Vader,VADER,12165062,12165062.0,499863.0,"Artificial Intelligence (AI), Meme, Base Ecosystem, AI Meme, AI Agents, Virtuals Protocol Ecosystem, Binance Alpha Spotlight, Robotics"
NRN,neuron,Neuron,NRN,10858927,24161389.0,177285.0,"Artificial Intelligence (AI), Gaming (GameFi), NFT, Arbitrum Ecosystem, Paradigm Portfolio, AI Agents, AI Framework, Action Games, Robotics"
WEXO,wexo,Wexo,WEXO,10637773,28614261.0,207539.0,"Ethereum Ecosystem, Base Ecosystem"
XTER,xterio,Xterio,XTER,10145275,71631881.0,17728761.0,"Artificial Intelligence (AI), Gaming (GameFi), NFT, BNB Chain Ecosystem, Animoca Brands Portfolio, Gaming Blockchains, YZi Labs (Prev. Binance Labs) Portfolio, Binance Alpha Spotlight"
PPC,peercoin,Peercoin,PPC,10077335,10077441.0,5555.9,"Smart Contract Platform, Polygon Ecosystem, Ethereum Ecosystem, Proof of Stake (PoS), Proof of Work (PoW)"
LUMIA,lumia,Lumia,LUMIA,9930346,31501118.0,3931797.0,"Smart Contract Platform, Layer 2 (L2), Real World Assets (RWA), Governance"
RARI,rarible,RARI,RARI,9669410,13349876.0,697387.0,"NFT, Ethereum Ecosystem, NFT Marketplace, Base Ecosystem, Coinbase Ventures Portfolio, Energi Ecosystem, Made in USA, Governance"
SCA,scallop-2,Scallop,SCA,7903150,14589959.0,3712544.0,"Decentralized Finance (DeFi), Lending/Borrowing Protocols, Sui Ecosystem"
TRIAS,trias-token,TriasLab,TRIAS,7846808,7846808.0,12811.1,"Artificial Intelligence (AI), Smart Contract Platform, BNB Chain Ecosystem, Layer 1 (L1), Ethereum Ecosystem, AI Agents"
GRAM,gram-2,Gram,GRAM,7413248,7413248.0,33342.0,"TON Ecosystem, Proof of Work (PoW)"
BELLS,bellscoin,Bellscoin,BELLS,6526458,6526458.0,326757.0,"Smart Contract Platform, Layer 1 (L1), Meme, Proof of Work (PoW), Inscriptions, Made in USA"
TET,tectum,Tectum,TET,6457188,6525986.0,288817.0,"Smart Contract Platform, Layer 1 (L1), Ethereum Ecosystem, Bitcoin Sidechains, SideChain"
GRAIL,camelot-token,Camelot Token,GRAIL,5923269,22749230.0,191585.0,"Decentralized Exchange (DEX), Exchange-based Tokens, Arbitrum Ecosystem, Camelot Launchpad"
SOVRN,sovrun,Sovrun,SOVRN,5713286,6154369.0,105695.0,"Gaming (GameFi), Metaverse, Ethereum Ecosystem, Animoca Brands Portfolio, Base Ecosystem, DWF Labs Portfolio, On-chain Gaming, Andreessen Horowitz (a16z) Portfolio, Hyperliquid Ecosystem, Delphi Ventures Portfolio, Circle Ventures Portfolio"
JETTON,jetton,JetTon Games,JETTON,5549120,8773294.0,94071.0,"Gambling (GambleFi), Telegram Apps, TON Ecosystem"
CEEK,ceek,CEEK Smart VR,CEEK,5446341,5468215.0,238853.0,"Entertainment, BNB Chain Ecosystem, Metaverse, Ethereum Ecosystem, DWF Labs Portfolio"
FNCT,financie-token,Financie Token,FNCT,5266859,27647417.0,69694.0,"Polygon Ecosystem, Ethereum Ecosystem"
LCAT,lion-cat,Lion Cat,LCAT,5029682,5831515.0,30512.0,"BNB Chain Ecosystem, Meme, Cat-Themed"
PAIN,pain,Pain,PAIN,4801083,9602258.0,30915.0,"Solana Ecosystem, Meme, Solana Meme, 4chan-Themed"
JOULE,joule-2,Joule,JOULE,4666735,4703032.0,13483.57,"Decentralized Finance (DeFi), Flare Network Ecosystem"
EOS,binance-peg-eos,Binance-Peg EOS,EOS,4382378,4382378.0,5718.27,"Smart Contract Platform, BNB Chain Ecosystem, Binance-Peg Tokens"
GMM,gamium,Gamium,GMM,4308333,4399413.0,43233.0,"SocialFi, Gaming (GameFi), BNB Chain Ecosystem, Metaverse, DaoMaker Launchpad, Ethereum Ecosystem, Gaming Governance Token, Gaming Utility Token, Governance"
LVVA,levva-protocol,Levva Protocol,LVVA,4236040,4328654.0,464518.0,"Decentralized Finance (DeFi), Analytics, Yield Farming, Yield Aggregator, Ethereum Ecosystem, Yield Optimizer"
OVR,ovr,Ovr,OVR,4081757,6990165.0,433376.0,"Artificial Intelligence (AI), Augmented Reality, BNB Chain Ecosystem, Polygon Ecosystem, Ethereum Ecosystem, DePIN, Base Ecosystem, Robotics"
XX,xxcoin,XX Network,XX,4018001,11151478.0,97954.0,"Smart Contract Platform, Layer 1 (L1), Ethereum Ecosystem"
VISTA,ethervista,Ethervista,VISTA,3874645,3874645.0,432677.0,"Decentralized Exchange (DEX), Exchange-based Tokens, Decentralized Finance (DeFi), Launchpad, Meme, Ethereum Ecosystem, Binance Alpha Spotlight"
RVF,rocketx,RocketX Exchange,RVF,3611365,3694532.0,15005.49,"Decentralized Exchange (DEX), Exchange-based Tokens, Decentralized Finance (DeFi), Automated Market Maker (AMM), Ethereum Ecosystem, Poolz Finance Launchpad"
KIMA,kima,Kima Network,KIMA,3427693,10990920.0,745767.0,"Infrastructure, Cosmos Ecosystem, Arbitrum Ecosystem, Outlier Ventures Portfolio"
SWAP,hyperswap,HyperSwap,SWAP,3169895,4506677.0,51377.0,"Decentralized Exchange (DEX), Decentralized Finance (DeFi), HyperEVM Ecosystem"
ARCA,arca,Legend of Arcadia,ARCA,3145519,10457444.0,303179.0,"Gaming (GameFi), Ethereum Ecosystem, RPG"
QORPO,qopro,QORPO WORLD,QORPO,2976449,3610687.0,861610.0,"Gaming (GameFi), NFT, BNB Chain Ecosystem, Play To Earn, Ethereum Ecosystem, RPG, Gaming Utility Token, Adventure Games, Gaming Platform, Action Games"
HYDRA,hydra,Hydra,HYDRA,2943488,3226143.0,89363.0,"Smart Contract Platform, Layer 1 (L1)"
RENTA,renta-network,Renta Network,RENTA,2869509,6474233.0,84297.0,"Retail, Smart Contract Platform, NFT, Ethereum Ecosystem, Layer 2 (L2), Real World Assets (RWA), NFTFi"
ICP,internet-computer,Internet Computer,ICP,3145498664,3145498664.0,692434329.0,"Artificial Intelligence (AI), Infrastructure, Smart Contract Platform, Layer 1 (L1), Ethereum Ecosystem, Internet Computer Ecosystem, Base Ecosystem, Alleged SEC Securities, Multicoin Capital Portfolio, Layer 0 (L0), Andreessen Horowitz (a16z) Portfolio, GMCI Layer 1 Index, GMCI 30 Index, Blockchain Capital Portfolio, GMCI Index, Polychain Capital Portfolio, Coinbase 50 Index, Governance"
APT,aptos,Aptos,APT,1912959605,3142427309.0,317219321.0,"Smart Contract Platform, Layer 1 (L1), Aptos Ecosystem, FTX Holdings, Coinbase Ventures Portfolio, Multicoin Capital Portfolio, Proof of Stake (PoS), DragonFly Capital Portfolio, Andreessen Horowitz (a16z) Portfolio, YZi Labs (Prev. Binance Labs) Portfolio, GMCI Layer 1 Index, GMCI 30 Index, Circle Ventures Portfolio, GMCI Index, Made in USA"
FTN,fasttoken,Fasttoken,FTN,875528173,1758270776.0,21315961.0,"Smart Contract Platform, BNB Chain Ecosystem, Layer 1 (L1), Arbitrum Ecosystem, Ethereum Ecosystem, Base Ecosystem, Bahamut Ecosystem"
AERO,aerodrome-finance,Aerodrome Finance,AERO,807334359,1592458616.0,75018144.0,"Decentralized Exchange (DEX), Exchange-based Tokens, Decentralized Finance (DeFi), Automated Market Maker (AMM), Base Ecosystem, Binance Alpha Spotlight, Made in USA"
DCR,decred,Decred,DCR,722052497,722071384.0,72819175.0,"Smart Contract Platform, Privacy, Layer 1 (L1), Proof of Stake (PoS), Proof of Work (PoW), Blockchain Capital Portfolio, Made in USA"
SYRUP,syrup,Maple Finance,SYRUP,471444252,503518928.0,57289877.0,"Decentralized Finance (DeFi), Yield Farming, Lending/Borrowing Protocols, Ethereum Ecosystem, Real World Assets (RWA), Base Ecosystem, Binance Alpha Spotlight"
DEXE,dexe,DeXe,DEXE,345721378,584264408.0,6103984.0,"Artificial Intelligence (AI), Decentralized Finance (DeFi), BNB Chain Ecosystem, Ethereum Ecosystem"
CCD,concordium,Concordium,CCD,328460377,396965250.0,1263469.0,"Smart Contract Platform, Layer 1 (L1), Decentralized Identifier (DID), Zero Knowledge (ZK)"
TEL,telcoin,Telcoin,TEL,326539155,343446200.0,6101156.0,"Decentralized Finance (DeFi), Wallets, Polygon Ecosystem, Arbitrum Ecosystem, Ethereum Ecosystem, Payment Solutions, Base Ecosystem, Made in USA"
KMNO,kamino,Kamino,KMNO,195317909,615371294.0,25769899.0,"Decentralized Finance (DeFi), Lending/Borrowing Protocols, Solana Ecosystem, Binance Alpha Spotlight"
MINA,mina-protocol,Mina Protocol,MINA,194274183,194275182.0,125938559.0,"Smart Contract Platform, Layer 1 (L1), Zero Knowledge (ZK), FTX Holdings, Paradigm Portfolio, Coinbase Ventures Portfolio, Multicoin Capital Portfolio, Proof of Stake (PoS), Pantera Capital Portfolio, Circle Ventures Portfolio, Privacy Blockchain, Polychain Capital Portfolio, Made in USA, Coinbase 50 Index"
KSM,kusama,Kusama,KSM,159256233,159256702.0,10493178.0,"Smart Contract Platform, Polkadot Ecosystem, Proof of Stake (PoS), Pantera Capital Portfolio, Made in USA, Coinbase 50 Index, Hydration Ecosystem"
TFUEL,theta-fuel,Theta Fuel,TFUEL,153534895,153534895.0,2550611.0,"Artificial Intelligence (AI), Smart Contract Platform, DePIN, Proof of Stake (PoS), Made in USA"
YFI,yearn-finance,yearn.finance,YFI,151080054,163166765.0,12482215.0,"Decentralized Finance (DeFi), Yield Farming, Yield Aggregator, Yearn Ecosystem, Avalanche Ecosystem, Polygon Ecosystem, Near Protocol Ecosystem, Gnosis Chain Ecosystem, Fantom Ecosystem, Harmony Ecosystem, Arbitrum Ecosystem, Ethereum Ecosystem, Optimism Ecosystem, Base Ecosystem, Index Coop Defi Index, Alameda Research Portfolio, Energi Ecosystem, Sora Ecosystem, Huobi ECO Chain Ecosystem, Blockchain Capital Portfolio, Governance"
ZIL,zilliqa,Zilliqa,ZIL,136270378,141012240.0,11620816.0,"Smart Contract Platform, BNB Chain Ecosystem, GMCI Layer 1 Index, GMCI Index, Made in China"
QUBIC,qubic-network,Qubic,QUBIC,136125997,172137420.0,3974043.0,"Artificial Intelligence (AI), Smart Contract Platform, Layer 1 (L1), Proof of Work (PoW)"
MEW,cat-in-a-dogs-world,cat in a dogs world,MEW,130492409,130492409.0,23854934.0,"Solana Ecosystem, Meme, Dog-Themed, Solana Meme, Cat-Themed"
NIZA,niza-global-2,Niza Global,NIZA,73892636,73892636.0,1366025.0,"Exchange-based Tokens, Centralized Exchange (CEX) Token, Ethereum Ecosystem"
YGG,yield-guild-games,Yield Guild Games,YGG,71162328,104875049.0,23164519.0,"Gaming (GameFi), NFT, BNB Chain Ecosystem, Metaverse, Collectibles, Polygon Ecosystem, Play To Earn, Harmony Ecosystem, Guild and Scholarship, Ethereum Ecosystem, Animoca Brands Portfolio, Base Ecosystem, DWF Labs Portfolio, Ronin Ecosystem, Gaming Governance Token, Andreessen Horowitz (a16z) Portfolio, Delphi Ventures Portfolio, Abstract Ecosystem"
CARV,carv,CARV,CARV,59429523,200770415.0,27123288.0,"Artificial Intelligence (AI), Infrastructure, Gaming (GameFi), NFT, BNB Chain Ecosystem, Solana Ecosystem, Arbitrum Ecosystem, Impossible Finance Launchpad, Ethereum Ecosystem, Animoca Brands Portfolio, Base Ecosystem"
ACH,alchemy-pay,Alchemy Pay,ACH,54216612,109668285.0,16979098.0,"BNB Chain Ecosystem, Ethereum Ecosystem, Payment Solutions, DWF Labs Portfolio, Made in China"
SWFTC,swftcoin,SWFTCOIN,SWFTC,53736873,53736873.0,1525444.0,"NFT, BNB Chain Ecosystem, Ethereum Ecosystem, Dex Aggregator"
WHITE,whiteheart,Whiteheart,WHITE,53053451,53053451.0,0.0,"Decentralized Finance (DeFi), Derivatives, Ethereum Ecosystem"
VVV,venice-token,Venice Token,VVV,52945618,101250800.0,2080578.0,"Artificial Intelligence (AI), Base Ecosystem, AI Agents, AI Applications, Made in USA"
SGB,songbird,Songbird,SGB,50530523,59758301.0,296399.0,Smart Contract Platform
PEOPLE,constitutiondao,ConstitutionDAO,PEOPLE,50490077,50490077.0,21152663.0,"Meme, Ethereum Ecosystem, PolitiFi"
EWT,energy-web-token,Energy Web,EWT,47874396,54574512.0,495705.0,"Energy, Polkadot Ecosystem, Gnosis Chain Ecosystem, Regenerative Finance (ReFi), Real World Assets (RWA), Blockchain Capital Portfolio, Hydration Ecosystem"
DORA,dora-2,DORA,DORA,46497067,46497067.0,387501.0,"BNB Chain Ecosystem, Meme, Binance Alpha Spotlight, Chinese Meme"
NOW,changenow,ChangeNOW,NOW,45749387,53391585.0,11260.9,"Decentralized Exchange (DEX), Exchange-based Tokens, BNB Chain Ecosystem, Ethereum Ecosystem"
CYBER,cyberconnect,CYBER,CYBER,43709025,88122382.0,12079600.0,"Artificial Intelligence (AI), Smart Contract Platform, SocialFi, NFT, BNB Chain Ecosystem, Binance Launchpool, Ethereum Ecosystem, Decentralized Identifier (DID), Optimism Ecosystem, Layer 2 (L2), Animoca Brands Portfolio, Multicoin Capital Portfolio, YZi Labs (Prev. Binance Labs) Portfolio, Delphi Ventures Portfolio, Cyber Ecosystem, Optimism Superchain Ecosystem, AI Applications, Governance"
WNXM,wrapped-nxm,Wrapped NXM,WNXM,40305962,40305962.0,26126.0,"Crypto-Backed Tokens, Decentralized Finance (DeFi), Insurance, Wrapped-Tokens, Ethereum Ecosystem, Blockchain Capital Portfolio"
ISLM,islamic-coin,Islamic Coin,ISLM,38779936,354234665.0,158421.0,"Smart Contract Platform, Wallets, Layer 2 (L2), Osmosis Ecosystem"
USTC,terrausd,TerraClassicUSD,USTC,37560520,40933982.0,3285523.0,"Stablecoins, USD Stablecoin, Seigniorage, Alleged SEC Securities, Osmosis Ecosystem, DeFiance Capital Portfolio, Terra Classic Ecosystem, YZi Labs (Prev. Binance Labs) Portfolio, Delphi Ventures Portfolio, Galaxy Digital Portfolio, Fiat-backed Stablecoin"
UNP,unipoly,Unipoly,UNP,37253458,133414954.0,300941.0,"Gaming (GameFi), Ethereum Ecosystem, Skale Ecosystem"
HBD,hive_dollar,Hive Dollar,HBD,34171632,34171808.0,3596.68,"Stablecoins, USD Stablecoin, Algorithmic Stablecoin"
PIVX,pivx,PIVX,PIVX,33400247,33400452.0,11589327.0,"Smart Contract Platform, Privacy, Masternodes, Zero Knowledge (ZK), Proof of Stake (PoS)"
