ALEX,alexgo,ALEX Lab,ALEX,13550790.0,15836229.0,832740.0,"Decentralized Finance (DeFi), Lending/Borrowing Protocols, Ethereum Ecosystem, DWF Labs Portfolio, Mode Ecosystem, Stacks Ecosystem, BTCfi Protocol"
DEXTF,dextf,Memento,DEXTF,12565687.0,19094689.0,275080.0,"Decentralized Finance (DeFi), Asset Manager, Avalanche Ecosystem, Ethereum Ecosystem, ZkSync Ecosystem, Real World Assets (RWA)"
BASEDAI,basedai,BasedAI,BASEDAI,12314802.0,12314802.0,104398.0,"Artificial Intelligence (AI), Ethereum Ecosystem, AI Agents"
CEEK,ceek,CEEK Smart VR,CEEK,11578045.0,11960792.0,473514.0,"Entertainment, BNB Chain Ecosystem, Metaverse, Ethereum Ecosystem, DWF Labs Portfolio"
SEDA,seda-2,SEDA,SEDA,11150816.0,31633964.0,972165.0,"Smart Contract Platform, Oracle, Ethereum Ecosystem, Base Ecosystem, Modular Blockchain, Osmosis Ecosystem"
YULI,yuli,YULI,YULI,10791506.0,10791506.0,288310.0,"Gaming (GameFi), NFT, Meme, Kaia Ecosystem, Card Games, Gaming Utility Token, Anime-Themed"
EOS,binance-peg-eos,Binance-Peg EOS,EOS,10638900.0,10638900.0,7084.63,"Smart Contract Platform, BNB Chain Ecosystem, Binance-Peg Tokens"
TKO,tokocrypto,Tokocrypto,TKO,9830248.0,65534987.0,2180721.0,"BNB Chain Ecosystem, Binance Launchpad, YZi Labs (Prev. Binance Labs) Portfolio"
TRIAS,trias-token,TriasLab,TRIAS,9711037.0,9711037.0,280893.0,"Artificial Intelligence (AI), Smart Contract Platform, BNB Chain Ecosystem, Layer 1 (L1), Ethereum Ecosystem, AI Agents"
KASTA,kasta,Kasta,KASTA,9058018.0,17799358.0,333225.0,Polygon Ecosystem
MLG,360noscope420blazeit,360noscope420blazeit,MLG,8724300.0,8724300.0,1409041.0,"Solana Ecosystem, Meme, Solana Meme"
XX,xxcoin,XX Network,XX,7772080.0,22399748.0,145092.0,"Smart Contract Platform, Layer 1 (L1), Ethereum Ecosystem"
MAVIA,heroes-of-mavia,Heroes of Mavia,MAVIA,7608068.0,36847088.0,3264274.0,"Gaming (GameFi), NFT, Ethereum Ecosystem, Animoca Brands Portfolio, Base Ecosystem, Gaming Governance Token, Strategy Games, Alameda Research Portfolio, YZi Labs (Prev. Binance Labs) Portfolio, Delphi Ventures Portfolio, Action Games"
FNCT,financie-token,Financie Token,FNCT,7536420.0,36982889.0,81851.0,Ethereum Ecosystem
GRAIL,camelot-token,Camelot Token,GRAIL,7370478.0,29480713.0,229655.0,"Decentralized Exchange (DEX), Arbitrum Ecosystem, Camelot Launchpad"
GLQ,graphlinq-protocol,GraphLinq Chain,GLQ,7322507.0,10768392.0,217759.0,"Artificial Intelligence (AI), Business Services, Infrastructure, Smart Contract Platform, Analytics, Layer 1 (L1), Ethereum Ecosystem, DWF Labs Portfolio"
ZYN,zyncoin-2,ZynCoin,ZYN,7137830.0,7137830.0,108013.0,"Solana Ecosystem, Meme, Ethereum Ecosystem, Parody Meme"
WEXO,wexo,Wexo,WEXO,6933485.0,18063325.0,171651.0,"Ethereum Ecosystem, Base Ecosystem"
PORTAL,portal-2,Portal,PORTAL,6045936.0,36174053.0,15704591.0,"Gaming (GameFi), Solana Ecosystem, Ethereum Ecosystem, Gaming Platform"
FLIX,omniflix-network,OmniFlix Network,FLIX,6033390.0,6697614.0,8681.47,"NFT, Osmosis Ecosystem, Archway Ecosystem"
GTAI,gt-protocol,GT Protocol,GTAI,5886880.0,10880949.0,2930067.0,"Artificial Intelligence (AI), BNB Chain Ecosystem, DeFAI"
TRADE,polytrade,Polytrade,TRADE,5866232.0,13739539.0,246948.0,"BNB Chain Ecosystem, Polygon Ecosystem, Arbitrum Ecosystem, Ethereum Ecosystem, Real World Assets (RWA), Base Ecosystem, DWF Labs Portfolio"
SRM,serum,Serum,SRM,5799460.0,17001642.0,283788.0,"Decentralized Exchange (DEX), Exchange-based Tokens, Decentralized Finance (DeFi), Solana Ecosystem, Ethereum Ecosystem, FTX Holdings, Multicoin Capital Portfolio, Energi Ecosystem, Viction Ecosystem"
OFN,openfabric,Openfabric AI,OFN,5676539.0,16233004.0,123423.0,"Artificial Intelligence (AI), BNB Chain Ecosystem, ChainGPT Launchpad, Poolz Finance Launchpad, AI Agents, AI Applications, AI Framework"
QORPO,qopro,QORPO WORLD,QORPO,5376018.0,9985714.0,2181844.0,"Gaming (GameFi), NFT, BNB Chain Ecosystem, Play To Earn, Ethereum Ecosystem, RPG, Gaming Utility Token, Adventure Games, Gaming Platform, Action Games"
PAIN,pain,Pain,PAIN,5373450.0,10746951.0,733947.0,"Solana Ecosystem, Meme, Solana Meme, 4chan-Themed"
CANTO,canto,CANTO,CANTO,4961334.0,8153843.0,391123.0,"Smart Contract Platform, Layer 1 (L1), Ethereum Ecosystem, Canto Ecosystem, Real World Assets (RWA), Osmosis Ecosystem, Parallelized EVM"
ARCA,arca,Legend of Arcadia,ARCA,4489519.0,21826972.0,191723.0,"Gaming (GameFi), Ethereum Ecosystem, RPG"
FUTURE,futurecoin,FutureCoin,FUTURE,4312867.0,13384577.0,456.51,BNB Chain Ecosystem
GENOME,genomesdao-genome,GenomesDAO GENOME,GENOME,4080638.0,4080638.0,41097.0,"Ethereum Ecosystem, Base Ecosystem, Decentralized Science (DeSci)"
POLYDOGE,polydoge,PolyDoge,POLYDOGE,3923612.0,3929150.0,321885.0,"NFT, Polygon Ecosystem, Meme, Dog-Themed"
WINR,winr-protocol,WINR Protocol,WINR,3922323.0,5242208.0,15886.56,"Gambling (GambleFi), Infrastructure, Smart Contract Platform, Solana Ecosystem, Arbitrum Ecosystem, Camelot Launchpad, Layer 3 (L3)"
SHIDO,shido-2,Shido Network,SHIDO,3642710.0,3642716.0,141831.0,"Ethereum Ecosystem, Osmosis Ecosystem, Shido Network Ecosystem"
IZI,izumi-finance,iZUMi Finance,IZI,3567698.0,9061971.0,344988.0,"Decentralized Exchange (DEX), Decentralized Finance (DeFi), Automated Market Maker (AMM), BNB Chain Ecosystem, Polygon Ecosystem, Arbitrum Ecosystem, Ethereum Ecosystem, ZkSync Ecosystem, Mantle Ecosystem, Linea Ecosystem, Base Ecosystem, Manta Network Ecosystem, Scroll Ecosystem"
L1,lamina1,Lamina1,L1,3273299.0,45776827.0,117314.0,"Smart Contract Platform, NFT, Metaverse, Layer 1 (L1), Avalanche Ecosystem, Made in USA"
SOLAMA,solama,Solama,SOLAMA,3265891.0,3265891.0,191076.0,"Gambling (GambleFi), Solana Ecosystem, Meme, Solana Meme"
GMM,gamium,Gamium,GMM,3122484.0,3188494.0,250120.0,"SocialFi, Gaming (GameFi), BNB Chain Ecosystem, Metaverse, DaoMaker Launchpad, Ethereum Ecosystem, Gaming Governance Token, Gaming Utility Token"
PHIL,phil,Phil,PHIL,2991589.0,2991589.0,1203275.0,"Meme, Ethereum Ecosystem"
FORWARD,forward,Forward,FORWARD,2798088.0,2801254.0,145587.0,"BNB Chain Ecosystem, Ethereum Ecosystem"
BAX,babb,BABB,BAX,2790125.0,2807673.0,28082.0,Ethereum Ecosystem
ETF500,elon-trump-fart,Elon Trump Fart,ETF500,2777845.0,2777845.0,186585.0,"Solana Ecosystem, Meme, Elon Musk-Inspired, Solana Meme, PolitiFi, Pump.fun Ecosystem, Stock market-themed"
MOVE,bluemove,BlueMove,MOVE,2690101.0,3710484.0,51447.0,"NFT, Aptos Ecosystem, Sui Ecosystem"
QBX,qbx,QBX,QBX,2480961.0,2480961.0,133609.0,Ethereum Ecosystem
SKOP,skull-of-pepe-token,Skull of Pepe Token,SKOP,2381454.0,2381454.0,328820.0,"Meme, Base Ecosystem, Frog-Themed, Base Meme, The Boy’s Club"
EGO,ego-ego,Ego Ego,EGO,2302427.0,4604859.0,41472.0,"SocialFi, Solana Ecosystem, Launchpad"
CDX,cod3x,Cod3x,CDX,2127060.0,2127060.0,6215.44,"Artificial Intelligence (AI), Solana Ecosystem, Base Ecosystem, AI Agent Launchpad, AI Framework, DeFAI"
STETH,staked-ether,Lido Staked Ether,STETH,22980963459.0,22980985175.0,21669552.0,"Decentralized Finance (DeFi), Liquid Staking Tokens, Ethereum Ecosystem, Liquid Staked ETH, Liquid Staking"
APT,aptos,Aptos,APT,2874677208.0,5151393073.0,184086742.0,"Smart Contract Platform, Layer 1 (L1), Aptos Ecosystem, FTX Holdings, Coinbase Ventures Portfolio, Multicoin Capital Portfolio, Proof of Stake (PoS), DragonFly Capital Portfolio, Andreessen Horowitz (a16z) Portfolio, YZi Labs (Prev. Binance Labs) Portfolio, GMCI Layer 1 Index, GMCI 30 Index, Circle Ventures Portfolio, GMCI Index, Made in USA"
SAROS,saros-finance,Saros,SAROS,566426960.0,2157817133.0,11508311.0,"Solana Ecosystem, Payment Solutions, Viction Ecosystem"
SYRUP,syrup,Maple Finance,SYRUP,497062721.0,552425441.0,115226777.0,"Decentralized Finance (DeFi), Yield Farming, Lending/Borrowing Protocols, Ethereum Ecosystem, Real World Assets (RWA), Base Ecosystem, Binance Alpha Spotlight"
KAITO,kaito,KAITO,KAITO,337546443.0,1398351201.0,107220538.0,"Artificial Intelligence (AI), Analytics, Base Ecosystem, Binance HODLer Airdrops, InfoFi"
TWT,trust-wallet-token,Trust Wallet,TWT,318404520.0,764201599.0,11368686.0,"BNB Chain Ecosystem, Wallets, Account Abstraction, Energi Ecosystem"
KSM,kusama,Kusama,KSM,248624538.0,248632257.0,14938618.0,"Smart Contract Platform, Polkadot Ecosystem, Proof of Stake (PoS), Pantera Capital Portfolio, Made in USA, Coinbase 50 Index, Hydration Ecosystem"
TFUEL,theta-fuel,Theta Fuel,TFUEL,227088995.0,227139626.0,4040958.0,"Smart Contract Platform, DePIN, Proof of Stake (PoS), Made in USA"
ZRO,layerzero,LayerZero,ZRO,212830818.0,1914758008.0,44301942.0,"Smart Contract Platform, BNB Chain Ecosystem, Avalanche Ecosystem, Polygon Ecosystem, Arbitrum Ecosystem, Ethereum Ecosystem, Optimism Ecosystem, Base Ecosystem, Multicoin Capital Portfolio, Layer 0 (L0), Cross-chain Communication, Circle Ventures Portfolio, Sequoia Capital Portfolio, OKX Ventures Portfolio"
TRIBE,tribe-2,Tribe,TRIBE,206368616.0,453541917.0,178854.0,"Decentralized Finance (DeFi), Ethereum Ecosystem, Stablecoin Protocol"
BLUR,blur,Blur,BLUR,190439133.0,240391742.0,24811245.0,"NFT, Ethereum Ecosystem, NFT Marketplace, FTX Holdings, NFTFi, eGirl Capital Portfolio, Paradigm Portfolio, GMCI DeFi Index, GMCI Index, Made in USA, Coinbase 50 Index"
QUBIC,qubic-network,Qubic,QUBIC,175471570.0,215681715.0,2916398.0,"Artificial Intelligence (AI), Smart Contract Platform, Layer 1 (L1), Proof of Work (PoW)"
YFI,yearn-finance,yearn.finance,YFI,174051823.0,188742128.0,18358217.0,"Decentralized Finance (DeFi), Yield Farming, Yield Aggregator, Yearn Ecosystem, Avalanche Ecosystem, Polygon Ecosystem, Near Protocol Ecosystem, Gnosis Chain Ecosystem, Fantom Ecosystem, Harmony Ecosystem, Arbitrum Ecosystem, Ethereum Ecosystem, Optimism Ecosystem, Base Ecosystem, Index Coop Defi Index, Alameda Research Portfolio, Energi Ecosystem, Sora Ecosystem, Huobi ECO Chain Ecosystem, Blockchain Capital Portfolio"
HOT,holotoken,Holo,HOT,158662187.0,158662187.0,8410364.0,"Smart Contract Platform, Storage, Harmony Ecosystem, Arbitrum Ecosystem, Ethereum Ecosystem, DePIN, Base Ecosystem, Energi Ecosystem, Sora Ecosystem, GMCI DePIN Index, GMCI Index"
ANKR,ankr,Ankr Network,ANKR,151700597.0,151700597.0,13060596.0,"BNB Chain Ecosystem, Avalanche Ecosystem, Polygon Ecosystem, Fantom Ecosystem, Arbitrum Ecosystem, Ethereum Ecosystem, Optimism Ecosystem, Liquid Staking Governance Tokens, Linea Ecosystem, DePIN, Scroll Ecosystem, Rollups-as-a-Service (RaaS), Blast Ecosystem, Mode Ecosystem, Pantera Capital Portfolio, Polygon zkEVM Ecosystem, YZi Labs (Prev. Binance Labs) Portfolio, Liquid Staking, Made in USA"
ONE,harmony,Harmony,ONE,150327941.0,150359472.0,15309099.0,"Smart Contract Platform, Layer 1 (L1), Harmony Ecosystem, Animoca Brands Portfolio, Binance Launchpad, YZi Labs (Prev. Binance Labs) Portfolio, Made in USA"
CSPR,casper-network,Casper Network,CSPR,148637473.0,153888370.0,5903970.0,"Smart Contract Platform, Layer 1 (L1), Real World Assets (RWA), Proof of Stake (PoS), GMCI Layer 1 Index, GMCI Index, Made in USA"
T,threshold-network-token,Threshold Network,T,142286784.0,156694358.0,8148516.0,"Decentralized Finance (DeFi), Solana Ecosystem, Ethereum Ecosystem, Optimism Ecosystem, Base Ecosystem, Cross-chain Communication, BTCfi Protocol"
SWFTC,swftcoin,SWFTCOIN,SWFTC,126815935.0,126815935.0,2875413.0,"Exchange-based Tokens, NFT, BNB Chain Ecosystem, Ethereum Ecosystem"
KMNO,kamino,Kamino,KMNO,117400708.0,566065847.0,21648216.0,"Decentralized Finance (DeFi), Lending/Borrowing Protocols, Solana Ecosystem, Binance Alpha Spotlight"
VVV,venice-token,Venice Token,VVV,108250478.0,252188069.0,16331029.0,"Artificial Intelligence (AI), Base Ecosystem, AI Agents, AI Applications, Made in USA"
MPLX,metaplex,Metaplex,MPLX,103363906.0,124999363.0,7147311.0,"Gaming (GameFi), NFT, Solana Ecosystem, Animoca Brands Portfolio, FTX Holdings, Multicoin Capital Portfolio, Alameda Research Portfolio"
XVS,venus,Venus,XVS,99224844.0,177199842.0,10240173.0,"Decentralized Finance (DeFi), Yield Farming, BNB Chain Ecosystem, Binance Launchpool, Lending/Borrowing Protocols, Arbitrum Ecosystem, Ethereum Ecosystem, Optimism Ecosystem, ZkSync Ecosystem, opBNB Ecosystem, Unichain Ecosystem"
ACH,alchemy-pay,Alchemy Pay,ACH,94428120.0,191007324.0,33996362.0,"BNB Chain Ecosystem, Ethereum Ecosystem, Payment Solutions, DWF Labs Portfolio"
PEOPLE,constitutiondao,ConstitutionDAO,PEOPLE,92837587.0,92837587.0,56661173.0,"Meme, Ethereum Ecosystem, PolitiFi"
SGB,songbird,Songbird,SGB,86797490.0,103000887.0,701163.0,Smart Contract Platform
PHA,pha,PHALA,PHA,86717244.0,108556489.0,18707382.0,"Artificial Intelligence (AI), Infrastructure, Smart Contract Platform, Oracle, Polkadot Ecosystem, Ethereum Ecosystem, Interoperability, Layer 2 (L2), Zero Knowledge (ZK), DePIN, DWF Labs Portfolio, Rollup, AI Agents, Sora Ecosystem, AI Framework, Made in USA"
NMD,nexusmind,NexusMind,NMD,85347159.0,832858346.0,139385.0,"SocialFi, BNB Chain Ecosystem"
CETUS,cetus-protocol,Cetus Protocol,CETUS,79422946.0,98255191.0,26817870.0,"Decentralized Exchange (DEX), Decentralized Finance (DeFi), Sui Ecosystem, Animoca Brands Portfolio, OKX Ventures Portfolio, Dex Aggregator"
BLAST,blast,Blast,BLAST,75847424.0,255518787.0,8199496.0,"Smart Contract Platform, Layer 2 (L2), eGirl Capital Portfolio, Paradigm Portfolio, Blast Ecosystem"
GLMR,moonbeam,Moonbeam,GLMR,73385600.0,87763778.0,6031447.0,"Smart Contract Platform, Polkadot Ecosystem, Layer 1 (L1), Coinbase Ventures Portfolio, Proof of Stake (PoS), YZi Labs (Prev. Binance Labs) Portfolio"
WILD,wilder-world,Wilder World,WILD,58572848.0,90300024.0,959397.0,"Gaming (GameFi), NFT, Metaverse, Solana Ecosystem, Play To Earn, Ethereum Ecosystem, Animoca Brands Portfolio, Gaming Governance Token, Racing Games, Simulation Games, Action Games"
SFUND,seedify-fund,Seedify.fund,SFUND,52567319.0,82701337.0,5615435.0,"Gaming (GameFi), BNB Chain Ecosystem, Launchpad, Arbitrum Ecosystem, Ethereum Ecosystem, DWF Labs Portfolio"
RIF,rif-token,Rootstock Infrastructure Framework,RIF,50835355.0,50835355.0,2412809.0,"Rootstock Ecosystem, Outlier Ventures Portfolio"
C98,coin98,Coin98,C98,44539943.0,46062580.0,12001089.0,"Decentralized Finance (DeFi), BNB Chain Ecosystem, Solana Ecosystem, Wallets, Polygon Ecosystem, Ethereum Ecosystem, Binance Launchpad, DWF Labs Portfolio, Multicoin Capital Portfolio, Alameda Research Portfolio, Viction Ecosystem, YZi Labs (Prev. Binance Labs) Portfolio"
CCD,concordium,Concordium,CCD,42483881.0,51314826.0,405649.0,"Smart Contract Platform, Layer 1 (L1), Decentralized Identifier (DID), Zero Knowledge (ZK)"
LOFI,lofi-2,LOFI,LOFI,40807747.0,40807747.0,1796621.0,"Meme, Sui Ecosystem, Sui Meme"
DODO,dodo,DODO,DODO,39443802.0,39443802.0,8586256.0,"Decentralized Exchange (DEX), Exchange-based Tokens, Decentralized Finance (DeFi), BNB Chain Ecosystem, Binance Launchpool, Polygon Ecosystem, Near Protocol Ecosystem, Arbitrum Ecosystem, Ethereum Ecosystem, DWF Labs Portfolio, Coinbase Ventures Portfolio, Alameda Research Portfolio, DeFiance Capital Portfolio, Pantera Capital Portfolio, Aurora Ecosystem, Energi Ecosystem, YZi Labs (Prev. Binance Labs) Portfolio, Galaxy Digital Portfolio"
MNSRY,mansory-token,Mansory Token,MNSRY,39348757.0,39348757.0,1299031.0,"Retail, BNB Chain Ecosystem, Solana Ecosystem, Real World Assets (RWA), Pump.fun Ecosystem"
WNXM,wrapped-nxm,Wrapped NXM,WNXM,38537878.0,38527769.0,218417.0,"Crypto-Backed Tokens, Decentralized Finance (DeFi), Insurance, Wrapped-Tokens, Ethereum Ecosystem, Blockchain Capital Portfolio"
EDU,edu-coin,Open Campus,EDU,36434238.0,140075564.0,10930866.0,"Education, BNB Chain Ecosystem, Polygon Ecosystem, Ethereum Ecosystem, Binance Launchpad, YZi Labs (Prev. Binance Labs) Portfolio"
STORJ,storj,Storj,STORJ,36074893.0,106628434.0,14440135.0,"Storage, Harmony Ecosystem, Ethereum Ecosystem, DePIN, Energi Ecosystem"
HSK,hashkey-ecopoints,HashKey Platform Token,HSK,35942805.0,271266455.0,1990970.0,"Exchange-based Tokens, Centralized Exchange (CEX) Token, Ethereum Ecosystem"
PNG,pangolin,Pangolin,PNG,31443428.0,76762988.0,725878.0,"Decentralized Exchange (DEX), Decentralized Finance (DeFi), Avalanche Ecosystem, Olympus Pro Ecosystem"
M87,messier,MESSIER,M87,31291893.0,31291893.0,836056.0,"Decentralized Finance (DeFi), Ethereum Ecosystem"
AVA,ava-ai,Ava AI,AVA,28191209.0,28191209.0,11187805.0,"Artificial Intelligence (AI), Solana Ecosystem, Meme, Solana Meme, AI Meme, AI Agents, Pump.fun Ecosystem, Binance Alpha Spotlight, Made in USA"
FORTH,ampleforth-governance-token,Ampleforth Governance,FORTH,28142600.0,37586355.0,1999699.0,"Ethereum Ecosystem, Stablecoin Protocol"
CWEB,coinweb,Coinweb,CWEB,26358878.0,32967311.0,271267.0,"Smart Contract Platform, Wallets, Ethereum Ecosystem, Interoperability, Layer 2 (L2), Cross-chain Communication, Bitcoin Sidechains, SideChain"
NEON,neon,Neon,NEON,25989719.0,108532218.0,804120.0,"Smart Contract Platform, Solana Ecosystem, Neon Ecosystem, Parallelized EVM"
LAT,platon-network,PlatON Network,LAT,24068697.0,37378883.0,4401901.0,"Smart Contract Platform, Appchains"
PHB,phoenix-global,Phoenix,PHB,23315421.0,23315421.0,8041726.0,"Artificial Intelligence (AI), Oracle, NFT, BNB Chain Ecosystem, DePIN, Made in China"
PIKA,pikaboss,Pikaboss,PIKA,22534964.0,22534964.0,12884.64,"Meme, Ethereum Ecosystem"
SIGMA,sigma,Sigma,SIGMA,21438732.0,21438732.0,9677408.0,"Solana Ecosystem, Meme, Solana Meme, Pump.fun Ecosystem, 4chan-Themed"
MMUI,metamui,MetaMUI,MMUI,21304620.0,35786386.0,269013.0,Avalanche Ecosystem
DYDX,dydx,dYdX,ETHDYDX,21091620.0,451623350.0,31588830.0,"Decentralized Exchange (DEX), Exchange-based Tokens, Decentralized Finance (DeFi), Derivatives, Perpetuals, Ethereum Ecosystem, Paradigm Portfolio"
BEL,bella-protocol,Bella Protocol,BEL,20633426.0,25791783.0,6759847.0,"Decentralized Finance (DeFi), Yield Farming, BNB Chain Ecosystem, Binance Launchpool, Yield Aggregator, Ethereum Ecosystem, Manta Network Ecosystem, YZi Labs (Prev. Binance Labs) Portfolio"
D,dar-open-network,Dar Open Network,D,20052542.0,24944365.0,3572965.0,"Artificial Intelligence (AI), Gaming (GameFi), BNB Chain Ecosystem, Binance Launchpool, Play To Earn, Ethereum Ecosystem, Animoca Brands Portfolio, AI Agents"
GHST,aavegotchi,Aavegotchi,GHST,19012895.0,19604037.0,4889557.0,"Smart Contract Platform, Gaming (GameFi), NFT, Metaverse, Collectibles, Polygon Ecosystem, Meme, Play To Earn, Ethereum Ecosystem, Gotchiverse, Base Ecosystem, Layer 3 (L3), RPG, Gaming Governance Token, Gaming Utility Token, Energi Ecosystem"
QUICK,quick,Quickswap [OLD],QUICK,18570973.0,24634549.0,42278.0,"Decentralized Exchange (DEX), Exchange-based Tokens, Decentralized Finance (DeFi), Yield Farming, Automated Market Maker (AMM), Polygon Ecosystem, Ethereum Ecosystem"
VARA,vara-network,Vara Network,VARA,18079964.0,55151392.0,343682.0,"Smart Contract Platform, Layer 1 (L1)"
BENJI,basenji,Basenji,BENJI,17899341.0,17899341.0,1730569.0,"Meme, Base Ecosystem, Dog-Themed, Base Meme"
FIS,stafi,Stafi,FIS,15372781.0,15372781.0,5198905.0,"Decentralized Finance (DeFi), Ethereum Ecosystem, Liquid Staking Governance Tokens, Osmosis Ecosystem, Sora Ecosystem, Liquid Staking"
MASK,catwifmask,catwifmask,MASK,15328181.0,15328181.0,12199085.0,"Solana Ecosystem, Meme, Solana Meme, Cat-Themed, Pump.fun Ecosystem"
ELX,elixir-finance,Elixir,ELX,13141250.0,82308141.0,11723251.0,"Decentralized Finance (DeFi), Ethereum Ecosystem, Real World Assets (RWA), Stablecoin Protocol, RWA Protocol"
THE,thena,Thena,THE,12554309.0,58668089.0,18322921.0,"Decentralized Exchange (DEX), Decentralized Finance (DeFi), BNB Chain Ecosystem, opBNB Ecosystem, Binance HODLer Airdrops"
PIVX,pivx,PIVX,PIVX,11614506.0,11614506.0,2339550.0,"Smart Contract Platform, Privacy, Masternodes, Zero Knowledge (ZK), Proof of Stake (PoS)"
ROOT,the-root-network,The Root Network,ROOT,11446179.0,60319516.0,3682908.0,"Smart Contract Platform, Gaming (GameFi), Layer 1 (L1), Ethereum Ecosystem, Gaming Blockchains, Outlier Ventures Portfolio"
KOMA,koma-inu,Koma Inu,KOMA,10869700.0,10869700.0,6127742.0,"BNB Chain Ecosystem, Meme, Dog-Themed, Binance Alpha Spotlight, Made in USA"
BOTIFY,botify,BOTIFY,BOTIFY,9996497.0,9996497.0,1730644.0,"Artificial Intelligence (AI), Retail, Solana Ecosystem, E-commerce"
NIBI,nibiru,Nibiru,NIBI,9983276.0,13482547.0,942789.0,"Infrastructure, Smart Contract Platform, Layer 1 (L1), Osmosis Ecosystem, Made in USA"
MSM,musmecoin,MusmeCoin,MSM,9206080.0,17703950.0,38953.0,"Meme, Ethereum Ecosystem, Anime-Themed, Oasys Ecosystem"
CSWAP,chainswap-3,ChainSwap,CSWAP,9169763.0,9621281.0,24188.0,"Decentralized Exchange (DEX), Decentralized Finance (DeFi), Ethereum Ecosystem, Cross-chain Communication"
STNK,stonks-4,Stonks,STNK,9050085.0,9050085.0,226583.0,"Solana Ecosystem, Meme, Solana Meme, Wall Street Bets Themed, Stock market-themed"
XSWAP,xswap-2,XSwap,XSWAP,8986858.0,13662956.0,316132.0,"Decentralized Finance (DeFi), Ethereum Ecosystem, Base Ecosystem, Cross-chain Communication"
BR,bedrock-token,Bedrock,BR,8888542.0,42326388.0,4725641.0,"Decentralized Finance (DeFi), BNB Chain Ecosystem, Liquid Staking Governance Tokens, Berachain Ecosystem, BTCfi Protocol, Binance Wallet IDO"
SNAI,swarmnode-ai,SwarmNode.ai,SNAI,8562448.0,9487596.0,2136390.0,"Artificial Intelligence (AI), Infrastructure, Solana Ecosystem, Pump.fun Ecosystem, AI Agent Launchpad, Binance Alpha Spotlight, AI Framework, DeFAI"
HDRO,hydro-protocol-2,Hydro Protocol,HDRO,8069123.0,23786244.0,112080.0,Injective Ecosystem
EVR,evernode,Evernode,EVR,7727540.0,15436574.0,2931.4,"Smart Contract Platform, Layer 2 (L2), DePIN"
MODE,mode,Mode,MODE,7505376.0,27807587.0,2576087.0,"Artificial Intelligence (AI), Infrastructure, Smart Contract Platform, Layer 2 (L2), Mode Ecosystem, Optimism Superchain Ecosystem, DeFAI"
OIK,space-nation-oikos,Space Nation Oikos,OIK,7478156.0,45106192.0,440131.0,"Gaming (GameFi), NFT, BNB Chain Ecosystem, Immutable zkEVM Ecosystem, RPG, MMO"
ULTI,ultiverse,Ultiverse,ULTI,7365030.0,18381933.0,3427494.0,"Gaming (GameFi), BNB Chain Ecosystem, Ethereum Ecosystem, Animoca Brands Portfolio"
AGRI,agridex-governance-token,AgriDex,AGRI,7104138.0,31233741.0,558352.0,"Tokenized Assets, Solana Ecosystem, Real World Assets (RWA), Tokenized Commodities"
DINERO,dinero-2,Dinero,DINERO,6836923.0,11216872.0,36833.0,"Infrastructure, Decentralized Finance (DeFi), Lending/Borrowing Protocols, Ethereum Ecosystem, Metagovernance, Liquid Staking Governance Tokens, LSDFi, Curve Ecosystem, Liquid Staking"
CLY,colony,Colony,CLY,6597071.0,8782009.0,110036.0,Avalanche Ecosystem
DCK,dexcheck,DexCheck AI,DCK,6224335.0,8479887.0,439110.0,"Artificial Intelligence (AI), Analytics, BNB Chain Ecosystem, Launchpad, Ethereum Ecosystem, ChainGPT Launchpad, Poolz Finance Launchpad, AI Agents, DeFAI, InfoFi"
3ULL,playa3ull-games-2,PLAYA3ULL GAMES,3ULL,5739838.0,5782713.0,661745.0,"Smart Contract Platform, Gaming (GameFi), NFT, Avalanche Ecosystem, Play To Earn, Shooting Games, Avalanche L1, MMO"
LUCE,offcial-mascot-of-the-holy-year,Luce,LUCE,5665205.0,5665205.0,5102518.0,"Solana Ecosystem, Meme, Solana Meme, Pump.fun Ecosystem, Mascot-Themed, Binance Alpha Spotlight"
REDO,resistance-dog,Resistance Dog,REDO,5645135.0,5645135.0,890919.0,"Meme, Dog-Themed, TON Ecosystem, TON Meme"
CATE,catecoin,CateCoin,CATE,5519300.0,5754111.0,318505.0,"Entertainment, Gaming (GameFi), Yield Farming, NFT, BNB Chain Ecosystem, Yield Aggregator, Launchpad, Wallets, Meme, Play To Earn, Ethereum Ecosystem, Base Ecosystem, Cat-Themed"
DOLAN,dolan-duck,Dolan Duck,DOLAN,5320008.0,5320008.0,263322.0,"Solana Ecosystem, Meme, Solana Meme, Parody Meme, 4chan-Themed"
CPH,cypherium,Cypherium,CPH,5045081.0,63712226.0,5860.26,"Smart Contract Platform, Layer 1 (L1), Proof of Work (PoW), Pantera Capital Portfolio"
STAT,stat,STAT,STAT,4787741.0,6543018.0,935356.0,"Media, Ethereum Ecosystem"
TREAT,shiba-inu-treat,Shiba Inu Treat,TREAT,4776189.0,22198044.0,5474032.0,"Meme, Ethereum Ecosystem, Dog-Themed"
DROP,drop-2,DROP,DROP,4451465.0,4451465.0,124295.0,"Meme, XRP Ledger Ecosystem"
XEL,xelis,Xelis,XEL,4101580.0,4101580.0,103001.0,"Smart Contract Platform, Privacy, Layer 1 (L1), Directed Acyclic Graph (DAG)"
U,u-coin,U Coin,U,3986001.0,3986001.0,237238.0,"BNB Chain Ecosystem, Polygon Ecosystem, Arbitrum Ecosystem, Ethereum Ecosystem"
YFII,yfii-finance,DFI.money,YFII,3963160.0,3989881.0,260247.0,"Decentralized Finance (DeFi), Yield Farming, Yield Aggregator, Ethereum Ecosystem, Energi Ecosystem"
LANDSHARE,landshare,Landshare,LAND,3743758.0,3757725.0,207104.0,"Tokenized Real Estate, Tokenized Assets, BNB Chain Ecosystem, Polygon Ecosystem, Arbitrum Ecosystem, Real World Assets (RWA)"
ORBT,orbitt-pro,Orbitt Token,ORBT,3687156.0,4935978.0,302651.0,"Solana Ecosystem, Telegram Apps"
NHT,neighbourhoods,Neighbourhoods,NHT,3683523.0,3995014.0,59825.0,"Polygon Ecosystem, Ethereum Ecosystem"
KAS,kaspa,Kaspa,KAS,2085116848.0,2085325046.0,68740400.0,"Smart Contract Platform, Layer 1 (L1), Proof of Work (PoW), Kaspa Ecosystem, Made in USA, Directed Acyclic Graph (DAG)"
VET,vechain,VeChain,VET,1924906455.0,1924906455.0,55110885.0,"Internet of Things (IOT), Smart Contract Platform, Layer 1 (L1), VeChain Ecosystem, Made in China"
BONK,bonk,Bonk,BONK,1104761987.0,1267188910.0,247929371.0,"BNB Chain Ecosystem, Solana Ecosystem, Polygon Ecosystem, Meme, Arbitrum Ecosystem, Ethereum Ecosystem, Aptos Ecosystem, Dog-Themed, Solana Meme, Neon Ecosystem, GMCI Meme Index, GMCI Index, Made in USA, Coinbase 50 Index, 4chan-Themed"
GALA,gala,GALA,GALA,673299911.0,673299911.0,149232342.0,"Smart Contract Platform, Gaming (GameFi), NFT, Layer 1 (L1), Play To Earn, Ethereum Ecosystem, DWF Labs Portfolio, Gaming Platform, YZi Labs (Prev. Binance Labs) Portfolio, GalaChain Ecosystem, Made in USA"
BSV,bitcoin-cash-sv,Bitcoin SV,BSV,590692841.0,590693212.0,33001015.0,"Smart Contract Platform, Bitcoin Fork, Proof of Work (PoW)"
FLOW,flow,Flow,FLOW,553975405.0,553975405.0,20153537.0,"Smart Contract Platform, Sports, NFT, Layer 1 (L1), Animoca Brands Portfolio, Alleged SEC Securities, Multicoin Capital Portfolio, Proof of Stake (PoS), Flow Ecosystem, Andreessen Horowitz (a16z) Portfolio"
