CHR,chromaway,Chromia,CHR,69619008.0,69619008.0,8266382.0,"Artificial Intelligence (AI), Smart Contract Platform, Gaming (GameFi), NFT, BNB Chain Ecosystem, Layer 1 (L1), Ethereum Ecosystem, Real World Assets (RWA), Modular Blockchain, Chromia Ecosystem, RWA Protocol"
ELON,dogelon-mars,Dogelon Mars,ELON,67067501.0,122018566.0,4901592.0,"BNB Chain Ecosystem, Solana Ecosystem, Polygon Ecosystem, Meme, Ethereum Ecosystem, Cronos Ecosystem, Dog-Themed, Elon Musk-Inspired, Fuse Ecosystem"
SOSO,sosovalue,SoSoValue,SOSO,65967692.0,572968247.0,3297637.0,"Index, Decentralized Finance (DeFi), Analytics, Ethereum Ecosystem, Base Ecosystem"
AERGO,aergo,Aergo,AERGO,56587563.0,59881020.0,24966980.0,"Smart Contract Platform, Ethereum Ecosystem, Sequoia Capital Portfolio"
GNS,gains-network,Gains Network,GNS,49804315.0,49804315.0,3505226.0,"Decentralized Finance (DeFi), Derivatives, Perpetuals, Polygon Ecosystem, Arbitrum Ecosystem, Base Ecosystem, ApeChain Ecosystem"
GEOD,geodnet,Geodnet,GEOD,47566358.0,148367502.0,553423.0,"Solana Ecosystem, Polygon Ecosystem, DePIN, Pantera Capital Portfolio"
HMSTR,hamster-kombat,Hamster Kombat,HMSTR,45306886.0,70379628.0,14980808.0,"Gaming (GameFi), Play To Earn, Telegram Apps, TON Ecosystem, Tap to Earn, Arcade Games"
CLANKER,tokenbot-2,tokenbot,CLANKER,42997657.0,42997657.0,4451123.0,"Artificial Intelligence (AI), Launchpad, Base Ecosystem, AI Applications, Clanker Ecosystem, Binance Alpha Spotlight"
LISTA,lista,Lista DAO,LISTA,42747760.0,247491869.0,12563573.0,"Decentralized Finance (DeFi), BNB Chain Ecosystem, Lending/Borrowing Protocols, Liquid Staking Tokens, Binance Megadrop, Liquid Staking"
SDEX,smardex,SMARDEX,SDEX,42059085.0,45625476.0,346001.0,"Decentralized Exchange (DEX), Decentralized Finance (DeFi), BNB Chain Ecosystem, Solana Ecosystem, Polygon Ecosystem, Arbitrum Ecosystem, Ethereum Ecosystem, Base Ecosystem"
SHELL,myshell,MyShell,SHELL,41108209.0,152252627.0,16508149.0,"Artificial Intelligence (AI), BNB Chain Ecosystem, Ethereum Ecosystem, DragonFly Capital Portfolio, YZi Labs (Prev. Binance Labs) Portfolio, Delphi Ventures Portfolio, OKX Ventures Portfolio, Binance HODLer Airdrops, AI Agent Launchpad, Binance Alpha Spotlight, AI Framework, Binance Wallet IDO"
MUBARAK,mubarak,Mubarak,MUBARAK,40157724.0,40157724.0,51446582.0,"BNB Chain Ecosystem, Meme"
DOGINME,doginme,doginme,DOGINME,34936674.0,34936674.0,3166922.0,"Meme, Base Ecosystem, Dog-Themed, Base Meme, Farcaster Ecosystem"
A8,ancient8,Ancient8,A8,31881801.0,106222991.0,7428244.0,"Smart Contract Platform, Gaming (GameFi), Play To Earn, Guild and Scholarship, Ethereum Ecosystem, Layer 2 (L2), Gaming Blockchains, Pantera Capital Portfolio, Ancient8 Ecosystem, Optimism Superchain Ecosystem"
SVL,slash-vision-labs,Slash Vision Labs,SVL,31639941.0,64053128.0,127343.0,"Mantle Ecosystem, Payment Solutions"
XION,xion-2,XION,XION,31495410.0,176627739.0,7086094.0,"Smart Contract Platform, Layer 1 (L1), Ethereum Ecosystem, Animoca Brands Portfolio, Base Ecosystem, Osmosis Ecosystem, Multicoin Capital Portfolio, Alameda Research Portfolio, DeFiance Capital Portfolio, Made in USA, Chain Abstraction"
ZETA,zeta,Zeta,ZEX,30450480.0,162168804.0,1854631.0,"Decentralized Finance (DeFi), Derivatives, Perpetuals, Solana Ecosystem"
ARRR,pirate-chain,Pirate Chain,ARRR,28343948.0,28890882.0,207196.0,"Smart Contract Platform, Privacy, Zero Knowledge (ZK), Proof of Work (PoW)"
TLM,alien-worlds,Alien Worlds,TLM,25965717.0,29896631.0,6447409.0,"Gaming (GameFi), NFT, BNB Chain Ecosystem, Binance Launchpool, Play To Earn, Ethereum Ecosystem, Animoca Brands Portfolio, Card Games, Gaming Governance Token, YZi Labs (Prev. Binance Labs) Portfolio, Wax Ecosystem, MMO"
BERT,bertram-the-pomeranian,Bertram The Pomeranian,BERT,24763962.0,24763962.0,2154973.0,"Solana Ecosystem, Meme, Dog-Themed, Solana Meme, Pump.fun Ecosystem"
SANTOS,santos-fc-fan-token,Santos FC Fan Token,SANTOS,21661478.0,56282773.0,2821637.0,"Sports, BNB Chain Ecosystem, Binance Launchpool, Fan Token"
MLN,melon,Enzyme,MLN,21388409.0,21388409.0,3554503.0,"Decentralized Finance (DeFi), Asset Manager, Polygon Ecosystem, Arbitrum Ecosystem, Ethereum Ecosystem, Real World Assets (RWA), DeFiance Capital Portfolio"
ARPA,arpa,ARPA,ARPA,20799707.0,42354397.0,146646659.0,"BNB Chain Ecosystem, Polygon Ecosystem, Ethereum Ecosystem, Animoca Brands Portfolio, DWF Labs Portfolio, YZi Labs (Prev. Binance Labs) Portfolio"
NKN,nkn,NKN,NKN,19317784.0,19321661.0,4227305.0,"Communication, Ethereum Ecosystem, DePIN"
IDEX,aurora-dao,IDEX,IDEX,18550708.0,19466076.0,5405157.0,"Decentralized Exchange (DEX), Exchange-based Tokens, Index, Decentralized Finance (DeFi), Perpetuals, Polygon Ecosystem, Ethereum Ecosystem, Made in USA"
FLM,flamingo-finance,Flamingo Finance,FLM,18522464.0,18522464.0,5409210.0,"Decentralized Exchange (DEX), Exchange-based Tokens, Decentralized Finance (DeFi), Yield Farming, Binance Launchpool, YZi Labs (Prev. Binance Labs) Portfolio, NEO Ecosystem"
OG,og-fan-token,OG Fan Token,OG,17612713.0,20479898.0,6217790.0,"Entertainment, Sports, Binance Launchpool, Fan Token, Chiliz Ecosystem, YZi Labs (Prev. Binance Labs) Portfolio"
KLV,klever,Klever,KLV,17057573.0,17057573.0,403495.0,"Smart Contract Platform, Layer 1 (L1), Proof of Stake (PoS)"
PSG,paris-saint-germain-fan-token,Paris Saint-Germain Fan Token,PSG,14210983.0,28965632.0,2706174.0,"Sports, Binance Launchpool, Fan Token, Chiliz Ecosystem, YZi Labs (Prev. Binance Labs) Portfolio"
WEFI,wefi,WeFi,WFI,12935389.0,413872657.0,746985.0,BNB Chain Ecosystem
ALEPH,aleph,Aleph Cloud,ALEPH,12006745.0,32201417.0,2812729.0,"Artificial Intelligence (AI), Infrastructure, Storage, BNB Chain Ecosystem, Avalanche Ecosystem, Ethereum Ecosystem, DePIN, Base Ecosystem, FTX Holdings, Alameda Research Portfolio"
COPI,cornucopias,Cornucopias,COPI,11884069.0,44199117.0,316436.0,"Gaming (GameFi), NFT, BNB Chain Ecosystem, Metaverse, Play To Earn, Cardano Ecosystem, Ethereum Ecosystem, Base Ecosystem, Gaming Governance Token, Gaming Utility Token, MMO"
G7,game7,Game7,G7,9784420.0,43279428.0,187447.0,"Gaming (GameFi), Arbitrum Ecosystem, Ethereum Ecosystem, Gaming Governance Token, Gaming Platform"
BZZ,swarm-bzz,Swarm,BZZ,9613182.0,9613182.0,401150.0,"Storage, Gnosis Chain Ecosystem, Ethereum Ecosystem, DePIN"
CERE,cere-network,Cere Network,CERE,9391682.0,14148580.0,302337.0,"Artificial Intelligence (AI), Storage, SocialFi, Gaming (GameFi), DaoMaker Launchpad, Ethereum Ecosystem, DePIN, YZi Labs (Prev. Binance Labs) Portfolio, OKX Ventures Portfolio, Made in USA"
HAI,hackenai,Hacken,HAI,9027031.0,10829881.0,203773.0,"Business Services, BNB Chain Ecosystem, Ethereum Ecosystem, Base Ecosystem, Cybersecurity, VeChain Ecosystem"
KARATE,karate-combat,Karate Combat,KARATE,8929667.0,14737751.0,124025.0,"Sports, Gaming (GameFi), Ethereum Ecosystem, Hedera Ecosystem, Sports Games, Fighting Games, Delphi Ventures Portfolio"
IRON,iron-fish,Iron Fish,IRON,8722069.0,8722491.0,66594.0,"Smart Contract Platform, Zero Knowledge (ZK), Proof of Work (PoW), Andreessen Horowitz (a16z) Portfolio, Sequoia Capital Portfolio, Privacy Blockchain"
ZTX,ztx,ZTX,ZTX,8599425.0,20450719.0,283948.0,Arbitrum Ecosystem
SQGROW,squidgrow-2,SquidGrow,SQGROW,8151006.0,8151006.0,131195.0,"Meme, Ethereum Ecosystem"
ALPINE,alpine-f1-team-fan-token,Alpine F1 Team Fan Token,ALPINE,7953117.0,28003933.0,1488284.0,"BNB Chain Ecosystem, Binance Launchpad"
PROS,prosper,Prosper [OLD],PROS,7830730.0,15236419.0,262.33,"Decentralized Finance (DeFi), BNB Chain Ecosystem, Polygon Ecosystem, Ethereum Ecosystem"
MFER,mfercoin,mfercoin,MFER,7817848.0,7817848.0,890042.0,"Meme, Base Ecosystem, Base Meme"
PRQ,parsiq,PARSIQ,PRQ,7536512.0,7987019.0,6206.36,"Business Services, Infrastructure, Smart Contract Platform, Analytics, BNB Chain Ecosystem, Ethereum Ecosystem, YZi Labs (Prev. Binance Labs) Portfolio"
HOLDSTATION,holdstation,Holdstation,HOLD,7317507.0,27774994.0,205249.0,"Artificial Intelligence (AI), Wallets, ZkSync Ecosystem, Account Abstraction, Berachain Ecosystem, AI Agent Launchpad"
ASTO,altered-state-token,Altered State Machine,ASTO,6709195.0,19477398.0,708444.0,"Artificial Intelligence (AI), Gaming (GameFi), NFT, Metaverse, Ethereum Ecosystem, Animoca Brands Portfolio, Coinbase Ventures Portfolio, Gaming Governance Token, Gaming Utility Token, AI Agents, Delphi Ventures Portfolio, AI Applications, Outlier Ventures Portfolio"
CAPTAINBNB,captainbnb,CaptainBNB,CAPTAINBNB,6483371.0,6483371.0,586201.0,"BNB Chain Ecosystem, Four.meme Ecosystem"
BLOK,bloktopia,Bloktopia,BLOK,6443038.0,19930733.0,284539.0,"BNB Chain Ecosystem, Metaverse, Polygon Ecosystem, Arbitrum Ecosystem"
OSOL,osol,OSOL,OSOL,6121669.0,6121669.0,239710.0,"Index, Solana Ecosystem"
KATA,katana-inu,Katana Inu,KATA,5871375.0,7758996.0,174567.0,"Gaming (GameFi), NFT, BNB Chain Ecosystem, Metaverse, Meme, Play To Earn, Ethereum Ecosystem, Base Ecosystem, Gaming Utility Token, Fighting Games, Action Games"
FITFI,step-app-fitfi,Step App,FITFI,5789777.0,6785471.0,2118357.0,"Sports, Gaming (GameFi), Yield Farming, NFT, BNB Chain Ecosystem, Avalanche Ecosystem, DaoMaker Launchpad, Play To Earn, Move To Earn, Step Network Ecosystem, Gaming Governance Token, Sports Games"
PINGO,pingo,PinGo,PINGO,5376415.0,56262187.0,70161.0,"DePIN, TON Ecosystem"
LKY,luckycoin,Luckycoin,LKY,5284822.0,5286275.0,192627.0,"Smart Contract Platform, Layer 1 (L1), Meme, Proof of Work (PoW)"
BNC,bifrost-native-coin,Bifrost,BNC,5275118.0,9443284.0,2986059.0,"Smart Contract Platform, Decentralized Finance (DeFi), Polkadot Ecosystem, Yield Farming, Derivatives, Lending/Borrowing Protocols, Layer 1 (L1), Liquid Staking Governance Tokens, DWF Labs Portfolio, Yield Optimizer, Liquid Staking"
TMAI,token-metrics-ai,Token Metrics AI,TMAI,5262614.0,7265822.0,384139.0,"Artificial Intelligence (AI), Analytics, Meme, Base Ecosystem, AI Agents, DeFAI, Made in USA"
JYAI,jerry-the-turtle-by-matt-furie,Jerry The Turtle By Matt Furie,JYAI,4941202.0,4941202.0,3085282.0,"Meme, Ethereum Ecosystem"
LQR,laqira-protocol,Laqira Protocol,LQR,4851403.0,136853605.0,330538.0,BNB Chain Ecosystem
NPCS,npc-on-solana,NPC On Solana,NPCS,4841191.0,4841191.0,241391.0,"Solana Ecosystem, Meme, Solana Meme"
NAVI,atlas-navi,Atlas Navi,NAVI,4401566.0,8165833.0,83299.0,"Artificial Intelligence (AI), NFT, DaoMaker Launchpad, Ethereum Ecosystem"
GENE,genopets,Genopets,GENE,4286826.0,5318679.0,24228.0,"Gaming (GameFi), NFT, BNB Chain Ecosystem, Solana Ecosystem, Play To Earn, Move To Earn, Animoca Brands Portfolio, RPG, Gaming Governance Token, Alameda Research Portfolio, Pantera Capital Portfolio, Action Games"
ELYS,elys-network,Elys,ELYS,4020863.0,14157375.0,207564.0,"Decentralized Exchange (DEX), Smart Contract Platform, Decentralized Finance (DeFi), Layer 1 (L1)"
EDEN,eden,EDEN,EDEN,3933356.0,4135197.0,93079.0,"MEV Protection, Ethereum Ecosystem, Account Abstraction, Multicoin Capital Portfolio, Alameda Research Portfolio, DeFiance Capital Portfolio"
HNS,handshake,Handshake,HNS,3872561.0,3872914.0,123830.0,"Infrastructure, Smart Contract Platform, NFT, Ethereum Ecosystem, DePIN, Multicoin Capital Portfolio, Proof of Work (PoW), Pantera Capital Portfolio, Andreessen Horowitz (a16z) Portfolio, Sequoia Capital Portfolio, Name Service, Made in USA"
CRAI,cryptify-ai,Cryptify AI,CRAI,3872207.0,3872207.0,132569.0,Ethereum Ecosystem
ARTY,artyfact,Artyfact,ARTY,3840797.0,4252167.0,1345835.0,"Artificial Intelligence (AI), Gaming (GameFi), NFT, BNB Chain Ecosystem, Metaverse, Shooting Games, Gaming Governance Token, Action Games"
DCB,decubate,Decubate,DCB,3669353.0,9703090.0,218324.0,"Infrastructure, Software as a service, BNB Chain Ecosystem, Launchpad"
HEU,heurist,Heurist,HEU,3601407.0,22184147.0,144278.0,"Artificial Intelligence (AI), Ethereum Ecosystem, ZkSync Ecosystem, DePIN, Base Ecosystem, AI Agents, AI Framework, Made in USA"
MILLI,milli-coin,MILLI,MILLI,3581244.0,3581244.0,252559.0,"Meme, Dog-Themed, Sei Network Ecosystem"
LINK,chainlink,Chainlink,LINK,9332112334.0,13762148268.0,397267834.0,"Business Services, Infrastructure, Smart Contract Platform, Decentralized Finance (DeFi), Oracle, BNB Chain Ecosystem, Solana Ecosystem, Avalanche Ecosystem, Polygon Ecosystem, Near Protocol Ecosystem, Gnosis Chain Ecosystem, Fantom Ecosystem, Harmony Ecosystem, Arbitrum Ecosystem, Ethereum Ecosystem, Optimism Ecosystem, Real World Assets (RWA), Base Ecosystem, Osmosis Ecosystem, Cross-chain Communication, Energi Ecosystem, Sora Ecosystem, Huobi ECO Chain Ecosystem, Milkomeda (Cardano) Ecosystem, GMCI DeFi Index, GMCI 30 Index, GMCI Index, World Liberty Financial Portfolio, Made in USA, Coinbase 50 Index, Chain Abstraction, Hydration Ecosystem"
XLM,stellar,Stellar,XLM,7444571367.0,11913072001.0,172618865.0,"Smart Contract Platform, Real World Assets (RWA), Stellar Ecosystem, GMCI 30 Index, GMCI Index, Made in USA, Coinbase 50 Index"
AAVE,aave,Aave,AAVE,4217195901.0,4446842064.0,458857583.0,"Decentralized Finance (DeFi), Yield Farming, BNB Chain Ecosystem, Lending/Borrowing Protocols, Avalanche Ecosystem, Polygon Ecosystem, Near Protocol Ecosystem, Fantom Ecosystem, Harmony Ecosystem, Arbitrum Ecosystem, Ethereum Ecosystem, Optimism Ecosystem, Base Ecosystem, Index Coop Defi Index, Energi Ecosystem, Sora Ecosystem, Huobi ECO Chain Ecosystem, GMCI DeFi Index, Blockchain Capital Portfolio, GMCI Index, World Liberty Financial Portfolio, Coinbase 50 Index, Hydration Ecosystem"
ETC,ethereum-classic,Ethereum Classic,ETC,2607114959.0,2607124181.0,54350708.0,"Smart Contract Platform, Layer 1 (L1), Proof of Work (PoW), Coinbase 50 Index"
ARB,arbitrum,Arbitrum,ARB,1751170007.0,3528281140.0,489423924.0,"Smart Contract Platform, Arbitrum Ecosystem, Ethereum Ecosystem, Arbitrum Nova Ecosystem, Layer 2 (L2), eGirl Capital Portfolio, Rollup, Alameda Research Portfolio, Pantera Capital Portfolio, GMCI Layer 2 Index, GMCI 30 Index, GMCI Index, Polychain Capital Portfolio, Made in USA"
WLD,worldcoin-wld,Worldcoin,WLD,1613259486.0,9529671766.0,188628520.0,"Smart Contract Platform, Ethereum Ecosystem, Decentralized Identifier (DID), Optimism Ecosystem, Coinbase Ventures Portfolio, Multicoin Capital Portfolio, Andreessen Horowitz (a16z) Portfolio, Blockchain Capital Portfolio, Optimism Superchain Ecosystem, World Chain Ecosystem, Made in USA"
SPX,spx6900,SPX6900,SPX,1195904025.0,1195904025.0,88616890.0,"Solana Ecosystem, Meme, Ethereum Ecosystem, Base Ecosystem, Bridged-Tokens, Murad Picks, Stock market-themed, 4chan-Themed"
FLR,flare-networks,Flare,FLR,1165106903.0,1785461430.0,5778369.0,"Smart Contract Platform, Layer 1 (L1), DWF Labs Portfolio"
GRT,the-graph,The Graph,GRT,866056924.0,947184086.0,31378370.0,"Artificial Intelligence (AI), Business Services, Infrastructure, Smart Contract Platform, Analytics, Avalanche Ecosystem, Polygon Ecosystem, Near Protocol Ecosystem, Harmony Ecosystem, Arbitrum Ecosystem, Ethereum Ecosystem, DePIN, Coinbase Ventures Portfolio, Multicoin Capital Portfolio, Proof of Stake (PoS), Energi Ecosystem, Sora Ecosystem, Made in USA, Coinbase 50 Index"
CAKE,pancakeswap-token,PancakeSwap,CAKE,759977571.0,869733621.0,62398808.0,"Decentralized Exchange (DEX), Exchange-based Tokens, Decentralized Finance (DeFi), Yield Farming, Automated Market Maker (AMM), BNB Chain Ecosystem, Arbitrum Ecosystem, Ethereum Ecosystem, Aptos Ecosystem, ZkSync Ecosystem, Linea Ecosystem, Base Ecosystem, Polygon zkEVM Ecosystem, YZi Labs (Prev. Binance Labs) Portfolio, opBNB Ecosystem, GMCI DeFi Index, GMCI Index"
ENS,ethereum-name-service,Ethereum Name Service,ENS,643387038.0,1939923678.0,50476824.0,"NFT, Ethereum Ecosystem, Decentralized Identifier (DID), Name Service"
WAL,walrus-2,Walrus,WAL,578735135.0,2095600974.0,27866859.0,"Infrastructure, Storage, Sui Ecosystem"
CTC,creditcoin-2,Creditcoin,CTC,274276448.0,362148007.0,8089783.0,"Smart Contract Platform, Layer 1 (L1), Ethereum Ecosystem, Real World Assets (RWA), DWF Labs Portfolio, Proof of Stake (PoS), Made in USA"
BABYDOGE,baby-doge-coin,Baby Doge Coin,BABYDOGE,198195596.0,494515380.0,11196247.0,"Gaming (GameFi), BNB Chain Ecosystem, Solana Ecosystem, Meme, Ethereum Ecosystem, Dog-Themed, Solana Meme, Gaming Utility Token"
BAT,basic-attention-token,Basic Attention,BAT,195474431.0,196040550.0,12384962.0,"Solana Ecosystem, Avalanche Ecosystem, Polygon Ecosystem, Near Protocol Ecosystem, Harmony Ecosystem, Ethereum Ecosystem, Pantera Capital Portfolio, Energi Ecosystem, Made in USA"
CVX,convex-finance,Convex Finance,CVX,194797711.0,237361493.0,9950195.0,"Decentralized Finance (DeFi), Yield Farming, Yield Aggregator, Ethereum Ecosystem, Metagovernance, Curve Ecosystem, Yield Optimizer"
NOT,notcoin,Notcoin,NOT,192696102.0,192696102.0,20784639.0,"Gaming (GameFi), Binance Launchpool, Meme, Play To Earn, TON Ecosystem, TON Meme, Tap to Earn"
WEMIX,wemix-token,WEMIX,WEMIX,182763995.0,219193913.0,2725586.0,"Smart Contract Platform, Gaming (GameFi), NFT, Layer 1 (L1), Play To Earn, Gaming Blockchains, WEMIX Ecosystem"
ORDI,ordinals,ORDI,ORDI,166772774.0,166772774.0,47441894.0,"Solana Ecosystem, BRC-20, Bitcoin Ecosystem, Inscriptions"
MOODENG,moo-deng,Moo Deng,MOODENG,161011524.0,161011524.0,89480216.0,"Solana Ecosystem, Meme, Solana Meme, Pump.fun Ecosystem, Zoo-Themed, Binance Alpha Spotlight, TikTok Meme"
TRAC,origintrail,OriginTrail,TRAC,159968916.0,160113993.0,2811168.0,"Artificial Intelligence (AI), Polkadot Ecosystem, Metaverse, Ethereum Ecosystem, Interoperability, Real World Assets (RWA), DePIN, Decentralized Science (DeSci), AI Agents"
BANANAS31,banana-for-scale-2,Banana For Scale,BANANAS31,138296164.0,138296164.0,68739045.0,"BNB Chain Ecosystem, Meme, Binance Alpha Spotlight"
UXLINK,uxlink,UXLINK,UXLINK,131101693.0,320575952.0,17214518.0,"SocialFi, Arbitrum Ecosystem"
ORCA,orca,Orca,ORCA,120209620.0,150368500.0,17219812.0,"Decentralized Exchange (DEX), Decentralized Finance (DeFi), Yield Farming, Automated Market Maker (AMM), Solana Ecosystem, Coinbase Ventures Portfolio, DeFiance Capital Portfolio, Made in USA"
ILV,illuvium,Illuvium,ILV,103452187.0,104797306.0,9548649.0,"Gaming (GameFi), NFT, Metaverse, Play To Earn, Ethereum Ecosystem, Animoca Brands Portfolio, RPG, Gaming Governance Token, Adventure Games, Energi Ecosystem, Delphi Ventures Portfolio"
IOST,iostoken,IOST,IOST,89427252.0,89427252.0,6520006.0,"Smart Contract Platform, Proof of Stake (PoS), Sequoia Capital Portfolio"
AEVO,aevo-exchange,Aevo,AEVO,78246396.0,86246366.0,10362401.0,"Smart Contract Platform, Decentralized Finance (DeFi), Binance Launchpool, Derivatives, Perpetuals, Ethereum Ecosystem, Layer 2 (L2), DragonFly Capital Portfolio, Pantera Capital Portfolio"
USUAL,usual,Usual,USUAL,72418421.0,81666888.0,38408007.0,"Decentralized Finance (DeFi), BNB Chain Ecosystem, Ethereum Ecosystem, Real World Assets (RWA), Base Ecosystem, Coinbase Ventures Portfolio, Stablecoin Protocol, YZi Labs (Prev. Binance Labs) Portfolio, Galaxy Digital Portfolio"
CBK,cobak-token,Cobak,CBK,71547138.0,75212185.0,46707425.0,"Polygon Ecosystem, Ethereum Ecosystem, DWF Labs Portfolio"
QRL,quantum-resistant-ledger,Quantum Resistant Ledger,QRL,70753088.0,70753088.0,102352.0,"Smart Contract Platform, Proof of Work (PoW)"
BGSC,bugscoin,BugsCoin,BGSC,70467275.0,179414302.0,26492399.0,"Retail, BNB Chain Ecosystem, Binance Alpha Spotlight"
SOLV,solv-protocol,Solv Protocol,SOLV,67419710.0,381981358.0,8753978.0,"BNB Chain Ecosystem, Binance Megadrop, BTCfi Protocol"
SAGA,saga-2,Saga,SAGA,59416598.0,235587465.0,16149849.0,"Artificial Intelligence (AI), Infrastructure, Smart Contract Platform, Binance Launchpool, Layer 1 (L1), Modular Blockchain, Appchains, Saga Ecosystem"
HEART,humans-ai,Humans.ai,HEART,52928585.0,52928585.0,385831.0,"Artificial Intelligence (AI), Smart Contract Platform, Layer 1 (L1), Ethereum Ecosystem, Osmosis Ecosystem, AI Agents, AI Agent Launchpad"
USDM,mountain-protocol-usdm,Mountain Protocol USD,USDM,47851627.0,47851627.0,245435.0,"Stablecoins, Polygon Ecosystem, Arbitrum Ecosystem, Ethereum Ecosystem, Optimism Ecosystem, ZkSync Ecosystem, Base Ecosystem, Fiat-backed Stablecoin"
BBT,babyboomtoken,BabyBoomToken,BBT,47401496.0,412898962.0,1340490.0,"Healthcare, Marketing, BNB Chain Ecosystem"
OLAS,autonolas,Autonolas,OLAS,46032617.0,120966768.0,521506.0,"Artificial Intelligence (AI), Solana Ecosystem, Polygon Ecosystem, Gnosis Chain Ecosystem, Arbitrum Ecosystem, Celo Ecosystem, Ethereum Ecosystem, Optimism Ecosystem, Base Ecosystem, AI Agents, Mode Ecosystem, AI Agent Launchpad, Binance Alpha Spotlight, AI Framework, DeFAI"
BC,bc-token,BCGame Coin,BC,43300753.0,43300753.0,44304.0,"Gambling (GambleFi), Solana Ecosystem"
RARE,superrare,SuperRare,RARE,42352447.0,51699095.0,10189621.0,"NFT, Ethereum Ecosystem"
OFT,onfa,ONFA,OFT,41709444.0,102991077.0,3137353.0,"Software as a service, BNB Chain Ecosystem"
DEP,deapcoin,DEAPCOIN,DEP,37387480.0,40601857.0,1707111.0,"Entertainment, Gaming (GameFi), NFT, BNB Chain Ecosystem, Solana Ecosystem, Avalanche Ecosystem, Play To Earn, Ethereum Ecosystem, Gaming Platform"
ALPH,alephium,Alephium,ALPH,37204696.0,68302976.0,344945.0,"Smart Contract Platform, BNB Chain Ecosystem, Layer 1 (L1), Wallets, Ethereum Ecosystem, Alephium Ecosystem, Proof of Work (PoW)"
SUPRA,supra,Supra,SUPRA,35776934.0,190446981.0,2315341.0,"Infrastructure, Smart Contract Platform, Oracle, Layer 1 (L1), Animoca Brands Portfolio, Coinbase Ventures Portfolio, Cross-chain Communication, DeFAI, Made in USA, Supra Ecosystem"
AIAT,ai-analysis-token,AI Analysis Token,AIAT,35082288.0,158962590.0,95556.0,Ethereum Ecosystem
SLERF,slerf,Slerf,SLERF,34567385.0,34567385.0,5440039.0,"Solana Ecosystem, Meme, Solana Meme"
LADYS,milady-meme-coin,Milady Meme Coin,LADYS,34028369.0,34028369.0,5582610.0,"Meme, Arbitrum Ecosystem, Ethereum Ecosystem, DWF Labs Portfolio, 4chan-Themed"
PROMPT,wayfinder,Wayfinder,PROMPT,31469037.0,140549328.0,53767663.0,"Artificial Intelligence (AI), Base Ecosystem, AI Agents, DeFAI"
RAD,radicle,Radworks,RAD,31367605.0,62949466.0,8330980.0,"Infrastructure, Ethereum Ecosystem, DePIN, Galaxy Digital Portfolio"
ARC,ai-rig-complex,AI Rig Complex,ARC,30788751.0,30788751.0,7664149.0,"Artificial Intelligence (AI), Infrastructure, Solana Ecosystem, AI Agents, Pump.fun Ecosystem, AI Agent Launchpad, Binance Alpha Spotlight, AI Framework"
AUKI,auki-labs,AUKI,AUKI,30045624.0,135034510.0,85035.0,"Artificial Intelligence (AI), DePIN, Base Ecosystem, Outlier Ventures Portfolio"
MIGGLES,mister-miggles,Mr. Miggles,MIGGLES,28283770.0,28283770.0,2941390.0,"Meme, Base Ecosystem, Cat-Themed, Base Meme, Made in USA"
SDL,stake-link,stake.link,SDL,28178657.0,48540316.0,5217.95,"Ethereum Ecosystem, Liquid Staking"
FARTCOIN,based-fartcoin,Based Fartcoin,FARTCOIN,26855619.0,26855619.0,336227.0,"Meme, Base Ecosystem, Base Meme"
BXN,bxn,BXN,BXN,24569490.0,79060699.0,1079134.0,"Smart Contract Platform, Layer 1 (L1)"
PYR,vulcan-forged,Vulcan Forged,PYR,22369044.0,46801667.0,5878119.0,"Gaming (GameFi), NFT, Metaverse, Polygon Ecosystem, Ethereum Ecosystem, DWF Labs Portfolio, Gaming Blockchains, Gaming Platform, Action Games, MMO"
GFAL,games-for-a-living,Games for a Living,GFAL,18018301.0,34298252.0,109367.0,"Gaming (GameFi), NFT, BNB Chain Ecosystem, Play To Earn"
POLS,polkastarter,Polkastarter,POLS,17402086.0,17540722.0,1596646.0,"Decentralized Finance (DeFi), BNB Chain Ecosystem, Launchpad, Ethereum Ecosystem"
STO,stakestone,StakeStone,STO,16409889.0,72824951.0,13455176.0,"Decentralized Finance (DeFi), BNB Chain Ecosystem, Ethereum Ecosystem, Binance Wallet IDO"
GUN,gunz,Gunz,GUN,16254242.0,268887372.0,40043635.0,"Smart Contract Platform, Gaming (GameFi), Layer 1 (L1), Play To Earn, Shooting Games, Coinbase Ventures Portfolio, Gaming Blockchains, YZi Labs (Prev. Binance Labs) Portfolio, Delphi Ventures Portfolio, Action Games"
AMO,amo,AMO Coin,AMO,15632814.0,15632814.0,431111.0,"Big Data, Kaia Ecosystem"
ZCX,unizen,Unizen,ZCX,15535847.0,23399637.0,676944.0,"Decentralized Exchange (DEX), Exchange-based Tokens, Decentralized Finance (DeFi), Polygon Ecosystem, Ethereum Ecosystem, DWF Labs Portfolio"
KIBSHI,kiboshib,KiboShib,KIBSHI,15304383.0,15304383.0,461529.0,"Solana Ecosystem, Meme, Arbitrum Ecosystem, Ethereum Ecosystem, Base Ecosystem, Dog-Themed, AI Meme"
CLEAR,everclear,Everclear,CLEAR,14713012.0,35478986.0,89978.0,"Infrastructure, BNB Chain Ecosystem, Polygon Ecosystem, Gnosis Chain Ecosystem, Arbitrum Ecosystem, Ethereum Ecosystem, Optimism Ecosystem, Coinbase Ventures Portfolio, Cross-chain Communication, Chain Abstraction"
ZND,znd-token,ZND Token,ZND,14710907.0,80345128.0,5477651.0,"Centralized Exchange (CEX) Token, Ethereum Ecosystem"
DOLO,dolomite,Dolomite,DOLO,14654126.0,40515260.0,3947380.0,"Decentralized Exchange (DEX), Decentralized Finance (DeFi), Automated Market Maker (AMM), Lending/Borrowing Protocols, Ethereum Ecosystem, Coinbase Ventures Portfolio, Venture Capital Portfolios, Dex Aggregator"
COCA,coca,COCA,COCA,14486525.0,127443692.0,363836.0,"Wallets, Polygon Ecosystem, Payment Solutions"
WUF,wuffi,WUFFI,WUF,14219655.0,14219655.0,63205.0,"Solana Ecosystem, Meme, Base Ecosystem"
SEAM,seamless-protocol,Seamless Protocol,SEAM,13952750.0,36166016.0,246979.0,"Decentralized Finance (DeFi), Lending/Borrowing Protocols, Ethereum Ecosystem, Base Ecosystem"
RBNT,redbelly-network-token,Redbelly Network,RBNT,13716155.0,134487913.0,1464688.0,"Smart Contract Platform, Layer 1 (L1), Ethereum Ecosystem, Real World Assets (RWA), Redbelly Network Ecosystem"
REEF,reef,Reef,REEF,13605169.0,13605281.0,1737135.0,"BNB Chain Ecosystem, Binance Launchpool, Harmony Ecosystem, Ethereum Ecosystem, Alameda Research Portfolio, Energi Ecosystem, Sora Ecosystem, YZi Labs (Prev. Binance Labs) Portfolio, GMCI Layer 1 Index, GMCI Index"
BKN,brickken,Brickken,BKN,13166303.0,26364614.0,369003.0,"Tokenized Real Estate, Tokenized Assets, BNB Chain Ecosystem, Impossible Finance Launchpad, Ethereum Ecosystem, Real World Assets (RWA), RWA Protocol"
