KRL,kryll,KRYLL,KRL,12499956.0,15500074.0,139772.0,"Artificial Intelligence (AI), Decentralized Finance (DeFi), Analytics, Arbitrum Ecosystem, Ethereum Ecosystem, Optimism Ecosystem, Base Ecosystem, AI Applications"
BAR,fc-barcelona-fan-token,FC Barcelona Fan Token,BAR,11845861.0,41395013.0,2475572.0,"Sports, Fan Token, Binance Launchpad, Chiliz Ecosystem"
BTY,bityuan,Bityuan,BTY,10768918.0,10769007.0,271253.0,
MINIMA,minima,Minima,MINIMA,10157141.0,20066236.0,183313.0,"Smart Contract Platform, Layer 1 (L1), DePIN"
PAID,paid-network,PAID,PAID,9757374.0,11554093.0,13721.46,"Launchpad, Base Ecosystem"
RWA,allo,Allo,RWA,9572257.0,53179205.0,6192844.0,"BNB Chain Ecosystem, Real World Assets (RWA), RWA Protocol"
BCUT,bitscrunch-token,bitsCrunch Token,BCUT,9414812.0,18004477.0,1523731.0,"Artificial Intelligence (AI), Infrastructure, Analytics, NFT, Polygon Ecosystem, Ethereum Ecosystem, Animoca Brands Portfolio, Coinbase Ventures Portfolio"
LAZIO,lazio-fan-token,Lazio Fan Token,LAZIO,8734885.0,29304518.0,6863635.0,"Sports, BNB Chain Ecosystem, Fan Token, Binance Launchpad"
STOS,stratos,Stratos,STOS,8560879.0,12619860.0,214359.0,"Entertainment, Infrastructure, Smart Contract Platform, Storage, Layer 1 (L1), Ethereum Ecosystem, DePIN, Osmosis Ecosystem"
TRUF,truflation,TRUF.Network,TRUF,7474323.0,21648653.0,395101.0,"Infrastructure, Oracle, Arbitrum Ecosystem, Ethereum Ecosystem, Real World Assets (RWA), Base Ecosystem, Coinbase Ventures Portfolio"
SCF,smoking-chicken-fish,Smoking Chicken Fish,SCF,7319568.0,7319568.0,945744.0,"Solana Ecosystem, Meme, Solana Meme, Pump.fun Ecosystem"
RFC,retard-finder-coin,Retard Finder Coin,RFC,6655105.0,6921088.0,17413107.0,"Solana Ecosystem, Meme, Pump.fun Ecosystem, Wojak-Themed"
BAD,bad-idea-ai,Bad Idea AI,BAD,6240868.0,7738520.0,1156643.0,"Artificial Intelligence (AI), Meme, Ethereum Ecosystem, Telegram Apps, Discord Bots, Shibarium Ecosystem"
LNQ,linqai,LinqAI,LNQ,6177983.0,22093872.0,1283449.0,"Artificial Intelligence (AI), Ethereum Ecosystem"
BITBOARD,bitboard,BitBoard,BB,5753429.0,8696712.0,68584.0,"Smart Contract Platform, Polygon Ecosystem, Layer 2 (L2), Zero Knowledge (ZK)"
BST,blocksquare,Blocksquare,BST,5066078.0,5066078.0,113501.0,"Tokenized Real Estate, Tokenized Assets, Ethereum Ecosystem, Real World Assets (RWA)"
INTER,inter-milan-fan-token,Inter Milan Fan Token,INTER,4961113.0,4961113.0,333273.0,"Sports, Fan Token, Chiliz Ecosystem"
BILLY,billy,Billy,BILLY,4902952.0,4902952.0,2390976.0,"Solana Ecosystem, Meme, Dog-Themed, Solana Meme, Pump.fun Ecosystem"
GOGLZ,googles,GOGGLES,GOGLZ,4730233.0,4730233.0,563526.0,"Meme, Sonic Ecosystem"
KANGO,kango,KANGO,KANGO,4350043.0,4350043.0,177871.0,"Meme, Kaspa Ecosystem"
NC,nodecoin,Nodecoin,NC,4083472.0,21932127.0,2618781.0,"Artificial Intelligence (AI), Solana Ecosystem, DePIN"
NRG,energi,Energi,NRG,3977654.0,3977682.0,169985.0,"Smart Contract Platform, Masternodes, Layer 1 (L1), Ethereum Ecosystem, Proof of Stake (PoS), Energi Ecosystem"
HUAHUA,chihuahua-token,Chihuahua Chain,HUAHUA,3686550.0,3926945.0,592266.0,"Smart Contract Platform, NFT, Layer 1 (L1), Meme, Dog-Themed, Osmosis Ecosystem"
TSUKA,dejitaru-tsuka,Dejitaru Tsuka,TSUKA,3621097.0,3621097.0,84985.0,"Meme, Ethereum Ecosystem"
READY,ready,READY!,READY,3425344.0,3425344.0,100420.0,"Gaming (GameFi), Solana Ecosystem, Gaming Platform"
MCN,mcncoin,MCNCOIN,MCN,3418485.0,3418485.0,354112.0,BNB Chain Ecosystem
NWC,newscrypto-coin,Numerico,NWC,3385020.0,5765788.0,66446.0,"Education, Smart Contract Platform, BNB Chain Ecosystem, Ethereum Ecosystem, Layer 2 (L2), Stellar Ecosystem"
NETVR,netvrk,Netvrk,NETVR,3230768.0,3230768.0,219238.0,"Entertainment, Gaming (GameFi), NFT, Metaverse, Polygon Ecosystem, Ethereum Ecosystem, Shooting Games, Racing Games"
ZKP,panther,Panther Protocol,ZKP,3194924.0,3194924.0,451675.0,"Smart Contract Platform, Privacy, Polygon Ecosystem, Ethereum Ecosystem, Zero Knowledge (ZK)"
FET,fetch-ai,Artificial Superintelligence Alliance,FET,1876391329.0,1955290875.0,138061077.0,"Artificial Intelligence (AI), NFT, BNB Chain Ecosystem, Ethereum Ecosystem, Binance Launchpad, DWF Labs Portfolio, Osmosis Ecosystem, AI Agents, GMCI DePIN Index, GMCI Index, Outlier Ventures Portfolio, AI Agent Launchpad"
QNT,quant-network,Quant,QNT,1589351493.0,1596816987.0,24170770.0,"Ethereum Ecosystem, Real World Assets (RWA), Energi Ecosystem, Coinbase 50 Index"
DOGWIFHAT,dogwifcoin,dogwifhat,WIF,915898833.0,915898833.0,592884094.0,"Solana Ecosystem, Meme, Dog-Themed, Solana Meme, GMCI Meme Index, GMCI Index"
XAUT,tether-gold,Tether Gold,XAUT,824422359.0,824422359.0,34174669.0,"Stablecoins, Tokenized Assets, Tokenized Gold, Ethereum Ecosystem, Real World Assets (RWA), Tokenized Commodities"
PENDLE,pendle,Pendle,PENDLE,581807672.0,995025530.0,54282826.0,"Decentralized Exchange (DEX), Decentralized Finance (DeFi), Yield Farming, Automated Market Maker (AMM), BNB Chain Ecosystem, Derivatives, Lending/Borrowing Protocols, Arbitrum Ecosystem, Ethereum Ecosystem, Optimism Ecosystem, Fixed Interest, LSDFi, Base Ecosystem, Restaking, LRTfi, Liquid Restaking Governance Tokens, Yield Tokenization Protocol, YZi Labs (Prev. Binance Labs) Portfolio, GMCI DeFi Index, Sonic Ecosystem, Liquid Staking, GMCI Index, BTCfi Protocol"
KAVA,kava,Kava,KAVA,444145316.0,444145316.0,8910131.0,"Smart Contract Platform, Layer 1 (L1), Binance Launchpad, DWF Labs Portfolio, Osmosis Ecosystem, YZi Labs (Prev. Binance Labs) Portfolio, Made in USA"
RON,ronin,Ronin,RON,304824607.0,462388131.0,6123757.0,"Smart Contract Platform, Gaming (GameFi), NFT, Layer 1 (L1), Play To Earn, Zero Knowledge (ZK), FTX Holdings, Ronin Ecosystem, Gaming Blockchains, SideChain, Andreessen Horowitz (a16z) Portfolio, YZi Labs (Prev. Binance Labs) Portfolio"
ZBCN,zebec-network,Zebec Network,ZBCN,285363371.0,330634067.0,18348399.0,"Decentralized Finance (DeFi), Solana Ecosystem, Real World Assets (RWA), Payment Solutions, DePIN, Coinbase Ventures Portfolio, Alameda Research Portfolio, Circle Ventures Portfolio, OKX Ventures Portfolio, RWA Protocol, Made in USA"
ATH,aethir,Aethir,ATH,282399505.0,1198609828.0,33216217.0,"Solana Ecosystem, Arbitrum Ecosystem, Impossible Finance Launchpad, Ethereum Ecosystem, DePIN, Animoca Brands Portfolio"
PLUME,plume,Plume,PLUME,266776173.0,1049611172.0,72641949.0,"Smart Contract Platform, Layer 1 (L1), Ethereum Ecosystem, Real World Assets (RWA), RWA Protocol, Made in USA, Plume Network Ecosystem"
1INCH,1inch,1inch,1INCH,253534795.0,272818996.0,15795098.0,"Decentralized Exchange (DEX), Exchange-based Tokens, Decentralized Finance (DeFi), Automated Market Maker (AMM), BNB Chain Ecosystem, Avalanche Ecosystem, Polygon Ecosystem, Near Protocol Ecosystem, Harmony Ecosystem, Ethereum Ecosystem, FTX Holdings, Alameda Research Portfolio, DragonFly Capital Portfolio, Pantera Capital Portfolio, Energi Ecosystem, YZi Labs (Prev. Binance Labs) Portfolio, GMCI DeFi Index, Galaxy Digital Portfolio, Blockchain Capital Portfolio, Dex Aggregator, GMCI Index, Coinbase 50 Index"
SFP,safepal,SafePal,SFP,229521698.0,229521698.0,3720910.0,"BNB Chain Ecosystem, Wallets, Ethereum Ecosystem, Animoca Brands Portfolio, Binance Launchpad, Energi Ecosystem, YZi Labs (Prev. Binance Labs) Portfolio"
QTUM,qtum,Qtum,QTUM,215461303.0,219768112.0,20826053.0,"Smart Contract Platform, Proof of Stake (PoS), Made in China"
FLUID,instadapp,Fluid,FLUID,156854468.0,397736264.0,1300604.0,"Decentralized Finance (DeFi), Polygon Ecosystem, Ethereum Ecosystem, Base Ecosystem, Coinbase Ventures Portfolio, Pantera Capital Portfolio"
XCH,chia,Chia,XCH,146181435.0,329850569.0,6813205.0,"Smart Contract Platform, Layer 1 (L1), DePIN, Andreessen Horowitz (a16z) Portfolio, Made in USA"
ZANO,zano,Zano,ZANO,143999010.0,144079631.0,1771127.0,"Smart Contract Platform, Privacy, Layer 1 (L1), Proof of Stake (PoS), Proof of Work (PoW), Zano Ecosystem, Privacy Blockchain"
LQTY,liquity,Liquity,LQTY,125485582.0,128602482.0,27391845.0,"Decentralized Finance (DeFi), Lending/Borrowing Protocols, Arbitrum Ecosystem, Ethereum Ecosystem, Alameda Research Portfolio, Pantera Capital Portfolio"
PROM,prometeus,Prom,PROM,122351400.0,129055586.0,6915463.0,"Smart Contract Platform, BNB Chain Ecosystem, Ethereum Ecosystem, Layer 2 (L2)"
OSMO,osmosis,Osmosis,OSMO,107205249.0,145382314.0,7110188.0,"Decentralized Exchange (DEX), Decentralized Finance (DeFi), Automated Market Maker (AMM), Cosmos Ecosystem, Osmosis Ecosystem, Paradigm Portfolio, Proof of Stake (PoS), Evmos Ecosystem, Secret Ecosystem, GMCI DeFi Index, GMCI Index, Made in USA"
BIGTIME,big-time,Big Time,BIGTIME,102236707.0,267881493.0,19397640.0,"Gaming (GameFi), Play To Earn, Ethereum Ecosystem, RPG, Alameda Research Portfolio, Circle Ventures Portfolio, OKX Ventures Portfolio, MMO"
UMA,uma,UMA,UMA,99245548.0,141098552.0,6382838.0,"Business Services, Decentralized Finance (DeFi), Oracle, Derivatives, Synthetic Issuer, Avalanche Ecosystem, Ethereum Ecosystem, Blockchain Capital Portfolio, Synthetic, Made in USA"
WAVES,waves,Waves,WAVES,99040660.0,99040660.0,12176113.0,"Smart Contract Platform, DWF Labs Portfolio, Proof of Stake (PoS)"
XVG,verge,Verge,XVG,90689361.0,90870767.0,4176401.0,"Smart Contract Platform, Privacy, Proof of Work (PoW), Made in USA"
DAG,constellation-labs,Constellation,DAG,89416889.0,111285885.0,2478826.0,"Smart Contract Platform, Layer 1 (L1), Base Ecosystem, Layer 0 (L0), Made in USA, Directed Acyclic Graph (DAG)"
RED,redstone-oracles,RedStone,RED,87158334.0,311279766.0,14854050.0,"Infrastructure, Oracle, Ethereum Ecosystem"
FIDA,bonfida,Solana Name Service (prev. Bonfida),FIDA,86958567.0,87756141.0,76042549.0,"Big Data, Business Services, Infrastructure, Decentralized Finance (DeFi), Solana Ecosystem, FTX Holdings, DWF Labs Portfolio, Name Service"
MANTA,manta-network,Manta Network,MANTA,81947046.0,195693776.0,16363975.0,"Smart Contract Platform, Polkadot Ecosystem, Binance Launchpool, Layer 2 (L2), Manta Network Ecosystem, Multicoin Capital Portfolio, Alameda Research Portfolio, DeFiance Capital Portfolio, YZi Labs (Prev. Binance Labs) Portfolio"
XRD,radix,Radix,XRD,80598027.0,90176126.0,332003.0,"Smart Contract Platform, Layer 1 (L1), DWF Labs Portfolio, Radix Ecosystem"
DYM,dymension,Dymension,DYM,78548118.0,246529813.0,12797717.0,"Smart Contract Platform, Cosmos Ecosystem, Modular Blockchain, Osmosis Ecosystem, Rollups-as-a-Service (RaaS)"
AITECH,solidus-aitech,Solidus Ai Tech,AITECH,69468249.0,89502312.0,15858346.0,"Artificial Intelligence (AI), BNB Chain Ecosystem, Launchpad, Base Ecosystem, ChainGPT Launchpad, AI Agents, Binance Alpha Spotlight, DeFAI"
STEEM,steem,Steem,STEEM,69235258.0,69310786.0,11146297.0,SocialFi
SHX,stronghold-token,Stronghold,SHX,60335563.0,,850017.0,"Ethereum Ecosystem, Stellar Ecosystem, Made in USA"
WCT,connect-token-wct,WalletConnect Token,WCT,59634683.0,320271943.0,34250420.0,"Solana Ecosystem, Wallets, Ethereum Ecosystem, Optimism Ecosystem"
NIL,nillion,Nillion,NIL,57963478.0,297020129.0,10723630.0,"Infrastructure, Binance Launchpool"
PARTI,particle-network,Particle Network,PARTI,48524065.0,208257790.0,20723235.0,"Decentralized Finance (DeFi), BNB Chain Ecosystem, Layer 1 (L1), Base Ecosystem, Account Abstraction, Cross-chain Communication, Binance HODLer Airdrops, Chain Abstraction, Binance Wallet IDO"
SOON,soon-2,SOON,SOON,46318175.0,247823300.0,16909802.0,"Infrastructure, Smart Contract Platform, BNB Chain Ecosystem, Layer 2 (L2), Cross-chain Communication, Binance Alpha Spotlight"
SERAPH,seraph,Seraph,SERAPH,45388358.0,189510282.0,99950728.0,"Gaming (GameFi), BNB Chain Ecosystem, Play To Earn, Ethereum Ecosystem, RPG, Gaming Utility Token, Action Games"
MBL,moviebloc,MovieBloc,MBL,43694158.0,70603937.0,8061130.0,DWF Labs Portfolio
HASHAI,hashai,HashAI,HASHAI,42603719.0,45243285.0,451256.0,"Artificial Intelligence (AI), Ethereum Ecosystem, DePIN"
SAI,sai,Sai,SAI,36219375.0,36219375.0,5644.53,"Decentralized Finance (DeFi), Ethereum Ecosystem"
ANYONE,airtor-protocol,ANyONe Protocol,ANYONE,34704984.0,43415045.0,135576.0,"Smart Contract Platform, Ethereum Ecosystem, DePIN, Privacy Blockchain"
ZETA,zeta,Zeta,ZEX,31171004.0,166006063.0,2018327.0,"Decentralized Finance (DeFi), Derivatives, Perpetuals, Solana Ecosystem"
DAO,dao-maker,DAO Maker,DAO,30372611.0,33592088.0,3321258.0,"BNB Chain Ecosystem, Solana Ecosystem, Launchpad, DaoMaker Launchpad, Arbitrum Ecosystem, Ethereum Ecosystem, Step Network Ecosystem"
NFP,nfprompt-token,NFPrompt,NFP,27937048.0,59088959.0,7955835.0,"BNB Chain Ecosystem, Binance Launchpool, YZi Labs (Prev. Binance Labs) Portfolio"
OGY,origyn-foundation,ORIGYN,OGY,27458530.0,32818344.0,302641.0,"Internet Computer Ecosystem, Real World Assets (RWA), RWA Protocol"
SD,stader,Stader,SD,26865695.0,53131853.0,5105485.0,"BNB Chain Ecosystem, Polygon Ecosystem, Fantom Ecosystem, Ethereum Ecosystem, Liquid Staking Governance Tokens, Animoca Brands Portfolio, Coinbase Ventures Portfolio, Pantera Capital Portfolio, Liquid Staking, Binance Alpha Spotlight"
ZORA,zora,Zora,ZORA,26676324.0,84691341.0,21499530.0,"Infrastructure, Media, Smart Contract Platform, NFT, Layer 2 (L2), Base Ecosystem, Coinbase Ventures Portfolio, Zora Ecosystem"
NMT,netmind-token,NetMind Token,NMT,24967339.0,72113672.0,1501960.0,"Artificial Intelligence (AI), BNB Chain Ecosystem, Ethereum Ecosystem, DePIN, AI Agents"
REZ,renzo,Renzo,REZ,23453286.0,89122595.0,10774098.0,"Decentralized Finance (DeFi), Binance Launchpool, Ethereum Ecosystem, Base Ecosystem, Restaking, YZi Labs (Prev. Binance Labs) Portfolio, OKX Ventures Portfolio"
RIO,realio-network,Realio Network Token,RIO,21243563.0,21243801.0,1720633.0,"BNB Chain Ecosystem, Solana Ecosystem, Ethereum Ecosystem, Algorand Ecosystem, Real World Assets (RWA), Osmosis Ecosystem, Stellar Ecosystem, Made in USA"
NATIX,natix-network,NATIX Network,NATIX,21020743.0,98042776.0,390813.0,"Artificial Intelligence (AI), Internet of Things (IOT), Solana Ecosystem, DePIN"
PORT3,port3-network,Port3 Network,PORT3,20597611.0,41207814.0,3913736.0,"SocialFi, BNB Chain Ecosystem, Ethereum Ecosystem, Poolz Finance Launchpad"
BOOE,book-of-ethereum,Book of Ethereum,BOOE,20238017.0,20238017.0,377504.0,"Meme, Ethereum Ecosystem"
VIC,tomochain,Viction,VIC,19976184.0,34503449.0,1644977.0,"Smart Contract Platform, Masternodes, Layer 1 (L1), DWF Labs Portfolio"
FHE,mind-network,Mind Network,FHE,18941845.0,76071668.0,10705482.0,"Artificial Intelligence (AI), Smart Contract Platform, BNB Chain Ecosystem, Layer 2 (L2), Binance Wallet IDO"
RETARDIO,retardio,RETARDIO,RETARDIO,16786742.0,16786742.0,1109096.0,"NFT, Solana Ecosystem, Meme, Solana Meme, Murad Picks, 4chan-Themed"
HOPR,hopr,HOPR,HOPR,16530680.0,17331155.0,210550.0,"Privacy, Gnosis Chain Ecosystem, Ethereum Ecosystem, DePIN, YZi Labs (Prev. Binance Labs) Portfolio"
VSC,vyvo-smart-chain,Vyvo Smart Chain,VSC,16422490.0,70677630.0,154208.0,"Smart Contract Platform, BNB Chain Ecosystem, Polygon Ecosystem, Layer 2 (L2)"
BRISE,bitrise-token,Bitgert,BRISE,15838028.0,17093874.0,3065147.0,"Smart Contract Platform, BNB Chain Ecosystem, Solana Ecosystem, Ethereum Ecosystem, Bitgert Ecosystem"
VOW,vow,Vow,VOW,15738451.0,51514675.0,370170.0,"Retail, Tourism, BNB Chain Ecosystem, Ethereum Ecosystem"
REI,rei-network,REI Network,REI,15456912.0,15808715.0,4039919.0,"Smart Contract Platform, Layer 1 (L1)"
WEPE,wall-street-pepe,Wall Street Pepe,WEPE,15364501.0,15364501.0,2684878.0,"Meme, Ethereum Ecosystem, Frog-Themed, The Boys Club"
MFT,mainframe,Mainframe,MFT,14065480.0,14984713.0,86.2,"Ethereum Ecosystem, Energi Ecosystem"
VINU,vita-inu,Vita Inu,VINU,13999331.0,13999331.0,2251763.0,"BNB Chain Ecosystem, Meme, Dog-Themed, DWF Labs Portfolio, Binance Alpha Spotlight"
LOOKS,looksrare,LooksRare,LOOKS,13578090.0,13578090.0,5850576.0,"NFT, Ethereum Ecosystem, NFT Marketplace"
NUM,numbers-protocol,Numbers Protocol,NUM,13384118.0,13552329.0,1629199.0,"Artificial Intelligence (AI), Smart Contract Platform, BNB Chain Ecosystem, DaoMaker Launchpad, Ethereum Ecosystem, Avalanche L1, YZi Labs (Prev. Binance Labs) Portfolio, Outlier Ventures Portfolio"
LOCK,houdini-swap,Houdini Swap,LOCK,12726342.0,12726342.0,4885.38,"Privacy, Solana Ecosystem, Ethereum Ecosystem"
LINGO,lingo,Lingo,LINGO,12141592.0,12141775.0,537032.0,"Solana Ecosystem, Real World Assets (RWA), Base Ecosystem, RWA Protocol"
SUKU,suku,SUKU,SUKU,12077637.0,39235406.0,351986.0,"Polygon Ecosystem, Ethereum Ecosystem, Made in USA"
MEMEFI,memefi-2,MemeFi,MEMEFI,11696075.0,11696075.0,7073408.0,"Gaming (GameFi), NFT, Meme, Play To Earn, Sui Ecosystem, Telegram Apps, Tap to Earn, Sui Meme, Action Games"
DIONE,dione,Dione,DIONE,11096089.0,13091763.0,199054.0,"Energy, Smart Contract Platform, Layer 1 (L1), Made in USA"
MLC,my-lovely-coin,My Lovely Coin,MLC,10818022.0,48567218.0,355276.0,"Charity, Gaming (GameFi), Polygon Ecosystem, Gaming Utility Token"
EPT,balance,Balance,EPT,10389835.0,44849820.0,8688251.0,"Gaming (GameFi), BNB Chain Ecosystem, Animoca Brands Portfolio, DWF Labs Portfolio, AI Agents, Andreessen Horowitz (a16z) Portfolio, AI Agent Launchpad"
LEVER,lever,LeverFi,LEVER,10346438.0,10346661.0,18077757.0,"Decentralized Finance (DeFi), Ethereum Ecosystem, DWF Labs Portfolio, Alameda Research Portfolio"
PROPS,propbase,Propbase,PROPS,9540846.0,27305247.0,2754032.0,"Tokenized Real Estate, Tokenized Assets, Aptos Ecosystem, Real World Assets (RWA), Base Ecosystem, RWA Protocol"
MCB,mcdex,MUX Protocol,MCB,8912064.0,11255407.0,3500.66,"Decentralized Exchange (DEX), Exchange-based Tokens, Decentralized Finance (DeFi), BNB Chain Ecosystem, Derivatives, Perpetuals, Arbitrum Ecosystem, Ethereum Ecosystem, Multicoin Capital Portfolio, Alameda Research Portfolio, DeFiance Capital Portfolio, Delphi Ventures Portfolio, OKX Ventures Portfolio"
SIDUS,sidus,Sidus,SIDUS,8297315.0,14167846.0,483120.0,"Gaming (GameFi), NFT, BNB Chain Ecosystem, Metaverse, Play To Earn, Ethereum Ecosystem, Linea Ecosystem, Animoca Brands Portfolio, Base Ecosystem, RPG, Gaming Governance Token, Alameda Research Portfolio, OKX Ventures Portfolio"
OX,ox-fun,OX Coin,OX,7519432.0,7515493.0,375750.0,"BNB Chain Ecosystem, Derivatives, Perpetuals, Solana Ecosystem, Avalanche Ecosystem, Polygon Ecosystem, Arbitrum Ecosystem, Ethereum Ecosystem, Base Ecosystem, Blast Ecosystem"
AEROBUD,aerobud,AEROBUD,AEROBUD,7466443.0,7466443.0,150987.0,"Charity, Meme, Base Ecosystem, Dog-Themed, Base Meme, Made in USA"
K,kinto,Kinto,K,6616958.0,35859409.0,431072.0,"Decentralized Finance (DeFi), Wallets"
JUNO,juno-network,JUNO,JUNO,6563784.0,8720478.0,64737.0,"Smart Contract Platform, Cosmos Ecosystem, Osmosis Ecosystem, Juno Ecosystem, Evmos Ecosystem, Secret Ecosystem"
RLY,rally-2,Rally,RLY,6357724.0,19027913.0,96731.0,"SocialFi, Yield Farming, Ethereum Ecosystem, Alleged SEC Securities, Coinbase Ventures Portfolio, Andreessen Horowitz (a16z) Portfolio"
PMT,public-meme-token,Public Masterpiece Token,PMT,5757995.0,22719155.0,267257.0,BNB Chain Ecosystem
BEAM,beam,BEAM,BEAM,5490589.0,7874593.0,442532.0,"Smart Contract Platform, Privacy, Ethereum Ecosystem, Proof of Work (PoW), BeamPrivacy Ecosystem, Privacy Blockchain"
OBT,oobit,Oobit,OBT,4706207.0,13368984.0,63098.0,"BNB Chain Ecosystem, Ethereum Ecosystem, Payment Solutions"
KILO,kiloex,KiloEx,KILO,4648168.0,21956391.0,4091116.0,"Decentralized Exchange (DEX), Decentralized Finance (DeFi), BNB Chain Ecosystem, Derivatives, Binance Wallet IDO"
AZIT,azit,azit,AZIT,4627290.0,6807619.0,178518.0,Kaia Ecosystem
PEAR,pear-protocol,Pear Protocol,PEAR,4574621.0,15363094.0,25410.0,"Decentralized Exchange (DEX), Decentralized Finance (DeFi), Perpetuals, Arbitrum Ecosystem"
LIF3,lif3,LIF3 (OLD),LIF3,4283845.0,14556792.0,158.75,Fantom Ecosystem
MAS,massa,Massa,MAS,4081911.0,15384278.0,115610.0,"Smart Contract Platform, Layer 1 (L1), Massa Ecosystem"
LL,lightlink,LightLink,LL,4046972.0,13903711.0,220188.0,"Infrastructure, Smart Contract Platform, Ethereum Ecosystem, Layer 2 (L2), Rollup, LightLink Ecosystem"
NLS,nolus,Nolus,NLS,3977664.0,5889149.0,35398.0,"Ethereum Ecosystem, Osmosis Ecosystem"
SDN,shiden,Shiden Network,SDN,3921499.0,5076344.0,46707.0,Smart Contract Platform
DYNA,dynachain,Dynachain,DYNA,3873369.0,16813114.0,228839.0,"Healthcare, BNB Chain Ecosystem"
GAIA,gaia-2,Gaia,SN57,3540292.0,3567301.0,81336.0,"Artificial Intelligence (AI), Bittensor Ecosystem, Bittensor Subnets"
METAV,metaverse,METAVERSE,METAV,3488397.0,3488397.0,420533.0,"Artificial Intelligence (AI), Solana Ecosystem, AI Agents, Pump.fun Ecosystem, Binance Alpha Spotlight"
TRT,trust-ai,TRUST AI,TRT,3459023.0,19115655.0,8976.2,Arbitrum Ecosystem
BCT,toucan-protocol-base-carbon-tonne,Base Carbon Tonne,BCT,3433499.0,3433499.0,442.48,"Polygon Ecosystem, Regenerative Finance (ReFi), Base Ecosystem"
HARAMBEAI,harambe-ai,Harambe AI,HARAMBEAI,3359888.0,5019406.0,4.66,"Meme, Ethereum Ecosystem"
LIKE,likecoin,LikeCoin,LIKE,3236317.0,4409842.0,745.58,"SocialFi, Osmosis Ecosystem"
HBAR,hedera-hashgraph,Hedera,HBAR,6597226070.0,7781318745.0,192423669.0,"Smart Contract Platform, Layer 1 (L1), Hedera Ecosystem, GMCI Layer 1 Index, GMCI 30 Index, GMCI Index, Outlier Ventures Portfolio, Made in USA, Directed Acyclic Graph (DAG)"
BGB,bitget-token,Bitget Token,BGB,5370670990.0,5370670990.0,90351923.0,"Exchange-based Tokens, Centralized Exchange (CEX) Token, Ethereum Ecosystem, DragonFly Capital Portfolio, Morph L2 Ecosystem"
TKX,tokenize-xchange,Tokenize Xchange,TKX,1950137053.0,2437793275.0,7800109.0,"Exchange-based Tokens, Centralized Exchange (CEX) Token, Ethereum Ecosystem, Titanchain Ecosystem"
LBTC,lombard-staked-btc,Lombard Staked BTC,LBTC,1707680723.0,1707680723.0,11250331.0,"BNB Chain Ecosystem, Ethereum Ecosystem, Sui Ecosystem, Base Ecosystem, Restaking, Berachain Ecosystem, Liquid Restaking Tokens, Sonic Ecosystem, Swellchain Ecosystem, Corn Ecosystem, Liquid Staked BTC"
RENDER,render-token,Render,RENDER,1699106662.0,1747509897.0,96711262.0,"Artificial Intelligence (AI), NFT, Metaverse, Solana Ecosystem, Polygon Ecosystem, Ethereum Ecosystem, DePIN, Multicoin Capital Portfolio, Alameda Research Portfolio, GMCI DePIN Index, GMCI 30 Index, GMCI Index, Made in USA, Coinbase 50 Index"
TIA,celestia,Celestia,TIA,1110890452.0,1809033139.0,151375285.0,"Smart Contract Platform, Cosmos Ecosystem, Layer 1 (L1), Data Availability, Modular Blockchain, Osmosis Ecosystem, eGirl Capital Portfolio, Coinbase Ventures Portfolio, Proof of Stake (PoS), Secret Ecosystem, YZi Labs (Prev. Binance Labs) Portfolio, Delphi Ventures Portfolio, Galaxy Digital Portfolio, Blockchain Capital Portfolio, OKX Ventures Portfolio, Polychain Capital Portfolio"
XDC,xdce-crowd-sale,XDC Network,XDC,981498874.0,2299237342.0,29658182.0,"Smart Contract Platform, Layer 1 (L1), Real World Assets (RWA)"
IP,story-2,Story,IP,851430465.0,3000521844.0,18565194.0,"Artificial Intelligence (AI), Smart Contract Platform, Layer 1 (L1), Made in USA, Story Ecosystem"
FLOKI,floki,FLOKI,FLOKI,757527029.0,783970929.0,88166549.0,"Gaming (GameFi), NFT, BNB Chain Ecosystem, Metaverse, Meme, Play To Earn, Ethereum Ecosystem, Telegram Apps, Dog-Themed, DWF Labs Portfolio, RPG, On-chain Gaming, TokenFi Launchpad, GMCI Meme Index, GMCI Index"
LDO,lido-dao,Lido DAO,LDO,686772563.0,765697604.0,89575647.0,"Infrastructure, Decentralized Finance (DeFi), Polygon Ecosystem, Arbitrum Ecosystem, Ethereum Ecosystem, Optimism Ecosystem, Liquid Staking Governance Tokens, eGirl Capital Portfolio, Paradigm Portfolio, Coinbase Ventures Portfolio, Multicoin Capital Portfolio, Index Coop Defi Index, Alameda Research Portfolio, DragonFly Capital Portfolio, Andreessen Horowitz (a16z) Portfolio, GMCI DeFi Index, Delphi Ventures Portfolio, Liquid Staking, GMCI Index, Coinbase 50 Index"
BTT,bittorrent,BitTorrent,BTT,606431532.0,608853945.0,9357959.0,"Storage, BNB Chain Ecosystem, Ethereum Ecosystem, DePIN, Alleged SEC Securities, Binance Launchpad, Tron Ecosystem, Energi Ecosystem, YZi Labs (Prev. Binance Labs) Portfolio, BitTorrent Ecosystem, GMCI DePIN Index, GMCI Index"
PYTH,pyth-network,Pyth Network,PYTH,594803805.0,1034443913.0,41137881.0,"Business Services, Infrastructure, Decentralized Finance (DeFi), Oracle, Solana Ecosystem, Neon Ecosystem, Manta Network Ecosystem, Multicoin Capital Portfolio, GMCI DeFi Index, Delphi Ventures Portfolio, GMCI Index"
RAY,raydium,Raydium,RAY,577005265.0,1196486656.0,57660940.0,"Decentralized Exchange (DEX), Decentralized Finance (DeFi), Yield Farming, Automated Market Maker (AMM), Solana Ecosystem, Launchpad, GMCI DeFi Index, GMCI Index"
CFX,conflux-token,Conflux,CFX,393000850.0,437174296.0,27591679.0,"Smart Contract Platform, DWF Labs Portfolio, Proof of Work (PoW), GMCI Layer 1 Index, Sequoia Capital Portfolio, GMCI Index, Made in China"
EIGEN,eigenlayer,EigenCloud (prev. EigenLayer),EIGEN,369740188.0,2058315392.0,88798630.0,"Infrastructure, Ethereum Ecosystem, Data Availability, Restaking, Polychain Capital Portfolio, Made in USA"
JST,just,JUST,JST,345733321.0,345733321.0,25068364.0,"Decentralized Finance (DeFi), Tron Ecosystem"
SUN,sun-token,Sun Token,SUN,335746625.0,348960306.0,26553301.0,"Decentralized Finance (DeFi), Tron Ecosystem"
DASH,dash,Dash,DASH,252237232.0,252260642.0,16974894.0,"Smart Contract Platform, Privacy, Masternodes, Alleged SEC Securities, Proof of Stake (PoS), Proof of Work (PoW), Made in USA"
LGCT,legacy-token,Legacy Token,LGCT,192538738.0,544514797.0,6353798.0,"Education, Gaming (GameFi), BNB Chain Ecosystem, Base Ecosystem"
ROSE,oasis-network,Oasis,ROSE,188433803.0,254994364.0,9203728.0,"Smart Contract Platform, BNB Chain Ecosystem, Layer 1 (L1), Proof of Stake (PoS), Pantera Capital Portfolio, Andreessen Horowitz (a16z) Portfolio, YZi Labs (Prev. Binance Labs) Portfolio, Blockchain Capital Portfolio, Privacy Blockchain, Polychain Capital Portfolio, Coinbase 50 Index"
VTHO,vethor-token,VeThor,VTHO,180592666.0,180665147.0,4206931.0,"Layer 1 (L1), VeChain Ecosystem"
