KRL,kryll,KRYLL,KRL,12598589.0,15622381.0,144346.0,"Artificial Intelligence (AI), Decentralized Finance (DeFi), Analytics, Arbitrum Ecosystem, Ethereum Ecosystem, Optimism Ecosystem, Base Ecosystem, AI Applications"
BAR,fc-barcelona-fan-token,FC Barcelona Fan Token,BAR,11791073.0,41203555.0,1980614.0,"Sports, Fan Token, Binance Launchpad, Chiliz Ecosystem"
MINIMA,minima,Minima,MINIMA,11060262.0,21851682.0,189669.0,"Smart Contract Platform, Layer 1 (L1), DePIN"
BTY,bityuan,Bityuan,BTY,10752099.0,10752187.0,273125.0,
PAID,paid-network,PAID,PAID,9922548.0,11749682.0,6281.43,"Launchpad, Base Ecosystem"
RWA,allo,Allo,RWA,9769789.0,54276606.0,4438977.0,"BNB Chain Ecosystem, Real World Assets (RWA), RWA Protocol"
BCUT,bitscrunch-token,bitsCrunch Token,BCUT,9609262.0,18376334.0,1296769.0,"Artificial Intelligence (AI), Infrastructure, Analytics, NFT, Polygon Ecosystem, Ethereum Ecosystem, Animoca Brands Portfolio, Coinbase Ventures Portfolio"
LAZIO,lazio-fan-token,Lazio Fan Token,LAZIO,8726880.0,29277663.0,6440572.0,"Sports, BNB Chain Ecosystem, Fan Token, Binance Launchpad"
TRUF,truflation,TRUF.Network,TRUF,7695734.0,22299695.0,404929.0,"Infrastructure, Oracle, Arbitrum Ecosystem, Ethereum Ecosystem, Real World Assets (RWA), Base Ecosystem, Coinbase Ventures Portfolio"
SCF,smoking-chicken-fish,Smoking Chicken Fish,SCF,6971905.0,6971905.0,1076105.0,"Solana Ecosystem, Meme, Solana Meme, Pump.fun Ecosystem"
RFC,retard-finder-coin,Retard Finder Coin,RFC,6693310.0,6960820.0,16578317.0,"Solana Ecosystem, Meme, Pump.fun Ecosystem, Wojak-Themed"
BAD,bad-idea-ai,Bad Idea AI,BAD,6585539.0,8165904.0,1182346.0,"Artificial Intelligence (AI), Meme, Ethereum Ecosystem, Telegram Apps, Discord Bots, Shibarium Ecosystem"
LNQ,linqai,LinqAI,LNQ,6144075.0,21972608.0,1218780.0,"Artificial Intelligence (AI), Ethereum Ecosystem"
BITBOARD,bitboard,BitBoard,BB,5795719.0,8760636.0,69463.0,"Smart Contract Platform, Polygon Ecosystem, Layer 2 (L2), Zero Knowledge (ZK)"
STOS,stratos,Stratos,STOS,5652038.0,12584835.0,203736.0,"Entertainment, Infrastructure, Smart Contract Platform, Storage, Layer 1 (L1), Ethereum Ecosystem, DePIN, Osmosis Ecosystem"
BST,blocksquare,Blocksquare,BST,5175063.0,5175063.0,261799.0,"Tokenized Real Estate, Tokenized Assets, Ethereum Ecosystem, Real World Assets (RWA)"
BILLY,billy,Billy,BILLY,5063263.0,5063263.0,2022706.0,"Solana Ecosystem, Meme, Dog-Themed, Solana Meme, Pump.fun Ecosystem"
INTER,inter-milan-fan-token,Inter Milan Fan Token,INTER,4950508.0,4950508.0,325592.0,"Sports, Fan Token, Chiliz Ecosystem"
GOGLZ,googles,GOGGLES,GOGLZ,4518936.0,4518936.0,548650.0,"Meme, Sonic Ecosystem"
NRG,energi,Energi,NRG,4093047.0,4093120.0,178752.0,"Smart Contract Platform, Masternodes, Layer 1 (L1), Ethereum Ecosystem, Proof of Stake (PoS), Energi Ecosystem"
KANGO,kango,KANGO,KANGO,4072255.0,4072255.0,189487.0,"Meme, Kaspa Ecosystem"
NC,nodecoin,Nodecoin,NC,4000108.0,21484379.0,2348134.0,"Artificial Intelligence (AI), Solana Ecosystem, DePIN"
HUAHUA,chihuahua-token,Chihuahua Chain,HUAHUA,3677476.0,3917287.0,665583.0,"Smart Contract Platform, NFT, Layer 1 (L1), Meme, Dog-Themed, Osmosis Ecosystem"
TSUKA,dejitaru-tsuka,Dejitaru Tsuka,TSUKA,3634195.0,3634195.0,118929.0,"Meme, Ethereum Ecosystem"
NWC,newscrypto-coin,Numerico,NWC,3434711.0,5850428.0,67678.0,"Education, Smart Contract Platform, BNB Chain Ecosystem, Ethereum Ecosystem, Layer 2 (L2), Stellar Ecosystem"
MCN,mcncoin,MCNCOIN,MCN,3366990.0,3366990.0,380971.0,BNB Chain Ecosystem
CATCH,spacecatch,SpaceCatch,CATCH,3357312.0,7775936.0,195413.0,"Gaming (GameFi), Metaverse, Arbitrum Ecosystem, Gaming Utility Token"
READY,ready,READY!,READY,3228439.0,3228439.0,76266.0,"Gaming (GameFi), Solana Ecosystem, Gaming Platform"
ZKP,panther,Panther Protocol,ZKP,3195796.0,3195796.0,448454.0,"Smart Contract Platform, Privacy, Polygon Ecosystem, Ethereum Ecosystem, Zero Knowledge (ZK)"
FET,fetch-ai,Artificial Superintelligence Alliance,FET,1864071809.0,1942453337.0,126359537.0,"Artificial Intelligence (AI), NFT, BNB Chain Ecosystem, Ethereum Ecosystem, Binance Launchpad, DWF Labs Portfolio, Osmosis Ecosystem, AI Agents, GMCI DePIN Index, GMCI Index, Outlier Ventures Portfolio, AI Agent Launchpad"
QNT,quant-network,Quant,QNT,1582510881.0,1589944243.0,22887501.0,"Ethereum Ecosystem, Real World Assets (RWA), Energi Ecosystem, Coinbase 50 Index"
DOGWIFHAT,dogwifcoin,dogwifhat,WIF,881602833.0,881602833.0,435692506.0,"Solana Ecosystem, Meme, Dog-Themed, Solana Meme, GMCI Meme Index, GMCI Index"
XAUT,tether-gold,Tether Gold,XAUT,826089890.0,826089890.0,27090303.0,"Stablecoins, Tokenized Assets, Tokenized Gold, Ethereum Ecosystem, Real World Assets (RWA), Tokenized Commodities"
PENDLE,pendle,Pendle,PENDLE,583210269.0,997129337.0,57295405.0,"Decentralized Exchange (DEX), Decentralized Finance (DeFi), Yield Farming, Automated Market Maker (AMM), BNB Chain Ecosystem, Derivatives, Lending/Borrowing Protocols, Arbitrum Ecosystem, Ethereum Ecosystem, Optimism Ecosystem, Fixed Interest, LSDFi, Base Ecosystem, Restaking, LRTfi, Liquid Restaking Governance Tokens, Yield Tokenization Protocol, YZi Labs (Prev. Binance Labs) Portfolio, GMCI DeFi Index, Sonic Ecosystem, Liquid Staking, GMCI Index, BTCfi Protocol"
KAVA,kava,Kava,KAVA,442476489.0,442476489.0,8066319.0,"Smart Contract Platform, Layer 1 (L1), Binance Launchpad, DWF Labs Portfolio, Osmosis Ecosystem, YZi Labs (Prev. Binance Labs) Portfolio, Made in USA"
RON,ronin,Ronin,RON,303117175.0,459798129.0,5644050.0,"Smart Contract Platform, Gaming (GameFi), NFT, Layer 1 (L1), Play To Earn, Zero Knowledge (ZK), FTX Holdings, Ronin Ecosystem, Gaming Blockchains, SideChain, Andreessen Horowitz (a16z) Portfolio, YZi Labs (Prev. Binance Labs) Portfolio"
ZBCN,zebec-network,Zebec Network,ZBCN,292210751.0,338567731.0,16299857.0,"Decentralized Finance (DeFi), Solana Ecosystem, Real World Assets (RWA), Payment Solutions, DePIN, Coinbase Ventures Portfolio, Alameda Research Portfolio, Circle Ventures Portfolio, OKX Ventures Portfolio, RWA Protocol, Made in USA"
PLUME,plume,Plume,PLUME,289300771.0,1138232541.0,70759743.0,"Smart Contract Platform, Layer 1 (L1), Ethereum Ecosystem, Real World Assets (RWA), RWA Protocol, Made in USA, Plume Network Ecosystem"
ATH,aethir,Aethir,ATH,278085920.0,1180301351.0,31453143.0,"Solana Ecosystem, Arbitrum Ecosystem, Impossible Finance Launchpad, Ethereum Ecosystem, DePIN, Animoca Brands Portfolio"
1INCH,1inch,1inch,1INCH,251422294.0,270545816.0,14582713.0,"Decentralized Exchange (DEX), Exchange-based Tokens, Decentralized Finance (DeFi), Automated Market Maker (AMM), BNB Chain Ecosystem, Avalanche Ecosystem, Polygon Ecosystem, Near Protocol Ecosystem, Harmony Ecosystem, Ethereum Ecosystem, FTX Holdings, Alameda Research Portfolio, DragonFly Capital Portfolio, Pantera Capital Portfolio, Energi Ecosystem, YZi Labs (Prev. Binance Labs) Portfolio, GMCI DeFi Index, Galaxy Digital Portfolio, Blockchain Capital Portfolio, Dex Aggregator, GMCI Index, Coinbase 50 Index"
SFP,safepal,SafePal,SFP,227744084.0,227744084.0,3142322.0,"BNB Chain Ecosystem, Wallets, Ethereum Ecosystem, Animoca Brands Portfolio, Binance Launchpad, Energi Ecosystem, YZi Labs (Prev. Binance Labs) Portfolio"
QTUM,qtum,Qtum,QTUM,215602307.0,219912634.0,16553126.0,"Smart Contract Platform, Proof of Stake (PoS), Made in China"
FLUID,instadapp,Fluid,FLUID,158213688.0,401182843.0,1047547.0,"Decentralized Finance (DeFi), Polygon Ecosystem, Ethereum Ecosystem, Base Ecosystem, Coinbase Ventures Portfolio, Pantera Capital Portfolio"
XCH,chia,Chia,XCH,145757076.0,328893025.0,7063654.0,"Smart Contract Platform, Layer 1 (L1), DePIN, Andreessen Horowitz (a16z) Portfolio, Made in USA"
ZANO,zano,Zano,ZANO,144241496.0,144318788.0,1622790.0,"Smart Contract Platform, Privacy, Layer 1 (L1), Proof of Stake (PoS), Proof of Work (PoW), Zano Ecosystem, Privacy Blockchain"
LQTY,liquity,Liquity,LQTY,129123497.0,132332421.0,25203205.0,"Decentralized Finance (DeFi), Lending/Borrowing Protocols, Arbitrum Ecosystem, Ethereum Ecosystem, Alameda Research Portfolio, Pantera Capital Portfolio"
PROM,prometeus,Prom,PROM,123510807.0,130278522.0,7206498.0,"Smart Contract Platform, BNB Chain Ecosystem, Ethereum Ecosystem, Layer 2 (L2)"
OSMO,osmosis,Osmosis,OSMO,105740364.0,143395765.0,6678611.0,"Decentralized Exchange (DEX), Decentralized Finance (DeFi), Automated Market Maker (AMM), Cosmos Ecosystem, Osmosis Ecosystem, Paradigm Portfolio, Proof of Stake (PoS), Evmos Ecosystem, Secret Ecosystem, GMCI DeFi Index, GMCI Index, Made in USA"
BIGTIME,big-time,Big Time,BIGTIME,101176265.0,265102914.0,17705852.0,"Gaming (GameFi), Play To Earn, Ethereum Ecosystem, RPG, Alameda Research Portfolio, Circle Ventures Portfolio, OKX Ventures Portfolio, MMO"
UMA,uma,UMA,UMA,99427757.0,141357616.0,5137269.0,"Business Services, Decentralized Finance (DeFi), Oracle, Derivatives, Synthetic Issuer, Avalanche Ecosystem, Ethereum Ecosystem, Blockchain Capital Portfolio, Synthetic, Made in USA"
WAVES,waves,Waves,WAVES,98499248.0,98499248.0,10744338.0,"Smart Contract Platform, DWF Labs Portfolio, Proof of Stake (PoS)"
DAG,constellation-labs,Constellation,DAG,95696351.0,119134642.0,2408171.0,"Smart Contract Platform, Layer 1 (L1), Base Ecosystem, Layer 0 (L0), Made in USA, Directed Acyclic Graph (DAG)"
XVG,verge,Verge,XVG,90710468.0,90891915.0,3790282.0,"Smart Contract Platform, Privacy, Proof of Work (PoW), Made in USA"
RED,redstone-oracles,RedStone,RED,87235788.0,311556385.0,14469916.0,"Infrastructure, Oracle, Ethereum Ecosystem"
FIDA,bonfida,Solana Name Service (prev. Bonfida),FIDA,81363403.0,82109659.0,66078107.0,"Big Data, Business Services, Infrastructure, Decentralized Finance (DeFi), Solana Ecosystem, FTX Holdings, DWF Labs Portfolio, Name Service"
MANTA,manta-network,Manta Network,MANTA,81000256.0,193432792.0,14901663.0,"Smart Contract Platform, Polkadot Ecosystem, Binance Launchpool, Layer 2 (L2), Manta Network Ecosystem, Multicoin Capital Portfolio, Alameda Research Portfolio, DeFiance Capital Portfolio, YZi Labs (Prev. Binance Labs) Portfolio"
XRD,radix,Radix,XRD,80507763.0,90075284.0,516091.0,"Smart Contract Platform, Layer 1 (L1), DWF Labs Portfolio, Radix Ecosystem"
DYM,dymension,Dymension,DYM,76734196.0,240949013.0,10468658.0,"Smart Contract Platform, Cosmos Ecosystem, Modular Blockchain, Osmosis Ecosystem, Rollups-as-a-Service (RaaS)"
STEEM,steem,Steem,STEEM,68361455.0,68433222.0,8966933.0,SocialFi
AITECH,solidus-aitech,Solidus Ai Tech,AITECH,68107490.0,87748346.0,12532165.0,"Artificial Intelligence (AI), BNB Chain Ecosystem, Launchpad, Base Ecosystem, ChainGPT Launchpad, AI Agents, Binance Alpha Spotlight, DeFAI"
SHX,stronghold-token,Stronghold,SHX,61620537.0,,963269.0,"Ethereum Ecosystem, Stellar Ecosystem, Made in USA"
WCT,connect-token-wct,WalletConnect Token,WCT,59907733.0,321738375.0,30959191.0,"Solana Ecosystem, Wallets, Ethereum Ecosystem, Optimism Ecosystem"
NIL,nillion,Nillion,NIL,58313685.0,298814682.0,10166642.0,"Infrastructure, Binance Launchpool"
PARTI,particle-network,Particle Network,PARTI,49489146.0,212399767.0,20749983.0,"Decentralized Finance (DeFi), BNB Chain Ecosystem, Layer 1 (L1), Base Ecosystem, Account Abstraction, Cross-chain Communication, Binance HODLer Airdrops, Chain Abstraction, Binance Wallet IDO"
SERAPH,seraph,Seraph,SERAPH,45052141.0,188106473.0,105420158.0,"Gaming (GameFi), BNB Chain Ecosystem, Play To Earn, Ethereum Ecosystem, RPG, Gaming Utility Token, Action Games"
SOON,soon-2,SOON,SOON,44473241.0,237952065.0,15516095.0,"Infrastructure, Smart Contract Platform, BNB Chain Ecosystem, Layer 2 (L2), Cross-chain Communication, Binance Alpha Spotlight"
MBL,moviebloc,MovieBloc,MBL,42625243.0,68876714.0,7501902.0,DWF Labs Portfolio
HASHAI,hashai,HashAI,HASHAI,42577248.0,45215174.0,444446.0,"Artificial Intelligence (AI), Ethereum Ecosystem, DePIN"
SAI,sai,Sai,SAI,36143916.0,36143916.0,6.83,"Decentralized Finance (DeFi), Ethereum Ecosystem"
ANYONE,airtor-protocol,ANyONe Protocol,ANYONE,34314013.0,42925950.0,164677.0,"Smart Contract Platform, Ethereum Ecosystem, DePIN, Privacy Blockchain"
DAO,dao-maker,DAO Maker,DAO,30553347.0,33791982.0,3054748.0,"BNB Chain Ecosystem, Solana Ecosystem, Launchpad, DaoMaker Launchpad, Arbitrum Ecosystem, Ethereum Ecosystem, Step Network Ecosystem"
ZETA,zeta,Zeta,ZEX,30450480.0,162168804.0,1854631.0,"Decentralized Finance (DeFi), Derivatives, Perpetuals, Solana Ecosystem"
OGY,origyn-foundation,ORIGYN,OGY,28276835.0,32927391.0,317854.0,"Internet Computer Ecosystem, Real World Assets (RWA), RWA Protocol"
NFP,nfprompt-token,NFPrompt,NFP,27790549.0,58779103.0,8455925.0,"BNB Chain Ecosystem, Binance Launchpool, YZi Labs (Prev. Binance Labs) Portfolio"
SD,stader,Stader,SD,27298696.0,53988191.0,4620361.0,"BNB Chain Ecosystem, Polygon Ecosystem, Fantom Ecosystem, Ethereum Ecosystem, Liquid Staking Governance Tokens, Animoca Brands Portfolio, Coinbase Ventures Portfolio, Pantera Capital Portfolio, Liquid Staking, Binance Alpha Spotlight"
ZORA,zora,Zora,ZORA,27074054.0,85954107.0,21467737.0,"Infrastructure, Media, Smart Contract Platform, NFT, Layer 2 (L2), Base Ecosystem, Coinbase Ventures Portfolio, Zora Ecosystem"
NMT,netmind-token,NetMind Token,NMT,24912815.0,72024742.0,1324952.0,"Artificial Intelligence (AI), BNB Chain Ecosystem, Ethereum Ecosystem, DePIN, AI Agents"
REZ,renzo,Renzo,REZ,23269305.0,88423463.0,9409360.0,"Decentralized Finance (DeFi), Binance Launchpool, Ethereum Ecosystem, Base Ecosystem, Restaking, YZi Labs (Prev. Binance Labs) Portfolio, OKX Ventures Portfolio"
RIO,realio-network,Realio Network Token,RIO,21417921.0,21418136.0,1623408.0,"BNB Chain Ecosystem, Solana Ecosystem, Ethereum Ecosystem, Algorand Ecosystem, Real World Assets (RWA), Osmosis Ecosystem, Stellar Ecosystem, Made in USA"
PORT3,port3-network,Port3 Network,PORT3,20689717.0,41392081.0,4035710.0,"SocialFi, BNB Chain Ecosystem, Ethereum Ecosystem, Poolz Finance Launchpad"
NATIX,natix-network,NATIX Network,NATIX,20456604.0,95411577.0,388631.0,"Artificial Intelligence (AI), Internet of Things (IOT), Solana Ecosystem, DePIN"
VIC,tomochain,Viction,VIC,20005608.0,34555151.0,1572774.0,"Smart Contract Platform, Masternodes, Layer 1 (L1), DWF Labs Portfolio"
BOOE,book-of-ethereum,Book of Ethereum,BOOE,19712750.0,19712750.0,355372.0,"Meme, Ethereum Ecosystem"
FHE,mind-network,Mind Network,FHE,18904066.0,75919943.0,10218255.0,"Artificial Intelligence (AI), Smart Contract Platform, BNB Chain Ecosystem, Layer 2 (L2), Binance Wallet IDO"
RETARDIO,retardio,RETARDIO,RETARDIO,17769175.0,17769175.0,1029215.0,"NFT, Solana Ecosystem, Meme, Solana Meme, Murad Picks, 4chan-Themed"
HOPR,hopr,HOPR,HOPR,16574849.0,17377463.0,240898.0,"Privacy, Gnosis Chain Ecosystem, Ethereum Ecosystem, DePIN, YZi Labs (Prev. Binance Labs) Portfolio"
WEPE,wall-street-pepe,Wall Street Pepe,WEPE,16476459.0,16476459.0,2342569.0,"Meme, Ethereum Ecosystem, Frog-Themed, The Boys Club"
VSC,vyvo-smart-chain,Vyvo Smart Chain,VSC,16290797.0,70160774.0,152288.0,"Smart Contract Platform, BNB Chain Ecosystem, Polygon Ecosystem, Layer 2 (L2)"
BRISE,bitrise-token,Bitgert,BRISE,15946083.0,17210497.0,2962821.0,"Smart Contract Platform, BNB Chain Ecosystem, Solana Ecosystem, Ethereum Ecosystem, Bitgert Ecosystem"
VOW,vow,Vow,VOW,15767814.0,51610786.0,395938.0,"Retail, Tourism, BNB Chain Ecosystem, Ethereum Ecosystem"
REI,rei-network,REI Network,REI,15417283.0,15768232.0,4241703.0,"Smart Contract Platform, Layer 1 (L1)"
VINU,vita-inu,Vita Inu,VINU,14065324.0,14065324.0,5405096.0,"BNB Chain Ecosystem, Meme, Dog-Themed, DWF Labs Portfolio, Binance Alpha Spotlight"
MFT,mainframe,Mainframe,MFT,13790453.0,14691712.0,83.65,"Ethereum Ecosystem, Energi Ecosystem"
LOOKS,looksrare,LooksRare,LOOKS,13580488.0,13580488.0,6526213.0,"NFT, Ethereum Ecosystem, NFT Marketplace"
NUM,numbers-protocol,Numbers Protocol,NUM,13536775.0,13706904.0,1272115.0,"Artificial Intelligence (AI), Smart Contract Platform, BNB Chain Ecosystem, DaoMaker Launchpad, Ethereum Ecosystem, Avalanche L1, YZi Labs (Prev. Binance Labs) Portfolio, Outlier Ventures Portfolio"
LOCK,houdini-swap,Houdini Swap,LOCK,12580463.0,12580463.0,4961.67,"Privacy, Solana Ecosystem, Ethereum Ecosystem"
SUKU,suku,SUKU,SUKU,12188725.0,39596287.0,354074.0,"Polygon Ecosystem, Ethereum Ecosystem, Made in USA"
LINGO,lingo,Lingo,LINGO,12151811.0,12151811.0,575568.0,"Solana Ecosystem, Real World Assets (RWA), Base Ecosystem, RWA Protocol"
MEMEFI,memefi-2,MemeFi,MEMEFI,11610869.0,11610869.0,6088681.0,"Gaming (GameFi), NFT, Meme, Play To Earn, Sui Ecosystem, Telegram Apps, Tap to Earn, Sui Meme, Action Games"
MLC,my-lovely-coin,My Lovely Coin,MLC,10964241.0,49223664.0,370816.0,"Charity, Gaming (GameFi), Polygon Ecosystem, Gaming Utility Token"
DIONE,dione,Dione,DIONE,10895651.0,12855276.0,202030.0,"Energy, Smart Contract Platform, Layer 1 (L1), Made in USA"
LEVER,lever,LeverFi,LEVER,10599022.0,10599250.0,17296737.0,"Decentralized Finance (DeFi), Ethereum Ecosystem, DWF Labs Portfolio, Alameda Research Portfolio"
EPT,balance,Balance,EPT,10429045.0,45019079.0,9631547.0,"Gaming (GameFi), BNB Chain Ecosystem, Animoca Brands Portfolio, DWF Labs Portfolio, AI Agents, Andreessen Horowitz (a16z) Portfolio, AI Agent Launchpad"
PROPS,propbase,Propbase,PROPS,9478986.0,27128209.0,2705611.0,"Tokenized Real Estate, Tokenized Assets, Aptos Ecosystem, Real World Assets (RWA), Base Ecosystem, RWA Protocol"
MCB,mcdex,MUX Protocol,MCB,9086307.0,11475466.0,1209.05,"Decentralized Exchange (DEX), Exchange-based Tokens, Decentralized Finance (DeFi), BNB Chain Ecosystem, Derivatives, Perpetuals, Arbitrum Ecosystem, Ethereum Ecosystem, Multicoin Capital Portfolio, Alameda Research Portfolio, DeFiance Capital Portfolio, Delphi Ventures Portfolio, OKX Ventures Portfolio"
SIDUS,sidus,Sidus,SIDUS,8280038.0,14138344.0,525242.0,"Gaming (GameFi), NFT, BNB Chain Ecosystem, Metaverse, Play To Earn, Ethereum Ecosystem, Linea Ecosystem, Animoca Brands Portfolio, Base Ecosystem, RPG, Gaming Governance Token, Alameda Research Portfolio, OKX Ventures Portfolio"
OX,ox-fun,OX Coin,OX,7990708.0,7990708.0,408365.0,"BNB Chain Ecosystem, Derivatives, Perpetuals, Solana Ecosystem, Avalanche Ecosystem, Polygon Ecosystem, Arbitrum Ecosystem, Ethereum Ecosystem, Base Ecosystem, Blast Ecosystem"
AEROBUD,aerobud,AEROBUD,AEROBUD,7624536.0,7624536.0,138448.0,"Charity, Meme, Base Ecosystem, Dog-Themed, Base Meme, Made in USA"
K,kinto,Kinto,K,6600649.0,35773090.0,412438.0,"Decentralized Finance (DeFi), Wallets"
RLY,rally-2,Rally,RLY,6289317.0,18823180.0,89091.0,"SocialFi, Yield Farming, Ethereum Ecosystem, Alleged SEC Securities, Coinbase Ventures Portfolio, Andreessen Horowitz (a16z) Portfolio"
JUNO,juno-network,JUNO,JUNO,6257439.0,8313475.0,65361.0,"Smart Contract Platform, Cosmos Ecosystem, Osmosis Ecosystem, Juno Ecosystem, Evmos Ecosystem, Secret Ecosystem"
PMT,public-meme-token,Public Masterpiece Token,PMT,5731706.0,22702854.0,272598.0,BNB Chain Ecosystem
BEAM,beam,BEAM,BEAM,5593703.0,8022907.0,238723.0,"Smart Contract Platform, Privacy, Ethereum Ecosystem, Proof of Work (PoW), BeamPrivacy Ecosystem, Privacy Blockchain"
KILO,kiloex,KiloEx,KILO,4699918.0,22200843.0,4043697.0,"Decentralized Exchange (DEX), Decentralized Finance (DeFi), BNB Chain Ecosystem, Derivatives, Binance Wallet IDO"
PEAR,pear-protocol,Pear Protocol,PEAR,4614334.0,15496463.0,27961.0,"Decentralized Exchange (DEX), Decentralized Finance (DeFi), Perpetuals, Arbitrum Ecosystem"
OBT,oobit,Oobit,OBT,4575466.0,12997584.0,62621.0,"BNB Chain Ecosystem, Ethereum Ecosystem, Payment Solutions"
AZIT,azit,azit,AZIT,4573923.0,6729106.0,165640.0,Kaia Ecosystem
LIF3,lif3,LIF3 (OLD),LIF3,4380819.0,14886315.0,134.18,Fantom Ecosystem
DYNA,dynachain,Dynachain,DYNA,4127094.0,17922858.0,241882.0,"Healthcare, BNB Chain Ecosystem"
MAS,massa,Massa,MAS,4097617.0,15440795.0,113296.0,"Smart Contract Platform, Layer 1 (L1), Massa Ecosystem"
LL,lightlink,LightLink,LL,4034213.0,13859877.0,230101.0,"Infrastructure, Smart Contract Platform, Ethereum Ecosystem, Layer 2 (L2), Rollup, LightLink Ecosystem"
SDN,shiden,Shiden Network,SDN,3954056.0,5118267.0,47660.0,Smart Contract Platform
NLS,nolus,Nolus,NLS,3941312.0,5842495.0,31292.0,"Ethereum Ecosystem, Osmosis Ecosystem"
GAIA,gaia-2,Gaia,SN57,3593156.0,3593156.0,124006.0,"Artificial Intelligence (AI), Bittensor Ecosystem, Bittensor Subnets"
METAV,metaverse,METAVERSE,METAV,3467660.0,3467660.0,421508.0,"Artificial Intelligence (AI), Solana Ecosystem, AI Agents, Pump.fun Ecosystem, Binance Alpha Spotlight"
BCT,toucan-protocol-base-carbon-tonne,Base Carbon Tonne,BCT,3459473.0,3459473.0,404.46,"Polygon Ecosystem, Regenerative Finance (ReFi), Base Ecosystem"
HARAMBEAI,harambe-ai,Harambe AI,HARAMBEAI,3358584.0,5017497.0,54.25,"Meme, Ethereum Ecosystem"
LIKE,likecoin,LikeCoin,LIKE,3257290.0,4438420.0,700.34,"SocialFi, Osmosis Ecosystem"
HMND,humanode,Humanode,HMND,3152669.0,9636627.0,481152.0,"Artificial Intelligence (AI), Smart Contract Platform, Layer 1 (L1), Decentralized Identifier (DID), Discord Bots, Humanode Ecosystem"
HBAR,hedera-hashgraph,Hedera,HBAR,6557353528.0,7736384805.0,152823233.0,"Smart Contract Platform, Layer 1 (L1), Hedera Ecosystem, GMCI Layer 1 Index, GMCI 30 Index, GMCI Index, Outlier Ventures Portfolio, Made in USA, Directed Acyclic Graph (DAG)"
BGB,bitget-token,Bitget Token,BGB,5407819177.0,5407819177.0,87207872.0,"Exchange-based Tokens, Centralized Exchange (CEX) Token, Ethereum Ecosystem, DragonFly Capital Portfolio, Morph L2 Ecosystem"
TKX,tokenize-xchange,Tokenize Xchange,TKX,1950555801.0,2438316736.0,11848432.0,"Exchange-based Tokens, Centralized Exchange (CEX) Token, Ethereum Ecosystem, Titanchain Ecosystem"
LBTC,lombard-staked-btc,Lombard Staked BTC,LBTC,1718340966.0,1718383769.0,8777433.0,"BNB Chain Ecosystem, Ethereum Ecosystem, Sui Ecosystem, Base Ecosystem, Restaking, Berachain Ecosystem, Liquid Restaking Tokens, Sonic Ecosystem, Swellchain Ecosystem, Corn Ecosystem, Liquid Staked BTC"
RENDER,render-token,Render,RENDER,1708401233.0,1757069247.0,81521993.0,"Artificial Intelligence (AI), NFT, Metaverse, Solana Ecosystem, Polygon Ecosystem, Ethereum Ecosystem, DePIN, Multicoin Capital Portfolio, Alameda Research Portfolio, GMCI DePIN Index, GMCI 30 Index, GMCI Index, Made in USA, Coinbase 50 Index"
TIA,celestia,Celestia,TIA,1037693958.0,1692456500.0,110250985.0,"Smart Contract Platform, Cosmos Ecosystem, Layer 1 (L1), Data Availability, Modular Blockchain, Osmosis Ecosystem, eGirl Capital Portfolio, Coinbase Ventures Portfolio, Proof of Stake (PoS), Secret Ecosystem, YZi Labs (Prev. Binance Labs) Portfolio, Delphi Ventures Portfolio, Galaxy Digital Portfolio, Blockchain Capital Portfolio, OKX Ventures Portfolio, Polychain Capital Portfolio"
XDC,xdce-crowd-sale,XDC Network,XDC,952312858.0,2230866832.0,25195800.0,"Smart Contract Platform, Layer 1 (L1), Real World Assets (RWA)"
IP,story-2,Story,IP,850050816.0,2995798951.0,17729326.0,"Artificial Intelligence (AI), Smart Contract Platform, Layer 1 (L1), Made in USA, Story Ecosystem"
FLOKI,floki,FLOKI,FLOKI,758011448.0,784472259.0,69323268.0,"Gaming (GameFi), NFT, BNB Chain Ecosystem, Metaverse, Meme, Play To Earn, Ethereum Ecosystem, Telegram Apps, Dog-Themed, DWF Labs Portfolio, RPG, On-chain Gaming, TokenFi Launchpad, GMCI Meme Index, GMCI Index"
LDO,lido-dao,Lido DAO,LDO,690812126.0,770201401.0,74769416.0,"Infrastructure, Decentralized Finance (DeFi), Polygon Ecosystem, Arbitrum Ecosystem, Ethereum Ecosystem, Optimism Ecosystem, Liquid Staking Governance Tokens, eGirl Capital Portfolio, Paradigm Portfolio, Coinbase Ventures Portfolio, Multicoin Capital Portfolio, Index Coop Defi Index, Alameda Research Portfolio, DragonFly Capital Portfolio, Andreessen Horowitz (a16z) Portfolio, GMCI DeFi Index, Delphi Ventures Portfolio, Liquid Staking, GMCI Index, Coinbase 50 Index"
BTT,bittorrent,BitTorrent,BTT,603903571.0,606315886.0,8885975.0,"Storage, BNB Chain Ecosystem, Ethereum Ecosystem, DePIN, Alleged SEC Securities, Binance Launchpad, Tron Ecosystem, Energi Ecosystem, YZi Labs (Prev. Binance Labs) Portfolio, BitTorrent Ecosystem, GMCI DePIN Index, GMCI Index"
PYTH,pyth-network,Pyth Network,PYTH,598734925.0,1041280661.0,34013094.0,"Business Services, Infrastructure, Decentralized Finance (DeFi), Oracle, Solana Ecosystem, Neon Ecosystem, Manta Network Ecosystem, Multicoin Capital Portfolio, GMCI DeFi Index, Delphi Ventures Portfolio, GMCI Index"
RAY,raydium,Raydium,RAY,569275969.0,1180459074.0,51171166.0,"Decentralized Exchange (DEX), Decentralized Finance (DeFi), Yield Farming, Automated Market Maker (AMM), Solana Ecosystem, Launchpad, GMCI DeFi Index, GMCI Index"
CFX,conflux-token,Conflux,CFX,397364644.0,442030514.0,26521455.0,"Smart Contract Platform, DWF Labs Portfolio, Proof of Work (PoW), GMCI Layer 1 Index, Sequoia Capital Portfolio, GMCI Index, Made in China"
EIGEN,eigenlayer,EigenCloud (prev. EigenLayer),EIGEN,376620344.0,2096616694.0,73956528.0,"Infrastructure, Ethereum Ecosystem, Data Availability, Restaking, Polychain Capital Portfolio, Made in USA"
JST,just,JUST,JST,342715664.0,342715664.0,25715694.0,"Decentralized Finance (DeFi), Tron Ecosystem"
SUN,sun-token,Sun Token,SUN,334671850.0,347843232.0,36099316.0,"Decentralized Finance (DeFi), Tron Ecosystem"
DASH,dash,Dash,DASH,251725218.0,251743532.0,16194300.0,"Smart Contract Platform, Privacy, Masternodes, Alleged SEC Securities, Proof of Stake (PoS), Proof of Work (PoW), Made in USA"
LGCT,legacy-token,Legacy Token,LGCT,192538738.0,544514797.0,6479847.0,"Education, Gaming (GameFi), BNB Chain Ecosystem, Base Ecosystem"
ROSE,oasis-network,Oasis,ROSE,182968733.0,247599965.0,9374091.0,"Smart Contract Platform, BNB Chain Ecosystem, Layer 1 (L1), Proof of Stake (PoS), Pantera Capital Portfolio, Andreessen Horowitz (a16z) Portfolio, YZi Labs (Prev. Binance Labs) Portfolio, Blockchain Capital Portfolio, Privacy Blockchain, Polychain Capital Portfolio, Coinbase 50 Index"
VTHO,vethor-token,VeThor,VTHO,181072769.0,181127247.0,4017741.0,"Layer 1 (L1), VeChain Ecosystem"
