TIA,celestia,Celestia,TIA,843390727,1179361494.0,64521842.0,"Smart Contract Platform, Cosmos Ecosystem, Layer 1 (L1), Data Availability, Modular Blockchain, Osmosis Ecosystem, eGirl Capital Portfolio, Coinbase Ventures Portfolio, Proof of Stake (PoS), Secret Ecosystem, YZi Labs (Prev. Binance Labs) Portfolio, Delphi Ventures Portfolio, Galaxy Digital Portfolio, Blockchain Capital Portfolio, OKX Ventures Portfolio, Polychain Capital Portfolio"
LDO,lido-dao,Lido DAO,LDO,821732420,917348782.0,112037246.0,"Infrastructure, Decentralized Finance (DeFi), Polygon Ecosystem, Arbitrum Ecosystem, Ethereum Ecosystem, Optimism Ecosystem, Liquid Staking Governance Tokens, eGirl Capital Portfolio, Paradigm Portfolio, Coinbase Ventures Portfolio, Multicoin Capital Portfolio, Index Coop Defi Index, Alameda Research Portfolio, DragonFly Capital Portfolio, Andreessen Horowitz (a16z) Portfolio, GMCI DeFi Index, Delphi Ventures Portfolio, Liquid Staking, GMCI Index, Coinbase 50 Index, Governance"
STX,blockstack,Stacks,STX,797823437,797823437.0,24390746.0,"Infrastructure, Smart Contract Platform, Layer 2 (L2), Bitcoin Sidechains, Stacks Ecosystem, SideChain, GMCI Layer 2 Index, GMCI 30 Index, Blockchain Capital Portfolio, GMCI Index, Made in USA, Coinbase 50 Index"
FLOKI,floki,FLOKI,FLOKI,761533618,788439564.0,505349122.0,"Gaming (GameFi), NFT, BNB Chain Ecosystem, Metaverse, Meme, Play To Earn, Ethereum Ecosystem, Telegram Apps, Dog-Themed, DWF Labs Portfolio, RPG, On-chain Gaming, TokenFi Launchpad, GMCI Meme Index, GMCI Index"
PYTH,pyth-network,Pyth Network,PYTH,671577382,1167964105.0,28357279.0,"Business Services, Infrastructure, Decentralized Finance (DeFi), Oracle, Solana Ecosystem, Neon Ecosystem, Manta Network Ecosystem, Multicoin Capital Portfolio, GMCI DeFi Index, Delphi Ventures Portfolio, GMCI Index"
DASH,dash,Dash,DASH,594235591,594260414.0,194076639.0,"Smart Contract Platform, Privacy, Masternodes, Alleged SEC Securities, Proof of Stake (PoS), Proof of Work (PoW), Made in USA"
CFX,conflux-token,Conflux,CFX,579551967,644071474.0,20977056.0,"Smart Contract Platform, DWF Labs Portfolio, Proof of Work (PoW), GMCI Layer 1 Index, Sequoia Capital Portfolio, GMCI Index, Made in China"
RAY,raydium,Raydium,RAY,503877855,1042896472.0,42398790.0,"Decentralized Exchange (DEX), Exchange-based Tokens, Decentralized Finance (DeFi), Yield Farming, Automated Market Maker (AMM), Perpetuals, Solana Ecosystem, Launchpad, GMCI DeFi Index, GMCI Index"
BTT,bittorrent,BitTorrent,BTT,497697758,499685829.0,14191419.0,"Storage, BNB Chain Ecosystem, Ethereum Ecosystem, DePIN, Alleged SEC Securities, Binance Launchpad, Tron Ecosystem, Energi Ecosystem, YZi Labs (Prev. Binance Labs) Portfolio, BitTorrent Ecosystem, GMCI DePIN Index, GMCI Index"
SUN,sun-token,Sun Token,SUN,445819730,462766078.0,17472457.0,"Decentralized Finance (DeFi), Tron Ecosystem, Made in China"
EIGEN,eigenlayer,EigenCloud (prev. EigenLayer),EIGEN,442975259,2007960280.0,114088524.0,"Infrastructure, Ethereum Ecosystem, Base Ecosystem, Data Availability, Restaking, Polychain Capital Portfolio, Made in USA"
JST,just,JUST,JST,327910047,327910047.0,22933834.0,"Decentralized Finance (DeFi), Tron Ecosystem"
ZK,zksync,ZKsync,ZK,270566865,785686549.0,15253743.0,"Smart Contract Platform, Ethereum Ecosystem, Layer 2 (L2), Zero Knowledge (ZK), ZkSync Ecosystem, Consensys Portfolio, Blockchain Capital Portfolio, OKX Ventures Portfolio"
DRIFT,drift-protocol,Drift Protocol,DRIFT,196987931,515887154.0,15995365.0,"Decentralized Finance (DeFi), Derivatives, Prediction Markets, Perpetuals, Solana Ecosystem, Governance"
LGCT,legacy-token,Legacy Token,LGCT,192538738,544514797.0,3023327.0,"Education, Gaming (GameFi), BNB Chain Ecosystem, Base Ecosystem"
TKX,tokenize-xchange,Tokenize Xchange,TKX,170769998,213473177.0,4340.83,"Exchange-based Tokens, Centralized Exchange (CEX) Token, Ethereum Ecosystem, Titanchain Ecosystem"
EUL,euler,Euler,EUL,156729458,228002536.0,20139421.0,"BNB Chain Ecosystem, Lending/Borrowing Protocols, Avalanche Ecosystem, Arbitrum Ecosystem, Ethereum Ecosystem, Base Ecosystem, Berachain Ecosystem, Paradigm Portfolio, Coinbase Ventures Portfolio, Sonic Ecosystem, Swellchain Ecosystem, Unichain Ecosystem, TAC Ecosystem, Plasma Ecosystem"
CELO,celo,Celo,CELO,145856923,249711978.0,16793735.0,"Smart Contract Platform, Celo Ecosystem, Layer 2 (L2), DWF Labs Portfolio, Coinbase Ventures Portfolio, Proof of Stake (PoS), Andreessen Horowitz (a16z) Portfolio, Optimism Superchain Ecosystem, Outlier Ventures Portfolio, Made in USA"
OZO,ozone-chain,Ozone Chain,OZO,119941441,133809293.0,234627.0,"Smart Contract Platform, Layer 1 (L1), Zero Knowledge (ZK)"
ELF,aelf,aelf,ELF,115024456,144078146.0,3153601.0,"Infrastructure, Smart Contract Platform, BNB Chain Ecosystem, Layer 1 (L1), Ethereum Ecosystem, GMCI Layer 1 Index, Aelf Ecosystem, GMCI Index"
NPC,non-playable-coin,Non-Playable Coin,NPC,106520734,106520734.0,6875475.0,"NFT, BNB Chain Ecosystem, Solana Ecosystem, Meme, Ethereum Ecosystem, Base Ecosystem, Hybrid Token Standards, Wojak-Themed, 4chan-Themed"
WOO,woo-network,WOO,WOO,83436875,96576035.0,6847464.0,"Decentralized Exchange (DEX), Exchange-based Tokens, Decentralized Finance (DeFi), Automated Market Maker (AMM), BNB Chain Ecosystem, Derivatives, Perpetuals, Centralized Exchange (CEX) Token, Solana Ecosystem, Avalanche Ecosystem, Polygon Ecosystem, Near Protocol Ecosystem, Fantom Ecosystem, Arbitrum Ecosystem, Ethereum Ecosystem, ZkSync Ecosystem, Mantle Ecosystem, Linea Ecosystem, Base Ecosystem, DragonFly Capital Portfolio, YZi Labs (Prev. Binance Labs) Portfolio"
IO,io,io.net,IO,73484527,266429548.0,23073106.0,"Artificial Intelligence (AI), Internet of Things (IOT), Binance Launchpool, Solana Ecosystem, DePIN, Animoca Brands Portfolio, Multicoin Capital Portfolio, Delphi Ventures Portfolio, OKX Ventures Portfolio, Made in USA"
HIVE,hive,Hive,HIVE,69762688,,1706432.0,"Smart Contract Platform, SocialFi, Layer 1 (L1), Gaming Blockchains"
B3,b3,B3 (Base),B3,68194159,225081184.0,2770385.0,"Smart Contract Platform, Base Ecosystem, Gaming Blockchains"
BICO,biconomy,Biconomy,BICO,65531312,66193619.0,4527471.0,"Arbitrum Ecosystem, Ethereum Ecosystem, Account Abstraction, Coinbase Ventures Portfolio, YZi Labs (Prev. Binance Labs) Portfolio, Consensys Portfolio, Outlier Ventures Portfolio"
BAL,balancer,Balancer,BAL,64979988,70671788.0,3463759.0,"Decentralized Exchange (DEX), Exchange-based Tokens, Decentralized Finance (DeFi), Yield Farming, Automated Market Maker (AMM), Avalanche Ecosystem, Polygon Ecosystem, Near Protocol Ecosystem, Gnosis Chain Ecosystem, Harmony Ecosystem, Arbitrum Ecosystem, Ethereum Ecosystem, Optimism Ecosystem, Base Ecosystem, Index Coop Defi Index, Alameda Research Portfolio, DeFiance Capital Portfolio, Pantera Capital Portfolio, Energi Ecosystem, Polygon zkEVM Ecosystem, Huobi ECO Chain Ecosystem, Blockchain Capital Portfolio, Governance"
RLC,iexec-rlc,iExec RLC,RLC,64514294,77542582.0,5130554.0,"Artificial Intelligence (AI), Oracle, Arbitrum Ecosystem, Ethereum Ecosystem, DePIN, AI Agents, Energi Ecosystem, Sora Ecosystem, GMCI DePIN Index, GMCI Index"
AI16Z,ai16z,ai16z,AI16Z,64255944,64255944.0,26557134.0,"Artificial Intelligence (AI), Solana Ecosystem, Meme, Solana Token-2022, AI Agents, Binance Alpha Spotlight, AI Framework, Made in USA"
MVL,mass-vehicle-ledger,MVL,MVL,60305409,61297529.0,376532.0,"Internet of Things (IOT), BNB Chain Ecosystem, Ethereum Ecosystem, DePIN, DWF Labs Portfolio"
SCRT,secret,Secret,SCRT,52427530,54867979.0,2251339.0,"Artificial Intelligence (AI), Smart Contract Platform, Cosmos Ecosystem, Layer 1 (L1), Osmosis Ecosystem, Alameda Research Portfolio, DragonFly Capital Portfolio, DeFiance Capital Portfolio, Privacy Blockchain, Outlier Ventures Portfolio"
ACX,across-protocol,Across Protocol,ACX,52135943,84355837.0,3274033.0,"Polygon Ecosystem, Arbitrum Ecosystem, Ethereum Ecosystem, Optimism Ecosystem, Bridge Governance Tokens, Cross-chain Communication, Intent, Boba Network Ecosystem, Blockchain Capital Portfolio, Made in USA"
ANVL,anvil,Anvil,ANVL,50717295,63238084.0,120658.0,"Decentralized Finance (DeFi), Ethereum Ecosystem"
FLOCK,flock-2,FLOCK,FLOCK,48199008,202558389.0,5811124.0,"Artificial Intelligence (AI), Base Ecosystem, AI Applications, Binance Alpha Spotlight"
VEE,blockv,BLOCKv,VEE,45796828,45796828.0,20763.0,"NFT, Polygon Ecosystem, Ethereum Ecosystem, Optimism Ecosystem"
SEDA,seda-2,SEDA,SEDA,40809482,67146321.0,1367599.0,"Smart Contract Platform, Oracle, Ethereum Ecosystem, Base Ecosystem, Modular Blockchain, Osmosis Ecosystem"
QI,benqi,BENQI,QI,40271325,40271325.0,1343618.0,"Decentralized Finance (DeFi), Yield Farming, Binance Launchpool, Lending/Borrowing Protocols, Avalanche Ecosystem, Liquid Staking Governance Tokens, DragonFly Capital Portfolio, Liquid Staking"
NYM,nym,Nym,NYM,39623934,48373547.0,2204196.0,"Smart Contract Platform, Privacy, Ethereum Ecosystem, DePIN, Osmosis Ecosystem, VPN, Andreessen Horowitz (a16z) Portfolio, YZi Labs (Prev. Binance Labs) Portfolio, Governance"
NOS,nosana,Nosana,NOS,39053715,46826996.0,541071.0,"Artificial Intelligence (AI), Solana Ecosystem, DePIN"
QKC,quark-chain,QuarkChain,QKC,38877130,54204559.0,659917.0,"Infrastructure, Ethereum Ecosystem, Energi Ecosystem"
PAAL,paal-ai,PAAL AI,PAAL,38323619,42700812.0,8079493.0,"Artificial Intelligence (AI), Virtual Reality, BNB Chain Ecosystem, Solana Ecosystem, Launchpad, Ethereum Ecosystem, Telegram Apps, Discord Bots, Base Ecosystem, PAAL AI Launchpad, AI Agents, AI Applications, AI Agent Launchpad, Binance Alpha Spotlight, AI Framework, DeFAI, Made in USA"
VANRY,vanar-chain,Vanar Chain,VANRY,34257041,35730127.0,4460090.0,"Artificial Intelligence (AI), Smart Contract Platform, Layer 1 (L1), Polygon Ecosystem, Ethereum Ecosystem, Vanar Chain Ecosystem"
AINTI,aintivirus,AIntivirus,AINTI,33726599,33726599.0,0.0,"Solana Ecosystem, Meme, AI Meme, Pump.fun Ecosystem"
UQC,uquid-coin,Uquid Coin,UQC,33438765,133755059.0,15433.29,Ethereum Ecosystem
SIX,six,Six Sigma,SIX,29974300,29974300.0,521.34,"Gambling (GambleFi), Solana Ecosystem"
NAVX,navi,NAVI Protocol,NAVX,28512269,39615796.0,1835998.0,"Decentralized Finance (DeFi), Lending/Borrowing Protocols, Sui Ecosystem, OKX Ventures Portfolio, Binance Alpha Spotlight"
GPS,goplus-security,GoPlus Security,GPS,28297236,89690128.0,4224216.0,"BNB Chain Ecosystem, Base Ecosystem, Cybersecurity, YZi Labs (Prev. Binance Labs) Portfolio, OKX Ventures Portfolio, Binance Alpha Spotlight"
ACS,access-protocol,Access Protocol,ACS,27910863,56833493.0,1097484.0,"SocialFi, Solana Ecosystem"
MBX,marblex,MARBLEX,MBX,27553367,34005636.0,1444424.0,"Smart Contract Platform, Gaming (GameFi), NFT, BNB Chain Ecosystem, Kaia Ecosystem, Aptos Ecosystem, DWF Labs Portfolio, Gaming Blockchains"
AO,ao-computer,ao Computer,AO,27383447,27383447.0,135399.0,"Artificial Intelligence (AI), Smart Contract Platform, DePIN"
CHILLGUY,chill-guy,Just a chill guy,CHILLGUY,27005469,27005469.0,6822753.0,"Solana Ecosystem, Meme, Dog-Themed, Solana Meme, Pump.fun Ecosystem, TikTok Meme"
FARTBOY,fartboy,Fartboy,$FARTBOY,25853881,25853881.0,159721.0,"Solana Ecosystem, Meme, Solana Meme, Pump.fun Ecosystem"
FORT,forta,Forta,FORT,24718811,39519468.0,4067488.0,"Artificial Intelligence (AI), Polygon Ecosystem, Arbitrum Ecosystem, Ethereum Ecosystem, Base Ecosystem, Coinbase Ventures Portfolio, Cybersecurity, Andreessen Horowitz (a16z) Portfolio, Blockchain Capital Portfolio"
MAPO,marcopolo,MAP Protocol,MAPO,24013224,38366418.0,647895.0,"BNB Chain Ecosystem, Ethereum Ecosystem, DWF Labs Portfolio"
L3,layer3,Layer3,L3,21460643,78261173.0,5720643.0,"Marketing, BNB Chain Ecosystem, Solana Ecosystem, Polygon Ecosystem, Arbitrum Ecosystem, Ethereum Ecosystem, Decentralized Identifier (DID), Optimism Ecosystem, Quest-to-Earn, Made in USA"
LYX,lukso-token-2,LUKSO,LYX,18974801,26170083.0,417637.0,"Smart Contract Platform, SocialFi, Layer 1 (L1), Decentralized Identifier (DID), Proof of Stake (PoS), Lukso Ecosystem"
PIKA,pikaboss,Pikaboss,PIKA,18000844,18000844.0,4078.54,"Meme, Ethereum Ecosystem"
WALLET,ambire-wallet,Ambire Wallet,WALLET,16585584,16743858.0,33260.0,"Wallets, Polygon Ecosystem, Ethereum Ecosystem, Base Ecosystem, Account Abstraction, Governance"
PIPPIN,pippin,pippin,PIPPIN,15445938,15445938.0,7578771.0,"Artificial Intelligence (AI), Infrastructure, Solana Ecosystem, Meme, Solana Meme, AI Meme, AI Agents, Pump.fun Ecosystem, Binance Alpha Spotlight, AI Framework"
TLOS,telos,Telos,TLOS,14149412,14149413.0,2017397.0,"Smart Contract Platform, BNB Chain Ecosystem, Layer 1 (L1), Avalanche Ecosystem, Polygon Ecosystem, Arbitrum Ecosystem, Ethereum Ecosystem, Zero Knowledge (ZK), Base Ecosystem, Telos Ecosystem, Consensys Portfolio"
SWARMS,swarms,Swarms,SWARMS,14008065,14008065.0,4694130.0,"Artificial Intelligence (AI), Solana Ecosystem, AI Agents, Pump.fun Ecosystem, Binance Alpha Spotlight, AI Framework"
NRN,neuron,Neuron,NRN,13870933,30863179.0,245935.0,"Artificial Intelligence (AI), Gaming (GameFi), NFT, Arbitrum Ecosystem, Paradigm Portfolio, AI Agents, AI Framework, Action Games, Robotics"
LUMIA,lumia,Lumia,LUMIA,11585168,36750558.0,2390360.0,"Smart Contract Platform, Layer 2 (L2), Real World Assets (RWA), Governance"
WEXO,wexo,Wexo,WEXO,11288862,30166527.0,165622.0,"Ethereum Ecosystem, Base Ecosystem"
PPC,peercoin,Peercoin,PPC,11037839,11037865.0,5041.36,"Smart Contract Platform, Polygon Ecosystem, Ethereum Ecosystem, Proof of Stake (PoS), Proof of Work (PoW)"
RARI,rarible,RARI,RARI,10359284,14297231.0,521969.0,"NFT, Ethereum Ecosystem, NFT Marketplace, Base Ecosystem, Coinbase Ventures Portfolio, Energi Ecosystem, Made in USA, Governance"
BELLS,bellscoin,Bellscoin,BELLS,9456673,9456673.0,355816.0,"Smart Contract Platform, Layer 1 (L1), Meme, Proof of Work (PoW), Inscriptions, Made in USA"
SCA,scallop-2,Scallop,SCA,9417347,18346835.0,3474058.0,"Decentralized Finance (DeFi), Lending/Borrowing Protocols, Sui Ecosystem"
TRIAS,trias-token,TriasLab,TRIAS,9347944,9347944.0,11235.0,"Artificial Intelligence (AI), Smart Contract Platform, BNB Chain Ecosystem, Layer 1 (L1), Ethereum Ecosystem, AI Agents"
XTER,xterio,Xterio,XTER,9198248,64945289.0,4563695.0,"Artificial Intelligence (AI), Gaming (GameFi), NFT, BNB Chain Ecosystem, Animoca Brands Portfolio, Gaming Blockchains, YZi Labs (Prev. Binance Labs) Portfolio, Binance Alpha Spotlight"
VADER,vaderai-by-virtuals,Vader,VADER,8503564,8503564.0,690769.0,"Artificial Intelligence (AI), Meme, Base Ecosystem, AI Meme, AI Agents, Virtuals Protocol Ecosystem, Binance Alpha Spotlight, Robotics"
TET,tectum,Tectum,TET,8489920,8580375.0,286372.0,"Smart Contract Platform, Layer 1 (L1), Ethereum Ecosystem, Bitcoin Sidechains, SideChain"
GRAM,gram-2,Gram,GRAM,7639737,7639737.0,13797.71,"TON Ecosystem, Proof of Work (PoW)"
CEEK,ceek,CEEK Smart VR,CEEK,6542526,6568802.0,154880.0,"Entertainment, BNB Chain Ecosystem, Metaverse, Ethereum Ecosystem, DWF Labs Portfolio"
SWAP,trustswap,TrustSwap,SWAP,6540104,6540104.0,148882.0,"Decentralized Finance (DeFi), BNB Chain Ecosystem, Avalanche Ecosystem, Launchpad, Polygon Ecosystem, Ethereum Ecosystem, Energi Ecosystem"
GRAIL,camelot-token,Camelot Token,GRAIL,6523781,24812679.0,88009.0,"Decentralized Exchange (DEX), Exchange-based Tokens, Arbitrum Ecosystem, Camelot Launchpad"
JETTON,jetton,JetTon Games,JETTON,6009658,9460560.0,84303.0,"Gambling (GambleFi), Telegram Apps, TON Ecosystem"
PAIN,pain,Pain,PAIN,5822825,11645742.0,97805.0,"Solana Ecosystem, Meme, Solana Meme, 4chan-Themed"
DEXTF,dextf,Memento,DEXTF,5630895,8556651.0,152994.0,"Decentralized Finance (DeFi), Asset Manager, Avalanche Ecosystem, Ethereum Ecosystem, ZkSync Ecosystem, Real World Assets (RWA), Privacy Blockchain"
SOVRN,sovrun,Sovrun,SOVRN,5627337,6061785.0,97205.0,"Gaming (GameFi), Metaverse, Ethereum Ecosystem, Animoca Brands Portfolio, Base Ecosystem, DWF Labs Portfolio, On-chain Gaming, Andreessen Horowitz (a16z) Portfolio, Hyperliquid Ecosystem, Delphi Ventures Portfolio, Circle Ventures Portfolio"
XX,xxcoin,XX Network,XX,5543907,15406684.0,127490.0,"Smart Contract Platform, Layer 1 (L1), Ethereum Ecosystem"
JOULE,joule-2,Joule,JOULE,5331381,5373896.0,15675.98,"Decentralized Finance (DeFi), Flare Network Ecosystem"
LVVA,levva-protocol,Levva Protocol,LVVA,5329445,5449633.0,2763219.0,"Decentralized Finance (DeFi), Analytics, Yield Farming, Yield Aggregator, Ethereum Ecosystem, Yield Optimizer"
OVR,ovr,Ovr,OVR,5297000,9071316.0,333131.0,"Artificial Intelligence (AI), Augmented Reality, BNB Chain Ecosystem, Polygon Ecosystem, Ethereum Ecosystem, DePIN, Base Ecosystem, Robotics"
FNCT,financie-token,Financie Token,FNCT,5292387,27850395.0,90803.0,"Polygon Ecosystem, Ethereum Ecosystem"
LCAT,lion-cat,Lion Cat,LCAT,5264734,6104039.0,37866.0,"BNB Chain Ecosystem, Meme, Cat-Themed"
VISTA,ethervista,Ethervista,VISTA,5045294,5045294.0,333776.0,"Decentralized Exchange (DEX), Exchange-based Tokens, Decentralized Finance (DeFi), Launchpad, Meme, Ethereum Ecosystem, Binance Alpha Spotlight"
EOS,binance-peg-eos,Binance-Peg EOS,EOS,4968587,4968587.0,1746.67,"Smart Contract Platform, BNB Chain Ecosystem, Binance-Peg Tokens"
RVF,rocketx,RocketX Exchange,RVF,4958801,5072998.0,2348.5,"Decentralized Exchange (DEX), Exchange-based Tokens, Decentralized Finance (DeFi), Automated Market Maker (AMM), Ethereum Ecosystem, Poolz Finance Launchpad"
GMM,gamium,Gamium,GMM,4779076,4880107.0,41251.0,"SocialFi, Gaming (GameFi), BNB Chain Ecosystem, Metaverse, DaoMaker Launchpad, Ethereum Ecosystem, Gaming Governance Token, Gaming Utility Token, Governance"
KIMA,kima,Kima Network,KIMA,4245215,13639705.0,812919.0,"Infrastructure, Cosmos Ecosystem, Arbitrum Ecosystem, Outlier Ventures Portfolio"
ZKL,zklink,zkLink,ZKL,3985041,10622392.0,2475232.0,"Smart Contract Platform, Ethereum Ecosystem, Zero Knowledge (ZK), Layer 3 (L3), zkLink Nova Ecosystem, OKX Ventures Portfolio"
RENTA,renta-network,Renta Network,RENTA,3937447,8883732.0,82862.0,"Retail, Smart Contract Platform, NFT, Ethereum Ecosystem, Layer 2 (L2), Real World Assets (RWA), NFTFi"
TATSU,tatsu,Tatsu,TATSU,3856586,3856586.0,128945.0,"Artificial Intelligence (AI), Ethereum Ecosystem, Bittensor Ecosystem"
QORPO,qopro,QORPO WORLD,QORPO,3774857,6272218.0,577064.0,"Gaming (GameFi), NFT, BNB Chain Ecosystem, Play To Earn, Ethereum Ecosystem, RPG, Gaming Utility Token, Adventure Games, Gaming Platform, Action Games"
APT,aptos,Aptos,APT,2339999069,3848937556.0,289717299.0,"Smart Contract Platform, Layer 1 (L1), Aptos Ecosystem, FTX Holdings, Coinbase Ventures Portfolio, Multicoin Capital Portfolio, Proof of Stake (PoS), DragonFly Capital Portfolio, Andreessen Horowitz (a16z) Portfolio, YZi Labs (Prev. Binance Labs) Portfolio, GMCI Layer 1 Index, GMCI 30 Index, Circle Ventures Portfolio, GMCI Index, Made in USA"
ICP,internet-computer,Internet Computer,ICP,1717647617,1717647617.0,59475656.0,"Artificial Intelligence (AI), Infrastructure, Smart Contract Platform, Layer 1 (L1), Ethereum Ecosystem, Internet Computer Ecosystem, Base Ecosystem, Alleged SEC Securities, Multicoin Capital Portfolio, Layer 0 (L0), Andreessen Horowitz (a16z) Portfolio, GMCI Layer 1 Index, GMCI 30 Index, Blockchain Capital Portfolio, GMCI Index, Polychain Capital Portfolio, Coinbase 50 Index, Governance"
FTN,fasttoken,Fasttoken,FTN,873698289,1754870589.0,29902404.0,"Smart Contract Platform, BNB Chain Ecosystem, Layer 1 (L1), Arbitrum Ecosystem, Ethereum Ecosystem, Base Ecosystem, Bahamut Ecosystem"
AERO,aerodrome-finance,Aerodrome Finance,AERO,759067837,1487211724.0,33503608.0,"Decentralized Exchange (DEX), Exchange-based Tokens, Decentralized Finance (DeFi), Automated Market Maker (AMM), Base Ecosystem, Binance Alpha Spotlight, Made in USA"
SYRUP,syrup,Maple Finance,SYRUP,402340222,437808649.0,24763557.0,"Decentralized Finance (DeFi), Yield Farming, Lending/Borrowing Protocols, Ethereum Ecosystem, Real World Assets (RWA), Base Ecosystem, Binance Alpha Spotlight"
TEL,telcoin,Telcoin,TEL,376217115,395696313.0,1769815.0,"Decentralized Finance (DeFi), Wallets, Polygon Ecosystem, Arbitrum Ecosystem, Ethereum Ecosystem, Payment Solutions, Base Ecosystem, Made in USA"
DEXE,dexe,DeXe,DEXE,373987461,632033703.0,8182181.0,"Artificial Intelligence (AI), Decentralized Finance (DeFi), BNB Chain Ecosystem, Ethereum Ecosystem"
DCR,decred,Decred,DCR,292325986,292339294.0,5041151.0,"Smart Contract Platform, Privacy, Layer 1 (L1), Proof of Stake (PoS), Proof of Work (PoW), Blockchain Capital Portfolio, Made in USA"
CCD,concordium,Concordium,CCD,222101239,268356143.0,840409.0,"Smart Contract Platform, Layer 1 (L1), Decentralized Identifier (DID), Zero Knowledge (ZK)"
TFUEL,theta-fuel,Theta Fuel,TFUEL,189185831,189185831.0,1271073.0,"Artificial Intelligence (AI), Smart Contract Platform, DePIN, Proof of Stake (PoS), Made in USA"
KMNO,kamino,Kamino,KMNO,183534820,601076341.0,22702970.0,"Decentralized Finance (DeFi), Lending/Borrowing Protocols, Solana Ecosystem, Binance Alpha Spotlight"
QUBIC,qubic-network,Qubic,QUBIC,180104735,226878167.0,3705758.0,"Artificial Intelligence (AI), Smart Contract Platform, Layer 1 (L1), Proof of Work (PoW)"
MEW,cat-in-a-dogs-world,cat in a dogs world,MEW,172820794,172820794.0,20207545.0,"Solana Ecosystem, Meme, Dog-Themed, Solana Meme, Cat-Themed"
YFI,yearn-finance,yearn.finance,YFI,164150326,177659152.0,11696657.0,"Decentralized Finance (DeFi), Yield Farming, Yield Aggregator, Yearn Ecosystem, Avalanche Ecosystem, Polygon Ecosystem, Near Protocol Ecosystem, Gnosis Chain Ecosystem, Fantom Ecosystem, Harmony Ecosystem, Arbitrum Ecosystem, Ethereum Ecosystem, Optimism Ecosystem, Base Ecosystem, Index Coop Defi Index, Alameda Research Portfolio, Energi Ecosystem, Sora Ecosystem, Huobi ECO Chain Ecosystem, Blockchain Capital Portfolio, Governance"
ZIL,zilliqa,Zilliqa,ZIL,157007182,162474704.0,9948144.0,"Smart Contract Platform, BNB Chain Ecosystem, GMCI Layer 1 Index, GMCI Index, Made in China"
MINA,mina-protocol,Mina Protocol,MINA,138154733,138154812.0,8098324.0,"Smart Contract Platform, Layer 1 (L1), Zero Knowledge (ZK), FTX Holdings, Paradigm Portfolio, Coinbase Ventures Portfolio, Multicoin Capital Portfolio, Proof of Stake (PoS), Pantera Capital Portfolio, Circle Ventures Portfolio, Privacy Blockchain, Polychain Capital Portfolio, Made in USA, Coinbase 50 Index"
YGG,yield-guild-games,Yield Guild Games,YGG,90580835,144584179.0,27280061.0,"Gaming (GameFi), NFT, BNB Chain Ecosystem, Metaverse, Collectibles, Polygon Ecosystem, Play To Earn, Harmony Ecosystem, Guild and Scholarship, Ethereum Ecosystem, Animoca Brands Portfolio, Base Ecosystem, DWF Labs Portfolio, Ronin Ecosystem, Gaming Governance Token, Andreessen Horowitz (a16z) Portfolio, Delphi Ventures Portfolio, Abstract Ecosystem"
SWFTC,swftcoin,SWFTCOIN,SWFTC,66151378,66151378.0,897920.0,"NFT, BNB Chain Ecosystem, Ethereum Ecosystem, Dex Aggregator"
ACH,alchemy-pay,Alchemy Pay,ACH,65125403,131734370.0,10719952.0,"BNB Chain Ecosystem, Ethereum Ecosystem, Payment Solutions, DWF Labs Portfolio, Made in China"
PEOPLE,constitutiondao,ConstitutionDAO,PEOPLE,64207167,64207167.0,20366641.0,"Meme, Ethereum Ecosystem, PolitiFi"
SGB,songbird,Songbird,SGB,60450479,71505603.0,226988.0,Smart Contract Platform
WHITE,whiteheart,Whiteheart,WHITE,60192896,60192896.0,4755.68,"Decentralized Finance (DeFi), Derivatives, Ethereum Ecosystem"
VVV,venice-token,Venice Token,VVV,59926185,114150375.0,2190982.0,"Artificial Intelligence (AI), Base Ecosystem, AI Agents, AI Applications, Made in USA"
CYBER,cyberconnect,CYBER,CYBER,54879004,110642335.0,10261758.0,"Artificial Intelligence (AI), Smart Contract Platform, SocialFi, NFT, BNB Chain Ecosystem, Binance Launchpool, Ethereum Ecosystem, Decentralized Identifier (DID), Optimism Ecosystem, Layer 2 (L2), Animoca Brands Portfolio, Multicoin Capital Portfolio, YZi Labs (Prev. Binance Labs) Portfolio, Delphi Ventures Portfolio, Cyber Ecosystem, Optimism Superchain Ecosystem, AI Applications, Governance"
EWT,energy-web-token,Energy Web,EWT,50986635,58122315.0,248805.0,"Energy, Polkadot Ecosystem, Gnosis Chain Ecosystem, Regenerative Finance (ReFi), Real World Assets (RWA), Blockchain Capital Portfolio, Hydration Ecosystem"
NOW,changenow,ChangeNOW,NOW,50637212,59095896.0,13811.93,"Decentralized Exchange (DEX), Exchange-based Tokens, BNB Chain Ecosystem, Ethereum Ecosystem"
CARV,carv,CARV,CARV,48114891,162900380.0,15694632.0,"Artificial Intelligence (AI), Infrastructure, Gaming (GameFi), NFT, BNB Chain Ecosystem, Solana Ecosystem, Arbitrum Ecosystem, Impossible Finance Launchpad, Ethereum Ecosystem, Animoca Brands Portfolio, Base Ecosystem"
WNXM,wrapped-nxm,Wrapped NXM,WNXM,46572246,46572246.0,179653.0,"Crypto-Backed Tokens, Decentralized Finance (DeFi), Insurance, Wrapped-Tokens, Ethereum Ecosystem, Blockchain Capital Portfolio"
USTC,terrausd,TerraClassicUSD,USTC,46076737,50214393.0,3920281.0,"Stablecoins, USD Stablecoin, Seigniorage, Alleged SEC Securities, Osmosis Ecosystem, DeFiance Capital Portfolio, Terra Classic Ecosystem, YZi Labs (Prev. Binance Labs) Portfolio, Delphi Ventures Portfolio, Galaxy Digital Portfolio, Fiat-backed Stablecoin"
DORA,dora-2,DORA,DORA,43540826,43540826.0,438005.0,"BNB Chain Ecosystem, Meme, Binance Alpha Spotlight, Chinese Meme"
CETUS,cetus-protocol,Cetus Protocol,CETUS,42864005,49896522.0,10296121.0,"Decentralized Exchange (DEX), Exchange-based Tokens, Decentralized Finance (DeFi), Sui Ecosystem, Animoca Brands Portfolio, OKX Ventures Portfolio, Dex Aggregator"
ISLM,islamic-coin,Islamic Coin,ISLM,39345394,365335729.0,176792.0,"Smart Contract Platform, Wallets, Layer 2 (L2), Osmosis Ecosystem"
UNP,unipoly,Unipoly,UNP,37947791,135901553.0,245807.0,"Gaming (GameFi), Ethereum Ecosystem, Skale Ecosystem"
AGLD,adventure-gold,Adventure Gold,AGLD,36449327,38701087.0,7317518.0,"Ethereum Ecosystem, DWF Labs Portfolio"
