ALI,alethea-artificial-liquid-intelligence-token,Artificial Liquid Intelligence,ALI,36112370,39093898.0,1531379.0,"Artificial Intelligence (AI), NFT, Metaverse, Solana Ecosystem, Polygon Ecosystem, Ethereum Ecosystem, Cronos Ecosystem, Base Ecosystem, Multicoin Capital Portfolio, AI Agents, Alameda Research Portfolio, DeFiance Capital Portfolio, YZi Labs (Prev. Binance Labs) Portfolio, Airdropped Tokens by NFT Projects, Governance"
ZRC,zircuit,Zircuit,ZRC,34906805,159034270.0,8566102.0,"Smart Contract Platform, BNB Chain Ecosystem, Ethereum Ecosystem, Layer 2 (L2), Zero Knowledge (ZK), Restaking, Zircuit Ecosystem"
DODO,dodo,DODO,DODO,34056343,34056343.0,3270717.0,"Decentralized Exchange (DEX), Exchange-based Tokens, Decentralized Finance (DeFi), BNB Chain Ecosystem, Binance Launchpool, Polygon Ecosystem, Near Protocol Ecosystem, Arbitrum Ecosystem, Ethereum Ecosystem, DWF Labs Portfolio, Coinbase Ventures Portfolio, Alameda Research Portfolio, DeFiance Capital Portfolio, Pantera Capital Portfolio, Aurora Ecosystem, Energi Ecosystem, YZi Labs (Prev. Binance Labs) Portfolio, Galaxy Digital Portfolio, Made in China"
AVAIL,avail,Avail,AVAIL,32754898,98832538.0,1893854.0,"Infrastructure, Smart Contract Platform, BNB Chain Ecosystem, Ethereum Ecosystem, Data Availability, Modular Blockchain, Binance Alpha Spotlight"
SCR,scroll,Scroll,SCR,32243141,169700740.0,8274967.0,"Smart Contract Platform, Binance Launchpool, Layer 2 (L2), Scroll Ecosystem"
ADS,adshares,Adshares,ADS,32123537,32136578.0,2800608.0,"Business Services, Decentralized Finance (DeFi), BNB Chain Ecosystem, Metaverse, Polygon Ecosystem, Ethereum Ecosystem, Base Ecosystem"
HFT,hashflow,Hashflow,HFT,31831065,52157985.0,9084061.0,"Decentralized Exchange (DEX), Exchange-based Tokens, Decentralized Finance (DeFi), BNB Chain Ecosystem, Binance Launchpool, MEV Protection, Ethereum Ecosystem, Coinbase Ventures Portfolio, Alameda Research Portfolio, DragonFly Capital Portfolio, Galaxy Digital Portfolio"
NCT,polyswarm,PolySwarm,NCT,31184995,31191814.0,133807.0,"Business Services, Polygon Ecosystem, Ethereum Ecosystem, Cybersecurity, Made in USA"
KSM,kusama,Kusama,KSM,29266161,142062375.0,10123116.0,"Smart Contract Platform, Polkadot Ecosystem, Proof of Stake (PoS), Pantera Capital Portfolio, Made in USA, Coinbase 50 Index, Hydration Ecosystem"
ELX,elixir-finance,Elixir,ELX,25973406,100178903.0,7612774.0,"Decentralized Finance (DeFi), Ethereum Ecosystem, Real World Assets (RWA), Stablecoin Issuer, RWA Protocol"
FORTH,ampleforth-governance-token,Ampleforth Governance,FORTH,25735690,34224396.0,4905596.0,"Ethereum Ecosystem, Stablecoin Issuer, Governance"
CWEB,coinweb,Coinweb,CWEB,21638586,25987076.0,206525.0,"Smart Contract Platform, Wallets, Ethereum Ecosystem, Interoperability, Layer 2 (L2), Cross-chain Communication, Bitcoin Sidechains, SideChain"
INV,inverse-finance,Inverse Finance,INV,18983524,22856396.0,139952.0,"Decentralized Finance (DeFi), Yield Farming, Yield Aggregator, Olympus Pro Ecosystem, Ethereum Ecosystem, Fixed Interest"
SYN,synapse-2,Synapse,SYN,18040017,20587373.0,4323291.0,"BNB Chain Ecosystem, Avalanche Ecosystem, Polygon Ecosystem, Fantom Ecosystem, Arbitrum Ecosystem, Olympus Pro Ecosystem, Ethereum Ecosystem, Optimism Ecosystem, Bridge Governance Tokens, Base Ecosystem, Alameda Research Portfolio, Intent"
PIVX,pivx,PIVX,PIVX,17726415,17726521.0,3401866.0,"Smart Contract Platform, Privacy, Masternodes, Zero Knowledge (ZK), Proof of Stake (PoS)"
CHEQ,cheqd-network,CHEQD Network,CHEQ,17549401,22825880.0,650191.0,"Smart Contract Platform, Ethereum Ecosystem, Decentralized Identifier (DID), Zero Knowledge (ZK), Animoca Brands Portfolio, Osmosis Ecosystem, Outlier Ventures Portfolio"
PORTAL,portal-2,Portal,PORTAL,16318014,27616642.0,5493398.0,"Gaming (GameFi), Solana Ecosystem, Ethereum Ecosystem, Gaming Platform"
ALU,altura,Altura,ALU,15922390,15922390.0,2934995.0,"Artificial Intelligence (AI), Infrastructure, Gaming (GameFi), NFT, BNB Chain Ecosystem, NFT Marketplace, Base Ecosystem, Gaming Platform, Made in USA, Gaming Marketplace"
D,dar-open-network,Dar Open Network,D,15374550,19125176.0,1280282.0,"Gaming (GameFi), BNB Chain Ecosystem, Binance Launchpool, Play To Earn, Ethereum Ecosystem, Animoca Brands Portfolio, AI Agents"
OCTA,octaspace,OctaSpace,OCTA,15341944,15341944.0,341632.0,"Artificial Intelligence (AI), Internet of Things (IOT), Smart Contract Platform, BNB Chain Ecosystem, Layer 1 (L1), Ethereum Ecosystem, DePIN, AI Agents"
SWEAT,sweatcoin,SWEAT,SWEAT,12977253,35072480.0,2705142.0,"Sports, Gaming (GameFi), BNB Chain Ecosystem, Solana Ecosystem, Avalanche Ecosystem, Polygon Ecosystem, Near Protocol Ecosystem, Play To Earn, Arbitrum Ecosystem, Celo Ecosystem, Move To Earn, Ethereum Ecosystem, Optimism Ecosystem, Aptos Ecosystem, Sui Ecosystem, Base Ecosystem, Gaming Governance Token, Gaming Utility Token, OKX Ventures Portfolio"
FLAY,flayer,Flayer,FLAY,12142983,20238305.0,334411.0,"Launchpad, Ethereum Ecosystem"
KENDU,kendu-inu,Kendu,KENDU,11700062,11752697.0,31420.0,"Solana Ecosystem, Meme, Ethereum Ecosystem, Base Ecosystem, Dog-Themed"
TKO,tokocrypto,Tokocrypto,TKO,10323186,68821243.0,1160978.0,"BNB Chain Ecosystem, Binance Launchpad, YZi Labs (Prev. Binance Labs) Portfolio"
J,jambo,Jambo,J,10231327,63545567.0,3220833.0,"Solana Ecosystem, Paradigm Portfolio, Coinbase Ventures Portfolio"
IZI,izumi-finance,iZUMi Finance,IZI,8456970,21480747.0,139837.0,"Decentralized Exchange (DEX), Exchange-based Tokens, Decentralized Finance (DeFi), Automated Market Maker (AMM), BNB Chain Ecosystem, Polygon Ecosystem, Arbitrum Ecosystem, Ethereum Ecosystem, ZkSync Ecosystem, Mantle Ecosystem, Linea Ecosystem, Base Ecosystem, Manta Network Ecosystem, Scroll Ecosystem"
BASEDAI,basedai,BasedAI,BASEDAI,8351751,8351751.0,98563.0,"Artificial Intelligence (AI), Ethereum Ecosystem, AI Agents"
UPC,upcx,UPCX,UPC,8307171,1561832270.0,596831.0,Ethereum Ecosystem
KASTA,kasta,Kasta,KASTA,7255693,14248833.0,534444.0,Polygon Ecosystem
STAT,stat,STAT,STAT,6125238,7819558.0,1179473.0,"Media, Ethereum Ecosystem"
ALVA,alvara-protocol,Alvara Protocol,ALVA,5954369,14619159.0,148973.0,"Decentralized Finance (DeFi), Avalanche Ecosystem, Ethereum Ecosystem"
FLIX,omniflix-network,OmniFlix Network,FLIX,5788680,6371141.0,4583.62,"NFT, Osmosis Ecosystem, Archway Ecosystem"
MODE,mode,Mode,MODE,5542724,11085449.0,759529.0,"Artificial Intelligence (AI), Infrastructure, Smart Contract Platform, Ethereum Ecosystem, Optimism Ecosystem, Layer 2 (L2), Mode Ecosystem, Optimism Superchain Ecosystem, DeFAI"
TICO,tico,Funtico,TICO,5070375,23701374.0,16151.31,"Gaming (GameFi), Avalanche Ecosystem, RPG"
GHUB,gemhub,GemHUB,GHUB,5003430,24748553.0,108160.0,Kaia Ecosystem
QBX,qbx,QBX,QBX,5000340,5000340.0,42885.0,Ethereum Ecosystem
GLQ,graphlinq-protocol,GraphLinq Chain,GLQ,4669723,6867239.0,170468.0,"Artificial Intelligence (AI), Business Services, Infrastructure, Smart Contract Platform, Analytics, Layer 1 (L1), Ethereum Ecosystem, DWF Labs Portfolio, AI Agents, DeFAI"
WINR,winr-protocol,WINR Protocol,WINR,4605118,4764620.0,32762.0,"Gambling (GambleFi), Infrastructure, Smart Contract Platform, Solana Ecosystem, Arbitrum Ecosystem, Camelot Launchpad, Layer 3 (L3)"
POR,portugal-national-team-fan-token,Portugal National Team Fan Token,POR,4599488,14714079.0,114653.0,"Sports, Fan Token, Chiliz Ecosystem"
RMV,reality-metaverse,Reality Metaverse,RMV,4418050,5918257.0,106032.0,"Gaming (GameFi), NFT, Metaverse, Polygon Ecosystem, Play To Earn, Ethereum Ecosystem, DWF Labs Portfolio, Gaming Utility Token"
ALON,alon,Alon,ALON,4236819,4236819.0,479328.0,"Solana Ecosystem, Pump.fun Ecosystem, Binance Alpha Spotlight"
SHIDO,shido-2,Shido Network,SHIDO,4054855,4054861.0,145985.0,"Ethereum Ecosystem, Osmosis Ecosystem, Shido Network Ecosystem"
MAVIA,heroes-of-mavia,Heroes of Mavia,MAVIA,3977593,19264117.0,2825989.0,"Gaming (GameFi), NFT, Ethereum Ecosystem, Animoca Brands Portfolio, Base Ecosystem, Gaming Governance Token, Strategy Games, Alameda Research Portfolio, YZi Labs (Prev. Binance Labs) Portfolio, Delphi Ventures Portfolio, Action Games"
GTAI,gt-protocol,GT Protocol,GTAI,3814331,7050175.0,1370542.0,"Artificial Intelligence (AI), BNB Chain Ecosystem, DeFAI"
SRM,serum,Serum,SRM,3650971,10703151.0,81494.0,"Decentralized Exchange (DEX), Exchange-based Tokens, Decentralized Finance (DeFi), Solana Ecosystem, Ethereum Ecosystem, FTX Holdings, Multicoin Capital Portfolio, Energi Ecosystem, Viction Ecosystem"
DEOD,decentrawood,Decentrawood,DEOD,3625651,3625651.0,239152.0,"Gaming (GameFi), BNB Chain Ecosystem, Metaverse, Solana Ecosystem, Polygon Ecosystem"
ALEX,alexgo,ALEX Lab,ALEX,3414730,3918273.0,237775.0,"Decentralized Finance (DeFi), Ethereum Ecosystem, DWF Labs Portfolio, Mode Ecosystem, Stacks Ecosystem, BTCfi Protocol"
CDX,cod3x,Cod3x,CDX,3221875,3221875.0,28442.0,"Artificial Intelligence (AI), Solana Ecosystem, Base Ecosystem, AI Agent Launchpad, AI Framework, DeFAI"
4EVER,4everland,4EVERLAND,4EVER,2790096,15375960.0,81019.0,"Artificial Intelligence (AI), BNB Chain Ecosystem, Ethereum Ecosystem, DePIN, AI Framework"
GENOME,genomesdao-genome,GenomesDAO GENOME,GENOME,2753235,2753235.0,66907.0,"Ethereum Ecosystem, Base Ecosystem, Decentralized Science (DeSci)"
ZYN,zyncoin-2,ZynCoin,ZYN,2728661,2728661.0,71274.0,"Solana Ecosystem, Meme, Ethereum Ecosystem, Parody Meme"
MLG,360noscope420blazeit,360noscope420blazeit,MLG,2486092,2486092.0,217809.0,"Solana Ecosystem, Meme, Solana Meme"
SMURFCAT,real-smurf-cat,Real Smurf Cat,SMURFCAT,2435594,2435594.0,77439.0,"Solana Ecosystem, Meme, Arbitrum Ecosystem, Ethereum Ecosystem, Cat-Themed"
MASK,catwifmask,catwifmask,MASK,2283786,2283786.0,323142.0,"Solana Ecosystem, Meme, Solana Meme, Cat-Themed, Pump.fun Ecosystem"
TREAT,shiba-inu-treat,Shiba Inu Treat,TREAT,1948512,9055997.0,173390.0,"Meme, Ethereum Ecosystem, Dog-Themed"
HXD,honeyland-honey,Honeyland,HXD,1767644,4029266.0,156375.0,"Gaming (GameFi), NFT, Solana Ecosystem, Play To Earn, Breeding, Gaming Utility Token, Strategy Games"
SLN,smart-layer-network,Smart Layer Network,SLN,1667272,2155263.0,28443.0,"Infrastructure, BNB Chain Ecosystem, Polygon Ecosystem, Ethereum Ecosystem, Optimism Ecosystem, ZkSync Ecosystem, Linea Ecosystem, Base Ecosystem, Scroll Ecosystem, Polygon zkEVM Ecosystem, Mint Ecosystem"
SOLAMA,solama,Solama,SOLAMA,1628443,1628443.0,161543.0,"Gambling (GambleFi), Solana Ecosystem, Meme, Solana Meme"
OFN,openfabric,Openfabric AI,OFN,1597580,1597580.0,74639.0,"Artificial Intelligence (AI), BNB Chain Ecosystem, ChainGPT Launchpad, Poolz Finance Launchpad, AI Agents, AI Applications, AI Framework, Governance"
LUCE,offcial-mascot-of-the-holy-year,Luce,LUCE,1505534,1505534.0,331883.0,"Solana Ecosystem, Meme, Solana Meme, Pump.fun Ecosystem, Mascot-Themed, Binance Alpha Spotlight"
L1,lamina1,Lamina1,L1,1372711,11826829.0,29038.0,"Smart Contract Platform, NFT, Metaverse, Layer 1 (L1), Avalanche Ecosystem, Avalanche L1, Made in USA"
BAX,babb,BABB,BAX,1205140,1211196.0,13017.23,Ethereum Ecosystem
GZONE,gamezone,GameZone,GZONE,1145735,1145735.0,17171.85,BNB Chain Ecosystem
LAVA,lava,Lava,LAVA,1111643,2936570.0,25835.0,
YULI,yuli,YULI,YULI,978730,978730.0,19646.85,"Gaming (GameFi), NFT, Meme, Kaia Ecosystem, Card Games, Gaming Utility Token, Anime-Themed"
KOM,kommunitas,Kommunitas [OLD],KOM,910733,1096765.0,8494.26,"Launchpad, Polygon Ecosystem, Arbitrum Ecosystem"
STETH,staked-ether,Lido Staked Ether,STETH,33783218189,33783218189.0,52376647.0,"Decentralized Finance (DeFi), Liquid Staking Tokens, Ethereum Ecosystem, Liquid Staked ETH, Liquid Staking"
HTX,htx-dao,HTX DAO,HTX,1873443906,1873443906.0,15912564.0,"Exchange-based Tokens, BNB Chain Ecosystem, Centralized Exchange (CEX) Token, Ethereum Ecosystem, Tron Ecosystem"
VET,vechain,VeChain,VET,1528135831,1528135831.0,24832725.0,"Internet of Things (IOT), Smart Contract Platform, Layer 1 (L1), VeChain Ecosystem, Made in China"
SAROS,saros-finance,Saros,SAROS,564263128,2149573962.0,3010103.0,"Decentralized Exchange (DEX), Exchange-based Tokens, Decentralized Finance (DeFi), Solana Ecosystem, Viction Ecosystem, Binance Alpha Spotlight"
TWT,trust-wallet-token,Trust Wallet,TWT,549462119,1318762153.0,33201147.0,"BNB Chain Ecosystem, Wallets, Account Abstraction, Energi Ecosystem"
GALA,gala,GALA,GALA,524221313,524221313.0,68900057.0,"Smart Contract Platform, Gaming (GameFi), NFT, Layer 1 (L1), Play To Earn, Ethereum Ecosystem, DWF Labs Portfolio, Gaming Platform, YZi Labs (Prev. Binance Labs) Portfolio, GalaChain Ecosystem, Made in USA"
TRIBE,tribe-2,Tribe,TRIBE,291034935,639615387.0,80972.0,"Decentralized Finance (DeFi), Ethereum Ecosystem, Stablecoin Issuer"
KAITO,kaito,KAITO,KAITO,261454951,1083127529.0,14820907.0,"Artificial Intelligence (AI), Analytics, Launchpad, Base Ecosystem, Binance HODLer Airdrops, InfoFi, Governance"
MOCA,mocaverse,Moca Network,MOCA,209688572,471566748.0,8967836.0,"Gaming (GameFi), Ethereum Ecosystem, Decentralized Identifier (DID), Animoca Brands Portfolio, Base Ecosystem, OKX Ventures Portfolio, Outlier Ventures Portfolio"
ZRO,layerzero,LayerZero,ZRO,192350866,1730507665.0,38450091.0,"Smart Contract Platform, BNB Chain Ecosystem, Avalanche Ecosystem, Polygon Ecosystem, Arbitrum Ecosystem, Ethereum Ecosystem, Optimism Ecosystem, Base Ecosystem, Multicoin Capital Portfolio, Layer 0 (L0), Cross-chain Communication, Circle Ventures Portfolio, Sequoia Capital Portfolio, OKX Ventures Portfolio"
BLUR,blur,Blur,BLUR,137635720,160966759.0,9896323.0,"NFT, Ethereum Ecosystem, NFT Marketplace, FTX Holdings, NFTFi, eGirl Capital Portfolio, Paradigm Portfolio, GMCI DeFi Index, GMCI Index, Made in USA, Coinbase 50 Index"
MPLX,metaplex,Metaplex,MPLX,132435148,225789952.0,5243680.0,"Gaming (GameFi), NFT, BNB Chain Ecosystem, Solana Ecosystem, Launchpad, Animoca Brands Portfolio, FTX Holdings, Multicoin Capital Portfolio, Alameda Research Portfolio, Binance Alpha Spotlight"
HOT,holotoken,Holo,HOT,122017286,122017286.0,7093659.0,"Smart Contract Platform, Storage, Harmony Ecosystem, Arbitrum Ecosystem, Ethereum Ecosystem, DePIN, Base Ecosystem, Energi Ecosystem, Sora Ecosystem, GMCI DePIN Index, GMCI Index"
CSPR,casper-network,Casper Network,CSPR,110339713,114237670.0,1167814.0,"Smart Contract Platform, Layer 1 (L1), Real World Assets (RWA), Proof of Stake (PoS), GMCI Layer 1 Index, GMCI Index, Made in USA"
HSK,hashkey-ecopoints,HashKey Platform Token,HSK,106560661,330461633.0,600543.0,"Exchange-based Tokens, Centralized Exchange (CEX) Token, Ethereum Ecosystem, Governance"
ANKR,ankr,Ankr Network,ANKR,105533904,105533904.0,7652363.0,"BNB Chain Ecosystem, Avalanche Ecosystem, Polygon Ecosystem, Fantom Ecosystem, Arbitrum Ecosystem, Ethereum Ecosystem, Optimism Ecosystem, Liquid Staking Governance Tokens, Linea Ecosystem, DePIN, Scroll Ecosystem, Rollups-as-a-Service (RaaS), Blast Ecosystem, Mode Ecosystem, Pantera Capital Portfolio, Polygon zkEVM Ecosystem, YZi Labs (Prev. Binance Labs) Portfolio, Liquid Staking, Made in USA, Governance"
EDU,edu-coin,Open Campus,EDU,100215828,168942396.0,41300125.0,"Education, BNB Chain Ecosystem, Polygon Ecosystem, Ethereum Ecosystem, Binance Launchpad, YZi Labs (Prev. Binance Labs) Portfolio"
GOHOME,gohome,GOHOME,GOHOME,92366259,1760566585.0,2827291.0,"Solana Ecosystem, Meme"
WILD,wilder-world,Wilder World,WILD,86075968,109190588.0,1593279.0,"Gaming (GameFi), NFT, BNB Chain Ecosystem, Metaverse, Solana Ecosystem, Avalanche Ecosystem, Polygon Ecosystem, Play To Earn, Ethereum Ecosystem, Animoca Brands Portfolio, Base Ecosystem, Gaming Governance Token, Racing Games, Simulation Games, Action Games"
XVS,venus,Venus,XVS,84404943,149916048.0,8725307.0,"Decentralized Finance (DeFi), Yield Farming, BNB Chain Ecosystem, Binance Launchpool, Lending/Borrowing Protocols, Arbitrum Ecosystem, Ethereum Ecosystem, Optimism Ecosystem, ZkSync Ecosystem, opBNB Ecosystem, Unichain Ecosystem"
JELLYJELLY,jelly-my-jelly,Jelly-My-Jelly,JELLYJELLY,78406261,78406261.0,6838310.0,"Solana Ecosystem, Pump.fun Ecosystem"
BLAST,blast,Blast,BLAST,72682124,150908102.0,3841242.0,"Smart Contract Platform, Layer 2 (L2), eGirl Capital Portfolio, Paradigm Portfolio, Blast Ecosystem"
CTK,certik,Shentu,CTK,57129961,57965403.0,2268531.0,"Business Services, Binance Launchpool, Osmosis Ecosystem, Coinbase Ventures Portfolio, Cybersecurity, YZi Labs (Prev. Binance Labs) Portfolio, OKX Ventures Portfolio"
PHA,pha,PHALA,PHA,50899129,62455837.0,8143601.0,"Artificial Intelligence (AI), Infrastructure, Smart Contract Platform, Oracle, Polkadot Ecosystem, Ethereum Ecosystem, Interoperability, Layer 2 (L2), Zero Knowledge (ZK), DePIN, DWF Labs Portfolio, Rollup, AI Agents, Sora Ecosystem, AI Framework, Made in USA"
RIF,rif-token,Rootstock Infrastructure Framework,RIF,48256976,48256976.0,828376.0,"Solana Ecosystem, Arbitrum Ecosystem, Ethereum Ecosystem, Base Ecosystem, Rootstock Ecosystem, Outlier Ventures Portfolio"
OMI,ecomi,ECOMI,OMI,47481448,54478914.0,3313703.0,"Gaming (GameFi), NFT, Metaverse, Collectibles, Play To Earn, Ethereum Ecosystem, Base Ecosystem, Energi Ecosystem"
FUN,funfair,FUNToken,FUN,44964056,46665211.0,4767266.0,"Gambling (GambleFi), Ethereum Ecosystem, Pantera Capital Portfolio, Energi Ecosystem"
GLMR,moonbeam,Moonbeam,GLMR,42478326,49871965.0,3950850.0,"Smart Contract Platform, Polkadot Ecosystem, Layer 1 (L1), Coinbase Ventures Portfolio, Proof of Stake (PoS), YZi Labs (Prev. Binance Labs) Portfolio"
SSV,ssv-network,SSV Network,SSV,40300366,80655496.0,20535650.0,"Decentralized Finance (DeFi), Ethereum Ecosystem, Restaking, Coinbase Ventures Portfolio, OKX Ventures Portfolio, Liquid Staking"
QI,benqi,BENQI,QI,40271325,40271325.0,1343618.0,"Decentralized Finance (DeFi), Yield Farming, Binance Launchpool, Lending/Borrowing Protocols, Avalanche Ecosystem, Liquid Staking Governance Tokens, DragonFly Capital Portfolio, Liquid Staking"
ZEREBRO,zerebro,Zerebro,ZEREBRO,39068870,39068870.0,15420218.0,"Solana Ecosystem, Meme, Solana Meme, AI Meme, Pump.fun Ecosystem, Binance Alpha Spotlight"
C98,coin98,Coin98,C98,38937259,38937300.0,8423076.0,"Decentralized Finance (DeFi), BNB Chain Ecosystem, Perpetuals, Solana Ecosystem, Wallets, Polygon Ecosystem, Ethereum Ecosystem, Binance Launchpad, DWF Labs Portfolio, Multicoin Capital Portfolio, Alameda Research Portfolio, Viction Ecosystem, YZi Labs (Prev. Binance Labs) Portfolio"
PHB,phoenix-global,Phoenix,PHB,31631378,31631378.0,10790229.0,"Artificial Intelligence (AI), Oracle, NFT, BNB Chain Ecosystem, DePIN, Made in China"
ACT,acet-token,Acet,ACT,31343708,40892250.0,9960.55,BNB Chain Ecosystem
KUJI,kujira,Kujira,KUJI,30629900,30637971.0,419.25,"Smart Contract Platform, Decentralized Finance (DeFi), BNB Chain Ecosystem, Layer 1 (L1), Arbitrum Ecosystem, Ethereum Ecosystem, Optimism Ecosystem, Osmosis Ecosystem, Secret Ecosystem"
STORJ,storj,Storj,STORJ,26074335,77069266.0,5358530.0,"Storage, Harmony Ecosystem, Ethereum Ecosystem, DePIN, Energi Ecosystem"
MNSRY,mansory-token,Mansory Token,MNSRY,23792800,23792800.0,1471566.0,"Retail, BNB Chain Ecosystem, Solana Ecosystem, Real World Assets (RWA), Pump.fun Ecosystem"
OORT,oort,OORT,OORT,23341545,75266321.0,371069.0,"Artificial Intelligence (AI), Storage, BNB Chain Ecosystem, Ethereum Ecosystem, DePIN, AI Agents, Made in USA"
NEON,neon,Neon,NEON,22343216,93304531.0,1133413.0,"Smart Contract Platform, Solana Ecosystem, Neon Ecosystem, Parallelized EVM"
MMUI,metamui,MetaMUI,MMUI,22196645,37315070.0,619801.0,Avalanche Ecosystem
BEL,bella-protocol,Bella Protocol,BEL,19853428,24816784.0,26952721.0,"Decentralized Finance (DeFi), Yield Farming, BNB Chain Ecosystem, Binance Launchpool, Yield Aggregator, Ethereum Ecosystem, Manta Network Ecosystem, YZi Labs (Prev. Binance Labs) Portfolio"
PNG,pangolin,Pangolin,PNG,19198603,46034075.0,711956.0,"Decentralized Exchange (DEX), Exchange-based Tokens, Decentralized Finance (DeFi), Avalanche Ecosystem, Olympus Pro Ecosystem"
M87,messier,MESSIER,M87,18994579,18994579.0,802552.0,"Decentralized Finance (DeFi), Ethereum Ecosystem"
RACA,radio-caca,Radio Caca,RACA,18850605,19033767.0,3439735.0,"Gaming (GameFi), NFT, BNB Chain Ecosystem, Metaverse, Play To Earn, Ethereum Ecosystem, DWF Labs Portfolio, OKT Chain Ecosystem"
PIKA,pikaboss,Pikaboss,PIKA,18000844,18000844.0,4078.54,"Meme, Ethereum Ecosystem"
LAT,platon-network,PlatON Network,LAT,17353689,26434276.0,3441573.0,"Smart Contract Platform, Appchains"
PERP,perpetual-protocol,Perpetual Protocol,PERP,16726330,34553839.0,6903150.0,"Decentralized Exchange (DEX), Exchange-based Tokens, Decentralized Finance (DeFi), Automated Market Maker (AMM), BNB Chain Ecosystem, Derivatives, Perpetuals, Gnosis Chain Ecosystem, Arbitrum Ecosystem, Ethereum Ecosystem, Optimism Ecosystem, Multicoin Capital Portfolio, Alameda Research Portfolio, YZi Labs (Prev. Binance Labs) Portfolio"
PROPC,propchain,Propchain,PROPC,16605229,24895844.0,432338.0,"Ethereum Ecosystem, Real World Assets (RWA)"
STNK,stonks-4,Stonks,STNK,16242871,16242871.0,318704.0,"Solana Ecosystem, Meme, Solana Meme, Wall Street Bets Themed, Stock market-themed"
GHST,aavegotchi,Aavegotchi,GHST,16044379,16543225.0,2039201.0,"Smart Contract Platform, Gaming (GameFi), NFT, Metaverse, Collectibles, Polygon Ecosystem, Meme, Play To Earn, Ethereum Ecosystem, Gotchiverse, Base Ecosystem, Layer 3 (L3), RPG, Gaming Governance Token, Gaming Utility Token, Energi Ecosystem, Governance"
SFI,saffron-finance,saffron.finance,SFI,16026736,18444833.0,170766.0,"Decentralized Finance (DeFi), Yield Farming, Ethereum Ecosystem, Fixed Interest, Coinbase Ventures Portfolio, Multicoin Capital Portfolio, DragonFly Capital Portfolio, Energi Ecosystem"
CXT,covalent-x-token,Covalent X Token,CXT,15703149,16625568.0,2049564.0,"Artificial Intelligence (AI), Infrastructure, Decentralized Finance (DeFi), Ethereum Ecosystem, Data Availability, Coinbase Ventures Portfolio, YZi Labs (Prev. Binance Labs) Portfolio"
BR,bedrock-token,Bedrock,BR,15314440,69611089.0,8693977.0,"Decentralized Finance (DeFi), BNB Chain Ecosystem, Ethereum Ecosystem, Liquid Staking Governance Tokens, Base Ecosystem, Berachain Ecosystem, BTCfi Protocol, Binance Wallet IDO"
UFD,unicorn-fart-dust,Unicorn Fart Dust,UFD,14818712,14818712.0,4322607.0,"Solana Ecosystem, Meme, Solana Meme, Pump.fun Ecosystem, Binance Alpha Spotlight, Made in USA"
QUICK,quick,Quickswap [OLD],QUICK,14376091,19529226.0,8052.58,"Decentralized Exchange (DEX), Exchange-based Tokens, Decentralized Finance (DeFi), Yield Farming, Automated Market Maker (AMM), Polygon Ecosystem, Ethereum Ecosystem"
DYDX,dydx,dYdX,ETHDYDX,14185946,295136713.0,15418720.0,"Decentralized Exchange (DEX), Exchange-based Tokens, Decentralized Finance (DeFi), Derivatives, Perpetuals, Ethereum Ecosystem, Paradigm Portfolio"
GHX,gamercoin,GamerCoin,GHX,13536944,15562794.0,170840.0,"Artificial Intelligence (AI), Infrastructure, BNB Chain Ecosystem, Solana Ecosystem, Ethereum Ecosystem, DePIN, AI Applications"
AVA,ava-ai,Ava AI,AVA,12790869,12790869.0,2847526.0,"Artificial Intelligence (AI), Solana Ecosystem, Meme, AI Meme, AI Agents, Pump.fun Ecosystem, Binance Alpha Spotlight, Made in USA"
ZEPH,zephyr-protocol,Zephyr Protocol,ZEPH,12367904,12368222.0,439667.0,"Smart Contract Platform, Privacy, Proof of Work (PoW), Stablecoin Issuer, Privacy Blockchain"
LOFI,lofi-2,LOFI,LOFI,12113605,12113605.0,666144.0,"Meme, Sui Ecosystem, Sui Meme"
KOMA,koma-inu,Koma Inu,KOMA,11999486,11999486.0,937984.0,"BNB Chain Ecosystem, Meme, Dog-Themed, Binance Alpha Spotlight, Made in USA"
FIS,stafi,Stafi,FIS,11220796,11220796.0,1672611.0,"Decentralized Finance (DeFi), Ethereum Ecosystem, Liquid Staking Governance Tokens, Osmosis Ecosystem, Sora Ecosystem, Liquid Staking"
DINERO,dinero-2,Dinero,DINERO,10615454,15834457.0,5646.19,"Infrastructure, Decentralized Finance (DeFi), Ethereum Ecosystem, Metagovernance, Liquid Staking Governance Tokens, LSDFi, Curve Ecosystem, Liquid Staking"
OPUL,opulous,Opulous,OPUL,10352113,10352113.0,651092.0,"Artificial Intelligence (AI), Music, NFT, BNB Chain Ecosystem, Arbitrum Ecosystem, Ethereum Ecosystem, Algorand Ecosystem, Real World Assets (RWA), Telegram Apps, AI Applications"
STUFF,book-2,STUFF.io,STUFF,9558967,24985849.0,18092.44,Cardano Ecosystem
XSWAP,xswap-2,XSwap,XSWAP,9527402,11279982.0,38454.0,"Decentralized Finance (DeFi), Ethereum Ecosystem, Base Ecosystem, Cross-chain Communication"
NIBI,nibiru,Nibiru,NIBI,9086732,11014705.0,300783.0,"Infrastructure, Smart Contract Platform, Layer 1 (L1), Osmosis Ecosystem, Made in USA"
RNT,reental,Reental,RNT,8999894,36588871.0,4284.33,"Tokenized Real Estate, Tokenized Assets, Polygon Ecosystem, Real World Assets (RWA), RWA Protocol"
VARA,vara-network,Vara Network,VARA,8871721,19454420.0,157657.0,"Smart Contract Platform, Layer 1 (L1)"
ULTI,ultiverse,Ultiverse,ULTI,8868900,12999850.0,3010637.0,"Gaming (GameFi), BNB Chain Ecosystem, Ethereum Ecosystem, Animoca Brands Portfolio, Binance Alpha Spotlight"
SFUND,seedify-fund,Seedify.fund,SFUND,8806930,21108902.0,736019.0,"Gaming (GameFi), BNB Chain Ecosystem, Launchpad, Arbitrum Ecosystem, Ethereum Ecosystem, DWF Labs Portfolio"
EVR,evernode,Evernode,EVR,8498679,16977006.0,9825.66,"Smart Contract Platform, Layer 2 (L2), DePIN"
CATE,catecoin,CateCoin,CATE,8313366,8642839.0,1847194.0,"Entertainment, Gaming (GameFi), Yield Farming, NFT, BNB Chain Ecosystem, Yield Aggregator, Launchpad, Wallets, Meme, Play To Earn, Ethereum Ecosystem, Base Ecosystem, Cat-Themed"
PSTAKE,pstake-finance,pSTAKE Finance,PSTAKE,8174371,8174371.0,5785105.0,"Smart Contract Platform, BNB Chain Ecosystem, Ethereum Ecosystem, Optimism Ecosystem, Liquid Staking Governance Tokens, Sui Ecosystem, Base Ecosystem, Coinbase Ventures Portfolio, Proof of Stake (PoS), Blast Ecosystem, Alameda Research Portfolio, DeFiance Capital Portfolio, YZi Labs (Prev. Binance Labs) Portfolio, Galaxy Digital Portfolio, Sequoia Capital Portfolio, Liquid Staking, BTCfi Protocol, Binance Alpha Spotlight"
