OCTA,octaspace,OctaSpace,OCTA,17628820,17628980.0,809560.0,"Artificial Intelligence (AI), Internet of Things (IOT), Smart Contract Platform, BNB Chain Ecosystem, Layer 1 (L1), Ethereum Ecosystem, DePIN, AI Agents"
KENDU,kendu-inu,Kendu Inu,KENDU,17272654,17355279.0,296870.0,"Solana Ecosystem, Meme, Ethereum Ecosystem, Base Ecosystem, Dog-Themed"
ADS,adshares,Adshares,ADS,16612321,16623050.0,82612.0,"Business Services, Decentralized Finance (DeFi), BNB Chain Ecosystem, Metaverse, Polygon Ecosystem, Ethereum Ecosystem, Base Ecosystem"
ALVA,alvara-protocol,Alvara Protocol,ALVA,16588234,44456381.0,587252.0,"Decentralized Finance (DeFi), Avalanche Ecosystem, Ethereum Ecosystem"
CHEQ,cheqd-network,CHEQD Network,CHEQ,14914361,19803560.0,339489.0,"Smart Contract Platform, Ethereum Ecosystem, Decentralized Identifier (DID), Zero Knowledge (ZK), Animoca Brands Portfolio, Osmosis Ecosystem, Outlier Ventures Portfolio"
UPC,upcx,UPCX,UPC,14491395,2724528869.0,726575.0,Ethereum Ecosystem
PIVX,pivx,PIVX,PIVX,14416090,14416191.0,2625089.0,"Smart Contract Platform, Privacy, Masternodes, Zero Knowledge (ZK), Proof of Stake (PoS)"
MASK,catwifmask,catwifmask,MASK,13296097,13296097.0,3975549.0,"Solana Ecosystem, Meme, Solana Meme, Cat-Themed, Pump.fun Ecosystem"
TKO,tokocrypto,Tokocrypto,TKO,12881120,85874132.0,2022091.0,"BNB Chain Ecosystem, Binance Launchpad, YZi Labs (Prev. Binance Labs) Portfolio"
KASTA,kasta,Kasta,KASTA,11590023,22763744.0,681560.0,Polygon Ecosystem
TICO,tico,Funtico,TICO,10836154,50692891.0,67609.0,"Gaming (GameFi), Avalanche Ecosystem, RPG"
MODE,mode,Mode,MODE,10697075,23596488.0,1776700.0,"Artificial Intelligence (AI), Infrastructure, Smart Contract Platform, Layer 2 (L2), Mode Ecosystem, Optimism Superchain Ecosystem, DeFAI"
BASEDAI,basedai,BasedAI,BASEDAI,10557026,10557026.0,146903.0,"Artificial Intelligence (AI), Ethereum Ecosystem, AI Agents"
MAVIA,heroes-of-mavia,Heroes of Mavia,MAVIA,9792076,47424587.0,12798842.0,"Gaming (GameFi), NFT, Ethereum Ecosystem, Animoca Brands Portfolio, Base Ecosystem, Gaming Governance Token, Strategy Games, Alameda Research Portfolio, YZi Labs (Prev. Binance Labs) Portfolio, Delphi Ventures Portfolio, Action Games"
MLG,360noscope420blazeit,360noscope420blazeit,MLG,9326335,9326335.0,1488157.0,"Solana Ecosystem, Meme, Solana Meme"
ZYN,zyncoin-2,ZynCoin,ZYN,8111563,8111563.0,107155.0,"Solana Ecosystem, Meme, Ethereum Ecosystem, Parody Meme"
CDX,cod3x,Cod3x,CDX,8085281,8085281.0,86239.0,"Artificial Intelligence (AI), Solana Ecosystem, Base Ecosystem, AI Agent Launchpad, AI Framework, DeFAI"
FLIX,omniflix-network,OmniFlix Network,FLIX,7823559,8648496.0,8467.03,"NFT, Osmosis Ecosystem, Archway Ecosystem"
QBX,qbx,QBX,QBX,7619523,7619523.0,66247.0,Ethereum Ecosystem
GLQ,graphlinq-protocol,GraphLinq Chain,GLQ,7466935,10980786.0,184902.0,"Artificial Intelligence (AI), Business Services, Infrastructure, Smart Contract Platform, Analytics, Layer 1 (L1), Ethereum Ecosystem, DWF Labs Portfolio, AI Agents, DeFAI"
FNCT,financie-token,Financie Token,FNCT,7069191,34348329.0,124893.0,Ethereum Ecosystem
4EVER,4everland,4EVERLAND,4EVER,7066698,38943914.0,504630.0,"Artificial Intelligence (AI), BNB Chain Ecosystem, Ethereum Ecosystem, DePIN, AI Framework"
ALU,altura,Altura,ALU,6229317,6229317.0,3607642.0,"Artificial Intelligence (AI), Infrastructure, Gaming (GameFi), NFT, BNB Chain Ecosystem, NFT Marketplace, Base Ecosystem, Gaming Platform, Made in USA, Gaming Marketplace"
GTAI,gt-protocol,GT Protocol,GTAI,5991442,11074215.0,1502287.0,"Artificial Intelligence (AI), BNB Chain Ecosystem, DeFAI"
QORPO,qopro,QORPO WORLD,QORPO,5910389,10266830.0,1027741.0,"Gaming (GameFi), NFT, BNB Chain Ecosystem, Play To Earn, Ethereum Ecosystem, RPG, Gaming Utility Token, Adventure Games, Gaming Platform, Action Games"
GENOME,genomesdao-genome,GenomesDAO GENOME,GENOME,5890644,5890644.0,84028.0,"Ethereum Ecosystem, Base Ecosystem, Decentralized Science (DeSci)"
WEXO,wexo,Wexo,WEXO,5839217,15404141.0,156580.0,"Ethereum Ecosystem, Base Ecosystem"
TRADE,polytrade,Polytrade,TRADE,5560697,12863049.0,159694.0,"BNB Chain Ecosystem, Polygon Ecosystem, Arbitrum Ecosystem, Ethereum Ecosystem, Real World Assets (RWA), Base Ecosystem, DWF Labs Portfolio"
ALEX,alexgo,ALEX Lab,ALEX,5405464,6281288.0,1119134.0,"Decentralized Finance (DeFi), Lending/Borrowing Protocols, Ethereum Ecosystem, DWF Labs Portfolio, Mode Ecosystem, Stacks Ecosystem, BTCfi Protocol"
SRM,serum,Serum,SRM,5347086,15675467.0,115430.0,"Decentralized Exchange (DEX), Exchange-based Tokens, Decentralized Finance (DeFi), Solana Ecosystem, Ethereum Ecosystem, FTX Holdings, Multicoin Capital Portfolio, Energi Ecosystem, Viction Ecosystem"
SMURFCAT,real-smurf-cat,Real Smurf Cat,SMURFCAT,5199099,5199099.0,92904.0,"Solana Ecosystem, Meme, Arbitrum Ecosystem, Ethereum Ecosystem, Cat-Themed"
STAT,stat,STAT,STAT,5178820,6611349.0,256161.0,"Media, Ethereum Ecosystem"
POLYDOGE,polydoge,PolyDoge,POLYDOGE,4173263,4179153.0,374400.0,"NFT, Polygon Ecosystem, Meme, Dog-Themed"
TREAT,shiba-inu-treat,Shiba Inu Treat,TREAT,3914819,18194702.0,705289.0,"Meme, Ethereum Ecosystem, Dog-Themed"
CANTO,canto,CANTO,CANTO,3878048,6373486.0,134197.0,"Smart Contract Platform, Layer 1 (L1), Ethereum Ecosystem, Canto Ecosystem, Real World Assets (RWA), Osmosis Ecosystem, Parallelized EVM"
IZI,izumi-finance,iZUMi Finance,IZI,3490799,8866648.0,68588.0,"Decentralized Exchange (DEX), Decentralized Finance (DeFi), Automated Market Maker (AMM), BNB Chain Ecosystem, Polygon Ecosystem, Arbitrum Ecosystem, Ethereum Ecosystem, ZkSync Ecosystem, Mantle Ecosystem, Linea Ecosystem, Base Ecosystem, Manta Network Ecosystem, Scroll Ecosystem"
ARCA,arca,Legend of Arcadia,ARCA,3246078,13440938.0,51967.0,"Gaming (GameFi), Ethereum Ecosystem, RPG"
WINR,winr-protocol,WINR Protocol,WINR,3147390,4464607.0,42655.0,"Gambling (GambleFi), Infrastructure, Smart Contract Platform, Solana Ecosystem, Arbitrum Ecosystem, Camelot Launchpad, Layer 3 (L3)"
DEOD,decentrawood,Decentrawood,DEOD,3088252,3088252.0,186762.0,"Gaming (GameFi), BNB Chain Ecosystem, Metaverse, Solana Ecosystem, Polygon Ecosystem"
SOLAMA,solama,Solama,SOLAMA,3063392,3063392.0,174462.0,"Gambling (GambleFi), Solana Ecosystem, Meme, Solana Meme"
SHIDO,shido-2,Shido Network,SHIDO,2967387,2967392.0,159974.0,"Ethereum Ecosystem, Osmosis Ecosystem, Shido Network Ecosystem"
MUMU,mumu,Mumu,MUMU,2699710,2699707.0,59747.0,"Meme, Ethereum Ecosystem, 4chan-Themed"
VMINT,volumint,VoluMint,VMINT,2432459,3991251.0,51677.0,"Artificial Intelligence (AI), Ethereum Ecosystem, Telegram Apps, Market-Making Solution"
MOVE,bluemove,BlueMove,MOVE,2303984,3177909.0,56254.0,"NFT, Aptos Ecosystem, Sui Ecosystem"
VGX,ethos,VGX Token,VGX,2257732,2264014.0,645319.0,"Gaming (GameFi), Ethereum Ecosystem, Galaxy Digital Portfolio"
RMV,reality-metaverse,Reality Metaverse,RMV,2070578,2773670.0,54471.0,"Gaming (GameFi), NFT, Metaverse, Polygon Ecosystem, Play To Earn, Ethereum Ecosystem, DWF Labs Portfolio, Gaming Utility Token"
YULI,yuli,YULI,YULI,2067909,2067909.0,59410.0,"Gaming (GameFi), NFT, Meme, Kaia Ecosystem, Card Games, Gaming Utility Token, Anime-Themed"
SLN,smart-layer-network,Smart Layer Network,SLN,2009133,2614659.0,69295.0,"Infrastructure, BNB Chain Ecosystem, Polygon Ecosystem, Ethereum Ecosystem, Optimism Ecosystem, ZkSync Ecosystem, Linea Ecosystem, Base Ecosystem, Scroll Ecosystem, Polygon zkEVM Ecosystem, Mint Ecosystem"
BAX,babb,BABB,BAX,1839829,1851401.0,20332.0,Ethereum Ecosystem
OFN,openfabric,Openfabric AI,OFN,1557848,1557848.0,32215.0,"Artificial Intelligence (AI), BNB Chain Ecosystem, ChainGPT Launchpad, Poolz Finance Launchpad, AI Agents, AI Applications, AI Framework"
STETH,staked-ether,Lido Staked Ether,STETH,40963954671,40963954671.0,175105725.0,"Decentralized Finance (DeFi), Liquid Staking Tokens, Ethereum Ecosystem, Liquid Staked ETH, Liquid Staking"
VET,vechain,VeChain,VET,2216328986,2216328986.0,48822025.0,"Internet of Things (IOT), Smart Contract Platform, Layer 1 (L1), VeChain Ecosystem, Made in China"
SAROS,saros-finance,Saros,SAROS,962415407,3666344649.0,8913920.0,"Decentralized Exchange (DEX), Decentralized Finance (DeFi), Solana Ecosystem, Viction Ecosystem"
QUBIC,qubic-network,Qubic,QUBIC,340020480,430667049.0,14586546.0,"Artificial Intelligence (AI), Smart Contract Platform, Layer 1 (L1), Proof of Work (PoW)"
TWT,trust-wallet-token,Trust Wallet,TWT,334959518,803935193.0,11279398.0,"BNB Chain Ecosystem, Wallets, Account Abstraction, Energi Ecosystem"
KAITO,kaito,KAITO,KAITO,292488929,1211691766.0,42623569.0,"Artificial Intelligence (AI), Analytics, Base Ecosystem, Binance HODLer Airdrops, InfoFi"
TRIBE,tribe-2,Tribe,TRIBE,287968691,632876619.0,97538.0,"Decentralized Finance (DeFi), Ethereum Ecosystem, Stablecoin Protocol"
MOCA,mocaverse,Moca Network,MOCA,279562788,686248468.0,26287770.0,"Gaming (GameFi), Ethereum Ecosystem, Decentralized Identifier (DID), Animoca Brands Portfolio, Base Ecosystem, OKX Ventures Portfolio, Outlier Ventures Portfolio"
TFUEL,theta-fuel,Theta Fuel,TFUEL,271095182,271095182.0,3652848.0,"Artificial Intelligence (AI), Smart Contract Platform, DePIN, Proof of Stake (PoS), Made in USA"
ZRO,layerzero,LayerZero,ZRO,252231272,2269228928.0,105080301.0,"Smart Contract Platform, BNB Chain Ecosystem, Avalanche Ecosystem, Polygon Ecosystem, Arbitrum Ecosystem, Ethereum Ecosystem, Optimism Ecosystem, Base Ecosystem, Multicoin Capital Portfolio, Layer 0 (L0), Cross-chain Communication, Circle Ventures Portfolio, Sequoia Capital Portfolio, OKX Ventures Portfolio"
BLUR,blur,Blur,BLUR,218462995,265869991.0,20736194.0,"NFT, Ethereum Ecosystem, NFT Marketplace, FTX Holdings, NFTFi, eGirl Capital Portfolio, Paradigm Portfolio, GMCI DeFi Index, GMCI Index, Made in USA, Coinbase 50 Index"
HOT,holotoken,Holo,HOT,184549055,184549055.0,7900636.0,"Smart Contract Platform, Storage, Harmony Ecosystem, Arbitrum Ecosystem, Ethereum Ecosystem, DePIN, Base Ecosystem, Energi Ecosystem, Sora Ecosystem, GMCI DePIN Index, GMCI Index"
ANKR,ankr,Ankr Network,ANKR,168286430,168286430.0,16300522.0,"BNB Chain Ecosystem, Avalanche Ecosystem, Polygon Ecosystem, Fantom Ecosystem, Arbitrum Ecosystem, Ethereum Ecosystem, Optimism Ecosystem, Liquid Staking Governance Tokens, Linea Ecosystem, DePIN, Scroll Ecosystem, Rollups-as-a-Service (RaaS), Blast Ecosystem, Mode Ecosystem, Pantera Capital Portfolio, Polygon zkEVM Ecosystem, YZi Labs (Prev. Binance Labs) Portfolio, Liquid Staking, Made in USA"
WILD,wilder-world,Wilder World,WILD,164711760,215538450.0,1741979.0,"Gaming (GameFi), NFT, Metaverse, Solana Ecosystem, Avalanche Ecosystem, Play To Earn, Ethereum Ecosystem, Animoca Brands Portfolio, Gaming Governance Token, Racing Games, Simulation Games, Action Games"
MPLX,metaplex,Metaplex,MPLX,157866336,189792205.0,8552756.0,"Gaming (GameFi), NFT, BNB Chain Ecosystem, Solana Ecosystem, Launchpad, Animoca Brands Portfolio, FTX Holdings, Multicoin Capital Portfolio, Alameda Research Portfolio, Binance Alpha Spotlight"
CSPR,casper-network,Casper Network,CSPR,147358734,152564458.0,3118098.0,"Smart Contract Platform, Layer 1 (L1), Real World Assets (RWA), Proof of Stake (PoS), GMCI Layer 1 Index, GMCI Index, Made in USA"
BLAST,blast,Blast,BLAST,136718388,312708561.0,11112756.0,"Smart Contract Platform, Layer 2 (L2), eGirl Capital Portfolio, Paradigm Portfolio, Blast Ecosystem"
HSK,hashkey-ecopoints,HashKey Platform Token,HSK,127715218,510901725.0,10430373.0,"Exchange-based Tokens, Centralized Exchange (CEX) Token, Ethereum Ecosystem"
GOHOME,gohome,GOHOME,GOHOME,116087728,2212714643.0,6476107.0,"Solana Ecosystem, Meme"
ACH,alchemy-pay,Alchemy Pay,ACH,112814697,228199326.0,22537229.0,"BNB Chain Ecosystem, Ethereum Ecosystem, Payment Solutions, DWF Labs Portfolio"
XVS,venus,Venus,XVS,111752948,198602650.0,10251527.0,"Decentralized Finance (DeFi), Yield Farming, BNB Chain Ecosystem, Binance Launchpool, Lending/Borrowing Protocols, Arbitrum Ecosystem, Ethereum Ecosystem, Optimism Ecosystem, ZkSync Ecosystem, opBNB Ecosystem, Unichain Ecosystem"
SWFTC,swftcoin,SWFTCOIN,SWFTC,109195506,109195506.0,1595556.0,"Exchange-based Tokens, NFT, BNB Chain Ecosystem, Ethereum Ecosystem"
ACT,acet-token,Acet,ACT,108006336,140909371.0,345182.0,BNB Chain Ecosystem
CETUS,cetus-protocol,Cetus Protocol,CETUS,94058087,112820652.0,16590293.0,"Decentralized Exchange (DEX), Decentralized Finance (DeFi), Sui Ecosystem, Animoca Brands Portfolio, OKX Ventures Portfolio, Dex Aggregator"
PHA,pha,PHALA,PHA,90798096,112589292.0,16328493.0,"Artificial Intelligence (AI), Infrastructure, Smart Contract Platform, Oracle, Polkadot Ecosystem, Ethereum Ecosystem, Interoperability, Layer 2 (L2), Zero Knowledge (ZK), DePIN, DWF Labs Portfolio, Rollup, AI Agents, Sora Ecosystem, AI Framework, Made in USA"
GLMR,moonbeam,Moonbeam,GLMR,77470922,91933173.0,8309648.0,"Smart Contract Platform, Polkadot Ecosystem, Layer 1 (L1), Coinbase Ventures Portfolio, Proof of Stake (PoS), YZi Labs (Prev. Binance Labs) Portfolio"
USDP,paxos-standard,Pax Dollar,USDP,66967119,66967119.0,5951383.0,"Stablecoins, USD Stablecoin, Solana Ecosystem, Ethereum Ecosystem, Multicoin Capital Portfolio, Fiat-backed Stablecoin"
CCD,concordium,Concordium,CCD,65027387,78584190.0,545898.0,"Smart Contract Platform, Layer 1 (L1), Decentralized Identifier (DID), Zero Knowledge (ZK)"
RIF,rif-token,Rootstock Infrastructure Framework,RIF,59163781,59163781.0,2798198.0,"Solana Ecosystem, Arbitrum Ecosystem, Ethereum Ecosystem, Base Ecosystem, Rootstock Ecosystem, Outlier Ventures Portfolio"
M87,messier,MESSIER,M87,58582676,58582676.0,994822.0,"Decentralized Finance (DeFi), Ethereum Ecosystem"
C98,coin98,Coin98,C98,56768948,56768964.0,16516659.0,"Decentralized Finance (DeFi), BNB Chain Ecosystem, Solana Ecosystem, Wallets, Polygon Ecosystem, Ethereum Ecosystem, Binance Launchpad, DWF Labs Portfolio, Multicoin Capital Portfolio, Alameda Research Portfolio, Viction Ecosystem, YZi Labs (Prev. Binance Labs) Portfolio"
CTK,certik,Shentu,CTK,52716750,53535772.0,9032612.0,"Business Services, Binance Launchpool, Osmosis Ecosystem, Coinbase Ventures Portfolio, Cybersecurity, YZi Labs (Prev. Binance Labs) Portfolio, OKX Ventures Portfolio"
OMI,ecomi,ECOMI,OMI,52242460,59941568.0,2172051.0,"Gaming (GameFi), NFT, Metaverse, Collectibles, Play To Earn, Ethereum Ecosystem, Base Ecosystem, Energi Ecosystem"
THE,thena,Thena,THE,48420574,112059345.0,29582361.0,"Decentralized Exchange (DEX), Decentralized Finance (DeFi), BNB Chain Ecosystem, opBNB Ecosystem, Binance HODLer Airdrops"
DODO,dodo,DODO,DODO,47820505,47820505.0,7027131.0,"Decentralized Exchange (DEX), Exchange-based Tokens, Decentralized Finance (DeFi), BNB Chain Ecosystem, Binance Launchpool, Polygon Ecosystem, Near Protocol Ecosystem, Arbitrum Ecosystem, Ethereum Ecosystem, DWF Labs Portfolio, Coinbase Ventures Portfolio, Alameda Research Portfolio, DeFiance Capital Portfolio, Pantera Capital Portfolio, Aurora Ecosystem, Energi Ecosystem, YZi Labs (Prev. Binance Labs) Portfolio, Galaxy Digital Portfolio"
UFD,unicorn-fart-dust,Unicorn Fart Dust,UFD,46015224,46015224.0,5515620.0,"Solana Ecosystem, Meme, Solana Meme, Pump.fun Ecosystem, Binance Alpha Spotlight, Made in USA"
ELX,elixir-finance,Elixir,ELX,45131561,174071523.0,11593985.0,"Decentralized Finance (DeFi), Ethereum Ecosystem, Real World Assets (RWA), Stablecoin Protocol, RWA Protocol"
STORJ,storj,Storj,STORJ,40682845,120248398.0,16787579.0,"Storage, Harmony Ecosystem, Ethereum Ecosystem, DePIN, Energi Ecosystem"
EDU,edu-coin,Open Campus,EDU,38122072,146564633.0,77548597.0,"Education, BNB Chain Ecosystem, Polygon Ecosystem, Ethereum Ecosystem, Binance Launchpad, YZi Labs (Prev. Binance Labs) Portfolio"
SFUND,seedify-fund,Seedify.fund,SFUND,37508291,59009779.0,5027331.0,"Gaming (GameFi), BNB Chain Ecosystem, Launchpad, Arbitrum Ecosystem, Ethereum Ecosystem, DWF Labs Portfolio"
AVA,ava-ai,Ava AI,AVA,35973036,35973036.0,19657188.0,"Artificial Intelligence (AI), Solana Ecosystem, Meme, AI Meme, AI Agents, Pump.fun Ecosystem, Binance Alpha Spotlight, Made in USA"
FORTH,ampleforth-governance-token,Ampleforth Governance,FORTH,32690507,43473203.0,11195457.0,"Ethereum Ecosystem, Stablecoin Protocol"
MMUI,metamui,MetaMUI,MMUI,32249627,54171346.0,548034.0,Avalanche Ecosystem
PHB,phoenix-global,Phoenix,PHB,31435264,31435264.0,10717977.0,"Artificial Intelligence (AI), Oracle, NFT, BNB Chain Ecosystem, DePIN, Made in China"
PNG,pangolin,Pangolin,PNG,30860003,75338668.0,690888.0,"Decentralized Exchange (DEX), Decentralized Finance (DeFi), Avalanche Ecosystem, Olympus Pro Ecosystem"
KUJI,kujira,Kujira,KUJI,30629900,30637971.0,2139.99,"Smart Contract Platform, Decentralized Finance (DeFi), BNB Chain Ecosystem, Layer 1 (L1), Arbitrum Ecosystem, Ethereum Ecosystem, Optimism Ecosystem, Osmosis Ecosystem, Secret Ecosystem"
T,talos-2,Talos,T,30561879,32170399.0,867277.0,"Artificial Intelligence (AI), Arbitrum Ecosystem, AI Agents, DeFAI"
ZEREBRO,zerebro,Zerebro,ZEREBRO,29142126,29142126.0,6449789.0,"Solana Ecosystem, Meme, Solana Meme, AI Meme, Pump.fun Ecosystem, Binance Alpha Spotlight"
DYDX,dydx,dYdX,ETHDYDX,28335088,589507748.0,22780687.0,"Decentralized Exchange (DEX), Exchange-based Tokens, Decentralized Finance (DeFi), Derivatives, Perpetuals, Ethereum Ecosystem, Paradigm Portfolio"
U,u,U,U,27500720,27500720.0,555434.0,"BNB Chain Ecosystem, Meme"
MNSRY,mansory-token,Mansory Token,MNSRY,27054811,27054811.0,1860080.0,"Retail, BNB Chain Ecosystem, Solana Ecosystem, Real World Assets (RWA), Pump.fun Ecosystem"
LOFI,lofi-2,LOFI,LOFI,26595735,26595735.0,1744165.0,"Meme, Sui Ecosystem, Sui Meme"
GHST,aavegotchi,Aavegotchi,GHST,26098201,26909637.0,16343621.0,"Smart Contract Platform, Gaming (GameFi), NFT, Metaverse, Collectibles, Polygon Ecosystem, Meme, Play To Earn, Ethereum Ecosystem, Gotchiverse, Base Ecosystem, Layer 3 (L3), RPG, Gaming Governance Token, Gaming Utility Token, Energi Ecosystem"
PIKA,pikaboss,Pikaboss,PIKA,24235513,24235513.0,30453.0,"Meme, Ethereum Ecosystem"
JELLYJELLY,jelly-my-jelly,Jelly-My-Jelly,JELLYJELLY,23612467,23612467.0,4371233.0,"Solana Ecosystem, Pump.fun Ecosystem"
OPUL,opulous,Opulous,OPUL,22440575,22440575.0,857071.0,"Artificial Intelligence (AI), Music, NFT, BNB Chain Ecosystem, Arbitrum Ecosystem, Ethereum Ecosystem, Algorand Ecosystem, Real World Assets (RWA), Telegram Apps, AI Applications"
PERP,perpetual-protocol,Perpetual Protocol,PERP,22152860,45764154.0,10224248.0,"Decentralized Exchange (DEX), Exchange-based Tokens, Decentralized Finance (DeFi), Automated Market Maker (AMM), BNB Chain Ecosystem, Derivatives, Perpetuals, Gnosis Chain Ecosystem, Arbitrum Ecosystem, Ethereum Ecosystem, Optimism Ecosystem, Multicoin Capital Portfolio, Alameda Research Portfolio, YZi Labs (Prev. Binance Labs) Portfolio"
NEON,neon,Neon,NEON,21873032,91341066.0,676818.0,"Smart Contract Platform, Solana Ecosystem, Neon Ecosystem, Parallelized EVM"
BEL,bella-protocol,Bella Protocol,BEL,21834607,27293259.0,5339097.0,"Decentralized Finance (DeFi), Yield Farming, BNB Chain Ecosystem, Binance Launchpool, Yield Aggregator, Ethereum Ecosystem, Manta Network Ecosystem, YZi Labs (Prev. Binance Labs) Portfolio"
LAT,platon-network,PlatON Network,LAT,21731839,33453699.0,3455403.0,"Smart Contract Platform, Appchains"
CWEB,coinweb,Coinweb,CWEB,21415469,26270377.0,147921.0,"Smart Contract Platform, Wallets, Ethereum Ecosystem, Interoperability, Layer 2 (L2), Cross-chain Communication, Bitcoin Sidechains, SideChain"
BENJI,basenji,Basenji,BENJI,20674167,20674167.0,7598264.0,"Meme, Base Ecosystem, Dog-Themed, Base Meme"
MSM,musmecoin,MusmeCoin,MSM,20583349,39583249.0,17181.3,"Meme, Ethereum Ecosystem, Anime-Themed, Oasys Ecosystem"
QUICK,quick,Quickswap [OLD],QUICK,20482022,27523769.0,19649.33,"Decentralized Exchange (DEX), Exchange-based Tokens, Decentralized Finance (DeFi), Yield Farming, Automated Market Maker (AMM), Polygon Ecosystem, Ethereum Ecosystem"
CATE,catecoin,CateCoin,CATE,19535715,20319311.0,143669.0,"Entertainment, Gaming (GameFi), Yield Farming, NFT, BNB Chain Ecosystem, Yield Aggregator, Launchpad, Wallets, Meme, Play To Earn, Ethereum Ecosystem, Base Ecosystem, Cat-Themed"
FIS,stafi,Stafi,FIS,18983564,18983564.0,4397563.0,"Decentralized Finance (DeFi), Ethereum Ecosystem, Liquid Staking Governance Tokens, Osmosis Ecosystem, Sora Ecosystem, Liquid Staking"
GHX,gamercoin,GamerCoin,GHX,18436712,21195829.0,435236.0,"Artificial Intelligence (AI), Infrastructure, BNB Chain Ecosystem, Solana Ecosystem, Ethereum Ecosystem, DePIN, AI Applications"
VARA,vara-network,Vara Network,VARA,17542055,44539746.0,236844.0,"Smart Contract Platform, Layer 1 (L1)"
PSTAKE,pstake-finance,pSTAKE Finance,PSTAKE,15968234,15968234.0,3262838.0,"Smart Contract Platform, BNB Chain Ecosystem, Ethereum Ecosystem, Optimism Ecosystem, Liquid Staking Governance Tokens, Sui Ecosystem, Base Ecosystem, Coinbase Ventures Portfolio, Proof of Stake (PoS), Blast Ecosystem, Alameda Research Portfolio, DeFiance Capital Portfolio, YZi Labs (Prev. Binance Labs) Portfolio, Galaxy Digital Portfolio, Sequoia Capital Portfolio, Liquid Staking, BTCfi Protocol, Binance Alpha Spotlight"
KOMA,koma-inu,Koma Inu,KOMA,14957352,14957352.0,1844854.0,"BNB Chain Ecosystem, Meme, Dog-Themed, Binance Alpha Spotlight, Made in USA"
SIGMA,sigma,Sigma,SIGMA,14569289,14569289.0,1467910.0,"Solana Ecosystem, Meme, Solana Meme, Pump.fun Ecosystem, 4chan-Themed"
CAM,camino-network,Camino Network,CAM,12933259,34343456.0,51320.0,"Smart Contract Platform, Layer 1 (L1), Outlier Ventures Portfolio"
ULTI,ultiverse,Ultiverse,ULTI,12089229,19952877.0,79539737.0,"Gaming (GameFi), BNB Chain Ecosystem, Ethereum Ecosystem, Animoca Brands Portfolio, Binance Alpha Spotlight"
ROOT,the-root-network,The Root Network,ROOT,11907058,46929564.0,3769332.0,"Smart Contract Platform, Gaming (GameFi), Layer 1 (L1), Ethereum Ecosystem, Gaming Blockchains, Outlier Ventures Portfolio"
SNAI,swarmnode-ai,SwarmNode.ai,SNAI,11555059,12803359.0,4469477.0,"Artificial Intelligence (AI), Infrastructure, Solana Ecosystem, Pump.fun Ecosystem, AI Agent Launchpad, Binance Alpha Spotlight, AI Framework, DeFAI"
CSWAP,chainswap-3,ChainSwap,CSWAP,11386436,11947102.0,49816.0,"Decentralized Exchange (DEX), Decentralized Finance (DeFi), Ethereum Ecosystem, Cross-chain Communication"
SLF,self-chain,Self Chain,SLF,11363969,22864034.0,6985338.0,"Infrastructure, Smart Contract Platform, Layer 1 (L1), Account Abstraction, Intent"
XSWAP,xswap-2,XSwap,XSWAP,11168460,14943475.0,364213.0,"Decentralized Finance (DeFi), Ethereum Ecosystem, Base Ecosystem, Cross-chain Communication"
OIK,space-nation-oikos,Space Nation Oikos,OIK,10886545,50195012.0,183932842.0,"Gaming (GameFi), NFT, BNB Chain Ecosystem, Immutable zkEVM Ecosystem, RPG, MMO"
REDO,resistance-dog,Resistance Dog,REDO,10538452,10538452.0,173204.0,"Meme, Dog-Themed, TON Ecosystem, TON Meme"
BR,bedrock-token,Bedrock,BR,10517083,50081346.0,44771454.0,"Decentralized Finance (DeFi), BNB Chain Ecosystem, Ethereum Ecosystem, Liquid Staking Governance Tokens, Base Ecosystem, Berachain Ecosystem, BTCfi Protocol, Binance Wallet IDO"
3ULL,playa3ull-games-2,PLAYA3ULL GAMES,3ULL,10439497,10455280.0,735188.0,"Smart Contract Platform, Gaming (GameFi), NFT, Avalanche Ecosystem, Play To Earn, Shooting Games, Avalanche L1, MMO"
AGRI,agridex-governance-token,AgriDex,AGRI,9226196,27651461.0,584029.0,"Tokenized Assets, Solana Ecosystem, Real World Assets (RWA), Tokenized Commodities"
DINERO,dinero-2,Dinero,DINERO,8467903,13542011.0,50588.0,"Infrastructure, Decentralized Finance (DeFi), Lending/Borrowing Protocols, Ethereum Ecosystem, Metagovernance, Liquid Staking Governance Tokens, LSDFi, Curve Ecosystem, Liquid Staking"
RNT,reental,Reental,RNT,8142639,38367217.0,11997.81,"Tokenized Real Estate, Tokenized Assets, Polygon Ecosystem, Real World Assets (RWA), RWA Protocol"
HDRO,hydro-protocol-2,Hydro Protocol,HDRO,8122637,22960512.0,90648.0,Injective Ecosystem
EVR,evernode,Evernode,EVR,7208626,14399990.0,8110.55,"Smart Contract Platform, Layer 2 (L2), DePIN"
NIBI,nibiru,Nibiru,NIBI,6906487,8839920.0,389797.0,"Infrastructure, Smart Contract Platform, Layer 1 (L1), Osmosis Ecosystem, Made in USA"
DOLAN,dolan-duck,Dolan Duck,DOLAN,6888934,6888934.0,165840.0,"Solana Ecosystem, Meme, Solana Meme, Parody Meme, 4chan-Themed"
GHUB,gemhub,GemHUB,GHUB,6767693,34360351.0,232278.0,Kaia Ecosystem
CLY,colony,Colony,CLY,6137203,8169183.0,116421.0,Avalanche Ecosystem
KISHU,kishu-inu,Kishu Inu,KISHU,5958007,5958000.0,129431.0,"Meme, Ethereum Ecosystem, Dog-Themed"
STNK,stonks-4,Stonks,STNK,5804576,5804576.0,253307.0,"Solana Ecosystem, Meme, Solana Meme, Wall Street Bets Themed, Stock market-themed"
BOTIFY,botify,BOTIFY,BOTIFY,5722145,5722145.0,947484.0,"Artificial Intelligence (AI), Retail, Solana Ecosystem, E-commerce"
DROP,drop-2,DROP,DROP,5527415,5527415.0,31932.0,"Meme, XRP Ledger Ecosystem"
XEL,xelis,Xelis,XEL,5511130,5511556.0,88370.0,"Smart Contract Platform, Privacy, Layer 1 (L1), Directed Acyclic Graph (DAG)"
WUSD,worldwide-usd,Worldwide USD,WUSD,5151573,5151573.0,1025317.0,"Stablecoins, USD Stablecoin, Polygon Ecosystem, Ethereum Ecosystem, Viction Ecosystem, Fiat-backed Stablecoin"
GRPH,soul-graph,Soul Graph,GRPH,4799219,4799219.0,92443.0,"Artificial Intelligence (AI), Solana Ecosystem, Pump.fun Ecosystem, AI Applications"
BRN,brn-metaverse,BRN Metaverse,BRN,4480196,4978076.0,972493.0,"Gaming (GameFi), BNB Chain Ecosystem, Metaverse"
SPARKLET,upland,Upland,SPARKLET,4294460,18293136.0,269526.0,"Gaming (GameFi), NFT, Metaverse, Play To Earn, Ethereum Ecosystem, Animoca Brands Portfolio, Venture Capital Portfolios, Made in USA"
OKB,okb,OKB,OKB,2792526341,10981967526.0,7626582.0,"Exchange-based Tokens, Centralized Exchange (CEX) Token, Ethereum Ecosystem, Sora Ecosystem, OKT Chain Ecosystem, GMCI 30 Index, GMCI Index, Made in China"
KAS,kaspa,Kaspa,KAS,2568424683,2588410682.0,98181995.0,"Smart Contract Platform, Layer 1 (L1), Proof of Work (PoW), Kaspa Ecosystem, Made in USA, Directed Acyclic Graph (DAG)"
