DASH,dash,Dash,DASH,244773216.0,244779506.0,14594185.0,"Smart Contract Platform, Privacy, Masternodes, Alleged SEC Securities, Proof of Stake (PoS), Proof of Work (PoW), Made in USA"
LGCT,legacy-token,Legacy Token,LGCT,192538738.0,544514797.0,5484832.0,"Education, Gaming (GameFi), BNB Chain Ecosystem, Base Ecosystem"
VTHO,vethor-token,VeThor,VTHO,171745641.0,171762787.0,2916346.0,"Layer 1 (L1), VeChain Ecosystem"
AI16Z,ai16z,ai16z,AI16Z,165728976.0,165728976.0,59109149.0,"Artificial Intelligence (AI), Solana Ecosystem, Meme, Solana Meme, Solana Token-2022, AI Meme, AI Agents, Binance Alpha Spotlight, AI Framework, Made in USA"
CELO,celo,Celo,CELO,164758387.0,286024215.0,27226399.0,"Smart Contract Platform, Celo Ecosystem, Layer 2 (L2), DWF Labs Portfolio, Coinbase Ventures Portfolio, Proof of Stake (PoS), Andreessen Horowitz (a16z) Portfolio, Optimism Superchain Ecosystem, Outlier Ventures Portfolio, Made in USA"
ELF,aelf,aelf,ELF,153553779.0,199906963.0,9288218.0,"Infrastructure, Smart Contract Platform, BNB Chain Ecosystem, Layer 1 (L1), Ethereum Ecosystem, GMCI Layer 1 Index, Aelf Ecosystem, GMCI Index"
DRIFT,drift-protocol,Drift Protocol,DRIFT,132861632.0,389241937.0,11707771.0,"Decentralized Finance (DeFi), Derivatives, Prediction Markets, Solana Ecosystem"
WOO,woo-network,WOO,WOO,127954537.0,148060070.0,6959715.0,"Decentralized Exchange (DEX), Exchange-based Tokens, Decentralized Finance (DeFi), Automated Market Maker (AMM), BNB Chain Ecosystem, Derivatives, Perpetuals, Centralized Exchange (CEX) Token, Solana Ecosystem, Avalanche Ecosystem, Polygon Ecosystem, Near Protocol Ecosystem, Fantom Ecosystem, Arbitrum Ecosystem, Ethereum Ecosystem, ZkSync Ecosystem, Mantle Ecosystem, Linea Ecosystem, Base Ecosystem, DragonFly Capital Portfolio, YZi Labs (Prev. Binance Labs) Portfolio"
NPC,non-playable-coin,Non-Playable Coin,NPC,122069272.0,122069272.0,5790616.0,"NFT, BNB Chain Ecosystem, Solana Ecosystem, Meme, Ethereum Ecosystem, Base Ecosystem, Hybrid Token Standards, Wojak-Themed, 4chan-Themed"
ZIG,zignaly,ZIGChain,ZIG,118015240.0,163665352.0,2258719.0,"Artificial Intelligence (AI), Smart Contract Platform, BNB Chain Ecosystem, Solana Ecosystem, Layer 1 (L1), Polygon Ecosystem, Ethereum Ecosystem, DWF Labs Portfolio, Injective Ecosystem, OKX Ventures Portfolio"
IO,io,io.net,IO,113138349.0,536298590.0,16249821.0,"Artificial Intelligence (AI), Internet of Things (IOT), Binance Launchpool, Solana Ecosystem, DePIN, Animoca Brands Portfolio, Multicoin Capital Portfolio, Delphi Ventures Portfolio, OKX Ventures Portfolio, Made in USA"
OZO,ozone-chain,Ozone Chain,OZO,107083533.0,128617716.0,242354.0,"Smart Contract Platform, Layer 1 (L1), Zero Knowledge (ZK)"
SIX,six,Six Sigma,SIX,93098425.0,93098425.0,120545.0,"Gambling (GambleFi), Solana Ecosystem"
BICO,biconomy,Biconomy,BICO,87049489.0,90279863.0,5454343.0,"Arbitrum Ecosystem, Ethereum Ecosystem, Account Abstraction, Coinbase Ventures Portfolio, YZi Labs (Prev. Binance Labs) Portfolio, Consensys Portfolio, Outlier Ventures Portfolio"
PAAL,paal-ai,PAAL AI,PAAL,86898139.0,96823347.0,4621062.0,"Artificial Intelligence (AI), Virtual Reality, BNB Chain Ecosystem, Launchpad, Ethereum Ecosystem, Telegram Apps, Discord Bots, Base Ecosystem, PAAL AI Launchpad, AI Agents, AI Applications, AI Agent Launchpad, Binance Alpha Spotlight, AI Framework, DeFAI, Made in USA"
TKX,tokenize-xchange,Tokenize Xchange,TKX,79995998.0,100000000.0,3748506.0,"Exchange-based Tokens, Centralized Exchange (CEX) Token, Ethereum Ecosystem, Titanchain Ecosystem"
OSAK,osaka-protocol,Osaka Protocol,OSAK,73151548.0,73151548.0,74801.0,"BNB Chain Ecosystem, Solana Ecosystem, Avalanche Ecosystem, Polygon Ecosystem, Meme, Arbitrum Ecosystem, Ethereum Ecosystem, Optimism Ecosystem, Base Ecosystem, Dog-Themed"
RLC,iexec-rlc,iExec RLC,RLC,65352491.0,78550048.0,3602126.0,"Artificial Intelligence (AI), Oracle, Ethereum Ecosystem, DePIN, AI Agents, Energi Ecosystem, Sora Ecosystem, GMCI DePIN Index, GMCI Index"
BAL,balancer,Balancer,BAL,61699463.0,66258511.0,4079135.0,"Decentralized Exchange (DEX), Exchange-based Tokens, Decentralized Finance (DeFi), Yield Farming, Automated Market Maker (AMM), Avalanche Ecosystem, Polygon Ecosystem, Near Protocol Ecosystem, Gnosis Chain Ecosystem, Harmony Ecosystem, Arbitrum Ecosystem, Ethereum Ecosystem, Optimism Ecosystem, Base Ecosystem, Index Coop Defi Index, Alameda Research Portfolio, DeFiance Capital Portfolio, Pantera Capital Portfolio, Energi Ecosystem, Polygon zkEVM Ecosystem, Huobi ECO Chain Ecosystem, Blockchain Capital Portfolio"
VEE,blockv,BLOCKv,VEE,59858538.0,59858538.0,15913.35,"NFT, Polygon Ecosystem, Ethereum Ecosystem, Optimism Ecosystem"
ANVL,anvil,Anvil,ANVL,59234239.0,214240148.0,163431.0,"Decentralized Finance (DeFi), Ethereum Ecosystem"
TAIKO,taiko,Taiko,TAIKO,58607114.0,376250403.0,8909896.0,"Smart Contract Platform, BNB Chain Ecosystem, Ethereum Ecosystem, Layer 2 (L2), Zero Knowledge (ZK), Rollup, OKX Ventures Portfolio, Centralized Exchange (CEX) Product, Binance Alpha Spotlight"
JOE,joe,JOE,JOE,56567168.0,70997911.0,5535510.0,"Decentralized Exchange (DEX), Decentralized Finance (DeFi), Yield Farming, Automated Market Maker (AMM), BNB Chain Ecosystem, Avalanche Ecosystem, Arbitrum Ecosystem, Mantle Ecosystem, DeFiance Capital Portfolio, Delphi Ventures Portfolio, Dex Aggregator"
AO,ao-computer,ao Computer,AO,54593576.0,54593576.0,1456428.0,"Artificial Intelligence (AI), Smart Contract Platform, DePIN"
SUNDOG,sundog,Sundog,SUNDOG,54383283.0,54383283.0,8120143.0,"Meme, Tron Ecosystem, Sun Pump Ecosystem, TRON Meme"
CHILLGUY,chill-guy,Just a chill guy,CHILLGUY,52661216.0,52661216.0,15041071.0,"Solana Ecosystem, Meme, Dog-Themed, Solana Meme, Pump.fun Ecosystem, TikTok Meme"
SCRT,secret,Secret,SCRT,51412335.0,54038536.0,4238459.0,"Artificial Intelligence (AI), Smart Contract Platform, Cosmos Ecosystem, Layer 1 (L1), Osmosis Ecosystem, Alameda Research Portfolio, DragonFly Capital Portfolio, DeFiance Capital Portfolio, Privacy Blockchain, Outlier Ventures Portfolio"
ACS,access-protocol,Access Protocol,ACS,51238263.0,109072554.0,4175042.0,"SocialFi, Solana Ecosystem"
VANRY,vanar-chain,Vanar Chain,VANRY,50227412.0,51658318.0,7736791.0,"Smart Contract Platform, Gaming (GameFi), NFT, Layer 1 (L1), Polygon Ecosystem, Ethereum Ecosystem, Vanar Chain Ecosystem"
QKC,quark-chain,QuarkChain,QKC,48832744.0,68408268.0,8769784.0,"Infrastructure, Ethereum Ecosystem, Energi Ecosystem"
GPS,goplus-security,GoPlus Security,GPS,43214967.0,238309074.0,5274006.0,"BNB Chain Ecosystem, Base Ecosystem, Cybersecurity, YZi Labs (Prev. Binance Labs) Portfolio, OKX Ventures Portfolio, Binance Alpha Spotlight"
NOS,nosana,Nosana,NOS,42908249.0,51448740.0,435455.0,"Artificial Intelligence (AI), Solana Ecosystem, DePIN"
FORT,forta,Forta,FORT,40835983.0,67975167.0,2381046.0,"Artificial Intelligence (AI), Polygon Ecosystem, Ethereum Ecosystem, Coinbase Ventures Portfolio, Cybersecurity, Andreessen Horowitz (a16z) Portfolio, Blockchain Capital Portfolio"
MBX,marblex,MARBLEX,MBX,40743145.0,61235685.0,1631766.0,"Smart Contract Platform, Gaming (GameFi), NFT, BNB Chain Ecosystem, Kaia Ecosystem, Aptos Ecosystem, DWF Labs Portfolio, Gaming Blockchains"
QI,benqi,BENQI,QI,40566650.0,41741910.0,3475902.0,"Decentralized Finance (DeFi), Yield Farming, Binance Launchpool, Lending/Borrowing Protocols, Avalanche Ecosystem, Liquid Staking Governance Tokens, DragonFly Capital Portfolio, Liquid Staking"
OGN,origin-protocol,Origin Token,OGN,36853743.0,74316938.0,13880090.0,"NFT, Ethereum Ecosystem, Base Ecosystem, Pantera Capital Portfolio, Sonic Ecosystem, Made in USA"
UQC,uquid-coin,Uquid Coin,UQC,35042345.0,140169381.0,51711.0,Ethereum Ecosystem
AINTI,aintivirus,AIntivirus,AINTI,33728677.0,33728677.0,0.0,"Solana Ecosystem, Meme, AI Meme, Pump.fun Ecosystem"
APX,apollox-2,APX,APX,33152301.0,306380019.0,655290.0,"Decentralized Finance (DeFi), BNB Chain Ecosystem, Perpetuals, YZi Labs (Prev. Binance Labs) Portfolio, Binance Alpha Spotlight"
RSS3,rss3,RSS3,RSS3,32505627.0,41582037.0,2508374.0,"Artificial Intelligence (AI), Infrastructure, Storage, Ethereum Ecosystem, Coinbase Ventures Portfolio, DragonFly Capital Portfolio, RSS3 VSL Ecosystem, AI Framework, DeFAI"
L3,layer3,Layer3,L3,30483013.0,154025103.0,6700887.0,"Marketing, BNB Chain Ecosystem, Solana Ecosystem, Polygon Ecosystem, Arbitrum Ecosystem, Ethereum Ecosystem, Decentralized Identifier (DID), Optimism Ecosystem, Quest-to-Earn, Made in USA"
MAPO,marcopolo,MAP Protocol,MAPO,27322558.0,44899983.0,418018.0,"BNB Chain Ecosystem, Ethereum Ecosystem, DWF Labs Portfolio"
NAVX,navi,NAVI Protocol,NAVX,23101180.0,40102912.0,1926153.0,"Decentralized Finance (DeFi), Lending/Borrowing Protocols, Sui Ecosystem, OKX Ventures Portfolio"
PIKA,pikaboss,Pikaboss,PIKA,21729751.0,21729751.0,1600.83,"Meme, Ethereum Ecosystem"
XTER,xterio,Xterio,XTER,19846813.0,140787841.0,15532168.0,"Artificial Intelligence (AI), Gaming (GameFi), NFT, BNB Chain Ecosystem, Animoca Brands Portfolio, Gaming Blockchains, YZi Labs (Prev. Binance Labs) Portfolio, Binance Alpha Spotlight"
LYX,lukso-token-2,LUKSO,LYX,19361102.0,26702870.0,1876171.0,"Smart Contract Platform, SocialFi, Layer 1 (L1), Decentralized Identifier (DID), Proof of Stake (PoS), Lukso Ecosystem"
FARTBOY,fartboy,Fartboy,$FARTBOY,18287496.0,18287496.0,221424.0,"Solana Ecosystem, Meme, Solana Meme, Pump.fun Ecosystem"
FLOCK,flock-2,FLOCK,FLOCK,16624283.0,150887200.0,5122378.0,"Artificial Intelligence (AI), Base Ecosystem, AI Applications, Binance Alpha Spotlight"
RARI,rarible,RARI,RARI,16535479.0,22811482.0,1268942.0,"NFT, Ethereum Ecosystem, NFT Marketplace, Coinbase Ventures Portfolio, Energi Ecosystem, Made in USA"
PIPPIN,pippin,pippin,PIPPIN,16324342.0,16324342.0,7701165.0,"Artificial Intelligence (AI), Infrastructure, Solana Ecosystem, Meme, Solana Meme, AI Meme, AI Agents, Pump.fun Ecosystem, Binance Alpha Spotlight, AI Framework"
LUMIA,lumia,Lumia,LUMIA,16216918.0,51443432.0,3987312.0,"Smart Contract Platform, Layer 2 (L2), Real World Assets (RWA)"
NRN,neuron,Neuron,NRN,15478725.0,35998187.0,369843.0,"Artificial Intelligence (AI), Gaming (GameFi), NFT, Arbitrum Ecosystem, Paradigm Portfolio, AI Agents, AI Framework, Action Games"
SEDA,seda-2,SEDA,SEDA,15241287.0,45599413.0,569766.0,"Smart Contract Platform, Oracle, Ethereum Ecosystem, Base Ecosystem, Modular Blockchain, Osmosis Ecosystem"
CRTS,cratos,Cratos,CRTS,14031951.0,22108079.0,646538.0,"BNB Chain Ecosystem, Ethereum Ecosystem"
HMT,human-protocol,HUMAN Protocol,HMT,13673378.0,18041934.0,56221.0,"Artificial Intelligence (AI), Infrastructure, Software as a service, Polygon Ecosystem, Ethereum Ecosystem, Market-Making Solution, AI Framework"
TLOS,telos,Telos,TLOS,13322668.0,13322669.0,2233807.0,"Smart Contract Platform, BNB Chain Ecosystem, Layer 1 (L1), Avalanche Ecosystem, Polygon Ecosystem, Arbitrum Ecosystem, Ethereum Ecosystem, Zero Knowledge (ZK), Telos Ecosystem, Consensys Portfolio"
PEPE,based-pepe,Based Pepe,PEPE,11264466.0,11264466.0,580940.0,"Meme, Base Ecosystem, Frog-Themed, Base Meme, The Boys Club"
WALLET,ambire-wallet,Ambire Wallet,WALLET,10146355.0,10204874.0,247780.0,"Wallets, Polygon Ecosystem, Ethereum Ecosystem, Base Ecosystem, Account Abstraction"
BELLS,bellscoin,Bellscoin,BELLS,10019180.0,10019197.0,706697.0,"Smart Contract Platform, Layer 1 (L1), Meme, Proof of Work (PoW), Inscriptions, Made in USA"
BUZZ,hive-ai,Hive AI,BUZZ,9855987.0,9855987.0,8068575.0,"Decentralized Finance (DeFi), Solana Ecosystem, AI Agents, Pump.fun Ecosystem, Binance Alpha Spotlight, DeFAI"
EOS,binance-peg-eos,Binance-Peg EOS,EOS,9760844.0,9760844.0,49550.0,"Smart Contract Platform, BNB Chain Ecosystem, Binance-Peg Tokens"
JETTON,jetton,JetTon Games,JETTON,9693230.0,15099916.0,130212.0,"Gambling (GambleFi), Telegram Apps, TON Ecosystem"
CA,ca-htb,Coupon Assets,CA,9404148.0,138053723.0,2308156.0,"Retail, Ethereum Ecosystem"
TRIAS,trias-token,TriasLab,TRIAS,8962423.0,8962423.0,354620.0,"Artificial Intelligence (AI), Smart Contract Platform, BNB Chain Ecosystem, Layer 1 (L1), Ethereum Ecosystem, AI Agents"
PPC,peercoin,Peercoin,PPC,7832098.0,7832107.0,6.14,"Smart Contract Platform, Polygon Ecosystem, Ethereum Ecosystem, Proof of Stake (PoS), Proof of Work (PoW)"
LCAT,lion-cat,Lion Cat,LCAT,7707087.0,10893409.0,111996.0,"BNB Chain Ecosystem, Meme, Cat-Themed"
LMT,limitus,LIMITUS,LMT,7593652.0,7593652.0,547541.0,"Artificial Intelligence (AI), Solana Ecosystem, Pump.fun Ecosystem, Binance Alpha Spotlight"
GRAM,gram-2,Gram,GRAM,7192474.0,7192474.0,50171.0,"TON Ecosystem, Proof of Work (PoW)"
SOVRN,sovrun,Sovrun,SOVRN,6919093.0,7453268.0,147561.0,"Gaming (GameFi), Metaverse, Ethereum Ecosystem, Animoca Brands Portfolio, Base Ecosystem, DWF Labs Portfolio, On-chain Gaming, Andreessen Horowitz (a16z) Portfolio, Hyperliquid Ecosystem, Delphi Ventures Portfolio, Circle Ventures Portfolio"
XX,xxcoin,XX Network,XX,6691775.0,19138638.0,125524.0,"Smart Contract Platform, Layer 1 (L1), Ethereum Ecosystem"
APP,moon-app,RWAX,APP,5916205.0,14669612.0,318385.0,"Tokenized Real Estate, Tokenized Assets, BNB Chain Ecosystem, Solana Ecosystem, Ethereum Ecosystem, Real World Assets (RWA), Injective Ecosystem, RWA Protocol"
SKOP,skull-of-pepe-token,Skull of Pepe Token,SKOP,5782126.0,5782126.0,231093.0,"Meme, Base Ecosystem, Frog-Themed, Base Meme, The Boys Club"
VRTX,vertex-protocol,Vertex,VRTX,5639172.0,10706988.0,1100187.0,"Decentralized Exchange (DEX), Exchange-based Tokens, Decentralized Finance (DeFi), Derivatives, Perpetuals, Avalanche Ecosystem, Arbitrum Ecosystem, Mantle Ecosystem, Base Ecosystem, Blast Ecosystem, Sonic Ecosystem, Sei Network Ecosystem"
VISTA,ethervista,Ethervista,VISTA,5351229.0,5351229.0,1139581.0,"Decentralized Exchange (DEX), Launchpad, Ethereum Ecosystem, Binance Alpha Spotlight"
OSMI,osmi,OSMI,OSMI,5268182.0,6030566.0,19569.48,"Artificial Intelligence (AI), Ethereum Ecosystem, DePIN, AI Applications"
HAPPY,happycat-2,Happy Cat,HAPPY,5221578.0,5221578.0,1248867.0,"BNB Chain Ecosystem, Solana Ecosystem, Meme, Cat-Themed, Binance Alpha Spotlight"
ZKL,zklink,zkLink,ZKL,4947678.0,16345024.0,3481203.0,"Smart Contract Platform, Ethereum Ecosystem, Zero Knowledge (ZK), Layer 3 (L3), zkLink Nova Ecosystem, OKX Ventures Portfolio"
OBT,oobit,Oobit,OBT,4721546.0,13412557.0,84732.0,"BNB Chain Ecosystem, Ethereum Ecosystem, Payment Solutions"
OVR,ovr,Ovr,OVR,4638106.0,7942935.0,296522.0,"Augmented Reality, NFT, BNB Chain Ecosystem, Metaverse, Polygon Ecosystem, Ethereum Ecosystem, DePIN, Base Ecosystem"
ELON4AFD,elon4afd,Elon4AfD,ELON4AFD,4591261.0,4591261.0,218380.0,"Solana Ecosystem, Meme, Elon Musk-Inspired, Pump.fun Ecosystem"
KIMA,kima,Kima Network,KIMA,4130199.0,16590570.0,146981.0,"Infrastructure, Cosmos Ecosystem, Arbitrum Ecosystem, Outlier Ventures Portfolio"
RVF,rocketx,RocketX Exchange,RVF,3594495.0,3677273.0,37175.0,"Decentralized Exchange (DEX), Decentralized Finance (DeFi), Automated Market Maker (AMM), Ethereum Ecosystem, Poolz Finance Launchpad"
EGP,eigenpie,Eigenpie,EGP,3572214.0,9673640.0,1108786.0,"Decentralized Finance (DeFi), BNB Chain Ecosystem, Arbitrum Ecosystem, Restaking, Liquid Staking"
TET,tectum,Tectum,TET,3535116.0,4074100.0,210252.0,"Smart Contract Platform, Layer 1 (L1), Ethereum Ecosystem, Bitcoin Sidechains, SideChain"
ICP,internet-computer,Internet Computer,ICP,2552302505.0,2552302813.0,38713986.0,"Artificial Intelligence (AI), Infrastructure, Smart Contract Platform, Layer 1 (L1), Internet Computer Ecosystem, Alleged SEC Securities, Multicoin Capital Portfolio, Layer 0 (L0), Andreessen Horowitz (a16z) Portfolio, GMCI Layer 1 Index, GMCI 30 Index, Blockchain Capital Portfolio, GMCI Index, Polychain Capital Portfolio, Coinbase 50 Index"
FTN,fasttoken,Fasttoken,FTN,1913837938.0,3864970648.0,59435292.0,"Smart Contract Platform, BNB Chain Ecosystem, Layer 1 (L1), Arbitrum Ecosystem, Ethereum Ecosystem, Base Ecosystem, Bahamut Ecosystem"
POL,polygon-ecosystem-token,POL (ex-MATIC),POL,1664691717.0,1933398743.0,51038231.0,"Smart Contract Platform, Polygon Ecosystem, Ethereum Ecosystem, Layer 2 (L2)"
STX,blockstack,Stacks,STX,994820347.0,994820347.0,21557287.0,"Infrastructure, Smart Contract Platform, Layer 2 (L2), Bitcoin Sidechains, Stacks Ecosystem, SideChain, GMCI Layer 2 Index, GMCI 30 Index, Blockchain Capital Portfolio, GMCI Index, Made in USA, Coinbase 50 Index"
AERO,aerodrome-finance,Aerodrome Finance,AERO,574416719.0,1131522413.0,36401521.0,"Decentralized Exchange (DEX), Decentralized Finance (DeFi), Automated Market Maker (AMM), Base Ecosystem, Binance Alpha Spotlight, Made in USA"
SYRUP,syrup,Maple Finance,SYRUP,551640941.0,613420760.0,69520941.0,"Decentralized Finance (DeFi), Yield Farming, Lending/Borrowing Protocols, Ethereum Ecosystem, Real World Assets (RWA), Base Ecosystem, Binance Alpha Spotlight"
DEXE,dexe,DeXe,DEXE,437873005.0,739999400.0,5753665.0,"Artificial Intelligence (AI), Decentralized Finance (DeFi), BNB Chain Ecosystem, Ethereum Ecosystem"
TEL,telcoin,Telcoin,TEL,345551060.0,376009046.0,1133787.0,"Decentralized Finance (DeFi), Wallets, Polygon Ecosystem, Arbitrum Ecosystem, Ethereum Ecosystem, Payment Solutions, Base Ecosystem, Made in USA"
ZK,zksync,ZKsync,ZK,323415468.0,948906588.0,17691453.0,"Smart Contract Platform, Layer 2 (L2), Zero Knowledge (ZK), ZkSync Ecosystem, Consensys Portfolio, Blockchain Capital Portfolio, OKX Ventures Portfolio"
DCR,decred,Decred,DCR,265720911.0,265730897.0,2927019.0,"Smart Contract Platform, Privacy, Layer 1 (L1), Proof of Stake (PoS), Proof of Work (PoW), Blockchain Capital Portfolio, Made in USA"
MEW,cat-in-a-dogs-world,cat in a dogs world,MEW,236521575.0,236521575.0,34356209.0,"Solana Ecosystem, Meme, Dog-Themed, Solana Meme, Cat-Themed"
EUL,euler,Euler,EUL,227835502.0,331444216.0,2435345.0,"Lending/Borrowing Protocols, Ethereum Ecosystem, Paradigm Portfolio, Coinbase Ventures Portfolio"
MINA,mina-protocol,Mina Protocol,MINA,205797472.0,205797472.0,9868713.0,"Smart Contract Platform, Layer 1 (L1), Zero Knowledge (ZK), FTX Holdings, Paradigm Portfolio, Coinbase Ventures Portfolio, Multicoin Capital Portfolio, Proof of Stake (PoS), Pantera Capital Portfolio, Circle Ventures Portfolio, Privacy Blockchain, Polychain Capital Portfolio, Made in USA, Coinbase 50 Index"
ZIL,zilliqa,Zilliqa,ZIL,201496947.0,216888303.0,6799359.0,"Smart Contract Platform, BNB Chain Ecosystem, GMCI Layer 1 Index, GMCI Index, Made in China"
YFI,yearn-finance,yearn.finance,YFI,172070236.0,186609041.0,12403777.0,"Decentralized Finance (DeFi), Yield Farming, Yield Aggregator, Yearn Ecosystem, Avalanche Ecosystem, Polygon Ecosystem, Near Protocol Ecosystem, Gnosis Chain Ecosystem, Fantom Ecosystem, Harmony Ecosystem, Arbitrum Ecosystem, Ethereum Ecosystem, Optimism Ecosystem, Base Ecosystem, Index Coop Defi Index, Alameda Research Portfolio, Energi Ecosystem, Sora Ecosystem, Huobi ECO Chain Ecosystem, Blockchain Capital Portfolio"
KMNO,kamino,Kamino,KMNO,126651749.0,559827089.0,8933406.0,"Decentralized Finance (DeFi), Lending/Borrowing Protocols, Solana Ecosystem, Binance Alpha Spotlight"
HIVE,hive,Hive,HIVE,105760587.0,,15599376.0,"Smart Contract Platform, SocialFi, Layer 1 (L1), Gaming Blockchains"
PEOPLE,constitutiondao,ConstitutionDAO,PEOPLE,90588612.0,90588612.0,27379283.0,"Meme, Ethereum Ecosystem, PolitiFi"
VVV,venice-token,Venice Token,VVV,86721063.0,198712491.0,3034283.0,"Artificial Intelligence (AI), Base Ecosystem, AI Agents, AI Applications, Made in USA"
MVL,mass-vehicle-ledger,MVL,MVL,81688329.0,84421095.0,855488.0,"Internet of Things (IOT), BNB Chain Ecosystem, Ethereum Ecosystem, DePIN, DWF Labs Portfolio"
SGB,songbird,Songbird,SGB,79639305.0,94415772.0,451922.0,Smart Contract Platform
YGG,yield-guild-games,Yield Guild Games,YGG,77694662.0,147260034.0,11413412.0,"Gaming (GameFi), NFT, BNB Chain Ecosystem, Metaverse, Collectibles, Polygon Ecosystem, Play To Earn, Harmony Ecosystem, Guild and Scholarship, Ethereum Ecosystem, Animoca Brands Portfolio, Base Ecosystem, DWF Labs Portfolio, Ronin Ecosystem, Gaming Governance Token, Andreessen Horowitz (a16z) Portfolio, Delphi Ventures Portfolio, Abstract Ecosystem"
USTC,terrausd,TerraClassicUSD,USTC,70207771.0,76495185.0,4103918.0,"Stablecoins, USD Stablecoin, Seigniorage, Alleged SEC Securities, Osmosis Ecosystem, Stablecoin Protocol, DeFiance Capital Portfolio, Terra Classic Ecosystem, YZi Labs (Prev. Binance Labs) Portfolio, Delphi Ventures Portfolio, Galaxy Digital Portfolio, Fiat-backed Stablecoin"
CARV,carv,CARV,CARV,68335923.0,232881788.0,18619133.0,"Artificial Intelligence (AI), Infrastructure, Gaming (GameFi), NFT, Solana Ecosystem, Arbitrum Ecosystem, Impossible Finance Launchpad, Ethereum Ecosystem, Animoca Brands Portfolio, Base Ecosystem"
B3,b3,B3 (Base),B3,68254454.0,250318814.0,3850140.0,"Smart Contract Platform, Base Ecosystem, Gaming Blockchains"
ACX,across-protocol,Across Protocol,ACX,67359846.0,136557944.0,16644029.0,"Polygon Ecosystem, Arbitrum Ecosystem, Ethereum Ecosystem, Optimism Ecosystem, Bridge Governance Tokens, Cross-chain Communication, Intent, Boba Network Ecosystem, Blockchain Capital Portfolio, Made in USA"
CONX,connex,Connex,CONX,65278918.0,5676427683.0,4122.31,BNB Chain Ecosystem
AGLD,adventure-gold,Adventure Gold,AGLD,65145739.0,65145739.0,10693416.0,"Ethereum Ecosystem, DWF Labs Portfolio"
EWT,energy-web-token,Energy Web,EWT,58801944.0,66988471.0,436719.0,"Energy, Polkadot Ecosystem, Gnosis Chain Ecosystem, Regenerative Finance (ReFi), Real World Assets (RWA), Blockchain Capital Portfolio, Hydration Ecosystem"
ISLM,islamic-coin,Islamic Coin,ISLM,55720674.0,582017964.0,528602.0,"Smart Contract Platform, Wallets, Layer 2 (L2), Osmosis Ecosystem"
UNP,unipoly,Unipoly,UNP,53411119.0,191280018.0,1147316.0,"Gaming (GameFi), Ethereum Ecosystem, Skale Ecosystem"
HFT,hashflow,Hashflow,HFT,53208933.0,90844434.0,31275331.0,"Decentralized Exchange (DEX), Exchange-based Tokens, Decentralized Finance (DeFi), BNB Chain Ecosystem, Binance Launchpool, MEV Protection, Ethereum Ecosystem, Coinbase Ventures Portfolio, Alameda Research Portfolio, DragonFly Capital Portfolio, Galaxy Digital Portfolio"
CYBER,cyberconnect,CYBER,CYBER,52461440.0,119877429.0,8299309.0,"Smart Contract Platform, SocialFi, NFT, BNB Chain Ecosystem, Binance Launchpool, Ethereum Ecosystem, Decentralized Identifier (DID), Optimism Ecosystem, Layer 2 (L2), Animoca Brands Portfolio, Multicoin Capital Portfolio, YZi Labs (Prev. Binance Labs) Portfolio, Delphi Ventures Portfolio, Cyber Ecosystem, Optimism Superchain Ecosystem"
ZRC,zircuit,Zircuit,ZRC,49918157.0,227425502.0,8837917.0,"Smart Contract Platform, BNB Chain Ecosystem, Ethereum Ecosystem, Layer 2 (L2), Zero Knowledge (ZK), Restaking, Zircuit Ecosystem"
SCR,scroll,Scroll,SCR,49685816.0,261504295.0,9027395.0,"Smart Contract Platform, Binance Launchpool, Layer 2 (L2), Scroll Ecosystem"
AVAIL,avail,Avail,AVAIL,49589721.0,205669952.0,9186714.0,"Infrastructure, Smart Contract Platform, BNB Chain Ecosystem, Ethereum Ecosystem, Data Availability, Modular Blockchain, Binance Alpha Spotlight"
ALI,alethea-artificial-liquid-intelligence-token,Artificial Liquid Intelligence,ALI,42219862.0,45705640.0,1211026.0,"Artificial Intelligence (AI), NFT, Metaverse, Solana Ecosystem, Polygon Ecosystem, Ethereum Ecosystem, Cronos Ecosystem, Base Ecosystem, Multicoin Capital Portfolio, AI Agents, Alameda Research Portfolio, DeFiance Capital Portfolio, YZi Labs (Prev. Binance Labs) Portfolio"
WHITE,whiteheart,Whiteheart,WHITE,38504796.0,38504796.0,3.04,"Decentralized Finance (DeFi), Derivatives, Ethereum Ecosystem"
WNXM,wrapped-nxm,Wrapped NXM,WNXM,37707947.0,37707947.0,225187.0,"Crypto-Backed Tokens, Decentralized Finance (DeFi), Insurance, Wrapped-Tokens, Ethereum Ecosystem, Blockchain Capital Portfolio"
STRIKE,strike,Strike,STRIKE,36079719.0,42062742.0,19455255.0,"Decentralized Finance (DeFi), Lending/Borrowing Protocols, Ethereum Ecosystem"
NCT,polyswarm,PolySwarm,NCT,34508013.0,34515559.0,1562151.0,"Business Services, Polygon Ecosystem, Ethereum Ecosystem, Cybersecurity, Made in USA"
VADER,vaderai-by-virtuals,VaderAI by Virtuals,VADER,34112917.0,34112917.0,1161200.0,"Artificial Intelligence (AI), Meme, Base Ecosystem, AI Meme, AI Agents, Virtuals Protocol Ecosystem, Binance Alpha Spotlight"
NYM,nym,Nym,NYM,32597870.0,40035840.0,1391970.0,"Smart Contract Platform, Privacy, Ethereum Ecosystem, DePIN, Osmosis Ecosystem, VPN, Andreessen Horowitz (a16z) Portfolio, YZi Labs (Prev. Binance Labs) Portfolio"
D,dar-open-network,Dar Open Network,D,22618405.0,28136172.0,13826303.0,"Gaming (GameFi), BNB Chain Ecosystem, Binance Launchpool, Play To Earn, Ethereum Ecosystem, Animoca Brands Portfolio, AI Agents"
SWARMS,swarms,Swarms,SWARMS,22457913.0,22457913.0,8367139.0,"Artificial Intelligence (AI), Solana Ecosystem, AI Agents, Pump.fun Ecosystem, Binance Alpha Spotlight, AI Framework"
SYN,synapse-2,Synapse,SYN,19851064.0,22654150.0,5905657.0,"BNB Chain Ecosystem, Avalanche Ecosystem, Polygon Ecosystem, Fantom Ecosystem, Arbitrum Ecosystem, Olympus Pro Ecosystem, Ethereum Ecosystem, Optimism Ecosystem, Bridge Governance Tokens, Base Ecosystem, Alameda Research Portfolio, Intent"
J,jambo,Jambo,J,18179885.0,112913117.0,5582171.0,"Solana Ecosystem, Paradigm Portfolio, Coinbase Ventures Portfolio"
PEP,pepecoin-network,Pepecoin,PEP,17955599.0,17955599.0,163768.0,"Smart Contract Platform, Layer 1 (L1), Meme, Frog-Themed, Proof of Work (PoW), The Boys Club, 4chan-Themed"
KENDU,kendu-inu,Kendu Inu,KENDU,17425065.0,17510181.0,61916.0,"Solana Ecosystem, Meme, Ethereum Ecosystem, Base Ecosystem, Dog-Themed"
INV,inverse-finance,Inverse Finance,INV,17115733.0,17639499.0,308791.0,"Decentralized Finance (DeFi), Yield Farming, Yield Aggregator, Lending/Borrowing Protocols, Olympus Pro Ecosystem, Ethereum Ecosystem, Fixed Interest"
