Input Token,CoinGecko ID,Name,Symbol,Market Cap,FDV,24H Volume,Categories
TRX,tron,TRON,TRX,27176974803.0,27176996664.0,358280114.0,"Smart Contract Platform, Layer 1 (L1), Alleged SEC Securities, FTX Holdings, DWF Labs Portfolio, Tron Ecosystem, Proof of Stake (PoS), GMCI Layer 1 Index, GMCI 30 Index, GMCI Index, World Liberty Financial Portfolio, Made in China"
SUI,sui,Sui,SUI,9940700323.0,28771798663.0,687540345.0,"Smart Contract Platform, Binance Launchpool, Layer 1 (L1), Sui Ecosystem, Coinbase Ventures Portfolio, Andreessen Horowitz (a16z) Portfolio, YZi Labs (Prev. Binance Labs) Portfolio, GMCI Layer 1 Index, Circle Ventures Portfolio, GMCI Index, Made in USA"
AVAX,avalanche-2,Avalanche,AVAX,7578850919.0,8207143135.0,203137708.0,"Smart Contract Platform, Layer 1 (L1), Avalanche Ecosystem, Proof of Stake (PoS), DragonFly Capital Portfolio, DeFiance Capital Portfolio, Andreessen Horowitz (a16z) Portfolio, GMCI Layer 1 Index, GMCI 30 Index, Galaxy Digital Portfolio, GMCI Index, Polychain Capital Portfolio, World Liberty Financial Portfolio, Made in USA, Coinbase 50 Index"
TAO,bittensor,Bittensor,TAO,2871218864.0,6708104511.0,63122985.0,"Artificial Intelligence (AI), Smart Contract Platform, Layer 1 (L1), DePIN, Bittensor Ecosystem, Polychain Capital Portfolio"
ONDO,ondo-finance,Ondo,ONDO,2468886232.0,7815138324.0,116549928.0,"Decentralized Finance (DeFi), Ethereum Ecosystem, Real World Assets (RWA), Coinbase Ventures Portfolio, Pantera Capital Portfolio, GMCI DeFi Index, RWA Protocol, GMCI Index, World Liberty Financial Portfolio, Binance Alpha Spotlight, Made in USA"
ATOM,cosmos,Cosmos Hub,ATOM,1853209190.0,1853233035.0,56191574.0,"Smart Contract Platform, BNB Chain Ecosystem, Cosmos Ecosystem, Canto Ecosystem, Alleged SEC Securities, Osmosis Ecosystem, Paradigm Portfolio, Proof of Stake (PoS), Kava Ecosystem, Layer 0 (L0), DragonFly Capital Portfolio, Pantera Capital Portfolio, Archway Ecosystem, Evmos Ecosystem, GMCI 30 Index, GMCI Index, Outlier Ventures Portfolio, Polychain Capital Portfolio, Mantra Ecosystem, Coinbase 50 Index"
ENA,ethena,Ethena,ENA,1631828590.0,3851869798.0,127740494.0,"Decentralized Finance (DeFi), Binance Launchpool, Ethereum Ecosystem, Stablecoin Protocol, DragonFly Capital Portfolio, YZi Labs (Prev. Binance Labs) Portfolio, Delphi Ventures Portfolio, OKX Ventures Portfolio, World Liberty Financial Portfolio"
ALGO,algorand,Algorand,ALGO,1513888774.0,1514484651.0,39264847.0,"Smart Contract Platform, Layer 1 (L1), Algorand Ecosystem, Real World Assets (RWA), Alleged SEC Securities, DWF Labs Portfolio, Multicoin Capital Portfolio, Proof of Stake (PoS), GMCI Layer 1 Index, GMCI Index, Made in USA, Coinbase 50 Index"
FDUSD,first-digital-usd,First Digital USD,FDUSD,1456470485.0,1456470485.0,6169282188.0,"Stablecoins, USD Stablecoin, BNB Chain Ecosystem, Arbitrum Ecosystem, Ethereum Ecosystem, Sui Ecosystem, Fiat-backed Stablecoin"
NEXO,nexo,NEXO,NEXO,1216248452.0,1216248452.0,8546773.0,"Polygon Ecosystem, Fantom Ecosystem, Ethereum Ecosystem, Alleged SEC Securities, Energi Ecosystem, Sora Ecosystem"
INJ,injective-protocol,Injective,INJ,1026708039.0,1050585534.0,78921468.0,"Smart Contract Platform, Decentralized Finance (DeFi), BNB Chain Ecosystem, Cosmos Ecosystem, Layer 1 (L1), Ethereum Ecosystem, Real World Assets (RWA), Binance Launchpad, Osmosis Ecosystem, Proof of Stake (PoS), Pantera Capital Portfolio, Secret Ecosystem, GMCI Layer 1 Index, GMCI Index, Made in USA, Coinbase 50 Index"
WBTC,arbitrum-bridged-wbtc-arbitrum-one,Arbitrum Bridged WBTC (Arbitrum One),WBTC,895485646.0,895485646.0,89996930.0,"Arbitrum Ecosystem, Bridged WBTC, Bridged-Tokens"
DOGWIFHAT,dogwifcoin,dogwifhat,WIF,837807190.0,837807190.0,337135972.0,"Solana Ecosystem, Meme, Dog-Themed, Solana Meme, GMCI Meme Index, GMCI Index"
MANA,decentraland,Decentraland,MANA,504111183.0,576074845.0,23967942.0,"Entertainment, Gaming (GameFi), NFT, Metaverse, Polygon Ecosystem, Play To Earn, Ethereum Ecosystem, Animoca Brands Portfolio, Alleged SEC Securities, Simulation Games, Coinbase 50 Index"
NFT,apenft,APENFT,NFT,435211420.0,439556176.0,8221434.0,"NFT, BNB Chain Ecosystem, Ethereum Ecosystem, Tron Ecosystem"
RSR,reserve-rights-token,Reserve Rights,RSR,407018527.0,702825672.0,15749946.0,"Decentralized Finance (DeFi), Arbitrum Ecosystem, Ethereum Ecosystem, Real World Assets (RWA), Base Ecosystem, Coinbase Ventures Portfolio, Energi Ecosystem, Made in USA"
CHZ,chiliz,Chiliz,CHZ,339997264.0,339997264.0,21504222.0,"Smart Contract Platform, Sports, NFT, Layer 1 (L1), Ethereum Ecosystem, Alleged SEC Securities, Chiliz Ecosystem, YZi Labs (Prev. Binance Labs) Portfolio, Coinbase 50 Index"
AR,arweave,Arweave,AR,330895257.0,330895257.0,17447730.0,"Artificial Intelligence (AI), Smart Contract Platform, Storage, Layer 1 (L1), DePIN, Coinbase Ventures Portfolio, Multicoin Capital Portfolio, Andreessen Horowitz (a16z) Portfolio, Blockchain Capital Portfolio"
LPT,livepeer,Livepeer,LPT,255761341.0,255761341.0,30075795.0,"Artificial Intelligence (AI), Harmony Ecosystem, Arbitrum Ecosystem, Ethereum Ecosystem, DePIN, Coinbase Ventures Portfolio, Multicoin Capital Portfolio, Pantera Capital Portfolio, GMCI DePIN Index, GMCI Index, Coinbase 50 Index"
BERA,berachain-bera,Berachain,BERA,201195783.0,840270035.0,25624518.0,"Smart Contract Platform, Decentralized Finance (DeFi), Layer 1 (L1), Berachain Ecosystem, Binance HODLer Airdrops, Outlier Ventures Portfolio, Polychain Capital Portfolio"
RVN,ravencoin,Ravencoin,RVN,196558452.0,196562040.0,8392407.0,"Smart Contract Platform, Real World Assets (RWA), Proof of Work (PoW), Made in USA"
LAYER,solayer,Solayer,LAYER,128532721.0,612060578.0,25078958.0,"Decentralized Finance (DeFi), Solana Ecosystem, LSDFi, Restaking, Stablecoin Protocol, YZi Labs (Prev. Binance Labs) Portfolio, Binance HODLer Airdrops, Polychain Capital Portfolio"
MELANIA,melania-meme,Melania Meme,MELANIA,123817217.0,191964893.0,8183368.0,"Solana Ecosystem, Meme, Solana Meme, PolitiFi, Made in USA"
KDA,kadena,Kadena,KDA,121955051.0,121961723.0,3883926.0,"Smart Contract Platform, Layer 1 (L1), Kadena Ecosystem, Multicoin Capital Portfolio, Proof of Work (PoW), Made in USA"
AIXBT,aixbt,aixbt by Virtuals,AIXBT,120178013.0,126143667.0,54993282.0,"Artificial Intelligence (AI), Solana Ecosystem, Meme, Base Ecosystem, AI Meme, AI Agents, Virtuals Protocol Ecosystem, Binance Alpha Spotlight, DeFAI"
SNT,status,Status,SNT,106953646.0,183766861.0,33274977.0,"Software as a service, Ethereum Ecosystem, Energi Ecosystem"
WELL,moonwell-artemis,Moonwell,WELL,98545872.0,140692524.0,2413485.0,"Decentralized Finance (DeFi), Lending/Borrowing Protocols, Moonbeam Ecosystem, Base Ecosystem, Coinbase Ventures Portfolio, Made in USA"
VELO,velo,Velo,VELO,94859844.0,308048194.0,9575122.0,"Decentralized Finance (DeFi), BNB Chain Ecosystem, Real World Assets (RWA), DWF Labs Portfolio, Stellar Ecosystem, Binance Alpha Spotlight"
ALEO,aleo,ALEO,ALEO,92905964.0,383317565.0,2284175.0,"Smart Contract Platform, Layer 1 (L1), Zero Knowledge (ZK), Andreessen Horowitz (a16z) Portfolio, Privacy Blockchain, Made in USA"
COREUM,coreum,Coreum,COREUM,85412430.0,85412430.0,615341.0,"Smart Contract Platform, Layer 1 (L1), Osmosis Ecosystem, XRP Ledger Ecosystem"
MYTH,mythos,Mythos,MYTH,82399712.0,103463087.0,1649423.0,"Gaming (GameFi), Polkadot Ecosystem, NFT, Ethereum Ecosystem, Gaming Blockchains, Andreessen Horowitz (a16z) Portfolio, YZi Labs (Prev. Binance Labs) Portfolio, Galaxy Digital Portfolio, Made in USA"
IQ,everipedia,IQ,IQ,79670212.0,79670212.0,2812296.0,"Artificial Intelligence (AI), Big Data, Media, BNB Chain Ecosystem, Polygon Ecosystem, Ethereum Ecosystem, GMCI DePIN Index, Galaxy Digital Portfolio, GMCI Index"
DKA,dkargo,dKargo,DKA,77574039.0,77574039.0,1280215.0,Ethereum Ecosystem
MERL,merlin-chain,Merlin Chain,MERL,76697203.0,222157415.0,10341664.0,"Smart Contract Platform, BNB Chain Ecosystem, Ethereum Ecosystem, Layer 2 (L2), Merlin Chain Ecosystem, Bitcoin Sidechains, SideChain, OKX Ventures Portfolio"
ERG,ergo,Ergo,ERG,75764112.0,91046348.0,220440.0,"Smart Contract Platform, Layer 1 (L1), Proof of Work (PoW), Privacy Blockchain"
BNT,bancor,Bancor Network,BNT,68870066.0,68870066.0,3713993.0,"Decentralized Exchange (DEX), Exchange-based Tokens, Decentralized Finance (DeFi), Automated Market Maker (AMM), Ethereum Ecosystem, DeFiance Capital Portfolio, Energi Ecosystem"
DBR,debridge,deBridge,DBR,58938530.0,202484381.0,9407296.0,"Solana Ecosystem, Bridge Governance Tokens, Cross-chain Communication, Intent"
ZKJ,polyhedra-network,Polyhedra Network,ZKJ,55172049.0,170327910.0,13114379.0,"Smart Contract Platform, BNB Chain Ecosystem, Ethereum Ecosystem, Zero Knowledge (ZK), Animoca Brands Portfolio, YZi Labs (Prev. Binance Labs) Portfolio, OKX Ventures Portfolio, Binance Alpha Spotlight"
NTRN,neutron-3,Neutron,NTRN,51054991.0,85348946.0,2613280.0,"Binance Launchpool, Osmosis Ecosystem, Delphi Ventures Portfolio"
ELG,escoin-token,Escoin,ELG,50217420.0,68152707.0,455844.0,"BNB Chain Ecosystem, Polygon Ecosystem, Ethereum Ecosystem"
ORAI,oraichain-token,Oraichain,ORAI,48308494.0,48916697.0,514738.0,"Artificial Intelligence (AI), Big Data, Business Services, Smart Contract Platform, Decentralized Finance (DeFi), Oracle, BNB Chain Ecosystem, Solana Ecosystem, Layer 1 (L1), Ethereum Ecosystem, DWF Labs Portfolio, Osmosis Ecosystem, AI Agents"
DEVVE,devve,DevvE,DEVVE,43090553.0,59170036.0,351721.0,"Exchange-based Tokens, Layer 1 (L1), Ethereum Ecosystem"
GRIFFAIN,griffain,GRIFFAIN,GRIFFAIN,42057901.0,42057901.0,8173865.0,"Artificial Intelligence (AI), Solana Ecosystem, Pump.fun Ecosystem, AI Agent Launchpad, Binance Alpha Spotlight, DeFAI"
CELR,celer-network,Celer Network,CELR,40970190.0,72571991.0,4275190.0,"Arbitrum Ecosystem, Ethereum Ecosystem, Bridge Governance Tokens, Binance Launchpad, Cross-chain Communication, Pantera Capital Portfolio, Energi Ecosystem, YZi Labs (Prev. Binance Labs) Portfolio"
XPLA,xpla,XPLA,XPLA,37085968.0,89954846.0,449373.0,"Smart Contract Platform, Gaming (GameFi), NFT, Wallets, Osmosis Ecosystem, Gaming Blockchains, Gaming Platform, Appchains"
ROAM,roam-token,ROAM Token,ROAM,36276940.0,123986777.0,9553886.0,"Retail, BNB Chain Ecosystem, Solana Ecosystem, DePIN"
PYTHIA,pythia,PYTHIA,PYTHIA,35986079.0,35986079.0,1948261.0,"Solana Ecosystem, Meme, AI Meme, Pump.fun Ecosystem, Desci Meme, Binance Alpha Spotlight"
PSP,paraswap,ParaSwap,PSP,30369692.0,35216194.0,321399.0,"Decentralized Exchange (DEX), Exchange-based Tokens, Decentralized Finance (DeFi), BNB Chain Ecosystem, Polygon Ecosystem, Ethereum Ecosystem, Optimism Ecosystem, Alameda Research Portfolio, Intent, Blockchain Capital Portfolio, Dex Aggregator"
IXS,ix-swap,IXS,IXS,29375011.0,29375011.0,127170.0,"Polygon Ecosystem, Ethereum Ecosystem, Real World Assets (RWA), Base Ecosystem, DWF Labs Portfolio, Poolz Finance Launchpad, Coinbase Ventures Portfolio"
REX,revox,REVOX,REX,29306631.0,43488972.0,4800905.0,"Artificial Intelligence (AI), BNB Chain Ecosystem, AI Agents, AI Applications"
SYS,syscoin,Syscoin,SYS,27550197.0,27551101.0,5929779.0,"Smart Contract Platform, Masternodes, Layer 1 (L1), Decentralized Identifier (DID), Layer 2 (L2), Zero Knowledge (ZK), Rollux Ecosystem, DWF Labs Portfolio, Data Availability, Modular Blockchain, Rollup, Proof of Work (PoW)"
DF,dforce-token,dForce,DF,26419010.0,26419010.0,3015608.0,"Decentralized Finance (DeFi), BNB Chain Ecosystem, Lending/Borrowing Protocols, Arbitrum Ecosystem, Ethereum Ecosystem, Multicoin Capital Portfolio, Stablecoin Protocol, Energi Ecosystem"
CAW,a-hunters-dream,A Hunters Dream,CAW,25745619.0,26958764.0,586917.0,"SocialFi, Ethereum Ecosystem"
MAV,maverick-protocol,Maverick Protocol,MAV,25702096.0,78293012.0,8278448.0,"BNB Chain Ecosystem, Binance Launchpool, Ethereum Ecosystem, ZkSync Ecosystem, Base Ecosystem, Coinbase Ventures Portfolio, Pantera Capital Portfolio, YZi Labs (Prev. Binance Labs) Portfolio, Circle Ventures Portfolio"
OMG,omisego,OMG Network,OMG,25058140.0,25058140.0,2728872.0,"Smart Contract Platform, Ethereum Ecosystem, Alleged SEC Securities, Pantera Capital Portfolio, Boba Network Ecosystem"
BAKE,bakerytoken,BakerySwap,BAKE,24541703.0,24632265.0,39744857.0,"NFT, BNB Chain Ecosystem, Harmony Ecosystem"
HEI,heima,Heima,HEI,20473661.0,26579734.0,3393594.0,"BNB Chain Ecosystem, Binance Launchpool, Ethereum Ecosystem, YZi Labs (Prev. Binance Labs) Portfolio"
LOKA,league-of-kingdoms,League of Kingdoms,LOKA,20294224.0,27105175.0,13664988.0,"Gaming (GameFi), NFT, Metaverse, Ethereum Ecosystem, Binance Launchpad, Gaming Governance Token, Gaming Utility Token, Strategy Games, Andreessen Horowitz (a16z) Portfolio, YZi Labs (Prev. Binance Labs) Portfolio, Sequoia Capital Portfolio"
DOVU,dovu-2,DOVU,DOVU,19131538.0,19248441.0,49053.0,"Infrastructure, Ethereum Ecosystem, Regenerative Finance (ReFi), Real World Assets (RWA), Hedera Ecosystem"
OL,open-loot,OPENLOOT,OL,17082442.0,137123200.0,3815797.0,"Gaming (GameFi), NFT, BNB Chain Ecosystem, Ethereum Ecosystem, Gaming Marketplace"
KERNEL,kernel-2,KernelDAO,KERNEL,17066768.0,103394116.0,6085147.0,"BNB Chain Ecosystem, Arbitrum Ecosystem, Ethereum Ecosystem, Liquid Restaked ETH"
ATR,artrade,Artrade,ATR,16630049.0,16681403.0,881743.0,"NFT, Solana Ecosystem, NFT Marketplace, Real World Assets (RWA), Art"
CATI,catizen,Catizen,CATI,16183095.0,78558714.0,5800368.0,"Gaming (GameFi), Play To Earn, Telegram Apps, TON Ecosystem, Tap to Earn"
BLZ,bluzelle,Bluzelle,BLZ,14888283.0,15952633.0,1056314.0,"Smart Contract Platform, BNB Chain Ecosystem, Ethereum Ecosystem, DePIN, Decentralized Science (DeSci), Osmosis Ecosystem, Energi Ecosystem, GMCI DePIN Index, GMCI Index"
HIFI,hifi-finance,Hifi Finance,HIFI,12341729.0,13788111.0,16238548.0,"Tokenized Real Estate, Decentralized Finance (DeFi), Tokenized Assets, Lending/Borrowing Protocols, Ethereum Ecosystem, Real World Assets (RWA), Made in USA"
BDC,billion-dollar-cat-runes,Billy (Bitcoin),BDC,12284898.0,12284898.0,43390.0,"Solana Ecosystem, Meme, Cat-Themed, Bitcoin Ecosystem, Runes"
FIO,fio-protocol,FIO Protocol,FIO,11943633.0,14676920.0,22736214.0,"Smart Contract Platform, Layer 1 (L1), YZi Labs (Prev. Binance Labs) Portfolio"
BOSON,boson-protocol,Boson Protocol,BOSON,11382688.0,15776477.0,1301619.0,"NFT, Metaverse, Polygon Ecosystem, Ethereum Ecosystem, Real World Assets (RWA), Animoca Brands Portfolio, Base Ecosystem, RWA Protocol, Outlier Ventures Portfolio"
VOXEL,voxies,Voxies,VOXEL,10853198.0,13809762.0,11200321.0,"Gaming (GameFi), NFT, Polygon Ecosystem, Binance Launchpad, RPG, Gaming Utility Token, Strategy Games, YZi Labs (Prev. Binance Labs) Portfolio"
GEL,gelato,Gelato,GEL,10568352.0,16925576.0,443553.0,"Smart Contract Platform, Polygon Ecosystem, Fantom Ecosystem, Ethereum Ecosystem, Layer 2 (L2), Modular Blockchain, Rollups-as-a-Service (RaaS), DragonFly Capital Portfolio, Galaxy Digital Portfolio, Binance Alpha Spotlight"
VICE,vice-2,VICE,VICE,10163372.0,12942306.0,290630.0,"Gaming (GameFi), Ethereum Ecosystem"
BXX,baanx,Baanx,BXX,9164944.0,9164944.0,55374.0,Ethereum Ecosystem
PUSS,puss,Puss,PUSS,8990492.0,8990492.0,695809.0,"Meme, Tron Ecosystem, TRON Meme"
MANEKI,maneki,MANEKI,MANEKI,8941439.0,8971925.0,2965482.0,"Solana Ecosystem, Meme, Solana Meme, Cat-Themed"
HANDY,handy,Handy,HANDY,8493012.0,16282702.0,24374.0,Ethereum Ecosystem
SNSY,sensay,Sensay,SNSY,8432216.0,15190559.0,701099.0,"Artificial Intelligence (AI), Arbitrum Ecosystem, Ethereum Ecosystem, Base Ecosystem, AI Agents"
HTR,hathor,Hathor,HTR,8256485.0,14442399.0,1165537.0,"Infrastructure, Smart Contract Platform, Layer 1 (L1), Real World Assets (RWA), Proof of Work (PoW), Directed Acyclic Graph (DAG)"
RX,reachx-mainnet,ReachX Mainnet,RX,7712797.0,15425594.0,73468.0,"SocialFi, Meme, Base Ecosystem, Base Meme"
AURA,aura-2,Aura,AURA,7344383.0,20779981.0,29421.0,"Artificial Intelligence (AI), Base Ecosystem, AI Framework"
PHNIX,phnix,PHNIX,PHNIX,7247633.0,8046095.0,304240.0,"Meme, XRP Ledger Ecosystem"
PROS,prosper,Prosper [OLD],PROS,7199577.0,14008372.0,57.07,"Decentralized Finance (DeFi), BNB Chain Ecosystem, Polygon Ecosystem, Ethereum Ecosystem"
SABAI,sabai-ecovers,Sabai Protocol,SABAI,7170594.0,36065639.0,4391202.0,"Polygon Ecosystem, Ethereum Ecosystem"
TJRM,tajir-tech-hub,Tajir Tech Hub,TJRM,6672677.0,6672677.0,351396.0,Solana Ecosystem
BCB,bitcoin-bit,Bitcoin Bit,BCB,6437961.0,31500761.0,4.5,"Ethereum Ecosystem, Proof of Stake (PoS)"
HTM,hatom,Hatom,HTM,6192090.0,11755752.0,193031.0,"Decentralized Finance (DeFi), Lending/Borrowing Protocols, Meme, MultiversX Ecosystem, Liquid Staking"
GRIFT,orbit-3,ORBIT,GRIFT,6168577.0,7009756.0,2241124.0,"Artificial Intelligence (AI), Solana Ecosystem, AI Agents, Pump.fun Ecosystem, Binance Alpha Spotlight, DeFAI"
EAI,eagle-ai,Eagle AI,EAI,5823376.0,14648845.0,194475.0,"Analytics, Base Ecosystem"
SWELL,layerzero-bridged-swell,Layerzero Bridged Swell,SWELL,5456629.0,5454327.0,2048.46,"Liquid Staking Governance Tokens, Liquid Restaking Governance Tokens, Bridged-Tokens, Swellchain Ecosystem"
SYNTH,synth-2,Synth,SN50,5230209.0,5271127.0,389320.0,"Artificial Intelligence (AI), Bittensor Ecosystem, Bittensor Subnets"
ZYPTO,french-connection-finance,Zypto Token,ZYPTO,4817170.0,4817170.0,54753.0,Ethereum Ecosystem
NRS,nereus-token,Nereus,NRS,4664312.0,119575798.0,186580.0,"Decentralized Finance (DeFi), Derivatives, Polygon Ecosystem"
VAI,vai,Vai,VAI,4554852.0,4554852.0,2250.33,"Stablecoins, Decentralized Finance (DeFi), USD Stablecoin, BNB Chain Ecosystem, Crypto-backed Stablecoin, Fiat-backed Stablecoin"
DEFX,definity,DeFinity,DEFX,4533069.0,5079041.0,2596.19,"BNB Chain Ecosystem, Ethereum Ecosystem"
DOLZ,dolz-io,DOLZ.io,DOLZ,4301786.0,4301786.0,23133.0,"Artificial Intelligence (AI), Gaming (GameFi), NFT, Polygon Ecosystem, Ethereum Ecosystem, Base Ecosystem, Card Games, AI Agents"
IRIS,i-r-i-s,I.R.I.S,IRIS,4178497.0,8356995.0,2313976.0,"Artificial Intelligence (AI), Analytics, Ethereum Ecosystem, AI Agents, Virtuals Protocol Ecosystem"
SEXY,settled-ethxy-token,Settled EthXY Token,SEXY,3917549.0,3917549.0,38898.0,"Gaming (GameFi), Ethereum Ecosystem, Base Ecosystem, Andreessen Horowitz (a16z) Portfolio"
NYA,nya,Nya,NYA,3433074.0,3438978.0,8621.5,"BNB Chain Ecosystem, Avalanche Ecosystem, Polygon Ecosystem, Meme, Arbitrum Ecosystem, Ethereum Ecosystem, Optimism Ecosystem, Base Ecosystem, Cat-Themed"
TROLL,troll,Troll,TROLL,3392058.0,3392058.0,134720.0,"Meme, Ethereum Ecosystem, 4chan-Themed"
SWASH,swash,Swash,SWASH,3274852.0,3291440.0,79191.0,"BNB Chain Ecosystem, Polygon Ecosystem, Gnosis Chain Ecosystem, Ethereum Ecosystem, Outlier Ventures Portfolio"
JAILSTOOL,stool-prisondente,Stool Prisondente,JAILSTOOL,2984430.0,2984430.0,2107230.0,"Solana Ecosystem, Pump.fun Ecosystem"
XMR,monero,Monero,XMR,5804961174.0,5804961174.0,106440596.0,"Smart Contract Platform, Privacy, Layer 1 (L1), Proof of Work (PoW), Galaxy Digital Portfolio"
MNT,mantle,Mantle,MNT,1901919328.0,3514367628.0,134962942.0,"Smart Contract Platform, Ethereum Ecosystem, Layer 2 (L2), Mantle Ecosystem, DWF Labs Portfolio, DragonFly Capital Portfolio, GMCI Layer 2 Index, GMCI 30 Index, GMCI Index, World Liberty Financial Portfolio"
VIRTUAL,virtual-protocol,Virtuals Protocol,VIRTUAL,990716385.0,1512734535.0,129439155.0,"Artificial Intelligence (AI), Solana Ecosystem, Ethereum Ecosystem, Base Ecosystem, AI Agents, Virtuals Protocol Ecosystem, AI Agent Launchpad, Binance Alpha Spotlight"
JTO,jito-governance-token,Jito,JTO,648797787.0,1874834862.0,40432560.0,"Decentralized Finance (DeFi), Solana Ecosystem, Liquid Staking Governance Tokens, Multicoin Capital Portfolio, Alameda Research Portfolio, Delphi Ventures Portfolio, Liquid Staking, Made in USA"
SAND,the-sandbox,The Sandbox,SAND,593593582.0,728080445.0,27929845.0,"Gaming (GameFi), NFT, Metaverse, Polygon Ecosystem, Play To Earn, Harmony Ecosystem, Ethereum Ecosystem, Animoca Brands Portfolio, Alleged SEC Securities, Binance Launchpad, Gaming Utility Token, Simulation Games, Energi Ecosystem, YZi Labs (Prev. Binance Labs) Portfolio, Coinbase 50 Index"
JASMY,jasmycoin,JasmyCoin,JASMY,584595898.0,603671931.0,22798350.0,"Internet of Things (IOT), Ethereum Ecosystem, DePIN, DWF Labs Portfolio, Coinbase 50 Index"
XCN,chain-2,Onyxcoin,XCN,471479226.0,665800701.0,19345306.0,"Smart Contract Platform, BNB Chain Ecosystem, Layer 1 (L1), Ethereum Ecosystem, Base Ecosystem, Proof of Stake (PoS), Pantera Capital Portfolio, Made in USA"
RUNE,thorchain,THORChain,RUNE,465277622.0,563241690.0,56342223.0,"Decentralized Exchange (DEX), Infrastructure, Smart Contract Platform, Exchange-based Tokens, Decentralized Finance (DeFi), Bridge Governance Tokens, Multicoin Capital Portfolio, Proof of Stake (PoS), Delphi Ventures Portfolio"
MORPHO,morpho,Morpho,MORPHO,431190069.0,1350756841.0,8485767.0,"Decentralized Finance (DeFi), Lending/Borrowing Protocols, Ethereum Ecosystem, Base Ecosystem, Coinbase Ventures Portfolio, Pantera Capital Portfolio, Morpho Ecosystem, Binance Alpha Spotlight"
DOGE,binance-peg-dogecoin,Binance-Peg Dogecoin,DOGE,429788363.0,429788363.0,2654456.0,"BNB Chain Ecosystem, Meme, Binance-Peg Tokens"
STRK,starknet,Starknet,STRK,400189496.0,1113419140.0,22987502.0,"Infrastructure, Smart Contract Platform, Ethereum Ecosystem, Layer 2 (L2), Zero Knowledge (ZK), Starknet Ecosystem, Paradigm Portfolio, Coinbase Ventures Portfolio, Rollup, Multicoin Capital Portfolio, Alameda Research Portfolio, Pantera Capital Portfolio, GMCI Layer 2 Index, Consensys Portfolio, Sequoia Capital Portfolio, GMCI Index, Polychain Capital Portfolio"
XEC,ecash,eCash,XEC,363295240.0,363298665.0,5251770.0,"Smart Contract Platform, Layer 1 (L1), Bitcoin Fork, Proof of Work (PoW)"
GRASS,grass,Grass,GRASS,338977116.0,1176579938.0,64742387.0,"Artificial Intelligence (AI), Solana Ecosystem, DePIN, Polychain Capital Portfolio"
POPCAT,popcat,Popcat,POPCAT,281608261.0,281608261.0,42548662.0,"Solana Ecosystem, Meme, Solana Meme, Cat-Themed, Murad Picks"
OM,mantra-dao,MANTRA,OM,201431367.0,345818872.0,32935948.0,"Infrastructure, Smart Contract Platform, BNB Chain Ecosystem, Cosmos Ecosystem, Layer 1 (L1), Polygon Ecosystem, Ethereum Ecosystem, Real World Assets (RWA), Base Ecosystem, Osmosis Ecosystem, Mantra Ecosystem"
ZRX,0x,0x Protocol,ZRX,184473300.0,217437585.0,15105100.0,"Decentralized Exchange (DEX), Decentralized Finance (DeFi), Avalanche Ecosystem, Harmony Ecosystem, Ethereum Ecosystem, Coinbase Ventures Portfolio, Pantera Capital Portfolio, Energi Ecosystem, GMCI DeFi Index, Blockchain Capital Portfolio, GMCI Index, Made in USA"
ASTR,astar,Astar,ASTR,177000995.0,184405313.0,6098071.0,"Smart Contract Platform, Polkadot Ecosystem, Layer 1 (L1), Ethereum Ecosystem, Layer 2 (L2), Alameda Research Portfolio, YZi Labs (Prev. Binance Labs) Portfolio, OKX Ventures Portfolio"
GOMINING,gmt-token,GoMining Token,GOMINING,173534599.0,173534599.0,19727785.0,"Gaming (GameFi), BNB Chain Ecosystem, Ethereum Ecosystem, TON Ecosystem"
ORDI,ordinals,ORDI,ORDI,156767705.0,156767705.0,30181739.0,"Solana Ecosystem, BRC-20, Bitcoin Ecosystem, Inscriptions"
ETHW,ethereum-pow-iou,EthereumPoW,ETHW,141309127.0,141309127.0,5320343.0,"Smart Contract Platform, EthereumPoW Ecosystem, Proof of Work (PoW)"
ZEN,zencash,Horizen,ZEN,118298417.0,118298417.0,8336776.0,"Smart Contract Platform, Masternodes, Zero Knowledge (ZK), Proof of Work (PoW), Made in USA"
SUSHI,sushi,Sushi,SUSHI,115116854.0,169767163.0,20694233.0,"Decentralized Exchange (DEX), Exchange-based Tokens, Decentralized Finance (DeFi), Yield Farming, Automated Market Maker (AMM), BNB Chain Ecosystem, Yearn Ecosystem, Solana Ecosystem, Avalanche Ecosystem, Polygon Ecosystem, Near Protocol Ecosystem, Fantom Ecosystem, Harmony Ecosystem, Arbitrum Ecosystem, Celo Ecosystem, Ethereum Ecosystem, Base Ecosystem, Alameda Research Portfolio, Pantera Capital Portfolio, Energi Ecosystem, Sora Ecosystem, Blockchain Capital Portfolio"
SXP,swipe,Solar,SXP,111268907.0,111525430.0,5163059.0,"BNB Chain Ecosystem, Harmony Ecosystem, Ethereum Ecosystem, Alameda Research Portfolio, YZi Labs (Prev. Binance Labs) Portfolio"
CHEX,chex-token,Chintai,CHEX,110877231.0,110877231.0,3071603.0,"Decentralized Exchange (DEX), Decentralized Finance (DeFi), BNB Chain Ecosystem, Solana Ecosystem, Ethereum Ecosystem, Real World Assets (RWA), Base Ecosystem, RWA Protocol"
RPL,rocket-pool,Rocket Pool,RPL,105241474.0,105241474.0,6065657.0,"Business Services, Infrastructure, Smart Contract Platform, Decentralized Finance (DeFi), Polygon Ecosystem, Arbitrum Ecosystem, Ethereum Ecosystem, Liquid Staking Governance Tokens, Coinbase Ventures Portfolio, Proof of Stake (PoS), Index Coop Defi Index, Consensys Portfolio, Liquid Staking"
SKL,skale,SKALE,SKL,96040783.0,101031628.0,5688950.0,"Smart Contract Platform, Gaming (GameFi), Layer 1 (L1), Ethereum Ecosystem, Modular Blockchain, Account Abstraction, Multicoin Capital Portfolio, Gaming Blockchains, Gaming Utility Token, Skale Ecosystem, Consensys Portfolio, Galaxy Digital Portfolio, Made in USA"
COOKIE,cookie,Cookie DAO,COOKIE,86814355.0,158508193.0,10764971.0,"Artificial Intelligence (AI), Marketing, Analytics, BNB Chain Ecosystem, Ethereum Ecosystem, Animoca Brands Portfolio, Base Ecosystem, AI Agents, Binance Alpha Spotlight, InfoFi"
VRA,verasity,Verasity,VRA,86550815.0,100921542.0,3952694.0,"Entertainment, Wallets, Ethereum Ecosystem"
XPR,proton,XPR Network,XPR,85328748.0,94256666.0,2093995.0,"Smart Contract Platform, BNB Chain Ecosystem, Ethereum Ecosystem, DWF Labs Portfolio, Made in USA"
HONEY,hivemapper,Hivemapper,HONEY,78526868.0,113084013.0,1390355.0,"Solana Ecosystem, DePIN, Multicoin Capital Portfolio, Made in USA"
PEAQ,peaq-2,peaq,PEAQ,75892419.0,328122036.0,3897328.0,"Smart Contract Platform, Polkadot Ecosystem, Layer 1 (L1), DePIN, Outlier Ventures Portfolio, Peaq Ecosystem"
