RBNT,redbelly-network-token,Redbelly Network,RBNT,13834736.0,135650613.0,1049608.0,"Smart Contract Platform, Layer 1 (L1), Ethereum Ecosystem, Real World Assets (RWA), Redbelly Network Ecosystem"
BKN,brickken,Brickken,BKN,12215547.0,24460792.0,331011.0,"Tokenized Real Estate, Tokenized Assets, BNB Chain Ecosystem, Impossible Finance Launchpad, Ethereum Ecosystem, Real World Assets (RWA), RWA Protocol"
KRL,kryll,KRYLL,KRL,12195808.0,15122928.0,143305.0,"Artificial Intelligence (AI), Decentralized Finance (DeFi), Analytics, Arbitrum Ecosystem, Ethereum Ecosystem, Optimism Ecosystem, Base Ecosystem, AI Applications"
BAR,fc-barcelona-fan-token,FC Barcelona Fan Token,BAR,11790597.0,40844708.0,3647280.0,"Sports, Fan Token, Binance Launchpad, Chiliz Ecosystem"
MINIMA,minima,Minima,MINIMA,11170392.0,22054767.0,225064.0,"Smart Contract Platform, Layer 1 (L1), DePIN"
PAID,paid-network,PAID,PAID,9910012.0,11734837.0,67306.0,"Launchpad, Base Ecosystem"
BTY,bityuan,Bityuan,BTY,9565224.0,9565224.0,243232.0,
REEF,reef,Reef,REEF,8858823.0,8858823.0,402644.0,"BNB Chain Ecosystem, Binance Launchpool, Harmony Ecosystem, Ethereum Ecosystem, Alameda Research Portfolio, Energi Ecosystem, Sora Ecosystem, YZi Labs (Prev. Binance Labs) Portfolio, GMCI Layer 1 Index, GMCI Index"
LAZIO,lazio-fan-token,Lazio Fan Token,LAZIO,8674091.0,29100562.0,7256434.0,"Sports, BNB Chain Ecosystem, Fan Token, Binance Launchpad"
BCUT,bitscrunch-token,bitsCrunch Token,BCUT,8440154.0,16140583.0,1364583.0,"Artificial Intelligence (AI), Infrastructure, Analytics, NFT, Polygon Ecosystem, Ethereum Ecosystem, Animoca Brands Portfolio, Coinbase Ventures Portfolio"
TRUF,truflation,TRUF.Network,TRUF,7120453.0,20444912.0,412033.0,"Infrastructure, Oracle, Arbitrum Ecosystem, Ethereum Ecosystem, Real World Assets (RWA), Base Ecosystem, Coinbase Ventures Portfolio"
SCF,smoking-chicken-fish,Smoking Chicken Fish,SCF,6695713.0,6695713.0,1182121.0,"Solana Ecosystem, Meme, Solana Meme, Pump.fun Ecosystem"
RWA,allo,Allo,RWA,6487116.0,36039535.0,3275127.0,"BNB Chain Ecosystem, Real World Assets (RWA), RWA Protocol"
LNQ,linqai,LinqAI,LNQ,5877409.0,21018950.0,1154637.0,"Artificial Intelligence (AI), Ethereum Ecosystem"
BITBOARD,bitboard,BitBoard,BB,5583332.0,8439598.0,88168.0,"Smart Contract Platform, Polygon Ecosystem, Layer 2 (L2), Zero Knowledge (ZK)"
BAD,bad-idea-ai,Bad Idea AI,BAD,5508669.0,6830612.0,1132807.0,"Artificial Intelligence (AI), Meme, Ethereum Ecosystem, Telegram Apps, Discord Bots, Shibarium Ecosystem"
RFC,retard-finder-coin,Retard Finder Coin,RFC,5443103.0,5660646.0,14640546.0,"Solana Ecosystem, Meme, Pump.fun Ecosystem, Wojak-Themed"
BILLY,billy,Billy,BILLY,4862684.0,4862684.0,1717713.0,"Solana Ecosystem, Meme, Dog-Themed, Solana Meme, Pump.fun Ecosystem"
BST,blocksquare,Blocksquare,BST,4844894.0,4844894.0,280995.0,"Tokenized Real Estate, Tokenized Assets, Ethereum Ecosystem, Real World Assets (RWA)"
INTER,inter-milan-fan-token,Inter Milan Fan Token,INTER,4789323.0,4789323.0,431254.0,"Sports, Fan Token, Chiliz Ecosystem"
STOS,stratos,Stratos,STOS,4721623.0,10506288.0,216127.0,"Entertainment, Infrastructure, Smart Contract Platform, Storage, Layer 1 (L1), Ethereum Ecosystem, DePIN, Osmosis Ecosystem"
GOGLZ,googles,GOGGLES,GOGLZ,4447575.0,4447575.0,133557.0,"Meme, Sonic Ecosystem"
NRG,energi,Energi,NRG,3958852.0,3958870.0,163537.0,"Smart Contract Platform, Masternodes, Layer 1 (L1), Ethereum Ecosystem, Proof of Stake (PoS), Energi Ecosystem"
KANGO,kango,KANGO,KANGO,3841014.0,3841014.0,140251.0,"Meme, Kaspa Ecosystem"
TSUKA,dejitaru-tsuka,Dejitaru Tsuka,TSUKA,3521459.0,3521459.0,89054.0,"Meme, Ethereum Ecosystem"
READY,ready,READY!,READY,3502338.0,3502338.0,90817.0,"Gaming (GameFi), Solana Ecosystem, Gaming Platform"
NC,nodecoin,Nodecoin,NC,3425231.0,18396741.0,2212816.0,"Artificial Intelligence (AI), Solana Ecosystem, DePIN"
NWC,newscrypto-coin,Numerico,NWC,3223546.0,5490747.0,85118.0,"Education, Smart Contract Platform, BNB Chain Ecosystem, Ethereum Ecosystem, Layer 2 (L2), Stellar Ecosystem"
ZKP,panther,Panther Protocol,ZKP,3185189.0,3185189.0,453109.0,"Smart Contract Platform, Privacy, Polygon Ecosystem, Ethereum Ecosystem, Zero Knowledge (ZK)"
MCN,mcncoin,MCNCOIN,MCN,3081728.0,3081728.0,268964.0,BNB Chain Ecosystem
FUSE,fuse-network-token,Fuse,FUSE,2989600.0,3733112.0,738922.0,"Smart Contract Platform, Decentralized Finance (DeFi), BNB Chain Ecosystem, Layer 1 (L1), Polygon Ecosystem, Gnosis Chain Ecosystem, Arbitrum Ecosystem, Ethereum Ecosystem, Optimism Ecosystem, Layer 2 (L2), Payment Solutions, Base Ecosystem, DWF Labs Portfolio, Account Abstraction, Fuse Ecosystem"
SBR,saber,Saber,SBR,2901617.0,3930867.0,242414.0,"Decentralized Exchange (DEX), Decentralized Finance (DeFi), Yield Farming, Automated Market Maker (AMM), Solana Ecosystem, Multicoin Capital Portfolio"
FET,fetch-ai,Artificial Superintelligence Alliance,FET,1748961079.0,1822502367.0,92818548.0,"Artificial Intelligence (AI), NFT, BNB Chain Ecosystem, Ethereum Ecosystem, Binance Launchpad, DWF Labs Portfolio, Osmosis Ecosystem, AI Agents, GMCI DePIN Index, GMCI Index, Outlier Ventures Portfolio, AI Agent Launchpad"
QNT,quant-network,Quant,QNT,1552424974.0,1559717018.0,13805568.0,"Ethereum Ecosystem, Real World Assets (RWA), Energi Ecosystem, Coinbase 50 Index"
DOGWIFHAT,dogwifcoin,dogwifhat,WIF,837807190.0,837807190.0,337135972.0,"Solana Ecosystem, Meme, Dog-Themed, Solana Meme, GMCI Meme Index, GMCI Index"
XAUT,tether-gold,Tether Gold,XAUT,820991681.0,820991681.0,33813273.0,"Stablecoins, Tokenized Assets, Tokenized Gold, Ethereum Ecosystem, Real World Assets (RWA), Tokenized Commodities"
PENDLE,pendle,Pendle,PENDLE,559705020.0,956975333.0,32568732.0,"Decentralized Exchange (DEX), Decentralized Finance (DeFi), Yield Farming, Automated Market Maker (AMM), BNB Chain Ecosystem, Derivatives, Lending/Borrowing Protocols, Arbitrum Ecosystem, Ethereum Ecosystem, Optimism Ecosystem, Fixed Interest, LSDFi, Base Ecosystem, Restaking, LRTfi, Liquid Restaking Governance Tokens, Yield Tokenization Protocol, YZi Labs (Prev. Binance Labs) Portfolio, GMCI DeFi Index, Sonic Ecosystem, Liquid Staking, GMCI Index, BTCfi Protocol"
KAVA,kava,Kava,KAVA,425235060.0,425235060.0,13655999.0,"Smart Contract Platform, Layer 1 (L1), Binance Launchpad, DWF Labs Portfolio, Osmosis Ecosystem, YZi Labs (Prev. Binance Labs) Portfolio, Made in USA"
RON,ronin,Ronin,RON,311794795.0,472961202.0,7722976.0,"Smart Contract Platform, Gaming (GameFi), NFT, Layer 1 (L1), Play To Earn, Zero Knowledge (ZK), FTX Holdings, Ronin Ecosystem, Gaming Blockchains, SideChain, Andreessen Horowitz (a16z) Portfolio, YZi Labs (Prev. Binance Labs) Portfolio"
PLUME,plume,Plume,PLUME,269359904.0,1059776670.0,26662184.0,"Smart Contract Platform, Layer 1 (L1), Ethereum Ecosystem, Real World Assets (RWA), RWA Protocol, Made in USA, Plume Network Ecosystem"
1INCH,1inch,1inch,1INCH,267305287.0,287636891.0,27637298.0,"Decentralized Exchange (DEX), Exchange-based Tokens, Decentralized Finance (DeFi), Automated Market Maker (AMM), BNB Chain Ecosystem, Avalanche Ecosystem, Polygon Ecosystem, Near Protocol Ecosystem, Harmony Ecosystem, Ethereum Ecosystem, FTX Holdings, Alameda Research Portfolio, DragonFly Capital Portfolio, Pantera Capital Portfolio, Energi Ecosystem, YZi Labs (Prev. Binance Labs) Portfolio, GMCI DeFi Index, Galaxy Digital Portfolio, Blockchain Capital Portfolio, Dex Aggregator, GMCI Index, Coinbase 50 Index"
ATH,aethir,Aethir,ATH,260586644.0,1106027833.0,17452177.0,"Solana Ecosystem, Arbitrum Ecosystem, Impossible Finance Launchpad, Ethereum Ecosystem, DePIN, Animoca Brands Portfolio"
SFP,safepal,SafePal,SFP,227009800.0,227009800.0,2222997.0,"BNB Chain Ecosystem, Wallets, Ethereum Ecosystem, Animoca Brands Portfolio, Binance Launchpad, Energi Ecosystem, YZi Labs (Prev. Binance Labs) Portfolio"
ZBCN,zebec-network,Zebec Network,ZBCN,220740679.0,255759485.0,16771464.0,"Decentralized Finance (DeFi), Solana Ecosystem, Real World Assets (RWA), Payment Solutions, DePIN, Coinbase Ventures Portfolio, Alameda Research Portfolio, Circle Ventures Portfolio, OKX Ventures Portfolio, RWA Protocol, Made in USA"
QTUM,qtum,Qtum,QTUM,207437984.0,211570914.0,15335740.0,"Smart Contract Platform, Proof of Stake (PoS), Made in China"
ROSE,oasis-network,Oasis,ROSE,173564636.0,234851256.0,6159031.0,"Smart Contract Platform, BNB Chain Ecosystem, Layer 1 (L1), Proof of Stake (PoS), Pantera Capital Portfolio, Andreessen Horowitz (a16z) Portfolio, YZi Labs (Prev. Binance Labs) Portfolio, Blockchain Capital Portfolio, Privacy Blockchain, Polychain Capital Portfolio, Coinbase 50 Index"
FLUID,instadapp,Fluid,FLUID,154197508.0,390999005.0,910391.0,"Decentralized Finance (DeFi), Polygon Ecosystem, Ethereum Ecosystem, Base Ecosystem, Coinbase Ventures Portfolio, Pantera Capital Portfolio"
ZANO,zano,Zano,ZANO,147611285.0,147645444.0,1980101.0,"Smart Contract Platform, Privacy, Layer 1 (L1), Proof of Stake (PoS), Proof of Work (PoW), Zano Ecosystem, Privacy Blockchain"
PROM,prometeus,Prom,PROM,136963334.0,144468175.0,3806740.0,"Smart Contract Platform, BNB Chain Ecosystem, Ethereum Ecosystem, Layer 2 (L2)"
XCH,chia,Chia,XCH,135528519.0,305812834.0,5686018.0,"Smart Contract Platform, Layer 1 (L1), DePIN, Andreessen Horowitz (a16z) Portfolio, Made in USA"
LQTY,liquity,Liquity,LQTY,118587987.0,121528875.0,18658576.0,"Decentralized Finance (DeFi), Lending/Borrowing Protocols, Arbitrum Ecosystem, Ethereum Ecosystem, Alameda Research Portfolio, Pantera Capital Portfolio"
WAVES,waves,Waves,WAVES,96741495.0,96741495.0,11723214.0,"Smart Contract Platform, DWF Labs Portfolio, Proof of Stake (PoS)"
BIGTIME,big-time,Big Time,BIGTIME,96287808.0,252294136.0,13997693.0,"Gaming (GameFi), Play To Earn, Ethereum Ecosystem, RPG, Alameda Research Portfolio, Circle Ventures Portfolio, OKX Ventures Portfolio, MMO"
DAG,constellation-labs,Constellation,DAG,95023294.0,118242813.0,2416937.0,"Smart Contract Platform, Layer 1 (L1), Base Ecosystem, Layer 0 (L0), Made in USA, Directed Acyclic Graph (DAG)"
UMA,uma,UMA,UMA,93967496.0,133544405.0,5050746.0,"Business Services, Decentralized Finance (DeFi), Oracle, Derivatives, Synthetic Issuer, Avalanche Ecosystem, Ethereum Ecosystem, Blockchain Capital Portfolio, Synthetic, Made in USA"
XVG,verge,Verge,XVG,84721525.0,84890993.0,3126824.0,"Smart Contract Platform, Privacy, Proof of Work (PoW), Made in USA"
RED,redstone-oracles,RedStone,RED,78937211.0,281918612.0,59887784.0,"Infrastructure, Oracle, Ethereum Ecosystem"
XRD,radix,Radix,XRD,77785892.0,87026599.0,382548.0,"Smart Contract Platform, Layer 1 (L1), DWF Labs Portfolio, Radix Ecosystem"
MANTA,manta-network,Manta Network,MANTA,75931272.0,181265244.0,12145026.0,"Smart Contract Platform, Polkadot Ecosystem, Binance Launchpool, Layer 2 (L2), Manta Network Ecosystem, Multicoin Capital Portfolio, Alameda Research Portfolio, DeFiance Capital Portfolio, YZi Labs (Prev. Binance Labs) Portfolio"
FIDA,bonfida,Solana Name Service (prev. Bonfida),FIDA,75567508.0,76260606.0,12550981.0,"Big Data, Business Services, Infrastructure, Decentralized Finance (DeFi), Solana Ecosystem, FTX Holdings, DWF Labs Portfolio, Name Service"
DYM,dymension,Dymension,DYM,73757878.0,229339944.0,6181368.0,"Smart Contract Platform, Cosmos Ecosystem, Modular Blockchain, Osmosis Ecosystem, Rollups-as-a-Service (RaaS)"
STEEM,steem,Steem,STEEM,68017395.0,68021825.0,14227636.0,SocialFi
AITECH,solidus-aitech,Solidus Ai Tech,AITECH,59821301.0,77144005.0,9741393.0,"Artificial Intelligence (AI), BNB Chain Ecosystem, Launchpad, Base Ecosystem, ChainGPT Launchpad, AI Agents, Binance Alpha Spotlight, DeFAI"
WCT,connect-token-wct,WalletConnect Token,WCT,55780158.0,299570966.0,18581481.0,"Solana Ecosystem, Wallets, Ethereum Ecosystem, Optimism Ecosystem"
NIL,nillion,Nillion,NIL,55394619.0,283856620.0,10123104.0,"Infrastructure, Binance Launchpool"
SHX,stronghold-token,Stronghold,SHX,53490194.0,,776258.0,"Ethereum Ecosystem, Stellar Ecosystem, Made in USA"
SERAPH,seraph,Seraph,SERAPH,47149174.0,196862231.0,139776192.0,"Gaming (GameFi), BNB Chain Ecosystem, Play To Earn, Ethereum Ecosystem, RPG, Gaming Utility Token, Action Games"
MBL,moviebloc,MovieBloc,MBL,41713811.0,67136368.0,3769166.0,DWF Labs Portfolio
HASHAI,hashai,HashAI,HASHAI,40219897.0,42711770.0,354238.0,"Artificial Intelligence (AI), Ethereum Ecosystem, DePIN"
PARTI,particle-network,Particle Network,PARTI,38296296.0,164361786.0,15557284.0,"Decentralized Finance (DeFi), BNB Chain Ecosystem, Layer 1 (L1), Base Ecosystem, Account Abstraction, Cross-chain Communication, Binance HODLer Airdrops, Chain Abstraction, Binance Wallet IDO"
VIC,tomochain,Viction,VIC,37029853.0,63930651.0,336838397.0,"Smart Contract Platform, Masternodes, Layer 1 (L1), DWF Labs Portfolio"
SAI,sai,Sai,SAI,35872854.0,35872854.0,11.53,"Decentralized Finance (DeFi), Ethereum Ecosystem"
ANYONE,airtor-protocol,ANyONe Protocol,ANYONE,30799457.0,38529331.0,142364.0,"Smart Contract Platform, Ethereum Ecosystem, DePIN, Privacy Blockchain"
DAO,dao-maker,DAO Maker,DAO,29436855.0,32557144.0,2655445.0,"BNB Chain Ecosystem, Solana Ecosystem, Launchpad, DaoMaker Launchpad, Arbitrum Ecosystem, Ethereum Ecosystem, Step Network Ecosystem"
SOON,soon-2,SOON,SOON,27982177.0,149717372.0,29388605.0,"Infrastructure, Smart Contract Platform, BNB Chain Ecosystem, Layer 2 (L2), Cross-chain Communication, Binance Alpha Spotlight"
NFP,nfprompt-token,NFPrompt,NFP,25959950.0,54907249.0,3688310.0,"BNB Chain Ecosystem, Binance Launchpool, YZi Labs (Prev. Binance Labs) Portfolio"
NMT,netmind-token,NetMind Token,NMT,25677167.0,73864486.0,1741290.0,"Artificial Intelligence (AI), BNB Chain Ecosystem, Ethereum Ecosystem, DePIN, AI Agents"
OGY,origyn-foundation,ORIGYN,OGY,25329720.0,30274006.0,270158.0,"Internet Computer Ecosystem, Real World Assets (RWA), RWA Protocol"
ZORA,zora,Zora,ZORA,24959581.0,79233006.0,17061592.0,"Infrastructure, Media, Smart Contract Platform, NFT, Layer 2 (L2), Base Ecosystem, Coinbase Ventures Portfolio, Zora Ecosystem"
SD,stader,Stader,SD,24899971.0,49244271.0,2643521.0,"BNB Chain Ecosystem, Polygon Ecosystem, Fantom Ecosystem, Ethereum Ecosystem, Liquid Staking Governance Tokens, Animoca Brands Portfolio, Coinbase Ventures Portfolio, Pantera Capital Portfolio, Liquid Staking, Binance Alpha Spotlight"
ZETA,zeta,Zeta,ZEX,23491855.0,125109557.0,1802490.0,"Decentralized Finance (DeFi), Derivatives, Perpetuals, Solana Ecosystem"
REZ,renzo,Renzo,REZ,21389700.0,81280959.0,7342207.0,"Decentralized Finance (DeFi), Binance Launchpool, Ethereum Ecosystem, Base Ecosystem, Restaking, YZi Labs (Prev. Binance Labs) Portfolio, OKX Ventures Portfolio"
RIO,realio-network,Realio Network Token,RIO,19942188.0,19942188.0,1384094.0,"BNB Chain Ecosystem, Solana Ecosystem, Ethereum Ecosystem, Algorand Ecosystem, Real World Assets (RWA), Osmosis Ecosystem, Stellar Ecosystem, Made in USA"
NATIX,natix-network,NATIX Network,NATIX,19742690.0,92081815.0,472170.0,"Artificial Intelligence (AI), Internet of Things (IOT), Solana Ecosystem, DePIN"
FHE,mind-network,Mind Network,FHE,17672879.0,70975416.0,9149427.0,"Artificial Intelligence (AI), Smart Contract Platform, BNB Chain Ecosystem, Layer 2 (L2), Binance Wallet IDO"
HOPR,hopr,HOPR,HOPR,16524577.0,17324757.0,233764.0,"Privacy, Gnosis Chain Ecosystem, Ethereum Ecosystem, DePIN, YZi Labs (Prev. Binance Labs) Portfolio"
BOOE,book-of-ethereum,Book of Ethereum,BOOE,15891004.0,15891004.0,140051.0,"Meme, Ethereum Ecosystem"
PORT3,port3-network,Port3 Network,PORT3,15697653.0,31404902.0,14760292.0,"SocialFi, BNB Chain Ecosystem, Ethereum Ecosystem, Poolz Finance Launchpad"
VOW,vow,Vow,VOW,15678223.0,51295581.0,265740.0,"Retail, Tourism, BNB Chain Ecosystem, Ethereum Ecosystem"
REI,rei-network,REI Network,REI,15433689.0,15777285.0,5858034.0,"Smart Contract Platform, Layer 1 (L1)"
BRISE,bitrise-token,Bitgert,BRISE,15331689.0,16547386.0,2948723.0,"Smart Contract Platform, BNB Chain Ecosystem, Solana Ecosystem, Ethereum Ecosystem, Bitgert Ecosystem"
RETARDIO,retardio,RETARDIO,RETARDIO,14944424.0,14944424.0,905901.0,"NFT, Solana Ecosystem, Meme, Solana Meme, Murad Picks, 4chan-Themed"
VSC,vyvo-smart-chain,Vyvo Smart Chain,VSC,14260096.0,61059257.0,224595.0,"Smart Contract Platform, BNB Chain Ecosystem, Polygon Ecosystem, Layer 2 (L2)"
WEPE,wall-street-pepe,Wall Street Pepe,WEPE,14029110.0,14029110.0,2378875.0,"Meme, Ethereum Ecosystem, Frog-Themed, The Boys Club"
MFT,mainframe,Mainframe,MFT,13778462.0,14678937.0,5.26,"Ethereum Ecosystem, Energi Ecosystem"
NUM,numbers-protocol,Numbers Protocol,NUM,13489095.0,13658625.0,878861.0,"Artificial Intelligence (AI), Smart Contract Platform, BNB Chain Ecosystem, DaoMaker Launchpad, Ethereum Ecosystem, Avalanche L1, YZi Labs (Prev. Binance Labs) Portfolio, Outlier Ventures Portfolio"
VINU,vita-inu,Vita Inu,VINU,13192438.0,13192438.0,1152868.0,"BNB Chain Ecosystem, Meme, Dog-Themed, DWF Labs Portfolio, Binance Alpha Spotlight"
SUKU,suku,SUKU,SUKU,11963356.0,38864154.0,370609.0,"Polygon Ecosystem, Ethereum Ecosystem, Made in USA"
LINGO,lingo,Lingo,LINGO,11813439.0,11813681.0,421222.0,"Solana Ecosystem, Real World Assets (RWA), Base Ecosystem, RWA Protocol"
LOOKS,looksrare,LooksRare,LOOKS,11725706.0,11725706.0,1764578.0,"NFT, Ethereum Ecosystem, NFT Marketplace"
MLC,my-lovely-coin,My Lovely Coin,MLC,11140186.0,50013563.0,309530.0,"Charity, Gaming (GameFi), Polygon Ecosystem, Gaming Utility Token"
LOCK,houdini-swap,Houdini Swap,LOCK,11107333.0,11107333.0,13844.94,"Privacy, Solana Ecosystem, Ethereum Ecosystem"
MEMEFI,memefi-2,MemeFi,MEMEFI,11021692.0,11021692.0,4557085.0,"Gaming (GameFi), NFT, Meme, Play To Earn, Sui Ecosystem, Telegram Apps, Tap to Earn, Sui Meme, Action Games"
PROPS,propbase,Propbase,PROPS,10274102.0,29403777.0,2652375.0,"Tokenized Real Estate, Tokenized Assets, Aptos Ecosystem, Real World Assets (RWA), Base Ecosystem, RWA Protocol"
K,kinto,Kinto,K,10075804.0,54653626.0,723421.0,"Decentralized Finance (DeFi), Wallets"
DIONE,dione,Dione,DIONE,9950059.0,11739615.0,175954.0,"Energy, Smart Contract Platform, Layer 1 (L1), Made in USA"
EPT,balance,Balance,EPT,9911821.0,42786376.0,4792068.0,"Gaming (GameFi), BNB Chain Ecosystem, Animoca Brands Portfolio, DWF Labs Portfolio, AI Agents, Andreessen Horowitz (a16z) Portfolio, AI Agent Launchpad"
MCB,mcdex,MUX Protocol,MCB,9385339.0,11853125.0,13100.67,"Decentralized Exchange (DEX), Exchange-based Tokens, Decentralized Finance (DeFi), BNB Chain Ecosystem, Derivatives, Perpetuals, Arbitrum Ecosystem, Ethereum Ecosystem, Multicoin Capital Portfolio, Alameda Research Portfolio, DeFiance Capital Portfolio, Delphi Ventures Portfolio, OKX Ventures Portfolio"
SIDUS,sidus,Sidus,SIDUS,7706965.0,13159811.0,538164.0,"Gaming (GameFi), NFT, BNB Chain Ecosystem, Metaverse, Play To Earn, Ethereum Ecosystem, Linea Ecosystem, Animoca Brands Portfolio, Base Ecosystem, RPG, Gaming Governance Token, Alameda Research Portfolio, OKX Ventures Portfolio"
AEROBUD,aerobud,AEROBUD,AEROBUD,7246803.0,7246803.0,145068.0,"Charity, Meme, Base Ecosystem, Dog-Themed, Base Meme, Made in USA"
OX,ox-fun,OX Coin,OX,7143608.0,7143608.0,157656.0,"BNB Chain Ecosystem, Derivatives, Perpetuals, Solana Ecosystem, Avalanche Ecosystem, Polygon Ecosystem, Arbitrum Ecosystem, Ethereum Ecosystem, Base Ecosystem, Blast Ecosystem"
RLY,rally-2,Rally,RLY,6683338.0,20002436.0,134972.0,"SocialFi, Yield Farming, Ethereum Ecosystem, Alleged SEC Securities, Coinbase Ventures Portfolio, Andreessen Horowitz (a16z) Portfolio"
LEVER,lever,LeverFi,LEVER,6120414.0,6120546.0,3091772.0,"Decentralized Finance (DeFi), Ethereum Ecosystem, DWF Labs Portfolio, Alameda Research Portfolio"
PMT,public-meme-token,Public Masterpiece Token,PMT,5864892.0,22696773.0,248576.0,BNB Chain Ecosystem
JUNO,juno-network,JUNO,JUNO,5849083.0,7770943.0,75674.0,"Smart Contract Platform, Cosmos Ecosystem, Osmosis Ecosystem, Juno Ecosystem, Evmos Ecosystem, Secret Ecosystem"
BEAM,beam,BEAM,BEAM,5435714.0,7788254.0,168183.0,"Smart Contract Platform, Privacy, Ethereum Ecosystem, Proof of Work (PoW), BeamPrivacy Ecosystem, Privacy Blockchain"
KILO,kiloex,KiloEx,KILO,5214718.0,24632582.0,4302181.0,"Decentralized Exchange (DEX), Decentralized Finance (DeFi), BNB Chain Ecosystem, Derivatives, Binance Wallet IDO"
AZIT,azit,azit,AZIT,4763512.0,7008028.0,200022.0,Kaia Ecosystem
DYNA,dynachain,Dynachain,DYNA,4742434.0,20371982.0,317279.0,"Healthcare, BNB Chain Ecosystem"
OBT,oobit,Oobit,OBT,4721546.0,13412557.0,84732.0,"BNB Chain Ecosystem, Ethereum Ecosystem, Payment Solutions"
LIF3,lif3,LIF3 (OLD),LIF3,4492353.0,15265318.0,5.6,Fantom Ecosystem
PEAR,pear-protocol,Pear Protocol,PEAR,4265693.0,14325612.0,52879.0,"Decentralized Exchange (DEX), Decentralized Finance (DeFi), Perpetuals, Arbitrum Ecosystem"
NLS,nolus,Nolus,NLS,3977682.0,5853275.0,188110.0,"Ethereum Ecosystem, Osmosis Ecosystem"
MAS,massa,Massa,MAS,3967043.0,14876216.0,115102.0,"Smart Contract Platform, Layer 1 (L1), Massa Ecosystem"
LL,lightlink,LightLink,LL,3838539.0,13181257.0,232981.0,"Infrastructure, Smart Contract Platform, Ethereum Ecosystem, Layer 2 (L2), Rollup, LightLink Ecosystem"
SHRUB,shrub,Shrub,SHRUB,3640762.0,3671006.0,766954.0,"Solana Ecosystem, Meme, Ethereum Ecosystem, Base Ecosystem, Elon Musk-Inspired"
BCT,toucan-protocol-base-carbon-tonne,Base Carbon Tonne,BCT,3422580.0,3422580.0,38.98,"Polygon Ecosystem, Regenerative Finance (ReFi), Base Ecosystem"
METAV,metaverse,METAVERSE,METAV,3377362.0,3377362.0,391256.0,"Artificial Intelligence (AI), Solana Ecosystem, AI Agents, Pump.fun Ecosystem, Binance Alpha Spotlight"
SDN,shiden,Shiden Network,SDN,3279709.0,4244590.0,74953.0,Smart Contract Platform
HARAMBEAI,harambe-ai,Harambe AI,HARAMBEAI,3189004.0,4763862.0,106.3,"Meme, Ethereum Ecosystem"
GAIA,gaia-2,Gaia,SN57,3168585.0,3193042.0,254734.0,"Artificial Intelligence (AI), Bittensor Ecosystem, Bittensor Subnets"
ATS,alltoscan,Alltoscan,ATS,3023247.0,4431417.0,112278.0,BNB Chain Ecosystem
HBAR,hedera-hashgraph,Hedera,HBAR,6682015665.0,7881326679.0,172768010.0,"Smart Contract Platform, Layer 1 (L1), Hedera Ecosystem, GMCI Layer 1 Index, GMCI 30 Index, GMCI Index, Outlier Ventures Portfolio, Made in USA, Directed Acyclic Graph (DAG)"
BGB,bitget-token,Bitget Token,BGB,5040827580.0,5040827580.0,78269174.0,"Exchange-based Tokens, Centralized Exchange (CEX) Token, Ethereum Ecosystem, DragonFly Capital Portfolio, Morph L2 Ecosystem"
LBTC,lombard-staked-btc,Lombard Staked BTC,LBTC,1647725151.0,1647725151.0,6840557.0,"BNB Chain Ecosystem, Ethereum Ecosystem, Sui Ecosystem, Base Ecosystem, Restaking, Berachain Ecosystem, Liquid Restaking Tokens, Sonic Ecosystem, Swellchain Ecosystem, Corn Ecosystem, Liquid Staked BTC"
RENDER,render-token,Render,RENDER,1629288101.0,1675702383.0,53877283.0,"Artificial Intelligence (AI), NFT, Metaverse, Solana Ecosystem, Polygon Ecosystem, Ethereum Ecosystem, DePIN, Multicoin Capital Portfolio, Alameda Research Portfolio, GMCI DePIN Index, GMCI 30 Index, GMCI Index, Made in USA, Coinbase 50 Index"
TIA,celestia,Celestia,TIA,1107024473.0,1788904406.0,192011026.0,"Smart Contract Platform, Cosmos Ecosystem, Layer 1 (L1), Data Availability, Modular Blockchain, Osmosis Ecosystem, eGirl Capital Portfolio, Coinbase Ventures Portfolio, Proof of Stake (PoS), Secret Ecosystem, YZi Labs (Prev. Binance Labs) Portfolio, Delphi Ventures Portfolio, Galaxy Digital Portfolio, Blockchain Capital Portfolio, OKX Ventures Portfolio, Polychain Capital Portfolio"
XDC,xdce-crowd-sale,XDC Network,XDC,1080530910.0,2531227576.0,17234787.0,"Smart Contract Platform, Layer 1 (L1), Real World Assets (RWA)"
IP,story-2,Story,IP,906915234.0,3193208627.0,53369595.0,"Artificial Intelligence (AI), Smart Contract Platform, Layer 1 (L1), Made in USA, Story Ecosystem"
FLOKI,floki,FLOKI,FLOKI,798902900.0,826795593.0,169239292.0,"Gaming (GameFi), NFT, BNB Chain Ecosystem, Metaverse, Meme, Play To Earn, Ethereum Ecosystem, Telegram Apps, Dog-Themed, DWF Labs Portfolio, RPG, On-chain Gaming, TokenFi Launchpad, GMCI Meme Index, GMCI Index"
LDO,lido-dao,Lido DAO,LDO,651818199.0,726726227.0,56121584.0,"Infrastructure, Decentralized Finance (DeFi), Polygon Ecosystem, Arbitrum Ecosystem, Ethereum Ecosystem, Optimism Ecosystem, Liquid Staking Governance Tokens, eGirl Capital Portfolio, Paradigm Portfolio, Coinbase Ventures Portfolio, Multicoin Capital Portfolio, Index Coop Defi Index, Alameda Research Portfolio, DragonFly Capital Portfolio, Andreessen Horowitz (a16z) Portfolio, GMCI DeFi Index, Delphi Ventures Portfolio, Liquid Staking, GMCI Index, Coinbase 50 Index"
BTT,bittorrent,BitTorrent,BTT,601964524.0,604369093.0,16481470.0,"Storage, BNB Chain Ecosystem, Ethereum Ecosystem, DePIN, Alleged SEC Securities, Binance Launchpad, Tron Ecosystem, Energi Ecosystem, YZi Labs (Prev. Binance Labs) Portfolio, BitTorrent Ecosystem, GMCI DePIN Index, GMCI Index"
RAY,raydium,Raydium,RAY,575656684.0,1193690218.0,68567358.0,"Decentralized Exchange (DEX), Decentralized Finance (DeFi), Yield Farming, Automated Market Maker (AMM), Solana Ecosystem, Launchpad, GMCI DeFi Index, GMCI Index"
PYTH,pyth-network,Pyth Network,PYTH,552132013.0,960231944.0,22194464.0,"Business Services, Infrastructure, Decentralized Finance (DeFi), Oracle, Solana Ecosystem, Neon Ecosystem, Manta Network Ecosystem, Multicoin Capital Portfolio, GMCI DeFi Index, Delphi Ventures Portfolio, GMCI Index"
CFX,conflux-token,Conflux,CFX,371458639.0,413180184.0,19069086.0,"Smart Contract Platform, DWF Labs Portfolio, Proof of Work (PoW), GMCI Layer 1 Index, Sequoia Capital Portfolio, GMCI Index, Made in China"
EIGEN,eigenlayer,EigenCloud (prev. EigenLayer),EIGEN,355100021.0,1970135077.0,40135619.0,"Infrastructure, Ethereum Ecosystem, Data Availability, Restaking, Polychain Capital Portfolio, Made in USA"
JST,just,JUST,JST,340334721.0,340334721.0,19784505.0,"Decentralized Finance (DeFi), Tron Ecosystem"
SUN,sun-token,Sun Token,SUN,330008406.0,342964072.0,10143606.0,"Decentralized Finance (DeFi), Tron Ecosystem"
