TKX,tokenize-xchange,Tokenize Xchange,TKX,403209861,504037542.0,480628.0,"Exchange-based Tokens, Centralized Exchange (CEX) Token, Ethereum Ecosystem, Titanchain Ecosystem"
DRIFT,drift-protocol,Drift Protocol,DRIFT,358269646,576897313.0,20226706.0,"Decentralized Finance (DeFi), Derivatives, Prediction Markets, Solana Ecosystem"
JST,just,JUST,JST,338931037,338931037.0,27820385.0,"Decentralized Finance (DeFi), Tron Ecosystem"
DASH,dash,Dash,DASH,291498041,291526186.0,22979368.0,"Smart Contract Platform, Privacy, Masternodes, Alleged SEC Securities, Proof of Stake (PoS), Proof of Work (PoW), Made in USA"
NPC,non-playable-coin,Non-Playable Coin,NPC,257139936,257139936.0,8498310.0,"NFT, BNB Chain Ecosystem, Solana Ecosystem, Meme, Ethereum Ecosystem, Base Ecosystem, Hybrid Token Standards, Wojak-Themed, 4chan-Themed"
CELO,celo,Celo,CELO,211160708,364875504.0,22295563.0,"Smart Contract Platform, Celo Ecosystem, Layer 2 (L2), DWF Labs Portfolio, Coinbase Ventures Portfolio, Proof of Stake (PoS), Andreessen Horowitz (a16z) Portfolio, Optimism Superchain Ecosystem, Outlier Ventures Portfolio, Made in USA"
LGCT,legacy-token,Legacy Token,LGCT,192538738,544514797.0,6081712.0,"Education, Gaming (GameFi), BNB Chain Ecosystem, Base Ecosystem"
VTHO,vethor-token,VeThor,VTHO,186398245,186453240.0,2904357.0,"Layer 1 (L1), VeChain Ecosystem"
ELF,aelf,aelf,ELF,170628284,216376619.0,5421839.0,"Infrastructure, Smart Contract Platform, BNB Chain Ecosystem, Layer 1 (L1), Ethereum Ecosystem, GMCI Layer 1 Index, Aelf Ecosystem, GMCI Index"
WOO,woo-network,WOO,WOO,155028359,179413564.0,9156062.0,"Decentralized Exchange (DEX), Exchange-based Tokens, Decentralized Finance (DeFi), Automated Market Maker (AMM), BNB Chain Ecosystem, Derivatives, Perpetuals, Centralized Exchange (CEX) Token, Solana Ecosystem, Avalanche Ecosystem, Polygon Ecosystem, Near Protocol Ecosystem, Fantom Ecosystem, Arbitrum Ecosystem, Ethereum Ecosystem, ZkSync Ecosystem, Mantle Ecosystem, Linea Ecosystem, Base Ecosystem, DragonFly Capital Portfolio, YZi Labs (Prev. Binance Labs) Portfolio"
AI16Z,ai16z,ai16z,AI16Z,154264330,154264330.0,59681230.0,"Artificial Intelligence (AI), Solana Ecosystem, Meme, Solana Token-2022, AI Agents, Binance Alpha Spotlight, AI Framework, Made in USA"
ZIG,zignaly,ZIGChain,ZIG,140325257,194605228.0,3755010.0,"Artificial Intelligence (AI), Smart Contract Platform, BNB Chain Ecosystem, Solana Ecosystem, Layer 1 (L1), Polygon Ecosystem, Ethereum Ecosystem, DWF Labs Portfolio, Injective Ecosystem, OKX Ventures Portfolio"
IO,io,io.net,IO,129903927,552370827.0,62931282.0,"Artificial Intelligence (AI), Internet of Things (IOT), Binance Launchpool, Solana Ecosystem, DePIN, Animoca Brands Portfolio, Multicoin Capital Portfolio, Delphi Ventures Portfolio, OKX Ventures Portfolio, Made in USA"
OZO,ozone-chain,Ozone Chain,OZO,123347584,145368018.0,225016.0,"Smart Contract Platform, Layer 1 (L1), Zero Knowledge (ZK)"
SIX,six,Six Sigma,SIX,114879417,114879417.0,10686.44,"Gambling (GambleFi), Solana Ecosystem"
BICO,biconomy,Biconomy,BICO,114441435,117619863.0,11072143.0,"Arbitrum Ecosystem, Ethereum Ecosystem, Account Abstraction, Coinbase Ventures Portfolio, YZi Labs (Prev. Binance Labs) Portfolio, Consensys Portfolio, Outlier Ventures Portfolio"
PAAL,paal-ai,PAAL AI,PAAL,101139977,112691839.0,9613113.0,"Artificial Intelligence (AI), Virtual Reality, BNB Chain Ecosystem, Launchpad, Ethereum Ecosystem, Telegram Apps, Discord Bots, Base Ecosystem, PAAL AI Launchpad, AI Agents, AI Applications, AI Agent Launchpad, Binance Alpha Spotlight, AI Framework, DeFAI, Made in USA"
BAL,balancer,Balancer,BAL,98010303,105335084.0,33017311.0,"Decentralized Exchange (DEX), Exchange-based Tokens, Decentralized Finance (DeFi), Yield Farming, Automated Market Maker (AMM), Avalanche Ecosystem, Polygon Ecosystem, Near Protocol Ecosystem, Gnosis Chain Ecosystem, Harmony Ecosystem, Arbitrum Ecosystem, Ethereum Ecosystem, Optimism Ecosystem, Base Ecosystem, Index Coop Defi Index, Alameda Research Portfolio, DeFiance Capital Portfolio, Pantera Capital Portfolio, Energi Ecosystem, Polygon zkEVM Ecosystem, Huobi ECO Chain Ecosystem, Blockchain Capital Portfolio"
VEE,blockv,BLOCKv,VEE,86660238,86660238.0,94563.0,"NFT, Polygon Ecosystem, Ethereum Ecosystem, Optimism Ecosystem"
RLC,iexec-rlc,iExec RLC,RLC,74903893,90030301.0,8738564.0,"Artificial Intelligence (AI), Oracle, Arbitrum Ecosystem, Ethereum Ecosystem, DePIN, AI Agents, Energi Ecosystem, Sora Ecosystem, GMCI DePIN Index, GMCI Index"
VANRY,vanar-chain,Vanar Chain,VANRY,65592748,66737506.0,10496041.0,"Smart Contract Platform, Gaming (GameFi), NFT, Layer 1 (L1), Polygon Ecosystem, Ethereum Ecosystem, Vanar Chain Ecosystem"
AO,ao-computer,ao Computer,AO,63989800,63989800.0,2011646.0,"Artificial Intelligence (AI), Smart Contract Platform, DePIN"
SCRT,secret,Secret,SCRT,61036590,64129641.0,2967272.0,"Artificial Intelligence (AI), Smart Contract Platform, Cosmos Ecosystem, Layer 1 (L1), Osmosis Ecosystem, Alameda Research Portfolio, DragonFly Capital Portfolio, DeFiance Capital Portfolio, Privacy Blockchain, Outlier Ventures Portfolio"
STRIKE,strike,Strike,STRIKE,58991909,68325684.0,72734323.0,"Decentralized Finance (DeFi), Lending/Borrowing Protocols, Ethereum Ecosystem"
CHILLGUY,chill-guy,Just a chill guy,CHILLGUY,58860350,58860350.0,17947364.0,"Solana Ecosystem, Meme, Dog-Themed, Solana Meme, Pump.fun Ecosystem, TikTok Meme"
QI,benqi,BENQI,QI,53804892,54036498.0,2614470.0,"Decentralized Finance (DeFi), Yield Farming, Binance Launchpool, Lending/Borrowing Protocols, Avalanche Ecosystem, Liquid Staking Governance Tokens, DragonFly Capital Portfolio, Liquid Staking"
QKC,quark-chain,QuarkChain,QKC,53187495,74387518.0,2255423.0,"Infrastructure, Ethereum Ecosystem, Energi Ecosystem"
ACS,access-protocol,Access Protocol,ACS,51058685,107608075.0,1211335.0,"SocialFi, Solana Ecosystem"
ANVL,anvil,Anvil,ANVL,47843727,172421599.0,194045.0,"Decentralized Finance (DeFi), Ethereum Ecosystem"
UQC,uquid-coin,Uquid Coin,UQC,46770839,187083357.0,102004.0,Ethereum Ecosystem
NYM,nym,Nym,NYM,46249520,56701897.0,2277064.0,"Smart Contract Platform, Privacy, Ethereum Ecosystem, DePIN, Osmosis Ecosystem, VPN, Andreessen Horowitz (a16z) Portfolio, YZi Labs (Prev. Binance Labs) Portfolio"
OGN,origin-protocol,Origin Token,OGN,44198471,91738026.0,5694743.0,"Decentralized Finance (DeFi), NFT, Ethereum Ecosystem, Base Ecosystem, Pantera Capital Portfolio, Sonic Ecosystem, Liquid Staking, Made in USA"
FORT,forta,Forta,FORT,43818987,71334813.0,640690.0,"Artificial Intelligence (AI), Polygon Ecosystem, Ethereum Ecosystem, Coinbase Ventures Portfolio, Cybersecurity, Andreessen Horowitz (a16z) Portfolio, Blockchain Capital Portfolio"
GPS,goplus-security,GoPlus Security,GPS,43239847,162821063.0,8036689.0,"BNB Chain Ecosystem, Base Ecosystem, Cybersecurity, YZi Labs (Prev. Binance Labs) Portfolio, OKX Ventures Portfolio, Binance Alpha Spotlight"
NOS,nosana,Nosana,NOS,42898527,51437083.0,625516.0,"Artificial Intelligence (AI), Solana Ecosystem, DePIN"
SEDA,seda-2,SEDA,SEDA,40124160,67027916.0,404880.0,"Smart Contract Platform, Oracle, Ethereum Ecosystem, Base Ecosystem, Modular Blockchain, Osmosis Ecosystem"
MBX,marblex,MARBLEX,MBX,39187684,58287638.0,2595016.0,"Smart Contract Platform, Gaming (GameFi), NFT, BNB Chain Ecosystem, Kaia Ecosystem, Aptos Ecosystem, DWF Labs Portfolio, Gaming Blockchains"
LYX,lukso-token-2,LUKSO,LYX,36672842,50579255.0,2461697.0,"Smart Contract Platform, SocialFi, Layer 1 (L1), Decentralized Identifier (DID), Proof of Stake (PoS), Lukso Ecosystem"
APX,apollox-2,APX,APX,35577952,328796898.0,971809.0,"Decentralized Finance (DeFi), BNB Chain Ecosystem, Perpetuals, YZi Labs (Prev. Binance Labs) Portfolio, Binance Alpha Spotlight"
MAPO,marcopolo,MAP Protocol,MAPO,34566305,55961669.0,2556227.0,"BNB Chain Ecosystem, Ethereum Ecosystem, DWF Labs Portfolio"
AINTI,aintivirus,AIntivirus,AINTI,33726912,33726912.0,0.0,"Solana Ecosystem, Meme, AI Meme, Pump.fun Ecosystem"
NAVX,navi,NAVI Protocol,NAVX,32615520,55331398.0,3981491.0,"Decentralized Finance (DeFi), Lending/Borrowing Protocols, Sui Ecosystem, OKX Ventures Portfolio, Binance Alpha Spotlight"
L3,layer3,Layer3,L3,31751524,148081851.0,10425931.0,"Marketing, BNB Chain Ecosystem, Solana Ecosystem, Polygon Ecosystem, Arbitrum Ecosystem, Ethereum Ecosystem, Decentralized Identifier (DID), Optimism Ecosystem, Quest-to-Earn, Made in USA"
LUMIA,lumia,Lumia,LUMIA,27212801,86324656.0,8687921.0,"Smart Contract Platform, Layer 2 (L2), Real World Assets (RWA)"
PIKA,pikaboss,Pikaboss,PIKA,24235513,24235513.0,30453.0,"Meme, Ethereum Ecosystem"
WALLET,ambire-wallet,Ambire Wallet,WALLET,21706617,21822252.0,294711.0,"Wallets, Polygon Ecosystem, Ethereum Ecosystem, Base Ecosystem, Account Abstraction"
FARTBOY,fartboy,Fartboy,$FARTBOY,20962496,20962496.0,346243.0,"Solana Ecosystem, Meme, Solana Meme, Pump.fun Ecosystem"
FLOCK,flock-2,FLOCK,FLOCK,20058366,182056014.0,16891163.0,"Artificial Intelligence (AI), Base Ecosystem, AI Applications, Binance Alpha Spotlight"
NRN,neuron,Neuron,NRN,18753473,41726955.0,137340.0,"Artificial Intelligence (AI), Gaming (GameFi), NFT, Arbitrum Ecosystem, Paradigm Portfolio, AI Agents, AI Framework, Action Games"
RARI,rarible,RARI,RARI,18210195,25121832.0,998578.0,"NFT, Ethereum Ecosystem, NFT Marketplace, Coinbase Ventures Portfolio, Energi Ecosystem, Made in USA"
PIPPIN,pippin,pippin,PIPPIN,17680303,17680303.0,8246466.0,"Artificial Intelligence (AI), Infrastructure, Solana Ecosystem, Meme, Solana Meme, AI Meme, AI Agents, Pump.fun Ecosystem, Binance Alpha Spotlight, AI Framework"
BUZZ,hive-ai,Hive AI,BUZZ,17632420,17632420.0,14221440.0,"Decentralized Finance (DeFi), Solana Ecosystem, AI Agents, Pump.fun Ecosystem, Binance Alpha Spotlight, DeFAI"
VADER,vaderai-by-virtuals,VaderAI by Virtuals,VADER,17507386,17507386.0,885126.0,"Artificial Intelligence (AI), Meme, Base Ecosystem, AI Meme, AI Agents, Virtuals Protocol Ecosystem, Binance Alpha Spotlight"
TLOS,telos,Telos,TLOS,16776480,16776481.0,1922843.0,"Smart Contract Platform, BNB Chain Ecosystem, Layer 1 (L1), Avalanche Ecosystem, Polygon Ecosystem, Arbitrum Ecosystem, Ethereum Ecosystem, Zero Knowledge (ZK), Base Ecosystem, Telos Ecosystem, Consensys Portfolio"
SCA,scallop-2,Scallop,SCA,13624264,28287399.0,3782004.0,"Decentralized Finance (DeFi), Lending/Borrowing Protocols, Sui Ecosystem"
XTER,xterio,Xterio,XTER,13182533,93254929.0,10836073.0,"Artificial Intelligence (AI), Gaming (GameFi), NFT, BNB Chain Ecosystem, Animoca Brands Portfolio, Gaming Blockchains, YZi Labs (Prev. Binance Labs) Portfolio, Binance Alpha Spotlight"
TET,tectum,Tectum,TET,12241949,12472830.0,477077.0,"Smart Contract Platform, Layer 1 (L1), Ethereum Ecosystem, Bitcoin Sidechains, SideChain"
BELLS,bellscoin,Bellscoin,BELLS,11183068,11183068.0,396808.0,"Smart Contract Platform, Layer 1 (L1), Meme, Proof of Work (PoW), Inscriptions, Made in USA"
EOS,binance-peg-eos,Binance-Peg EOS,EOS,10967003,10967003.0,5020.58,"Smart Contract Platform, BNB Chain Ecosystem, Binance-Peg Tokens"
HMT,human-protocol,HUMAN Protocol,HMT,10512224,13870812.0,17740.22,"Artificial Intelligence (AI), Infrastructure, Software as a service, Polygon Ecosystem, Ethereum Ecosystem, Market-Making Solution, AI Framework"
JETTON,jetton,JetTon Games,JETTON,10337503,16155298.0,109386.0,"Gambling (GambleFi), Telegram Apps, TON Ecosystem"
CEEK,ceek,CEEK Smart VR,CEEK,10273462,10558533.0,415034.0,"Entertainment, BNB Chain Ecosystem, Metaverse, Ethereum Ecosystem, DWF Labs Portfolio"
DEXTF,dextf,Memento,DEXTF,10268449,15603830.0,39006.0,"Decentralized Finance (DeFi), Asset Manager, Avalanche Ecosystem, Ethereum Ecosystem, ZkSync Ecosystem, Real World Assets (RWA)"
VISTA,ethervista,Ethervista,VISTA,9666155,9666109.0,1781354.0,"Decentralized Exchange (DEX), Decentralized Finance (DeFi), Launchpad, Meme, Ethereum Ecosystem, Murad Picks, Binance Alpha Spotlight"
SOVRN,sovrun,Sovrun,SOVRN,9443916,10173015.0,122027.0,"Gaming (GameFi), Metaverse, Ethereum Ecosystem, Animoca Brands Portfolio, Base Ecosystem, DWF Labs Portfolio, On-chain Gaming, Andreessen Horowitz (a16z) Portfolio, Hyperliquid Ecosystem, Delphi Ventures Portfolio, Circle Ventures Portfolio"
XX,xxcoin,XX Network,XX,9399121,26599032.0,212418.0,"Smart Contract Platform, Layer 1 (L1), Ethereum Ecosystem"
PPC,peercoin,Peercoin,PPC,8984751,8984804.0,61690.0,"Smart Contract Platform, Polygon Ecosystem, Ethereum Ecosystem, Proof of Stake (PoS), Proof of Work (PoW)"
TRIAS,trias-token,TriasLab,TRIAS,8673400,8673400.0,159253.0,"Artificial Intelligence (AI), Smart Contract Platform, BNB Chain Ecosystem, Layer 1 (L1), Ethereum Ecosystem, AI Agents"
GRAM,gram-2,Gram,GRAM,8643773,8643773.0,17134.13,"TON Ecosystem, Proof of Work (PoW)"
GRAIL,camelot-token,Camelot Token,GRAIL,8414768,31937613.0,168607.0,"Decentralized Exchange (DEX), Arbitrum Ecosystem, Camelot Launchpad"
OVR,ovr,Ovr,OVR,7746839,13266758.0,376694.0,"Augmented Reality, NFT, BNB Chain Ecosystem, Metaverse, Polygon Ecosystem, Ethereum Ecosystem, DePIN, Base Ecosystem"
CA,ca-htb,Coupon Assets,CA,7708862,113166771.0,4468420.0,"Retail, Ethereum Ecosystem"
DNX,dynex,Dynex,DNX,7501543,7505602.0,623844.0,"Artificial Intelligence (AI), Smart Contract Platform, Layer 1 (L1), Ethereum Ecosystem, DePIN, Decentralized Science (DeSci), Proof of Work (PoW)"
IMGN,imgn-labs,IMGN Labs,IMGN,7416345,7416345.0,270249.0,"Artificial Intelligence (AI), Base Ecosystem, AI Applications"
PAIN,pain,Pain,PAIN,6529498,13059079.0,842699.0,"Solana Ecosystem, Meme, Solana Meme, 4chan-Themed"
LCAT,lion-cat,Lion Cat,LCAT,6292237,8431809.0,103881.0,"BNB Chain Ecosystem, Meme, Cat-Themed"
APP,moon-app,RWAX,APP,6138455,9272848.0,83710.0,"Tokenized Real Estate, Tokenized Assets, BNB Chain Ecosystem, Solana Ecosystem, Ethereum Ecosystem, Real World Assets (RWA), Injective Ecosystem, RWA Protocol"
RVF,rocketx,RocketX Exchange,RVF,5959701,6096947.0,22745.0,"Decentralized Exchange (DEX), Decentralized Finance (DeFi), Automated Market Maker (AMM), Ethereum Ecosystem, Poolz Finance Launchpad"
VRTX,vertex-protocol,Vertex,VRTX,5831689,11037230.0,5533.84,"Decentralized Exchange (DEX), Exchange-based Tokens, Decentralized Finance (DeFi), Derivatives, Perpetuals, Avalanche Ecosystem, Arbitrum Ecosystem, Mantle Ecosystem, Base Ecosystem, Blast Ecosystem, Sonic Ecosystem, Sei Network Ecosystem"
ORT,okratech-token,Okratech,ORT,5699941,5721265.0,423404.0,"BNB Chain Ecosystem, Kommunitas Launchpad, DWF Labs Portfolio"
ZKL,zklink,zkLink,ZKL,5606645,17014590.0,2649087.0,"Smart Contract Platform, Ethereum Ecosystem, Zero Knowledge (ZK), Layer 3 (L3), zkLink Nova Ecosystem, OKX Ventures Portfolio"
KIMA,kima,Kima Network,KIMA,5468352,19658677.0,292733.0,"Infrastructure, Cosmos Ecosystem, Arbitrum Ecosystem, Outlier Ventures Portfolio"
HAPPY,happycat-2,Happy Cat,HAPPY,5051916,5051916.0,1358001.0,"BNB Chain Ecosystem, Solana Ecosystem, Meme, Cat-Themed, Binance Alpha Spotlight"
LMT,limitus,LIMITUS,LMT,5050752,5050752.0,489924.0,"Artificial Intelligence (AI), Solana Ecosystem, Pump.fun Ecosystem, Binance Alpha Spotlight"
APT,aptos,Aptos,APT,3306499761,5652273733.0,542079391.0,"Smart Contract Platform, Layer 1 (L1), Aptos Ecosystem, FTX Holdings, Coinbase Ventures Portfolio, Multicoin Capital Portfolio, Proof of Stake (PoS), DragonFly Capital Portfolio, Andreessen Horowitz (a16z) Portfolio, YZi Labs (Prev. Binance Labs) Portfolio, GMCI Layer 1 Index, GMCI 30 Index, Circle Ventures Portfolio, GMCI Index, Made in USA"
ICP,internet-computer,Internet Computer,ICP,3063009239,3063009239.0,76241473.0,"Artificial Intelligence (AI), Infrastructure, Smart Contract Platform, Layer 1 (L1), Internet Computer Ecosystem, Alleged SEC Securities, Multicoin Capital Portfolio, Layer 0 (L0), Andreessen Horowitz (a16z) Portfolio, GMCI Layer 1 Index, GMCI 30 Index, Blockchain Capital Portfolio, GMCI Index, Polychain Capital Portfolio, Coinbase 50 Index"
FTN,fasttoken,Fasttoken,FTN,1981143487,3997120163.0,63122520.0,"Smart Contract Platform, BNB Chain Ecosystem, Layer 1 (L1), Arbitrum Ecosystem, Ethereum Ecosystem, Base Ecosystem, Bahamut Ecosystem"
STX,blockstack,Stacks,STX,1347235975,1347235975.0,36503872.0,"Infrastructure, Smart Contract Platform, Layer 2 (L2), Bitcoin Sidechains, Stacks Ecosystem, SideChain, GMCI Layer 2 Index, GMCI 30 Index, Blockchain Capital Portfolio, GMCI Index, Made in USA, Coinbase 50 Index"
AERO,aerodrome-finance,Aerodrome Finance,AERO,1081959375,2109072481.0,158750683.0,"Decentralized Exchange (DEX), Decentralized Finance (DeFi), Automated Market Maker (AMM), Base Ecosystem, Binance Alpha Spotlight, Made in USA"
TEL,telcoin,Telcoin,TEL,595733519,643498937.0,2477911.0,"Decentralized Finance (DeFi), Wallets, Polygon Ecosystem, Arbitrum Ecosystem, Ethereum Ecosystem, Payment Solutions, Base Ecosystem, Made in USA"
SYRUP,syrup,Maple Finance,SYRUP,512335369,550233791.0,82727629.0,"Decentralized Finance (DeFi), Yield Farming, Lending/Borrowing Protocols, Ethereum Ecosystem, Real World Assets (RWA), Base Ecosystem, Binance Alpha Spotlight"
DEXE,dexe,DeXe,DEXE,426296183,720434729.0,8756407.0,"Artificial Intelligence (AI), Decentralized Finance (DeFi), BNB Chain Ecosystem, Ethereum Ecosystem"
DCR,decred,Decred,DCR,304198474,304213039.0,3325733.0,"Smart Contract Platform, Privacy, Layer 1 (L1), Proof of Stake (PoS), Proof of Work (PoW), Blockchain Capital Portfolio, Made in USA"
MEW,cat-in-a-dogs-world,cat in a dogs world,MEW,301172525,301172525.0,39852368.0,"Solana Ecosystem, Meme, Dog-Themed, Solana Meme, Cat-Themed"
KSM,kusama,Kusama,KSM,269386301,269397101.0,15032476.0,"Smart Contract Platform, Polkadot Ecosystem, Proof of Stake (PoS), Pantera Capital Portfolio, Made in USA, Coinbase 50 Index, Hydration Ecosystem"
MINA,mina-protocol,Mina Protocol,MINA,250889267,250890136.0,117036973.0,"Smart Contract Platform, Layer 1 (L1), Zero Knowledge (ZK), FTX Holdings, Paradigm Portfolio, Coinbase Ventures Portfolio, Multicoin Capital Portfolio, Proof of Stake (PoS), Pantera Capital Portfolio, Circle Ventures Portfolio, Privacy Blockchain, Polychain Capital Portfolio, Made in USA, Coinbase 50 Index"
ZIL,zilliqa,Zilliqa,ZIL,235535089,253526450.0,15414457.0,"Smart Contract Platform, BNB Chain Ecosystem, GMCI Layer 1 Index, GMCI Index, Made in China"
EUL,euler,Euler,EUL,225702685,328341495.0,3976808.0,"Lending/Borrowing Protocols, Avalanche Ecosystem, Arbitrum Ecosystem, Ethereum Ecosystem, Base Ecosystem, Paradigm Portfolio, Coinbase Ventures Portfolio, Unichain Ecosystem"
YFI,yearn-finance,yearn.finance,YFI,199852075,216540186.0,22430985.0,"Decentralized Finance (DeFi), Yield Farming, Yield Aggregator, Yearn Ecosystem, Avalanche Ecosystem, Polygon Ecosystem, Near Protocol Ecosystem, Gnosis Chain Ecosystem, Fantom Ecosystem, Harmony Ecosystem, Arbitrum Ecosystem, Ethereum Ecosystem, Optimism Ecosystem, Base Ecosystem, Index Coop Defi Index, Alameda Research Portfolio, Energi Ecosystem, Sora Ecosystem, Huobi ECO Chain Ecosystem, Blockchain Capital Portfolio"
KMNO,kamino,Kamino,KMNO,151064043,596249500.0,19001069.0,"Decentralized Finance (DeFi), Lending/Borrowing Protocols, Solana Ecosystem, Binance Alpha Spotlight"
CYBER,cyberconnect,CYBER,CYBER,129165277,289292464.0,1202421301.0,"Smart Contract Platform, SocialFi, NFT, BNB Chain Ecosystem, Binance Launchpool, Ethereum Ecosystem, Decentralized Identifier (DID), Optimism Ecosystem, Layer 2 (L2), Animoca Brands Portfolio, Multicoin Capital Portfolio, YZi Labs (Prev. Binance Labs) Portfolio, Delphi Ventures Portfolio, Cyber Ecosystem, Optimism Superchain Ecosystem"
ACX,across-protocol,Across Protocol,ACX,116821776,192468581.0,18164487.0,"Polygon Ecosystem, Arbitrum Ecosystem, Ethereum Ecosystem, Optimism Ecosystem, Bridge Governance Tokens, Cross-chain Communication, Intent, Boba Network Ecosystem, Blockchain Capital Portfolio, Made in USA"
HIVE,hive,Hive,HIVE,110426941,,3005184.0,"Smart Contract Platform, SocialFi, Layer 1 (L1), Gaming Blockchains"
PEOPLE,constitutiondao,ConstitutionDAO,PEOPLE,107040735,107040735.0,51241351.0,"Meme, Ethereum Ecosystem, PolitiFi"
YGG,yield-guild-games,Yield Guild Games,YGG,102787724,173755631.0,20187956.0,"Gaming (GameFi), NFT, BNB Chain Ecosystem, Metaverse, Collectibles, Polygon Ecosystem, Play To Earn, Harmony Ecosystem, Guild and Scholarship, Ethereum Ecosystem, Animoca Brands Portfolio, Base Ecosystem, DWF Labs Portfolio, Ronin Ecosystem, Gaming Governance Token, Andreessen Horowitz (a16z) Portfolio, Delphi Ventures Portfolio, Abstract Ecosystem"
VVV,venice-token,Venice Token,VVV,98222463,221040261.0,4658242.0,"Artificial Intelligence (AI), Base Ecosystem, AI Agents, AI Applications, Made in USA"
EWT,energy-web-token,Energy Web,EWT,93758747,106488630.0,369171.0,"Energy, Polkadot Ecosystem, Gnosis Chain Ecosystem, Regenerative Finance (ReFi), Real World Assets (RWA), Blockchain Capital Portfolio, Hydration Ecosystem"
SGB,songbird,Songbird,SGB,91910596,108846193.0,239998.0,Smart Contract Platform
CARV,carv,CARV,CARV,91196699,309514332.0,21394859.0,"Artificial Intelligence (AI), Infrastructure, Gaming (GameFi), NFT, BNB Chain Ecosystem, Solana Ecosystem, Arbitrum Ecosystem, Impossible Finance Launchpad, Ethereum Ecosystem, Animoca Brands Portfolio, Base Ecosystem"
MVL,mass-vehicle-ledger,MVL,MVL,89077995,91547540.0,349324.0,"Internet of Things (IOT), BNB Chain Ecosystem, Ethereum Ecosystem, DePIN, DWF Labs Portfolio"
B3,b3,B3 (Base),B3,88972562,326301141.0,7398727.0,"Smart Contract Platform, Base Ecosystem, Gaming Blockchains"
USTC,terrausd,TerraClassicUSD,USTC,81072729,88336934.0,22092465.0,"Stablecoins, USD Stablecoin, Seigniorage, Alleged SEC Securities, Osmosis Ecosystem, Stablecoin Protocol, DeFiance Capital Portfolio, Terra Classic Ecosystem, YZi Labs (Prev. Binance Labs) Portfolio, Delphi Ventures Portfolio, Galaxy Digital Portfolio, Fiat-backed Stablecoin"
ZRC,zircuit,Zircuit,ZRC,77055556,351062611.0,14350828.0,"Smart Contract Platform, BNB Chain Ecosystem, Ethereum Ecosystem, Layer 2 (L2), Zero Knowledge (ZK), Restaking, Zircuit Ecosystem"
SCR,scroll,Scroll,SCR,69604872,366341431.0,60598125.0,"Smart Contract Platform, Binance Launchpool, Layer 2 (L2), Scroll Ecosystem"
AVAIL,avail,Avail,AVAIL,67459955,208009440.0,6041505.0,"Infrastructure, Smart Contract Platform, BNB Chain Ecosystem, Ethereum Ecosystem, Data Availability, Modular Blockchain, Binance Alpha Spotlight"
ALI,alethea-artificial-liquid-intelligence-token,Artificial Liquid Intelligence,ALI,67346020,72906277.0,2216043.0,"Artificial Intelligence (AI), NFT, Metaverse, Solana Ecosystem, Polygon Ecosystem, Ethereum Ecosystem, Cronos Ecosystem, Base Ecosystem, Multicoin Capital Portfolio, AI Agents, Alameda Research Portfolio, DeFiance Capital Portfolio, YZi Labs (Prev. Binance Labs) Portfolio"
PEP,pepecoin-network,Pepecoin,PEP,66175956,66176296.0,418910.0,"Smart Contract Platform, Layer 1 (L1), Meme, Frog-Themed, Proof of Work (PoW), The Boys Club, 4chan-Themed"
WHITE,whiteheart,Whiteheart,WHITE,64331810,64331810.0,844.8,"Decentralized Finance (DeFi), Derivatives, Ethereum Ecosystem"
WNXM,wrapped-nxm,Wrapped NXM,WNXM,64011234,63997483.0,675912.0,"Crypto-Backed Tokens, Decentralized Finance (DeFi), Insurance, Wrapped-Tokens, Ethereum Ecosystem, Blockchain Capital Portfolio"
AGLD,adventure-gold,Adventure Gold,AGLD,62656890,69634606.0,12429256.0,"Ethereum Ecosystem, DWF Labs Portfolio"
NMD,nexusmind,NexusMind,NMD,60700129,591763271.0,49.41,"SocialFi, BNB Chain Ecosystem"
HFT,hashflow,Hashflow,HFT,58070964,97040649.0,32192964.0,"Decentralized Exchange (DEX), Exchange-based Tokens, Decentralized Finance (DeFi), BNB Chain Ecosystem, Binance Launchpool, MEV Protection, Ethereum Ecosystem, Coinbase Ventures Portfolio, Alameda Research Portfolio, DragonFly Capital Portfolio, Galaxy Digital Portfolio"
UNP,unipoly,Unipoly,UNP,55928727,200296268.0,586772.0,"Gaming (GameFi), Ethereum Ecosystem, Skale Ecosystem"
ISLM,islamic-coin,Islamic Coin,ISLM,43807177,438374351.0,222340.0,"Smart Contract Platform, Wallets, Layer 2 (L2), Osmosis Ecosystem"
NCT,polyswarm,PolySwarm,NCT,42290839,42300086.0,4943714.0,"Business Services, Polygon Ecosystem, Ethereum Ecosystem, Cybersecurity, Made in USA"
SYN,synapse-2,Synapse,SYN,32148694,36688277.0,8520520.0,"BNB Chain Ecosystem, Avalanche Ecosystem, Polygon Ecosystem, Fantom Ecosystem, Arbitrum Ecosystem, Olympus Pro Ecosystem, Ethereum Ecosystem, Optimism Ecosystem, Bridge Governance Tokens, Base Ecosystem, Alameda Research Portfolio, Intent"
PORTAL,portal-2,Portal,PORTAL,29849180,51008177.0,13183599.0,"Gaming (GameFi), Solana Ecosystem, Ethereum Ecosystem, Gaming Platform"
CONX,connex,Connex,CONX,27589941,2399125275.0,8823.64,BNB Chain Ecosystem
FLAY,flayer,Flayer,FLAY,26101879,43503132.0,361145.0,"Launchpad, Ethereum Ecosystem"
SWARMS,swarms,Swarms,SWARMS,25213023,25213023.0,9586784.0,"Artificial Intelligence (AI), Solana Ecosystem, AI Agents, Pump.fun Ecosystem, Binance Alpha Spotlight, AI Framework"
INV,inverse-finance,Inverse Finance,INV,25090554,30210782.0,256691.0,"Decentralized Finance (DeFi), Yield Farming, Yield Aggregator, Lending/Borrowing Protocols, Olympus Pro Ecosystem, Ethereum Ecosystem, Fixed Interest"
D,dar-open-network,Dar Open Network,D,23914538,29748497.0,2780343.0,"Gaming (GameFi), BNB Chain Ecosystem, Binance Launchpool, Play To Earn, Ethereum Ecosystem, Animoca Brands Portfolio, AI Agents"
SWEAT,sweatcoin,SWEAT,SWEAT,18414135,50678246.0,5113349.0,"Sports, Gaming (GameFi), BNB Chain Ecosystem, Solana Ecosystem, Avalanche Ecosystem, Polygon Ecosystem, Near Protocol Ecosystem, Play To Earn, Arbitrum Ecosystem, Celo Ecosystem, Move To Earn, Ethereum Ecosystem, Optimism Ecosystem, Aptos Ecosystem, Sui Ecosystem, Base Ecosystem, Gaming Governance Token, Gaming Utility Token, OKX Ventures Portfolio"
J,jambo,Jambo,J,17943065,111442255.0,4648598.0,"Solana Ecosystem, Paradigm Portfolio, Coinbase Ventures Portfolio"
