LBTC,lombard-staked-btc,Lombard Staked BTC,LBTC,1088055993,1088055993.0,6975892.0,"BNB Chain Ecosystem, Solana Ecosystem, Ethereum Ecosystem, Sui Ecosystem, Base Ecosystem, Starknet Ecosystem, Restaking, Berachain Ecosystem, Liquid Restaking Tokens, Sonic Ecosystem, Etherlink Ecosystem, Swellchain Ecosystem, Corn Ecosystem, Liquid Staked BTC, Katana Ecosystem, TAC Ecosystem"
RENDER,render-token,Render,RENDER,1054488297,1084501586.0,80866038.0,"Artificial Intelligence (AI), NFT, Metaverse, Solana Ecosystem, Ethereum Ecosystem, DePIN, Multicoin Capital Portfolio, Alameda Research Portfolio, GMCI DePIN Index, GMCI 30 Index, GMCI Index, Made in USA, Coinbase 50 Index"
IP,story-2,Story,IP,972294304,2994451054.0,40385685.0,"Artificial Intelligence (AI), Smart Contract Platform, Layer 1 (L1), Made in USA, Story Ecosystem, IP"
XDC,xdce-crowd-sale,XDC Network,XDC,954236489,2043758766.0,35118481.0,"Smart Contract Platform, Layer 1 (L1), Real World Assets (RWA)"
AERO,aerodrome-finance,Aerodrome Finance,AERO,740996132,1460399880.0,54727512.0,"Decentralized Exchange (DEX), Exchange-based Tokens, Decentralized Finance (DeFi), Automated Market Maker (AMM), Base Ecosystem, Binance Alpha Spotlight, Made in USA"
TIA,celestia,Celestia,TIA,699401068,959704565.0,74145221.0,"Cosmos Ecosystem, Data Availability, Layer 1 (L1), Osmosis Ecosystem, Coinbase Ventures Portfolio, Secret Ecosystem, eGirl Capital Portfolio, Galaxy Digital Portfolio, Modular Blockchain, OKX Ventures Portfolio, Delphi Ventures Portfolio, Smart Contract Platform, Polychain Capital Portfolio, YZi Labs (Prev. Binance Labs) Portfolio, Blockchain Capital Portfolio, Proof of Stake (PoS)"
LDO,lido-dao,Lido DAO,LDO,657830715,738642221.0,93081351.0,"Infrastructure, Decentralized Finance (DeFi), Polygon Ecosystem, Arbitrum Ecosystem, Ethereum Ecosystem, Optimism Ecosystem, Liquid Staking Governance Tokens, eGirl Capital Portfolio, Paradigm Portfolio, Coinbase Ventures Portfolio, Multicoin Capital Portfolio, Index Coop Defi Index, Alameda Research Portfolio, DragonFly Capital Portfolio, Andreessen Horowitz (a16z) Portfolio, GMCI DeFi Index, Delphi Ventures Portfolio, Liquid Staking, GMCI Index, Coinbase 50 Index, Governance"
STX,blockstack,Stacks,STX,632113931,632113931.0,16677146.0,"Infrastructure, Smart Contract Platform, Layer 2 (L2), Bitcoin Sidechains, Stacks Ecosystem, SideChain, GMCI Layer 2 Index, GMCI 30 Index, Blockchain Capital Portfolio, GMCI Index, Made in USA, Coinbase 50 Index"
FLOKI,floki,FLOKI,FLOKI,523272301,541810239.0,58302262.0,"Gaming (GameFi), NFT, BNB Chain Ecosystem, Metaverse, Meme, Play To Earn, Ethereum Ecosystem, Telegram Apps, Dog-Themed, DWF Labs Portfolio, RPG, On-chain Gaming, TokenFi Launchpad, GMCI Meme Index, GMCI Index"
PYTH,pyth-network,Pyth Network,PYTH,515824807,897089278.0,24279227.0,"Business Services, Infrastructure, Decentralized Finance (DeFi), Oracle, Solana Ecosystem, Neon Ecosystem, Manta Network Ecosystem, Multicoin Capital Portfolio, GMCI DeFi Index, Delphi Ventures Portfolio, GMCI Index"
CFX,conflux-token,Conflux,CFX,448041516,497840705.0,30080583.0,"Smart Contract Platform, DWF Labs Portfolio, Proof of Work (PoW), GMCI Layer 1 Index, Sequoia Capital Portfolio, GMCI Index, Made in China"
BTT,bittorrent,BitTorrent,BTT,432197663,433924093.0,11725502.0,"Storage, BNB Chain Ecosystem, Ethereum Ecosystem, DePIN, Alleged SEC Securities, Binance Launchpad, Tron Ecosystem, Energi Ecosystem, YZi Labs (Prev. Binance Labs) Portfolio, BitTorrent Ecosystem, GMCI DePIN Index, GMCI Index"
SUN,sun-token,Sun Token,SUN,423388993,439307630.0,26141980.0,"Decentralized Finance (DeFi), Tron Ecosystem, Made in China"
ZK,zksync,ZKsync,ZK,388276828,1127499042.0,201004997.0,"Smart Contract Platform, Ethereum Ecosystem, Layer 2 (L2), Zero Knowledge (ZK), ZkSync Ecosystem, Consensys Portfolio, Blockchain Capital Portfolio, OKX Ventures Portfolio, Privacy Blockchain"
RAY,raydium,Raydium,RAY,342998348,709639511.0,39864390.0,"Decentralized Exchange (DEX), Exchange-based Tokens, Decentralized Finance (DeFi), Yield Farming, Automated Market Maker (AMM), Perpetuals, Solana Ecosystem, Launchpad, GMCI DeFi Index, GMCI Index"
EIGEN,eigenlayer,EigenCloud (prev. EigenLayer),EIGEN,298585835,1201608475.0,50305038.0,"Infrastructure, Ethereum Ecosystem, Base Ecosystem, Data Availability, Restaking, Polychain Capital Portfolio, Made in USA, x402 Ecosystem"
LGCT,legacy-token,Legacy Token,LGCT,192538738,544514797.0,4999169.0,"Education, Gaming (GameFi), BNB Chain Ecosystem, Base Ecosystem"
TKX,tokenize-xchange,Tokenize Xchange,TKX,145963835,182463922.0,8905.42,"Exchange-based Tokens, Centralized Exchange (CEX) Token, Ethereum Ecosystem, Titanchain Ecosystem"
NPC,non-playable-coin,Non-Playable Coin,NPC,124909403,124909403.0,11192941.0,"NFT, BNB Chain Ecosystem, Solana Ecosystem, Meme, Ethereum Ecosystem, Base Ecosystem, Hybrid Token Standards, Wojak-Themed, 4chan-Themed"
DRIFT,drift-protocol,Drift Protocol,DRIFT,116775464,286320443.0,18495194.0,"Decentralized Finance (DeFi), Derivatives, Prediction Markets, Perpetuals, Solana Ecosystem, Binance Alpha Spotlight, Governance"
OZO,ozone-chain,Ozone Chain,OZO,116666553,130155757.0,226904.0,"Smart Contract Platform, Layer 1 (L1), Zero Knowledge (ZK)"
CELO,celo,Celo,CELO,114459302,195059743.0,13151887.0,"Smart Contract Platform, Celo Ecosystem, Layer 2 (L2), DWF Labs Portfolio, Coinbase Ventures Portfolio, Proof of Stake (PoS), Andreessen Horowitz (a16z) Portfolio, Optimism Superchain Ecosystem, Outlier Ventures Portfolio, Made in USA"
ELF,aelf,aelf,ELF,95343626,118340695.0,22146512.0,"Infrastructure, Smart Contract Platform, BNB Chain Ecosystem, Layer 1 (L1), Ethereum Ecosystem, GMCI Layer 1 Index, Aelf Ecosystem, GMCI Index"
EUL,euler,Euler,EUL,82881953,120572710.0,7402930.0,"BNB Chain Ecosystem, Lending/Borrowing Protocols, Avalanche Ecosystem, Arbitrum Ecosystem, Ethereum Ecosystem, Base Ecosystem, Berachain Ecosystem, Paradigm Portfolio, Coinbase Ventures Portfolio, Sonic Ecosystem, Swellchain Ecosystem, Unichain Ecosystem, TAC Ecosystem, Plasma Ecosystem"
AP3X,apex-4,APEX,AP3X,67823049,169075651.0,99877.0,Layer 1 (L1)
IO,io,io.net,IO,61649291,208221471.0,16046921.0,"Artificial Intelligence (AI), Internet of Things (IOT), Binance Launchpool, Solana Ecosystem, DePIN, Animoca Brands Portfolio, Multicoin Capital Portfolio, Delphi Ventures Portfolio, OKX Ventures Portfolio, Made in USA"
SCRT,secret,Secret,SCRT,57203080,59833719.0,12600785.0,"Artificial Intelligence (AI), Infrastructure, Smart Contract Platform, Privacy, Cosmos Ecosystem, Layer 1 (L1), Osmosis Ecosystem, Alameda Research Portfolio, DragonFly Capital Portfolio, DeFiance Capital Portfolio, Privacy Blockchain, Outlier Ventures Portfolio"
WOO,woo-network,WOO,WOO,56582580,65492880.0,4642084.0,"Decentralized Exchange (DEX), Exchange-based Tokens, Decentralized Finance (DeFi), Automated Market Maker (AMM), BNB Chain Ecosystem, Derivatives, Perpetuals, Centralized Exchange (CEX) Token, Solana Ecosystem, Avalanche Ecosystem, Polygon Ecosystem, Near Protocol Ecosystem, Fantom Ecosystem, Arbitrum Ecosystem, Ethereum Ecosystem, ZkSync Ecosystem, Mantle Ecosystem, Linea Ecosystem, Base Ecosystem, DragonFly Capital Portfolio, YZi Labs (Prev. Binance Labs) Portfolio"
RLC,iexec-rlc,iExec RLC,RLC,55897924,67186187.0,14992037.0,"Artificial Intelligence (AI), Privacy, Oracle, Arbitrum Ecosystem, Ethereum Ecosystem, DePIN, AI Agents, Energi Ecosystem, Sora Ecosystem, GMCI DePIN Index, GMCI Index"
HIVE,hive,Hive,HIVE,55288304,,1260261.0,"Smart Contract Platform, SocialFi, Layer 1 (L1), Gaming Blockchains"
BICO,biconomy,Biconomy,BICO,55225221,55411196.0,6074294.0,"Arbitrum Ecosystem, Ethereum Ecosystem, Account Abstraction, Coinbase Ventures Portfolio, YZi Labs (Prev. Binance Labs) Portfolio, Consensys Portfolio, Outlier Ventures Portfolio"
ANVL,anvil,Anvil,ANVL,52542790,65466998.0,10568.57,"Decentralized Finance (DeFi), Ethereum Ecosystem"
SEDA,seda-2,SEDA,SEDA,50219792,81829923.0,587026.0,"Smart Contract Platform, Oracle, Ethereum Ecosystem, Base Ecosystem, Modular Blockchain, Osmosis Ecosystem, HyperEVM Ecosystem"
MVL,mass-vehicle-ledger,MVL,MVL,48927752,49461452.0,2365467.0,"Internet of Things (IOT), BNB Chain Ecosystem, Ethereum Ecosystem, DePIN, DWF Labs Portfolio"
BAL,balancer,Balancer,BAL,47919231,52355676.0,2213539.0,"Decentralized Exchange (DEX), Exchange-based Tokens, Decentralized Finance (DeFi), Yield Farming, Automated Market Maker (AMM), Avalanche Ecosystem, Polygon Ecosystem, Near Protocol Ecosystem, Gnosis Chain Ecosystem, Harmony Ecosystem, Arbitrum Ecosystem, Ethereum Ecosystem, Optimism Ecosystem, Base Ecosystem, Index Coop Defi Index, Alameda Research Portfolio, DeFiance Capital Portfolio, Pantera Capital Portfolio, Energi Ecosystem, Polygon zkEVM Ecosystem, Huobi ECO Chain Ecosystem, Blockchain Capital Portfolio, Governance"
ACX,across-protocol,Across Protocol,ACX,40715239,63512089.0,3739729.0,"Polygon Ecosystem, Arbitrum Ecosystem, Ethereum Ecosystem, Optimism Ecosystem, Bridge Governance Tokens, Cross-chain Communication, Intent, Boba Network Ecosystem, Blockchain Capital Portfolio, Made in USA"
FLOCK,flock-2,FLOCK,FLOCK,38585794,159006915.0,4705478.0,"Artificial Intelligence (AI), Base Ecosystem, AI Applications, Binance Alpha Spotlight, x402 Ecosystem"
B3,b3,B3 (Base),B3,38164151,123769812.0,3150211.0,"Smart Contract Platform, Base Ecosystem, Gaming Blockchains"
NYM,nym,Nym,NYM,36809299,44821311.0,1611824.0,"Smart Contract Platform, Privacy, Ethereum Ecosystem, DePIN, Osmosis Ecosystem, VPN, Andreessen Horowitz (a16z) Portfolio, YZi Labs (Prev. Binance Labs) Portfolio, Governance"
SIX,six,Six Sigma,SIX,35769604,35769604.0,4951.74,"Gambling (GambleFi), Solana Ecosystem"
AINTI,aintivirus,AIntivirus,AINTI,33726458,33726458.0,0.0,"Solana Ecosystem, Meme, AI Meme, Pump.fun Ecosystem"
QKC,quark-chain,QuarkChain,QKC,32447306,45185002.0,615604.0,"Infrastructure, Ethereum Ecosystem, Energi Ecosystem"
AO,ao-computer,ao Computer,AO,31600268,31600268.0,191759.0,"Artificial Intelligence (AI), Smart Contract Platform, DePIN"
VEE,blockv,BLOCKv,VEE,31270323,31270323.0,30746.0,"NFT, Polygon Ecosystem, Ethereum Ecosystem, Optimism Ecosystem"
UQC,uquid-coin,Uquid Coin,UQC,30791869,123167477.0,13114.73,Ethereum Ecosystem
QI,benqi,BENQI,QI,29050718,29050718.0,1017578.0,"Decentralized Finance (DeFi), Yield Farming, Binance Launchpool, Lending/Borrowing Protocols, Avalanche Ecosystem, Liquid Staking Governance Tokens, DragonFly Capital Portfolio, Liquid Staking"
PIPPIN,pippin,pippin,PIPPIN,28938197,28938197.0,6506345.0,"Artificial Intelligence (AI), Infrastructure, Solana Ecosystem, Meme, Solana Meme, AI Meme, AI Agents, Pump.fun Ecosystem, Binance Alpha Spotlight, AI Framework"
AI16Z,ai16z,ai16z,AI16Z,28937340,28937340.0,6656192.0,"Artificial Intelligence (AI), Solana Ecosystem, Meme, Solana Token-2022, AI Agents, Binance Alpha Spotlight, AI Framework, Made in USA"
MBX,marblex,MARBLEX,MBX,24363456,29863287.0,1301118.0,"Smart Contract Platform, Gaming (GameFi), NFT, BNB Chain Ecosystem, Kaia Ecosystem, Aptos Ecosystem, DWF Labs Portfolio, Gaming Blockchains"
ACS,access-protocol,Access Protocol,ACS,23210697,46722480.0,776991.0,"SocialFi, Solana Ecosystem"
VANRY,vanar-chain,Vanar Chain,VANRY,23027684,24606219.0,2969483.0,"Artificial Intelligence (AI), Smart Contract Platform, Layer 1 (L1), Polygon Ecosystem, Ethereum Ecosystem, Vanar Chain Ecosystem"
MAPO,marcopolo,MAP Protocol,MAPO,22594436,35884824.0,571222.0,"BNB Chain Ecosystem, Ethereum Ecosystem, DWF Labs Portfolio"
NOS,nosana,Nosana,NOS,22246570,26674544.0,819117.0,"Artificial Intelligence (AI), Solana Ecosystem, DePIN"
LYX,lukso-token-2,LUKSO,LYX,21976656,30310247.0,1352797.0,"Smart Contract Platform, SocialFi, Layer 1 (L1), Decentralized Identifier (DID), Proof of Stake (PoS), Lukso Ecosystem"
PAAL,paal-ai,PAAL AI,PAAL,20802982,23179027.0,5336785.0,"Artificial Intelligence (AI), Virtual Reality, BNB Chain Ecosystem, Solana Ecosystem, Launchpad, Ethereum Ecosystem, Telegram Apps, Discord Bots, Base Ecosystem, PAAL AI Launchpad, AI Agents, AI Applications, AI Agent Launchpad, Binance Alpha Spotlight, AI Framework, DeFAI, Made in USA"
NAVX,navi,NAVI Protocol,NAVX,19051885,26471256.0,1665569.0,"Decentralized Finance (DeFi), Lending/Borrowing Protocols, Sui Ecosystem, OKX Ventures Portfolio, Binance Alpha Spotlight"
DEXTF,dextf,Memento,DEXTF,18639582,28324518.0,379794.0,"Decentralized Finance (DeFi), Asset Manager, Avalanche Ecosystem, Ethereum Ecosystem, ZkSync Ecosystem, Real World Assets (RWA), Base Ecosystem, Privacy Blockchain"
GPS,goplus-security,GoPlus Security,GPS,18064944,57258144.0,3755834.0,"BNB Chain Ecosystem, Base Ecosystem, Cybersecurity, YZi Labs (Prev. Binance Labs) Portfolio, OKX Ventures Portfolio, Binance HODLer Airdrops, Binance Alpha Spotlight"
CHILLGUY,chill-guy,Just a chill guy,CHILLGUY,17767435,17767435.0,7644827.0,"Solana Ecosystem, Meme, Dog-Themed, Solana Meme, Pump.fun Ecosystem, TikTok Meme"
FORT,forta,Forta,FORT,15833512,25514255.0,475377.0,"Artificial Intelligence (AI), Polygon Ecosystem, Arbitrum Ecosystem, Ethereum Ecosystem, Base Ecosystem, Coinbase Ventures Portfolio, Cybersecurity, Andreessen Horowitz (a16z) Portfolio, Blockchain Capital Portfolio"
FARTBOY,fartboy,Fartboy,$FARTBOY,14660206,14660206.0,1110165.0,"Solana Ecosystem, Meme, Solana Meme, Pump.fun Ecosystem"
PIKA,pikaboss,Pikaboss,PIKA,13700689,13700689.0,9312.3,"Meme, Ethereum Ecosystem"
TLOS,telos,Telos,TLOS,13140310,13140311.0,1929345.0,"Smart Contract Platform, Privacy, BNB Chain Ecosystem, Layer 1 (L1), Avalanche Ecosystem, Polygon Ecosystem, Arbitrum Ecosystem, Ethereum Ecosystem, Zero Knowledge (ZK), Base Ecosystem, Telos Ecosystem, Consensys Portfolio, Privacy Blockchain"
L3,layer3,Layer3,L3,12819976,43075239.0,5925053.0,"Marketing, BNB Chain Ecosystem, Solana Ecosystem, Polygon Ecosystem, Arbitrum Ecosystem, Ethereum Ecosystem, Decentralized Identifier (DID), Optimism Ecosystem, Quest-to-Earn, Made in USA"
WALLET,ambire-wallet,Ambire Wallet,WALLET,12504225,12642101.0,443462.0,"Wallets, Polygon Ecosystem, Ethereum Ecosystem, Base Ecosystem, Account Abstraction, Governance"
SWARMS,swarms,Swarms,SWARMS,12385040,12385040.0,2730118.0,"Artificial Intelligence (AI), Solana Ecosystem, AI Agents, Pump.fun Ecosystem, Binance Alpha Spotlight, AI Framework"
LUMIA,lumia,Lumia,LUMIA,10627648,33713106.0,1945921.0,"Smart Contract Platform, Layer 2 (L2), Real World Assets (RWA), Governance"
NRN,neuron,Neuron,NRN,10577531,23535275.0,480708.0,"Artificial Intelligence (AI), Gaming (GameFi), NFT, Arbitrum Ecosystem, Paradigm Portfolio, AI Agents, AI Framework, Action Games, Robotics"
PPC,peercoin,Peercoin,PPC,10177266,10177277.0,76418.0,"Smart Contract Platform, Polygon Ecosystem, Ethereum Ecosystem, Proof of Stake (PoS), Proof of Work (PoW)"
WEXO,wexo,Wexo,WEXO,10002456,26905340.0,598962.0,"Ethereum Ecosystem, Payment Solutions, Base Ecosystem, E-commerce"
RARI,rarible,RARI,RARI,8787706,12133699.0,612351.0,"NFT, Ethereum Ecosystem, NFT Marketplace, Base Ecosystem, Coinbase Ventures Portfolio, Energi Ecosystem, Made in USA, Governance"
SCA,scallop-2,Scallop,SCA,8140364,14930350.0,1249282.0,"Decentralized Finance (DeFi), Lending/Borrowing Protocols, Sui Ecosystem"
VADER,vaderai-by-virtuals,Vader,VADER,8101375,8101375.0,370788.0,"Artificial Intelligence (AI), Meme, Base Ecosystem, AI Meme, AI Agents, Virtuals Protocol Ecosystem, Binance Alpha Spotlight, Robotics"
GRAM,gram-2,Gram,GRAM,7336890,7336890.0,26127.0,"TON Ecosystem, Proof of Work (PoW)"
XTER,xterio,Xterio,XTER,7140358,50367932.0,3808480.0,"Artificial Intelligence (AI), Gaming (GameFi), NFT, BNB Chain Ecosystem, Animoca Brands Portfolio, Gaming Blockchains, YZi Labs (Prev. Binance Labs) Portfolio, Binance Alpha Spotlight"
BELLS,bellscoin,Bellscoin,BELLS,6182411,6182411.0,285573.0,"Smart Contract Platform, Layer 1 (L1), Meme, Proof of Work (PoW), Inscriptions, Made in USA"
TET,tectum,Tectum,TET,5885258,5947962.0,148608.0,"Smart Contract Platform, Layer 1 (L1), Ethereum Ecosystem, Bitcoin Sidechains, SideChain"
TRIAS,trias-token,TriasLab,TRIAS,5639555,5639555.0,6715.0,"Artificial Intelligence (AI), Smart Contract Platform, BNB Chain Ecosystem, Layer 1 (L1), Ethereum Ecosystem, AI Agents"
CEEK,ceek,CEEK Smart VR,CEEK,5634472,5657101.0,427043.0,"Entertainment, BNB Chain Ecosystem, Metaverse, Ethereum Ecosystem, DWF Labs Portfolio"
LCAT,lion-cat,Lion Cat,LCAT,5274176,5852068.0,30209.0,"BNB Chain Ecosystem, Meme, Cat-Themed"
JETTON,jetton,JetTon Games,JETTON,5086235,8041462.0,80575.0,"Gambling (GambleFi), Telegram Apps, TON Ecosystem"
SOVRN,sovrun,Sovrun,SOVRN,5049902,5439771.0,110108.0,"Gaming (GameFi), Metaverse, Ethereum Ecosystem, Animoca Brands Portfolio, Base Ecosystem, DWF Labs Portfolio, On-chain Gaming, Andreessen Horowitz (a16z) Portfolio, Hyperliquid Ecosystem, Delphi Ventures Portfolio, Circle Ventures Portfolio"
GRAIL,camelot-token,Camelot Token,GRAIL,4514605,17161964.0,69946.0,"Decentralized Exchange (DEX), Exchange-based Tokens, Arbitrum Ecosystem, Camelot Launchpad"
FNCT,financie-token,Financie Token,FNCT,4484360,23537743.0,77832.0,"SocialFi, Polygon Ecosystem, Ethereum Ecosystem, Governance"
JOULE,joule-2,Joule,JOULE,4470681,4504920.0,44700.0,"Decentralized Finance (DeFi), Flare Network Ecosystem"
EOS,binance-peg-eos,Binance-Peg EOS,EOS,4180357,4180357.0,3144.01,"Smart Contract Platform, BNB Chain Ecosystem, Binance-Peg Tokens"
PAIN,pain,Pain,PAIN,4086474,8173028.0,15254.61,"Solana Ecosystem, Meme, Solana Meme, 4chan-Themed"
LVVA,levva-protocol,Levva Protocol,LVVA,4073088,4160408.0,2475214.0,"Decentralized Finance (DeFi), Analytics, Yield Farming, Yield Aggregator, Ethereum Ecosystem, Yield Optimizer"
OVR,ovr,Ovr,OVR,3564942,6105100.0,336654.0,"Artificial Intelligence (AI), Augmented Reality, BNB Chain Ecosystem, Polygon Ecosystem, Ethereum Ecosystem, DePIN, Base Ecosystem, Robotics"
VISTA,ethervista,Ethervista,VISTA,3247025,3247025.0,343253.0,"Decentralized Exchange (DEX), Exchange-based Tokens, Decentralized Finance (DeFi), Launchpad, Meme, Ethereum Ecosystem, Binance Alpha Spotlight"
XX,xxcoin,XX Network,XX,3240197,8964745.0,94655.0,"Smart Contract Platform, Layer 1 (L1), Ethereum Ecosystem"
RENTA,renta-network,Renta Network,RENTA,3173867,6731947.0,66703.0,"Retail, Smart Contract Platform, NFT, Ethereum Ecosystem, Layer 2 (L2), Real World Assets (RWA), NFTFi"
ARCA,arca,Legend of Arcadia,ARCA,3042402,10114625.0,340406.0,"Gaming (GameFi), Ethereum Ecosystem, RPG"
SWAP,hyperswap,HyperSwap,SWAP,2934103,4172985.0,8149.18,"Decentralized Exchange (DEX), Decentralized Finance (DeFi), HyperEVM Ecosystem"
HYDRA,hydra,Hydra,HYDRA,2808399,3066716.0,89394.0,"Smart Contract Platform, Layer 1 (L1)"
ZKL,zklink,zkLink,ZKL,2772595,6966806.0,1336241.0,"Smart Contract Platform, Ethereum Ecosystem, Zero Knowledge (ZK), Layer 3 (L3), zkLink Nova Ecosystem, OKX Ventures Portfolio"
QORPO,qopro,QORPO WORLD,QORPO,2728288,3309646.0,946750.0,"Gaming (GameFi), NFT, BNB Chain Ecosystem, Play To Earn, Ethereum Ecosystem, RPG, Gaming Utility Token, Adventure Games, Gaming Platform, Action Games"
ICP,internet-computer,Internet Computer,ICP,2639226545,2639230984.0,354901046.0,"Artificial Intelligence (AI), Infrastructure, Smart Contract Platform, Layer 1 (L1), Ethereum Ecosystem, Internet Computer Ecosystem, Base Ecosystem, Alleged SEC Securities, Multicoin Capital Portfolio, Layer 0 (L0), Andreessen Horowitz (a16z) Portfolio, GMCI Layer 1 Index, GMCI 30 Index, Blockchain Capital Portfolio, GMCI Index, Polychain Capital Portfolio, Coinbase 50 Index, Governance"
APT,aptos,Aptos,APT,2099792026,3393147887.0,312101863.0,"Smart Contract Platform, Layer 1 (L1), Aptos Ecosystem, FTX Holdings, Coinbase Ventures Portfolio, Multicoin Capital Portfolio, Proof of Stake (PoS), DragonFly Capital Portfolio, Andreessen Horowitz (a16z) Portfolio, YZi Labs (Prev. Binance Labs) Portfolio, GMCI Layer 1 Index, GMCI 30 Index, Circle Ventures Portfolio, GMCI Index, Made in USA"
FTN,fasttoken,Fasttoken,FTN,771423854,1548525734.0,1751091.0,"Smart Contract Platform, BNB Chain Ecosystem, Layer 1 (L1), Arbitrum Ecosystem, Ethereum Ecosystem, Base Ecosystem, Bahamut Ecosystem"
DCR,decred,Decred,DCR,619262655,619271609.0,37487765.0,"Smart Contract Platform, Privacy, Layer 1 (L1), Proof of Stake (PoS), Proof of Work (PoW), Blockchain Capital Portfolio, Made in USA"
TEL,telcoin,Telcoin,TEL,615730401,647610747.0,18930586.0,"Decentralized Finance (DeFi), Wallets, Polygon Ecosystem, Arbitrum Ecosystem, Ethereum Ecosystem, Payment Solutions, Base Ecosystem, Made in USA"
SYRUP,syrup,Maple Finance,SYRUP,510253194,544968233.0,61261744.0,"Decentralized Finance (DeFi), Yield Farming, Lending/Borrowing Protocols, Ethereum Ecosystem, Real World Assets (RWA), Base Ecosystem, Binance Alpha Spotlight"
CCD,concordium,Concordium,CCD,271747975,328481164.0,896361.0,"Smart Contract Platform, Privacy, Layer 1 (L1), Decentralized Identifier (DID), Zero Knowledge (ZK), Privacy Blockchain"
DEXE,dexe,DeXe,DEXE,257056957,531492400.0,5634707.0,"Artificial Intelligence (AI), Decentralized Finance (DeFi), BNB Chain Ecosystem, Ethereum Ecosystem"
KMNO,kamino,Kamino,KMNO,174895379,537005837.0,18592958.0,"Decentralized Finance (DeFi), Lending/Borrowing Protocols, Solana Ecosystem, Binance Alpha Spotlight"
KSM,kusama,Kusama,KSM,173333289,173334687.0,9569137.0,"Smart Contract Platform, Polkadot Ecosystem, Proof of Stake (PoS), Pantera Capital Portfolio, Made in USA, Coinbase 50 Index, Hydration Ecosystem"
MINA,mina-protocol,Mina Protocol,MINA,164780398,164782465.0,31819877.0,"Smart Contract Platform, Layer 1 (L1), Zero Knowledge (ZK), FTX Holdings, Paradigm Portfolio, Coinbase Ventures Portfolio, Multicoin Capital Portfolio, Proof of Stake (PoS), Pantera Capital Portfolio, Circle Ventures Portfolio, Privacy Blockchain, Polychain Capital Portfolio, Made in USA, Coinbase 50 Index"
YFI,yearn-finance,yearn.finance,YFI,155800832,168084675.0,13585563.0,"Decentralized Finance (DeFi), Yield Farming, Yield Aggregator, Yearn Ecosystem, Avalanche Ecosystem, Polygon Ecosystem, Near Protocol Ecosystem, Gnosis Chain Ecosystem, Fantom Ecosystem, Harmony Ecosystem, Arbitrum Ecosystem, Ethereum Ecosystem, Optimism Ecosystem, Base Ecosystem, Index Coop Defi Index, Alameda Research Portfolio, Energi Ecosystem, Sora Ecosystem, Huobi ECO Chain Ecosystem, Blockchain Capital Portfolio, Governance"
TFUEL,theta-fuel,Theta Fuel,TFUEL,150960803,150963710.0,2625534.0,"Artificial Intelligence (AI), Smart Contract Platform, DePIN, Proof of Stake (PoS), Made in USA"
ZIL,zilliqa,Zilliqa,ZIL,133824786,138479018.0,10446555.0,"Smart Contract Platform, BNB Chain Ecosystem, GMCI Layer 1 Index, GMCI Index, Made in China"
MEW,cat-in-a-dogs-world,cat in a dogs world,MEW,122329125,122329125.0,26337752.0,"Solana Ecosystem, Meme, Dog-Themed, Solana Meme, Cat-Themed, Binance Alpha Spotlight, IP Meme"
QUBIC,qubic-network,Qubic,QUBIC,106039906,134376146.0,3340675.0,"Artificial Intelligence (AI), Smart Contract Platform, Layer 1 (L1), Proof of Work (PoW)"
NIZA,niza-global-2,Niza Global,NIZA,80689674,80689674.0,1431628.0,"Exchange-based Tokens, Centralized Exchange (CEX) Token, Ethereum Ecosystem"
YGG,yield-guild-games,Yield Guild Games,YGG,68400353,100769528.0,17262983.0,"Gaming (GameFi), NFT, BNB Chain Ecosystem, Metaverse, Collectibles, Polygon Ecosystem, Play To Earn, Harmony Ecosystem, Guild and Scholarship, Ethereum Ecosystem, Animoca Brands Portfolio, Base Ecosystem, DWF Labs Portfolio, Ronin Ecosystem, Gaming Governance Token, Andreessen Horowitz (a16z) Portfolio, Delphi Ventures Portfolio, Abstract Ecosystem"
AP3X,apex-4,APEX,AP3X,67823049,169075651.0,99877.0,Layer 1 (L1)
PEOPLE,constitutiondao,ConstitutionDAO,PEOPLE,54348194,54348194.0,17995552.0,"Meme, Ethereum Ecosystem, PolitiFi"
ACH,alchemy-pay,Alchemy Pay,ACH,52606955,106412302.0,8484950.0,"BNB Chain Ecosystem, Ethereum Ecosystem, Payment Solutions, DWF Labs Portfolio, Made in China"
WHITE,whiteheart,Whiteheart,WHITE,51570842,51570842.0,9.55,"Decentralized Finance (DeFi), Derivatives, Ethereum Ecosystem"
CARV,carv,CARV,CARV,48236214,159232701.0,11058389.0,"Artificial Intelligence (AI), Infrastructure, Gaming (GameFi), NFT, BNB Chain Ecosystem, Solana Ecosystem, Arbitrum Ecosystem, Impossible Finance Launchpad, Ethereum Ecosystem, Animoca Brands Portfolio, Base Ecosystem, Binance Alpha Spotlight"
SGB,songbird,Songbird,SGB,47362072,56005056.0,177107.0,Smart Contract Platform
CYBER,cyberconnect,CYBER,CYBER,47278946,86149970.0,8911790.0,"Artificial Intelligence (AI), Smart Contract Platform, SocialFi, NFT, BNB Chain Ecosystem, Binance Launchpool, Ethereum Ecosystem, Decentralized Identifier (DID), Optimism Ecosystem, Layer 2 (L2), Animoca Brands Portfolio, Multicoin Capital Portfolio, YZi Labs (Prev. Binance Labs) Portfolio, Delphi Ventures Portfolio, Cyber Ecosystem, Optimism Superchain Ecosystem, AI Applications, Governance"
EWT,energy-web-token,Energy Web,EWT,45910850,52336164.0,330888.0,"Energy, Polkadot Ecosystem, Gnosis Chain Ecosystem, Regenerative Finance (ReFi), Real World Assets (RWA), Blockchain Capital Portfolio, Hydration Ecosystem"
SWFTC,swftcoin,SWFTCOIN,SWFTC,45622964,45622964.0,960140.0,"NFT, BNB Chain Ecosystem, Ethereum Ecosystem, Dex Aggregator"
VVV,venice-token,Venice Token,VVV,45410486,86190858.0,2371181.0,"Artificial Intelligence (AI), Base Ecosystem, AI Agents, AI Applications, Binance Alpha Spotlight, Made in USA"
NOW,changenow,ChangeNOW,NOW,44948400,52456797.0,245916.0,"Decentralized Exchange (DEX), Exchange-based Tokens, BNB Chain Ecosystem, Ethereum Ecosystem"
DORA,dora-2,DORA,DORA,43148790,43148790.0,383430.0,"BNB Chain Ecosystem, Meme, Binance Alpha Spotlight, Chinese Meme"
USTC,terrausd,TerraClassicUSD,USTC,36575226,39861256.0,2086436.0,"Stablecoins, USD Stablecoin, Seigniorage, Alleged SEC Securities, Osmosis Ecosystem, DeFiance Capital Portfolio, Terra Classic Ecosystem, YZi Labs (Prev. Binance Labs) Portfolio, Delphi Ventures Portfolio, Galaxy Digital Portfolio, Fiat-backed Stablecoin"
