DOLO,dolomite,Dolomite,DOLO,17733160.0,49028073.0,9966526.0,"Decentralized Exchange (DEX), Decentralized Finance (DeFi), Automated Market Maker (AMM), Lending/Borrowing Protocols, Ethereum Ecosystem, Coinbase Ventures Portfolio, Venture Capital Portfolios, Dex Aggregator"
BTY,bityuan,Bityuan,BTY,17155738.0,17155738.0,181898.0,
RFC,retard-finder-coin,Retard Finder Coin,RFC,16310940.0,16962889.0,24739025.0,"Solana Ecosystem, Meme, Pump.fun Ecosystem, Wojak-Themed"
KRL,kryll,KRYLL,KRL,16015268.0,19966816.0,2627782.0,"Artificial Intelligence (AI), Decentralized Finance (DeFi), Analytics, Arbitrum Ecosystem, Ethereum Ecosystem, Optimism Ecosystem, Base Ecosystem, AI Applications"
BZZ,swarm-bzz,Swarm,BZZ,15942985.0,15942985.0,201213.0,"Storage, Gnosis Chain Ecosystem, Ethereum Ecosystem, DePIN"
TRUF,truflation,TRUF.Network,TRUF,15663241.0,49411937.0,304710.0,"Infrastructure, Oracle, Arbitrum Ecosystem, Ethereum Ecosystem, Real World Assets (RWA), Base Ecosystem, Coinbase Ventures Portfolio"
COCA,coca,COCA,COCA,15068423.0,132761436.0,559169.0,"Wallets, Polygon Ecosystem, Payment Solutions"
INTER,inter-milan-fan-token,Inter Milan Fan Token,INTER,13495234.0,13495234.0,16362609.0,"Sports, Fan Token, Chiliz Ecosystem"
LAZIO,lazio-fan-token,Lazio Fan Token,LAZIO,13279301.0,44550505.0,3636340.0,"Sports, BNB Chain Ecosystem, Fan Token, Binance Launchpad"
LNQ,linqai,LinqAI,LNQ,13101372.0,50016614.0,768720.0,"Artificial Intelligence (AI), Ethereum Ecosystem"
BCUT,bitscrunch-token,bitsCrunch Token,BCUT,12275404.0,26428213.0,1547964.0,"Artificial Intelligence (AI), Infrastructure, Analytics, NFT, Polygon Ecosystem, Ethereum Ecosystem, Animoca Brands Portfolio, Coinbase Ventures Portfolio"
ZND,znd-token,ZND Token,ZND,12239780.0,71277003.0,5095831.0,"Centralized Exchange (CEX) Token, Ethereum Ecosystem"
SCF,smoking-chicken-fish,Smoking Chicken Fish,SCF,11790165.0,11790165.0,1698850.0,"Solana Ecosystem, Meme, Solana Meme, Pump.fun Ecosystem"
BST,blocksquare,Blocksquare,BST,9617152.0,9617152.0,263534.0,"Tokenized Real Estate, Tokenized Assets, Ethereum Ecosystem, Real World Assets (RWA)"
BAD,bad-idea-ai,Bad Idea AI,BAD,8783395.0,11304950.0,1050021.0,"Artificial Intelligence (AI), Meme, Ethereum Ecosystem, Telegram Apps, Discord Bots, Shibarium Ecosystem"
BITBOARD,bitboard,BitBoard,BB,8604038.0,13005605.0,79629.0,"Smart Contract Platform, Polygon Ecosystem, Layer 2 (L2), Zero Knowledge (ZK)"
KANGO,kango,KANGO,KANGO,7576234.0,7576234.0,1083819.0,"Meme, Kaspa Ecosystem"
KIBSHI,kiboshib,KiboShib,KIBSHI,7271223.0,7271223.0,514066.0,"Solana Ecosystem, Meme, Arbitrum Ecosystem, Ethereum Ecosystem, Base Ecosystem, Dog-Themed, AI Meme"
STOS,stratos,Stratos,STOS,7207063.0,16344303.0,115965.0,"Entertainment, Infrastructure, Smart Contract Platform, Storage, Layer 1 (L1), Ethereum Ecosystem, DePIN, Osmosis Ecosystem"
TMAI,token-metrics-ai,Token Metrics AI,TMAI,6663970.0,9700645.0,109577.0,"Artificial Intelligence (AI), Analytics, Meme, Base Ecosystem, AI Agents, DeFAI, Made in USA"
TOMI,tominet,TOMI,TOMI,6122742.0,6155856.0,31889311.0,"Smart Contract Platform, Ethereum Ecosystem, DWF Labs Portfolio, Proof of Stake (PoS)"
CLEAR,everclear,Everclear,CLEAR,5992093.0,16373616.0,55733.0,"Infrastructure, Ethereum Ecosystem, Coinbase Ventures Portfolio, Cross-chain Communication, Chain Abstraction"
WELSH,welsh-corgi-coin,Welshcorgicoin,WELSH,5699657.0,5699657.0,10642.74,"Meme, Dog-Themed, Stacks Ecosystem"
NWC,newscrypto-coin,Numerico,NWC,5581985.0,9507934.0,90407.0,"Education, Smart Contract Platform, BNB Chain Ecosystem, Ethereum Ecosystem, Layer 2 (L2), Stellar Ecosystem"
GOGLZ,googles,GOGGLES,GOGLZ,5580462.0,5580462.0,19202099.0,"Meme, Sonic Ecosystem"
BILLY,billy,Billy,BILLY,5470421.0,5470421.0,3485122.0,"Solana Ecosystem, Meme, Dog-Themed, Solana Meme, Pump.fun Ecosystem"
NETVR,netvrk,Netvrk,NETVR,4698952.0,4698952.0,210465.0,"Entertainment, Gaming (GameFi), NFT, Metaverse, Polygon Ecosystem, Ethereum Ecosystem, Shooting Games, Racing Games"
TRVL,dtravel,Dtravel,TRVL,4593733.0,10657051.0,147402.0,"Artificial Intelligence (AI), Tourism, BNB Chain Ecosystem, Ethereum Ecosystem, Real World Assets (RWA), DePIN, Base Ecosystem"
CATCH,spacecatch,SpaceCatch,CATCH,4529099.0,11765287.0,179014.0,"Gaming (GameFi), Metaverse, Arbitrum Ecosystem, Gaming Utility Token"
FUSE,fuse-network-token,Fuse,FUSE,4076875.0,5110737.0,574371.0,"Smart Contract Platform, Decentralized Finance (DeFi), BNB Chain Ecosystem, Layer 1 (L1), Polygon Ecosystem, Gnosis Chain Ecosystem, Arbitrum Ecosystem, Ethereum Ecosystem, Optimism Ecosystem, Layer 2 (L2), Payment Solutions, Base Ecosystem, DWF Labs Portfolio, Account Abstraction, Fuse Ecosystem"
GMEE,gamee,GAMEE,GMEE,3953026.0,9215154.0,136005.0,"Gaming (GameFi), NFT, BNB Chain Ecosystem, Play To Earn, Ethereum Ecosystem, Telegram Apps, Animoca Brands Portfolio, TON Ecosystem, Gaming Platform, YZi Labs (Prev. Binance Labs) Portfolio, Arcade Games"
FET,fetch-ai,Artificial Superintelligence Alliance,FET,2180793647.0,2272492871.0,142741158.0,"Artificial Intelligence (AI), NFT, BNB Chain Ecosystem, Ethereum Ecosystem, Binance Launchpad, DWF Labs Portfolio, Osmosis Ecosystem, AI Agents, GMCI DePIN Index, GMCI Index, Outlier Ventures Portfolio, AI Agent Launchpad"
QNT,quant-network,Quant,QNT,1465479674.0,1472363318.0,26615306.0,"Ethereum Ecosystem, Real World Assets (RWA), Energi Ecosystem, Coinbase 50 Index"
DOGWIFHAT,dogwifcoin,dogwifhat,WIF,1126298159.0,1126298159.0,602613904.0,"Solana Ecosystem, Meme, Dog-Themed, Solana Meme, GMCI Meme Index, GMCI Index"
XAUT,tether-gold,Tether Gold,XAUT,786277527.0,786277527.0,29775909.0,"Stablecoins, Tokenized Assets, Tokenized Gold, Ethereum Ecosystem, Real World Assets (RWA), Tokenized Commodities"
PENDLE,pendle,Pendle,PENDLE,695318066.0,1206279456.0,109257092.0,"Decentralized Exchange (DEX), Decentralized Finance (DeFi), Yield Farming, Automated Market Maker (AMM), BNB Chain Ecosystem, Derivatives, Lending/Borrowing Protocols, Arbitrum Ecosystem, Ethereum Ecosystem, Optimism Ecosystem, Fixed Interest, LSDFi, Base Ecosystem, Restaking, LRTfi, Liquid Restaking Governance Tokens, Yield Tokenization Protocol, YZi Labs (Prev. Binance Labs) Portfolio, GMCI DeFi Index, Sonic Ecosystem, Liquid Staking, GMCI Index, BTCfi"
KAVA,kava,Kava,KAVA,490463039.0,490463039.0,17400889.0,"Smart Contract Platform, Layer 1 (L1), Binance Launchpad, DWF Labs Portfolio, Osmosis Ecosystem, YZi Labs (Prev. Binance Labs) Portfolio, Made in USA"
ATH,aethir,Aethir,ATH,482845470.0,2232276864.0,127032450.0,"Solana Ecosystem, Arbitrum Ecosystem, Impossible Finance Launchpad, Ethereum Ecosystem, DePIN, Animoca Brands Portfolio"
RON,ronin,Ronin,RON,470349252.0,718924977.0,15016968.0,"Smart Contract Platform, Gaming (GameFi), NFT, Layer 1 (L1), Play To Earn, Zero Knowledge (ZK), FTX Holdings, Ronin Ecosystem, Gaming Blockchains, SideChain, Andreessen Horowitz (a16z) Portfolio, YZi Labs (Prev. Binance Labs) Portfolio"
PLUME,plume,Plume,PLUME,381101848.0,1905509240.0,56328874.0,"Smart Contract Platform, Layer 1 (L1), Ethereum Ecosystem, Real World Assets (RWA), RWA Protocol, Made in USA, Plume Network Ecosystem"
1INCH,1inch,1inch,1INCH,331030105.0,358083672.0,30868372.0,"Decentralized Exchange (DEX), Exchange-based Tokens, Decentralized Finance (DeFi), Automated Market Maker (AMM), BNB Chain Ecosystem, Avalanche Ecosystem, Polygon Ecosystem, Near Protocol Ecosystem, Harmony Ecosystem, Ethereum Ecosystem, FTX Holdings, Alameda Research Portfolio, DragonFly Capital Portfolio, Pantera Capital Portfolio, Energi Ecosystem, YZi Labs (Prev. Binance Labs) Portfolio, GMCI DeFi Index, Galaxy Digital Portfolio, Blockchain Capital Portfolio, Dex Aggregator, GMCI Index, Coinbase 50 Index"
SFP,safepal,SafePal,SFP,295719855.0,295719855.0,3366180.0,"BNB Chain Ecosystem, Wallets, Ethereum Ecosystem, Animoca Brands Portfolio, Binance Launchpad, Energi Ecosystem, YZi Labs (Prev. Binance Labs) Portfolio"
QTUM,qtum,Qtum,QTUM,266373352.0,271867968.0,23544850.0,"Smart Contract Platform, Proof of Stake (PoS), Made in China"
XCH,chia,Chia,XCH,196581651.0,445194085.0,8394395.0,"Smart Contract Platform, Layer 1 (L1), DePIN, Andreessen Horowitz (a16z) Portfolio, Made in USA"
FLUID,instadapp,Fluid,FLUID,194965181.0,494373694.0,6927628.0,"Decentralized Finance (DeFi), Polygon Ecosystem, Ethereum Ecosystem, Coinbase Ventures Portfolio, Pantera Capital Portfolio"
DAG,constellation-labs,Constellation,DAG,189285542.0,189285678.0,4356902.0,"Smart Contract Platform, Layer 1 (L1), Base Ecosystem, Layer 0 (L0), Made in USA, Directed Acyclic Graph (DAG)"
OSMO,osmosis,Osmosis,OSMO,187214872.0,256781677.0,9087880.0,"Decentralized Exchange (DEX), Decentralized Finance (DeFi), Automated Market Maker (AMM), Cosmos Ecosystem, Osmosis Ecosystem, Paradigm Portfolio, Proof of Stake (PoS), Evmos Ecosystem, Secret Ecosystem, GMCI DeFi Index, GMCI Index, Made in USA"
BIGTIME,big-time,Big Time,BIGTIME,156518750.0,414276034.0,39914225.0,"Gaming (GameFi), Play To Earn, Ethereum Ecosystem, RPG, Alameda Research Portfolio, Circle Ventures Portfolio, OKX Ventures Portfolio, MMO"
WAVES,waves,Waves,WAVES,143958188.0,143958188.0,105418438.0,"Smart Contract Platform, DWF Labs Portfolio, Proof of Stake (PoS)"
ZANO,zano,Zano,ZANO,141438331.0,141447370.0,1214951.0,"Smart Contract Platform, Privacy, Layer 1 (L1), Proof of Stake (PoS), Proof of Work (PoW), Zano Ecosystem, Privacy Blockchain"
RED,redstone-oracles,RedStone,RED,130797405.0,467133591.0,45580116.0,"Infrastructure, Oracle, Ethereum Ecosystem"
ZBCN,zebec-network,Zebec Network,ZBCN,127356236.0,161946535.0,12503402.0,"Decentralized Finance (DeFi), Solana Ecosystem, Real World Assets (RWA), Payment Solutions, DePIN, Coinbase Ventures Portfolio, Alameda Research Portfolio, Circle Ventures Portfolio, OKX Ventures Portfolio, RWA Protocol, Made in USA"
DYM,dymension,Dymension,DYM,125527130.0,434033969.0,15718875.0,"Smart Contract Platform, Cosmos Ecosystem, Modular Blockchain, Osmosis Ecosystem, Rollups-as-a-Service (RaaS)"
XVG,verge,Verge,XVG,123548884.0,123796018.0,31525263.0,"Smart Contract Platform, Privacy, Proof of Work (PoW), Made in USA"
UMA,uma,UMA,UMA,119213079.0,171323784.0,19807383.0,"Business Services, Decentralized Finance (DeFi), Oracle, Derivatives, Synthetic Issuer, Avalanche Ecosystem, Ethereum Ecosystem, Blockchain Capital Portfolio, Synthetic, Made in USA"
LQTY,liquity,Liquity,LQTY,105227246.0,107980061.0,46454419.0,"Decentralized Finance (DeFi), Lending/Borrowing Protocols, Arbitrum Ecosystem, Ethereum Ecosystem, Alameda Research Portfolio, Pantera Capital Portfolio"
WCT,connect-token-wct,WalletConnect Token,WCT,104699803.0,562297539.0,423656422.0,"Wallets, Ethereum Ecosystem, Optimism Ecosystem"
PROM,prometeus,Prom,PROM,102299493.0,107904944.0,4522221.0,"Smart Contract Platform, BNB Chain Ecosystem, Ethereum Ecosystem, Layer 2 (L2)"
AITECH,solidus-aitech,Solidus Ai Tech,AITECH,101592421.0,129955747.0,20863615.0,"Artificial Intelligence (AI), BNB Chain Ecosystem, Launchpad, Base Ecosystem, ChainGPT Launchpad, AI Agents, Binance Alpha Spotlight, DeFAI"
FIDA,bonfida,Solana Name Service,FIDA,101292682.0,102221713.0,43020485.0,"Big Data, Business Services, Infrastructure, Decentralized Finance (DeFi), Solana Ecosystem, FTX Holdings, DWF Labs Portfolio, Name Service"
NIL,nillion,Nillion,NIL,92341229.0,473180780.0,62641613.0,"Infrastructure, Binance Launchpool"
XRD,radix,Radix,XRD,86620277.0,105974862.0,830524.0,"Smart Contract Platform, Layer 1 (L1), DWF Labs Portfolio, Radix Ecosystem"
STEEM,steem,Steem,STEEM,81286905.0,81302796.0,25088199.0,SocialFi
PARTI,particle-network,Particle Network,PARTI,79524191.0,341305540.0,67645307.0,"Decentralized Finance (DeFi), BNB Chain Ecosystem, Layer 1 (L1), Base Ecosystem, Account Abstraction, Cross-chain Communication, Binance HODLer Airdrops, Chain Abstraction, Binance Wallet IDO"
HASHAI,hashai,HashAI,HASHAI,60424889.0,64168588.0,937183.0,"Artificial Intelligence (AI), Ethereum Ecosystem, DePIN"
AIAT,ai-analysis-token,AI Analysis Token,AIAT,57338100.0,259806682.0,271759.0,Ethereum Ecosystem
VINE,vine,Vine,VINE,56190552.0,56190552.0,104216956.0,"Solana Ecosystem, Meme, Solana Meme, Pump.fun Ecosystem, Binance Alpha Spotlight"
SHX,stronghold-token,Stronghold,SHX,54737995.0,,584210.0,"Ethereum Ecosystem, Stellar Ecosystem, Made in USA"
NMT,netmind-token,NetMind Token,NMT,49597947.0,149211025.0,2604916.0,"Artificial Intelligence (AI), BNB Chain Ecosystem, Ethereum Ecosystem, DePIN, AI Agents"
MBL,moviebloc,MovieBloc,MBL,46196748.0,74946512.0,5789347.0,DWF Labs Portfolio
NFP,nfprompt-token,NFPrompt,NFP,45430397.0,102821101.0,9358278.0,"BNB Chain Ecosystem, Binance Launchpool, YZi Labs (Prev. Binance Labs) Portfolio"
ANYONE,airtor-protocol,ANyONe Protocol,ANYONE,45240990.0,56595318.0,317055.0,"Smart Contract Platform, Ethereum Ecosystem, DePIN, Privacy Blockchain"
REZ,renzo,Renzo,REZ,43982112.0,167132226.0,15318686.0,"Decentralized Finance (DeFi), Binance Launchpool, Ethereum Ecosystem, Base Ecosystem, Restaking, YZi Labs (Prev. Binance Labs) Portfolio, OKX Ventures Portfolio"
DAO,dao-maker,DAO Maker,DAO,39429897.0,43609442.0,1121275.0,"BNB Chain Ecosystem, Solana Ecosystem, Launchpad, DaoMaker Launchpad, Arbitrum Ecosystem, Ethereum Ecosystem, Step Network Ecosystem"
MFT,mainframe,Mainframe,MFT,36130266.0,38491518.0,604.29,"Ethereum Ecosystem, Energi Ecosystem"
SERAPH,seraph,Seraph,SERAPH,36027744.0,177510810.0,2490237.0,"Gaming (GameFi), BNB Chain Ecosystem, Play To Earn, Ethereum Ecosystem, RPG, Gaming Utility Token, Action Games"
ZORA,zora,Zora,ZORA,32459926.0,117097805.0,25080313.0,"Infrastructure, Media, Smart Contract Platform, NFT, Layer 2 (L2), Base Ecosystem, Coinbase Ventures Portfolio, Zora Ecosystem"
VIC,tomochain,Viction,VIC,32005472.0,55551806.0,1471749.0,"Smart Contract Platform, Masternodes, Layer 1 (L1), DWF Labs Portfolio"
OGY,origyn-foundation,ORIGYN,OGY,31886968.0,37606281.0,108407.0,"Internet Computer Ecosystem, Real World Assets (RWA), RWA Protocol"
RETARDIO,retardio,RETARDIO,RETARDIO,31516580.0,31516580.0,1345770.0,"NFT, Solana Ecosystem, Meme, Solana Meme, Murad Picks, 4chan-Themed"
BRISE,bitrise-token,Bitgert,BRISE,26562128.0,28668320.0,3473752.0,"Smart Contract Platform, BNB Chain Ecosystem, Solana Ecosystem, Ethereum Ecosystem, Bitgert Ecosystem"
HOPR,hopr,HOPR,HOPR,26152612.0,27432958.0,264833.0,"Privacy, Gnosis Chain Ecosystem, Ethereum Ecosystem, DePIN, YZi Labs (Prev. Binance Labs) Portfolio"
RIO,realio-network,Realio Network Token,RIO,25706690.0,25706690.0,2791050.0,"BNB Chain Ecosystem, Solana Ecosystem, Ethereum Ecosystem, Algorand Ecosystem, Real World Assets (RWA), Osmosis Ecosystem, Stellar Ecosystem, Made in USA"
F,synfutures,SynFutures,F,24874107.0,144064453.0,17463403.0,"Decentralized Finance (DeFi), NFT, Perpetuals, Ethereum Ecosystem, NFTFi, DragonFly Capital Portfolio, Pantera Capital Portfolio, Polychain Capital Portfolio"
EPT,balance,Balance,EPT,24779421.0,106965376.0,60756404.0,"Artificial Intelligence (AI), Gaming (GameFi), BNB Chain Ecosystem, Animoca Brands Portfolio, DWF Labs Portfolio, AI Agents, Andreessen Horowitz (a16z) Portfolio, AI Agent Launchpad"
LOOKS,looksrare,LooksRare,LOOKS,23788013.0,23788013.0,27994861.0,"NFT, Ethereum Ecosystem, NFT Marketplace"
FHE,mind-network,Mind Network,FHE,23431352.0,94101817.0,34702495.0,"Artificial Intelligence (AI), Smart Contract Platform, BNB Chain Ecosystem, Layer 2 (L2), Binance Wallet IDO"
LEVER,lever,LeverFi,LEVER,21389623.0,21390083.0,4989880.0,"Decentralized Finance (DeFi), Ethereum Ecosystem, DWF Labs Portfolio, Alameda Research Portfolio"
DIONE,dione,Dione,DIONE,20104587.0,26620526.0,190453.0,"Energy, Smart Contract Platform, Layer 1 (L1), Made in USA"
MEMEFI,memefi-2,MemeFi,MEMEFI,19776789.0,19776789.0,18701134.0,"Gaming (GameFi), NFT, Meme, Play To Earn, Sui Ecosystem, Telegram Apps, Tap to Earn, Sui Meme, Action Games"
MLC,my-lovely-coin,My Lovely Coin,MLC,19717140.0,88519569.0,219710.0,"Charity, Gaming (GameFi), Polygon Ecosystem, Gaming Utility Token"
NUM,numbers-protocol,Numbers Protocol,NUM,19664489.0,19919151.0,1414560.0,"Artificial Intelligence (AI), Smart Contract Platform, BNB Chain Ecosystem, DaoMaker Launchpad, Ethereum Ecosystem, Avalanche L1, YZi Labs (Prev. Binance Labs) Portfolio, Outlier Ventures Portfolio"
REI,rei-network,REI Network,REI,19172803.0,19616566.0,2693633.0,"Smart Contract Platform, Layer 1 (L1)"
VSC,vyvo-smart-chain,Vyvo Smart Chain,VSC,19170871.0,85684793.0,161411.0,"Smart Contract Platform, BNB Chain Ecosystem, Polygon Ecosystem, Layer 2 (L2)"
AEROBUD,aerobud,AEROBUD,AEROBUD,16403115.0,16403115.0,214345.0,"Charity, Meme, Base Ecosystem, Dog-Themed, Base Meme, Made in USA"
NATIX,natix-network,NATIX Network,NATIX,15263292.0,71561997.0,332498.0,"Artificial Intelligence (AI), Internet of Things (IOT), Solana Ecosystem, DePIN"
PORT3,port3-network,Port3 Network,PORT3,14497659.0,28515063.0,5448282.0,"SocialFi, BNB Chain Ecosystem, Solana Ecosystem, Polygon Ecosystem, Arbitrum Ecosystem, Ethereum Ecosystem, Optimism Ecosystem, Poolz Finance Launchpad"
PROPS,propbase,Propbase,PROPS,14167721.0,41296844.0,2800911.0,"Tokenized Real Estate, Tokenized Assets, Aptos Ecosystem, Real World Assets (RWA), Base Ecosystem, RWA Protocol"
LOCK,houdini-swap,Houdini Swap,LOCK,13506756.0,13506756.0,43233.0,"Privacy, Solana Ecosystem, Ethereum Ecosystem"
MOZ,lumoz,Lumoz,MOZ,12683242.0,98703977.0,3872461.0,"Smart Contract Platform, Arbitrum Ecosystem, Zero Knowledge (ZK)"
OX,ox-fun,OX Coin,OX,11123256.0,11123256.0,3705120.0,"BNB Chain Ecosystem, Derivatives, Perpetuals, Solana Ecosystem, Avalanche Ecosystem, Polygon Ecosystem, Arbitrum Ecosystem, Ethereum Ecosystem, Base Ecosystem, Blast Ecosystem"
PAID,paid-network,PAID,PAID,10907484.0,13109034.0,36594.0,"Launchpad, Base Ecosystem"
LINGO,lingo,Lingo,LINGO,10790085.0,10790085.0,499871.0,"Solana Ecosystem, Real World Assets (RWA), Base Ecosystem, RWA Protocol"
MCB,mcdex,MUX Protocol,MCB,8657790.0,10934274.0,60902.0,"Decentralized Exchange (DEX), Exchange-based Tokens, Decentralized Finance (DeFi), BNB Chain Ecosystem, Derivatives, Perpetuals, Arbitrum Ecosystem, Ethereum Ecosystem, Multicoin Capital Portfolio, Alameda Research Portfolio, DeFiance Capital Portfolio, Delphi Ventures Portfolio, OKX Ventures Portfolio"
NC,nodecoin,Nodecoin,NC,8632731.0,47208537.0,6488480.0,"Artificial Intelligence (AI), Solana Ecosystem, DePIN"
KILO,kiloex,KiloEx,KILO,8506474.0,40181737.0,13822460.0,"Decentralized Exchange (DEX), Decentralized Finance (DeFi), BNB Chain Ecosystem, Derivatives, Binance Wallet IDO"
JUNO,juno-network,JUNO,JUNO,7991515.0,10617324.0,66344.0,"Smart Contract Platform, Cosmos Ecosystem, Osmosis Ecosystem, Juno Ecosystem, Evmos Ecosystem, Secret Ecosystem"
SHRUB,shrub,Shrub,SHRUB,7757336.0,7821776.0,1949192.0,"Solana Ecosystem, Meme, Ethereum Ecosystem, Base Ecosystem, Elon Musk-Inspired"
RLY,rally-2,Rally,RLY,7556900.0,22616905.0,125920.0,"SocialFi, Yield Farming, Ethereum Ecosystem, Alleged SEC Securities, Coinbase Ventures Portfolio, Andreessen Horowitz (a16z) Portfolio"
BEAM,beam,BEAM,BEAM,7187072.0,10432851.0,105523.0,"Smart Contract Platform, Privacy, Ethereum Ecosystem, Proof of Work (PoW), BeamPrivacy Ecosystem, Privacy Blockchain"
HARAMBEAI,harambe-ai,Harambe AI,HARAMBEAI,6754322.0,10099613.0,14523.29,"Meme, Ethereum Ecosystem"
VVAIFU,dasha,Dasha,VVAIFU,6599475.0,6599475.0,2928804.0,"Artificial Intelligence (AI), Solana Ecosystem, Launchpad, Meme, AI Meme, AI Agents, Pump.fun Ecosystem, AI Agent Launchpad, Binance Alpha Spotlight"
LIF3,lif3,LIF3 (OLD),LIF3,6418135.0,21809254.0,922.01,Fantom Ecosystem
MAS,massa,Massa,MAS,6124009.0,24377450.0,98801.0,"Smart Contract Platform, Layer 1 (L1), Massa Ecosystem"
K,kinto,Kinto,K,5943059.0,56631776.0,676239.0,"Decentralized Finance (DeFi), Wallets"
AIMONICA,aimonica-brands,Aimonica Brands,AIMONICA,5671491.0,5671491.0,1845412.0,"Solana Ecosystem, Meme, AI Meme, Pump.fun Ecosystem, Binance Alpha Spotlight, daos.fun Ecosystem"
OBT,oobit,Oobit,OBT,5657921.0,16072530.0,30839.0,"BNB Chain Ecosystem, Ethereum Ecosystem, Payment Solutions"
ZETA,zeta,Zeta,ZEX,5555221.0,29585174.0,1031098.0,"Decentralized Finance (DeFi), Derivatives, Perpetuals, Solana Ecosystem"
PAWS,paws,PAWS,PAWS,5355109.0,8446545.0,6608733.0,"SocialFi, Solana Ecosystem, Telegram Apps"
FARM,cryptofarmers,CryptoFarmers,FARM,5179521.0,8704364.0,3713.65,"Gaming (GameFi), Breeding, Gaming Utility Token, Simulation Games"
WEPE,wall-street-pepe,Wall Street Pepe,WEPE,5040816.0,5040816.0,741646.0,"Meme, Ethereum Ecosystem, Frog-Themed, The Boy’s Club"
LL,lightlink,LightLink,LL,4829030.0,16781196.0,182404.0,"Infrastructure, Smart Contract Platform, Ethereum Ecosystem, Layer 2 (L2), Rollup, LightLink Ecosystem"
BCT,toucan-protocol-base-carbon-tonne,Base Carbon Tonne,BCT,4798077.0,4798077.0,824.16,"Polygon Ecosystem, Regenerative Finance (ReFi), Base Ecosystem"
PMT,public-meme-token,Public Masterpiece Token,PMT,4771680.0,19846234.0,196269.0,BNB Chain Ecosystem
XNA,neurai,Neurai,XNA,4733536.0,4733536.0,83435.0,"Smart Contract Platform, Layer 1 (L1), Real World Assets (RWA), Proof of Work (PoW)"
AZIT,azit,azit,AZIT,4727275.0,7414442.0,281113.0,Kaia Ecosystem
CREO,creo-engine,Creo Engine,CREO,4601221.0,9073994.0,1160538.0,"Gaming (GameFi), BNB Chain Ecosystem, Ethereum Ecosystem, Gaming Platform"
HMND,humanode,Humanode,HMND,4594192.0,16825009.0,529633.0,"Artificial Intelligence (AI), Smart Contract Platform, Layer 1 (L1), Decentralized Identifier (DID), Discord Bots"
SDN,shiden,Shiden Network,SDN,4585935.0,5975870.0,39229.0,Smart Contract Platform
XCHNG,chainge-finance,Chainge,XCHNG,4480436.0,10882634.0,63438.0,"Decentralized Exchange (DEX), Decentralized Finance (DeFi), Arbitrum Ecosystem, Ethereum Ecosystem, Dex Aggregator"
PEAR,pear-protocol,Pear Protocol,PEAR,4118325.0,14128205.0,18074.16,"Decentralized Exchange (DEX), Decentralized Finance (DeFi), Perpetuals, Arbitrum Ecosystem"
HBAR,hedera-hashgraph,Hedera,HBAR,8758809923.0,10368195496.0,268064572.0,"Smart Contract Platform, Layer 1 (L1), Hedera Ecosystem, GMCI Layer 1 Index, GMCI 30 Index, GMCI Index, Outlier Ventures Portfolio, Made in USA, Directed Acyclic Graph (DAG)"
BGB,bitget-token,Bitget Token,BGB,5598037701.0,5598037701.0,148184978.0,"Exchange-based Tokens, Centralized Exchange (CEX) Token, Ethereum Ecosystem, DragonFly Capital Portfolio, Morph L2 Ecosystem"
TKX,tokenize-xchange,Tokenize Xchange,TKX,2898143205.0,3622860192.0,21988555.0,"Exchange-based Tokens, Centralized Exchange (CEX) Token, Ethereum Ecosystem, Titanchain Ecosystem"
RENDER,render-token,Render,RENDER,2662540463.0,2738449869.0,462494626.0,"Artificial Intelligence (AI), NFT, Metaverse, Solana Ecosystem, Polygon Ecosystem, Ethereum Ecosystem, DePIN, Multicoin Capital Portfolio, Alameda Research Portfolio, GMCI DePIN Index, GMCI 30 Index, GMCI Index, Made in USA, Coinbase 50 Index"
IP,story-2,Story,IP,1315522765.0,4735625401.0,53294241.0,"Artificial Intelligence (AI), Smart Contract Platform, Layer 1 (L1), Made in USA, Story Ecosystem"
XDC,xdce-crowd-sale,XDC Network,XDC,1175664017.0,2843413064.0,34770379.0,"Smart Contract Platform, Layer 1 (L1), Real World Assets (RWA)"
FLOKI,floki,FLOKI,FLOKI,1052914351.0,1089564953.0,179757501.0,"Gaming (GameFi), NFT, BNB Chain Ecosystem, Metaverse, Meme, Play To Earn, Ethereum Ecosystem, Telegram Apps, Dog-Themed, DWF Labs Portfolio, RPG, On-chain Gaming, TokenFi Launchpad, GMCI Meme Index, GMCI Index"
RAY,raydium,Raydium,RAY,1004953327.0,1924692093.0,241646712.0,"Decentralized Exchange (DEX), Decentralized Finance (DeFi), Yield Farming, Automated Market Maker (AMM), Solana Ecosystem, Launchpad, GMCI DeFi Index, GMCI Index"
LDO,lido-dao,Lido DAO,LDO,962750379.0,1072287505.0,117772998.0,"Infrastructure, Decentralized Finance (DeFi), Polygon Ecosystem, Arbitrum Ecosystem, Ethereum Ecosystem, Optimism Ecosystem, Liquid Staking Governance Tokens, eGirl Capital Portfolio, Paradigm Portfolio, Coinbase Ventures Portfolio, Multicoin Capital Portfolio, Index Coop Defi Index, Alameda Research Portfolio, DragonFly Capital Portfolio, Andreessen Horowitz (a16z) Portfolio, GMCI DeFi Index, Delphi Ventures Portfolio, Liquid Staking, Index Coop Index, GMCI Index, Coinbase 50 Index"
BTT,bittorrent,BitTorrent,BTT,795334144.0,798511135.0,25718323.0,"Storage, BNB Chain Ecosystem, Ethereum Ecosystem, DePIN, Alleged SEC Securities, Binance Launchpad, Tron Ecosystem, Energi Ecosystem, YZi Labs (Prev. Binance Labs) Portfolio, BitTorrent Ecosystem, GMCI DePIN Index, GMCI Index"
PYTH,pyth-network,Pyth Network,PYTH,667456697.0,1841265549.0,95725640.0,"Business Services, Infrastructure, Decentralized Finance (DeFi), Oracle, Solana Ecosystem, Neon Ecosystem, Manta Network Ecosystem, Multicoin Capital Portfolio, GMCI DeFi Index, Delphi Ventures Portfolio, GMCI Index"
CFX,conflux-token,Conflux,CFX,501272768.0,558004158.0,38327641.0,"Smart Contract Platform, DWF Labs Portfolio, Proof of Work (PoW), GMCI Layer 1 Index, Sequoia Capital Portfolio, GMCI Index, Made in China"
EIGEN,eigenlayer,Eigenlayer,EIGEN,444654667.0,2561345038.0,121482746.0,"Infrastructure, Ethereum Ecosystem, Data Availability, Restaking, Polychain Capital Portfolio, Made in USA"
SUN,sun-token,Sun Token,SUN,382853989.0,395749163.0,54661225.0,"Decentralized Finance (DeFi), Tron Ecosystem"
AI16Z,ai16z,ai16z,AI16Z,377181457.0,377181457.0,109971778.0,"Artificial Intelligence (AI), Solana Ecosystem, Meme, Solana Meme, AI Meme, AI Agents, Binance Alpha Spotlight, AI Framework, Made in USA"
JST,just,JUST,JST,374538957.0,374538957.0,41545140.0,"Decentralized Finance (DeFi), Tron Ecosystem"
DASH,dash,Dash,DASH,309159130.0,309168963.0,37470268.0,"Smart Contract Platform, Privacy, Masternodes, Alleged SEC Securities, Proof of Stake (PoS), Proof of Work (PoW), Made in USA"
